id	utterance_id	role	text	search_query	search_URL	reference_date	terminate	regDate	updDate
BK22002944	1	질문자	여름이 되어서 그런지 요즘 모기가 너무 많은 것 같아요! 제가 제일 싫어하는 게 모기인데 도대체 이 모기가 지구에서 언제부터 살아온 걸까요?				0	2022-08-04 09:17:51	2022-08-04 09:17:51
BK22002944	2	전문가	모기는 약 1억 7천만 년 전부터 남아메리카 대륙에서 처음 등장한 것으로 추정돼요. 그 당시는 모기가 지금 크기보다 3배 정도 컸어요!	모기의 등장	https://ko.wikipedia.org/wiki/%EB%AA%A8%EA%B8%B0	2022/06/11	0	2022-08-04 09:17:51	2022-08-04 09:17:51
BK22002944	3	질문자	지구의 토착종이라고 할 만큼 오래전부터 살았네요. 도대체 모기는 왜 밤만 되면 저를 괴롭히고 피를 빨아먹으려 할까요?				0	2022-08-04 09:17:51	2022-08-04 09:17:51
BK22002944	4	전문가	왜냐하면 모기는 낮에는 풀숲에서 잠을 자고 밤에 활동하는 야행성 동물이기 때문에 밤에 활동을 주로 해요. 모기는 일반적으로 주요 영양소를 섭취하기 위해 과즙이나 꽃의 꿀을 먹는데 흡혈은 암컷이 난소의 발육을 하기 위해 서면하기 때문에 흡혈을 하는 모기들은 모두 암컷이라 생각하면 돼요.	모기 흡혈	https://ko.wikipedia.org/wiki/%EB%AA%A8%EA%B8%B0	2022/06/11	0	2022-08-04 09:17:51	2022-08-04 09:17:51
BK22002944	5	질문자	그러면 이때까지 제 피를 흡혈한 모기들은 다 암컷이군요. 그러면 모기는 사람의 피만 흡혈하나요?				0	2022-08-04 09:17:52	2022-08-04 09:17:52
BK22002944	6	전문가	꼭 사람의 피만 흡혈하는 것은 아니에요. 흡혈 대상은 포유류 외에도 조류나 양서류 혹은 파충류의 피를 흡혈해요.	모기 흡혈 대상	https://ko.wikipedia.org/wiki/%EB%AA%A8%EA%B8%B0	2022/06/11	0	2022-08-04 09:17:52	2022-08-04 09:17:52
BK22002944	7	질문자	지금까지 모기가 사람의 피만 흡혈하는 줄 알았는데 그게 아니었네요. 어떤 모기들은 피를 너무 많이 빨아서 날지도 못하는 모기를 봤는데 얼마나 흡혈을 많이 하길래 그러는 거죠? 그리고 그렇게 피를 흡혈하고 난소를 발달시켜서 어떤 일을 하죠?				0	2022-08-04 09:17:52	2022-08-04 09:17:52
BK22002944	8	전문가	모기들은 빈속일 때 자신의 몸무게와 같거나 혹은 그 이상으로 피를 흡혈하는데 여름 기온에서는 그 피를 약 3일정도면 모두 소화를 하고 소화한 피를 가지고 난소를 발달시킨 후 약 300개의 알을 낳아요.	모기 흡혈량	https://ko.wikipedia.org/wiki/%EB%AA%A8%EA%B8%B0	2022/06/11	0	2022-08-04 09:17:52	2022-08-04 09:17:52
BK22002944	9	질문자	소화력도 빠른 것 같고 알도 정말 많이 낳네요. 그런데 모기에 물리는 것 자체는 스트레스가 없는데 모기에 물리면 너무 간지러워서 그게 너무 스트레스에요. 모기에 물리면 왜 이렇게 간지러울까요?				0	2022-08-04 09:17:52	2022-08-04 09:17:52
BK22002944	10	전문가	모기가 흡혈을 할 때 혈액의 응고를 방지하기 위해서 히루딘이라는 타액을 주입하는데 이 타액이 사람들에게는 간지럼증을 유발해요. 그리고 타액이 주입되면서 말라리아와 같은 바이러스가 주입되기도 하죠.	모기 가려움	https://ko.wikipedia.org/wiki/%EB%AA%A8%EA%B8%B0	2022/06/11	0	2022-08-04 09:17:52	2022-08-04 09:17:52
BK22002944	11	질문자	말라리아가 걸렸다는 말을 들어만 봤지 직접 말라리아에 걸려보지는 못했는데 왜 그런 병들이 모기에 물리면 발생하는 거죠?				0	2022-08-04 09:17:52	2022-08-04 09:17:52
BK22002944	12	전문가	왜냐하면 모기가 가지고 있는 질병 자체가 약 3,000종 정도 있고 대표적으로 뇌염이나 말라리아를 가지고 있기 때문이죠.	모기 전염병	https://ko.wikipedia.org/wiki/%EB%AA%A8%EA%B8%B0	2022/06/11	0	2022-08-04 09:17:52	2022-08-04 09:17:52
BK22002944	13	질문자	모기가 그만큼 많은 질병을 가지고 있는지 몰랐어요. 사람들에게도 해를 끼칠 수 있는 모기들의 개체 수를 좀 줄일 수 있는 방법은 없나요?				0	2022-08-04 09:17:52	2022-08-04 09:17:52
BK22002944	14	전문가	모기들의 천적들 중에서는 잉어, 자라, 가물치, 미꾸라지, 메기 등이 있긴 하지만 공업화와 각종 개발로 인해 생태계가 파괴되면서 모기들의 천적들의 개체 수도 줄어들어 모기들의 수가 비정상적으로 늘고 있는 실정이에요.	모기 천적	https://ko.wikipedia.org/wiki/%EB%AA%A8%EA%B8%B0	2022/06/11	0	2022-08-04 09:17:52	2022-08-04 09:17:52
BK22002944	15	질문자	각종 개발과 공업화가 모기들이 더욱 성행하게끔 만들었군요.				0	2022-08-04 09:17:52	2022-08-04 09:17:52
BK22002944	16	전문가	개발과 공업화 뿐만 아니라 지구 온난화와 환경 오염으로 인해서 모기의 개체 수가 더욱 늘어나고 있죠.	모기 수	https://ko.wikipedia.org/wiki/%EB%AA%A8%EA%B8%B0	2022/06/11	0	2022-08-04 09:17:52	2022-08-04 09:17:52
BK22002944	17	질문자	그래서 그런지 요즘 모기를 잡아도 계속 어디선가 모기가 보이고 정말 스트레스 받아요!				0	2022-08-04 09:17:52	2022-08-04 09:17:52
BK22002944	18	전문가	지금 현시점에서 모기의 개체 수를 급격하게 줄일 수 있는 방법은 없지만 환경을 개선해 나간다면 서서히 모기 개체들이 정상 범위로 자리 잡을 수 있을 거예요.				0	2022-08-04 09:17:52	2022-08-04 09:17:52
BK22002944	19	질문자	그러기 위해서는 제가 먼저 환경을 생각하는 행동을 해야겠죠?				0	2022-08-04 09:17:52	2022-08-04 09:17:52
BK22002944	20	전문가	좋은 생각이에요, 모두가 같은 생각으로 환경을 더 이상 파괴하지 않는다면 언젠가는 모기로부터 보다 자유로운 여름을 보낼 수 있을 거예요.				0	2022-08-04 09:17:52	2022-08-04 09:17:52
BK22002944	21	질문자	모두가 함께 환경을 생각하는 마음으로 행동하면 좋을 것 같네요.				0	2022-08-04 09:17:52	2022-08-04 09:17:52
BK22002944	22	전문가	오늘부터 저와 함께 환경 보호 캠페인에 동참하여 환경을 보호하자고요!				0	2022-08-04 09:17:52	2022-08-04 09:17:52
BK22002944	23	질문자	우리 함께 환경을 보호하여 모기로부터 벗어나 보아요!				1	2022-08-04 09:17:52	2022-08-04 14:07:42
