id	utterance_id	role	text	search_query	search_URL	reference_date	terminate	regDate	updDate
BK22013774	1	질문자	제가 부동산 재건축 관련 신문 기사를 봤는데 모르는 내용이 너무 많더라고요.				0	2022-09-30 15:53:25	2022-10-02 11:57:14
BK22013774	2	전문가	모르는 게 있으면 뭐든 물어보세요.				0	2022-09-30 15:53:25	2022-10-02 11:57:14
BK22013774	3	질문자	부동산 관련 기사에서 용적률과 관련된 내용이 많이 나와서 그러는데요. 용적률이 무엇을 의미하는지 알려주세요.				0	2022-09-30 15:53:25	2022-10-02 11:57:14
BK22013774	4	전문가	전체 대지면적에 대한 건물 연면적의 비율을 건축 용어로 용적률이라고 합니다. 용적률은 백분율로 표시하는데요, 용적률이 높으면 높을수록 건축 가능한 연면적이 많아져 건축 밀도가 높아지기 때문에 주거환경의 적정성 보장을 위해 용적률에도 상한선을 둡니다.	용적률	https://ko.wikipedia.org/wiki/%EC%9A%A9%EC%A0%81%EB%A5%A0	2022/07/30	0	2022-09-30 15:53:25	2022-10-02 11:57:14
BK22013774	5	질문자	용적률이 너무 높으면 쾌적한 느낌이 적겠네요. 그런데 아까 말씀에서 연면적이라는 설명을 하셨는데 연면적이라는 말은 무엇을 의미하나요?				0	2022-09-30 15:53:25	2022-10-02 11:57:14
BK22013774	6	전문가	지하층을 제외한 건물 지상층의 면적을 모두 더한 것을 연면적이라고 합니다. 용적률이 높아질수록 동일한 대지면적에 지을 수 있는 연면적도 넓어지기에 공급할 수 있는 주택량도 늘어나게 됩니다.	연면적	https://n.news.naver.com/mnews/article/011/0004047460?sid=101	2022/04/27	0	2022-09-30 15:53:25	2022-10-02 11:57:14
BK22013774	7	질문자	또 한 가지 궁금한 게 있는데요. 용적률 관련 기사를 보면 건폐율 이야기가 매번 함께 나오던데 건폐율은 무엇을 의미하나요?				0	2022-09-30 15:53:25	2022-10-02 11:57:14
BK22013774	8	전문가	대지면적에 대한 건축면적 비율을 건축법상 건폐율이라고 부릅니다. 대지면적 중에서 건물이 지어지는 부분이 얼마나 되는지 나타내는 비율입니다. 한 대지에 건축물이 둘 이상인 경우는 모든 건축물 면적을 더한 비율을 건폐율로 봅니다.	건폐율	http://www.shinailbo.co.kr/news/articleView.html?idxno=1479285	2021/11/06	0	2022-09-30 15:53:25	2022-10-02 11:57:14
BK22013774	9	질문자	설명을 들으니 조금씩 이해가 되네요. 또 궁금한 게 있는데, 부동산 광고나 신문 기사를 보면 전용면적이라는 단어가 항상 나오던데요. 전용면적이라는 말은 어떤 의미인가요?				0	2022-09-30 15:53:25	2022-10-02 11:57:14
BK22013774	10	전문가	아파트를 비롯한 공동주택의 소유주가 독점해 사용하는 면적을 전용면적이라고 합니다. 거실이나 욕실, 화장실, 주방 등 같은 세대의 내부 면적을 칭하는데, 발코니의 경우 전용면적에 포함되지 않습니다.	전용면적	https://n.news.naver.com/mnews/article/003/0010250932?sid=101	2020/12/19	0	2022-09-30 15:53:25	2022-10-02 11:57:14
BK22013774	11	질문자	세대 내부 면적을 전용면적이라고 하는군요. 그러면 건축 용어 중 공용면적은 어떤 뜻인가요?				0	2022-09-30 15:53:25	2022-10-02 11:57:14
BK22013774	12	전문가	여러 세대가 같은 건축물에서 공동으로 사용하는 공간을 공용면적이라고 부릅니다. 공용면적은 다시 주거 공용면적과 기타 공용면적으로 나뉘는데요, 건물 출입 현관이나 복도, 계단, 엘리베이터 등이 주거 공용면적이고요. 주거 공용면적을 제외한 나머지 시설물, 예를 들어 지하층이나 노인정, 관리사무소, 보육 시설, 커뮤니티시설 등을 기타 공용면적이라고 칭합니다.	공용면적	https://n.news.naver.com/mnews/article/003/0010250932?sid=101	2020/12/19	0	2022-09-30 15:53:25	2022-10-02 11:57:14
BK22013774	13	질문자	공용면적에 다양한 시설이 포함되는 거였네요. 그러면 공급면적이라는 건 어떤 의미인가요? 아파트 광고를 보면 항상 등장하더라고요.				0	2022-09-30 15:53:26	2022-10-02 11:57:14
BK22013774	14	전문가	전용면적과 공용면적을 모두 합친 게 공급면적인데요, 분양면적이라고도 부릅니다. 공급면적은 분양가를 책정할 때 사용되는데요, 거실이나 침실, 주방, 욕실 등 생활공간을 비롯해 이웃과 함께 사용하는 복도, 계단, 현관 등까지 포함됩니다. 일반적으로 아파트 평수를 말할 때 공급면적으로 말하는데 실 거주면적, 이른바 전용면적은 공급면적에서 공용면적을 제외한 부분을 말합니다.	공급면적	https://n.news.naver.com/mnews/article/003/0010250932?sid=101	2020/12/19	0	2022-09-30 15:53:26	2022-10-02 11:57:14
BK22013774	15	질문자	또 한 가지 궁금한 게 있는데요. 재건축 사업에서는 대지지분이 굉장히 중요하다고 하던데 대지지분은 어떤 의미인가요?				0	2022-09-30 15:53:26	2022-10-02 11:57:14
BK22013774	16	전문가	각 세대가 가지고 있는 토지 소유분을 의미하는데요, 아파트 전체 단지 대지면적을 가구 수로 나눈 대지의 몫입니다. 대지지분이 많으면 용적률이 낮아서 더 많은 아파트를 새로 지을 수 있는데요, 아파트 대지면적이 넓은 상황에서 세대수가 적고 면적이 좁으면 대지지분이 늘어나게 되기 때문입니다.	대지지분	https://n.news.naver.com/mnews/article/018/0005180685?sid=101	2022/04/03	0	2022-09-30 15:53:26	2022-10-02 11:57:14
BK22013774	17	질문자	마지막으로 하나만 더 물어볼게요. 이것도 재건축 사업에서 중요하게 여기는 단어같던데 무상지분율이 무슨 의미인가요?				0	2022-09-30 15:53:26	2022-10-02 11:57:14
BK22013774	18	전문가	조합원이 추가 비용 없이 입주할 수 있는 평형을 대지지분 기준으로 나눈 비율을 무상지분율이라고 합니다. 재건축 사업의 수익에 무상지분율이 결정적인 영향을 끼치는데요, 조합원의 입장에서 시공사 브랜드나 안전성, 건축 능력 등과 함께 시공사를 선정하는 핵심 요소이기도 합니다.	무상지분율	https://n.news.naver.com/mnews/article/018/0005180685?sid=101	2022/04/03	0	2022-09-30 15:53:26	2022-10-02 11:57:14
BK22013774	19	질문자	건축 용어에 대해 알려주셔서 고맙습니다. 큰 도움이 될 것 같아요.				0	2022-09-30 15:53:26	2022-10-02 11:57:14
BK22013774	20	전문가	언제든 궁금한 게 있으시면 물어보세요.				1	2022-09-30 15:53:26	2022-10-02 11:57:14
