id	utterance_id	role	text	search_query	search_URL	reference_date	terminate	regDate	updDate
BK22009006	1	질문자	얼마전에 연금술과 관련된 애니메이션을 봤어. 연금술이라는 건 금을 만드려는 시도로 인해 화학 발전에 영향을 줬다는 것 외에는 하나도 몰랐는데 색다로운 것들이 많았어. 관련으로 조사하고 있는데 좀 도와줄래?				0	2022-09-20 11:51:24	2022-09-26 22:53:36
BK22009006	2	전문가	물론이지. 연금술을 소재로 한 책이나 그 밖의 콘텐츠는 많으니까 관련된 상식을 쌓아두면 다음에도 도움이 될 거야. 그럼 먼저 어떤 것을 가르쳐 줄까?				0	2022-09-20 11:51:24	2022-09-26 22:53:36
BK22009006	3	질문자	일단 연금술이 정확히 무엇을 하는 학문인 걸까?				0	2022-09-20 11:51:24	2022-09-26 22:53:36
BK22009006	4	전문가	연금술은 보통 금속에서 금 같은 귀금속으로 정련하려는 시도로 알려져 있지만, 화학과 금속학, 물리학, 약학 그리고 점성술과 기호학, 신비주의 같은 것들을 거대한 힘의 일부로 이해하려는 운동이야. 참고로 메소포타미아와 고대 이집트, 페르시아, 인도, 중국 등에서 연금술이 이루어졌고, 고대 그리스와 로마, 이어 이슬람 문명권과 유럽에서, 고대부터 19세기까지 약 2500년 동안 여러가지 단체와 철학적 시스템으로 상호작용해왔어.	연금술	https://ko.wikipedia.org/wiki/%EC%97%B0%EA%B8%88%EC%88%A0	2022/05/28	0	2022-09-20 11:51:24	2022-09-26 22:53:36
BK22009006	5	질문자	연금술이 기호학이나 신비주의와 관련이 있다는 건 정말 놀라운 것 같아. 그래서 독특한 기호도 많이 나왔던 것 같아. 꼬리를 물고 있는 뱀 기호가 있었는데 그건 무엇일까?				0	2022-09-20 11:51:24	2022-09-26 22:53:36
BK22009006	6	전문가	그건 우로보로스라고 해. 꼬리를 삼키는 자라는 의미가 있는데, 거대한 뱀이나 용이 본인의 꼬리를 물고 삼키고 있는 모습이 원형을 이루고 있는 이 형상은 고대의 상징이지. 우로보로스는 시작이 곧 끝이라는 의미가 있어 윤회사상이나 영원성의 상징으로 인식되어 왔고 이건 수세기에 걸쳐서 여러 문화권에서 등장해. 그런데 시대가 흐르면서 우로보로스는 점차 많은 개념을 가지게 되었는데, 특히나 종교적 상징이나 미신적 상징으로 중요한 상징이 되었어. 여기서 중세 연금술의 대표적인 상징물이 되었고 오늘날에도 칼 융과 같은 심리학자들에 의해 인간의 심성을 나타내는 상징으로 사용되었어.	우로보로스	https://ko.wikipedia.org/wiki/%EC%9A%B0%EB%A1%9C%EB%B3%B4%EB%A1%9C%EC%8A%A4	2022/02/07	0	2022-09-20 11:51:24	2022-09-20 14:04:41
BK22009006	7	질문자	우로보로스가 연금술 이전 부터 사용된 상징이었구나. 현자의 돌이라고 하는 물건은 어떤 거야?				0	2022-09-20 11:51:24	2022-09-27 17:30:58
BK22009006	8	전문가	현자의 돌은 마법사의 돌이나 철학자의 돌이라고도 해. 현자의 돌은 전설에서만 등장하는 물질이지. 값싼 금속을 금으로 바꿀 수 있는 능력이 있다고 하는데, 때때로 생명의 묘약으로서 사람을 젊게 만들 수 있는 능력이 있다고도 해.	마법사의 돌	https://ko.wikipedia.org/wiki/%ED%98%84%EC%9E%90%EC%9D%98_%EB%8F%8C	2022/02/14	0	2022-09-20 11:51:24	2022-09-20 14:04:41
BK22009006	9	질문자	해리포터와 마법사의 돌이라는 제목에 있던 마법사의 돌도 현자의 돌이겠다. 작품에 등장하는 사람의 이름이 호엔하임이었는데 혹시 모티브가 있는 걸까?				0	2022-09-20 11:51:24	2022-09-27 17:30:58
BK22009006	10	전문가	아마 그건 파라켈수스 호엔하임일 거야. 문예부흥기 시대에 활동한 독일계 스위스인 테오프라스투스 필리푸스 아우레올루스 봄바스투스 폰 호엔하임의 속칭이 파라켈수스야. 본초학자지만 광의의 오컬티스트로 연금술사이자 점성술사였지. 그는 최초로 정신적 고통이 일부 질병의 뿌리가 된다고 주장하여 정신의학의 선구자로 여겨지기도 해.	파라켈수스	https://ko.wikipedia.org/wiki/%ED%8C%8C%EB%9D%BC%EC%BC%88%EC%88%98%EC%8A%A4	2022/02/17	0	2022-09-20 11:51:24	2022-09-27 17:30:58
BK22009006	11	질문자	실존하는 호엔하임도 연금술사라니 정말 놀랍다. 작품에서는 호문쿨루스가 인간의 모습을 한 괴물로 등장했는데 호문쿨루스라는 건 정확히 어떤 거야?				0	2022-09-20 11:51:28	2022-09-27 17:30:58
BK22009006	12	전문가	플라스크 속 작은 인간이라는 의미인 호문쿨루스는 유럽의 연금술사가 만들어 낸 인조인간을 말하거나 또는 이걸 만들어 내는 기술을 말하지. 파라켈수스가 호문쿨루스를 만드는데 성공했다고 하며, 호문쿨루스는 태어날 때부터 모든 지식을 가지고 있지. 그런데 호문쿨루스는 플라스크 안에서만 살 수 있다고 전해져.	호문쿨루스	https://ko.wikipedia.org/wiki/%ED%98%B8%EB%AC%B8%EC%BF%A8%EB%A3%A8%EC%8A%A4	2022/03/11	0	2022-09-20 11:51:28	2022-09-20 14:04:41
BK22009006	13	질문자	작품에서는 플라스크 밖에 있던데 재미를 위해 여러가지가 바뀐 부분이라고 생각해. 파라켈수스는 정말 여러면으로 신비한 점이 많은 것 같은데, 파라켈수스처럼 실존한 유명한 연금술사가 있을까? 한 명만 예시로 들어줘.				0	2022-09-20 11:51:28	2022-09-26 22:53:36
BK22009006	14	전문가	저명한 무슬림 박식가인 아부 무사 자비르 이븐 하이얀을 가르쳐 주고 싶어. 그는 화학자이자 천문학자, 연금술사, 지구과학자, 철학자, 물리학자, 약사, 의사로 알 라지라는 인물과 함께 화학 분야의 거장이며, 근대 화학의 아버지이자 근대 약학의 기초를 닦은 인물로 평가되고 있지. 자비르 이븐 하이얀은 연금술사로써 여과와 증류 같은 실험방법을 확립했고 왕수의 제법에 성공해 화학의 아버지라 여기고 있고 최초의 실험 연금술사라고도 여기고 있지. 그리고 그가쓴 연금술 저작들은 중세 유럽의 연금술 이론에 많은 영향을 주었어.	자비르 이븐 하이얀	https://ko.wikipedia.org/wiki/%EC%9E%90%EB%B9%84%EB%A5%B4_%EC%9D%B4%EB%B8%90_%ED%95%98%EC%9D%B4%EC%96%80	2022/08/23	0	2022-09-20 11:51:28	2022-09-26 22:53:36
BK22009006	15	질문자	최초의 실험 연금술사라니 정말 놀랍다. 이제 작품이야기를 벗어나서 동양에도 연금술이 있었는지 궁금해.				0	2022-09-20 11:51:28	2022-09-26 22:53:36
BK22009006	16	전문가	연금술과 비슷한 연단술이라고 있어. 고대 중국의 도사의 기술이라고 하는 이 연단술은 불로불사의 선인이 되는 기술로 진사 등 금속에서 액상수은을 추출해 그것을 먹었어. 그리고 비금속을 금으로 바꿀 수 있는영약을 만드는 기술이기도 하지. 비금속을 귀금속으로 바꿀 수 있는, 이 불로불사의 엘릭서 현자의 돌을 만드려고 하는 목적에서 연금술과 연단술은 공통부분이 많아.	연단술	https://ko.wikipedia.org/wiki/%EC%97%B0%EB%8B%A8%EC%88%A0	2022/02/15	0	2022-09-20 11:51:37	2022-09-26 22:53:36
BK22009006	17	질문자	중국에도 연금술과 비슷한 게 있었다는 건 정말 놀라운 것 같아. 마지막으로 불로불사같은 건 몰라도 오늘날에도 금이 만들어 지는 원리는 파악하지 못한 걸까?				0	2022-09-20 11:51:37	2022-09-26 22:53:36
BK22009006	18	전문가	금과 백금 등 자연계에 존재하는 원소의 3분의 2는 아직도 그 생성원리가 명확히 알려지지 않았어. 다만 과학자들이 추측하는 바로는 금이나 백금 등은 우주에서 중성자수가 126인 불안정한 중성자 과잉핵들이 차례로 붕괴하는 과정에서 생겨났다고 보고있어. 참고로 과잉핵이란 양성자 개수에 비해 특정범위를 넘어 중성자가 더 많은 원자핵을 말해.	연금술 원소 금	https://www.yna.co.kr/view/AKR20151110052000004	2015/11/10	1	2022-09-20 11:51:37	2022-09-28 12:02:02
BK22009006	19	질문자	어떤 특정 원소를 만드는 건 역시나 어려운 일이구나. 오늘 덕분에 많이 알게 되었어. 정말 고마워.				0	2022-09-20 11:51:37	2022-09-26 22:53:36
BK22009006	20	전문가	나중에 더 궁금한 것이 있으면 연락해. 그럼 내일 보자.				0	2022-09-20 11:51:37	2022-09-26 22:53:36
