id	utterance_id	role	text	search_query	search_URL	reference_date	terminate	regDate	updDate
BK22013622	1	질문자	저녁에 대체적으로 몇 시쯤 잠자리에 들어?				0	2022-09-30 15:47:09	2022-10-02 11:27:29
BK22013622	2	전문가	밤 10시에서 늦어도 12시 정도에는 자는데 왜?				0	2022-09-30 15:47:09	2022-10-02 11:27:29
BK22013622	3	질문자	요즘 초저녁만 되면 피곤이 밀려오는데 아침형 인간이라 그런가?				0	2022-09-30 15:47:09	2022-10-02 11:27:29
BK22013622	4	전문가	맞아, 아침형 인간이 초저녁부터 피로가 느껴지고 잠자리에 일찍 들게 되는 것은 멜라토닌이 저녁형 인간보다 3시간 정도 빨리 분비돼서 그러는 건데 반대로 저녁형 인간이 밤늦게까지 깨어 있을 수 있는 이유도 멜라토닌이 늦게 분비돼서 그런 거야.	아침형 인간	https://view.asiae.co.kr/article/2022032708353058812	2022/03/27	0	2022-09-30 15:47:10	2022-10-02 11:27:29
BK22013622	5	질문자	그런데 아침형 인간이라는 말은 언제 생겨난 거야?				0	2022-09-30 15:47:10	2022-10-02 11:27:29
BK22013622	6	전문가	일본의 의사 사이쇼 히로기가 1993년에 쓴 아침형 인간이라는 책에서 시작되었는데 그 책에서 아침형 인간이 삶에서 성공할 가능성이 크다고 사이쇼는 주장했지.	사이쇼 히로기	https://kormedi.com/1299474/%ea%b1%b4%ea%b0%95%ec%9d%84-%ec%9c%84%ed%95%b4-%ec%95%84%ec%b9%a8%ed%98%95-%ec%9d%b8%ea%b0%84%ec%9c%bc%eb%a1%9c-%eb%b0%94%ea%bf%94%ec%95%bc-%ed%95%98%eb%82%98/	2019/08/11	0	2022-09-30 15:47:10	2022-10-02 11:27:29
BK22013622	7	질문자	아침형과 저녁형 인간으로 나눠지는 원인이 유전자에 있다는 얘기도 들었던 것 같은데 진짜 그런 게 있니?				0	2022-09-30 15:47:10	2022-10-02 11:27:29
BK22013622	8	전문가	유전자에 의해 아침형 인간과 저녁형 인간이 나뉠 수 있다는 연구결과가 나왔어. 미국 캘리포니아주에 있는 23앤드미 라는 바이오기업의 연구팀은 인간을 포함한 여러 개체에는 낮이나 밤중에 자연스러운 선호가 있을 가능성이 크다고 봤어. 플랑크톤에서 호모사피엔스까지 모든 동식물은 24주기의 생체 리듬을 가지고 있는 것에 주목했지. 8만 9283명의 게놈을 조사하고 대상자들에게 아침과 밤중에 어느 쪽을 더 선호하는가의 질문과 답을 비교하는 방법으로 연구를 했는데 연구 결과 12개 이상의 유전자와 아침형 인간의 상관관계가 명백히 드러났어.	아침형인간과 저녁형 인간 유전자	http://www.asiae.co.kr/news/view.htm?idxno=2016020314511622013	2016/02/03	0	2022-09-30 15:47:10	2022-10-02 11:27:29
BK22013622	9	질문자	그런 연구 결과가 있다고 하니까 재밌는데 또 어떤 연구들이 있었어?				0	2022-09-30 15:47:10	2022-10-02 11:27:29
BK22013622	10	전문가	이스라엘의 텔아비브 학술대학 연구팀이 2016년에 생체리듬과 불면증에 대한 설문조사를 598명을 대상으로 한 적이 있는데 취침시간과 기상시간을 기준으로 아침형 인간과 저녁형 인간으로 실험 대상들을 나눠서 진행했어.	이스라엘 텔아비브 학술대학 연구팀	http://www.ikunkang.com/news/articleView.html?idxno=33453	2021/03/25	0	2022-09-30 15:47:10	2022-10-02 11:27:29
BK22013622	11	질문자	그 연구에서는 어떤 결과들이 나왔어?				0	2022-09-30 15:47:10	2022-10-02 11:27:29
BK22013622	12	전문가	저녁형 인간은 불면증을 호소하는 경우가 많았고 일을 미루는 경향도 크며 계획을 세워 활동하는 것에 어려움을 느낀다는 사실을 알아냈어. 그리고 부족한 수면을 아침에 채우지 못해서 신진대사가 원활하지 않고 밤에 활발해지는 재생능력이 방해를 받아 안색이 칙칙하고 생기가 없는 것으로 나타났지.	저녁형 인간 불면증	http://www.ikunkang.com/news/articleView.html?idxno=33453	2021/03/25	0	2022-09-30 15:47:10	2022-10-02 11:27:29
BK22013622	13	질문자	저녁형 인간이 너무 안 좋은 쪽으로만 결과가 나왔는데 장점이 나타난 연구는 없었어?				0	2022-09-30 15:47:10	2022-10-02 11:27:29
BK22013622	14	전문가	독창성이나 창의성 면에서 저녁형 인간이 더 뛰어나다는 연구결과도 있는데 스페인 마드리드대 연구팀이 2013년에 청소년 1000명을 조사했어. 그 결과 아침형 인간보다 저녁형 인간이 귀납추리나 문제해결 능력이 우수하고 IQ도 높은 것으로 나타났어.	저녁형 인간의 독창성과 창의성	http://www.ikunkang.com/news/articleView.html?idxno=33453	2021/03/25	0	2022-09-30 15:47:10	2022-10-02 11:27:29
BK22013622	15	질문자	그렇구나, 아침형 인간과 저녁형 인간에 따른 질병에 관한 연구들은 없었어?				0	2022-09-30 15:47:11	2022-10-02 11:27:29
BK22013622	16	전문가	미국 연구팀은 일주기 유형이 평상시 혈당 소모와 에너지 대사에 끼치는 영향을 조사하기 위해 성인 51명을 생활 습관을 기준으로 아침형과 저녁형으로 나눠 놓았어. 그리고 참여자들의 일주일간의 신체 활동량을 살펴보고 체질량지수와 신체 구성 및 인슐린 민감성을 확인해서 그들이 소모하는 지방과 탄수화물이 얼마나 되는지도 알아보았지.	미국 연구팀의 일주기 유형의 혈당 소모와 에너지대사 관계 연구	https://v.daum.net/v/20220920223014907	2022/09/20	0	2022-09-30 15:47:11	2022-10-02 11:27:29
BK22013622	17	질문자	구체적인 결과가 어떻게 나왔는지 궁금하네?				0	2022-09-30 15:47:11	2022-10-02 11:27:29
BK22013622	18	전문가	저녁형 인간은 인슐린 저항성이 높아지기 쉬워서 심혈관계 질환이나 당뇨병이 생길 위험이 높고 아침형 인간이 지방을 더 많이 연소하는 데 비해 저녁형 인간은 탄수화물을 더 많이 연소해서 에너지를 만드는 데 사용하는 주 에너지원도 다르다는 결과가 나왔어.	아침형과 저녁형 인간의 인슐린 저항성	https://v.daum.net/v/20220920223014907	2022/09/20	0	2022-09-30 15:47:11	2022-10-02 11:27:29
BK22013622	19	질문자	그렇구나, 저녁형인 사람들은 오랜 시간 굳어진 생활 습관을 갑자기 바꿀 수는 없지만 건강을 위해 조금씩 변화를 주는 것도 필요하겠다. 재밌는 내용 알려줘서 고마워.				0	2022-09-30 15:47:11	2022-10-02 11:27:29
BK22013622	20	전문가	그래, 더 알고 싶은 것들 생기면 또 연락하렴.				1	2022-09-30 15:47:11	2022-10-02 11:27:29
