id	utterance_id	role	text	search_query	search_URL	reference_date	terminate	regDate	updDate
BK22006677	1	질문자	요즘 신문을 읽다 보면 여성 CEO들이 참 많이 보이는 거 같아. AMD의 리사 수 같은 분도 중국계 여성인데 진짜 대단하잖아. 혹시 과거 역사시대의 중국에는 여성 리더가 없었어?				0	2022-08-28 16:47:58	2022-08-28 16:47:58
BK22006677	2	전문가	측천무후라는 인물이 있었어. 624년 2월 17일에 태어나서 705년 12월 16일에 죽은 당나라 고종 이치의 황후이자 무주라는 국가의 황제였지. 아, 참고로 중국 역사에 나오는 200여 명의 황제 중 유일한 여성 황제야.	측천무후 고종 황후 무주 황제	https://ko.wikipedia.org/wiki/%EC%B8%A1%EC%B2%9C%EB%AC%B4%ED%9B%84	2022/08/27	0	2022-08-28 16:47:58	2022-08-28 16:51:06
BK22006677	3	질문자	오, 중국에도 여자 황제가 있었구나. 그럼 측천무후는 당나라 고종에게 시집을 가면서 처음 역사에 등장한거야?				0	2022-08-28 16:47:58	2022-08-28 16:47:58
BK22006677	4	전문가	아니야. 처음에는 13살때 고종의 아버지인 태종의 후궁으로 입궁했어. 하지만 태종이 11년 뒤에 사망하자 관례에 따라 여승이 돼서 절에서 살게 되지.	측천무후 태종 후궁 비구니	http://www.jjan.kr/1122631	2017/03/10	0	2022-08-28 16:47:58	2022-09-06 15:33:14
BK22006677	5	질문자	고종의 아버지의 후궁이었다고? 이거 진짜 놀라운 일이네. 그럼 측천무후는 고종이랑 대체 무슨 관계였던거야?				0	2022-08-28 16:47:58	2022-08-28 16:51:06
BK22006677	6	전문가	사실 태종이 사망하기 전부터 측천무후와 고종은 관계가 있었고, 측천무후가 궁을 나가자 그녀를 잊지 못한 고종은 절을 자주 방문했지.	측천무후 고종 태종 관계	http://www.jjan.kr/1122631	2017/03/10	0	2022-08-28 16:47:58	2022-09-06 15:33:14
BK22006677	7	질문자	아버지의 첩과 사랑에 빠지다니 뭔가 현대인의 입장에서 볼 때는 굉장히 황당하네. 그럼 측천무후는 언제부터 황후가 된거야?				0	2022-08-28 16:47:58	2022-08-28 16:47:58
BK22006677	8	전문가	측천무후가 31살이 되던 해에 황후의 자리에 오르게 돼. 이후 그녀는 자신에게 반대하던 중신들을 모조리 제거해버려. 게다가 남편인 고종까지 정치를 멀리 하자 드디어 모든 권력을 손아귀에 넣고 실질적인 통치 권한을 갖게 되지.	측천무후 황후 중신 숙청	http://www.jjan.kr/1122631	2017/03/10	0	2022-08-28 16:47:58	2022-08-28 16:51:06
BK22006677	9	질문자	정말 대단하네. 그럼 황후였던 측천무후가 황제가 되는 건 언제 벌어진 일이야?				0	2022-08-28 16:47:58	2022-08-28 16:47:58
BK22006677	10	전문가	고종이 683년 사망하자 무후는 고종과 낳은 아들인 중종을 황제로 세웠다가 얼마 뒤 중종을 황제 자리에서 내려오게 하고 690년에 스스로 황제를 칭하면서 당이라는 국호를 주로 바꾸게 돼.	측천무후 중종 황제 주	https://www.skyedaily.com/news/news_view.html?ID=98980	2020/02/09	0	2022-08-28 16:47:58	2022-08-28 16:51:06
BK22006677	11	질문자	정말 엄청난 여걸이었구나. 당시 측천무후는 어떤 식으로 정치를 펼쳤어?				0	2022-08-28 16:47:58	2022-08-28 16:47:58
BK22006677	12	전문가	측천무후는 구 귀족의 지배를 끝내고 과거시험 합격자 출신의 새로운 인재들로 정사를 이끌어갔어. 그래서 그녀의 통치기간은 관료가 정사를 지배하기 시작한 과도기를 대표하는 것으로 해석되고 있지.	측천무후 치세 귀족 관료	https://www.skyedaily.com/news/news_view.html?ID=98980	2020/02/09	0	2022-08-28 16:47:58	2022-08-28 16:51:06
BK22006677	13	질문자	굉장히 혁신적인 황제였네. 하지만 중국은 역사적으로 유교가 지배하던 사회라서 오히려 공격을 많이 받았을 거 같아. 예전 사람들의 평가는 어땠어?				0	2022-08-28 16:47:58	2022-08-28 16:47:58
BK22006677	14	전문가	네 말대로 당나라가 망한 후 들어선 송나라와 명나라는 문치주의와 유교 체제를 기반으로 성리학적 정치체제가 성립된 국가였지. 그래서 송나라와 명나라의 유학자들에게 좋지 않은 평가를 많이 받았어.	측천무후 성리학 유학자 평가	https://ko.wikipedia.org/wiki/%EC%B8%A1%EC%B2%9C%EB%AC%B4%ED%9B%84	2022/08/27	0	2022-08-28 16:47:58	2022-08-28 16:51:06
BK22006677	15	질문자	역시 유학자들은 평가가 박했구나. 아, 그러면 측천무후가 죽은 뒤 후사는 어떻게 됐어?				0	2022-08-28 16:47:58	2022-09-04 16:53:26
BK22006677	16	전문가	측천무후가 705년에 사망하자 중종이 다시 황위에 오르게 돼. 이로 인해 무씨가 세운 주왕조는 사라지고 다시 이씨의 당왕조로 복귀하게 되지.	측천무후 중종 주왕조 당왕조	https://www.skyedaily.com/news/news_view.html?ID=98980	2020/02/09	0	2022-08-28 16:47:58	2022-09-04 21:21:29
BK22006677	17	질문자	역시 여자황제라는 한계 때문에 1대 이상 지속되지는 못했구나. 좀 많이 아쉽네.				0	2022-08-28 16:47:58	2022-08-28 16:47:58
BK22006677	18	전문가	어쩔 수 없지 뭐. 그래도 요즘 여성들이 롤모델로 삼아도 괜찮은 인물이라고 봐.				0	2022-08-28 16:47:58	2022-08-28 16:47:58
BK22006677	19	질문자	맞아. 600년대에 여자의 몸으로 황제까지 올라간 건 정말 대단한 거 같아. 오늘 측천무후에 대해 시간 내서 알려줘서 정말 고마워.				0	2022-08-28 16:47:58	2022-08-28 16:47:58
BK22006677	20	전문가	에이, 별거 아냐. 다음에도 모르는 게 있으면 부담 갖지 말고 자유롭게 질문해 줘!				1	2022-08-28 16:47:58	2022-09-06 15:45:41
