id	utterance_id	role	text	search_query	search_URL	reference_date	terminate	regDate	updDate
BK22001273	1	질문자	요새 토익 말고 토익 스피킹 점수를 요구하는 회사들이 많아졌어요. 토익 스피킹은 정확히 어떤 시험인가요?				0	2022-07-20 16:14:56	2022-08-02 12:01:32
BK22001273	2	전문가	토익 스피킹은 영어를 모국어로 하지 않는 수험자의 영어 말하기 능력을 평가하는 시험이에요. 에듀케이셔널 테스팅 서비스가 시행하는 시험이죠.	토익 스피킹	https://ko.wikipedia.org/wiki/TOEIC_Speaking	2022/05/31	0	2022-07-20 16:14:56	2022-07-21 10:24:40
BK22001273	3	질문자	영어가 외국어인 사람들이 토익 스피킹을 보는 거군요. 그런데 에듀케이셔널 테스팅 서비스는 회사 이름인가요?				0	2022-07-20 16:14:56	2022-08-02 12:01:32
BK22001273	4	전문가	에듀케이셔널 테스팅 서비스는 더 정확히는 시험 개발 연구 기관이에요. 미국 뉴저지 프린스턴에 본사를 두고 있죠. 한국에서 유명한 TOEIC, TOEFL, GRE 등의 시험을 개발하고 시행하고 있어요.	에듀케이셔널 테스팅 서비스	https://ko.wikipedia.org/wiki/%EC%97%90%EB%93%80%EC%BC%80%EC%9D%B4%EC%85%94%EB%84%90_%ED%85%8C%EC%8A%A4%ED%8C%85_%EC%84%9C%EB%B9%84%EC%8A%A4	2022/04/26	0	2022-07-20 16:14:56	2022-07-21 10:24:40
BK22001273	5	질문자	토익과 토플을 개발하는 곳이 같은 곳이었는지 처음 알았네요. 그렇다면 토익 스피킹은 어떤 식으로 시험이 치뤄지나요?				0	2022-07-20 16:14:56	2022-08-02 12:01:32
BK22001273	6	전문가	토익 스피킹은 컴퓨터 앞에서 수험자가 헤드폰을 끼고 혼자 말하는 방식으로 시험이 치뤄져요.	토익 스피킹 시험 컴퓨터	https://www.nbntv.co.kr/news/articleView.html?idxno=237531	2020/03/12	0	2022-07-20 16:14:56	2022-07-21 10:24:40
BK22001273	7	질문자	모든 사람들이 컴퓨터 앞에서 말하는 시험이라면 시끄러울 수도 있겠는데요? 주변 소음에 방해받지 않고 말하는 연습이 필요하겠네요. 보통 시험은 어디에서 보나요?				0	2022-07-20 16:14:57	2022-08-02 12:01:32
BK22001273	8	전문가	토익을 신청할 때 홈페이지에 들어가면 날짜와 장소가 나와요. 거기에 있는 장소 중 본인이 고르면 돼요.	토익 스피킹 시험 장소	http://www.woodkorea.co.kr/news/articleView.html?idxno=39320	2019/11/25	0	2022-07-20 16:14:57	2022-07-21 10:24:40
BK22001273	9	질문자	시험을 보는 장소를 선택할 수 있다니 다행이네요. 그러면 시험 응시 비용은 얼마나 할까요?				0	2022-07-20 16:14:57	2022-08-02 12:01:32
BK22001273	10	전문가	원래는 7만 7000원이었는데 이번 7월부터 8만 4000원으로 높아졌어요.	토익 스피킹 응시료	https://view.asiae.co.kr/article/2022062310004715580	2022/06/24	0	2022-07-20 16:14:57	2022-07-21 10:24:40
BK22001273	11	질문자	시험을 한 번 보는데 8만 4000원을 내나요? 혹시 다른 영어 말하기 시험도 있나요? 그 시험도 이렇게 비싸나요?				0	2022-07-20 16:14:57	2022-08-02 12:01:32
BK22001273	12	전문가	미국 ACTFL이라는 기관에서 출제되는 오픽이라는 다른 시험이 있는데, 이 시험도 응시료가 낮지 않아요. 원어민 공인 평가자가 채점하거든요.	영어 말하기 시험	http://news.heraldcorp.com/view.php?ud=20200511000642	2020/05/11	0	2022-07-20 16:14:57	2022-07-21 10:24:40
BK22001273	13	질문자	인건비 때문에 영어 말하기 시험이 비싸나 보네요. 그런데 오픽과 토익 스피킹은 시험이 어떻게 다른가요?				0	2022-07-20 16:14:57	2022-08-02 12:01:32
BK22001273	14	전문가	토익 스피킹은 11문제를 15분 이내에 끝내야 해서 시간이 촉박해요. 하지만 정해진 패턴과 형식이 있어서, 그 틀에 맞춰 대답하면 고득점을 달성할 수가 있죠. 기존에 토익을 공부했던 사람들이 선호해요. 반면 오픽은 15문제를 40분 동안 보기 때문에 시간에 구애를 받는 정도가 덜해요.	오픽 토익스피킹 차이	http://www.gpkorea.com/news/articleView.html?idxno=73634	2021/04/28	0	2022-07-20 16:14:57	2022-07-21 10:24:40
BK22001273	15	질문자	토익 스피킹보다 오픽이 발화 시간이 훨씬 많네요. 저는 시간에 쫓기는 게 싫어서 오픽이 나을 것 같아요. 어떻게 공부해야 할까요?				0	2022-07-20 16:14:57	2022-08-02 12:01:32
BK22001273	16	전문가	오픽은 문제를 듣고 답하는 시험 방식을 채택하고 있어요. 그러니 대부분의 기출 유형에 익숙해질 수 있도록 훈련하는 게 중요하죠.	오픽 공부법	http://www.thedrive.co.kr/news/newsview.php?ncode=1065580324466829	2021/10/12	0	2022-07-20 16:14:57	2022-07-21 10:24:40
BK22001273	17	질문자	그렇다면 최대한 오픽 문제를 많이 듣고 답해봐야겠네요. 일단은 기출 유형을 파악하고, 기출 문제를 많이 풀어봐야 겠어요.				0	2022-07-20 16:14:57	2022-08-02 12:01:32
BK22001273	18	전문가	모든 종류의 시험이 비슷한 것 같아요. 최대한 많이 풀어보는 것 말이에요.				0	2022-07-20 16:14:57	2022-07-21 10:24:40
BK22001273	19	질문자	저는 지금 당장 서점에 가서 오픽 책을 사야겠어요.				0	2022-07-20 16:14:57	2022-08-02 12:01:32
BK22001273	20	전문가	그러면 우리는 이만 여기에서 헤어지죠. 조심히 들어가시고 오픽 공부 화이팅하세요.				0	2022-07-20 16:14:57	2022-07-21 10:24:40
BK22001273	21	질문자	네, 그럼 다음에 또 뵙겠습니다.				1	2022-07-20 16:14:57	2022-08-02 12:01:32
