id	utterance_id	role	text	search_query	search_URL	reference_date	terminate	regDate	updDate
BK22008395	1	질문자	시의성 있는 소재를 가지고 역사 관련 레포트를 좀 써보려고 하는데, 요즘 흑백 영화로 만든 자산어보에 대해 호평하는 사람들이 많더라고요. 혹시 영화의 제목인 자산어보는 뭘 뜻하는 건지 아세요? 시대극인 만큼 재밌는 레포트 소재가 될 것 같아요.				0	2022-09-14 13:52:05	2022-09-23 17:00:22
BK22008395	2	전문가	네, 조선시대 영조부터 순조 때까지의 학자인 정약전이 천주교 박해 사건인 신유박해로 인해 전라도 흑산도에 1801년부터 1814년까지 귀양살이를 하면서 해당 지역의 해상 생물에 관해 분석하여 편찬한 해양생물학 서적이 자산어보에요.	자산어보	https://ko.wikipedia.org/wiki/%EC%9E%90%EC%82%B0%EC%96%B4%EB%B3%B4	2022/09/10	0	2022-09-14 13:52:05	2022-09-14 18:27:14
BK22008395	3	질문자	자산어보가 해양생물학 서적이군요. 이 서적을 편찬한 정약전은 어떤 사람인가요?				0	2022-09-14 13:52:05	2022-09-14 13:52:05
BK22008395	4	전문가	조선 후기에 살았던 정약전은 문관이자 실학자로 저술가와 생물학자이기도 했어요. 그리고 형제 관계는 형인 정약현과 동생인 정약종과 정약용이 있죠.	정약전	https://ko.wikipedia.org/wiki/%EC%A0%95%EC%95%BD%EC%A0%84	2022/09/13	0	2022-09-14 13:52:05	2022-09-14 18:27:14
BK22008395	5	질문자	형제가 많았네요. 정약현도 문관이었던 동생 정약전처럼 문과시험 출신의 관리였나요?				0	2022-09-14 13:52:05	2022-09-14 18:27:14
BK22008395	6	전문가	아니요. 정약현은 정조 19년에 식년시 진사 3등에 급제했지만 벼슬자리는 받지 못했어요. 그리고 고향집에 머물면서 천주교를 믿지 않은 덕분에 1801년 순조 원년에 신유박해로 인해 조정의 천주교 신자 탄압이 매우 크게 일어나 동생들이 죽거나 유배될 때 화를 면하여 가문을 보존하였죠.	정약현	https://ko.wikipedia.org/wiki/%EC%A0%95%EC%95%BD%ED%98%84	2022/08/04	0	2022-09-14 13:52:05	2022-09-14 18:27:14
BK22008395	7	질문자	천주교를 받아들여 동생들이 죽거나 귀양을 갔군요. 그럼 정약종은 어떻게 되었나요?				0	2022-09-14 13:52:05	2022-09-14 18:27:14
BK22008395	8	전문가	조선 정조 때의 학자인 정약종은 정약용의 셋째 형으로 형제들 가운데 제일 늦게 천주교 신자가 되었으나 박해와 탄압에도 변치 않는 신앙을 유지하다가 서소문 밖에서 신유박해 때 순교하여 로마 가톨릭교회의 순교자로 남게 되죠.	정약종	https://ko.wikipedia.org/wiki/%EC%A0%95%EC%95%BD%EC%A2%85	2022/07/04	0	2022-09-14 13:52:05	2022-09-14 18:27:14
BK22008395	9	질문자	신유박해 때 순교하였군요. 그럼 정약용은 이 사건으로 어떻게 되었나요?				0	2022-09-14 13:52:05	2022-09-14 18:27:14
BK22008395	10	전문가	정약용은 조선 후기를 대표하는 실학자로 1801년에 신유박해로 인해 귀양살이를 18년 동안 하게 되죠. 이때 경세유표와 목민심서 등을 귀양지에서 저술했어요.	정약용 신유박해 유배	https://www.news1.kr/articles/?4697147	2022/05/30	0	2022-09-14 13:52:05	2022-09-14 18:27:14
BK22008395	11	질문자	정약전처럼 유배지에서 서적을 집필했군요. 목민심서는 어떤 내용을 다루고 있나요?				0	2022-09-14 13:52:05	2022-09-14 18:27:14
BK22008395	12	전문가	관리들의 폭정을 비판하면서 목민관으로 일컬어지는 지방 수령이 지켜야 할 행동 준칙을 규정한 책이에요.	목민심서	https://ko.wikipedia.org/wiki/%EB%AA%A9%EB%AF%BC%EC%8B%AC%EC%84%9C	2022/02/12	0	2022-09-14 13:52:05	2022-09-14 18:27:14
BK22008395	13	질문자	관리들의 폭정을 비판한 저서군요. 그런데 신유박해가 정확히 어떤 사건인가요?				0	2022-09-14 13:52:05	2022-09-14 18:27:14
BK22008395	14	전문가	1801년에 일어난 조선 천주교 박해 사건이 신유박해에요. 시파를 없애기 위해 오래전부터 숙원해온 벽파가 시파와의 정치 싸움에서 천주교 탄압을 구실로 일으킨 사건이었죠.	신유박해	https://ko.wikipedia.org/wiki/%EC%8B%A0%EC%9C%A0%EB%B0%95%ED%95%B4	2022/08/11	0	2022-09-14 13:52:05	2022-09-23 17:00:22
BK22008395	15	질문자	조선 천주교 박해 사건이 신유박해군요. 그럼 조선에서 천주교 박해가 자주 있었나요?				0	2022-09-14 13:52:05	2022-09-14 18:27:14
BK22008395	16	전문가	천주교가 조선 후기에 들어와서 크게 세 번의 박해가 발생하는데, 표면적으로는 종교탄압이지만 속내는 정치 투쟁이었죠. 천주교 박해 사건으로는 1791년에 발생한 신해사옥과 1801년에 일어난 신유사옥 그리고 1866년의 병인사옥이 있었죠.	조선 후기 천주교 박해 사건은 크게 세 번	https://www.whitepaper.co.kr/news/articleView.html?idxno=61870	2016/02/15	0	2022-09-14 13:52:05	2022-09-14 18:27:14
BK22008395	17	질문자	본질은 권력 투쟁이었군요. 오늘 자산어보의 시대적 배경에 대해 공부할 수 있어서 좋았어요.				0	2022-09-14 13:52:05	2022-09-23 17:00:22
BK22008395	18	전문가	네, 저도 오늘 대화 좋았어요.				0	2022-09-14 13:52:05	2022-09-14 18:27:14
BK22008395	19	질문자	요즘 해가 짧아져서 그런지 금세 어두워졌네요. 조심히 들어가시고, 또 뵈어요.				1	2022-09-14 13:52:05	2022-09-23 17:00:22
BK22008395	20	전문가	정말 해가 많이 짧아진 것 같아요. 그럼 살펴 가시고, 또 봬요.				0	2022-09-14 13:52:05	2022-09-14 18:27:14
