id	utterance_id	role	text	search_query	search_URL	reference_date	terminate	regDate	updDate
BK22003195	1	질문자	우주란 참 신비로운 존재예요. 최근 제임스 웹으로 찍은 사진을 봤는데, 아름답기도 하고 조금 무섭기도 하고 그렇더라고요. 그런데 기존에 있던 허블과는 다른 건가요?				0	2022-08-04 11:10:15	2022-08-05 09:42:20
BK22003195	2	전문가	둘은 파장대가 달라요. 허블은 자외선에서 가시광선 부분까지 촬영하는데, 제임스웹은 근적외선에서 중적외선까지 촬영 가능한 적외선 전용 망원경이거든요.	제임스웹 허블 차이	https://www.hellodd.com/news/articleView.html?idxno=97517	2022/07/17	0	2022-08-04 11:10:15	2022-08-08 09:21:12
BK22003195	3	질문자	파장대의 차이군요. 그럼 지금 사용하는 제임스 웹의 성능은 어느 정도 되는건가요?				0	2022-08-04 11:10:15	2022-08-05 17:24:06
BK22003195	4	전문가	제임스 웹 우주 망원경은 천문학 역사상 가장 큰 프로젝트로 꼽히고 있어요. 약 100억 달러, 우리나라 돈으로 13조 원 정도가 투자되었죠. 기존에 사용하던 허블 우주 망원경보다 100배 높은 성능을 가지고 있어요. 나사에서는 제임스 웹이 135억 년 전 초기 우주에서 생겼던 별의 빛을 관찰할 수 있을 거라 기대하고 있을 정도죠.	제임스웹 성능	https://m.mbn.co.kr/news/world/4802186	2022/07/12	0	2022-08-04 11:10:15	2022-08-08 09:21:12
BK22003195	5	질문자	가늠도 안 될 역사 속을 보게 되는 거네요. 최근 뉴스에 제임스 웹이 초기 우주 빛을 찍었다고 본 것 같은데 맞나요?				0	2022-08-04 11:10:15	2022-08-04 11:10:15
BK22003195	6	전문가	제임스 웹이 찍은 SMACS 0723 은하단은 뒤에서 다가오는 빛을 확대시키고 휘게 만들어요. 이 은하단의 사진에서 중력렌즈에 의해 은하보다 훨씬 더 먼 131억 년 전 초기 우주에서 온 빛이 발견되었죠. 중력 렌즈 현상은 아인슈타인의 상대성이론으로 설명할 수 있는데, 블랙홀이나 은하단처럼 중력이 강한 천제는 뒤에서 다가오는 빛을 확대시키고 휘게 하는 현상이 있음을 말하는 거예요.	초기우주 관찰	https://www.chosun.com/economy/science/2022/07/13/K6ELLWZOERDZ5EMOQYPTZSRQEQ/	2022/07/13	0	2022-08-04 11:10:15	2022-08-04 11:10:15
BK22003195	7	질문자	과학 기술이란 정말 신기하면서도 어려운 것 같아요. 이렇게까지 관찰하려면 망원경 자체의 크기가 엄청 커야할 것 같은데 제임스 웹의 크기는 어느정도인가요?				0	2022-08-04 11:10:15	2022-08-04 11:10:15
BK22003195	8	전문가	제임스 웹의 거울을 모두 펼치면 지름은 6.5m예요. 허블 망원경의 약 3배 정도 되는 크기죠. 집광 면적은 25제곱미터죠.	제임스웹 크기	https://m.dongascience.com/news.php?idx=55341	2022/07/12	0	2022-08-04 11:10:15	2022-08-04 11:10:15
BK22003195	9	질문자	만들기도 어려웠겠지만 우주로 어떻게 쏘아 올렸던거죠? 너무 큰 것 같아서요.				0	2022-08-04 11:10:15	2022-08-04 11:10:15
BK22003195	10	전문가	맞아요. 그래서 로켓에 탑재될 때는 폴더블폰처럼 거울의 한쪽 끝부분을 접었다가 우주에서 로켓과 분리되었을 때 펼치는 방식으로 진행되었어요. 대각선이 1.3m인 정육각형 거울 18개를 이어붙여서 만든거죠.	제입스웹 로켓발사	https://m.dongascience.com/news.php?idx=55341	2022/07/12	0	2022-08-04 11:10:15	2022-08-04 11:10:15
BK22003195	11	질문자	진짜 대단하네요. 그런데 인류가 우주로 망원경을 쏘아 올린 건 언제인가요?				0	2022-08-04 11:10:15	2022-08-04 11:10:15
BK22003195	12	전문가	1990년이에요. 허블망원경이 우주완복선에 실려 대기권 밖 지구 상공 600여km 궤도에 안착해 여러 활동을 시작했고 그간 인류가 모르고 있던 다양한 우주 정보들을 캐치했어요. 천체물리학의 오랜 난재들을 푸는데 자료들을 제공해주었어요.	우주망원경 역사	http://mobile.busan.com/view/busan/view.php?code=2022011118453680777	2022/01/11	0	2022-08-04 11:10:15	2022-08-05 09:42:20
BK22003195	13	질문자	그 이후 제임스 웹이 올려진거군요. 그런데 꼭 우주에 망원경을 쏘아 올리는 이유가 있나요? 지상에서도 우주 관측은 할 수 있잖아요.				0	2022-08-04 11:10:15	2022-08-04 11:10:15
BK22003195	14	전문가	지구는 대기층에 쌓여있기 때문에 우주의 빛은 대기층을 지나야 지표면에 닿을 수 있어요. 덕분에 우리는 지구에서 안전하게 생활할 수 있지만, 우주로부터 오는 빛 중에 가시광선과 전파 영역을 뺀 다른 파장의 빛은 모두 대기로 인해 차단되거나 흡수되어 관측이 불가해요. 지상에서 관찰하는 것만으로 우주에 대한 모든 정보를 알 수 없는거죠. 대기는 흔들리는 현상도 있어서 원래보다 커지고 흐릿하게 보일 수도 있죠. 이런 문제들을 해결하기위해 우주 공간에서 관측을 하는데, 지구의 대기 흔들림에 의한 화질 저하를 해결할 수 있고 대기층으로 인한 관측 파장의 제한을 받지 않을 수 있죠.	우주망원경	https://ko.wikipedia.org/wiki/%EC%9A%B0%EC%A3%BC%EB%A7%9D%EC%9B%90%EA%B2%BD	2022/07/16	0	2022-08-04 11:10:15	2022-08-05 09:42:20
BK22003195	15	질문자	그렇군요. 그래도 비용이나 시간이 많이 들어가니 많은 나라에서 시도하진 못할 것 같아요. 이번 제임스 웹 발사에 우리나라도 함께 했나요?				0	2022-08-04 11:10:15	2022-08-04 11:10:15
BK22003195	16	전문가	아니요. 우리나라는 개발 과정에 참여하지 못했어요. 천문 후발국으로 한국의 입지가 그리 높지 않고 우주개발의 예산이 부족한 실정도 이유가 되었을 거예요. 차별화된 우리나라만의 전략 모색도 이유로 나오고 있어요.	제임스웹 한국 참여	https://www.edaily.co.kr/news/read?newsId=01095526632394848&mediaCodeNo=257	2022/07/15	0	2022-08-04 11:10:15	2022-08-04 11:10:15
BK22003195	17	질문자	우리나라는 참여하지 못했군요. 우주 관측 분야에서 우리나라도 무언가 노력을 하고 있나요?				0	2022-08-04 11:10:16	2022-08-04 11:10:16
BK22003195	18	전문가	한국천문연구원이 나사와 함께 우주 전체를 촬영하는 적외선 우주 망원경인 스피어X 개발에 참여중이에요. 기기개발, 자료처리 소프트웨어, 과학연구 전반에 걸쳐 참여하고 있으니 성과를 기대해봐요.	한국 우주관측	https://m.dongascience.com/news.php?idx=55354	2022/07/15	0	2022-08-04 11:10:16	2022-08-04 11:10:16
BK22003195	19	질문자	오, 기대되네요! 우주 관측은 지금 당장 내 생활에 영향을 주는 분야가 아니다보니 이런 빅뉴스가 나와야 관심을 갖게 되는 것 같아요.				0	2022-08-04 11:10:16	2022-08-04 11:10:16
BK22003195	20	전문가	아무래도 그렇죠. 하지만 천문학은 인류 생활과 땔 수 없는 실용적 기술이에요. 규칙적인 천체 현상을 관찰해 표준 시간을 정할 수 있었고 농사, 어업, 일상생활에 적용되었죠. 먼 거리로 이동하게 될 때 정확한 위치를 추적할 수 있게하는 것 역시 천문학을 바탕으로 하고 있어요.	우주관측 필요성	https://www.sciencetimes.co.kr/news/%EC%9A%B0%EC%A3%BC-%EA%B7%BC%EC%9B%90-%ED%83%90%EA%B5%AC%ED%95%98%EC%97%AC-%EB%AF%B8%EB%9E%98%EB%A5%BC-%EC%98%88%EC%B8%A1%ED%95%9C%EB%8B%A4/	2020/12/16	0	2022-08-04 11:10:16	2022-08-04 11:10:16
BK22003195	21	질문자	몰라서 그렇지 우리 생활에 스며들어 있었네요. 우리나라도 우주 개발에 더욱 투자하고 개발했으면 좋겠어요.				0	2022-08-04 11:10:16	2022-08-04 11:10:16
BK22003195	22	전문가	우리나라 국민 10명 중 9명이 국가 발전에 우주 분야가 중요하다고 생각해요. 우주 개발의 예산을 지금보다 늘려야 한다는 의견도 81.9퍼센트나되고요. 국민들의 관심이 높으니 지금보다 더 발전하게 될 거예요.	한국 우주개발 예산 늘려야	https://m.dongascience.com/news.php?idx=51236	2021/12/22	0	2022-08-04 11:10:16	2022-08-04 11:10:16
BK22003195	23	질문자	다행이네요. 저도 꾸준히 관심을 가지고 지켜봐야겠어요. 다음에 제임스 웹의 사진이 또 공개되면 다시 이야기해봐요.				1	2022-08-04 11:10:16	2022-08-08 09:21:12
