id	utterance_id	role	text	search_query	search_URL	reference_date	terminate	regDate	updDate
BK22006268	1	질문자	바다 수평선을 보고 있으면 지구가 둥들다는게 새삼 느껴져. 옛날 사람들도 지구가 둥글다는 것을 알았을까? 우리는 당연하게 받아들이고 있지만 옛날에는 어떨 지 모르잖아.				0	2022-08-23 17:14:55	2022-08-23 17:14:55
BK22006268	2	전문가	놀랍게도 기원전 6세기의 수학자로 잘 알려진 피타고라스는 형태의 순수성을 근거로, 신의 작품이자 인류의 터전인 지구는 완전한 구여야 한다고 했어. 그리고 200여년 뒤 아리스토텔레스가 월식 때 달에 생기는 지구의 그림자를 근거로 지구가 구형의 천체라는 더 과학적인 주장을 했지. 그는 우리가 아는 수평선 너머 다가오는 배의 돛대의 모습도 증거로 내세웠어.	지구는 둥글다	https://www.hani.co.kr/arti/science/science_general/741948.html	2016/05/01	0	2022-08-23 17:14:55	2022-08-23 17:14:55
BK22006268	3	질문자	그거 놀라운데? 그래도 옛날 사람들은 관찰되는 결과에만 의존해야해서 가설의 영역을 벗어나지 못했을 것 같아. 오늘날에는 지구 둘레까지 측정한다는 걸 알면 많이 놀라지 않을까?				0	2022-08-23 17:14:55	2022-09-02 09:25:14
BK22006268	4	전문가	과연 그럴까? 에라토스테네스는 원 둘레 공식을 이용해 약 46,250㎞ 라는 지구 둘레 값을 구했어. 오늘날 밝혀진 40,075km보다 약 15% 많은 값이야.	지구 둘레	https://www.sciencetimes.co.kr/news/10%EA%B0%9C%EA%B5%AD%EC%9D%B4-%EB%AD%89%EC%B3%90-%EC%A7%80%EA%B5%AC-%EB%91%98%EB%A0%88-%EA%B3%84%EC%82%B0/	2017/02/27	0	2022-08-23 17:14:55	2022-09-02 09:25:14
BK22006268	5	질문자	거의 유사하다니 정말 놀라워. 하지만 천동설이 중세에 지배적인 것을 보면 받아들여지지 않은 것 같아. 천동설이 무너진 때는 언제야?				0	2022-08-23 17:14:55	2022-09-02 09:25:14
BK22006268	6	전문가	우선 간단하게 역사를 보면 BC 3세기에 그리스인 아리스타르코스가 최초로 정지해 있는 태양을 중심으로 지구가 돈다고 주장했지만, 1800년 후인 16세기가 되서야 폴란드의 수학자이자 천문학자인 코페르니쿠스가 완전히 예측 가능한 태양중심 체계를 수학적 모델로 제시했어. 코페르니쿠스 체계는 나중에 요하네스 케플러가 다듬어 확장되었어. 그리고 갈릴레오 갈릴레이가 천체 망원경을 개발해 지동설에 관한 근거를 내놓았어. 이게 지동설이 인정 받게 되는 결정적인 역할을 했지.	지동설	https://ko.wikipedia.org/wiki/%ED%83%9C%EC%96%91%EC%A4%91%EC%8B%AC%EC%84%A4	2022/07/03	0	2022-08-23 17:14:55	2022-09-02 09:25:14
BK22006268	7	질문자	갈릴레오 갈릴레이도 지구가 둥글다고 주장한 사람아니야? 어렴풋이 기억나.				0	2022-08-23 17:14:55	2022-09-02 09:25:14
BK22006268	8	전문가	맞아. 갈릴레이는 망원경을 개량하여 관찰하고 운동 법칙을 확립했어. 이렇듯 코페르니쿠스의 이론을 옹호하여 태양계의 중심이 지구가 아니라 태양이라고 믿었지. 하지만 연구 성과에 대한 반대가 많아 자진해서 로마 교황청을 방문했고 변명했지만 종교 재판에 회부되어 지동설의 포기를 명령도 받았어.	갈릴레오 갈릴레이	https://ko.wikipedia.org/wiki/%EA%B0%88%EB%A6%B4%EB%A0%88%EC%98%A4_%EA%B0%88%EB%A6%B4%EB%A0%88%EC%9D%B4	2022/07/06	0	2022-08-23 17:14:55	2022-09-02 09:25:14
BK22006268	9	질문자	그 사건에서 지구는 그래도 돈다라는 이야기 있었던 것 같아. 그러고보니 지구는 왜 둥근 거야? 아무도 지구가 둥근 이유에 대해서는 설명하지 않네.				0	2022-08-23 17:14:55	2022-08-23 17:14:55
BK22006268	10	전문가	중력을 알아야 해. 중력은 인력밖에 없고 어떤 것에도 차단되지 않아 물질의 양이 늘어나면 점점 강해지지. 그래서 어떤 물질이라도 대량으로 모이면 중력이 주변에 가장 큰 영향을 주는 힘이 돼. 어느정도 이상의 질량을 가지는 천체는 자신의 중력만으로 그 모양이 결정되고 큰 천체 내부 각 부분은 중심을 향해 균등하게 중력을 받아 구형의 모습을 띠게 되는 거지.	지구가 둥근 이유	http://www.gycitizen.com/news/articleView.html?idxno=15167	2016/12/26	0	2022-08-23 17:14:55	2022-09-02 09:25:14
BK22006268	11	질문자	자전도 그럼 중력때문에 일어나는 걸까? 공을 어느 한 축 중심에 세워두고 제자리에서 회전 시킬 수 있는 것처럼 말이야.				0	2022-08-23 17:14:56	2022-08-23 17:14:56
BK22006268	12	전문가	이건 경우가 다른 것 같아. 나오즈 교수에 의하면, 우주 바위들이 지구에 흡수되는 과정 중 지구와 충돌하게 되어 많은 충격량이 지구에 가해졌어. 이 힘 때문에 지구에 가속도가 붙어 지금처럼 빠른 속도로 자전을 하게 되었다는 거지.	지구 자전	https://www.sciencetimes.co.kr/news/%EC%A7%80%EA%B5%AC%EB%8A%94-%EC%99%9C-%EC%9E%90%EC%A0%84%ED%95%98%EB%8A%94-%EA%B2%83%EC%9D%BC%EA%B9%8C/	2018/08/27	0	2022-08-23 17:14:56	2022-09-02 09:25:14
BK22006268	13	질문자	자전을 알기 위해서는 생성과정에 초점을 맞춰야 하는 거구나. 그렇다면 태양의 질량이 크니까 공전이 중력 때문이겠다. 난 지구의 자전축도 중력때문에 기울어 있는 것 같다고 생각하는데 맞을까?				0	2022-08-23 17:14:56	2022-09-02 09:25:14
BK22006268	14	전문가	정확했어. 그런데 놀라운 건 지구 자전축이 23.5도로 안정되게 잡아주는 건 달이라는 사실이야. 달이 없었다면 태양의 중력으로 인해서 태양을 향해 심하게 기울어 질 수도 있거든. 그렇게 되면 지구에는 4계절도 없고 남북극이 녹아 생물이 생존할 수 없는 행성이 되었을 거야. 조석력보다도 달은 이런 점에서 더 큰 영향을 주는 셈이지.	지구 축	https://www.sciencetimes.co.kr/news/%EC%A7%80%EA%B5%AC%EC%99%80-%EB%8B%AC-%EA%B3%B5%EC%83%9D%EA%B4%80%EA%B3%84%EC%9D%98-%EB%81%9D%EC%9D%80/	2016/02/12	0	2022-08-23 17:14:56	2022-09-02 09:25:14
BK22006268	15	질문자	마침 23.5도로 유지되는 이유도 알고 싶었는데 달의 역할까지 알게되어 놀라워. 그런데 조석력이 어떤 것인지 알 수 있을까?				0	2022-08-23 17:14:56	2022-08-23 17:14:56
BK22006268	16	전문가	달은 지구의 바닷물을 밀거나 끌어당기는 조석현상을 일으켜. 이건 조석력 때문이야. 지구의 바닷물은 달을 마주보고 있는 쪽과 그 반대쪽을 향해 움직이지.	조석력	https://m.dongascience.com/news.php?idx=15611	2016/12/31	0	2022-08-23 17:14:56	2022-08-23 17:14:56
BK22006268	17	질문자	달이 여러가지 방면으로 지구에 영향을 주다니 매우 놀라워. 다시 지구가 둥글다는 이야기로 돌아와서, 지구가 둥글다는 걸 확인한 사례가 콜럼버스가 맞을까?				0	2022-08-23 17:14:56	2022-09-01 14:36:33
BK22006268	18	전문가	그렇지 않아. 포르투갈 태생의 스페인 탐험가인 페르디난드 마젤란이 세계최초로 세계일주에 성공한 유럽인으로 인정받고 있어. 마젤란의 항해로 지구가 둥글다는 사실이 실질적으로 입증되었어.	마젤란	https://ko.wikipedia.org/wiki/%ED%8E%98%EB%A5%B4%EB%94%94%EB%82%9C%EB%93%9C_%EB%A7%88%EC%A0%A4%EB%9E%80	2022/07/21	0	2022-08-23 17:14:56	2022-09-01 16:44:47
BK22006268	19	질문자	세계 최초니까 콜럼버스 이전의 사람일 것 같은데 그 시절 세계일주라니 놀라운데? 어릴 적 나도 탐험가를 꿈꾼 적이 있는데 탐험가의 심리가 그런 용기를 만드는 것일지도. 난 서핑이나 하러 가야겠다.				0	2022-08-23 17:14:56	2022-09-01 14:36:33
BK22006268	20	전문가	잘 가다가 이상한 이야기로 샜잖아. 웬일로 과학에 관심을 가지나 했더니, 같이 좀 가!				1	2022-08-23 17:14:56	2022-09-02 09:25:14
