id	utterance_id	role	text	search_query	search_URL	reference_date	terminate	regDate	updDate
BK22007885	1	질문자	저는 요새 한의학에 관심이 생겨서 이것저것 공부하고 있어요. 사상체질의학이라고 아시죠?				0	2022-09-08 11:02:29	2022-09-08 11:22:16
BK22007885	2	전문가	사장체질의학 알죠. 조선 후기에 이제마 선생이 체계화한 학문인데, 중의학 본고장인 중국에 존재하지 않는 한의학만의 독특한 영역이죠.	사상체질의학 중의학	https://www.nocutnews.co.kr/news/5619851	2021/09/06	0	2022-09-08 11:02:29	2022-09-08 11:22:16
BK22007885	3	질문자	네, 맞아요. 한의학만의 독특한 부분이라는 게 신기해요. 사상체질 관련 연구는 외국에서는 하고 있지 않죠?				0	2022-09-08 11:02:29	2022-10-27 13:26:26
BK22007885	4	전문가	그렇죠. PubMed에서 검색어 sasang constitution을 치면 사상체질 연구를 진행하는 것은 전부 한국인이라는 사실을 알 수 있어요. 사실 이제마 주장을 근거를 가지고 검증한 연구가 없거든요. 그러니까 정치적인 이유가 없으면 특별히 연구를 할 이유도 없는 거죠.	사상체질의학은 이제마	http://www.doctorsnews.co.kr/news/articleView.html?idxno=129428	2019/06/03	0	2022-09-08 11:02:29	2022-09-08 11:22:16
BK22007885	5	질문자	아, 역시 검증이 안 됐군요. 그래도 흥미로운 이론이긴 한 것 같아요. 사상체질의학에서 인간을 4가지 형태로 나누는 기준이 정확히 뭐예요?				0	2022-09-08 11:02:29	2022-10-27 13:26:26
BK22007885	6	전문가	신체 장기가 큰지 작은지, 골격의 형태는 어떤지, 성격은 어떤지, 지배적인 감정상태는 무엇인지 등이죠. 이제마는 이런 것을 파악해 음양 및 대소의 조합인 태양인, 소양인, 태음인, 소음인의 4가지 형태로 인간을 구분했어요.	태음인 소음인 소양인 체질	https://www.seoul.co.kr/news/newsView.php?id=20220809025010&wlog_tag3=naver	2022/08/09	0	2022-09-08 11:02:29	2022-09-08 11:22:16
BK22007885	7	질문자	확실히 명확히 근거를 제시하기가 애매한 기준들이기는 하네요. 한의학에서는 8체질 의학도 흥미롭던데요. 8체질 의학은 언제 처음 등장한 거죠?				0	2022-09-08 11:02:29	2022-09-08 11:22:16
BK22007885	8	전문가	체질을 8가지로 분류한 8체질의학은 1965년 권도원이 발표한 것이죠. 침 치료, 식이, 운동 등 섭생법을 병행하여 질병 치료와 예방에 효과가 좋다고 알려져 있죠.	8체질 권도원	http://www.e2news.com/news/articleView.html?idxno=92027	2016/04/07	0	2022-09-08 11:02:29	2022-09-08 11:22:16
BK22007885	9	질문자	네, 제 주변에서도 8체질에 정말 관심이 많아요. 8체질에서 제시하는 인간의 여덟 가지 체질에는 뭐가 있어요?				0	2022-09-08 11:02:29	2022-09-08 11:22:16
BK22007885	10	전문가	금양, 금음으로 나뉘는 태양인, 목양, 목음의 태음인, 토양, 토음의 소양인, 수양, 수음의 소음인 등 총 여덟 가지 체질이 있죠. 각 체질별로 이로운 음식과 해로운 음식이 정해져 있어요. 그래서 이로운 음식은 되도록 즐겨 먹고 해로운 음식을 먹지 않는 것이 좋죠.	8체질 금양 금음 토양 토음	http://www.busan.com/view/busan/view.php?code=2022041118210626580	2022/04/11	0	2022-09-08 11:02:29	2022-09-08 11:22:16
BK22007885	11	질문자	사상 체질에서 더 깊게 들어가서 4개 분류를 8개 분류로 발전시킨 거군요. 8체질에서는 확실히 식이를 중요하게 보더라고요. 그런데 각 체질에 좋은 음식은 어떻게 정해진 거예요?				0	2022-09-08 11:02:29	2022-09-08 11:22:16
BK22007885	12	전문가	8체질별 식이법이 어떻게 도출되었는지에 대한 원리, 과정, 분류 기준은 확실히 알려져 있지 않아요. 권도원 선생이 오랫동안 임상을 통해 실험하면서 골라낸 목록이라고 봐야죠.	8체질의학 체질식	http://www.mjmedi.com/news/articleView.html?idxno=50019	2020/01/11	0	2022-09-08 11:02:29	2022-09-08 11:22:16
BK22007885	13	질문자	아, 그럼 역시 과학적 검증이 되지 않았네요. 아까 체질 감별 자체도 기준이 좀 모호했잖아요. 그럼 신뢰성을 갖추기 위해서는 좀 더 많은 연구가 필요한 거 아닌가요?				0	2022-09-08 11:02:29	2022-09-08 11:22:16
BK22007885	14	전문가	네, 그렇죠. 체질 감별을 보통 진맥을 짚어서 하는 데다 한의사들마다 방법이 다를 때도 많다 보니까, 신뢰성을 갖춘 감별 방법에 대해 연구가 필요하다는 목소리가 높아요. 하지만 8체질은 단순히 증상에 따라 똑같은 처방을 내리기보다는 동일한 병이라도 체질에 따라 처방을 달리 하기 때문에, 개인에 맞춘 진료를 진행할 수 있다는 게 특징이죠.	체질 감별 8체질	https://www.allurekorea.com/2020/08/06/8%ec%b2%b4%ec%a7%88%ec%9d%84-%ec%95%84%ec%8b%ad%eb%8b%88%ea%b9%8c/?utm_source=naver&utm_medium=partnership	2020/08/06	0	2022-09-08 11:02:29	2022-09-08 11:22:16
BK22007885	15	질문자	그렇군요, 어쨌든 우리나라만의 독창적인 학문이라는 게 참 신기하긴 하네요.				0	2022-09-08 11:02:29	2022-09-08 11:22:16
BK22007885	16	전문가	맞아요, 저도 그렇게 생각해요.				0	2022-09-08 11:02:29	2022-10-27 13:26:26
BK22007885	17	질문자	그래도 한의학 자체는 중의학에서 영향을 많이 받은 거죠?				0	2022-09-08 11:02:29	2022-09-08 11:22:16
BK22007885	18	전문가	네, 맞아요. 한의학은 중의학에서 큰 영향을 받았기 때문에 주된 이론과 생명관 등에 있어서는 중의학과 모두 같아요. 전통의학은 중국전통의학과 한국전통의학인 한의학을 각각 구분해서 부르고 있으며 극히 일부 면에서 차이가 있긴 하지만, 학문적 체계는 동일하죠.	중의학 8체질	http://www.mjmedi.com/news/articleView.html?idxno=30092	2015/11/02	0	2022-09-08 11:02:29	2022-10-27 13:26:26
BK22007885	19	질문자	그렇군요. 더 궁금한 점이 많은데, 제가 약속이 있어서 이만 가봐야겠네요.				0	2022-09-08 11:02:29	2022-09-08 11:22:16
BK22007885	20	전문가	다음에 또 얘기하면 되죠 뭐. 그럼 조심히 들어가요.				1	2022-09-08 11:02:29	2022-10-27 13:26:26
