id	utterance_id	role	text	search_query	search_URL	reference_date	terminate	regDate	updDate
BK22012965	1	질문자	우리가 지금 사용하는 한글은 누가 만든 건가요?				0	2022-09-30 15:28:48	2022-10-01 17:00:35
BK22012965	2	전문가	한글은 세종이 한국어를 표기하기 위해 창제했어요. 한국어의 공식 문자인 한글은 훈민정음을 20세기 초반 이후부터 다르게 부르는 이름이죠.	한글	https://ko.wikipedia.org/wiki/%ED%95%9C%EA%B8%80	2022/09/13	0	2022-09-30 15:28:48	2022-10-01 17:00:35
BK22012965	3	질문자	어떠한 이유로 한글로 부르기로 한 건가요?				0	2022-09-30 15:28:48	2022-10-01 17:00:35
BK22012965	4	전문가	훈민정음은 홀대받던 우리글이었는데 으뜸가는 글, 하나밖에 없는 글이라는 뜻의 한글로 새롭게 부르자고 제안하며 사용하게 된 것이에요.	주시경	https://ko.wikipedia.org/wiki/%EC%A3%BC%EC%8B%9C%EA%B2%BD	2022/07/04	0	2022-09-30 15:28:48	2022-10-01 17:00:35
BK22012965	5	질문자	홀대받던 글이었는데 왜 우리의 공식 문자가 된 거예요?				0	2022-09-30 15:28:48	2022-10-01 17:00:35
BK22012965	6	전문가	한자와 비교해서 배우기 쉽고 읽기와 쓰기가 쉬워서 널리 퍼지게 되었고 오늘날 한국어를 표기하는 공식 문자가 된 것이죠.	훈민정음	https://ko.wikipedia.org/wiki/%ED%9B%88%EB%AF%BC%EC%A0%95%EC%9D%8C	2022/07/23	0	2022-09-30 15:28:48	2022-10-01 17:00:35
BK22012965	7	질문자	그럼 한자가 어려워서 한글을 만들게 된 것인가요?				0	2022-09-30 15:28:48	2022-10-01 17:00:35
BK22012965	8	전문가	네, 1443년에 세종은 당시 백성들이 한자를 쉽게 배우지 못하였고 우리 말과 한자가 연관이 없어 말하고 싶은 것을 표현하지 못하는 걸 보고 안타까운 마음에 28개의 글자를 창제한 것이죠.	조선 세종	https://ko.wikipedia.org/wiki/%EC%A1%B0%EC%84%A0_%EC%84%B8%EC%A2%85	2022/09/12	0	2022-09-30 15:28:48	2022-10-01 17:00:35
BK22012965	9	질문자	그럼 한글이 창제되기 전에 한국어는 이미 있었던 건가요?				0	2022-09-30 15:28:48	2022-10-01 17:00:35
BK22012965	10	전문가	맞아요, 한국어 역사 중 10세기부터 16세기 사이에 중세 한국어가 있었어요. 이 시기에 한국어와 잘 맞는 훈민정음이 창제되며 표음문자로 된 표기가 시작된 것이에요.	중세 한국어	https://ko.wikipedia.org/wiki/%EC%A4%91%EC%84%B8_%ED%95%9C%EA%B5%AD%EC%96%B4	2022/03/12	0	2022-09-30 15:28:48	2022-10-01 17:00:35
BK22012965	11	질문자	정말 오래전부터 한국어가 사용되고 있었군요! 혹시 더 오래전에도 한국어가 있었나요?				0	2022-09-30 15:28:48	2022-10-01 17:00:35
BK22012965	12	전문가	네, 중세 한국어로 발전하기 이전에 한국어가 처음 문증되는 단계의 언어인 고대 한국어가 있었어요.	고대 한국어	https://ko.wikipedia.org/wiki/%EA%B3%A0%EB%8C%80_%ED%95%9C%EA%B5%AD%EC%96%B4	2022/09/09	0	2022-09-30 15:28:49	2022-10-01 17:00:35
BK22012965	13	질문자	그렇군요, 현재 한국어는 우리나라만 사용하고 있죠?				0	2022-09-30 15:28:49	2022-10-01 17:00:35
BK22012965	14	전문가	아니에요, 한국어는 남한과 북한의 공용어예요. 다만, 한국에서는 한국어나 한국말이라고 부르고 북한은 조선어나 조선말이라고 불러요.	한국어	https://ko.wikipedia.org/wiki/%ED%95%9C%EA%B5%AD%EC%96%B4	2022/08/11	0	2022-09-30 15:28:49	2022-10-01 17:00:35
BK22012965	15	질문자	그럼 북한과 정확히 같은 말을 사용하고 있다는 거예요?				0	2022-09-30 15:28:49	2022-10-01 17:00:35
BK22012965	16	전문가	그렇지는 않아요. 남한과 북한은 약 80년 가까이 분단되었기 때문에 언어상의 특징이 약간 달라요. 하지만 소수의 단어를 빼면 모든 언어와 문법이 일치해서 의사소통에 문제가 되지는 않죠.	한국어의 남북 간 차이	https://ko.wikipedia.org/wiki/%ED%95%9C%EA%B5%AD%EC%96%B4	2022/08/11	0	2022-09-30 15:28:49	2022-10-01 17:00:35
BK22012965	17	질문자	북한 사람들과 대화를 해본 적이 없어서 몰랐는데 이제 알겠어요, 감사합니다.				0	2022-09-30 15:28:49	2022-10-01 17:00:35
BK22012965	18	전문가	별말씀을요, 더 궁금한 거 없으세요?				0	2022-09-30 15:28:49	2022-10-01 17:00:35
BK22012965	19	질문자	사실 한글 문법도 궁금한데 시간이 너무 늦었죠?				0	2022-09-30 15:28:49	2022-10-01 17:00:35
BK22012965	20	전문가	네, 지금은 졸리니까 내일 카페에서 알려줄게요.				1	2022-09-30 15:28:49	2022-10-01 17:00:35
