id	utterance_id	role	text	search_query	search_URL	reference_date	terminate	regDate	updDate
BK22004473	1	질문자	요즘 주식을 하는 친구들이 본인들이 동학 개미 운동을 한다고 해서 한참을 웃었지 뭐예요.				0	2022-08-04 11:39:40	2022-08-08 13:51:10
BK22004473	2	전문가	하하, 재밌는 친구분들을 두셨네요.				0	2022-08-04 11:39:40	2022-08-08 13:51:10
BK22004473	3	질문자	그런데 웃다 보니 갑자기 동학농민운동이 기억이 나더라고요. 학교를 다니면서 어렴풋이 배웠던 기억은 나는데 정확히는 잘 기억이 나질 않아서 오늘 여쭤보려고 생각하고 있었어요.				0	2022-08-04 11:39:40	2022-08-08 13:51:10
BK22004473	4	전문가	재밌게 웃고 떠드는 와중에도 저에게 물어볼 것을 생각하고 계셨군요. 동학농민혁명은 농민혁명, 동학혁명, 동학운동, 동학농민운동, 동학농민전쟁 등 불리는 이름이 많은 혁명이죠. 1894년 동학 지도자, 신도, 농민과 같은 백성들이 연합해 주도한 무장봉기 운동이죠.	동학 농민 혁명	https://ko.wikipedia.org/wiki/%EB%8F%99%ED%95%99_%EB%86%8D%EB%AF%BC_%ED%98%81%EB%AA%85	2022/07/15	0	2022-08-04 11:39:40	2022-08-08 13:51:10
BK22004473	5	질문자	말씀하시는 것을 들어보니 요즘은 동학농민운동보다 혁명이라는 단어를 사용하는 모양이네요. 그런데 동학은 뭔가요?				0	2022-08-04 11:39:40	2022-08-08 13:51:10
BK22004473	6	전문가	동학은 철종 11년인 1860년에 최제우가 창설한 신흥 종교예요.	동학	https://ko.wikipedia.org/wiki/%EB%8F%99%ED%95%99	2022/02/21	0	2022-08-04 11:39:40	2022-08-08 13:51:10
BK22004473	7	질문자	동학이 어떤 학문이 아니라 종교였군요. 그런데 동학농민운동이 일어난 계기는 뭔가요?				0	2022-08-04 11:39:40	2022-08-08 13:51:11
BK22004473	8	전문가	1차 동학농민운동은 동학 교주 최제우의 명예를 복권시키려는 교조신원운동에서 출발해요.	교조신원운동	http://www.jeollailbo.com/news/articleView.html?idxno=622247	2021/03/15	0	2022-08-04 11:39:40	2022-08-22 08:29:43
BK22004473	9	질문자	음, 그저 농민들이 연합한 줄 알았는데 종교가 왜 나오나 했더니 이런 배경이 있었군요. 그런데 1차라는 것은 2차도 있는 건가요?				0	2022-08-04 11:39:40	2022-08-08 13:51:11
BK22004473	10	전문가	네, 맞아요. 미리 말씀드리자면 동학농민운동 1차는 반봉건, 반부패의 색을 띠고 2차부터는 척왜척양을 앞세운 항일구국투쟁의 모습을 보이죠.	1차 동학농민운동	http://www.dailysportshankook.co.kr/news/articleView.html?idxno=258249	2022/05/19	0	2022-08-04 11:39:40	2022-08-08 23:34:12
BK22004473	11	질문자	아하, 여러 차례 일어난 운동이었군요. 그런데 아까 교주를 복권시키려는 움직임 때문이라고 하셨는데 반봉건적이고 반부패적인 색을 띤 이유는 뭔가요?				0	2022-08-04 11:39:40	2022-08-08 13:51:11
BK22004473	12	전문가	네, 그 시기 다른 일이 있기도 했거든요. 바로 전라도 고부군수 조병갑과 관련된 일이에요. 조병갑은 농민들에 대한 가렴주구를 펼쳤어요. 이에 동학도와 농민들이 더 이상 참지 못하고 고종 31년인 1894년 전봉준을 필두로 혁명을 일으키게 된 거죠.	동학농민운동 최제우 조병갑	https://www.gukjenews.com/news/articleView.html?idxno=2245053	2021/06/15	0	2022-08-04 11:39:40	2022-08-08 13:51:11
BK22004473	13	질문자	여러 사건이 맞물려 혁명의 불씨를 댕긴거네요. 그나저나 제가 알고 있던 녹두장군 전봉준의 이름이 여기서 나오네요. 그럼 1차 혁명은 성공하긴 한건 가요?				0	2022-08-04 11:39:40	2022-08-08 13:51:11
BK22004473	14	전문가	네, 우선 관아를 상대로 벌인 습격은 성공을 했어요. 농민군이 워낙 사기가 높아서 관군이 상대가 되질 않았거든요. 결국 황토현에서 승리를 거두죠.	1차 동학농민운동 성공	https://www.fnnews.com/news/202109181157558781	2021/09/19	0	2022-08-04 11:39:40	2022-08-22 16:23:31
BK22004473	15	질문자	와, 관군을 상대로 승리했다니 엄청난 활약이네요. 그럼 그 이후로는 어떻게 돌아가나요?				0	2022-08-04 11:39:40	2022-08-08 13:51:11
BK22004473	16	전문가	이후 전주성을 목표로 진격했는데 농민군이 생각보다 강력하다 보니 전주성의 관군들은 도망을 쳤어요. 덕분에 농민군은 1894년 4월 27일 전주성에 무혈입성하게 되죠.	동학농민운동 전주성	https://www.fnnews.com/news/202109181157558781	2021/09/19	0	2022-08-04 11:39:40	2022-08-22 16:23:31
BK22004473	17	질문자	와, 무혈입성이라니 대단하네요. 그런데 이런 움직임이 어쩌다 척왜 척양을 외치는 운동으로 변한 건지도 궁금해요.				0	2022-08-04 11:39:40	2022-08-08 13:51:11
BK22004473	18	전문가	2차 동학농민혁명은 일본군이 경복궁을 점령하면서 일어나게 돼요. 남접의 전봉준과 북접의 손병희가 만여 명이 되는 농민군을 이끌며 1894년 11월과 12월에 걸쳐서 일본군과 적의 편으로 넘어간 관군을 상대로 공주에서 우금치 전투와 같은 큰 전투로 맞섰지만 결국 상대방 화력에 비한 약세로 패배하게 되죠. 그리고 그 결과 전봉준은 12월 28일 밤에 순창 피노리에서 연행되고 말아요.	2차동학농민운동	http://www.dailysportshankook.co.kr/news/articleView.html?idxno=258249	2022/05/19	0	2022-08-04 11:39:40	2022-08-24 08:13:26
BK22004473	19	질문자	아이고, 다들 대단한 의지로 항쟁에 맞선 건데 2차는 결과가 좋지 못했네요. 그런데 제가 알기로는 전봉준은 결국 사형을 당하지 않나요?				0	2022-08-04 11:39:40	2022-08-08 13:51:11
BK22004473	20	전문가	네, 맞아요. 말씀하신 것처럼 근대사법제도의 심판하에 처음으로 사형선고를 받은 인물이 전봉준이에요. 전봉준뿐만 아니라 다른 동학농민운동 지도자들도 교수형 선고를 받았고요.	전봉준 사형	https://www.khan.co.kr/culture/culture-general/article/201610260957001	2016/11/02	0	2022-08-04 11:39:40	2022-08-08 13:51:11
BK22004473	21	질문자	대단했던 시작에 비해 뭔가 뒷맛이 씁쓸한 결말이네요. 그 이후에 우리나라가 당했던 안 좋은 일들을 알고 있어서 더 그렇게 느껴지는 것 같기도 하고요.				0	2022-08-04 11:39:40	2022-08-08 13:51:11
BK22004473	22	전문가	네, 그래도 동학농민운동은 추후에 일어나는 갑오개혁과 31 운동에 영향을 주기도 했고 청일전쟁 발발의 불씨가 되기도 했으니 어떻게 보면 큰 의미가 있는 사건이라고 할 수 있죠.	동학농민운동 갑오개혁	http://www.joongdo.co.kr/web/view.php?key=20201107010002545	2020/11/07	0	2022-08-04 11:39:40	2022-08-08 13:51:11
BK22004473	23	질문자	그래도 실패로만 끝난 게 아니라 그 의지가 이어졌다니 정말 다행이네요. 오늘 이렇게 동학농민혁명에 대해 알려주셔서 정말 감사합니다.				0	2022-08-04 11:39:40	2022-08-24 08:13:26
BK22004473	24	전문가	저야말로 지루한 이야기 재밌게 들어주셔서 감사해요. 혹시 또 역사에 대해 궁금한 점 있으시면 편하게 물어봐주세요.				1	2022-08-08 23:34:12	2022-08-24 08:13:26
