id	utterance_id	role	text	search_query	search_URL	reference_date	terminate	regDate	updDate
BK22000126	1	질문자	점심이 조금 과했는지 입이 텁텁했는데 양치를 하고나니 개운해졌어요. 양치를 하다가 문득 궁금해졌는데 양치의 어원이 뭔가요?				0	2022-07-20 16:04:23	2022-08-02 12:01:32
BK22000126	2	전문가	국어사전에서 양치질을 찾아보면 이를 닦고 물로 입 안을 가시는 일로 나오고 한자를 빌려 쓰기도 해요. 그런데 어원은 따로 있어요. 바로 버드나무 가지를 뜻하는 양지예요.	옛날 양치	https://www.yna.co.kr/view/AKR20220607077100797	2022/06/09	0	2022-07-20 16:04:23	2022-07-21 09:30:52
BK22000126	3	질문자	양지요? 옛날 조상님들은 버드나무 가지로 양치를 하셨던 건가요?				0	2022-07-20 16:04:23	2022-08-02 12:01:32
BK22000126	4	전문가	맞아요. 옛날 조상님들은 가느다란 버드나무 가지를 꺾어서 이쑤시개를 만들어 치아 사이에 낀 음식물을 빼냈어요. 이것이 양치질의 시작이고 나중에는 이를 뜻하는 치가 들어가며 지금의 이름이 만들어진 거예요.	옛날 사람들 양치	http://www.newscj.com/news/articleView.html?idxno=427228	2017/05/30	0	2022-07-20 16:04:23	2022-07-21 09:30:52
BK22000126	5	질문자	칫솔이 없는 시대에는 나뭇가지를 이용했군요. 그럼 지금의 모습을 갖춘 칫솔은 언제부터 썼던 건가요?				0	2022-07-20 16:04:23	2022-08-02 12:01:32
BK22000126	6	전문가	지금 우리가 사용하는 칫솔은 1500년경 중국에서 시작되었어요. 동물의 털을 이용해 제작한 기록이 있고 1780년에 영국에서 동물의 털을 이용해 칫솔을 만드는 회사가 만들어졌죠.	칫솔의 역사	https://www.gunchinews.com/news/articleView.html?idxno=53941	2019/05/03	0	2022-07-20 16:04:23	2022-07-21 09:30:52
BK22000126	7	질문자	옛날 사람들도 치아 건강의 소중함을 다 알았나 봐요. 만약 치통이 생기거나 문제가 있으면 어떻게 했나요?				0	2022-07-20 16:04:23	2022-08-02 12:01:32
BK22000126	8	전문가	동의보감 외형편에는 7가지 치통, 취나 코를 막아 치통을 멎게 하는 법, 벌레를 내보내 충치를 치료하는 법, 닭똥을 발라 치아를 다시 나게 하는 법, 치아 색으로 병을 아는 법, 치아를 단단하게 하는 수양법 등 치아 치료에 관련된 내용들을 볼 수 있어요. 치통이 심할 때는 마늘 등으로 귀나 코를 막아서 멎게 했는데, 이렇게 하며 벌레가 죽고 다시는 치통이 재발하지 않는다고 여겼어요.	옛날 치아치료	https://dailydental.co.kr/news/article.html?no=111693	2020/06/24	0	2022-07-20 16:04:23	2022-07-21 09:30:52
BK22000126	9	질문자	이가 아프면 정말 짜증 나고 힘들잖아요. 어떻게든 이겨내려고 했던 노력이 느껴져요. 그럼 치약을 쓰기도 했었나요?				0	2022-07-20 16:04:23	2022-08-02 12:01:32
BK22000126	10	전문가	고대 이집트의 한 서기관이 작성한 글이 있는데, 그 글을 보면 그을린 검댕과 아라비아 고무를 물에 타 섞은 검은 잉크를 사용했어요. 하얗고 완벽한 치아를 위해 사용했다고 진지하게 기록한 내용이에요.	고대 치약	https://www.dentalarirang.com/news/articleView.html?idxno=33955	2022/01/20	0	2022-07-20 16:04:23	2022-07-21 09:30:52
BK22000126	11	질문자	예나 지금이나 가지런하고 하얀 치아를 좋아했나 봐요. 지금 우리가 사용하는 치약의 모양새를 갖춘 건 역사가 깊지 않나요?				0	2022-07-20 16:04:23	2022-08-02 12:01:32
BK22000126	12	전문가	지금 우리가 사용하는 크림 형태는 1850년대예요. 그 전에는 모두 가루 형태를 사용했고 1873년부터 대량생산이 가능해졌어요. 지금처럼 튜브에 담아서 판매한 건 1890년대부터니까 역사가 아주 오래된 건 아니죠?	치약 역사	https://www.joongang.co.kr/article/25005683	2021/09/09	0	2022-07-20 16:04:23	2022-07-21 09:30:52
BK22000126	13	질문자	그러네요. 인류 역사로 보면 엄청 최근에 생긴 거였네요. 그 사이에 발전을 많이 했는데 어디서 듣기론 알갱이 들어있는 치약이 좋지 않다던데 정말인가요?				0	2022-07-20 16:04:23	2022-08-02 12:01:32
BK22000126	14	전문가	치약 속 들어있는 알갱이는 치아 표면을 긁어서 개운한 느낌이 들잖아요. 그런데 일부 녹지 않는 재질로 만들어진 알갱이는 잇몸 안에 박혀서 문제를 일으킬 수 있어요. 남은 알갱이가 잇몸 염증을 유발하는 거예요.	알갱이 치약	http://www.ujeil.com/news/articleView.html?idxno=250043	2020/03/10	0	2022-07-20 16:04:23	2022-07-21 09:30:52
BK22000126	15	질문자	치아 관리하려고 사용하는 치약이 되레 악영향을 끼치는 거네요. 잇몸 염증은 흔하다고 해서 늘 조심하는데 어떤 치약을 써야 좋을까요?				0	2022-07-20 16:04:23	2022-08-02 12:01:32
BK22000126	16	전문가	염화나트륨이나 초산토코페롤, 염산피리독신, 알란토인류와 같은 성분들은 잇몸의 혈류를 개선시켜서 염증을 완화하는 효과가 있어요. 치은염이나 치주염이 걱정된다면 이 성분들이 들어있는 치약을 고르세요.	잇몸 염증 치약	https://m.health.chosun.com/svc/news_view.html?contid=2022060902117	2022/06/10	0	2022-07-20 16:04:23	2022-07-21 09:30:52
BK22000126	17	질문자	성분들의 이름이 조금 어렵긴 한데 적어두고 잘 기억해둬야겠어요. 칫솔, 치약을 잘 골라도 양치를 제대로 하지 않으면 소용이 없잖아요. 하루에 양치는 얼마나 해야하나요?				0	2022-07-20 16:04:23	2022-08-02 12:01:32
BK22000126	18	전문가	하루 세 번 양치질은 기본인거 아시죠? 잠을 자는 동안 입안에 세균이 제일 많이 증식하니까 잠들기 전에도 양치는 꼭 해주세요. 산도가 높은 탄산음료나 맥주, 커피를 마신 후 바로 양치를 하면 치약 성분이 치아 표면을 손상시킬 수 있으니 물로 입을 헹구고 30분 정도 뒤에 하면 좋아요.	양치질 횟수	https://www.m-i.kr/news/articleView.html?idxno=923591	2022/06/01	0	2022-07-20 16:04:23	2022-07-21 09:30:52
BK22000126	19	질문자	뭘 먹느냐에 따라서 양치법이 달라지는군요. 잘 기억해둘게요. 양치를 꼼꼼하게 잘 하면 스케일링 안 해도 되는 걸까요?				0	2022-07-20 16:04:23	2022-08-02 12:01:32
BK22000126	20	전문가	양치질로 제거되지 않는 치석이 생긴다면 스케일링이 필요해요. 1년에 한 번에서 두 번 정도 주기적인 관리를 받는 것이 좋아요.	양치 잘 하는데 스케일링	https://m.health.chosun.com/svc/news_view.html?contid=2021121301015	2021/12/13	0	2022-07-20 16:04:23	2022-07-21 09:30:52
BK22000126	21	질문자	어른이 되어도 치과는 언제나 무서운 곳이라 웬만하면 별로 가고 싶지 않아서 자꾸만 핑곗거리를 찾게 되는 것 같아요.				0	2022-07-20 16:04:23	2022-08-02 12:01:32
BK22000126	22	전문가	병원은 누구나 무서워하죠. 그래도 많이 아프고 난 뒤 가는 것보다는 나으니 치과랑도 친하게 지내려는 노력을 해보세요.				0	2022-07-20 16:04:23	2022-07-21 09:30:52
BK22000126	23	질문자	칫솔, 치약 잘 골라서 사용하고 주기적으로 치과도 방문하면서 잘 관리할게요.				1	2022-07-20 16:04:23	2022-08-02 12:01:32
