id	utterance_id	role	text	search_query	search_URL	reference_date	terminate	regDate	updDate
BK22003609	1	질문자	어제 동생이 한 서양 여자가 나오는 다큐를 보고 있는 거야. 그래서 뭘 보냐고 물어봤더니 한때 여자 스티븐 잡스라고 불리던 사람의 일대기를 그린 다큐래. 여자 스티븐 잡스라고 불리던 사람이 있어?				0	2022-08-04 11:14:00	2022-08-04 11:14:00
BK22003609	2	전문가	여자 스티븐 잡스라고 불리던 사람이면 엘리자베스 홈즈 아닌가? 잡스처럼 까만 터틀넥을 잘 입고 다녔었는데.				0	2022-08-04 11:14:00	2022-08-04 11:14:00
BK22003609	3	질문자	맞아, 다큐 속에서도 까만 터틀넥을 입고 있었어. 그 여자는 뭐 하는 사람이야?				0	2022-08-04 11:14:00	2022-08-04 11:14:00
BK22003609	4	전문가	엘리자베스 홈즈는 스탠퍼드대학교를 다니다가 자퇴하고 테라노스라는 회사를 차린 사람이야. 테라노스는 저렴한 비용으로 혈액 검사를 해주는 회사라 화제였고. 미국 400대 부호를 조사했을 때 엘리자베스 홈즈는 45억 달러의 자산을 가져서 400대 부호 중 110위를 차지하기도 했어. 마이크로소프트 창업자인 빌게이츠는 21년 동안 1위를 했고 말이야.	엘리자베스 홈즈 직업	http://view.asiae.co.kr/news/view.htm?idxno=2014093009080983275⭕	2014/10/01	0	2022-08-04 11:14:00	2022-08-09 14:00:02
BK22003609	5	질문자	그렇구나, 엄청난 사람이네. 그런데 테라노스는 다른 회사보다 저렴하게 혈액 검사를 할 수 있는 기술을 가지고 있던 거야?				0	2022-08-04 11:14:00	2022-08-04 11:14:00
BK22003609	6	전문가	응, 주사기로 피를 채취하지 않아도 네 시간 만에 모바일로 혈액검사 결과를 알려주는 휴대용 키트를 개발해서 이목을 끌었어. 그 키트의 이름은 나노테이너야.	테라노스 혈액검사	http://www.econovill.com/news/articleView.html?idxno=374399	2019/10/11	0	2022-08-04 11:14:00	2022-08-09 13:29:49
BK22003609	7	질문자	오, 주사기로 피 뽑으면 괜히 무섭잖아. 주사기 안 쓰고도 혈액 검사를 할 수 있다니 대박인데. 그런데 나노테이너를 쓰면 기존의 혈액검사 비용보다 얼마나 싼 거야?				0	2022-08-04 11:14:00	2022-08-04 11:14:00
BK22003609	8	전문가	비용은 기존 검사 비용의 십 퍼센트 수준으로 내려갔어. 그리고 진단 시간도 15분으로 줄어들었고. 무척 획기적이지?	나노테이너 혈액검사 비용	https://www.edaily.co.kr/news/read?newsId=02925766612616120&mediaCodeNo=257&OutLnkChk=Y⭕	2016/04/14	0	2022-08-04 11:14:00	2022-08-09 13:29:49
BK22003609	9	질문자	그렇구나, 그럼 테라노스는 계속 승승장구했겠네?				0	2022-08-04 11:14:00	2022-08-04 11:14:00
BK22003609	10	전문가	아니, 테라노스는 계속 잘나가진 못했어. 2015년 월스트리트저널이 테라노스의 기술력은 실체가 없다고 내부 관계자를 인용해서 폭로했거든. 그리고 2016년 미국공공의료보험운영 역시 테라노스의 기술력은 허상이라고 밝혔어.	테라노스 몰락이유	http://www.econovill.com/news/articleView.html?idxno=374399	2019/10/11	0	2022-08-04 11:14:00	2022-08-04 11:14:00
BK22003609	11	질문자	나노테이너 키트의 기술력에 문제가 있는 거였네. 테라노스의 내부 관계자가 무슨 말을 했는지 궁금하다.				0	2022-08-04 11:14:00	2022-08-04 11:14:00
BK22003609	12	전문가	테라노스 내부 고발자는 혈액 검사 전부를 처리할 수는 없다고 했어. 그리고 일부만 처리했던 혈액검사조차 기존 혈액검사에 쓰이던 방법을 쓴다고 했지.	월스트리트 저널 테라노스 내부고발자	https://www.hankyung.com/international/article/2021090128477⭕	2021/09/30	0	2022-08-04 11:14:00	2022-08-09 13:29:49
BK22003609	13	질문자	엄청 충격적인 발언이었네. 이 내부 고발에 대한 파장이 컸을 것 같은데 어땠어?				0	2022-08-04 11:14:00	2022-08-04 11:14:00
BK22003609	14	전문가	홈즈와 테라노스사는 이건 단지 나쁜 루머일 뿐이라고 말했지만 업계의 반응은 냉담했지. 테라노스의 투자자와 파트너는 테라노스와의 거래를 바로 끊었어.	테라노스 내부 고발 반응	https://it.donga.com/27494/	2018/03/12	0	2022-08-04 11:14:00	2022-08-04 11:14:00
BK22003609	15	질문자	투자자와 파트너들이 등을 돌렸네. 그럼 홈즈는 법적으로 처벌을 받은 거야?				0	2022-08-04 11:14:00	2022-08-04 11:14:00
BK22003609	16	전문가	응, 캘리포니아 산호세 연방 지방법원의 배심원단은 홈즈에게 유죄를 선고했어. 홈즈에게 열한 가지 혐의가 적용되었는데 그중 투자자에게 저지른 사기 3건과 사기공모 1건에 대해 유죄가 선고되었지.	엘리자베스 홈즈 처벌	https://www.segye.com/newsView/20220104514026?OutUrl=naver	2022/01/04	0	2022-08-04 11:14:00	2022-08-04 11:14:00
BK22003609	17	질문자	음, 그렇구나. 홈즈도 나름대로 억울함을 피력했을 것 같은데 뭐라고 했는지 궁금해.				0	2022-08-04 11:14:00	2022-08-04 11:14:00
BK22003609	18	전문가	홈즈는 사기 치려는 마음이 아니었고 회사 운영 과정이 조금 미흡했다고 했어. 그리고 연인에게 성적, 신체적 학대를 당해 심리적으로 불안했다고 주장했지. 그러나 법원은 이 주장을 안 받아들여줬어.	엘리자베스 홈즈 처벌	https://www.segye.com/newsView/20220104514026?OutUrl=naver	2022/01/04	0	2022-08-04 11:14:00	2022-08-04 11:14:00
BK22003609	19	질문자	나 같아도 그런 주장은 받아들이기 힘들었을 것 같아. 실수라고 보기엔 좀 힘들지 않나 싶어.				0	2022-08-04 11:14:00	2022-08-04 11:14:00
BK22003609	20	전문가	맞아, 나도 그렇게 생각해. 그리고 나 이제 알바 갈 시간이라 일어나 봐야 할 것 같아.				0	2022-08-04 11:14:00	2022-08-04 11:14:00
BK22003609	21	질문자	아, 내가 너무 시간을 많이 뺏은 건 아닌지 모르겠네.				0	2022-08-04 11:14:00	2022-08-04 11:14:00
BK22003609	22	전문가	아냐, 오래간만에 수다 떨고 재밌었어. 그럼 시간 날 때 또 연락해!				1	2022-08-04 11:14:00	2022-08-09 14:09:15
