id	utterance_id	role	text	search_query	search_URL	reference_date	terminate	regDate	updDate
BK22013272	1	질문자	방학이라 조카의 현장 체험학습을 따라가는 경우가 많은데 어디를 가야 할지 모르겠어요.				0	2022-09-30 15:37:47	2022-10-01 18:29:16
BK22013272	2	전문가	유적지를 가야 하는 건가요?				0	2022-09-30 15:37:47	2022-10-01 18:29:16
BK22013272	3	질문자	유네스코 세계 유산을 체험해야 한다는데 혹시 이게 정확히 무엇인지 잘 아시나요?				0	2022-09-30 15:37:47	2022-10-01 18:29:16
BK22013272	4	전문가	유네스코에서 전 세계 인류의 문화 및 자연 유산을 보호하고자 지정한 것들을 유네스코 세계 유산이라고 해요.	유네스코 세계 유산	https://ko.wikipedia.org/wiki/%EC%84%B8%EA%B3%84%EC%9C%A0%EC%82%B0	2022/02/26	0	2022-09-30 15:37:47	2022-10-01 18:29:16
BK22013272	5	질문자	유네스코 세계 유산은 생소한데, 혹시 종류가 나뉘어 있나요?				0	2022-09-30 15:37:47	2022-10-01 18:29:16
BK22013272	6	전문가	네, 역사적으로 중요한 가치를 가지고 있는 문화 유산, 지구의 역사를 드러내는 자연 유산 그리고 이를 복합적으로 가지고 있는 경우 복합 유산으로 유네스코 세계 유산의 종류를 나눌 수 있어요.	유네스코 세계 유산 종류	https://ko.wikipedia.org/wiki/%EC%84%B8%EA%B3%84%EC%9C%A0%EC%82%B0	2022/02/26	0	2022-09-30 15:37:47	2022-10-01 18:29:16
BK22013272	7	질문자	아하, 유네스코 세계 문화 유산은 자주 들어 봐서 헷갈렸나 싶었어요. 유네스코 세계 유산을 가장 많이 보유하고 있는 나라는 어디예요?				0	2022-09-30 15:37:47	2022-10-01 18:29:16
BK22013272	8	전문가	가장 많은 세계 유산을 보유하고 있는 국가는 총 58점을 보유한 이탈리아예요. 10건 이상 보유한 국가는 32개, 1개 이상 보유한 국가는 167개나 돼요.	유네스코 세계 유산 보유국	http://www.economyf.com/news/view.asp?idx=7395&page=1&ca1=&ca2=&sword=%BC%BC%B0%E8%C0%AF%BB%EA	2022/05/25	0	2022-09-30 15:37:47	2022-10-01 18:29:16
BK22013272	9	질문자	와, 생각보다 많은 나라가 세계 유산을 가지고 있네요. 우리나라의 세계 문화 유산 중 답사를 추천해 주신다면요?				0	2022-09-30 15:37:47	2022-10-01 18:29:16
BK22013272	10	전문가	1995년에 유네스코 세계 문화 유산으로 지정된 석굴암을 추천할게요. 건축이나 기하학, 수리, 종교적 가치뿐 아니라 건축미와 예술적 가치를 인정받아 불국사와 함께 등재됐어요.	석굴암	https://ko.wikipedia.org/wiki/%EC%84%9D%EA%B5%B4%EC%95%94	2022/05/24	0	2022-09-30 15:37:47	2022-10-01 18:29:16
BK22013272	11	질문자	아하, 경주까지 가기엔 조금 거리가 멀어서요. 또 다른 세계 문화 유산을 추천해 주신다면요?				0	2022-09-30 15:37:47	2022-10-01 18:29:16
BK22013272	12	전문가	경기도의 도립공원이면서 경기도 광주시에 위치한 남한산을 중심으로 이루어진 남한산성을 추천할게요. 병자호란 때 인조가 이곳에서 40일간 청과 싸웠지만, 결국엔 투항했던 곳으로 유명해요.	남한산성	https://ko.wikipedia.org/wiki/%EB%82%A8%ED%95%9C%EC%82%B0%EC%84%B1	2022/08/23	0	2022-09-30 15:37:47	2022-10-01 18:29:16
BK22013272	13	질문자	남한산성도 좋지만, 교통이 좀 더 편리한 곳이었으면 좋겠어요.				0	2022-09-30 15:37:48	2022-10-01 18:29:16
BK22013272	14	전문가	그렇다면 서울 북악산의 왼쪽 봉우리인 응봉자락에 자리해 있는 조선시대 궁궐인 창덕궁을 추천해요.	창덕궁	https://ko.wikipedia.org/wiki/%EC%B0%BD%EB%8D%95%EA%B6%81	2022/06/25	0	2022-09-30 15:37:48	2022-10-01 18:29:16
BK22013272	15	질문자	오, 창덕궁은 언제 유네스코 세계 문화 유산으로 등재됐어요?				0	2022-09-30 15:37:48	2022-10-01 18:29:16
BK22013272	16	전문가	창덕궁이 국내 유네스코 세계 문화 유산으로 등재된 것은 1997년인데요. 원형이 잘 보존되어 있기도 하고, 우리나라에서 유일하게 궁궐후원을 가지고 있어서 정원을 대표한다는 의미에서 가치를 높이 살 수 있어요.	국내 유네스코 세계 문화 유산	https://ko.wikipedia.org/wiki/%EC%B0%BD%EB%8D%95%EA%B6%81	2022/06/25	0	2022-09-30 15:37:48	2022-10-01 18:29:16
BK22013272	17	질문자	아, 창덕궁을 가 봐야겠어요. 유네스코 세계 유산으로 등재되려면 어떤 절차를 거쳐야 하나요?				0	2022-09-30 15:37:48	2022-10-01 18:29:16
BK22013272	18	전문가	우선 세계 유산 잠정목록으로 등록을 하는 것이 세계 유산 등재의 첫 단계인데요. 유네스코에 문화재청이 세계 유산 잠정 등록을 신청하고, 이에 대한 문화유산 가치 등을 심의한 다음, 유네스코에서 잠정목록에 등록하는 절차를 거쳐요.	유네스코 세계 유산 잠정 목록	https://www.hani.co.kr/arti/area/gangwon/920608.html	2019/12/12	0	2022-09-30 15:37:48	2022-10-01 18:29:16
BK22013272	19	질문자	아, 잠정목록에 있으면 세계 유산으로 등재될 수도 있겠네요. 현재 우리나라에도 잠정목록에 속한 유적이 있나요?				0	2022-09-30 15:37:48	2022-10-01 18:29:16
BK22013272	20	전문가	네, 7월 27일에 양주 회암사지 유적이 잠정목록에 등재됐는데요. 이 유적은 14세기 동아시아의 불교 선종 문화를 증명하는 물적증거이기도 하거니와, 수행 전통이나 사원의 공간구성 등을 세밀하게 검증하는 역사 문화적 가치를 지닌 유산이에요.	양주 회암사지 유적	https://news.kmib.co.kr/article/view.asp?arcid=0017317610&code=61121111&sid1=soc	2022/07/27	0	2022-09-30 15:37:48	2022-10-01 18:29:16
BK22013272	21	질문자	오, 그렇다면 잠정목록에서 세계 유산으로 등재되길 기다려 봐야겠네요.				0	2022-09-30 15:37:48	2022-10-01 18:29:16
BK22013272	22	전문가	네, 꼭 등재되었으면 좋겠어요.				1	2022-09-30 15:37:48	2022-10-01 18:29:16
