id	utterance_id	role	text	search_query	search_URL	reference_date	terminate	regDate	updDate
BK22002938	1	질문자	예전부터 독일어를 배워보고 싶어서 독일어를 배워볼까 하는데 독일어가 어느 계열의 언어이죠?				0	2022-08-04 09:10:24	2022-08-04 09:10:24
BK22002938	2	전문가	독일어는 인도유럽어족 계통의 언어로 더 좁은 의미에서는 서게르만어계의 언어에요.	독일어 계통	https://ko.wikipedia.org/wiki/%EB%8F%85%EC%9D%BC%EC%96%B4	2022/06/29	0	2022-08-04 09:10:24	2022-08-04 10:46:23
BK22002938	3	질문자	그렇군요, 그러면 영어와 독일어는 다른 계통인 건가요?				0	2022-08-04 09:10:24	2022-08-04 09:10:24
BK22002938	4	전문가	독일어와 영어는 기본적으로 같은 계통으로 게르만어에 뿌리를 두고 있어요. 하지만 서로 다른 발달과정을 겪어와서 다른 점이 뚜렷하게 보이죠.	독일어와 영어	https://ko.wikipedia.org/wiki/%EB%8F%85%EC%9D%BC%EC%96%B4	2022/06/29	0	2022-08-04 09:10:24	2022-08-04 09:10:24
BK22002938	5	질문자	영어와 독일어가 같은 게르만어에 뿌리를 두고 있었던 거군요. 그러면 영어의 사용자가 많은 만큼 독일어 사용자도 그만큼 많은가요?				0	2022-08-04 09:10:24	2022-08-04 09:10:24
BK22002938	6	전문가	전 세계적으로 모국어로 독일어를 사용하는 사람들은 약 1억 2천만 명으로 세계에서 10번째로 많이 사용하는 언어에요. 그리고 유럽 연합에서 가장 많이 사용하는 언어이기도 해요.	독일어 사용자수	https://ko.wikipedia.org/wiki/%EB%8F%85%EC%9D%BC%EC%96%B4	2022/06/29	0	2022-08-04 09:10:24	2022-08-04 09:10:24
BK22002938	7	질문자	이때까지 유럽 연합에서 가장 많이 사용되는 언어가 스페인어인 줄 알고 있었어요.				0	2022-08-04 09:10:24	2022-08-04 09:10:24
BK22002938	8	전문가	독일어는 유럽 연합에서 공식 실무 언어이고 중서부 유럽에서 가장 많이 사용되는 언어로 유럽에서의 입지가 굉장히 강한 언어에요.	독일어 모국어	https://ko.wikipedia.org/wiki/%EB%8F%85%EC%9D%BC%EC%96%B4	2022/06/29	0	2022-08-04 09:10:24	2022-08-04 09:10:24
BK22002938	9	질문자	그러면 유럽 국가 중에서 독일을 제외하고 독일어를 사용하는 국가는 어떤 국가들이 있나요?				0	2022-08-04 09:10:24	2022-08-04 09:10:24
BK22002938	10	전문가	독일을 제외하고 독일어를 사용하는 국가로는 오스트리아와 리히텐슈타인이 독일어를 국어로 채택하고 있고 스위스, 벨기에, 룩셈부르크, 루마니아에서는 공용어로 독일어를 사용하고 있어요. 그리고 아프리카 서부 나미비아에서도 독일어가 독일 지역어로 채택되어 있어요.	독일어 사용국가	https://ko.wikipedia.org/wiki/%EB%8F%85%EC%9D%BC%EC%96%B4	2022/06/29	0	2022-08-04 09:10:24	2022-08-04 09:10:24
BK22002938	11	질문자	생각보다 독일어를 사용하는 나라가 많네요. 제 2외국어로 독일어를 쓰는 나라들도 있죠?				0	2022-08-04 09:10:24	2022-08-04 09:10:24
BK22002938	12	전문가	네, 그렇죠. 이탈리아나 프랑스, 헝가리, 체코, 슬로바키아 등 동유럽 국가들의 중장년층 국민들은 제2외국어로 독일어를 자유롭게 구사할 수 있어요.	독일어 제2외국어	https://ko.wikipedia.org/wiki/%EB%8F%85%EC%9D%BC%EC%96%B4	2022/06/29	0	2022-08-04 09:10:24	2022-08-04 09:10:24
BK22002938	13	질문자	유럽에서는 거의 공용어라고 할 정도로 독일어도 많이 사용되는군요. 궁금한 점이 또 있는데 독일어도 토익과 같은 기관 인증 시험이 따로 존재하나요?				0	2022-08-04 09:10:24	2022-08-04 09:10:24
BK22002938	14	전문가	물론이죠, 독일어 관련 기관인 괴테인스티투트는 전 세계 지부에서 독일어 능력 인증 시험인 괴테 체어 티피 카트를 실시하고 있어 독일어 어학 시험을 칠 수 있어요.	독일어 공인시험	https://ko.wikipedia.org/wiki/%EB%8F%85%EC%9D%BC%EC%96%B4	2022/06/29	0	2022-08-04 09:10:24	2022-08-04 09:10:24
BK22002938	15	질문자	한국에서도 괴테 체어티피카트 시험을 칠 수 있나요?				0	2022-08-04 09:10:24	2022-08-04 09:10:24
BK22002938	16	전문가	당연하죠, 한국에서도 괴테 인스티투트 서울, 즉 주한독일문화원에서 실시하는 시험을 볼 수 있으며 A1 레벨부터 C2 레벨까지 레벨에 따라 성적이 나뉘어요.	독일어 괴테시험	https://ko.wikipedia.org/wiki/%EB%8F%85%EC%9D%BC%EC%96%B4	2022/06/29	0	2022-08-04 09:10:24	2022-08-04 10:46:23
BK22002938	17	질문자	독일어를 배울 이유가 이 정도면 충분한 것 같아요.				0	2022-08-04 09:10:24	2022-08-04 09:10:24
BK22002938	18	전문가	하지만 독일어를 막상 쉽게 생각하고 배우면 쉽게 포기할 수 있으니 마음을 단단히 먹으셔야 할 거예요.				0	2022-08-04 09:10:24	2022-08-04 09:10:24
BK22002938	19	질문자	안 그래도 주변에서 독일어를 공부하는 사람들이 독일어가 정말 어려운 언어라고 하더라고요.				0	2022-08-04 09:10:24	2022-08-04 09:10:24
BK22002938	20	전문가	만약 독일어를 배우시게 된다면, 특히나 문법적인 부분에서 굉장히 혼란이 오실 수 있지만 포기하지 않는 마음가짐이 가장 중요해요!				0	2022-08-04 09:10:24	2022-08-04 09:10:24
BK22002938	21	질문자	그러면 혹시나 공부하다가 문법 부분이나 혼란스러운 독일어가 있으면 여쭤봐도 될까요?				0	2022-08-04 09:10:24	2022-08-04 09:10:24
BK22002938	22	전문가	그럼요, 공부하시다가 물어볼게 생기시면 언제든 물어보세요!				1	2022-08-04 09:10:24	2022-08-04 10:46:23
