id	utterance_id	role	text	search_query	search_URL	reference_date	terminate	regDate	updDate
BK22003119	1	질문자	요즘 유럽권 작가들을 찾아서 읽어보고 있어. 이번엔 뒤렌마트라는 작가를 읽어보려는데 혹시 아는 게 좀 있어?				0	2022-08-12 18:45:21	2022-08-12 18:45:21
BK22003119	2	전문가	프리드리히 뒤렌마트라면 잘 알고 있지. 1921년 생인 스위스 극작가이고 1990년에 돌아 가셨어.	뒤렌마트	https://ko.wikipedia.org/wiki/%ED%94%84%EB%A6%AC%EB%93%9C%EB%A6%AC%ED%9E%88_%EB%92%A4%EB%A0%8C%EB%A7%88%ED%8A%B8	2022/02/17	0	2022-08-12 18:45:21	2022-08-16 08:42:35
BK22003119	3	질문자	아, 스위스 작가 셨구나, 처음 들어보는 이름이라 작품을 읽어보려고 하는데 유명하신 분인가?				0	2022-08-12 18:45:21	2022-08-16 08:42:35
BK22003119	4	전문가	아무렴, 사무엘 베케트나 이오네스크와 같은 반열에 드는 현대의 고전 작가라고 인정받는 분이지. 50년와 60년대에는 작품들이 영화화 돼서 세계적인 성공을 거두기도 했어.	뒤렌마트 영화화	https://ko.wikipedia.org/wiki/%ED%94%84%EB%A6%AC%EB%93%9C%EB%A6%AC%ED%9E%88_%EB%92%A4%EB%A0%8C%EB%A7%88%ED%8A%B8	2022/02/17	0	2022-08-12 18:45:21	2022-08-16 08:42:35
BK22003119	5	질문자	엄청 대단하신 분이였네, 주로 어떤 작업들을 하셨어?				0	2022-08-12 18:45:21	2022-08-12 18:45:21
BK22003119	6	전문가	희비극이라는 장르를 발전시키고 정착 시켰고 다루는 주제는 주로 신과 인간의 구원 문제, 자유와 정의의 문제 같은 철학적 문제들이였어. 이런 주제들을 독특한 드라마 기법으로 끊임없이 분석하고 실험했지.	뒤렌마트 희비극	https://ko.wikipedia.org/wiki/%ED%94%84%EB%A6%AC%EB%93%9C%EB%A6%AC%ED%9E%88_%EB%92%A4%EB%A0%8C%EB%A7%88%ED%8A%B8	2022/02/17	0	2022-08-12 18:45:21	2022-08-16 08:42:35
BK22003119	7	질문자	오, 굉장히 진지한 작가였던거 같네. 읽어보기 조금 겁나기 시작하는데? 너무 진지하고 무거워서 포기하지 않을까 걱정되네.				0	2022-08-12 18:45:21	2022-08-12 18:45:21
BK22003119	8	전문가	걱정 안해도 될거야. 뒤렌마트의 작품에는 풍자와 아이러니, 유머가 넘쳐나니까. 자신의 관찰과 성찰을 그로테스크, 패러독스, 아이러니, 풍자, 유머를 통해 희극화한 작품을 많이 썼어. 읽고나면 쓴 웃음과 함께 독자들을 성찰하게 만들지.	뒤렌마트 패러독스	https://ko.wikipedia.org/wiki/%ED%94%84%EB%A6%AC%EB%93%9C%EB%A6%AC%ED%9E%88_%EB%92%A4%EB%A0%8C%EB%A7%88%ED%8A%B8	2022/02/17	0	2022-08-12 18:45:21	2022-08-12 18:45:21
BK22003119	9	질문자	아, 고전 작가라고 해서 아까 다루는 주제도 그렇고 뭔가 고전적인 영웅의 일대기 같은 걸 다룰지 알았는데 그건 아닌가봐?				0	2022-08-12 18:45:21	2022-08-12 18:45:21
BK22003119	10	전문가	응, 오히려 반대의 이야기를 다뤘다고 할 수 있지. 뒤렌마트는 어떠한 영웅적인 결단도 내릴 수 없는 현대인들이 할 수 있는 최선의 선택은 반성 뿐이라는 신념을 가지고 있었어.	뒤렌마트 반성	https://ko.wikipedia.org/wiki/%ED%94%84%EB%A6%AC%EB%93%9C%EB%A6%AC%ED%9E%88_%EB%92%A4%EB%A0%8C%EB%A7%88%ED%8A%B8	2022/02/17	0	2022-08-12 18:45:21	2022-08-12 18:45:21
BK22003119	11	질문자	시대문제에 예민한 작가였구나, 결국 시대를 얘기하는 작가가 고전이 되는 거 같지 않아?				0	2022-08-12 18:45:21	2022-08-12 18:45:21
BK22003119	12	전문가	맞아, 뒤렌마트는 항상 작품으로 시대의 문제를 정열적으로 이야기 했고, 시대를 비추는 거울과도 같은 비평가적인 면모도 있는 작가였어.	뒤렌마트 비평가	https://ko.wikipedia.org/wiki/%ED%94%84%EB%A6%AC%EB%93%9C%EB%A6%AC%ED%9E%88_%EB%92%A4%EB%A0%8C%EB%A7%88%ED%8A%B8	2022/02/17	0	2022-08-12 18:45:21	2022-08-12 18:45:21
BK22003119	13	질문자	아, 사회참여적인 면도 많은 작가였구나. 작품 이외의 실제로 현실에 대한 발언을 한 적이 있으려나?				0	2022-08-12 18:45:21	2022-08-12 18:45:21
BK22003119	14	전문가	응, 작품 이외에도 핵무기를 반대하고 고르바쵸프의 개방정책에 지지하는 입장을 내기도 했지. 세계평화라는 화두에 관심이 많았지.	뒤렌마트 세계 평화	https://ko.wikipedia.org/wiki/%ED%94%84%EB%A6%AC%EB%93%9C%EB%A6%AC%ED%9E%88_%EB%92%A4%EB%A0%8C%EB%A7%88%ED%8A%B8	2022/02/17	0	2022-08-12 18:45:21	2022-08-12 18:45:21
BK22003119	15	질문자	그렇구나, 그럼 대표적인 작품 알려주라, 한번 찾아보려고.				0	2022-08-12 18:45:21	2022-08-17 08:26:39
BK22003119	16	전문가	성공작으로는 56년에 발표한 귀부인 고향으로 돌아오다가 있고 천사 바빌론에 오다 나 미시시피씨의 결혼이라는 작품도 있어. 아 그리고 논문에도 관심이 있으면 연극의 여러 문제라는 논문도 있지. 당시에 큰 주목을 끈 논문이야.	뒤렌마트 천사 바빌론에 오다	https://ko.wikipedia.org/wiki/%ED%94%84%EB%A6%AC%EB%93%9C%EB%A6%AC%ED%9E%88_%EB%92%A4%EB%A0%8C%EB%A7%88%ED%8A%B8	2022/02/17	0	2022-08-12 18:45:21	2022-08-17 10:07:02
BK22003119	17	질문자	너무 고마워, 시간 날 때 읽어봐야겠다.				0	2022-08-12 18:45:21	2022-08-18 08:05:52
BK22003119	18	전문가	그래, 읽어보고 나서 또 만나자. 만나서 작품 이야기도 해야지.				0	2022-08-12 18:45:21	2022-08-12 18:45:21
BK22003119	19	질문자	응, 조만간 연락할게, 기다리고 있어!				0	2022-08-12 18:45:21	2022-08-18 08:05:52
BK22003119	20	전문가	그래, 그럼 오늘은 이만 가볼게, 안녕!				1	2022-08-12 18:45:21	2022-08-18 08:05:52
