id	utterance_id	role	text	search_query	search_URL	reference_date	terminate	regDate	updDate
BK22005207	1	질문자	방금 피자 먹었는데, 피자는 진짜 최고의 음식 같아. 어떻게 이런 게 만들어졌을까? 피자의 기원에 대해 좀 알아?				0	2022-08-10 17:14:56	2022-08-10 17:20:36
BK22005207	2	전문가	확실하진 않은데, 터키의 피데에서 유래되었다는 설이 있어. 현대 피자는 1889년부터 치즈가 들어간 중세 이탈리아의 나폴리탄 파이가 기원이야.	피자 기원	https://ko.wikipedia.org/wiki/%ED%94%BC%EC%9E%90	2022/08/06	0	2022-08-10 17:14:56	2022-08-10 17:20:36
BK22005207	3	질문자	이탈리아가 피자의 원조 국가였구나. 난 미국식 피자를 먹었는데, 미국은 언제부터 피자를 먹은 거야?				0	2022-08-10 17:14:56	2022-08-10 17:20:36
BK22005207	4	전문가	세계 대전 이후 미군들은 이탈리아에 주둔했는데, 그때 피자를 맛 본 미군들이 피자를 미국에 전파했지. 그리고 미국으로 넘어간 이탈리아 이민자들의 역할도 주요했어. 그렇게 미국 전 지역으로 퍼지며 세계적인 음식이 되었지.	피자 미국	https://ko.wikipedia.org/wiki/%ED%94%BC%EC%9E%90	2022/08/06	0	2022-08-10 17:14:56	2022-08-10 17:20:36
BK22005207	5	질문자	그렇구나, 아, 한국에는 언제부터 피자가 들어온 거야?				0	2022-08-10 17:14:56	2022-08-10 17:20:36
BK22005207	6	전문가	서울 유네스코 빌딩에 한국 최초로 피자가게가 열렸었어. 그 때 한국에 처음 알려졌는데, 1972년이었지.	피자 한국	https://ko.wikipedia.org/wiki/%ED%94%BC%EC%9E%90	2022/08/06	0	2022-08-10 17:14:56	2022-08-10 17:20:36
BK22005207	7	질문자	벌써 50년이나 되었구나. 우리나라 피자의 역사도 깊은 편이네.				0	2022-08-10 17:14:56	2022-08-10 17:20:36
BK22005207	8	전문가	맞아, 넌 어떤 피자를 좋아하는 편이야?				0	2022-08-10 17:14:56	2022-08-10 17:20:36
BK22005207	9	질문자	난 피자 중에 페퍼로니 피자를 제일 좋아하는데, 가끔 페퍼로니가 뭔 뜻일까 생각하곤 해. 페퍼로니가 뭔지 아니?				0	2022-08-10 17:14:56	2022-08-10 17:20:36
BK22005207	10	전문가	페퍼로니는 이탈리아 살라미의 미국식 음식이야. 양념이 들어간 고기로 만들지.	페퍼로니	https://ko.wikipedia.org/wiki/%ED%8E%98%ED%8D%BC%EB%A1%9C%EB%8B%88	2022/05/09	0	2022-08-10 17:14:56	2022-08-10 17:20:36
BK22005207	11	질문자	양념이 들어간 고기로 만든다고? 정확히 어떻게 만드는지 알려줘.				0	2022-08-10 17:14:56	2022-08-10 17:20:36
BK22005207	12	전문가	살라미는 말린 햄의 일종인데, 공기 중에 말리는 방식으로 발효를 시켜서 만들어.	살라미	https://ko.wikipedia.org/wiki/%EC%82%B4%EB%9D%BC%EB%AF%B8	2022/02/12	0	2022-08-10 17:14:56	2022-08-10 17:20:36
BK22005207	13	질문자	오오, 그렇구나. 살라미, 이름이 참 신기해. 살라미 어원에 대해서는 좀 아는 것이 있어?				0	2022-08-10 17:14:56	2022-08-10 17:21:44
BK22005207	14	전문가	살라미는 salame의 복수형이야. 살라메는 각 종류나 하나의 소시지를 가리키는 일반명사고.	살라미 어원	https://ko.wikipedia.org/wiki/%EC%82%B4%EB%9D%BC%EB%AF%B8	2022/02/12	0	2022-08-10 17:14:56	2022-08-10 17:21:44
BK22005207	15	질문자	넌 참 이런 걸 잘 아는구나. 살라미는 어떻게 만들어?				0	2022-08-10 17:14:56	2022-08-10 17:26:44
BK22005207	16	전문가	전통적인 살라미는 소고기나 돼지고기, 양, 염소, 기타 가금류, 거위 등의 고기로 만들어.	살라미 재료	https://ko.wikipedia.org/wiki/%EC%82%B4%EB%9D%BC%EB%AF%B8	2022/02/12	0	2022-08-10 17:14:56	2022-08-10 17:26:44
BK22005207	17	질문자	엄청 다양한 고기들로 만드네. 살라미는 도대체 어디서 시작된 음식인 거야?				0	2022-08-10 17:14:56	2022-08-10 17:26:44
BK22005207	18	전문가	살라미는 이탈리아에 오랜 전통이 있어. 그도 그럴 것이 살라미는 작은 방에서 일 년 내내 말려 저장할 수 있어서 많은 농민들에게 사랑 받았거든. 이런 방식은 부자가 아닌 농민들에게 손쉽게 신선한 고기 맛을 느낄 수 있게 해줘서 좋았던 거지.	살라미 기원	https://ko.wikipedia.org/wiki/%EC%82%B4%EB%9D%BC%EB%AF%B8	2022/02/12	0	2022-08-10 17:14:56	2022-08-18 17:04:25
BK22005207	19	질문자	그렇구나, 이런 이야기들을 하고 있으니 살라미, 아니 페퍼로니 피자가 먹고 싶어졌어. 같이 먹을래?				0	2022-08-10 17:14:56	2022-08-10 17:26:44
BK22005207	20	전문가	나야 좋지, 당장 시키자.				1	2022-08-10 17:14:56	2022-08-24 12:05:32
