id	utterance_id	role	text	search_query	search_URL	reference_date	terminate	regDate	updDate
BK22012849	1	질문자	가끔 일본 영화를 보면 사무라이가 나오잖아요. 사무라이라는 단어의 뜻이 무엇인가요?				0	2022-09-30 15:26:01	2022-10-01 16:46:01
BK22012849	2	전문가	원래는 가까운 곳에서 모신다는 의미의 단어 시로부터 나온 말인데 귀한 사람을 경호하는 사람을 말해요. 일본이 봉건 제도를 행했던 시기의 무사를 뜻하는 단어죠.	사무라이	https://ko.wikipedia.org/wiki/%EC%82%AC%EB%AC%B4%EB%9D%BC%EC%9D%B4	2022/07/21	0	2022-09-30 15:26:01	2022-10-01 16:46:01
BK22012849	3	질문자	무사라면 싸울텐데 혹시 사무라이 중에 한 번도 져본 적이 없는 사무라이도 있나요?				0	2022-09-30 15:26:01	2022-10-01 16:46:01
BK22012849	4	전문가	네. 아즈치모모야마 시대부터 에도 시대 초반까지 활동한 미야모토 무사시라는 무사가 있었는데, 단 한 번의 대결에서도 패하지 않은 전설적인 검술가였어요.	미야모토 무사시	https://ko.wikipedia.org/wiki/%EB%AF%B8%EC%95%BC%EB%AA%A8%ED%86%A0_%EB%AC%B4%EC%82%AC%EC%8B%9C	2022/06/19	0	2022-09-30 15:26:01	2022-10-01 16:46:01
BK22012849	5	질문자	한 번도 패하지 않았다니 대단하네요. 그럼 그가 활동한 에도 시대는 어떤 시대인가요?				0	2022-09-30 15:26:01	2022-10-01 16:46:01
BK22012849	6	전문가	도쿠가와 이에야스로부터 에도 막부가 세워졌는데,  1603년부터 1868년까지 이 막부에 의해 일본이 통치된 시기를 에도 시대라고 해요. 도쿠가와 시대라고도 불린 이 시기에 일본은 경제가 급격하게 발전되었고 크게 번성하였어요.	에도 시대	https://ko.wikipedia.org/wiki/%EC%97%90%EB%8F%84_%EC%8B%9C%EB%8C%80	2022/06/12	0	2022-09-30 15:26:01	2022-10-01 16:46:01
BK22012849	7	질문자	그 시기라면 우리나라는 조선시대인데 혹시 조선과의 교류가 있었나요?				0	2022-09-30 15:26:01	2022-10-01 16:46:01
BK22012849	8	전문가	네. 개화기 이전까지 조선에서는 에도 막부에 큰 규모의 사절단을 파견하였는데 그것이 바로 조선통신사예요.	조선 통신사	https://ko.wikipedia.org/wiki/%EC%A1%B0%EC%84%A0_%ED%86%B5%EC%8B%A0%EC%82%AC	2022/03/18	0	2022-09-30 15:26:01	2022-10-01 16:46:01
BK22012849	9	질문자	학교 다닐 때 우리의 문화를 전파해주었다고 배웠던 것이 기억이 나요. 교류라고 하면 일본에서 받은 것도 있을 것 같은데, 고구마가 그 중 하나라는 이야기를 들었어요. 이것이 사실인가요?				0	2022-09-30 15:26:01	2022-10-01 16:46:01
BK22012849	10	전문가	네, 18세기 후반에 일본으로부터 고구마가 들어와 한국에 재배되기 시작하였어요.	고구마	https://ko.wikipedia.org/wiki/%EA%B3%A0%EA%B5%AC%EB%A7%88	2022/07/15	0	2022-09-30 15:26:01	2022-10-01 16:46:01
BK22012849	11	질문자	고구마가 그렇게 오래 전에 들어온 거였어요? 그럼 고구마의 원산지는 일본인가요?				0	2022-09-30 15:26:01	2022-10-01 16:46:01
BK22012849	12	전문가	아니요. 16세기 초반 대항해시대에 콜럼버스가 유럽으로 가져온 대표적인 구황작물이 고구마인데, 멕시코와 중남미 지역에서 고구마를 가져왔지요.	고구마	https://ko.wikipedia.org/wiki/%EA%B3%A0%EA%B5%AC%EB%A7%88	2022/07/15	0	2022-09-30 15:26:01	2022-10-01 16:46:01
BK22012849	13	질문자	구황작물이라니. 처음 들어보는 거 같은데 그게 무엇을 뜻하는 건가요?				0	2022-09-30 15:26:01	2022-10-01 16:46:01
BK22012849	14	전문가	구황작물은 흉년같은 기근으로 인해 주식물 대신 먹을 수 있는 농작물을 말해요. 다른 말로는 비황작물이라고도 해요.	구황작물	https://ko.wikipedia.org/wiki/%EA%B5%AC%ED%99%A9%EC%9D%8C%EC%8B%9D#%EA%B5%AC%ED%99%A9%EC%9E%91%EB%AC%BC	2022/05/07	0	2022-09-30 15:26:01	2022-10-01 16:46:01
BK22012849	15	질문자	예전에는 기근이 심했었나 보군요, 조선에도 그런 기근이 있었나요?				0	2022-09-30 15:26:02	2022-10-01 16:46:01
BK22012849	16	전문가	네. 1670년과 1671년에 현종이 조선시대를 다스리던 시기였는데, 이 때 경신 대기근이 발생했어요. 역사상 기록된 적이 없었던 기아 사태였으며, 그 결과는 매우 안 좋았죠.	경신 대기근	https://ko.wikipedia.org/wiki/%EA%B2%BD%EC%8B%A0_%EB%8C%80%EA%B8%B0%EA%B7%BC	2022/07/15	0	2022-09-30 15:26:02	2022-10-01 16:46:01
BK22012849	17	질문자	그렇게나 많은 사람들이 굶어 죽었다니 정말 끔찍하네요.				0	2022-09-30 15:26:02	2022-10-01 16:46:01
BK22012849	18	전문가	요즘 시대를 사는 분들은 잘 모르시겠지만, 과거에는 정말 굶는 일이 많았어요.				0	2022-09-30 15:26:02	2022-10-01 16:46:01
BK22012849	19	질문자	정말 이 시대에 태어나 굶지 않고 배부르게 먹는 것도 참 큰 축복인가 봐요.				0	2022-09-30 15:26:02	2022-10-01 16:46:01
BK22012849	20	전문가	우리 부모님 세대만 해도 보릿고개라는 말이 있을 정도였으니, 굶주림이 얼마나 심각했는지 짐작할 수 있죠.				1	2022-09-30 15:26:02	2022-10-01 16:46:01
