id	utterance_id	role	text	search_query	search_URL	reference_date	terminate	regDate	updDate
BK22012058	1	질문자	영화에서 너무 귀여운 범고래를 봤어요! 범고래는 실제로도 사람과 잘 지내나요?				0	2022-09-30 15:02:49	2022-10-01 10:29:04
BK22012058	2	전문가	범고래가 사람을 직접적으로 공격하여 사망까지 이르게 하지는 않았지만, 범고래에 의한 어선 공격은 증가하고 있어요. 2022년 7월에는 포르투칼의 앞바다에서 범고래가 공격하여 배가 침몰했었죠.	범고래 공격	https://www.mk.co.kr/news/culture/view/2022/08/772688/	2022/08/31	0	2022-09-30 15:02:49	2022-10-01 10:29:04
BK22012058	3	질문자	왜 범고래가 어선을 공격하는 과격한 행동을 하나요?				0	2022-09-30 15:02:49	2022-10-01 10:29:04
BK22012058	4	전문가	범고래가 배의 프로펠러에서 생성되는 수압을 즐긴다는 가설도 있어요.	범고래 어선 공격	https://www.mk.co.kr/news/culture/view/2022/08/772688/	2022/08/31	0	2022-09-30 15:02:49	2022-10-01 10:29:04
BK22012058	5	질문자	그러고보니 범고래는 생김새가 흰수염고래와 다르네요. 두 종에 어떤 차이가 있나요?				0	2022-09-30 15:02:49	2022-10-01 10:29:04
BK22012058	6	전문가	범고래는 돌고래와 같은 이빨고래는 날카로운 이빨로 먹이를 통째로 씹어서 삼켜요. 밍크고래와 흰수염고래 등은 수염고래에 속하는데 바닷물을 빨아들이면서 물과 함께 딸려 들어온 작은 고기와 새우등을 수염을 통해 걸러서 먹어요.	수염고래 이빨고래	http://kids.donga.com/?ptype=article&no=20220330131955750126	2022/03/30	0	2022-09-30 15:02:50	2022-10-01 10:29:04
BK22012058	7	질문자	수염고래가 무엇을 먹었는지는 어떻게 아나요?				0	2022-09-30 15:02:50	2022-10-01 10:29:04
BK22012058	8	전문가	수염고래가 먹이를 수염을 통해서 걸러낼 때는 섭취하는 해양 생물이 생화학적 신호를 남기게 되죠. 이 신호는 사라지지 않고 수염에 흔적을 남기게 되어요. 수염이 점점 자라며 신호들은 층층이 수염 내부에 갇히게 되죠.	수염고래 먹이 신호	http://kids.donga.com/?ptype=article&no=20220330131955750126	2022/03/30	0	2022-09-30 15:02:50	2022-10-01 10:29:04
BK22012058	9	질문자	수염의 연구를 통해 먹이의 종류 말고 어떤 정보를 얻을 수 있었나요?				0	2022-09-30 15:02:50	2022-10-01 10:29:04
BK22012058	10	전문가	고래가 주로 먹는 남극의 크릴 새우는 얼음이 있는 차가운 바다에서 번성하는데, 기후변화로 라니냐가 발생한 다음에는 크릴이 풍부하지 않았어요.	고래 크릴 새우 수염	https://www.yna.co.kr/view/AKR20220322124700009?input=1195m	2022/03/22	0	2022-09-30 15:02:50	2022-10-01 10:29:04
BK22012058	11	질문자	고래가 주로 차가운 곳에 사는 새우를 먹으면, 남극에 있지 않을때는 먹지 않나요?				0	2022-09-30 15:02:50	2022-10-01 10:29:04
BK22012058	12	전문가	혹등고래의 경우 여름에는 차가운 남극 주변에서 먹이를 먹으며 활동하다가, 겨울이 되면 번식을 위해 따뜻한 열대 수역으로 내려와요. 이때는 안정적으로 공급되는 먹이원 없이 체내 영양분으로 활동하거나 우연히 먹는 영양분에 의존하죠. 그래서 남극에서 충분히 영양을 섭취해야 해요.	혹등고래 남극 크릴	https://www.yna.co.kr/view/AKR20220322124700009?input=1195m	2022/03/22	0	2022-09-30 15:02:50	2022-10-01 10:29:04
BK22012058	13	질문자	그렇군요, 한국에는 어떤 고래가 서식하나요?				0	2022-09-30 15:02:50	2022-10-01 10:29:04
BK22012058	14	전문가	한국의 대표적 토종 돌고래로 상괭이가 있어요. 상괭이는 둥근 머리와 작은 눈, 지느러미가 없다는 외적 특징이 있어요. 국내에서는 서해안, 남해안, 동해안, 제주도 등의 전역에서 발견되고 있죠.	한국 상괭이	http://www.jibs.co.kr/news/articles/articlesDetail/20359?feed=na	2022/02/02	0	2022-09-30 15:02:50	2022-10-01 10:29:04
BK22012058	15	질문자	상괭이라니 아주 귀여운 이름이네요. 한국에 서식하는 고래라고 하니 바다에 가면 쉽게 만날 수 있나요?				0	2022-09-30 15:02:50	2022-10-01 10:29:04
BK22012058	16	전문가	글쎄요, 상괭이의 개체수는 최근 크게 줄어들고 있거든요. 상괭이의 개체수는 2004년 3만 6천마리에서 2016년에는 1만 7000마리로 12년 사이에 53% 감소했어요.	상괭이 멸종위기	http://www.sisaweek.com/news/curationView.html?idxno=154794	2022/07/11	0	2022-09-30 15:02:50	2022-10-01 10:29:04
BK22012058	17	질문자	상괭이의 개체수가 줄어들고 있다니, 마음이 아프네요.				0	2022-09-30 15:02:50	2022-10-01 10:29:04
BK22012058	18	전문가	상괭이만이 아니고 자연과 환경이 많이 위협받고 있죠.				0	2022-09-30 15:02:50	2022-10-01 10:29:04
BK22012058	19	질문자	맞아요, 아는 것이 힘이라고 고래에 대해 아니까 관심과 애정이 생겨요.				0	2022-09-30 15:02:50	2022-10-01 10:29:04
BK22012058	20	전문가	고래에 대해서 애정이 생긴다니 저도 기쁘네요.				0	2022-09-30 15:02:50	2022-10-01 10:29:04
BK22012058	21	질문자	네, 다음엔 우리 바다에 쓰레기를 주우러 가요.				0	2022-09-30 15:02:50	2022-10-01 10:29:04
BK22012058	22	전문가	좋아요, 고래들이 알면 기뻐하겠네요.				1	2022-09-30 15:02:51	2022-10-01 10:29:04
