id	utterance_id	role	text	search_query	search_URL	reference_date	terminate	regDate	updDate
BK22005659	1	질문자	사해 호수가 텔레비전에 나왔는데, 생각보다 많이 크더라. 사해는 얼마나 넓은 호수야?				0	2022-08-16 09:01:43	2022-08-16 15:26:14
BK22005659	2	전문가	네게브 사막 근처에 있는 사해는 넓이가 810제곱 킬로미터에 이르는 호수야.	사해	http://weekly.hankooki.com/news/articleView.html?idxno=6824100	2021/01/11	0	2022-08-16 09:01:43	2022-08-16 15:26:14
BK22005659	3	질문자	사막 옆 넓은 호수이구나. 사해는 염분이 높다고 하는데 얼마나 높아?				0	2022-08-16 09:01:43	2022-08-16 15:26:14
BK22005659	4	전문가	사해는 요르단 강에서 물이 들어오기는 하지만 빠져나가지 않는 폐쇄된 구조의 호수로 물이 유입되는 양과 증발되는 양이 비슷해. 그래서, 인근 물웅덩이와 사해의 염분 농도는 200퍼센트로 많이 염분을 함유하고 있고, 바닷물과 비교하면 5배나 높아.	사해 염분	https://nownews.seoul.co.kr/news/newsView.php?id=20210914601012&wlog_tag3=naver	2021/09/14	0	2022-08-16 09:01:43	2022-08-26 10:18:15
BK22005659	5	질문자	바닷물 보다 5배나 높은 호수라니 신기하다. 거기에 사해는 지대가 낮은 곳에 위치하고 있다며?				0	2022-08-16 09:01:43	2022-08-16 15:26:14
BK22005659	6	전문가	맞아, 해수면 보다 414미터 밑에 있어 사해는 세계에서 가장 지대가 낮은 곳에 있는 호수야.	사해 위치	https://www.yna.co.kr/view/AKR20150811020300805?input=1195m	2015/08/11	0	2022-08-16 09:01:43	2022-08-16 15:26:14
BK22005659	7	질문자	지대가 낮고 물의 증발량과 유입량이 같아서 염분의 농도가 유지되는 건 이해가 되는데, 호수의 물이라면 처음부터 염분이 있으면 안 되는거 아닌가?				0	2022-08-16 09:01:43	2022-08-16 15:26:14
BK22005659	8	전문가	맞아, 우리가 알고 있는 호수는 염분기가 있는 물이 아니지. 사해 물이 염분기가 있는 이유는 처음에 사해에 유입된 물이 바닷물이어서 그런 거야. 400만 년 전 지구온난화와 기후 대변동을 겪을 때 지중해의 해수면이 상승했고, 그때 지중해의 바닷물이 흘러들어 생성된 호수가 사해야. 그 후 7만 년 전 빙하기가 되면서 물이 더 이상 유입되지 않았고, 그러면서 지금보다 더 큰 225킬로미터의 호수가 형성됐었어.	사해호수	https://ko.wikipedia.org/wiki/%EC%82%AC%ED%95%B4	2022/07/06	0	2022-08-16 09:01:43	2022-08-24 23:41:53
BK22005659	9	질문자	바닷물이 만든 큰 웅덩이가 사해가 돼서 염분기가 있는 거구나. 그렇게 염분기가 있어서 사해라고 불리는 거지?				0	2022-08-16 09:01:43	2022-08-16 15:26:14
BK22005659	10	전문가	맞아, 염분 농도가 바닷물보다도 5배나 높으니 생물이 살기 어렵지. 그래서, 죽음의 바다나 소금 호수라고 사해를 부르는 거야.	사해 의미	http://www.greenpostkorea.co.kr/news/articleView.html?idxno=98996	2018/12/07	0	2022-08-16 09:01:43	2022-08-16 15:26:14
BK22005659	11	질문자	염분이 그렇게 높으니 생명이 살기 어렵겠네. 생명이 살기는 어렵지만, 사해는 유용한 관광자원이지?				0	2022-08-16 09:01:43	2022-08-16 15:26:14
BK22005659	12	전문가	맞아, 염도가 높아 몸을 담그면 둥둥 떠서 사람들에게 유명하지. 그래서 사해는 전 세계 사람들에게 인기 있는 유명 관광지야.	사해 관광	https://www.sedaily.com/NewsView/1RUJ0ZYBEC	2018/01/22	0	2022-08-16 09:01:43	2022-08-24 23:41:53
BK22005659	13	질문자	나는 수영을 못해서 튜브 없이는 물에 떠본 적이 없는 데 한번 가보고 싶다. 사해는 관광지로도 유명하지만, 미용제품도 유명하잖아?				0	2022-08-16 09:01:43	2022-08-16 15:26:14
BK22005659	14	전문가	응, 사해에 있는 유기물이 피부와 신경통에 좋다고 알려져 있어서 물과 진흙이 함유된 미용제품이 기념품으로 많이 팔려.	사해 미용용품	http://www.travie.com/news/articleView.html?idxno=19182	2016/07/12	0	2022-08-16 09:01:43	2022-08-24 23:41:53
BK22005659	15	질문자	염분이 많아 생물체가 살지 못하지만, 다양한 용도로 쓰이고 있구나. 텔레비전에서도 보니까 소독 효과도 있다고 하던데?				0	2022-08-16 09:01:43	2022-08-16 15:26:14
BK22005659	16	전문가	맞아, 높은 염분과 미네랄이 몸을 소독해 주는 역할도 하고, 질병 치료에도 효과가 있어. 하지만, 그런 효과가 있더라고 사해에 몸을 담들 때에는 주의해야 할 점이 있어. 얼굴을 물에 넣으면 절대로 안 된다는 거야. 눈을 감더라도 입수는 절대 안 돼. 눈이 타 들어가는 고통이 오고, 바로 씻지 않으면 실명까지 될 수도 있어.	사해 관광	https://www.mk.co.kr/news/culture/view/2015/05/451061/	2015/05/12	0	2022-08-16 09:01:43	2022-08-26 10:18:15
BK22005659	17	질문자	염분이 너무 높아 눈이 상할 수 있는 거구나. 그 점만 조심하고 사해를 즐기면 되는 거네. 근데, 사해가 위기를 겪고 있다고 하던데 왜 그래?				0	2022-08-16 09:01:43	2022-08-16 15:26:14
BK22005659	18	전문가	사해의 수면이 최근 매년 1미터씩 수면이 낮아지는 위기를 겪고 있어. 그 이유는 이스라엘의 증가된 인구와 늘어난 농업 인구에게 부족한 물을 공급하기 위해 갈릴리 호수에 댐과 운하를 건설했고, 요르단도 요르단 강에 댐을 건설했거든.	사해 위기	http://www.docdocdoc.co.kr/news/articleView.html?idxno=1055110	2018/04/21	0	2022-08-16 09:01:43	2022-08-24 23:41:53
BK22005659	19	질문자	그렇게 댐을 건설했으니 사해에 유입될 물이 부족해져서 수면이 낮아지고 있는 거구나. 사해가 계속 있었으면 좋겠는데.				0	2022-08-16 09:01:43	2022-08-16 15:26:14
BK22005659	20	전문가	나도 너와 같은 생각이야. 사해가 잘 보존되었으면 좋겠어.				0	2022-08-16 09:01:43	2022-08-16 15:26:14
BK22005659	21	질문자	네가 사해에 대해 잘 설명해 줘서 많은 걸 알게 되었어, 고마워.				0	2022-08-16 15:26:14	2022-08-16 15:26:14
BK22005659	22	전문가	고맙긴, 나도 너와 이야기 나눠서 즐거웠어. 다음에 또 이야기 나누자, 잘 가.				1	2022-08-16 15:26:14	2022-08-26 10:18:15
