id	utterance_id	role	text	search_query	search_URL	reference_date	terminate	regDate	updDate
BK22003209	1	질문자	조선시대 궁녀들은 지금으로 따지면 공무원 같은 건가요?				0	2022-08-04 11:10:25	2022-08-04 11:10:25
BK22003209	2	전문가	네, 맞아요. 궁녀의 정식 명칭은 궁궐 안에서 일하는 여성 관원이라는 뜻을 가진 궁중여관이에요. 다른 관리들처럼 일정한 지위를 부여받고 봉급을 받으며 일하는 전문직 여성 공무원이라고 할 수 있죠.	조선시대 궁녀 공무원	http://www.munhwa.com/news/view.html?no=2021111901031412000001	2021/11/19	0	2022-08-04 11:10:25	2022-08-08 10:47:23
BK22003209	3	질문자	궁녀의 신분이 꽤 높았나보네요. 궁녀도 지위에 따라 부르는 이름이 달랐죠?				0	2022-08-04 11:10:25	2022-08-04 11:10:25
BK22003209	4	전문가	궁녀는 언제 입궁을 했는지, 소속 부서는 어디인지에 따라 차이를 두어 상궁, 나인, 애기나인의 3가지 신분으로 나뉘었어요. 이 중 가장 높은 지위를 가진 사람은 상궁이었고, 나인은 상궁과 거의 비슷한 역할을 수행했지만 주로 상궁의 보조역할을 했죠. 그리고 그 밑에 애기나인이 있는 구조예요.	조선시대 궁녀 신분	https://sisunnews.co.kr/news/articleView.html?idxno=147066	2021/09/17	0	2022-08-04 11:10:25	2022-08-08 10:47:23
BK22003209	5	질문자	그렇군요. 그럼 월급도 신분에 따라 차등을 두고 받았나요?				0	2022-08-04 11:10:25	2022-08-04 11:10:25
BK22003209	6	전문가	맞아요. 처음 나인이 되어 받는 월급은 쌀 4말, 콩 1말 5되, 북어 3마리를 받았어요. 이후 정5품에 해당하는 상궁이 되면 쌀 16말 5되, 콩 5되, 북어 80마리를 받았죠. 그리고 명절, 연말에는 특별 상여를 받기도 했어요.	조선시대 궁녀 월급	https://www.sisunnews.co.kr/news/articleView.html?idxno=128226	2020/07/23	0	2022-08-04 11:10:25	2022-08-04 11:10:25
BK22003209	7	질문자	처우가 나쁘지 않았네요. 그럼 대부분의 백성들은 궁녀가 되길 바랐나요?				0	2022-08-04 11:10:25	2022-08-04 11:10:25
BK22003209	8	전문가	가난한 백성들은 자녀가 궁녀가 되길 바랬지만 자발적 지원으로 되는 경우는 별로 없었어요. 왜냐하면 고된 일을 해야하는 건 기본이고 죽을 때까지 연애도 못하고 왕을 위한 삶을 살아야 했기 때문이죠. 늙고 병들어야 궁 밖으로 나올 수 있었으니까요. 그래서 대략 10년 주기로 궁녀를 뽑았는데, 지원자가 부족해 궁녀 집안의 친척 딸, 기녀의 딸을 데려 오기도 했고 관청에 있는 여자 노비 중에서 선발하기도 했어요.	조선시대 궁녀 채용	https://www.sisunnews.co.kr/news/articleView.html?idxno=128226	2020/07/23	0	2022-08-04 11:10:25	2022-08-08 10:47:23
BK22003209	9	질문자	궁녀는 장점과 단점이 뚜렷한 직업이었던 것 같네요. 한 번 궁녀가 되면 결혼은 절대 못 하는 거였나요?				0	2022-08-04 11:10:25	2022-08-08 10:47:23
BK22003209	10	전문가	네. 궁녀는 모두 왕의 여자이기 때문에 왕이 아닌 다른 남자와는 관계를 맺어선 안 됐어요.	조선시대 궁녀 결혼	http://www.gnnews.co.kr/news/articleView.html?idxno=411003	2019/05/13	0	2022-08-04 11:10:25	2022-08-08 10:47:23
BK22003209	11	질문자	그럼 궁에 있는 모든 궁녀가 왕만을 바라보며 살았던 거네요? 만약 궁녀가 왕에게 선택을 받으면 신분이 달라지나요?				0	2022-08-04 11:10:25	2022-08-08 10:47:23
BK22003209	12	전문가	궁녀가 왕에게 선택을 받으면 승은상궁이 되었어요. 이렇게 한 번 승은을 입으면 궁녀일 때 하던 모든 일을 하지 않아도 돼요. 한 번 승은을 입은 후 다시는 왕이 찾지 않아 외롭게 여생을 보내던 상궁도 있었지만 대부분은 임신을 했어요. 왕의 아이를 가졌다면 내명부 종4품에 해당하는 숙원의 후궁이 될 수 있었죠.	궁녀	https://ko.wikipedia.org/wiki/%EA%B6%81%EB%85%80	2022/02/22	0	2022-08-04 11:10:25	2022-08-04 11:10:25
BK22003209	13	질문자	단 한 번 만으로 인생 역전이 가능했군요. 그럼 궁녀들은 왕의 선택을 받기 위해 노력을 했었나요?				0	2022-08-04 11:10:25	2022-08-08 10:47:23
BK22003209	14	전문가	네, 맞아요. 궁녀들은 왕에게 눈에 띄기 위해 열심히 몸매 관리를 했었어요. 그 중 하나가 식초에 절인 마늘인데, 궁녀들 사이에서 좋은 다이어트 식품으로 통했죠. 방법은 아침, 저녁 식사를 마친 후 초마늘 2쪽이나 3쪽 정도를 먹는거에요. 이렇게 초마늘을 먹으면 가는 허리를 만들 수 있었어요.	궁녀 승은 노력	https://www.insight.co.kr/news/321162	2021/01/26	0	2022-08-04 11:10:25	2022-08-08 10:47:23
BK22003209	15	질문자	그렇군요. 많은 궁녀들이 왕만을 바라보고 살다 보니 관리에 집중할 수 밖에 없는 환경이었을 것 같아요. 그럼 궁녀로서 가장 높은 자리는 어디였나요?				0	2022-08-04 11:10:25	2022-08-08 10:47:23
BK22003209	16	전문가	큰방상궁이라 불렀던 제조상궁이에요. 사극에서도 중요한 인물로 자주 등장하며 잘 알려져 있죠. 후궁, 승은상궁을 제외하면 제조상궁이 가장 높은 자리였어요. 중전, 대비와 대면하는 일이 많은 만큼 영향력도 컸죠.	조선시대 궁녀 계급	https://www.sisunnews.co.kr/news/articleView.html?idxno=128226	2020/07/23	0	2022-08-04 11:10:25	2022-08-08 10:47:23
BK22003209	17	질문자	영향력이 큰 만큼 궁에 몇 명 없었을 것 같은데 제조상궁은 몇 명을 두었고 어느 정도의 경력을 쌓아야 될 수 있었나요?				0	2022-08-04 11:10:25	2022-08-04 11:10:25
BK22003209	18	전문가	궁녀 중 최고 수장이었던 제조상궁은 보통 1명만 두었어요. 궁녀들은 일반적으로 6살에서 7살즈음에 입궁하고, 15년 정도가 지나 관례를 치르고 정식 나인이 되었어요. 나인이 되고 15년이 지나야 상궁이 될 수 있었으니 어느 정도 가늠이 되실 거예요.	조선시대 제조상궁	https://www.newscj.com/574991	2018/11/21	0	2022-08-04 11:10:25	2022-08-08 10:47:23
BK22003209	19	질문자	입궁해 오랜 시간을 걸쳐 1명만 할 수 있는 자리라니 대부분의 궁녀들은 다가갈 수 없었겠네요. 보통 궁녀들은 더이상 일하지 못하게 되면 어떻게 되었나요?				0	2022-08-04 11:10:25	2022-08-04 11:10:25
BK22003209	20	전문가	궁녀는 늙거나 심각한 병에 걸려 일을 더이상 하기 어려워졌을 때 궁녀직을 파했어요. 그렇게 출궁하고 나면 승려가 되어 절에서 여생을 보내다가 사망 후 화장되는 경우가 많았어요.	조선시대 궁녀 출궁	http://www.ohmynews.com/NWS_Web/View/at_pg.aspx?CNTN_CD=A0002066081	2015/07/13	0	2022-08-04 11:10:25	2022-08-08 10:47:23
BK22003209	21	질문자	슬프네요. 왕을 위해 평생을 노력하고 살아왔는데 끝은 좋지 못한 것 같아서요.				0	2022-08-04 11:10:25	2022-08-04 11:10:25
BK22003209	22	전문가	지금의 시선으로 보면 그럴지도 몰라요. 하지만 조선시대는 지금 우리 시대와는 다르니 과거에는 이런 삶도 있었구나라는 정도로만 이해하고 받아들이시면 돼요.				0	2022-08-04 11:10:25	2022-08-04 11:10:25
BK22003209	23	질문자	옛날에는 그렇게 살았구나 정도로 받아들일게요. 오늘 이야기 재밌었어요. 다음에 또 만나면 그땐 조금 더 즐거운 이야기를 해요.				1	2022-08-04 11:10:25	2022-08-08 10:47:23
