id	utterance_id	role	text	search_query	search_URL	reference_date	terminate	regDate	updDate
BK22005429	1	질문자	최근에 만화책을 읽었는데 조금 오래된 시대를 다루는 만화여서 그런지 거기 나오는 등장인물들은 우주가 지구를 중심으로 돈다고 생각하더라고요.				0	2022-08-12 16:40:27	2022-08-12 16:40:27
BK22005429	2	전문가	지구가 우주의 중심이고 천체 전부가 지구 주위를 공전한다는 지구중심설이 대세이던 시절을 배경으로 그린 만화인가 보네요?	지구중심설	https://ko.wikipedia.org/wiki/%EC%A7%80%EA%B5%AC%EC%A4%91%EC%8B%AC%EC%84%A4	2022/04/20	0	2022-08-12 16:40:27	2022-08-12 16:40:27
BK22005429	3	질문자	네, 그래서 현대인의 시각으로 보니 너무 생소했어요. 저런 이론을 지구중심설이라고 하는군요?				0	2022-08-12 16:40:27	2022-08-12 16:40:27
BK22005429	4	전문가	네, 천동설이라고 부르기도 하죠. 천동설이라는 우주론은 크게 에우독소스가 고안해 아리스토텔레스의 철학관에 반영된 동심천구가설과 프톨레마이오스의 천동설 두 가지로 나뉘고요.	천동설	https://ko.wikipedia.org/wiki/%EC%A7%80%EA%B5%AC%EC%A4%91%EC%8B%AC%EC%84%A4	2022/04/20	0	2022-08-12 16:40:27	2022-08-12 16:40:27
BK22005429	5	질문자	천동설이라고도 부르는군요. 와중에 제가 아는 유명한 철학자인 아리스토텔레스가 나오는 것도 신기하네요. 저 정도로 유명한 철학자가 얘기했다니 당시 사람들은 다 그러려니 했을 것 같아요.				0	2022-08-12 16:40:27	2022-08-12 16:40:27
BK22005429	6	전문가	네, 그렇죠? 때문에 아리스토텔레스가 기원전 4세기경 천동설을 내세운 이후로 수천 년 동안이나 정설로 대우 받았어요.	천동설 아리스토텔레스	http://www.kookje.co.kr/news2011/asp/newsbody.asp?code=0500&key=20130601.22016191153	2013/05/31	0	2022-08-12 16:40:27	2022-08-25 11:06:42
BK22005429	7	질문자	와, 그 이론이 몇천 년 동안이나 살아남았네요? 제가 알기로는 갈릴레이가 지구는 돈다는 주장을 했던 걸로 아는데 그럼 천동설은 갈릴레이가 처음 주장한 건가요?				0	2022-08-12 16:40:27	2022-08-12 16:40:27
BK22005429	8	전문가	아뇨, 보통 우리나라에서는 지동설 하면 갈릴레이나 코페르니쿠스를 떠올리지만 사실 이 둘은 최초로 지동설을 주장한 인물은 아니에요.	코페르니쿠스	https://www.asiatime.co.kr/article/20210219500057	2021/02/19	0	2022-08-12 16:40:27	2022-08-12 16:40:27
BK22005429	9	질문자	오, 갈릴레이가 최초로 주장한 인물은 아녔군요? 그럼 누가 최초로 지동설을 발견한 건가요?				0	2022-08-12 16:40:27	2022-08-12 16:40:27
BK22005429	10	전문가	네, 지동설을 처음 주장한 사람은 기원전 310년에 태어나 230년까지 살았던 아리스타르코스 호 사모스예요. 그는 고대 그리스의 천문학자인데, 알렉산드리아 도서관에서 근무하기도 했죠.	아리스타르코스	https://ko.wikipedia.org/wiki/%EC%82%AC%EB%AA%A8%EC%8A%A4%EC%9D%98_%EC%95%84%EB%A6%AC%EC%8A%A4%ED%83%80%EB%A5%B4%EC%BD%94%EC%8A%A4	2022/02/23	0	2022-08-12 16:40:27	2022-08-25 11:06:42
BK22005429	11	질문자	어, 이미 기원전에 지동설을 주장한 인물이 있었는데 왜 천동설이 그토록 오랫동안 지지를 받은 건가요?				0	2022-08-12 16:40:27	2022-08-25 11:06:42
BK22005429	12	전문가	당시 사람들이 천동설을 주장한 이유가 있기는 해요. 지동설이 맞다는 걸 입증하기 위해서는 항성의 연주 시차를 관측할 수 있어야 하는데 당시의 기술이 부족했기 때문에 연주 시차를 관측할 수 없었거든요.	천동설 연주시차	https://ko.wikipedia.org/wiki/%EC%A7%80%EA%B5%AC%EC%A4%91%EC%8B%AC%EC%84%A4	2022/04/20	0	2022-08-12 16:40:27	2022-08-12 16:40:27
BK22005429	13	질문자	관측기술이 부족해 빚어진 문제였군요. 그런데 혹시 연주 시차가 뭔가요?				0	2022-08-12 16:40:27	2022-08-12 16:40:27
BK22005429	14	전문가	네, 연주 시차는 어떤 천체를 관찰했을 때 지구가 공전하면서 생기는 시차를 말해요. 그래서 지구가 공전한다는 결정적인 근거이기도 하고요.	연주 시차	https://ko.wikipedia.org/wiki/%EC%97%B0%EC%A3%BC_%EC%8B%9C%EC%B0%A8	2022/02/05	0	2022-08-12 16:40:27	2022-08-12 16:40:27
BK22005429	15	질문자	지구의 공전에 따라 생기는 시차를 연주 시차라고 하는군요. 잊지 말고 기억해둬야겠어요. 그런데 갈릴레이와 코페르니쿠스가 지동설을 주장한 이후로는 다들 지동설을 납득했겠죠?				0	2022-08-12 16:40:27	2022-08-12 16:40:27
BK22005429	16	전문가	아뇨, 당시 교황청이 엄청난 영향력을 가지고 있었는데 교황청은 지구 중심적인 천동설을 우선시하며 계속해서 지동설을 받아들이지 않으려 했어요. 이런 교황청의 영향 때문에 지동설이 주류가 되기까지는 많은 고난이 있었죠.	천동설 교황	http://www.busan.com/view/busan/view.php?code=2021091218582133643	2021/09/12	0	2022-08-12 16:40:27	2022-08-25 11:06:42
BK22005429	17	질문자	헉, 지동설이 지금처럼 당연시되기까지 그런 어려움이 있었군요.				0	2022-08-12 16:40:27	2022-08-12 16:40:27
BK22005429	18	전문가	네, 아무래도 종교의 영향력이 막강했으니까요.				0	2022-08-12 16:40:27	2022-08-12 16:40:27
BK22005429	19	질문자	흠, 당시에는 종교가 곧 법이었으니 그럴 법도 하네요. 오늘 이렇게 지동설에 대해 설명을 들으니 이해하지 못하고 넘어갔던 만화의 세계관도 지금 이해가 되는 게 있네요. 이렇게 재밌는 지동설 이야기를 해주셔서 감사합니다.				0	2022-08-12 16:40:27	2022-08-12 16:40:27
BK22005429	20	전문가	저야말로 지루한 이야기 경청해주셔서 감사해요. 다음에 혹시 또 궁금한 게 있으시면 질문해주세요.				1	2022-08-12 16:40:27	2022-08-25 11:06:42
