id	utterance_id	role	text	search_query	search_URL	reference_date	terminate	regDate	updDate
BK22000535	1	질문자	오늘 한국인계 수학과 교수가 상을 탔다고 뉴스에 나오던데 혹시 알아요?				0	2022-07-20 16:08:13	2022-08-02 12:01:32
BK22000535	2	전문가	아, 저도 그 뉴스 봤어요. 미국 프린스턴대 수학과의 허준이 교수가 수학계 노벨상인 필즈상을 수상했어요.	허준이	https://www.donga.com/news/article/all/20220705/114303240/1	2022/07/05	0	2022-07-20 16:08:13	2022-07-21 09:50:16
BK22000535	3	질문자	이름이 허준이 교수였군요. 허준이 교수가 수상한 필즈상이 수학계 노벨상인 거예요?				0	2022-07-20 16:08:13	2022-08-02 12:01:32
BK22000535	4	전문가	필즈상은 1936년 제정된 상으로 수학계의 노벨상으로 불리는 상이에요. 4년마다 수학계에서 뛰어난 업적을 이루고, 향후 학문적 성취가 기대되는 40세 미만 수학자에게 수여하는 수학 분야 최고의 상이 필즈상이에요.	필즈상	https://www.yna.co.kr/view/AKR20220705082600098?input=1195m	2022/07/05	0	2022-07-20 16:08:13	2022-07-21 09:50:16
BK22000535	5	질문자	아, 정말 대단한 상을 허준이 교수가 받은 거네요. 한국인은 필즈상을 한 번도 수상한 적이 없는 거예요?				0	2022-07-20 16:08:14	2022-08-02 12:01:32
BK22000535	6	전문가	네, 한국계 수학자가 필즈상 수상 후보로 오른 것도 유일하고, 또 세계 수학자 대회 126년의 역사에서 한국인과 한국계 동포가 필즈상을 수상한 적이 없었는데 이번에 허준이 교수가 역대 최초로 상을 타게 됐어요.	한국인 최초 필즈상	https://www.fnnews.com/news/202207051619412256	2022/07/05	0	2022-07-20 16:08:14	2022-07-21 09:50:16
BK22000535	7	질문자	그렇군요. 그럼 필즈상은 한 명만 주는 상인 건가요?				0	2022-07-20 16:08:14	2022-08-02 12:01:32
BK22000535	8	전문가	아니요. 이번에 필즈상 수상자는 허준이 교수와 스위스 로잔연방공과대 교수인 마리나 비아조우스카, 프랑스 고등과학원 교수인 위고 뒤미닐코팽, 영국 옥스퍼드대 교수인 제임스 메이나드, 총 4명이 선정됐어요.	필즈상 수상자	https://www.chosun.com/economy/science/2022/07/05/N6MUCKOLCFGHLGRGORUY5DFVM4/?utm_source=naver&utm_medium=referral&utm_campaign=naver-news	2022/07/05	0	2022-07-20 16:08:14	2022-07-21 09:50:16
BK22000535	9	질문자	쟁쟁한 해외 수학자들 사이에서 허준이 교수도 수상을 한 거네요. 그러면 허준이 교수는 수학계에서 어떤 업적을 이뤘기에 상을 탄 거예요?				0	2022-07-20 16:08:14	2022-08-02 12:01:32
BK22000535	10	전문가	허준이 교수는 수학계에서 오랫동안 해결하기 어려운 일이었던 리드 추측과 로타 추측을 증명해냈어요.	허준이 리드 추측	https://news.kmib.co.kr/article/view.asp?arcid=0017246831&code=61121111&cp=nv	2022/07/05	0	2022-07-20 16:08:14	2022-07-21 09:50:16
BK22000535	11	질문자	리드 추측과 로타 추측이라니 듣기만 해도 어려운데요?				0	2022-07-20 16:08:14	2022-08-02 12:01:32
BK22000535	12	전문가	그렇죠. 리드 추측은 1968년에 나온 문제인데 여러 개의 꼭짓점들을 선분으로 연결하고, 옆에 있는 꼭짓점을 서로 다른 색으로 칠할 때 나오는 경우의 수에 관한 문제에요. 허준이 교수는 대수기하학의 이론을 사용해 리드 추측을 증명해냈어요. 아무도 하지 못한 방법을 해내다니 대단하지 않아요?	리드 추측	https://www.inews24.com/view/1497286	2022/07/05	0	2022-07-20 16:08:14	2022-07-21 09:50:16
BK22000535	13	질문자	네, 그럼 허준이 교수는 대수기하학 이론을 사용해 리드 추측을 증명해냈다는 건데 대수기하학 이론은 어떤 이론인 거예요?				0	2022-07-20 16:08:14	2022-08-02 12:01:32
BK22000535	14	전문가	대수기하학은 대수학과 기하위상수학이 만나는 분야로 보면 돼요. 물론 보는 방법에 따라 다양한 정의가 있어요. 단순히 말하면 대수기하학은 곡선, 곡면 등 기하학적 대상들과 대수적 방정식 사이의 관계를 연구하는 걸 말해요.	대수기하학 이론	https://www.yna.co.kr/view/AKR20220704149000017?input=1195m	2022/07/05	0	2022-07-20 16:08:14	2022-07-21 09:50:16
BK22000535	15	질문자	그렇군요. 그러면 허준이 교수가 해결한 난제들은 실제로 활용되고 있나요?				0	2022-07-20 16:08:14	2022-08-02 12:01:32
BK22000535	16	전문가	네, 허준이 교수의 연구 업적들은 정보통신, 반도체 설계, 교통 분야나 기계 학습 및 통계 물리, 그리고 물류 등에 사용되고 있어요. 연구를 통해 얻은 지식을 통해서 여러 분야 발달에 도움을 주고 있는 거죠.	허준이 교수 업적	https://newsis.com/view/?id=NISX20220705_0001932133&cID=13005&pID=13100	2022/07/05	0	2022-07-20 16:08:14	2022-07-21 09:50:16
BK22000535	17	질문자	아, 전 수학을 잘 못해서 관심이 없긴 하지만 역시 수학은 생활 전반에 도움을 주는 학문이네요.				0	2022-07-20 16:08:14	2022-08-02 12:01:32
BK22000535	18	전문가	맞아요. 저도 수학은 어려워서 흥미가 없는데 보면 모든 분야에 수학은 꼭 필요한 것 같아요.				0	2022-07-20 16:08:14	2022-07-21 09:50:16
BK22000535	19	질문자	그렇죠. 아무튼 허준이 교수의 연구가 수학계에서 인정받으니 기분이 좋네요.				0	2022-07-20 16:08:14	2022-08-02 12:01:32
BK22000535	20	전문가	네, 저도 그래서 뉴스 보면서 흐뭇하다 못해 기뻤어요. 오늘 얘기 너무 재밌었어요. 다음에 만나서 또 얘기 나눠요.				1	2022-07-20 16:08:14	2022-07-21 12:40:53
