id	utterance_id	role	text	search_query	search_URL	reference_date	terminate	regDate	updDate
BK22009024	1	질문자	요새 고민이 있어요. 제가 건설 현장에서 일용직 노동자로 오래 일했잖아요. 일용직으로만 일하다 보니 많이 지쳐서, 건설 현장에서 좀 더 전문성이 있는 일을 해야되겠다는 생각이 들더라고요.				0	2022-09-19 21:56:03	2022-10-01 23:36:26
BK22009024	2	전문가	그러셨군요, 그런데 구체적으로 어떤 일을 하셔야 되겠다는 생각을 하셨어요?				0	2022-09-19 21:56:03	2022-09-19 21:56:03
BK22009024	3	질문자	안 그래도 그게 고민이에요. 그래서 말인데 혹시 건설 현장에서 일하는 전문적인 직무 중에 추천 해주실 만 한게 있나요?				0	2022-09-19 21:56:03	2022-09-19 21:56:03
BK22009024	4	전문가	굴삭기운전기능사 자격증을 따셔서 굴삭기운전을 하시는건 어떠세요? 굴삭기는 토사 등을 착굴하는 땅을 파는 건설기계로 주로 도로, 주택, 농지정리, 준설 등 각종 건설 공사나 광산 작업 등에 사용돼요. 건설 기계 중에 제일 많이 사용되고 있죠. 게다가 굴삭기운전기능사는 응시자격에 제한을 두고있지 않아요. 즉, 연령, 학력, 경력, 성별, 지역 등에 제약없이 취득할 수 있는 자격증이에요.	굴삭기운전기능사	https://www.sedaily.com/NewsView/22JWONBXF6	2021/05/25	0	2022-09-19 21:56:03	2022-09-19 22:07:39
BK22009024	5	질문자	응시자격에 제한이 없다니 솔깃하네요. 그런데 굴삭기운전기능사 자격은 정확히 어떤 작업 능력을 평가하는 건가요?				0	2022-09-19 21:56:03	2022-09-19 22:23:10
BK22009024	6	전문가	굴삭기운전기능사 자격은 건설 토목 공사 현장에서 장비를 조종해 터파기, 깎기, 상차, 쌓기, 메우기 등의 일을 실행하는 업무 능력을 평가해요. 또 굴삭기의 일상점검과 예방정비를 하는 일도 함께 평가해요.	굴삭기운전기능사 업무 능력	https://www.sedaily.com/NewsView/22JWONBXF6	2021/05/25	0	2022-09-19 21:56:03	2022-09-19 22:07:39
BK22009024	7	질문자	그렇군요, 그런데 자격증을 가지고 있으면 어디에 주로 취업하게 되나요?				0	2022-09-19 21:56:03	2022-09-19 22:23:10
BK22009024	8	전문가	건설업체, 건설기계대여업체, 건설기계제조업체, 건설기계정비업체 등에 취업할 수 있어요. 제조업체나 물류업체, 광산, 항만, 시,도 건설사업소 등에도 진출할 수 있어요.	굴삭기운전기능사 취업	https://www.sedaily.com/NewsView/22JWONBXF6	2021/05/25	0	2022-09-19 21:56:03	2022-09-19 22:23:10
BK22009024	9	질문자	진출할 수 있는 곳이 다양하네요. 그런데 혹시 자격증을 가지고 있으면 우대사항도 있나요?				0	2022-09-19 21:56:03	2022-09-19 22:53:41
BK22009024	10	전문가	국가기술자격법에 의해 공공기관 및 사기업 고용 시 그리고 보수, 승진, 전보, 신분보장 등에 있어서 잘 대우 받을 수 있죠. 6급 이하 및 기술직 공무원 채용 시험 시 공무원임용시행령 31조에 따라 공업직렬의 운전 직렬에서 3%의 가산점이 더해지고, 국가공무원법 36조에 따라 공공기관 및 일반기업 채용시 보수, 승진, 전보, 신분보장 등에 있어서 우대를 받을 수 있어요.	굴삭기운전기능사 우대사항	https://www.sedaily.com/NewsView/22JWONBXF6	2021/05/25	0	2022-09-19 21:56:06	2022-09-19 22:53:41
BK22009024	11	질문자	그런데 취업하면 월급은 어느 정도 수준인가요?				0	2022-09-19 21:56:06	2022-09-19 22:53:41
BK22009024	12	전문가	자격증 취득 후 취업을 하게 되면 첫 월급은 평균 150만원 정도에요. 그리고 업무의 능숙함에 따라 최대 400만원까지 받는 사람도 있어요.	굴삭기운전기능사 월급	https://www.sedaily.com/NewsView/22JWONBXF6	2021/05/25	0	2022-09-19 21:56:06	2022-09-19 22:53:41
BK22009024	13	질문자	그렇군요, 근데 지인에게 들었는데 개인 굴삭기를 가지고 있으면 창업도 할 수 있다던데 맞나요?				0	2022-09-19 21:56:06	2022-09-19 22:53:41
BK22009024	14	전문가	네, 맞아요. 굴삭기를 가지고 있으면 대여 업체를 창업할 수 있어요. 창업 외에도 가지고 있는 굴삭기로 직접 일을 할 수도 있어요. 현장에선 이를 지입이라고 하는데요, 해당 업체와 계약을 맺고 자신이 소유한 굴삭기를 사용해 개인적으로 일을 하는 거에요.	굴삭기운전기능사 창업	https://www.sedaily.com/NewsView/22JWONBXF6	2021/05/25	0	2022-09-19 21:56:06	2022-09-19 22:53:41
BK22009024	15	질문자	창업이 되는게 맞았군요. 그런데 굴삭운전기능사의 직업 전망은 어떤가요? 건설경기가 하도 어렵다고 해서요.				0	2022-09-19 21:56:06	2022-09-19 22:53:41
BK22009024	16	전문가	굴삭운전기능사들의 향후 직업 전망도 좋은 편이에요. 산업인력공단은 향후 10년 간 건설기계운전원의 취업자 수는 현 상태를 유지할 것으로 전망했거든요.	굴삭기운전기능사 직업 전망	https://www.sedaily.com/NewsView/22JWONBXF6	2021/05/25	0	2022-09-19 21:56:06	2022-09-19 22:53:41
BK22009024	17	질문자	그렇군요, 그런데 자격증 시험은 어떻게 구성되어 있나요?				0	2022-09-19 21:56:10	2022-09-19 22:53:41
BK22009024	18	전문가	자격증 시험은 필기시험과 실기시험으로 나뉘어져 있어요. 필기시험은 객관식으로 건설기계기관, 전기 및 작업장치, 유압일반, 건설기계관리법규 및 도로통행방법, 안전관리 총 5개 과목으로 60문항을 풀어야 해요. 작업형인 실기시험은 굴삭기운전작업 및 도로주행을 통과해야 해요.	굴삭기운전기능사 시험	https://www.sedaily.com/NewsView/22JWONBXF6	2021/05/25	0	2022-09-19 21:56:10	2022-09-19 22:53:41
BK22009024	19	질문자	오늘 좋은 정보 알려주셔서 감사했어요. 진지하게 자격증 따는 걸 고민해봐야겠어요.				0	2022-09-19 21:56:10	2022-09-19 22:30:41
BK22009024	20	전문가	네, 기운 내시고 현명한 선택 하시길 바랄게요. 그럼 조심히 들어가세요.				1	2022-09-19 21:56:13	2022-10-04 09:53:21
