id	utterance_id	role	text	search_query	search_URL	reference_date	terminate	regDate	updDate
BK22002323	1	질문자	저는 심리학과에 가고 싶어요.				0	2022-08-02 12:15:40	2022-08-02 13:33:12
BK22002323	2	전문가	오, 심리학에 관심이 있나 봐요?				0	2022-08-02 12:15:40	2022-08-02 13:33:12
BK22002323	3	질문자	네, 아직 잘 모르지만 꼭 배워보고 싶은 학문이에요. 잘 아신다고 들었는데, 심리학은 인간의 심리를 연구하는 학문 맞죠?				0	2022-08-02 12:15:40	2022-08-02 13:33:12
BK22002323	4	전문가	맞아요. 심리학은 인간의 심리와 행동을 과학적으로 연구하는 학문이에요. 인문과학, 자연과학, 예술, 공학 등 수많은 분야에 도움을 주고 있죠.	심리학	https://ko.wikipedia.org/wiki/%EC%8B%AC%EB%A6%AC%ED%95%99	2022/05/07	0	2022-08-02 12:15:40	2022-08-02 13:33:12
BK22002323	5	질문자	인간과 관계가 있는 모든 분야에 다 응용이 되겠네요. 크게 기초심리학이랑 응용심리학으로 나눠서 말하던데, 두 가지는 어떻게 달라요?				0	2022-08-02 12:15:40	2022-08-02 13:33:12
BK22002323	6	전문가	기초심리학은 심리학의 기초 원리와 이론을 다루고, 응용심리학은 기초심리학의 원리와 이론을 활용해 실제 문제를 해결하는 것에 초점을 맞춘 연구 분야예요. 2020년도 기준으로 심리학은 미국에는 본과를 제외하고 총 56개의 분과가 있고, 우리나라에는 14개 분과가 있어요.	기초심리학 응용심리학	https://ko.wikipedia.org/wiki/%EC%8B%AC%EB%A6%AC%ED%95%99	2022/05/07	0	2022-08-02 12:15:40	2022-08-02 13:33:12
BK22002323	7	질문자	와 분과가 엄청 많네요? 제가 관심있는 분야는 인지심리학인데, 인지심리학은 기초심리학에 속하는 개념인가요?				0	2022-08-02 12:15:40	2022-08-02 13:33:12
BK22002323	8	전문가	맞아요. 기초심리학에는 인지심리학, 학습심리학, 발달심리학, 생리심리학, 사회심리학, 신경심리학이 포함돼요. 기초심리학은 실험을 통해 기초지식과 심리적 기제를 연구하는 과학자형 모델로 대표되는 연구 분야인데, 주로 귀납적 사고를 쓰는 자연과학과 다르게 연역적 사고도 활용한다는 특징이 있어요.	기초심리학 인지심리학	https://ko.wikipedia.org/wiki/%EC%8B%AC%EB%A6%AC%ED%95%99	2022/05/07	0	2022-08-02 12:15:40	2022-08-02 13:33:12
BK22002323	9	질문자	그럼 범죄심리학은 기초심리학에요, 응용심리학이에요? 티비에서 범죄심리학자 이수정 교수님이 나오는 강의를 봤는데 멋지시더라고요.				0	2022-08-02 12:15:40	2022-08-02 13:33:12
BK22002323	10	전문가	범죄심리학은 응용심리학에 속해요. 응용심리학은 범죄심리학, 산업심리학, 임상심리학, 교육심리학, 건강심리학, 여성심리학 등을 포괄하고, 전문가형 모델로 대표되는 연구 분야거든요. 응용심리학에서는 실재 현장에의 적용을 목표로 응용방법과 원리를 연구하는데, 범죄심리학도 그렇죠.	심리학 범죄심리학	https://ko.wikipedia.org/wiki/%EC%8B%AC%EB%A6%AC%ED%95%99	2022/05/07	0	2022-08-02 12:15:40	2022-08-02 13:33:12
BK22002323	11	질문자	그렇군요. 전 인지심리학과 범죄심리학 중 하날 골라서 제대로 배워보고 싶어요. 인지심리학의 연구 대상이 뭔지도 알 수 있을까요?				0	2022-08-02 12:15:40	2022-08-02 13:33:12
BK22002323	12	전문가	그럼요, 얼마든지 물어봐요. 인지심리학의 연구대상으로는 지각, 이해, 사고, 학습, 기억, 추론, 문제해결, 고차인지기능이 있죠.	인지심리학 연구대상	https://ko.wikipedia.org/wiki/%EC%9D%B8%EC%A7%80%EC%8B%AC%EB%A6%AC%ED%95%99	2022/02/23	0	2022-08-02 12:15:40	2022-08-02 13:33:12
BK22002323	13	질문자	인지심리학의 정확한 정의도 궁금해요. 대충 느낌으론 알겠는데, 말로 설명을 못 하겠더라고요.				0	2022-08-02 12:15:40	2022-08-02 13:33:12
BK22002323	14	전문가	쉽게 설명해줄게요. 인지심리학은 인간이 지식을 습득하고 축적하는 과정을 연구하는 과학적, 기초적 심리학의 한 종류예요. 인공지능, 언어학, 정치, 교육, 문화, 경제 등 여러 분야에서 인지심리학을 활용하죠.	인지심리학 뜻	https://www.sciencetimes.co.kr/news/%EA%B3%BC%ED%95%99%EC%A0%81-%EC%8B%AC%EB%A6%AC%EB%B6%84%EC%84%9D-%EB%85%B8%EB%B2%A8%EA%B2%BD%EC%A0%9C%ED%95%99%EC%83%81-%EC%88%98%EC%83%81/	2017/10/10	0	2022-08-02 12:15:40	2022-08-02 13:33:12
BK22002323	15	질문자	아, 알 것 같아요. 프로이트에 관해서도 잘 아시나요? 심리학과 관련된 학자 중 제일 유명한 것 같은데, 어떤 사람인지 아는 게 없네요.				0	2022-08-02 12:15:40	2022-08-02 13:33:12
BK22002323	16	전문가	심리학계에서 빼놓을 수 없는 인물이죠. 오스트리아의 지그문트 프로이트는 정신과 의사인 동시에 정신분석학이라는 개념을 처음 만든 학자였어요. 프로이트는 무의식과 억압의 방어 기제에 관한 이론으로도 잘 알려졌지만, 환자와 정신분석자가 나눈 대화로 정신 병리를 치료하는 정신분석학적 임상 치료 방식을 고안해낸 걸로도 정말 유명해요.	프로이트	https://ko.wikipedia.org/wiki/%EC%A7%80%EA%B7%B8%EB%AC%B8%ED%8A%B8_%ED%94%84%EB%A1%9C%EC%9D%B4%ED%8A%B8	2022/07/09	0	2022-08-02 12:15:40	2022-08-02 13:33:12
BK22002323	17	질문자	무의식과 억압의 방어 기제라, 그러고 보니 프로이트와 관련해서 자기방어기제라는 단어를 들어본 것 같아요. 프로이트가 연구했다는 자기방어기제 이론이 어떤 건지 좀 더 설명해 줄 수 있어요?				0	2022-08-02 12:15:40	2022-08-02 13:33:12
BK22002323	18	전문가	프로이트가 말하는 자기방어기제란 자신을 보호하기 위한 도구예요. 자신을 압도시키는 불안으로부터 스스로를 지키고 기능을 수행할 수 있도록 도와주는 도구죠. 자기방어기제는 무의식 차원에서 작용하고, 불안을 감소시키기 위해 현실을 왜곡해 인식한다는 특징이 있어요.	프로이트 자기방어기제	https://ko.wikipedia.org/wiki/%EC%A7%80%EA%B7%B8%EB%AC%B8%ED%8A%B8_%ED%94%84%EB%A1%9C%EC%9D%B4%ED%8A%B8	2022/07/09	0	2022-08-02 12:15:40	2022-08-02 13:33:12
BK22002323	19	질문자	자기방어기제도 종류가 나뉘겠죠? 원래 관심이 있었지만, 이야기를 듣다 보니 심리학을 더 알고 싶어졌어요.				0	2022-08-02 12:15:40	2022-08-02 13:33:12
BK22002323	20	전문가	그렇죠? 심리학은 우리 인간의 심리와 행동을 연구하는 학문인 만큼 굉장히 광범위하고 유용해요.				0	2022-08-02 12:15:40	2022-08-02 13:33:12
BK22002323	21	질문자	그런 것 같아요! 다음번엔 프로이트의 자기방어기제의 종류도 알려주세요.				0	2022-08-02 12:15:40	2022-08-02 13:33:12
BK22002323	22	전문가	좋죠, 다음에 만날 땐 더 많은 이야기를 해줄게요. 아! 그리고 심리학과 꼭 들어가길 바라요.				0	2022-08-02 12:15:40	2022-08-02 13:33:12
BK22002323	23	질문자	하하, 아직 갈 길이 멀었지만, 열심히 해볼게요. 응원 정말 감사해요.				1	2022-08-02 12:15:40	2022-08-02 14:55:24
