id	utterance_id	role	text	search_query	search_URL	reference_date	terminate	regDate	updDate
BK22012868	1	질문자	우리나라도 예전에 핵무기 개발을 추진했었던 때가 있었다고 하는데 사실인가요?				0	2022-09-30 15:26:25	2022-10-01 16:47:40
BK22012868	2	전문가	네. 과거에도 대한민국은 핵무기 개발을 추진한 이력이 있어요.	대한민국의 핵무기 개발	https://ko.wikipedia.org/wiki/%EB%8C%80%ED%95%9C%EB%AF%BC%EA%B5%AD%EC%9D%98_%ED%95%B5%EB%AC%B4%EA%B8%B0_%EA%B0%9C%EB%B0%9C	2022/06/19	0	2022-09-30 15:26:25	2022-10-01 16:47:40
BK22012868	3	질문자	그렇다면 왜 핵무기 개발을 결심하게 되었나요?				0	2022-09-30 15:26:25	2022-10-01 16:47:40
BK22012868	4	전문가	1970년 7월 베트남 공화국 사이공에서 주최된 월남전 참전국 회의에서 윌리엄 로저스 미국 국무장관이 최규하 장관에게 보고한 주한미군 2만명을 거두어 들이는 것이 계기가 되었어요.	대한민국의 핵무기 개발	https://ko.wikipedia.org/wiki/%EB%8C%80%ED%95%9C%EB%AF%BC%EA%B5%AD%EC%9D%98_%ED%95%B5%EB%AC%B4%EA%B8%B0_%EA%B0%9C%EB%B0%9C	2022/06/19	0	2022-09-30 15:26:25	2022-10-01 16:47:40
BK22012868	5	질문자	주한미군의 철수 통보로 우리나라는 안보적 위협을 느끼게 되었군요. 그렇다면 세계 최초의 핵무기 개발 계획은 어떤 것이었나요?				0	2022-09-30 15:26:25	2022-10-01 16:47:40
BK22012868	6	전문가	제2차 세계 대전 중에 미국이 주동적으로 이끌고 영국, 캐나다가 공동으로 관계했던 맨해튼 계획이에요.	맨해튼 계획	https://ko.wikipedia.org/wiki/%EB%A7%A8%ED%95%B4%ED%8A%BC_%EA%B3%84%ED%9A%8D#%EA%B0%99%EC%9D%B4_%EB%B3%B4%EA%B8%B0	2022/07/31	0	2022-09-30 15:26:25	2022-10-01 16:47:40
BK22012868	7	질문자	그렇다면 그 맨해튼 계획을 건의한 사람은 누구인가요?				0	2022-09-30 15:26:25	2022-10-01 16:47:40
BK22012868	8	전문가	헝가리 태생의 미국 물리학자 실라르드 레오예요. 그는 1933년에 핵 연쇄 반응을 탐지하여 핵에너지를 이용할 수 있는 길을 열었고, 1939년에는 아인슈타인과 함께 루스벨트 미국 대통령에게 비밀리에 핵무기 개발을 제안하였어요.	실라르드 레오	https://ko.wikipedia.org/wiki/%EC%8B%A4%EB%9D%BC%EB%A5%B4%EB%93%9C_%EB%A0%88%EC%98%A4	2022/03/11	0	2022-09-30 15:26:25	2022-10-01 16:47:40
BK22012868	9	질문자	그렇다면 핵폭탄 한 개를 만들려면 무엇이 필요하나요?				0	2022-09-30 15:26:25	2022-10-01 16:47:40
BK22012868	10	전문가	한 개의 핵폭탄을 제조하려면 우라늄 235가 20kg 이 요구되는데, 이것을 위해서는 천연 우라늄이 3.5톤이 필요해요.	우라늄 레이저 농축법	https://ko.wikipedia.org/wiki/%EC%9A%B0%EB%9D%BC%EB%8A%84_%EB%A0%88%EC%9D%B4%EC%A0%80_%EB%86%8D%EC%B6%95%EB%B2%95	2022/06/19	0	2022-09-30 15:26:25	2022-10-01 16:47:40
BK22012868	11	질문자	제2차 세계 대전 중 개발이 되었다면, 당시의 나치 독일은 핵 개발을 추진한 적이 없었나요?				0	2022-09-30 15:26:26	2022-10-01 16:47:40
BK22012868	12	전문가	나치 독일도 2차 세계 대전 당시에 우란프로옉트라는 핵 개발 계획이 있었어요.	우란프로옉트	https://ko.wikipedia.org/wiki/%EC%9A%B0%EB%9E%80%ED%94%84%EB%A1%9C%EC%98%89%ED%8A%B8	2022/02/27	0	2022-09-30 15:26:26	2022-10-01 16:47:40
BK22012868	13	질문자	그렇다면 혹시 나치 독일의 동맹이었던 일본도 핵무기 개발 계획을 하고 그 과정이 있었나요?				0	2022-09-30 15:26:26	2022-10-01 16:47:40
BK22012868	14	전문가	제2차 세계대전 동안 일본 제국 역시 핵무기 개발을 추진했었지만 독일이 그랬던 것처럼 제반 사항을 갖추지 못해, 핵무기를 설계하고 개발하는 것이 불가능했어요.	일본의 핵무기 개발	https://ko.wikipedia.org/wiki/%EC%9D%BC%EB%B3%B8%EC%9D%98_%ED%95%B5%EB%AC%B4%EA%B8%B0_%EA%B0%9C%EB%B0%9C	2022/06/19	0	2022-09-30 15:26:26	2022-10-01 16:47:40
BK22012868	15	질문자	제2차 세계대전 중 나치독일과 일본이 핵무기 개발을 성공했더라면, 정말 생각만 해도 아찔하네요.				0	2022-09-30 15:26:26	2022-10-01 16:47:40
BK22012868	16	전문가	그래서 비핵보유국이 핵무기를 갖는 것을 막고 보유국이 비보유국에 핵무기를 제공할 수 없도록 규정한 핵무기의 비확산에 관한 조약, 줄여서 핵확산 금지조약이 생겼어요.	핵확산방지조약	https://ko.wikipedia.org/wiki/%ED%95%B5%ED%99%95%EC%82%B0%EB%B0%A9%EC%A7%80%EC%A1%B0%EC%95%BD	2022/07/23	0	2022-09-30 15:26:26	2022-10-01 16:47:40
BK22012868	17	질문자	하지만 북한도 핵 개발을 사실상 완료하였잖아요.				0	2022-09-30 15:26:26	2022-10-01 16:47:40
BK22012868	18	전문가	국제적인 협약을 무시하고 강행한 것이죠.				0	2022-09-30 15:26:26	2022-10-01 16:47:40
BK22012868	19	질문자	무기가 아닌 안전하게 사용이 된다면 좋은 에너지원일 텐데 안타깝네요.				0	2022-09-30 15:26:26	2022-10-01 16:47:40
BK22012868	20	전문가	발전용도로 사용한다고 하여도, 현재는 폐기물에 대한 문제도 아직 남아 있어요.				0	2022-09-30 15:26:26	2022-10-01 16:47:40
BK22012868	21	질문자	그렇군요, 자세한 설명 감사합니다.				1	2022-09-30 15:26:26	2022-10-01 16:47:40
