id	utterance_id	role	text	search_query	search_URL	reference_date	terminate	regDate	updDate
BK22006986	1	질문자	아빠가 편백나무에 대해서 좀 알아보라고 하는데, 혹시 편백나무에 대해서 잘 아세요?				0	2022-08-31 17:08:15	2022-08-31 17:08:15
BK22006986	2	전문가	네, 잘 알죠. 편백나무는 상록교목에 속하고 노송나무 또는 회목이라고도 불리워요. 원산지는 일본으로 30~40센티미터 정도까지 자라고, 폭은 1~2미터 정도 돼요. 나무 껍질은 적갈색을 띄고, 잎 모양은 작은 바늘처럼 생겼는데 가지에 아주 빽빽하게 붙어 있어요. 그런데, 아버님이 왜 알아보라고 하신거에요?	편백	https://ko.wikipedia.org/wiki/%ED%8E%B8%EB%B0%B1	2022/02/27	0	2022-08-31 17:08:15	2022-08-31 17:08:15
BK22006986	3	질문자	아빠가 요즘 건강이 좀 안좋아지셨는데 그 나무가 건강에 좋다고 들으셨대요. 편백나무가 진짜 건강에 좋아요?				0	2022-08-31 17:08:15	2022-08-31 17:08:15
BK22006986	4	전문가	그러셨군요. 편백나무는 음이온과 피톤치드 성분을 일반 수목에 비해 5배나 많이 방출 하고 있어서 건강에 여러 가지 좋은 효과가 있어요. 스트레스를 해소해주기도 하고 심신안정에도 도움이 되며, 아토피와 같은 각종 환경성질환을 치유하는데에도 효과가 있죠.	편백나무 건강	http://www.kwangju.co.kr/article.php?aid=1650433500737146144	2022/04/20	0	2022-08-31 17:08:15	2022-09-05 23:54:28
BK22006986	5	질문자	아, 피톤치드라는 성분이 건강에 좋은 영향을 주는가보네요. 피톤치드라는 성분이 구체적으로 뭘 말하는거에요?				0	2022-08-31 17:08:15	2022-08-31 17:08:15
BK22006986	6	전문가	Phytoncide라는 말은 그리스어의 식물을 뜻하는 phyton과 라틴어에 있는 죽인다는 것을 의미하는 cide를 합해서 새롭게 만들어진 단어에요. 즉, 단어가 의미하는 것은 식물로부터 방출되어 다른 생물을 죽이는 물질이라는 뜻인데, 현재는 생리활성은 물론, 식물이 방출해내는 비휘발성과 휘발성 물질을 모두 포함해서 말해요.	피톤치드	https://www.woodkorea.co.kr/news/articleView.html?idxno=60099	2022/07/21	0	2022-08-31 17:08:15	2022-09-05 23:54:28
BK22006986	7	질문자	결국 피톤치드는 식물이 자기를 방어 하려고 내뿜어서 항균 효과가 있다는 건데, 이것이 사람들에게까지 이로운 효과를 주는거군요. 피톤치드가 많은 편백나무는 주로 어느 지역에 많이 있어요?				0	2022-08-31 17:08:15	2022-08-31 17:08:15
BK22006986	8	전문가	편백은 추위에 약해서 중부지방 이북에 심을 경우, 동해를 입기 쉬워서 제대로 생육을 하려면 따뜻한 온난대 기후 지역에 심어야 해요. 우리나라에는 주로 제주도와 남부지방에 많이 분포 되어 있어요.	편백나무 분포	https://newsis.com/view/?id=NISX20200602_0001044729&cID=10812&pID=10800	2020/06/02	0	2022-08-31 17:08:15	2022-08-31 17:08:15
BK22006986	9	질문자	편백이 따뜻한 곳에서 잘 자라는 식물이군요. 그래도 건강에 좋다면 다른 곳도 심을 것 같은데, 혹시 중부지방 위로는 편백숲이 아예 없어요?				0	2022-08-31 17:08:15	2022-08-31 17:08:15
BK22006986	10	전문가	아주 정확히 잘 짚으셨어요. 현재 피톤치드가 건강에 좋다는 장점 때문에, 산의 주인들과 지방자치단체들이 지역 상관없이 편백나무를 가장 선호해서 중부나 북부지방까지도 편백나무가 심어지고 있고 치유 공간 등으로 조성 하고 있어요.	편백나무 분포	https://newsis.com/view/?id=NISX20200602_0001044729&cID=10812&pID=10800	2020/06/02	0	2022-08-31 17:08:15	2022-08-31 17:08:15
BK22006986	11	질문자	원래, 건강에 좋다고 하면 사람들이 물불 가리지 않잖아요. 실패 하더라도 막 심을 것 같은데, 그러면 편백나무 자라는 곳이 엄청 많이 늘어났겠네요.				0	2022-08-31 17:08:15	2022-08-31 17:08:15
BK22006986	12	전문가	네, 산림청에서 발표한 통계를 보면, 편백나무를 심은 면적이 2008년에는 1622ha였던 것이 2018년에는 5746ha로 증가했어요.	편백나무 면적	https://newsis.com/view/?id=NISX20200602_0001044729&cID=10812&pID=10800	2020/06/02	0	2022-08-31 17:08:15	2022-08-31 17:08:15
BK22006986	13	질문자	역시 그럴 것 같았어요. 만약에 편백 숲 가게 되면 저희는 웬만하면 중부 아래 쪽으로 가야겠어요. 잘 자란 편백이 삼림욕 효과도 좋을 것 같아요.				0	2022-08-31 17:08:15	2022-09-05 22:15:53
BK22006986	14	전문가	그러세요, 중부 아래 쪽이 서울에서 좀 거리가 있더라도 마음 편한 곳으로 가야죠.				0	2022-08-31 17:08:15	2022-09-05 23:54:28
BK22006986	15	질문자	맞아요, 그런데 편백이 좋고 마음이 편하다고 해서 매 번 편백숲을 갈 수는 없을 것 같은데, 편백나무로 만드는 제품은 따로 없어요?				0	2022-08-31 17:08:22	2022-09-05 22:15:53
BK22006986	16	전문가	시중에 편백을 이용한 다양한 종류의 제품들이 있어요. 스프레이 형태의 편백수도 있고, 편백나무를 이용한 베개와 히노끼 욕조, 편백나무 칩도 있죠. 또, 벽지에도 활용하는데 아토피나 새집증후군 억제에 도움을 주거든요.	편백나무 제품	http://www.dailypop.kr/news/articleView.html?idxno=59028	2022/04/04	0	2022-08-31 17:08:22	2022-08-31 17:08:22
BK22006986	17	질문자	정말 다양한 제품들이 이미 있군요. 다른 제품들은 이해가 잘 가는데 편백나무칩이라는건 뭐에요?				0	2022-08-31 17:08:22	2022-08-31 17:08:22
BK22006986	18	전문가	편백나무칩이라는 제품이 좀 생소하시죠. 편백나무를 손톱 크기 정도로 작게 만들어서 편백나무칩이라고 부르는데, 향주머니에 담아서 방향제로 사용 할 수 있는 제품이에요. 차안이나 벽에 걸어두면 편백나무의 향을 은은하게 느낄 수 있죠.	편백나무 칩	http://www.dailypop.kr/news/articleView.html?idxno=59028	2022/04/04	0	2022-08-31 17:08:22	2022-08-31 17:08:22
BK22006986	19	질문자	나무를 가공해서 작게 만든것에서 향을 느낄 수 있다니 신기하네요. 바로 효과는 없겠지만 일단, 아빠를 위해서 편백나무칩을 선물해드려야겠어요.				0	2022-08-31 17:08:22	2022-08-31 17:08:22
BK22006986	20	전문가	바로 큰 효과가 없더라도 아버님이 정성에 좋아 하시겠어요.				0	2022-08-31 17:08:22	2022-08-31 17:08:22
BK22006986	21	질문자	다, 오늘 많은 정보 알려주신 덕분이죠. 다음에 편백나무 숲 가게 되면 미리 궁금한 점 여쭤봐도 될까요?				1	2022-08-31 17:08:22	2022-09-08 10:29:24
BK22006986	22	전문가	그럼요, 궁금한 것 있으면 언제든지 물어보세요.				0	2022-08-31 17:08:22	2022-08-31 17:08:22
