id	utterance_id	role	text	search_query	search_URL	reference_date	terminate	regDate	updDate
BK22005752	1	질문자	우리나라의 기후는 사계절의 구분이 나타나는 것이 특징이잖아. 그런데 이 사계절의 변화는 왜 나타나는 거야?				0	2022-08-17 14:50:23	2022-08-17 14:50:23
BK22005752	2	전문가	그건 지구의 자전축이 23.5도 기울어진 상태로 태양 주변을 공전하기 때문에 그래. 만약 자전축이 기울어지지 않고 자전과 공전을 했다면 계절의 변화는 없었겠지만, 기울어진 상태로 돌기 때문에 계절에 따라서 태양 빛을 받는 시간과 양이 달라지기 때문이지. 그래서 사계절이 생기는거야.	사계절이 생기는 이유	https://www.sciencetimes.co.kr/news/%EC%95%84%EB%A6%84%EB%8B%B5%EA%B3%A0-%EB%86%80%EB%9D%BC%EC%9A%B4-%EC%A7%80%EA%B5%AC%EC%9D%98-%EC%82%AC%EA%B3%84%EC%A0%88/	2020/06/30	0	2022-08-17 14:50:23	2022-08-25 22:17:58
BK22005752	3	질문자	그렇구나. 그런데 사계절은 무엇을 기준으로 결정 되는 거야? 계절을 나누는 데 어떤 기준이라도 있는건가?				0	2022-08-17 14:50:23	2022-08-25 22:17:58
BK22005752	4	전문가	기상청에서 정해 놓은 봄의 시작은 일 평균 기온이 5도C 이상 올라간 후 다시 떨어지지 않는 첫날이야. 또 여름의 시작은 일 평균기온이 20도C 이상 올라간 후 다시 떨어지지 않는 첫날이고, 가을은 일 평균기온이 20도C미만으로 내려간 후 다시 올라가지 않는 날을 첫날로 규정하고 있지. 마지막으로 겨울의 시작 기준은 일 평균기온이 5도C미만으로 내려간 후 다시 올라가지 않는 첫날이야.	사계절을 구분하는 기준	http://www.newsroad.co.kr/news/articleView.html?idxno=11940	2019/05/17	0	2022-08-17 14:50:23	2022-08-30 09:50:12
BK22005752	5	질문자	아, 그런 기준이 있구나. 그런데 예전에 비하면 우리나라의 사계절 구분이 점점 희미해지는 것 같아. 체감하기로는 여름은 엄청 길고 봄이랑 가을은 짧아진 것 같은데 진짜 그렇게 변한 게 맞아?				0	2022-08-17 14:50:23	2022-08-25 22:24:52
BK22005752	6	전문가	국립기상과학원에서 1912년부터 1941년까지 과거 30년과 1988년부터 2017년까지의 최근 30년을 비교했는데, 봄은 88일에서 85일로, 가을은 73일에서 69일로 조금 감소한 것으로 나타나긴 했어. 하지만 3일에서 4일 정도 줄어든 것을 계절이 짧아졌다는 근거로 보기는 어렵지.	봄과 가을 짧아짐	http://www.newsroad.co.kr/news/articleView.html?idxno=11940	2019/05/17	0	2022-08-17 14:50:23	2022-08-30 09:50:12
BK22005752	7	질문자	고작 그것밖에 차이가 안 난다고? 체감하기로는 훨씬 줄어든 것 같았는데. 그냥 기분탓인거야?				0	2022-08-17 14:50:23	2022-08-25 22:24:52
BK22005752	8	전문가	그건 여름이 길어져서 그래. 국립기상과학원이 과거 30년과 최근 30년간의 여름 길이를 비교했는데, 예전에 98일이었던 것이 최근에는 117일로 늘어났거든. 여름이 길어지니까 봄과 가을의 선선한 날씨를 즐길 시간이 줄어들었다고 느끼기 쉬운 거지.	봄 가을 짧아짐 체감	http://www.newsroad.co.kr/news/articleView.html?idxno=11940	2019/05/17	0	2022-08-17 14:50:23	2022-08-25 22:24:52
BK22005752	9	질문자	아, 여름이 길어지니까 상대적으로 그렇게 느껴지는 거구나. 그럼 겨울은? 여름이 길어진 만큼 겨울도 짧아졌어?				0	2022-08-17 14:50:23	2022-08-25 22:24:52
BK22005752	10	전문가	국립기상과학원에서 같은 기간 동안 겨울의 변화도 조사했는데, 겨울은 109일이었던 것이 91일로 줄어든 것으로 조사되었어. 또 기간의 변화뿐 아니라 겨울철 평균 기온도 상승한 것으로 변화되었어.	겨울 기간 짧아짐	http://www.newsroad.co.kr/news/articleView.html?idxno=11940	2019/05/17	0	2022-08-17 14:50:23	2022-08-25 22:24:52
BK22005752	11	질문자	그래? 어쩐지, 최근 들어 겨울이 어릴 때처럼 그렇게 지독하게 춥다는 느낌이 없더라고. 최근 겨울 기온이 영상권인 날이 많아지지 않았어?				0	2022-08-17 14:50:23	2022-08-25 22:24:52
BK22005752	12	전문가	맞아, 1월에 있는 소한과 대한도 최근에는 영상권일 정도야. 그동안은 1월 후반에 오는 대한이 가장 추운 절기로 여겨졌지만, 이제는 소한이 제일 추운 절기가 되었지. 1월 후반부에 기온 상승이 빨라졌거든.	최근 겨울 기온	https://www.joongang.co.kr/article/24046402#home	2021/04/29	0	2022-08-17 14:50:23	2022-08-25 22:24:52
BK22005752	13	질문자	그래? 그럼 최근 들어와서 어느 정도로 기온이 상승하고 있는 거야?				0	2022-08-17 14:50:23	2022-08-25 22:24:52
BK22005752	14	전문가	1912년에서 1940년까지 기간과 1991년에서 2020년의 가장 최근 30년을 비교해보면 평균기온이 1.6도로 올랐어. 따지고 보면 10년마다 0.2도씩 오르는 추세지.	최근의 기온상승	https://www.joongang.co.kr/article/24046402#home	2021/04/29	0	2022-08-17 14:50:23	2022-08-30 09:50:12
BK22005752	15	질문자	꾸준히 상승한다는 게 너무 걱정스럽다. 아무래도 기후변화로 인한 피해가 인류에게 직접적인 영향을 줄 것 같은데. 혹시 최근에 폭우가 내린 것도 이것과 관련이 있는 건가?				0	2022-08-17 14:50:23	2022-08-25 22:24:52
BK22005752	16	전문가	맞아. 평균기온이 지구온난화로 인해 1도만 상승해도 대기 중의 수증기가 약 7퍼센트나 증가하게 되거든. 그래서 한 번에 쏟아지는 비의 양이 많아지는 현상도 증가하게 되는 거야.	기온상승으로 인한 폭우	https://www.hankookilbo.com/News/Read/A2022081015120005607	2022/08/11	0	2022-08-17 14:50:23	2022-08-25 22:24:52
BK22005752	17	질문자	그렇구나. 그럼 앞으로도 이렇게 기온 상승이 이어지면 강수량도 계속 증가하게 되는 거야?				0	2022-08-17 14:50:23	2022-08-25 22:24:52
BK22005752	18	전문가	그렇지. 국토연구원에서 지난달 발행한 보고서를 보면, 2021년부터 2040년까지 단기적으로는 17.7퍼센트 늘 것으로 보고 있어. 또 2081년부터 2100년까지 장기적으로 보면 20.6퍼센트까지 증가할 것으로 예측되지.	기온 상승으로 인한 강수량 증가	https://www.sedaily.com/NewsView/269QC9IF7H	2022/08/09	0	2022-08-17 14:50:23	2022-08-25 22:24:52
BK22005752	19	질문자	앞으로 계속 강수량이 늘어나게 되는구나. 벌써 지구온난화로 인한 이상기후 현상들도 종종 발생하고 있잖아. 최근에 듣기로는 꿀벌들이 사라지고 있다던데?				0	2022-08-17 14:50:23	2022-08-25 22:24:52
BK22005752	20	전문가	맞아, 전남과 경남 지역에서는 이상기후 현상으로 인해서 기온이 높아지면서 꽃들이 일찍 피어서 꿀벌이 사라지는 이상 현상이 발생하기도 했어. 남부지방 같은 경우는 벌써 아열대기후로 진입하기도 했고.	지구 온난화 이상기후 현상	https://www.sedaily.com/NewsView/269QC9IF7H	2022/08/09	0	2022-08-17 14:50:23	2022-08-25 22:24:52
BK22005752	21	질문자	휴, 이상 징후들이 한둘씩 생겨나고 있는 걸 보니 지구온난화가 계절은 물론이고 우리 생활에도 막대한 영향을 미치고 있다고 느껴지는걸.				0	2022-08-17 14:50:23	2022-08-25 22:24:52
BK22005752	22	전문가	그렇지. 이런 이상 기후 현상이 계속되는 것을 막기 위해서라도 환경에 많은 관심을 가져야 할 것 같아.				0	2022-08-25 22:24:52	2022-08-25 22:24:52
BK22005752	23	질문자	맞아, 우리 모두 이 문제에 대해서 심각하게 생각해야겠어. 오늘 계절과 기후에 관한 대화 여러모로 유익했어, 그럼 다음에 또 보자.				1	2022-08-25 22:24:52	2022-08-30 09:50:12
