id	utterance_id	role	text	search_query	search_URL	reference_date	terminate	regDate	updDate
BK22005668	1	질문자	우연히 조지아 오키프라는 화가의 그림을 봤는데, 너무 좋았어. 조지아 오키프는 미국의 화가인가?				0	2022-08-15 21:48:45	2022-08-15 21:48:45
BK22005668	2	전문가	맞아, 조지아 오키프는 1887년 태어난 미국 화가야. 자연에서 영감을 받아 그림을 그렸던 걸로 유명한 화가지.	조지아 오키프	https://ko.wikipedia.org/wiki/%EC%A1%B0%EC%A7%80%EC%95%84_%EC%98%A4%ED%82%A4%ED%94%84	2022/02/18	0	2022-08-15 21:48:45	2022-10-31 15:41:07
BK22005668	3	질문자	그래, 내가 본 그림도 꽃 그림이었어. 오지아 오키프는 꽃과 자연을 많이 그렸나보구나?				0	2022-08-15 21:48:45	2022-10-31 14:41:57
BK22005668	4	전문가	맞아, 한창 땐 꽃을 그렸고 중년이 되면서는 사막에 뒹구는 동물의 뼈와 사막의 꽃을 그렸어. 그래서 꽃과 사막의 화가라고 불리기도 해.	조지아 오키프 꽃	https://www.vop.co.kr/A00001562746.html	2021/05/09	0	2022-08-15 21:48:45	2022-08-15 21:48:45
BK22005668	5	질문자	그렇구나, 그런데 단순한 꽃그림이라기엔 좀 묘하고 야한 느낌이 들었어.				0	2022-08-15 21:48:45	2022-10-31 14:41:57
BK22005668	6	전문가	오키프의 초창기 꽃 그림들은 여성의 생식기를 닮았고 그래서 그의 작품이 성적인 암시로 가득하다는 평도 자주 있었어.	조지아 오키프 여성성	https://www.vop.co.kr/A00001562746.html	2021/05/09	0	2022-08-15 21:48:45	2022-11-01 08:05:44
BK22005668	7	질문자	그림에 성적인 암시가 있다고 평가받았지만, 실제 화가의 의도이기도 했을까?				0	2022-08-15 21:48:45	2022-10-31 14:41:57
BK22005668	8	전문가	그렇진 않아. 오키프는 여성적이라고 생각해서 꽃을 그렸던게 아니었거든. 그는 우리 주변에 꽃들이 많은데 실제로 꽃을 바라보는 사람은 없다고 말했어. 그리고 자신의 그림을 통해 아주 바쁜 뉴요커까지도 꽃을 진정으로 바라볼 수 있는 시간을 갖게 하기 위해서 꽃그림을 그렸다고 설명했어.	조지아 오키프 꽃그림	http://www.ccdn.co.kr/news/articleView.html?idxno=586428#09SX	2019/07/21	0	2022-08-15 21:48:45	2022-10-31 14:41:57
BK22005668	9	질문자	그렇구나, 생전에 다작을 했다고 하던데, 혹시 조지아 오키프 그림이 있는 미술관도 있을까?				0	2022-08-15 21:48:45	2022-10-31 14:41:57
BK22005668	10	전문가	응, 조지아 오키프는 99세로 사망하기 전까지 정말 많은 작품을 남겼는데, 그 작품들을 모은 미술관은 뉴멕시코 쪽에 만들어졌지.	조지아 오키프 미술관	http://www.ccdn.co.kr/news/articleView.html?idxno=586428#09SX	2019/07/21	0	2022-08-15 21:48:45	2022-11-01 14:34:55
BK22005668	11	질문자	아, 내가 잘 몰라서 그러는데 조지아 오키프 미술관이 있다는 뉴멕시코도 미국땅인가?				0	2022-08-15 21:48:45	2022-10-31 14:41:57
BK22005668	12	전문가	맞아, 뉴멕시코주는 미국의 남서부에 위치한 주야.	뉴멕시코	https://ko.wikipedia.org/wiki/%EB%89%B4%EB%A9%95%EC%8B%9C%EC%BD%94%EC%A3%BC	2022/07/06	0	2022-08-15 21:48:45	2022-08-15 21:48:45
BK22005668	13	질문자	뉴멕시코는 나에겐 좀 낯선 곳이다. 왜 뉴멕시코에 미술관이 지어진거야?				0	2022-08-15 21:48:45	2022-10-31 14:41:57
BK22005668	14	전문가	오키프가 1929년 무렵부터 뉴욕과 뉴멕시코를 오가면서 작품활동을 했거든. 그리고 1946년부터는 뉴멕시코 산타페로 완전히 이주해서 거의 은둔하며 작품활동을 했어.	조지아 오키프 뉴멕시코	https://www.hankookilbo.com/News/Read/202003021431746844	2020/03/06	0	2022-08-15 21:48:45	2022-11-01 14:34:55
BK22005668	15	질문자	그랬구나, 조지아 오키프가 몇 년도에, 몇 살에 사망했는지도 혹시 알아?				0	2022-08-15 21:48:45	2022-10-31 14:41:57
BK22005668	16	전문가	1986년, 한국 최초의 아시안 게임이 열렸던 해이기도 하지. 그리고 오키프는 우리나이로 100세에 사망했어.	조지아 오키프 사망	https://www.vop.co.kr/A00001562746.html	2021/05/09	0	2022-08-15 21:48:45	2022-08-15 21:48:45
BK22005668	17	질문자	와, 장수하며 작품활동을 해서 작품을 많이 남겼구나.				1	2022-08-15 21:48:45	2022-11-01 14:34:55
BK22005668	18	전문가	맞아, 그는 정말 대단하지?				0	2022-08-15 21:48:45	2022-10-31 14:41:57
BK22005668	19	질문자	응, 나이대별로 작품을 분류해서 보면 더 재밌을 것 같다. 심리나 상태에 대한 변화도 보이고.				0	2022-08-15 21:48:45	2022-10-31 14:41:57
BK22005668	20	전문가	네가 조지아 오키프 작품이 정말 흥미로웠나보구나. 또 궁금한 게 있으면 물어봐.				0	2022-08-15 21:48:45	2022-10-31 14:41:57
BK22005668	21	질문자	응, 고마워. 또 궁금한 게 생기면 물어볼게. 조지아 오키프에 대해 이야기 해줘서 고마워!				0	2022-08-15 21:48:45	2022-10-31 14:41:57
