id	utterance_id	role	text	search_query	search_URL	reference_date	terminate	regDate	updDate
BK22008660	1	질문자	반도체에 대해서 공부하고 있는데 도와줄래? 반도체라는 게 무엇인지 간단히 설명해줘.				0	2022-09-16 16:40:42	2022-09-16 16:40:42
BK22008660	2	전문가	상온의 전기 전도율이 구리의 전기 전도율인 도체와 애자, 유리 같은 부도체의 중간 정도인 물질을 반도체라고 해. 가해지는 열, 빛의 파장, 전압 등으로 전도도가 바뀌고, 매우 낮은 온도에서는 부도체처럼 동작하고 실온에서는 도체처럼 동작하는 특징이 있어.	반도체	https://ko.wikipedia.org/wiki/%EB%B0%98%EB%8F%84%EC%B2%B4	2022/06/04	0	2022-09-16 16:40:42	2022-09-16 16:40:42
BK22008660	3	질문자	도체와 부도체를 오가는 물체라니 정말 놀랍다. 반도체는 어떻게 만들어 지는 거야?				0	2022-09-16 16:40:42	2022-09-16 16:40:42
BK22008660	4	전문가	반도체는 웨이퍼 제조 공정, 산화 공정, 포토 공정, 식각 공정, 증착-이온주입 공정, 금속배선공정, EDS 공정, 패키징 공정을 통해 만들어져. 이걸 반도체 8대 공정이라고 하지.	반도체 8대 공정	https://www.youthdaily.co.kr/news/article.html?no=108932	2022/08/20	0	2022-09-16 16:40:42	2022-09-16 16:40:42
BK22008660	5	질문자	8단계로 제조 방법을 요약할 수 있구나. 8대 공정에 대해 자세히 정리하고 싶은데 모르는 용어도 많고 오늘은 각각의 단계가 어떤 것인지만 간단히 알면 좋을 것 같아. 먼저 웨이퍼라는 게 뭘까?				0	2022-09-16 16:40:42	2022-09-16 16:40:42
BK22008660	6	전문가	실리콘, 갈륨 아세나이드 등을 성장시켜 만든 단결정 기둥을 적당한 두께로 얇게 썰어놓은 원판을 웨이퍼라고 해. 웨이퍼는 반도체의 기반으로 웨이퍼의 얇은 기판 위에 다수의 동일 회로를 만들면 반도체 직접회로가 만들어져. 참고로 반도체 집적회로라는 건 많은 소자가 하나의 칩 안에 집적한 전자부품인데 다양한 기능을 처리하고 저장할 수 있어.	웨이퍼	https://semiconductor.samsung.com/kr/support/tools-resources/fabrication-process/eight-essential-semiconductor-fabrication-processes-part-1-what-is-a-wafer/	2017/04/06	0	2022-09-16 16:40:42	2022-09-16 16:40:42
BK22008660	7	질문자	반도체의 기반이니까 1단계에 웨이퍼 제조가 먼저 되구나. 산화 공정이라는 건 어떤 걸까?				0	2022-09-16 16:40:42	2022-09-16 16:40:42
BK22008660	8	전문가	반도체 제조과정은 미세한 공정을 다루기 때문에 아주 작은 불순물도 집적회로의 전기적 특성에 엄청난 영향을 끼쳐. 이때 산화공정에서 만들어진 산화막이 반도체 제조과정에서 보호막의 역할을 하지. 산화공정에서는 웨이퍼에 산화막을 형성하는데 산화막은 절연막 역할을 해 회로와 회로사이에 누설전류가 흐르는 것을 차단할 수 있어. 산화막은 식각공정에서 식각 방지막 역할도 해 필요한 부분이 잘못 식각되는 것을 막고, 이온주입공정에서는 확산을 방지하는 역할을 하지.	산화 공정	https://semiconductor.samsung.com/kr/support/tools-resources/fabrication-process/eight-essential-semiconductor-fabrication-processes-part-2-oxidation-to-protect-the-wafer/	2017/06/05	0	2022-09-16 16:40:42	2022-09-16 16:40:42
BK22008660	9	질문자	절연막으로 산화막을 사용하는 이유가 궁금한 걸? 다음에 알아봐야 겠어. 포토 공정은 어떤 걸까?				0	2022-09-16 16:40:42	2022-09-16 16:40:42
BK22008660	10	전문가	포토공정은 Photo Lithography를 줄여 말하는 거야. 웨이퍼 위에 회로 패턴이 담긴 마스크 상을 빛을 비춰 회로를 그리기 때문에 붙여진 이름이지. 반도체는 집적도가 증가할수록 칩을 구성하는 단위 소자도 미세 공정을 통해 정말 작게 만들어야 해. 이에 따라 집적도가 높아질수록 세심하고 높은 수준의 포토 공정 기술을 필요로 하는데 미세 회로 패턴 구현은 포토 공정에서 결정되기 때문이야.	포토공정	https://semiconductor.samsung.com/kr/support/tools-resources/fabrication-process/eight-essential-semiconductor-fabrication-processes-part-4-photolithography-laying-the-blueprint/	2022/09/22	0	2022-09-16 16:40:42	2022-09-27 11:53:33
BK22008660	11	질문자	웨이퍼 위에 회로를 그리는 작업이라니 신기하다. 식각공정은 어떤 거야?				0	2022-09-16 16:40:43	2022-09-16 16:40:43
BK22008660	12	전문가	포토공정 다음 부터는 필요한 회로 패턴을 제외한 나머지 부분을 제거하는 공정이 이루어져. 식각공정의 경우에는 반도체 회로 패턴을 만드는 공정인데, 부식과 같은 화학작용을 이용해 이미지를 만드는 판화의 에칭 기법과 유사하지. 액체나 기체 형태의 부식액을 이용해 웨이퍼의 불필요한 부분을 선택적으로 제거하고 반도체 회로 패턴을 만들지.	식각공정	https://semiconductor.samsung.com/kr/support/tools-resources/fabrication-process/eight-essential-semiconductor-fabrication-processes-part-5-etching-a-circuit-pattern/	2018/01/04	0	2022-09-16 16:40:43	2022-09-16 16:40:43
BK22008660	13	질문자	부식액의 원료가 궁금한데 다음에 알아봐야 겠어. 증착, 이온주입 공정은 어떤거야?				0	2022-09-16 16:40:43	2022-09-16 16:40:43
BK22008660	14	전문가	증착은 웨이퍼 위에 원하는 분자나 원자 단위의 박막을 입히는 과정을 말해. 증착공정을 통해 웨이퍼 위에 형성된 박막은 크게 두 가지로 구분돼. 하나는 회로들 간 전기적인 신호를 연결해주는 금속막층이고 다른 하나는 절연막층인데, 절연막층은 내부 연결층을 전기적으로 분리하거나 오염원으로부터 차단시켜주지. 이때 반도체가 전기적 성질을 가지게 하는 공정이 필요한데, 이온주입공정이 반도체의 생명을 불어넣는 작업이라고 볼 수 있지.	이온주임 공정	https://semiconductor.samsung.com/kr/support/tools-resources/fabrication-process/eight-essential-semiconductor-fabrication-processes-part-6-deposition-and-ion-implantation-for-the-electrical-properties/	2018/02/22	0	2022-09-16 16:40:43	2022-09-16 16:40:43
BK22008660	15	질문자	다음에 이온주입공정의 원리를 공부해보고 싶어. 이어서 금속 배선 공정에 대해서 설명해줘.				0	2022-09-16 16:40:43	2022-09-16 16:40:43
BK22008660	16	전문가	반도체 회로는 포토, 식각, 이온주입, 증착 공정을 반복해 수많은 회로로 만들어져. 반도체 회로가 동작하기 위해서는 외부의 전기적 신호를 필요로 하는데, 이 신호가 잘 전달되도록 하는 것이 금속 배선 공정이라고 해. 금속 배선 공정은 반도체 회로 패턴에 따라 전기길인 금속선을 연결하는 작업이야.	금속 배선 공정	https://semiconductor.samsung.com/kr/support/tools-resources/fabrication-process/eight-essential-semiconductor-fabrication-processes-part-7-metal-interconnects-electrical-highways/	2018/03/19	0	2022-09-16 16:40:43	2022-09-27 11:53:33
BK22008660	17	질문자	흔히 전자기기에서 전기 신호를 받기 위한 부분은 밖에 나와 있어서 그런 작업은 마지막이라고 생각했는데 놀랍다. EDS 공정은 어떤 거야?				0	2022-09-16 16:40:43	2022-09-27 11:53:33
BK22008660	18	전문가	EDS공정은 전기적 특성검사를 통해 개별 칩들이 목표하는 품질 수준에 도달했는지를 확인하는 과정이야. FAB 공정과 최종적인 제품의 형태를 갖추는 패키지 공정 사이에 진행되지. 참고로 FAB 공정이라는 것은 웨이퍼 위에 전자회로를 그리는 공정이야. EDS공정은 반도체의 수율을 높이는데 중요한 역할을 해. 수율이라는 것은 웨이퍼 한 장에 설계된 최대 칩 개수 대비 생산된 양품 칩의 개수를 백분율로 계산한 것을 말하는데, 이건 반도체의 생산성과 직결되어 있지.	EDS 공정	https://semiconductor.samsung.com/kr/support/tools-resources/fabrication-process/eight-essential-semiconductor-fabrication-processes-part-8-eds-electrical-die-sorting-for-the-perfect-chips/	2018/05/09	0	2022-09-16 16:40:43	2022-09-16 16:40:43
BK22008660	19	질문자	점검 과정이라고 생각하면 되겠다.				0	2022-09-16 16:40:43	2022-09-16 16:40:43
BK22008660	20	전문가	반도체 직접회로인 반도체 칩을 기판이나 전자기기에 장착하기 위해서는 여기에 맞는 포장이 필요한데, 이때 패키징은 반도체 칩과 외부 사이에서 신호를 주고 받을 수 있도록 길을 만들고 외부환경에서 발생할 수 있는 다양한 위험으로부터 안전하게 보호받는 형태로 만드는 과정을 말해. 요약하면 패키징 공정이라는 것은 고온, 고습, 화학약품, 진동이나 충격 같은 외부환경으로부터 회로를 보호하고 집적회로와 전자기기를 연결하기 위한 과정이야.	패키징 공정	https://semiconductor.samsung.com/kr/support/tools-resources/fabrication-process/eight-essential-semiconductor-fabrication-processes-part-9-packaging-to-protect-the-chips-from-external-elements/	2018/10/18	0	2022-09-16 16:40:43	2022-09-16 16:40:43
BK22008660	21	질문자	반도체의 8대 공정 중 어느 하나도 중요하지 않은 게 없는 것 같아. 오늘 덕분에 많은 것을 알게 되었어. 정말 고마워.				0	2022-09-16 16:40:43	2022-09-16 16:40:43
BK22008660	22	전문가	다음에는 더 자세히 알아보면 좋을 것 같아. 그럼 내일 보자.				1	2022-09-16 16:40:43	2022-09-27 11:53:33
