id	utterance_id	role	text	search_query	search_URL	reference_date	terminate	regDate	updDate
BK22011645	1	질문자	나 요즘 임용고시를 준비할까 싶은 생각이 들어. 넌 임용고시에 대해 알고 있니?				0	2022-09-26 01:26:42	2022-09-26 03:27:05
BK22011645	2	전문가	국공립학교의 교사를 선발하기 위해 실시하는 임용시험 말하는 거지? 시험을 통해 유치원교사, 초등교사, 중등교사를 선발하잖아.	임용고시	https://ko.wikipedia.org/wiki/%EB%8C%80%ED%95%9C%EB%AF%BC%EA%B5%AD%EC%9D%98_%EA%B5%90%EC%82%AC%EC%9E%84%EC%9A%A9%EC%8B%9C%ED%97%98	2022/02/09	0	2022-09-26 01:26:42	2022-09-26 02:08:02
BK22011645	3	질문자	맞아, 그런데 시험 응시를 위한 자격 요건이 까다로운 것 같더라. 유치원교사 임용고시를 응시하기 위한 자격 요건은 뭐야?				0	2022-09-26 01:26:42	2022-09-26 03:27:05
BK22011645	4	전문가	유아 임용고시를 통해 유치원 교사 자격을 얻기 위해서는 유치원 정교사 2급 자격증을 취득해야 해. 이 자격증을 취득하려면, 전문대나 일반대에 개설되어 있는 유아교육과나 유아교육학과를 졸업해야 해. 일반대는 유아교육과를 나오지 않더라도, 교직 이수 과정을 거치면 자격증을 받을 수 있어.	유아 임용 자격	https://news.unn.net/news/articleView.html?idxno=501773	2020/12/23	0	2022-09-26 01:26:42	2022-09-26 03:27:05
BK22011645	5	질문자	거의 유아교육학과를 나온 학생들이 응시하는 경우가 많겠구나. 그러면 초등학교 교사임용시험에 응시하려면 무슨 자격이 필요하니?				0	2022-09-26 01:26:42	2022-09-26 03:27:05
BK22011645	6	전문가	전국의 교육대학을 졸업하거나, 한국교원대학교나 제주대학교, 이화여자대학교에 개설되어 있는 초등교육과를 졸업해서 초등 정교사 2급 자격증을 취득한 상태여야 해. 그리고 초등과 중등 임용시험은 둘 다 정교사 2급 자격증 뿐만 아니라 3급 이상의 한국사능력검정자격도 필요해.	초등 임용 자격	https://ko.wikipedia.org/wiki/%EB%8C%80%ED%95%9C%EB%AF%BC%EA%B5%AD%EC%9D%98_%EA%B5%90%EC%82%AC%EC%9E%84%EC%9A%A9%EC%8B%9C%ED%97%98	2022/02/09	0	2022-09-26 01:26:42	2022-09-26 03:27:05
BK22011645	7	질문자	초등교육과가 개설되어 있는 학교가 몇 개 없으니, 주로 교육대학을 졸업한 학생들이 응시하겠어. 그러면 중등 임용고시에 응시하려면 어떤 자격이 있어야 해?				0	2022-09-26 01:26:42	2022-09-26 03:27:05
BK22011645	8	전문가	한국교원대에서 초등교육과를 제외하고 일정한 교육과정을 이수하거나, 사범대학에서 교육과정을 이수하거나, 혹은 일반 대학에서 인가된 교직 과정을 이수함으로써 중등 정교사 2급 자격증을 취득해야 해. 중등 임용고시를 치고 싶지만 관련 전공을 하지 않은 경우에는, 해당하는 전공이 설치된 교육대학원에 진학해서 중등 정교사 2급 자격증을 취득하는 방법도 있어.	중등 임용 자격	https://ko.wikipedia.org/wiki/%EB%8C%80%ED%95%9C%EB%AF%BC%EA%B5%AD%EC%9D%98_%EA%B5%90%EC%82%AC%EC%9E%84%EC%9A%A9%EC%8B%9C%ED%97%98	2022/02/09	0	2022-09-26 01:26:42	2022-09-26 03:27:05
BK22011645	9	질문자	초등 임용보다 자격을 얻을 수 있는 경로가 더 다양하구나. 시험은 보통 어떻게 진행되는 거야?				0	2022-09-26 01:26:42	2022-09-26 03:27:05
BK22011645	10	전문가	초등과 중등 임용시험을 기준으로 보면, 하루 동안 1차인 이론 시험을 실시한 후 이틀 동안 2차인 실기 시험을 시행하여 총 3일로 구성돼. 이론 시험의 경우, 일반공무원 시험과는 다르게 모두 주관식으로 출제되는 점이 특이해. 실기 시험은 17개 시도교육청에 따라 문항이 달라지지만 수업 실연과 교직적성심층면접은 꼭 포함돼.	임용고시 시험	https://ko.wikipedia.org/wiki/%EB%8C%80%ED%95%9C%EB%AF%BC%EA%B5%AD%EC%9D%98_%EA%B5%90%EC%82%AC%EC%9E%84%EC%9A%A9%EC%8B%9C%ED%97%98	2022/02/09	0	2022-09-26 01:26:42	2022-09-26 03:27:05
BK22011645	11	질문자	전부 주관식이라니 공부하기 힘들 것 같아. 초등 교사 임용의 경우 경쟁률이 어느 정도 돼?				0	2022-09-26 01:26:42	2022-09-26 03:27:05
BK22011645	12	전문가	일반전형을 기준으로, 2019학년도에는 1.79대 1이었고, 2020학년도에는 1.96대 1, 2021학년도에는 2.08대 1, 2022학년도에는 2.20대 1을 기록하면서 경쟁률이 점점 올랐어.	초등 임용고시 경쟁률	http://www.nextplay.kr/news/articleView.html?idxno=1614	2021/10/15	0	2022-09-26 01:26:42	2022-09-26 03:27:05
BK22011645	13	질문자	교대 아니면 특정 학과만 응시할 수 있어서 그런지 경쟁률이 그렇게 높지 않네. 그러면 중등 임용고시는 경쟁률이 어느 정도야?				0	2022-09-26 01:26:42	2022-09-26 03:27:05
BK22011645	14	전문가	2022학년도 일반 모집을 기준으로, 평균 경쟁률은 국어 14.75대 1, 영어 12.7대 1, 수학 10.35대 1로 나타났어.	중등 임용고시 경쟁률	https://www.kunews.ac.kr/news/articleView.html?idxno=33789	2022/05/22	0	2022-09-26 01:26:42	2022-09-26 03:27:05
BK22011645	15	질문자	중등 임용고시는 경쟁률이 훨씬 세서 힘들겠다. 전국에 사범대학이 많을 텐데 실제로 교사가 되는 비율은 얼마나 되는 거야?				0	2022-09-26 01:26:42	2022-09-26 03:27:05
BK22011645	16	전문가	사범대 졸업자 중 실제로 교사가 되는 비율이 20%대에 불과한 것으로 조사됐어. 임용고시에 합격하기도 어렵고, 합격한다고 해도 자리가 부족하기 때문이야.	중등 임용고시 현실	https://www.hankyung.com/society/article/2015051535008	2015/05/15	0	2022-09-26 01:26:42	2022-09-26 03:27:05
BK22011645	17	질문자	5명 중 1명이 교사가 되는 거면 심각하네. 자리가 없다는 건 무슨 말이야?				0	2022-09-26 01:26:42	2022-09-26 03:27:05
BK22011645	18	전문가	각 시도 교육청에서 교육 재정이 부족한 탓에 명예퇴직을 신청하는 교원들을 퇴직시켜 주지 못해서 교원 적체가 심각하거든. 예를 들면, 2014년 하반기에 서울 지역에서 명예퇴직을 신청한 2386명의 교원 중 181명의 신청만 수용되어서 수용률이 고작 7.8%에 불과했어.	교사 자리 없는 이유	https://www.hankyung.com/society/article/2015051535008	2015/05/15	0	2022-09-26 01:26:42	2022-10-04 15:25:15
BK22011645	19	질문자	그런 현실적 문제들이 발생하고 있다니 사범대생들의 수심이 깊겠어. 임용고시 공부하기도 힘들 텐데 그런 문제라도 잘 해결되어야 할 텐데.				0	2022-09-26 01:26:42	2022-09-26 03:27:05
BK22011645	20	전문가	예산 조정이나 관계 부처 협의를 통해 잘 해결되길 바라는 수밖에 없지.				0	2022-09-26 01:26:42	2022-09-26 03:27:05
BK22011645	21	질문자	임용고시 현실이 녹록치 않은 것 같으니, 난 좀 더 고민해보고 진입할지 결정해야겠어.				0	2022-09-26 03:27:05	2022-09-26 03:27:05
BK22011645	22	전문가	그래, 잘 고민해서 신중하게 결정하길 바라.				1	2022-09-26 03:27:05	2022-10-04 15:25:15
