id	utterance_id	role	text	search_query	search_URL	reference_date	terminate	regDate	updDate
BK22001050	1	질문자	요즘 날씨가 따뜻해져서 그런지 슬슬 모기가 한두 마리씩 보이네요. 모기는 주로 한여름에 많아지겠죠? 이번 여름을 잘 넘겨야 할 텐데 벌써 눈에 보이니 걱정이네요.				0	2022-07-20 16:12:53	2022-08-02 12:01:32
BK22001050	2	전문가	모기가 벌써 있어요? 보통 모기의 주된 활동 계절이 여름이라 생각하지만 모기는 겨울이 오기 전까지 활동해요. 7월 8월 보다 9월에 더 왕성해서 가을까지도 모기와의 전쟁을 치러야 해요.	모기 활동시기	https://www.hani.co.kr/arti/society/society_general/1010563.html	2021/09/06	0	2022-07-20 16:12:53	2022-07-21 10:16:02
BK22001050	3	질문자	겨울이 모기로부터 가장 안전한 계절이네요. 제가 모기한테 잘 물리는 체질이라 유난스러운 편이에요. 진짜 모기에게 잘 물리는 체질이 있는 건지 궁금해요.				0	2022-07-20 16:12:53	2022-08-02 12:01:32
BK22001050	4	전문가	모기는 사람이 숨을 쉴 때 내뱉는 이산화탄소를 감지할 수 있는데 사람의 피부 분비샘에서 나오는 젖산 등의 냄새와 화학물질 냄새에 민감하게 반응하죠. 그런 이유로 땀을 많이 흘리는 뚱뚱한 사람, 호흡량이 많은 사람이 모기에 더 잘 물리게 되죠. 그리고 여자는 남자보다 체온이 높고 체취가 강하기 때문에 모기가 좋아하죠.	모기 잘 물리는 사람	https://www.yna.co.kr/view/AKR20190722112500797?input=1195m	2019/08/08	0	2022-07-20 16:12:53	2022-07-21 10:16:02
BK22001050	5	질문자	아, 그런 요소가 있었군요. 집모기에게 물리는 것도 간지러운데 사람에게 치명적인 모기가 따로 있나요?				0	2022-07-20 16:12:53	2022-08-02 12:01:32
BK22001050	6	전문가	전 세계의 3500종의 모기 중 병을 옮기는 치명적인 모기로는 얼룩날개모기, 작은빨간집모기, 그리고 이집트숲모기와 흰술숲모기가 있는데 각각 말라리아, 일본뇌염, 뎅기열과 지카 바이러스 감염증 등을 옮기죠.	질병 매개 모기	http://www.lecturernews.com/news/articleView.html?idxno=74024	2021/08/19	0	2022-07-20 16:12:53	2022-07-21 10:16:02
BK22001050	7	질문자	모기 이름은 굉장히 생소하지만 말라리아, 일본뇌염, 뎅기열은 치명적인 바이러스라고 뉴스에서 봐서 알죠. 바이러스에 걸리면 어떤 증상이 생겨요?				0	2022-07-20 16:12:53	2022-08-02 12:01:32
BK22001050	8	전문가	뎅기열의 경우 뎅기 바이러스 감염으로 고열을 동반하고, 말라리아는 모기가 옮긴 열원충이 인체의 적혈구에 기생하게 되며 열발작, 빈혈 등의 증상이 나타나요.	뎅기열 말라리아 황열	http://www.discoverynews.kr/news/articleView.html?idxno=821599	2022/06/18	0	2022-07-20 16:12:53	2022-07-21 10:16:02
BK22001050	9	질문자	그런데 그런 치명적인 바이러스를 옮기는 모기가 우리나라에도 있어요?				0	2022-07-20 16:12:53	2022-08-02 12:01:32
BK22001050	10	전문가	우리나라에서도 작은빨간집모기가 발견되는데 날씨가 따뜻해지면서 그 시기가 빨라지고 있어요. 그리고 흰줄숲모기는 우리나라에서 알 상태로 월동을 해왔지만 1월 평균기온이 10도를 넘게 되면 성충인 상태로 월동할 수도 있으니 안전하지 않죠.	한국 흰줄숲모기	http://www.chemicalnews.co.kr/news/articleView.html?idxno=4400	2021/12/13	0	2022-07-20 16:12:53	2022-07-21 10:16:02
BK22001050	11	질문자	해외여행만 가지 않으면 된다고 생각했는데 상관없는 문제가 아니군요.				0	2022-07-20 16:12:53	2022-08-02 12:01:32
BK22001050	12	전문가	우리나라뿐 아니라 온난화로 앞으로 전 세계가 모기를 매개로 한 바이러스에 위험할 수 있죠. 혹시 아르보바이러스라고 들어보셨나요? 곤충을 매개로 하는 감염병을 말하는데 세계보건기구에서 아르보바이러스 대책 계획을 발표했고, 모기가 다음 팬데믹을 일으킬 잠재력을 가장 크게 보고 있어요.	아르보바이러스	https://health.chosun.com/site/data/html_dir/2022/04/12/2022041201465.html	2022/04/12	0	2022-07-20 16:12:53	2022-07-21 10:16:02
BK22001050	13	질문자	그렇다면 치명적인 바이러스에 대해 백신이나 치료제가 필요하겠네요. 일본뇌염이랑 뎅기열은 백신이 있나요?				0	2022-07-20 16:12:53	2022-08-02 12:01:32
BK22001050	14	전문가	황열병과 일본뇌염, 뎅기열은 백신이 있지만 이중 뎅기열 백신의 경우 제한된 국가에서만 사용하고 있고, 말라리아 백신은 효과가 뛰어나지 않아요.	아르보바이러스 백신	https://health.chosun.com/site/data/html_dir/2022/04/12/2022041201465.html	2022/04/12	0	2022-07-20 16:12:53	2022-07-21 10:16:02
BK22001050	15	질문자	앞으로 아르보바이러스에 대한 백신 개발이 중요한 과제가 되겠네요. 바이러스를 옮기는 무서운 모기에 비해 집모기, 숲모기가 귀여운 수준이네요.				0	2022-07-20 16:12:53	2022-08-02 12:01:32
BK22001050	16	전문가	그렇지만 이번 집모기, 숲모기와의 전쟁도 잘 대비하세요. 간지러워서 잠을 설치기도 하잖아요.				0	2022-07-20 16:12:53	2022-07-21 10:16:02
BK22001050	17	질문자	잠을 못 잘뿐더러 어떨 때는 모기에 물리면 피부가 많이 붓고 따가워서 아플 때도 있어요.				0	2022-07-20 16:12:53	2022-08-02 12:01:32
BK22001050	18	전문가	남들보다 많이 붓고 화끈거리면 스터키 증후군을 의심해 볼 수 있어요.				0	2022-07-20 16:12:53	2022-07-21 10:16:02
BK22001050	19	질문자	알레르기 양상 처럼 부을 때가 있어요. 스터키 증후군은 왜 생기는 거예요?				0	2022-07-20 16:12:53	2022-08-02 12:01:32
BK22001050	20	전문가	집모기라도 우리가 모기에게 물리면 우리 몸은 모기의 타액을 외부 물질로 인식해 가려움을 유발하는 면역 반응을 유발해서 발생해요. 더욱 모기 퇴치에 노력을 기울이셔야겠어요.	스터키 증후군	https://health.chosun.com/site/data/html_dir/2022/06/03/2022060301165.html	2022/06/05	0	2022-07-20 16:12:53	2022-07-21 10:16:02
BK22001050	21	질문자	네, 그래서 모기장이랑 모기 기피제를 알아보고 있어요. 모기기피제는 몸에 사용하는 제품이라 잘 알아봐야 할 텐데 종류가 굉장히 다양하네요.				0	2022-07-20 16:12:54	2022-08-02 12:01:32
BK22001050	22	전문가	정말 종류가 다양하죠? 선택할 때, 식약처 인증을 통과하지 못한 제품은 안전성과 유효성이 입증되지 않은 공산품이기 때문에 주의하세요. 그리고 모기기피제 성분 중에 효과가 좋은 디에틸톨루아미드 성분은 신경계 부작용 등이 발생할 수 있어 12세 미만 어린이는 함량이 10퍼센트 이하인 제품을 선택하는 게 좋아요.	모기기피제	http://www.bosa.co.kr/news/articleView.html?idxno=2175412	2022/06/15	0	2022-07-20 16:12:54	2022-07-21 10:16:02
BK22001050	23	질문자	아, 알려주신 내용 참고하도록 할게요. 혹시 캣닢이라는 식물 알고 계시나요? 모기 퇴치에 도움이 되는 식물이라고 하는데 처음 들어봐요.				0	2022-07-20 16:12:54	2022-08-02 12:01:32
BK22001050	24	전문가	저는 식물을 좋아해서 알고 있죠. 개박하라고도 불리는 캣닢에는 모기가 싫어하는 네페탈락톤이라는 천연 화학물질이 들어있어 모기를 쫓는 효능이 있어요.	캣닢	https://kormedi.com/1344035/%eb%aa%a8%ea%b8%b0%eb%a5%bc-%ec%9e%90%ec%97%b0%ec%8a%a4%eb%9f%bd%ea%b2%8c-%ed%87%b4%ec%b9%98%ed%95%98%eb%8a%94-%ec%8b%9d%eb%ac%bc-5/	2021/06/30	0	2022-07-20 16:12:54	2022-07-21 10:16:02
BK22001050	25	질문자	캣닢이랑 또 다른 식물도 찾아봐야겠어요. 오늘 도움이 되는 정보 주셔서 너무 감사해요.				0	2022-07-20 16:12:54	2022-08-02 12:01:32
BK22001050	26	전문가	도움이 되었다니 저도 기분이 좋네요. 모기와의 전쟁에서 꼭 살아남으시기 바랄게요.				1	2022-07-20 16:12:54	2022-07-21 15:30:19
