id	utterance_id	role	text	search_query	search_URL	reference_date	terminate	regDate	updDate
BK22013301	1	질문자	얼마 전에 카페를 갔는데, 이제 내부에서는 일회용 컵을 쓸 수 없다고 하더라고요.				0	2022-09-30 15:38:30	2022-10-01 18:32:51
BK22013301	2	전문가	네, 예전과 달리 법이 바뀌어서 그래요.				0	2022-09-30 15:38:30	2022-10-01 18:32:51
BK22013301	3	질문자	어떻게 바뀌었길래 그런지 알려 주실 수 있나요?				0	2022-09-30 15:38:30	2022-10-01 18:32:51
BK22013301	4	전문가	식당, 카페 등 내부에서 일회용 컵과 플라스틱 컵, 플라스틱으로 만든 빨대와 젓는 막대까지 사용이 금지됐어요. 적용 시점은 2018년 11월 24일부터라고 환경부에서 발표했어요.	카페 일회용 컵 규제	donga.com/news/Society/article/all/20220825/115132287/1	2018/08/25	0	2022-09-30 15:38:31	2022-10-01 18:32:51
BK22013301	5	질문자	아, 그럼 이제부터는 텀블러 사용을 생활화해야겠네요. 그런데 텀블러는 잘못 쓰면 악취가 나고 관리가 어렵지 않나요?				0	2022-09-30 15:38:31	2022-10-01 18:32:51
BK22013301	6	전문가	텀블러에 생수를 담는 건 크게 문제가 되지 않는데, 유제품 같은 경우 오래 두면 안에서 부패하면서 악취가 남을 수도 있어요. 또 염분이 있는 음료 같은 경우 텀블러의 내부를 부식시킬 수도 있고, 탄산이 들어간 음료 같은 경우엔 압력 때문에 음료가 밖으로 샐 수도 있어서 피하는 게 좋죠.	텀블러 악취	https://news.sbs.co.kr/news/endPage.do?news_id=N1004894435	2018/08/23	0	2022-09-30 15:38:31	2022-10-01 18:32:51
BK22013301	7	질문자	텀블러 관리하는 법을 잘 알아야겠네요, 커피를 마신 텀블러는 어떻게 세척하는 게 좋나요?				0	2022-09-30 15:38:31	2022-10-01 18:32:51
BK22013301	8	전문가	커피나 음료를 마신 텀블러에는 기름때 같은 게 낄 수 있는데, 이럴 때는 베이킹소다를 한 숟갈 넣고 뜨거운 물을 담아서 한 시간 정도 내버려 두었다가 씻으면 돼요.	텀블러 베이킹소다	https://health.chosun.com/site/data/html_dir/2022/08/01/2022080101790.html	2022/08/02	0	2022-09-30 15:38:31	2022-10-01 18:32:51
BK22013301	9	질문자	아하, 만약 텀블러 안에 녹이 슬거나 하면 어떻게 세척해야 해요?				0	2022-09-30 15:38:31	2022-10-01 18:32:51
BK22013301	10	전문가	오래 사용한 텀블러의 내부가 녹이 슬었을 경우에는 식초와 미온수를 1대 9 비율로 섞은 다음, 30분 기다렸다가 헹구면 괜찮아져요.	텀블러 녹	https://health.chosun.com/site/data/html_dir/2021/10/25/2021102501547.html	2021/10/26	0	2022-09-30 15:38:31	2022-10-01 18:32:51
BK22013301	11	질문자	텀블러의 상태에 따라 닦는 방법이 가지각색이네요. 저는 주로 아메리카노를 마셔서 변색이 잘 되던데, 이런 경우엔 어떻게 세척하나요?				0	2022-09-30 15:38:31	2022-10-01 18:32:51
BK22013301	12	전문가	이럴 때 텀블러 세척 방법은 미온수와 구연산을 10g 넣은 다음 3시간 정도 기다리면 본래 색으로 돌아와요. 이때 텀블러의 뚜껑은 열어 두어야 하고요.	텀블러 세척	https://www.hidoc.co.kr/healthstory/news/C0000460184	2019/04/18	0	2022-09-30 15:38:31	2022-10-01 18:32:51
BK22013301	13	질문자	만약, 이렇게 세척을 했는데도 냄새가 나거나 할 때는 어떻게 해야 해요?				0	2022-09-30 15:38:31	2022-10-01 18:32:51
BK22013301	14	전문가	이런 경우에는 텀블러 소독을 해 주면 좋은데요. 금속제일 경우에는 30초 이상 열탕소독을 하면 되고, 플라스틱 재질이나 고무가 사용된 물병인 경우에는 알코올 혹은 살균소독제를 용량에 맞게 사용해 소독하면 돼요.	텀블러 소독	https://kormedi.com/1340434/%EB%AC%BC%EB%B3%91%EC%97%90%EC%84%9C-%EB%83%84%EC%83%88%EA%B0%80-%EC%94%BB%EA%B3%A0-%EA%B1%B4%EC%A1%B0%EA%B9%8C%EC%A7%80-%ED%95%B4%EC%95%BC-%EC%B2%AD%EC%86%8C-%EB%81%9D/	2021/05/28	0	2022-09-30 15:38:31	2022-10-01 18:32:51
BK22013301	15	질문자	아하, 텀블러 소독하는 방법도 있군요. 또 텀블러 사용 시 주의해야 할 사항이 있나요?				0	2022-09-30 15:38:31	2022-10-01 18:32:51
BK22013301	16	전문가	우선 텀블러 세척이 끝나면 물기를 아예 제거해야 세균이 생기질 않아요. 또 6개월에서 8개월 정도 사용한 텀블러는 아무리 깨끗하게 썼다고 하더라도 교체해주는 게 좋아요. 텀블러 교체 시기는 2년을 넘기지 않는 게 좋고요.	텀블러 교체 시기	https://health.chosun.com/site/data/html_dir/2022/08/01/2022080101790.html	2022/08/02	0	2022-09-30 15:38:31	2022-10-01 18:32:51
BK22013301	17	질문자	아하, 그럼 텀블러랑 같이 사용하는 다회용 빨대 세척도 마찬가지 방법을 사용하면 되나요?				0	2022-09-30 15:38:31	2022-10-01 18:32:51
BK22013301	18	전문가	빨대 세척의 경우에는 크기에 맞는 솔에 세제를 묻혀서 내부를 닦고 수세미로 외부를 닦은 다음에 따뜻한 물로 세척하면 돼요. 세척이 끝나면 완전히 빨대가 마를 수 있도록 세워 두어야 해요.	빨대 세척	https://www.hidoc.co.kr/healthstory/news/C0000664468	2022/02/07	0	2022-09-30 15:38:32	2022-10-01 18:32:51
BK22013301	19	질문자	매번 세척하는 게 귀찮긴 하지만, 방법을 알았으니 텀블러 들고 다니기를 실천해야겠어요.				0	2022-09-30 15:38:32	2022-10-01 18:32:51
BK22013301	20	전문가	네, 환경을 위해 우리 모두 노력해 봐요.				1	2022-09-30 15:38:32	2022-10-01 18:32:51
