id	utterance_id	role	text	search_query	search_URL	reference_date	terminate	regDate	updDate
BK22004342	1	질문자	며칠 전에 미국에서 총기난사범을 제압한 시민을 두고 말이 많은 것 같아.				0	2022-08-04 11:38:33	2022-08-18 11:37:38
BK22004342	2	전문가	맞아, 위험을 무릅 쓴 시민의 행동이 더 큰 참사를 막아낸 착한 사마리안이라고 찬사를 하는 부류가 있는 반면, 이번 일로 인해서 민간인이 더욱 총기로 무장하게 되어 오히려 총기 규제를 막게 될 거란 우려도 나오고 있어.	총기난사 민간인제압	https://www.yna.co.kr/view/AKR20220719057300009?input=1195m	2022/07/19	0	2022-08-04 11:38:33	2022-08-18 11:37:38
BK22004342	3	질문자	정말 딜레마다. 나 같아도 만일의 사태를 대비해서 총기를 더욱 소지하려고 할 것 같아. 사람을 살리는 총이 될 수도 있으니까.				0	2022-08-04 11:38:33	2022-08-18 11:37:38
BK22004342	4	전문가	하지만 실제로 이번처럼 민간인이 총기난사범을 제압하는 사례는 극히 드물어. 로이터 통신은 연방수사국의 5월 보고에 따르면 작년에 발생한 총기난사 사건 61건 중에서도 무장시민이 개입하여 총격범을 저지한 경우는 2건 정도로 3퍼센트밖에 안 된다고 발표했어.	민간인 총기제압	https://www.yna.co.kr/view/AKR20220719057300009?input=1195m	2022/07/19	0	2022-08-04 11:38:33	2022-08-22 10:19:21
BK22004342	5	질문자	정말 극히 드문 수치이긴 하다. 미국은 지금 총기규제법 통과를 준비하고 있다고 들었어. 맞지?				0	2022-08-04 11:38:33	2022-08-06 15:52:26
BK22004342	6	전문가	응, 맞아. 5월 24일 텍사스주의 초등학교에서 있었던 총기 난사사건 기억나? 그때 어린이 19명, 교사 2명의 무고한 생명이 희생되었어. 그 때 이후로 미국내 총기 규제 목소리가 커졌고, 규제안도 내놓은 상황이야.	미국 총기규제법	https://www.sisain.co.kr/news/articleView.html?idxno=47780	2022/07/02	0	2022-08-04 11:38:33	2022-08-22 10:19:21
BK22004342	7	질문자	그 뉴스 보고 얼마나 마음이 아팠는지 몰라. 총기 규제법의 내용은 어때? 무조건 소지 불가는 아니지 않아?				0	2022-08-04 11:38:33	2022-08-06 15:52:26
BK22004342	8	전문가	응, 그건 아니고 21세 이하의 총기 구매자의 신원 조회를 강화하자는 내용과, 잠재적 위험 인물의 경우에 법원이 총기 소유를 금지하게끔 하는 내용이야.	미국 총기규제법 내용	https://www.sisain.co.kr/news/articleView.html?idxno=47780	2022/07/02	0	2022-08-04 11:38:33	2022-08-22 10:19:21
BK22004342	9	질문자	모든 사람들에게 소지를 막을 수 없으니 그렇게라도 되면 좋겠다. 법안이 통과 가능 할까?				0	2022-08-04 11:38:33	2022-08-06 15:52:26
BK22004342	10	전문가	아니, 이번에도 반대파로 인하여 법안통과가 어려울 거라고 예상되는 게 2012년 코네티컷주 샌디훅 초등학교에서 총기 난사 사건이 발생한 후 미 상원은 가족 간 구매를 제외하고 모든 총기 구매 시 신원조회를 확대하는 내용의 법안에 초당적으로 합의를 하였지만, 소수파의 반대로 법안통과가 무산된 적이 있어.	미국 총기 규제법 여론	https://www.etoday.co.kr/news/view/2137823	2022/05/26	0	2022-08-04 11:38:33	2022-08-22 10:19:21
BK22004342	11	질문자	그렇구나, 이번에 규제가 안되면 미국은 또 많은 총기사건들이 발생할 텐데, 걱정이다. 시민들의 반응은 어때?				0	2022-08-04 11:38:33	2022-08-22 10:19:21
BK22004342	12	전문가	그래서 미국 시민들은 시위에 나섰어. 그들은 총이 아니라 아이를 보호하라, 두려움 없이 공부할 수 있게 해달라는 의미를 담은 팻말을 들고 총기폭력을 더이상 용인해서는 안된다고 호소했어.	총기규제법 시위	https://www.hankookilbo.com/News/Read/A2022061212020005207?did=NA	2022/06/12	0	2022-08-04 11:38:33	2022-08-22 10:19:21
BK22004342	13	질문자	미국사람들의 마음에 절박함이 느껴져. 시위는 미국 전역에서 일어나고 있는 거야?				0	2022-08-04 11:38:33	2022-08-22 10:19:21
BK22004342	14	전문가	미국 일간 워싱턴포스트와 CNN방송 등에 따르면 이 시위는 하나의 주에서 그치는 게 아니라 워싱턴, 뉴욕, 로스앤젤레스, 애틀랜타 등 450개 도시, 미 전역에서 진행되고 있어. 그만큼 미국 국민들은 이 법의 통과를 강력히 원한다는 게 느껴졌어.	총기규제법 시위	https://www.hankookilbo.com/News/Read/A2022061212020005207?did=NA	2022/06/12	0	2022-08-04 11:38:33	2022-08-22 10:19:21
BK22004342	15	질문자	이건 나를 지키는 것과 동시에 가족을 지키는 문제이고, 나아가 나라를 지키는 문제라고 생각해. 그래서 이 법이 통과되지 못하면 또 강한 반발이 예상돼.				0	2022-08-04 11:38:33	2022-08-06 15:52:26
BK22004342	16	전문가	맞아. CNN보도에 따르면 의회는 지금 어느 때 보다 더, 행동해야 한다는 강한 압박에 직면했다고 말하고 있어. 여론의 뜻을 받아들일지 의회의 결정에 맡기는 것 밖에 남지 않은 상황이야.	총기규제법 의회	https://www.hankookilbo.com/News/Read/A2022061212020005207?did=NA	2022/06/12	0	2022-08-04 11:38:33	2022-08-22 10:19:21
BK22004342	17	질문자	부디 현명하게 국민의 뜻을 읽어서 바른 결정을 할 수 있길 소망해.				0	2022-08-04 11:38:33	2022-08-06 15:52:26
BK22004342	18	전문가	응, 더이상 미국에 총기난사로 인한 무고한 희생이 없어지길 바라고.				0	2022-08-04 11:38:33	2022-08-18 11:37:38
BK22004342	19	질문자	맞아, 죄 없는 일반 시민들은 절대 이렇게 죽어서는 안되지. 오늘 대화 덕분에 더 많은 걸 알게 되었어 고마워.				0	2022-08-04 11:38:33	2022-08-22 10:19:21
BK22004342	20	전문가	응, 우리 교민들이 안전하게 사는 미국사회가 되길 바래. 덕분에 나도 유익한 시간이었어. 다음에 또 보자.				1	2022-08-04 11:38:33	2022-08-22 10:19:21
