id	utterance_id	role	text	search_query	search_URL	reference_date	terminate	regDate	updDate
BK22002885	1	질문자	대청소하는 중인데 주방에 기름 찌든 때가 잘 안 지워져서 너무 힘드네요.				0	2022-08-02 12:20:30	2022-08-02 14:12:28
BK22002885	2	전문가	어떤 세제로 청소하고 있는지 물어봐도 될까요?				0	2022-08-02 12:20:30	2022-08-02 14:12:28
BK22002885	3	질문자	주방이고 기름때 제거다 보니 퐁퐁으로 하면 되겠지 싶어서 퐁퐁 이용해서 열심히 수세미로 문질러 보고 있는데 깨끗하게 안 되네요.				0	2022-08-02 12:20:30	2022-08-02 14:12:28
BK22002885	4	전문가	주방 기름때는 기름과 산소가 결합해 만들어져서 세척하기가 쉽지 않아요. 단백질 성분의 기름때를 없애는 데는 알칼리성 물질인 베이킹소다가 좋으니 베이킹소다를 이용해서 한번 닦아보세요.	주방청소 세제	https://www.chosun.com/special/special_section/2021/09/29/ATF3L6JYFVFHXINM76235TL3PA/	2021/09/29	0	2022-08-02 12:20:30	2022-08-02 14:12:28
BK22002885	5	질문자	그 하얀색 가루인 베이킹소다요? 그거 빵 만들거나 요리할 때 쓰는 거 아니었어요? 청소할 때도 쓴다구요?				0	2022-08-02 12:20:30	2022-08-02 14:12:28
BK22002885	6	전문가	그 베이킹소다 맞아요. 그런데 주로 요리에 사용하는 것은 식품첨가물로 분류돼있고, 청소에 사용하는 것은 위생용품으로 분류가 돼 있는데 그 이유는 세척용 베이킹소다가 더 강한 알칼리성이라 그래요. 어느것으로 청소해도 상관은 없지만, 세척용 베이킹소다를 요리할 때 쓰는 것은 몸에 해로울 수 있어서 좋지 않아요.	베이킹소다 주방청소	http://www.chemicalnews.co.kr/news/articleView.html?idxno=3618	2021/02/05	0	2022-08-02 12:20:30	2022-08-02 14:12:28
BK22002885	7	질문자	아, 그렇군요. 베이킹소다를 청소에 이용하는 줄은 몰라서 집에 없는데 사러 나가봐야겠어요.				0	2022-08-02 12:20:30	2022-08-02 14:12:28
BK22002885	8	전문가	베이킹소다가 집에 없으시면 코로나 때문에 사놓은 손소독제를 이용해서 청소를 할 수도 있어요. 손소독제를 물티슈나 화장 솜에 묻혀서 찌든 기름때를 닦으면 말끔하게 닦여요.	주방 기름때 제거	https://www.chosun.com/culture-life/living/2022/06/08/3YKZE5I435BGTDO7REAOJM7YU4/	2022/06/08	0	2022-08-02 12:20:30	2022-08-02 14:12:28
BK22002885	9	질문자	와, 정말 신기하네요. 생활용품들이 청소할 때 그렇게 도움이 될 줄은 몰랐는데. 기름기 제거하는 좋은 방법이 더 있을까요?				0	2022-08-02 12:20:30	2022-08-02 14:12:28
BK22002885	10	전문가	주방 기름때 제거에는 먹다 남은 술도 큰 도움이 돼요. 남은 소주나 맥주가 있으시면 기름때가 있는 곳에 뿌려놓고 닦아내면 돼요.	주방 기름때 제거	https://www.gokorea.kr/news/articleView.html?idxno=232293	2019/06/12	0	2022-08-02 12:20:30	2022-08-02 14:12:28
BK22002885	11	질문자	정말 다양한 재료로 기름때를 제거할 수가 있군요. 집에 있는 재료들 이용해봐야겠어요. 아 참, 근데 청소하다 보니 집 여기저기 곰팡이도 많이 펴있더라구요.				0	2022-08-02 12:20:30	2022-08-02 14:12:28
BK22002885	12	전문가	집에 곰팡이가 많으면 공기 중에 퍼지는 포자를 통해 곰팡이균이 호흡기나 식도 등 체내에 들어갈 수도 있고, 그럴 경우에 기관지염, 알레르기, 천식 등을 일으킬 수 있어서 잘 제거해줘야 해요.	곰팡이의 위험성	https://www.hankookilbo.com/News/Read/A2021070320400001263	2021/07/05	0	2022-08-02 12:20:30	2022-08-02 14:12:28
BK22002885	13	질문자	안 그래도 제거해보려고 곰팡이 닦아내긴 했는데 심하게 핀 곳은 얼룩이 남더라구요. 곰팡이 청소하는 좋은 방법도 좀 알려주실 수 있으세요?				0	2022-08-02 12:20:30	2022-08-02 14:12:28
BK22002885	14	전문가	시중에 곰팡이 전용 세제를 파는데, 그걸 사서 곰팡이 핀 곳에 뿌리고 솔로 문질러 닦아주세요. 잘 닦이지 않는 타일 사이사이는 젤 타입의 곰팡이 제거제를 이용해주시면 좋은데요, 발라놓고 1시간 이상 방치해 놓으면 웬만한 곰팡이는 금방 없어져요.	곰팡이 제거	https://www.dailypop.kr/news/articleView.html?idxno=61181	2022/07/08	0	2022-08-02 12:20:30	2022-08-02 14:12:28
BK22002885	15	질문자	아하, 여러 타입의 곰팡이 전용 세제를 파는군요. 써봐야겠어요. 그런데 근본적으로 곰팡이가 잘 안 생기게 하는 방법은 어떤 게 있을까요?				0	2022-08-02 12:20:30	2022-08-02 14:12:28
BK22002885	16	전문가	곰팡이가 잘 안 생기게 하려면 실내 온도는 20도에서 22도, 습도는 40퍼센트에서 60퍼센트 정도로 유지하는 게 좋아요. 또 신문지, 굵은 소금, 숯을 옷장이나 주방에 두면 습기 제거에 탁월한 효과를 보여 큰 도움이 된답니다.	곰팡이 안생기게 하는법	https://m.health.chosun.com/svc/news_view.html?contid=2021060201765	2021/06/03	0	2022-08-02 12:20:30	2022-08-02 14:12:28
BK22002885	17	질문자	온도, 습도를 잘 조절하는 게 관건이군요. 청소도 정말 다양하고 효과적으로 하는 방법들이 많네요. 공부를 더 열심히 해야겠어요.				0	2022-08-02 12:20:30	2022-08-02 14:12:28
BK22002885	18	전문가	처음에 알려드렸던 베이킹소다는 정말 생활 속에서 활용할 방법이 많으니까 나중에 장 볼 때 꼭 하나 사다 두고 쓰세요. 텀블러 세척이나 화장실 변기 세척, 흰 운동화 세탁, 치아미백에도 쓸 수 있고, 겨드랑이 색소 침착에도 쓸 수 있어요.	베이킹소다 활용법	https://www.nbntv.co.kr/news/articleView.html?idxno=347532	2020/03/12	0	2022-08-02 12:20:30	2022-08-02 14:12:28
BK22002885	19	질문자	우와, 청소에만 쓰이는 게 아니고 미용적인 부분에도 이용하는군요. 정말 이제 집에 필수용품으로 구비해 놔야겠어요.				0	2022-08-02 12:20:30	2022-08-02 14:12:28
BK22002885	20	전문가	그래요. 오늘 대청소하느라 힘드실텐데, 얼른 나머지 청소 마무리하시고 쉬세요.				1	2022-08-02 12:20:30	2022-08-03 09:05:31
