id	utterance_id	role	text	search_query	search_URL	reference_date	terminate	regDate	updDate
BK22008013	1	질문자	이번에 이사하면서 소파를 바꾸려구요. 그런데 어디서부터 시작을 해야할지 모르겠어요.				0	2022-09-09 18:14:00	2022-09-09 18:14:00
BK22008013	2	전문가	가구 구입이 고민이 되는 일이긴 하죠. 그 중에서도 소파는 집에 들어서면 가장 눈에 띄는 가구기도 하고 직접 몸에 닿는 가구기도 하니까요.				0	2022-09-09 18:14:00	2022-09-09 21:51:19
BK22008013	3	질문자	제 맘을 딱 아시네요. 그래서 고민이랍니다. 소파 고르기에서 가장 먼저 무엇을 고려해야할까요?				0	2022-09-09 18:14:00	2022-09-09 18:14:00
BK22008013	4	전문가	가장 먼저 소파를 배치할 공간의 사이즈를 정확하게 측정해야 해요. 그리고 소파를 놓을 공간에는 소파 옆에 놓을 에어컨이나 협탁과 같은 아이템의 배치도 고려해야 하지요. 때문에 소파 사이즈는 공간의 60-70%를 넘지 않는 것을 추천해요.	소파 고르는 법	http://woman.chosun.com/news/articleView.html?idxno=99018	2022/06/13	0	2022-09-09 18:14:00	2022-09-22 10:24:27
BK22008013	5	질문자	아 적합한 크기를 먼저 고려해야 하는군요. 저는 이번에는 오래 쓸 수 있는 가죽 소파를 구매하고 싶어요. 가죽 소파는 어떤 제품이 오래 쓸 수 있나요?				0	2022-09-09 18:14:00	2022-09-22 10:24:27
BK22008013	6	전문가	오래 쓸 수 있는 제품을 원하시는군요. 그러면 손쉽게 확인하는 방법을 하나 알려드릴게요. 손으로 가죽을 꼬집어봐서 두께가 최소 1.2~1.4㎜ 이상 인지 확인해보세요. 두께감이 강할 수록 오래 쓰기 적합하거든요.	가죽 소파 고르기	https://www.khan.co.kr/economy/market-trend/article/201801082143025	2018/01/08	0	2022-09-09 18:14:00	2022-09-22 10:24:27
BK22008013	7	질문자	두께감을 먼저 체크해야겠어요. 그런데 천연가죽도 여러 종류가 있더라구요. 고를 때 어떤 점을 주의하면 좋을까요?				0	2022-09-09 18:14:00	2022-09-15 22:54:37
BK22008013	8	전문가	천연가죽은 다양한 등급이 있어요. 또 외피용인지 내피용인지에 따라, 또 가공 방법에 따라 소파에 사용된 가죽의 품질은 천차만별이랍니다. 따라서 소파 구입 시 제품에 대한 품질보증서를 꼭 확인해 보는 것이 중요해요.	소파 고르기 등급	https://www.dailysecu.com/news/articleView.html?idxno=51157	2019/05/28	0	2022-09-09 18:14:00	2022-09-22 10:24:27
BK22008013	9	질문자	고맙습니다. 꼼꼼히 확인해볼게요. 제가 소파에서 지내는 시간이 긴 편이라 편안한 소파를 찾고 싶은데 쿠션을 고르는 기준도 있나요?				0	2022-09-09 18:14:00	2022-09-22 10:24:27
BK22008013	10	전문가	음, 소파의 쿠션감은 침대의 매트리스와 같이 너무 푹신하거나 너무 딱딱해도 스타일 별로 느껴지는 불편함이 다르기 때문에 각자의 체형과 라이프스타일에 맞는 디테일 체크가 필수에요. 특히 좌방석은 1인당 최소 800㎜ 이상 돼야 여유롭게 앉을 수 있으니 쿠션감과 함께 길이도 꼭 살펴보시고, 소파에 앉았을 때 발이 뜨지 않을 정도의 깊이를 선택하는 것이 좋아요.	소파 고르는 법 좌방석	http://woman.chosun.com/news/articleView.html?idxno=99018	2022/06/13	0	2022-09-09 18:14:00	2022-09-22 10:24:27
BK22008013	11	질문자	맞아요, 유명한 소파라고 해도 앉았을 때 꼭 편한 건 아니더군요. 혹시 리클라이너 소파에 대해서도 아세요?				0	2022-09-09 18:14:00	2022-09-22 10:24:27
BK22008013	12	전문가	네, 리클라이너 소파에 관심이 있으세요? 다리와 등, 머리 부분이 움직이며 독립적인 좌석을 만들어주어 기존 소파와는 다른 편안함을 주는 소파죠. 하지만 리클라이너 쇼파는 전동으로 작동하는 기계적인 제품이기 때문에 사용하면서 발생할 수 있는 고장이나 파손, 수리 등의 문제를 잘 처리할 수 있는지 미리 알아보셔야 돼요.	리클라이너 소파	https://www.dailysecu.com/news/articleView.html?idxno=127834	2021/08/21	0	2022-09-09 18:14:00	2022-09-22 10:24:27
BK22008013	13	질문자	편리한 점과 주의해야 할 점이 있는 거군요. 그런데 가죽 관리는 어떻게 하는 게 좋은가요?				0	2022-09-09 18:14:00	2022-09-09 20:55:50
BK22008013	14	전문가	가죽 소파의 경우 청소를 잘 안하기도 하지만, 사실은 일주일에 한 번 진공 청소로 먼지를 제거해 주는 것이 좋아요. 또한 최소한 4-6개월에 한 번 정도는 가죽 전문 세척제 및 크림으로 깨끗이 손질하는 게 좋구요. 또 장시간 직사광선이나 강한 열에 노출될 경우 탈색이나 변색의 가능성이 있으니 주의하세요. 생활을 하다 보면 얼룩이나 오염이 생기는 경우가 있는데, 이때는 즉시 닦아내고, 연성 비눗물을 묻혀 꼭 짜낸 스펀지나 헝겊으로 살살 문지른 후, 물기가 가죽에 스며들지 않게 신속하게 마른 걸레로 닦아내세요.	가죽 소파 관리	https://www.fnnews.com/news/201712311610059496	2017/12/31	0	2022-09-09 18:14:00	2022-09-22 10:24:27
BK22008013	15	질문자	소파를 잘 쓰려면 소파 청소와 오염 제거법을 잘 숙지해야겠어요. 그런데 제가 아직 가죽 관리제는 써본 적이 없어서 그러는데 어떤 제품을 쓰는 게 좋은가요?				0	2022-09-09 18:14:00	2022-09-22 10:24:27
BK22008013	16	전문가	아직 사용해보신 적이 없으시군요. 그렇다면 가죽 관리제를 고르기 전에 먼저 소파의 가죽 종류를 파악해야 해요. 가죽 종류에 따라 구분해서 가죽관리제를 사용해야 하기 때문이죠. 가죽 종류를 파악하신 후 제품을 골라보세요.	가죽 소파 관리	https://www.job-post.co.kr/news/articleView.html?idxno=23766	2021/05/27	0	2022-09-09 18:14:00	2022-09-16 00:17:33
BK22008013	17	질문자	네 알겠어요. 그리고 예전에 제가 새 가구를 사고 냄새 때문에 머리가 아파서 고생한 적이 있거든요. 새로 사려니 그게 다시 생각나는데, 그건 왜 그런 건지 알 수 있을까요?				0	2022-09-09 18:14:00	2022-09-22 10:24:27
BK22008013	18	전문가	많이 힘드셨겠어요. 새 가구에서 나는 냄새는 포름알데히드 때문일 수 있어요. 포름알데히드는 자재나 접착제에 사용하는 물질로 가격이 싸고 접착 기능이 뛰어나지만 인체에 매우 유해합니다. 그러니 가구를 사실 때는 포름알데히드 방출량을 체크해야해요.	친환경 소파 구매	http://www.gvalley.co.kr/news/articleView.html?idxno=524764	2016/03/15	0	2022-09-09 18:14:00	2022-09-22 10:24:27
BK22008013	19	질문자	그럴 수도 있군요. 냄새와 유해물질을 연관시켜 생각하지 못했어요. 그러면 포름알데히드 방출량을 어떻게 확인하지요?				0	2022-09-09 18:14:00	2022-09-15 22:54:37
BK22008013	20	전문가	목재 등급을 확인해보세요. 환경부는 가구의 경우 E0 등급 자재를 사용해야만 친환경 가구로 인정하고 있어요. 하지만, 포름알데히드 방출량이 0.5~1.5mg/L 수준인 E1 등급도 가구 제작에 사용할 수 있기 때문에 꼭 등급을 확인하고, 그 차이를 알고 구매하셔야 해요.	가구 포름알데히드 방출량 기준	http://www.wsobi.com/news/articleView.html?idxno=122762	2021/05/25	0	2022-09-09 18:14:00	2022-09-22 10:24:27
BK22008013	21	질문자	알겠어요. 보기에 좋은 것도 좋지만, 보이지 않는 부분도 신경 써야겠네요. 오늘 정말 감사합니다.				0	2022-09-09 18:14:00	2022-09-09 21:51:20
BK22008013	22	전문가	이사한 집에 꼭 맞는 편안하고 건강에 좋은 소파 잘 구매하시길 바래요. 그럼 안녕히 계세요!				1	2022-09-09 18:14:00	2022-09-22 10:24:27
