id	utterance_id	role	text	search_query	search_URL	reference_date	terminate	regDate	updDate
BK22008039	1	질문자	오늘 후배가 나한테 버건디가 잘 어울리겠다고 하더라? 무슨 색인지는 대충 알겠는데 버건디는 어디서 온 말이래?				0	2022-09-10 01:15:34	2022-09-10 01:15:34
BK22008039	2	전문가	아 그건 부르고뉴와인의 색에서 유래된건데 와인 빛이 나는 색상이야. 평소에 좋아하는 색깔이야?	버건디 유래	https://ko.wikipedia.org/wiki/%EB%B2%84%EA%B1%B4%EB%94%94_(%EC%83%89)	2022/03/08	0	2022-09-10 01:15:34	2022-09-10 01:15:34
BK22008039	3	질문자	평소에 그런색상은 한번도 안사보기는 했어. 요즘들어서 패션에 관심 갖기 시작했다고 했더니 후배가 가을이니까 버건디 옷 사보라고 추천 해 주더라고.				0	2022-09-10 01:15:34	2022-09-10 01:15:34
BK22008039	4	전문가	가을이니까 잘 어울릴 것 같아. 어떤 패션에 관심이 생긴거야?				0	2022-09-10 01:15:34	2022-09-10 01:15:34
BK22008039	5	질문자	너 혹시 꾸안꾸라고 알아? 무난하면서도 은근히 예쁘게들 많이 입더라.				0	2022-09-10 01:15:34	2022-09-10 01:15:34
BK22008039	6	전문가	꾸안꾸 알지. 꾸미지 않은 것 같으면서도 꾸몄다는 것을 다른 사람들도 알 수 있을만하게 스타일링 한걸 말하는거잖아.	꾸안꾸 뜻	http://www.viva100.com/main/view.php?key=20180831001307135	2018/08/31	0	2022-09-10 01:15:34	2022-09-10 01:15:34
BK22008039	7	질문자	오 맞아맞아. 그동안 나만 모르고 있었나보다. 평소에 무난한 스타일을 좋아하는데 뭔가 포인트만 하나씩 줘도 예쁘길래 요즘 노력중이야.				0	2022-09-10 01:15:34	2022-09-10 01:15:34
BK22008039	8	전문가	무난한 스타일을 추구한다면 꾸안꾸스타일로 코디 해 보는거 좋겠다.				0	2022-09-10 01:15:34	2022-09-10 01:15:34
BK22008039	9	질문자	여기저기 많이 참고하면서 배우는 중이지뭐. 나 모자도 자주 쓰는데 꾸안꾸로 버킷햇 써보라고 추천 받았거든. 그게 뭐야?				0	2022-09-10 01:15:34	2022-09-10 01:15:34
BK22008039	10	전문가	모자 좋아하면 버킷햇을 써보는 것도 좋겠다. 이건 챙이 헤드 아래로 내려오는 모양인데 양동이 쓴 것 처럼 생겼다고 해서 버킷햇이라고 이름 지어진거야.	버킷햇 모양	https://news.mt.co.kr/mtview.php?no=2020061713492186648	2020/06/19	0	2022-09-10 01:15:34	2022-09-10 01:15:34
BK22008039	11	질문자	얘기 들으니까 알거 같아. 나 맨날 캡 모자만 쓰고 다니는데 이번에 버킷햇 하나 사봐야겠다. 내일 회사 쉬는날이라 쇼핑하러 가보려고.				0	2022-09-10 01:15:34	2022-09-10 01:15:34
BK22008039	12	전문가	쇼핑이라니 너무 즐거울 거 같아 부럽네. 버킷햇말고 사고 싶은거 또 있어?				0	2022-09-10 01:15:34	2022-09-10 01:15:34
BK22008039	13	질문자	나 와이드팬츠 사러 가는거야. 이것도 평소에 입어본적은 없는 핏인데 한번 도전 해 보려고 하고 있지. 어떤 핏인지 알지?				0	2022-09-10 01:15:34	2022-09-10 01:15:34
BK22008039	14	전문가	통이 넓은 팬츠 말하는거잖아. 통이 넓어서 여름에 입기도 시원하고 좋겠다. 활동하기도 편하고 말이야. 오버핏 셔츠랑 같이 입어도 예쁘겠는걸.	와이드팬츠 핏	https://www.insight.co.kr/news/396847	2022/05/25	0	2022-09-10 01:15:34	2022-09-10 01:15:34
BK22008039	15	질문자	안그래도 뭐랑 입어야 하나 고민중이였는데 알려줘서 고마워. 요즘은 또 y2k 패션이 유행이라던데 나는 전혀 모르겠던데 뭘까? 시대적인 걸 말하는건가?				0	2022-09-10 01:15:34	2022-09-17 01:18:04
BK22008039	16	전문가	그거 90년대에서 2000년대 걸쳐서 유행하던 옷들이 다시 2022년도에 젊은 세대들한테 유행한다는 뜻이야.	y2k패션이란	http://www.kyongbuk.co.kr/news/articleView.html?idxno=2111555	2022/09/07	0	2022-09-10 01:15:34	2022-09-22 11:15:43
BK22008039	17	질문자	아 복고풍인 셈이구나. 뉴트로 컨셉이 어딜가나 유행이던데 비슷한 맥락인거 같네. 뉴트로가 복고풍을 말하는거 맞지?				0	2022-09-10 01:15:34	2022-09-10 01:15:34
BK22008039	18	전문가	맞아. 뉴트로라는건 신조어 인데 새로움과 복고를 합친 말이야. 복고를 새롭게 즐긴다는 거지.	뉴르토 뜻	https://terms.naver.com/entry.naver?docId=5668828&cid=43667&categoryId=43667	2018/08/21	0	2022-09-10 01:15:34	2022-09-10 01:15:34
BK22008039	19	질문자	요즘은 참 신조어도 많아서 따라가기 힘들어. 여자들은 요새 티셔츠 짧은게 유행인지 다들 그렇게 입던데 그건 뭐라고 해?				0	2022-09-10 01:15:34	2022-09-10 01:15:34
BK22008039	20	전문가	상의를 짧게 하는건 크롭톱이라고 해. 90년대에 유행했던건데 다시 유행하고 있어.	짧게입는 티셔츠	https://www.mk.co.kr/news/business/view/2021/07/695189/	2021/07/21	0	2022-09-10 01:15:34	2022-09-22 11:15:43
BK22008039	21	질문자	크롭이라고 들으니 알거같네. 그리고 아노락이라는건 뭐야? 바람막이 필요하다고 하니까 요새 아노락 예쁜거 많다던데 어떤거야?				0	2022-09-10 01:15:34	2022-09-10 01:15:34
BK22008039	22	전문가	요즘 아노락이 간절기 필수템이지. 모자가 달린 가볍고 얇은 재킷을 의미해. 경량소재라서 기본적인 방풍효과나 통기성이 뛰어나니까 간절기에 입기가 좋아. 운동이나 등산할때 런닝 할때도 활용 할 수 있어.	아노락 뜻	http://www.gimhaenews.co.kr/news/articleView.html?idxno=36351	2021/03/09	0	2022-09-10 01:15:34	2022-09-10 01:15:34
BK22008039	23	질문자	나 내일 옷사러 가서 또 물어볼거 있으면 물어볼게. 너 진짜 아는거 많다.				0	2022-09-10 01:15:34	2022-09-10 01:15:34
BK22008039	24	전문가	내가 아는거라면 말해줄 수 있으니까 궁금한거 있으면 언제든지 물어봐.				1	2022-09-10 01:15:34	2022-09-22 11:15:43
