id	utterance_id	role	text	search_query	search_URL	reference_date	terminate	regDate	updDate
BK22007074	1	질문자	요즘 MBTI가 유행이라는데 전 아직 안 해봤거든요. 혹시 테스트 해보셨어요?				0	2022-09-01 00:06:48	2022-09-01 00:06:48
BK22007074	2	전문가	네, 저는 테스트가 유행하기 전에 이미 해봤어요.				0	2022-09-01 00:06:48	2022-09-15 00:46:20
BK22007074	3	질문자	그러시군요, 그런데 MBTI 라는게 정확히 뭔가요?				0	2022-09-01 00:06:48	2022-09-06 15:30:04
BK22007074	4	전문가	MBTI는 칼 융의 심리유형 이론을 근거로 만들어진 4가지 척도에 따라 인간의 성격유형을 16가지로 분류하는 테스트에요.	MBTI 척도	http://www.cctimes.kr/news/articleView.html?idxno=705177	2022/05/19	0	2022-09-01 00:06:48	2022-09-01 00:06:48
BK22007074	5	질문자	그렇군요, 그런데 4가지 척도로 어떻게 성격유형을 16가지로 분류하죠?				0	2022-09-01 00:06:48	2022-09-01 00:06:48
BK22007074	6	전문가	4개의 척도는 양극이 있어서 8개의 선호 경향으로 표현돼요. 4개의 척도에 따른 8개의 선호 경향은 외향형인 E와 내향형인 I, 감각형인 S와 직관형인 N, 사고형인 T와 감정형인 F, 판단형인 J와 인식형인 P가 있어요. 이 척도들은 뜻하지 않게 형성된 것이 아니라 생득적으로 인간 속에 있는 경향성을 말해요. 각각의 선호 경향의 영단어 첫 자 4개를 합하면 16개의 유형이 만들어지고 우리는 이들 중 하나의 유형을 부여받는 것이죠.	MBTI 척도	http://www.cctimes.kr/news/articleView.html?idxno=705177	2022/05/19	0	2022-09-01 00:06:48	2022-09-15 00:46:20
BK22007074	7	질문자	혈액형 별 성격 구분론처럼 근거가 모호한 게 아니라, 선호 경향을 파악하는 방식이라 테스트가 합리적이라는 생각이 드네요. 기업에서도 채용에도 활용하고 있다는데 맞나요?				0	2022-09-01 00:06:48	2022-09-01 14:38:50
BK22007074	8	전문가	네, 한 대기업은 지난해 하반기 자소서 항목에 자신의 MBTI 유형을 소개하고, 이를 바탕으로 해서 장단점을 예시를 들어 자기소개서를 작성하라고 요구하기도 했어요. 그 밖에도 작가를 뽑는 공고에 희망하는 성격 유형을 구체적으로 드러내는가 하면, 학원 강사 고용에 MBTI 검사 결과를 요구하는 곳도 있죠.	mbti 검사 기업	https://www.edaily.co.kr/news/read?newsId=03345606632423384&mediaCodeNo=257&OutLnkChk=Y	2022/08/02	0	2022-09-01 00:06:48	2022-09-15 00:46:20
BK22007074	9	질문자	MBTI가 기업에서도 사용되고 있다는게 사실이었군요. 그런데 심리학계에서는 MBTI가 갑론을박의 대상이 되기도 한다고 들었는데 왜 그런 건가요?				0	2022-09-01 00:06:51	2022-09-15 14:44:08
BK22007074	10	전문가	일단 신뢰도 때문이에요. 4가지 지표를 개별적으로 보면 재현될 확률이 꽤 높아요. 하지만 16개로 나눠지는 성격유형이 재현되려면 4가지 지표가 모두 똑같이 나와야 하므로 재현성이 조금 낮아요. 예컨대 외향형인 E와 내향형인 I로 나누는 지표가 다음 검사에서 그대로 나올 확률이 90%라고 가정했을때, 지표가 네 가지니까 성격유형이 똑같이 나올 확률은 0.9를 네 번 곱한 0.66, 66% 정도예요.	MBTI 신뢰도	https://news.kbs.co.kr/news/view.do?ncd=5507270&ref=A	2022/07/12	0	2022-09-01 00:06:51	2022-09-15 00:46:20
BK22007074	11	질문자	그렇군요, 그럼 신뢰도 외에도 MBTI가 논쟁의 대상이 되는 또 다른 이유도 있을까요?				0	2022-09-01 00:06:54	2022-09-15 00:46:20
BK22007074	12	전문가	다른 이유로는 타당도가 낮기 때문이에요. 타당도는 이 검사가 얼마나 성격을 정확히 측정할 수 있냐는 의미로 볼 수 있는데, MBTI는 이분법적인 측정을 하고 있을 뿐 아니라 자가 보고식으로만 구성돼 있어 타당도에도 한계가 있어요.	MBTI 타당도	https://sports.chosun.com/news/ntype.htm?id=202206210100139410008896&servicedate=20220620	2022/06/20	0	2022-09-01 00:06:54	2022-09-01 14:38:50
BK22007074	13	질문자	아, 그런 이유가 있었군요. 그런데 심리학 용어 중에 바넘효과라는 것이 있잖아요. MBTI도 이에 해당하나요?				0	2022-09-01 00:06:54	2022-09-15 00:46:20
BK22007074	14	전문가	네, 아시다시피 바넘효과는 누구나 보편적으로 가지고 있는 성격이나 특징을 자신만의 고유한 특성으로 착각하는 것을 말하잖아요? 자신이 수다스럽지 않지만 공감을 확신하는 상대에겐 과한 수다를 늘어놓기도 하는 것 처럼요. 이런 예시문은 누구에게나 해당하는 보편적인 항목들일 뿐인데, 테스트 결과지가 자신의 성격에 딱 맞는다며 신기해하는게 바넘 효과라는 거죠.	MBTI 바넘효과	https://www.yeongnam.com/web/view.php?key=20220831010003806	2022/08/31	0	2022-09-01 00:06:54	2022-09-15 14:44:08
BK22007074	15	질문자	그렇다면 이렇게 신뢰도나 타당도에 논쟁의 여지가 있는 테스트에 사람들이 열광하는 이유는 뭔가요?				0	2022-09-01 00:06:54	2022-09-15 00:46:20
BK22007074	16	전문가	전문가들은 젊은 세대가 최근 취업난과 집값 상승, 경직된 직장 문화 등 불안한 상황에서, 빠르게 마음이 맞는 사람을 만날 수 있는 효과적인 방법으로 MBTI에 주목했다고 했어요.	MBTI 과몰입	https://www.edaily.co.kr/news/read?newsId=02040166632398128&mediaCodeNo=257&OutLnkChk=Y	2022/07/25	0	2022-09-01 00:06:54	2022-09-15 00:46:20
BK22007074	17	질문자	그렇군요, 그렇다면 MBTI를 어떻게 활용하는게 좋을까요?				0	2022-09-01 00:06:54	2022-09-01 15:36:28
BK22007074	18	전문가	MBTI를 통해 평가한 본인 또는 타인의 성격적인 특성에 대해 이해하고 다른 사람들과 소통하기 위한 도구로서 가볍게 활용하는 것이 좋아요. 그리고 개인의 성격은 모두 다르기 때문에 결과를 너무 맹신하여, 상대방에 대한 선입견을 갖거나 상대방을 쉽게 판단하지 말아야 해요. 이밖에도 자신의 성격 역시 MBTI로 평가된 하나의 틀 안에 가두는 것보다는 본인이 가진 성격적 특성의 장점은 살리고 단점을 보완해 더 나은 사람이 되기 위한 참고 자료로서 생각하는 것으로 활용하는 게 좋아요.	MBTI 활용	http://www.sportsworldi.com/newsView/20220714519385	2022/07/15	1	2022-09-01 00:07:59	2022-09-15 14:44:08
BK22007074	19	질문자	그렇군요, 오늘 알려주신 내용 흥미로웠어요. 또 이렇게 이야기 할 기회가 생기면 좋겠네요. 저는 이제 들어 가볼게요.				0	2022-09-01 00:07:59	2022-09-01 15:36:28
BK22007074	20	전문가	네, 조심히 들어가시고 다음에 또 얘기 나눠요. 그럼 안녕히 가세요.				0	2022-09-01 00:06:54	2022-09-01 15:36:28
