id	utterance_id	role	text	search_query	search_URL	reference_date	terminate	regDate	updDate
BK22007037	1	질문자	9월이 되니 밤낮으로 공기가 차갑네요. 차가운 공기 때문인지 피부가 많이 건조해지는 것 같아요.				0	2022-09-01 20:42:56	2022-09-01 20:42:56
BK22007037	2	전문가	아침저녁으로 기온 차이가 많이 나는 가을철에는 건조한 날씨 때문에 아토피나 지루성 피부염, 두드러기 같은 피부질환이 발생할 수 있어요.	가을철 피부건조	http://www.thegolftimes.co.kr/news/articleView.html?idxno=52354	2021/11/19	0	2022-09-01 20:42:56	2022-09-01 20:42:56
BK22007037	3	질문자	자꾸만 피부가 간지럽고 푸석한 것 같은데 제일 먼저 뭘 하면 도움이 될까요?				0	2022-09-01 20:42:56	2022-09-01 20:42:56
BK22007037	4	전문가	가을을 맞이한 피부는 큰 일교차와 건조한 공기 때문에 피부 속 수분을 뺏겨 민감하고 푸석해지기 쉽기 때문에 충분한 보습 케어를 통해 환절기 피부 건강을 챙겨야 해요. 피부 건강을 위한 가장 기본적이면서 가장 핵심적인 단계는 피부 속 노폐물과 피지를 제거하는 클렌징이죠.	가을 피부관리	http://zine.istyle24.com/Beauty/BeautyView.aspx?Idx=55402&Menu=1&_C_=23069	2021/10/07	0	2022-09-01 20:42:56	2022-09-08 11:39:26
BK22007037	5	질문자	그럼 클렌징 단계를 늘리고 더 꼼꼼히 세안을 하는 게 좋을까요?				0	2022-09-01 20:42:56	2022-09-06 18:25:19
BK22007037	6	전문가	적당한 세안은 피부 속까지 깨끗하게 정돈해주는 클렌징 기능을 하지만 너무 과한 세안은 피부 속 유분까지 제거하여 푸석푸석한 건성피부와 주름을 만드는 지름길이 되기요 해요.	가을철 클렌징	https://www.bntnews.co.kr/article/view/bnt201009130182	2010/09/14	0	2022-09-01 20:42:56	2022-09-08 11:39:26
BK22007037	7	질문자	저는 클렌징을 더 꼼꼼히 해야하는 줄 알았는데 그게 아니었군요. 클렌징 말고도 어떤 걸 더 신경쓰면 좋을까요?				0	2022-09-01 20:42:56	2022-09-06 18:25:19
BK22007037	8	전문가	건조한 가을철 날씨는 피부 속 콜라겐과 엘라스틴을 감소시키는데 영향을 줘요. 이로 인해서 피부 탄력이 떨어지면 피부가 힘을 잃으면서 주름이 깊어지고, 얼굴라인이 쳐지는 등 본인의 나이보다 더 나이가 들어보이는 인상을 줄 수 있기 때문에 탄력 관리에도 신경을 써줘야 해요.	가을 피부 보습관리	http://www.beopbo.com/news/articleView.html?idxno=302607	2021/09/09	0	2022-09-01 20:42:56	2022-09-08 11:39:26
BK22007037	9	질문자	그렇다면 피부 탄력 관리는 어떻게 할 수 있죠?				0	2022-09-01 20:42:56	2022-09-06 18:25:19
BK22007037	10	전문가	우유나 계란 같은 저렴한 재료를 이용해서 얼마든지 피부를 관리할 수 있어요.	피부 탄력	https://kormedi.com/1411599/%ec%a7%91%ec%97%90-%ec%9e%88%eb%8a%94-%ec%8b%9d%ec%9e%ac%eb%a3%8c%eb%a1%9c-%ed%83%84%eb%a0%a5%ec%9e%88%eb%8a%94-%ed%94%bc%eb%b6%80-%eb%a7%8c%eb%93%a4%ea%b8%b0/	2022/08/10	0	2022-09-01 20:42:56	2022-09-06 18:25:19
BK22007037	11	질문자	우유로 피부 관리를 할 수 있다니 흥미롭네요! 어떻게 우유로 피부 관리를 할 수 있나요?				0	2022-09-01 20:42:56	2022-09-06 18:25:19
BK22007037	12	전문가	세안 마지막 과정에서 우유로 헹궈주는 방법으로 간편하게 활용할 때 사용할 수 있어요.	우유 피부관리	https://www.sedaily.com/NewsView/22TZ4VF18H	2021/11/11	0	2022-09-01 20:42:56	2022-09-06 18:25:19
BK22007037	13	질문자	그럼 우유로 피부 관리를 할 때 어떤 효과를 얻을 수 있는거죠?				0	2022-09-01 20:42:56	2022-09-06 18:25:19
BK22007037	14	전문가	우유는 단백질 분해효소가 피부의 묵은 각질을 없애주면서 수분과 유분의 균형을 맞춰 거친 피부를 매끄럽게 해주는 장점을 가지고 있어요.	피부 우유팩 효과	https://www.yeongnam.com/web/view.php?key=20141128.010400811140001	2014/11/28	0	2022-09-01 20:42:56	2022-09-06 18:25:19
BK22007037	15	질문자	저에게 정말 좋은 정보네요! 우유처럼 간단하게 할 수 있는 피부 관리 방법이 있다면 더 알려주시겠어요?				0	2022-09-01 20:42:56	2022-09-06 18:25:19
BK22007037	16	전문가	그렇다면 각질제거와 피지 조절에 딱 좋은 토마토팩도 있어요. 토마토의 비타민과 미네랄 성분이 거친 피부를 매끄럽게 만들어주고 탄력 있게 만드는 데 도움을 주거든요.	피부 천연팩	http://www.beyondpost.co.kr/view.php?ud=202001171354389704992c130dbe_30	2020/01/17	0	2022-09-01 20:42:56	2022-09-08 11:39:26
BK22007037	17	질문자	집에서도 간단하게 가을철 피부 관리를 할 수 있는 방법이 여러 가지가 있군요!				0	2022-09-01 20:42:56	2022-09-06 18:25:19
BK22007037	18	전문가	그렇죠? 저도 생각난 김에 오늘은 집에서 피부 관리를 해야겠어요.				0	2022-09-01 20:42:56	2022-09-06 18:25:19
BK22007037	19	질문자	저도 오늘 집에 가는 길에 우유를 한 팩 사서 가야겠네요. 다음에 또 뵙도록 해요.				0	2022-09-01 20:42:56	2022-09-06 18:25:19
BK22007037	20	전문가	그래요, 다음에 또 봬요!				1	2022-09-01 20:42:56	2022-09-08 11:39:26
