id	utterance_id	role	text	search_query	search_URL	reference_date	terminate	regDate	updDate
BK22008323	1	질문자	음식물 쓰레기를 버리다 보니 궁금해진 것이 있어. 우리가 다른 쓰레기와 음식물 쓰레기를 분리해서 버리는데, 그 음식물 쓰레기가 어떻게 처리되는 건지 궁금해.				0	2022-09-13 13:29:40	2022-09-19 21:11:24
BK22008323	2	전문가	2019년 기준으로 버려진 음식물 쓰레기는 퇴비로 38.1%, 사료로 36.2%, 바이오 가스 12.7%로 다시 사용되었어. 이렇게 다시 재활용될 수 있기 때문에 공정상 설비의 고장을 일으키거나 퇴비나 사료의 품질에 영향을 줄 수 있는 것들은 음식물 쓰레기가 아닌 일반 쓰레기로 분리해서 배출해야 해.	음식물 쓰레기 활용	https://www.fnnews.com/news/202207081414547695	2022/07/09	0	2022-09-13 13:29:40	2022-09-13 14:15:07
BK22008323	3	질문자	음식물 쓰레기가 다시 재활용되는 만큼 잘 버려야겠구나. 근데, 일반 쓰레기인지 음식물 쓰레기인지 헷갈리는 것이 많더라고. 조개 껍질은 일반 쓰레기로 버리는건가?				0	2022-09-13 13:29:40	2022-09-23 14:36:46
BK22008323	4	전문가	맞아, 조개 같은 패류의 껍데기나 파인애플 껍질, 복숭아, 감의 씨는 일반 쓰레기로 버려야 해. 그렇게 딱딱한 물질은 처리 시설에서 분쇄할 때 기계 고장의 원인이 될 수 있거든.	음식물 쓰레기 배출 방법	https://news.mt.co.kr/mtview.php?no=2022032316455856157	2022/03/24	0	2022-09-13 13:29:40	2022-09-13 14:15:07
BK22008323	5	질문자	그렇게 딱딱한 것은 재가공하는 것도 어렵겠구나. 그럼, 생선뼈도 음식물 쓰레기로 버리면 안 되겠네?				0	2022-09-13 13:29:40	2022-09-13 14:15:07
BK22008323	6	전문가	맞아, 먹고 남은 생선은 음식물 쓰레기지만, 생선 뼈는 일반 쓰레기에 버려야 해. 소, 돼지, 닭 뼈와 달걀 껍질도 일반 쓰레기로 버려야 하고.	생선 뼈 음식물 쓰레기	https://www.hani.co.kr/arti/society/society_general/1058192.html	2022/09/10	0	2022-09-13 13:29:40	2022-09-23 14:36:46
BK22008323	7	질문자	달걀 껍질도 일반 쓰레기로 버려야 한다고? 달걀 껍데기는 음식물 쓰레기로 버렸었는데 왜 일반 쓰레기로 버려야 하는거야?				0	2022-09-13 13:29:41	2022-09-23 14:36:46
BK22008323	8	전문가	껍질에 있는 석회 성분이 사료나 비료로 사용하기에는 적합하지 않거든. 그리고, 딱딱해서 분쇄기 고장의 원인이 되기도 해. 그래서 달걀, 메추리알, 타조랑 같은 껍데기는 일반 쓰레기로 버려야 하는거지.	달걀 음식물 쓰레기	http://www.mkhealth.co.kr/news/articleView.html?idxno=43157	2019/03/27	0	2022-09-13 13:29:41	2022-09-23 14:36:46
BK22008323	9	질문자	이제부터 달걀 껍질은 일반 쓰레기에 버려야겠다. 그럼, 옥수수 껍질이나 마늘 껍질은?				0	2022-09-13 13:29:41	2022-09-13 14:15:07
BK22008323	10	전문가	마늘, 옥수수, 양파 껍질같이 수분이 없는 채소의 찌꺼기도 일반 쓰레기로 버려야 해. 파나 미나리의 뿌리처럼 향과 매운맛이 나는 것과 마늘대, 옥수수대도 일반 쓰레기야.	음식물 쓰레기 옥수수	https://www.gokorea.kr/news/articleView.html?idxno=47352	2018/07/03	0	2022-09-13 13:29:41	2022-09-13 14:15:07
BK22008323	11	질문자	그렇구나, 버릴 때 많이 헷갈렸던 것들이야. 또, 주의해서 버려야 할 것들 좀 알려 줘.				0	2022-09-13 13:29:41	2022-09-13 14:15:07
BK22008323	12	전문가	같은 식품이지만 다르게 버려야 하는 것도 있는 데, 그것은 고추야. 고추의 꼭지나 씨, 고추장은 일반 쓰레기, 몸통이나 가루는 음식물 쓰레기로 분리해서 배출해야 해.	음식물 쓰레기	https://www.gokorea.kr/news/articleView.html?idxno=47352	2018/07/03	0	2022-09-13 13:29:41	2022-09-13 14:15:07
BK22008323	13	질문자	고추는 분류해서 버려야 하는구나. 그러면 과일 껍데기는 어떻게 버려?				0	2022-09-13 13:29:41	2022-09-13 14:15:07
BK22008323	14	전문가	부드러운 귤, 바나나, 사과 껍질이나 딸기, 토마토 등의 꼭지는 가축이 먹을 수 있기 때문에 음식물 쓰레기로 버리면 돼.	과일 껍질 음식물 쓰레기	https://news.g-enews.com/ko-kr/news/article/news_all/202112031000375835ce2cf03261_1/article.html?md=20211203162648_U	2021/12/03	0	2022-09-13 13:29:41	2022-09-19 21:11:24
BK22008323	15	질문자	부드러운 과일 껍질은 음식물 쓰레기로 버리면 되는구나. 근데, 음식물 쓰레기인지 분류하는 것은 너무 어려운 것 같은 데 기준 같은 것은 없을까?				0	2022-09-13 13:29:41	2022-09-13 14:15:07
BK22008323	16	전문가	음식물 쓰레기로 분류하는 것들은 가공해서 동물 사료로 활용하니까 동물이 먹을 수 있는지 생각해 보고 버리면 돼.	음식물 쓰레기 기준	http://www.cctimes.kr/news/articleView.html?idxno=619753	2020/07/12	0	2022-09-13 13:29:41	2022-09-19 21:11:24
BK22008323	17	질문자	가축이 먹을 수 있는지 생각해 보고 버려야겠구나.				0	2022-09-13 13:29:41	2022-09-13 14:15:07
BK22008323	18	전문가	버릴 때 이물질이 들어가지 않게 주의하고.				0	2022-09-13 13:29:41	2022-09-13 14:15:07
BK22008323	19	질문자	알겠어, 음식물 쓰레기 버릴 때마다 헷갈렸는데 덕분에 좀 해결된 것 같아.				0	2022-09-13 13:29:41	2022-09-13 14:15:07
BK22008323	20	전문가	그래, 궁금한 건 언제든지 더 물어봐. 우리는 다음에 만나자, 안녕.				1	2022-09-13 13:29:41	2022-09-23 14:36:46
