id	utterance_id	role	text	search_query	search_URL	reference_date	terminate	regDate	updDate
BK22004165	1	질문자	흰옷을 오래입었더니 누렇게 변해버렸어. 다시 하얗게 만들 방법은 없을까?				0	2022-08-04 11:19:19	2022-08-04 11:19:19
BK22004165	2	전문가	혹시 집에 과탄산소다와 베이킹소다 있어? 흰옷이 누렇게 변했을 때 이 두가지로 얼룩을 제거할 수 있거든.	흰옷 누런때 제거	https://www.nbntv.co.kr/news/articleView.html?idxno=662929	2019/11/14	0	2022-08-04 11:19:19	2022-08-17 15:29:33
BK22004165	3	질문자	베이킹소다는 자주 사용해서 있는데 과탄산소다는 없어. 근데 과탄산소다 몸에 안좋은거 아니야?				0	2022-08-04 11:19:19	2022-08-04 11:19:19
BK22004165	4	전문가	과탄산소다는 천연세제야. 이게 과산화수소랑 탄산나트륨이 만나서 결합된 화합물이거든.	과탄산소다 성분	http://www.ggilbo.com/news/articleView.html?idxno=789482	2020/08/15	0	2022-08-04 11:19:19	2022-08-04 11:19:19
BK22004165	5	질문자	그래? 베이킹 소다는 과일 씻을때 자주 쓰니까 여러개 사다놨는데 과탄산소다도 하나 사와야겠네.				0	2022-08-04 11:19:19	2022-08-04 11:19:19
BK22004165	6	전문가	과일 씻을때 베이킹소다를 쓰는구나? 잔류농약 남아있을때 베이킹소다로 씻으면 걱정 안해도 되잖아.	베이킹소다 과일	http://topclass.chosun.com/news/articleView.html?idxno=21023	2021/04/30	0	2022-08-04 11:19:19	2022-08-04 11:19:19
BK22004165	7	질문자	맞아, 내가 그래서 과일이나 야채 씻을 때 꼭 베이킹소다를 쓰는 거야. 근데 베이킹소다를 빨래할 때도 쓰는 거였어?				0	2022-08-04 11:19:19	2022-08-23 22:43:27
BK22004165	8	전문가	물론이지, 오염물질을 흡착하기 때문에 세척이나 청소할때도 사용하면 좋아. 그리고 악취를 제거해주기도 해서 세탁할 때 넣거나 탈취제로도 쓸 수 있어.	베이킹소다 활용	https://kormedi.com/1367495/%ea%b1%b4%ea%b0%95%ea%b3%bc-%eb%af%b8%ec%9a%a9-%ec%9c%84%ed%95%9c-%eb%b2%a0%ec%9d%b4%ed%82%b9%ec%86%8c%eb%8b%a4-%ed%99%9c%ec%9a%a9%eb%b2%95-5/	2021/11/26	0	2022-08-04 11:19:19	2022-08-29 13:31:28
BK22004165	9	질문자	악취 제거에도 쓰인단 말이야? 그럼 세탁기 청소도 베이킹소다를 활용하면 될까?				0	2022-08-04 11:19:19	2022-08-04 11:19:19
BK22004165	10	전문가	당연하지, 세탁조에 식초랑 베이킹소다를 넣은 후에 통세척을 하면 도움이 많이 될거야.	베이킹소다 세탁조	https://www.ekn.kr/web/view.php?key=20201211001522311	2020/12/11	0	2022-08-04 11:19:19	2022-08-04 11:19:19
BK22004165	11	질문자	정말? 우리집 세탁기에서 계속 퀴퀴한 냄새가 나서 스트레스였는데 당장 해봐야겠다. 근데 왜 그런 냄새가 나는걸까?				0	2022-08-04 11:19:19	2022-08-29 13:31:28
BK22004165	12	전문가	세탁조에서 퀴퀴한 냄새가 나는건 빨래하면서 생긴 물 때나 곰팡이가 쌓여서 그래. 그러니까 얼른 청소해봐.	세탁기 냄새	https://kormedi.com/1410789/%ea%bf%89%ea%bf%89%ed%95%9c-%ec%97%ac%eb%a6%84%ec%b2%a0%ec%97%90%eb%8f%84-%eb%b9%a8%eb%9e%98-%ec%9e%98%ed%95%98%eb%8a%94-%ec%a3%bc%eb%b6%80-9%eb%8b%a8%ec%9d%98-%eb%b9%84%eb%b2%95%ec%9d%80/	2022/07/27	0	2022-08-04 11:19:19	2022-08-29 13:31:28
BK22004165	13	질문자	진작에 너한테 물어볼걸 그랬네. 난 얼른 장마 시작되기 전에 세탁조 청소부터 해야겠다. 요즘엔 장마철이라 세탁조에서 더 냄새가 났던 걸까?				0	2022-08-04 11:19:19	2022-08-29 13:31:28
BK22004165	14	전문가	그렇지, 장마 시즌에는 세균과 곰팡이가 서식하기 좋은 환경이 되니까 말이야. 집안 공기도 눅눅해지고.	여름철 빨래	http://www.ggilbo.com/news/articleView.html?idxno=922083	2022/07/12	0	2022-08-04 11:19:19	2022-08-29 13:31:28
BK22004165	15	질문자	그래서 나는 장마 시즌이 정말 싫어. 옷장에 넣어둔 옷에도 냄새가 나거든.				0	2022-08-04 11:19:19	2022-08-04 11:19:19
BK22004165	16	전문가	그럼 옷장에 신문지를 구겨서 넣어둬 봐. 그러면 벌레를 없애는 데 효과적이기도 하고 습기나 냄새를 잡을수도 있거든.	장마 빨래	http://weekly.chosun.com/news/articleView.html?idxno=21117	2022/07/07	0	2022-08-04 11:19:19	2022-08-29 13:31:28
BK22004165	17	질문자	정말? 나 오늘 생활의 팁 너무 많이 배우는거 아니야?				0	2022-08-04 11:19:19	2022-08-04 11:19:19
BK22004165	18	전문가	난 아직도 알려줄게 많이 남았는걸?				0	2022-08-04 11:19:19	2022-08-04 11:19:19
BK22004165	19	질문자	하하, 고마워 너 덕분에 든든하다. 오늘 다양한 정보 알려줘서 고마워. 난 일때문에 이제 다시 가봐야 겠어.				0	2022-08-04 11:19:19	2022-08-29 13:31:28
BK22004165	20	전문가	그렇게 생각해준다니 뿌듯하네. 그래 그럼 우리 다음에 또 이야기 나누자!				1	2022-08-04 11:19:19	2022-08-29 13:31:28
