id	utterance_id	role	text	search_query	search_URL	reference_date	terminate	regDate	updDate
BK22006774	1	질문자	우연히 지인한테서 물고기를 얻어왔어요. 여러모로 좋다고 키워보라고 권하시던데, 듣기로는 요새 물고기로도 재테크하는 사람들이 늘고 있다면서요?				0	2022-09-05 04:28:47	2022-10-06 09:25:30
BK22006774	2	전문가	네, 물가도 오르고 투자 심리도 위축되면서 부업을 찾는 사람들이 늘었는데, 열대어를 키워서 판매하는 어테크가 인기예요.	열대어 투자	https://n.news.naver.com/article/015/0004701833?sid=102	2022/05/22	0	2022-09-05 04:28:47	2022-09-05 04:28:47
BK22006774	3	질문자	그렇군요, 사실 물고기를 길러본 적이 없어서 그런데, 구피는 초보자도 잘 키울 수 있나요?				0	2022-09-05 04:28:47	2022-10-05 17:08:58
BK22006774	4	전문가	그럼요, 구피뿐 아니라 네온테트라, 구라미, 코리도라스, 엔젤피시는 초보자가 기르기도 쉬운 편이고, 비교적 수질 관리하기도 쉬워요.	키우기 쉬운 물고기	http://www.mhns.co.kr/news/articleView.html?idxno=202198	2019/04/07	0	2022-09-05 04:28:47	2022-09-05 04:28:47
BK22006774	5	질문자	아, 그렇다면 다행이에요. 구피가 생각보다 많이 키우는 물고기인가 봐요?				0	2022-09-05 04:28:47	2022-09-05 04:28:47
BK22006774	6	전문가	네, 구피는 깃털 같은 꼬리와 아름다운 지느러미를 갖고 있어서 금붕어와 함께 세계에서 가장 인기 있는 애완용 물고기예요.	구피	https://ko.m.wikipedia.org/wiki/%EA%B5%AC%ED%94%BC_(%EC%96%B4%EB%A5%98)	2022/03/04	0	2022-09-05 04:28:47	2022-09-05 04:28:47
BK22006774	7	질문자	확실히 꼬리랑 지느러미가 정말 예쁘더라고요. 구피는 번식력이 좋은 편인가요?				0	2022-09-05 04:28:47	2022-09-05 04:28:47
BK22006774	8	전문가	그럼요, 어항 관리가 서툴러서 혹시라도 몇 마리가 세상을 떠나도 어항을 금방 채울 정도로 구피는 번식력이 좋은 어종이에요.	구피 번식력 물멍	https://n.news.naver.com/article/015/0004571578?sid=101	2021/07/02	0	2022-09-05 04:28:47	2022-09-05 04:28:47
BK22006774	9	질문자	와, 번식력이 뛰어난 물고기군요. 구피도 알을 낳는 어종인가요?				0	2022-09-05 04:28:47	2022-09-05 04:28:47
BK22006774	10	전문가	아뇨, 우리나라에서 키우는 관상어 중 60~70%를 차지하는 구피는 알을 낳지 않고 새끼를 낳는 난태성이에요.	구피 난태성	https://n.news.naver.com/article/008/0004233719?sid=101	2019/06/15	0	2022-09-05 04:28:47	2022-09-05 04:28:47
BK22006774	11	질문자	알이 아니라 새끼를 낳는다니 신기하네요. 구피 키울 때 수온은 몇 도로 맞춰주는 게 좋을까요?				0	2022-09-05 04:28:47	2022-09-05 04:28:47
BK22006774	12	전문가	24~27도 정도에 맞춰주시면 돼요. 보통 구피는 그 온도의 물에 살거든요.	열대어 온도	https://n.news.naver.com/article/032/0002874133?sid=102	2018/06/06	0	2022-09-05 04:28:47	2022-09-05 04:28:47
BK22006774	13	질문자	그렇군요, 혹시 이끼를 먹는 물고기도 있을까요?				0	2022-09-05 04:28:47	2022-09-05 04:28:47
BK22006774	14	전문가	비파와 안시스트루스라는 어종이 어항 벽 등에 붙어서 이끼를 먹어요.	비파 안시스트루스	https://n.news.naver.com/article/008/0004237078?sid=101	2019/06/22	0	2022-09-05 04:28:47	2022-09-05 04:28:47
BK22006774	15	질문자	음, 같이 키우면 이끼 관리하는 데 도움이 되겠어요. 혹시 물고기 키우면서 주의해야 할 점이 있을까요?				0	2022-09-05 04:28:47	2022-09-05 04:28:47
BK22006774	16	전문가	물고기는 대부분 스트레스에 취약해서 수족관 유리를 살짝만 두드려도 스트레스를 받아요. 수족관안에선 파동이 아주 크게 느껴져서 물고기가 놀랄 수 있거든요.	반려물고기 스트레스	https://n.news.naver.com/article/658/0000013727?sid=103	2022/07/04	0	2022-09-05 04:28:47	2022-09-05 04:28:47
BK22006774	17	질문자	아, 그런 행동이 물고기에게 스트레스가 될 수 있을 거라곤 생각 못했어요.				0	2022-09-05 04:28:47	2022-09-05 04:28:47
BK22006774	18	전문가	아무래도 사람한텐 그 정도 파동이 크게 안 느껴지니까요.				1	2022-09-05 04:28:47	2022-10-06 09:25:30
BK22006774	19	질문자	이래저래 좋은 정보 얻어가네요. 고마워요, 물고기 기를 때 큰 도움이 될 것 같아요.				0	2022-09-05 04:28:47	2022-09-05 04:28:47
BK22006774	20	전문가	도움이 됐다니 다행이에요. 키우다가 어려운 점 생기면 언제든 물어봐 주세요.				0	2022-09-05 04:28:47	2022-09-05 04:28:47
