id	utterance_id	role	text	search_query	search_URL	reference_date	terminate	regDate	updDate
BK22004383	1	질문자	최근에 배꼽이 드러나는 옷을 입는 젊은 사람들이 많은데, 그런 옷을 뭐라고 부르나요?				0	2022-08-04 11:38:54	2022-08-07 13:57:21
BK22004383	2	전문가	크롭 톱을 말씀하시는 거군요? 배, 허리, 배꼽을 드러내는 옷이죠.	크롭톱	https://ko.wikipedia.org/wiki/%ED%81%AC%EB%A1%AD_%ED%86%B1	2022/07/09	0	2022-08-04 11:38:54	2022-08-07 13:57:21
BK22004383	3	질문자	맞아요, 크롭 톱이라고 부르는 것 같았어요. 요새는 그렇게 짧은 옷을 입는 게 유행인가요?				0	2022-08-04 11:38:54	2022-08-07 13:57:21
BK22004383	4	전문가	네, 요새 Y2K 패션이 다시 유행하고 있거든요. Y2K 패션이란 1990년대부터 2000년대 초반까지 유행했던 패션을 말하는데, 말씀하신 크롭 톱 말고도 로우라이즈 팬츠, 미니스커트 등이 있어요. 참고로 로우라이즈 팬츠는 골반에 걸쳐 입는 바지를 뜻하는 거고요.	크롭톱 Y2K 패션	https://www.mk.co.kr/news/business/view/2022/03/231784/	2022/03/14	0	2022-08-04 11:38:54	2022-08-18 14:29:18
BK22004383	5	질문자	패션은 돌고 돈다는 말이 맞는가 보네요. 그런데 정확히 Y2K 라는 게 어떤 뜻인가요?				0	2022-08-04 11:38:54	2022-08-07 13:57:21
BK22004383	6	전문가	Y2K 트렌드는 Year to 2000의 줄임말이에요. 세기말을 의미하는 단어죠.	Y2K	http://www.slist.kr/news/articleView.html?idxno=347865	2022/04/20	0	2022-08-04 11:38:54	2022-08-07 13:57:21
BK22004383	7	질문자	아, 1990년대 후면 세기말이 맞네요. 그런데 이렇게 20년 전의 유행이 다시 시작된 이유가 뭔가요?				0	2022-08-04 11:38:54	2022-08-07 13:57:21
BK22004383	8	전문가	최근에 세기말 감성을 담은 드라마나 예능 등이 많이 방영되었거든요. 그래서 2, 30대 젊은 사람들 사이에서 그때의 패션과 아이템들이 다시 유행하고 있는 거예요.	Y2K 패션 유행 이유	https://economist.co.kr/2022/03/08/industry/normal/20220308120715217.html	2022/03/11	0	2022-08-04 11:38:54	2022-08-07 13:57:21
BK22004383	9	질문자	드라마에서 나오는 패션이 실제로 유행하다니, 역시 문화는 연결되어 있는 거군요. 그렇다면 의류 브랜드에서도 이런 트렌드를 많이 반영해서 옷을 만들고 있겠네요?				0	2022-08-04 11:38:54	2022-08-07 13:57:21
BK22004383	10	전문가	네, 요즘 패션계에서는 레트로 감성을 잘 담고 있는 아이템들이 많이 나오고 있어요. 복고 열풍에 힘입은 부츠컷과 일자핏 데님 상품들도 새롭게 나오고 있죠.	Y2K 패션 영화	https://www.newspim.com/news/view/20220422000769	2022/04/24	0	2022-08-04 11:38:54	2022-08-18 14:29:18
BK22004383	11	질문자	저도 옛날에 부츠컷 바지를 정말 많이 입었는데, 새삼 추억이 떠오르네요. 그런데 Y2K는 알겠는데 레트로는 무슨 뜻인가요?				0	2022-08-04 11:38:54	2022-08-07 15:18:36
BK22004383	12	전문가	레트로, 즉 복고풍은 복고주의를 지향하는 하나의 유행이나 패션 스타일이에요. 회상, 회고, 추억이라는 뜻의 영어 단어 retrospect의 줄임말이죠. 과거의 상태나 돌아가려 하거나, 그때의 체제, 전통 등을 그리워해서 본뜬다는 의미를 담고 있어요.	레트로	https://ko.wikipedia.org/wiki/%EB%B3%B5%EA%B3%A0%ED%92%8D	2022/05/22	0	2022-08-04 11:38:54	2022-08-22 10:03:13
BK22004383	13	질문자	아, 그러면 레트로가 더 넓은 의미를 가진 단어네요. 그러고 보니 저는 요새 곱창끈을 많이 쓰고 있어요.				0	2022-08-04 11:38:54	2022-08-07 13:57:21
BK22004383	14	전문가	곱창밴드는 대표적인 레트로 아이템 중의 하나죠. 영어로는 헤어 스크런치라고 하는데, 1990년대에 한국에서 뿐만 아니라 전 세계적으로 인기를 얻었어요.	곱창밴드	https://www.donga.com/news/article/all/20200817/102514630/1	2020/08/17	0	2022-08-04 11:38:54	2022-08-07 13:57:21
BK22004383	15	질문자	역시 패션은 돌고 돌 뿐만 아니라, 국경을 따지지도 않는 군요. 아, 그러고 보니 요즘 수영복도 조금 옛날 느낌이 나는 것들이 많은 것 같아요.				0	2022-08-04 11:38:54	2022-08-07 13:57:21
BK22004383	16	전문가	맞아요, 현재 수영복 트렌드도 비키니보다도 Y2K 스타일이 더 주목받고 있죠. 한 업체는 비키니에 화려한 파자마 셔츠와 팬츠를 더한 수영복을 출시했고, 또 다른 곳에서는 보헤미안 느낌의 크로셰 톱에 데님 팬츠를 매치한 수영복을 매치했어요.	Y2K 스타일 수영복	http://www.apparelnews.co.kr/news/news_view/?idx=199094	2022/07/12	0	2022-08-04 11:38:54	2022-08-24 08:36:34
BK22004383	17	질문자	팬츠와 셔츠가 같이 매치되어서인지 언뜻 보면 수영복인지 잘 모르겠는 것들도 있더라고요.				0	2022-08-04 11:38:55	2022-08-07 13:57:21
BK22004383	18	전문가	그게 또 요새의 패션 포인트인 것 같기도 하고요.				0	2022-08-04 11:38:55	2022-08-07 13:57:21
BK22004383	19	질문자	그러고 보니 그렇네요. 그나저나, 오늘도 대화를 하다 보니 시간이 이렇게 지났네요. 오늘도 유용한 정보 감사드려요.				0	2022-08-04 11:38:55	2022-08-07 13:57:21
BK22004383	20	전문가	뭘요, 다음에도 궁금한 게 있으면 또 찾아오세요. 그럼 조심히 들어가시고요.				1	2022-08-04 11:38:55	2022-08-24 08:36:34
