id	utterance_id	role	text	search_query	search_URL	reference_date	terminate	regDate	updDate
BK22004009	1	질문자	아, 진짜 큰일났다. 변기가 막혔는데 집에 뚫어뻥도 없고 어떻게 뚫어야 할지 모르겠네.				0	2022-08-04 11:17:45	2022-08-29 08:04:14
BK22004009	2	전문가	집에 페트병 있으면 그거로 뚫어뻥 대체 할 수 있어. 페트병 아래 부분을 잘라주고 페트병 앞쪽을 변기에 밀착시켜 준다음에 공기를 넣고 당겨주면 돼. 이게 우리가 뚫어뻥 쓸때랑 같은 역할을 해주는 건데, 계속 당기다보면 공기가 변기에 들어가져서 물이 내려가져.	페트병으로 변기 뚫기	http://www.woodkorea.co.kr/news/articleView.html?idxno=40688	2019/12/08	0	2022-08-04 11:17:45	2022-08-26 20:36:15
BK22004009	3	질문자	하필 아까 쓰레기 다 분리수거 해놓고 와서 집에 페트병이 없네. 다른 방법은 없어?				0	2022-08-04 11:17:45	2022-08-04 11:17:45
BK22004009	4	전문가	샴푸는 있지? 샴푸를 변기 안쪽에 바르고 30분 정도 기다려봐. 30분 이후에 물을 내려주면 되는데, 뜨거운 물을 같이 넣어주면 샴푸가 녹으면서 변기가 더 잘 뚫려.	샴푸로 변기 뚫는법	https://www.dailysecu.com/news/articleView.html?idxno=89852	2019/12/23	0	2022-08-04 11:17:45	2022-08-29 08:04:14
BK22004009	5	질문자	뭔가 지금 변기에 샴푸 덕지덕지 바르고 있으면 자괴감 느껴질 것 같은데.				0	2022-08-04 11:17:45	2022-08-04 11:17:45
BK22004009	6	전문가	그럼 집에 콜라 있으면 변기에 부어놓고 20분에서 30분 정도 기다리고 물 내려봐. 콜라 속에 들어있는 이산화탄소가 변기 속 물에 거품을 내고 압력을 더해주는 원리라서 뚫릴거야.	콜라로 변기 뚫기	https://www.dailypop.kr/news/articleView.html?idxno=48899	2021/02/01	0	2022-08-04 11:17:45	2022-08-29 08:04:14
BK22004009	7	질문자	콜라가 있긴 한데, 사실 지금 집에 여자친구도 와있어서 몰래 급하게 뚫어야 하는데 샴푸나 콜라를 사용하는 방법은 너무 시간이 오래 걸릴 것 같아. 다른 방법도 알고 있어?				0	2022-08-04 11:17:45	2022-08-04 11:17:45
BK22004009	8	전문가	그럼 집에 옷걸이 있지? 철사로 된 옷걸이 말이야. 그걸 일자로 길게 편 다음에 변기 구멍 안으로 깊숙이 넣어서 막혀있는 이물질을 빼내봐.	옷걸이로 변기 뚫는법	http://www.seoulwire.com/news/articleView.html?idxno=69098	2019/02/15	0	2022-08-04 11:17:45	2022-08-04 11:17:45
BK22004009	9	질문자	오, 바로 옷걸이 가져와서 해봐야겠다.				0	2022-08-04 11:17:45	2022-08-04 11:17:45
BK22004009	10	전문가	부디 변기 뚫기에 성공하기를 바란다.				0	2022-08-04 11:17:45	2022-08-04 11:17:45
BK22004009	11	질문자	옷걸이로 열심히 해봤는데 그래도 물이 안내려가는데? 아, 여자친구 이상한 낌새 느끼기 전에 빨리 뚫고 싶은데.				0	2022-08-04 11:17:45	2022-08-04 11:17:45
BK22004009	12	전문가	그럼 비닐 이용해서 뚫는 방법을 써보자. 적당히 두꺼운 비닐 찾아다가 변기에 덮어놓고 박스 테이프로 공기가 안들어가게 틈새를 단단하게 고정해. 그 다음에 비닐을 눌러서 공기압을 줘서 변기를 뚫는거야.	비닐이나 랩으로 변기 뚫는법	https://www.woodkorea.co.kr/news/articleView.html?idxno=41206	2019/12/13	0	2022-08-04 11:17:45	2022-08-04 11:17:45
BK22004009	13	질문자	오 그런 방법도 있어? 얼른 비닐 가져다가 해볼게.				0	2022-08-04 11:17:45	2022-08-26 20:36:15
BK22004009	14	전문가	이번엔 꼭 성공하길 바랄게.				0	2022-08-04 11:17:45	2022-08-04 11:17:45
BK22004009	15	질문자	오, 비닐 이용해서 했더니 변기 뚫렸어! 집에 뚫어뻥 꼭 사다놓던가 해야지 안되겠네. 일반 고무 달린 뚫어뻥 말고 다른 형식으로 된 것도 있어?				0	2022-08-04 11:17:45	2022-08-29 08:04:14
BK22004009	16	전문가	일단 성공한거 축하한다. 뚫어뻥은 반원형 고무가 달려있어서 그 부분 압력차를 이용하는 형식과 피스톤 형식의 뚫어뻥도 있는데, 이건 막힌 부분에 바닥면을 갖다 대고 위에 달려있는 손잡이를 끌어 당기는 방식이야. 고무 달려있는 뚫어뻥이 싫으면 피스톤 형식을 사서 써봐.	뚫어뻥	https://ko.wikipedia.org/wiki/%EB%9A%AB%EC%96%B4%EB%BB%A5	2022/03/12	0	2022-08-04 11:17:45	2022-08-29 08:04:14
BK22004009	17	질문자	그걸로 꼭 구비해 놔야겠다. 급하게 뚫는다고 엄청 고생했네. 여러가지 방법 알려줘서 고맙다.				0	2022-08-04 11:17:45	2022-08-04 11:17:45
BK22004009	18	전문가	뚫어뻥도 구비해놓고 싱크대, 세면대, 변기, 배수구 등 막힌 배수관을 뚫어주는 전용 세정제들도 판매하니까 그것도 하나 사다 놔.	막힌 변기 뚫어주는 세제	http://www.dailysmart.co.kr/news/articleView.html?idxno=55309	2022/01/25	0	2022-08-04 11:17:45	2022-08-04 11:17:45
BK22004009	19	질문자	오늘 너무 고생해서 뚫어뻥이랑 세정제랑 다 사다 놓을거야. 볼일 보고 뒷처리 할 때 물티슈로 마무리 하면서 변기에 버렸더니 이렇게 막혀버리네. 잘 분해된다고 해서 쓰는건데 말이야.				0	2022-08-04 11:17:45	2022-08-04 11:17:45
BK22004009	20	전문가	물티슈 제조사들의 주장과는 다르게 물티슈는 물과 티슈만으로 만들어진 게 아니야. 허프포스트에 따르면 대부분의 물티슈에 미세 플라스틱이 있거든. 그래서 쉽게 분해되지 않으니까 물티슈는 변기에 버리지 않는게 좋아. 어쨌든 변기 뚫느라 몸고생, 맘고생 많이 했다. 여자친구랑 즐거운 시간 보내.	물티슈 변기에 버리면 안되는 이유	https://www.huffingtonpost.kr/entry/wet-wipes-flush_kr_5bebd4d0e4b0caeec2bf621e	2018/11/15	1	2022-08-04 11:17:45	2022-08-29 08:04:14
