id	utterance_id	role	text	search_query	search_URL	reference_date	terminate	regDate	updDate
BK22001628	1	질문자	얼마 전부터 세탁기에서 안 좋은 냄새가 나기 시작했어요. 왜 이런 걸까요?				0	2022-07-20 16:17:58	2022-08-02 12:01:32
BK22001628	2	전문가	혹시 최근에 세탁기 청소를 하신 적이 있으실까요?				0	2022-07-20 16:17:58	2022-07-21 10:42:10
BK22001628	3	질문자	혹시 세탁기도 청소를 해야 하나요?				0	2022-07-20 16:17:58	2022-08-02 12:01:32
BK22001628	4	전문가	네, 물론이죠. 세탁기는 장기간 습기에 노출되어 있어서 관리가 어렵기도 하지만 오염된 세탁기로 빨래를 해 청결하지 못한 옷들을 장기간에 걸쳐서 입는다면 건강에 문제가 될 수 있거든요.	세탁기 청소	http://www.outsourcing.co.kr/news/articleView.html?idxno=93170	2022/01/14	0	2022-07-20 16:17:58	2022-07-21 10:42:10
BK22001628	5	질문자	부끄러운 소리지만 세탁기도 청소를 해야 하는 줄 몰랐네요. 지금 처음 알게 됐어요.				0	2022-07-20 16:17:58	2022-08-02 12:01:32
BK22001628	6	전문가	빨래에서 냄새가 나는 것도 섬유 유연제를 사용하는 것이 중요한 게 아니라 세탁조 청소를 해야 하는 문제죠. 빨래에 묻은 세탁기 속 세균이 습한 공기와 만나면 악취를 유발하거든요.	세탁기 냄새	http://www.kbiznews.co.kr/news/articleView.html?idxno=91586	2022/06/27	0	2022-07-20 16:17:58	2022-07-21 10:42:10
BK22001628	7	질문자	저는 그것도 모르고 요즘 섬유 유연제 양만 잔뜩 늘렸네요.				0	2022-07-20 16:17:58	2022-08-02 12:01:32
BK22001628	8	전문가	그리고 혹시 세탁을 냉수로만 하고 있지는 않으신가요?				0	2022-07-20 16:17:58	2022-07-21 10:42:10
BK22001628	9	질문자	어, 네, 맞아요. 대체로 냉수로 세탁하는 편일 것 같아요. 그보다 물 온도를 설정한 기억이 없네요.				0	2022-07-20 16:17:58	2022-08-02 12:01:32
BK22001628	10	전문가	앞으로는 조금 더 신경을 쓰시는 게 좋겠네요. 냉수로만 세탁하는 경우 세탁기에 곰팡이가 생길 가능성이 더 늘어나죠. 또 세탁기를 건조하지 않는 경우에는 박테리아가 자라기도 하고요.	세탁기 곰팡이	http://it.chosun.com/site/data/html_dir/2021/08/18/2021081801954.html	2021/08/19	0	2022-07-20 16:17:58	2022-07-21 10:42:10
BK22001628	11	질문자	아이고, 설마 제 세탁기에서 곰팡이가 자라고 있는 것은 아니겠죠? 곰팡이가 핀 걸 본 기억은 없긴 한데요. 혹시 어떤 걸로 곰팡이 여부를 알 수 있을까요?				0	2022-07-20 16:17:58	2022-08-02 12:01:32
BK22001628	12	전문가	눈에 보이지 않더라도 세탁 후 옷이나 세탁실에서 달걀 썩은 냄새나 유황냄새가 난다면 곰팡이를 의심해 보셔야 해요.	세탁기 냉수	http://it.chosun.com/site/data/html_dir/2021/08/18/2021081801954.html	2021/08/19	0	2022-07-20 16:17:58	2022-07-21 10:42:10
BK22001628	13	질문자	아까 냄새가 난다고 하기는 했지만 다행히도 아직 그 단계까지는 아닌 것 같아요. 그러면 혹시 어떻게 해야 세탁기를 깨끗하게 쓸 수 있나요?				0	2022-07-20 16:17:58	2022-08-02 12:01:32
BK22001628	14	전문가	우선 가장 쉬운 방법은 내부에 습기가 차는 것을 방지하기 위해 세탁기를 사용한 후 문을 열어둬야 해요.	세탁조 관리법	http://www.dailypop.kr/news/articleView.html?idxno=61117	2022/07/05	0	2022-07-20 16:17:58	2022-07-21 10:42:10
BK22001628	15	질문자	가끔 뭐 본다고 빨래가 끝났다는 소리를 듣고도 방치한 적이 많았는데 그러면 안 되는 거였군요. 앞으로는 문이라도 바로바로 열어 둬야겠어요.				0	2022-07-20 16:17:58	2022-08-02 12:01:32
BK22001628	16	전문가	그리고 세탁기에 물만 받아서 베이킹 소다와 식초를 넣고 돌리면 세탁기 내부를 깨끗하게 살균할 수 있어요.	세탁기 식초 살균	https://kormedi.com/1343632/%ea%bf%89%ea%bf%89%ed%95%9c-%ec%97%ac%eb%a6%84%ec%b2%a0%eb%b9%a8%eb%9e%98-%ec%9e%98%ed%95%98%eb%8a%94-%eb%b0%a9%eb%b2%95-3/	2021/06/26	0	2022-07-20 16:17:58	2022-07-21 10:42:10
BK22001628	17	질문자	생각보다 간단한 방법으로 청소가 되는군요. 그럼 이렇게 청소하면 문제없겠죠?				0	2022-07-20 16:17:58	2022-08-02 12:01:32
BK22001628	18	전문가	아니요. 세탁기 청소에서 더 신경 써줘야 하는 부분이 있어요. 세제함도 신경 써줘야 하는데 항상 물이 닿아 입구와 내부에 세탁 후 남은 찌꺼기가 눌어 붙거든요. 그리고 세탁기 문 아래쪽 배수필터에 붙은 보푸라기나 실밥을 방치하는 것도 세균과 곰팡이가 번식할 수 있어서 제거해 줘야 하죠. 세탁기 입구의 고무 패킹도 청소해 주는 것이 좋고요.	세탁기 패킹 청소	http://view.asiae.co.kr/news/view.htm?idxno=2016062213461884774	2016/06/22	0	2022-07-20 16:17:58	2022-07-21 10:42:10
BK22001628	19	질문자	이제까지 세탁기를 청소한다는 생각 없이 살았는데 생각보다 신경 써 줄게 많은 친구였군요. 할 게 너무 많네요.				0	2022-07-20 16:17:58	2022-08-02 12:01:32
BK22001628	20	전문가	네, 그리고 세탁기 분해 청소도 추천드려요. 아기가 있는 집이나 세탁을 자주 하는 경우는 1년에 한 번 정도가 좋고 보통 2년에서 3년 주기로 하시면 좋죠.	세탁기 분해청소	https://www.hangyo.com/news/article.html?no=86577	2018/09/18	0	2022-07-20 16:17:58	2022-07-21 10:42:10
BK22001628	21	질문자	분해라니, 저는 기계를 잘 못 다루니 이건 업체를 알아봐야겠네요. 오늘 알려주신 덕분에 깨끗하게 세탁기를 사용할 수 있을 것 같아요. 감사합니다.				1	2022-07-20 16:17:58	2022-08-02 12:01:32
