id	utterance_id	role	text	search_query	search_URL	reference_date	terminate	regDate	updDate
BK22007446	1	질문자	나 오늘 뉴스로 파키스탄 홍수에 대해 봤는데 심각하더라. 너도 알고 있었어?				0	2022-09-06 00:06:02	2022-09-16 12:53:29
BK22007446	2	전문가	응, 나도 TV 뉴스로 봤는데, 영상으로 보니까 더 심각해 보였어.				0	2022-09-06 00:06:02	2022-09-16 12:53:29
BK22007446	3	질문자	홍수 때문에 사람들이 많이 피해를 본 것 같아. 사망자들도 많았던 것 같았는데, 맞지?				0	2022-09-06 00:06:02	2022-09-16 12:53:29
BK22007446	4	전문가	응. 로이터에 따르면 사망자가 1100명이 넘는데, 거기에 어린이 380명이 포함되어 있어. 기록적인 홍수 때문에 파키스탄 국토 3분의 1이 물바다가 됐고, 파키스탄 사는 사람들 7명 중 1명꼴인 3300만 명 이상이 피해를 입었어.	파키스탄 홍수	https://www.joongang.co.kr/article/25098669	2022/09/01	0	2022-09-06 00:06:02	2022-09-16 12:53:29
BK22007446	5	질문자	아니, 도대체 비가 얼마나 왔길래 그래?				0	2022-09-06 00:06:02	2022-09-16 12:53:29
BK22007446	6	전문가	인더스강 주변에 있는 펀자브주, 신드주 쪽에서 최악의 홍수가 발생했는데, 특히 신드주는 8월 초부터 26일까지 443mm의 비가 내렸어. 이 수치는 평년 강수량의 780퍼센트가 넘는 수치야. 비 때문에 강이 범람해서 집들도 무너지고 도로도 끊기고 피해가 극심해.	파키스탄 강수량	https://www.joongang.co.kr/article/25098669	2022/09/01	0	2022-09-06 00:06:02	2022-09-16 12:53:29
BK22007446	7	질문자	평년 강수량의 780퍼센트라고? 와 상상이 안 가는 수치인데, 왜 그렇게 비가 많이 온 거야?				0	2022-09-06 00:06:02	2022-09-16 12:53:29
BK22007446	8	전문가	몬순 때문이야. 이렇게 유례없는 홍수 피해가 발생한 건. 괴물 몬순이 기록적인 여름철 집중호우를 몰고 왔어.	파키스탄 홍수 원인	https://www.joongang.co.kr/article/25098669	2022/09/01	0	2022-09-06 00:06:02	2022-09-16 12:53:29
BK22007446	9	질문자	몬순? 어디서 많이 들어본 단어이긴 한데 무슨 말이야?				0	2022-09-06 00:06:02	2022-09-06 00:06:02
BK22007446	10	전문가	몬순은 계절이라는 뜻이야. 아랍어 마우심이란 단어에서 파생된 단어지. 몬순은 바다와 대륙이 만나는 곳에서 생겨. 육지와 바다이 온도 차에 따라서 계절풍이 부는 현상을 말해. 겨울에는 대륙에서 바다로, 여름에는 바다에서 대륙으로 계절풍이 부는 거지.	몬순의 뜻	https://www.joongang.co.kr/article/25098669	2022/09/01	0	2022-09-06 00:06:02	2022-09-16 12:53:29
BK22007446	11	질문자	아, 파키스탄이 몬순기후인 거구나? 근데 계절풍이면 바람이잖아. 바람이 왜 홍수 피해를 줘?				0	2022-09-06 00:06:02	2022-09-16 12:53:29
BK22007446	12	전문가	맞아. 파키스탄과 인도 등 남아시아일대가 몬순기후의 영향을 받아. 우리나라를 포함한 동아시아도 그렇고. 근데 이 몬순이 여름철에는 바다에서 수증기를 몰고 오기 때문에 육지에 많은 비를 내리게 만들어. 한국에 장마 역시 이런 이유에서 발생하는 거고.	파키스탄 몬순기후	https://www.joongang.co.kr/article/25098669	2022/09/01	0	2022-09-06 00:06:02	2022-09-16 12:53:29
BK22007446	13	질문자	아, 장마도 몬순기후 때문에 생기는 현상이구나. 근데 매년 몬순기후 영향을 받는데 올해는 특히 이렇게 비가 많이 내리는 이유가 뭐야?				0	2022-09-06 00:06:02	2022-09-16 12:53:29
BK22007446	14	전문가	지구온난화 때문이야. 기온이 높아지면서 대기 중 수증기가 많아졌고, 이 때문에 몬순기후 지역에는 집중호우의 강도가 세지고, 빈도도 잦아졌어. 지구온난화가 몬순을 더 강력하고 불규칙하게 만들어서 괴물몬순이 되는 거야.	지구 온난화 몬순	https://www.joongang.co.kr/article/25098669	2022/09/01	0	2022-09-06 00:06:02	2022-09-16 12:53:29
BK22007446	15	질문자	지구온난화가 진짜 문제이긴 하구나. 몬순기후지역은 아시아 국가가 많다며? 아시아 국가들이 조심 해야 하는 거야?				0	2022-09-06 00:06:03	2022-09-16 12:53:29
BK22007446	16	전문가	응 맞아. 기후 전문가들도 점점 기후 위기가 심각해지면서 몬순 기후 영향을 받는 지역에 있는 아시아 국가들이 자주, 그리고 더 심한 집중 호우에 노출될 확률이 높다고 경고했어. 실제로 지구의 기온이 1도 올라가면 여름철에 내리는 비의 양이 5퍼센트 증가한다는 연구 결과도 있으니, 지구의 온도가 높아지지 않도록 전 세계인이 노력해야겠지.	몬순기후 지역	https://www.joongang.co.kr/article/25098669	2022/09/01	0	2022-09-06 00:06:03	2022-09-16 12:53:29
BK22007446	17	질문자	전 세계인이 어떤 노력을 우선적으로 해야 하는 걸까?				0	2022-09-06 00:06:03	2022-09-06 00:06:03
BK22007446	18	전문가	포츠담 기후영향연구소의 안데르스 레버만 기후 과학자에 따르면 각 나라의 정책 결정자들이 책임지고 전 세계에서 나오는 온실가스의 배출량을 대폭 줄여야 해. 점점 더 혼란스러워지는 몬순이 그 지역의 농업과 경제를 위협하지 못하게 말이야.	온실가스 몬순	https://www.joongang.co.kr/article/25098669	2022/09/01	0	2022-09-06 00:06:03	2022-09-16 12:53:29
BK22007446	19	질문자	네 얘기를 들어보니 나도 온실가스가 생길 수 있을 만한 습관은 고쳐보도록 노력 해야겠다. 지구가 아프지 말아야 이런 자연 재해에 의한 피해도 덜 발생할 것 같아. 오늘 덕분에 좋은 이야기 많이 듣고 가.				0	2022-09-06 00:06:03	2022-09-16 12:53:29
BK22007446	20	전문가	도움이 됐다면 다행이야. 나도 오늘 너와 나눈 대화 너무 유익하고 즐거웠어. 다음에 만날 때는 더 재미있는 주제 가지고 얘기하자. 오늘 조심히 가고, 다음에 봐!				1	2022-09-06 00:06:03	2022-09-16 12:53:29
