id	utterance_id	role	text	search_query	search_URL	reference_date	terminate	regDate	updDate
BK22007717	1	질문자	보건복지부에서 새로운 복지 서비스를 발표했다고 뉴스에 나오던데 어떤 내용인가요?				0	2022-09-06 16:42:39	2022-09-06 16:42:39
BK22007717	2	전문가	오늘부터 차세대 사회보장정보 시스템 2차개통을 하면서 맞춤형 급여 안내를 전 국민 대상으로 확대, 전국단위 신청사업 확대 등이 추가될 거라고 보건복지부에서 예고했어요.	보건복지부 차세대 사회보장정보시스템	https://kizmom.hankyung.com/news/view.html?aid=202209051494o	2022/09/05	0	2022-09-06 16:42:39	2022-09-06 16:42:39
BK22007717	3	질문자	전국민 대상으로 확대 되는 군요. 맞춤형 급여를 신청하려면 어디에서 하면 되나요?				0	2022-09-06 16:42:39	2022-09-22 09:18:30
BK22007717	4	전문가	복지멤버십을 신청하려면 온라인 복지로를 통하거나 주소지와 관계없이 전국 읍면동 행정복지센터를 방문하면 돼요.	복지서비스 안내받기	https://www.news1.kr/articles/4794203	2022/09/05	0	2022-09-06 16:42:39	2022-09-22 09:18:30
BK22007717	5	질문자	복지멤버십이라는 제도는 처음 들어보는데 어떤 서비스 인가요?				0	2022-09-06 16:42:39	2022-09-06 16:42:39
BK22007717	6	전문가	개인의 소득이나 재산 등을 고려해서 받을 수 있는 복지서비스를 선제적으로 알려주는 맞춤형 급여 안내 제도가 복지멤버십이에요.	복지멤버십	https://www.etnews.com/20220905000193	2022/09/05	0	2022-09-06 16:42:39	2022-09-06 16:42:39
BK22007717	7	질문자	복지멤버십이 그런 제도였군요. 그리고 사회보장정보 시스템도 2차개통을 했다고 하셨는데 1차개통은 언제한건가요?				0	2022-09-06 16:42:39	2022-09-06 16:42:39
BK22007717	8	전문가	전체 과업 중 복지서비스가 시급한 수요자들에게 선제적으로 제공이 가능한 서비스, 단기간의 개편을 통해 사용자의 불편을 해소할 수 있는 과업을 선별해 추진한 1차 개통은 작년 9월 6일에 1차개통했다고 보건복지부에서 밝혔어요.	차세대 사회보장시스템 1차개통	https://newsis.com/view/?id=NISX20210905_0001572398&cID=10201&pID=10200	2021/09/05	0	2022-09-06 16:42:39	2022-09-06 16:42:39
BK22007717	9	질문자	그렇군요. 그럼 사회보장정보 시스템 1차개통을 통해서 얼마나 많은 사람들이 혜택을 받은 건가요?				0	2022-09-06 16:42:39	2022-09-06 16:42:39
BK22007717	10	전문가	복지멤버십은 지난 달 말일을 기준으로 944만명이 가입된 상태인데, 이 중 65만 가구가 통합문화이용권, 이동통신 요금감면 등의 81만3000건의 혜택을 받게 될 예정이에요.	차세대 사회보장시스템 혜택	https://www.newsworks.co.kr/news/articleView.html?idxno=608352	2022/09/05	0	2022-09-06 16:42:39	2022-09-22 09:18:30
BK22007717	11	질문자	81만 3천건의 혜택이면 굉장히 많이 받았네요. 그럼 2차 개통 차세대 시스템은 어떻게 개편되는 건가요?				0	2022-09-06 16:42:39	2022-09-06 16:42:39
BK22007717	12	전문가	차세대 시스템은 오늘부터 사회보장정보시스템과 희망이음 일부가 먼저 개편이 되고 오는 11월에는 희망이음 전체, 올 12월 통계정보시스템, 이렇게 세 차례 단계적으로 개편될 예정이에요.	차세대 사회보장시스템 2ㅊ차개편	https://bravo.etoday.co.kr/view/atc_view.php?varAtcId=13937	2022/09/05	0	2022-09-06 16:42:39	2022-09-22 09:18:30
BK22007717	13	질문자	단계적으로 개편이 될 예정이군요. 근데 이번에 전국민 대상으로 확대했다고 하셨는데 그럼 사람들이 많이 모여서 시스템 오류가 날 가능성이 높지 않을까요?				0	2022-09-06 16:42:39	2022-09-06 16:42:39
BK22007717	14	전문가	안그래도 기존 사회보장정보시스템의 인프라를 전면 교체하기 때문에 시스템 개통 초기에 일부 장애가 발생할 가능성이 있다고 보건복지부에서도 판단했어요. 그래서 개통 후 1개월을 시스템 안정화 기간으로 설정하고, 이 기간동안 긴급상황반, 콜센터를 운영하여 국민의 문의사항이나 사용자 불편사항을 신속히 해소해 나가겠다고 발표했어요.	보건복지부 시스템 안정화 기간	https://www.kpanews.co.kr/article/show.asp?idx=236043&category=C	2022/09/05	0	2022-09-06 16:42:39	2022-09-20 20:18:55
BK22007717	15	질문자	그렇군요. 근데 이런 서비스가 생기기 전에도 우편물로 복지서비스를 신청하라는 안내문을 송부하는 식으로 잘 운영이 되고 있었는데 이런 서비스를 만든 이유가 무엇인가요?				0	2022-09-06 16:42:39	2022-09-22 09:18:30
BK22007717	16	전문가	최근에 발생한 수원 세모녀 사망 사건을 계기로 복지 서비스와 사각지대 발굴시스템을 더욱 개선시키는 계기가 되었어요.	복지서비스 개선 계기 세모녀	https://www.joongang.co.kr/article/25099698	2022/09/05	0	2022-09-06 16:42:39	2022-09-06 16:42:39
BK22007717	17	질문자	저는 처음 들어보는데 수원 세모녀 사망사건이 무엇인가요?				0	2022-09-06 16:42:39	2022-09-06 16:42:39
BK22007717	18	전문가	8년 전 서울 송파 세 모녀 사건 이후로 복지의 사각지대가 다시 드러나게 한 수원 세모녀 사건은 지난 21일 경기 수원시에서 발생했고 극심한 생활고, 난소암과 희귀병의 고통을 겪다 스스로 목숨을 끊은 사건이에요.	수원 세모녀 사건	https://www.seoul.co.kr/news/newsView.php?id=20220829500127&wlog_tag3=naver	2022/08/29	0	2022-09-06 16:42:39	2022-09-06 16:42:39
BK22007717	19	질문자	그런 안타까운 사건이 있었군요. 보건복지부에서 발표한 서비스들로 그런 사건이 다시 일어나지 않았으면 좋겠네요.				0	2022-09-06 16:42:39	2022-09-06 16:42:39
BK22007717	20	전문가	맞아요. 이런 안타까운 사건들이 이번 개편활동으로 사라졌으면 좋겠네요.				0	2022-09-06 16:42:39	2022-09-06 16:42:39
BK22007717	21	질문자	맞아요. 덕분에 복지 서비스에 대해서 많이 알게 되었네요.				0	2022-09-06 16:42:39	2022-09-06 16:42:39
BK22007717	22	전문가	언제든지 필요한 정보나 궁금한 점이 있으면 연락주세요. 안녕히 계세요.				1	2022-09-06 16:42:39	2022-09-22 09:18:30
