id	utterance_id	role	text	search_query	search_URL	reference_date	terminate	regDate	updDate
BK22008376	1	질문자	고속도로에 휴게소 있잖아. 요즘은 여행 중에 잠시 들르는 곳이 아니라 아예 휴게소 투어가 여행 상품으로 떠오르고 있다고 하던데 혹시 알고 있어?				0	2022-09-14 14:58:13	2022-09-14 14:58:13
BK22008376	2	전문가	맞아. 고속도로 휴게소는 추석 명절 귀성, 귀경길에 한 번쯤은 들르게 되는데, 이제는 그저 쉬어가는 곳이 아니라 먹거리와 볼거리는 물론 사진 명소, 로봇, 반려동물 이색 서비스 같이 즐길 수 있는 요소를 가진 장소로 달라지고 있어.	휴게소 투어	https://news.mt.co.kr/mtview.php?no=2022090817032456306	2022/09/09	0	2022-09-14 14:58:13	2022-09-14 23:10:34
BK22008376	3	질문자	진짜 그렇구나. 휴게소 하면 특히 먹는 음식들로 유명한 곳도 많아서 이제는 휴게소 음식도 하나의 음식 문화로 자리 잡는 모양새인가 보네. 그럼 언제부터 휴게소를 대표하는 음식들이 생기게 된 거야?				0	2022-09-14 14:58:13	2022-09-26 16:01:50
BK22008376	4	전문가	2016년부터 한국 도로공사에서는 매년 휴게소를 찾는 이용객들과 조리학과 교수 등의 전문가를 통해 지역 특산품을 활용해서 요리를 개발한 다음, 깐깐한 평가 기준을 통해 Ex-Food라는 휴게소 대표 음식을 정하고 있어.	휴게소음식	http://www.sisacast.kr/news/articleView.html?idxno=35203	2022/08/01	0	2022-09-14 14:58:13	2022-09-24 12:14:46
BK22008376	5	질문자	그렇구나. 그럼 그 Ex-Food 목록은 어디서 확인할 수 있는 거야? 올해도 정해진 건가?				0	2022-09-14 14:58:13	2022-09-14 23:10:34
BK22008376	6	전문가	도로공사 인스타그램을 통해 확인할 수 있는데, 올해도 식자재와 조리법을 차별화하여 만든 메뉴로 Ex-Food를 지정했어.	2022 휴게소 Ex-Food	http://www.sisacast.kr/news/articleView.html?idxno=35203	2022/08/01	0	2022-09-14 14:58:13	2022-09-19 22:37:21
BK22008376	7	질문자	식도락 여행을 좋아하는 사람들에게는 필수 리스트겠다. 그럼 그 중에 휴게소에서 요즘 제일 인기 있는 메뉴는 뭔지 알아?				0	2022-09-14 14:58:13	2022-09-14 23:10:34
BK22008376	8	전문가	가장 인기가 많은 메뉴로는 강릉 방향의 한우 떡 더덕 스테이크, 횡성 서창 방향 휴게소의 횡성 더덕 설렁탕이 있고, 여주 인천 방향 휴게소의 매운 돼지갈비찜도 인기 메뉴로 선정되었어.	강원도 휴게소 인기 메뉴	http://www.sisacast.kr/news/articleView.html?idxno=35203	2022/08/01	0	2022-09-14 14:58:13	2022-09-19 22:37:21
BK22008376	9	질문자	사람들이 많이 먹는 메뉴라고 하니까 어떤 맛일지 궁금해진다. 아, 볼거리와 사진 명소로 유명한 휴게소도 있다고 했는데 거기는 어디야?				0	2022-09-14 14:58:13	2022-09-14 23:10:34
BK22008376	10	전문가	2019년에 도로공사가 10대 사진 명소 휴게소를 전국의 195개의 고속도로 휴게소 중에 선정했는데, 휴게소 사진 명소 1위로 뽑힌 곳은 특색 있는 사진을 찍을 수 있는 망향휴게소였어. 이곳에는 열린 미술관이 있는데, 그리움이라는 주제로 탁 트인 야외에 각종 조각 작품들이 전시되어 있거든.	볼거리가 많은 사진명소 휴게소	https://news.mt.co.kr/mtview.php?no=2022090817032456306	2022/09/09	0	2022-09-14 14:58:13	2022-09-14 23:10:34
BK22008376	11	질문자	휴게소에 미술관이라니 진짜 생각지도 못한 발상이다. 그럼 사진찍기 좋은 휴게소 2위랑 3위는 어디로 정해졌어?				0	2022-09-14 14:58:13	2022-09-14 23:10:34
BK22008376	12	전문가	사진 명소 휴게소 2위는 동해고속도로의 옥계휴게소인데, 동해가 보이는 전망대로 해돋이 명소로도 유명한 곳이야. 또 3위는 다양한 조명과 미디어아트 작품도 감상할 수 있는 테마공원 별빛 정원 우주를 갖추고 있는 영동고속도로의 덕평휴게소지.	휴게소 사진명소 2, 3위	https://news.mt.co.kr/mtview.php?no=2022090817032456306	2022/09/09	0	2022-09-14 14:58:13	2022-09-14 23:10:34
BK22008376	13	질문자	이곳에 가면 인생 사진을 건질 수 있겠네. 휴게소에서도 여행의 즐거움을 느낄 수 있을 것 같다. 참, 요즘 반려견도 많이 데리고 다니는데, 반려견을 위한 시설이 갖춰진 휴게소는 몇 군데나 있을까?				0	2022-09-14 14:58:13	2022-09-26 16:01:50
BK22008376	14	전문가	반려동물을 위한 놀이터와 쉼터가 있는 휴게소는 14곳이나 마련되어 있어.	반려견을 위한 휴게소	https://news.mt.co.kr/mtview.php?no=2022090817032456306	2022/09/09	0	2022-09-14 14:58:13	2022-09-27 13:20:18
BK22008376	15	질문자	그래? 의외로 꽤 많구나. 그럼 그 중에서도 사람들에게 평판이 좋은 휴게소는 어디야?				0	2022-09-14 14:58:13	2022-09-28 22:16:31
BK22008376	16	전문가	이른바 반려인들의 성지라고 불리는 덕평자연휴게소야. 이곳에는 중앙공원 옆에 달려라 코코라는 곳이 있는데, 자연 속에서 반려견과 주인이 함께 즐겁게 보낼 수 있는 공간으로 꾸며져 있어.	반려동물 휴게소 제일 좋은 곳	https://www.edaily.co.kr/news/read?newsId=01079126632458480&mediaCodeNo=257	2022/09/09	0	2022-09-14 14:58:13	2022-09-28 22:16:31
BK22008376	17	질문자	애견과 함께 여행하는 관광객들에게는 굉장히 만족스러운 공간일 것 같네. 진짜 요즘 휴게소가 많이 발전했구나.				0	2022-09-14 14:58:13	2022-09-14 23:10:34
BK22008376	18	전문가	맞아. 그냥 화장실을 이용하고 잠시 쉬는 공간에 그치는 게 아니라 다양한 주제로 이용객들을 만족시키기 위해 변신하고 있지.				0	2022-09-14 14:58:13	2022-09-14 23:10:34
BK22008376	19	질문자	길고 피곤한 여행길에 휴게소에서 쉬는 시간 진짜 달콤하잖아. 아마도 여행의 재미를 더 해주는 긍정적인 효과를 가져올 수 있을 것 같네.				0	2022-09-14 14:58:13	2022-09-14 23:10:34
BK22008376	20	전문가	그래서 요즘은 아예 목적지를 이런 특색있는 휴게소로 정하고 고속도로에 오르는 여행객들도 많지.				0	2022-09-14 14:58:13	2022-09-14 23:10:34
BK22008376	21	질문자	진짜 그럴 만도 해, 아무튼 오늘 휴게소에 관한 이야기 너무 즐거웠어. 다음에 또 새로운 이야기로 대화 나누도록 하자. 그럼 안녕.				1	2022-09-14 23:10:34	2022-09-29 13:37:51
