id	utterance_id	role	text	search_query	search_URL	reference_date	terminate	regDate	updDate
BK22000040	1	질문자	사람이 미세플라스틱을 섭취한다는 이야기가 많더라고요.				0	2022-07-20 16:03:35	2022-08-02 12:01:32
BK22000040	2	전문가	바다 생물에게 먹이로 인식되는 미세플라스틱이 먹이사슬 구조에 따라 결국 사람에게로 되돌아와요. 그래서 사람이 섭취하는 미세플라스틱 양은 일일 5그램 정도인데, 쉽게 생각해보자면 신용카드 1개 분량에 해당하죠.	미세플라스틱 섭취	http://www.ujeil.com/news/articleView.html?idxno=306179	2022/06/16	0	2022-07-20 16:03:35	2022-07-21 09:18:44
BK22000040	3	질문자	일일 5그램이면 생각보다 양이 많은데요?				0	2022-07-20 16:03:35	2022-08-02 12:01:32
BK22000040	4	전문가	미세플라스틱은 살아있는 사람의 폐에서도 발견되었어요. 인체에 흡수된 미세플라스틱은 조직염증이나 세포증식, 괴사, 면역세포 억제의 원인이 되기도 하죠. 그런데 이 미세플라스틱이 체내에서 분해되지 않기 때문에 장기에 직접적인 영향을 미칠 수 있어 더 큰일이에요.	미세플라스틱	http://www.kookje.co.kr/news2011/asp/newsbody.asp?code=0300&key=20220616.99099004425	2022/06/17	0	2022-07-20 16:03:35	2022-07-21 09:18:44
BK22000040	5	질문자	살아있는 사람한테도 직접적인 영향을 미치는 중인데, 자연도 당연히 피해 갈 수 없을 듯하네요.				0	2022-07-20 16:03:35	2022-08-02 12:01:32
BK22000040	6	전문가	맞아요. 고산지대나 극지방의 눈과 얼음에 미세플라스틱이 있으면 빙권을 더 빠르게 녹일 수 있어요. 게다가 대기에서 구름입자를 뭉치게 도와주는 빙정핵으로도 작용해 기후에 영향을 주죠.	미세플라스틱 생태계	https://zdnet.co.kr/view/?no=20220613104236	2022/06/13	0	2022-07-20 16:03:35	2022-07-21 09:18:44
BK22000040	7	질문자	크기가 미세하기 때문에 안일하게 생각했는데, 보이지 않기 때문에 오히려 더 큰 문제를 일으키는 듯해요.				0	2022-07-20 16:03:35	2022-08-02 12:01:32
BK22000040	8	전문가	지금처럼 플라스틱을 계속 생산하고 소비하면 2060년에는 지금보다 3배 많은 플라스틱 폐기물이 쌓인다는 것 알고 계세요? 경제협력개발기구가 플라스틱 전망 보고서를 통해 이미 경고한 내용이에요. 지금부터라도 대응 정책을 강화하고 재생 가능 플라스틱 사용을 위한 기술 속도를 높인다면 3분의 1 정도는 해결할 수 있기 때문에 서두르는게 좋아요.	미세플라스틱 줄이기	https://www.hani.co.kr/arti/economy/marketing/1045790.html	2022/06/06	0	2022-07-20 16:03:35	2022-07-21 09:18:44
BK22000040	9	질문자	저라도 당장 나서서 플라스틱을 줄여야겠네요. 일회용품 줄이기부터 실천해 보려고요.				0	2022-07-20 16:03:35	2022-08-02 12:01:32
BK22000040	10	전문가	당장 눈에 보이는 플라스틱도 줄여야 하지만 패션과 직물 또한 소비를 자제해야 해요. 패션과 직물은 천으로 보이지만 합성섬유로 이루어졌는데, 이는 자연분해되지 않고 플라스틱처럼 작은 입자로 분해되거든요.	미세플라스틱 해결	http://www.danbinews.com/news/articleView.html?idxno=20780	2022/06/26	0	2022-07-20 16:03:35	2022-07-21 09:18:44
BK22000040	11	질문자	저는 눈에 보이는 큰 플라스틱만 생각했지 합성섬유 소비는 상상도 못했어요.				0	2022-07-20 16:03:35	2022-08-02 12:01:32
BK22000040	12	전문가	2018년도 전 세계에서 생산된 섬유의 62퍼센트는 석유 화학 합성 섬유였다는 사실 아셨어요? 그만큼 의류 부분에서 플라스틱이 차지하는 영향도 상당히 커요.	합성섬유 플라스틱	https://www.bbc.com/korean/features-61773695?xtor=AL-73-%5Bpartner%5D-%5Bnaver%5D-%5Bheadline%5D-%5Bkorean%5D-%5Bbizdev%5D-%5Bisapi%5D	2022/06/12	0	2022-07-20 16:03:35	2022-07-21 09:18:44
BK22000040	13	질문자	의류 플라스틱 문제를 의류회사는 인지를 하고 있을까요?				0	2022-07-20 16:03:35	2022-08-02 12:01:32
BK22000040	14	전문가	그럼요. 기업들은 이미 친환경 의류를 개발하고 판매 중이에요. 세계적인 스포츠 업체 나이키는 연간 폴리에스터 사용량 가운데 재활용 섬유 비중이 38퍼센트나 돼요. 더불어 아웃도어 의류인 블랙아크 또한 친환경 섬유로 만든 티셔츠나 재킷, 팬츠 등을 선보이고 있죠.	합성섬유	https://www.mk.co.kr/news/society/view/2022/06/507156/	2022/06/10	0	2022-07-20 16:03:35	2022-07-21 09:18:44
BK22000040	15	질문자	저는 단순히 텀블러 쓰기와 욕실에서 플라스틱 용품 줄이기만 실천했는데, 반성하게 되네요.				0	2022-07-20 16:03:35	2022-08-02 12:01:32
BK22000040	16	전문가	이미 제로 웨이스트를 실천하고 있다는 부분에서 충분히 대단하신걸요? 팁 하나 드리자면, 플라스틱 용기를 사용하지 않는 고체 비누들이 주목을 받고 있어서 알아보시면 좋을 것 같아요.	욕실 플라스틱	https://www.fnnews.com/news/202110220944240038	2021/10/23	0	2022-07-20 16:03:35	2022-07-21 09:18:44
BK22000040	17	질문자	엇, 저도 고체비누 사용 중이에요. 효능이 생각보다 좋더라고요. 비누를 만드는 기업도 점차 많아지는 것 같고요.				0	2022-07-20 16:03:35	2022-08-02 12:01:32
BK22000040	18	전문가	아무래도 기후 문제가 심각하다 보니 뷰티 및 생활용품 업계가 인체에 유해한 성분을 배제하고 자연 유래 성분을 첨가하거나, 분리배출이 쉬운 포장재를 사용하는 친환경 제품을 앞다투어 선보이고 있어요. 소비자 입장에서는 지속 가능한 환경을 추구하고 포장재 등 불필요한 쓰레기를 줄이는 과정에 동참하면 좋죠.	고체 비누	http://www.bokuennews.com/news/article.html?no=217716	2022/06/20	0	2022-07-20 16:03:35	2022-07-21 09:18:44
BK22000040	19	질문자	서서히 더 가치지향적인 소비를 하게 되는 것 같아요.				0	2022-07-20 16:03:35	2022-08-02 12:01:32
BK22000040	20	전문가	맞아요. 함께 노력해야 해결할 수 있는 문제이다 보니 그런 것 같아요.				0	2022-07-20 16:03:35	2022-07-21 09:18:44
BK22000040	21	질문자	가족과 친구들에게도 제로 웨이스트가 무엇인지 알려줘야겠어요. 좋은 정보 감사해요.				1	2022-07-20 16:03:35	2022-08-02 12:01:32
