id	utterance_id	role	text	search_query	search_URL	reference_date	terminate	regDate	updDate
BK22007131	7	질문자	깨진 컵은 일반쓰레기였군요! 그럼 거울은 유리로 분리수거 하는 것이 맞겠죠? 지난 주에 이사왔는데 이전 세입자가 거울을 두고가서 버리려고 하거든요.				0	2022-09-02 13:59:15	2022-09-02 13:59:15
BK22007131	8	전문가	거울은 재활용이 불가능해서 일반쓰레기로 버려야 해요. 하지만 거울이 많거나 크기가 크다면 마대로 제작된 특수규격 쓰레기 봉투에 넣어서 버려야 하죠. 만약 전신거울이나 벽거울처럼 봉투에 담을 수 없는 크기라면 대형폐기물로 신고한 뒤 스티커를 부착해서 버리면 되요.	거울 분리수거	http://news.kmib.co.kr/article/view.asp?arcid=0016693866&code=61121711&cp=nv	2022/01/22	0	2022-09-02 13:59:15	2022-09-06 13:17:37
BK22007131	9	질문자	하마터면 잘못 버릴뻔했군요. 아 그리고 집에 유통기한이 지난 알약들이 많아서 버려야 하는데 한번에 종량제봉투에 넣어서 버려도 되나요?				0	2022-09-02 13:59:15	2022-09-02 13:59:15
BK22007131	10	전문가	현행법에서는 의약품을 버릴때 반드시 소각하도록 규정하고 있기 때문에 절대로 종량제 봉투나 하수를 통해 버리면 안되요! 만약 그렇게 버린다면 항생물질 등의 약 성분이 땅이나 하천에 들어가서 생태계를 교란시키고 사람의 건강을 위협할 수 있어요. 그래서 알약 등은 약국이나 보건소 등에 있는 폐의약품 수거함에 버려야 해요.	알약 분리수거	https://health.chosun.com/site/data/html_dir/2022/08/16/2022081602045.html	2022/08/17	0	2022-09-02 13:59:15	2022-09-06 17:28:36
BK22007131	11	질문자	몰랐으면 큰일날 뻔 했군요. 분리수거는 정말 어렵네요. 어제는 페트병을 모아서 버리려고 했는데 경비아저씨가 페트병을 그렇게 버리면 안된다고 하시던데 어떻게 버리는 것이 맞는 걸까요?				0	2022-09-02 13:59:15	2022-09-02 13:59:15
BK22007131	12	전문가	투명 페트병은 내용물을 비우고 깨끗하게 씻은 다음 병에 붙어 있는 비닐 라벨을 제거해서 버려야 해요. 라벨을 제거하면 페트병을 납작하게 찌그러트린 뒤에 뚜껑을 닫아주고 색이 있는 페트병들과는 분리해서 배출해주시면 되요.	페트병 분리수거
