id	utterance_id	role	text	search_query	search_URL	reference_date	terminate	regDate	updDate
BK22001127	1	질문자	러시아가 우크라이나를 침공했다는 뉴스를 봤어요.				0	2022-07-20 16:13:38	2022-08-02 12:01:32
BK22001127	2	전문가	그러니까요. 21세기에 유럽에서 전쟁이 일어날거라고 상상도 못했는데 말이에요.				0	2022-07-20 16:13:38	2022-07-21 10:18:43
BK22001127	3	질문자	도대체 러시아가 우크라이나를 침공한 이유가 뭘까요?				0	2022-07-20 16:13:38	2022-08-02 12:01:32
BK22001127	4	전문가	우크라이나가 나토에 가입하려고 시도한 것이 이번 전쟁의 가장 큰 이유에요.	러시아 우크라이나 침공 이유	https://imnews.imbc.com/replay/2022/nw1400/article/6344562_35722.html	2022/02/24	0	2022-07-20 16:13:38	2022-07-21 10:18:43
BK22001127	5	질문자	아, 미국이 만든 나토 말하는거죠?				0	2022-07-20 16:13:38	2022-08-02 12:01:32
BK22001127	6	전문가	네, 잘 아시네요. 1949년에 미국하고 유럽이 냉전 초기 소련에 맞서 서방의 안보를 지키기 위해 설립한 정치군사동맹이에요.	나토 설립	https://www.bbc.com/korean/news-50659418	2019/12/04	0	2022-07-20 16:13:38	2022-07-21 10:18:43
BK22001127	7	질문자	전쟁이 빨리 끝나야할텐데요. 러시아랑 우크라이나의 군사력은 차이가 많이 날까요?				0	2022-07-20 16:13:38	2022-08-02 12:01:32
BK22001127	8	전문가	러시아는 미국 다음으로 세계 2위고 우크라이나는 25위에요. 다윗과 골리앗의 싸움 같네요.	러시아 우크라이나 군사력	www.joongang.co.kr/atoz/8?id=242	2022/05/04	0	2022-07-20 16:13:38	2022-07-21 10:18:43
BK22001127	9	질문자	그러네요. 우크라이나가 쓸 수 있는 새로운 무기는 없나요?				0	2022-07-20 16:13:38	2022-08-02 12:01:32
BK22001127	10	전문가	드론이 사용되고 있어요. 러시아 장갑차를 공격하기도 하고요. 옛날 전쟁과는 많이 다른 거 같아요.	러시아 우크라이나 드론	https://zdnet.co.kr/view/?no=20220411112321	2022/04/11	0	2022-07-20 16:13:38	2022-07-21 10:18:43
BK22001127	11	질문자	그러게요, 뉴스에 사이버전도 있었다고 나오더라고요.				0	2022-07-20 16:13:38	2022-08-02 12:01:32
BK22001127	12	전문가	네, 맞아요. 인터넷이 사용되고 있죠. 전쟁 전부터 러시아가 우크라이나 주요 시설의 데이터를 삭제하는 악성코드를 퍼트리고, 온라인에 우크라이나가 러시아를 먼저 공격했다는 가짜영상을 퍼트리는 사이버전이 있었어요.	러시아 우크라이나 사이버전	http://weekly.chosun.com/news/articleView.html?idxno=19272	2022/03/26	0	2022-07-20 16:13:38	2022-07-21 10:18:43
BK22001127	13	질문자	특히나 요즘은 인터넷 인프라가 우주로까지 확장되서 이용할 수 있는 방법이 정말 많은 거 같던데요.				0	2022-07-20 16:13:38	2022-08-02 12:01:32
BK22001127	14	전문가	맞아요. 이번 전쟁에도 우주인터넷이 사용되고 있어요. 통신 인프라가 망가진 우크라이나에 일론 머스크의 스페이스엑스가 우주인터넷 스타링크 서비스를 제공하고 있죠.	러시아 우크라이나 일론머스크	https://www.hani.co.kr/arti/science/technology/1034704.html	2022/03/14	0	2022-07-20 16:13:38	2022-07-21 10:18:43
BK22001127	15	질문자	그렇군요. 더군다나 이제는 전쟁이 길어지니까 다른 국가들한테도 영향을 미치고 있는 거 같아요.				0	2022-07-20 16:13:38	2022-08-02 12:01:32
BK22001127	16	전문가	그러게 말이에요. 세계적으로 밀가루 가격이 급등하고 있어요. 러시아와 우크라이나가 곡물 수출을 많이 하는 나라인데 전쟁때문에 생산은 커녕 수출도 할 수 없으니까요.	러시아 우크라이나 전쟁 밀가루	https://news.nate.com/view/20220322n25924?mid=n0507&isq=10802	2022/03/22	0	2022-07-20 16:13:38	2022-07-21 10:18:43
BK22001127	17	질문자	그러면 한국에서도 밀가루 가격이 오르고 있나요?				0	2022-07-20 16:13:38	2022-08-02 12:01:32
BK22001127	18	전문가	그것보다 러시아 수출 제재 때문에 한국은 자동차, 철강 수출이 70퍼센트 이상 감소했어요.	러시아 우크라이나 전쟁 한국 수출	https://www.newspim.com/news/view/20220502000246	2022/05/02	0	2022-07-20 16:13:38	2022-07-21 10:18:43
BK22001127	19	질문자	전쟁이 하루라도 빨리 끝났으면 좋겠네요. 자세한 설명 감사해요.				0	2022-07-20 16:13:38	2022-08-02 12:01:32
BK22001127	20	전문가	덕분에 저도 유익한 대화를 했네요. 다음에는 좋은 소식으로 이야기를 나누었으면 좋겠어요. 다음에 봐요.				1	2022-07-20 16:13:38	2022-07-21 16:24:19
