id	utterance_id	role	text	search_query	search_URL	reference_date	terminate	regDate	updDate
BK22007966	1	질문자	요즘 뉴스에 자립준비청년이라는 단어가 많이 나오던데 무슨 단어인가요? 말 그대로 일반 가정에서 이제 막 독립하는 청년들을 이야기 하는 건가요?				0	2022-09-09 20:43:39	2022-09-09 22:09:35
BK22007966	2	전문가	아니에요. 아동양육시설, 가정위탁시설 등에서 생활하다가 만 18세에서 24세가 되어 시설에서 나와 홀로서기를 해야 하는 청년들이 자립준비청년이에요.	자립준비청년	https://futurechosun.com/archives/68207	2022/09/08	0	2022-09-09 20:43:39	2022-09-09 22:09:35
BK22007966	3	질문자	그런 청년들을 자립준비청년이라고 부르는 군요. 근데 요즘 뉴스에 많이 나오는 것을 보니 무슨 일이 있었나 보던데 무슨 일인지 아시나요?				0	2022-09-09 20:43:39	2022-09-09 22:09:35
BK22007966	4	전문가	보육원에서 자립하거나 자립을 준비중인 청년들이 극단적인 선택을 한 사건이 연이어 일어나고 있어 체계적인 사후 관리와 심리 정서적 지원이 필요하다는 지적이 나오고 있는 상황이에요.	보육원 자살	https://www.yna.co.kr/view/AKR20220826115700530?input=1195m	2022/08/28	0	2022-09-09 20:43:39	2022-09-15 09:54:50
BK22007966	5	질문자	그런 안타까운 사건들이 있었군요. 왜 그 친구들이 극단적인 선택을 했는지도 알 수 있을까요?				0	2022-09-09 20:43:39	2022-09-09 22:09:35
BK22007966	6	전문가	보육원 출신 새내기 대학생이 저번 달 18일에 대학교 건물 옥상에서 극단적 선택을 한 이유는 금전문제때문이에요.	보육원 대학생 투신	https://www.jnilbo.com/view/media/view?code=2022083010064862813	2022/08/30	0	2022-09-09 20:43:39	2022-09-09 22:09:35
BK22007966	7	질문자	금전문제라니 너무 안타깝네요. 극단적인 선택을 한 청년뿐아니라 자립준비청년들 대부분이 금전문제를 겪고 있는 건가요?				0	2022-09-09 20:43:39	2022-09-09 22:09:35
BK22007966	8	전문가	맞아요. 자립준비청년의 평균 부채액은 605만 1천원으로 부채가 있다고 이야기한 비율은 24.3퍼센트였어요.	자립준비청년 부채액	http://www.shinailbo.co.kr/news/articleView.html?idxno=1591843	2022/08/28	0	2022-09-09 20:43:39	2022-09-09 22:09:35
BK22007966	9	질문자	6백만원이 넘을 정도면 금전문제가 생각보다 심각한 가 보네요. 정부에서 자립준비청년들을 위해서 지원해주는 정책이 필요할 것 같아 보이는데 이번에 새로 발표한 내용은 없나요?				0	2022-09-09 20:43:39	2022-09-09 22:09:35
BK22007966	10	전문가	자립준비청년에 대한 기존 지원 사업을 확대하고 일부 사업은 새로 만들어 내년예산안에 반영하겠다고 보건복지부에서 저번 달 말일에 발표했어요.	보건복지부 자립청년	https://news.kbs.co.kr/news/view.do?ncd=5545997&ref=A	2022/08/31	0	2022-09-09 20:43:39	2022-09-09 22:09:35
BK22007966	11	질문자	기존 지원 사업을 확대하기도 하고 신설하기도 하는 군요. 이번에 보건복지부에서 발표한 지원 사업에는 어떤 것들이 있나요?				0	2022-09-09 20:43:39	2022-09-09 22:09:35
BK22007966	12	전문가	내년부터 시행할 예정인 의료비 지원 사업과 자립수당이 있어요. 의료비 지원사업은 건강보험에 가입한 자립준비청년의 의료비 부담금을 의료급여 2종 수준으로 지원하기로 했고 보육원을 떠나는 자립준비청년에게 지급되는 자립수당이 내년부터 40만원으로 인상할 예정이에요.	자립수당 의료비 지원 자립청년	https://mdtoday.co.kr/news/view/1065617491105905	2022/08/31	0	2022-09-09 20:43:39	2022-09-09 22:09:35
BK22007966	13	질문자	40만원으로 인상한거면 지금의 자립수당은 얼마인가요?				0	2022-09-09 20:43:39	2022-09-09 22:09:35
BK22007966	14	전문가	내년부터 40만원을 지급하기로 한 자립수당의 현재금액은 월 35만원이에요. 35만원은 저번달부터 인상된 거에요.	자립수당 40만원	https://www.sedaily.com/NewsView/26A0H8HMDY	2022/08/31	0	2022-09-09 20:43:39	2022-09-09 22:09:35
BK22007966	15	질문자	현재 자립수당은 35만원이었군요. 의료비 지원사업이나 자립수당 인상 건 말고 다른 지원책은 없나요?				0	2022-09-09 20:43:39	2022-09-09 22:09:35
BK22007966	16	전문가	맞춤형 사례관리 지원 대상자를 현재 1470명에서 내년 2천명까지 확대하기로 했어요. 그리고 체계적인 사후관리를 담당할 자립지원 점담기관을 연말까지 17개 시도에 설치하고 인력도 추가 확충할 예정이에요.	자립청년 자립전담기관 전담인력확대	https://www.kukinews.com/newsView/kuk202208310058	2022/08/31	0	2022-09-09 20:43:39	2022-09-09 22:09:35
BK22007966	17	질문자	그렇군요. 그럼 복지부말고 다른 기관에서 지원하는 정책은 없나요?				0	2022-09-09 20:43:39	2022-09-09 22:09:35
BK22007966	18	전문가	복지부말고도 고용노동부, 국토교통부 등에서도 자립준비청년 지원 정책을 확대하려는 노력을 하고 있어요. 먼저 고용부에서 진행하는 정책을 말씀드리면 자립준비청년 취업역량 강화를 위해 국민취업지원제도를 통해 일대일 맞춤형 취업지원서비스를 제공할 계획이라고 밝혔어요.	자립준비청년 지원 고용노동부	http://news.heraldcorp.com/view.php?ud=20220831000532	2022/08/31	0	2022-09-09 20:43:39	2022-09-09 22:09:35
BK22007966	19	질문자	취업지원을 해주는 군요. 이런 서비스를 받게 되면 취업도 가능해져 금전고민을 하는 자립준비청년들이 줄어들 것 같네요. 고용노동부뿐아니라 국토교통부에서도 지원 정책을 확대한다고 했는 데 어떤 것이 있나요?				0	2022-09-09 20:43:39	2022-09-09 22:09:35
BK22007966	20	전문가	국토교통부에서는 자립준비청년들의 주거를 지원을 확대하기로 했어요. 지원 방법은 자립준비청년들에게 공공임대주택을 우선 공급하고 청년 월세 지급과 주거급여 분리 지급을 통해 주거 비용도 지원하기로 했어요.	자립준비청년 지원 국토 교통부	http://www.namdonews.com/news/articleView.html?idxno=693685	2022/08/31	0	2022-09-09 20:43:39	2022-09-09 22:09:35
BK22007966	21	질문자	주거문제가 해결되면 자립준비청년들의 금전문제도 줄어들겠네요. 근데 정부에서 지원해주는 것도 좋지만 미리 홀로서기를 시작한 청년들이 이제 막 시설을 떠나는 아이들에게 멘토역할을 해주면 좋을 것 같은데 이런 정책은 없나요?				0	2022-09-09 21:00:54	2022-09-09 22:09:35
BK22007966	22	전문가	자립준비 청년들이 스스로 멘토로 참여해 보호대상아동을 지원하는 바람개비 서포터즈가 있어요. 그리고 이 모임이 활성화 될 수 있도록 내년부터 활동비로 1인당 10만원씩을 지급할 예정이에요.	바람개비 서포터즈	https://www.news1.kr/articles/4788790	2022/08/31	0	2022-09-09 21:00:54	2022-09-09 22:09:35
BK22007966	23	질문자	그렇군요. 설명해주신 정책들로 자립준비청년들의 금전고민이 조금은 사라질 수 있었으면 좋겠네요.				0	2022-09-09 22:09:35	2022-09-09 22:09:35
BK22007966	24	전문가	저도 그럴 수 있었으면 좋겠네요. 다음에도 또 궁금한 점이나 필요한 정보가 있으면 연락주세요. 안녕히 계세요.				1	2022-09-09 22:09:35	2022-09-21 16:15:00
