id	utterance_id	role	text	search_query	search_URL	reference_date	terminate	regDate	updDate
BK22008580	1	질문자	제가 저번 달에 차를 구매했거든요. 그리고 이번 주말에 처음으로 셀프 세차를 해보려고 하거든요. 혹시 셀프 세차하는 법 잘 아시나요?				0	2022-09-15 21:08:39	2022-09-15 21:08:39
BK22008580	2	전문가	그럼요, 일단 셀프 세차장을 미리 찾아 두세요. 다수의 셀프 세차장은 카 샴푸와 개인세차도구 이용을 반기지 않아요. 하지만 요즘은 디테일링에 대한 관심이 많아지면서 개인 용품 사용이 허가되는 세차장이 점차 늘고 있어요. 가까운 곳에 개인 용품 사용이 허가되는 셀프 세차장이 있는지 미리 찾아 두는 것이 좋아요.	셀프 세차장 찾기	https://www.gokorea.kr/news/articleView.html?idxno=15810	2017/04/12	0	2022-09-15 21:08:39	2022-09-15 21:08:39
BK22008580	3	질문자	셀프 세차장은 모두 개인용품이 사용 가능한 줄 알았는데 아니었네요. 개인용품 사용 가능한 세차장을 찾아서 방문했다면 처음에 해야하는 것은 무엇인가요?				0	2022-09-15 21:08:39	2022-09-27 10:09:42
BK22008580	4	전문가	세차를 시작하기 전에 먼저 반드시 엔진을 식히기 위해 차 겉면에 고압수를 끼얹어 주어야 해요. 엔진의 경우 화상 등의 안전 문제도 있지만 엔진이 식지 않은 상태에서 차량에 거품이 닿을 경우 거품이 말라 붙어 닦아내기 쉽지 않기 때문에 미리 차량을 충분히 차갑게 만들어야 해요. 이후 차량의 지붕과 유리, 차체 순으로 고압수를 뿌려주어 차량에 묻어있는 흙먼지 등의 이물질과 때를 불려 주어야 해요. 미리 물을 뿌려 불려놓지 않을 경우 세차 시에 차량 흠집이 생길 수 있기 때문이에요.	차량 세차 고압수	http://www.mhns.co.kr/news/articleView.html?idxno=233185	2019/06/18	0	2022-09-15 21:08:39	2022-09-15 22:10:52
BK22008580	5	질문자	그렇군요, 차에 고압수를 뿌려 충분히 불린 후에는 어떻게 해야하나요?				0	2022-09-15 21:08:39	2022-09-15 22:17:19
BK22008580	6	전문가	그 다음으로는 버킷에 물을 나눠 담아 주세요. 두 개의 버킷 중에 버킷 하나는 물만 넣고 다른 하나에는 물과 카 샴푸를 함께 넣어주세요. 카 샴푸는 상품에 따라 적정한 비율이 있기 때문에 이에 따라 담는 게 좋아요.	차량 세차 버킷에 물 나눠 담기	https://www.gokorea.kr/news/articleView.html?idxno=15810	2017/04/12	0	2022-09-15 21:08:39	2022-09-15 22:17:19
BK22008580	7	질문자	버킷을 두 개 사용하는 거였군요. 그런 다음 세척을 하면 되나요?				0	2022-09-15 21:08:39	2022-09-15 22:32:54
BK22008580	8	전문가	네, 거품이 묻은 미트를 잡고 손에 힘을 뺀 뒤 보닛과 루프, 측면과 후면 순으로 부드럽게 문지르세요. 이때 미트에 오염물이 묻어있는 경우 차량 전체가 더러워 질 수 있기 때문에 미트를 중간에 한 번씩 세척해주세요. 다음으로 휠과 타이어는 맨 마지막에 닦는 것이 좋으며, 휠 전용 세정제와 브러시를 사용하여 문질러야 작은 부품까지 씻어낼 수 있어요.	차량 외부 세차 방법	http://www.mhns.co.kr/news/articleView.html?idxno=233185	2019/06/18	0	2022-09-15 21:08:39	2022-09-15 22:32:54
BK22008580	9	질문자	휠은 카 샴푸가 아니라 휠 전용 세정제가 따로 있는 거였군요. 세척 후 세정제를 씻어낼 때 주의해야 할 점이 있을까요?				0	2022-09-15 21:08:39	2022-09-27 10:09:42
BK22008580	10	전문가	네, 물을 꼼꼼하게 분사해 샴푸액이 남지 않도록 헹궈주세요. 고압수를 뿌렸던 예비세차 때 보다 떨어져서 분사 하면 더 빠르고 쉽게 샴푸액을 씻어낼 수 있어요.	셀프 세차 헹굼	https://www.gokorea.kr/news/articleView.html?idxno=15810	2017/04/12	0	2022-09-15 21:08:39	2022-09-27 10:09:42
BK22008580	11	질문자	오 좋은 팁이네요. 샴푸를 모두 헹궜다면 이제 끝난건가요?				0	2022-09-15 21:08:39	2022-09-27 10:09:42
BK22008580	12	전문가	아니요. 모두 헹궜다면 물기를 없애 줘야해요. 드라이 타월을 자동차 위에 넓게 펼친 다음 위에서 아래로 당기듯이 닦아주면 돼요. 유리를 포함한 전체적인 부분을 문지른 후에는 물이 고인 틈을 찾아 닦으면 외부 세차는 끝이에요.	셀프 세차 물기 제거	https://www.gokorea.kr/news/articleView.html?idxno=15810	2017/04/12	0	2022-09-15 21:08:39	2022-09-27 10:09:42
BK22008580	13	질문자	해 볼만 하겠다는 생각이 드네요. 실외 세차는 끝났고 그럼 실내 세차는 어떻게 해야하나요?				0	2022-09-15 21:08:39	2022-09-15 22:54:39
BK22008580	14	전문가	먼저 매트 청소는 셀프 세차장에 구비된 매트 청소기계를 사용하면 돼요. 금액이나 사용법은 세차장 마다 차이가 날 수 있지만 사용설명서를 잘 읽고 따라하면 되기 때문에 사용법은 대부분 쉬워요. 만약 매트 청소기계가 없다면 세게 털어주세요.	셀프 세차 매트 세척	https://www.gokorea.kr/news/articleView.html?idxno=15810	2017/04/12	0	2022-09-15 21:08:39	2022-09-27 10:09:42
BK22008580	15	질문자	그렇군요, 그렇다면 바닥 청소는 어떻게 해야 할까요?				0	2022-09-15 21:08:39	2022-09-15 22:54:39
BK22008580	16	전문가	바닥 청소는 셀프 세차장에 있는 진공청소기를 이용하면 돼요. 차 바닥의 모래나 먼지를 진공청소기를 사용해 제거하면 됩니다.	셀프 세차 바닥 청소	https://www.gokorea.kr/news/articleView.html?idxno=15810	2017/04/12	0	2022-09-15 21:08:39	2022-09-27 10:09:42
BK22008580	17	질문자	진공 청소기를 이용하는 거면 어렵지 않게 청소할 수 있겠네요. 마지막으로 혹시 세차 할 때 잘 할 수 있는 팁이 있으면 알려주시겠어요?				0	2022-09-15 21:08:39	2022-09-27 10:09:42
BK22008580	18	전문가	세차는 해가 진 저녁 시간이나, 그늘에서 세차하는 게 좋아요. 그 이유는 햇빛의 유무 때문이에요. 낮에 세차를 하면 조그마한 물방울들이 햇빛에 의해 렌즈열학을 해 자동체 몸체에 얼룩 자국을 만들 수 있기 때문이에요.	셀프 세차 그늘	https://www.gokorea.kr/news/articleView.html?idxno=15810	2017/04/12	0	2022-09-15 21:08:39	2022-09-27 10:09:42
BK22008580	19	질문자	늦은 오후에 세차하러 가야겠네요. 오늘 좋은 정보 많이 주셔서 감사해요. 주말에 세차장 가서 시행착오를 겪지 않을 것 같아요.				0	2022-09-15 21:08:39	2022-09-15 23:00:12
BK22008580	20	전문가	뭘요, 세차 잘 하시고 또 뵈요.				1	2022-09-15 21:08:39	2022-09-27 10:09:42
