id	utterance_id	role	text	search_query	search_URL	reference_date	terminate	regDate	updDate
BK22008297	1	질문자	요새 물가가 너무 오른 것 같네요.				0	2022-09-13 00:20:52	2022-09-19 14:44:24
BK22008297	2	전문가	맞아요, 마트에 가서 장보기가 두려워질 정도로 물가가 올랐더라구요.				0	2022-09-13 00:20:52	2022-09-19 14:44:24
BK22008297	3	질문자	이번 추석이 지나고도 이런 고물가 추세가 계속 되려나요?				0	2022-09-13 00:20:52	2022-09-19 14:44:24
BK22008297	4	전문가	네, 추석 이후에도 먹거리 물가가 오히려 더 오를 것으로 예상되고 있어서, 서민들의 부담이 늘어가고 있어요.	고물가 흐름	https://www.daejonilbo.com/news/articleView.html?idxno=2023147	2022/09/12	0	2022-09-13 00:20:52	2022-09-23 13:52:50
BK22008297	5	질문자	그렇군요, 그럼 이렇게 고물가 현상이 장기화되는 이유가 뭔가요?				0	2022-09-13 00:20:52	2022-09-19 14:44:24
BK22008297	6	전문가	러시아와 우크라이나 전쟁이 장기화되고 있고, 태풍 힌남노와 집중호우 피해 등의 재해 상황이 겹쳤기 때문이에요.	고물가 원인	http://www.sporbiz.co.kr/news/articleView.html?idxno=631323	2022/09/11	0	2022-09-13 00:20:52	2022-09-13 00:20:52
BK22008297	7	질문자	음, 걱정이 이만저만이 아니네요. 그리고 공공요금도 오른다는데 진짜인가요?				0	2022-09-13 00:20:52	2022-09-19 14:44:24
BK22008297	8	전문가	네 맞아요, 산업통상자원부와 한국전력 등에 따르면 전기요금이 다가오는 10월부터 kWh당 4.9원이 인상될 예정이에요.	전기요금 인상	https://www.hankyung.com/economy/article/202209080316i	2022/09/11	0	2022-09-13 00:20:52	2022-09-13 00:20:52
BK22008297	9	질문자	그렇군요, 그리고 천연가스 가격도 오른다는데 이유가 뭐죠?				0	2022-09-13 00:20:52	2022-09-19 14:44:24
BK22008297	10	전문가	러시아가 유럽에 천연가스 공급을 중단하면서 수급위기가 나타나고 있어서 천연가스 가격이 오르고 있는 거예요.	천연가스 가격	https://news.mt.co.kr/mtview.php?no=2022091210262086856	2022/09/12	0	2022-09-13 00:20:52	2022-09-19 14:44:24
BK22008297	11	질문자	러시아의 전쟁이 여러모로 큰 영향을 미치고 있네요. 그럼 가스요금은 이제 어느 정도 오르려나요?				0	2022-09-13 00:20:52	2022-09-19 14:44:24
BK22008297	12	전문가	월평균 2천MJ을 사용하는 가구의 경우를 예로 들면, 연초와 대비해서 다음 달엔 4천600원의 가스요금을 더 내게 돼요.	가스요금 인상	https://www.kihoilbo.co.kr/news/articleView.html?idxno=995305	2022/09/13	0	2022-09-13 00:20:52	2022-09-23 13:52:50
BK22008297	13	질문자	그렇군요, 관련 부처들은 물가도 올랐는데 가스요금까지 올리자니 서민들의 불편함이 클 것 같아 고민이 많을 것 같은데, 부처들의 입장은 어떤가요?				0	2022-09-13 00:20:52	2022-09-19 14:44:24
BK22008297	14	전문가	산업통상자원부는 한전과 같은 기업의 손실 규모가 커졌기 때문에 공공요금을 인상해야 한다고 생각하고 있어요. 하지만 물가를 총괄하는 기획재정부는 현재의 고물가 상황을 고려하면 공공요금 인상 폭을 제한할 수밖에 없어, 두 부처의 고민이 깊어지고 있어요.	가스요금 인상 한전	https://www.fnnews.com/news/202209121844217744	2022/09/12	0	2022-09-13 00:20:52	2022-09-19 14:44:24
BK22008297	15	질문자	상반된 의견이 앞으로 어떻게 조정될 지 궁금하네요. 그리고 식료품 중에서는 우유와 관련된 품목이 크게 오른다고 들었는데 맞나요?				0	2022-09-13 00:20:52	2022-09-19 14:44:24
BK22008297	16	전문가	네, 우유나 버터, 치즈를 재료로 하는 식품의 가격이 인상되는 걸 밀크플레이션이라고 부르기도 해요. 밀크플레이션으로 인해 빵, 커피, 아이스크림 등의 가격도 잇따라 오를 것으로 예상되고 있어요.	밀크플레이션	https://news.mt.co.kr/mtview.php?no=2022090814470848072	2022/09/12	0	2022-09-13 00:20:52	2022-09-19 14:44:24
BK22008297	17	질문자	그럼 우유 가격은 얼만큼의 폭으로 인상되나요?				0	2022-09-13 00:20:52	2022-09-19 14:44:24
BK22008297	18	전문가	흰우유 제품 1리터의 평균 가격은 3000원에서 3500원으로 16.66% 오를 예정이에요.	우유 가격 인상	https://www.kgnews.co.kr/news/article.html?no=717312	2022/09/12	0	2022-09-13 00:20:52	2022-09-19 14:44:24
BK22008297	19	질문자	정말 물가 인상이 다양한 곳에서 끝도 없이 진행되네요.				1	2022-09-13 00:20:52	2022-09-23 13:52:50
BK22008297	20	전문가	맞아요, 여러모로 고민이 깊어지는 요즘이에요. 다음에 언제 장 한번 같이 보러갔다가 시간 되시면 얘기도 다시 나눠요. 편할 때 연락 주세요.				0	2022-09-13 00:20:52	2022-09-19 14:44:24
