id	utterance_id	role	text	search_query	search_URL	reference_date	terminate	regDate	updDate
BK22000659	1	질문자	친구가 길에서 울고 있는 새끼 고양이를 발견했대요. 그냥 두면 잘못될까 봐 걱정이라는데, 냥줍해야 할까요?				0	2022-07-20 16:09:19	2022-08-02 12:01:32
BK22000659	2	전문가	길고양이를 데려오는 것은 길고양이들에게 구조가 아니라 납치일 수 있기 때문에 주의해서 해야 해요.	냥줍	https://www.joongang.co.kr/article/25021554	2021/11/07	0	2022-07-20 16:09:19	2022-07-21 09:55:08
BK22000659	3	질문자	바로 냥줍을 하면 안되는 거군요. 냥줍할 때 주의할 점에는 어떤게 있나요?				0	2022-07-20 16:09:19	2022-08-02 12:01:32
BK22000659	4	전문가	어미 고양이는 24시간 새끼와 함께 있지 않아요. 그 이유는 먹이를 구하기 위해서 몇 분에서 24시간 이상 자리를 비우기 때문이에요. 만약 혼자 있는 새끼 고양이를 냥줍하게 되면 새끼와 어미를 평생 만나지 못하게 하는 걸 수도 있어요.	냥줍 주의할 점	https://moneys.mt.co.kr/news/mwView.php?type=1&no=2017032810088044639&outlink=1	2017/04/09	0	2022-07-20 16:09:19	2022-07-21 09:55:08
BK22000659	5	질문자	하마터면 어미 고양이와 영영 못 보게 할 뻔했네요. 그렇다면 어떻게 해야 할까요?				0	2022-07-20 16:09:19	2022-08-02 12:01:32
BK22000659	6	전문가	길고양이 보호단체인 앨리 캣 얼라이즈에 따르면 새끼 고양이가 깔끔하고 조용한 경우에는 어미 고양이가 돌아올 확률이 높지만, 반대의 경우는 새끼 고양이를 구조하는 것이 좋아요.	냥줍 주의할 점	https://nownews.seoul.co.kr/news/newsView.php?id=20160326601008	2016/03/26	0	2022-07-20 16:09:19	2022-07-21 09:55:08
BK22000659	7	질문자	그렇군요, 친구에게 주의해야 할 점을 말해주도록 할게요.				0	2022-07-20 16:09:19	2022-08-02 12:01:32
BK22000659	8	전문가	네, 어미 고양이가 돌아온다면 좋겠지만 아닐 경우 꼭 데려가주셨으면 좋겠네요.				0	2022-07-20 16:09:19	2022-07-21 09:55:08
BK22000659	9	질문자	그런데 요즘 저희 집 주변에도 길고양이가 많아졌어요. 길고양이들에게 물과 사료를 챙겨주는 캣맘도 생겼고요.				0	2022-07-20 16:09:19	2022-08-02 12:01:32
BK22000659	10	전문가	고양이와 어머니를 합친 캣맘 말씀하시는 건가요? 고양이들에게 먹이를 주거나 보살피는 사람들이요.	캣맘	http://www.jemin.com/news/articleView.html?idxno=726703	2021/11/03	0	2022-07-20 16:09:19	2022-07-21 09:55:08
BK22000659	11	질문자	네, 맞아요. 그런데 캣맘이 이웃 주민들과 갈등이 있는 것 같더라고요. 캣맘과 공존하기 위해서는 어떻게 해야 할까요?				0	2022-07-20 16:09:19	2022-08-02 12:01:32
BK22000659	12	전문가	캣맘과 주민들의 갈등을 중재하기 위해 구청이나 시청에서 여러 가지 정책을 내놓고 있어요. 핵심 정책으로는 길고양이들의 번식을 막아 고양이 수를 조절하는 TNR이 있지요.	캣맘과 주민의 공존	https://www.segye.com/newsView/20201209526530?OutUrl=naver	2020/12/10	0	2022-07-20 16:09:19	2022-07-21 09:55:08
BK22000659	13	질문자	TNR에 대해 더 설명해주세요.				0	2022-07-20 16:09:19	2022-08-02 12:01:32
BK22000659	14	전문가	길고양이 중성화 사업인 TNR은 길고양이를 포획해 중성화 수술 후 다시 방사하는 것을 뜻해요. 길고양이가 기하급수적으로 늘어나는 것을 막기 위해 매년 하고 있는 사업이고요.	길고양이 TNR	https://www.breaknews.com/894621	2022/05/13	0	2022-07-20 16:09:19	2022-07-21 09:55:08
BK22000659	15	질문자	그렇군요. 그러면 고양이가 TNR을 했는지 어떻게 알 수 있나요? TNR 표시가 있나요?				0	2022-07-20 16:09:19	2022-08-02 12:01:32
BK22000659	16	전문가	왼쪽 귀 끝을 1센티미터 정도 잘라내 표시하기 때문에, 귀 부분을 보면 중성화를 한 길고양이인지 알 수 있어요.	길고양이 TNR 표시	http://www.beyondpost.co.kr/view.php?ud=20220330113245959967114f971d_30	2022/03/30	0	2022-07-20 16:09:19	2022-07-21 09:55:08
BK22000659	17	질문자	아하. 요즘 보는 길고양이들의 귀가 잘린 이유가 그것때문이었군요. 그 길고양이가 있던 곳에는 길고양이 급식소도 있던데요.				0	2022-07-20 16:09:19	2022-08-02 12:01:32
BK22000659	18	전문가	고양이 급식소는 길고양이에게 안전하고 깨끗한 장소이며, 주민들의 갈등을 완화시키는데도 효과적이에요. 지속적으로 길고양이에게 사료를 제공함으로써 길고양이가 음식물이나 시설물에 손대는 것을 방지하니 주민들의 불편사항도 줄어들겠죠.	길고양이 급식소	https://www.breaknews.com/812667	2021/06/08	0	2022-07-20 16:09:19	2022-07-21 09:55:08
BK22000659	19	질문자	모든 사람이 다 길고양이를 좋아할 수는 없으니까요. 길고양이 급식소나 TNR을 통해 길고양이와 사람 모두 행복했으면 하는 바람이에요.				0	2022-07-20 16:09:19	2022-08-02 12:01:32
BK22000659	20	전문가	저도 그 말씀에 동의해요.				1	2022-07-20 16:09:19	2022-07-21 13:03:27
