id	utterance_id	role	text	search_query	search_URL	reference_date	terminate	regDate	updDate
BK22007379	1	질문자	뉴스에서 새로운 재정사업 성과관리 계획이 발표되었다고 들었는데, 어떤 내용인가요?				0	2022-09-04 12:48:11	2022-09-15 14:59:38
BK22007379	2	전문가	기획재정부는 재정사업평가결과 성과가 미흡한 사업에 대해서 지출 구조조정을 추진한다는 내용인 2022~2026 재정사업 성과관리 기본계획을 22일 개최된 국무회의에서 발표했어요.	성과미흡 사업 구조조정	https://www.asiatoday.co.kr/view.php?key=20220822010012565	2022/08/22	0	2022-09-04 12:48:11	2022-09-15 14:59:38
BK22007379	3	질문자	왜 이런 성과관리 기본계획을 발표한건가요?				0	2022-09-04 12:48:11	2022-09-04 13:39:41
BK22007379	4	전문가	우리나라의 나랏빛이 과도하게 늘어났다는 정부의 판단에 의해서 재정사업 관리 방안을 마련한거에요. 올해 2차 추가경정예산 기준으로 이번 년도 국가채무는 5년전인 2017년에 조사된 660조2천억원 보다 400조원 넘게 늘어난 1068조8천억원으로 조사되었어요.	재정사업 관리방안 나랏빛	https://news.mt.co.kr/mtview.php?no=2022082214191076071	2022/08/22	0	2022-09-04 12:48:11	2022-09-11 11:45:27
BK22007379	5	질문자	국가채무가 5년동안 400조원이 넘는 금액이 증가했군요. 그럼 정부에서 국가채무비율을 어느정도까지 관리하려고 하는 건가요?				0	2022-09-04 12:48:11	2022-09-04 13:39:41
BK22007379	6	전문가	정부가 관리하기로 한 2022년도부터 2026년까지의 관리재정수지 적자폭과 국가채무 비율은 각 2퍼센트 초반과 50퍼센트 초반이에요.	건전재정 작심한 尹정부	https://www.mk.co.kr/news/economy/view/2022/08/767978/	2022/08/31	0	2022-09-04 12:48:11	2022-09-04 13:39:41
BK22007379	7	질문자	그렇군요. 그럼 사업성과를 평가해 성과가 미흡한 사업에 대해서 지출 구조조정을 한다고 하셨는데 평가는 어떻게 진행하나요?				0	2022-09-04 12:48:11	2022-09-04 13:39:41
BK22007379	8	전문가	현재 기재부를 비롯한 6개 부처에서 운영하는 11개 평가제도에 대해서 대부분 평가에 예산을 반영할 수 있는 구속력이 없어 평가 결과를 활용하기 어렵다는 지적이 있는 만큼, 평가 결과에 따라 평가 대상 예산의 일정비율을 구조 조정하는 원칙을 사용하기로 했어요.	기재부 11개 평가제도	https://www.segye.com/newsView/20220822523877?OutUrl=naver	2022/08/23	0	2022-09-04 12:48:11	2022-09-04 13:39:41
BK22007379	9	질문자	그럼 이 원칙이 도입된다면 평가에 따라서 예산이 어떻게 삭감이 되나요?				0	2022-09-04 12:48:11	2022-09-04 13:39:41
BK22007379	10	전문가	그렇게 된다면 미흡을 받은 성과 평가 결과가 있는 사업의 예산이 삭감되는데, 현재 논의중인 삭감비율은 최소 1퍼센트에요. 그리고 2년째 미흡하다는 성과 평가 결과를 받으면 사업계획 재설립, 3년째 받으면 폐지를 진행할 예정이에요.	미흡한 사업 예산 삭감	https://www.segye.com/newsView/20220822516319?OutUrl=naver	2022/08/22	0	2022-09-04 12:48:11	2022-09-04 13:39:41
BK22007379	11	질문자	3년연속으로 미흡하다는 평가를 받으면 폐지하는 군요. 재정사업 성과관리 기본계획에는 예산 삭감에 대한 내용 외에 다른 내용은 없나요?				0	2022-09-04 12:48:11	2022-09-04 13:39:41
BK22007379	12	전문가	국민 체감도가 높고 관련 부처, 국민 등의 의견을 수렴해 선정한 재정사업 10개는 핵심사업으로 따로 관리할 예정이라는 내용도 정부에서 발표했어요.	핵심사업 10개 관리	https://www.yna.co.kr/view/AKR20220822031700002?input=1195m	2022/08/22	0	2022-09-04 12:48:11	2022-09-04 13:39:41
BK22007379	13	질문자	핵심사업을 따로 분류해서 관리할 예정이라는 내용도 있었군요. 그럼 어떻게 관리할 예정인가요?				0	2022-09-04 12:48:11	2022-09-04 13:39:41
BK22007379	14	전문가	정부에서 기재부, 관련 부처, 전문가로 구성된 전담 성과관리 팀을 구성할 예정이에요. 그리고 이렇게 구성된 성과관리팀이 현장점검, 진행관리를 진행해 성과평가를 하고 이 결과를 그래프로 만들어 국민들에게 공개할 거에요.	핵심사업 전담 성과관리팀	https://www.dnews.co.kr/uhtml/view.jsp?idxno=202208221050512750603	2022/08/22	0	2022-09-04 12:48:11	2022-09-15 14:59:38
BK22007379	15	질문자	성과관리팀을 편성할 예정이이군요. 그럼 핵심 사업으로 거론되고 있는 예를 하나만 들어주실 수 있나요?				0	2022-09-04 12:48:11	2022-09-04 13:39:41
BK22007379	16	전문가	현재 핵심 사업의 대표적인 예로 거론되고 있는 것은 산업통상자원부, 과학기술정보통신부 등 여러 개의 부처가 관련된 반도체 인력양성 사업이에요. 이 사업은 현재 3% 수준인 국내 기업 시스템반도체 세계시장 점유율을 2030년 10%까지 올리는 것이 목표예요.	반도체 인력양성 핵심 사업	https://www.hankyung.com/economy/article/202208229795i	2022/08/22	0	2022-09-04 12:48:11	2022-09-15 14:59:38
BK22007379	17	질문자	반도체 인력양성사업이 핵심 사업이 되는 군요. 그럼 평가는 매년 언제 진행하는 건가요?				0	2022-09-04 12:48:11	2022-09-04 13:39:41
BK22007379	18	전문가	전년도 11월에서 12월쯤 동보 된 통합평가 치침을 토대로 1월에서 4월 중 평가를 시행할 계획이에요. 그리고 이렇게 시행된 평가 결과를 5월 중에 결과를 확정짓도록 지침이 정해졌어요. 이런 평가 시기를 정한 이유는 예산과의 연계성을 강화하기 위해서에요.	재정사업 평가 시기	https://biz.chosun.com/policy/policy_sub/2022/08/22/6J6OHBR52JGWHH44YCBRGRATNI/?utm_source=naver&utm_medium=original&utm_campaign=biz	2022/08/22	0	2022-09-04 12:48:11	2022-09-04 13:39:41
BK22007379	19	질문자	5월 중에 모든 결과가 나오는 군요. 덕분에 많은 정보 알게 되었네요.				1	2022-09-04 12:48:11	2022-09-15 14:59:38
BK22007379	20	전문가	언제든지 필요한 정보나 궁금한 점이 있으면 연락주세요. 안녕히 계세요.				0	2022-09-04 12:48:11	2022-09-04 13:39:41
