id	utterance_id	role	text	search_query	search_URL	reference_date	terminate	regDate	updDate
BK22004617	1	질문자	독립한지 이제 3개월 차인데 난 정말 집안일에 소질이 없나 봐. 하나부터 열까지 검색하지 않으면 진도가 안 나가네.				0	2022-08-04 11:40:56	2022-08-10 14:55:00
BK22004617	2	전문가	이제 겨우 3개월인데 익숙하지 않은 게 당연하지. 누구나 다 그런 과정을 겪을걸?				0	2022-08-04 11:40:56	2022-08-10 14:55:00
BK22004617	3	질문자	집안일을 하다가 막히면 항상 밤낮 가릴 것 없이 엄마한테 전화를 하거든? 처음에는 반갑게 내 전화를 받았는데 이제는 조금 지친 느낌이야.				0	2022-08-04 11:40:56	2022-08-10 14:55:00
BK22004617	4	전문가	네가 괜히 먼저 눈치를 보니까 그런 생각이 드는 거야. 정작 어머님은 별생각 없으실 수도 있다고!				0	2022-08-04 11:40:56	2022-08-22 10:29:54
BK22004617	5	질문자	그런가. 아무튼 요즘 장마철이라서 너무 찝찝하고 꿉꿉해 미치겠어. 습도가 높다 보니까 온 집안이 축축하고 끈적한 느낌이 드는데 나만 그래?				0	2022-08-04 11:40:56	2022-08-10 14:55:00
BK22004617	6	전문가	장마철은 습도가 80프로 이상이기 때문에 세균 및 곰팡이균이 가장 활발하게 증식하는 시기야. 더구나 우리 몸에 해로운 집먼지 진드기 바이러스 등도 쉽게 증식시켜서 건강에도 나쁜 영향을 줄 수 있어. 하루 빨리 이 시기가 지나가길 바랄 뿐이야.	장마철 빨래	http://weekly.chosun.com/news/articleView.html?idxno=21117	2022/07/07	0	2022-08-04 11:40:56	2022-08-22 10:29:54
BK22004617	7	질문자	나만 장마철이 싫은 게 아니었구나. 요즘 빨래를 돌릴 때마다 이상하고 역겨운 냄새가 나서 스트레스 받아. 무슨 짓을 해도 그 퀴퀴한 냄새가 안 빠져서 너무 힘들어.				0	2022-08-04 11:40:56	2022-08-10 14:55:00
BK22004617	8	전문가	요즘 같은 날씨에 빨래하기 정말 힘들긴 하지. 기껏 세탁, 건조까지 다 했는데 습한 주변 공기 때문에 다시 빨래를 해야 하는 경우도 많거든. 장마철에는 자주자주 세탁을 해주는 것도 중요하지만 어떻게 말리는지도 매우 중요해!	장마철 빨래 냄새	http://www.ggilbo.com/news/articleView.html?idxno=922083	2022/07/12	0	2022-08-04 11:40:56	2022-08-22 10:29:54
BK22004617	9	질문자	그렇구나. 난 계속 세탁하는 거에만 집착했네. 그나저나 왜 빨래에서 자꾸 이상하고 불쾌한 냄새가 나는 거야?				0	2022-08-04 11:40:56	2022-08-10 14:55:00
BK22004617	10	전문가	날씨가 습하기 때문에 빨래가 잘 마르지 않게 되면서 세균이나 곰팡이가 쉽게 번식하거든. 이 불쾌한 냄새의 주범은 바로 모락셀라균이라는건데 이 세균이 세탁물에 남은 단백질과 피지를 분해하면서 꿉꿉한 냄새를 만들어.	장마철 빨래 전쟁	https://www.cjb.co.kr/home/sub.php?menukey=61&mod=view&P_NO=220712502&PRO_CODE=99	2022/07/12	0	2022-08-04 11:40:56	2022-08-22 10:29:54
BK22004617	11	질문자	처음 들어보는 이름인데 잘 기억해둬야겠네. 이 균은 당연히 사람 몸에 안 좋겠지?				0	2022-08-04 11:40:56	2022-08-10 14:55:00
BK22004617	12	전문가	음 모락셀라균이 면역력이 약한 사람에게 침투할 경우 문제가 될 수 있지. 흔히 아는 대상포진이나 사람의 몸에 곰팡이가 생기는 칸디다증 등을 유발할 수 있어서 주의가 필요해.	모락셀라균	https://kormedi.com/1410789/%ea%bf%89%ea%bf%89%ed%95%9c-%ec%97%ac%eb%a6%84%ec%b2%a0%ec%97%90%eb%8f%84-%eb%b9%a8%eb%9e%98-%ec%9e%98%ed%95%98%eb%8a%94-%ec%a3%bc%eb%b6%80-9%eb%8b%a8%ec%9d%98-%eb%b9%84%eb%b2%95%ec%9d%80/	2022/07/27	0	2022-08-04 11:40:56	2022-08-10 14:55:00
BK22004617	13	질문자	면역력이 떨어진 사람이 잘못 걸리면 굉장히 고통스럽겠네. 이 세균은 제거가 가능해? 없애는 방법이 따로 있어?				0	2022-08-04 11:40:56	2022-08-10 14:55:00
BK22004617	14	전문가	물론이지. 모락셀라균의 경우 60도가 넘는 온도에서 없어진다는 연구 결과가 있거든. 수건과 같은 세탁물은 삶은 물을 사용하여 빨래를 하면 효과를 볼 수 있어.	모락셀라균 제거	https://kormedi.com/1405952/%ec%9e%a5%eb%a7%88%ec%b2%a0-%eb%b9%a8%eb%9e%98-%ec%9e%98%ed%95%98%eb%8a%94-%ec%9a%94%eb%a0%b9-4/	2022/06/28	0	2022-08-04 11:40:56	2022-08-22 10:29:54
BK22004617	15	질문자	오 그렇구나. 그동안 막무가내로 찬물에 빨래를 돌린 내가 많이 무지했네. 그래서 냄새가 사라지지 않고 계속해서 남아있었나 봐.				0	2022-08-04 11:40:56	2022-08-22 10:29:54
BK22004617	16	전문가	단순히 빨래를 한다고 해결되는 게 아니라 어떻게 하면 번식된 세균을 없앨 수 있냐가 관건인 거지!				0	2022-08-04 11:40:56	2022-08-22 10:29:54
BK22004617	17	질문자	혹시 세탁을 한 후 빨래는 잘 말리는 방법도 있어? 비법같은게 있으면 좀 알려줘.				0	2022-08-04 11:40:56	2022-08-10 14:55:00
BK22004617	18	전문가	일단 세탁을 마친 후 무조건 바로 건조 시켜줘야 해. 젖은 빨래를 방치하게 될 경우 세균이 증식될 수 있거든. 그다음 건조대에 빨래를 널 때는 빨랫감 사이에 간격을 넓게 두는 게 중요한데 긴 옷을 나란히 널기보다는 긴 옷과 짧은 옷을 교대로 널어주는 게 좋아. 마지막으로 빨래 건조대 아래에 신문지를 깔아주거나 선풍기를 틀어놓으면 습기를 좀 더 빨리 제거할 수 있어.	장마철 세탁	http://www.dailypop.kr/news/articleView.html?idxno=61117	2022/07/05	0	2022-08-04 11:40:56	2022-08-10 14:55:00
BK22004617	19	질문자	그렇구나. 여름철에는 세탁부터 건조까지 신경 써야 할게 많네.				0	2022-08-04 11:40:56	2022-08-10 14:55:00
BK22004617	20	전문가	그치. 그리고 건조 후에도 옷장 내부가 습하다면 옷이 다시 눅눅해지는 사태가 발생할 수 있거든. 옷장 전용으로 나온 습기제는 저렴한 가격에 살 수 있으니까 주기적으로 구비해두는 게 좋아.	장마철 빨래	http://www.sisajournal.com/news/articleView.html?idxno=240225	2022/06/11	0	2022-08-04 11:40:56	2022-08-10 14:55:00
BK22004617	21	질문자	집에 가는 길에 마트에 들러서 습기 제거제를 꼭 사야겠네. 깜빡하지 말아야 할 텐데. 아 그리고 창고에 방치해두고 안 쓰는 제습기가 있는데 장마철만이라도 제습기를 틀어두는 게 좋을까?				0	2022-08-04 11:40:56	2022-08-10 14:55:00
BK22004617	22	전문가	아무래도 제습기는 제습 효과가 뛰어나기 때문에 장마철에 특히 유용하지. 에어컨과 함께 틀어줄 경우 시너지 효과가 나서 더욱 좋아. 물론 전기세는 많이 나오긴 하겠지만 말이야.	빨래 제습기	http://www.mhns.co.kr/news/articleView.html?idxno=140517	2018/05/16	0	2022-08-04 11:40:56	2022-08-10 14:55:00
BK22004617	23	질문자	차라리 전기세 몇 푼을 더 내는 게 낫겠어. 꿉꿉함 때문에 같은 빨래를 여러 번 돌리는 것도 힘들고 신경 써서 말리는 것도 보통 일이 아니니까 말이야. 아무쪼록 오늘 세탁 팁을 전수해 줘서 정말 고마워.				0	2022-08-04 11:40:56	2022-08-10 14:55:00
BK22004617	24	전문가	내가 오늘 알려준 대로만 세탁을 하면 더 이상 빨래 냄새 때문에 괴로운 일은 없을 거야. 직접 해보고 추가로 더 궁금한 점이 있으면 언제든 물어봐. 아는 선에선 최대한 자세하게 알려줄게.				0	2022-08-04 11:40:56	2022-08-10 14:55:00
BK22004617	25	질문자	우와 엄청 든든한데? 일단 알려준 방법을 총동원하여 빨래를 해치워보려고. 오늘 정말 고마워.				1	2022-08-04 11:40:56	2022-08-22 10:29:54
