id	utterance_id	role	text	search_query	search_URL	reference_date	terminate	regDate	updDate
BK22006979	1	질문자	혹시 너도 그거 들었어? 뉴스를 봤는데, 이번 9월에 태풍이 하나 북상한다고 하더라.				0	2022-09-01 03:22:01	2022-09-01 03:22:01
BK22006979	2	전문가	북상 중인 태풍이라면, 제11호 태풍인 힌남노를 말하는 거구나. 힌남노는 현재 초강력으로 세력을 키우는 중인데, 이번 주말부터 제주에 직접적, 간접적으로 영향을 줄 예정이야. 제주도에 근접하는 시점은 5일 오후부터 6일 오전 사이로 예상되고 있지.	태풍 북상 예보	http://www.ihalla.com/article.php?aid=1661903979731427121	2022/08/31	0	2022-09-01 03:22:01	2022-09-01 03:22:01
BK22006979	3	질문자	응, 그런데 어쩌면 그 태풍이 제주도 뿐만 아니라 다른 지방들에도 영향을 줄 수 있잖아. 혹시 모르니 우리 가족도 좀 대비를 하려고 하는데, 혹시 태풍이 오기 전에 어떤 대비를 할 수 있을까?				0	2022-09-01 03:22:01	2022-09-01 03:22:01
BK22006979	4	전문가	일단은, TV와 라디오를 사용해서 태풍의 진로와 도달 시간을 파악하도록 해. 그 다음, 혹시라도 날아갈 위험이 있는 자전거나 가구 같은 물건들을 고정시키는 것도 잊지마.	태풍 오기 전 대비	https://www.korea.kr/news/visualNewsView.do?newsId=148892622	2021/09/02	0	2022-09-01 03:22:01	2022-09-01 03:22:01
BK22006979	5	질문자	응, 그리고 혹시 창문은 어떻게 하는 게 좋을까? 전에 보니까 태풍 때문에 집 창문이 깨진 경우도 있다고 하더라.				0	2022-09-01 03:22:01	2022-09-01 03:22:01
BK22006979	6	전문가	맞아, 간혹 강한 바람이 창틀과 창문 사이의 틈 속으로 들어가면서, 유리창이 이탈해 깨지는 2차 사고가 발생하는 경우가 있어. 그러니 유리창이 깨지는 걸 막으려면, 창문의 틈도 신문지나 테이프를 활용해서 꼼꼼히 막아야 해.	태풍 창문 깨짐 어떻게	https://www.jjan.kr/article/20200826715483	2020/08/26	0	2022-09-01 03:22:01	2022-09-01 03:22:01
BK22006979	7	질문자	그러면 태풍이 올 때, 창문의 틈만 막으면 되는 거야? 아니면 창문 자체에도 신문지를 붙이는 게 좋을까? 예전에 다른 태풍이 올 때를 보니, 창문에 테이프나 신문지를 붙여둔 이웃도 있더라고.				0	2022-09-01 03:22:01	2022-09-01 03:22:01
BK22006979	8	전문가	네 말처럼, 태풍을 대비하기 위해서 창문에 X자 모양으로 테이프를 붙이거나, 젖은 신문지를 붙이는 경우가 종종 있지. 하지만 이 방법은 유리창이 파손되는 것 자체를 막아주지는 못해. 대신, 테이프를 X자로 붙이는 경우에는, 유리창이 파손된 이후에 유리 파편이 날아서 흩어지는 현상을 방지할 수 있어.	태풍 창문 신문지	https://www.chosun.com/national/national_general/2022/08/31/QLTKD3U735GZPBDVBE3U5UFJCI/	2022/08/31	0	2022-09-01 03:22:01	2022-09-01 03:22:01
BK22006979	9	질문자	아, 테이프 자체에 유리 일부가 붙어버리니 파편이 덜 날리겠구나. 그럼 신문지는 안 붙이더라도, 혹시 모르니 테이프 정도는 준비해둬야겠어. 그러면 이거 말고도, 태풍이 오기 전에 미리 준비해야 하는 다른 것들은 뭐 없을까?				0	2022-09-01 03:22:01	2022-09-01 03:22:01
BK22006979	10	전문가	비가 많이 쏟아질 수 있으니, 하수구나 집 주변의 배수구를 점검해서 막힌 곳은 뚫어주도록 해. 그리고 혹시 모르니, 응급약품이나 손전등, 그리고 식수나 비상식량 같은 생활필수품들도 사전에 준비하는 편이 좋을 거야.	태풍 오기전 준비	https://biz.heraldcorp.com/view.php?ud=20190907000041	2019/09/07	0	2022-09-01 03:22:01	2022-09-01 03:22:01
BK22006979	11	질문자	응, 그렇게 하도록 할게. 그러면 방금 말해준 것들은 다 숙지한다고 치고, 태풍이 이미 왔다면 어떻게 행동하는 게 좋을까?				0	2022-09-01 03:22:01	2022-09-01 03:22:01
BK22006979	12	전문가	만약 건물이나 집처럼 실내에 있는 상태라면, 파손 방지를 위해 출입문이나 창문은 닫아두어야 해. 그리고, 혹시 모르니 창문이나 유리벽 등으로부터는 떨어지는 게 좋아.	태풍 올 때 행동	https://www.mk.co.kr/news/society/view/2019/09/709760/	2019/09/07	0	2022-09-01 03:22:01	2022-09-01 03:22:01
BK22006979	13	질문자	알겠어, 그런데 운이 나쁘게, 하필 태풍이 시작되었을 때 실내가 아니라 실외에 있을 수도 있잖아. 만약에 태풍이 왔는데 내가 아직 실외에 있다면, 그땐 어떻게 하는 게 좋을까?				0	2022-09-01 03:22:01	2022-09-01 03:22:01
BK22006979	14	전문가	일단 피해야 하는 장소들이 있는데, 하천변이나 산길, 공사장 쪽으로는 가선 안 돼. 그리고 방파제 뿐만 아니라 가로등과 신호등, 그리고 전신주도 피해야 하지. 그리고 혹시 바깥에서 차로 이동하던 중이었다면, 감속 운전을 해야 한다는 것을 잊지 않도록 해.	태풍 실외	https://www.hani.co.kr/arti/society/society_general/858699.html	2018/08/22	0	2022-09-01 03:22:01	2022-09-01 03:22:01
BK22006979	15	질문자	아, 운전은 생각도 못했어. 혹시 태풍이 왔을 때, 부득이하게 차량 운행 중이었다면 또 어떤 점을 주의해야 할까?				0	2022-09-01 03:22:01	2022-09-01 03:22:01
BK22006979	16	전문가	일단 아까 말했던 것처럼, 차의 주행속도는 평소의 20퍼센트에서 50퍼센트 가량 감속해야 해. 앞 차와의 간격도 중요한데, 평소보다 거리를 두 배 이상 유지하는 것이 좋아. 그리고 제동을 걸어야 할 때는 저단 기어를 사용하거나, 브레이크 페달을 여러 번 나누어서 밟는 게 좋다는 걸 기억하도록 해.	태풍 차량 운행 주의	http://dnews.co.kr/m_home/view.jsp?idxno=202208191532525670285	2022/08/19	0	2022-09-01 03:22:01	2022-09-01 03:22:01
BK22006979	17	질문자	응, 꼭 기억하도록 할게. 듣고 보니, 태풍이 오는 날이면 가급적이면 운전 자체를 안 하는 게 더 좋겠다는 생각도 드네.				0	2022-09-01 03:22:01	2022-09-01 03:22:01
BK22006979	18	전문가	맞아, 사실 강풍이나 비 때문에 어떤 일이 벌어질지 알 수 없으니, 태풍 오는 날에는 가급적 운전을 하지 않는 편이 제일 좋기는 하겠지.				0	2022-09-01 03:22:01	2022-09-01 03:22:01
BK22006979	19	질문자	그러게 말이야. 그나저나 저번 폭우가 얼마 가시지도 않았는데 태풍이라니, 이번에는 좀 피해 없이 잘 지나가면 좋겠어. 아무튼 이야기 나온 김에, 난 혹시 집에 있는 생활용품들이 충분한지, 테이프는 있는지 잠시 확인하러 가볼게.				0	2022-09-01 03:22:01	2022-09-01 03:22:01
BK22006979	20	전문가	그래, 그런 건 일이 터지기 전에 미리미리 확인하는 게 좋지. 꼼꼼하게 잘 확인해 보고, 나중에 다시 또 이야기 나누자.				1	2022-09-01 03:22:01	2022-09-28 08:38:27
