id	utterance_id	role	text	search_query	search_URL	reference_date	terminate	regDate	updDate
BK22005059	1	질문자	저는 어제 연어회 사다 먹었어요.				0	2022-08-09 10:31:11	2022-08-09 10:31:11
BK22005059	2	전문가	아, 연어를 자주 드시네요. 연어를 굉장히 좋아하시나 봐요.				0	2022-08-09 10:31:11	2022-08-09 10:31:11
BK22005059	3	질문자	네, 연어는 제가 가장 좋아하는 생선이에요. 근데 요새는 주위를 보면 저만 그런 게 아니라 연어의 인기가 전반적으로 가장 높아진 것 같아요. 그렇지 않나요?				0	2022-08-09 10:31:11	2022-08-09 10:31:11
BK22005059	4	전문가	네, 국내에서 연어를 소비하는 사람들이 늘면서 연어 수입량은 2020년 4만여톤에서 2021년 6만여톤으로 증가하기도 했어요. 국내에서 소비하는 연어는 대부분 수입산이거든요.	연어 소비 증가	https://newsis.com/view/?id=NISX20220718_0001946650&cID=10811&pID=10800	2022/07/18	0	2022-08-09 10:31:11	2022-08-09 10:31:11
BK22005059	5	질문자	아, 확실히 연어 인기가 굉장하군요. 근데 최근 가격이 엄청 올라서 계속 많이 사 먹을 수 있을지 모르겠어요. 가격이 왜 그렇게 오른 거죠?				0	2022-08-09 10:31:11	2022-08-09 10:38:53
BK22005059	6	전문가	원래 노르웨이 연어를 수입할 때 러시아를 거쳐 오는데, 전쟁 때문에 우회해서 다른 항로로 오면서 비용이 세 배 가까이 더 드니까 소비자가를 올린 거예요. 실제로 노량진시장에서 연어의 1kg당 도매가를 살펴 보면 2월 초에 1만 3000원, 3월 초에 1만 4000원이었는데 4월 초에는 2만원, 5월에 2만 2000원, 6월 초에는 2만 2000원선이 되는 등 계속 가격이 오르는 양상이죠.	연어 가격	https://www.edaily.co.kr/news/read?newsId=03817926632391568&mediaCodeNo=257&OutLnkChk=Y	2022/07/05	0	2022-08-09 10:31:11	2022-08-09 10:38:53
BK22005059	7	질문자	수입 생선이라서 발생하는 문제네요. 워낙 연어 인기가 많으니까, 그냥 국내에서 연어를 양식하면 참 좋을 것 같은데. 뭐 소식 없나요?				0	2022-08-09 10:31:11	2022-08-09 10:51:56
BK22005059	8	전문가	안 그래도 이제 대서양연어를 국내에서 양식할 수 있게 됐어요. 19일 오후 2시 30분 부산시와 해양수산부가 부산 기장군 부경대 수산과학연구소 부지에서 스마트 양식 클러스터 테스트베드 착공식을 진행했고, 18일 발표한 내용에 따르면 이제 본격적으로 공사에 들어가요.	부산 연어 양식	https://www.yna.co.kr/view/AKR20220718052600051?input=1195m	2022/07/18	0	2022-08-09 10:31:11	2022-08-28 21:50:00
BK22005059	9	질문자	오, 스마트 양식이라니 신기하네요. 거기서는 그럼 연어를 얼마나 양식할 수 있는데요?				0	2022-08-09 10:31:11	2022-08-09 11:09:33
BK22005059	10	전문가	대서양연어 연간 500톤 정도요. 이 시설에는 또한 태양광이나 풍력 같은 친환경 에너지 설비가 장착된 테스트베드, 자동 사료 급여 장치, 수처리 설비 자동 제어 시스템 등 최신식 기술이 도입되죠.	gs건설 연어	https://www.hankyung.com/realestate/article/2022071974456	2022/07/19	0	2022-08-09 10:31:11	2022-08-09 10:51:56
BK22005059	11	질문자	아, 대단하지만 규모가 500톤밖에 되지 않는 점은 아쉽네요. 아까 수입량이 6만여 톤이라고 했으니 수입산 연어를 완전히 대체할 수는 없을 것 같아서요. 부산 말고 다른 곳에서는 움직임이 없나요?				0	2022-08-09 10:31:11	2022-08-09 11:09:33
BK22005059	12	전문가	최근 강릉과 양양에도 아시아 최대 규모의 대서양 연어 스마트 양식 클러스터가 생기고 있고, 포항에도 연어 스마트 양식 산업단지가 생기는 중이에요. 이런 스마트 양식 클러스터가 가동되기 시작하면 매년 수입산에 사용하던 5000억 원 이상의 돈을 아낄 수 있죠.	국내 연어 소비량	http://www.chungnamilbo.co.kr/news/articleView.html?idxno=602438	2021/05/17	0	2022-08-09 10:31:11	2022-08-09 11:09:33
BK22005059	13	질문자	그렇군요, 여기저기서 양식 시설이 생기는 걸 보면 국내에서 연어 산업에 대한 관심이 정말 뜨거운가 보네요. 하긴 저도 그렇고 사람들이 연어를 정말 좋아하니까요. 원래는 우리나라에서 연어를 잘 먹지 않았던 것 같은데, 언제부터 연어가 이렇게 전국구 급 인기를 얻게 됐는지 모르겠어요.				0	2022-08-09 10:31:11	2022-08-09 11:27:52
BK22005059	14	전문가	연어의 인기에는 웰빙 바람이 큰 역할을 했죠. 소비자들이 건강에 신경을 쓰게 되고 규칙적인 생선 섭취를 원하게 되면서 연어 소비량도 증가한 것으로 분석되네요.	연어 웰빙	https://news.koreadaily.com/2016/01/19/economy/economygeneral/3970937.html	2016/01/19	0	2022-08-09 10:31:11	2022-08-09 11:27:52
BK22005059	15	질문자	맞아요, 웰빙 열풍 불 때쯤부터 우리나라에서 연어 인기가 치솟은 것 같네요. 사실 저는 일본에서 연어를 처음 먹기 시작했는데, 그 연어는 뭔가 요새 시중에서 찾아볼 수 있는 연어랑은 맛이 좀 달랐던 기억이 나네요. 연어도 어종이 여러 가지죠?				0	2022-08-09 10:31:11	2022-08-09 11:36:27
BK22005059	16	전문가	네, 연어는 은연어, 첨연어, 대서양연어 등 종류가 다양하죠. 우리가 외국에서 수입해서 먹는 연어는 대부분 대서양연어인데, 기름기가 많은 주홍색 훈제 연어가 대서양언어 종이에요.	연어 종류	https://www.hani.co.kr/arti/area/gangwon/1022695.html	2021/12/09	0	2022-08-09 10:31:11	2022-08-09 11:27:52
BK22005059	17	질문자	오, 그래서 아까 부산에서 대서양언어를 양식할 예정이라고 했던 거군요. 일본이 먹는 연어는 주로 어떤 종인가요?				0	2022-08-09 10:31:11	2022-08-09 11:36:27
BK22005059	18	전문가	일본은 은연어를 가장 많이 먹는 편이고, 첨연어 또한 즐겨 먹어요. 참고로 첨연어는 국내의 토종 물고기이기도 해요.	은연어 일본	http://www.hdhy.co.kr/news/articleView.html?idxno=15974	2021/12/10	0	2022-08-09 10:31:11	2022-08-09 11:36:27
BK22005059	19	질문자	어쩐지 일본 연어 맛과 한국에서 먹는 연어 맛이 다르다고 생각했는데, 종이 달랐군요. 나중에 기회 되면 은연어나 첨연어도 먹어봐야겠네요. 일단 연어는 나중에 먹고, 점심시간 되었으니 구내식당 갑시다.				0	2022-08-09 10:31:11	2022-08-09 11:36:27
BK22005059	20	전문가	네, 구내식당이 붐비기 전에 얼른 자리 잡아야죠. 어서 가요.				1	2022-08-09 10:31:11	2022-08-29 09:46:42
