id	utterance_id	role	text	search_query	search_URL	reference_date	terminate	regDate	updDate
BK22000896	1	질문자	혹시 할라피뇨 들어간 음식 좋아하세요?				0	2022-07-20 16:11:27	2022-08-02 12:01:32
BK22000896	2	전문가	할라피뇨 들어간 거 저는 좋아해요. 멕시코산 고추 맞죠? 할라피뇨는 탄수화물 함량 적고 열량도 낮아요. 갑자기 왜요?	할라피뇨	https://health.chosun.com/site/data/html_dir/2022/04/28/2022042802265.html	2022/04/29	0	2022-07-20 16:11:27	2022-07-21 10:07:27
BK22000896	3	질문자	샐러드 만들려고 하는데, 할라피뇨는 꽤 호불호가 갈리잖아요. 넣을까말까 고민되서요.				0	2022-07-20 16:11:27	2022-08-02 12:01:32
BK22000896	4	전문가	한번 넣어보세요. 우리나라 사람들을 표현할 때 각종 매체에서 매운맛의 민족이라고 표현하잖아요. 다들 좋아할 것 같아요.	매운맛	https://www.hankyung.com/life/article/202205248287H	2022/05/24	0	2022-07-20 16:11:27	2022-07-21 10:07:27
BK22000896	5	질문자	그렇긴 하죠. 그럼 고수 들어간 음식은 어떠세요? 저는 고수를 좋아해서 많이 넣고싶거든요.				0	2022-07-20 16:11:27	2022-08-02 12:01:32
BK22000896	6	전문가	고수는 좀 어렵긴 하네요. 저는 조금은 먹는 편인데 우리나라 사람들이 동남아 여행 갈 때 그 나라 인삿말보다 더 열심히 외우는 말이 노 팍치래요. 동남아 음식에는 대부분 고수가 들어가니까 고수 빼달라는 말이에요.	한국인 불호 음식	https://www.hidoc.co.kr/healthstory/news/C0000469374	2019/07/02	0	2022-07-20 16:11:27	2022-07-21 10:07:27
BK22000896	7	질문자	그정도에요? 저는 향이 고소하고 독특하고 좋은데, 대체 왜 싫다는건지 잘 모르겠다니까요?				0	2022-07-20 16:11:27	2022-08-02 12:01:32
BK22000896	8	전문가	고수에 든 화합물 탓이 커요. 향 첨가 세제의 반 이상, 모기 기피제 등에 이 물질이 들어가는데, 민감한 사람들은 이거 때문에 비누나 살충제를 먹는 느낌을 받아요.	고수 향	https://kormedi.com/1373013/%EC%99%9C-%EC%96%B4%EB%96%A4-%EC%82%AC%EB%9E%8C%EC%9D%80-%EA%B3%A0%EC%88%98%EB%A5%BC-%EB%AA%BB-%EB%A8%B9%EC%9D%84%EA%B9%8C/	2021/12/28	0	2022-07-20 16:11:27	2022-07-21 10:07:27
BK22000896	9	질문자	비누맛이라고 하긴 하더라고요. 다같이 먹으려면 고수는 빼는게 낫겠어요.				0	2022-07-20 16:11:27	2022-08-02 12:01:32
BK22000896	10	전문가	샐러드 파티같은 거 하시나봐요?				0	2022-07-20 16:11:27	2022-07-21 10:07:27
BK22000896	11	질문자	친구네 루프탑에서 파티하려고 하는데 제가 샐러드 담당이거든요. 아주 많이 만들어서 각자 접시에 담아 먹으려고요. 어떤 샐러드가 좋을까요?				0	2022-07-20 16:11:27	2022-08-02 12:01:32
BK22000896	12	전문가	그리스식 샐러드 어때요? 올리브, 토마토, 오이, 페타 치즈, 양파의 조합이 가장 인기있어요. 그런데 그리스인들은 이 샐러드를 칼라마타, 혹은 촌놈 샐러드라고 부른대요.	그리스 샐러드	https://www.huffingtonpost.kr/2015/11/17/story_n_8579752.html	2015/11/17	0	2022-07-20 16:11:27	2022-07-21 10:07:27
BK22000896	13	질문자	그래도 그리스식 샐러드라고 칭하니 멋지네요. 그리스에서 샐러드 많이 먹는건 아는데, 그리스 음식에 큰 특징이 있나요?				0	2022-07-20 16:11:28	2022-08-02 12:01:32
BK22000896	14	전문가	그리스 식단에서 찾아볼 수 있는 제일 독특하고 오래된 요소는 올리브유에요. 거의 대부분 요리에 등장하거든요.	그리스 요리	https://ko.wikipedia.org/wiki/%EA%B7%B8%EB%A6%AC%EC%8A%A4_%EC%9A%94%EB%A6%AC	2021/03/01	0	2022-07-20 16:11:28	2022-07-21 10:07:27
BK22000896	15	질문자	그리스는 왠지 와인이 생각나는데! 그리스에서 올리브가 많이 나고 유명한가요?				0	2022-07-20 16:11:28	2022-08-02 12:01:32
BK22000896	16	전문가	그렇죠, 그리스는 온 나라가 와인 산지일 정도로 재배지가 넓어요. 그렇지만 그리스의 다른 이름은 올리브의 나라이기도 해요.	그리스 올리브	https://www.hani.co.kr/arti/specialsection/esc_section/740631.html	2016/04/20	0	2022-07-20 16:11:28	2022-07-21 10:07:27
BK22000896	17	질문자	그렇군요, 이제 샐러드 드레싱만 정하면 되겠어요!				0	2022-07-20 16:11:28	2022-08-02 12:01:32
BK22000896	18	전문가	이왕 샐러드 준비하는건데, 칼로리 생각도 하면 좋으니까 저칼로리 드레싱 추천할게요. 마요네즈보다는 간장이나 과일식초를 베이스로 으깬 과일이나 곡물을 첨가한 드레싱이 건강에 좋으면서도 칼로리가 낮아요.	샐러드 드레싱 추천	https://m.health.chosun.com/svc/news_view.html?contid=2022030700827	2022/03/09	0	2022-07-20 16:11:28	2022-07-21 10:07:27
BK22000896	19	질문자	아, 저 곡물 첨가한 드레싱 좋아해요. 그렇게 직접 만들어 봐야겠어요. 도움 줘서 고마워요.				0	2022-07-20 16:11:28	2022-08-02 12:01:32
BK22000896	20	전문가	파티 어디서 해요? 많은 사람들 가는 자리면 저도 껴주세요.				0	2022-07-20 16:11:28	2022-07-21 10:07:27
BK22000896	21	질문자	오, 그럼 이번에 오실래요? 파티 다음주에 하는데 괜찮으시면 이번에 초대할게요.				0	2022-07-20 16:11:28	2022-08-02 12:01:32
BK22000896	22	전문가	자세한 거 문자로 알려주세요. 시간 맞으면 저 갈게요.				0	2022-07-20 16:11:28	2022-07-21 15:05:09
BK22000896	23	질문자	그래요, 날 가까워지면 연락 드려볼게요.				1	2022-07-20 16:11:28	2022-08-02 12:01:32
