id	utterance_id	role	text	search_query	search_URL	reference_date	terminate	regDate	updDate
BK22012432	1	질문자	지난 추석에 이모가 커피머신을 주셨어. 집에서 커피를 내려서 마셔볼까 하는데 원두 고르는 것부터 너무 어려워. 원두 고르는 방법을 알려줘.				0	2022-09-30 15:14:09	2022-10-01 14:36:08
BK22012432	2	전문가	먼저 블렌드와 싱글 오리진 중에 선택하는 방법이 있어. 블렌드는 여러 나라에서 온 원두를 섞은 것을 의미하고, 싱글 오리진은 보통 한 나라에서 재배된 원두를 의미해. 경우에 따라서는 한 농장이나 한 협동조합에서 재배된 원두를 싱글 오리진이라고 하기도 해.	원두고르는방법	http://monthly.chosun.com/client/mdaily/daily_view.asp?idx=9858&Newsnumb=2020069858	2020/06/22	0	2022-09-30 15:14:09	2022-10-01 14:36:08
BK22012432	3	질문자	하지만 나는 블렌드나 싱글 오리진의 맛을 몰라서 고르기가 어려워. 조금 더 쉬운 방법은 없을까?				0	2022-09-30 15:14:09	2022-10-01 14:36:08
BK22012432	4	전문가	그렇다면 커피의 맛을 보고 자기 입맛에 맞는 커피를 고르는 방법이 있어. 커피는 신맛, 쓴맛, 단맛, 그리고 입안에 머무르는 커피가 부드러운 정도와 진한 밀도감을 나타내는 바디감이라는 게 있어.	원두고르는방법	https://www.ajunews.com/view/20160712102238041	2016/07/12	0	2022-09-30 15:14:09	2022-10-01 14:36:08
BK22012432	5	질문자	커피의 맛은 원산지에 따라 달라지는 거야?				0	2022-09-30 15:14:09	2022-10-01 14:36:08
BK22012432	6	전문가	맞아, 커피 재배 국가가 속해 있는 대륙의 커피 특징을 알면 커피의 맛도 예상할 수 있어. 하지만 품종이나 커피의 가공 방식, 토양 등에 따라서도 커피의 풍미가 달라질 수 있어.	커피맛원산지	https://www.mk.co.kr/news/economy/view/2022/08/750483/	2022/08/25	0	2022-09-30 15:14:09	2022-10-01 14:36:08
BK22012432	7	질문자	커피는 생산 국가마다 이름이 다르다고 하는데 생산 국가와 이름에 대해서 알 수있을까?				0	2022-09-30 15:14:09	2022-10-01 14:36:08
BK22012432	8	전문가	대표적인 품종 원산지는 에티오피아로, 이곳에서 생산되는 아라비카는 세계 커피 생산량의 60~70%를 차지하고 있어. 아라비카는 생산 국가에 따라서 하와이안 코나, 자메이카 블루마운틴, 예멘 모카, 케냐 AA, 과테말라 안티구아, 콜롬비아 수프리모로 불리고 있어. 또 아프리카나 아시아에서도 커피가 생산되고 있어. 이곳 열대지역 해발 0~800m에서 재배되는 종자인 로부스타는 우리가 마시는 대부분의 인스턴트 커피로 판매되고 있어.	대표적 커피원산지	https://www.econovill.com/news/articleView.html?idxno=290634	2016/06/02	0	2022-09-30 15:14:09	2022-10-01 14:36:08
BK22012432	9	질문자	들어본 이름의 커피가 많은 것 같아. 원산지와 품종으로 이름을 구분할 수 있구나. 커피의 가공방식에 대해서도 알려줘.				0	2022-09-30 15:14:10	2022-10-01 14:36:08
BK22012432	10	전문가	커피의 생두에 열을 가해서 조직을 팽창시키고 화학 변화를 일으켜서 맛과 향을 끌어내는 가공방식을 로스팅이라고 해. 로스팅을 통해 생두의 수분, 지방분 등의 성분이 조화롭게 표현되기 때문에 커피의 독특한 맛을 느낄 수 있어.	커피로스팅	https://ko.wikipedia.org/wiki/%EC%BB%A4%ED%94%BC_%EB%A1%9C%EC%8A%A4%ED%8C%85	2022/03/12	0	2022-09-30 15:14:10	2022-10-01 14:36:08
BK22012432	11	질문자	로스팅에 따라서 맛이 어떻게 달라지는지도 알려줘.				0	2022-09-30 15:14:10	2022-10-01 14:36:08
BK22012432	12	전문가	커피의 볶음 정도를 커피의 배전도라고도 하는데 산미가 없는 걸 선호하면 중배전 정도로 볶은 원두를 선택하는 게 좋아. 반대로 이탈리안이나 프렌치 정도의 강배전을 한 원두는 다크한 느낌을 주고, 약중배전을 한 원두는 산미가 강해.	로스팅에 따른 커피맛	http://www.ohmynews.com/NWS_Web/View/at_pg.aspx?CNTN_CD=A0002810690	2022/02/16	0	2022-09-30 15:14:10	2022-10-01 14:36:08
BK22012432	13	질문자	이제 원두 고르는 방법을 조금 알 것 같아. 그럼 원두를 구매했을 때 맛을 변하게 하지 않고 오랫동안 보관하려면 어떻게 해야 해?				0	2022-09-30 15:14:10	2022-10-01 14:36:08
BK22012432	14	전문가	원두를 구매한 후에 산소를 최대한 차단시켜야 변질되지 않아. 그리고 분쇄하지 않은 홀빈 상태로 보관해야 하고, 어둡고 서늘한 곳에 보관하는 것이 좋아. 그렇다고 냉장실이나 냉동고에 보관하면 안 돼.	원두보관방법	http://www.dailypop.kr/news/articleView.html?idxno=48874	2021/01/29	0	2022-09-30 15:14:10	2022-10-01 14:36:08
BK22012432	15	질문자	음식도 궁합이 있잖아. 커피도 음식과 잘 어울리게  맞춰주는 서비스가 있다고 하는 데 그게 어떤 건지 알 수 있어?				0	2022-09-30 15:14:10	2022-10-01 14:36:08
BK22012432	16	전문가	커피와 어울리는 음식을 찾아 함께 제공하는 걸 커피페어링이라고 해. 일본 스타벅스에서는 커피 원두의 원산지를 고려해서 음식을 판매하고 있어. 파푸아뉴기니 원두로 만든 음료는 치킨과 그린 샌드위치를 함께 제공해. 또 다크하게 로스팅한 수마트라 커피는 계피나 오트밀, 메이플, 버터, 치즈와 같은 음식과 함께 제공하기도 해.	커피와 어울리는 음식	https://it.chosun.com/site/data/html_dir/2022/08/24/2022082400832.html	2022/08/26	0	2022-09-30 15:14:10	2022-10-01 14:36:08
BK22012432	17	질문자	생각보다 커피와 다양한 음식을 함께 먹을 수 있구나. 나도 이제 집에서 여러 종류의 커피를 많이 만들어서 마셔봐야겠어.				0	2022-09-30 15:14:10	2022-10-01 14:36:08
BK22012432	18	전문가	그래, 요즘에 홈 카페가 인기잖아. 홈 카페를 만들어서 새로운 취미로 삼으면 좋을 거야.				0	2022-09-30 15:14:11	2022-10-01 14:36:08
BK22012432	19	질문자	알겠어. 좋은 원두를 골라서 맛있는 커피를 많이 만들어볼게. 나중에 우리 집에 놀러와서 커피도 마시고 가.				0	2022-09-30 15:14:11	2022-10-01 14:36:08
BK22012432	20	전문가	고마워, 꼭 초대해줘. 네가 만든 맛있는 커피를 마셔보고 싶어.				1	2022-09-30 15:14:11	2022-10-01 14:36:08
