id	utterance_id	role	text	search_query	search_URL	reference_date	terminate	regDate	updDate
BK22008111	1	질문자	요즘 보니까 카레 요리를 하는 식당이 많더라고요.				0	2022-09-11 01:55:21	2022-09-11 01:55:21
BK22008111	2	전문가	그쵸. 카레를 활용한 요리를 선보이는 식당이 많이 보여요. 집에서도 카레 가루를 이용하면 여러 요리를 할 수 있잖아요.				0	2022-09-11 01:55:21	2022-09-11 01:55:21
BK22008111	3	질문자	카레 가루는 집에서도 활용하기 좋죠. 제가 어디서 들어 본 건데 시중에 있는 카레 가루는 향신료로 만들어진다고 하더라고요. 어떤 향신료가 들어가 있나요?				0	2022-09-11 01:55:21	2022-09-22 14:49:10
BK22008111	4	전문가	알고 계신 것처럼 카레 가루에는 심황이나 고수, 커민, 호로파 등 여러 향신료가 들어가 있어요. 이 향신료에 생강이나 후추, 겨자씨 등이 들어가 있어서 건강에도 좋죠.	카레 가루	https://www.hidoc.co.kr/healthstory/news/C0000494271	2020/02/04	0	2022-09-11 01:55:21	2022-09-11 01:55:21
BK22008111	5	질문자	생각보다 더 다양한 향신료가 들어가는군요. 카레는 어떤 효능이 있는 거죠?				0	2022-09-11 01:55:21	2022-09-11 01:55:21
BK22008111	6	전문가	카레는 항암과 항산화 효과가 있고 면역력 강화에도 좋아요. 항염증 효과도 있는데 그렇기에 노인이 카레를 먹어도 좋죠. 카레에 커큐민이라는 성분은 위산 분비를 조절하는 효능도 있어서 위염이 있는 환자에게 도움이 되죠.	카레 효능	http://www.joygm.com/news/articleView.html?idxno=79706#09d9	2019/12/09	0	2022-09-11 01:55:21	2022-09-11 01:55:21
BK22008111	7	질문자	카레는 몸 건강에도 정말 좋군요. 커큐민은 어디서 들어봤는데 정확하게 뭔가요?				0	2022-09-11 01:55:21	2022-09-11 01:55:21
BK22008111	8	전문가	커큐민은 강황에 들어 있는 성분으로 카레에도 있는데요. 이 강황은 인도가 원산지인 다년생 식물로 카레와 겨자 등에 색소로 사용 되곤 해요. 강황 속 커큐민은 항산화 효과에 좋고 전립선암 예방에도 도움을 주죠.	카레 커큐민	https://kormedi.com/1370678/%ec%a4%91%eb%85%84%ec%97%90-%ec%a2%8b%ec%9d%80-%eb%b0%a4%c2%b7%ec%b9%b4%eb%a0%88-%eb%9c%bb%eb%b0%96%ec%9d%98-%ea%b1%b4%ea%b0%95%ed%9a%a8%ea%b3%bc%ea%b0%80/	2021/12/15	0	2022-09-11 01:55:21	2022-09-11 01:55:21
BK22008111	9	질문자	커큐민은 강황에 들어있는 성분이네요. 이번에 정확하게 알게 되었어요. 카레가 다이어트에도 도움이 된다는 데 정말인가요?				0	2022-09-11 01:55:21	2022-09-11 01:55:21
BK22008111	10	전문가	카레에는 캡사이신 성분이 있는데요. 이 성분이 카테콜라민 호르몬 분비를 촉진 시키기 때문에 지방 대사를 활발하게 만들어요. 그렇기에 다이어트에 도움이 되죠.	카레 다이어트	http://www.busaneconomy.com/news/articleView.html?idxno=140180	2020/01/16	0	2022-09-11 01:55:21	2022-09-11 01:55:21
BK22008111	11	질문자	카레가 정말 다이어트에 도움이 되는 식품이군요. 혹시 카레를 먹을 때 주의해야 할 사항이 있을까요?				0	2022-09-11 01:55:21	2022-09-11 01:55:21
BK22008111	12	전문가	카레는 임산부들은 먹지 않는 것이 좋은데요. 임산부들의 자궁이 수축될 수 있기 때문이죠.	카레 부작용	http://www.insightkorea.co.kr/news/articleView.html?idxno=76984	2020/02/23	0	2022-09-11 01:55:21	2022-09-11 01:55:21
BK22008111	13	질문자	임산부는 피하는 것이 좋은 음식이군요. 주의해서 먹어야겠어요. 카레를 이용한 음식 레시피가 궁금한데 알려줄 수 있나요?				0	2022-09-11 01:55:21	2022-09-11 01:55:21
BK22008111	14	전문가	토마토 카레 레시피를 알려드릴게요. 먼저 감자와 양파와 같은 채소를 준비하고 토마토도 먹기 좋은 크기로 잘라줘요. 팬에 기름을 두르고 마늘을 편으로 썰어서 볶아주다가 준비한 감자와 양파, 토마토를 넣고 볶아줘요. 물을 넣고 채소가 잘 익을 수 있도록 끓여주다 카레를 넣고 풀어주고요. 파프리카도 넣어준 후 마지막에는 우유를 넣어주면 완성이에요.	카레 레시피	http://www.sporbiz.co.kr/news/articleView.html?idxno=55787	2016/12/02	0	2022-09-11 01:55:21	2022-09-22 14:49:10
BK22008111	15	질문자	정말 맛있을 것 같은 레시피네요. 혹시 카레를 먹다가 남겼을 때 냉동 보관해도 되나요?				0	2022-09-11 01:55:21	2022-09-11 01:55:21
BK22008111	16	전문가	카레를 소분한 뒤 밀폐용기에 담아주고 냉동 보관하면 돼요. 꺼내 먹을 때 차가워도 맛이 좋죠.	카레 냉동보관	http://www.fintechpost.co.kr/news/articleView.html?idxno=96803	2019/12/25	0	2022-09-11 01:55:21	2022-09-22 14:49:10
BK22008111	17	질문자	소분해서 냉동 보관하면 좋겠군요. 카레를 활용한 레시피중에 밥을 넣은 레시피가 있다면 알려줄 수 있나요?				0	2022-09-11 01:55:21	2022-09-11 01:55:21
BK22008111	18	전문가	카레 볶음밥은 15분 내외로 만들 수 있는 건강한 레시피인데요. 양파와 당근을 다져주고 완두콩의 물기를 제거해줘요. 팬에 기름을 두르고 열이 오르면 당근을 먼저 넣고 볶아주다가 준비한 양파와 완두콩을 넣고 볶아요. 야채가 다 익어가면 밥을 넣어 볶아주다가 마지막에 카레가루를 넣고 볶으면 완성이에요.	카레 볶음밥	https://www.etoday.co.kr/news/view/897383	2014/04/07	0	2022-09-11 01:55:21	2022-09-11 01:55:21
BK22008111	19	질문자	카레 볶음밥 레시피는 간단한데 맛도 건강도 잡을 수 있을 것 같네요. 오늘 좋은 정보 고마워요.				0	2022-09-11 01:55:21	2022-09-11 01:55:21
BK22008111	20	전문가	다음에도 언제든 궁금한 것이 있으면 연락해요. 오늘처럼 즐겁게 대화해요.				1	2022-09-11 01:55:21	2022-09-22 14:49:10
