id	utterance_id	role	text	search_query	search_URL	reference_date	terminate	regDate	updDate
BK22002924	1	질문자	요즘 새조개가 맛있대서 주말에 수산시장에 가보려고요. 근데 새조개가 겨울이 제철이 맞나요?				0	2022-08-02 12:20:51	2022-08-02 14:14:20
BK22002924	2	전문가	네, 맞아요. 1월부터 3월까지가 새조개 철이거든요. 이 시기에 먹어야 감칠맛도 돌고 토톰한 식감도 제대로 느낄 수 있어요.	새조개 제철	http://www.seoulfn.com/news/articleView.html?idxno=444682	2022/01/21	0	2022-08-02 12:20:51	2022-08-02 14:14:20
BK22002924	3	질문자	그럼 지금이 새조개 먹기 딱이네요. 제가 작년에 샤브샤브로 처음 먹어봤는데 정말 맛있어서 깜짝 놀랐거든요.				0	2022-08-02 12:20:51	2022-08-02 14:14:20
BK22002924	4	전문가	새조개는 보통 샤브샤브로 먹는데 제대로 드셨군요? 근데 살짝만 넣었다 빼야지 너무 오래 익히면 질겨질뿐 아니라 달큰한 맛도 떨어져요.	새조개 요리	https://news.mt.co.kr/mtview.php?no=2021021515414675352	2021/02/15	0	2022-08-02 12:20:51	2022-08-02 14:14:20
BK22002924	5	질문자	맞아요. 저도 너무 오래 담궜다 먹으니까 질감이 별로였어요.				0	2022-08-02 12:20:51	2022-08-02 14:14:20
BK22002924	6	전문가	그렇죠? 그리고 다음에는 새조개 회도 한번 드셔보세요. 단백질, 철분, 타우린까지 들어있어서 겨울철에 별미랍니다.	새조개 회	https://www.gokorea.kr/news/articleView.html?idxno=37012	2018/01/26	0	2022-08-02 12:20:51	2022-08-02 14:14:20
BK22002924	7	질문자	오, 새조개 회도 맛있겠네요! 겨울에는 역시 먹을게 많아서 참 좋아요.				0	2022-08-02 12:20:51	2022-08-02 14:14:20
BK22002924	8	전문가	겨울철 별미하면 또 매생이를 빼 놓을 수 없죠. 탄수화물에 비타민까지 들어있는 고단백 식품이라 건강에 좋거든요.	겨울철 별미	http://www.shinailbo.co.kr/news/articleView.html?idxno=1511064	2022/01/27	0	2022-08-02 12:20:51	2022-08-02 14:14:20
BK22002924	9	질문자	맞아요. 저 매생이로 만든 떡국 먹어봤는데 기가 막히던걸요?				0	2022-08-02 12:20:51	2022-08-02 14:14:20
BK22002924	10	전문가	근데 그거 잘 식혀서 먹어야 되는거 아시죠? 섬유가 촘촘히 뭉쳐있어서 김이 잘 안나니까 그냥 먹다가 앗,뜨거 하는 경우도 많거든요. 오죽하면 미운 사위에게 매생이국 준다 라는 속담까지 있겠어요.	매생이	https://ko.wikipedia.org/wiki/%EB%A7%A4%EC%83%9D%EC%9D%B4	2022/06/19	0	2022-08-02 12:20:51	2022-08-02 14:14:20
BK22002924	11	질문자	저도 당연히 그 속담 들어봤죠. 근데 제가 먹어보니 왜 그런 속담이 생겼는지 알만큼 뜨겁긴했어요.				0	2022-08-02 12:20:51	2022-08-02 14:14:20
BK22002924	12	전문가	그러니까요, 후후 불어먹어야지 아주 큰일나는 수가 있다고요.				0	2022-08-02 12:20:51	2022-08-03 09:16:20
BK22002924	13	질문자	얘기하다 보니 매생이도 먹고싶은데 수산시장에서 좀 사와야겠네요.				0	2022-08-02 12:20:51	2022-08-02 14:14:21
BK22002924	14	전문가	가격이 괜찮으면 넉넉하게 사서 소분하여 냉동실에 보관하면 좋아요. 필요할때마다 꺼내서 녹여먹으면 오랫동안 드실 수도 있거든요.	매생이 보관	https://www.ajunews.com/view/20191031091355977	2019/10/31	0	2022-08-02 12:20:51	2022-08-02 14:14:21
BK22002924	15	질문자	그래야겠네요. 근데 요새 수산시장 안간지가 오래되서 시세가 어떻게 되는지 통 모르겠어요.				0	2022-08-02 12:20:51	2022-08-02 14:14:21
BK22002924	16	전문가	아, 요즘엔 수산시장 당일 시세와 가격 변동 추이를 바로 볼 수 있는 D2C 플랫폼도 있어요. 예를 들면 인어교주해적단 이라고 있는데 다운받으셔서 방문하실 시장의 원하는 수산물을 조회하시면 시세가 어떻게 되는지를 미리 볼 수 있어요.	새조개 시세	https://www.junggi.co.kr/article/articleView.html?no=28922	2022/06/27	0	2022-08-02 12:20:51	2022-08-02 14:14:21
BK22002924	17	질문자	우와, 이런 꿀팁이 있다니 감사합니다!				0	2022-08-02 12:20:51	2022-08-02 14:14:21
BK22002924	18	전문가	그리고 도루묵,양미리,도치 이런 겨울생선이 DHA가 풍부해서 피로회복이나 숙취해소에도 좋거든요. 혹시 시세가 괜찮다싶으면 드셔보세요.	겨울 생선	http://www.mkhealth.co.kr/news/articleView.html?idxno=56422	2022/01/21	0	2022-08-02 12:20:51	2022-08-02 14:14:21
BK22002924	19	질문자	저 양미리 진짜 좋아하는데 값이 괜찮으면 좀 사와야겠어요.				0	2022-08-02 12:20:51	2022-08-02 14:14:21
BK22002924	20	전문가	수산시장 가셔서 맛있는 거 많이 구입하시고 잘 다녀오세요.				1	2022-08-02 12:20:51	2022-08-03 09:16:21
