id	utterance_id	role	text	search_query	search_URL	reference_date	terminate	regDate	updDate
BK22005791	1	질문자	요즘 세계 10대 푸드 중 귀리에 관심이 생겼는데 귀리가 뭔가요?				0	2022-08-17 17:32:33	2022-08-17 17:32:33
BK22005791	2	전문가	벼과에 있는 두해살이 풀로 고려시대부터 재배하기 시작했으며, 원산지는 중앙아시아 지역이에요.	귀리	https://ko.wikipedia.org/wiki/%EA%B7%80%EB%A6%AC	2022/05/09	0	2022-08-17 17:32:33	2022-09-07 08:15:08
BK22005791	3	질문자	귀리가 몸에 그렇게 좋은지 효능이 궁금해요!				0	2022-08-17 17:32:33	2022-08-30 10:21:08
BK22005791	4	전문가	귀리는 식이섬유가 13~20%로 굉장히 풍부하며 백미의 22배, 현미의 3배에 이르며, 포만감 또한 커서 다이어트 식품이에요. 또한 섬유질이 가득해 변비가 있으신 분들께 좋아요.	귀리 효능	http://www.thekpm.com/news/articleView.html?idxno=122098	2022/06/06	0	2022-08-17 17:32:33	2022-08-30 10:21:08
BK22005791	5	질문자	귀리가 몸에 굉장히 좋겠네요. 혹시 영양성분으로는 뭐가 들어 있나요?				0	2022-08-17 17:32:33	2022-08-17 17:32:33
BK22005791	6	전문가	귀리 속엔 필수아미노산과 단백질 등 베타글루칸이 가득 하여 면역력에 도움을 주며 콜레스테롤 저하에 많은 도움을 줍니다. 또한 혈당과 콜레스테롤 수치를 낮춰줘요.	귀리 영양	https://www.cnbnews.com/news/article.html?no=541939	2022/04/18	0	2022-08-17 17:32:33	2022-08-30 10:21:08
BK22005791	7	질문자	베타글루칸이 면역력을 높여 주는 건가요? 정확한 효능이 궁금해요.				0	2022-08-17 17:32:33	2022-08-17 17:42:22
BK22005791	8	전문가	네 맞아요. 베타글루칸이 면역력을 높여주며, 항산화 향상까지 해주기 때문에 항암 효과에도 좋아요.	베타글루칸	https://www.topstarnews.net/news/articleView.html?idxno=633345	2019/06/06	0	2022-08-17 17:32:33	2022-08-17 17:42:22
BK22005791	9	질문자	귀리 이외에도 베타글루칸이 들어있는 식재료가 있나요?				0	2022-08-17 17:32:33	2022-08-17 17:49:59
BK22005791	10	전문가	버섯 중에 목질진흙버섯은 버섯 중에도 베타글루칸1.3 함량이 높아 암세포의 성장을 억제해주고 방사선 및 항암치료에도 부작용을 줄일 수 있어요.	목질진흙버섯	http://www.realfoods.co.kr/view.php?ud=20171227000352	2017/12/27	0	2022-08-17 17:32:35	2022-08-30 10:21:08
BK22005791	11	질문자	암세포와 항암치료에도 아주 좋은거군요. 그런데 목질진흙버섯이 뭔지 알려주실 수 있나요?				0	2022-08-17 17:32:35	2022-08-30 10:21:08
BK22005791	12	전문가	목질진흙버섯은 상황버섯 이라고 많이 알려져있어요. 또한 맛이 순하며 독성도 거의 없지만 개인의 건강에 따라 부작용이 있을 수 있어요.	목질진흙버섯	https://ko.wikipedia.org/wiki/%EC%83%81%ED%99%A9%EB%B2%84%EC%84%AF	2022/05/11	0	2022-08-17 17:32:35	2022-08-30 10:21:08
BK22005791	13	질문자	많이 들어 본 것 같은데, 상황버섯의 효능을 더 알려주실 수 있나요?				0	2022-08-17 17:32:35	2022-08-17 18:06:06
BK22005791	14	전문가	상황버섯에는 노화를 방지해주는 폴리페놀이란 성분이 들어 있어요. 뿐만 아니라 혈액을 순환해주는 도움까지 주기 때문에 몸에 아주 좋아요.	상황버섯 효능	http://www.gnnews.co.kr/news/articleView.html?idxno=507021	2022/08/07	0	2022-08-17 17:32:35	2022-08-17 18:06:06
BK22005791	15	질문자	귀리에 상황버섯까지 몸에 너무 좋겠네요. 상황버섯은 어떻게 먹나요?				0	2022-08-17 17:32:35	2022-08-17 18:06:06
BK22005791	16	전문가	맞아요. 귀리와 상황버섯 둘 다 몸에 좋으니 챙겨드시면 좋겠죠? 상황버섯은 몸체로 먹는것보다 끓인 후 차로 마시는게 보통이에요.	상황버섯 먹는법	https://www.nbntv.co.kr/news/articleView.html?idxno=370909	2020/03/12	0	2022-08-17 17:32:35	2022-08-30 10:21:08
BK22005791	17	질문자	귀리와 상황버섯의 베타글루칸이 면역력에 많은 도움을 주는 것 같아요. 그렇다면 베타글루칸이 들어간 음식은 또 뭐가 있나요?				0	2022-08-17 17:32:35	2022-08-29 11:57:13
BK22005791	18	전문가	베타글루칸이 들어간 음식으로는 버섯, 잡곡, 효모 등이 있으며 이석증에도 좋아요.	베타글루칸	http://www.fintechpost.co.kr/news/articleView.html?idxno=76455	2019/10/05	0	2022-08-17 17:32:35	2022-08-30 10:21:08
BK22005791	19	질문자	버섯 뿐 아니라 잡곡 효모 등도 잘 챙겨먹을게요. 또 궁금한 점 있으면 여쭤볼게요!				0	2022-08-17 17:32:35	2022-08-30 10:21:08
BK22005791	20	전문가	네 면역력 관리와 건강 관리 잘하시길 바래요!				1	2022-08-17 17:32:35	2022-09-07 08:15:08
