id	utterance_id	role	text	search_query	search_URL	reference_date	terminate	regDate	updDate
BK22012050	1	질문자	한식에 관심이 많은 외국인 친구가 저번 주에 씨간장을 맛보러 갔다는데, 씨간장에 대해 아세요?				0	2022-09-30 15:02:38	2022-10-01 10:26:51
BK22012050	2	전문가	음, 간장을 새로 담그면 햇간장, 1~2년의 숙성을 거치면 청간장, 3~4년은 중간장, 5년이 넘으면 진간장이라고 하죠. 씨간장은 숙성을 거친 진간장 중에서도 가장 좋은 것을 골라 유지한 것입니다.	씨간장 만들기	https://www.joongang.co.kr/article/25080362	2022/06/20	0	2022-09-30 15:02:38	2022-10-01 10:26:51
BK22012050	3	질문자	진간장이란 말은 많이 들어봤는데, 씨간장도 진간장의 한 종류이군요. 씨간장은 어떤 맛을 내나요?				0	2022-09-30 15:02:38	2022-10-01 10:26:52
BK22012050	4	전문가	풍미가 강하고 단맛과 감칠맛이 동시에 나요. 또한 보기에는 흑색인데, 깊은 풍미로 맛의 씨 역할을 한답니다.	씨간장 맛의 풍미	https://www.donga.com/news/article/all/20220820/115039579/1	2022/08/20	0	2022-09-30 15:02:38	2022-10-01 10:26:52
BK22012050	5	질문자	그럼 씨간장은 어떻게 해서 만들어지나요?				0	2022-09-30 15:02:38	2022-10-01 10:26:52
BK22012050	6	전문가	종가에선 씨간장은 그 해에 새로 만든 햇간장을 조금씩 첨가하는 방식으로 기존 간장의 맛을 유지해요. 이러한 방법을 일명 덧장이라고 부른답니다.	간장 덧장	https://www.mk.co.kr/news/economy/view/2022/09/796841/	2022/09/07	0	2022-09-30 15:02:38	2022-10-01 10:26:52
BK22012050	7	질문자	그럼 씨간장은 아주 귀하겠네요. 씨간장을 구하려면 가격도 비쌀까요?				0	2022-09-30 15:02:38	2022-10-01 10:26:52
BK22012050	8	전문가	그럼요, 오래된 씨간장의 경우 항아리 하나의 가치가 1억 원에 달해요. 그래서 옛말에 씨간장은 옹기채 훔쳐간다라고 하죠.	씨간장 맛의 이유	https://www.sedaily.com/NewsView/269WT831X8	2022/08/23	0	2022-09-30 15:02:38	2022-10-01 10:26:52
BK22012050	9	질문자	씨간장의 맛이 정말 궁금해지는데, 씨간장을 넣은 요리가 있을까요?				0	2022-09-30 15:02:38	2022-10-01 10:26:52
BK22012050	10	전문가	불고기 요리에 씨간장을 넣어 판매하는 한 식당의 경우, 76년 전통의 씨간장을 사용해요. 이 씨간장은 맛과 향이 매우 강해서 조금만 덜 쓰거나 더 많이 쓰면 음식의 맛을 망칠 수 있어요.	씨간장 들어간 요리	http://www.naeil.com/news_view/?id_art=243745	2017/07/11	0	2022-09-30 15:02:39	2022-10-01 10:26:52
BK22012050	11	질문자	흠, 씨간장 불고기같이 한식 말고 서양 요리는 없나요?				0	2022-09-30 15:02:39	2022-10-01 10:26:52
BK22012050	12	전문가	씨간장을 활용한 버거 요리도 있어요. 미국의 쉐이크쉑 버거에서는 씨간장을 활용한 더 헤리티지 370 버거를 출시했어요. 이 버거에는 기순도 명인의 씨간장을 원재료로 넣은 아이올리소스 넣은 버거를 맛볼 수 있어요.	씨간장 기업	https://www.donga.com/news/article/all/20220828/115186231/1	2022/08/29	0	2022-09-30 15:02:39	2022-10-01 10:26:52
BK22012050	13	질문자	음, 버거가 설명만 들어도 군침이 도네요. 요리 말고 마트에서 사 올 제품도 있나요?				0	2022-09-30 15:02:39	2022-10-01 10:26:52
BK22012050	14	전문가	씨간장을 활용한 숙성 양조간장을 마트에서도 구매할 수 있어요. 간단한 무침과 볶음, 또는 갈비찜이나 새우장 등의 간장을 활용하는 한식 요리에 잘 어울려요.	씨간장 기업	https://sports.chosun.com/news/ntype.htm?id=202109010100000590015043&servicedate=20210831	2021/08/31	0	2022-09-30 15:02:39	2022-10-01 10:26:52
BK22012050	15	질문자	씨간장을 사서 요리에 활용해보고 싶어요. 씨간장 요리를 외국인 손님께 대접하면 반응이 좋을까요?				0	2022-09-30 15:02:39	2022-10-01 10:26:52
BK22012050	16	전문가	그럼요, 도널드 트럼프 전 미국 대통령이 2017년에 방한했을 때 대접한 음식 중 하나가 씨간장을 넣어서 구운 한우갈비구이였어요. 당시 그 씨간장이 360년이나 된 간장이었죠.	씨간장 트럼프	https://www.chosun.com/culture-life/food-taste/2021/05/29/GQKWXY5J3RCNXIFFX542AFQD6A/?utm_source=naver&utm_medium=referral&utm_campaign=naver-news	2021/05/29	0	2022-09-30 15:02:39	2022-10-01 10:26:52
BK22012050	17	질문자	360년이라니 정말 귀하게 느껴져요. 하지만 당장 씨간장을 구하긴 힘들겠어요				0	2022-09-30 15:02:39	2022-10-01 10:26:52
BK22012050	18	전문가	맞아요, 씨간장은 귀한 재료이니까요.				0	2022-09-30 15:02:39	2022-10-01 10:26:52
BK22012050	19	질문자	하지만 알려주신 요리도 몇 가지 있으니 그것부터 시도를 해볼게요!				0	2022-09-30 15:02:39	2022-10-01 10:26:52
BK22012050	20	전문가	그래요, 긍정적인 태도 좋은걸요.				0	2022-09-30 15:02:39	2022-10-01 10:26:52
BK22012050	21	질문자	먹어보며 그다음에 어떤 요리를 할지도 생각해볼게요.				1	2022-09-30 15:02:39	2022-10-01 10:26:52
