id	utterance_id	role	text	search_query	search_URL	reference_date	terminate	regDate	updDate
BK22013294	1	질문자	아침식사로 주로 뭘 드세요?				0	2022-09-30 15:38:19	2022-10-01 18:32:04
BK22013294	2	전문가	저도 아침에 주로 빵을 먹고 있어요.				0	2022-09-30 15:38:20	2022-10-01 18:32:04
BK22013294	3	질문자	오, 어떤 빵을 주로 드세요? 최근에 달달한 빵을 많이 먹으니 물리더라고요. 담백한 빵을 좀 추천해 주실래요?				0	2022-09-30 15:38:20	2022-10-01 18:32:04
BK22013294	4	전문가	밀가루, 물, 효모를 넣어서 반죽해 구운 다음, 먹기 편하게 잘라놓은 식빵을 추천해 드릴게요.	식빵	https://www.hankyung.com/economy/article/2021111129211	2021/11/12	0	2022-09-30 15:38:20	2022-10-01 18:32:04
BK22013294	5	질문자	아, 근데 식빵은 매번 많이 남아서 결국 버리게 되더라고요. 맛있게 먹는 방법 없을까요?				0	2022-09-30 15:38:20	2022-10-01 18:32:04
BK22013294	6	전문가	프렌치토스트를 해 드시는 걸 추천드려요. 빵을 버리는 게 죄나 다름없던 중세 시대 유럽에선 남은 딱딱한 빵을 재활용하는 방법으로 프렌치토스트를 해 먹었어요. 프랑스어로 팽페르뒤라고 하는데, 못 쓰게 된 빵이란 뜻이에요.	프렌치토스트	https://www.chosun.com/site/data/html_dir/2020/04/28/2020042800061.html	2020/04/28	0	2022-09-30 15:38:20	2022-10-01 18:32:04
BK22013294	7	질문자	프렌치토스트가 그렇게 맛있는데, 식빵을 재활용하는 방법이었다니 재미있어요. 식빵보다 한 번에 먹기 딱 좋은 크기의 빵으론 뭐가 있을까요?				0	2022-09-30 15:38:20	2022-10-01 18:32:04
BK22013294	8	전문가	보통 손바닥 정도의 크기의 베이글을 추천해요. 이스트와 밀가루를 반죽한 다음 끓는 물에 물에 데친 후 구운 빵이에요.	베이글	https://ko.wikipedia.org/wiki/%EB%B2%A0%EC%9D%B4%EA%B8%80	2022/09/02	0	2022-09-30 15:38:20	2022-10-01 18:32:04
BK22013294	9	질문자	오호, 베이글은 보통 어떻게 해서 드세요?				0	2022-09-30 15:38:20	2022-10-01 18:32:04
BK22013294	10	전문가	베이글에 크림치즈를 발라 먹는 쉬미어 방식이 미국식 베이글의 기본 형태이에요. 하지만 쫄깃하고 담백한 맛이 좋으니 그냥 드셔도 돼요. 아니면 염장 연어나 양파, 토마토 등을 곁들여 샌드위치 형태로도 먹을 수 있어요.	쉬미어	https://www.foodbank.co.kr/news/articleView.html?idxno=63288	2022/08/24	0	2022-09-30 15:38:20	2022-10-01 18:32:04
BK22013294	11	질문자	아하, 베이글이 여러모로 먹는 방법이 다양하군요. 그래서 요즘 그렇게 인기가 많은 건가요?				0	2022-09-30 15:38:20	2022-10-01 18:32:04
BK22013294	12	전문가	베이글이 당분, 지방이 다른 빵에 비해 적은 편이기도 하고 육류나 치즈 등을 끼워 먹을 수 있다 보니 건강을 중시하는 트렌드와 잘 맞아떨어져 인기를 끌게 됐죠.	베이글 트렌드	https://www.foodbank.co.kr/news/articleView.html?idxno=63288	2022/08/24	0	2022-09-30 15:38:20	2022-10-01 18:32:04
BK22013294	13	질문자	그렇군요, 그런데 베이글 말고 또 샌드위치를 해 먹을 수 있는 빵으론 뭐가 있나요? 베이글은 중간에 구멍이 있어서 재료를 넣기 어렵더라고요.				0	2022-09-30 15:38:20	2022-10-01 18:32:04
BK22013294	14	전문가	이탈리아에서 시작돼 유럽, 북미로 퍼진 치아바타는 이스트로 반죽해 만드는데요. 치아바타는 샌드위치 빵으로 불리기도 해요.	치아바타	https://ko.wikipedia.org/wiki/%EC%B9%98%EC%95%84%EB%B0%94%ED%83%80	2022/02/13	0	2022-09-30 15:38:20	2022-10-01 18:32:04
BK22013294	15	질문자	오, 치아바타가 이탈리아 빵이군요. 치아바타는 어떤 뜻을 가지고 있어요?				0	2022-09-30 15:38:20	2022-10-01 18:32:04
BK22013294	16	전문가	치아바타 어원의 유래는 이탈리아 말로 낡은 신발 그리고 슬리퍼를 의미해요. 빵의 모양이 길고 넓적한 데다 가운데가 푹 꺼진 모양이잖아요.	치아바타 유래	http://www.handmk.com/news/articleView.html?idxno=12824	2022/07/12	0	2022-09-30 15:38:20	2022-10-01 18:32:04
BK22013294	17	질문자	하하, 정말 신발처럼 생겼네요. 이런 빵을 먹는 건 정말 행복한 일이긴 하지만, 살이 찔까 봐 걱정이 되는데, 이런 빵들을 대체할 만한 식품도 있을까요?				0	2022-09-30 15:38:20	2022-10-01 18:32:05
BK22013294	18	전문가	버터나 우유, 달걀과 같은 동물성 재료를 사용하지 않는 비건 베이커리가 있어요. 코코넛 슈가, 곡물가루 같은 식물성 재료를 써서 저열량, 고영양이라 건강 빵이라고도 불려요.	건강 빵	https://newspim.com/news/view/20211231000424	2022/01/08	0	2022-09-30 15:38:20	2022-10-01 18:32:05
BK22013294	19	질문자	비건 베이커리에 대해서 들어보기만 했는데, 이쪽에도 관심을 가져 봐야겠네요.				0	2022-09-30 15:38:21	2022-10-01 18:32:05
BK22013294	20	전문가	네, 여러 가지 빵들 드셔 보시고 가장 맛있었던 빵이 뭔지 알려 주세요.				1	2022-09-30 15:38:21	2022-10-01 18:32:05
