id	utterance_id	role	text	search_query	search_URL	reference_date	terminate	regDate	updDate
BK22002945	1	질문자	저는 커피를 마시지 않는데 사람들이 아메리카노를 정말 즐겨 마시더라고요. 아메리카노가 어떤 커피인지 설명해 주실 수 있나요?				0	2022-08-04 09:18:51	2022-08-04 09:18:51
BK22002945	2	전문가	아메리카노 좋죠. 아메리카노는 에스프레소에 뜨거운 물을 넣어 에스프레소의 농도를 희석해서 만든 커피예요.	아메리카노	https://ko.wikipedia.org/wiki/%EC%B9%B4%ED%8E%98_%EC%95%84%EB%A9%94%EB%A6%AC%EC%B9%B4%EB%85%B8	2022/04/14	0	2022-08-04 09:18:51	2022-08-05 09:12:56
BK22002945	3	질문자	그런데 저는 아메리카노는 써서 잘 못 마시겠더라고요.				0	2022-08-04 09:18:51	2022-08-05 09:12:56
BK22002945	4	전문가	그럴 수 있어요, 아메리카노의 농도는 에스프레소의 샷 수와 물이 얼마나 들어가느냐에 따라 달라지기 때문이에요.	아메리카노 농도	https://ko.wikipedia.org/wiki/%EC%B9%B4%ED%8E%98_%EC%95%84%EB%A9%94%EB%A6%AC%EC%B9%B4%EB%85%B8	2022/04/14	0	2022-08-04 09:18:51	2022-08-04 09:18:51
BK22002945	5	질문자	그렇군요, 커피는 원래 이탈리아에서 에스프레소로 마시는 것이 풍습으로 알고 있는데 아메리카노는 언제부터 마시게 된 것이죠?				0	2022-08-04 09:18:51	2022-08-04 09:18:51
BK22002945	6	전문가	1773년 보스턴 차 사건 이후에 미국인들이 홍차 대신에 커피를 홍차처럼 연하게 마시기 위해 만들어졌고, 이렇게 커피를 연하게 마시는 풍습이 이어져서 아메리칸 스타일의 커피라 불리게 되며 아메리카노가 탄생되었어요.	아메리카노 역사	https://ko.wikipedia.org/wiki/%EC%B9%B4%ED%8E%98_%EC%95%84%EB%A9%94%EB%A6%AC%EC%B9%B4%EB%85%B8	2022/04/14	0	2022-08-04 09:18:51	2022-08-05 09:12:56
BK22002945	7	질문자	미국 사람이 커피를 마시는 스타일이라 해서 아메리카노라고 불리게 되었군요. 그러면 일반적인 아메리카노 레시피는 에스프레소와 물이 끝인가요?				0	2022-08-04 09:18:51	2022-08-04 09:18:51
BK22002945	8	전문가	일반적으로 아메리카노는 에스프레소 샷 1개 또는 샷 2개와 함께 뜨거운물을 섞는 레시피로 만들어져요.	아메리카노 샷	https://ko.wikipedia.org/wiki/%EC%B9%B4%ED%8E%98_%EC%95%84%EB%A9%94%EB%A6%AC%EC%B9%B4%EB%85%B8	2022/04/14	0	2022-08-04 09:18:51	2022-08-05 09:12:56
BK22002945	9	질문자	샷을 한 번 넣을지 두 번을 넣을지는 만드는 사람 마음이기 때문에 카페마다 아메리카노 맛이 다 다를 수도 있겠어요.				0	2022-08-04 09:18:51	2022-08-05 09:12:56
BK22002945	10	전문가	그렇죠, 샷의 수와 물의 양에 따라서도 커피의 맛이 달라지지만 어떤 원두로 에스프레소를 추출했냐에 따라서도 커피의 맛이 다양해져요.	아메리카노 원두	https://ko.wikipedia.org/wiki/%EC%B9%B4%ED%8E%98_%EC%95%84%EB%A9%94%EB%A6%AC%EC%B9%B4%EB%85%B8	2022/04/14	0	2022-08-04 09:18:51	2022-08-04 09:18:51
BK22002945	11	질문자	아하, 그런데 만약 에스프레소를 조금 넣고 뜨거운 물을 많이 넣으면 커피 고유의 맛이 안 느껴지지 않을까요? 제가 쓴 거를 못 먹어서 그렇게 해서라도 아메리카노를 마셔보려고요.				0	2022-08-04 09:18:51	2022-08-05 09:12:56
BK22002945	12	전문가	그렇지는 않아요, 물을 많이 희석한다고 해서 커피 고유의 맛이 약해지지 않을뿐더러 커피의 맛을 뜨거운 물이 부드럽게 만들어 주기 때문에 오히려 커피 본연의 맛이 강조되기도 해요.	아메리카노 맛	https://ko.wikipedia.org/wiki/%EC%B9%B4%ED%8E%98_%EC%95%84%EB%A9%94%EB%A6%AC%EC%B9%B4%EB%85%B8	2022/04/14	0	2022-08-04 09:18:51	2022-08-05 09:12:56
BK22002945	13	질문자	뜨거운 물로 희석해도 커피 본연의 맛이 사라지지 않는다면 도전해볼 만하겠어요. 일단 에스프레소 샷을 내려야겠네요.				0	2022-08-04 09:18:51	2022-08-05 09:12:56
BK22002945	14	전문가	아, 아메리카노는 에스프레소 뿐만 아니라 리스토레토와 룽고를 이용해서도 만들 수 있어요.	아메리카노 종류	https://ko.wikipedia.org/wiki/%EC%B9%B4%ED%8E%98_%EC%95%84%EB%A9%94%EB%A6%AC%EC%B9%B4%EB%85%B8	2022/04/14	0	2022-08-04 09:18:51	2022-08-05 09:12:56
BK22002945	15	질문자	리스토레토와 룽고를 이용해서 아메리카노를 만들면 맛이 많이 다른가요?				0	2022-08-04 09:18:51	2022-08-04 09:18:51
BK22002945	16	전문가	리스토레토로 아메리카노를 만들면 물과 많이 희석되기 때문에 가장 연한 아메리카노를 맛보실 수 있고 룽고로 만든 아메리카노는 물과 희석이 가장 적게 되기 때문에 가장 진한 아메리카노를 맛보실 수 있어요.	리스트레토	https://ko.wikipedia.org/wiki/%EC%B9%B4%ED%8E%98_%EC%95%84%EB%A9%94%EB%A6%AC%EC%B9%B4%EB%85%B8	2022/04/14	0	2022-08-04 09:18:51	2022-08-04 09:18:51
BK22002945	17	질문자	그러면 저는 리스토레토로 만든 아메리카노를 먼저 도전해봐야겠네요.				0	2022-08-04 09:18:51	2022-08-05 09:12:56
BK22002945	18	전문가	네, 일반적으로 에스프레소로 만든 아메리카노보다 훨씬 연한 맛을 느낄 수 있으실 테니 가장 잘 맞으실 거예요.				0	2022-08-04 09:18:51	2022-08-05 09:12:56
BK22002945	19	질문자	안 그래도 다들 커피를 즐겨 마시는데 저는 쓴맛 때문에 잘 못 마셔서 카페를 가도 항상 다른 메뉴만 시켜서 아쉬웠거든요. 리스토레토 아메리카노는 잘 맞았으면 좋겠네요.				0	2022-08-04 09:18:51	2022-08-05 09:12:56
BK22002945	20	전문가	리스토레토 아메리카노를 마시다가 쓴맛에 더 익숙해지시면 일반적인 에스프레소로 만든 아메리카노를 마시는 것에 도전해 보세요.				0	2022-08-04 09:18:51	2022-08-05 09:12:56
BK22002945	21	질문자	그것도 좋은 방법인 것 같아요. 오늘 말씀해 주신 정보 덕분에 이제 저도 커피를 마음껏 마실 수 있겠어요. 나중에 시간이 되면 커피 한 잔 같이 해요.				0	2022-08-04 09:18:51	2022-08-05 09:12:56
BK22002945	22	전문가	좋아요, 시간 되실 때 미리 연락 주시고 카페에서 한 번 만나요!				1	2022-08-04 09:18:51	2022-08-05 09:12:56
