id	utterance_id	role	text	search_query	search_URL	reference_date	terminate	regDate	updDate
BK22003961	1	질문자	요즘 카레를 자주 먹고 있는데 너무 맛있어! 이렇게 맛있는 카레의 유래가 궁금해.				0	2022-08-04 11:17:15	2022-08-07 15:01:54
BK22003961	2	전문가	카레는 인도의 커리를 일본식으로 만든 음식으로, 일본식 양식인 요쇼쿠 요리에 해당돼. 유럽식 커리에 비해 고기를 적게 넣고 채소를 많이 넣어서 만드는 음식이야.	카레	https://ko.wikipedia.org/wiki/%EC%B9%B4%EB%A0%88	2022/02/26	0	2022-08-04 11:17:15	2022-08-07 15:01:54
BK22003961	3	질문자	요쇼쿠 요리가 뭐야? 그러면 일본에서 카레가 양식에 속한다는 거야?				0	2022-08-04 11:17:15	2022-08-04 11:17:15
BK22003961	4	전문가	응, 요쇼쿠는 일본에서 독자적으로 개발한 서양식 요리야. 일본 요쇼쿠 협회에 따르면 일본의 양식은 쌀밥에 어울리게 독자적인 진화를 이룬 서양 요리라고 정의해. 메이지 시대에 서양 재료를 완벽하게 갖출 수 없어서 대용 재료를 사용했는데, 그렇게 탄생한 대표적인 음식이 포크커틀릿, 카레라이스, 오므라이스야.	요쇼쿠	https://ko.wikipedia.org/wiki/%EC%9A%94%EC%87%BC%EC%BF%A0	2022/05/17	0	2022-08-04 11:17:15	2022-08-07 12:51:06
BK22003961	5	질문자	요쇼쿠 요리는 처음 들어봐. 카레가 일본의 양식이라는 사실도 처음 알았어. 카레는 인도 음식인 줄로만 알고 있었어.				0	2022-08-04 11:17:16	2022-08-07 12:51:06
BK22003961	6	전문가	인도 음식은 커리 혹은 카리라고 불러. 강황을 비롯한 여러 향신료를 넣어 만든 마살라와 채소, 고기 등을 넣어 만든 음식이야. 카레와 커리는 다른 음식이지.	커리	https://ko.wikipedia.org/wiki/%EC%BB%A4%EB%A6%AC	2022/03/01	0	2022-08-04 11:17:16	2022-08-07 12:51:06
BK22003961	7	질문자	일본식 카레와 인도식 커리는 다른 음식이었구나. 그러면 한국에서 먹는 카레는 정확히 어떤 거야?				0	2022-08-04 11:17:16	2022-08-04 11:17:16
BK22003961	8	전문가	카레는 1940년대에 국내에 소개되었어. 특유의 향 때문에 소비자들이 좋아하진 않았지. 이후 오뚜기가 1969년 회사를 열면서 개발에 착수했어. 카레가 쌀이랑 잘 어울리고 매운맛을 즐기는 한국인의 특성에 잘 맞을 거라 예상했거든. 그 결과 다양한 재료를 듬뿍 넣고 걸쭉하게 끓여서 밥과 함께 먹는 한국식 카레가 등장했지.	한국식 카레	https://www.sedaily.com/NewsView/22SSV4ZNUZ	2021/10/19	0	2022-08-04 11:17:16	2022-08-04 11:17:16
BK22003961	9	질문자	내가 잘 먹는 카레는 한국식 카레였구나. 그런데 카레는 몸에 좋은 음식이니?				0	2022-08-04 11:17:16	2022-08-04 11:17:16
BK22003961	10	전문가	몸에 매우 좋아. 카레는 항암과 항산화, 항염 효과가 뛰어난 음식이야. 게다가 면역력 강화와 치매 예방 효과도 있어.	카레의 효능	http://www.insightkorea.co.kr//news/articleView.html?idxno=70059	2019/12/09	0	2022-08-04 11:17:16	2022-08-07 12:51:06
BK22003961	11	질문자	그렇다면 자주 먹어야겠네. 그런데 카레의 칼로리는 어느 정도야? 자주 먹어서 살찔까 봐 걱정이야.				0	2022-08-04 11:17:16	2022-08-04 11:17:16
BK22003961	12	전문가	커리 가루는 100그램에 325칼로리야. 그런데 조리된 카레의 칼로리는 측정이 힘들어. 조리법과 넣는 재료에 따라 메뉴가 달라지거든.	카레 칼로리	http://www.busaneconomy.com/news/articleView.html?idxno=140520	2020/01/21	0	2022-08-04 11:17:16	2022-08-07 12:51:06
BK22003961	13	질문자	카레 칼로리를 정확히 알 수 없으니 밥을 조절하면서 먹어야겠다. 그리고 카레에 관련해서 또 궁금한 게 있어! 스프카레가 뭐야?				0	2022-08-04 11:17:16	2022-08-04 11:17:16
BK22003961	14	전문가	1990년대 초 삿포로에서 시작된 요리야. 스프 카레의 높은 인기는 일본 전체로 퍼졌고, 과거 해외 곳곳에 스프 카레를 판매하는 곳이 생겨났었어. 스프 카레는 스프처럼 묽어.	스프카레	http://www.civicnews.com/news/articleView.html?idxno=11461	2017/11/18	0	2022-08-04 11:17:16	2022-08-07 15:01:54
BK22003961	15	질문자	맛있겠다. 혹시 집에서 간단하게 스프카레를 만들어 먹을 수도 있나?				0	2022-08-04 11:17:16	2022-08-04 11:17:16
BK22003961	16	전문가	간편식이 있어. 오뚜기에서 판매하는 스프카레 제품이야. 닭다리, 닭날개, 슬라이스 연근, 감자 등의 풍부한 건더기가 큼직하게 들어 있어. 전자레인지에 3분간 데워서 대접에 따라 국처럼 떠먹으면 맛있는 스프카레를 간편하게 즐길 수 있어.	스프카레 제품	https://www.megaeconomy.co.kr/news/newsview.php?ncode=1065582693287608	2020/12/24	0	2022-08-04 11:17:16	2022-08-16 10:31:24
BK22003961	17	질문자	괜찮아 보인다. 재료가 충분하니까 저것만 단품으로 먹거나 밥을 추가해도 맛있을 것 같아.				0	2022-08-04 11:17:16	2022-08-04 11:17:16
BK22003961	18	전문가	스프카레도 맛있는 음식이니까 꼭 먹어봐!				0	2022-08-04 11:17:16	2022-08-04 11:17:16
BK22003961	19	질문자	그래야겠다. 사실 카레는 다 맛있어서 뭘 먹어도 괜찮을 것 같긴 해!				0	2022-08-04 11:17:16	2022-08-04 11:17:16
BK22003961	20	전문가	카레 맛있게 먹고 궁금한 게 있으면 또 물어봐 줘!				1	2022-08-04 11:17:16	2022-08-16 10:31:24
