id	utterance_id	role	text	search_query	search_URL	reference_date	terminate	regDate	updDate
BK22000336	1	질문자	너 혹시 꼬막에 대해 잘 알아? 꼬막 먹고 싶어서 인터넷으로 시키려고 했더니 종류가 많던데.				0	2022-07-20 16:06:16	2022-08-02 12:01:32
BK22000336	2	전문가	나 꼬막 좋아해서 잘 알아. 시중에 유통되는 꼬막은 크게 3종류가 있어. 참꼬막, 새꼬막, 피조개 이렇게 세 가지인데, 피조개는 피꼬막이라고도 불려.	꼬막 종류	https://kormedi.com/1382831/%ec%b0%b8%ea%bc%ac%eb%a7%89-%ec%83%88%ea%bc%ac%eb%a7%89-%ed%94%bc%ec%a1%b0%ea%b0%9c-%ea%bc%ac%eb%a7%89%eb%a5%98-%ea%b5%ac%eb%b3%84%ed%95%98%eb%8a%94-%eb%b2%95/	2022/02/22	0	2022-07-20 16:06:16	2022-07-21 09:37:50
BK22000336	3	질문자	피꼬막이 속이 붉은 거 맞지? 그건 이름하고 매치가 돼서 알겠던데.				0	2022-07-20 16:06:16	2022-08-02 12:01:32
BK22000336	4	전문가	응, 맞아. 피꼬막은 붉은 조갯살을 가지고 있는 게 특징이야.	피꼬막 특징	http://www.ezyeconomy.com/news/articleView.html?idxno=116277	2022/02/11	0	2022-07-20 16:06:16	2022-07-21 09:37:50
BK22000336	5	질문자	우리가 가장 흔하게 먹는 꼬막이 뭐야? 피꼬막은 아니란 거 알겠는데, 참꼬막인지 새꼬막인지 모르겠어.				0	2022-07-20 16:06:16	2022-08-02 12:01:32
BK22000336	6	전문가	가장 흔하게 볼 수 있는 꼬막은 새꼬막이야.	가장 많이 먹는 꼬막	https://idsn.co.kr/news/view/1065580632877272	2022/02/11	0	2022-07-20 16:06:17	2022-07-21 09:37:50
BK22000336	7	질문자	그럼 새꼬막이 참꼬막보다 더 저렴한 건가?				0	2022-07-20 16:06:17	2022-08-02 12:01:32
BK22000336	8	전문가	맞아. 참꼬막은 자라는 데만 삼사 년이 걸리는 데다, 널배를 타고 들어가 수작업으로 채취하기 때문에 생산량이 적거든. 그래서 새꼬막보다 세네 배 정도가 더 비싸.	새꼬막 참꼬막 가격	http://digitalchosun.dizzo.com/site/data/html_dir/2022/02/11/2022021180103.html	2022/02/12	0	2022-07-20 16:06:17	2022-07-21 09:37:50
BK22000336	9	질문자	가격을 제대로 안 봤었는데 생각보다 차이가 크구나. 근데 두 개를 어떻게 구별할 수 있어? 크기가 다른가?				0	2022-07-20 16:06:17	2022-08-02 12:01:32
BK22000336	10	전문가	참꼬막이 새꼬막보다 크기가 더 작아. 새꼬막은 피꼬막보다 더 작고.	새꼬막 참꼬막 크기 차이	https://www.news1.kr/articles/?4205049	2021/02/07	0	2022-07-20 16:06:17	2022-07-21 09:37:50
BK22000336	11	질문자	참꼬막이 제일 작고 피꼬막이 제일 큰 거구나. 크기 말고 또 다른 차이가 있어?				0	2022-07-20 16:06:17	2022-08-02 12:01:32
BK22000336	12	전문가	껍데기에 난 홈의 개수에도 차이가 있어. 참꼬막은 17개에서 20개 정도이고 새꼬막은 30개 정도거든.	새꼬막 참꼬막 차이	http://san.chosun.com/site/data/html_dir/2020/10/26/2020102600950.html?utm_source=naver&utm_medium=original&utm_campaign=san	2020/11/09	0	2022-07-20 16:06:17	2022-07-21 09:37:50
BK22000336	13	질문자	크기랑 홈의 개수도 다르면 구별하기 쉽겠다. 이참에 두 개 다 시켜서 비교 좀 해봐야겠다.				0	2022-07-20 16:06:17	2022-08-02 12:01:32
BK22000336	14	전문가	그러면 확실하게 비교가 되겠네.				0	2022-07-20 16:06:17	2022-07-21 09:37:50
BK22000336	15	질문자	근데 나 집에서 꼬막 처음 먹는데, 해감 어떻게 해야 돼?				0	2022-07-20 16:06:17	2022-08-02 12:01:32
BK22000336	16	전문가	먼저 흐르는 물에 꼬막을 여러 번 씻어. 그래서 껍질에 있는 불순물이 어느 정도 제거됐다 싶으면, 꼬막이 잠길 만큼 물을 충분히 붓고 소금 1큰술을 넣어줘. 이때 스테인리스 숟가락을 함께 넣어주면 해감 시간이 단축되니까 잊지 말고. 그런 다음 최소 한 시간에서 반나절 정도 두면 해감 끝이야.	꼬막 해감하는 법	http://www.100ssd.co.kr/news/articleView.html?idxno=84091	2022/01/17	0	2022-07-20 16:06:17	2022-07-21 09:37:50
BK22000336	17	질문자	복잡할 줄 알았는데 생각보다 간단하네? 말 나온 김에 삶는 법까지 알려줄래?				0	2022-07-20 16:06:17	2022-08-02 12:01:32
BK22000336	18	전문가	물이 끓기 시작하면 해감을 끝낸 꼬막을 넣어. 그런 다음 주걱으로 저어주면 되는데, 반드시 한쪽 방향으로만 저어줘야 돼. 그렇게 10분 정도를 저으면 꼬막의 입이 한두 개씩 벌어지기 시작하는데, 이때 불을 끄고 남은 물을 버리면 끝이야. 주의할 점은 꼬막이 완전히 익어 입이 다 열릴 때까지 삶으면 안 된다는 거야. 그렇게 되면 꼬막에 들어있는 철분이 빠져나갈 뿐 아니라 식감도 질겨져서 본연을 맛을 느낄 수가 없거든.	꼬막 삶는 법	http://www.thekpm.com/news/articleView.html?idxno=107761	2022/02/01	0	2022-07-20 16:06:17	2022-07-21 09:37:50
BK22000336	19	질문자	아, 그렇구나. 내가 일단 한 번 해보고 만족스러우면 다음에 너한테도 대접할게.				0	2022-07-20 16:06:17	2022-08-02 12:01:32
BK22000336	20	전문가	나도 꼬막 되게 좋아하니까 꼭 대접해줘.				0	2022-07-20 16:06:17	2022-07-21 09:37:50
BK22000336	21	질문자	근데 먹을 거 얘기해서 그런가, 좀 배고프지 않아? 아까 올 때 보니까 옥수수 팔던데 나가서 그것 좀 사 와야겠다.				0	2022-07-20 16:06:17	2022-08-02 12:01:32
BK22000336	22	전문가	옥수수 너무 좋지. 그럼 나는 미숫가루 타고 있을 테니까 얼른 갔다 와.				1	2022-07-20 16:06:17	2022-07-21 11:38:28
