id	utterance_id	role	text	search_query	search_URL	reference_date	terminate	regDate	updDate
BK22006384	1	질문자	토마토가 그렇게 건강에 좋다고 하더라고요. 토마토에 어떤 성분이 있길래 건강에 좋다고 하는거죠?				0	2022-08-25 00:08:27	2022-08-25 00:08:27
BK22006384	2	전문가	토마토는 항산화 물질인 라이코펜이 많이 들어 있어서 면역력을 강화시켜 주고 전립선암과 유방암 예방에 도움을 줘요. 토마토에는 각종 비타민도 많이 들어있는데, 비타민C는 피로회복과 피부미용에 좋고, 비타민K는 칼슘이 몸에서 빠져나가는 것을 막아줘서 뼈 건강에 좋아요. 그리고 토마토에는 칼륨이 있어서 찌개나 젓갈, 김치와 같은 맵고 짠 음식을 먹을 때 섭취한 염분을 배출시켜주죠.	토마토 성분	https://kormedi.com/1412328/%EB%8B%A4%EC%9D%B4%EC%96%B4%ED%8A%B8%C2%B7%EC%95%94-%EC%98%88%EB%B0%A9%ED%86%A0%EB%A7%88%ED%86%A0%EC%97%90-%EC%9D%B4%EB%9F%B0-%ED%9A%A8%EB%8A%A5%EC%9D%B4/	2022/08/06	0	2022-08-25 00:08:27	2022-08-25 00:08:27
BK22006384	3	질문자	토마토에 건강한 성분이 정말 많군요. 토마토는 다이어트 음식이라고도 하던데 다이어트에 도움이 되는게 맞나요?				0	2022-08-25 00:08:27	2022-08-25 00:08:27
BK22006384	4	전문가	네, 토마토는 다이어트 식품으로도 유명하죠. 토마토 1개는 35칼로리의 적은 열량을 가지고 있어요. 칼로리는 적고 미네랄과 같은 영양소는 풍부해요.	토마토 다이어트	https://kizmom.hankyung.com/news/view.html?aid=202207281026o	2022/07/28	0	2022-08-25 00:08:27	2022-08-25 00:08:27
BK22006384	5	질문자	좋은 음식이네요. 토마토를 열심히 먹어야겠어요. 토마토는 하루에 몇 개까지 먹어도 건강에 문제가 없나요?				0	2022-08-25 00:08:27	2022-08-25 00:08:27
BK22006384	6	전문가	찰토마토와 황금토마토 같은 토마토는 하루 2개가 적당량이고 방울토마토나 대추방울토마토 같이 작은 토마토는 하루에 15개가 적절해요. 토마토는 찬 성질이 있어서 몸이 찬 체질이거나 호흡기나 소화불량이 있는 사람은 설사와 장염의 부작용이 있을 수 있어요. 토마토를 과다 복용할 경우에는 구토와 복통, 설사, 두드러기 등이 생길 수도 있고요.	토마토 섭취량	https://www.dailysecu.com/news/articleView.html?idxno=66123	2019/08/27	0	2022-08-25 00:08:27	2022-08-25 00:08:27
BK22006384	7	질문자	아무리 몸에 좋아도 많이 먹으면 안되겠네요. 토마토를 이용한 요리가 궁금해요. 외국에는 토마토로 스튜도 하던데 스튜 만드는 방법을 알려주세요.				0	2022-08-25 00:08:27	2022-08-25 00:08:27
BK22006384	8	전문가	토마토 스튜 레시피를 알려드릴게요. 당근을 적당한 크기로 썰어주고 토마토를 끓는 물에 데치고 껍질을 벗긴 후에 깍둑썰기를 해 주세요. 팬에 버터와 다진마늘, 양파, 스튜용 고기를 넣고 볶은 후에 샐러리를 넣어 주면 됩니다. 그리고 바질과 설탕, 고춧가루, 우스터소스, 후추가루, 케첩, 넛맥, 큐민과 파프리카 분말을 넣고 볶아요. 그 후 토마토와 홀 토마토를 넣고 당근, 물, 감자, 월계수잎을 넣고 끓이기만 하면 돼요.	토마토 스튜 레시피	https://www.nbntv.co.kr/news/articleView.html?idxno=194929	2020/03/12	0	2022-08-25 00:08:27	2022-09-02 09:20:34
BK22006384	9	질문자	재료를 준비하고 다 넣고 끓이기만 하면 되는 것 같아서 레시피가 어렵지는 않네요. 토마토 달걀 볶음도 유명한 토마토 요리던데 어떻게 만드나요?				0	2022-08-25 00:08:27	2022-08-25 00:08:27
BK22006384	10	전문가	토마토 달걀 볶음을 만들기 위해서 토마토 꼭지를 자르고 열 십자로 칼집을 내준 후에 데쳐주고 껍질을 벗겨요. 그리고 한번 볶아서 수분을 빼 줘요. 달걀을 풀어서 소금과 설탕으로 간을 한 후 다진 파를 넣어주고 감칠맛을 위한 굴 소스를 기호에 따라 넣어주세요. 팬에 달걀을 붓고 다 익기 전에 토마토를 넣고 약불에 익히면 완성돼요.	토마토 달걀 볶음 레시피	https://www.nbntv.co.kr/news/articleView.html?idxno=194929	2020/03/12	0	2022-08-25 00:08:27	2022-08-25 00:08:27
BK22006384	11	질문자	토마토 달걀 볶음이 토마토 스튜보다도 더 쉽네요. 간편하게 토마토를 먹을 수 있겠어요. 토마토 달걀 볶음에 굴소스가 들어가는 걸 보니 중국음식인가봐요?				0	2022-08-25 00:08:27	2022-08-25 00:08:27
BK22006384	12	전문가	네 맞아요. 토마토 달걀 볶음은 중국의 볶음요리로 토달볶이라고도 해요. 토마토 달걀 볶음에 밥을 넣고 볶으면 쉽게 토마토 달걀 볶음밥을 맛볼 수 있죠.	토마토 달걀 볶음 중국	https://www.nbntv.co.kr/news/articleView.html?idxno=184805	2020/03/12	0	2022-08-25 00:08:27	2022-08-25 00:08:27
BK22006384	13	질문자	토마토 달걀 볶음밥도 맛있을 것 같아요. 선드라이 토마토는 이탈리아 음식에 많이 들어가던데 어떻게 만드는 건가요?				0	2022-08-25 00:08:27	2022-08-25 00:08:27
BK22006384	14	전문가	선드라이토마토는 생 토마토를 잘라서 건조기나 해 아래에서 말린 걸 말해요. 선드라이 토마토는 시판용으로도 판매해요.	선드라이토마토 오븐	https://www.donga.com/news/article/all/20140123/60331955/2	2014/01/23	0	2022-08-25 00:08:27	2022-08-25 00:08:27
BK22006384	15	질문자	선드라이 토마토라고 해서 꼭 햇볕에 말릴 필요는 없군요. 익히거나 구운 토마토는 생 토마토랑 비교해서 영양에 차이가 없나요?				0	2022-08-25 00:08:27	2022-08-25 00:08:27
BK22006384	16	전문가	토마토는 과채류로 익혀 먹으면 더 좋아요. 항암작용을 하는 리코펜이라는 토마토에 든 성분이 익히면 체내로 더 잘 흡수된답니다.	토마토 익히면 영양소	https://kormedi.com/1360309/%EB%AC%B4%EC%A1%B0%EA%B1%B4-%EC%83%9D%EC%9C%BC%EB%A1%9C-%EC%9D%B5%ED%9E%88%EB%A9%B4-%EB%8D%94-%EC%A2%8B%EC%9D%80-%EC%B1%84%EC%86%8C%C2%B7%EA%B3%BC%EC%9D%BC%EC%9D%80/	2021/10/14	0	2022-08-25 00:08:27	2022-08-25 00:08:27
BK22006384	17	질문자	익히면 더 흡수가 잘된다니 걱정 말고 오늘 알려주신 레시피를 이용해서 토마토 요리를 해야겠네요.				0	2022-08-25 00:08:27	2022-08-25 00:08:27
BK22006384	18	전문가	네, 위에 말씀드린 레시피 말고도 토마토 요리는 무궁무진하니 색다른 토마토 요리가 궁금하시면 또 연락 주세요.				0	2022-08-25 00:08:27	2022-08-25 00:08:27
BK22006384	19	질문자	다음번에는 토마토로 만드는 살사소스나 파스타 요리법에 대해 문의드릴게요.				0	2022-08-25 00:08:27	2022-08-25 00:08:27
BK22006384	20	전문가	네, 레시피나 요리 재료가 궁금하시면 언제든지 말씀 주세요. 다음에 또 이야기 나눠요.				1	2022-08-25 00:08:27	2022-09-02 09:51:13
