id	utterance_id	role	text	search_query	search_URL	reference_date	terminate	regDate	updDate
BK22004942	1	질문자	요즘 여름이라 그런지 옥수수가 너무 먹고 싶다. 너도 옥수수 좋아해?				0	2022-08-07 21:35:31	2022-08-07 21:35:31
BK22004942	2	전문가	나도 옥수수 같은 구황작물 엄청 좋아하지. 찐 옥수수만 있으면 끼니로 계속 때울 수도 있어.				0	2022-08-07 21:35:31	2022-08-08 00:04:21
BK22004942	3	질문자	와, 나는 그렇게 먹으면 질릴 것 같은데 대단하다. 그런데 왜 옥수수를 구황작물이라고 부르는 거야?				0	2022-08-07 21:35:31	2022-08-07 21:35:31
BK22004942	4	전문가	구황작물은 비황작물이라고도 하는데, 흉년 등으로 먹을 양식이 심하게 부족할 때 주식물 대신 먹을 수 있는 농작물을 말해.	구황작물	https://ko.wikipedia.org/wiki/%EA%B5%AC%ED%99%A9%EC%9D%8C%EC%8B%9D	2022/05/07	0	2022-08-07 21:35:31	2022-08-07 21:35:31
BK22004942	5	질문자	그렇구나, 그럼 구황작물들은 키우기도 쉽겠다.				0	2022-08-07 21:35:31	2022-08-07 21:35:31
BK22004942	6	전문가	맞아. 구황작물들은 가뭄, 장마 같은 큰 재해에 영향을 받지 않아. 척박한 환경이나 비옥하지 않은 토양에서도 키울 수 있어.	구황작물	https://ko.wikipedia.org/wiki/%EA%B5%AC%ED%99%A9%EC%9D%8C%EC%8B%9D	2022/05/07	0	2022-08-07 21:35:31	2022-08-23 13:29:33
BK22004942	7	질문자	그래서 옥수수는 어디서든 키우나 봐. 혹시 옥수수의 제철은 언제인지 아니?				0	2022-08-07 21:35:31	2022-08-23 13:29:33
BK22004942	8	전문가	그럼 잘 알지. 옥수수는 햇볕이 따뜻한 늦은 봄에서 여름까지가 가장 맛있어.	옥수수 제철	http://kpenews.com/View.aspx?No=1987364	2021/08/01	0	2022-08-07 21:35:31	2022-08-08 00:04:21
BK22004942	9	질문자	역시 요즘같이 볕이 좋을 때가 제철이구나. 옥수수는 종류도 여러가지잖아. 너는 어떤 옥수수를 가장 좋아해?				0	2022-08-07 21:35:31	2022-08-08 00:04:21
BK22004942	10	전문가	나는 찰옥수수를 가장 좋아해. 옥수수는 용도에 따라 크게 간식용과 사료용으로 구분할 수 있는데, 그 중에 찰옥수수와 단옥수수, 초당옥수수는 간식용 옥수수로 많이 먹지.	옥수수 종류	http://kpenews.com/View.aspx?No=1987364	2021/08/01	0	2022-08-07 21:35:31	2022-08-08 00:04:21
BK22004942	11	질문자	옥수수 종류도 여러가지네. 그럼, 우리나라에서 가장 많이 재배되는 옥수수는 뭘까?				0	2022-08-07 21:35:31	2022-08-08 00:04:21
BK22004942	12	전문가	우리나라에서는 찰옥수수를 가장 많이 키우지. 시중에서 판매되는 찰옥수수는 거의 100퍼센트 국산이야.	우리나라에서 가장 많이 재배되는 옥수수	http://kpenews.com/View.aspx?No=1987364	2021/08/01	0	2022-08-07 21:35:31	2022-08-08 00:04:21
BK22004942	13	질문자	옥수수는 거의 수입을 안하는구나. 그럼, 찰옥수수는 어떤 특징을 갖고 있어?				0	2022-08-07 21:35:31	2022-08-08 00:04:21
BK22004942	14	전문가	찰옥수수는 식감이 단단한 느낌인데 먹어보면 쫀득한 찰기를 갖고 있어. 또한 낮은 당도지만 고소한 맛이 좋지. 길에서 자주 볼 수 있는 찐 옥수수가 바로 찰옥수수야.	찰옥수수	http://kpenews.com/View.aspx?No=1987364	2021/08/01	0	2022-08-07 21:35:31	2022-08-08 00:04:21
BK22004942	15	질문자	그렇구나, 나 찐 옥수수 진짜 좋아하는데 너무 맛있겠다. 옥수수는 어떻게 쪄야 맛있어?				0	2022-08-07 21:35:31	2022-08-08 00:04:21
BK22004942	16	전문가	옥수수를 찔 때 껍질을 벗기지 않고 2장에서 3장 붙어있는 상태로 찌면 너무 맛있어. 이렇게 찌면 옥수수에 수분이 유지되어 촉촉하고, 쫄깃한 맛과 옥수수 특유의 풍미가 추가되어 더욱 맛있게 먹을 수 있어.	옥수수 맛있게 찌는 법	https://www.sisamagazine.co.kr/news/articleView.html?idxno=366678	2021/07/29	0	2022-08-07 21:35:31	2022-08-08 00:04:21
BK22004942	17	질문자	와, 진짜 좋은 팁이네. 다음 번에는 껍질을 벗기지 말고 쪄야겠구나. 혹시 옥수수를 많이 찌게 되면 냉동보관해도 될까?				0	2022-08-07 21:35:31	2022-08-08 00:04:21
BK22004942	18	전문가	냉동보관은 가능한데 장기보관을 위해서는 한 번 찐 다음 냉동보관하는 게 좋아. 왜냐하면 시간이 지날수록 당분이 전분으로 변해서 단맛이 줄어들 수 있기 때문이야.	찐 옥수수 냉동보관	http://www.k-health.com/news/articleView.html?idxno=60400	2022/07/27	0	2022-08-07 21:35:31	2022-08-08 00:04:21
BK22004942	19	질문자	어머, 나는 그냥 냉동보관하면 될 줄 알았는데 아니었구나.				0	2022-08-07 21:35:31	2022-08-08 00:04:21
BK22004942	20	전문가	응, 나도 옥수수 제철이 되면 대량으로 쪄서 냉동보관해놓거든. 너도 다음에 이렇게 해봐.				0	2022-08-07 21:35:31	2022-08-23 13:29:33
BK22004942	21	질문자	그래야겠다, 당장 마트에 가서 옥수수를 사와야겠어. 내가 이번에 옥수수 맛있게 쪄지면 너도 좀 가져다 줄게!				1	2022-08-08 00:04:21	2022-08-23 13:29:33
BK22004942	22	전문가	그래, 나까지 챙겨줘서 고마워. 맛있는 옥수수로 잘 골라오고, 다음에 또 연락하자!				0	2022-08-08 00:04:21	2022-08-08 00:04:21
