id	utterance_id	role	text	search_query	search_URL	reference_date	terminate	regDate	updDate
BK22012973	1	질문자	순대는 어떤 음식인지 알려주세요.				0	2022-09-30 15:28:59	2022-10-01 17:01:29
BK22012973	2	전문가	한국의 음식인 순대는 돼지의 창자 속에 채소나 당면을 넣고 선지로 색과 맛을 내고 수증기로 쪄서 만든 음식이에요.	순대	https://ko.wikipedia.org/wiki/%EC%88%9C%EB%8C%80	2022/07/29	0	2022-09-30 15:29:00	2022-10-01 17:01:29
BK22012973	3	질문자	한국에서 순대는 언제부터 먹기 시작했는지 알고 있나요?				0	2022-09-30 15:29:00	2022-10-01 17:01:29
BK22012973	4	전문가	한국에서는 삼국 시대나 고려 말기부터 먹었다는 두 가지 설이 있어요. 삼국 시대에는 중국과의 교류로 양반장자해가 전파되면서 먹었다는 의견과 몽골군이 침략한 고려 말기에 피순대가 전파되면서 먹었다는 의견이 있어요.	순대 유래	https://ko.wikipedia.org/wiki/%EC%88%9C%EB%8C%80	2022/07/29	0	2022-09-30 15:29:00	2022-10-01 17:01:29
BK22012973	5	질문자	그렇군요, 순대의 조리법은 어떻게 되나요?				0	2022-09-30 15:29:00	2022-10-01 17:01:29
BK22012973	6	전문가	우선 돼지 창자를 소금과 밀가루로 문질러 잡내를 제거하며 순대의 껍질을 만들어요. 깨끗한 면이 바깥으로 나오게 손질한 돼지 창자를 뒤집고 그 속에 두부와 숙주나물, 찹쌀 등 각종 향신료와 돼지피를 넣어요. 이후 가마솥에 쪄내면 순대가 만들어 져요.	순대 조리법	https://ko.wikipedia.org/wiki/%EC%88%9C%EB%8C%80	2022/07/29	0	2022-09-30 15:29:00	2022-10-01 17:01:29
BK22012973	7	질문자	은근 손이 많이 가는 요리네요. 그런데 순대를 먹을 때 사람마다 찍어 먹는 양념이 다르던데 왜 그런 건가요?				0	2022-09-30 15:29:00	2022-10-01 17:01:29
BK22012973	8	전문가	지역별로 먹는 방식이 달라서 그런 것이에요. 경상남도 부산, 울산 등 일부 지역에서는 쌈장, 제주도에서는 간장, 다른 지역에서는 소금에 찍어 먹기도 하고 돼지의 간이나 허파 같은 부산물도 함께 팔아요.	순대 지역별 특색	https://ko.wikipedia.org/wiki/%EC%88%9C%EB%8C%80	2022/07/29	0	2022-09-30 15:29:00	2022-10-01 17:01:29
BK22012973	9	질문자	그런 이유가 있었군요. 그런데 순대는 꼭 돼지 창자에 소를 넣어야 하는 건가요?				0	2022-09-30 15:29:00	2022-10-01 17:01:29
BK22012973	10	전문가	아니에요, 돼지 곱창 대신 오징어 속에 소를 넣고 쪄서 순대를 만들기도 하는데 이것을 오징어 순대라고 불러요.	오징어순대	https://ko.wikipedia.org/wiki/%EC%98%A4%EC%A7%95%EC%96%B4%EC%88%9C%EB%8C%80	2022/02/08	0	2022-09-30 15:29:00	2022-10-01 17:01:29
BK22012973	11	질문자	오징어 순대도 맛있겠네요. 또 다른 재료를 사용한 순대 하나만 더 알려주세요.				0	2022-09-30 15:29:00	2022-10-01 17:01:29
BK22012973	12	전문가	명태 속에 소를 넣고 찐 명태 순대가 있어요. 동태 순대라고도 불리는데 이유는 생태로 만들지만, 겨울철에 얼렸다가 먹기 때문이에요.	명태순대	https://ko.wikipedia.org/wiki/%EB%AA%85%ED%83%9C%EC%88%9C%EB%8C%80	2022/03/11	0	2022-09-30 15:29:00	2022-10-01 17:01:29
BK22012973	13	질문자	명태 순대는 정말 처음 들어보네요. 간단한 조리법을 알려주세요.				0	2022-09-30 15:29:00	2022-10-01 17:01:29
BK22012973	14	전문가	명태 순대는 삶은 돼지고기를  다진 것과 살짝 데쳐서 물기를 뺀 배추, 숙주나물, 명태알과 두부, 나물 등을 함께 넣어 만든 소를 소금에 절여 내장을 들어낸 생태 속에 넣어 찜통에 쪄서 만들어요.	명태순대 만들기	https://ko.wikipedia.org/wiki/%EB%AA%85%ED%83%9C%EC%88%9C%EB%8C%80	2022/03/11	0	2022-09-30 15:29:00	2022-10-01 17:01:29
BK22012973	15	질문자	직접 해먹기는 번거로우니 사 먹어야겠네요. 순대를 이용한 국물 요리는 없나요?				0	2022-09-30 15:29:01	2022-10-01 17:01:29
BK22012973	16	전문가	돼지 부산물 등과 함께 순대를 이용해서 끓여서 만든 순댓국이 있어요. 순댓국으로 끓인 순대국밥도 있죠.	순댓국	https://ko.wikipedia.org/wiki/%EC%88%9C%EB%8C%93%EA%B5%AD	2022/07/22	0	2022-09-30 15:29:01	2022-10-01 17:01:29
BK22012973	17	질문자	순대는 조리법이 다양하고 순대를 사용한 요리도 많은 것 같네요.				0	2022-09-30 15:29:01	2022-10-01 17:01:29
BK22012973	18	전문가	네, 앞서 말씀드린 순댓국 외에도 순대 볶음이라는 요리도 있어요.				0	2022-09-30 15:29:01	2022-10-01 17:01:29
BK22012973	19	질문자	그건 어떤 요리인지 간단한 설명 부탁해요.				0	2022-09-30 15:29:01	2022-10-01 17:01:29
BK22012973	20	전문가	말그대로 순대 볶음은 순대와 곱창을 같이 섞어서 볶는 요리예요.				0	2022-09-30 15:29:01	2022-10-01 17:01:29
BK22012973	21	질문자	혹시 먹어봤으면 맛이 어떤지 알려주세요.				0	2022-09-30 15:29:01	2022-10-01 17:01:29
BK22012973	22	전문가	맛은 매콤하게 만드는 경우가 일반적이니 매운 것을 좋아하면 추천해 드립니다.				1	2022-09-30 15:29:01	2022-10-01 17:01:29
