id	utterance_id	role	text	search_query	search_URL	reference_date	terminate	regDate	updDate
BK22006249	1	질문자	전문가님, 우리나라에서도 바나나가 나온다는 거 아셨어요? 어제 마트 가니까 국산 바나나가 있더라고요! 원래 바나나는 열대 지역에서 자라는 거 아니었나요?				0	2022-08-23 12:11:34	2022-08-23 12:11:34
BK22006249	2	전문가	아, 궁금이님도 발견하셨구나! 맞아요, 바나나는 원래 열대 지역에서 주로 경작하죠. 그런데 우리나라 기후가 점점 아열대성으로 바뀌고 있어서 바나나를 재배하려는 농가가 늘고 있는 상횡이에요.	한국 아열대 기후 변화, 바나나 재배 농가 증가	https://www.nongmin.com/news/NEWS/ECO/CMS/297498/view	2018/09/01	0	2022-08-23 12:11:34	2022-08-23 12:11:34
BK22006249	3	질문자	아하, 우리나라 기후가 점점 따뜻해지고 있군요. 그럼 국산 바나나는 언제 처음 재배하기 시작한 거예요?				0	2022-08-23 12:11:34	2022-08-23 12:11:34
BK22006249	4	전문가	우리나라는 1981년에 처음으로 제주도에서 바나나를 재배하기 시작했어요.	한국 바나나 재배 시작	http://news.imaeil.com/page/view/2022081014191984038	2022/08/10	0	2022-08-23 12:11:34	2022-08-23 12:11:34
BK22006249	5	질문자	엇, 제 생각보다 훨씬 전이네요. 근데 왜 예전에는 있는지 몰랐죠?				0	2022-08-23 12:11:34	2022-08-23 12:11:34
BK22006249	6	전문가	1990년대 초에 우리나라가 우루과이라운드를 체결하면서 바나나가 많이 수입되기 시작해서 그래요. 수입산이 가격이 저렴하다 보니 원래 제주도 내 최고소득 작물이었던 바나나는 자취를 감췄고요.	수입산 바나나에 경쟁 밀린 국산 바나나	http://news.imaeil.com/page/view/2022081014191984038	2022/08/10	0	2022-08-23 12:11:34	2022-08-23 12:11:34
BK22006249	7	질문자	아, 확실히 수입산 바나나가 싸긴 하더라고요. 그럼 언제 다시 재배를 시작한 거죠?				0	2022-08-23 12:11:34	2022-08-23 12:11:34
BK22006249	8	전문가	2006년도쯤이에요. 제주시가 정예소득을 위한 작목단지 사업 중 하나로 바나나를 재배하기로 하면서 2곳의 농가와 관련 계약을 체결하고 바나나를 시범 재배했죠. 이후 제주도에서 다시 바나나가 재배되기 시작했고요.	제주시 바나나 재생산 시작	http://news.imaeil.com/page/view/2022081014191984038	2022/08/10	0	2022-08-23 12:11:34	2022-08-23 12:11:34
BK22006249	9	질문자	아하, 시에서 주도적으로 사업을 시작한 거군요. 그럼 지금은 제주도에 바나나를 재배하는 농가가 많이 있나요?				0	2022-08-23 12:11:34	2022-08-23 12:11:34
BK22006249	10	전문가	꽤 늘어났죠. 2016년에는 제주도에서 바나나를 재배하는 곳이 5곳으로 늘었고, 2020년에는 25곳으로 확 늘어났어요. 재배 규모도 2006년에는 2만 2000제곱미터였는데, 2020년에는 16만 5000제곱미터로 늘었고요.	제주지역 바나나 농가 증가	http://news.imaeil.com/page/view/2022081014191984038	2022/08/10	0	2022-08-23 12:11:34	2022-08-23 12:11:34
BK22006249	11	질문자	오, 이 상태라면 앞으로도 꾸준히 늘어날 것 같네요. 근데 국산 바나나가 수입산 바나나랑 특별히 다른 점이 있나요? 가격이 좀 비싸서 살까 말까 엄청 고민했거든요.				0	2022-08-23 12:11:34	2022-08-23 12:11:34
BK22006249	12	전문가	국산 바나나는 사고 싶을 때 언제든 신선한 것을 바로바로 사먹을 수 있다는 게 장점이죠. 반면, 수입산 바나나는 약품 처리도 거치고 덜 익힌 상태에서 수확해 후숙 작업을 진행하니까 많이들 신선하지 않을 거라고 생각하는 편이잖아요.	국산 바나나 장점	http://www.gnnews.co.kr/news/articleView.html?idxno=325149	2018/04/08	0	2022-08-23 12:11:34	2022-09-02 11:30:59
BK22006249	13	질문자	맞아요, 수입산 바나나에 농약을 많이 친다는 얘기는 언뜻 들은 것 같아요. 그럼 국내산 바나나는 후처리를 안 하나요?				0	2022-08-23 12:11:34	2022-08-23 12:11:34
BK22006249	14	전문가	그렇죠, 일단 유통 거리가 길지 않으니까요. 그래서 국내산 바나나는 수입산 바나나처럼 이르게 수확하지 않기도 하고 방부 처리와 훈증 처리도 안 하죠. 국내의 바나나 재배 농가는 건강에 나쁘지 않고 신선한 바나나를 공급한다는 데에 큰 자부심을 가질 정도예요. 그 자부심이 농사를 꾸준히 할 수 있는 큰 원동력으로 작용하기도 하고요.	국산 바나나 후처리 안 한다	http://www.ikpnews.net/news/articleView.html?idxno=37791	2019/06/09	0	2022-08-23 12:11:34	2022-09-02 11:30:59
BK22006249	15	질문자	어쩐지 오늘 아침에 바나나를 먹어봤는데 신선하다는 느낌이 확 와서 좋더라고요! 그런데 아직 수입산에 비해선 물량이 모자란 것 같던데 이런 쪽으론 정비가 덜 됐나 봐요.				0	2022-08-23 12:11:34	2022-09-02 11:30:59
BK22006249	16	전문가	확실히 인프라 문제가 바나나 재배 농가의 가장 골칫거리긴 해요. 판매 루트와 유통 구조가 너무 약하다 보니까 국내의 농가들이 바나나 재배를 시작하려고 마음 먹는 데 큰 장애물이 되기도 하고요.	국산 바나나 인프라 문제	http://www.ikpnews.net/news/articleView.html?idxno=37791	2019/06/09	0	2022-08-23 12:11:34	2022-08-23 12:11:34
BK22006249	17	질문자	이런, 바나나는 금방 익으니까 빨리 팔아야 할 텐데 유통과정이 애매하면 꽤나 골치 아프겠네요.				0	2022-08-23 12:11:34	2022-08-23 12:11:34
BK22006249	18	전문가	그러니까요. 열심히 키웠는데 제대로 팔지도 못하고 버리면 너무 속상할 거예요.				0	2022-08-23 12:11:34	2022-08-23 12:11:34
BK22006249	19	질문자	빠른 시일 내로 시스템이 정립됐으면 좋겠네요. 가격만 조금 더 싸면 국내산을 사먹는 게 이득이잖아요. 물론 맛도 좋았고요!				0	2022-08-23 12:11:34	2022-08-23 12:11:34
BK22006249	20	전문가	저도 완전 동감해요. 궁금이님이랑 이야기 나누다 보니 저도 바나나가 먹고 싶어지네요. 오늘 집에 가면서 하나 사가야겠어요!				1	2022-08-23 12:11:34	2022-09-02 11:30:59
