id	utterance_id	role	text	search_query	search_URL	reference_date	terminate	regDate	updDate
BK22008014	1	질문자	요즘 친구들이 히비스커스 차를 많이 마시던데, 히비스커스가 뭐야?				0	2022-09-09 17:18:37	2022-09-09 17:18:37
BK22008014	2	전문가	히비스커스는 쌍떡잎식물의 아욱목 아욱과 무궁화속에 속한 식물의 꽃이야. 아름다운 신 히비스와 닮았다는 뜻의 이스코를 합쳐서 이름을 지었다고 해. 이집트의 미녀 클레오파트라가 사랑한 히비스커스 차는 기원전 4000년 역사를 가진 미의 여신을 닮은 차야.	히비스커스	https://www.topstarnews.net/news/articleView.html?idxno=438392	2018/07/02	0	2022-09-09 17:18:37	2022-09-22 10:33:55
BK22008014	3	질문자	무궁화와 비슷한 예쁜 꽃이 히비스커스구나. 그럼, 히비스커스 원산지는 어디야?				0	2022-09-09 17:18:37	2022-09-22 19:14:49
BK22008014	4	전문가	원산지는 동인도와 중국인데 열대지방에서 많이 재배하고 있고, 북미에서도 쉽게 볼 수 있어.	히비스커스 원산지	http://www.joygm.com/news/articleView.html?idxno=66773#09d9	2019/09/29	0	2022-09-09 17:18:37	2022-09-27 08:24:43
BK22008014	5	질문자	여러 곳에서 재배하고 있구나. 근데 히비스커스 나무를 개인이 직접 키울 수도 있니?				0	2022-09-09 17:18:37	2022-09-27 08:24:43
BK22008014	6	전문가	그럼, 한국에서도 분재로 온실에서 키우기도 해. 상록 관목으로 가지가 많이 나뉘고 높이가 2에서 5미터까지 자라. 광택이 있는 잎 표면은 진녹색을 띠는 것이 특징이야.	히비스커스 키우기	https://www.topstarnews.net/news/articleView.html?idxno=279016	2017/06/28	0	2022-09-09 17:18:37	2022-09-22 19:14:49
BK22008014	7	질문자	히비스커스를 분재로 키운다는 것이 너무 신기하다. 그런데 우리가 차로 마시려면 어떤 히비스커스를 사야 해?				0	2022-09-09 17:18:37	2022-09-22 19:14:49
BK22008014	8	전문가	항상 외부에 노출되어 있는 히비스커스는 유기농 제품을 고르는 것이 더 좋아. 그리고, 분말이 작으면 작을수록 향이 더 많이 나니 참고하면 좋고.	히비스커스 구매 방법	https://www.ajunews.com/view/20170317141950995	2017/03/17	0	2022-09-09 17:18:37	2022-09-22 19:14:49
BK22008014	9	질문자	히비스커스 향이 좋으면 작은 분말의 제품을 사면 되겠구나. 근데, 히비스커스도 유기농이 있어?				0	2022-09-09 17:18:37	2022-09-22 19:14:49
BK22008014	10	전문가	전세계에서 재배되는 히비스커스 꽃 중에 2퍼센트 이하가 유기농이야. 유기농 잎은 그냥 먹어도 괜찮아.	유기농 히비스커스	https://www.fetv.co.kr/news/article.html?no=3095	2017/03/20	0	2022-09-09 17:18:37	2022-09-22 19:14:49
BK22008014	11	질문자	그렇다면 히비스커스 살 때 되도록 유기농 제품으로 구입해야겠다. 그럼, 히비스커스 차는 어떤 맛일지 궁금해.				0	2022-09-09 17:18:37	2022-09-27 08:24:43
BK22008014	12	전문가	차는 일반적으로는 말린 꽃잎을 우려 마시는데 빨간색이고 달콤한 맛이 아니라 쓴맛이 강한 편이야. 혹시 쓴맛 때문에 먹기 어렵다면 꿀을 타서 먹거나 스무디에 가루로 첨가해서 마시면 돼.	히비스커스 섭취 방법	https://www.nbntv.co.kr/news/articleView.html?idxno=350876	2020/03/12	0	2022-09-09 17:18:37	2022-09-27 08:24:43
BK22008014	13	질문자	히비스커스는 맛이 달콤할 줄 알았는데 쓴맛이 강하구나. 그래도 차로 마셔보고 싶은데 방법 좀 알려 줄래?				0	2022-09-09 17:18:37	2022-09-23 18:47:50
BK22008014	14	전문가	차로 히비스커스를 마시는 방법은 꽃잎, 꿀 1, 2 큰술을 준비해서, 끓인 물에 말린 꽃잎을 넣은 후 진한 붉은색으로 우러날 때까지 기다리면 돼. 그리고, 꿀을 넣어 단맛을 내면 차가 완성이야.	히비스커스 차	http://www.insightkorea.co.kr/news/articleView.html?idxno=77404	2020/02/27	0	2022-09-09 17:18:37	2022-09-22 10:33:56
BK22008014	15	질문자	차 우리는 방법은 간단하구나. 혹시 차 말고 히비스커스를 사용해서 식품을 만들기도 해?				0	2022-09-09 17:18:37	2022-09-23 18:47:50
BK22008014	16	전문가	식품업계에서는 히비스커스는 차나 음료, 주류 외에도 다양하게 활용하고 있어. 화려한 색과 톡 쏘는 신맛을 활용한 잼, 젤리, 아이스크림, 타르트, 초콜릿, 푸딩, 케이크가 있어.	히비스커스 활용	http://www.realfoods.co.kr/view.php?ud=20210823000207	2021/08/23	0	2022-09-09 17:18:37	2022-09-22 19:14:49
BK22008014	17	질문자	식품 업계에서 히비스커스를 다양하게 활용하고 있구나.				0	2022-09-09 17:18:37	2022-09-22 19:14:49
BK22008014	18	전문가	응, 히비스커스의 화려한 색과 독특한 맛 때문이지.				0	2022-09-09 17:18:37	2022-09-22 19:14:49
BK22008014	19	질문자	그렇구나, 너와 이야기하면서 히비스커스에 대해 알게 되어서 즐거운 시간이었어.				0	2022-09-09 17:18:37	2022-09-09 17:39:40
BK22008014	20	전문가	다음에도 궁금한 것 생기면 물어봐, 우리는 다음에 보자.				1	2022-09-09 17:18:37	2022-09-27 08:24:43
