id	utterance_id	role	text	search_query	search_URL	reference_date	terminate	regDate	updDate
BK22013460	1	질문자	선물용 와인을 보고 있었는데, 와인을 잘 아는 친구는 와인이 나라마다 특징과 개성이 있다고 하더라고. 이렇게 나라별로 특징이 다른 이유가 있어?				0	2022-09-30 15:43:09	2022-10-01 19:20:39
BK22013460	2	전문가	와인 생산에 필수인 포도를 재배할 때 제일 중요한 요소는 바로 기후야. 국가별 위치에 따라 기후조건이 모두 차이가 있기 때문에 와인 개성도 뚜렷해.	와인 개성	https://dk.asiae.co.kr/article/2020042915091489578	2020/05/01	0	2022-09-30 15:43:09	2022-10-01 19:20:39
BK22013460	3	질문자	기후 조건 때문이구나. 나라별로 와인특징을 알고 있으면 와인 고르기도 편하겠어.				0	2022-09-30 15:43:10	2022-10-01 19:20:39
BK22013460	4	전문가	각 나라의 와인의 개성을 알고 있으면, 취향에 따라 고를 때도 도움이 될 거야.				0	2022-09-30 15:43:10	2022-10-01 19:20:39
BK22013460	5	질문자	곧 명절이라서 교수님과 지인들에게 보낼 선물용 와인을 보고 있었거든. 먼저 프랑스 와인 특징을 알려줄래?				0	2022-09-30 15:43:10	2022-10-01 19:20:39
BK22013460	6	전문가	보르도나와 부르고뉴는 와인의 좋은 산물이 나오는 유명한 지방이야. 이 지역에서는 세계적으로 최고의 와인으로 인정받은 피노 누아가 생산되는데, 이 와인의 특징은 드라이함이야. 정제된 드라이함은 프랑스를 따라올 수 있는 나라가 없어.	프랑스와인 특징	https://dk.asiae.co.kr/article/2020042915091489578	2020/05/01	0	2022-09-30 15:43:10	2022-10-01 19:20:39
BK22013460	7	질문자	드라이한 와인을 좋아하면 프랑스 와인을 선물하면 좋겠구나. 그러면 칠레 와인의 특징은 뭐야?				0	2022-09-30 15:43:10	2022-10-01 19:20:39
BK22013460	8	전문가	칠레를 포함한 미국, 호주 등의 와인을 신대륙 와인이라고 해. 포도의 향을 적나라하게 표현한 과일의 진한 풍미가 매력적이지. 이 때문에 드라이함은 상대적으로 약하지만, 오크 향의 여운이 오래 남아. 입문자에게는 호불호가 가장 적은 칠레 와인이 추천하기 좋은 와인이야.	칠레와인 특징	https://dk.asiae.co.kr/article/2020042915091489578	2020/05/01	0	2022-09-30 15:43:10	2022-10-01 19:20:39
BK22013460	9	질문자	와인을 처음 시작하는 사람에게는 칠레 와인을 선물해야겠어. 이태리 와인의 특징은 어떤 게 있어?				0	2022-09-30 15:43:10	2022-10-01 19:20:39
BK22013460	10	전문가	레드와인은 산미가 새콤달콤하고, 화이트 와인은 드라이함이 입안에 감돌고 싱그러운 게 매력적이야. 옛날의 이태리와인의 맛을 온전하게 유지했기 때문에 이태리 음식과 여전히 잘 어울려.	이태리와인 특징	https://dk.asiae.co.kr/article/2020042915091489578	2020/05/01	0	2022-09-30 15:43:10	2022-10-01 19:20:39
BK22013460	11	질문자	이태리 와인은 이태리음식을 먹을 때, 내가 먹어봐야겠다. 한국인이 좋아하는 와인은 어떤 나라 와인일까?				0	2022-09-30 15:43:10	2022-10-01 19:20:39
BK22013460	12	전문가	포도의 풍미가 꾸밈없이 그대로 드러나는 솔직한 매력이 최고인 스페인 와인은 마시는 데 불편함이 없고, 한국인 입맛에도 잘 어울려.	스페인 와인 특징	https://dk.asiae.co.kr/article/2020042915091489578	2020/05/01	0	2022-09-30 15:43:10	2022-10-01 19:20:39
BK22013460	13	질문자	스페인 와인은 부모님께 선물하면 좋을 거 같아. 한국에서 생산되는 와인은 없을까?				0	2022-09-30 15:43:10	2022-10-01 19:20:39
BK22013460	14	전문가	농촌진흥청을 중심으로 국내에서 와인용 품종인 아그데를 육성했어. 2022년에도 계속해서 육종 중이야. 2021년에는 레드와인용 품종을 개발해서 자체적인 시음에 좋은 평가를 받고, 생과용으로 재배된 청수 품종이 와인용 품종으로 좋은 평을 받아서 재배하는 면적이 빨리 늘고 있어.	국내생산 와인	http://www.ggilbo.com/news/articleView.html?idxno=929200	2022/08/18	0	2022-09-30 15:43:10	2022-10-01 19:20:39
BK22013460	15	질문자	국내에서도 와인이 나오는구나. 청수는 내가 정말 먹어보고 싶다. 여자친구에게 선물할 달콤한 와인은 어떤 걸 사야 할까?				0	2022-09-30 15:43:10	2022-10-01 19:20:39
BK22013460	16	전문가	가장 대중적인 스위트 와인 중 하나로 모스카도 와인은 알코올 도수가 낮고 부드럽지. 또 당도가 높고, 꽃향기, 과일 향이 풍부해. 하지만 산도가 약하기 때문에 오랫동안 보관은 어려워.	스위트 와인	https://www.mhns.co.kr/news/articleView.html?idxno=426709	2021/01/28	0	2022-09-30 15:43:10	2022-10-01 19:20:39
BK22013460	17	질문자	여자친구에겐 모스카토와 어울리는 음식도 같이 선물해주고 싶어. 어울리는 음식도 알려줘.				0	2022-09-30 15:43:11	2022-10-01 19:20:39
BK22013460	18	전문가	모스카도 중 프리잔테 스타일의 모스카토는 마카롱과 잘 어울려. 우리나라에서는 아이스크림이 소로 들어간 마카롱, 소가 많이 들어간 뚱카롱 등 종류가 다양해서 디저트를 좋아하는 사람들에게 인기가 많지.	모스카토 어울리는	https://dk.asiae.co.kr/article/2020061909262555279	2020/06/19	1	2022-10-01 19:20:39	2022-10-01 19:20:39
BK22013460	19	질문자	많은 지인분에게 입맛에 맞는 와인 선물을 해줄 수 있을 거 같아. 알려줘서 고마워.				0	2022-09-30 15:43:11	2022-10-01 19:20:39
BK22013460	20	전문가	너에게 도움이 되어서 기뻐.				0	2022-09-30 15:43:11	2022-10-01 19:20:39
