id	utterance_id	role	text	search_query	search_URL	reference_date	terminate	regDate	updDate
BK22013756	1	질문자	내일 이탈리아 음식을 먹기로 했어요.				0	2022-09-30 15:52:55	2022-10-02 11:47:32
BK22013756	2	전문가	저도 이탈리아 음식 좋아하는데 부럽네요.				0	2022-09-30 15:52:56	2022-10-02 11:47:32
BK22013756	3	질문자	이탈리아 음식 하면 파스타가 제일 먼저 떠오르는데 생각해보니 파스타가 뭔지도 모르고 먹었어요. 어떤 음식을 파스타라고 하는 건지 알려주세요.				0	2022-09-30 15:52:56	2022-10-02 11:47:32
BK22013756	4	전문가	밀가루 반죽을 팽창시켜 물이나 달걀을 섞은 뒤 다양한 형태로 만들어 끓이거나 구운 음식을 파스타라고 합니다. 밀가루 속 글루텐 섭취를 막거나 독특한 식감을 내기 위해 콩이나 렌즈콩 또는 쌀가루를 사용해 만들기도 합니다. 파스타는 이탈리아 사람들의 주식이죠.	파스타	https://ko.wikipedia.org/wiki/%ED%8C%8C%EC%8A%A4%ED%83%80	2022/09/05	0	2022-09-30 15:52:56	2022-10-02 11:47:32
BK22013756	5	질문자	파스타를 먹다 보면 면이 긴 것도 있고 짧은 것도 있던데 어떻게 구분하나요?				0	2022-09-30 15:52:56	2022-10-02 11:47:32
BK22013756	6	전문가	면의 길이에 따라 롱파스타와 숏파스타로 나눌 수 있는데요, 한국에서는 주로 롱파스타를 선호합니다. 롱파스타 중에서는 스파게티, 스파게티니, 탈리아텔레, 링귀니 등을 흔히 먹고요. 숏파스타는 팬네, 푸질리, 로텔레, 파르팔레, 마카로니 등이 유명합니다.	파스타 면 길이	https://n.news.naver.com/mnews/article/081/0000123692?sid=103	2007/03/01	0	2022-09-30 15:52:56	2022-10-02 11:47:32
BK22013756	7	질문자	설명을 들어보니 파스타 속에 스파게티가 있는 거였네요. 그러면 스파게티는 어떤 종류의 파스타를 의미하고 주로 어떤 식으로 요리를 하나요?				0	2022-09-30 15:52:56	2022-10-02 11:47:32
BK22013756	8	전문가	스파게티는 가늘고 긴 원통형 파스타 중 하나입니다. 흔히 이탈리아 요리의 대명사로 불리는데요, 토마토소스를 끼얹어 먹는 것이 일반적입니다. 소금을 약간 넣은 끓는 물에 8분에서 12분 정도 충분히 면을 삶은 뒤, 찬물에 헹구지 않고 뜨거운 상태로 건져 우묵하게 파인 그릇에 담고 토마토소스나 토마토 퓌레를 끼얹은 뒤 취향에 맞게 가루 치즈를 뿌려 먹습니다.	스파게티	https://ko.wikipedia.org/wiki/%EC%8A%A4%ED%8C%8C%EA%B2%8C%ED%8B%B0	2022/08/18	0	2022-09-30 15:52:56	2022-10-02 11:47:32
BK22013756	9	질문자	그러면 스파게티라는 이름은 어떻게 해서 붙여진 건지 그 뜻을 알고 싶어요.				0	2022-09-30 15:52:56	2022-10-02 11:47:32
BK22013756	10	전문가	이탈리아어로 줄을 의미하는 spago에 본래 뜻보다 더 작은 개념을 나타내는 접사를 붙이면 spaghetto가 되는데요, spaghetto의 복수형이 spaghetti, 즉 스파게티입니다. 말 그대로 조그마한 줄들이라는 뜻인데요, 단면이 원형인 줄 모양의 파스타로 굵기가 2mm 정도인 것을 의미합니다.	스파게티 뜻	https://ko.wikipedia.org/wiki/%EC%8A%A4%ED%8C%8C%EA%B2%8C%ED%8B%B0	2022/08/18	0	2022-09-30 15:52:56	2022-10-02 11:47:32
BK22013756	11	질문자	스파게티라는 이름에 상당히 의미가 많았네요. 또 궁금한 게 파스타는 종류가 몇 개 정도 되나요?				0	2022-09-30 15:52:57	2022-10-02 11:47:32
BK22013756	12	전문가	파스타를 구체적 형태로 나누면 310개이고요, 파스타의 이름은 기록된 것만 1천300개가 넘습니다. 일부 파스타의 모양이나 종류 역시 지역에 따라 다양한데요, 파스타의 면 모양인 카바텔리의 경우 지역과 마을에 따라 부르는 명칭이 달라 총 28개의 이름을 지닌 것으로 유명해요.	파스타 종류	https://ko.wikipedia.org/wiki/%ED%8C%8C%EC%8A%A4%ED%83%80	2022/08/19	0	2022-09-30 15:52:57	2022-10-02 11:47:32
BK22013756	13	질문자	아까 설명하실 때 숏파스타의 예로 마카로니를 말씀하셨는데요. 마카로니도 이름은 익숙한데 정확히 무엇을 의미하는지 몰라서 모양이나 특징에 대해 설명 좀 부탁드려요.				0	2022-09-30 15:52:57	2022-10-02 11:47:32
BK22013756	14	전문가	마카로니는 스파게티보다 길이가 현격히 짧고 속이 비어 있는 데다, 달걀이 사용되지 않습니다. 마카로니는 기계로 만드는데 가정에서도 기계로 만들 수는 있지만 대개 공산품으로 만들어져 유통됩니다.	마카로니	https://ko.wikipedia.org/wiki/%EB%A7%88%EC%B9%B4%EB%A1%9C%EB%8B%88	2022/02/23	0	2022-09-30 15:52:57	2022-10-02 11:47:32
BK22013756	15	질문자	마카로니는 기계로 만드는 짧은 파스타를 의미하는 거였네요. 아까 말씀하신 푸실리 파스타도 평소에 많이 들어봤는데요. 푸실리는 외형에 어떤 특징이 있나요?				0	2022-09-30 15:52:57	2022-10-02 11:47:32
BK22013756	16	전문가	푸실리는 굵고 긴 파스타의 한 종류로 타래송곳을 닮았어요. 다른 파스타처럼 여러 가지의 밀가루를 사용하기도 하는데요, 들어가는 재료에 따라 반죽의 색이 다르게 나타나요.	푸실리 특징	https://ko.wikipedia.org/wiki/%ED%91%B8%EC%8B%A4%EB%A6%AC	2022/02/22	0	2022-09-30 15:52:57	2022-10-02 11:47:32
BK22013756	17	질문자	파스타 면에 대해 하나씩 알아가니 재미있네요. 마지막으로 하나만 더 여쭤보고 싶네요. 제가 파스타 중에 알리오올리오를 가장 좋아하는데, 알리오올리오 조리법에 대해 알고 싶어요.				0	2022-09-30 15:52:57	2022-10-02 11:47:32
BK22013756	18	전문가	알리오올리오는 올리브유에 마늘을 빻아서 으깬 뒤 뿌려서 만드는데, 붉은 고춧가루를 뿌려서 먹는 경우도 있습니다. 흔히 파슬리를 잘게 썬 뒤 장식처럼 뿌려 파르미자노 레자노 치즈를 함께 먹는데, 전통적인 조리법에 의하면 치즈는 넣지 않고 주로 해산물을 넣습니다.	알리오올리오	https://ko.wikipedia.org/wiki/%EC%8A%A4%ED%8C%8C%EA%B2%8C%ED%8B%B0_%EC%95%8C%EB%A6%AC%EC%98%A4_%EC%98%AC%EB%A6%AC%EC%98%A4	2022/02/22	0	2022-09-30 15:52:57	2022-10-02 11:47:32
BK22013756	19	질문자	파스타에 관해 자세히 알려주셔서 정말 고맙습니다.				0	2022-09-30 15:52:57	2022-10-02 11:47:32
BK22013756	20	전문가	언제든지 이탈리아 음식이 궁금하면 물어보세요.				1	2022-09-30 15:52:57	2022-10-02 11:47:32
