id	utterance_id	role	text	search_query	search_URL	reference_date	terminate	regDate	updDate
BK22007705	1	질문자	추석에 엄마가 싸주신 음식들이 너무 많이 남았어. 남은 음식을 뭔가 다른 음식으로 해먹고 싶은 데 방법이 없을까?				0	2022-09-06 13:09:12	2022-09-06 14:16:14
BK22007705	2	전문가	동그랑땡이 남았다면 동그랑땡 강정을 해 먹어 봐. 동그랑땡 말고도 다른 전으로도 만들 수 있는 데, 남은 전을 달고 짭짤한 간식으로 바꿀 수 있는 메뉴야.	남은 전 활용	http://www.sommeliertimes.com/news/articleView.html?idxno=17347	2020/10/03	0	2022-09-06 13:09:12	2022-09-06 14:16:14
BK22007705	3	질문자	전으로 강정을 해먹으면 맛있겠다. 사실 전찌개를 해먹어야 하나 생각했거든. 전찌개 만드는 방법도 알려 줘.				0	2022-09-06 13:09:12	2022-09-06 14:16:14
BK22007705	4	전문가	동태전, 꼬치, 산적, 동그랑땡, 호박전 같은 다양한 전과 육수를 넣어 끓이면 전찌개야. 단, 만들 때 주의할 점은 냄비에 바로 전을 넣지 말고 바닥에 무나 양파 같은 재료를 넣고 육수를 부은 후에 전을 위에 올려줘야 한다는 거야. 그리고, 고춧가루나 고추장을 넣어 입맛에 맞게 얼큰한 전찌개를 만들어 먹는 것도 방법이야.	전 찌개	https://kizmom.hankyung.com/news/view.html?aid=201609185405o	2016/09/18	0	2022-09-06 13:09:12	2022-09-06 14:16:14
BK22007705	5	질문자	전이 많이 남아서 찌개도 끓이고 강정도 만들어 먹고 해야겠다. 그리고, 남은 나물은 어떤 요리를 만들면 좋을까?				0	2022-09-06 13:09:12	2022-09-06 14:16:14
BK22007705	6	전문가	도라지, 시금치, 고사리 같은 나물이 남았다면 특별하게 양념을 할 필요 없이 나물전을 만들 수 있어. 나물을 짤게 썬 다음에 부침가루와 계란을 넣고 부치면 색다른 전이 완성돼.	추석 나물 활용	http://www.ftimes.kr/news/articleView.html?idxno=12851	2021/09/24	0	2022-09-06 13:09:12	2022-09-06 14:16:14
BK22007705	7	질문자	나물전은 생각해 보지 못한 메뉴인데 맛있을 것 같아. 근데 아이들은 나물전을 잘 먹을지 모르겠어. 나물을 활용한 다른 요리도 있을까?				0	2022-09-06 13:09:12	2022-09-06 14:16:14
BK22007705	8	전문가	그럼, 시큰둥한 아이들을 위해 나물죽을 해 먹어 보는 것도 좋아. 잘게 썬 나물을 찬밥과 같이 끓이고, 마지막에 푼 달걀을 넣어주거나 김가루를 뿌리면 더 맛있게 먹을 수 있어.	추석 남은 나물	https://sports.khan.co.kr/bizlife/sk_index.html?art_id=202109171142023&sec_id=560101&pt=nv	2021/09/17	0	2022-09-06 13:09:12	2022-09-06 14:16:14
BK22007705	9	질문자	나물죽은 아이들도 먹을 것 같아. 그리고, 엄마가 과일도 많이 싸주셨는데 어떻게 할까?				0	2022-09-06 13:09:12	2022-09-06 14:16:14
BK22007705	10	전문가	과일을 오래 두면 표면도 마르고 색도 변해서 신선도가 떨어질 수 있지. 남은 과일을 모아서 샐러드를 만들어 봐. 또, 사과는 납작하게 썰어서 고추장 양념에 버무려 사과초무침으로 활용할 수 있어.	추석 남은 과일	http://www.kookje.co.kr/news2011/asp/newsbody.asp?code=0700&key=20160912.99002111948	2016/09/12	0	2022-09-06 13:09:12	2022-09-06 14:16:14
BK22007705	11	질문자	과일 샐러드는 엄마가 많이 만들어 주시던 건데 한번 만들어 봐야겠다. 남은 잡채 활용법도 알려 줄래?				0	2022-09-06 13:09:12	2022-09-06 14:16:14
BK22007705	12	전문가	남은 잡채는 과일과 함께 월남쌈을 만들면 돼. 잡채, 사과와 배 같은 과일, 라이스페이퍼, 뜨거운 물, 땅콩소스면 재료 준비는 끝이야. 뜨거운 물에 적신 라이스페이퍼에 재료를 넣고 싸먹으면 되는 간단한 요리야.	추석 잡채	http://www.sportsseoul.com/news/read/818187	2019/09/14	0	2022-09-06 13:09:12	2022-09-06 14:16:14
BK22007705	13	질문자	월남쌈에 남은 과일과 잡채를 활용하는 요리구나. 그리고, 엄마가 묵도 잔뜩 싸주셨는데 어떻게 하지?				0	2022-09-06 13:09:12	2022-09-06 14:16:14
BK22007705	14	전문가	나무젓가락 굵기로 썰어서 식품건조기로 말리면 돼. 말린 묵은 무쳐 먹어도 되고, 끓는 물에 5분 정도 삶아 채소와 고기와 먹어도 맛있어.	추석 묵	https://kormedi.com/1325169/%ec%a0%84-%ed%8a%80%ea%b9%80%ec%97%90-%eb%ac%b4%eb%a5%bc-%eb%84%a3%ea%b3%a0%ec%b6%94%ec%84%9d%ec%9d%8c%ec%8b%9d-%ed%99%9c%ec%9a%a9-%ec%9a%94%eb%a6%ac-6/	2020/10/04	0	2022-09-06 13:09:12	2022-09-06 14:16:14
BK22007705	15	질문자	묵을 건조만 해도 훨씬 오래 보관할 수 있겠네. 혹시 남은 송편도 활용할 수 있는 방법이 있을까?				0	2022-09-06 13:09:12	2022-09-06 14:16:14
BK22007705	16	전문가	남은 송편을 이용해서 송편 고구마 맛탕을 만들면 돼. 송편과 고구마를 튀겨서 맛탕 소스에 버무린 후 견과류와 흑임자를 뿌리면 고소한 간식이 완성돼.	추석 송편	http://news.heraldcorp.com/view.php?ud=20160913000849	2016/09/14	0	2022-09-06 13:09:12	2022-09-06 14:16:14
BK22007705	17	질문자	송편 고구마 맛탕은 아이들에게 인기 만점이겠는데. 마지막으로 한과도 많은 데 활용방법이 있을까?				0	2022-09-06 13:09:12	2022-09-06 14:16:14
BK22007705	18	전문가	한과나 남은 떡은 건조기에 말려 분쇄기에 갈아두고 먹으면 돼. 건조한 떡과 한과는 당과 곡물의 함량이 적당해서 다른 재료를 넣지 않아도 뜨거운 물만 부으면 죽이나 수프처럼 마실 수 있어서 좋아.	추석 남은 떡	http://kormedi.com/1216324/	2015/09/25	0	2022-09-06 13:09:12	2022-09-06 14:16:14
BK22007705	19	질문자	한과와 떡을 가루처럼 만드는 거 너무 좋은 아이디어네. 오늘은 알려준 방법대로 남은 명절 음식을 이용해서 요리를 해야겠어.				0	2022-09-06 13:09:12	2022-09-06 14:16:14
BK22007705	20	전문가	그래, 맛있게 요리해서 즐겁게 먹고, 우리는 다음에 보자.				1	2022-09-06 13:09:12	2022-09-19 16:40:27
