id	utterance_id	role	text	search_query	search_URL	reference_date	terminate	regDate	updDate
BK22004838	1	질문자	얼마전에 고기 사려고 마트에 다녀왔는데, 진열된 상품들이 좀 실망스럽더라.				0	2022-08-06 01:09:37	2022-08-06 01:09:37
BK22004838	2	전문가	어떤 점 때문에 실망까지 했다는 거야?				0	2022-08-06 01:10:32	2022-08-06 01:10:32
BK22004838	3	질문자	그게, 소가 건강하고 고기가 맛있을수록, 소고기에 마블링이 많이 생긴다고 하잖아. 그런데, 내가 갔던 마트에서 파는 소고기에는 마블링이 거의 없더라. 그래서 그냥 돼지고기만 좀 사고 돌아왔어.				0	2022-08-06 01:09:37	2022-08-15 22:12:12
BK22004838	4	전문가	어, 뭔가 조금 잘못 알고 있는 것 아닐까? 마블링은 건강한 소에게 생기는 특징이라기보단, 간기능에 문제가 생기고 대사기능이 거의 망가졌을 때 지방이 근육을 침투해서 생기는 현상이거든. 그러다 보니, 이런 소들을 키울 때 자연히 항생제를 많이 투입하게 되는데, 항생제는 소 뿐만 아니라 사람들에게도 좋지 않은 영향을 미칠 수 있어.	마블링 소고기 건강에	http://www.idsn.co.kr/news/articleView.html?idxno=57142	2021/10/22	0	2022-08-06 01:09:37	2022-08-23 09:12:31
BK22004838	5	질문자	앗, 그게 정말이야? 난 지금까지 비싸더라도 마블링이 많은 소고기만 골라서 샀는데, 네 말 대로라면 오히려 마블링이 건강에 안 좋다는 거지?				0	2022-08-06 01:09:37	2022-08-06 01:09:37
BK22004838	6	전문가	맞아, 그렇지 않아도 소고기는 다른 고기들과 비교했을 때 지방이 많은 고기인데, 마블링까지 많은 소고기의 경우엔 포화지방산도 많이 함유하고 있거든. 그런데 포화지방산을 많이 먹으면, 이걸 바탕으로 간에서 콜레스테롤도 만들어내기 때문에, 혈중 콜레스테롤이 높아지는 현상이 생겨.	마블링 건강에 안좋음	https://www.hankookilbo.com/News/Read/201507171644001177	2015/07/17	0	2022-08-06 01:09:37	2022-08-23 09:12:31
BK22004838	7	질문자	으음, 그러니까 조금 정리해보면, 마블링에는 포화지방산이라는 성분이 있는데, 이 포화지방산이 나쁜 콜레스테롤을 몸에 축적시키는 원인이라는 거지?				0	2022-08-06 01:09:37	2022-08-15 22:12:12
BK22004838	8	전문가	맞아, 동물성 지방에는 포화지방산이 들어가는데, 이게 혈중 콜레스테롤 수치를 높이는 역할을 하거든.	포화지방산 콜레스테롤	https://kormedi.com/1383231/%EC%BD%9C%EB%A0%88%EC%8A%A4%ED%85%8C%EB%A1%A4-%EB%86%92%EC%9C%BC%EB%A9%B4-%EC%9E%90%EC%A3%BC-vs-%EC%A0%81%EA%B2%8C-%EB%A8%B9%EC%96%B4%EC%95%BC-%ED%95%A0-%EC%9D%8C%EC%8B%9D/	2022/02/28	0	2022-08-06 01:09:37	2022-08-06 01:09:37
BK22004838	9	질문자	흠, 지금까지는 마블링만 보고선 고기의 질을 판단했는데, 결국에는 이게 다 지방 덩어리였다는거네. 앞으로는 다른 기준을 가지고 고기를 골라야겠어.				0	2022-08-06 01:09:37	2022-08-06 01:09:37
BK22004838	10	전문가	맞아, 어떤 고기가 좋은지, 마블링 유무보단 다른 기준을 보고 판단하는 걸 추천할게.				0	2022-08-06 01:09:37	2022-08-06 01:09:37
BK22004838	11	질문자	응, 알겠어. 그러면 혹시, 소고기를 고를 때 어떻게 해야 좋은 고기를 찾을 수 있을까?				0	2022-08-06 01:09:37	2022-08-06 01:09:37
BK22004838	12	전문가	우선 색이 밝고, 붉은색을 띠는 고기를 고르는 게 좋아. 그리고, 만약에 포장지 안쪽에 육즙이 과하게 고여 있다면, 그 고기는 고르지 않도록 해.	좋은 소고기 고르는 법	https://bravo.etoday.co.kr/view/atc_view.php?varAtcId=12767	2021/09/16	0	2022-08-06 01:10:32	2022-08-06 01:10:32
BK22004838	13	질문자	혹시 고기의 단면을 보는 것도, 소고기를 고를 때 도움이 될 수 있을까?				0	2022-08-06 01:10:32	2022-08-06 01:10:32
BK22004838	14	전문가	물론이야, 고기 단면을 보면 고기의 결을 확인할 수 있는데, 이때 가늘고 섬세한 결이 있는 고기를 고르는 게 좋아. 덧붙여, 표면이 건조하지는 않은지, 탄력은 있는지도 같이 확인하도록 해.	고기 단면 소고기 고르는 법	https://www.thekpm.com/news/articleView.html?idxno=107781	2022/01/26	0	2022-08-06 01:10:32	2022-08-06 01:10:32
BK22004838	15	질문자	응, 그 부분도 기억해 두도록 할게. 그리고 말이야, 가급적이면 건강하게 먹고 싶은데, 혹시 같은 소고기라도 지방 함유량이 상대적으로 적은 부위가 있을까?				0	2022-08-06 01:10:32	2022-08-06 01:10:32
BK22004838	16	전문가	그렇다면 목심이나 채끝 내지, 안심을 먹어보는 건 어때? 이 부위들이랑, 설도랑 사태, 그리고 우둔이 소고기 중에서는 지방 함유량이 적은 부위들이거든.	지방 적은 소고기 부위	https://health.chosun.com/site/data/html_dir/2015/11/19/2015111901289.html	2015/11/19	0	2022-08-06 01:10:32	2022-08-06 01:10:32
BK22004838	17	질문자	어, 채끝은 왠지 지방이 많은 이미지인데, 조금 의외다. 그러면 반대로, 소고기에서 지방이 많은 부위는 어느 쪽이야?				0	2022-08-06 01:10:32	2022-08-06 01:10:32
BK22004838	18	전문가	등심이나 갈비, 양지나 앞다리살에는 지방이 많은 편이야. 따라서, 지방 섭취를 피하고 싶다면 이 부위들은 피하는 게 좋겠지.	소고기에서 지방이 많은 부위	https://health.chosun.com/site/data/html_dir/2015/11/19/2015111901289.html	2015/11/19	0	2022-08-06 01:10:32	2022-08-06 01:10:32
BK22004838	19	질문자	음, 그렇다면 당분간 등심도 너무 많이 먹진 말아야겠다. 그럼 혹시, 그냥 등심 말고 꽃등심도 마찬가지로 건강에 안 좋은 편일까?				0	2022-08-06 01:10:32	2022-08-06 01:10:32
BK22004838	20	전문가	맞아, 꽃등심을 보면 지방이 섞여 있고, 마블링이 있잖아. 그렇다 보니 맛은 있을지 몰라도, 건강에 좋은 부위라고 볼 수는 없지. 참고로, 이건 꽃등심 뿐만 아니라 갈빗살도 마찬가지야.	꽃등심 건강	https://www.hidoc.co.kr/healthstory/news/C0000285823	2017/09/19	0	2022-08-06 01:10:32	2022-08-06 01:10:32
BK22004838	21	질문자	이런, 꽃등심이랑 갈빗살 둘 다 좋아하는 부위라서 안타깝네. 그래도 네 말대로, 건강 생각해서 앞으로는 조금씩 자제하면서 먹어야겠어.				0	2022-08-06 01:10:32	2022-08-06 01:10:32
BK22004838	22	전문가	그래, 맛있는 걸 먹는 것도 좋지만, 그 전에 건강이 먼저지.				0	2022-08-06 01:10:32	2022-08-06 01:10:32
BK22004838	23	질문자	응, 네 말이 맞아. 아무튼 유용한 정보를 알려줘서 고마워. 더 이야기하고 싶지만, 난 이만 저녁 준비를 해야해서 그만 들어가볼게.				0	2022-08-06 01:10:32	2022-08-06 01:10:32
BK22004838	24	전문가	그래, 잘 들어가고, 저녁 잘 차려서 먹길 바랄게.				1	2022-08-06 01:10:32	2022-08-23 09:12:31
