id	utterance_id	role	text	search_query	search_URL	reference_date	terminate	regDate	updDate
BK22006654	1	질문자	이번에 조별 과제로 가을철에 제철을 맞는 것들을 조사하기로 했는데, 모르는 것이 생겼어. 네가 도와줄 수 있니?				0	2022-08-28 04:24:39	2022-10-11 00:07:12
BK22006654	2	전문가	응, 어떤 것이 궁금한지 말해볼래?				0	2022-08-28 04:24:39	2022-10-11 00:07:12
BK22006654	3	질문자	일단 가을철에 제철을 맞는 해산물이 어떤 것이 있는지 궁금해.				0	2022-08-28 04:24:39	2022-10-11 00:07:12
BK22006654	4	전문가	가을이 제철인 해산물은 대표적으로 굴, 보리새우, 대하, 고등어 등이 있어. 굴은 9월부터 12월까지가 제철이고 보리새우, 대하, 고등어도 굴과 마찬가지로 9월부터 12월이 제철이야.	가을 제철 해산물	https://www.nbntv.co.kr/news/articleView.html?idxno=688376	2020/03/14	0	2022-08-28 04:24:39	2022-09-29 22:47:48
BK22006654	5	질문자	여러 해산물이 있네. 흠, 수족관에서 주로 보는 큰 새우는 대하겠지?				0	2022-08-28 04:24:39	2022-10-11 00:07:12
BK22006654	6	전문가	실제로 대하로 판매되고 있는 것 중 일부는 대하가 아니라 흰다리 새우야. 더욱이 네가 본 수조에서 헤엄치고 있는 새우를 대하라고 판매하고 있다면 그것은 대하일 확률이 정말 낮아.	대하 흰다리새우	http://www.suhyupnews.co.kr/news/articleView.html?idxno=29577	2022/08/24	0	2022-08-28 04:24:39	2022-10-11 00:07:12
BK22006654	7	질문자	대하일 줄 알았는데 그게 흰다리새우일 수도 있겠네. 그런데 왜 대하가 아니라 흰다리 새우를 파는거지?				0	2022-08-28 04:24:39	2022-08-28 04:24:39
BK22006654	8	전문가	우리나라는 2000년대까진 대하를 양식했는데, 지금은 대부분이 흰다리새우 양식으로 변경했어. 대하는 바이러스성 질환인 흰반점병에 약하고 밀집 상태로 기르기 어렵다는 단점이 있어. 반면에 아열대성 해양 생물인 흰다리새우는 대하보다 질환에 강하고 같은 공간이지만 더 많은 개체를 키울 수 있다는 장점이 있어. 그리고 대하만큼 크기가 크다는 점도 있지.	대하 흰다리새우 양식	https://www.donga.com/news/article/all/20170901/86113164/1	2017/09/01	0	2022-08-28 04:24:39	2022-08-28 04:24:39
BK22006654	9	질문자	그렇구나. 그럼 대하와 흰다리새우를 구분하지 못하면 잘못 살 수도 있겠네. 그럼 어떻게 구분 할 수 있는지 네가 알려줄래?				0	2022-08-28 04:24:39	2022-10-11 00:07:12
BK22006654	10	전문가	좋아, 내가 알려줄게. 대하와 흰다리새우를 쉽게 구별하는 방법에는 새우 꼬리의 색을 확인하는 것이야. 대하의 꼬리는 녹색빛이지만 흰다리새우는 붉은 빛을 띄고 있거든.	대하 흰다리새우 구분 꼬리	http://www.civicnews.com/news/articleView.html?idxno=32702	2021/11/01	0	2022-08-28 04:24:39	2022-08-28 04:24:39
BK22006654	11	질문자	오, 좋은 방법이다. 그런데 익혀져있거나 대하와 흰다리 새우를 직접 보면 색 차이를 구분하기 힘들 것 같아. 다른 외형적인 차이점은 없어?				0	2022-08-28 04:24:39	2022-08-28 04:24:39
BK22006654	12	전문가	물론 있어. 대하의 수염은 몸집의 2배에서 3배정도로 흰다리 새우보다 더 길어서 요리된 새우가 대하인지 흰다리새우인지 판단하기 좋아. 그리고 수염으로 착각할 수 있는 새우 코끝에 있는 더듬이로도 구분할 수 있어. 흰다리 새우의 경우엔 더듬이가 매우 짧은데 대하는 수염이라고 생각 들 정도로 매우 긴 특징을 가지고 있어.	대하 흰다리새우 수염 차이	http://www.civicnews.com/news/articleView.html?idxno=32702	2021/11/01	0	2022-08-28 04:24:39	2022-08-28 04:24:39
BK22006654	13	질문자	이제 나도 대하와 흰다리 새우를 구분할 수 있겠어. 그런데 꽃게도 가을에 제철을 맞나?				0	2022-08-28 04:24:39	2022-10-11 00:07:12
BK22006654	14	전문가	맞아. 봄은 암게가 가장 맛있는 것에 비해 수게는 가을에 제철을 맞아. 수게는 여름부터 살을 찌우기 시작하는데, 가장 통통해지는 시기가 바로 가을이기 때문이야.	가을 제철 꽃게	http://www.realfoods.co.kr/view.php?ud=20161005000312	2016/10/05	0	2022-08-28 04:24:39	2022-08-28 04:24:39
BK22006654	15	질문자	그렇구나. 그럼 게를 먹는다면 꼭 수게로 먹어야겠네. 그런데 수게와 암게는 어떻게 구분 할 수있어?				0	2022-08-28 04:24:39	2022-08-28 04:24:39
BK22006654	16	전문가	암게와 수게를 구분하기 위해선 배를 봐야해. 암게는 배 딱지가 둥근 모양이지만 수게는 뾰족한 모양을 가지고 있거든. 참고로 봄에 암게가 맛있다는 이유는 알을 품고 있어서고, 수게는 금어기가 끝나고 살이 올라서 찜이나 탕으로 즐기기에 좋아.	암게 수게 구분	http://www.ftimes.kr/news/articleView.html?idxno=12722	2021/09/15	0	2022-08-28 04:24:39	2022-08-28 04:24:39
BK22006654	17	질문자	오, 정말 좋은 정보야. 그런데 꽃게는 흰다리새우처럼 양식이 가능한 생물이야?				0	2022-08-28 04:24:39	2022-08-28 04:24:39
BK22006654	18	전문가	꽃게는 양식을 통해 대량으로 키우기 어려워. 꽃게를 키우는덴 수온이 중요해. 뿐만 아니라 우리가 먹을 정도로 자라려면 꽃게가 먹이활동도 열심히하고 12회 넘게 허물을 벗어야하기 때문이야. 게다가 꽃게는 동물성 먹이를 필요로해서 먹이 공급이 쉽지도 않고 동족끼리 잡아먹기도해서 양식엔 적합하지 않아.	꽃게 양식	https://www.dongascience.com/news.php?idx=19577	2017/09/01	0	2022-08-28 04:24:39	2022-08-28 04:24:39
BK22006654	19	질문자	그렇구나. 네가 알려준 정보 덕분에 과제하는데 많은 도움이 될 것 같아. 그럼 나는 네가 알려준 것들을 바탕으로 과제를 하러 가볼게.				0	2022-08-28 04:24:39	2022-10-11 00:07:12
BK22006654	20	전문가	그래, 그럼 과제 준비 잘 하고 더 궁금한게 생긴다면 언제든지 물어봐.				1	2022-08-28 04:24:39	2022-10-21 08:26:11
