id	utterance_id	role	text	search_query	search_URL	reference_date	terminate	regDate	updDate
BK22007973	1	질문자	저번에 부산에서 삼치 구이를 먹었는데 정말 맛있더라고요.				0	2022-09-09 02:14:33	2022-09-09 02:14:33
BK22007973	2	전문가	삼치가 촉촉하고 맛있는 생선이죠.				0	2022-09-09 02:14:33	2022-09-09 02:14:33
BK22007973	3	질문자	그러니까요. 저는 거의 처음 먹어보는데 삼치는 어떤 생선이죠?				0	2022-09-09 02:14:33	2022-09-09 02:14:33
BK22007973	4	전문가	삼치는 등푸른 생선인데요. 고등어과에 속하죠. 우리나라 바다에서 많이 잡히는 생선이고 모양은 조기랑 비슷한데 몸은 둥근편이고 머리가 작아요. 등이 청흑색을 띄는데 윤기가 나는 것이 특징인 생선이죠.	삼치	http://kormedi.com/1208078/	2013/10/04	0	2022-09-09 02:14:33	2022-09-09 02:14:33
BK22007973	5	질문자	삼치가 고등어과 생선이었군요. 그럼 삼치는 혹시 제철이 언제인가요?				0	2022-09-09 02:14:33	2022-09-09 02:14:33
BK22007973	6	전문가	삼치의 경우에는 10월부터 살에 기름기가 오르는 생선으로 10월부터 시작해서 2월까지 제철이에요.	삼치 철	https://www.sisunnews.co.kr/news/articleView.html?idxno=50738	2017/02/25	0	2022-09-09 02:14:33	2022-09-09 02:14:33
BK22007973	7	질문자	겨울에 맛있는 생선이군요. 그럼 삼치는 어떤 효능이 있는 생선인가요?				0	2022-09-09 02:14:33	2022-09-09 02:14:33
BK22007973	8	전문가	삼치의 경우에는 DHA가 함유되어 있는데 이 성분은 태아의 두뇌발달을 돕는 성분이에요. 또한 노인들의 치매 예방에도 좋고 기억력 증진에도 탁월해요. 암 예방을 해주기도 하고요.	삼치 효능	https://www.segye.com/newsView/20160212002485?OutUrl=naver	2016/02/12	0	2022-09-09 02:14:33	2022-09-21 16:44:47
BK22007973	9	질문자	삼치는 상당히 많은 효능이 있군요. 맛있는 삼치를 고르는 요령이 있을까요?				0	2022-09-09 02:14:33	2022-09-09 02:14:33
BK22007973	10	전문가	삼치는 배와 몸통이 단단하고 탄력이 있는 것이 좋고요. 광택이 선명하면서 살이 통통한 것을 고르면 돼요.	삼치 고르기	https://www.hankyung.com/society/article/2015021237777	2015/02/12	0	2022-09-09 02:14:33	2022-09-21 16:44:47
BK22007973	11	질문자	그렇군요. 그럼 삼치를 사와서 손질하고 보관하는 건 어떻게 해야 하나요?				0	2022-09-09 02:14:33	2022-09-09 02:14:33
BK22007973	12	전문가	삼치의 경우에는 꼭 내장을 제거해야 쓴맛을 없앨 수 있어요. 그래서 손질할 때 내장을 제거해야 하고, 보관할 때는 마이너스 20도부터 0도 정도의 온도에서 냉장보관이 한달까지는 가능한데요. 냉동 보관을 하려면 토막을 낸 후 소금을 뿌려서 보관하는 것이 좋죠. 삼치는 지방질이 많고 살이 연한편이라서 다른 생선에 비해 빨리 상할 수 있기에 구입해서 바로 먹는 것이 가장 좋아요.	삼치 보관	http://www.ggilbo.com/news/articleView.html?idxno=747363	2020/02/21	0	2022-09-09 02:14:33	2022-09-21 16:44:48
BK22007973	13	질문자	구입해서 바로 바로 먹는 것이 좋겠군요. 삼치를 맛있게 굽는 요령이 있을까요?				0	2022-09-09 02:14:33	2022-09-09 02:14:33
BK22007973	14	전문가	삼치는 기름기가 많은 생선이라서 잘 굽지 못하면 퍼석한 식감으로 구워질 수도 있어요. 에어 프라이어로 굽는 경우도 종종 있지만 프라이팬에 굽는 것이 더 촉촉해요. 혹시 에어 프라이어를 이용하려면 생선 겉 면에 기름을 발라서 굽는 것이 좋고요. 비린내가 걱정된다면 쌀뜨물에 10분 정도 담군 후 굽는 것이 좋아요.	삼치 구이	http://www.100ssd.co.kr/news/articleView.html?idxno=73029	2020/11/27	0	2022-09-09 02:14:33	2022-09-09 02:14:33
BK22007973	15	질문자	알려주신대로 하면 집에서도 맛있게 삼치 구이를 해서 먹을 수 있겠어요. 혹시 구이 말고 다른 레시피도 알려줄 수 있나요?				0	2022-09-09 02:14:33	2022-09-21 16:44:48
BK22007973	16	전문가	삼치 크로켓 만드는 방법을 알려드릴게요. 삼치의 살을 먼저 믹서기에 갈아야 하는데 잘 갈리도록 듬성듬성 잘라주고요. 삼치살과 생강, 맛술을 넣고 믹서기에 갈아주고 볶은 양파와 삼치살, 다진 마늘, 다진 파슬리, 치즈, 카레가루, 밀가루, 생크림까지 넣고 치대주면 돼요. 그 후 동그란 모양으로 만들어서 밀가루, 계란물, 빵가루의 순서로 튀김옷을 입혀준 뒤 180도 기름에 튀겨주면 완성돼요.	삼치 요리	http://www.heraldpop.com/view.php?ud=201602162207310662994_1	2016/02/16	0	2022-09-09 02:14:33	2022-09-21 16:44:48
BK22007973	17	질문자	삼치 크로켓이라니 정말 맛있을 것 같아요. 다음에 한 번 요리해볼게요. 삼치는 어떤 식재료와 궁합이 좋나요?				0	2022-09-09 02:14:33	2022-09-09 02:14:33
BK22007973	18	전문가	삼치의 경우에는 단백질이 많은데요. 무나 파와 같이 비타민이 풍부한 채소와 함께 먹으면 궁합이 좋죠.	삼치 궁합	https://www.segye.com/newsView/20211101509358?OutUrl=naver	2021/11/01	0	2022-09-09 02:14:33	2022-09-09 02:14:33
BK22007973	19	질문자	비타민이 많은 채소들과 함께 먹어봐야겠네요. 오늘 삼치에 대해서 덕분에 잘 알게 되었어요. 감사해요.				0	2022-09-09 02:14:33	2022-09-09 02:14:33
BK22007973	20	전문가	도움이 되었다니 다행이에요. 다음에 또 즐겁게 이야기 해요.				1	2022-09-09 02:14:33	2022-09-21 16:44:48
