id	utterance_id	role	text	search_query	search_URL	reference_date	terminate	regDate	updDate
BK22013668	1	질문자	나는 두리안 처음 먹어봤을 때는 별 냄새도 못 느꼈고 맛있게 먹었어. 두리안 냄새에 대한 별별 표현을 다 들어봤는데 그 냄새를 자세하게 표현한 사람 있으면 좀 알려줄래?				0	2022-09-30 15:48:32	2022-10-02 11:34:47
BK22013668	2	전문가	앤서니 버제스라는 영국 소설가는 두리안 향에 대해 변소에서 바닐라 커스터드를 먹는 것 같다고 설명했어.	두리안	https://www.dongascience.com/news.php?idx=17332	2017/03/30	0	2022-09-30 15:48:32	2022-10-02 11:34:47
BK22013668	3	질문자	와, 정말 기가 막힌 표현이다. 처음에는 맛있게 먹었는데 세 번째 경험한 두리안에서 나는 냄새와 맛은 정말 그런 느낌이었어. 나는 왜 처음에는 못 맡았던 냄새를 왜 시간이 지나고 맡을 수 있었을까?				0	2022-09-30 15:48:32	2022-10-02 11:34:47
BK22013668	4	전문가	두리안은 보통 낙과한 지 하루가 지나면 발효되기 시작하는데 그 과정에서 냄새가 풍기는 거야. 최대한 싱싱한 상태에서 먹으면 냄새 없이 즐길 수 있어.	두리안 냄새	https://www.edaily.co.kr/news/read?newsId=01531766625997864&mediaCodeNo=257&OutLnkChk=Y	2020/12/12	0	2022-09-30 15:48:33	2022-10-02 11:34:47
BK22013668	5	질문자	내가 처음 맛본 두리안은 운 좋게도 싱싱해서 냄새가 안 났던 거구나. 두리안 냄새에 얽힌 사건이 있을 것 같은데 어떤 게 있을까?				0	2022-09-30 15:48:33	2022-10-02 11:34:47
BK22013668	6	전문가	2020년 6월 어느 주말, 한적한 도시인 독일의 슈바인푸르트 시 당국에 비상이 걸렸던 적이 있어. 관내 우체국 직원들이 소포를 분류하던 중 구토 증상을 보이며 쓰러졌고, 여섯 명은 병원에 실려 가기까지 했어. 테러의 가능성을 두고 경찰과 소방관이 출동했지만, 원인은 현장에 있던 두리안이 담긴 소포였어.	두리안 공공장소	https://www.edaily.co.kr/news/read?newsId=01531766625997864&mediaCodeNo=257&OutLnkChk=Y	2020/12/12	0	2022-09-30 15:48:33	2022-10-02 11:34:47
BK22013668	7	질문자	두리안이 소포 속에서 얼마나 오래 발효됐으면 그랬을까 싶다. 두리안은 왜 그렇게 고약한 냄새를 풍기는 걸까?				0	2022-09-30 15:48:33	2022-10-02 11:34:47
BK22013668	8	전문가	동남아시아 밀림에서 주로 자라는 두리안은 일반적으로 야생동물의 먹이가 된 후 배설물과 함께 배출된 씨를 통해 번식해. 넓고 넓은 우림에서 코끼리나 유인원 등의 눈에 띄려면 강한 냄새를 자체 발산하여 유혹해야하기 때문에 이 냄새가 일종의 생존 기법이라는 게 진화론적인 설명이야.	두리안 지독한 냄새	https://www.edaily.co.kr/news/read?newsId=01531766625997864&mediaCodeNo=257&OutLnkChk=Y	2020/12/12	0	2022-09-30 15:48:33	2022-10-02 11:34:47
BK22013668	9	질문자	동물들은 그런 냄새를 좋아하는구나. 냄새만 아니면 정말 많은 사람이 호불호 없이 좋아할 맛이던데 냄새 없이 먹는 방법은 싱싱할 때 먹는 것 말고 없어?				0	2022-09-30 15:48:33	2022-10-02 11:34:47
BK22013668	10	전문가	태국에서 품종 개량에 성공해서 특유의 향을 제거한 품종의 두리안이 나왔어. 이제 두리안에 대한 소비자들의 진입 장벽이 낮아질 것으로 보여.	두리안 악취	https://www.chosun.com/international/topic/2022/07/21/QBIFQ4JJIVAWXP5NOC7FFI74YU/?utm_source=naver&utm_medium=referral&utm_campaign=naver-news	2022/07/21	0	2022-09-30 15:48:33	2022-10-02 11:34:47
BK22013668	11	질문자	나도 냄새 없는 두리안 실컷 먹어보고 싶다. 그런데 두리안은 술이랑 먹으면 큰일 난다던데 사실이야?				0	2022-09-30 15:48:33	2022-10-02 11:34:47
BK22013668	12	전문가	두리안은 알코올 음료와 함께 섭취하면 혈당이 급격하게 오르고 발열 증상과 잦은 소변 배출로 인해 탈수가 올 수도 있어. 의식을 잃거나 심하면 사망에 이를 수 있으니 알코올음료와 먹는 건 피해야 해.	두리안 사망	https://kormedi.com/1399380/%ec%97%b4%eb%8c%80%ea%b3%bc%ec%9d%bc%ec%9d%98-%ed%99%a9%ec%a0%9c-%eb%91%90%eb%a6%ac%ec%95%88-%e2%96%a1%e2%96%a1%ea%b3%bc-%eb%a8%b9%ec%9c%bc%eb%a9%b4-%ec%82%ac%eb%a7%9d%ed%95%a0-%ec%88%98%eb%8f%84/	2022/05/23	0	2022-09-30 15:48:33	2022-10-02 11:34:47
BK22013668	13	질문자	나도 두리안 먹으면 몸에서 열이 나는 것 같았는데 조심해야겠다. 너 잭 푸르트라는 과일 혹시 들어봤어?				0	2022-09-30 15:48:34	2022-10-02 11:34:47
BK22013668	14	전문가	아프리카 열대지역과 브라질, 동남아시아에서 자라는 무화과의 친척인 잭 푸르트 말하는거야? 껍질이 가시 없는 두리안과 비슷하지만, 속에는 노란 피망 같은 과일이 들어있잖아.	잭푸르트	http://www.k-health.com/news/articleView.html?idxno=47480	2020/02/28	0	2022-09-30 15:48:34	2022-10-02 11:34:47
BK22013668	15	질문자	두리안과 비슷하게 생긴 잭 프루트가 무화과의 친척이라고? 베트남에서는 밋이라고 부르더라고. 먹었을 때 정말 맛있던데 두리안이랑 어떤 차이가 있어?				0	2022-09-30 15:48:34	2022-10-02 11:34:47
BK22013668	16	전문가	밋은 세계에서 제일 크고 무거운 과일인데,  빵나무와 열매가 비슷하고 냄새도 나서 밋과 두리안을 구분하지 못하는 사람들이 많아. 그러나 밋보다 두리안 냄새가 더 구릿하고 강해. 두리안이 가시도 더 뾰족하고 모양도 길쭉한 타원형 모양이면서 맛도 달라. 밋은 과육 말고도 잎과 씨, 뿌리까지 먹을 수 있을 정도로 버릴 것이 없는 과일이야.	잭프루트 밋	http://www.joongdo.co.kr/web/view.php?key=20200417010006506	2020/04/21	0	2022-09-30 15:48:34	2022-10-02 11:34:47
BK22013668	17	질문자	과육이 너무 맛있어서 반했는데 씨와 잎, 뿌리는 어떻게 먹는지 한 번 나도 먹어보고 싶어. 베트남 여행 가게 되면 수소문해 봐야겠어.				0	2022-09-30 15:48:34	2022-10-02 11:34:47
BK22013668	18	전문가	쓰임새가 다양한 걸 보니 덩칫값을 하는 과일이네.				0	2022-09-30 15:48:34	2022-10-02 11:34:47
BK22013668	19	질문자	코코넛이 나는 나라 국민들도 코코넛은 버릴 것이 없다고 하는데 잭 프루트도 그런 과일이었어.				0	2022-09-30 15:48:34	2022-10-02 11:34:47
BK22013668	20	전문가	활용도 높은 열대과일이 또 있는지 알아보는 것도 재미있겠다.				1	2022-09-30 15:48:34	2022-10-02 11:34:47
