id	utterance_id	role	text	search_query	search_URL	reference_date	terminate	regDate	updDate
BK22003799	1	질문자	제가 요즘 채식을 좀 해보려고 고기 먹는 양을 줄였는데 먹고 싶은 걸 참았더니 더 먹고 싶네요. 어쩌면 좋죠?				0	2022-08-04 11:15:43	2022-08-12 16:57:37
BK22003799	2	전문가	그런 거라면 대체육을 사먹어 보는 건 어때요? 대체육은 비동물성 재료를 사용해서 모양과 식감을 고기와 유사하게 만든 식재료예요.	대체육	https://ko.wikipedia.org/wiki/%EB%8C%80%EC%B2%B4%EC%9C%A1	2022/05/29	0	2022-08-04 11:15:43	2022-08-04 11:15:43
BK22003799	3	질문자	오, 그런 식재료도 있군요? 고기랑 유사한 느낌이라니 저한테 너무 필요한 거예요! 근데 무슨 재료로 만든 건가요?				0	2022-08-04 11:15:43	2022-08-04 11:15:43
BK22003799	4	전문가	대체육은 일반적으로 콩단백질이나 밀가루 속에 든 글루텐 같은 식물성 재료로 만들어요. 그래서 식물성 고기라고 불리기도 하죠. 비식물성 대체육을 만들 때는 균단백질을 활용하고요.	대체육 재료	https://ko.wikipedia.org/wiki/%EB%8C%80%EC%B2%B4%EC%9C%A1	2022/05/29	0	2022-08-04 11:15:43	2022-08-12 11:16:06
BK22003799	5	질문자	아하, 콩이나 밀가루로 만드는 거군요? 어떤 맛일지 너무 궁금해요. 혹시 구하기가 어렵진 않나요?				0	2022-08-04 11:15:43	2022-08-04 11:15:43
BK22003799	6	전문가	다행히 요즘은 대체육 상품 판매가 대중화되다 보니 축산 코너에 가면 육류만 판매하던 예전과 달리 대체육 상품이 진열되어 판매되고 있어요.	대체육 구매	https://economist.co.kr/2022/07/08/industry/distribution/20220708070011676.html	2022/07/11	0	2022-08-04 11:15:43	2022-08-12 11:16:06
BK22003799	7	질문자	오, 그럼 마트에 가서 살 수 있다는 얘기네요. 너무 좋은데요? 근데 대체육은 아직까지 육고기만 나오는 편인가요?				0	2022-08-04 11:15:43	2022-08-04 11:15:43
BK22003799	8	전문가	오, 아니에요. 고기를 대체하는 식품인 대체육에 이은 대체 해산물이 있어요. 생선과 비슷한 맛을 구현하려고 이를 개발하는 스타트업들이 늘고 있죠.	대체 해산물	https://www.hankyung.com/it/article/202207148581i	2022/07/14	0	2022-08-04 11:15:43	2022-08-12 11:16:06
BK22003799	9	질문자	와, 대체 해산물이라니 어떤 식으로 구현될지 상상이 안 가네요.				0	2022-08-04 11:15:43	2022-08-04 11:15:43
BK22003799	10	전문가	현재 투자가 가장 많이 이루어지고 있는 대체 해산물은 참치예요. 참치가 세계적으로 소비량이 가장 많거든요. 스페인의 스타트업 업체인 미믹시푸드와 미국의 오션허거푸드가 개발한 식품이 있는데, 토마토를 활용해서 식물성 참치회를 만들었어요.	대체 해산물 참치	https://www.hankyung.com/it/article/202207148581i	2022/07/14	0	2022-08-04 11:15:43	2022-08-12 11:16:06
BK22003799	11	질문자	토마토로 생선 맛을 낼 수 있다니, 우리나라에도 팔게 되면 꼭 사먹어 봐야겠어요. 근데 계란은 대체 식품으로 아직 안 만들어졌나요?				0	2022-08-04 11:15:43	2022-08-16 09:11:34
BK22003799	12	전문가	미국의 잇저스트에서 개발한 식물성 대체계란을 만든 게 있어요. 녹두에서 추출한 단백질과 강황으로 만들었죠. 일반 계란이랑 단백질 함량은 같은데 콜레스테롤이 없어서 건강에 좋아요.	식물성 계란	https://www.sedaily.com/NewsView/22RLPL89DQ	2021/09/25	0	2022-08-04 11:15:43	2022-08-16 09:11:34
BK22003799	13	질문자	달걀까지 식물성으로 대체가 가능하다니, 식물성으로 못 만드는 게 없네요. 햄버거 같은 것도 만들어 먹을 수 있겠고요. 제가 워낙 햄버거를 좋아했어서 자주 사먹었는데 채식 생활하면서 안 먹은 지 꽤 됐거든요.				0	2022-08-04 11:15:43	2022-08-12 11:16:06
BK22003799	14	전문가	앗, 혹시 정크 푸드인 패스트푸드를 파는 업체들도 비건 식품 시장에 진입하기 시작한 거 알고 계세요? 대표적으로 신세계푸드에서 만든 노브랜드버거가 있어요.	패스트푸드 비건	https://www.hankyung.com/economy/article/2022021710351	2022/02/18	0	2022-08-04 11:15:43	2022-08-16 09:11:34
BK22003799	15	질문자	우와, 너무 좋은 정보네요! 안 그래도 요즘 햄버거가 너무 먹고 싶었는데 이제 참지 않아도 된다는 게 너무 좋네요! 밖에서 먹을 수 있는 채식 요리를 하나 찾기도 했고요!				0	2022-08-04 11:15:44	2022-08-12 11:16:06
BK22003799	16	전문가	만약 밖에서도 채식을 더 많이 하고 싶다면 서울시에서 제공하는 채식 음식점 정보를 활용해 봐요. 온라인 지도서비스 형태로 제공되는데 각 음식점들과 채식 메뉴 정보를 확인할 수 있어요.	채식한끼 앱	http://www.seoulfocus.kr/news/articleView.html?idxno=116566	2022/07/05	0	2022-08-04 11:15:44	2022-08-12 11:16:06
BK22003799	17	질문자	와, 저한텐 너무 꿀 같은 팁이네요!				0	2022-08-04 11:15:44	2022-08-04 11:15:44
BK22003799	18	전문가	시에서 관리해 주니 믿음도 가고 좋죠.				0	2022-08-04 11:15:44	2022-08-04 11:15:44
BK22003799	19	질문자	너무 좋은 정보예요. 고마워요! 나름 마음 먹고 시작한 채식이라 금방 포기하고 싶지 않았는데 덕분에 게속 시도해 볼 수 있겠어요.				0	2022-08-04 11:15:44	2022-08-04 11:15:44
BK22003799	20	전문가	별 말씀을요. 이런 정보들이 도움이 되었다면 너무 다행이죠. 즐거운 채식 생활하길 바랄게요!				1	2022-08-04 11:15:44	2022-08-16 09:11:34
