id	utterance_id	role	text	search_query	search_URL	reference_date	terminate	regDate	updDate
BK22001646	1	질문자	지난번에 얻어 마셨으니 오늘은 내가 커피 살게요. 어떤 거로 마실래요?				0	2022-07-20 16:18:07	2022-08-02 12:01:32
BK22001646	2	전문가	그럼 나는 아이스 라떼요. 아, 우유 말고 오트밀크 옵션으로 해줄래요?				0	2022-07-20 16:18:07	2022-07-21 10:47:40
BK22001646	3	질문자	오트밀크는 뭐예요? 우유 대신 아몬드 밀크로 변경하는 경우는 봤는데.				0	2022-07-20 16:18:07	2022-08-02 12:01:32
BK22001646	4	전문가	아몬드 밀크랑 마찬가지로 요즘 많이 각광 받는 식물성 우유예요. 아몬드 밀크는 비타민 E가 많다면, 오트밀크는 귀리로 만든 식물성 음료라 베타글루칸이라는 수용성 식이섬유가 많아요. 요즘 프랜차이즈 커피 전문점 뿐만 아니라 동네 카페에도 옵션으로 많더라고요.	오트밀크	http://www.realfoods.co.kr/view.php?ud=20220511000132	2022/05/11	0	2022-07-20 16:18:07	2022-07-21 10:47:40
BK22001646	5	질문자	항상 보면 우유 말고 식물성 대체 우유로 바꿔 드시네요. 특별한 이유가 있는 거예요?				0	2022-07-20 16:18:07	2022-08-02 12:01:32
BK22001646	6	전문가	제가 유당 불내증이 있어서 우유를 마시면 자주 배탈이 나거든요. 그리고 2년전부터 채식을 하고 있기도 해요. 예전보다 많이 대중화 되어서 요즘엔 카페를 갈 때마다 자주 보이더라고요.	식물성우유	https://m.sedaily.com/NewsView/265SV46EUB#cb	2022/05/01	0	2022-07-20 16:18:07	2022-07-21 10:47:40
BK22001646	7	질문자	아, 생각해보니 항상 육류가 아닌 야채나 해산물을 위주로 드셨던 것 같아요. 해산물이나 계란은 드시나요?				0	2022-07-20 16:18:07	2022-08-02 12:01:32
BK22001646	8	전문가	네, 사회생활 하다보니 완전 채식주의자인 비건으로 살아가긴 어렵더라고요. 비건은 계란이나 생선, 우유, 꿀까지 동물성 식품을 완전히 배제하니까. 그래도 최대한 피하고 있죠.	베지테리언	https://www.esocialtimes.com/news/articleView.html?idxno=26128	2022/06/17	0	2022-07-20 16:18:07	2022-07-21 10:47:40
BK22001646	9	질문자	그래도 요즘 한국에도 채식을 지향하는 사람들이 많아진 것 같아요. 식물성 음료도 그렇고, 베지테리언을 위한 음식들도 꽤 보이던데요?				0	2022-07-20 16:18:07	2022-08-02 12:01:32
BK22001646	10	전문가	맞아요, 최근 식품 소비의 트렌드가 환경보호, 가치소비이다 보니 비건식품이나 대체육 시장이 굉장히 빠르게 커졌어요. 대체육 시장 규모만 봐도 20년에는 60.7억 달러였는데, 25년쯤에는 110.3억달러까지 성장할 것으로 보이거든요. 혹시 먹어본 적 있어요?	비건 대체음식	http://www.foodnews.news/mobile/article.html?no=488789	2022/04/01	0	2022-07-20 16:18:07	2022-07-21 10:47:40
BK22001646	11	질문자	대체육은 아직 먹어본 적 없어요. 아직 선뜻 도전하기가 어렵달까. 그럼 콩으로 만드는 건가요?				0	2022-07-20 16:18:07	2022-08-02 12:01:32
BK22001646	12	전문가	음, 크게 보면 식물성 대체육, 균류 단백질 식품, 배양육과 곤충 단백질 식품, 해조류 단백질 식품으로 나뉘는데 역시 가장 대중적인건 콩이나 밀,버섯이나 호박 같은 식물에서 추출한 단백질로 만드는거죠. 먹어보면 나쁘지만은 않을 거예요. 최근에는 개발이 굉장히 많이 되어서 맛이나 질감이 많이 발전했거든요. 예전의 콩고기랑은 많이 다르죠.	대체육	https://magazine.hankyung.com/money/article/202206201032c	2022/06/27	0	2022-07-20 16:18:07	2022-07-21 10:47:40
BK22001646	13	질문자	큰 기업들에서도 관련 식품이 많이 나오던데 한번 도전해봐야겠네요. 그런데 채식하시고 몸에 무리는 안 가요? 지겹게 들었겠지만 단백질 섭취라든지, 뭐 그런거요.				0	2022-07-20 16:18:07	2022-08-02 12:01:32
BK22001646	14	전문가	채식한다고 하면 다들 한 번씩 꼭 물어보더라고요. 근데 많은 사람들이 간과하고 있는 사실이, 동물성 단백질 외에도 양질의 단백질을 섭취할 수 있는 식품은 많거든요. 아까 말한 귀리에도 100그램 당 17그램 정도의 단백질이 들어있어요. 심지어 브로콜리에도 단백질이 들어있는걸요.	식물성 고단백식품	https://kormedi.com/1383304/달걀-고기-외에도단백질-많은-식물성-식품-13/	2022/02/25	0	2022-07-20 16:18:07	2022-07-21 10:47:40
BK22001646	15	질문자	귀리랑 브로콜리에도 단백질이 들어있어요? 식물성 단백질 하면 콩이나 두부만 알았지 그런건 몰랐네요. 환경적인 측면에서도 이점이 많죠?				0	2022-07-20 16:18:07	2022-08-02 12:01:32
BK22001646	16	전문가	그럼요, 생각보다 공장식 축산업이 환경에 미치는 악영향이 굉장히 커요. 세계 온실가스 배출량의 14.5퍼센트가 공장식 축산업에서 발생되는 거 알아요? 그정도면 전체 탄소 배출량으로 봤을때 두 번째로 큰 배출량이에요. 또, 한 사람만 육류나 유제품의 소비를 줄여도 최대 73퍼센트까지 탄소발자국 발생을 줄일 수 있다는 연구결과도 있죠.	채식 환경보호	https://www.greened.kr/news/articleView.html?idxno=292253	2021/10/20	0	2022-07-20 16:18:07	2022-07-21 10:47:40
BK22001646	17	질문자	와, 그 정도 수치면 정말 어마어마한 거네요. 이참에 나도 한번 도전해볼까 봐요. 종종 육식을 즐기긴 하지만 못 먹어서 너무 힘든 정도는 아니거든요.				0	2022-07-20 16:18:07	2022-08-02 12:01:32
BK22001646	18	전문가	이 기회에 실천해보는것도 나쁘지 않죠. 완벽한 채식을 할 필요는 없으니 상황에 따라 유연하게 해보는 건 어때요? 채식 위주의 식단으로 가되 육식을 금지하지는 않는거죠. 그런걸 플렉시테리언이라고 말하는데 자연스럽게 육류 섭취는 줄이고, 채소와 과일을 많이 먹게 되니 몸의 컨디션도 좋아질껄요?	플렉시테리언	https://www.ftimes.kr/news/articleView.html?idxno=13880	2021/10/26	0	2022-07-20 16:18:07	2022-07-21 10:47:40
BK22001646	19	질문자	그거 처음 시작하기에 좋은 방식이네요. 앞으로 식단을 최대한 채식 위주로 구성해봐야겠어요. 그런 의미에서 나도 오트밀크로 변경한 아이스 라떼 마셔볼래요.				0	2022-07-20 16:18:07	2022-08-02 12:01:32
BK22001646	20	전문가	그렇게 천천히 작은 것부터 도전해보는거죠. 입맛에 맞았으면 좋겠네요.				1	2022-07-20 16:18:07	2022-07-22 11:55:13
