id	utterance_id	role	text	search_query	search_URL	reference_date	terminate	regDate	updDate
BK22003135	1	질문자	여보세요? 나 지금 집에 들어가는 길인데 탄산수를 사가려고. 날이 더워서 그런지 탄산이 자꾸 생각나.				0	2022-08-04 11:09:44	2022-09-18 11:26:59
BK22003135	2	전문가	아마도 탄산수의 톡 쏘는 맛 덕분에 청량감이 느껴져서 자주 찾나봐. 요즘 다양하게 잘 나오던데? 맛도 여러가지로 나뉘고.				0	2022-08-04 11:09:44	2022-09-18 11:26:59
BK22003135	3	질문자	요즘 여러 회사에서 탄산수를 만드는데, 새로운 것을 많이 접할 수 있어 신기해. 탄산수 종류가 어떻게 이렇게 다양할 수 있을까?				0	2022-08-04 11:09:44	2022-09-20 12:47:37
BK22003135	4	전문가	요즘 탄산수 제조사들은 탄산수에 인공적인 맛을 첨가해서 종류가 더 풍부해졌다고 봐.	탄산수 인공맛	https://kormedi.com/1344985/%ec%9e%a5%ec%a0%90-%eb%a7%8e%ec%9d%80-%ed%83%84%ec%82%b0%ec%88%98%ed%94%bc%ed%95%b4%ec%95%bc-%eb%90%a0-%ec%82%ac%eb%9e%8c%ec%9d%80/	2021/07/08	0	2022-08-04 11:09:44	2022-09-20 11:42:25
BK22003135	5	질문자	덕분에 골라서 먹는 재미가 생긴 것 같아. 그런데 왜 갑자기 인공적인 맛을 여러가지로 더했을까?				0	2022-08-04 11:09:44	2022-09-20 12:47:37
BK22003135	6	전문가	음, 판매를 높이려는 이유 때문이 아닐까? 요즘 탄산수 업계에서는 시장점유율을 확대하려고 신제품을 출시하거나 마케팅을 강화하고 있어. 웅진식품에서는 빅토리아 수박맛을 내놓았는데 뒤이어 배맛까지 선보이며 제품 라인업을 늘렸지.	탄산수 배맛	https://www.mk.co.kr/news/business/view/2019/08/607497/	2019/08/07	0	2022-08-04 11:09:44	2022-09-18 11:26:59
BK22003135	7	질문자	그러게, 생각해보니 예전에 비해 탄산수 시장이 많이 커진 것 같긴 해. 브랜드도 많아지고 맛 종류도 다양해진게 보이거든. 탄산수의 가장 큰 장점이 뭐라고 생각해?				0	2022-08-04 11:09:44	2022-09-20 12:47:37
BK22003135	8	전문가	음, 아무래도 건강한 성분 아닐까? 탄산수는 일반 탄산음료보다는 저당과 저칼로리잖아. 그래서 탄산수를 찾는 수요도 빠르게 늘고, 덩달아 탄산수 시장이 빠르게 성장했다고 볼 수 있지.	탄산수 시장 성장	http://thepublic.kr/news/newsview.php?ncode=1065596337002890	2021/06/23	0	2022-08-04 11:09:44	2022-09-18 11:26:59
BK22003135	9	질문자	그런데 코로나 이후 탄산수 시장이 더 확대된 듯한 느낌이야. 너도 그렇게 느껴?				0	2022-08-04 11:09:44	2022-09-20 12:47:37
BK22003135	10	전문가	응. 실제로도 탄산수 시장이 확대된 것에 코로나19 영향이 크긴 해. 집밥족이나 혼술족이 늘면서 각 가정에서도 탄산수를 즐겨 마시게 됐거든.	탄산수 코로나 인기	https://www.mk.co.kr/news/business/view/2021/06/606977/	2021/06/23	0	2022-08-04 11:09:44	2022-09-18 11:26:59
BK22003135	11	질문자	그런데 탄산수를 물 대신 자주 마셔도 되나 싶어. 아무래도 탄산이 들어가있다 보니 물이랑은 좀 다른 것 같아서. 주의해야 할 것이 있을까?				0	2022-08-04 11:09:44	2022-09-20 12:47:37
BK22003135	12	전문가	탄산수는 물에 이산화탄소를 주입해 만든 제품이라 약산성을 띄고 있어. 이런 약산성 음료를 물처럼 과도하게 섭취하면 우선 치아가 약해질 수 있어 주의가 필요하지.	탄산수 물	https://health.chosun.com/site/data/html_dir/2022/05/02/2022050202075.html	2022/05/03	0	2022-08-04 11:09:44	2022-08-04 11:09:44
BK22003135	13	질문자	아, 그리고 탄산수를 먹으면 배에 가스가 많이 차더라고. 혹시 이것도 몸에 안좋은 영향을 미칠까?				0	2022-08-04 11:09:44	2022-09-20 12:47:37
BK22003135	14	전문가	응, 물론이지. 탄산수를 과도하게 섭취할 경우 가스가 차 복부 팽만이나 역류성 식도염을 유발할 수 있어 조심해야 해.	탄산수 가스	https://www.mk.co.kr/news/culture/view/2021/10/959630/	2021/10/10	0	2022-08-04 11:09:44	2022-09-18 11:26:59
BK22003135	15	질문자	탄산수를 마실 때 첫입은 정말 상쾌하고 좋은데 늘 배가 아팠었거든. 역시 이유가 있었구나. 과하게 마실 경우 어떤 질병이 생길 수 있는지도 알려주라.				0	2022-08-04 11:09:44	2022-09-20 12:47:37
BK22003135	16	전문가	응. 탄산수는 과하게 마시면 가스 때문에 위가 자극을 받거든. 위가 자극을 받으면 위궤양 뿐만 아니라 역류성 식도염과 치아 부식도 겪을 수 있어서 과하게 마시는건 좋지 않아.	탄산수 식도염	https://www.nbntv.co.kr/news/articleView.html?idxno=862344	2020/03/03	0	2022-08-04 11:09:44	2022-09-20 12:47:37
BK22003135	17	질문자	그래도 탄산수가 다이어트에 도움이 된다는 이야기를 들어서 포기할 수는 없을 것 같아. 혹시 탄산수가 체중감량에 어떤 도움이 되는지도 알고 있어?				0	2022-08-04 11:09:44	2022-09-20 12:47:37
BK22003135	18	전문가	탄산수는 탄산음료랑 다르게 당분과 열량이 없어서 다이어트에 도움이 될 수는 있어. 그런데 체중감량에 직접적인 도움은 주는 것이 아니니까 과하게 마시는 건 지양하는게 좋아.	탄산수 부작용	https://www.dailysecu.com/news/articleView.html?idxno=94118	2020/01/08	0	2022-08-04 11:09:44	2022-08-08 08:20:34
BK22003135	19	질문자	역시 그냥 물을 마시는게 제일 좋은 방법인 것 같아. 알려줘서 고마워.				0	2022-08-04 11:09:44	2022-08-04 11:09:44
BK22003135	20	전문가	응, 무엇이든 적당한게 가장 좋지. 나중에 새로운 맛 탄산수가 출시되면 알려줘. 그리고 집에 조심히 들어가고.				1	2022-08-04 11:09:44	2022-09-20 12:47:37
