id	utterance_id	role	text	search_query	search_URL	reference_date	terminate	regDate	updDate
BK22000053	1	질문자	탄산음료를 줄이고 싶은데 대체해서 마실 수 있는 음료가 뭐가 있을까?				0	2022-07-20 16:03:42	2022-08-02 12:01:32
BK22000053	2	전문가	콤부차 어때? 요즘 쉽게 구할 수 있고 맛도 좋거든.				0	2022-07-20 16:03:42	2022-07-21 09:19:11
BK22000053	3	질문자	오, 콤부차가 뭐야? 처음 들어보는 음료라서 더 궁금하다.				0	2022-07-20 16:03:42	2022-08-02 12:01:32
BK22000053	4	전문가	콤부차는 설탕을 넣은 녹차나 홍차에 유익균을 넣어 발효시킨 음료야. 시큼하면서도 달콤한 식초 맛과 향이 나고, 발효 과정에서 탄산이 생성돼 마실 때 청량감이 느껴지지.	콤부차 음료	https://www.asiatoday.co.kr/view.php?key=20210305001943509	2021/03/05	0	2022-07-20 16:03:42	2022-07-21 09:19:11
BK22000053	5	질문자	아하, 유익균을 넣어 발효시킨 음료라고 하니까 몸에 좋을 것 같은데?				0	2022-07-20 16:03:42	2022-08-02 12:01:32
BK22000053	6	전문가	맞아. 콤부차에는 여러 효능이 있는데 가장 대표적인 것은 항염작용이야. 그리고 폐에도 좋은 음식으로 알려져 있어. 손상된 세포를 복구하는데 효능을 보이지.	콤부차 효능	https://www.dailysecu.com/news/articleView.html?idxno=60564	2021/07/30	0	2022-07-20 16:03:42	2022-07-21 09:19:11
BK22000053	7	질문자	마셔보고 싶은데, 혹시 추천하는 브랜드 제품 있어?				0	2022-07-20 16:03:42	2022-08-02 12:01:32
BK22000053	8	전문가	요즘 티젠에서 나온 콤부차를 쉽게 구할 수 있더라. 상큼한 과즙감에 시원하고 청량감이 뛰어난 탄산이 돋보여. 그리고 무엇보다 저칼로리여서 다이어트 중에도 마실 수 있지.	콤부차 칼로리	https://news.mt.co.kr/mtview.php?no=2022061617002239117	2022/06/16	0	2022-07-20 16:03:42	2022-07-21 09:19:11
BK22000053	9	질문자	과즙감이라고 하면 과일맛이 날 것 같은데?				0	2022-07-20 16:03:42	2022-08-02 12:01:32
BK22000053	10	전문가	맞아. 티젠 콤부차는 세계 최초 분말 스틱형 제품인데 최근 1억 스틱 판매를 돌파했어. 맛은 레몬, 베리, 유자, 피치 등 다양하게 구성되어 있어서 취향에 따라 골라 마시면 돼.	티젠 콤부차	https://news.mt.co.kr/mtview.php?no=2022050916434376216	2022/05/09	0	2022-07-20 16:03:42	2022-07-21 09:19:11
BK22000053	11	질문자	오, 좋다. 티젠 콤부차를 한번 마셔봐야겠어. 그런데 콤부차는 갑자기 왜 국내 시장에서 유행하게 된거야?				0	2022-07-20 16:03:42	2022-08-02 12:01:32
BK22000053	12	전문가	음, 사실 콤부차는 미국에서는 2012년부터 헐리웃 유명인사들의 다이어트 음료로 소개되며 선풍적인 인기를 끌었어. 우리나라에서는 20년 전 고 현대 정주영 회장의 건강 비결로 소개되며 화제가 된 적 있었지. 그러다가 최근들어 현대인의 식습관이 바뀌고 장내 건강이 부각되며 콤부차 같은 건강 음료가 다시 입소문을 타기 시작한거야.	콤부차 유행	https://platum.kr/archives/105649	2018/09/11	0	2022-07-20 16:03:42	2022-07-21 09:19:11
BK22000053	13	질문자	그럼 카페에서도 쉽게 콤부차를 맛볼 수 있겠다.				0	2022-07-20 16:03:42	2022-08-02 12:01:32
BK22000053	14	전문가	맞아. 요즘 음료나 커피프랜차이즈 업체들도 콤부차 신제품을 내놓아서 어딜가나 쉽게 접할 수 있어.	콤부차 인기	https://www.mk.co.kr/news/culture/view/2021/09/849855/	2021/09/02	0	2022-07-20 16:03:42	2022-07-21 09:19:11
BK22000053	15	질문자	카페인에 민감한 사람도 이제 카페에서 커피 대신 콤부차를 마시면 되겠네.				0	2022-07-20 16:03:42	2022-08-02 12:01:32
BK22000053	16	전문가	음, 아냐. 콤부차는 사실 카페인과 알코올이 함유되어 있어서 카페인에 민감한 사람은 부작용이 나타날 수 있기 때문에 주의가 필요해.	콤부차 카페인	http://weekly.chosun.com/news/articleView.html?idxno=17333	2021/05/13	0	2022-07-20 16:03:42	2022-07-21 09:19:11
BK22000053	17	질문자	몸에 건강하다기에 당연히 카페인이 없을 줄 알았어.				0	2022-07-20 16:03:42	2022-08-02 12:01:32
BK22000053	18	전문가	그리고 콤부차를 과도하게 마시면 치아가 침식될 위험도 있어. 콤부차는 발효음료다 보니 발효 도중에 아세트산과 같은 산을 생성하거든? 그런데 이 아세트산은 식초에서 발견되는 산과 같은 종류고, 이게 치아를 부식 시킬 수 있어. 톡 쏘는 맛이 좋더라도 조심해야하지.	콤부차 부작용	https://www.hidoc.co.kr/healthstory/news/C0000597695	2021/04/20	0	2022-07-20 16:03:42	2022-07-21 09:19:11
BK22000053	19	질문자	건강에 좋다는 이야기를 들어서 다다익선일 줄 알았는데 역시 적당히 마셔야겠네.				0	2022-07-20 16:03:42	2022-08-02 12:01:32
BK22000053	20	전문가	맞아. 무엇이든 과하게 접하면 탈이 나는 것 같아. 나중에 맛있는 콤부차 있으면 소개시켜줄게.				1	2022-07-20 16:03:42	2022-07-21 09:55:09
