id	utterance_id	role	text	search_query	search_URL	reference_date	terminate	regDate	updDate
BK22001366	1	질문자	나 요즘 다이어트 중인데 치킨이 너무 먹고 싶어. 치킨 칼로리가 어느 정돈가?				0	2022-07-20 16:15:41	2022-08-02 12:01:32
BK22001366	2	전문가	다이어트 중에 치킨 참기 힘들지. 치킨은 닭다리 1조각 기준으로 300칼로리 정도 돼.	치킨 칼로리	https://www.edaily.co.kr/news/read?newsId=01085686629248016&mediaCodeNo=257&OutLnkChk=Y	2021/11/21	0	2022-07-20 16:15:41	2022-07-21 10:29:05
BK22001366	3	질문자	칼로리가 너무 높은데, 아무래도 먹으면 안되겠지?				0	2022-07-20 16:15:41	2022-08-02 12:01:32
BK22001366	4	전문가	치킨은 튀김옷 때문에 칼로리가 높으니까, 튀김옷 없는 구운 치킨을 먹어봐.	구운 치킨	https://www.harpersbazaar.co.kr/article/63390	2022/01/27	0	2022-07-20 16:15:41	2022-07-21 10:29:05
BK22001366	5	질문자	그러기엔 튀긴 치킨이 너무 먹고 싶은데, 그냥 참아야겠어.				0	2022-07-20 16:15:41	2022-08-02 12:01:32
BK22001366	6	전문가	그래, 오늘은 시간이 늦었으니 다음에 꼭 먹어.				0	2022-07-20 16:15:41	2022-07-21 10:29:05
BK22001366	7	질문자	우리나라에는 맛있는 치킨이 너무 많은 게 문제야.				0	2022-07-20 16:15:41	2022-08-02 12:01:32
BK22001366	8	전문가	거의 한국인의 소울푸드지. 우리나라 치킨이 맛있다고 해외에도 소문이 났잖아.	한국 치킨	http://www.sisajournal.com/news/articleView.html?idxno=240632	2022/06/22	0	2022-07-20 16:15:41	2022-07-21 10:29:05
BK22001366	9	질문자	치킨은 미국이 원조 아니야? 한국엔 어떻게 들어온 거야?				0	2022-07-20 16:15:41	2022-08-02 12:01:32
BK22001366	10	전문가	우리나라에는 한국 전쟁 이후에 미군을 통해서 치킨이 유입된 걸로 추정해.	치킨	https://ko.wikipedia.org/wiki/%EC%B9%98%ED%82%A8_(%ED%95%9C%EA%B5%AD_%EC%9D%8C%EC%8B%9D)	2022/06/17	0	2022-07-20 16:15:41	2022-07-21 10:29:05
BK22001366	11	질문자	아 그렇구나, 그때부터 치킨이 대중적이었어?				0	2022-07-20 16:15:41	2022-08-02 12:01:32
BK22001366	12	전문가	아니, 처음에는 비싼 닭값이랑 기름 등 문제들로 대중화되지 못하다가 1960년대에 전기구이 통닭이 등장하면서 치킨이 대중화되기 시작했어.	전기구이 통닭	http://www.munhwa.com/news/view.html?no=2020090301031812000001	2020/09/03	0	2022-07-20 16:15:41	2022-07-21 10:29:05
BK22001366	13	질문자	아 전기구이 통닭도 매력있지. 그럼 우리가 아는 튀긴 치킨은 언제 처음 판매된거야?				0	2022-07-20 16:15:41	2022-08-02 12:01:32
BK22001366	14	전문가	우리한테 익숙한 치킨은 1977년에 림스치킨에서 처음 판매하기 시작했어.	림스치킨	https://kizmom.hankyung.com/news/view.html?aid=201608250038o	2016/08/25	0	2022-07-20 16:15:41	2022-07-21 10:29:05
BK22001366	15	질문자	아직도 있는 치킨 프렌차이즈잖아, 엄청 오래된 곳이었구나.				0	2022-07-20 16:15:42	2022-08-02 12:01:32
BK22001366	16	전문가	응, 그렇게 지금은 전국에 외식 프랜차이즈 가맹점 중에 20퍼센트 이상으로 가장 많이 차지하는 게 치킨집일 정도로 대중화되었지.	전국 치킨집	http://news.kmib.co.kr/article/view.asp?arcid=0924220822&code=11171211&cp=nv	2021/12/02	0	2022-07-20 16:15:42	2022-07-21 10:29:05
BK22001366	17	질문자	한국인들은 정말 치킨에 진심인 것 같아. 나도 조만간 꼭 먹어야지.				0	2022-07-20 16:15:42	2022-08-02 12:01:32
BK22001366	18	전문가	한 2주에 한 번 먹고 싶었던 음식 먹는 날인 치팅데이를 잡아서 먹어.	치팅데이	http://www.kihoilbo.co.kr/news/articleView.html?idxno=835467	2019/11/10	0	2022-07-20 16:15:42	2022-07-21 10:29:05
BK22001366	19	질문자	응 그래야겠어. 그 날만 기다리면서 열심히 다이어트 해야지.				0	2022-07-20 16:15:42	2022-08-02 12:01:32
BK22001366	20	전문가	마음가짐이 아주 독하네, 다이어트 꼭 성공하길 바랄게.				1	2022-07-20 16:15:42	2022-07-22 10:49:53
