id	utterance_id	role	text	search_query	search_URL	reference_date	terminate	regDate	updDate
BK22008685	1	질문자	요즘 마트를 다녀보면 야채 가격이 너무 올랐더라고요.				0	2022-09-16 22:33:33	2022-09-16 22:33:33
BK22008685	2	전문가	맞아요, 배추 가격도 무척 올랐어요.				0	2022-09-16 22:33:33	2022-09-16 22:33:33
BK22008685	3	질문자	배추 가격이 올라서 김치 완제품을 구입하려 해도 물건이 많이 없어서 불편하기도 하더라고요. 왜 완제품 김치 물량이 이렇게 없을까요?				0	2022-09-16 22:33:33	2022-09-16 22:33:33
BK22008685	4	전문가	말씀하신대로 배추 가격때문이죠. 김치를 직접 담그는 것보다 포장김치를 사먹는 게 싸다고 생각하는 사람들이 많아져서 포장김치가 품절되고 있는 거예요.	포장김치	https://www.hankyung.com/economy/article/202209164372i	2022/09/16	0	2022-09-16 22:33:33	2022-09-27 13:18:39
BK22008685	5	질문자	그렇군요, 배추 가격이 작년보다 얼마만큼 오른 거죠?				0	2022-09-16 22:33:33	2022-09-27 13:18:39
BK22008685	6	전문가	배추 도매가격은 올해엔 10㎏에 3만4천240원인데, 작년과 비교해봤을 때 2.3배 오른 수치예요.	배추 가격	https://www.nocutnews.co.kr/news/5818130	2022/09/15	0	2022-09-16 22:33:33	2022-09-27 13:18:39
BK22008685	7	질문자	상당히 많이 올랐군요, 그럼 김치에 들어가는 부재료는 가격이 올랐나요, 내렸나요?				0	2022-09-16 22:33:33	2022-09-16 22:33:33
BK22008685	8	전문가	김치 부재료도 크게 올랐어요. 무는 올해엔 20㎏에 2만7천580원으로 작년과 대비하면 2.5배가 올랐어요.	김치 재료 가격	https://www.nocutnews.co.kr/news/5818130	2022/09/15	0	2022-09-16 22:33:33	2022-09-16 22:33:33
BK22008685	9	질문자	정말 김치의 가격이 오를 수밖에 없는 구조네요. 그럼 마트에 납품되는 김치 브랜드들의 가격은 얼마만큼 올랐는지 알고 계시나요?				0	2022-09-16 22:33:33	2022-09-27 13:18:39
BK22008685	10	전문가	종가집 김치는 10월 1일부터 평균 9.8%정도 가격이 오를 예정이에요. 비비고 김치는 평균적으로 11.0% 정도 오르고요.	종가집 김치 가격	http://www.busan.com/view/busan/view.php?code=2022091607173117945	2022/09/16	0	2022-09-16 22:33:33	2022-09-27 13:18:39
BK22008685	11	질문자	그렇군요, 근데 최근에 이렇게 배추 가격이 많이 오른 이유가 뭐죠?				0	2022-09-16 22:33:33	2022-09-16 22:33:33
BK22008685	12	전문가	현재 수확되는 배추는 강원도 고랭지에서 생산되는 여름 배추인데, 최근에 비가 자주 내려서 기후가 배추 생육에 불리한 조건이었기 때문이에요.	배추 가격 인상	https://www.ajunews.com/view/20220915162651935	2022/09/15	0	2022-09-16 22:33:33	2022-09-16 22:33:33
BK22008685	13	질문자	그럼 언제부터 다시 가격이 안정화될까요?				0	2022-09-16 22:33:33	2022-09-16 22:33:33
BK22008685	14	전문가	이번 달 말부터 준고랭지 배추 수확이 시작되니 전보다 공급량이 증가할 테고, 그럼 다음 달부터 배추 가격이 안정세에 접어들 것으로 예측하고 있어요.	배추 가격 안정	https://www.donga.com/news/Economy/article/all/20220915/115470630/1	2022/09/15	0	2022-09-16 22:33:33	2022-09-27 13:18:39
BK22008685	15	질문자	그렇군요, 근데 이렇게 상황이 안 좋다 보니 최근 중국산 김치를 수입하는 경우도 늘고 있다면서요?				0	2022-09-16 22:33:33	2022-09-27 13:18:39
BK22008685	16	전문가	네, 맞아요. 올해 8월까지 중국산 김치를 수입한 규모는 1억986만2천달러인데, 작년 8월까지의 금액과 비교해보면 27.6% 증가한 수준이에요.	중국산 김치 수입	https://www.yna.co.kr/view/AKR20220915162100003?section=economy/all	2022/09/16	0	2022-09-16 22:33:33	2022-09-27 13:18:39
BK22008685	17	질문자	근데 중국산 김치는 인식이 안 좋아서 소비자들이 안 찾지 않나요? 주로 어디서 소비되는 건가요?				0	2022-09-16 22:33:33	2022-09-27 13:18:39
BK22008685	18	전문가	금전적으로 압박에 시달리는 식당과 같은 외식 업체를 중심으로 수요가 늘어나고 있어요.	중국산 김치	https://www.dailian.co.kr/news/view/1151761?watchtype=pc	2022/09/14	0	2022-09-16 22:33:33	2022-09-27 13:18:39
BK22008685	19	질문자	그렇군요, 다 각자의 사정이 있을 테니 뭐라 할 순 없지만 어서 빨리 상황이 나아져서 국산 김치가 다시 식탁 위에 올랐으면 좋겠네요.				1	2022-09-16 22:33:33	2022-09-27 13:18:39
BK22008685	20	전문가	맞아요, 다음에 시간 되시면 같이 장 보러 가서 김치 가격이 어떻게 바뀌었는지 알아보도록 해요, 다음에 봬요!				0	2022-09-16 22:33:33	2022-09-27 13:18:39
