id	utterance_id	role	text	search_query	search_URL	reference_date	terminate	regDate	updDate
BK22008217	1	질문자	시골 할머니 댁에 갔더니 메주를 천장에 매달아 두셨더라고요. 그렇게 메주를 말려서 된장을 만드는 거죠?				0	2022-09-13 21:49:18	2022-09-13 21:49:18
BK22008217	2	전문가	맞아요, 메주는 된장이나 고추장, 간장 등의 장을 담그는 데 쓰이는 기본적인 재료예요. 삶은 콩을 절구에 찧은 후 덩이로 뭉쳐서 발효와 숙성을 거치도록 말린 것이죠.	메주	https://ko.wikipedia.org/wiki/%EB%A9%94%EC%A3%BC	2022/02/27	0	2022-09-13 21:49:18	2022-09-13 21:49:18
BK22008217	3	질문자	메주로 된장뿐만 아니라 간장과 고추장도 만들 수 있군요. 간장은 메주로 어떻게 만드는 거예요?				0	2022-09-13 21:49:18	2022-09-23 15:18:30
BK22008217	4	전문가	콩으로 만든 메주를 소금물에 넣어 숙성을 시킨 후 그 건더기로 된장을 만들고, 건더기를 제외한 장액으로 간장을 만들어요.	간장 만드는 법	http://www.kdpress.co.kr/news/articleView.html?idxno=110943	2022/02/28	0	2022-09-13 21:49:18	2022-09-13 21:49:18
BK22008217	5	질문자	메주를 숙성시켜서 동시에 된장과 간장을 만들 수 있군요. 간장도 여러가지 종류가 있죠?				0	2022-09-13 21:49:18	2022-09-13 21:49:18
BK22008217	6	전문가	맞아요, 한국 간장의 경우 대개 개량 간장과 한식 간장으로 구분해요. 그 밖에 제주도의 어간장도 있는데, 어간장은 물고기의 단백질을 이용해서 만들죠.	간장의 종류	https://ko.wikipedia.org/wiki/%EA%B0%84%EC%9E%A5	2022/08/24	0	2022-09-13 21:49:18	2022-09-13 21:49:18
BK22008217	7	질문자	물고기로 만드는 간장도 있다니 놀랍네요. 어간장에 대해서 자세히 설명해 주실 수 있나요?				0	2022-09-13 21:49:18	2022-09-13 21:49:18
BK22008217	8	전문가	어간장은 한국의 대표적인 수산발효식품으로, DHA와 칼슘, 아미노산이 풍부하게 들어 있어요. 청정 제주 10대 우수 상품으로도 꼽히는 간장이죠.	어간장	https://www.mk.co.kr/news/business/view/2013/04/273695/	2013/04/15	0	2022-09-13 21:49:18	2022-09-13 21:49:18
BK22008217	9	질문자	요리를 할 때 어간장을 한 번 사용해 봐야겠네요. 그러면 고추장은 어떻게 메주로 만드는 거예요?				0	2022-09-13 21:49:18	2022-09-13 21:49:18
BK22008217	10	전문가	고추장을 만들 때는 고춧가루를 주 재료로 하여 메주와 찹쌀 등을 섞어서 만들어요.	고추장	http://www.gnnews.co.kr/news/articleView.html?idxno=498119	2022/04/12	0	2022-09-13 21:49:18	2022-09-13 21:49:18
BK22008217	11	질문자	메주 하나로 여러가지 장을 만들 수 있다니 신기하네요. 그렇다면 고추장, 된장, 간장 이외에 또 다른 장도 있어요?				0	2022-09-13 21:49:18	2022-09-13 21:49:18
BK22008217	12	전문가	삶은 콩을 발효시켜서 만드는 속성 장인 청국장이 있죠. 청국장은 납두균이 생기도록 만드는 장인데, 담가서 2일에서 3일이면 먹을 수 있어요. 발효시켜서 먹기까지 수개월이 필요한 된장과는 다르죠.	청국장	https://ko.wikipedia.org/wiki/%EC%B2%AD%EA%B5%AD%EC%9E%A5	2022/03/13	0	2022-09-13 21:49:18	2022-09-13 21:49:18
BK22008217	13	질문자	청국장은 된장과 다르게 빨리 담가 먹을 수 있군요. 청국장도 발효 식품인 만큼 몸에 좋을 것 같은데, 청국장의 효능에는 어떤 것들이 있나요?				0	2022-09-13 21:49:18	2022-09-13 21:49:18
BK22008217	14	전문가	청국장에는 프로바이오틱스가 많이 함유되어 있어서 장 건강에 효과가 좋아요. 프로바이오틱스는 유익한 균을 활성화하고, 유해한 세균은 제거하는 기능을 하죠.	청국장 효능	https://health.chosun.com/site/data/html_dir/2022/03/17/2022031702032.html	2022/03/18	0	2022-09-13 21:49:18	2022-09-13 21:49:18
BK22008217	15	질문자	장이 좋지 않을 때 청국장 요리를 자주 해 먹으면 좋겠어요! 이런 장류는 어떻게 보관을 하는 것이 좋을까요?				0	2022-09-13 21:49:18	2022-09-13 21:49:18
BK22008217	16	전문가	고추장이나 된장 등의 발효 식품들은 냉장실에 보관하는 게 좋아요. 옛날에 장류를 땅속에 묻은 독에 담아 시원하게 보관했던 것처럼요.	장류 보관	https://www.news1.kr/articles/?3702353	2019/08/24	0	2022-09-13 21:49:18	2022-09-13 21:49:18
BK22008217	17	질문자	장류는 꼭 냉장 보관을 해야겠네요. 앞으로도 한국의 장을 이용한 요리들을 자주 먹어야겠어요.				0	2022-09-13 21:49:18	2022-09-13 21:49:18
BK22008217	18	전문가	그래요, 우리의 전통 장류는 발효 식품이기 때문에 건강에도 좋고 맛도 좋죠.				1	2022-09-13 21:49:18	2022-09-23 15:18:30
BK22008217	19	질문자	할머니 댁에 있던 메주가 새삼 더 소중하게 느껴지네요. 유익한 정보들을 알려줘서 고마워요.				0	2022-09-13 21:49:18	2022-09-13 21:49:18
BK22008217	20	전문가	천만에요, 언제든 궁금한 것이 생기면 또 연락하세요!				0	2022-09-13 21:49:18	2022-09-13 21:49:18
