id	utterance_id	role	text	search_query	search_URL	reference_date	terminate	regDate	updDate
BK22005906	1	질문자	제가 요즘 무화과에 빠져있어요. 혹시 잘 익은 맛있는 무화과를 고르는 방법을 아시나요?				0	2022-08-19 11:38:15	2022-08-19 15:14:23
BK22005906	2	전문가	그러시군요, 그럼 무화과 아랫부분이 쫙 갈라져 있는지 보세요. 그런 게 잘 익은 무화과랍니다. 그리고 그 부위가 건조하지 않는지도 체크해 보세요. 또 전체적으로 적갈색을 띠는 걸 고르시면 된답니다.	무화과 고르기	https://www.nbntv.co.kr/news/articleView.html?idxno=585944	2019/08/22	0	2022-08-19 11:38:15	2022-08-28 00:36:11
BK22005906	3	질문자	알려주신 대로 잘 보고 고를게요. 주로 생과로 먹지만 이번에는 잼까지 만들 생각이어서 세 박스는 사 와야겠네요. 아, 그런데 무화과는 껍질을 벗기고 먹는 게 맞죠?				0	2022-08-19 11:38:15	2022-08-19 15:14:23
BK22005906	4	전문가	무화과의 껍질은 딱딱하지 않고 부드러워서 껍질째로 먹어도 된답니다. 저도 무화과를 즐겨 먹는데 생과로 먹는 게 최고지요.	무화과 껍질	http://www.newsam.co.kr/news/article.html?no=29948	2019/12/10	0	2022-08-19 11:38:15	2022-08-19 15:14:23
BK22005906	5	질문자	껍질째 먹어도 된다니, 여태 아까운 부분을 다 버렸었네요. 농약이 남아있을까 봐 알맹이만 먹었었거든요.				0	2022-08-19 11:38:15	2022-08-19 15:14:23
BK22005906	6	전문가	그랬군요, 그냥 간단하게 씻고 섭취하면 돼요. 무화과의 잎은 살충에 강하기 때문에 농약을 사용하지 않고 재배하니 안심하세요.	무화과 세척	https://www.fnnews.com/news/202109241741261261	2021/09/24	0	2022-08-19 11:38:15	2022-08-19 15:14:23
BK22005906	7	질문자	새로운 사실을 알았네요. 그럼 무화과를 세척할 때 주의할 점이 있을까요?				0	2022-08-19 11:38:16	2022-08-19 15:14:23
BK22005906	8	전문가	일단 무화과를 씻은 후 물기를 완전히 없애고, 손질할 때는 무화과 속으로 물이 들어가지 않게 조심해야 해요.	무화과 손질	https://www.nbntv.co.kr/news/articleView.html?idxno=585944	2019/08/22	0	2022-08-19 11:38:16	2022-08-19 15:14:23
BK22005906	9	질문자	그것도 모르고 물에 담가 세척하고 그랬는데 제 자신이 어리석네요.				0	2022-08-19 11:38:16	2022-08-19 15:14:23
BK22005906	10	전문가	그러셨군요, 이제부터는 조금 편하게 드세요.				0	2022-08-19 11:38:16	2022-08-19 15:14:23
BK22005906	11	질문자	이제라도 알아서 다행이에요. 아, 무화과 보관 방법에 대해서도 궁금해요.				0	2022-08-19 11:38:16	2022-08-19 15:14:23
BK22005906	12	전문가	무화과를 보관하실 땐 종이 행주로 감싸서 비닐봉지에 넣고 밀봉시킨 다음 1도에서 5도로 냉장 보관하면 된답니다.	무화과 냉장 보관	http://www.thekpm.com/news/articleView.html?idxno=100725	2021/10/05	0	2022-08-19 11:38:16	2022-08-19 15:14:23
BK22005906	13	질문자	그렇게 보관하는 거였군요. 안 그래도 며칠이 지나면 금방 물러서 아예 무화과 말랭이를 만들어서 먹을까 고민했었거든요.				0	2022-08-19 11:38:16	2022-08-19 15:14:23
BK22005906	14	전문가	말려서 먹는 것도 방법일 수 있어요. 빨리 먹을 수 없다면 말리는 방법이나 레드와인에 졸여 냉장고에 넣어두는 등의 방법을 이용하면 오래 먹을 수 있답니다.	무화과 보관	https://www.nbntv.co.kr/news/articleView.html?idxno=657584	2019/09/24	0	2022-08-19 11:38:16	2022-08-28 00:36:11
BK22005906	15	질문자	많이 남을 때 그렇게 해야겠어요. 그럼 냉동해놓는 건 어떤가요?				0	2022-08-19 11:38:16	2022-08-19 15:14:23
BK22005906	16	전문가	괜찮아요, 냉동해 놓은 무화과는 스무디로 만들어 먹거나 바나나 등의 다른 과일과 갈아서 마시면 간단한 아침 식사 대용으로도 좋지요.	무화과 냉동 보관	http://news.heraldcorp.com/view.php?ud=20211001000903	2021/10/04	0	2022-08-19 11:38:16	2022-08-19 15:14:23
BK22005906	17	질문자	그런 방법들이 있군요. 아, 혹시 무화과잼을 만드는 방법에 대해 아시나요?				0	2022-08-19 11:38:16	2022-08-19 15:14:23
BK22005906	18	전문가	그럼요, 아주 간단하답니다. 무화과와 설탕을 같은 비율로 중불에서 저으며 끓이는 방법인데요. 물이 끓었을 때 무화과와 궁합이 좋은 레몬즙을 넣으면 더 좋아요. 레몬즙을 넣은 후 약불로 졸이면 완성된답니다.	무화과잼	https://www.nbntv.co.kr/news/articleView.html?idxno=657584	2019/11/14	0	2022-08-19 11:38:16	2022-08-19 15:14:23
BK22005906	19	질문자	정말 간단하네요, 제가 맛있게 무화과잼을 만들어 선물할 테니 기대하세요.				0	2022-08-19 11:38:16	2022-08-19 15:14:23
BK22005906	20	전문가	궁금하네요, 그럼 기대하고 있을게요. 다음에 또 대화 나눠요.				1	2022-08-19 11:38:16	2022-08-29 12:21:10
