id	utterance_id	role	text	search_query	search_URL	reference_date	terminate	regDate	updDate
BK22002951	1	질문자	요즘 따라 맥주를 많이 마시다 보니깐 맥주 제조법에 대한 관심이 가기 시작해요. 맥주는 기본적으로 어떤 원료로 만들어지나요?				0	2022-08-04 09:25:18	2022-08-04 09:25:18
BK22002951	2	전문가	맥주에 대해 궁금해지기 시작하셨군요! 맥주의 주원료는 양조용수와 보리 그리고 홉이 있어요. 그리고 나라와 지역에 따라서 쌀이나 옥수수, 녹말, 당류 등을 녹말질 보충 원료로 사용하고, 나라의 사정이나 기호에 따라 비율을 다르게 조정한답니다.	맥주 원료	https://ko.wikipedia.org/wiki/%EB%A7%A5%EC%A3%BC	2022/02/27	0	2022-08-04 09:25:18	2022-08-04 14:13:39
BK22002951	3	질문자	주원료와 보조 원료가 있군요, 신기해요. 그러면 양조용수는 맥주를 만들 때 어떤 역할을 하는 원료인가요?				0	2022-08-04 09:25:18	2022-08-04 09:25:18
BK22002951	4	전문가	양조용수는 색이 없고 냄새도 없는 투명한 특성을 가졌지만 맥주의 품질과 종류를 나누는데 직접적인 요소를 가지고 있어요. 그렇기 때문에 양주 용수에 함유된 염류나 미량원소들의 조화도 굉장히 중요하게 여겨져요.	맥주 양조용수	https://ko.wikipedia.org/wiki/%EB%A7%A5%EC%A3%BC	2022/02/27	0	2022-08-04 09:25:18	2022-08-04 09:25:18
BK22002951	5	질문자	양조용수로 인해 맥주의 품질과 종류가 나뉘기도 하는군요.				0	2022-08-04 09:25:18	2022-08-04 09:25:18
BK22002951	6	전문가	보통 경수로 맥주가 만들어졌는지 연수로 맥주가 만들어졌는지에 따라서 맥주의 종류가 나뉘어요. 경수로 만들어진 맥주의 경우에는 색이 굉장히 짙고 깊은 맛을 내는 특징을 가지고 있어 스타우트나 에일을 만드는데 주로 쓰이고, 연수로 만들어진 맥주의 경우에는 부드러운 맛을 내기 때문에 주로 라거를 만드는 데 사용돼요.	맥주 경수와 연수	https://ko.wikipedia.org/wiki/%EB%A7%A5%EC%A3%BC	2022/02/27	0	2022-08-04 09:25:18	2022-08-04 09:25:18
BK22002951	7	질문자	어떤 맥주를 만들 것인지에 따라 양주 용수가 다르게 쓰이는군요. 제가 알기로 맥주의 가장 주원료가 되는 것이 보리로 알고 있는데 보리는 일반적인 보리를 사용해도 맥주를 만들 수 있는 건가요?				0	2022-08-04 09:25:18	2022-08-04 09:25:18
BK22002951	8	전문가	일반적인 보리가 아닌 보리를 싹 틔워서 맥아로 만들어야 맥주를 만들 수 있어요. 주로 맥주를 만들기 위해 쓰는 보리는 곡립이 고르고 녹말질이 많아야 하며 적은 단백질을 가지고 있을 뿐만 아니라 발아력이 왕성한 보리를 사용하면 맥주용 보리로써 완벽한 조건을 가지고 있다고 볼 수 있어요.	맥주 보리	https://ko.wikipedia.org/wiki/%EB%A7%A5%EC%A3%BC	2022/02/27	0	2022-08-04 09:25:18	2022-08-04 09:25:18
BK22002951	9	질문자	질 좋은 맥주를 만들기 위해서는 보리의 역할이 정말 중요하군요! 그렇다면 홉은 맥주를 만드는 데 어떤 역할을 하는 재료인가요?				0	2022-08-04 09:25:18	2022-08-04 09:25:18
BK22002951	10	전문가	홉은 맥주를 마셨을 때 특유의 향과 쓴맛을 내는 데 가장 중요한 첨가물이라고 할 수 있어요. 향과 맛 때문에 홉을 첨가하기도 하지만 홉을 첨가함으로써 맥아즙의 단백질이 침전되어 맥주가 더 맑아지는 효과를 볼 수 있고 맥주를 제조하는 과정에서 균의 번식을 방지하기 때문에 보존성을 높여주는 역할도 해요.	맥주 홉	https://ko.wikipedia.org/wiki/%EB%A7%A5%EC%A3%BC	2022/02/27	0	2022-08-04 09:25:18	2022-08-04 14:13:39
BK22002951	11	질문자	홉이 균의 번식을 방지하는 역할도 하고 맥주의 향도 내는 일석이조의 원료네요! 맥주를 만드는 주원료는 이렇게 동일해도 맥주가 만들어지는 방법에 따라 맥주 종류가 나뉘기도 하던데 크게 맥주 종류를 어떻게 나누죠?				0	2022-08-04 09:25:18	2022-08-04 09:25:18
BK22002951	12	전문가	맥주를 분류하는 기준으로는 여러 가지 기준이 있지만 일반적으로는 맥주를 상면 발효시키는지 아니면 하면 발효를 시키는지에 따라 에일 혹은 라거로 나눌 수 있어요.	맥주 분류	https://ko.wikipedia.org/wiki/%EB%A7%A5%EC%A3%BC	2022/02/27	0	2022-08-04 09:25:18	2022-08-04 14:13:39
BK22002951	13	질문자	발효를 시키는 방법에 따라서 맥주를 분류시킨다는 것은 알고 있었는데 상면 발효와 하면 발효는 처음 들어보네요. 상면 발효를 하면 어떤 맥주가 탄생하죠?				0	2022-08-04 09:25:18	2022-08-04 09:25:18
BK22002951	14	전문가	색이 짙고 알코올 도수도 높은 맥주가 탄생한답니다. 왜냐하면 상면발효맥주는 맥아 농도가 높고, 10도에서 25도 사이의 상온에서 발효시키기 때문이에요.	상면발효맥주	https://ko.wikipedia.org/wiki/%EB%A7%A5%EC%A3%BC	2022/02/27	0	2022-08-04 09:25:18	2022-08-04 14:13:39
BK22002951	15	질문자	그렇군요! 그러면 하면 발효를 하면 어떤 특성을 가진 맥주가 만들어지나요?				0	2022-08-04 09:25:18	2022-08-04 09:25:18
BK22002951	16	전문가	하면 발효는 저온에서 발효하기 때문에, 하면 발효를 할 시에는 깨끗하고 부드러운 맛과 향을 가진 맥주가 만들어져요. 현재 전 세계의 70퍼센트의 맥주가 하면 발효를 통해 만들어지고 하면 발효로 만들어진 맥주를 라거라고 부르기도 해요.	하면발효맥주	https://ko.wikipedia.org/wiki/%EB%A7%A5%EC%A3%BC	2022/02/27	0	2022-08-04 09:25:18	2022-08-04 09:25:18
BK22002951	17	질문자	제가 요즘 주로 마시는 맥주가 라거 맥주였는데 라거 맥주가 하면 발효를 통해 만들어진 맥주였군요.				0	2022-08-04 09:25:18	2022-08-04 09:25:18
BK22002951	18	전문가	맞아요, 요즘 사람들이 마시는 맥주 트렌드가 깨끗하고 부드러운 맛을 가진 맥주를 원하기 때문에 라거가 많이 선호되기도 하죠.				0	2022-08-04 09:25:18	2022-08-04 09:25:18
BK22002951	19	질문자	에일도 많이 마셔보긴 했지만 특유의 향과 쓴맛 때문에 제 입맛에는 맞지 않는 것 같더라고요. 그래도 특색 있는 맥주를 마셔보는 경험이 좋기 때문에 여러 종류의 맥주를 마셔보려 하고 있긴 해요.				0	2022-08-04 09:25:18	2022-08-04 09:25:18
BK22002951	20	전문가	여러 종류의 맥주를 마셔보면서 각각의 특성을 알아보는 것도 정말 좋은 경험이죠! 다음번에 저랑 이태원에 가서 세계 여러 맥주를 같이 마셔보는 건 어때요?				0	2022-08-04 09:25:18	2022-08-04 09:25:18
BK22002951	21	질문자	너무 좋을 것 같아요! 같이 세계 여러 맥주를 마셔보면서 맥주에 대해 더 깊은 이야기를 나눌 수 있으면 좋겠어요!				1	2022-08-04 09:25:18	2022-08-04 14:13:39
