id	utterance_id	role	text	search_query	search_URL	reference_date	terminate	regDate	updDate
BK22003114	1	질문자	지금 드시는 음식 맛있어보이는데 뭐예요?				0	2022-08-04 10:36:32	2022-08-10 14:55:03
BK22003114	2	전문가	아, 이건 날생선 샐러드인데 하와이 음식이에요. 이름은 하와이어로 포케라고 해요.	포케	https://ko.wikipedia.org/wiki/%ED%8F%AC%EC%BC%80	2022/02/23	0	2022-08-04 10:36:32	2022-08-10 14:55:03
BK22003114	3	질문자	날생선이 들어간 샐러드라고요? 연어 샐러드나 참치 샐러드 같은 음식이라고 생각하면 되는 건가요?				0	2022-08-04 10:36:32	2022-08-10 14:55:03
BK22003114	4	전문가	하와이안식 회덮밥이라고 생각하시면 돼요. 우리나라 회덮밥은 회랑 채소를 초장에 비벼먹잖아요. 포케는 초장 대신에 다른 소스들을 쓰고 쌀밥보다는 현미밥을 넣는게 특징이에요. 미역이나 김같은 해조류도 들어가고 취향에 맞게 땅콩소스나 양파, 콩, 아보카도처럼 건강에 좋은 음식을 추가해서 먹기도 해요. 밥을 빼고 야채만 넣어서 비벼먹을 수도 있어요.	포케 샐러드 뜻	https://news.koreadaily.com/2020/08/27/society/opinion/8603533.html	2020/08/27	0	2022-08-04 10:36:32	2022-08-04 14:18:01
BK22003114	5	질문자	하와이안식 회덮밥이라니 뭔가 재밌네요. 포케라는 음식은 언제부터 먹기 시작한거예요? 혹시 포케라는 말에 담긴 의미가 있나요?				0	2022-08-04 10:36:32	2022-08-10 14:55:03
BK22003114	6	전문가	포케는 고대 하와이 사람들이 처음으로 만들어 먹기 시작했는데, 갓 잡아 싱싱한 생선을 바다 소금과 해초, 으깬 이아모 아니면 쿠쿠이 너트에 버무려서 먹었던 데에서 왔어요. 또 하와이의 어부들이 참치를 잡았을 때 소금에 절여 먹는 걸 포케라고 부르기도 했어요. 포케라는 이름에는 하와이어로 자르다 라는 의미가 담겨 있고요.	포케 유래	https://news.koreadaily.com/2020/08/27/society/opinion/8603533.html	2020/08/27	0	2022-08-04 10:36:32	2022-08-10 14:55:03
BK22003114	7	질문자	생각보다 엄청 오래 전부터 전해져 온 음식이네요, 고대 하와이 사람이라니. 그런데 생선에 야채를 버무리거나 소금에 절인 건 회덮밥과는 거리가 좀 있는 것 같은데요?				0	2022-08-04 10:36:32	2022-08-10 14:55:03
BK22003114	8	전문가	맞아요, 포케가 지금과 같은 모습으로 변하기 시작한 건 아시아계 이민자들이 하와이로 와서 정착하면서였거든요. 아시아 이민자들은 포케에 소금 대신 간장을 뿌리고, 참기름도 넣어 밥과 함께 먹었어요. 일본계 이민자들은 김 가루와 후리카케같은 걸 넣어 감칠맛을 더했죠. 그리고 포케가 전 세계로 퍼지면서 더 다양한 모습으로 변하고 응용되고 있어요.	포케의 변천사	https://www.joongang.co.kr/article/25013558	2021/10/09	0	2022-08-04 10:36:32	2022-08-10 14:55:03
BK22003114	9	질문자	다른 문화와 함께 어우러져 발전한 독특한 풍미의 음식인 거네요. 어쩐지 맛있을 것 같더라니, 아시아계 이민자라면 우리의 먼 조상님도 계신 거니 어떻게 보자면 입맛이 이어져 내려온 거네요.				0	2022-08-04 10:36:32	2022-08-10 14:55:03
BK22003114	10	전문가	하하, 그렇게 볼 수도 있겠네요. 혹시 더 궁금하신 게 있을까요? 포케 아니면 다른 하와이 음식에 대해서라든지요.				0	2022-08-04 10:36:32	2022-08-10 14:55:03
BK22003114	11	질문자	아, 안 그래도 다른 음식에 대해서도 질문하고 싶었어요. 하와이 하면 관광지, 휴양지로 바로 연상 되긴 하는데 막상 먹거리는 떠오르는 게 없어서요. 포케처럼 하와이 특유의 음식이나 요리가 더 있을까요?				0	2022-08-04 10:36:32	2022-08-10 14:55:03
BK22003114	12	전문가	그럼요, 하와이 무수비라는 음식이 있어요. 하와이 김밥, 하와이 초밥이라고도 불리는데 스팸통 안에 비닐을 깔고 양념된 밥, 계란, 스팸 그 위에 밥을 또 얹고 눌러 만든 샌드위치 모양의 밥을 김으로 둘러싸 준 음식이에요.	하와이 음식	http://www.seniormaeil.com/news/articleView.html?idxno=36649	2022/06/22	0	2022-08-04 10:36:32	2022-08-10 14:55:03
BK22003114	13	질문자	스팸이 들어간 삼각김밥이랑 비슷한 맛이 날 것 같은데요? 그런데 무스비는 영어가 아니지 않나요?				0	2022-08-04 10:36:32	2022-08-10 14:55:03
BK22003114	14	전문가	무스비는 일본어로 감싸다, 묶다라는 의미를 가진 단어예요. 김으로 둘러싼 일본 주먹밥 이름 무스비를 그대로 가져와 사용했어요.	하와이 무수비	http://www.joongboo.com/news/articleView.html?idxno=1331450	2019/03/02	0	2022-08-04 10:36:32	2022-08-10 14:55:03
BK22003114	15	질문자	어, 하와이 음식인데 왜 일본어를 사용하죠?				0	2022-08-04 10:36:32	2022-08-10 14:55:03
BK22003114	16	전문가	2차 세계대전 이후에 일본인들이 하와이로 많이 건너갔거든요. 거기서 일본식 주먹밥을 팔기 시작했고 한 때 어업이 금지되면서 일본인들이 생선 대신에 스팸을 넣어서 팔기 시작했어요.	하와이 무수비	http://www.joongboo.com/news/articleView.html?idxno=1331450	2019/03/02	0	2022-08-04 10:36:32	2022-08-04 14:18:01
BK22003114	17	질문자	일본인들이 하와이에서 팔기 시작한 하와이 음식이군요. 왠지 익숙한 느낌이었어요. 하와이 무스비는 많이 유명한 음식인가요?				0	2022-08-04 10:36:32	2022-08-10 14:55:03
BK22003114	18	전문가	상당히 유명하다고 해야 할까, 흔하다고 해야 할까, 우리나라의 김밥과 같은 위치라고 설명하면 이해가 되실까요? 미국에서 무스비라고 하면 보통은 하와이 무스비를 가리킬 정도죠. 우리나라에서도 무스비라는 이름으로 스팸 무스비를 판 식당이 몇 군데 있었고요. 오바마 대통령이 하와이에서 골프를 치던 도중에 먹어서 한 번 화제가 된 적도 있었죠.	하와이 무수비 화제	http://www.joongboo.com/news/articleView.html?idxno=1331450	2019/03/02	0	2022-08-04 10:36:32	2022-08-10 14:55:03
BK22003114	19	질문자	우리나라 김밥에 비유하니 딱 와닿네요. 포케는 재료 준비가 좀 필요할 것 같지만 하와이 무스비는 어렵지 않을 것 같아서 한 번 만들어볼까 하는데, 잘 만들어지면 좀 가져다 드릴게요!				0	2022-08-04 10:36:32	2022-08-10 14:55:03
BK22003114	20	전문가	와, 가져다 주시면 감사히 잘 먹겠습니다.				0	2022-08-04 10:36:32	2022-08-10 14:55:03
BK22003114	21	질문자	하하, 너무 기대는 하지 마시고요. 그럼 나중에 곁들일 음식이랑 들고 찾아뵐게요, 조심히 들어가세요!				1	2022-08-10 14:55:03	2022-08-10 14:55:03
