id	utterance_id	role	text	search_query	search_URL	reference_date	terminate	regDate	updDate
BK22005702	1	질문자	어제 친구랑 이자카야에 갔는데 서비스로 이상한 고추 구이 같은 걸 받았거든? 고추같이 생겼는데 맵지는 않고, 또 모양도 별 모양이라 좀 신기하더라고. 이거 혹시 뭔지 알아?				0	2022-08-16 16:34:13	2022-08-16 16:34:13
BK22005702	2	전문가	아 오크라 구이를 서비스로 주셨나 보네. 오크라가 고추랑 비슷하게 생겼는데, 맛이 자극적이지 않거든. 그리고 자른 단면이 별 모양인 것이 특징이야.	오크라 고추	https://www.nbntv.co.kr/news/articleView.html?idxno=126663	2020/03/11	0	2022-08-16 16:34:13	2022-08-16 16:34:13
BK22005702	3	질문자	오크라가 뭐지? 난 처음 들어보는데, 외국에서 들여온 채소인가 봐?				0	2022-08-16 16:34:13	2022-08-16 16:34:13
BK22005702	4	전문가	응, 이집트 쪽에서 즐겨 먹는 건데 원산지는 아프리카 북동부 지역이야. 그리고 레이디 핑거라는 재미있는 별명이 있는데, 생김새가 여자 손가락 모양을 닮았다고 해서 붙은 이름이야.	오크라 원산지	https://www.nbntv.co.kr/news/articleView.html?idxno=126663	2020/03/11	0	2022-08-16 16:34:13	2022-08-16 16:34:13
BK22005702	5	질문자	나는 고추를 닮았다고 생각했는데, 그쪽에서는 여자 손가락처럼 생겼다고 생각하나 보네. 근데 먹을 때 좀 끈적끈적하던데 그건 왜 그런 거야?				0	2022-08-16 16:34:13	2022-08-16 16:34:13
BK22005702	6	전문가	아 그건 오크라에 함유되어 있는 당단백질 중 하나인 뮤신 성분 때문이야. 그래서 마처럼 끈적끈적한 식감이 나는 거지.	오크라 끈적	https://www.hidoc.co.kr/healthstory/news/C0000412364	2018/07/12	0	2022-08-16 16:34:13	2022-08-16 16:34:13
BK22005702	7	질문자	그 뮤신이라는 성분은 몸에 좋은 성분이야?				0	2022-08-16 16:34:13	2022-08-16 16:34:13
BK22005702	8	전문가	응, 이게 몸속 콜레스테롤 수치를 낮춰주고, 아토피 개선, 해독 작용 등에 좋아. 또 단백질의 소화를 촉진하고 위벽을 보호해 주는 효능도 있고.	오크라 뮤신	https://www.hidoc.co.kr/healthstory/news/C0000412364	2018/07/12	0	2022-08-16 16:34:13	2022-08-26 11:28:50
BK22005702	9	질문자	오, 엄청 건강에 좋은 성분인가 보다. 근데 이자카야 사장님은 이게 여자들 피부 미용에 좋다고 하던데, 피부에도 좋은 것 맞아?				0	2022-08-16 16:34:13	2022-08-16 16:34:13
BK22005702	10	전문가	아 그건 오크라에 다량 함유되어 있는 비타민과 지용성 비타민, 베타카로틴 성분들 때문에 그렇게 말씀하신 거야. 이 성분들이 활성산소를 제거 및 콜라겐을 형성하고 피부 진피층을 탄탄하게 하거든. 그래서 그런지 세기의 미인이라 알려져 있는 클레오파트라와 양귀비도 이 오크라를 즐겨먹었다고 전해져.	오크라 피부	https://www.mbn.co.kr/news/life/2503955	2015/08/20	0	2022-08-16 16:34:13	2022-08-26 11:28:50
BK22005702	11	질문자	오 그렇게 들으니까 솔깃한걸? 직접 사서 요리해 먹어보고 싶은데, 혹시 마트에도 오크라 파는지 한 번 가봐야겠다. 혹시 오크라 사게 되면 어떤 점을 보고 골라야 해?				0	2022-08-16 16:34:13	2022-08-16 16:34:13
BK22005702	12	전문가	일단 오크라는 크기가 중요한데, 너무 큰 건 맛이 없으니까 적당한 크기를 골라서 사야 해. 또 꼭지가 선명한 녹색을 띠고 싱싱해 보이는 것으로 사는 게 좋아.	오크라 크기	https://www.gokorea.kr/news/articleView.html?idxno=84347	2019/01/25	0	2022-08-16 16:34:13	2022-08-16 16:34:13
BK22005702	13	질문자	그렇구나, 적당한 크기에 꼭지가 싱싱한 것으로 사야겠네. 근데 오크라는 어떻게 요리해 먹어야 하지? 낯선 채소라서 어떻게 활용해서 먹어야 할지 전혀 감이 안 오네.				0	2022-08-16 16:34:13	2022-08-16 16:34:13
BK22005702	14	전문가	아까 말했던 오크라의 베타카로틴 성분은 기름과 만나면 몸에 흡수가 더 잘 되거든? 그래서 기름에 볶는 방식의 요리를 하면 좋아. 아니면 수제어묵 만들 때 반죽 안에 손질된 오크라를 넣어서 튀기는 등 튀김 요리에도 활용할 수 있고. 만약 오크라의 끈적거리는 식감을 즐기고 싶다면, 잘게 썰어서 낫토와 곁들여 먹어도 좋아.	오크라 낫토	https://www.hidoc.co.kr/healthstory/news/C0000412364	2018/07/12	0	2022-08-16 16:34:13	2022-08-16 16:34:13
BK22005702	15	질문자	와 그건 생각지도 못했던 요리법인데. 어묵 오크라 튀김이나 오크라 낫토라니, 상상은 안가지만 새로운 요리에 도전해 보면 좋을 것 같아. 근데 오크라 먹을 때 주의 사항 같은 거 혹시 있어?				0	2022-08-16 16:34:13	2022-08-16 16:34:13
BK22005702	16	전문가	아 오크라 손질할 때 주의사항이 하나 있어. 생 오크라를 보면 표면이 따끔따끔할 텐데, 표면이 보풀로 덮여있어서 그래. 그래서 생으로 먹을 수는 없고, 먼저 소금을 묻혀 문질러서 보풀을 제거하고 물에 살짝 데쳐서 먹어야 해.	오크라 표면	https://www.gokorea.kr/news/articleView.html?idxno=84347	2019/01/25	0	2022-08-16 16:34:13	2022-08-16 16:34:13
BK22005702	17	질문자	아, 나는 야채 씻는 바구니에 살짝 씻어서 먹으려고 했더니 큰일 날뻔했구나. 집에 굵은소금이 없으니, 굵은소금도 사야겠다.				0	2022-08-16 16:34:13	2022-08-16 16:34:13
BK22005702	18	전문가	응, 마트 가서 오크라 있는지 보고 사게 되면 그때 굵은소금도 같이 사.				0	2022-08-16 16:34:13	2022-08-16 16:34:13
BK22005702	19	질문자	알겠어, 난 이제 마트 들렀다가 집에 가봐야겠다. 너도 조심히 들어가고 다음에 또 보자.				0	2022-08-16 16:34:13	2022-08-16 16:34:13
BK22005702	20	전문가	응, 나도 이제 집에 가봐야겠어. 조심히 들어가고, 혹시 오크라 사게 되면 다음에 만날 때 어땠는지 후기 알려줘.				1	2022-08-16 16:34:13	2022-08-26 11:28:50
