id	utterance_id	role	text	search_query	search_URL	reference_date	terminate	regDate	updDate
BK22012468	1	질문자	제철 과일으로 무화과를 좀 사볼까 하는데, 무화과는 어떤 효능이 있어?				0	2022-09-30 15:15:12	2022-10-01 15:12:36
BK22012468	2	전문가	무화과는 노화를 예방해 주고 혈관을 건강하게 해주는 효과가 있어. 잘 익은 무화과는 식감이 부드럽고 맛이 달콤한데, 무화과에 하얀 즙은 피를 맑게하고 혈액이 잘 흐르게 해서 혈압을 안정시키는 효능이 있지.	무화과 효능	https://kormedi.com/1416842/9%ec%9b%94-%ec%a0%9c%ec%b2%a0-%ea%b3%bc%ec%9d%bc%ec%97%90-%ec%88%a8%ea%b2%a8%ec%a7%84-%ed%8a%b9%eb%b3%84%ed%95%9c-%ec%98%81%ec%96%91/	2022/09/01	0	2022-09-30 15:15:12	2022-10-01 15:12:36
BK22012468	3	질문자	맞아, 맛도 있어서 나도 좋아해. 잔뜩 사서 보관하고 싶은데 어떻게 보관해?				0	2022-09-30 15:15:12	2022-10-01 15:12:36
BK22012468	4	전문가	생과일은 쉽게 무르기 때문에 먹을 만큼만 사서 되도록 빨리 먹는 게 좋아. 무화과를 키친타월에 감싸고 비닐봉지에 넣고 공기가 들어가지 않게 잘 묶고 냉장고에 보관하면 신선하게 보관할 수 있어.	무화과 보관	http://www.thekpm.com/news/articleView.html?idxno=100725	2021/10/05	0	2022-09-30 15:15:12	2022-10-01 15:12:36
BK22012468	5	질문자	그렇구나, 무화과로 요리를 하면 오래 보관이 가능해?				0	2022-09-30 15:15:12	2022-10-01 15:12:36
BK22012468	6	전문가	주스나 잼을 만드는 방법이 있어. 자두나 키위, 오렌지, 복숭아, 패션프루트같이 다른 과일을 같이 넣어서 만들면 새콤달콤한 맛의 주스나 잼이 돼. 또 오래 보관하는 방법에는 냉동으로 보관하는 방법이 있는데, 냉동 후 요구르트나 과일주스를 넣어서 스무디로 만들어 먹어도 좋아.	무화과 오래 먹을 수 있는 요리	http://digitalchosun.dizzo.com/site/data/html_dir/2020/09/01/2020090180058.html	2020/09/01	0	2022-09-30 15:15:12	2022-10-01 15:12:36
BK22012468	7	질문자	오, 냉동으로 해뒀다가 스무디 만들면 좋겠다. 무화과는 칼로리가 어느 정도야?				0	2022-09-30 15:15:13	2022-10-01 15:12:36
BK22012468	8	전문가	무화과 칼로리는 100그램에 43칼로리야. 열량이 아주 낮기 때문에 다이어트할 때 먹으면 좋아.	무화과 칼로리	https://www.dailysecu.com/news/articleView.html?idxno=78378	2019/11/09	0	2022-09-30 15:15:13	2022-10-01 15:12:36
BK22012468	9	질문자	정말 다이어트에 좋겠다. 다이어트 요리로 무화과로 샐러드 해먹어도 좋겠지?				0	2022-09-30 15:15:13	2022-10-01 15:12:36
BK22012468	10	전문가	응, 무화과는 신맛보다 단맛이 많이 나는 과일이라서 야채 샐러드에 넣으면 부족한 단맛을 채울 수가 있어. 특히 무화만의 특별한 향과 맛이 샐러드에도 잘 어울려,	무화과 다이어트 샐러드	http://www.realfoods.co.kr/view.php?ud=20171226000351	2017/12/26	0	2022-09-30 15:15:13	2022-10-01 15:12:36
BK22012468	11	질문자	정말 간단하게 만들 수 있겠다. 무화과로 또 뭘 만들 수 있어?				0	2022-09-30 15:15:13	2022-10-01 15:12:36
BK22012468	12	전문가	무화과 간식으로는 무화과 칩이 있어. 무화과를 먹기 좋게 자르고 식품건조기나 에어프라이어로 건조하면 되는데 간단하게 반건조 무화과 칩을 만들 수 있어. 간식을 처음 먹는 어린아이에게도 부담이 없고, 식감이 부드러워서 이가 약한 사람에게도 괜찮지.	무화과 디저트	https://www.fnnews.com/news/202109241741261261	2021/09/24	0	2022-09-30 15:15:13	2022-10-01 15:12:36
BK22012468	13	질문자	가볍게 먹을 간식으로 좋겠다. 신선한 무화과를 고르려면 어떻게 골라야 돼?				0	2022-09-30 15:15:13	2022-10-01 15:12:36
BK22012468	14	전문가	무화과 겉에 광이 나면서 꼭지가 마르지 않고 촉촉한 상태인 게 신선한 무화과야. 색은 자줏빛이나 적갈색일수록 당도가 높아. 무화과는 수확하고 나서는 더 이상 익지 않는 과일이니까 숙성 시키면 더 맛있겠다는 생각으로 초록색 무화과를 고르지 않는 게 좋아.	무화과 고르는 법	https://view.asiae.co.kr/article/2020110215365669106	2020/11/03	0	2022-09-30 15:15:13	2022-10-01 15:12:36
BK22012468	15	질문자	아, 숙성해도 더 이상 익지 않는구나. 하루에 몇 개까지 먹는 게 좋아?				0	2022-09-30 15:15:13	2022-10-01 15:12:36
BK22012468	16	전문가	무화과는 하루에 5개에서 8개 정도 먹는 게 좋아. 무화과를 많이 먹으면 배탈이나 설사 같은 부작용이 생길 수 있고, 입술이나 혀에 알레르기 증상이 있을 수 있으니 많이 먹지 않는 게 좋아.	무화과 하루 섭취량	https://www.nbntv.co.kr/news/articleView.html?idxno=681477	2019/11/14	0	2022-09-30 15:15:13	2022-10-01 15:12:36
BK22012468	17	질문자	맛있다고 많이 먹는 것도 좋진 않겠구나. 알려줘서 고마워.				0	2022-09-30 15:15:13	2022-10-01 15:12:36
BK22012468	18	전문가	응, 많이 먹지 않고 적당량만 섭취하면 몸에 좋은 제철 과일이야.				0	2022-09-30 15:15:13	2022-10-01 15:12:36
BK22012468	19	질문자	자세하게 알려줘서 고마워. 모르고 먹을 뻔했는데 알고 먹으니까 더 좋겠다.				0	2022-09-30 15:15:13	2022-10-01 15:12:36
BK22012468	20	전문가	응, 더 궁금한 게 있다면 언제든지 물어보고 건강 유의해.				1	2022-09-30 15:15:13	2022-10-01 15:12:36
