id	utterance_id	role	text	search_query	search_URL	reference_date	terminate	regDate	updDate
BK22000120	1	질문자	날이 더워지니 자꾸만 수박을 찾아요. 아삭한 식감에 시원한 맛이 너무 좋은거있죠.				0	2022-07-20 16:04:19	2022-08-02 12:01:32
BK22000120	2	전문가	수박 맛있죠. 여름이 되면 자연스럽게 찾게되는 제철 과일인 것 같아요.				0	2022-07-20 16:04:19	2022-07-21 09:30:37
BK22000120	3	질문자	달콤한 과일이다보니 살이 찌지 않을까 걱정이 되기도해요. 많이 먹으면 안좋겠죠?				0	2022-07-20 16:04:19	2022-08-02 12:01:32
BK22000120	4	전문가	수박은 100그램당 31킬로칼로리 정도밖에 안하니까 식후 간식으로 좋아요. 수박 속 칼륨은 혈압을 낮추는 역할도 하니까 맛뿐아니라 효능도 제대로 갖춘 과일이죠.	수박 칼로리	https://health.chosun.com/site/data/html_dir/2022/06/17/2022061701837.html	2022/06/19	0	2022-07-20 16:04:19	2022-07-21 09:30:37
BK22000120	5	질문자	지금까지는 맛으로 먹었는데 반가운 이야기네요. 혹시 다른 효능들도 있을까요?				0	2022-07-20 16:04:19	2022-08-02 12:01:32
BK22000120	6	전문가	그럼요. 붉은 속살에는 라이코펜이 풍부해 강력한 항산화 성분으로 활성산소를 억제하고 노화 예방과 항염 작용을 해요. 또 혈당을 떨어뜨리고 콜레스테롤을 낮춰서 혈관 건강에 도움을 줘요.	수박 효능	https://kormedi.com/1402852/%EC%97%AC%EB%A6%84-%EB%8C%80%ED%91%9C-%EA%B3%BC%EC%9D%BC-%EC%88%98%EB%B0%95-%EC%9D%B4%EB%9F%B0-%ED%9A%A8%EB%8A%A5%EC%9D%B4/	2022/06/09	0	2022-07-20 16:04:19	2022-07-21 09:30:37
BK22000120	7	질문자	달콤한 과일이라 혈당 생각은 전혀 못했는데 그럼 당뇨 환자들도 드실 수 있는걸까요?				0	2022-07-20 16:04:19	2022-08-02 12:01:32
BK22000120	8	전문가	당뇨 환자의 경우 권장 당수치가 70미만인데 수박은 72로 여름 과일 중 가장 높아요. 몇 조각만 먹어도 혈당이 급격히 올라갈 수 있으니까 한쪽에서 두쪽내외로 양을 정해두고 드시는 것이 좋아요.	수박 당뇨 환자	https://www.ftimes.kr/news/articleView.html?idxno=18139	2022/06/15	0	2022-07-20 16:04:19	2022-07-21 09:30:37
BK22000120	9	질문자	아예 금물은 아니군요. 당뇨 환자들이 마음껏 먹을 수 있는 여름 과일은 뭐가 있나요?				0	2022-07-20 16:04:19	2022-08-02 12:01:32
BK22000120	10	전문가	당뇨 환자의 경우 수박이나 바나나같은 부드러운 과일보다 사과, 천도복숭아, 개구리참외, 참다래처럼 단단한 과일을 먹는 것이 좋아요. 과육이 단단한 과일은 섬유질을 이루는 세포 조직이 질기고 촘촘해서 소화와 흡수가 천천히 진행되기 때문이에요.	당뇨환자 복숭아	https://health.chosun.com/site/data/html_dir/2020/04/08/2020040801353.html	2020/04/08	0	2022-07-20 16:04:19	2022-07-21 09:30:37
BK22000120	11	질문자	가족 중 당뇨 환자가 있어서 걱정이었는데 같이 나눠먹을 수 있는 과일이 많으니까 좋네요. 그리고 올 해들어 신비복숭아라는걸 처음 봤는데 이건 뭔가요?				0	2022-07-20 16:04:20	2022-08-02 12:01:32
BK22000120	12	전문가	겉은 천도복숭아 모습을 하고 있는데 백도 맛을 내는 복숭아에요. 일반 복숭아에 비해서 성분 함량 수치가 월등이 높다는 특징을 가지고 있어요.	신비복숭아	https://www.mk.co.kr/news/business/view/2022/06/508197/	2022/06/10	0	2022-07-20 16:04:20	2022-07-21 09:30:37
BK22000120	13	질문자	이름이 신기해서 기억하고 있었는데 겉은 천도, 속은 백도라니 신기해요. 신비복숭아도 다른 복숭아처럼 여름에만 먹을 수 있나요?				0	2022-07-20 16:04:20	2022-08-02 12:01:32
BK22000120	14	전문가	신비복숭아의 판매기간은 6월 하순께부터 약 2주정도에요. 생산량도 전체 천도복숭아의 0.8퍼센트정도라 여름에만 맛볼 수 있는 귀한 과일이죠.	신비복숭아 시기	https://www.mk.co.kr/news/business/view/2019/06/464196/	2019/06/27	0	2022-07-20 16:04:20	2022-07-21 09:30:37
BK22000120	15	질문자	대부분 여름 과일들이 보관하기 어렵긴한데 신비복숭아는 더 많이 어려우니 귀한 대접을 받는 것 같아요. 그만큼 좋은 효능도 있겠죠?				0	2022-07-20 16:04:20	2022-08-02 12:01:32
BK22000120	16	전문가	복숭아는 칼륨이 많아 혈압을 낮추는 효능을 가지고 있어요. 고혈압 환자들에게 추천하는 과일 중 하나에요. 그리고 변비에도 좋아요.	신비복숭아 효능	https://www.topstarnews.net/news/articleView.html?idxno=657106	2019/08/12	0	2022-07-20 16:04:20	2022-07-21 09:30:37
BK22000120	17	질문자	과일들도 제각각 효능을 가지고 있으니 골라먹는 재미가 있는 것 같아요. 그런데 과일은 아침이나 저녁 언제 먹는게 좋은건가요?				0	2022-07-20 16:04:20	2022-08-02 12:01:32
BK22000120	18	전문가	과일 섭취의 가장 좋은 시간은 아침 공복때에요. 과일이 가진 영양소 흡수가 빠르게 이뤄지고 수분이나 식이섬유로 포만감도 느껴져 다음 식사량을 자연스럽게 줄여줄 수 있거든요. 체중 조절에도 도움이 될 거에요.	과일 섭취 시간	http://www.updownnews.co.kr/news/articleView.html?idxno=300726	2022/03/18	0	2022-07-20 16:04:20	2022-07-21 09:30:37
BK22000120	19	질문자	아침 식사를 과일로 대신하면 좋겠네요. 여름엔 맛있는 과일이 많으니 골고루 먹기에도 좋아서 부담없네요.				0	2022-07-20 16:04:20	2022-08-02 12:01:32
BK22000120	20	전문가	기온이 오르면서 더위를 많이 타는 분들은 아침부터 식사가 부담스럽게 느껴질 수 있어요. 그럴땐 시원하고 달콤한 과일로 입맛을 깨우는 것도 좋죠. 과일주스나 즙은 당분이 너무 높으니 가능한 생과일로 드시는걸 권장해요.				0	2022-07-20 16:04:20	2022-07-21 09:30:37
BK22000120	21	질문자	그렇군요. 편하게 먹고싶을 땐 주스를 찾기도하는데 웬만하면 생과일로 먹으려고 노력해야겠어요.				1	2022-07-20 16:04:20	2022-08-02 12:01:32
