id	utterance_id	role	text	search_query	search_URL	reference_date	terminate	regDate	updDate
BK22007305	1	질문자	제가 요즘 기력이 딸리는 것 같아서 삼계탕을 먹으려고 해요. 아무래도 보양식 하면 삼계탕이 가장 먼저 떠올라서요. 그런데 삼계탕은 정확하게 어떤 음식인가요?				0	2022-09-02 22:41:13	2022-09-14 13:39:21
BK22007305	2	전문가	삼계탕은 닭 한 마리를 통째로 고아 만드는 음식이에요. 인삼, 대추, 생강, 마늘 등을 넣어서 말이죠. 한국의 대표 요리 중 하나인데, 주로 삼복에 먹죠.	삼계탕	https://ko.wikipedia.org/wiki/%EC%82%BC%EA%B3%84%ED%83%95	2022/08/20	0	2022-09-02 22:41:13	2022-09-02 22:41:13
BK22007305	3	질문자	삼복이라고 하니까 생각났는데, 복날이라는 문화는 한국에서 시작된 건가요?				0	2022-09-02 22:41:13	2022-09-02 22:41:13
BK22007305	4	전문가	아니요, 중국에서 시작되었어요. 중국의 사기를 보면 진의 덕공 2년에 시작되었어요. 진나라와 한나라 이후에 중국에서 삼복을 숭상하여 조정에서 신하들에게 고기를 나누어주었다고 해요. 일반 백성들도 여름의 더위 때문에 식욕이 떨어질까 봐 육류나 영양가 높은 음식을 먹었고요.	복날	https://ko.wikipedia.org/wiki/%EB%B3%B5%EB%82%A0	2022/08/05	0	2022-09-02 22:41:13	2022-09-14 13:39:21
BK22007305	5	질문자	중국에서 시작된 문화가 한반도까지 전파되었나 보네요. 그렇다면 삼계탕이라는 음식 자체의 역사는 얼마나 오래 되었나요?				0	2022-09-02 22:41:13	2022-09-02 22:41:13
BK22007305	6	전문가	삼계탕이라는 음식의 역사는 사실 그렇게 오래 되지 않았어요. 1960년대에 양계 산업이 본격화되면서 대중화된 음식이거든요. 비교적 근대의 음식이라고 볼 수 있죠.	삼계탕 역사	http://www.ohmynews.com/NWS_Web/View/at_pg.aspx?CNTN_CD=A0002757533&CMPT_CD=P0010&utm_source=naver&utm_medium=newsearch&utm_campaign=naver_news	2021/07/10	0	2022-09-02 22:41:13	2022-09-02 22:41:13
BK22007305	7	질문자	저는 삼계탕이 엄청나게 오래된 음식인 줄 알았지 뭐예요. 그런데 삼계탕은 얼마나 영양이 풍부하길래 보양식의 대표격이 된 건가요?				0	2022-09-02 22:41:13	2022-09-02 22:41:13
BK22007305	8	전문가	일단 삼계탕의 주재료인 닭에는 단백질이 풍부해서 면역력을 높이는 데 좋죠. 왜냐하면 우리 몸의 면역 세포가 단백질로 이루어져 있거든요. 그러니 단백질이 부족할 때 잘 보충해줘야 하는 거죠. 게다가 삼계탕을 만들 때 쓰이는 인삼이나 마늘 등도 몸에 좋은 재료고 말이에요.	삼계탕 영양성분	https://www.ekn.kr/web/view.php?key=374680	2018/07/17	0	2022-09-02 22:41:13	2022-09-02 22:41:13
BK22007305	9	질문자	우리 몸의 면역 세포가 단백질이었다니 몰랐네요. 그런데 삼계탕이 영양이 높다면 그만큼 칼로리도 높을 것 같아요. 그렇지 않나요?				0	2022-09-02 22:41:13	2022-09-02 22:41:13
BK22007305	10	전문가	식품의약품안전처의 영양성분 분석에 따르면 삼계탕의 열량은 918kcal예요. 1000g을 기준으로 말이에요. 우리나라 성인 남녀의 1일 에너지 섭취량이 2000~2600kcal, 1600~2100kcal임을 고려해본다면 꽤나 높다고 할 수 있죠. 하루에 필요한 에너지의 반 정도를 삼계탕 하나로 섭취하는 거니까 말이에요.	삼계탕 칼로리	https://www.donga.com/news/article/all/20180717/91089136/2	2018/07/17	0	2022-09-02 22:41:13	2022-09-14 13:39:21
BK22007305	11	질문자	그런데 저는 삼계탕을 먹으면 하루 종일 배가 부르기 때문에, 그 정도의 칼로리는 별로 문제가 될 것 같지 않네요. 그런데 문제는 가격이죠. 요새 물가가 너무 올랐는데 삼계탕은 요새 얼마 하나요?				0	2022-09-02 22:41:14	2022-09-02 22:41:14
BK22007305	12	전문가	이번 7월에 삼계탕 한 그릇의 가격이 15,000원을 처음으로 넘었어요. 6월에는 14,885원이었는데 말이에요.	삼계탕 가격	https://www.edaily.co.kr/news/read?newsId=01764646632424368&mediaCodeNo=257&OutLnkChk=Y	2022/08/05	0	2022-09-02 22:41:14	2022-09-02 22:41:14
BK22007305	13	질문자	와, 이제 삼계탕 한 그릇에 2만 원을 찍는 날도 오겠는데요? 요새 물가가 진짜 너무 심하게 오르는 것 같아요. 그런데 요즘 세대들도 삼계탕을 보양식으로 많이 먹나요?				0	2022-09-02 22:41:14	2022-09-14 13:39:21
BK22007305	14	전문가	사실 삼계탕 말고도 백숙이 우리나라 최고의 보양식이죠. 각종 한약재와 토종 닭으로 만들었으니까요. 그런데 요새 MZ세대에게는 복날에는 삼계탕이라는 공식이 통하지 않아요. 대신 치킨을 먹죠.	MZ세대 보양식	https://newsis.com/view/?id=NISX20220812_0001977482&cID=13001&pID=13000	2022/08/13	0	2022-09-02 22:41:14	2022-09-02 22:41:14
BK22007305	15	질문자	와, 역시나 세대별로 선호하는 음식이 다르군요. 그러면 복날에 삼계탕 대신 또 대신할 수 있는 보양식은 뭐가 있나요?				0	2022-09-02 22:41:14	2022-09-02 22:41:14
BK22007305	16	전문가	복날에는 삼계탕이라는 공식이 깨지면서 요새 다양한 콘셉트의 보양식들이 나오고 있어요. 그래서 삼계탕을 대체할 만한 식재료가 많이 소비되고 있는데, 장어와 문어 등 수산물 등을 한 예로 들 수 있죠.	삼계탕 대체 보양식	https://www.nocutnews.co.kr/news/5583844	2021/07/07	0	2022-09-02 22:41:14	2022-09-14 13:39:21
BK22007305	17	질문자	장어도 보양식의 대표주자 격이죠. 저는 삼계탕이랑 장어 둘 다 좋아해요.				0	2022-09-02 22:41:14	2022-09-02 22:41:14
BK22007305	18	전문가	그런데 이렇게 먹는 얘기를 하고 있으니까 슬슬 배가 고프네요. 시간도 늦었는데 이제 그만 들어가 볼까요?				0	2022-09-02 22:41:14	2022-09-14 13:39:21
BK22007305	19	질문자	네, 안 그래도 일어나려던 참이에요. 그럼 오늘도 즐거운 대화 감사하고 다음에 또 궁금한 게 있으면 찾아뵙겠습니다.				0	2022-09-02 22:41:14	2022-09-02 22:41:14
BK22007305	20	전문가	조심히 들어가시고 다음에 또 뵐게요.				1	2022-09-02 22:41:14	2022-09-14 13:39:21
