id	utterance_id	role	text	search_query	search_URL	reference_date	terminate	regDate	updDate
BK22013149	1	질문자	전문가님, 혹시 두부 좋아하세요?				0	2022-09-30 15:33:29	2022-10-01 18:03:26
BK22013149	2	전문가	네, 단백질도 많이 들어있고 칼슘도 풍부해서 즐겨 먹어요.				0	2022-09-30 15:33:29	2022-10-01 18:03:26
BK22013149	3	질문자	오늘 아침에 두부 반찬을 먹으면서 문득 그런 생각이 들더라고요. 대체 두부는 어떻게 만드는 걸까. 혹시 알고 계세요?				0	2022-09-30 15:33:29	2022-10-01 18:03:26
BK22013149	4	전문가	네, 물론 잘 알고 있습니다. 두부는 콩으로 만든 음식인데요. 콩을 물에 불려 매에 간 후 자루에 넣고 짠 다음 간수를 넣어 엉겨 붙게 만든 겁니다. 두부는 콩물에 간수 등을 넣고 굳힌 후에 각이 지도록 만든 가공식품이죠. 콩물로 두부를 제조하는 과정은, 우유에서 치즈를 만드는 과정과 비슷한 기술을 활용하고요.	두부	https://ko.wikipedia.org/wiki/%EB%91%90%EB%B6%80	2022/09/18	0	2022-09-30 15:33:29	2022-10-01 18:03:26
BK22013149	5	질문자	어떻게 보면 두부는 콩물로 만든 치즈군요. 그렇다면 두부는 언제 발명된 음식인가요?				0	2022-09-30 15:33:29	2022-10-01 18:03:26
BK22013149	6	전문가	문헌상으로는 기원전 164년 한나라 고조 유방의 손자인 회남왕 유안이 두부를 만들었다고 알려져 있습니다.	두부 회남왕 유안 발명	https://www.news1.kr/articles/?3594956	2019/04/13	0	2022-09-30 15:33:29	2022-10-01 18:03:26
BK22013149	7	질문자	와, 무려 기원전에 탄생한 요리군요. 그런데 우리나라 사람들도 두부를 많이 먹잖아요. 우리나라에는 언제 두부가 전파된 건가요?				0	2022-09-30 15:33:29	2022-10-01 18:03:26
BK22013149	8	전문가	기록상 우리나라에서는 고려 말 성리학자 이색이 쓴 목은집에 실린 시에 두부가 최초로 등장합니다. 나물국 오래 먹어 맛을 못 느껴 두부가 새로운 맛을 돋우어주네라고 적힌 구절이 있죠.	우리나라 두부에 관한 최초 기록	https://www.news1.kr/articles/?3594956	2019/04/13	0	2022-09-30 15:33:29	2022-10-01 18:03:26
BK22013149	9	질문자	아무리 늦어도 고려시대 말부터는 우리나라 사람들이 두부를 먹기 시작했다는 말씀이군요. 그건 그렇고 두부에는 연두부와 순두부가 있잖아요. 둘의 차이가 대체 뭔가요?				0	2022-09-30 15:33:29	2022-10-01 18:03:26
BK22013149	10	전문가	순두부는 콩물이 굳어졌을 때 수분을 빼지 않은 것을 의미합니다. 부드러운 질감에다 소화가 쉽다는 특징이 있죠. 연두부는 순두부와 거의 같은데, 포장 용기에 따라 순두부와 구별됩니다. 폴리에틸렌 같은 비닐 백에 담아서 팔면 순두부고, 플라스틱 용기에 넣은 것이 연두부죠.	연두부 순두부 차이	https://www.news1.kr/articles/?3594956	2019/04/13	0	2022-09-30 15:33:29	2022-10-01 18:03:26
BK22013149	11	질문자	아, 거의 같은데 그냥 포장 방법의 차이였군요. 그건 그렇고 두부 한 모에는 콩이 몇 개나 들어가나요?				0	2022-09-30 15:33:29	2022-10-01 18:03:26
BK22013149	12	전문가	보통 콩 1킬로그램으로 두부 3킬로그램이 만들어집니다. 두부 한 모의 무게는 제품마다 약간 차이가 있지만 보통은 300그램인데요. 콩 100그램으로 두부 한 모가 만들어지는 셈이죠. 콩 100그램에 들어가는 콩의 수를 계산해보면, 두부 한 모에 평균 338알의 콩이 들어갑니다.	두부 한 모 콩 338알	http://www.newsfs.com/news/articleView.html?idxno=17465	2019/04/26	0	2022-09-30 15:33:29	2022-10-01 18:03:26
BK22013149	13	질문자	두부 한 모를 먹으면 300알이 넘는 콩을 섭취하는 셈이군요. 그건 그렇고 북한 음식 중에 두부밥이라는 게 있다고 들었는데, 어떻게 만드는 음식인 건가요?				0	2022-09-30 15:33:30	2022-10-01 18:03:26
BK22013149	14	전문가	두부밥은 북한을 대표하는 길거리 음식 중의 하나인데요. 모양은 유부초밥과 흡사한데, 유부 대신 두부로 만듭니다. 두부 사이에 밥이 들어가 있는 모양입니다. 두부 한 모를 대각선 방향으로 반 가르고 기름에 튀긴 후, 그 속을 벌려서 안에 밥을 넣으면 완성됩니다.	북한 두부밥	http://www.mkhealth.co.kr/news/articleView.html?idxno=46282	2020/06/02	0	2022-09-30 15:33:30	2022-10-01 18:03:26
BK22013149	15	질문자	두부밥은 북한식 유부초밥인 셈이군요. 그렇다면 비지는 또 뭔가요?				0	2022-09-30 15:33:30	2022-10-01 18:03:26
BK22013149	16	전문가	두부를 제조할 때 콩물을 짠 후 남아있는 건더기를 의미합니다. 콩을 물에 불리고 나서 간다음 불로 열을 가하고 거즈로 여과합니다. 이때 콩물이 나오는데, 이것이 두유이고 거즈에 남아있는 고체 형태의 물질이 바로 비지죠.	두부 만드는 과정 비지	https://www.sisunnews.co.kr/news/articleView.html?idxno=51338	2017/03/06	0	2022-09-30 15:33:30	2022-10-01 18:03:26
BK22013149	17	질문자	두부 만드는 과정에서 나오는 부산물 같은 것이군요. 혹시 우리나라에서 두부로 유명한 곳이 있나요?				0	2022-09-30 15:33:30	2022-10-01 18:03:26
BK22013149	18	전문가	네, 바로 강릉시 초당동 초당두부촌입니다. 강릉의 초당순두부 하면 우리나라 전역에 이름이 알려져 있는데요. 초당순두부란 강릉시 초당두부촌에서 만든 두부를 의미합니다.	초당순두부 초당두부촌	http://www.kookje.co.kr/news2011/asp/newsbody.asp?code=0500&key=20220413.22017003310	2022/04/12	0	2022-09-30 15:33:30	2022-10-01 18:03:26
BK22013149	19	질문자	어우, 듣다 보니 침이 고이네요. 오늘 저녁에 두부로 요리해 먹어야겠어요. 그러면 다음에 또 뵐 때까지 안녕히 계세요.				0	2022-09-30 15:33:30	2022-10-01 18:03:26
BK22013149	20	전문가	네, 댁까지 조심해서 들어가세요.				1	2022-09-30 15:33:30	2022-10-01 18:03:26
