id	utterance_id	role	text	search_query	search_URL	reference_date	terminate	regDate	updDate
BK22004827	1	질문자	어제 마트 갔더니 카놀라유 세일 한다고 사람들 엄청 사더라고요. 몸에도 좋은 식물성 기름이니까 사람들이 그렇게 많이 사는거겠죠?				0	2022-08-06 02:54:44	2022-08-06 02:54:44
BK22004827	2	전문가	카놀라유에는 몸에 좋은 오메가3 지방산의 한 종류인 리놀렌산이 많고, 몸에 좋지 않은 포화지방산은 적어서 요리 하는 주부들 사이에서는 이미 국민 식용유로 불릴 만큼 인기가 높아요.	카놀라유 인기	https://kormedi.com/1211284/%EA%B5%AD%EB%AF%BC-%EC%8B%9D%EC%9A%A9%EC%9C%A0-%EC%B9%B4%EB%86%80%EB%9D%BC%EC%9C%A0-%EC%9E%A5%EB%8B%A8%EC%A0%90-%EC%95%8C%EA%B3%A0-%EB%A8%B9%EC%9E%90/	2014/07/02	0	2022-08-06 02:54:44	2022-08-06 02:54:44
BK22004827	3	질문자	전 그냥 충동구매 하는 것 같아서 1개만 샀는데, 더 살 걸 그랬나봐요. 그런데, 카놀라유면, 카놀라라는 식물에서 나온 기름이란 얘기인데, 혹시 카놀라라는 식물 아세요? 전 처음 듣는 이름이예요.				0	2022-08-06 02:54:44	2022-08-06 02:54:44
BK22004827	4	전문가	식물 이름으로는 들어보지 못한 게 당연해요. 카놀라는 식물 이름이 아니예요. 캐나다산을 의미하는 Canadian의 Can과 기름이라는 의미의 Oil, 적다는 뜻의 Low, 산성을 뜻하는 Acid의 맨 앞 알파벳을 조합해서 Canola라는 이름이 된거예요. 즉, 이름 자체는 식물명을 표시 한 것이 아니라, 캐나다산의 산성이 적은 기름이라는 의미일 뿐이예요.	카놀라유	https://ko.wikipedia.org/wiki/%EC%B9%B4%EB%86%80%EB%9D%BC%EC%9C%A0	2022/03/08	0	2022-08-06 02:54:44	2022-08-06 02:54:44
BK22004827	5	질문자	이름에 식물 표시가 없는데, 엄밀하게 보면 식물성이라고 할 수 없지 않아요?				0	2022-08-06 02:54:44	2022-08-06 02:54:44
BK22004827	6	전문가	이름만 그런 것이고, 카놀라유는 유채꽃씨에서 기름을 짜낸 식물성 기름 맞아요. 유채꽃에는 보통 동맥경화나 심장질환을 발생 시키는 독성물질 에루신산이 있어요. 캐나다 정부에서 이 독성물질을 거의 제거해서 개량된 유채꽃 품종을 개발했고, 이 개량된 유채꽃에서 기름을 추출한거죠.	카놀라유 유채꽃	https://kormedi.com/1211284/%EA%B5%AD%EB%AF%BC-%EC%8B%9D%EC%9A%A9%EC%9C%A0-%EC%B9%B4%EB%86%80%EB%9D%BC%EC%9C%A0-%EC%9E%A5%EB%8B%A8%EC%A0%90-%EC%95%8C%EA%B3%A0-%EB%A8%B9%EC%9E%90/	2014/07/02	0	2022-08-06 02:54:44	2022-08-06 02:54:44
BK22004827	7	질문자	그렇군요, 그런데 왜 하필 독성이 있는 유채꽃을 사용 했나 모르겠네요. 혹시나 완전 제거가 되지 않은 상태면 환자들에게는 좀 안좋을 것 같은데요.				0	2022-08-06 02:54:44	2022-08-06 02:54:44
BK22004827	8	전문가	독성보다는, 콩, 옥수수, 카놀라유 등에 많이 들어 있는 감마 토코페롤 형태의 비타민E 때문에 천식환자는 섭취하지 말아야 해요. 감마 토코페롤이 폐 기능에 아주 나쁜 영향을 끼친다는 것을 미국 노스웨스턴대학 약대 교수팀에서 대규모 연구를 실시해서 밝혀냈거든요.	카놀라유 천식	http://www.realfoods.co.kr/view.php?ud=20171121000570	2017/11/21	0	2022-08-06 02:54:44	2022-08-06 02:54:44
BK22004827	9	질문자	천식 환자는 아니지만, 요즘처럼 호흡기질환이 무서운 시기에는 맘 편하게 사용하기가 좀 꺼림직하네요. 가격도 다른 식물성 기름에 비해 너무 싸고, 혹시 다른 논란도 있는것 아니예요?				0	2022-08-06 02:54:44	2022-08-06 02:54:44
BK22004827	10	전문가	사실, 수입되고 있는 캐나다 등의 원재료들이 거의 다 유전자변형식품으로 알려져서 카놀라유가 과연 안전한 식품인지에 대한 논란이 있기는 해요.	카놀라유 유전자변형	https://kormedi.com/1211284/%EA%B5%AD%EB%AF%BC-%EC%8B%9D%EC%9A%A9%EC%9C%A0-%EC%B9%B4%EB%86%80%EB%9D%BC%EC%9C%A0-%EC%9E%A5%EB%8B%A8%EC%A0%90-%EC%95%8C%EA%B3%A0-%EB%A8%B9%EC%9E%90/	2014/07/02	0	2022-08-06 02:54:44	2022-08-06 02:54:44
BK22004827	11	질문자	싸고 좋은 기름인줄만 알았는데, 유전자변형식품이었군요. 그런데, 제가 산 카놀라유에 해썹 인증은 봤어도 GMO표시는 못봤는데요?				0	2022-08-06 02:54:44	2022-08-13 17:45:45
BK22004827	12	전문가	우리가 일상적으로 먹는 식품 중에 시중에서 판매되고 있는 대표적인 GMO 식품인 콩기름, 옥수수유, 카놀라유들은, 유전자변형식품이 분명해도, GMO표시가 거의 되지 않고 있어서 많은 사람들의 지적을 받고 있는게 현실이에요.	카놀라유 GMO표시	http://www.newsfreezone.co.kr/news/articleView.html?idxno=349464	2021/12/07	0	2022-08-06 02:54:44	2022-08-13 16:30:29
BK22004827	13	질문자	표시라도 제대로 해주면 알면서 먹는거니까 그러려니 할텐데, 아쉽네요. 소비자들은 나중에 알게 되니까 막연히 불안만 더 심해지고요. GMO가 아닌 식품이라도 표시해주면 좋겠는데, 그런 표시는 없나요?				0	2022-08-06 02:54:44	2022-08-13 16:30:29
BK22004827	14	전문가	유전자변형 단백질이 잔류 하지 않더라도 GMO를 사용한 식품이라면 모두 강제적으로 GMO 표시를 해야 한다는 것이 GMO 완전 표시제인데, 이 방안에는 GMO를 사용하지 않은 식품은 Non GMO라고 표시하자는 주장까지 담고 있는 제도에요. 하지만, 현재 정부와 국회에서는 시장의 혼란이 우려 된다는 이유로 Non GMO표시에 대해서는 반대 입장이에요.	GMO표시제	http://www.naeil.com/news_view/?id_art=429433	2022/07/14	0	2022-08-06 02:54:44	2022-08-14 00:45:58
BK22004827	15	질문자	GMO표시에 대해서는 상당한 진통이 있는 중이군요. 그런데, 유전자변형식품이 오랫동안 있었을텐데, 안전성에 대한 과학자들의 연구나 발표는 없었어요?				0	2022-08-06 02:54:44	2022-08-13 16:30:29
BK22004827	16	전문가	GMO의 유해성을 주장 하는 것은 과학적 근거가 없다는 입장을 미국과학한림원, 미국의사협회, 영국왕립협회 등이 밝혔고, 2016년에는 108명의 노벨상 수상자들도 GMO의 안전성을 지지하는 공동성명을 내놓았어요.	GMO 안전성	https://health.chosun.com/site/data/html_dir/2021/02/01/2021020102735.html	2021/02/01	0	2022-08-06 02:54:44	2022-08-06 02:54:44
BK22004827	17	질문자	과학자들 위주의 안전성 발표들이 있긴 있었군요. 하지만 계속 논란이 되는 것 보면 되도록이면 유전자변형 식품은 피하고 싶네요.				0	2022-08-06 02:54:44	2022-08-06 02:54:44
BK22004827	18	전문가	본인의 마음이 편해야 요리도 즐거워지는거니까 그렇게 하세요. 저도 모르면 모를까 알면서 일부러 선택하지는 않게 되더라고요.				0	2022-08-06 02:54:44	2022-08-06 02:54:44
BK22004827	19	질문자	사람 마음 다 비슷한가봐요. 오늘, 덕분에 유익한 정보들 알게 되었어요. 정말 감사해요.				1	2022-08-06 02:54:44	2022-08-23 08:29:04
BK22004827	20	전문가	유익한 정보가 되었다니 저도 좋네요. 다음에 또 뵈어요.				0	2022-08-06 02:54:44	2022-08-06 02:54:44
