id	utterance_id	role	text	search_query	search_URL	reference_date	terminate	regDate	updDate
BK22017930	1	질문자	아파트 분양권을 샀는데 매도자의 중도금 대출을 내가 인계 받아야한대. 중도금 대출이 정확히 무슨 의미인지 설명해줄래?				0	2022-10-21 02:51:32	2022-10-28 21:41:45
BK22017930	2	전문가	중도금 대출이란 아파트의 건설 기간 동안 통상 5, 6회 나눠어 실행되는 대출인데, 완공 후 입주 시기가 되면 잔금 대출을 받아야 해. 땅만 있는 상태에서 아파트를 먼저 분양하는 특수성을 반영해서 한국에서만 있는 독특한 대출 상품이라고 할 수 있어.	아파트 중도금대출	https://terms.naver.com/entry.naver?docId=3595662&cid=42107&categoryId=42107	2017/06/13	0	2022-10-21 02:51:32	2022-10-31 08:18:43
BK22017930	3	질문자	그러니까 아파트 건설 기간 동안 나누어 내야하는 대출을 내가 가져가야한다는 거구나. 근데 왜 중도금 대출을 사람들이 집단 대출이라고 하는거야?				0	2022-10-21 02:51:32	2022-10-28 23:05:21
BK22017930	4	전문가	그건 중도금 대출이 개별 심사 없이 특정 집단을 대상으로 일괄 승인해서 주는 대출이기 때문이야. 신규아파트 분양자, 재건축 아파트 소유자 등을 대상으로 하는 이주비, 중도금, 잔금 등 주택관련대출을 집단대출이라고 해.	집단 대출	https://terms.naver.com/entry.naver?docId=2065674&cid=50305&categoryId=50305	2017/06/15	0	2022-10-21 02:51:32	2022-10-21 03:41:23
BK22017930	5	질문자	이해했어, 근데 중도금은 집단 대출을 해주는데 만약에 입주 시점에 돈이 모자르면 어떻게 돼? 입주 시점에 중도금 대출을 연장 할 수 있어?				0	2022-10-21 02:51:32	2022-10-21 03:41:23
BK22017930	6	전문가	입주 시점에는 잔금 대출로 바꿔야 해. 잔금 대출은 신규 아파트를 분양 받은 사람들이 금융회사에서 집단으로 받는 대출이야. 중도금 대출 미상환액이 포함되지.	잔금대출	https://terms.naver.com/entry.naver?docId=3536505&cid=42107&categoryId=42107	2016/12/21	0	2022-10-21 02:51:32	2022-10-28 21:16:52
BK22017930	7	질문자	그러면 잔금대출은 주택담보대출이랑 비슷한 거야?				0	2022-10-21 02:51:32	2022-10-28 21:16:52
BK22017930	8	전문가	그렇지 않아, 둘 다 아파트를 담보로 대출을 해주긴 하지만 등기가 나오기 전 신청하는 대출이냐, 등기가 나온 후 신청하는 대출이냐 하는 차이가 있어. 보통 잔금 대출은 신축 분양의 등기부 등본이 나오기 전에 실행하기 때문에 시공사와 특정 은행이 계약을 맺고 집단 대출로 진행해.	잔금 대출 주택담보대출 차이	https://www.youthkor.com/%EC%9E%94%EA%B8%88%EB%8C%80%EC%B6%9C-%EC%A3%BC%ED%83%9D%EB%8B%B4%EB%B3%B4%EB%8C%80%EC%B6%9C-%EC%B0%A8%EC%9D%B4/	2022/08/15	0	2022-10-21 02:51:32	2022-10-21 03:41:23
BK22017930	9	질문자	그렇구나, 잔금 대출과 주담대는 비슷하면서도 다르네. 근데 주변에 잔금 대출보다 주담대로 갈아타는게 낫다는데 대출을 받으려니 용어가 너무 어려워.				0	2022-10-21 02:51:32	2022-10-21 03:41:23
BK22017930	10	전문가	맞아, DSR, DTI, LTV, 이런 용어들이 어렵긴 하지. 하지만 이런 용어들이 대출 한도를 정하는 방법들이니까 알아두면 좋아.				0	2022-10-21 02:51:32	2022-10-21 03:41:23
BK22017930	11	질문자	네 말이 맞아, 대출을 받으려면 정책을 알아야지. 먼저 DSR에 대해 설명해줄래?				0	2022-10-21 02:51:32	2022-10-21 03:41:23
BK22017930	12	전문가	DSR을 우리말로 풀면 총부채원리금상환비율이야. 즉, 자신의 연간 소득 대비 갚아야 할 원금과 이자를 더한 금액이지. 이때 수치가 낮을수록 내 소득 대비 갚아야 할 금액이 적다, 즉 상환능력이 높다는 의미야. 이 갚아야할 원금과 이자에는 주담대 원리금 뿐만 아니라 자동차 할부금, 학자금 대출, 카드론, 마이너스통장 등 모든 대출이 포함돼. 단, 전세대출, 중도금대출, 소액 신용대출 등은 제외돼.	DSR	https://www.fntimes.com/html/view.php?ud=2022070302004236dd55077bc2_18	2022/07/11	0	2022-10-21 02:51:32	2022-10-21 04:04:03
BK22017930	13	질문자	조금 어렵긴하지만 이해했어. 그러니까 내 소득대비 대출의 원리금을 얼마나 갚을 수 있느냐를 보는 거구나. 그러면 DTI는 뭐야?				0	2022-10-21 02:51:32	2022-10-21 04:04:03
BK22017930	14	전문가	DTI는 총부채상환비율인데 DSR과 마찬가지로 연소득 대비 상환능력을 보겠다는 거야. 다른 건 같지만 DSR이 주담대포함 모든 대출의 갚을 능력을 본다면, DTI는 기타 대출의 경우, 연간 상환액에 원금을 제외한 이자 상환액만 포함해 계산하겠다는 거지.	DTI	https://www.fntimes.com/html/view.php?ud=2022070302004236dd55077bc2_18	2022/07/11	0	2022-10-21 02:51:32	2022-10-28 21:16:52
BK22017930	15	질문자	머리가 터질 것 같아. 앞으로 몇번은 더 봐야 이해하겠는걸. 그러면 이번엔 LTV의 개념에 대해 설명해줄래?				0	2022-10-21 02:51:32	2022-10-21 04:04:03
BK22017930	16	전문가	LTV는 이 주택을 담보로 얼마나 대출이 나오느냐 하는 거야. 예를들어 LTV가 70%고, 3억짜리 주택을 담보로 돈을 빌린다면 최대 2억 1천만원까지 나오게 되는거지.	LTV	https://terms.naver.com/entry.naver?docId=2080142&cid=50305&categoryId=50305	2017/11/10	0	2022-10-21 02:51:32	2022-10-21 04:04:03
BK22017930	17	질문자	오, LTV는 금방 이해했어. 그러면 이 LTV는 전국이 똑같아? 아니면 아파트, 빌라에 따라 다른건가?				0	2022-10-21 02:51:32	2022-10-21 04:04:03
BK22017930	18	전문가	LTV는 지역이나 가격에 따라 달라. 예를들어 투기 과열 지구의 경우 주택이 9억 이하라면 40%를 대출 받을 수 있고, 9억을 초과하면 20%까지만 대출 받을 수 있어. 반면에 조정지역에서는 9억 이하라면 50%, 9억 초과라면 30%까지 대출이 나와.	투기과열지구 LTV	https://news.kbs.co.kr/news/view.do?ncd=5560831&ref=A	2022/09/21	0	2022-10-21 02:51:32	2022-10-21 04:04:03
BK22017930	19	질문자	그러니까 투기 과열 지구나 비싼 주택에 대해서는 대출을 많이 주지 않겠다는 거구나. 대출 받기 어렵다고 하더니 내가 직접 알아보니 더 막막한 거 같아. 그리고 대출 받을 때 자금 조달 계획서라는 걸 제출하라는데 이게 뭐야?				0	2022-10-21 02:51:32	2022-10-21 04:04:03
BK22017930	20	전문가	자금 조달 계획서는 쉽게 말해 내가 그 집을 사는데 돈을 어떻게 마련할건지 적는거야. 금융기관 예금액, 부동산 매도액, 주식 채권 매각 대금, 현금 등 자기 자금과 LTV, DTI, 그리고 기존의 내 대출사항까지 모두 적어야 해.	자금조달계획서	https://terms.naver.com/entry.naver?docId=2401457&cid=51281&categoryId=51285	2014/01/05	0	2022-10-21 02:51:32	2022-10-21 04:04:03
BK22017930	21	질문자	와, 대출을 받는 건 정말 쉽지 않구나. 중간에 삐긋하면 대출이 생각만큼 안나올 수 있으니 자금 계획을 잘 세워야겠다.				0	2022-10-21 03:41:23	2022-10-21 04:04:03
BK22017930	22	전문가	꼼꼼하게 잘 처리하리라고 믿어. 혹시 준비하다가 모르는게 있으면 언제든지 물어보고. 좋은 시간 보내.				1	2022-10-21 03:41:23	2022-10-31 08:18:43
