id	utterance_id	role	text	search_query	search_URL	reference_date	terminate	regDate	updDate
BK22011557	1	질문자	오늘 친구들을 만났다가 충격받았어요. 저만 주택청약통장이 없더라구요. 그래서 주택청약통장을 만들려고 하는데 어디에서 만들 수 있나요?				0	2022-09-25 04:34:25	2022-09-25 04:34:25
BK22011557	2	전문가	주로 이용하는 은행 어플에 접속한 후 주택청약종합저축 상품을 찾아서 가입하면 돼요. 따로 은행을 방문하거나 별도의 서류도 필요하지 않기 때문에 매우 간단하게 만들 수 있어요. 그리고 만약 만 19세~34세의 나이에 직전년도 소득이 3000만원 이하인 경우에는 소득증명서만 추가로 제출하면 비과세 혜택을 받을 수 있는 청년 우대형 주택청약종합저축에도 가입할 수 있다는 점 참고해주세요.	주택청약통장 만들기	http://news.bizwatch.co.kr/article/real_estate/2022/05/19/0018	2022/05/19	0	2022-09-25 04:34:25	2022-09-25 04:34:25
BK22011557	3	질문자	방법이 너무 간단하네요. 그런데 친구들이 저한테 주택청약을 통해서 공공주택에 청약을 해보라고 하던데, 공공주택에도 종류가 여러개더라구요. 공공주택의 종류에 대해 설명해 주실 수 있나요?				0	2022-09-25 04:34:25	2022-09-25 04:34:25
BK22011557	4	전문가	공공주택이란 공공주택 사업자가 국가나 지방자치단체의 재정이나 주택도시기금을 지원받아 건설이나 매입을 통해 공급하는 주택으로 공공임대주택과 공공분양주택으로 구분이 돼요. 먼저 공공임대 주택은 임대나 임대 후 분양전환을 목적으로 공급하는 주택을 말하고, 공공분양주택은 분양을 목적으로 공급하는 주택을 말해요. 그리고 공공임대주택은 공공건설임대주택과 공공매입임대주택으로 구분할 수 있는데요. 공공건설임대주택은 공공주택 특별법에 따른 공공주택 사업자가 직접 건설하여 공급하는 공공임대주택에 속해요.	공공주택이란?	https://www.gukjenews.com/news/articleView.html?idxno=2401464	2022/02/03	0	2022-09-25 04:34:25	2022-09-25 04:34:25
BK22011557	5	질문자	아, 어떤 차이가 있는지 정확히 이해했어요. 그럼 공공주택 청약을 위해서는 매월 얼마씩 납입을 하는게 좋을까요?				0	2022-09-25 04:34:25	2022-09-25 04:34:25
BK22011557	6	전문가	공공주택 청약에서 1회당 인정되는 최대 납입금액이 10만원이기 때문에 매월 10만원씩 예치하는게 좋아요.	공공주택 청약 월 납입금액	https://www.newsis.com/view/?id=NISX20200828_0001146444	2020/08/29	0	2022-09-25 04:34:25	2022-09-25 04:34:25
BK22011557	7	질문자	월 10만원이면 많이 부담되지 않는 금액이라 적당한 것 같아요. 그리고 저는 생애최초 특별공급 주택청약도 관심이 있는데요. 이건 혹시 신청가능한 조건이 따로 있을까요?				0	2022-09-25 04:34:25	2022-09-25 04:34:25
BK22011557	8	전문가	생애최초 특별공급은 생애 첫 주택을 구입하는 사람들에 한하여 적용되는 청약으로 한 번이라도 주택을 보유한 이력이 있다면 신청이 불가해요. 청약이 가능한 조건은 5년 이상 소득세를 납부하고 있어야 하고 초등 최대 160% 이하여야만 가능해요. 생애최초 특별공급은 추첨으로 신청하지만 저소득층에게 70%를 우선공급을 해주고 있고, 생애최초로 신청을 하는 경우에는 선납금을 포함하여 600만원 이상 납입이 된 경우에 신청이 가능합니다.	생애최초 특별공급 주택청약 신청조건	http://www.sisacast.kr/news/articleView.html?idxno=35329	2022/09/01	0	2022-09-25 04:34:25	2022-10-06 10:03:46
BK22011557	9	질문자	다행히 저는 신청이 가능할 것 같아요. 그런데 아파트 청약 일정은 어디에서 확인을 할 수 있나요? 청약을 하고 싶어도 일정을 모르니 어떻게 신청을 해야하는지 모르겠어요.				0	2022-09-25 04:34:25	2022-09-25 04:34:25
BK22011557	10	전문가	전국의 분양 아파트나 민간 임대 청약 일정은 청약홈 사이트의 청약 캘린더를 통해 확인이 가능해요. 그리고 청약홈에서 알림 서비스도 제공하고 있기 때문에 문자나 카톡으로도 원하는 지역의 분양공고를 확인할 수 있어요.	청약일정 확인방법	https://www.sedaily.com/NewsView/26B4FJHS5X	2022/09/18	0	2022-09-25 04:34:25	2022-10-06 10:03:46
BK22011557	11	질문자	아하, 일정 확인을 아주 간단하게 할 수 있네요. 그리고 주택청약통장에 납입한 금액도 연말정산에서 소득공제를 받을 수 있다고 하더라구요. 주택청약금액의 소득공제는 얼마나 받을 수 있는 건가요?				0	2022-09-25 04:34:25	2022-09-25 04:34:25
BK22011557	12	전문가	청약통장으로 받을 수 있는 소득공제는 연간 240만원 한도 내에서 납입한 금액의 40%까지, 최대 96만원을 공제 받을 수 있어요. 단, 연간 총 급여액이 7000만원 이하인 근로자로써 과세연도중 주택을 보유하지 않은 세대의 세대주에 해당해야 소득공제가 가능하다는 점 참고해주세요.	주택청약 소득공제	https://biz.newdaily.co.kr/site/data/html/2020/12/10/2020121000163.html	2020/12/10	0	2022-09-25 04:34:25	2022-09-25 04:34:25
BK22011557	13	질문자	그럼 10만원씩 납입을 하면 48만원을 공제받을 수 있는거네요. 그런데 주택청약에 당첨된 사람들이 청약을 포기하면 무순위 청약과 선착순 분양을 다시 모집하잖아요. 무순위 청약과 선착순 분양의 차이점은 뭔가요?				0	2022-09-25 04:34:25	2022-09-25 04:34:25
BK22011557	14	전문가	무순위 청약은 일반분양에서 청약경쟁률은 1대1 이상이었지만 계약 포기나 부적격의 사유로 최종적으로 미계약된 물량으로 청약홈에서 공고를 통해 인원을 모집한 후 추첨제를 통해 당첨자를 선정하는 방식을 말하고 선착순 계약은 최초에 분양을 할 때부터 인원 미달로 인하여 발생한 미분양 물량으로 분양회사가 선착순으로 모집하는 계약을 의미해요. 둘 다 유사한 방식이긴 하지만 무순위 청약은 해당 지역 내의 무주택 세대 구성원만 신청이 가능한 반면 선착순 계약의 경우에는 거주지나 세대주, 주택유무에 관계 없이 신청이 가능하다는 점에서 무순위 청약에 비해 선착순 계약 장점이 많은 편이에요.	주택청약 무순위와 선착순 차이	http://www.sisacast.kr/news/articleView.html?idxno=35303	2022/08/26	0	2022-09-25 04:34:25	2022-09-25 04:34:25
BK22011557	15	질문자	확실히 선착순 계약이 거주자나 세대주 유무에 관계가 없다고 하니 훨씬 유리한 것 같아요. 그런데 만약 주택청약에 당첨이 되고 나서 대출 등의 이유로 포기를 하게 된다면 어떤 제한사항이 있나요?				0	2022-09-25 04:34:25	2022-09-25 04:34:25
BK22011557	16	전문가	만약 청약에 당첨이 된 후 포기를 하게 된다면 최대 10년간 청약을 할 수 없고 점수 또한 초기화 되므로 신중하셔야 해요.	청약 담청 후 포기	https://www.dailypop.kr/news/articleView.html?idxno=60207	2022/05/30	0	2022-09-25 04:34:25	2022-09-25 04:34:25
BK22011557	17	질문자	10년간 청약이 불가하다니 당첨 후 포기 결정은 정말 신중해야겠네요. 오늘 정말 유용한 정보 많이 알려주셔서 너무 감사드려요.				0	2022-09-25 04:34:25	2022-09-25 04:34:25
BK22011557	18	전문가	아니에요, 제가 알려드린 정보가 도움이 됐으면 좋겠네요. 혹시 더 궁금한건 없으신가요?				0	2022-09-25 04:34:25	2022-09-25 04:34:25
BK22011557	19	질문자	이정도면 충분한 것 같아요. 정말 많은 도움이 됐어요. 전 그럼 이만 먼저 들어가보겠습니다.				1	2022-09-25 04:34:25	2022-10-06 10:03:46
BK22011557	20	전문가	도움이 됐다고 하니 기분이 좋네요. 네 그럼 저도 이만 들어가보겠습니다.				0	2022-09-25 04:34:25	2022-09-25 04:34:25
