id	utterance_id	role	text	search_query	search_URL	reference_date	terminate	regDate	updDate
BK22001655	1	질문자	집을 전세로 구하려고 하는데 전세 사기가 많아서 걱정이에요.				0	2022-07-20 16:18:13	2022-08-02 12:01:32
BK22001655	2	전문가	그러니까 말이에요, 요즘 전세시장이 불안하고 보증제도를 악용하는 사람이 많아서 전세집을 구하기 전에 많이 알아보고 구해야 해요.	전세사기 현황	https://newsis.com/view/?id=NISX20220602_0001894839&cID=10401&pID=10400	2022/06/02	0	2022-07-20 16:18:13	2022-07-21 10:49:17
BK22001655	3	질문자	전세 사기도 깡통전세랑 정보이 많다고 하더라고요. 전세사기 인지 확인하려면 어떤 것을 확인해야 하나요?				0	2022-07-20 16:18:13	2022-08-02 12:01:32
BK22001655	4	전문가	전세를 구해서 계약하기 전에 꼭 확인해야 할게 많더라고요. 실제 시세를 확인 해서 가격이 적절한지, 등기부 등본에 등기사항 증명서 확인하여 실제 소유자가 맞는지, 미납세금도 확인해서 선순위 권리관계에 대해 확실하게 알아보아야 해요	전세사기 예방방법	https://www.news1.kr/articles/?4704497	2022/06/07	0	2022-07-20 16:18:13	2022-07-21 10:49:17
BK22001655	5	질문자	방금 말씀해 주신 등기부등본이랑 미납세금이 있는지 확인 하고 나서 계약 하면 안전하겠죠?				0	2022-07-20 16:18:13	2022-08-02 12:01:32
BK22001655	6	전문가	이건 최소한의 확인 조건이고 전세 계약 후에 주택도시보증공사나 서울보증보험 등에서 보증해주는 전세보증보험에도 가입하는게 좋아요.  만약 임대인이 보증금을 돌려주지 않을 경우 보증사에서 반환해 주는 제도거든요.	전세 보증	https://www.edaily.co.kr/news/read?newsId=01426806632363032&mediaCodeNo=257&OutLnkChk=Y	2022/06/18	0	2022-07-20 16:18:13	2022-07-21 10:49:17
BK22001655	7	질문자	계약을 하고 나면 전세보증보험도 반드시 가입해야겠네요. 전세보증보험에 가입하려면 어떤 서류가 필요한가요?				0	2022-07-20 16:18:13	2022-08-02 12:01:32
BK22001655	8	전문가	전세보증보험에 가입하려면 계약서와 등기부등본을 공통적으로 제출하는데 필요한 서류는 보증사마다 약간씩 달라서 자세한 사항은 보증사에 직접 확인하는게 정확해요.	전세보증보험 서류	https://www.finda.co.kr/post/financial-life/19773	2019/06/13	0	2022-07-20 16:18:13	2022-07-21 10:49:17
BK22001655	9	질문자	전세보증보험은 전세이기만 하면 조건 없이 모두 가입 가능한가요?				0	2022-07-20 16:18:13	2022-08-02 12:01:32
BK22001655	10	전문가	아니요. 보증사 마다 가입조건이 달라요.  주택도시보증공사, SGI 서울보증공사, 한국주택금융공사 3군데에서 전세보증보험을 운영하니 내 상황에 맞는 보험사를 찾아서 확인이 필요해요.	전세보증보험 조건	https://it.donga.com/32535/	2021/09/20	0	2022-07-20 16:18:13	2022-07-21 10:49:17
BK22001655	11	질문자	보험사에 어떤 조건이 있는지 확인하고 집을 구해야 겠네요. 이렇게 알아보고 집을 구하더라도 사기를 당하는 경우도 있던데, 전세사기를 당한다면 어떻게 해야 하나요?				0	2022-07-20 16:18:13	2022-08-02 12:01:32
BK22001655	12	전문가	전세사기를 당했다면 전세금 반환 소송을 하는 방법 밖에는 없어요. 전세금 반환 내용증명을 보내면 임대인이 압박을 받아 전세금을 돌려주는 경우도 있으니 심리적 압박효과를 높이기 위해서라도 변호사를 통해 상담 받아 내용증명을 보내는 것이 좋아요.	전세사기 당하면	https://www.kukinews.com/newsView/kuk202105140190	2021/05/15	0	2022-07-20 16:18:13	2022-07-21 10:49:17
BK22001655	13	질문자	소송이라니 무섭네요. 소송을 진행할 때 주의해야 할 점이 있나요?				0	2022-07-20 16:18:13	2022-08-02 12:01:32
BK22001655	14	전문가	소송을 진행할 경우 보증금 반환 관련 법률 상담을 받아 대처해야 하는 것이 좋아요. 주의해야 할 것은 이사나 주민등록 이전은 임차권 등기명령이 부동산등기부에 기입된 것을 확인한 후에 진행해야 해요	전세금 반환 소송	http://www.kyeongin.com/main/view.php?key=20220606010000795	2022/06/07	0	2022-07-20 16:18:13	2022-07-21 10:49:17
BK22001655	15	질문자	잘 알겠습니다. 전세사기를 당하지 않는 것이 좋겠지만 당하는 경우에는 법률 상담을 받아서 해결해야겠네요. 최근 전세 대출 이자가 올랐다고 들었는데 얼마나 변동되었나요?				0	2022-07-20 16:18:13	2022-08-02 12:01:32
BK22001655	16	전문가	네, 전세대출과 주담대는 금융채 기준으로 책정되는데, 금융채 금리가 오르면서 전세대출 금리가 6퍼센트 대까지 올랐어요.	전세대출 이자	https://biz.chosun.com/stock/finance/2022/06/21/T6WVOLDMIRFWPKCVXD7YB3NFKQ/	2022/06/21	0	2022-07-20 16:18:13	2022-07-21 10:49:17
BK22001655	17	질문자	이자를 아낄 수 있는 방법은 없나요?				0	2022-07-20 16:18:13	2022-08-02 12:01:32
BK22001655	18	전문가	취업이나 승진으로 재산이 늘었거나, 신용등급이 올라갔다면 금리인하요구권을 신청해 볼 수 있어요. 변동금리로 되어 있다면 고정금리로 대출을 갈아타서 상환 부담을 줄일 수도 있답니다.	전세대출 금리	https://www.news1.kr/articles/?4715418	2022/06/19	0	2022-07-20 16:18:13	2022-07-21 10:49:17
BK22001655	19	질문자	계속 금리가 오를 예정이라면 처음부터 고정금리로 대출을 받는 것도 방법이 되겠네요.				0	2022-07-20 16:18:13	2022-08-02 12:01:32
BK22001655	20	전문가	맞아요. 고정금리는 대출 시점에서는 금리가 높지만 금리를 고정해 놓을 수 있어요. 금리가 계속 상승한다면 나중에는 고정금리 대출이 더 낮아질 때 이자를 아낄 수 있어요. 변동금리로 대출을 받았다면 고정금리인 대출로 갈아타는 방법도 있습니다. 대출을 갈아타기로 결정했다면 부대비용이 발생할 수 있어 남은 대출 기간과 중도상환수수료 등을 잘 따져봐야 해요.	고정금리 변동금리	http://www.dt.co.kr/contents.html?article_no=2022062002109963056001&ref=naver	2022/06/20	0	2022-07-20 16:18:13	2022-07-21 10:49:17
BK22001655	21	질문자	그럼 고정금리로 전세대출을 알아봐야겠어요. 덕분에 전세집 구하는 데 많은 도움이 되었어요.				1	2022-07-20 16:18:13	2022-08-02 12:01:32
