id	utterance_id	role	text	search_query	search_URL	reference_date	terminate	regDate	updDate
BK22019550	1	질문자	요즘은 진짜 월급 빼고 모두 다 오르는 것 같아요. 마트에서 장 볼 때마다 깜짝깜짝 놀란다니까요.				0	2022-10-28 13:01:12	2022-10-28 13:01:12
BK22019550	2	전문가	네, 맞아요. 특히 무작정 절약할 수도 없는 먹을거리가 너무 많이 올라서 더 힘든 것 같아요.				0	2022-10-28 13:01:12	2022-10-28 13:01:12
BK22019550	3	질문자	맞아요, 월급은 한정되어 있으니 재테크의 필요성을 절감하는 요즘이에요. 그래서 여쭤보는 건데 제 지인 중에 재테크를 굉장히 잘하는 분이 있거든요. 얼마 전까지만 해도 한창 주식으로 수익을 올린다고 하더니 요즘은 채권에 투자를 한다고 하는데 주식 투자에 집중하는 시기와 채권 투자에 집중하는 시기는 다른가요?				0	2022-10-28 13:01:12	2022-10-28 13:01:12
BK22019550	4	전문가	네, 주식 시장이 기울게 되면 채권에 대한 수요는 증가하는 경향을 보이기 때문에 흔히 채권과 주식을 시소에 빗대어 표현하기도 해요. 즉, 가격은 저렴해지지만 금리는 올라가므로 예금 대신 채권에 대한 수요가 발생하기 때문이에요.	채권과 주식의 관계	https://www.newspim.com/news/view/20221020000378	2022/10/23	0	2022-10-28 13:01:12	2022-10-31 08:27:32
BK22019550	5	질문자	그렇군요, 그럼 실제로 최근에 채권이 많이 팔리고 있는 추세인가요?				0	2022-10-28 13:01:12	2022-10-28 13:01:12
BK22019550	6	전문가	금융투자협회의 발표에 의하면 2022년 7월부터 9월까지 3개월간 9조 3400억 원 상당의 채권을 개인 투자자들이 순매수했어요. 이 액수는 2021년 같은 기간의 순매수액인 1조 2223억 원에 비해 8배 정도 많은 수준이죠.	채권 순매수 증가액	https://www.mk.co.kr/economy/view/2022/933351	2022/10/26	0	2022-10-28 13:01:12	2022-10-28 13:01:12
BK22019550	7	질문자	8배라니 굉장한 차이네요. 그런데 채권이라는 말은 많이 들어 봤는데 정확히 무엇을 의미하는지는 잘 모르겠어요. 채권에 대해 설명 좀 해 주실래요?				0	2022-10-28 13:01:12	2022-10-28 13:01:12
BK22019550	8	전문가	네, 그럴게요. 채권은 채무증서의 성격을 가진 유가증권으로 자금을 조달하기 위해 정부, 공공기관 또는 회사에서 발행하는 것이에요. 어느 곳에서 발행하느냐에 따라 다양한 명칭을 사용하는데, 정부에서 발행한 채권은 국채, 지자체에서 발행한 채권은 지방채, 회사에서 발행한 채권은 회사채라고 불러요.	채권	https://www.newspim.com/news/view/20221020000378	2022/10/23	0	2022-10-28 13:01:12	2022-10-28 13:01:12
BK22019550	9	질문자	아, 일반 기업 뿐만 아니라 정부나 지자체에서도 채권을 발행하는군요. 그럼 채권을 발행 주체로 구분하는 방법 말고 다른 분류 방법은 없나요?				0	2022-10-28 13:01:12	2022-10-28 13:01:12
BK22019550	10	전문가	있죠. 투자 기간에 따라 채권을 단기채와 장기채로 분류하기도 하거든요. 단기채는 일반적으로 1~2년 안에 상환하는 채권을 의미하고 그것보다 긴 기간 동안 투자하는 채권은 장기채라고 말해요.	채권 투자 기간에 따른 구분	https://www.newspim.com/news/view/20221020000378	2022/10/23	0	2022-10-28 13:01:12	2022-10-28 13:01:12
BK22019550	11	질문자	그렇군요, 그럼 만약 채권을 사고 싶다면 어떤 방법으로 살 수 있어요?				0	2022-10-28 13:01:12	2022-10-28 13:01:12
BK22019550	12	전문가	증권사의 홈트레이딩서비스 또는 모바일트레이딩서비스를 이용하면 채권을 매수할 수 있어요. 채권 가운데 한국거래소에 상장된 채권인 장내채권은 주식과 동일하게 호가에 매수와 매도가 가능한데, 공모채권청약을 통해 금융기관에서 매입한 물량을 올리기 때문에 어느 증권사를 선택하든 동일한 채권의 거래가 가능해요.	장내채권 거래 방법	https://www.newspim.com/news/view/20221020000378	2022/10/23	0	2022-10-28 13:01:12	2022-10-28 13:01:12
BK22019550	13	질문자	뭔가 어렵게 생각했는데 주식처럼 사고팔 수 있는 것이군요. 혹시 장내채권말고 다른 채권도 있나요? 거래 방법도 다른지 궁금하고요.				0	2022-10-28 13:01:12	2022-10-28 13:01:12
BK22019550	14	전문가	네, 장외채권이 있는데 사실상 대다수의 채권 거래는 이 장외채권 거래예요. 장외채권도 증권사에서 제공하는 거래 플랫폼을 이용해 매매할 수 있는데 장내채권과 달리 각 증권사에서 단독으로 보유하고 있는 채권 상품을 가지고 거래가 이루어져요. 따라서 증권사별로 취급하는 채권의 종류가 다르기 때문에 어떤 증권사를 선택해서 어떤 채권을 매수하느냐에 따라 수익률이 천차만별이죠.	장외채권 거래 방법	https://www.newspim.com/news/view/20221020000378	2022/10/23	0	2022-10-28 13:01:12	2022-10-28 13:01:12
BK22019550	15	질문자	그럼 장외채권을 매수하려면 여러 증권사를 확인할 필요가 있겠네요. 그런데 주식은 수익이 생기면 세금을 내잖아요. 채권도 수익에 대해 세금이 발생하나요?				0	2022-10-28 13:01:12	2022-10-28 13:01:12
BK22019550	16	전문가	어떤 수익이냐에 따라 달라요. 채권으로 얻을 수 있는 수익에는 이자 수익과 매매 차익이 있는데 이 가운데 이자 수익에 대해서는 만기가 되어 상환을 받을 때 15.4%의 세금을 제하고 나머지 금액을 지급 받을 수 있어요. 그렇지만 매매차익은 소득세법상 소득에 포함되지 않기 때문에 과세 대상이 아니구요.	채권 수익 과세 방법	https://www.newspim.com/news/view/20221020000378	2022/10/23	0	2022-10-28 13:01:12	2022-10-31 08:27:32
BK22019550	17	질문자	그렇군요, 그럼 마지막으로 채권에 투자를 할 때 유의해야 하는 사항은 무엇인지 설명 부탁드려도 될까요?				0	2022-10-28 13:01:12	2022-10-28 13:01:12
BK22019550	18	전문가	네, 채권에 투자할 때 유의해야 할 점은 만기수익률, 신용등급, 만기 등이에요. 일단 만기까지 채권을 보유했을 때 시장의 상황이 어떻게 변했는지와 상관없이 지급 받는 총 확정이자수익인 만기수익률을 잘 따져 봐야 하고, 해당 채권의 부도 위험은 어느 정도인지를 판단하는 지표이면서 차후 경제 상황의 변화로 인해 채권의 가격이 어떻게 변할지 예측할 수 있는 지표인 신용등급도 꼼꼼히 살펴 봐야 해요. 그리고 마지막으로 시중금리의 변동이 채권 가격에 어느 정도 민감하게 반영되는지를 결정하는 변수인 채권 만기도 잘 살펴 볼 필요가 있구요.	채권 투자 시 유의점	https://www.mk.co.kr/economy/view/2022/933351	2022/10/26	0	2022-10-28 13:01:12	2022-10-31 08:27:32
BK22019550	19	질문자	자세하게 설명해 주셔서 감사해요. 덕분에 채권에 대해서 어느 정도 머릿속에 정리가 되었어요.				0	2022-10-28 13:01:12	2022-10-28 13:01:12
BK22019550	20	전문가	제 설명이 도움이 되었다니 다행이네요. 재테크에 관해서 궁금한 게 있으면 언제든 물어보세요.				1	2022-10-28 13:01:12	2022-10-31 08:27:32
