id	utterance_id	role	text	search_query	search_URL	reference_date	terminate	regDate	updDate
BK22007072	1	질문자	나 시급 높은 아르바이트 하고 싶은데 어떤 아르바이트직종이 시급 높게 받을 수 있을까?				0	2022-09-01 08:10:23	2022-09-01 08:10:23
BK22007072	2	전문가	시급이 가장 높은 직종 1위는 퀵서비스로 시간당 평균 시급이 2만4477원으로 집계되었어.	시급 높은 알바직종	https://news.mt.co.kr/mtview.php?no=2022082610062547182	2022/08/26	0	2022-09-01 08:10:23	2022-09-01 08:10:23
BK22007072	3	질문자	평균 시급이 2만원 이상이라니 높기는 하다.지금 최저시급으로 월급 계산하면 얼마인거지?				0	2022-09-01 08:10:23	2022-09-01 08:10:23
BK22007072	4	전문가	2022년 현재 법정 최저임금은 최저시급 9160원에 주 40시간 근무에 유급 주휴 포함으로 기준했을 때 월급은 191만 4440원이야.	법정 최저시급	http://www.tvdaily.co.kr/read.php3?aid=16446405011625321002	2022/02/12	0	2022-09-01 08:10:23	2022-09-06 17:39:57
BK22007072	5	질문자	와 나는 최저시급도 못받고 일하고 있네. 나같은 청년들 중에 최저시급도 못받고 일하는 사람들 많은거 같은데 수치로 확인된게 있어?				0	2022-09-01 08:10:23	2022-09-01 13:08:30
BK22007072	6	전문가	수치로 확인된 자료가 있어. 22년도 7월13일 국민의힘 김웅 의원실이 최저임금위원회로부터 제출받은 자료에 따르면 2021년 24세 이하 근로자 중 최저임금 시급 8720원을 받지 못한 비율은 33.7%로 나타났어. 이건 전체 연령층 평균15.3%의 두 배 이상이야.	청년알바 최저임금	https://www.donga.com/news/article/all/20220714/114441246/1	2022/07/14	0	2022-09-01 08:10:23	2022-09-06 23:54:52
BK22007072	7	질문자	역시나 나같이 최저시급 못받는 경우도 많구나.퀵서비스가 시급이 높다고 하니 플랫폼 소속으로 일해볼까 싶은 생각이 드는데 고용보험은 가입이 되는걸까?				0	2022-09-01 08:10:23	2022-09-01 23:29:15
BK22007072	8	전문가	정부는 올해부터 플랫폼 종사자로 분류되는 퀵서비스와 대리운전 기사에게 고용보험을 적용하고 있어.	플랫폼 퀵서비스	https://newsis.com/view/?id=NISX20220415_0001834479&cID=10201&pID=10200	2022/04/15	0	2022-09-01 08:10:23	2022-09-01 23:29:15
BK22007072	9	질문자	고용보험이 적용 된다니 나중에 실업급여를 신청 할 수도 있겠는걸. 내 친구들도 작년에 실업급여라고 받는 애들이 있었는데 최근에는 실업급여 받는사람들이 늘었는지 줄었는지 궁금하네.				0	2022-09-01 08:10:23	2022-09-01 23:29:15
BK22007072	10	전문가	지난달 실업급여 지급 대상은 63만6천명으로 1년 전보다 9.7%인 6만8천명이 줄었어.	실업급여 증가 감소	http://news.bbsi.co.kr/news/articleView.html?idxno=3070945	2022/06/13	0	2022-09-01 08:10:23	2022-09-01 23:29:15
BK22007072	11	질문자	생각보다 많이 줄은거 같다. 근데 정확하게 실업급여라는게 뭐야? 얼마나 받을 수 있는건지 알려줄 수 있어?				0	2022-09-01 08:10:23	2022-09-06 17:39:57
BK22007072	12	전문가	실업급여는 실업자의 구직활동을 지원하기 위해 정부가 고용보험기금으로 지급하는 수당을 말해. 비자발적으로 퇴직한 직장인은 평균임금 60%를 최대 270일 동안 실업급여로 받을 수 있어.	실업급여 신청	https://www.edaily.co.kr/news/read?newsId=01102086632423384&mediaCodeNo=257&OutLnkChk=Y	2022/08/02	0	2022-09-01 08:10:28	2022-09-01 23:29:15
BK22007072	13	질문자	자세하게는 몰랐는데 알려줘서 고마워. 그런데 내 친구에게 이야기 들어보니까 실업급여를 부정적으로 받는 사람이 주변에 있어서 이번에 신고 했다고 하던데 실제로 이런일이 일어나는거야?				0	2022-09-01 08:10:28	2022-09-06 17:39:57
BK22007072	14	전문가	맞아. 고용노동부에 따르면 부정수급 제보는 매년 급증하고 있고 2022년 5월 말 기준 부정수급 제보 978건이 접수되어 총 18억원의 부정수급을 적발하였어.	실업급여 부정수급 신고	https://www.nbntv.co.kr/news/articleView.html?idxno=981309	2022/07/07	0	2022-09-01 08:10:23	2022-09-06 17:39:57
BK22007072	15	질문자	내가 생각했던것보다 정말 많은 건수가 적발 되고 있구나. 근데 실업급여는 스스로 그만 둔 경우에는 신청이 안되는거지?				0	2022-09-01 08:10:28	2022-09-09 20:25:11
BK22007072	16	전문가	그렇지는 않아. 퇴직일 전으로 1년 이내에 2개월 이상 근로조건 미달이나 임금을 못받았을때, 그리고 최저임금에 미치지 못하거나 연장근로 제한 위반 등이 있는 경우, 종교,성별,신체,노조활동 등의 이유로 불합리한 차별을 받거나 성희롱,성폭력 등 성적 괴롭힘, 직장 내 괴롭힘, 도산이나 폐업이 확실할때, 그리고 대량 감원 예정, 인원 감축 불가피로 고용조정 계획에 따른 퇴직 희망자 모집으로 퇴사할 경우나 사업장 이전이나 전근 등의 사유로 왕복 3시간 이상이 소요되게 되었을 경우에는 예외적으로 지급 받을 수 있어.	실업급여 조건	http://www.jemin.com/news/articleView.html?idxno=741970	2022/08/16	0	2022-09-01 08:10:28	2022-09-13 08:33:28
BK22007072	17	질문자	이건 일하면서 내가 진짜 알아둬야 하는 정보다. 이런거는 사장들이 잘 안알려주잖아.				0	2022-09-01 08:10:28	2022-09-09 20:25:11
BK22007072	18	전문가	그래 일하면서 도움이 되는 정보들이니까 알아두면 좋지.				0	2022-09-01 08:10:28	2022-09-09 20:25:11
BK22007072	19	질문자	덕분에 오늘 많은 정보들을 얻어서 나에게 큰 도움이 되었어 너무 고마워.				0	2022-09-01 08:10:28	2022-09-01 23:29:15
BK22007072	20	전문가	너에게 도움이 되었다니까 나도 기쁘다.				1	2022-09-01 08:10:28	2022-09-13 08:33:28
