id	utterance_id	role	text	search_query	search_URL	reference_date	terminate	regDate	updDate
BK22019385	1	질문자	제가 이번 학기를 마지막으로 간호과를 졸업하게 되거든요. 그런데 간호사로 일하고 싶지는 않지만 전공과 관련있는 일자리에서 일하려고 좀 찾아봤는데 생명윤리운영원이라는 직업이 있더라고요. 생명윤리운영원은 어떤 직업인가요?				0	2022-10-26 14:57:46	2022-10-26 15:26:30
BK22019385	2	전문가	의학연구윤리심의위원회인 IRB의 행정일을 맡아하는 생명윤리운영원은 IRB 역할 수행에 요구되는 행정적인 지원 업무를 진행하는 전문가에요. 생명윤리운영원은 IRB에 낸 연구계획 관련서류를 미리 검토하고 접수하며 안건에 대한 논의를 진행하기 위해 미리 준비업무를 진행해요. 또한 관계된 법령에 해당하는 표준운영지침서인 SOP와 연구윤리교육에 관한 관리도 맡아요. 전문역량이 누적되면 임상시험에 연관된 정책 설정에 참여하기도 해요.	생명윤리운영원	https://www.news2day.co.kr/article/20221007500107	2022/10/10	0	2022-10-26 14:57:46	2022-10-27 16:36:40
BK22019385	3	질문자	그렇군요, 그런데 생명윤리운영원의 연봉은 어느 정도 인가요?				0	2022-10-26 14:57:46	2022-10-26 14:57:46
BK22019385	4	전문가	초봉을 기준으로 월 150만원 부터 시작해서 정규직 3년차를 기준으로 해서 종합병원에서 일하는 경우 연봉은 3800만원 정도에요.	생명윤리운영원 연봉	https://www.news2day.co.kr/article/20221007500107	2022/10/10	0	2022-10-26 14:57:46	2022-10-26 14:57:46
BK22019385	5	질문자	처우가 나쁘지 않네요. 그럼 생명윤리운영원이 되려면 어떤 능력이나 자질이 필수적인가요?				0	2022-10-26 14:57:46	2022-10-26 15:26:30
BK22019385	6	전문가	연구자와 심의위원 간 또는 과학계 위원과 비 과학계 위원 간 문제에 대한 이해 정도와 입장 차이가 존재하기 때문에 둘 사이를 이어줄 수 있는 정보의 전달능력 혹은 의사소통능력이 요구돼요. 또 연관된 법령과 의학용어에 대한 지식이 꼭 필요하죠. 평소에 의학 분야에 많은 주의를 기울여야 하고 비 전공자의 경우 관련 교육 자료를 살펴보는 것도 도움이 돼요. 그리고 해외 자료를 참조하는 경우가 많으므로 어느 정도 이상의 외국어능력도 필요해요.	생명윤리운영원 능력	https://www.news2day.co.kr/article/20221007500107	2022/10/10	0	2022-10-26 14:57:46	2022-10-26 15:26:30
BK22019385	7	질문자	의학 분야의 교육 자료를 살펴보는게 도움이 된다고 하셨는데 관련 자료는 어디서 찾거나 수강할 수 있나요?				0	2022-10-26 14:57:49	2022-10-26 15:26:30
BK22019385	8	전문가	교육과정으로는 대한기관윤리심의기구협의회인 KAIRB가 복지부로부터 위임 받아 하는 교육을 수강할 수 있어요. 또 공용 IRB에 연관된 국가생명윤리정책연구원에서 맡아서 하는 교육도 있어요.	생명윤리운영원 교육과정	https://www.news2day.co.kr/article/20221007500107	2022/10/10	0	2022-10-26 14:57:49	2022-10-26 15:26:30
BK22019385	9	질문자	그렇군요, 그런데 교육 과정은 어떻게 이뤄져 있나요?				0	2022-10-26 14:57:49	2022-10-26 15:26:30
BK22019385	10	전문가	기본과정은 임상연구와 연관된 국내외 법규의 이해와 적용, IRB심의대상과 심의방법의 이해, 회의진행과 회의로 통보서 작성, SOP에 관한 내용이 주를 이뤄요. 심화과정은 IRB 위원의 역할, 임상연구 개요와 용어, 동의에 관한 내용을 가르치고 있어요.	생명윤리운영원 기본과정 심화과정	https://www.news2day.co.kr/article/20221007500107	2022/10/10	0	2022-10-26 14:57:49	2022-10-26 15:26:30
BK22019385	11	질문자	교육과정을 기본과 심화과정으로 나눠서 체계적으로 가르치고 있군요. 그런데 우리나라에는 몇 개의 IRB가 있나요?				0	2022-10-26 14:57:52	2022-10-26 16:08:28
BK22019385	12	전문가	국내 IRB는 공용과 기관으로 나눠져요. 공용IRB는 2014년 기준 국가생명윤리정책연구원이 유일하며 그 외는 전부 기관 IRB이죠. 기관 IRB는 병원, 학교가 다수이며 일부 연구소 등을 합쳐 총 590개가 있어요. 이 기관 IRB 590개에는 630개의 기관위원회가 있고 그 중 548개 위원회는 독립적으로 설치 및 운영하고 있어요. 반면 82개 위원회는 타 기관의 기관위원회나 공용위원회와의 규약으로 업무를 맡아 관리하고 있어요.	국내 IRB	https://www.news2day.co.kr/article/20221007500107	2022/10/10	0	2022-10-26 14:57:49	2022-10-27 16:36:40
BK22019385	13	질문자	그렇군요, 그럼 운영회에 행정간사는 몇 명이나 되나요?				0	2022-10-26 14:57:52	2022-10-26 16:08:28
BK22019385	14	전문가	보통 기관위원회에 1~3명의 행정간사가 일하는 것으로 미루어 봤을 때 전체 인원은 1000여명 내외로 추정돼요. 하지만 규모가 작은 곳의 경우 행정직원이나 간호사가 업무를 함께하는 경우가 있어서 숫자를 정확히 알기는 어려워요.	기관위원회 행정간사	https://www.news2day.co.kr/article/20221007500107	2022/10/10	0	2022-10-26 14:57:49	2022-10-27 16:36:40
BK22019385	15	질문자	행정직원이나 간호사가 업무를 겸임하기도 하는군요. 그런데 생명윤리운영원의 전망은 어떤가요?				0	2022-10-26 14:57:49	2022-10-26 16:08:28
BK22019385	16	전문가	임상연구시장은 이미 성장세에 있기 때문에, 앞으로 심의, 관리 등 가교자의 역할을 하고 있는 전문 행정간사의 수요가 많아질 것으로 보고 있어요.	행정간사 수요	https://www.news2day.co.kr/article/20221007500107	2022/10/10	0	2022-10-26 14:57:49	2022-10-27 16:36:40
BK22019385	17	질문자	그렇군요, 해볼 만한 직업이라는 생각이 드네요.				0	2022-10-26 14:57:52	2022-10-26 16:08:28
BK22019385	18	전문가	네, 게다가 전공이 간호과시니까 더 유리하실거에요.				0	2022-10-26 14:57:52	2022-10-26 16:08:28
BK22019385	19	질문자	오늘 좋은 정보 알려주셔서 감사합니다.				1	2022-10-26 14:57:54	2022-10-27 16:36:40
BK22019385	20	전문가	저도 오늘 대화 즐거웠어요. 그럼 다음에 또 얘기 나눠요.				0	2022-10-26 14:57:52	2022-10-26 16:08:28
