id	utterance_id	role	text	search_query	search_URL	reference_date	terminate	regDate	updDate
BK22002476	1	질문자	요즘 주식 시장이 어렵기도 해서 투자 포트폴리오를 좀 바꿔볼까 생각이 드네.				0	2022-08-02 12:16:54	2022-08-02 13:46:55
BK22002476	2	전문가	주변에서 주식하는 분들 다들 힘들어하긴 하더라. 포트폴리오를 어떻게 바꿔볼지 명확한 계획은 있어?				0	2022-08-02 12:16:54	2022-08-02 13:46:55
BK22002476	3	질문자	잘은 모르겠지만, 요즘 보니 채권이라는 게 인기가 많더라고? 나도 조금 관심이 가더라.				0	2022-08-02 12:16:54	2022-08-02 13:46:55
BK22002476	4	전문가	맞아, 한국예탁결제원이 낸 통계 수치만 봐도 알 수 있지. 13일에 발표된 자료를 보면, 올해 6월 말을 기준으로 했을 때 국내 투자자들이 매수한 해외채권의 잔액이 무려 44억 822만 달러에 달했거든. 한화로 바꾸면 5조 7703억 원에 해당하는 수치지.	채권 인기	https://www.asiatoday.co.kr/view.php?key=20220713010007468	2022/07/13	0	2022-08-02 12:16:54	2022-08-02 13:46:55
BK22002476	5	질문자	응, 그런데 사실 내가 진짜 초보 투자자거든. 그래서 채권이라는 게 뭔지 사실 잘 몰라. 혹시 이게 뭔지 설명해줄 수 있어?				0	2022-08-02 12:16:54	2022-08-02 13:46:55
BK22002476	6	전문가	채권은 영어로는 bond라고 하는데, 금융에서는 유가 증권의 하나로 분류해. 지급청구권이 표시된 채무증권이라고 할 수 있지.	채권이란 무엇인가	https://ko.wikipedia.org/wiki/%EC%B1%84%EA%B6%8C_(%EA%B8%88%EC%9C%B5)	2022/02/23	0	2022-08-02 12:16:54	2022-08-02 13:46:55
BK22002476	7	질문자	조금 설명이 어려운 것 같아. 유가 증권이라는 것은 또 뭘까?				0	2022-08-02 12:16:55	2022-08-02 13:46:55
BK22002476	8	전문가	유가 증권을 줄여서 그냥 증권이라고 부르기도 해. 일정한 규모의 돈이나 화물 같은, 유가물에 대해서 청구할 수 있는 권리가 표시된 증서를 증권이라고 불러. 다시 말해서, 상법상의 재산권을 표시하는 증서를 의미하는 거지.	유가증권	https://ko.wikipedia.org/wiki/%EC%9C%A0%EA%B0%80%EC%A6%9D%EA%B6%8C	2022/02/23	0	2022-08-02 12:16:55	2022-08-02 13:46:55
BK22002476	9	질문자	아, 유가물은 뭔지 알고 있어! 경제적 가치가 있는 물건을 말하는 거잖아. 그러면 채권에도 유가물에 대해서 청구할 수 있는 권리가 있는 거구나.				0	2022-08-02 12:16:55	2022-08-02 13:46:55
BK22002476	10	전문가	맞아, 보통 재산권을 채권과 물권으로 구분하잖아. 물권의 경우엔 재산권을 직접 취득하는 거지. 반면에 채권이라면, 채권자가 채무자에게 약속한 재산을 청구할 수 있는 권리인 거야.	유가물 채권 청구	https://ko.wikipedia.org/wiki/%EC%9C%A0%EA%B0%80%EC%A6%9D%EA%B6%8C	2022/02/23	0	2022-08-02 12:16:55	2022-08-02 13:46:55
BK22002476	11	질문자	그러면 결국 돈을 빌려주는 거라고 볼 수 있겠네. 그렇다면 혹시 채권도 금리의 영향을 받는 편이야?				0	2022-08-02 12:16:55	2022-08-02 13:46:55
BK22002476	12	전문가	그렇다고 볼 수 있지. 예를 들어서, 내가 오늘 연 2퍼센트의 이자를 주는 예금에 가입했는데, 내일 갑자기 예금 금리가 3퍼센트로 오르면 내 예금 통장의 가치가 떨어져서 손해를 보잖아. 채권도 마찬가지로, 만약에 내가 채권을 이미 사서 가지고 있는데 시중금리가 오른다면 내가 보유 중인 채권의 가치가 떨어지겠지. 새로 발행되는 채권의 금리가 올라가는 만큼 말이야.	금리 오르면 채권	https://www.mk.co.kr/news/economy/view/2022/07/600114/	2022/07/08	0	2022-08-02 12:16:55	2022-08-02 13:46:55
BK22002476	13	질문자	음, 그러면 주식이랑 마찬가지로 채권도 금리의 영향을 받는구나. 주식은 물가가 오르면 일반적으로 떨어지잖아. 그러면 채권도 물가가 오르면 수익을 장담할 수 없는 건가?				0	2022-08-02 12:16:55	2022-08-02 13:46:55
BK22002476	14	전문가	아니, 꼭 그렇지만은 않아. 채권 중에서 물가채라고 하는 채권이 있거든? 물가 상승률에 따라서 수익률이 달라지는 상품인데, 이 채권은 물가 상승률이 높을수록 투자 원금이 오히려 늘어나. 그렇다 보니 요즘 같은 고물가 시대에는 오히려 이런 채권이 각광을 받기도 해.	물가 상승 채권 수익	https://misaeng.chosun.com/site/data/html_dir/2022/07/11/2022071101370.html	2022/07/14	0	2022-08-02 12:16:55	2022-08-02 13:46:55
BK22002476	15	질문자	아, 그런 식의 투자 상품도 있구나. 그러고 보니 이번에 빅스텝도 진행한다고 했는데, 이때 미리 채권을 사들이는 것도 도움이 될까?				0	2022-08-02 12:16:55	2022-08-02 13:46:55
BK22002476	16	전문가	지금을 저가 매수의 기회로 볼 수 있기는 해. 금리와 채권은 일반적으로 역의 상관관계를 가지거든.	빅스텝 때 채권	https://www.edaily.co.kr/news/read?newsId=01423526632394520&mediaCodeNo=257	2022/07/14	0	2022-08-02 12:16:55	2022-08-02 13:46:55
BK22002476	17	질문자	혹시 한국은행에서 추가로 또 빅스텝을 단행하지는 않을까?				0	2022-08-02 12:16:55	2022-08-02 13:46:55
BK22002476	18	전문가	한국은행의 이번 빅스텝 결정은 이례적인 경우긴 해. 만약 추가적인 금리인상이 이뤄진다고 해도, 추가 금리 인상 폭이 통상적인 수준인 0.25 퍼센트에 그칠 확률이 높아. 채권시장의 전문가들도 같은 의견이고 말이야.	한국은행 추가 빅스텝	https://biz.chosun.com/policy/policy_sub/2022/07/13/CKIMAVCSVZCDLLAKAYUBKVCW3I/	2022/07/13	0	2022-08-02 12:16:55	2022-08-02 13:46:55
BK22002476	19	질문자	그렇구나, 채권도 채권이지만 일단 주식 투자를 하고 있다 보니 금리가 너무 오르진 않으면 좋겠더라고. 아무튼 좋은 정보를 알려줘서 고마워! 아까 알려준 물가채 말고도, 다른 괜찮은 상품이 있는지 한 번 찾아봐야겠어.				0	2022-08-02 12:16:55	2022-08-02 13:46:55
BK22002476	20	전문가	천만에, 성공적인 투자를 기원할게.				1	2022-08-02 12:16:55	2022-08-02 15:37:58
