id	utterance_id	role	text	search_query	search_URL	reference_date	terminate	regDate	updDate
BK22006317	1	질문자	이사를 가야해 걱정이네요. 전세자금대출을 받아야 하는데 대출금리도 높고 전세가도 올랐다고 하니까요.				0	2022-08-24 12:55:31	2022-08-24 12:55:31
BK22006317	2	전문가	아, 이사 오신지 얼마 안되셨잖아요, 전세계약이 만기되셨어요?				0	2022-08-24 12:55:31	2022-08-24 12:55:31
BK22006317	3	질문자	네, 전세계약기간 2년이 만기되었어요. 전세계약 만기되면 나가야 하지 않나요?				0	2022-08-24 12:55:31	2022-08-24 12:55:31
BK22006317	4	전문가	아니에요. 계약갱신청구권제라는게 있는 임차인이 원하는 경우 2년 단위 전세 계약을을 1회에 한해서 갱신 요구 할 수 있거든요. 그러니까 사실상 4년은 전세가 보장되는 거예요.	임대차3법	http://news.heraldcorp.com/view.php?ud=20200513000196	2020/05/13	0	2022-08-24 12:55:31	2022-08-24 12:55:31
BK22006317	5	질문자	그렇군요. 그럼 무조건 전세계약을 연장할 수 있는 거에요?				0	2022-08-24 12:55:31	2022-08-24 12:55:31
BK22006317	6	전문가	무조건은 아니예요, 박홍근 더불어민주당 의원이 대표발의한 개정안을 보면 집주인이 실거주를 할 객관적인 이유가 있거나 재건출이나 철가 등을 해야하는 경우에는 예의적으로 집주인의 의무가 없어지거든요. 그러니까 전세계약이 끝나는 시점에 집주인이 자기가 거주하겠다고 갱신을 거절하면 임재차 3법은 사실상 무용지물이 되는거죠.	계약갱신청구권 
