id	utterance_id	role	text	search_query	search_URL	reference_date	terminate	regDate	updDate
BK22014725	1	질문자	이사는 다음달로 다가왔는데 내놓은 집을 보러 오는 사람도 없고 정말 걱정이에요.				0	2022-10-02 16:06:25	2022-10-02 16:06:25
BK22014725	2	전문가	요즘 부동산 거래 절벽이라는 기사를 많이 봤는데 심각한가 보네요. 정말 고민이 많으시겠어요.				0	2022-10-02 16:06:25	2022-10-02 16:06:25
BK22014725	3	질문자	네, 가격도 계속 낮추고 있는데 거래 문의 자체가 없다고 하니 어찌 해야할지 정말 답답하네요. 기존 집이 팔리지 않은 상태로 새로운 집을 취득하게 되면 2주택자가 되어서 나중에 기존 집을 팔 때 양도세를 엄청 많이 내야 하는 거 아닌가요?				0	2022-10-02 16:06:25	2022-10-02 16:06:25
BK22014725	4	전문가	꼭 그런 건 아니에요. 이주를 위해 일시적으로 2주택자가 된 경우에는 정해진 기한 안에 기존의 주택의 처분이나 새로운 주택으로의 전입과 같은 몇 가지 요건이 충족되면 양도소득세 비과세 혜택을 1주택자와 동일하게 받을 수 있어요.	일시적 2주택자	https://newsis.com/view/?id=NISX20220225_0001772889&cID=10401&pID=10400	2022/02/26	0	2022-10-02 16:06:25	2022-10-02 16:06:25
BK22014725	5	질문자	그래요? 비과세를 위해 필요한 요건이 뭔지 자세히 좀 알려 주세요.				0	2022-10-02 16:06:25	2022-10-02 16:06:25
BK22014725	6	전문가	먼저 기존의 주택을 취득한 후 적어도 1년이 경과한 다음 신규 주택을 취득해야 해요. 그리고 기존의 주택을 2년 넘게 보유해야 하는데, 만약 기존의 주택이 조정대상지역에 위치하고 있다면 2년 이상 해당 주택에 거주해야 하고요. 동시에 신규 주택을 취득한 날로부터 3년이 지나기 전에 기존의 주택을 처분해야 해요.	일시적 2주택자 양도세 비과세 요건	https://newsis.com/view/?id=NISX20220225_0001772889&cID=10401&pID=10400	2022/02/26	0	2022-10-02 16:06:25	2022-10-02 16:06:25
BK22014725	7	질문자	저는 현재 집을 구매하고 거주한지 3년이 넘었으니 조건은 다 만족하네요. 그런데 조정대상지역 내에 위치한 주택이면 거주 요건도 추가된다고 하셨는데 그밖에 추가되는 또 다른 조건은 없나요?				0	2022-10-02 16:06:25	2022-10-02 16:06:25
BK22014725	8	전문가	네, 기존의 주택과 신규로 취득하는 주택이 둘 다 조정대상지역 안에 위치한다면 특히 까다로운 조건이 적용돼요. 신규 주택을 취득한 시점에 따라 종전 주택을 처분해야 하는 기한이 3년 이내, 2년 이내, 1년 이내로 상이하게 적용된답니다.	조정대상지역 내 일시적 2주택자 양도세 비과세 요건	https://newsis.com/view/?id=NISX20220225_0001772889&cID=10401&pID=10400	2022/02/26	0	2022-10-02 16:06:25	2022-10-02 16:06:25
BK22014725	9	질문자	그렇군요, 현재 사는 집도, 이사갈 집도 모두 조정대상지역에 위치한 것으로 알고 있는데 어떤 지역이 조정대상지역으로 지정되는 건가요?				0	2022-10-02 16:06:25	2022-10-02 16:06:25
BK22014725	10	전문가	주택값 상승률이 물가 상승률 대비 두 배를 넘거나 5 대 1 이상의 주택 청약의 경쟁률을 보이는 지역을 정부에서 조정대상지역으로 지정하는 것이에요.	조정대상지역 지정	https://www.hankyung.com/society/article/2022091904181	2022/09/20	0	2022-10-02 16:06:25	2022-10-02 16:06:25
BK22014725	11	질문자	알겠어요, 조정대상지역이면 새로운 주택의 취득 시점에 따라 처분 기한이 달라진다고 하셨는데 구체적으로 어떻게 달라지나요?				0	2022-10-02 16:06:25	2022-10-02 16:06:25
BK22014725	12	전문가	신규 주택을 취득한 날짜가 2018년 9월 13일 이전인 경우 종전 주택을 3년 안에 처분하면 돼요. 그리고 2018년 9월 14일에서 2019년 12월 16일 사이에 새로운 주택을 취득한 경우에는 신규 주택을 취득한 날로부터 2년 안에 종전 주택을 처분해야 하고요. 마지막으로 2019년 12월 17일 이후에 신규 주택을 취득한 경우라면 신규 주택을 취득한 날로부터 1년 이내에 종전 주택을 처분해야 하고 동시에 1년 이내에 해당 신규 주택으로 전입해야 해요.	조정대상지역 취득일별 주택 처분 기한	https://newsis.com/view/?id=NISX20220225_0001772889&cID=10401&pID=10400	2022/02/26	0	2022-10-02 16:06:25	2022-10-02 16:06:25
BK22014725	13	질문자	저는 2019년 12월 17일 이후에 신규 주택을 취득하니 1년 안에 처분하고 전입하면 비과세 요건은 만족시킬 수 있겠네요. 그럼 조건을 만족할 경우 양도세 비과세이니 양도세를 한 푼도 안 내도 되는 건가요?				0	2022-10-02 16:06:25	2022-10-02 16:06:25
BK22014725	14	전문가	매매가에 따라 달라요. 지금까지 설명한 양도세 비과세 요건을 빠짐없이 만족하는 일시적 2주택자는 1주택자와 동일한 조건으로 세금이 부과되는데 매매가가 12억 원을 넘지 않는다면 양도세를 내지 않아도 되고 매매가가 12억 원을 넘는다면 초과한 금액을 대상으로 기본세율을 적용하여 양도세가 부과돼요.	1주택자 양도세 과세 조건	https://newsis.com/view/?id=NISX20220225_0001772889&cID=10401&pID=10400	2022/02/26	0	2022-10-02 16:06:25	2022-10-02 16:06:25
BK22014725	15	질문자	저희 집은 언제 팔려도 12억 원은 안 넘을 것 같은데 만약 양도세 비과세 요건을 충족하지 못해서 2주택자로 양도세를 내야 하면 양도세가 얼마 정도 나올까요?				0	2022-10-02 16:06:25	2022-10-02 16:06:25
BK22014725	16	전문가	간단히 예를 들어 설명해 볼게요. 만약 아파트를 3억 원에 취득한 후 6억 원에 매도하게 되어 3억 원의 차익이 생겼다고 가정했을 때, 일시적 2주택자 요건을 갖추어 비과세 혜택을 받는다면 매매가가 12억 원을 넘지 않으므로 내야 할 세금은 없어요. 그에 반해 일시적 2주택자 요건을 갖추지 못한다면 중과 세율의 적용으로 과세표준 3억 원을 기준으로 하여 60%의 세율이 적용되고 거기에 누진공제액 2540만 원이 더해져 1억7000만 원을 양도세로 내야 해요.	1주택자와 2주택자 양도세 차이	https://newsis.com/view/?id=NISX20220225_0001772889&cID=10401&pID=10400	2022/02/26	0	2022-10-02 16:06:25	2022-10-02 16:06:25
BK22014725	17	질문자	0원과 1억7000만 원이라니 차이가 너무 크네요. 혹시 신규로 주택을 취득하는 것이 아닌 분양권을 취득하는 경우에도 동일하게 일시적 2주택 비과세 혜택을 받을 수 있나요?				0	2022-10-02 16:06:26	2022-10-02 16:06:26
BK22014725	18	전문가	네, 분양권 혹은 입주권을 취득하더라도 주택의 취득과 동일한 요건으로 일시적 2주택 비과세 혜택을 받을 수 있어요. 단, 분양권의 취득으로 인한 일시적 2주택자는 조정대상지역 여부와 상관없이 취득일로부터 3년 이내 기존의 주택을 처분하면 양도세 비과세 혜택을 받는 게 가능해요.	분양권 취득 시 일시적 2주택자 요건	https://newsis.com/view/?id=NISX20220225_0001772889&cID=10401&pID=10400	2022/02/26	0	2022-10-02 16:06:26	2022-10-02 16:06:26
BK22014725	19	질문자	그렇군요, 자세히 설명해 주셔서 감사해요. 정말 큰 도움이 되었어요.				1	2022-10-02 16:06:26	2022-10-07 11:24:54
BK22014725	20	전문가	별말씀을요, 혹시 더 궁금한 게 있으면 주저 말고 물어보세요.				0	2022-10-02 16:06:26	2022-10-02 16:06:26
