id	utterance_id	role	text	search_query	search_URL	reference_date	terminate	regDate	updDate
BK22006265	1	질문자	오늘 주식 어플 열어봤는데 제 계좌가 파란 불이 떠서 깜짝놀랐네요. 카카오뱅크에 관련된 악재가 있었나요?				0	2022-08-24 13:52:25	2022-09-05 10:22:37
BK22006265	2	전문가	카카오뱅크에 각종 악재가 한꺼번에 몰린데다가 기관에서의 대량 매도가 직접적인 여파로 연일 신저가를 달성했어요.	카카오뱅크 신저가	https://www.dailian.co.kr/news/view/1145417/?sc=Naver	2022/08/24	0	2022-08-24 13:52:25	2022-09-05 10:22:37
BK22006265	3	질문자	기관에서 대량매도를 했군요. 어느 기관에서 대량으로 매매를 한 것인가요?				0	2022-08-24 13:52:25	2022-08-24 13:52:25
BK22006265	4	전문가	카카오뱅크 주식을 시간 외 대량매매한 회사는 KB국민은행이에요.	카카오뱅크 블록딜	https://www.hankookilbo.com/News/Read/A2022081918230003469?did=NA	2022/08/19	0	2022-08-24 13:52:25	2022-08-24 13:52:25
BK22006265	5	질문자	KB에서 대량매도를 했군요. 그리고 카카오뱅크에 악재가 있었는지 몰랐네요. 무슨 악재가 나온 건가요?				0	2022-08-24 13:52:25	2022-08-24 13:52:25
BK22006265	6	전문가	18일에 카카오톡 송금하기 서비스가 제한을 받을 수 있다는 금융거래법 개정안이 보도된 영향으로 주가가 하락하고 있어요.	전금법 카톡 송금	https://www.news1.kr/articles/4777460	2022/08/19	0	2022-08-24 13:52:25	2022-08-24 13:52:25
BK22006265	7	질문자	카카오톡 송금하기 서비스가 무엇인가요?				0	2022-08-24 13:52:25	2022-08-24 13:52:25
BK22006265	8	전문가	사용자가 자신의 선불 계정에 카카오머니를 충전한 후 상대방 카카오톡 계정으로 소액을 송금하는 형태인 카카오톡 송금하기는 상대방 계좌를 몰라도 카톡 계정만 있으면 되어 많은 국민들이 사용하고 있는 간편한 송금 가능 서비스에요.	카카오톡 송금하기	http://www.safetimes.co.kr/news/articleView.html?idxno=113467	2022/08/18	0	2022-08-24 13:52:25	2022-08-24 13:52:25
BK22006265	9	질문자	그렇군요. 그럼 금융거래법 개정안 때문에, 앞으로는 이 기능을 사용하지 못하는 건가요?				0	2022-08-24 13:52:25	2022-08-24 13:52:25
BK22006265	10	전문가	맞아요. 선불전자금융업자 전자금융거래법 개정안은 지난 2020년 11월 윤관석 더불어민주당 의원이 발의해 국회에 계류 중인데, 이 개정안에 따라 선불충전을 통한 송금과 이체가 더 이상 불가능해요.	선불충전 송금 금지	https://news.kbs.co.kr/news/view.do?ncd=5536228&ref=A	2022/08/18	0	2022-08-24 13:52:25	2022-08-24 13:52:25
BK22006265	11	질문자	그렇군요. 근데 왜 카카오톡 송금하기 서비스 같이 선불충전을 통해 이체하는 것을 금지하는 건가요?				0	2022-08-24 13:52:25	2022-09-05 10:22:37
BK22006265	12	전문가	간편 송금 규제에 나선 이유는 정보기술을 활용한 금융서비스를 제공하는 빅테크나 핀테크 기업이 업종을 전자자금이체업이 아닌 선불전자지급수단업에만 등록할 경우, 실명 확인 의무가 없는 선불 계정을 통해 자금세탁을 할 수도 있다고 금융위에서 판단했기 때문이에요.	간편 송금 규제 왜	https://www.wikitree.co.kr/articles/781469	2022/08/18	0	2022-08-24 13:52:25	2022-09-05 10:22:37
BK22006265	13	질문자	자금 세탁에 악용될 우려가 있어 규제한 거군요. 카카오페이를 제외하고도 이 개정안 때문에 피해를 입는 업체와 사람들이 있나요?				0	2022-08-24 13:52:25	2022-08-24 13:52:25
BK22006265	14	전문가	말씀하신 카카오페이를 제외한 다른 기업들은 토스, 네이버 파이낸셜 등이 있어요. 그리고 미성년자와 외국인은 당장 계좌가 없어 송금이 불가능해져요.	미성년자 외국인 송금	https://wemakenews.co.kr/news/view.php?no=15218	2022/08/18	0	2022-08-24 13:52:25	2022-08-24 13:52:25
BK22006265	15	질문자	미성년자와 외국인들도 피해를 입는 군요. 그럼 앞으로 송금 서비스들을 이용하지 못하게 되는 건가요?				0	2022-08-24 13:52:25	2022-08-24 13:52:25
BK22006265	16	전문가	아니에요. 개정안이 통과되더라도 송금 업무가 가능한 방법이 있다고 금융위에서 밝혔는데 그 방법은 기존 선불전자금융업자가 자금이체업 허가를 받는 것이에요.	자금이체업 허가 송금 업무	https://www.yna.co.kr/view/AKR20220818159200002?input=1195m	2022/08/18	0	2022-08-24 13:52:25	2022-08-24 13:52:25
BK22006265	17	질문자	자금이체업 허가를 받으면 되는 군요. 그럼 업계에서는 어떻게 생각하나요?				0	2022-08-24 13:52:25	2022-08-24 13:52:25
BK22006265	18	전문가	업계에서는 개정안이 통과되더라도 개인끼리 하는 간편 송금에는 문제가 발생하지 않을 것으로 예상하고 있어요.	간편송금 문제	https://www.mk.co.kr/news/stock/view/2022/08/734116/	2022/08/19	0	2022-08-24 13:52:25	2022-08-24 13:52:25
BK22006265	19	질문자	업계에서도 문제가 없을 거라고 생각하는 군요. 덕분에 많은 정보를 알고 가네요.				1	2022-08-24 13:52:25	2022-09-05 10:22:37
BK22006265	20	전문가	언제든지 필요한 정보나 궁금한 점이 있으면 연락주세요. 안녕히 계세요.				0	2022-08-24 13:52:25	2022-08-24 13:52:25
