id	utterance_id	role	text	search_query	search_URL	reference_date	terminate	regDate	updDate
BK22017493	1	질문자	무지출 챌린지에 동참하고 싶은데, 정확히 무지출 챌린지가 뭔가요?				0	2022-10-18 12:39:22	2022-10-18 14:50:35
BK22017493	2	전문가	무지출 챌린지는 종일 돈을 거의 쓰지 않는 등 극단적으로 지출을 줄이는 것을 말해요. 일일 소비와 소득을 적은 가계부나 무지출을 시행한 날을 표시한 달력 사진 등은 SNS에서 많이 볼 수 있죠.	무지출 챌린지란	https://www.news1.kr/articles/4800075	2022/09/14	0	2022-10-18 12:39:22	2022-10-18 14:50:35
BK22017493	3	질문자	쉽지 않을 것 같은데, 무지출 챌린지 중 갑자기 소비 욕구가 생기면 어떻게 해야 하죠?				0	2022-10-18 12:39:22	2022-10-18 14:50:35
BK22017493	4	전문가	만약 그런 상황이 생긴다면 무지출에 성공한 기록인 가계부를 SNS에 올려 서로 응원하며 계속 도전할 수 있도록 고무시켜요. 또한 SNS에는 과소비 욕구에 대한 꿀팁도 공유되고 있는데, 예를 들면 구입하고 싶은 것이 있으면 잊히도록 일부러 회사 일을 벌여라 등이 있어요.	무지출 챌린지 소비욕구	https://www.hankookilbo.com/News/Read/A2022091913060004251?did=NA	2022/09/19	0	2022-10-18 12:39:22	2022-10-18 14:50:35
BK22017493	5	질문자	무지출 챌린지가 SNS를 통해 퍼진 일종의 놀이 같은 건가요?				0	2022-10-18 12:39:22	2022-10-18 14:50:35
BK22017493	6	전문가	무지출 챌린지를 SNS를 통한 놀이로 보거나 아껴 쓸 수 있는 돈이라도 가진 청년들의 놀이문화로 깎아내리는 시선이 있어요. 하지만 무지출 챌린지의 근본은 경제적 위기를 맞이한 청년들의 힘든 생활을 투영하고 있다고 보는 게 맞아요.	무지출 챌린지 SNS 놀이	https://www.hankookilbo.com/News/Read/A2022091913060004251?did=NA	2022/09/19	0	2022-10-18 12:39:22	2022-10-18 14:50:35
BK22017493	7	질문자	소비를 줄이는 것 외에 무지출 챌린지를 할 수 있는 다른 방법이 있나요?				0	2022-10-18 12:39:22	2022-10-18 14:50:35
BK22017493	8	전문가	자신에게는 이제 필요 없는 물건을 되파는 중고 거래도 무지출 챌린지의 방법 중 하나예요. 이 외에 앱테크 또한 많은 사람이 이용하고 있어요.	무지출 챌린지 방법	http://www.thereport.co.kr/news/articleView.html?idxno=24453	2022/09/27	0	2022-10-18 12:39:22	2022-10-18 14:50:35
BK22017493	9	질문자	앱테크라는 단어가 생소한데, 앱테크는 뭔가요?				0	2022-10-18 12:39:22	2022-10-18 14:50:35
BK22017493	10	전문가	앱테크는 애플리케이션과 제테크가 결합한 단어로 앱을 이용하여 적립금을 얻는 방법이에요. 앱을 설치하여 어떤 미션을 수행하거나 지정된 광고를 보면 소액을 적립금으로 쌓을 수 있는 구조죠.	앱테크란	http://www.thereport.co.kr/news/articleView.html?idxno=24453	2022/09/27	0	2022-10-18 12:39:22	2022-10-18 14:50:35
BK22017493	11	질문자	앱테크에 관심이 가는데, 앱테크는 어떤 것이 있나요?				0	2022-10-18 12:39:22	2022-10-18 14:50:35
BK22017493	12	전문가	설문조사나 영수증 리뷰부터 만보기, 출석 체크, 물 마시기 등 앱에서 지정한 미션에 성공하면 약간의 적립금을 줘요. 디지털 기기를 잘 다루는 MZ세대에게 특히 인기죠.	앱테크	http://www.seoulfn.com/news/articleView.html?idxno=467330	2022/09/20	0	2022-10-18 12:39:22	2022-10-18 14:50:35
BK22017493	13	질문자	좀 귀찮을 것도 같은데, 앱테크가 인기를 끄는 이유가 있을까요?				0	2022-10-18 12:39:22	2022-10-18 14:50:35
BK22017493	14	전문가	앱을 다운받고 가입하는 과정이 간단한 편이에요. 게다가 정보를 공유하거나 건강을 관리하는 미션을 수행하면서 적립금도 쌓을 수 있다는 부분에서 큰 호응을 얻고 있죠.	앱테크 참여	http://www.seoulfn.com/news/articleView.html?idxno=467330	2022/09/20	0	2022-10-18 12:39:22	2022-10-18 14:50:35
BK22017493	15	질문자	앱테크로 모은 적립금은 어떻게 사용할 수 있나요?				0	2022-10-18 12:39:22	2022-10-18 14:50:35
BK22017493	16	전문가	퀴즈를 맞히거나 광고를 보거나 출석 인증 등을 통해 얻은 적립금은 현금으로 교환할 수 있거나 커피 교환권 등으로 받을 수도 있고, 앱 내에서 기프티콘을 살 수도 있어요.	앱테크 적립	https://www.hankyung.com/economy/article/202110086201e	2021/10/09	0	2022-10-18 12:39:22	2022-10-18 14:50:35
BK22017493	17	질문자	무지출 챌린지를 통해 모은 돈을 어떻게 하나요?				0	2022-10-18 12:39:22	2022-10-18 14:50:35
BK22017493	18	전문가	소비를 극단적으로 줄인 사람들의 돈이 은행으로 향하고 있어요. 기준금리가 인상하면서 많은 은행이 예, 적금 금리를 상향시켰기 때문에 주식에 비해 돈을 잃을 위험도 적은 은행에 맡기는 거죠.	무지출 챌린지	https://economist.co.kr/2022/09/25/finance/bank/20220925183309717.html	2022/09/26	0	2022-10-18 12:39:22	2022-10-18 14:50:35
BK22017493	19	질문자	그렇군요. 제일 쉬울 것 같은 앱테크부터 시작해 봐야겠어요.				0	2022-10-18 12:39:22	2022-10-18 14:50:35
BK22017493	20	전문가	네, 종류가 다양하니 자신에게 맞는 앱을 찾아보세요.				1	2022-10-18 12:39:22	2022-10-18 14:50:35
