id	utterance_id	role	text	search_query	search_URL	reference_date	terminate	regDate	updDate
BK22007581	9	질문자	그럼 이번달 안에는 사업자 등록을 해야 겠네요. 통신판매업 신고는 꼭해야 하는 걸까요?				0	2022-09-05 08:38:21	2022-09-05 08:38:21
BK22007581	10	전문가	네 원칙적으로 지자체에 통신판매신고를 해야 해요. 다만 거래 횟수가 50회 미만이거나 부가가시체법상 간이과세자에 해당하는 경우에는 신고 면제 대상이여서 따로 신고를 하지 않아도 돼요.	통신판매업 신고대상	http://www.mediapen.com/news/view/544534	2020/07/29	0	2022-09-05 08:38:21	2022-09-05 08:38:21
BK22007581	11	질문자	아, 그래요? 그럼 혹시 일반사업자와 간이사업자 차이가 뭔지 아세요?				0	2022-09-05 08:38:21	2022-09-05 08:38:21
BK22007581	12	전문가	네. 보통 사업의 규모에 따라 일반과세자와 간이과세자로 구분하는데요. 일반과세자는 연간 매출액이 8,000만 원 이상으로 예상되거나 간이과세가 배제되는 업종, 지역에서 사업을 하고자 하는 경우에 해당돼요. 간이과세자는 주로 소비자를 상대하는 업종으로서 연간매출액이 8,000만 원 미만인 소규모 사업자의 경우 등록할 수 있구요.	간이사업자 일반사업자	http://www.jndn.com/article.php?aid=1660551313342624192	2022/08/15	0	2022-09-05 08:38:21	2022-09-05 08:38:21
BK22007581	13	질문자	잘 알려주셔서 고맙습니다. 저도 이제 사업을 시작하는거라서 몇년간은 연간 매출액이 간이사업자에 해당될 것 같네요 . 나중에 혹시 연간매출액이 8천만원 이상이라면 자동적으로 일반과세자로 전환이 되는 걸까요?				0	2022-09-05 08:38:21	2022-09-05 08:38:21
BK22007581	14	전문가	저도 처음 시작할 때 간이과세자로 신청했는데 온라인 창업하고 3년쯤 지나서 일반과세자로 전환됐네요.
