id	utterance_id	role	text	search_query	search_URL	reference_date	terminate	regDate	updDate
BK22002121	1	질문자	요즘 물가 너무 많이 오른 것 같지 않아요?				0	2022-08-02 12:13:56	2022-08-02 13:08:38
BK22002121	2	전문가	진짜 많이 올랐죠. 매일 점심 사먹기가 무서울 정도니까요.				0	2022-08-02 12:13:56	2022-08-02 13:08:38
BK22002121	3	질문자	예전에는 밥먹고 커피까지 사 먹었는데 이젠 커피를 언제 사마셨는지 기억도 안나요. 소소해도 돈 벌수 있는 방법이 있을까요?				0	2022-08-02 12:13:56	2022-08-02 13:08:38
BK22002121	4	전문가	앱테크 한 번 해보시는거 어때요? 어플리케이션이랑 재테크의 합성어인데요. 스마트폰 앱으로 돈을 벌 수 있거든요.	앱테크	https://www.job-post.co.kr/news/articleView.html?idxno=57564	2022/07/19	0	2022-08-02 12:13:56	2022-08-02 13:08:38
BK22002121	5	질문자	에이, 어떻게 앱으로 돈을 벌어요.				0	2022-08-02 12:13:56	2022-08-02 13:08:38
BK22002121	6	전문가	몇 개만 예시를 들자면 네이버 영수증 리뷰, 토스 만보기 등이 있어요. 영수증으로 장소를 인증하고 네이버 영수증 리뷰에 리뷰를 쓰면 네이버페이 포인트가 적립되거든요. 그걸 현금처럼 쓸 수 있고요.	앱테크	http://www.dailypop.kr/news/articleView.html?idxno=61378	2022/07/18	0	2022-08-02 12:13:56	2022-08-02 13:08:38
BK22002121	7	질문자	그게 앱테크라면 전 이미 해봤네요. 전 꼬박꼬박 리뷰 남겨서 50원씩 받고 있거든요.				0	2022-08-02 12:13:56	2022-08-02 13:08:38
BK22002121	8	전문가	잘 하시고 계시네요. 앱테크는 한번에 10원에서 100원정도 아주 소액을 벌 수 있어서 디지털 폐지 줍기라고 불리기도 하지만 생활비를 조금이라도 아끼려는 20대, 30대들에게는 재테크 수단으로 활용되고 있죠.	앱테크 효과	https://www.msn.com/ko-kr/money/topstories/%ED%8B%B0%EB%81%8C%EB%AA%A8%EC%95%84-%EC%BB%A4%ED%94%BC-%ED%95%9C-%EC%9E%94%E2%80%A6%EA%B3%A0%EB%AC%BC%EA%B0%80-%EC%8B%9C%EB%8C%80%EC%97%90-%EC%95%B1%ED%85%8C%ED%81%AC-%EC%9C%A0%ED%96%89/ar-AAZ8wCh	2022/07/03	0	2022-08-02 12:13:56	2022-08-02 13:08:38
BK22002121	9	질문자	저도 가끔 현타올 때가 있긴 하지만 꽤 쏠쏠하던데요. 저 말고도 많은 사람들이 앱테크를 하나봐요.				0	2022-08-02 12:13:56	2022-08-02 13:08:38
BK22002121	10	전문가	고물가 시대에 다들 생활비를 조금이라도 아끼려다보니 앱테크가 유행하고 있어요.	디지털폐지줍기	https://www.khan.co.kr/economy/market-trend/article/202207032106005#c2b	2022/07/03	0	2022-08-02 12:13:56	2022-08-02 13:08:38
BK22002121	11	질문자	저는 앱테크를 처음 들어보는데요. 유행이라고 불릴 정도로 많이 하나요?				0	2022-08-02 12:13:56	2022-08-02 13:08:38
BK22002121	12	전문가	그럼요. 취업포털 인크루트가 설문조사를 했었어요. 성인남녀 1707명 중에 무려 75퍼센트가 현재 앱테크를 하고 있다고 답했을 정도에요.	앱테크 통계	http://www.thescoop.co.kr/news/articleView.html?idxno=54021	2022/04/12	0	2022-08-02 12:13:56	2022-08-02 13:08:38
BK22002121	13	질문자	확실히 다들 오른 물가에 작은 돈이라도 벌려고 노력하네요.				0	2022-08-02 12:13:56	2022-08-02 13:08:38
BK22002121	14	전문가	네. 쓰테크도 있어요. 쓰레기와 재테크의 합성어인걸 보면 어떤 느낌인지 아시겠죠? 재활용되는 캔이나 페트병을 모아서 전문 회수 업체에 버리고 쌓이는 포인트를 현금으로 전환해서 쓰거나 상품을 구입하는데 사용하는거에요.	쓰테크	https://magazine.hankyung.com/business/article/202207061217b	2022/07/09	0	2022-08-02 12:13:56	2022-08-02 13:08:38
BK22002121	15	질문자	20대, 30대들이 디지털 폐지줍기 세대가 아니라 진짜 폐지도 줍는 세대가 됐네요.				0	2022-08-02 12:13:56	2022-08-02 13:08:38
BK22002121	16	전문가	게다가 구글 트렌드에 따르면 최근 5년 중에 2022년 5월 22일부터 28일까지 짠테크에 대한 검색량이 가장 많은 것으로 나타났어요.	짠테크	http://biz.heraldcorp.com/view.php?ud=20220718000123	2022/07/18	0	2022-08-02 12:13:56	2022-08-02 13:08:38
BK22002121	17	질문자	짠테크도 앱테크처럼 소소하더라도 돈 벌 수 있는 수단인가요?				0	2022-08-02 12:13:56	2022-08-02 13:08:38
BK22002121	18	전문가	짠테크는 짜다와 재테크의 합성어에요. 푼돈일지라도 절약하고 저축, 투자를 통해 목돈을 만드는 거죠.	짠테크 뜻	http://news.tf.co.kr/read/livingculture/1953635.htm	2022/07/24	0	2022-08-02 12:13:56	2022-08-02 13:08:38
BK22002121	19	질문자	이렇게 다들 힘든 세상에 열심히 사는 모습이 보기 좋기도 하고, 씁쓸하기도 하네요. 그러고보니 제 친구도 무지출챌린지라며 매일매일 SNS에 글을 올리는 것 같더라고요. 무지출챌린지도 비슷한 맥락이겠죠?				0	2022-08-02 12:13:56	2022-08-02 13:08:38
BK22002121	20	전문가	저도 무지출 챌린지하고 있어요. 불필요한 소비를 줄이는 절약을 넘어서 아예 무소비를 목적으로 하는 챌린지에요.	무지출챌린지	https://view.asiae.co.kr/article/2022071210540410678	2022/07/12	0	2022-08-02 12:13:56	2022-08-02 13:08:38
BK22002121	21	질문자	저도 그거 한 번 해볼까요?				0	2022-08-02 12:13:57	2022-08-02 13:08:38
BK22002121	22	전문가	나름 하다보면 재미있기도 해요. 저랑 같이 해보는 거 어때요?				0	2022-08-02 12:13:57	2022-08-02 13:08:38
BK22002121	23	질문자	재미있을 것 같긴 하네요. 그럼 앞으로 무지출하는 날마다 태그할게요, 다음에 봐요.				1	2022-08-02 12:13:57	2022-08-02 13:58:41
