id	utterance_id	role	text	search_query	search_URL	reference_date	terminate	regDate	updDate
BK22014848	1	질문자	이번에 저희 기업이 영국에서 열리는 박람회에 참가하게 돼서 좋은 기회로 영국에 가게 됐어요.				0	2022-10-04 00:20:33	2022-10-04 00:58:45
BK22014848	2	전문가	해외에 나가고 싶다고 하더니 이런 기회로 영국에 가게 됐네요.				0	2022-10-04 00:20:33	2022-10-04 00:58:45
BK22014848	3	질문자	영국은 처음인데 박람회 이후에 여행도 할 수 있어서 정말 기대돼요. 환전을 하려고 보니 파운드화 환율이 많이 떨어졌더라구요. 파운드화가 이렇게 크게 떨어진 이유는 뭔가요?				0	2022-10-04 00:21:06	2022-10-04 00:58:45
BK22014848	4	전문가	9월 23일 영국 정부에서 50년 만에 최대 폭으로 감세 정책을 발표하면서 파운드화 하락 폭이 가팔라졌거든요. 그러다가 25일 쿼지 콰텡 영국 재무 장관이 추가적인 감세 입장 발표를 하면서 하락이 더 빨라졌어요.	파운드화 폭락 내부 이유	http://news.heraldcorp.com/view.php?ud=20220927000233	2022/09/27	0	2022-10-04 00:21:06	2022-10-04 00:58:45
BK22014848	5	질문자	감세 굳히기에 따라 파운드화가 폭락하는 거네요. 이렇게 영국에서 감세 정책을 표방하는 이유는 뭔가요?				0	2022-10-04 00:21:06	2022-10-04 00:58:45
BK22014848	6	전문가	9월 초 리즈 트러스 영국 총리가 취임했는데 감세는 보수 표심을 공략한 정책이에요. 리즈 트러스 영국 총리는 마거릿 대처 전 총리를 본 받을 만한 대상으로 삼고 있거든요.	영국 감세 정책	https://biz.chosun.com/international/international_economy/2022/09/27/DLLRH5EXMRBYVPMWIIK2ADQRBQ/?utm_source=naver&utm_medium=original&utm_campaign=biz	2022/09/27	0	2022-10-04 00:21:06	2022-10-04 00:58:45
BK22014848	7	질문자	아무리 보수 표심을 공략했다지만 부작용이 나타날 수 있을 것 같아요. 영국 정부에서 강행한 감세로 인해 어떤 부작용이 나타날 수 있을까요?				0	2022-10-04 00:21:06	2022-10-04 00:58:45
BK22014848	8	전문가	영국 국가 부채가 급격히 증가하고 물가 상승세가 더 악화될 수도 있어요. 또한 이러한 소득세율 감세 혜택은 고소득자들한테 거의 집중될 것이라는 의견도 있는 상황이고요. 물론 영국 정부에서 감세를 해서 경제 성장을 유도하겠다는 목표를 발표했긴하지만 이런 부작용이 나타날 수 있죠.	영국 감세 정책 정부 입장	https://biz.chosun.com/international/international_economy/2022/09/27/DLLRH5EXMRBYVPMWIIK2ADQRBQ/?utm_source=naver&utm_medium=original&utm_campaign=biz	2022/09/27	0	2022-10-04 00:21:06	2022-10-11 13:53:18
BK22014848	9	질문자	하긴 보수 표심을 공략했다고 하니 부자들을 위한 혜택이네요. 아까 말한건 영국 감세 정책으로 인한 내부 효과인데 파운드화가 하락하는 외부 요인은 뭐가 있을까요?				0	2022-10-04 00:21:06	2022-10-04 00:58:45
BK22014848	10	전문가	미국이 40년만의 치솟고 있는 인플레이션을 잡기 위해 공격적으로 기준 금리를 연속적으로 인상하는 긴축 정책을 펼치고 있어서 파운드화 뿐만이 아니라 전 세계 대부분의 통화 가치가 같이 하락하고 있는 중이죠.	파운드화 폭락 외부 이유	https://www.hani.co.kr/arti/international/globaleconomy/1060304.html	2022/09/27	0	2022-10-04 00:21:06	2022-10-04 00:58:45
BK22014848	11	질문자	하긴 달러 환율이 올라도 너무 올랐죠. 이렇게 파운드화 폭락으로 국내 금융 시장에는 어떤 영향을 미쳤나요?				0	2022-10-04 00:21:06	2022-10-04 00:58:45
BK22014848	12	전문가	이런 국제 금융시장의 충격은 국내 시장 코스피도 연저점을 기록하는 등 충격이 그대로 영향을 미치고 있죠. 9월 27일 코스피는 장 초반 2220선을 안팎을 기록했거든요.	파운드화 폭락과 국내 시장 영향	http://news.heraldcorp.com/view.php?ud=20220927000233	2022/09/27	0	2022-10-04 00:21:06	2022-10-04 00:58:45
BK22014848	13	질문자	저도 주식에 어느 정도 투자했는데 장이 너무 안좋아서 걱정이에요. 그럼 영국의 경제 상황도 수치적으로 궁금한데 파운드화 환율의 하락폭은 어떤가요?				0	2022-10-04 00:21:06	2022-10-04 00:58:45
BK22014848	14	전문가	미 달러 대비 영국 파운드화의 환율은 9월 26일 약 5% 떨어져 한때 사상 최저치인 1.03 달러 수준이었어요. 종전 최저치 기록은 1985년 2월 26일의 1.05달러였거든요.	파운드화 달러 대비 하락폭	http://news.heraldcorp.com/view.php?ud=20220927000233	2022/09/27	0	2022-10-04 00:21:06	2022-10-11 13:53:18
BK22014848	15	질문자	어머, 역대 최저치라고 하니 영국의 파운드화 가치 폭락이 확 와닿네요. 달러와의 비교 말고 유로화 대비로도 낮은 편인가요?				0	2022-10-04 00:21:06	2022-10-04 00:58:45
BK22014848	16	전문가	유로화 대비로도 파운드화 가치는 3.7퍼센트 하락했어요. 2년 만에 최저치인 1.0787유로를 기록했구요. 유로화도 20년 만에 최저치를 경신하고 있는 상황에 이런 기록을 보인건 파운드화 약세가 달러 강세 때문만은 아닌거죠.	유로화 대비 파운드화	http://news.heraldcorp.com/view.php?ud=20220927000233	2022/09/27	0	2022-10-04 00:21:06	2022-10-04 00:58:45
BK22014848	17	질문자	대내적, 대외적 요인으로 파운드화 가치 하락이라 영국 사람들은 경제적으로 힘들겠어요. 파운드화 하락 상황이 채권 시장에도 영향을 미치나요?				0	2022-10-04 00:21:06	2022-10-04 00:58:45
BK22014848	18	전문가	영국에서 국가채무 확대 전망을 내놓자 채권시장에서도 5년 만기 국채금리가 세계 금융위기였던 2008년 9월 이후 4.603%로 최고치를 기록했어요.	파운드화 하락이 채권시장에 미치는 영향	http://news.heraldcorp.com/view.php?ud=20220927000233	2022/09/27	0	2022-10-04 00:21:06	2022-10-04 00:58:45
BK22014848	19	질문자	영국 정부의 바람대로 경제 성장이 과연 이루어질지 궁금하네요. 어려운 경제 현상을 잘 알려주셔서 이해가 쏙쏙 됐어요.				0	2022-10-04 00:21:06	2022-10-04 00:58:45
BK22014848	20	전문가	이해가 잘 됐다니 기분이 좋네요. 어머, 차 시간이 다 돼 가네요. 저는 이만 가 볼게요.				1	2022-10-04 00:21:06	2022-10-11 13:53:18
