id	utterance_id	role	text	search_query	search_URL	reference_date	terminate	regDate	updDate
BK22011760	1	질문자	요즘 물가가 올라도 너무 오르잖아요. 전 세계적으로 물가가 상승하고 있는 상황인데, 언제까지 이런 상황이 지속될까요?				0	2022-09-26 19:35:31	2022-09-26 19:35:31
BK22011760	2	전문가	전세계의 고물가 상황은 더 길어질 예정이에요. 미국을 시작으로 해외 주요국이 인플레이션을 잡기 위해 여러 방안을 시행 중이지만, 고물가로 인한 부담은 내년까지 이어질 것이라 관측되죠.	물가 상승	https://n.news.naver.com/mnews/article/366/0000843202?sid=101	2022/09/26	0	2022-09-26 19:35:31	2022-09-26 19:35:31
BK22011760	3	질문자	내년까지 이런 상황이 지속된다니 큰일이네요. 그렇다면 우리나라의 경제 성장률이 좀 걱정이 되는데, 앞으로의 한국 경제 성장률은 어떻게 예측되고 있나요?				0	2022-09-26 19:35:31	2022-09-26 19:35:31
BK22011760	4	전문가	경제협력개발기구가 발표한 올해 한국의 경제 성장률 전망치는 2.8퍼센트에요. 지난 6월의 전망치보다 0.5퍼센트 포인트나 높은 수치이죠. 하지만 내년의 한국 경제 성장률은 2.2퍼센트로 직전보다 0.3퍼센트 포인트 낮춰 잡았어요.	한국의 경제 성장률	https://n.news.naver.com/mnews/article/014/0004904434?sid=101	2022/09/26	0	2022-09-26 19:35:31	2022-09-27 01:43:59
BK22011760	5	질문자	한국은 그래도 전보다는 조금 올랐네요. 그렇다면 세계 경제 성장률은 어떻게 예상되고 있나요?				0	2022-09-26 19:35:31	2022-09-26 19:35:31
BK22011760	6	전문가	경제협력개발기구에서는 세계 경제가 내년에 2.2퍼센트 성장할 것이라고 예측했어요. 지난 6월에 발표한 2.8퍼센트보다 0.6퍼센트 포인트 낮아진 수치이죠.	세계 경제 성장률	https://www.hankyung.com/economy/article/202209266669i	2022/09/26	0	2022-09-26 19:35:31	2022-09-27 01:43:59
BK22011760	7	질문자	점점 낮아지고 있네요. 세계적인 경제 위기가 지속되고 있는 것 같은데요. 이렇게 전 세계적인 경제 위기가 닥친 주된 원인이 무엇인가요?				0	2022-09-26 19:35:31	2022-09-26 19:35:31
BK22011760	8	전문가	경제개발협력기구에서는 내년의 전 세계 경제 성장 속도가 당초 예상치를 크게 밑돌 것이란 전망을 발표했는데, 이의 원인은 러시아와 우크라이나의 전쟁이 장기화 때문이죠.	세계 경제 성장률	https://n.news.naver.com/mnews/article/016/0002045346?sid=101	2022/09/26	0	2022-09-26 19:35:31	2022-09-27 01:43:59
BK22011760	9	질문자	러시아의 전쟁이 원인이군요. 그럼 주변 국가의 피해가 더 클 것 같은데, 유럽의 경제 성장률은 어떻게 점 쳐지고 있죠?				0	2022-09-26 19:35:31	2022-10-05 10:12:48
BK22011760	10	전문가	경제개발협력기구에서 발표한 내년의 유럽 국가들의 성장률은 더 크게 하락할 것이라고 밝혔어요. 이는 유럽의 에너지 대란 때문이죠. 세계 경제와 G20 국가의 성장률의 하향 조정 폭은 각각 0.6퍼센트 포인트였지만, 유로존은 1.3퍼센트 포인트나 하향되었죠.	유럽 경제 성장률	https://n.news.naver.com/mnews/article/079/0003689285?sid=101	2022/09/26	0	2022-09-26 19:35:31	2022-09-27 01:43:59
BK22011760	11	질문자	유럽 국가에서 현재 에너지 대란이 일어나고 있나요? 유럽의 에너지 대란에 대해서도 알려주세요.				0	2022-09-26 19:35:31	2022-09-27 01:43:59
BK22011760	12	전문가	네, 유럽은 현재 엄청난 에너지 대란 위기에 처한 상황이에요. 코로나와 인플레이션, 기후 변화 그리고 러시아의 우크라이나 침공으로 시작된 에너지원 부족으로 상황이 나빠지고 있죠.	러시아발 에너지 대란	https://www.news1.kr/articles/4813729	2022/09/26	0	2022-09-26 19:35:31	2022-09-27 01:43:59
BK22011760	13	질문자	그렇군요. 유럽이 에너지원 부족에 놓였는 지는 몰랐어요. 그렇다면 대표적인 유럽 국가인 프랑스는 이 상황에 어떻게 대처해 나아가고 있나요?				0	2022-09-26 19:35:31	2022-09-27 01:43:59
BK22011760	14	전문가	프랑스는 에너지 위기의 여파로 올해 겨울 에너지 사용량을 작년보다 10퍼센트를 줄이겠다는 대책을 세웠어요. 이에 시청, 박물관 등의 공공기관의 조명들은 오후 10시부터 소등되며, 프랑스의 상징인 에펠탑도 평소보다 1시간 빨리 소등하게 되었죠.	유럽 에너지 대란	https://www.segye.com/newsView/20220925508333?OutUrl=naver	2022/09/25	0	2022-09-26 19:35:31	2022-10-05 10:12:48
BK22011760	15	질문자	대표 관광지인 에펠탑의 소등 시간까지 빨라지다니, 상황이 심각하긴 한가 보군요. 유럽에서 에너지 대란이 일어났다면, 전 세계적인 에너지원 부족 현상이 일어날 것 같은데요. 우리나라는 이 문제를 어떻게 해결해 나갈 것인가요?				0	2022-09-26 19:35:31	2022-10-05 10:12:48
BK22011760	16	전문가	러시아의 에너지 무기화로 인해 세계적으로 가스 공급 차질이 생길 것이라 예상돼요. 따라서 우리나라도 올겨울 가스 대란을 피하기 위해 EU의 수요 억제책이 필요하다는 주장이 제기되고 있죠. 산업부에서도 에너지 수급 위기를 해결해 나아가기 위해 공공기관이 주도적으로 에너지 절감 및 수요 관리에 노력을 기울여야 할 것이라 밝혔죠.	에너지 대란	https://news.mt.co.kr/mtview.php?no=2022092009444020822	2022/09/20	0	2022-09-26 19:35:31	2022-09-27 01:43:59
BK22011760	17	질문자	세계적인 에너지 부족이라니, 정말 심각한 상황이 아닐 수 없네요. 겨울에는 가스 사용량이 크게 늘텐데, 걱정이네요.				0	2022-09-26 19:35:31	2022-09-27 01:43:59
BK22011760	18	전문가	상황이 얼른 좋아지면 좋겠네요. 아, 제가 미리 말씀 못 드렸는데 선약이 있어 이만 가봐야 할 것 같아요.				1	2022-09-26 19:35:35	2022-10-05 10:12:48
BK22011760	19	질문자	네, 오늘 너무 유익한 시간이었어요. 다음에 또 기회가 되면 뵙겠습니다.				0	2022-09-26 19:35:31	2022-09-27 01:43:59
BK22011760	20	전문가	오늘 즐거웠고 다음에 뵐게요.				0	2022-09-26 19:35:31	2022-10-05 10:12:48
