id	utterance_id	role	text	search_query	search_URL	reference_date	terminate	regDate	updDate
BK22017720	1	질문자	요즘 물가가 너무 올라요, 달러도 오르고요. 그런데 제 주식은 너무 떨어지네요.				0	2022-10-19 20:06:15	2022-10-20 00:03:27
BK22017720	2	전문가	손해를 많이 보셨나 봐요. 요즘 달러랑 주식 때문에 고민하는 분들이 많더라고요.				0	2022-10-19 20:06:15	2022-10-20 00:03:27
BK22017720	3	질문자	저도 그 중에 한 명이죠. 앞으로도 달러 강세가 지속될까요?				0	2022-10-19 20:06:15	2022-10-20 00:03:27
BK22017720	4	전문가	미국의 고강도 긴축에 대한 공포 때문에 강달러 흐름이 지속되고, 원달러 환율이 1440원대로 급등할 전망이에요. 기대인플레이션이 꺾이지 않고 있기 때문에 연준의 4회 연속 자이언트스텝도 예상되고 있어요.	강달러 환율 급등	https://www.edaily.co.kr/news/read?newsId=01308726632493904&mediaCodeNo=257&OutLnkChk=Y	2022/10/17	0	2022-10-19 20:06:15	2022-10-20 00:03:27
BK22017720	5	질문자	그렇게 예상하시는군요. 달러 강세와 고환율이 지속되면 국내 주식 시장에는 어떤 영향을 줄까요?				0	2022-10-19 20:06:15	2022-10-20 00:03:27
BK22017720	6	전문가	달러 강세는 환차익을 노리는 외국인 매도를 자극하죠. 때문에 국내 주식 시장에는 악재로 작용해요. 원달러 환율 때문에 당분간 시장이 힘들 것으로 전망되니 이를 이용한 투자법도 고민해 볼 때죠.	강달러 고환율 국내 주식시장	https://www.edaily.co.kr/news/read?newsId=01167686632493904&mediaCodeNo=257&OutLnkChk=Y	2022/10/17	0	2022-10-19 20:06:15	2022-10-19 22:05:35
BK22017720	7	질문자	아, 강달러와 고환율이 주식 시장에 안 좋은 영향을 주는 거군요. 제가 주식 투자를 조금 하고 있는데, 그러면 어떤 주식에 주목하면 좋을까요?				0	2022-10-19 20:06:15	2022-10-20 00:03:27
BK22017720	8	전문가	요즘은 환율 급등기이니 환율 수혜주를 투자 우선주로 꼽을 수 있어요. 수출 비중이 높아 고환율에 따른 환차익을 얻을 수 있는 자동차, 조선, 철강, 정보기술 기업 등을 위주로 투자 포트폴리오를 구성해 보세요.	달러강세 시대 환율수혜주	https://weekly.donga.com/3/all/11/3669070/1	2022/10/05	0	2022-10-19 20:06:15	2022-10-20 00:03:27
BK22017720	9	질문자	환차익을 얻을 수 있는 기업에 주목해야 하는군요. 저는 개인적으로 제약바이오 업종에 관심이 있는데, 이런 업종은 환율에 얼마나 영향을 받나요?				0	2022-10-19 20:06:15	2022-10-20 00:03:27
BK22017720	10	전문가	제약, 바이오 업종도 환율 상승의 영향을 받죠. 다만 긍정적인 면과 부정적인 면이 동시에 있어요. 긍정적인 면은 미국향 매출이나 달러 기반 매출액이 환율 효과로 커질 수 있다는 점이에요. 반면 의약품 생산에 필요한 수입 원자재와 부자재 가격 상승에 따른 일부 제조원가가 상승할 수 있고, 해외 지사 인건비나 글로벌 임상 진행 비용 등 신약 개발 비용이 전반적으로 증가할 수 있다는 점은 부정적인 면이지요.	달러강세 시대 환율 상승 제약 바이오	https://www.edaily.co.kr/news/read?newsId=01167686632493904&mediaCodeNo=257&OutLnkChk=Y	2022/10/17	0	2022-10-19 20:06:15	2022-10-20 00:03:27
BK22017720	11	질문자	그러면 무작정 투자를 하는 것은 금물이네요. 부품 업종은 어떻게 생각하세요? 부품업종도 강달러 영향이 있을까요?				0	2022-10-19 20:06:15	2022-10-19 23:09:52
BK22017720	12	전문가	달러 강세 시점에는 완성품 보다 반도체, 2차전지, 전기전자, 통신장비, 디스플레이 등의 부품 업종이 더 긍정적이라는 분석도 있어요. 스마트폰, PC, 가전 등과 같은 완성품은 달러 및 현지 통화로 매출액이 발생하죠. 하지만 부품의 경우에는 글로벌 세트 업체들에게 B2B 형태로 공급하기 때문에 주로 달러 매출이 이뤄지거든요. 그러니까 최근과 같이 달러 홀로 강세를 지속하는 상황에서는 달러 결제 비중이 높은 부품업체가 받는 수혜가 완성품 업체보다 더 크다고 볼 수 있죠.	달러강세 시대 부품 업종 투자	https://skyedaily.com/news/news_view.html?ID=170097	2022/10/15	0	2022-10-19 20:06:15	2022-10-20 00:03:27
BK22017720	13	질문자	그러면 부품 업종 전망이 나쁘지 않네요. 강달러로 주식 하락장이 지속되는 경우 또 어떤 전략을 취하면 좋을까요?				0	2022-10-19 20:06:15	2022-10-20 00:03:27
BK22017720	14	전문가	강달러는 주가 급락을 불러일으키죠. 하락장에서는 평가절하된 주식을 사들이는 저점 매수법도 고려해 볼 수 있는 방법이에요. 대표적으로 반도체주가 있어요. 공급 과잉으로 기업 내 재고가 쌓이면서 주가가 하락한 경우거든요.	강달러 현상 주식 저점 매수	https://weekly.donga.com/3/all/11/3669070/1	2022/10/05	0	2022-10-19 20:06:15	2022-10-20 00:03:27
BK22017720	15	질문자	그렇군요. 주식 때문에 고민이 많았는데 조언 너무 감사해요. 주식 시장이 불안한데 정부가 준비하는 대책도 있나요?				0	2022-10-19 20:06:15	2022-10-19 23:09:53
BK22017720	16	전문가	주식시장 변동성 완화 방안으로 증권시장안정펀드 매입약정 체결 등을 하겠다고 밝혔어요. 증안펀드는 증시안정을 위해 금융당국이 증권사와 은행, 보험, 상장사 등의 금융기관 등에서 기금 출연을 받아 조성하는 펀드로, 증시가 폭락할 때 주식을 매입해 증시를 안정시키는 기능을 하죠.	금융당국 주식시장 대응	https://www.dailian.co.kr/news/view/1161888/?sc=Naver	2022/10/13	0	2022-10-19 20:06:15	2022-10-20 00:03:27
BK22017720	17	질문자	증안펀드 도입이 주식 시장에 도움이 되면 좋겠네요. 강달러가 계속되는 경우 달러에 직접 투자하는 것을 고려해 봐도 괜찮을까요?				0	2022-10-19 20:06:15	2022-10-20 00:03:27
BK22017720	18	전문가	지난 9월 금융감독원도 달러 강세 장기화 가능성이 크다고 보고 시중은행에 외화 관리를 특별 주문했어요. 따라서 달러에 직접 투자하는 보수적인 포트폴리오 운용도 해볼 만해요. 달러 정기예금에 가입하면 자금을 안전하게 관리하는 것과 더불어 향후 환율 상승에 따른 환차익을 기대할 수 있거든요. 현재 달러 예금 이자율은 3개월 3.85%, 6개월 4.35%, 1년 4.7%로 6개월 기준 3%대인 원화예금보다 높은 수준이에요.	달러강세 달러 직접 투자	https://weekly.donga.com/3/all/11/3669070/1	2022/10/05	0	2022-10-19 20:06:15	2022-10-20 00:03:27
BK22017720	19	질문자	그러면 달러 직접 투자도 생각해 봐야겠어요. 오늘 달러, 주식 등에 대해 많이 알려주셔서 앞으로 구체적인 투자 계획을 짤 수 있을 것 같아요. 정말 고마워요, 다음에 또 만나요.				0	2022-10-19 20:06:15	2022-10-20 00:03:27
BK22017720	20	전문가	네, 또 만나요. 달러 강세 시대에 여러가지 어려움도 많겠지만, 효과적인 투자도 가능하니 좋은 결실 있기를 바래요. 다음에 볼 때까지 잘 지내요.				1	2022-10-19 20:06:15	2022-10-24 12:39:49
