id	utterance_id	role	text	search_query	search_URL	reference_date	terminate	regDate	updDate
BK22019824	1	질문자	경제 공부를 좀 시작해보려고 하는데, 코스닥 코스피가 뭔지 모르겠어. 일단 코스닥이 뭔지 좀 알려줘.				0	2022-10-28 10:54:35	2022-10-28 13:59:37
BK22019824	2	전문가	코스닥은 증권거래소처럼 거래장소가 있는 것이 아니라 컴퓨터와 통신망을 사용해서 주식을 거래하는 전자거래 시장을 의미해요. 코스닥은 1996년 7월에 만들어졌는데 중소기업에는 자금을 조달할 수 있는 창구를 제공하고 일반 투자자들에게는 새로운 투자 방법을 제공하죠.	코스닥 뜻	https://terms.naver.com/entry.naver?docId=72957&cid=43667&categoryId=43667	2018/06/01	0	2022-10-28 10:54:35	2022-10-28 13:59:37
BK22019824	3	질문자	아, 주식을 전자로 거래하는 시장이 코스닥이구나. 그럼 코스피는 뭐야?				0	2022-10-28 10:54:35	2022-10-28 13:59:37
BK22019824	4	전문가	코스피는 한국 종합주가지수라고도 해요. 한국거래소 내 유가증권시장에 상장된 기업들의 시가총액 기준 시점과 비교 시점이 어떻게 다른지 보여주는 지표죠.	코스피 뜻	https://ko.wikipedia.org/w/index.php?title=%EC%BD%94%EC%8A%A4%ED%94%BC&oldid=32079986	2022/03/07	0	2022-10-28 10:54:35	2022-10-28 13:59:37
BK22019824	5	질문자	시가총액이라는 건 뭘 말하는 거야?				0	2022-10-28 10:54:35	2022-10-28 13:59:37
BK22019824	6	전문가	시가총액은 상장된 주식 전체를 시가로 평가한 금액이에요. 개별 종목의 시가 총액을 의미하는 경우와 전체 주식시장의 시가 총액을 의미하는 경우가 있죠.	시가총액	https://terms.naver.com/entry.naver?docId=69703&cid=43667&categoryId=43667	2018/06/01	0	2022-10-28 10:54:35	2022-10-28 13:59:37
BK22019824	7	질문자	주식 전체의 값이라고 생각하면 되겠네. 그럼 코스닥이랑 코스피는 무슨 차이가 있는 거야?				0	2022-10-28 10:54:35	2022-10-28 13:59:37
BK22019824	8	전문가	코스피에는 일정 규모 이상의 회사들이 모여 있어요. 코스닥은 코스피에 상장된 기업들보다 규모가 작고 IT, BT 등의 기업이 모여 있죠. 비유하자면 코스피를 형님, 코스닥을 아우라고 할 수 있어요.	코스닥 코스피 차이	https://www.newsis.com/view/?id=NISX20201120_0001241497	2020/11/30	0	2022-10-28 10:54:35	2022-10-28 13:59:37
BK22019824	9	질문자	아, 코스피가 더 큰 기업들이 몰린 시장이구나. 그럼 아까 말한 코스피 지수의 기준 시점이라는 건 뭘 말하는 거야?				0	2022-10-28 10:54:35	2022-10-28 13:59:37
BK22019824	10	전문가	코스피 지수에서 말하는 기준 시점이란 1980년 1월 4일이에요. 이때의 주가지수를 100으로 해서 현재 상장된 주식들의 가격과 비교하여 코스피 지수를 산출하죠.	코스피 지수 기준 시점	https://www.hankyung.com/thepen/moneyist/article/202202140926Q	2022/02/15	0	2022-10-28 10:54:35	2022-10-28 13:59:37
BK22019824	11	질문자	아, 당시 지수랑 지금 지수를 비교해서 얼마큼 규모가 커졌는지 보는 거구나. 그럼 코스피 지수는 어떻게 산출하는데?				0	2022-10-28 10:54:35	2022-10-28 13:59:37
BK22019824	12	전문가	코스피 지수를 계산하는 방법을 알려드릴게요. 코스피 지수가 얼마인지 알고 싶은 시기의 시가총액을 앞서 말씀드린 기준 시점 시가총액으로 나눈 값에 100을 곱하면 돼요.	코스피 산출	http://www.womentimes.co.kr/news/articleView.html?idxno=54895	2022/01/10	0	2022-10-28 10:54:35	2022-10-28 13:59:37
BK22019824	13	질문자	아, 그런 식으로 계산하는구나. 그럼 코스피 뒤에 50이나 100 같은 숫자가 붙는 건 무슨 의미야?				0	2022-10-28 10:54:35	2022-10-28 13:59:37
BK22019824	14	전문가	코스피50, 코스피100에서 숫자가 의미하는 것은 기업의 숫자예요. 코스피에 상장된 회사 중에서 시가총액이 높고 거래하는 양이 많은 기업을 50, 100, 200개씩 추려서 만든 지수를 말하는 거죠. 매해 6월에 어떤 기업을 빼고 넣을지 정하고 그걸 토대로 새로운 목록을 만들어요.	코스피 숫자 의미	https://www.sedaily.com/NewsView/2620U0QYA8	2022/02/05	0	2022-10-28 10:54:35	2022-10-28 13:59:37
BK22019824	15	질문자	아, 그럼 코스피에 상장된 기업들은 총 몇 개나 돼?				0	2022-10-28 10:54:35	2022-10-28 13:59:37
BK22019824	16	전문가	코스피에 상장된 회사는 총 799개예요. 상장된 종목의 갯수는 934개죠.	코스피 상장 기업 수	https://ko.wikipedia.org/w/index.php?title=%EC%BD%94%EC%8A%A4%ED%94%BC&oldid=32079986	2022/03/07	0	2022-10-28 10:54:35	2022-10-28 13:59:37
BK22019824	17	질문자	그럼 올해 코스피에 상장된 회사는 몇 개나 되는데?				0	2022-10-28 10:54:35	2022-10-28 13:59:37
BK22019824	18	전문가	2022년 3분기 기준 코스피에는 5개, 코스닥에는 43개 회사가 새롭게 상장되었어요. 작년 같은 기간 동안 총 65개의 회사가 상장된 것과 비교하면 26% 정도 줄었죠.	2022년 코스피 상장 기업 수	https://www.fntimes.com/html/view.php?ud=202210040913268250179ad43907_18	2022/10/04	0	2022-10-28 10:54:35	2022-10-28 13:59:37
BK22019824	19	질문자	경기가 안 좋은 게 기업 상장에 영향을 주기도 하는구나.				0	2022-10-28 10:54:35	2022-10-28 13:59:37
BK22019824	20	전문가	네. 코스닥과 코스피에 대해 아셨으니 앞으로는 여러 가지 지수를 통해 한국 경제의 상황을 가늠해 볼 수 있을 거예요.				1	2022-10-28 10:54:35	2022-10-28 13:59:37
