id	utterance_id	role	text	search_query	search_URL	reference_date	terminate	regDate	updDate
BK22015579	1	질문자	오늘 인터넷 찾아보니 청년들에게 월세를 지원해주는 사업이 있다고 하던 데 어떤 사업인지 설명해주실 수 있나요?				0	2022-10-10 14:53:36	2022-10-10 15:31:05
BK22015579	2	전문가	청년월세 사업 말씀하시나 보군요. 1인 가구 기준 중위소득 60퍼센트 이하 저소득 청년에게 월 20만원씩 최대 12개월 동안 월세를 보조해 주는 사업이 국토부의 청년월세 한시지원 사업이에요.	청년월세	https://biz.sbs.co.kr/article/20000083382?division=NAVER	2022/10/06	0	2022-10-10 14:53:36	2022-10-17 15:56:12
BK22015579	3	질문자	청년월세 한시지원 사업이었군요. 그럼 이 사업의 신청 대상은 어떻게 되나요?				0	2022-10-10 14:53:36	2022-10-10 15:31:05
BK22015579	4	전문가	임차보증금이 5천만원 이하이고 월세 60만원 이하인 주택에 부모와 별도로 거주하는 무주택자 중 만 19세에서 34세 청년이 지원대상이에요.	청년월세 대상	https://www.yna.co.kr/view/AKR20220915105400055?input=1195m	2022/09/15	0	2022-10-10 14:53:36	2022-10-10 15:31:05
BK22015579	5	질문자	저는 월세가 60만원이 넘어가서 대상으로 선정되기 어렵겠네요. 혹시 다른 해결책이 있을까요?				0	2022-10-10 14:53:36	2022-10-10 15:31:05
BK22015579	6	전문가	월세액이 60만원을 초과하는 경우라면 환산율 2.5퍼센트를 적용한 보증금 환산액과 월세 합산액이 일정 금액 이하면 신청할 수 있는 데 그 금액은 70만원 이하에요.	청년월세 60만원 초과	http://www.domin.co.kr/news/articleView.html?idxno=1396333	2022/09/15	0	2022-10-10 14:53:36	2022-10-10 15:31:05
BK22015579	7	질문자	그럼 저도 신청이 가능할 수도 있겟네요. 신청은 어디에서 하면 되는 건가요?				0	2022-10-10 14:53:36	2022-10-10 15:31:05
BK22015579	8	전문가	신청은 인터넷 마이홈포털이나 복지로 사이트에 있는 모의 계산 서비스로 대상 여부를 확인한 후에 신청 서류를 구비해 주소지에 해당하는 행정복지센터나 복지로를 통해서 할 수 있어요.	청년월세 신청	https://www.wikitree.co.kr/articles/789334	2022/09/15	0	2022-10-10 14:53:36	2022-10-10 15:31:05
BK22015579	9	질문자	대상 여부인지 확인도 미리 할 수 있어 편하겟네요. 그럼 신청은 언제까지 하면 되나요?				0	2022-10-10 14:53:36	2022-10-10 15:31:05
BK22015579	10	전문가	임차보증금이 5천만원 이하이고 월세 60만원 이하인 주택에 부모와 별도로 거주하는 무주택자 중 만 19세에서 34세 청년이 지원대상인 청년월세사업의 신청기한은 내년 8월 21일까지에요.	청년월세 신청기한	https://www.newspim.com/news/view/20220915000265	2022/09/15	0	2022-10-10 14:53:36	2022-10-10 15:31:05
BK22015579	11	질문자	내년 8월 21일까지면 여유있네요. 신청하기 전에 대상에서 제외되거나 지원이 중단되는 사항에 대해서도 알고 싶은 데 알려주실 수 있나요?				0	2022-10-10 14:53:36	2022-10-10 15:31:05
BK22015579	12	전문가	지원 대상에서 배제하는 경우는 행복주택 입주자, 부모형제주택 입주자 등이 있어요. 그리고 지원을 중단하는 경우에는 최근 6개월간 90일을 초과해 외국에 머물거나 부모와 합가하는 경우에요.	청년 월세 제외 대상	https://www.inews24.com/view/1525753	2022/10/06	0	2022-10-10 14:53:36	2022-10-17 15:56:12
BK22015579	13	질문자	그렇군요. 그럼 혹시, 지원이 불가한 경우에 대해서 더 알려주실 수 있을 까요?				0	2022-10-10 14:53:36	2022-10-17 15:56:12
BK22015579	14	전문가	그럼요. 지방자치단체에서 월세 지원을 한번이라도 받은 청년은 국토부가 운영하고 있는 청년 월세 지원사업 대상에서 배제 된다는 것도 알고 계시면 좋아요.	청년월세 중복 배제	https://www.hankyung.com/politics/article/202210057439i	2022/10/06	0	2022-10-10 14:53:36	2022-10-11 09:40:41
BK22015579	15	질문자	그런 이야기는 처음들어보는 데 어떤 사업이 청년월세에 지원할 수 없는 건가요?				0	2022-10-10 14:53:36	2022-10-10 17:28:58
BK22015579	16	전문가	국토부에서 중복사업이라 청년 월세에 지원할 수 없다고 밝힌 것은 무려 51개 지자체 사업이 속해 있는 지자체 청년 월세지원 현황이에요. 51개 지자체 사업에는 서울시에서 운영하는 2020년부터 월 최대 20만원 최대 10개월 지급 사업, 부산시에서 운영하는 2019년부터 월 최대 10만원을 최대 10개월 지급 등의 사업이 있어요.	지자체 청년 월세 지원	https://www.wikitree.co.kr/articles/795490	2022/10/06	0	2022-10-10 14:53:36	2022-10-12 18:58:21
BK22015579	17	질문자	저도 얼마전에 서울시에서 운영하는 월세지원 사업 참가했었는 데 참여하지 못하겠네요. 저 같이 과거에 월세 지원을 받아 청년월세지원사업에 참여하지 못하는 사람들은 얼마나 되나요?				0	2022-10-10 14:53:36	2022-10-10 15:31:05
BK22015579	18	전문가	올해까지 서울시에서 월세 지원을 받아 지원금액과 상관없이 국토부 사업에 참여할 수 없는 인원은 6만2천여명이에요.	서울시 월세 지원 6만 2천여명 청년 월세	https://www.yna.co.kr/view/AKR20221006049200001?input=1195m	2022/10/06	0	2022-10-10 14:53:36	2022-10-10 15:31:05
BK22015579	19	질문자	6만2천여명이 되는 군요. 월세 지원받을 수 있을 줄 알았는 데 아쉽네요. 그래도 많은 정보 알려주셔서 도움이 많이 되었네요.				0	2022-10-10 14:53:36	2022-10-10 15:31:05
BK22015579	20	전문가	도움이 되었다니 뿌듯하네요. 언제든지 필요한 정보나 궁금한 점이 있다면 연락주세요. 안녕히 계세요.				1	2022-10-10 14:53:36	2022-10-17 15:56:12
