id	utterance_id	role	text	search_query	search_URL	reference_date	terminate	regDate	updDate
BK22017707	1	질문자	아는 지인을 통해 보험을 너무 많이 들어놨더니 정리가 안되네요. 이번에 보험 해지를 하려고 알아보니 보험 용어가 너무 어려워서 머리가 아프네요.				0	2022-10-19 18:03:34	2022-10-19 18:03:34
BK22017707	2	전문가	아, 보험이 워낙 용어가 어려워서 그러실만해요.				0	2022-10-19 18:03:34	2022-10-19 18:03:34
BK22017707	3	질문자	네, 제가 가입한 보험 중에 유니버셜 보험이라는 게 있던데 혹시 그게 어떤 보험인지 아세요?				0	2022-10-19 18:03:34	2022-10-19 18:03:34
BK22017707	4	전문가	음, 유니버셜 보험은 일반적인 보험과 비교했을 때 보혐료 납입을 자유롭게 할 수 있는 상품이에요. 일반 보험은 가입한 후 정해진 보험료를 매달 내야 하는 반면에 유니버셜 보험은 의무 납입 기간이 지나면 보험료를 내는 시기와 금액이 조정 가능한 보험이에요.	유니버셜 보험	https://biz.chosun.com/stock/finance/2022/10/09/UVSS5QICVFBVXNQRT4B52VVOQ4/?utm_source=naver&utm_medium=original&utm_campaign=biz	2022/10/09	0	2022-10-19 18:03:34	2022-10-19 18:03:34
BK22017707	5	질문자	와, 보험료와 납입 시기를 마음대로 조절할 수 있다니 그건 몰랐네요. 그러면 유니버셜 보험은 의무 납입 기간이 어떻게 돼요?				0	2022-10-19 18:03:34	2022-10-19 18:03:34
BK22017707	6	전문가	유니버셜 보험의 보험료 의무 납입 기간은 통상 2년이에요. 2년이 지난 시점부터는 보험료의 납입금액과 시기를 조절 가능해요.	유니버셜 보험 의무납입기간	https://www.insnews.co.kr/design_php/news_view.php?num=68070&firstsec=5&secondsec=53	2021/12/26	0	2022-10-19 18:03:34	2022-10-19 18:03:34
BK22017707	7	질문자	네, 그런데 보험료를 내지 않아도 계약이 유지되는 거예요? 어떻게 그런 거죠?				0	2022-10-19 18:03:34	2022-10-19 18:03:34
BK22017707	8	전문가	아, 유니버셜 상품은 의무 납입 기간이 지난 후 계약이 유지되는 이유는 주계약 해지환급금에서 그 달에 내야 할 대체 보험료가 자동으로 납입되기 때문이에요. 대신 장기간 보험료를 내지 않으면 계약이 해지될 수 있으니 상품의 세부 조건을 잘 확인하셔야 해요.	유니버셜 보험 계약유지	https://biz.chosun.com/stock/finance/2022/10/09/UVSS5QICVFBVXNQRT4B52VVOQ4/?utm_source=naver&utm_medium=original&utm_campaign=biz	2022/10/09	0	2022-10-19 18:03:34	2022-10-19 18:03:34
BK22017707	9	질문자	네, 그런데 해지환급금이라고 하셨는데 해지환급금이 뭔가요?				0	2022-10-19 18:03:34	2022-10-19 18:03:34
BK22017707	10	전문가	해지환급금은 보험을 가입한 후 만기 전에 계약을 해지하면 돌려받는 돈을 말해요. 만약 보험 가입자가 계약을 해지하면 보험사는 운영비와 해지공제액 등을 제한 후에 가입자에게 해지환급금을 돌려줘요.	보험 해지환급금	https://www.dailian.co.kr/news/view/1155133/?sc=Naver	2022/09/23	0	2022-10-19 18:03:34	2022-10-19 18:03:34
BK22017707	11	질문자	어머, 그런 것도 있었군요. 그러면 만약에 보험료를 내지 못해서 보험이 사라진 경우에도 나중에 돈을 돌려받을 수 있나요?				0	2022-10-19 18:03:34	2022-10-19 18:03:34
BK22017707	12	전문가	그럼요. 보험료를 내지 못해서 보험의 효력을 상실했을 경우에 이미 낸 보험료 중 일부를 되돌려주는 게 있는데요. 그걸 효력상실 환급금이라고 불러요.	보험 효력상실환급금	http://www.consumernews.co.kr/news/articleView.html?idxno=648245	2022/06/16	0	2022-10-19 18:03:34	2022-10-19 18:03:34
BK22017707	13	질문자	네, 그런데 듣자 하니 보험료를 못 내도 납입을 유예해 주는 게 있다던데 어떤 제도에요?				0	2022-10-19 18:03:34	2022-10-19 18:03:34
BK22017707	14	전문가	아, 보험료 납입 유예 제도는 보험료를 내는 기일이 지났을 때 납입기일이 속한 월의 다음 달 말일까지 유예기간을 주는 거예요. 그 기간 안에 보험료를 내면 계약을 유지하는 제도니 만약 그 달에 보험료를 못 낼 경우 활용할 수 있어요.	보험 납입 유예	https://www.dailian.co.kr/news/view/1155133/?sc=Naver	2022/09/23	0	2022-10-19 18:03:34	2022-10-19 18:03:34
BK22017707	15	질문자	만약 보험료를 못내도 무작정 해지하지 말고 보험 납입 유예 제도를 이용하면 되겠네요. 그런데 만약 보험의 보장 금액이 너무 비싼 경우에는 금액을 낮출 수 있는 방법은 없나요?				0	2022-10-19 18:03:34	2022-10-19 18:03:34
BK22017707	16	전문가	아, 만약 보험의 보장금액을 낮추고 싶으면 감액제도를 이용하면 되는데요. 감액 완납제도는 가입한 보험계약의 보장 기간과 지급조건은 그대로 두되 보장금액을 낮추는 제도에요.	보험 감액 제도	https://www.dailian.co.kr/news/view/1155133/?sc=Naver	2022/09/23	0	2022-10-19 18:03:34	2022-10-19 18:03:34
BK22017707	17	질문자	네, 보험에는 참 다양한 제도들이 숨어 있었네요. 그런데 지인 중에 보험료를 못 내서 보험이 없어졌다가 다시 계약을 살렸다고도 하는데 그런 제도도 있나요?				0	2022-10-19 18:03:34	2022-10-19 18:03:34
BK22017707	18	전문가	아, 말씀하신 제도는 보험계약 부활 제도인데요. 보험이 실효된 날을 기준으로 최대 3년 이내에 그동안 내지 못한 보험료와 연체이자를 보험사에 내면 계약을 살릴 수 있는 방법이에요. 대신 해지환급금을 받지 않은 경우에만 가능해요.	보험 계약 부활 제도	https://www.dailian.co.kr/news/view/1155133/?sc=Naver	2022/09/23	0	2022-10-19 18:03:34	2022-10-19 18:03:34
BK22017707	19	질문자	네, 보험 정리를 할 때 알려주신 정보가 유용하게 도움 되겠어요. 정말 감사해요. 다음에도 좋은 정보 부탁드려요.				0	2022-10-19 18:03:34	2022-10-19 18:03:34
BK22017707	20	전문가	물론이죠. 보험 가입한 부분 잘 살펴보셔서 정리 잘하셨으면 좋겠네요. 그럼 나중에 또 수다 떨어요.				1	2022-10-19 18:03:34	2022-10-24 10:49:18
