id	utterance_id	role	text	search_query	search_URL	reference_date	terminate	regDate	updDate
BK22019807	1	질문자	개인 사업을 준비하고 있습니다. 개인사업자의 창업절차에 대해 알려주세요.				0	2022-10-28 10:54:25	2022-10-28 13:56:09
BK22019807	2	전문가	개인사업자는 대부분의 업종에서 특별한 규제 등이 없이 사업을 하실 수 있으나 인허가 대상 사업인 경우 관계법령에 따른 준비서류와 인허가 승인절차를 미리 숙지하시어 행정관청으로 부터 사업에 관한 승인을 받아여 하며 사업장마다 사업개시일로 부터 20일내에 관할 세무서에 사업자등록을 하셔야 합니다.	개인사업자 창업	https://easylaw.go.kr/CSP/CnpClsMain.laf?popMenu=ov&csmSeq=632&ccfNo=3&cciNo=1&cnpClsNo=1&menuType=onhunqna&search_put=	2022/08/15	0	2022-10-28 10:54:25	2022-10-28 13:56:09
BK22019807	3	질문자	그렇군요, 중소기업 시책에 따라 지원을 받고 싶은데 어떤 중소기업이 시책의 대상이 되나요?				0	2022-10-28 10:54:25	2022-10-28 13:56:09
BK22019807	4	전문가	중소기업 시책의 대상이 되는 기업 또는 조합 등을 중소기업이라 합니다. 이를 나누어 살펴보면 일정한 규모 및 독립성 기준을 갖춘 영리기업과 사회적기업 육성법에 따른 비영리 사회적기업, 소비자생활협동조합법에 따른 조합 등이 있습니다.	중소기업 시책 대상	https://easylaw.go.kr/CSP/CnpClsMain.laf?popMenu=ov&csmSeq=632&ccfNo=2&cciNo=1&cnpClsNo=1&menuType=onhunqna&search_put=	2022/08/15	0	2022-10-28 10:54:26	2022-10-28 13:56:09
BK22019807	5	질문자	말씀하신 대상 중에 사회적기업에 혜택이 많던데 사회적기업은 무엇인가요?				0	2022-10-28 10:54:26	2022-10-28 13:56:09
BK22019807	6	전문가	사회적기업은 사회적기업 인증요건을 갖추어 고용노동부장관의 승인을 받은 기업으로 취약계층에 대한 서비스나 일자리 제공을 통해 지역사회에 공헌 또는 지역주민의 삶의 질을 높이는 사회적 목적을 추구하면서 재화 및 서비스를 생산 판매합니다.	사회적기업	https://easylaw.go.kr/CSP/CnpClsMain.laf?popMenu=ov&csmSeq=632&ccfNo=2&cciNo=1&cnpClsNo=1&menuType=onhunqna&search_put=	2022/08/15	0	2022-10-28 10:54:26	2022-10-28 13:56:09
BK22019807	7	질문자	사회적기업에 대해서는 이해가 잘 됐어요. 그런데 IT쪽에는 벤처기업이 많던데 벤처기업은 무엇인가요? 중소기업과 다른 것인가요?				0	2022-10-28 10:54:26	2022-10-28 13:56:09
BK22019807	8	전문가	중소기업 중에서 정부가 지원할 필요가 인정되는 기업 중에 상대적으로 기술성이나 성장성이 뛰어난 기업들로 벤처투자유형, 연구개발유형, 혁신성장유형, 예비벤처기업 등에 해당하는 기업을 말합니다.	벤처기업	https://easylaw.go.kr/CSP/CnpClsMain.laf?popMenu=ov&csmSeq=632&ccfNo=2&cciNo=2&cnpClsNo=1&menuType=onhunqna&search_put=	2022/08/15	0	2022-10-28 10:54:26	2022-10-28 13:56:09
BK22019807	9	질문자	아하, 저는 벤처기업으로 정부지원을 받으려고 하는데 벤처기업 여부를 어디서 확인받을 수 있나요?				0	2022-10-28 10:54:26	2022-10-28 13:56:09
BK22019807	10	전문가	벤처확인종합관리시스템을 이용해 중소벤처기업진흥공단, 기술신용보증기금 등의 확인기관장에게 벤처기업 확인을 신청하면 확인기관이 기술성, 사업성 등을 벤처기업 유형에 따라 심사하여 벤처기업 여부를 확인합니다.	벤처기업 여부 확인	https://easylaw.go.kr/CSP/CnpClsMain.laf?popMenu=ov&csmSeq=632&ccfNo=2&cciNo=2&cnpClsNo=2&menuType=onhunqna&search_put=	2022/08/15	0	2022-10-28 10:54:26	2022-10-28 13:56:09
BK22019807	11	질문자	네, 그리고 창업할 벤처에서 제품을 생산할 공장을 필요로 하는데 창업사업계획승인을 받아야 된다고 합니다. 창업사업계획 승인에 관해 알려주세요.				0	2022-10-28 10:54:26	2022-10-28 13:56:09
BK22019807	12	전문가	창업사업계획승인제도는 공장 설립을 간편하게 할 수 있도록 산업단지 외의 지역에 공장을 설립하려고 할때 공장설립승인을 중소기업창업 지원법에 따라 창업사업계획승인으로도 인정하는 제도입니다.	창업사업계획승인	https://easylaw.go.kr/CSP/CnpClsMain.laf?popMenu=ov&csmSeq=632&ccfNo=3&cciNo=3&cnpClsNo=1&menuType=onhunqna&search_put=	2022/08/15	0	2022-10-28 10:54:26	2022-10-28 13:56:09
BK22019807	13	질문자	공장 설립을 간편하게 할 수 있도록 간소화한 제도로군요. 참, 창업보육센터에서 창업을 시작하는 것이 좋다고 하는데 창업보육센터에서 지원하는 내용에 대해 알려 주세요.				0	2022-10-28 10:54:26	2022-10-28 13:56:09
BK22019807	14	전문가	성공적인 창업을 위해 창업자에게 다양한 지원을 목적으로 설립된 창업보육센터에서는 시설과 장소 뿐만 아니라 공동연구 및 개발 등의 기술지원, 회계 및 세무 등의 경영지원 등을 받으실 수 있습니다.	창업보육센터	https://easylaw.go.kr/CSP/CnpClsMain.laf?popMenu=ov&csmSeq=632&ccfNo=4&cciNo=1&cnpClsNo=2&menuType=onhunqna&search_put=	2022/08/15	0	2022-10-28 10:54:26	2022-10-28 13:56:09
BK22019807	15	질문자	말씀해 주신 내용들을 일일이 알아보기가 힘듭니다. 중소기업 창업을 위한 절차나 경영상담 등을 지원받을 수 있는 곳이 있나요?				0	2022-10-28 10:54:26	2022-10-28 13:56:09
BK22019807	16	전문가	그렇다면 중소기업창업 지원법에 따라 중소기업의 사업성을 평가하고 경영 및 기술향상을 위한 용역수행은 물론 자금조달과 운용에 대한 자문, 창업절차의 대행 등을 전문적으로 영위하는 중소기업상담회사를 통해 지원을 받으실 수 있습니다.	중소기업상담회사	https://easylaw.go.kr/CSP/CnpClsMain.laf?popMenu=ov&csmSeq=632&ccfNo=4&cciNo=1&cnpClsNo=1&menuType=onhunqna&search_put=	2022/08/15	0	2022-10-28 10:54:26	2022-10-28 13:56:09
BK22019807	17	질문자	네, 중소기업상담회사 또한 메모해 두겠습니다. 이제는 실행만 남은 것 같네요.				0	2022-10-28 10:54:26	2022-10-28 13:56:09
BK22019807	18	전문가	천천히 더 꼼꼼히 알아보셔서 성공적인 창업이 되시길 바랍니다.				0	2022-10-28 10:54:26	2022-10-28 13:56:09
BK22019807	19	질문자	좋은 정보와 조언을 주셔서 감사합니다.				0	2022-10-28 10:54:26	2022-10-28 13:56:09
BK22019807	20	전문가	다음에 궁금한 것이 또 생기시면 찾아 주세요.				1	2022-10-28 10:54:26	2022-10-28 13:56:09
