id	utterance_id	role	text	search_query	search_URL	reference_date	terminate	regDate	updDate
BK22007876	1	질문자	어제 내 친구가 지역화폐를 통해서 복싱장을 싸게 등록했다더라. 잘 이용하면 아주 유용할 것 같던데, 넌 지역화폐에 대해서 좀 알고 있어?				0	2022-09-08 02:29:38	2022-09-08 02:29:38
BK22007876	2	전문가	응, 지역화폐는 보통 특정 지역에서만 쓰이는 대안 화폐여서 법정 화폐와 동등한 가치가 보장되기도 하고 아니기도 해. 보통은 골목상권을 활성화하려는 목적으로 발행하기 때문에 동네 상점이나 골목상권에서 주로 사용하고 백화점이나 대형마트 곳에서는 사용하기 어려운 것도 특징이지.	지역화폐	https://ko.wikipedia.org/wiki/%EC%A7%80%EC%97%AD%ED%99%94%ED%8F%90	2022/08/02	0	2022-09-08 02:29:38	2022-09-08 02:29:38
BK22007876	3	질문자	어떤 취지로 발행됐는지는 이해가 돼. 그렇지만 종류가 좀 많아서 복잡하게 느껴져. 여러 종류가 있지 않니?				0	2022-09-08 02:29:38	2022-09-08 02:29:38
BK22007876	4	전문가	크게 분류하면 지류형, 카드형, 모바일로 나눌 수 있어. 지류형은 농협 같은 곳에서 천원권이나 오천원권, 만원권을 구매할 수 있고 종이 화폐 형태야. 카드형은 대부분의 체크카드 가맹점에서 다 쓸 수 있고, 충전할 때 모바일 앱이나 금융사를 통해 하면 돼. 모바일 형태는 스마트폰을 이용해 바코드나 QR코드로 쉽게 결제할 수 있어.	지역화폐 종류	https://ko.wikipedia.org/wiki/%EC%A7%80%EC%97%AD%ED%99%94%ED%8F%90	2022/08/02	0	2022-09-08 02:29:38	2022-09-08 02:29:38
BK22007876	5	질문자	결제 방식에 따라 구분했구나. 그런데 이미 법정화폐가 있는데 굳이 지역화폐를 만드는 이유가 뭐야?				0	2022-09-08 02:29:38	2022-09-09 02:14:13
BK22007876	6	전문가	지역화폐가 만들어진 가장 큰 이유는 지역 경제 활성화와 재정 적자 완화 때문이야. 요즘엔 온라인 시장이 발전하고, 대기업 중심으로 경제가 돌아가고 있잖아. 그래서 지방 주민들이 지방에서 일하고 지방자치단체가 제공하는 복지혜택들을 누리는 반면, 소비는 서울에 본사가 있는 대형마트 혹은 백화점에서 하는 소득의 역외 유출 현상이 벌어진 거야. 따라서 대다수의 지방 정부들은 항상 세수가 부족해졌고,이러한 세수 부족에 대한 대안으로 나온 게 바로 지역화폐야. 거기다 정부 지원금을 지역 내에서만 사용하는 지역화폐 형태로 제공하면 지역 경제도 활성화되고, 세수 증가분이 지출한 복지 예산보다 커질 수도 있잖아.	지역화폐 이유	https://www.sedaily.com/NewsView/1Z1LJXLSZ9	2020/04/24	0	2022-09-08 02:29:38	2022-09-26 09:59:56
BK22007876	7	질문자	수도권 중심으로 소비가 진행되는 현상과 대기업 중심 경제 등 복잡한 문제가 얽혀 있었구나. 왜 지역화폐가 만들어졌는지 이제 이해가 돼. 또, 지역화폐를 사용하면 장점이 있어?				0	2022-09-08 02:29:38	2022-09-09 02:14:13
BK22007876	8	전문가	소비자와 소상공인 모두에게 좋다는 게 장점이지. 왜냐하면, 최근에는 지역화폐들이 모바일 간편결제나 선불카드 방식으로 많이 나와서 소상공인들이 원래 지불했어야 할 신용카드의 결제 수수료가 줄어들거든.	지역화폐 장점	https://www.sedaily.com/NewsView/1Z1LJXLSZ9	2020/04/24	0	2022-09-08 02:29:38	2022-09-09 02:14:13
BK22007876	9	질문자	확실히 신용카드 결제 수수료가 줄어드는 건 소상공인들에게 실질적으로 도움이 되겠어. 그런 지역화폐를 처음 시작했던 곳이 어디야?				0	2022-09-08 02:29:38	2022-09-09 02:14:13
BK22007876	10	전문가	2019년 서울 강북구에서 발표한 지역화폐 운영 실태 연구에 따르면, 지역화폐는 1983년 캐나다의 한 지역에서 처음 만들어졌어. 국내에서는 1996년에 화천군과 괴산군이 가장 먼저 시작했고, 이후에 일부 지자체에서 발행했어.	지역화폐 처음 시작	https://biz.chosun.com/policy/politics/election2022/2022/02/23/GMFHRI3IDRBI7NEGI3CIV3HI5A/	2022/02/23	0	2022-09-08 02:29:38	2022-09-09 02:14:13
BK22007876	11	질문자	내가 생각했던 것보다 역사가 길구나. 그러면 지금은 얼마나 많은 지자체로 확대된 거야?				0	2022-09-08 02:29:38	2022-09-09 02:14:13
BK22007876	12	전문가	전국 230여 개에 이르는 지방자치단체가 시행 중이야. 대표적인 지역화폐로는 서울시의 서울사랑상품권, 경기도의 경기지역화폐, 부산시의 동백전, 세종시의 여민전 등이 있어.	지역화폐 시행 지자체	https://www.chosun.com/economy/economy_general/2022/07/14/RL4V53VRKRG6JHQILUPO5SYTVA/	2022/07/14	0	2022-09-08 02:29:38	2022-09-09 02:14:13
BK22007876	13	질문자	굉장히 많은 지자체에서 시행 중이네. 그런데 혜택을 주는 건 좋은데, 그 사업 예산은 어디서 나오는 거야?				0	2022-09-08 02:29:38	2022-09-09 02:14:14
BK22007876	14	전문가	원래는 지자체의 자체 사업이라 지자체에서 예산을 모두 감당했었는데, 2018년부터는 고용위기지역 같은 곳에 중앙 정부에서 일부 지원을 해주었어. 그런데 이제 내년부터는 다시 정부에서 지역화폐를 지원하는 데 예산을 투입하지 않을 예정이야. 앞으로 지역화폐를 발행하고 싶은 지자체는 스스로의 예산으로 진행해야 해.	지역화폐 예산	http://www.busan.com/view/busan/view.php?code=2022083011054551768	2022/08/30	0	2022-09-08 02:29:38	2022-09-09 02:14:14
BK22007876	15	질문자	정부에서 지원해주는 예산이 줄어든다면 일부 지방자치단체는 지금까지의 혜택을 유지하는 게 어렵겠어. 혜택을 줄이는 지자체들이 있지 않니?				0	2022-09-08 02:29:38	2022-09-09 02:14:14
BK22007876	16	전문가	맞아, 부산시나 인천시, 대전시 등의 대표 지역화폐들이 한도와 할인율을 줄이고 캐시백을 일시 중단하는 등 혜택을 축소하고 있어. 부산시의 경우에는 기존 월 50만 원이었던 지역화폐 동백전의 1인당 충전 한도를 월 30만 원으로 축소하고, 충전 시의 할인율 역시 기존 10%에서 5%로 줄이겠다고 발표했어. 인천시의 인천e음, 대전시의 온통대전 등도 마찬가지의 상황이야.	지역화폐 폐지	https://www.hankyung.com/economy/article/2022072782041	2022/07/28	0	2022-09-08 02:29:41	2022-09-09 02:14:14
BK22007876	17	질문자	그렇게 축소되면 기존에 잘 사용하던 시민들은 아쉬울 수밖에 없겠어. 반발의 목소리가 있지는 않아?				0	2022-09-08 02:29:41	2022-09-09 02:14:14
BK22007876	18	전문가	소상공인들과 시민들 모두 지역화폐 폐지를 반대하고 나섰지. 더군다나 요즘에는 금리도 오르고, 생활 물가도 대폭 상승했는데 이런 상황에서 지역화폐를 줄이는 건 시민들에게 아쉬운 일일 수밖에 없어.	지역화폐 축소 반발	https://news.mt.co.kr/mtview.php?no=2022083013297878774	2022/09/01	0	2022-09-08 02:29:38	2022-09-26 09:59:56
BK22007876	19	질문자	하긴 요즘 경제 상황이 영 좋지 않아서 한 푼 한 푼이 소중한데 지역화폐 혜택이 축소되면 더 힘들어지겠다. 정부에서 시민들과 소상공인의 의견을 두루 듣고 잘 조율했으면 좋겠네.				0	2022-09-08 02:29:41	2022-09-09 02:14:14
BK22007876	20	전문가	맞아, 아무쪼록 재정에 너무 무리되지 않는 선에서 잘 해결되었으면 좋겠다.				1	2022-09-08 02:29:41	2022-09-26 10:25:43
