id	utterance_id	role	text	search_query	search_URL	reference_date	terminate	regDate	updDate
BK22015150	1	질문자	요새 금리가 많이 올랐다던데 사실인가요? 제 지인이 집을 분양받아서 대출을 이용해야 하는데 금리가 걱정인가 봐요.				0	2022-10-06 13:51:53	2022-10-06 15:11:54
BK22015150	2	전문가	네, 지금 신용대출과 전세자금 대출 금리가 7퍼센트가 육박해요. 1년에서 2년 전에 변동금리로 대출받은 사람들은 상환 부담이 점점 커지고 있고요.	금리	https://biz.chosun.com/stock/finance/2022/10/03/2I73VTZQKNCFXEYLXVI4DNXVJA/?utm_source=naver&utm_medium=original&utm_campaign=biz	2022/10/03	0	2022-10-06 13:51:53	2022-10-06 15:11:54
BK22015150	3	질문자	7퍼센트 금리라니 굉장히 높네요, 저금리 대출은 없는 건가요?				0	2022-10-06 13:51:53	2022-10-06 15:11:54
BK22015150	4	전문가	정부 지원 3대 서민 구입자금을 통합한 저금리의 구입자금 대출이 있어요. 주택도시기금에서 하는 내집마련디딤돌 대출이에요.	디딤돌 대출	https://www.gokorea.kr/news/articleView.html?idxno=726083	2022/07/28	0	2022-10-06 13:51:53	2022-10-06 15:11:54
BK22015150	5	질문자	그 대출은 금리가 어느 정도인가요?				0	2022-10-06 13:51:53	2022-10-06 14:56:11
BK22015150	6	전문가	디딤돌 대출의 금리는 9월 말 기준 2퍼센트 대로 이자 부담이 적어요. 단 5억 원 이하의 주택을 구입할 때 받을 수 있어요.	디딤돌 대출 금리	https://www.donga.com/news/article/all/20220929/115718457/1	2022/09/29	0	2022-10-06 13:51:53	2022-10-14 13:35:59
BK22015150	7	질문자	현재에 비해 금리가 너무 좋네요. 다른 대출 조건은 어떻게 되나요?				0	2022-10-06 13:51:53	2022-10-14 11:56:54
BK22015150	8	전문가	일단 주택을 구입하고자 하는 자로 주택 매매계약을 체결한 자, 대출 접수일을 기준으로 민법상 성년인 세대주를 모두 충족하는 자가 가능해요. 상속이나 증여, 재산분할로 주택 취득 시에는 대출이 불가하고요.	디딤돌 대출 대상	http://www.ggilbo.com/news/articleView.html?idxno=926269	2022/08/02	0	2022-10-06 13:51:53	2022-10-06 15:11:54
BK22015150	9	질문자	그렇군요, 혹시 소득 금액에 대한 제한은 없나요?				0	2022-10-06 13:51:53	2022-10-06 14:56:11
BK22015150	10	전문가	있어요, 부부합산 연 소득이 6천만 원 이하인 경우와 생애 최초 주택구입자, 2자녀 이상 가구, 신혼가구는 연 소득 7천만 원 이하인 경우에 가능해요. 무주택에 순자산가액 4.58억 원 이하여야 하죠.	디딤돌 대출 소득	http://www.ggilbo.com/news/articleView.html?idxno=926269	2022/08/02	0	2022-10-06 13:51:53	2022-10-06 15:11:54
BK22015150	11	질문자	그럼 대출금은 얼마까지 빌릴 수 있나요?				0	2022-10-06 13:51:53	2022-10-06 14:56:11
BK22015150	12	전문가	대출 금액은 담보주택 평가액에 LTV를 곱해 선순위 채권과 임대보증금 및 최우선변제소약임차보증금을 뺀 가격이에요.	디딤돌 대출 금액	http://www.ggilbo.com/news/articleView.html?idxno=926269	2022/08/02	0	2022-10-06 13:51:53	2022-10-06 15:11:54
BK22015150	13	질문자	집마다 상황이 다르겠군요, 더 구체적으로 상담받고 싶으면 어디로 연락하면 되나요?				0	2022-10-06 13:51:53	2022-10-06 15:11:54
BK22015150	14	전문가	내집마련디딤돌대출 심사 등의 상담은 관련 기관의 콜센터 및 수탁은행에서 진행해요. 자산심사 관련 상담은 주택도시 보증 공사 콜센터 및 심사 진행 중 안내된 담당자에게 문의하시고요.	디딤돌 대출 문의	http://www.ggilbo.com/news/articleView.html?idxno=926269	2022/08/02	0	2022-10-06 13:51:53	2022-10-06 15:11:54
BK22015150	15	질문자	그렇군요, 그런데 부부의 소득 수준이 7천만 원 이상일 경우 다른 저금리 대출은 어떤 게 있을까요?				0	2022-10-06 13:51:53	2022-10-06 15:11:54
BK22015150	16	전문가	부부합산 소득도 7000만 원, 신혼부부는 8500만 원까지 허용하는 대출은 보금자리론이 있어요. 이미 집 한 채가 있지만 갈아타고 싶은 경우도 가능하고 2자녀 이상이라면 최대 1억 원까지도 대출 가능해요.	보금자리론	https://www.sedaily.com/NewsView/264T09E4SC	2022/04/23	0	2022-10-06 13:51:53	2022-10-06 15:11:54
BK22015150	17	질문자	그렇군요, 제 지인의 상황을 정확하게 모르니 일단 이런 대출이 있다는 걸 얘기해 줘야겠어요.				0	2022-10-06 13:51:53	2022-10-06 15:11:54
BK22015150	18	전문가	네, 더 궁금한 게 있으신가요?				0	2022-10-06 13:51:53	2022-10-06 14:56:11
BK22015150	19	질문자	아니요, 오늘 좋은 정보 주셔서 너무 감사해요.				0	2022-10-06 13:51:53	2022-10-06 14:56:11
BK22015150	20	전문가	별말씀을요, 다음에 또 대화 나눠요.				1	2022-10-06 13:51:53	2022-10-14 13:35:59
