id	utterance_id	role	text	search_query	search_URL	reference_date	terminate	regDate	updDate
BK22000101	1	질문자	제가 비상장주식을 몇 개 가지고 있는데 이건 어떻게 거래하면 되나요?				0	2022-07-20 16:04:09	2022-08-02 12:01:32
BK22000101	2	전문가	비상장주식을 거래 할 수 있는 방법은 여러가지가 있는데, 금융투자협회에서 운영하고 있는 K OTC에서 거래하거나 한국거래소에서 운영하고 있는 코넥스 시장에 상장되어있다면 두 곳에서 거래할 수 있어요.	비상장주식 매매	https://www.news1.kr/articles/?4702400	2022/06/06	0	2022-07-20 16:04:09	2022-07-21 09:29:03
BK22000101	3	질문자	그럼 거래 시 수수료는 당연히 나올 것 같은데, 세금도 나오나요?				0	2022-07-20 16:04:09	2022-08-02 12:01:32
BK22000101	4	전문가	네, 주식 소유금액에 상관없이 비상장주식을 팔아서 차익금이 나왔다면, 양도소득세를 내야 해요. 대신 K OTC에서 소액주주가 벤처기업이나 중소기업, 중견기업의 비상장주식을 매매할 경우엔 양도세가 면제돼요.	비상장주식 세금	https://www.newspim.com/news/view/20210726000816	2021/07/26	0	2022-07-20 16:04:09	2022-07-21 09:29:03
BK22000101	5	질문자	오, 어차피 저는 진짜 소액만 가지고 있는거라 가능하면 K OTC시장에서 거래하는 게 좋겠네요. 그럼 K OTC 말고 아까 말씀하셨던 코넥스는 뭔가요?				0	2022-07-20 16:04:09	2022-08-02 12:01:32
BK22000101	6	전문가	코넥스는 2013년부터 시작한 중소기업 전용 주식시장이에요. 창업한지 얼마 안 된 중소기업이나 벤처기업들이 자본시장을 통해서 필요한 자금을 조달할 수 있도록 만들어졌죠.	코넥스	https://ko.wikipedia.org/wiki/%EC%BD%94%EB%84%A5%EC%8A%A4	2022/02/04	0	2022-07-20 16:04:09	2022-07-21 09:29:03
BK22000101	7	질문자	그럼 일반적인 주식들이 코스피나 코스닥에 상장되어야 거래가 가능하듯이 코넥스도 똑같나요?				0	2022-07-20 16:04:09	2022-08-02 12:01:32
BK22000101	8	전문가	맞아요, 코넥스에 상장하는 것도 조건이 있어요. 최근 감사의견이 적정의견을 받아야 하고, 지정자문인을 따로 선임해야 해요. 그리고 중소기업기본법 2조에 따른 중소기업이어야 하는 등의 조건들이 있죠.	코넥스 상장요건	http://www.sisajournal-e.com/news/articleView.html?idxno=245908	2021/12/10	0	2022-07-20 16:04:09	2022-07-21 09:29:03
BK22000101	9	질문자	그럼 비상장종목이라고 해서 코넥스에서 다 거래가 가능한건 아니겠네요. K OTC는 어떤가요? K OTC도 처음 들어보는거라 어떤 시장인지도 모르겠어요.				0	2022-07-20 16:04:09	2022-08-02 12:01:32
BK22000101	10	전문가	예전에 비상장 주식을 매매하던 장외시장인 프리보드를 좀 더 확대하고 개편한 게 K OTC에요. K OTC는 금융투자협회에서 운영하고 있는데, 여기서 거래할 수 있는 종목의 조건은 연 매출이 5억 이상이거나 감사의견이 적정의견이어야 해요. 증권예탁원에 전자 증권으로 등록하거나 자본이 전액 잠식 상태가 아닐 것 들의 조건이 요구되고 있어요. 그리고 한번 등록된다고 해서 쭉 유지가 되는 게 아니고, 협회에서 별도의 심사를 진행하면서 이 회사가 사업을 지속할 수 있는지도 점검하죠.	K-OTC	https://biz.newdaily.co.kr/site/data/html/2021/11/10/2021111000071.html	2021/11/10	0	2022-07-20 16:04:09	2022-07-21 09:29:03
BK22000101	11	질문자	흠, 두 시장에 상장할 정도로 큰 기업이 아니여서 그런데 그 방법 말고는 비상장주식을 거래할 수 있는 방법은 없나요?				0	2022-07-20 16:04:09	2022-08-02 12:01:32
BK22000101	12	전문가	방법은 또 있죠. 신한금융투자나 유안타증권, SK증권, 코리아에셋투자증권 등에서도 비상장주식 매매을 중개해주는 플랫폼을 운영하고 있어요.	증권사 비상장주식 중개서비스	https://cnews.fntimes.com/html/view.php?ud=202107310452118704dd55077bc2_18	2021/08/02	0	2022-07-20 16:04:09	2022-07-21 09:29:03
BK22000101	13	질문자	아, 증권사에서도 중개서비스를 해주는군요. 그것도 거래할 때 수수료가 나오는거죠?				0	2022-07-20 16:04:09	2022-08-02 12:01:32
BK22000101	14	전문가	그럼요, 비상장주식 중개서비스를 이용하는 경우 중개거래수수료로 매수 때 1퍼센트, 매도 때 1퍼센트 해서 총 2퍼센트정도 받아가고 있어요.	증권사 비상장주식 수수료	https://cnews.fntimes.com/html/view.php?ud=202107310452118704dd55077bc2_18	2021/08/02	0	2022-07-20 16:04:09	2022-07-21 09:29:03
BK22000101	15	질문자	일반적인 장내주식 거래하는 수수료와 비교하면 엄청 높은 편이네요. 흠, 그정도면 그냥 이 주식을 사고싶은 개인을 직접 찾아서 거래하는게 더 나을 것 같은데 그런걸 중개해주는 사설 플랫폼은 따로 없을까요?				0	2022-07-20 16:04:09	2022-08-02 12:01:32
BK22000101	16	전문가	38커뮤니케이션이나 엔젤리그, 증권플러스 등의 장외주식 거래 플랫폼이 있는데, 이 사이트들은 게시물을 올릴 때 확인절차가 따로 없어서 무작위로 게시글을 올릴 수 있어요. 거래 시 조심해야 하죠.	장외 주식거래 플랫폼	http://www.sisamagazine.co.kr/news/articleView.html?idxno=334608	2020/10/30	0	2022-07-20 16:04:09	2022-07-21 09:29:03
BK22000101	17	질문자	비상장주식 파는 게 이렇게 어려울 줄 몰랐어요. 언젠가는 상장되겠지, 했는데 안 되더라고요.				0	2022-07-20 16:04:09	2022-08-02 12:01:32
BK22000101	18	전문가	저도 그렇게 기다리다가 계속 상장이 안돼서 계좌에 남아있는 종목이 몇 개나 돼요. 그냥 언젠간 되겠지, 하고 넘어가고 있는거죠.				0	2022-07-20 16:04:09	2022-07-21 09:29:03
BK22000101	19	질문자	그냥 증권사에 중개서비스 신청해보거나 장외시장에라도 상장되는걸 기다려봐야겠어요. 알려주셔서 감사해요.				0	2022-07-20 16:04:09	2022-08-02 12:01:32
BK22000101	20	전문가	에이, 뭘요. 같은 처지라 하나라도 더 도움이 될까 싶어서 말씀드린 거예요. 꼭 팔리길 바라고 있을께요.				1	2022-07-20 16:04:09	2022-07-21 10:11:30
