id	utterance_id	role	text	search_query	search_URL	reference_date	terminate	regDate	updDate
BK22017201	1	질문자	요즘 경제 뉴스가 많이 나오네.				0	2022-10-18 12:36:09	2022-10-18 13:42:34
BK22017201	2	전문가	응, 아무래도 요즘 일이 많았잖아.				0	2022-10-18 12:36:09	2022-10-18 13:42:34
BK22017201	3	질문자	아까부터 계속 환율 이야기를 하던데, 환율이 정확히 뭐야?				0	2022-10-18 12:36:09	2022-10-18 13:42:34
BK22017201	4	전문가	환율은 서로 다른 통화를 사용하는 국가들이 각국의 통화를 교환하는 비율을 말해. 환율제도는 크게 고정 환율제와 변동 환율제로 구분하고.	환율	https://ko.wikipedia.org/wiki/%ED%99%98%EC%9C%A8	2022/09/21	0	2022-10-18 12:36:09	2022-10-18 13:42:34
BK22017201	5	질문자	고정 환율제와 변동 환율제가 있구나. 그럼 고정 환율제는 어떤 방식으로 통화를 교환하는 방식이지?				0	2022-10-18 12:36:09	2022-10-18 13:42:34
BK22017201	6	전문가	고정 환율제는 각 국가 통화의 교환 비율을 일정한 수준으로 고정시키는 제도야. 고정 환율제를 채택하면, 그 나라의 중앙은행이 환율을 일정하게 유지하도록 통화량을 관리할 수 있어.	고정 환율제	https://ko.wikipedia.org/wiki/%ED%99%98%EC%9C%A8	2022/09/21	0	2022-10-18 12:36:09	2022-10-18 13:42:34
BK22017201	7	질문자	그럼 고정 환율제를 채택할 때 생기는 이점이 있어?				0	2022-10-18 12:36:09	2022-10-18 13:42:34
BK22017201	8	전문가	응, 고정 환율제를 채택하면 일단 예측하기 어려운 환율 변동 상황에서 손해를 입을 염려가 없다는 게 큰 장점이지. 환율이 고정되어 있으니, 불확실성이 없어 국제 거래를 하는 데에도 이점이 많아.	고정 환율제 장점	https://ko.wikipedia.org/wiki/%EA%B3%A0%EC%A0%95_%ED%99%98%EC%9C%A8%EC%A0%9C	2022/05/09	0	2022-10-18 12:36:09	2022-10-18 13:42:34
BK22017201	9	질문자	그렇다면 고정 환율제의 단점은 없어?				0	2022-10-18 12:36:09	2022-10-18 13:42:34
BK22017201	10	전문가	고정 환율제를 채택하면 국제수지에서 발생할 수 있는 불균형이 자동적으로 조정되지 않아서 문제가 발생할 수 있다는 단점이 있어. 고정 환율제는 국제수지에 적자라도 발생한다면 정부에서 따로 긴축정책을 사용한다거나, 수입을 감소시키기 위해 여러 통제 방안을 써야 해. 그런데 문제는, 그런 상황에서 정부가 긴축정책을 쓰게 되면, 사회에 불황과 실업 등의 부작용이 발생할 수 있지.	고정 환율제 단점	https://ko.wikipedia.org/wiki/%EA%B3%A0%EC%A0%95_%ED%99%98%EC%9C%A8%EC%A0%9C	2022/05/09	0	2022-10-18 12:36:09	2022-10-18 13:42:34
BK22017201	11	질문자	아, 그건 좀 심각한 문제인데. 그럼 변동 환율제는 정확히 어떤 제도야?				0	2022-10-18 12:36:09	2022-10-18 13:42:34
BK22017201	12	전문가	변동 환율제는 각 국가의 통화 가치가 외국환 시장에 따라 시시각각 변화하는 체제야. 이 체제 아래에서는 환율이 변동하는 과정을 통해 국제수지가 조정되기 때문에, 국제 수지의 균형이 이루어질 수 있어.	변동 환율제	https://ko.wikipedia.org/wiki/%ED%99%98%EC%9C%A8	2022/09/21	0	2022-10-18 12:36:09	2022-10-18 13:42:34
BK22017201	13	질문자	그럼 변동 환율제는 어떤 장점이 있지?				0	2022-10-18 12:36:09	2022-10-18 13:42:34
BK22017201	14	전문가	변동 환율제를 채택하면 환전 과정에서 각 국가의 통화 가치가 자동적으로 변하기 때문에, 경제에 갑작스런 충격이 있었을 때 위험성이 다소 줄어들어. 또 외국인 투자가나 기업이 투자를 할 때도 상대적으로 유리한 점이 많지.	변동 환율제 장점	https://ko.wikipedia.org/wiki/%EB%B3%80%EB%8F%99_%ED%99%98%EC%9C%A8%EC%A0%9C	2022/04/20	0	2022-10-18 12:36:09	2022-10-18 13:42:34
BK22017201	15	질문자	그렇다면 변동 환율제는 단점이 없어?				0	2022-10-18 12:36:09	2022-10-18 13:42:34
BK22017201	16	전문가	변동 환율제는 고정 환율제에 비해 확실성도, 예측 가능성도 떨어진다는 단점이 크지. 그런데 이런 불확실성은 자국 통화의 가치를 떨어뜨리려는 정부의 노력에 따라 조절될 수도 있으니, 위와 같은 주장이 타당하지 않다는 학자들도 있어.	변동 환율제 단점	https://ko.wikipedia.org/wiki/%EB%B3%80%EB%8F%99_%ED%99%98%EC%9C%A8%EC%A0%9C	2022/04/20	0	2022-10-18 12:36:09	2022-10-18 13:42:34
BK22017201	17	질문자	그렇구나, 그럼 현재 모든 국가는 두 제도 중 하나를 택하고 있는 거야?				0	2022-10-18 12:36:09	2022-10-18 13:42:34
BK22017201	18	전문가	아니야, 현재 많은 국가들은 관리변동 환율 제도를 채택하고 있어. 정말 순수한 변동 환율 제도를 채택한다면, 환율은 오로지 외환시장의 수급이 결정하고, 정부는 외환시장에 개입을 할 수 없게 돼. 그러니 현실적으로는 오늘날 대부분의 국가가 순수한 변동 환율제 대신 관리 변동 환율제를 택하고 있지.	혼합된 환율제	https://ko.wikipedia.org/wiki/%EB%B3%80%EB%8F%99_%ED%99%98%EC%9C%A8%EC%A0%9C	2022/04/20	0	2022-10-18 12:36:09	2022-10-18 13:42:34
BK22017201	19	질문자	고마워, 덕분에 환율제에 대해 많이 알게 되었어.				0	2022-10-18 12:36:10	2022-10-18 13:42:34
BK22017201	20	전문가	응, 잘 알게 되었다니 기쁘다.				1	2022-10-18 12:36:10	2022-10-18 13:42:34
