id	utterance_id	role	text	search_query	search_URL	reference_date	terminate	regDate	updDate
BK22001603	1	질문자	에휴 친구들 따라서 아무런 지식 없이 주식에 투자했더니 계속 돈을 잃기만 하네요.				0	2022-07-20 16:17:44	2022-08-02 12:01:32
BK22001603	2	전문가	헉 진짜로 아무런 정보 없이 친구분들을 따라서 시작하신 거예요?				0	2022-07-20 16:17:44	2022-07-21 10:41:26
BK22001603	3	질문자	네 친구들 추천으로 막 시작했을 때는 상승장이었거든요. 돈 버는 족족 여기에 투자했는데 큰일이네요.				0	2022-07-20 16:17:44	2022-08-02 12:01:32
BK22001603	4	전문가	아이고 그런 식의 투자는 정말 안 좋아요. 아마도 팬데믹 직후부터 투자하신 것 같은데 보통 이때 유입된 사람들이 주식이 계속 오를 거라고 착각을 했더라고요.	초보자 주식투자	https://www.chosun.com/national/weekend/2022/05/28/4XELBJV6WRAGXLJ4KGYEQVPUPA/	2022/05/28	0	2022-07-20 16:17:44	2022-07-21 10:41:26
BK22001603	5	질문자	헉 제가 주식 시작한 시기도 딱 아시네요.				0	2022-07-20 16:17:44	2022-08-02 12:01:32
BK22001603	6	전문가	코로나 시기에 주식 열풍이 불었잖아요. 코로나 이후에 유동성을 타고 부풀었던 자산 거품이 꺼지고 있어서 충격받는 분들이 많더라고요.	팬데믹 주식	https://www.khan.co.kr/economy/economy-general/article/202206141734001	2022/06/14	0	2022-07-20 16:17:44	2022-07-21 10:41:26
BK22001603	7	질문자	휴 저는 이제 이렇게 변동성이 큰 주식 같은 거에는 더 이상 투자하지 않으려고요. 혹시 추천할만한 다른 투자 분야가 있을까요?				0	2022-07-20 16:17:44	2022-08-02 12:01:32
BK22001603	8	전문가	그럼 안전자산 위주로 투자하는 것을 추천해 드려요.				0	2022-07-20 16:17:44	2022-07-21 10:41:26
BK22001603	9	질문자	혹시 어떤 걸 안전자산이라고 하나요?				0	2022-07-20 16:17:44	2022-08-02 12:01:32
BK22001603	10	전문가	안전자산은 금이나 달러 채권 같은 것들을 말해요.	안전자산 금 달러	http://www.econovill.com/news/articleView.html?idxno=579473	2022/06/26	0	2022-07-20 16:17:44	2022-07-21 10:41:26
BK22001603	11	질문자	오 금에 투자하는 거라면 저도 몇 번 들어본 적 있는 분야네요. 근데 금은 보관하고 있기가 무서울 것 같아요.				0	2022-07-20 16:17:44	2022-08-02 12:01:32
BK22001603	12	전문가	음 그러시면 금 펀드나 현물신탁 상품에 투자하는 걸 추천할게요. 특히 금 현물 신탁은 매매차익에 대해 비과세 혜택도 있고 매도 시 부가가치세도 10퍼센트 면제받을 수 있거든요.	금 펀드	https://newsis.com/view/?id=NISX20220617_0001911696&cID=10403&pID=15000	2022/06/18	0	2022-07-20 16:17:44	2022-07-21 10:41:26
BK22001603	13	질문자	듣고 보니 솔깃하긴 한데 금에 투자할 때 주의해야 하는 점도 있을까요?				0	2022-07-20 16:17:44	2022-08-02 12:01:32
BK22001603	14	전문가	금 실물 투자는 무섭다고 하시긴 했는데 혹시 골드바를 사는 경우 달러와 연동한 환율에 의해 가격이 결정되는 구조라서 환율이 오르면 차익 실현이 생각보다 쉽지 않아요. 그래서 금 관련 상품을 더 추천하기도 하고요.	금 투자 주의점	http://www.segyefn.com/newsView/20190515002919?OutUrl=naver	2019/05/15	0	2022-07-20 16:17:44	2022-07-21 10:41:26
BK22001603	15	질문자	듣고 보니 확실히 관련 상품에 투자하는 게 안전해 보이기는 하네요. 그럼 혹시 요즘 달러가 오르고 있다는데 달러 가격이 떨어지는 경우 투자하는 것은 어떨까요? 그냥 은행에서 바꿔서 모아두면 되는 걸까요?				0	2022-07-20 16:17:45	2022-08-02 12:01:32
BK22001603	16	전문가	음 그건 정말 돈이 많은 분들이 아닌 이상 딱히 추천할 방법은 아닐 것 같아요. 달러를 은행에서 사고팔 땐 보통 3에서 4퍼센트 정도 수수료가 붙거든요.	달러 투자 환전소	https://www.mk.co.kr/news/economy/view/2022/06/543684/	2022/06/21	0	2022-07-20 16:17:45	2022-07-21 10:41:26
BK22001603	17	질문자	뭐 하나 쉬운 게 없네요. 그럼 달러도 다른 방법으로 투자하는 방법이 있을까요?				0	2022-07-20 16:17:45	2022-08-02 12:01:32
BK22001603	18	전문가	달러 예금이 초보자가 접근하기 가장 쉬운 방식이랍니다. 외화 통장을 만들어서 달러를 넣어두는 방식이거든요.	달러 예금	https://magazine.hankyung.com/money/article/202202215920c	2022/02/28	0	2022-07-20 16:17:45	2022-07-21 10:41:26
BK22001603	19	질문자	음 근데 제가 주식으로 손해를 꽤 많이 봐서 돈이 별로 없는데 괜찮을까요?				0	2022-07-20 16:17:45	2022-08-02 12:01:32
BK22001603	20	전문가	달러 통장이 소액으로 접근할 수 있는 가장 쉬운 투자수단이에요. 일반적인 예적금 통장으로 5천만 원 까지 예금자 보호를 받을 수 있어서 초보자들한테 더더욱 좋아요. 환차익에 대해서도 비과세이기도 하고요.	달러예금 소액	https://www.edaily.co.kr/news/read?newsId=01102086632292840&mediaCodeNo=257&OutLnkChk=Y	2022/04/04	0	2022-07-20 16:17:45	2022-07-21 10:41:26
BK22001603	21	질문자	와 들을수록 관련 상품을 사는 게 더 좋아 보이네요.				0	2022-07-20 16:17:45	2022-08-02 12:01:32
BK22001603	22	전문가	네 주식 말고도 많은 투자처가 있으니까 이번에는 잘 알아보고 투자하시길 바랄게요. 힘내세요!				0	2022-07-20 16:17:45	2022-07-21 10:41:26
BK22001603	23	질문자	주식때문에 심란했는데 덕분에 많은 정보를 얻게 되었어요. 말씀해주신 상품들은 제가 조금 더 찾아보고 투자하도록 할게요. 감사합니다!				1	2022-07-20 16:17:45	2022-08-02 12:01:32
