id	utterance_id	role	text	search_query	search_URL	reference_date	terminate	regDate	updDate
BK22002667	1	질문자	이제 아이들도 어느 정도 커서 재취업을 하고 싶은데 저같은 경단녀도 취업에 성공할 수 있을까요?				0	2022-08-02 12:18:35	2022-08-02 14:02:01
BK22002667	2	전문가	물론 할 수 있죠. 취업 준비는 어떻게 하고 계세요?				0	2022-08-02 12:18:35	2022-08-02 14:02:01
BK22002667	3	질문자	취업 사이트를 좀 찾아 봤는데 아무래도 나이가 있으니 관련 경력이 없으면 지원 조차 힘든 경우가 대부분이더라고요.				0	2022-08-02 12:18:35	2022-08-02 14:02:01
BK22002667	4	전문가	혼자 준비하기 힘드시면 여성가족부에서 운영하는 여성새로일하기센터의 도움을 받아 보세요. 육아와 가사로 인해 경력이 단절된 여성의 재취업을 돕는 기관으로 줄여서 새일센터라고 불러요. 직업 상담은 물론이고 직업훈련, 인턴십, 취업 연계 등의 지원을 받을 수 있어요.	여성새로일하기센터	https://misaeng.chosun.com/site/data/html_dir/2022/05/11/2022051102220.html?utm_source=naver&utm_medium=referral&utm_campaign=misaeng	2022/05/14	0	2022-08-02 12:18:35	2022-08-02 14:02:01
BK22002667	5	질문자	경력단절 여성을 위한 지원센터도 있었군요. 어떤 프로그램이 있는지 확인해 봐야겠어요.				0	2022-08-02 12:18:35	2022-08-02 14:02:01
BK22002667	6	전문가	혹시 어떤 분야의 일을 하고 싶으세요?				0	2022-08-02 12:18:35	2022-08-02 14:02:01
BK22002667	7	질문자	사실 아직 잘 모르겠어요. 제가 뭘 잘하는지도 잘 모르겠고요.				0	2022-08-02 12:18:35	2022-08-02 14:02:01
BK22002667	8	전문가	그럼 일단 여성새로일하기센터에서 진행하는 집단상담 프로그램을 통해 어떤 분야가 적성에 맞는지 확인해 보고 관련 교육 과정에 참여하면 돼요. IT, 디자인, 콘텐츠, 회계, 문화기획 등 다양한 분야의 직업교육훈련 과정이 마련되어 있거든요.	여성새로일하기센터 프로그램	https://www.mk.co.kr/news/business/view/2021/07/645067/	2021/07/04	0	2022-08-02 12:18:35	2022-08-02 14:02:01
BK22002667	9	질문자	정말 다양한 프로그램이 있네요. 그런데 집단상담은 구체적으로 어떤 프로그램이에요?				0	2022-08-02 12:18:35	2022-08-02 14:02:01
BK22002667	10	전문가	기본과정은 취업 동기, 직업 정보, 자신의 특성 발견, 성공한 경력단절여성, 새로운 출발과 나의 직업을 주제로 진행돼요. 그리고 기존 경력을 살려서 재취업하기를 희망하는 지원자를 위한 심화과정은 회차별로 3일간 진행되는데 취업 희망분야 탐색, 재취업 걸림돌 확인 및 해결방안 모색 등의 내용으로 구성되어 있고요.	여성새로일하기센터 집단상담	https://www.breaknews.com/787662	2021/02/22	0	2022-08-02 12:18:35	2022-08-02 14:02:01
BK22002667	11	질문자	그럼 저는 기본과정을 수강하면 되겠네요. 교육비는 얼마 정도예요?				0	2022-08-02 12:18:35	2022-08-02 14:02:01
BK22002667	12	전문가	교육비는 전액 무료예요. 과정을 수료하면 수료증이 발급되고 취업 알선과 사후관리도 제공돼요. 그리고 실업급여수급자는 2회의 구직 활동을 한 것으로 인정받을 수 있어요.	여성새로일하기센터 집단상담 교육비	https://www.breaknews.com/787662	2021/02/22	0	2022-08-02 12:18:35	2022-08-02 14:02:01
BK22002667	13	질문자	무료로 이런 좋은 프로그램을 수강할 수 있다니 정말 좋네요.				0	2022-08-02 12:18:35	2022-08-02 14:02:01
BK22002667	14	전문가	이밖에도 구직자를 위한 다양한 지원 제도가 마련되어 있어요.				0	2022-08-02 12:18:35	2022-08-02 14:02:01
BK22002667	15	질문자	정말이요? 또 어떤 지원을 받을 수 있는지 알려 주세요.				0	2022-08-02 12:18:35	2022-08-02 14:02:01
BK22002667	16	전문가	기업 인턴 근무를 통해 미취업 여성이 자신감과 현장 적응력을 쌓도록 하고 취업 후에는 순조롭게 적응할 수 있도록 지원하는 새일여성인턴이라는 제도가 있어요.	새일여성인턴	http://www.headlinejeju.co.kr/news/articleView.html?idxno=476775	2022/02/18	0	2022-08-02 12:18:35	2022-08-02 14:02:01
BK22002667	17	질문자	인턴은 대학생들만을 위한 제도인 줄 알았는데 저 같은 경단녀도 인턴을 할 수 있다니 놀랍네요. 인턴으로 근무하게 되면 받을 수 있는 또다른 혜택도 있나요?				0	2022-08-02 12:18:35	2022-08-02 14:02:01
BK22002667	18	전문가	네, 있어요. 인턴 참여 기업체와 참여자에게 지원금이 지급되거든요. 기업은 320만원, 참여자는 인턴 기간이 끝난 후 정규직 전환일부터 6개월간 고용이 유지되면 60만 원의 근속장려금을 받을 수 있어요.	새일여성인턴 혜택	http://www.headlinejeju.co.kr/news/articleView.html?idxno=476775	2022/02/18	0	2022-08-02 12:18:35	2022-08-02 14:02:01
BK22002667	19	질문자	인턴의 기회를 주는 것도 놀라운데 지원금까지 받을 수 있다니 내용을 꼼꼼히 체크해 둬야겠어요. 혹시 취업 후에도 센터를 통해 도움받을 수 있는 프로그램이 있나요?				0	2022-08-02 12:18:35	2022-08-02 14:02:01
BK22002667	20	전문가	물론 사후관리 프로그램도 있어요. 취업 후에도 경력단절 예방 특강, 노무 및 고충상담, 멘토링 프로그램, 임시 보육 및 돌봄 서비스 등 다양한 사후관리 프로그램이 제공되니까 그 내용도 함께 체크해 두세요.	여성새로일하기센터 사후관리 프로그램	https://www.fnnews.com/news/202007271712574975	2020/07/27	0	2022-08-02 12:18:35	2022-08-02 14:02:01
BK22002667	21	질문자	네, 자세한 설명 감사해요. 프로그램은 정말 다양하고 좋은데 과연 제가 교육을 잘 따라가고 취업까지 성공할 수 있을지 모르겠어요.				0	2022-08-02 12:18:35	2022-08-02 14:02:01
BK22002667	22	전문가	걱정하지 마시고 자신감을 가지세요. 2020년에 새일센터의 직업훈련과정은 95.5퍼센트의 수료율을 기록했거든요. 취업률은 73.8퍼센트였고요.	여성새로일하기센터 취업률	https://view.asiae.co.kr/article/2022031412050516241	2022/03/14	0	2022-08-02 12:18:35	2022-08-02 14:02:01
BK22002667	23	질문자	수료율도 취업률도 굉장히 높네요. 저도 한번 용기를 내 볼게요. 귀중한 정보 알려 줘서 고마워요.				0	2022-08-02 12:18:35	2022-08-02 14:02:01
BK22002667	24	전문가	취업 성공 응원할게요. 궁금한 거 있으면 언제든지 편하게 연락 주세요.				1	2022-08-02 12:18:35	2022-08-03 07:58:57
