id	utterance_id	role	text	search_query	search_URL	reference_date	terminate	regDate	updDate
BK22013771	1	질문자	자동차세와 관련해서 궁금한 게 있어요.				0	2022-09-30 15:53:20	2022-10-02 11:49:51
BK22013771	2	전문가	자동차세의 어떤 부분이 궁금하신가요?				0	2022-09-30 15:53:20	2022-10-02 11:49:51
BK22013771	3	질문자	친구가 픽업트럭을 샀는데 차량이 화물차로 분류돼 자동차세가 저렴하다고 하더라고요. 화물차는 세금 기준이 다른가요?				0	2022-09-30 15:53:20	2022-10-02 11:49:51
BK22013771	4	전문가	적재량이 1톤 미만인 화물차의 경우 연간 2만 8,500원만 세금으로 납부하면 됩니다. 승용차의 경우 배기량을 기준으로 자동차세를 매기지만 화물차는 적재중량에 따라 세금을 부여하기 때문이지요.	화물차 세금 기준	https://it.chosun.com/site/data/html_dir/2019/02/08/2019020802406.html	2019/02/10	0	2022-09-30 15:53:20	2022-10-02 11:49:51
BK22013771	5	질문자	2만 8,500원만 내면 된다니 부럽네요. 그러면 화물차는 취등록세 등 구매 시에 내는 다른 세금과 관련된 기준도 승용차와 다른가요?				0	2022-09-30 15:53:20	2022-10-02 11:49:51
BK22013771	6	전문가	승용차가 차량 가격의 7%를 취등록세로 내는 것과 달리 화물차는 5%만 내면 됩니다. 아울러 일종의 사치세인 개별소비세도 안 냅니다.	화물차 취등록세	https://it.chosun.com/site/data/html_dir/2019/02/08/2019020802406.html	2019/02/10	0	2022-09-30 15:53:20	2022-10-02 11:49:51
BK22013771	7	질문자	여러모로 화물차로 분류되면 세금 혜택이 많네요. 그런데 화물차는 고속도로 주행에 제한이 있지 않나요?				0	2022-09-30 15:53:21	2022-10-02 11:49:51
BK22013771	8	전문가	도로교통법 제60조 제1항에 의해 화물차량은 편도 3차로 이상 고속도로를 주행할 경우 2차로를 추월차로로 이용해야 하며 3차로나 4차로 등 추월차로 이하의 차로로 주행해야 합니다.	화물차 고속도로 주행	http://www.gndomin.com/news/articleView.html?idxno=305241#0BNb	2022/02/06	0	2022-09-30 15:53:21	2022-10-02 11:49:51
BK22013771	9	질문자	고속도로 1차로를 달리지 못하는 건 단점이네요. 또 궁금한 게 있는데요. 일반 승용차의 경우엔 어떤 기준으로 자동차세를 부과하나요?				0	2022-09-30 15:53:21	2022-10-02 11:49:51
BK22013771	10	전문가	비영업용 승용차의 경우 배기량별로 나누는데요. 1,000cc 이하는 cc당 80원을 자동차세로 내야 하고, 1,000cc에서 1,600cc 사이 차량의 경우 cc당 140원이 부과됩니다. 한편 1,600cc를 초과하는 차량의 경우 cc당 200원을 자동차세로 납부하셔야 합니다.	승용차 자동차세	https://n.news.naver.com/mnews/article/366/0000596777?sid=103	2020/09/28	0	2022-09-30 15:53:21	2022-10-02 11:49:51
BK22013771	11	질문자	자동차를 구매한 뒤 시간이 지나면 자동차세를 경감해주는 것으로 아는데 자세히 알려주세요.				0	2022-09-30 15:53:21	2022-10-02 11:49:51
BK22013771	12	전문가	자동차 최초 등록 후에 차량의 연식이 3년이 되는 해부터 매년 5%씩 자동차세가 줄고요. 차량의 연식이 12년이 되면 최대 50%까지 자동차세가 줄어듭니다.	자동차세 경감	http://www.daejonilbo.com/news/articleView.html?idxno=1347024	2018/12/10	0	2022-09-30 15:53:21	2022-10-02 11:49:51
BK22013771	13	질문자	그러면 엔진이 없어서 배기량도 없는 전기차의 경우 세금을 어떻게 부과하나요? 전기차가 1년에 세금을 얼마나 내는지도 궁금합니다.				0	2022-09-30 15:53:21	2022-10-02 11:49:51
BK22013771	14	전문가	말씀하셨듯 전기차는 엔진이 없어서 배기량도 없습니다. 이에 지방세법 제127조 3항에 따라 그 밖의 승용자동차로 분류되는데요, 비영업용 10만 원, 영업용의 경우 2만 원만 자동차세로 내면 됩니다. 전기차 보급에도 국민의 세금이 상당히 투입되고 있는 만큼 내연기관차 대비 전기차의 낮은 자동차세를 놓고 형평성 문제가 제기되고 있습니다.	전기차 자동차세	https://it.chosun.com/site/data/html_dir/2019/01/07/2019010702467.html	2019/01/08	0	2022-09-30 15:53:21	2022-10-02 11:49:51
BK22013771	15	질문자	또 궁금한 게 있는데요. 직장 동료가 미니밴을 샀는데 9인승을 살까 고민하다 세금 때문에 11인승으로 샀다고 하더라고요. 11인승 세금이 많이 저렴한가요?				0	2022-09-30 15:53:21	2022-10-02 11:49:51
BK22013771	16	전문가	일반 11인승 승합차의 경우 매년 6만 5,000원의 자동차세만 내면 됩니다. 그러나 9인승일 경우 매년 62만 9,000원이나 세금으로 내야 합니다. 10배 정도 차이가 나는 거죠.	11인승 자동차세	https://n.news.naver.com/mnews/article/421/0001066147?sid=101	2014/10/17	0	2022-09-30 15:53:21	2022-10-02 11:49:51
BK22013771	17	질문자	세금 차이가 상당히 크네요. 또 궁금한 게 있는데 버스전용차로를 통행할 수 있는 차량 기준은 어떻게 되는지 알려주세요.				0	2022-09-30 15:53:21	2022-10-02 11:49:51
BK22013771	18	전문가	도로교통법에 따르면 9인승 이상의 차량일 경우에만 고속도로 버스전용차로 통행이 가능합니다. 아울러 12인승 이하의 차량일 경우엔 실제 탑승한 인원이 6명 이상이 경우에만 버스전용차로를 이용할 수 있고요. 이를 위반할 시 이륜차 4만 원, 승용차 5만 원, 승합차의 경우 6만 원의 과태료를 내야 합니다.	버스전용차로 통행 기준	https://n.news.naver.com/mnews/article/417/0000447507?sid=102	2019/09/08	0	2022-09-30 15:53:21	2022-10-02 11:49:51
BK22013771	19	질문자	자동차 세금과 관련된 많은 내용을 알려주셔서 고맙습니다.				0	2022-09-30 15:53:21	2022-10-02 11:49:51
BK22013771	20	전문가	언제든 자동차 세금 관련 궁금한 게 있으면 물어보세요.				1	2022-09-30 15:53:21	2022-10-02 11:49:51
