id	utterance_id	role	text	search_query	search_URL	reference_date	terminate	regDate	updDate
BK22007788	1	질문자	요즘 이모티콘을 만들어 큰 수익을 올리는 사람들이 많아졌다고 들었어요.				0	2022-09-07 10:38:51	2022-09-07 10:38:51
BK22007788	2	전문가	네. 많은 분들이 온라인 메신저를 사용하다보니 자연스럽게 이모티콘 산업도 발전하게 되고 그와 비례해 이모티콘 판매로 수익을 얻는 분들도 많아지는 추세에요.				0	2022-09-07 10:38:51	2022-09-07 10:38:51
BK22007788	3	질문자	이모티콘이 대화에 꼭 필요한건 아니다보니 많이 사용하지 않는줄 알았는데 그게 아닌가보네요?				0	2022-09-07 10:38:51	2022-09-07 10:38:51
BK22007788	4	전문가	카카오에 등록된 누적 개별 이모티콘은 약 30만 개에 달하는데다가 누적 발신량은 2200억 건이에요. 엄청난 수치라 할 수 있죠.	이모티콘 발신량	https://n.news.naver.com/article/009/0004901713?sid=103	2021/12/30	0	2022-09-07 10:39:05	2022-09-20 15:48:51
BK22007788	5	질문자	어마어마하네요. 그런데 이모티콘은 왜 이렇게 많이들 사용하는 걸까요?				0	2022-09-07 10:39:05	2022-09-07 10:39:05
BK22007788	6	전문가	이모티콘은 다양한 관계의 사람들과 메신저를 할때 글로 전하기 어려운 감정들을 표현하기 쉽다는 점 때문에 사용되기 시작했구요. 요즘은 이모티콘 종류가 많아지면서 커뮤니케이션만이 아닌 개개인의 개성과 취향까지 나타낼수 있는 자기표현 도구로도 인식되고 있어요.	이모티콘 커뮤니케이션	https://newsis.com/view/?id=NISX20220808_0001970826&cID=13001&pID=13000	2022/08/08	0	2022-09-07 10:39:05	2022-09-07 10:39:05
BK22007788	7	질문자	이모티콘 산업이 커졌다면 이모티콘 제작을 직업으로 하는 사람들도 전보다는 많아졌겠네요?				0	2022-09-07 10:39:05	2022-09-07 10:39:05
BK22007788	8	전문가	맞아요. 이모티콘 창작이나 이모티콘 산업 종사자를 이모티콘 작가라고 부르는데요. 카카오톡 이모티콘 작가는 현재 1만 여명이 활동중이에요.	이모티콘 창작자	http://news.kmib.co.kr/article/view.asp?arcid=0924221215&code=11151100&cp=nv	2021/12/05	0	2022-09-07 10:39:05	2022-09-20 15:48:51
BK22007788	9	질문자	정말 많은 분들이 이모티콘 산업에 종사하고 계시네요. 저도 관심이 생기는데요. 그런데 꼭 본업으로 해야 하는건가요?				0	2022-09-07 10:39:05	2022-09-07 10:39:05
BK22007788	10	전문가	꼭 그렇지는 않아요. 직장 다니면서 퇴근 후 이모티콘을 만드는 것도 가능하거든요. 회사원들 중에서는 부업거리로 이모티콘 만드는 것을 고려해 보는 분들이 많고 실제로 이모티콘을 만들어 돈을 버는 사람들도 많아요.	이모티콘 부업	http://news.kmib.co.kr/article/view.asp?arcid=0924221215&code=11151100&cp=nv	2021/12/05	0	2022-09-07 10:39:05	2022-09-20 15:48:51
BK22007788	11	질문자	대단한 열정인것 같아요. 그런데 고등학생도 이모티콘을 제작해서 판매할수 있나요? 연령 제한이 없는 산업인지 알고 싶어요.				0	2022-09-07 10:39:05	2022-09-07 10:39:05
BK22007788	12	전문가	연령 제한은 없어요. 이모티콘 작가 중 최연소는 12세고, 최연장은 81세인것만 봐도 다양한 연령대가 있다는 걸 알 수 있죠. 가장 많이 참여하는 연령대는 20대인데 전체의 49.9%를 차지하고 있고 30대는 34.5%로 두번째로 많아요.	이모티콘 연령대	http://news.kmib.co.kr/article/view.asp?arcid=0924221215&code=11151100&cp=nv	2021/12/05	0	2022-09-07 10:39:05	2022-09-20 15:48:51
BK22007788	13	질문자	그럼 이모티콘 산업은 연령과 직업유무가 상관없는 직종이라 할수 있겠네요. 그런데 이모티콘 작가가 되려면 꼭 그림을 잘 그려야 하나요?				0	2022-09-07 10:39:05	2022-09-07 10:39:05
BK22007788	14	전문가	꼭 그렇지는 않아요. 이모티콘 제작에 있어서 그림 실력보다는 아이디어나 센스가 더 중요하답니다. 평소에 자주 사용하는 대화를 활용하면 남들과 차별화된 이모티콘을 만들 수 있어요.	이모티콘 그림 실력	http://www.joongdo.co.kr/web/view.php?key=20180910010004167	2018/09/11	0	2022-09-07 10:39:05	2022-09-20 15:48:51
BK22007788	15	질문자	그렇구나. 그림을 잘 못그려도 제작이 가능하다니 다행이에요. 혹시 이모티콘 제작하는데 팁이 있으면 알려주실수 있나요?				0	2022-09-07 10:39:05	2022-09-07 10:39:05
BK22007788	16	전문가	한가지 팁을 드리자면 요즘은 출시한 이모티콘이 인기가 많으면 캐릭터 시장으로 확대되는 경우가 늘고 있거든요. 그렇기 때문에 그림을 그릴 때 너무 작지 않게 그리시는게 좋아요.	이모티콘 제작 팁	https://www.khan.co.kr/economy/industry-trade/article/201712251719001	2017/12/25	0	2022-09-07 10:39:05	2022-09-07 10:39:05
BK22007788	17	질문자	정말 섬세한 팁이네요. 그럼 작업을 다 끝낸 후에는 어떤 과정을 거쳐 출시가 되는거죠?				0	2022-09-07 10:39:05	2022-09-07 10:39:05
BK22007788	18	전문가	작업을 끝내셨다면 이모티콘 플랫폼에 제안서를 올려 심사를 받으셔야 해요. 적절성과 상품성 등을 고려해 승인여부가 결정이 나게 되고 기간은 약 2~4주가 소요되요.	이모티콘 심사	https://www.sedaily.com/NewsView/22SSFUNLZ1	2021/10/18	0	2022-09-07 10:39:05	2022-09-20 15:48:51
BK22007788	19	질문자	길면 한달 후에 승인여부를 알 수 있는거네요. 관심있던 직업이었는데 상세히 설명해 주셔서 정말 많은 도움이 되었어요.				0	2022-09-07 10:39:05	2022-09-20 15:48:51
BK22007788	20	전문가	별말씀을요. 다만 미승인 되더라도 너무 실망하지 마시고 또 도전해 보시길 바랄께요. 그럼 안녕히 가세요.				1	2022-09-07 10:39:05	2022-09-20 15:48:51
