id	utterance_id	role	text	search_query	search_URL	reference_date	terminate	regDate	updDate
BK22006016	1	질문자	요즘 독립을 생각하고 있는데, 친구에게 이야기를 했더니 한 번 청약이나 행복주택을 알아보라고 하더라. 그래서 둘 다 조금 공부를 해보려고 하는데, 혹시 행복주택이 뭔지 좀 알 수 있을까?				0	2022-08-22 00:19:32	2022-08-22 00:19:32
BK22006016	2	전문가	그건 새로운 공공임대주택의 일종이야. 행복주택은 신혼부부 외에도 사회초년생이나 대학생들처럼, 사회에서 활동을 하는 계층들의 주거불안을 해소하기 위해 저렴하게 공급하는 공공임대주택인데, 보통 대중교통이 편리하고 직장과 주거지를 가깝게 만들 수 있는 부지를 활용해서 만들어. 간단하게 말하자면, 행복주택은 주거가 안정적이지 못한 젊은 계층을 위해 만든 주거복지 안전망이라고 볼 수 있는 거지.	행복주택이란	http://www.ggilbo.com/news/articleView.html?idxno=856557	2021/07/05	0	2022-08-22 00:19:32	2022-08-22 00:19:32
BK22006016	3	질문자	어, 대학생도 행복주택에 들어갈 수 있단 말이야? 대학생이면 조건 없이 누구나 다 행복주택 입주가 가능해?				0	2022-08-22 00:19:32	2022-08-22 00:19:32
BK22006016	4	전문가	아냐, 거기엔 조건이 좀 있어. 일단 대학생의 경우, 본인이 무주택자이면서 결혼도 하지 않은 대학생과 취업준비생으로 분류를 하는데, 취업준비생이 행복주택에 입주하고 싶다면 졸업이나 중퇴를 한 지 2년이 채 지나지 않은 상태여야 해. 만약 취업준비생이 아니라면, 현재 대학에 다니는 중이거나 입복학이 예정되어 있는 대학생만 행복주택에 입주할 수 있지.	행복주택 대학생	https://www.korea.kr/news/reporterView.do?newsId=148886391	2021/04/19	0	2022-08-22 00:19:32	2022-08-22 00:19:32
BK22006016	5	질문자	이런, 내가 왜 학생 때 그걸 몰랐을까? 지금 나는 대학생이 아니니까 그 조건으로는 행복주택을 신청할 수 없을 거 같아. 혹시 대학생 말고, 다른 입주 자격은 어떻게 되는지 알 수 있을까?				0	2022-08-22 00:19:32	2022-08-30 15:58:10
BK22006016	6	전문가	일단, 행복주택 같은 경우엔 공급되는 물량의 80퍼센트 이상이 청년들에게 할당되는데, 이 청년들 내에서도 입주 자격이 크게 세 가지 유형으로 나뉘어. 첫 번째는 아까 이야기했던 대학생 계층이고, 두 번째는 신혼부부나 한부모가족 계층, 그리고 마지막은 청년 계층이야.	행복주택 입주자격	https://www.korea.kr/news/reporterView.do?newsId=148886391	2021/04/19	0	2022-08-22 00:19:32	2022-08-30 15:58:10
BK22006016	7	질문자	으음, 당장 결혼을 할 거 같진 않고, 유일하게 가능성이 있는 게 청년 계층 아닐까 싶은데, 행복주택에서 말하는 청년 계층은 정확히 어떤 개념이야?				0	2022-08-22 00:19:32	2022-08-30 15:58:10
BK22006016	8	전문가	여기서 말하는 청년 계층이란, 만 19세에서 39세 이하의 나이를 가진 사람들을 가리켜. 그리고, 결혼한 상태가 아니어야 하고, 무주택자여야 한다는 추가적인 조건이 따라붙지.	행복주택 청년 계층	http://www.ggilbo.com/news/articleView.html?idxno=856557	2021/07/05	0	2022-08-22 00:19:32	2022-08-30 15:58:10
BK22006016	9	질문자	아, 나는 지금 부모님과 함께 살고 있는데, 지금 사는 아파트가 부모님 명의로 되어 있거든. 근데 부모님 말고 나는 내 명의의 집이 없어. 이런 경우에 나는 행복 주택에 들어갈 수 있는 거야?				0	2022-08-22 00:19:32	2022-08-30 23:46:45
BK22006016	10	전문가	물론이야, 설령 무주택 세대의 구성원이 아니라고 해도, 대학생 혹은 청년 계층에 속하는 경우 본인 명의의 집만 없다면 행복주택에 입주가 가능해.	부모님 명의 집 행복주택	https://www.korea.kr/news/reporterView.do?newsId=148886391	2021/04/19	0	2022-08-22 00:19:32	2022-08-30 23:46:45
BK22006016	11	질문자	으음, 용어가 조금 헷갈리는데 혹시 무주택자의 정의가 정확히 어떻게 돼? 내 명의의 집이 없어도, 부모님 명의의 주택이 있다면 나는 무주택자는 아니라는 거지?				0	2022-08-22 00:19:32	2022-08-30 23:46:45
BK22006016	12	전문가	맞아. 무주택자가 되려면, 가족 구성원 중 단 한 사람도 주택을 가지고 있어서는 안 돼. 단 한 사람만 주택이 있어도 구성원 모두가 유주택자로 간주되거든. 참고로 이런 상태라면, 무주택 세대주 청약 자격이 자동으로 사라져.	부모 명의 무주택	https://www.hankyung.com/society/article/2021011394761	2021/01/22	0	2022-08-22 00:19:32	2022-09-01 13:07:30
BK22006016	13	질문자	아, 그러면 나는 무주택 세대의 구성원은 아니지만, 청년 계층에 속하면서 동시에 내 명의의 집은 없기 때문에 행복주택 입주는 가능하다는 거구나. 그러면 혹시, 행복주택에 입주하는 경우에도 일반 청약처럼 청약 통장이 필요할까?				0	2022-08-22 00:19:32	2022-08-30 23:46:45
BK22006016	14	전문가	물론이야, 소득확인 서류와 청약 통장은 입주를 위한 필수 준비물이거든. 다만, 청약 통장의 경우엔 당첨 후에 가입해도 상관이 없고, 심지어 입주지정기간이 만료되기 전까지만 가입하면 돼. 그리고, 소득확인 서류로는 총 3가지 서류가 필요한데, 여기엔 국민연금가입증명서, 건강보험득실확인서, 그리고 재직증명서가 필요해.	행복주택 청약 통장	http://www.ggilbo.com/news/articleView.html?idxno=856557	2021/07/05	0	2022-08-22 00:19:32	2022-08-22 00:19:32
BK22006016	15	질문자	아, 행복주택에 입주하려면 소득도 확인해야 하는구나. 혹시 청년층이 여기 입주하는 경우, 소득 제한이 있을까?				0	2022-08-22 00:19:32	2022-08-22 00:19:32
BK22006016	16	전문가	물론이야, 소득기준 뿐만 아니라 자산기준도 있는 걸. 소득기준의 경우, 청년계층은 해당 세대의 소득 합계가 도시근로자의 월평균 소득의 100퍼센트를 초과해서는 안 돼. 그리고 세대가 아닌 본인은 80퍼센트 혹은 그 아래여야 하지. 그리고 자신 기준의 경우, 본인 총 자산이 2.8억원을 넘으면 안 되고, 자동차는 2,499만원까지 가능해.	행복주택 청년층 소득 기준	http://www.ggilbo.com/news/articleView.html?idxno=856557	2021/07/05	0	2022-08-22 00:19:32	2022-08-30 15:58:10
BK22006016	17	질문자	흠, 내 수입이 어디에 해당하는지 한 번 확인해 봐야겠네. 아무튼 행복주택 정책을 자세히 설명해줘서 고마워. 어쩌면, 나도 조만간 독립을 할 수도 있겠다는 희망이 생기는 거 같아.				0	2022-08-22 00:19:32	2022-08-22 00:19:32
BK22006016	18	전문가	천만에. 의외로 숨겨진 정책 중 도움이 될 수 있는 게 제법 많으니까, 한 번 잘 찾아보도록 해.				0	2022-08-22 00:19:32	2022-08-30 15:58:10
BK22006016	19	질문자	응, 그렇게 하도록 할게. 그럼 말 나온 김에 한 번 내 자산 규모랑 입주 조건을 확인해보러 가봐야겠다. 다음에 다시 또 이야기 나누자!				0	2022-08-22 00:19:32	2022-08-30 15:58:10
BK22006016	20	전문가	그래, 잘 확인해 보고. 다음에 다시 이야기 하자.				1	2022-08-22 00:19:32	2022-09-01 13:07:30
