id	utterance_id	role	text	search_query	search_URL	reference_date	terminate	regDate	updDate
BK22019827	1	질문자	주식을 시작해보려고 하는데 생소한 단어들이 너무 많아. 일단 주식에 투자하기 전에 꼭 알아둬야 하는 주식 용어들은 뭐가 있어?				0	2022-10-28 10:54:36	2022-10-28 14:00:04
BK22019827	2	전문가	주식에서 기본적으로 알아둬야 하는 용어로는 매수와 매도가 있어요. 매수는 매입과 같은 의미이고 매도는 주식을 판다는 의미예요. 매도 금액의 총합에서 매수한 금액의 총합을 빼고 난 나머지 금액을 순매도액이라고 하고요. 주가가 계속 내려가고 이른 시일 내에 가격이 상승하지 않을 것 같다고 판단한 경우, 자신이 보유한 주식을 매입한 가격 이하로 손해를 보고 매도하는 것을 손절매라고 해요.	필수 주식용어	http://www.newsinside.kr/news/articleView.html?idxno=509232	2018/10/15	0	2022-10-28 10:54:36	2022-10-28 14:00:04
BK22019827	3	질문자	그런 한글 용어도 중요하지만, PER, PBR, ROE 같은 영어로 된 용어들의 의미를 전혀 모르겠어. 우선 PER이 뭔지 좀 알려줘.				0	2022-10-28 10:54:36	2022-10-28 14:00:04
BK22019827	4	전문가	PER은 Price Earning Ratio의 약자로 주가수익비율을 의미해요. 현재 주가가 주당 이익과 비교해 몇 배 정도 되는지 보여주는 지표죠. PER을 보면 저평가된 주식을 찾을 수 있어요. 시가총액이 100억 원에 순이익이 10억 원인 회사의 경우 PER은 10이고요, 이는 이 회사가 10년 동안 벌 수 있는 순이익이 현재의 시가총액과 비슷하다는 것을 의미해요.	PER 뜻	http://www.sportsseoul.com/news/read/1165568?ref=naver	2022/10/05	0	2022-10-28 10:54:36	2022-10-28 14:00:04
BK22019827	5	질문자	그럼 PBR은 뭘 나타내는 거야?				0	2022-10-28 10:54:37	2022-10-28 14:00:04
BK22019827	6	전문가	PBR은 Prive Book-value Ratio의 약자로 주가순자산비율을 나타내요. 회사를 장부상의 값으로 정리할 때 주주들이 배당받을 수 있는 금액은 어느 정도인지를 알 수 있죠.	PBR	http://www.sportsseoul.com/news/read/1165568?ref=naver	2022/10/05	0	2022-10-28 10:54:37	2022-10-28 14:00:04
BK22019827	7	질문자	ROE도 뭔가를 보여주는 지표겠네. ROE는 뭘 보여주는 지표야?				0	2022-10-28 10:54:37	2022-10-28 14:00:04
BK22019827	8	전문가	ROE는 Return on equity의 약자로 자기자본이익률을 나타내요. 회사가 자기자본을 이용해 1년 간 어느 정도 수익을 올렸는가를 보여주는 지표이고, 이를 통해 평가가 절하된 우량주식을 쉽게 찾을 수 있어요.	ROE	http://www.sportsseoul.com/news/read/1165568?ref=naver	2022/10/05	0	2022-10-28 10:54:37	2022-10-28 14:00:04
BK22019827	9	질문자	PER, PBR, ROE는 어떤 주식을 고를 지 고민이 될 때 참고할 만한 자료가 되겠구나. 그럼 주식을 시작할 때 가장 먼저 뭘 해야 할까?				0	2022-10-28 10:54:37	2022-10-28 14:00:04
BK22019827	10	전문가	우선은 주식 거래를 위한 주식 계좌를 만들어야 해요.				0	2022-10-28 10:54:37	2022-10-28 14:00:04
BK22019827	11	질문자	그건 어떻게 만드는 건데? 은행가거나 할 시간이 없는데 온라인으로는 못 만드나?				0	2022-10-28 10:54:37	2022-10-28 14:00:04
BK22019827	12	전문가	그렇다면 비대면 계좌 개설을 이용하면 돼요. 인터넷뱅킹을 이용하고 있는 개인 고객 중 본인 명의의 핸드폰을 가지고 있다면 신청할 수 있어요. 앱을 설치한 후 가입 전 확인 사항, 본인 인증, 실명 확인 등을 거치면 계좌 개설을 신청할 수 있어요. 그리고 원래 거래하고 있던 계좌에서 소액을 주식계좌에 이체하면 계좌 개설이 끝나죠.	비대면 주식 계좌 개설 방법	https://www.gokorea.kr/news/articleView.html?idxno=377657	2019/08/31	0	2022-10-28 10:54:37	2022-10-28 14:00:04
BK22019827	13	질문자	계좌를 만들고 나서 주식은 어떻게 살 수 있는데? 처음이니까 삼성전자 한 번 사보려고 하거든.				0	2022-10-28 10:54:37	2022-10-28 14:00:04
BK22019827	14	전문가	일단 본인의 주식 계좌에 잔액이 충분한지 확인하시고요. 주식 주문 메뉴에서 삼성전자를 검색하고 구매 가격, 수량을 기재한 후 매수 버튼을 눌러요. 가격은 보통을 선택하시고요. 미리 계산이라는 버튼을 누르면 주식 매수에 소요되는 수수료나 세금 등을 미리 체크할 수 있어요.	주식 매수하는 방법	https://www.sedaily.com/NewsView/22U6G3F7BH	2021/11/27	0	2022-10-28 10:54:37	2022-10-28 14:00:04
BK22019827	15	질문자	알겠어. 그럼 주식은 나 편한 시간에 언제든지 사고팔 수 있는 거야?				0	2022-10-28 10:54:37	2022-10-28 14:00:04
BK22019827	16	전문가	아니요. 주식을 거래할 수 있는 시간은 정해져 있어요. 평일 오전 9시부터 오후 6시까지죠.	주식 거래시간	https://www.joongang.co.kr/article/25001247#home	2021/08/31	0	2022-10-28 10:54:37	2022-10-28 14:00:04
BK22019827	17	질문자	평일이라는 건 주말에는 주식 거래를 못한다는 말이야?				0	2022-10-28 10:54:37	2022-10-28 14:00:04
BK22019827	18	전문가	네. 주식시장은 정규장의 경우 말씀드린 대로 평일 오전 9시부터 열리고요, 3시 30분에 폐장돼요. 주말에는 주식시장이 열리지 않아 거래가 불가능하죠.	주말 주식 거래	https://www.asiatime.co.kr/article/20221014500028	2022/10/14	0	2022-10-28 10:54:37	2022-10-28 14:00:04
BK22019827	19	질문자	아, 매일 하는 게 아니구나. 주식 거래가 언제 가능한지도 미리 확인해둬야겠다.				0	2022-10-28 10:54:37	2022-10-28 14:00:04
BK22019827	20	전문가	네. 국가마다 주식 휴장일이 다르니, 해외 주식을 하실 생각이라면 이 점도 염두에 두시면 좋아요.				1	2022-10-28 10:54:37	2022-10-28 14:00:04
