id	utterance_id	role	text	search_query	search_URL	reference_date	terminate	regDate	updDate
BK22018626	1	질문자	요즘에 물가가 너무 올라서 밖에서 밥 사먹기가 무섭네요.				0	2022-10-22 12:24:26	2022-10-22 12:24:26
BK22018626	2	전문가	저도 그래요. 그래서 저도 웬만하면 집에서 밥을 해먹어요.				0	2022-10-22 12:24:26	2022-10-22 12:24:26
BK22018626	3	질문자	월급은 한정되어 있고 그래서 소비도 줄이고 재테크를 해보고 싶은데 친구가 도전형 저축을 해보라고 하더라고요. 혹시 이게 뭔지 아시나요?				0	2022-10-22 12:24:26	2022-10-22 12:24:26
BK22018626	4	전문가	물론 알죠. 도전형저축은 챌린지 성격을 더한 저축 상품을 말해요. 주 단위로 액수를 증액시켜 나가거나 월이나 연 단위의 목표를 설정해 이를 달성하면 우대금리 혜택을 부여하는 등의 저축 상품들이 있어요.	도전형저축 챌린지	http://www.dailypop.kr/news/articleView.html?idxno=62488	2022/09/02	0	2022-10-22 12:24:26	2022-10-22 12:24:26
BK22018626	5	질문자	그런게 있는지 처음 알았어요. 그러면 제 주거래 은행이 카카오 뱅크인데 여기서도 이 도전형 저축을 할 수 있을까요?				0	2022-10-22 12:24:26	2022-10-22 12:24:26
BK22018626	6	전문가	네 할 수 있어요. 카카오뱅크의 26주 적금이 있는데요, 월 1000원부터 300만원까지 26주간 금액을 늘려가며 저축하는 상품으로 기본금리는 3%, 최고금리는 3.5%에요. 참고로 저축액 납입 때마다 성공을 알리는 귀여운 캐릭터 스탬프가 찍혀 저축의 재미를 더해준답니다.	도전형저축 챌린지 카카오뱅크	http://www.dailypop.kr/news/articleView.html?idxno=62488	2022/09/02	0	2022-10-22 12:24:26	2022-10-25 12:18:37
BK22018626	7	질문자	카카오뱅크에서도 진행을 하는 군요! 저축을 성공할 때마다 귀여운 캐릭터들이 반겨주면 더 재밌을 것 같네요. 그러면 얼마나 많은 사람들이 가입했는지도 아시나요?				0	2022-10-22 12:24:26	2022-10-22 12:24:26
BK22018626	8	전문가	네, 카카오뱅크에 따르면 26주 적금은 기존에도 신규개설 계좌가 매년 300만개가 넘는 인기상품이지만, 올해는 짠테크 트렌드로 인해 특히 수요가 높아지면서 7월까지 이미 200만개를 돌파했다고 전했어요.	도전형저축 챌린지 카카오 뱅크 신설계좌	http://www.dailypop.kr/news/articleView.html?idxno=62488	2022/09/02	0	2022-10-22 12:24:26	2022-10-22 12:24:26
BK22018626	9	질문자	매년 300만개가 넘게 개설이 되는데 7월까지만 200만개면 정말 어마어마 하네요. 저 갑자기 본격적으로 도전형 저축을 하고 싶어졌는데 다른 은행에서도 하는지 알려주실 수 있나요?				0	2022-10-22 12:24:26	2022-10-22 12:24:26
BK22018626	10	전문가	네 있어요. 토스의 키워봐요 적금은 상품가입시 지급받은 동물 알을 6개월간 10단계에 걸쳐 전설의 동물로 진화시키는 스토리를 담고 있는데요, 금리는 6개월 만기시 최고 3%에요. 가입금액은 1000원부터 최고 20만원이며 한달 최대 저축 가능 금액은 100만원이고요. 만약 20만원씩 4주 적립했다면 추가로 20만원을 납입할 수 있다는 것이죠.	토스 키워봐요 적금	http://www.dailypop.kr/news/articleView.html?idxno=62488	2022/09/02	0	2022-10-22 12:24:26	2022-10-22 12:24:26
BK22018626	11	질문자	토스에서도 진행을 하는군요. 그러면 혹시 케이뱅크에서도 진행을 하나요? 왜냐면 제가 케이뱅크도 쓰거든요.				0	2022-10-22 12:24:26	2022-10-25 12:18:37
BK22018626	12	전문가	물론이죠. 케이뱅크의 챌린지박스는 목표금액 및 기간에 따라 매주 적립해야 할 돈이 자동 계산되는 상품인데, 매일 1.5%의 이자가 쌓이고 챌린지 성공시 추가 1.5%를 제공해 연 3%의 금리를 부여받을 수 있어요.	케이뱅크 챌린지박스	http://www.dailypop.kr/news/articleView.html?idxno=62488	2022/09/02	0	2022-10-22 12:24:26	2022-10-22 12:24:26
BK22018626	13	질문자	오, 제가 계좌를 가지고 있는 은행은 다 하는 것 같네요. 그러면 혹시 우리은행도 하나요? 우리은행과 거래하는 주변 지인들 한테도 소개시켜 주려고요.				0	2022-10-22 12:24:26	2022-10-24 21:32:02
BK22018626	14	전문가	우리은행도 진행하고 있어요. 우리은행의 우리 200일 적금은 200일간 매일 3만원 이하의 금액을 자동 적립하는 상품인데요, 기본 금리는 연 1.8%이고 해당 상품의 유지 기간 및 뱅킹 서비스 가입 유지 등 조건을 모두 충족하는 경우 최대 연 1.3%p의 우대금리를 제공해요.	우리은행 우리 200일 적금	http://www.dailypop.kr/news/articleView.html?idxno=62488	2022/09/02	0	2022-10-22 12:24:26	2022-10-22 12:24:26
BK22018626	15	질문자	우와, 이런 도전형 저축을 미리 알았다면 정말 좋았을 것 같아요. 혹시 저희 부모님이 신한은행이랑 국민은행을 자주 사용하시는데 여기도 진행을 할까요? 우선 신한은행부터 알려주실래요?				0	2022-10-22 12:24:26	2022-10-22 12:24:26
BK22018626	16	전문가	네, 신한은행의 쏠편한 작심3일 적금은 6개월간 매주 설정한 금액을 자동 적립하는 상품인데요, 주당 최대 3회까지 자동이체를 설정할 수 있어요. 월, 수, 금에 5000원씩 자동이체를 신청하면 매주 1만5000원씩 적립이 되는 구조고요, 월 최대 저축 금액은 50만원이이에요.	신한은행 쏠편한 작심3일 적금	http://www.dailypop.kr/news/articleView.html?idxno=62488	2022/09/02	0	2022-10-22 12:24:26	2022-10-22 12:24:26
BK22018626	17	질문자	그러면 국민은행은 어떤 방식으로 혜택을 제공하는지 알려주실래요?				0	2022-10-22 12:24:26	2022-10-24 21:32:02
BK22018626	18	전문가	KB국민은행은 최고금리 3.5%의 KB두근두근 여행적금 상품을 운영 중이에요. 6개월간 월 5만원 이상 100만원 이하의 금액을 저축할 수 있는데, 4회차 납입이 완료되면 여행사 노랑풍선에서 활용 가능한 할인혜택을 제공한답니다.	KB국민은행 KB두근두근 여행적금	http://www.dailypop.kr/news/articleView.html?idxno=62488	2022/09/02	0	2022-10-22 12:24:26	2022-10-22 12:24:26
BK22018626	19	질문자	아하, 도전형 저축 챌린지를 이제라도 알아서 다행이에요. 이걸 진행해 주는 은행도 많아서 정말 다행이네요. 오늘 자세히 알려주셔서 감사했어요.				0	2022-10-22 12:24:26	2022-10-24 21:32:02
BK22018626	20	전문가	네 저도 이미 계좌 두개나 개설했답니다. 그러면 또 궁금한거 생기면 연락 주세요. 조심히 들어가세요.				1	2022-10-22 12:24:26	2022-10-25 12:18:37
