id	utterance_id	role	text	search_query	search_URL	reference_date	terminate	regDate	updDate
BK22019175	1	질문자	집값이 너무 올라서 분양을 받으려고 하는데 우선 공급, 특별 공급은 무엇을 말하나요?				0	2022-10-25 16:03:02	2022-10-25 16:26:09
BK22019175	2	전문가	우선공급은 행정구역 통합으로 주택을 먼저 공급받을 필요가 있는 기존 거주자나 임대 사업자 등에게 주택을 분양하는 방법이며, 특별 공급은 다자녀가구, 신혼부부, 노부모부양자, 생애최초 주택 구입자, 기관 추천자 등을 대상으로 하는 주택 분양 방법입니다.	아파트 분양방법	https://easylaw.go.kr/CSP/CnpClsMain.laf?popMenu=ov&csmSeq=873&ccfNo=1&cciNo=1&cnpClsNo=1&search_put=	2022/08/15	0	2022-10-25 16:03:02	2022-10-25 16:26:09
BK22019175	3	질문자	아파트를 분양받으려면 청약통장이 있어야 한다고 하던데 청약통장은 어떤 것인가요?				0	2022-10-25 16:03:02	2022-10-25 16:26:09
BK22019175	4	전문가	시중은행에서 가입 가능한 주택청약종합저축 통장으로 청약저축에 민영 청약이 가능한 예부금 기능을 하나로 통합한 종합통장입니다.	주택청약종합저축	https://news.mt.co.kr/mtview.php?no=2009021210595562704&outlink=1&ref=https%3A%2F%2Fsearch.naver.com	2009/02/12	0	2022-10-25 16:03:02	2022-10-25 16:26:09
BK22019175	5	질문자	제 와이프 이름으로 된 주택청약종합저축 통장의 명의를 제가 세대주라서 제 명의로 변경하고 싶은데 가능할까요?				0	2022-10-25 16:03:02	2022-10-25 16:26:09
BK22019175	6	전문가	주택공급에 관한 규칙 제12조 제1항에 의하면 주택청약종합저축의 가입자 명의는 가입자가 사망한 경우에 의한 변경이 아니면 변경할 수 없도록 규정되어 있어 와이프 사망이 아니면 변경이 불가능합니다.	주택청약종합저축 가입자 변경	https://easylaw.go.kr/CSP/CnpClsMain.laf?popMenu=ov&csmSeq=873&ccfNo=1&cciNo=1&cnpClsNo=2&menuType=cnpcls&search_put=	2022/08/15	0	2022-10-25 16:03:02	2022-10-25 16:26:09
BK22019175	7	질문자	세대주가 아닌 와이프 명의의 통장으로도 공공분양 일반공급을 신청할 수 있나요?				0	2022-10-25 16:03:02	2022-10-25 16:26:09
BK22019175	8	전문가	와이프를 포함한 세대원이 모두 무주택자라면 세대주와 동일한 주민등록등본에 기재되어 있는 세대주의 배우자는 공공분양 일반공공분양에 청약할 수 있습니다.	일반공급 무주택세대원	https://easylaw.go.kr/CSP/CnpClsMain.laf?popMenu=ov&csmSeq=873&ccfNo=2&cciNo=2&cnpClsNo=1&search_put=	2022/08/15	0	2022-10-25 16:03:02	2022-10-25 16:26:09
BK22019175	9	질문자	정말 모르시는 게 없네요. 지방에서 수도권으로 이사를 와서 지방에서 가입한 청약통장이 있는데 수도권 민간분양 일반공급에 사용할 수 있나요?				0	2022-10-25 16:03:03	2022-10-25 16:26:09
BK22019175	10	전문가	수도권 이외의 지역에서 청약 통장에 가입하고 수도권으로 주소를 옮긴 거주자는 수도권에 해당하는 청약통장 예치금액으로 변경하여 청약통장 사용이 가능합니다.	청약통장 주택건설지역	https://easylaw.go.kr/CSP/CnpClsMain.laf?popMenu=ov&csmSeq=873&ccfNo=2&cciNo=2&cnpClsNo=1&search_put=	2022/08/15	0	2022-10-25 16:03:03	2022-10-25 16:26:09
BK22019175	11	질문자	회사와 학교 문제로 저와 제 와이프는 같이, 자녀들은 다른 주소지에 주민 등록되어 있는데 저를 세대주로 다자녀 특별분양이 가능한가요?				0	2022-10-25 16:03:03	2022-10-25 16:26:09
BK22019175	12	전문가	자녀들이 분양신청자와 동일 주민등록등본에 함께 등재되어는 무주택세대 구성원이어야 하므로 본인을 세대주로 다자녀 특별 분양이 어렵습니다.	다자녀 특별 분양	https://easylaw.go.kr/CSP/CnpClsMain.laf?popMenu=ov&csmSeq=873&ccfNo=2&cciNo=4&cnpClsNo=1&menuType=cnpcls&search_put=	2022/08/15	0	2022-10-25 16:03:03	2022-10-25 16:26:09
BK22019175	13	질문자	다자녀 특별 분양을 받는 것은 어렵겠네요. 저희 장모님과 주민등록을 합치고 모신 지 2년 정도 되었는데 노부모 부장자로 특별분양이 가능할까요?				0	2022-10-25 16:03:03	2022-10-25 16:26:09
BK22019175	14	전문가	특별분양 조건에 조금씩 모자라시네요. 노부모 부양자에는 장모님을 모시는 것은 포함되지만 같은 주민등록표상에 등재하고 3년 이상 부양하는 조건이라 해당이 안 되십니다.	노부모 부양자	https://easylaw.go.kr/CSP/CnpClsMain.laf?popMenu=ov&csmSeq=873&ccfNo=2&cciNo=4&cnpClsNo=1&menuType=cnpcls&search_put=	2022/08/15	0	2022-10-25 16:03:03	2022-10-25 16:26:09
BK22019175	15	질문자	이것도 어렵겠네요. 마지막으로 아파트 분양에 관한 질문 하나만 더 드려도 될까요?				0	2022-10-25 16:03:03	2022-10-25 16:26:09
BK22019175	16	전문가	제가 시간이 많아서 질문은 얼마든지 환영입니다.				0	2022-10-25 16:03:03	2022-10-25 16:26:09
BK22019175	17	질문자	제가 2년 전에 수도권의 공공분양에 당첨되었는데 배우자의 소득 합산을 잘못하여 당첨이 취소된 적이 있습니다. 다른 아파트에 청약을 다시 하려고 하니 5년간 당첨 제한이 된다고 하던데 그런가요?				0	2022-10-25 16:03:03	2022-10-25 16:26:09
BK22019175	18	전문가	재 당첨 제한과 당첨 취소를 혼동하신 것으로 당첨이 취소된 사람을 대상으로 하는 부적격자의 당첨 제한은 1년 동안 수도권의 다른 분양 주택의 입주자로 선정될 수 없다고 규정하고 있습니다.	부적격자 당첨 제한	https://easylaw.go.kr/CSP/CnpClsMain.laf?popMenu=ov&csmSeq=873&ccfNo=4&cciNo=2&cnpClsNo=2&menuType=onhunqna&search_put=	2022/08/15	0	2022-10-25 16:03:03	2022-10-25 16:26:09
BK22019175	19	질문자	아파트 분양에 관해 제가 궁금해하던 모든 사항이 해소되었네요. 진심으로 감사드립니다.				0	2022-10-25 16:03:03	2022-10-25 16:26:09
BK22019175	20	전문가	말씀드린 정보들을 잘 사용하셔서 꼭 내 집 마련의 꿈을 이루시기를 기원하겠습니다.				1	2022-10-25 16:03:03	2022-10-25 16:26:09
