id	utterance_id	role	text	search_query	search_URL	reference_date	terminate	regDate	updDate
BK22002844	1	질문자	요즘 주식에서 연전연패예요. 저 완전 문외한인데 너무 겁없이 공부도 안하고 덤볐나봐요.				0	2022-08-02 12:20:09	2022-08-02 14:10:30
BK22002844	2	전문가	요즘 시황 자체가 안 좋긴 해요. 그러니까 너무 자책은 하지 마세요.				0	2022-08-02 12:20:09	2022-08-02 14:10:30
BK22002844	3	질문자	그렇게 말씀해주시니 그나마 위안이 되네요. 저 질문 하나만 할게요. 공매도라는게 대체 뭔지 잘 이해가 안돼요.				0	2022-08-02 12:20:09	2022-08-02 14:10:30
BK22002844	4	전문가	우선 간단하게 말씀드리자면 없는 주식을 파는 개념이라고 생각하시면 돼요. 그러니까 개인이나 단체가 주식이나 채권을 갖고 있지 않은 상태에서 매도를 한다는 말이지요.	공매도 의미	https://ko.wikipedia.org/wiki/%EA%B3%B5%EB%A7%A4%EB%8F%84	2022/03/26	0	2022-08-02 12:20:09	2022-08-02 14:10:30
BK22002844	5	질문자	아니, 그런 게 가능해요? 없는 주식을 어떻게 판다는 거에요?				0	2022-08-02 12:20:09	2022-08-02 14:10:30
BK22002844	6	전문가	주식을 남에게 빌려서 파는 거죠. 우선 앞으로 주가가 하락한다고 예상하는 종목의 주식을 빌려서 판 다음에 진짜 주가가 하락하면 싼값에 다시 사들여서 주식을 갚고 시세차익을 얻는거죠.	공매도 매매기법	https://terms.naver.com/entry.naver?docId=66030&cid=43667&categoryId=43667	2021/05/03	0	2022-08-02 12:20:09	2022-08-02 14:10:30
BK22002844	7	질문자	상당히 복잡한 개념이네요. 그러니까 오래 오래 보유하고 싶은 사람한테서 주식을 빌려서 그 주식으로 이익을 보는거네요?				0	2022-08-02 12:20:09	2022-08-02 14:10:30
BK22002844	8	전문가	상당히 개념을 잘 이해하셨는데요? 굉장히 정확하게 개념을 정리하셨어요.				0	2022-08-02 12:20:09	2022-08-02 14:10:30
BK22002844	9	질문자	근데 대체 왜 이런 제도가 있는거죠? 굳이 이런 복잡한 과정이 존재하는 이유가 뭐예요?				0	2022-08-02 12:20:09	2022-08-02 14:10:30
BK22002844	10	전문가	주식 공매도의 순기능 때문이죠. 어떤 주식이 지나치게 거품이 끼었을 때 그 주식을 팔아치워서 주가를 정상적으로 돌리는 역할을 하거든요.	공매도 역할	https://terms.naver.com/entry.naver?docId=66030&cid=43667&categoryId=43667	2021/05/03	0	2022-08-02 12:20:09	2022-08-02 14:10:30
BK22002844	11	질문자	그러니까 균형을 잡아주는 역할을 한다는 거네요! 근데 장점만 있을 거 같진 않은데요?				0	2022-08-02 12:20:09	2022-08-02 14:10:30
BK22002844	12	전문가	맞아요. 주식 공매도는 시세조종이나 채무불이행을 일으키기도 해요. 즉 공매도 투자자가 대상 기업의 주가가 떨어지게 하기 위해 부정적인 소문이나 부정적인 기업보고서를 작성하는 행위를 할 가능성이 있죠.	공매도 투자자 부정적 역할	https://terms.naver.com/entry.naver?docId=66030&cid=43667&categoryId=43667	2021/05/03	0	2022-08-02 12:20:09	2022-08-02 14:10:30
BK22002844	13	질문자	공매도에 당한 기업 입장에서 그런 헛소문이 나면 정말 괴롭겠네요. 어쩐지 공매도 투자자의 이미지가 안 좋은 이유를 알겠네요.				0	2022-08-02 12:20:09	2022-08-02 14:10:30
BK22002844	14	전문가	그런 편이죠. 그래도 공매도 투자자 역시 늘 리스크가 있어요. 만약 자신의 예측이랑 다르게 주가가 확 올라버리면 손해가 쌓이면서 빌린 주식을 못 갚는 경우가 있거든요.	공매도 손실 결제불이행	https://terms.naver.com/entry.naver?docId=66030&cid=43667&categoryId=43667	2021/05/03	0	2022-08-02 12:20:09	2022-08-02 14:10:30
BK22002844	15	질문자	그렇겠네요. 그 누구도 주식이 오를지 내릴지는 알 수 없으니까요.				0	2022-08-02 12:20:09	2022-08-02 14:10:30
BK22002844	16	전문가	맞아요. 그럼에도 불구하고 개인투자자들은 공매도 때문에 한국증시가 세계 주식 시장과 비교해 크게 떨어지고 특히 공매도를 집중적으로 당한 종목들이 더욱 크게 떨어진다고 생각해요.	개인투자자 급락 원인 공매도	https://moneys.mt.co.kr/news/mwView.php?no=2022070816501091912	2022/07/10	0	2022-08-02 12:20:09	2022-08-02 14:10:30
BK22002844	17	질문자	개인투자자들이 공매도에 그렇게 원한이 깊다면 정부에 공매도 금지를 요구하지 않을까요?				0	2022-08-02 12:20:09	2022-08-02 14:10:30
BK22002844	18	전문가	그래서 실제로 금융위원장이 취임식에서 기자들이 개인투자자들의 공매도 금지 요구에 대한 의견을 묻자 외국도 필요할 땐 금지한다며 시장 상황을 봐서 필요하다면 공매도를 한시적으로 금지하고 증시안정화기금도 사용하겠다는 발언도 했어요.	금융위원장 공매도 금지	https://www.news1.kr/articles/?4738773	2022/07/11	0	2022-08-02 12:20:09	2022-08-02 14:10:30
BK22002844	19	질문자	미묘한 답변이네요. 확실히 정부 당국 측에서도 확실히 결론을 내리기엔 미묘한 문제네요.				0	2022-08-02 12:20:09	2022-08-02 14:10:30
BK22002844	20	전문가	그렇죠. 하지만 2020년 코로나19로 인해서 폭락이 너무 심했을 때는 기승을 부리던 공매도 세력을 견제하기 위해 2020년 3월 16일부터 2021년 5월 2일까지 전체 상장종목에 대한 공매도를 일시적으로 금지하기도 했죠. 이후 2021년 3월 15일까지 연장됐다가 다시 5월 2일까지 연장됐어요.	코로나19 공매도 금지 조치	https://terms.naver.com/entry.naver?docId=66030&cid=43667&categoryId=43667	2021/05/03	0	2022-08-02 12:20:09	2022-08-02 14:10:30
BK22002844	21	질문자	전 그땐 주식에 관심이 없어서 몰랐었네요. 아무튼 오늘 공매도에 대해서 너무 잘 설명해주셔서 감사해요. 전 이만 가볼게요.				0	2022-08-02 12:20:09	2022-08-02 14:10:30
BK22002844	22	전문가	잘 가세요. 나중에 또 궁금증 나는 거 있으시면 언제든 부담갖지 말고 질문해 주세요.				1	2022-08-02 12:20:09	2022-08-03 08:42:22
