id	utterance_id	role	text	search_query	search_URL	reference_date	terminate	regDate	updDate
BK22019105	1	질문자	내 집 마련을 위한 첫걸을으로 청약통장을 만들어 볼까 하는데 말만 들었지 정확히 모르고 있거든요. 그래서 말인데 이 청약통장이 뭔지 알려주실 수 있나요?				0	2022-10-25 16:01:48	2022-10-25 16:50:21
BK22019105	2	전문가	주택청약종합저축은 민영주택, 국민주택을 공급받기 위하여 매월 2만원에서 50만원까지의 금액을 자유롭게 납입하는 상품이에요.	청약통장이란	https://www.babytimes.co.kr/news/articleView.html?idxno=61152	2022/10/18	0	2022-10-25 16:01:48	2022-10-25 16:50:21
BK22019105	3	질문자	금액의 폭이 좀 넓네요. 얼마를 납입하는게 제일 유리할까요?				0	2022-10-25 16:01:48	2022-10-25 16:50:21
BK22019105	4	전문가	납입액은 50만원이 되어도 해당 납입월의 청약저축액에 반영되는 금액은 10만원까지라서 10만원을 매월 넣는게 유리해요.	청약저축 금액	https://www.hankyung.com/realestate/article/2021122646471	2021/12/27	0	2022-10-25 16:01:48	2022-10-25 16:50:21
BK22019105	5	질문자	저도 매월 납입액을 10만원으로 조정 해야겠어요. 그리고 청약저축도 저축이니까 이자가 있나요?				0	2022-10-25 16:01:48	2022-10-25 16:50:21
BK22019105	6	전문가	현재 주택청약종합저축의 금리는 2016년 8월부터 6년의 기간 동안 동일한 연 1.8%에요.	청약저축 이자	https://www.hani.co.kr/arti/economy/property/1055678.html	2022/08/22	0	2022-10-25 16:01:48	2022-10-25 16:50:21
BK22019105	7	질문자	연 1.8%면 이자가 일반 예금에 비해서 적은지 많은지 모르겠네요. 좀 더 많은 편인가요?				0	2022-10-25 16:01:48	2022-10-25 16:50:21
BK22019105	8	전문가	2022년 10월 20일 금융권에 따르면 저축은행에서 연 최고 6.5%까지 금리가 제공되는 정기예금 상품이 출시됐어요. 기준금리 상승과 같이 급등한 시중은행의 상품들과 금리 차이가 많이 벌어진 상태라 청약 가입자들 사이에서는 적어도 기준 금리만큼은 보장해줘야 하는거 아니냐며 불만도 나오고 있어요.	예금 이자 청약 이자	https://www.dnews.co.kr/uhtml/view.jsp?idxno=202210201408175490813	2022/10/20	0	2022-10-25 16:01:48	2022-10-25 16:50:21
BK22019105	9	질문자	정말 너무 할 정도로 금리가 벌어져 있네요. 청약통장 해지하고 다른 상품 가입하는 사람들도 있나요?				0	2022-10-25 16:01:48	2022-10-25 16:50:21
BK22019105	10	전문가	지금 아파트 청약 시장에 찬바람이 불고 시장 금리보다 적은 이자율에 점점 주택청약종합저축을 해지하는 국민들이 늘고 있어요.	청약통장 해지	https://www.asiatime.co.kr/article/20221020500226	2022/10/20	0	2022-10-25 16:01:48	2022-10-25 16:50:21
BK22019105	11	질문자	저같아도 그런 생각 할 것 같아요. 그런데 청약통장을 하던 중에 그 돈이 필요해지면 잠깐 인출도 할 수 있나요?				0	2022-10-25 16:01:48	2022-10-25 16:50:21
BK22019105	12	전문가	아뇨, 주택청약종합저축은 일부 인출 또는 일부 해지가 불가능해요.	청약통장 일부 출금	https://jnilbo.com/view/media/view?code=2021041413530552761	2021/05/02	0	2022-10-25 16:01:48	2022-10-25 16:50:21
BK22019105	13	질문자	그럼 돈이 필요하다면 아예 해지를 해야겠네요.				0	2022-10-25 16:01:48	2022-10-25 16:50:21
BK22019105	14	전문가	급전이 필요하다면 다른 방법을 찾는 수 밖에요.				0	2022-10-25 16:01:48	2022-10-25 16:50:21
BK22019105	15	질문자	그럼 요즘 청년을 대상으로 한 정책이 많던데 청년에게 더 혜택이 주어지는 청약통장은 없나요?				0	2022-10-25 16:01:48	2022-10-25 16:50:21
BK22019105	16	전문가	청년우대형 주택청약종합저축이라는 상품이 있어요. 이 상품은 2년 이상 경과시 세전 최대 연 3.3%의 금리로 일반 주택청약종합저축의 금리인 연 1.8% 보다 1.5%나 높아요. 대신 만 19세 부터 34세 까지의 연소득 3600만원 이하 무주택세대주 등의 조건을 충족한 사람만 가입이 가능해요.	청년우대형 주책청약종합저축	http://www.greened.kr/news/articleView.html?idxno=298273	2022/10/18	0	2022-10-25 16:01:49	2022-10-25 16:50:21
BK22019105	17	질문자	우와 거의 2배에 가까운 수치네요. 저도 해당되는지 찾아보고 가입해야겠어요. 그런데 막상 바로 필요하게 되면 따로 부모님에게 받을 수 있을까요?				0	2022-10-25 16:01:49	2022-10-25 16:50:21
BK22019105	18	전문가	2000년 3월 26일 이전의 종합청약저축 및 청약예금과 청약 부금은 직계가족 및 자녀에게 증여할 수 있지만 이후 가입한 경우에는 가입자가 사망했을때 자녀에게 상속이 돼요. 그리고 청약통장을 증여 받기로 한 사람은 가지고 있는 청약통장이 없어야 하고 세대주로 등록되어 있는 상태여야 해요.	청약통장 증여	https://www.taxwatch.co.kr/article/tax/2022/10/06/0001	2022/10/09	0	2022-10-25 16:01:49	2022-10-25 16:50:21
BK22019105	19	질문자	그럼 일단 부모님과 상의를 먼저 해봐야겠어요.				0	2022-10-25 16:01:49	2022-10-25 16:50:21
BK22019105	20	전문가	네, 부모님과 얘기 잘 나눠보시고 결정해도 늦지 않으실 거에요.				1	2022-10-25 16:01:49	2022-10-25 16:50:21
