id	utterance_id	role	text	search_query	search_URL	reference_date	terminate	regDate	updDate
BK22006879	1	질문자	우크라이나 전쟁이 생각보다 더 장기화 되고 있네요. 반도체 주식에 크게 투자했는데 러시아 공급난으로 반도체 대란이라 요즘 손해가 너무 커요.				0	2022-08-29 22:17:31	2022-08-29 22:21:07
BK22006879	2	전문가	아이고, 하필 반도체 관련주에 많이 투자를 하셨었네요.				0	2022-08-29 22:17:31	2022-08-29 22:21:07
BK22006879	3	질문자	러시아산 천연가스 공급난이 반도체 말고도 악영향을 미칠 산업이 있을까요? 투자 고려 종목에서 제외하려구요.				0	2022-08-29 22:17:31	2022-08-29 22:21:07
BK22006879	4	전문가	유럽에 악영향을 끼친 러시아산 천연가스 공급난으로 곧 유리 대란이 일어날거라는 우려가 커지고 있어요. 유리 제조업은 에너지 집약 산업 중 하나인데 유럽에서 유리를 제조하는 과정에서 주 에너지원으로 러시아산 천연가스를 사용하고 있어요.	유럽 천연가스 공급난 유리대란	https://www.hankyung.com/international/article/202208282821i?utm_source=naver&utm_medium=naver_newsstandcast&utm_campaign=newsstandcast_naver_all	2022/08/29	0	2022-08-29 22:17:31	2022-09-21 11:17:12
BK22006879	5	질문자	러시아산 천연가스 공급난이 지속되면 유리 대란은 일어날 수 밖에 없겠네요. 유럽연합에서는 어떻게 대응하고 있나요?				0	2022-08-29 22:17:31	2022-08-29 22:35:25
BK22006879	6	전문가	유럽연합에서는 회원국 정부에게 에너지 절약 비상계획을 세우도록 했어요. 이때 유리 제조업이 주요 취약 산업으로 꼽히고 있구요.	EU 에너지 절약 비상계획 마련	https://www.hankyung.com/international/article/202208282821i?utm_source=naver&utm_medium=naver_newsstandcast&utm_campaign=newsstandcast_naver_all	2022/08/29	0	2022-08-29 22:17:31	2022-08-29 22:35:25
BK22006879	7	질문자	에너지 절약 비상계획을 세울 정도로 위기인 상황인 거네요. 유럽에서는 유리 제조 과정의 어떤 부분에서 러시아산 천연가스를 사용해온거죠?				0	2022-08-29 22:17:31	2022-09-21 11:21:01
BK22006879	8	전문가	유럽에서는 유리 제조를 할 때 꼭 필요한 온도를 맞추기 위한 과정에서 러시아산 가스를 에너지원으로 사용해왔어요.	유럽 유리 제조 에너지원	https://www.hankyung.com/international/article/202208282821i?utm_source=naver&utm_medium=naver_newsstandcast&utm_campaign=newsstandcast_naver_all	2022/08/29	0	2022-08-29 22:17:31	2022-09-21 11:17:12
BK22006879	9	질문자	천연 가스가 온도를 맞출 때 필요한가 보네요. 그런데 보통 러시아가 유럽에 어떻게 천연 가스를 공급하나요?				0	2022-08-29 22:17:31	2022-09-21 11:21:01
BK22006879	10	전문가	러시아에서 유럽 대륙을 잇는 노르트스트림 가스관을 통해 천연가스를 공급하는데요. 이걸 러시아에서는 계속 부품 결함 등의 이유를 대면서 천연가스 공급을 중단하고 있는 상황이에요.	노르트스트림 가동 중단	https://www.hankyung.com/international/article/202208282821i?utm_source=naver&utm_medium=naver_newsstandcast&utm_campaign=newsstandcast_naver_all	2022/08/29	0	2022-08-29 22:17:31	2022-09-21 11:21:01
BK22006879	11	질문자	이렇게 계속 가동을 반복적으로 중단하고 있는 상황에 유럽에서는 천연 가스 사용을 제한 할 가능성이 있겠네요?				0	2022-08-29 22:17:31	2022-08-29 22:35:25
BK22006879	12	전문가	맞아요. EU 집행위원회는 에너지 비상 계획에 따라 올겨울 가스 배급제를 시행할 수도 있다고 했어요. 가스 배급제가 시행되면 가스를 공급할 우선 산업에 유리 제조 산업이 포함됐구요.	유럽 가스 배급제	https://www.hankyung.com/international/article/202208282821i?utm_source=naver&utm_medium=naver_newsstandcast&utm_campaign=newsstandcast_naver_all	2022/08/29	0	2022-08-29 22:17:31	2022-09-21 11:21:01
BK22006879	13	질문자	가스가 우선 공급될 정도로 유리 제조업에 유리가 꼭 필요한가 봐요. 그럼 유럽의 기업들은 어떻게 대책을 마련하고 있나요?				0	2022-08-29 22:17:31	2022-09-21 11:42:35
BK22006879	14	전문가	대표적으로 폭스바겐그룹은 공급망을 유럽 역외로 확대해서 차량용 유리 재고를 모아두고 있어요.	폭스바겐 그룹 유리대란 대책	https://www.hankyung.com/international/article/202208282821i?utm_source=naver&utm_medium=naver_newsstandcast&utm_campaign=newsstandcast_naver_all	2022/08/29	0	2022-08-29 22:17:31	2022-09-21 11:17:12
BK22006879	15	질문자	공급망 확대가 필수적일텐데 미리 재고를 모아두고 있네요. 유리병이 꼭 필요한 음료업계는 어떻게 대비하고 있나요?				0	2022-08-29 22:17:31	2022-08-29 22:35:25
BK22006879	16	전문가	음료업계에서는 병을 재활용하는 횟수를 늘리거나 제품 가격을 올리는 걸로 대책 마련에 대해 고민하는 중이에요.	음료업계 유리대란 대책	https://www.hankyung.com/international/article/202208282821i?utm_source=naver&utm_medium=naver_newsstandcast&utm_campaign=newsstandcast_naver_all	2022/08/29	0	2022-08-29 22:17:31	2022-09-21 11:42:35
BK22006879	17	질문자	하긴 유리가 귀해지면 제품 가격 인상으로 이어질 수 밖에 없겠네요. 유리 제조기업은 다른 에너지원으로는 온도를 맞출 수 없나요?				0	2022-08-29 22:17:31	2022-09-21 11:21:01
BK22006879	18	전문가	그래서 유리 제조기업은 유리 생산에 필요한 에너지원을 석유와 같은 에너지원으로 다변화하기 위해 노력하고 있어요.	유리 제조기업 유리대란 대책	https://www.hankyung.com/international/article/202208282821i?utm_source=naver&utm_medium=naver_newsstandcast&utm_campaign=newsstandcast_naver_all	2022/08/29	0	2022-08-29 22:17:31	2022-09-21 11:21:01
BK22006879	19	질문자	반복적으로 천연가스 공급 문제가 발생할 수 있으니 이번 참에 에너지원을 다변화하는 방법을 개발하는 것도 좋겠네요. 오늘 쉽게 설명해주셔서 감사해요.				0	2022-08-29 22:17:31	2022-08-29 22:35:25
BK22006879	20	전문가	저도 오랜만에 직접 만나서 이야기 나눠서 즐거웠어요. 열차 시간이 다 됐는데 조심히 가세요.				1	2022-08-29 22:17:31	2022-09-21 11:42:35
