id	utterance_id	role	text	search_query	search_URL	reference_date	terminate	regDate	updDate
BK22007310	1	질문자	요새 환율이 장난 아니네요. 달러 가치가 왜 이렇게 치솟는 거죠?				0	2022-09-02 21:50:01	2022-09-02 22:07:22
BK22007310	2	전문가	제롬 파월 미국 연방준비제도 의장이 지난주 잭슨홀 미팅 연설에서 매파적 발언을 해서 그래요. 미국 경제지표도 좋게 나왔기 때문에 연준이 강도 높은 긴축 정책을 펼칠 것이라는 예측이 우세하거든요.	환율	https://www.yna.co.kr/view/AKR20220902036451002?input=1195m	2022/09/02	0	2022-09-02 21:50:01	2022-09-02 22:07:22
BK22007310	3	질문자	아, 미국은 왜 이렇게 계속 금리를 올리는 거예요?				0	2022-09-02 21:50:01	2022-09-02 22:07:22
BK22007310	4	전문가	1970년대에 악몽 같은 장기 인플레이션을 경험했기 때문이죠. 당시 연준은 인플레이션에 대처하고자 금리를 올렸고 물가 상승이 조금 진정되자 긴축 정책을 중단했는데, 인플레이션은 1980년대 초까지 계속 올랐거든요. 그래서 이번에는 너무 일찍 인플레이션을 단정하지 않고 완전히 인플레이션을 잡을 때까지 계속 금리를 올리는 거예요.	미국 경제성장률	https://news.mt.co.kr/mtview.php?no=2022090213492265323	2022/09/02	0	2022-09-02 21:50:01	2022-09-02 22:07:22
BK22007310	5	질문자	그런 역사가 있었군요. 아무리 그래도 원화 가치가 너무 많이 떨어진 것 같아요. 한국은행은 원화 약세에 대해 이유가 뭐라고 생각하고 있나요?				0	2022-09-02 21:50:01	2022-09-14 13:58:27
BK22007310	6	전문가	원달러 환율이 2009년 금융위기 때와 맞먹는 1350원대까지 치솟는 원화 가치 약세 원인으로 한국은행은 우리나라 무역수지 적자와 위안화 약세를 들고 있어요.	달러 한은	https://newsis.com/view/?id=NISX20220831_0001997421&cID=15001&pID=15000	2022/08/31	0	2022-09-02 21:50:01	2022-09-02 22:07:22
BK22007310	7	질문자	그렇군요, 저는 우리나라 금리가 너무 낮아서 그런 것 같은데 말이죠. 아무래도 달러가 계속 오를 것 같으니, 달러에 투자할까 생각 중이에요. 요새 달러 선물 상품 가격이 수익률이 꽤 좋죠?				0	2022-09-02 21:50:01	2022-09-02 22:07:22
BK22007310	8	전문가	맞아요. 달러 선물지수를 두 배로 추종하는 KOSEF미국달러선물레버리지와 KODEX미국달러선물레버리지가 8월 1일부터 30일까지 단 한 달 만에 보여준 수익률은 각각 6.65퍼센트와 6.76퍼센트죠. KOSEF미국달러선물과 KODEX미국달러선물도 수익률이 3.4퍼센트예요.	원화에 투자	https://biz.chosun.com/stock/stock_general/2022/08/30/UEBMMZPM7RFBJG6GDLMCP2RMTI/?utm_source=naver&utm_medium=original&utm_campaign=biz	2022/08/30	0	2022-09-02 21:50:01	2022-09-02 22:07:22
BK22007310	9	질문자	휴, 지금 물려 있는 국내 주식을 다 처분하고 달러 상품으로 갈아타야 할지 고민이네요. 그런데 막상 제가 팔고 나면 코스피가 오를지도 몰라서 고민이에요. 지난달 외국인이 코스피에서 꽤 많이 매수하지 않았어요?				0	2022-09-02 21:50:01	2022-09-02 22:07:22
BK22007310	10	전문가	네, 지난달 코스피에서 외국인이 순매수한 금액은 올해 최대 규모인 3조 8천 53억원이죠. 올해 들어 외국인은 대체로 매도하는 모습을 보였는데, 7월 2조 4천 897억원 매수를 하면서 매수 우위로 돌아섰어요.	코스피 3조8천53억원	https://www.yna.co.kr/view/AKR20220901072400002?input=1195m	2022/09/01	0	2022-09-02 21:50:01	2022-09-02 22:07:22
BK22007310	11	질문자	아, 지난달에 제 생각보다 훨씬 많이 샀네요. 그럼 국제적으로 봐도 지난달 코스피는 꽤 선방한 것 아닌가요?				0	2022-09-02 21:50:01	2022-09-02 22:07:22
BK22007310	12	전문가	그렇죠, 지난달 소폭 상승으로 인해서 코스피는 G20 증시 대표지수 중 상승률 8위에 올랐어요. 환율이 높고 긴축에 대한 염려도 있지만, 외국인이 국내 증시에서 매수를 해 준 덕분이죠.	코스피 8월 상승률 G20	https://www.wowtv.co.kr/NewsCenter/News/Read?articleId=A202209010170&t=NN	2022/09/01	0	2022-09-02 21:50:01	2022-09-02 22:07:22
BK22007310	13	질문자	이런 뉴스를 들으니 또 고민이 되네요. 꼭 제가 팔고 나면 오르더라고요. 외국인이 LG에너지솔루션에도 많이 투자했죠?				0	2022-09-02 21:50:01	2022-09-02 22:07:22
BK22007310	14	전문가	2일 한국거래소에 따르면 7월 25일부터 9월 1일까지 지난 28거래일 동안 외국인의 LG에너지솔루션 순매수 금액은 1조498억원이에요. 인플레이션 감축법이 통과되면서 미국 내 에너지저장장치 시장 점유율이 기대되니 투자가 늘어난 것이죠.	외국인 순매수 LG에너지솔루션	https://view.asiae.co.kr/article/2022090209532531470	2022/09/02	0	2022-09-02 21:50:01	2022-09-02 22:07:22
BK22007310	15	질문자	휴, 제가 LG에너지솔루션 고점에 물려 있어서 물어봤어요. 9월에는 코스피 상황이 좀 어떨지 궁금하네요. 9월 코스피 등락범위는 어느 정도일 것으로 예상되나요?				0	2022-09-02 21:50:02	2022-09-02 22:10:20
BK22007310	16	전문가	1일 한국투자증권은 9월 코스피 등락범위가 2340p에서 2540p일 것이라고 예측했죠.	코스피 향방	https://www.skyedaily.com/news/news_view.html?ID=166242	2022/09/01	0	2022-09-02 21:50:02	2022-09-02 22:10:20
BK22007310	17	질문자	하방보다는 상방이 열려 있네요. 일단은 그냥 하던 대로 가지고 있던 주식을 보유해야겠어요.				0	2022-09-02 21:50:02	2022-09-02 22:10:20
BK22007310	18	전문가	네, 잘 생각해서 결정해요.				1	2022-09-02 21:50:02	2022-09-14 13:58:27
BK22007310	19	질문자	이것저것 알려줘서 고마워요. 저는 이만 집에 가 봐야겠어요.				0	2022-09-02 21:50:02	2022-09-02 22:10:20
BK22007310	20	전문가	네, 주말 잘 보내고 다음 주에 봐요.				0	2022-09-02 21:50:02	2022-09-02 22:10:20
