id	utterance_id	role	text	search_query	search_URL	reference_date	terminate	regDate	updDate
BK22012721	1	질문자	요즘 여가수들의 노래가 많이 들리던데 걸그룹의 인기가 어때?				0	2022-09-30 15:21:49	2022-10-01 16:19:46
BK22012721	2	전문가	유튜브와 전 세계적인 음원 스트리밍 플랫폼을 보면 걸그룹 케이팝이 기세를 펼치고 있는데, 멜론이라는 한국 최대 음원 사이트 메인 차트 top100을 보면 여성 가수 및 걸그룹이 10위권 비중을 차지하고 있어.	걸그룹 케이팝	https://sports.donga.com/ent/article/all/20220824/115129986/3	2022/08/25	0	2022-09-30 15:21:49	2022-10-01 16:19:46
BK22012721	3	질문자	블랙핑크의 핑크 베놈도 인기가 엄청 많지 않아?				0	2022-09-30 15:21:49	2022-10-01 16:19:46
BK22012721	4	전문가	응. 핑크 베놈은 블랙핑크의 정규 2집 중에서 미리 공개한 노래인데, 한국 아티스트 처음으로 스포티파이 글로벌 톱 노래 차트에서 3일 동안 1위를 했어. 또한 영국과 미국을 포함해 75개국 아이튠즈 송 차트에서 상위권을 기록하며 인기가 식지 않고 있어.	블랙핑크 핑크베놈	https://www.mk.co.kr/star/musics/view/2022/08/755249/	2022/08/26	0	2022-09-30 15:21:49	2022-10-01 16:19:46
BK22012721	5	질문자	핑크 베놈 노래 들어봤는데 좋더라! 그런데 이번에 소녀시대도 컴백하지 않았어?				0	2022-09-30 15:21:49	2022-10-01 16:19:46
BK22012721	6	전문가	지난 8월 5일 무려 5년 만에 컴백한 소녀시대는 포에버 원이라는 정규 7집을 공개했어.	소녀시대 포에버 원	https://www.chosun.com/entertainments/music/2022/08/07/LS6ZZL25TFCSBCBOFVXBIDDWRU/	2022/08/07	0	2022-09-30 15:21:49	2022-10-01 16:19:46
BK22012721	7	질문자	포에버 원은 어떤 노래인지 설명해 줄 수 있어?				0	2022-09-30 15:21:49	2022-10-01 16:19:46
BK22012721	8	전문가	타이틀 노래인 포에버 원은 에너지 넘치는 멜로디와 다이내믹하게 전개되는 팝 댄스 곡이야. 소녀시대 특유의 막힘없이 부르는 노래가 축제에 와있는 것처럼 즐거운 분위기를 느낄 수 있고, 가사는 항상 힘이 되어주는 귀한 사람들에 대한 끝없는 사랑의 의미를 담고 있어.	FOREVER1 의미	https://biz.chosun.com/entertainment/enter_general/2022/08/05/L6GBRR4X2Y5MGWDFZ56MNLIYSY/	2022/08/05	0	2022-09-30 15:21:49	2022-10-01 16:19:46
BK22012721	9	질문자	무슨 노래인지 한번 들어봐야겠다. 그런데 현재 소녀시대 멤버가 몇 명인 거야?				0	2022-09-30 15:21:49	2022-10-01 16:19:46
BK22012721	10	전문가	소녀시대는 9명이서 데뷔했었는데, 2014년에 예전 멤버였던 제시카가 그룹을 탈퇴하면서 현재 소녀시대는 총 8명의 멤버로 이루어져 있어.	소녀시대 멤버	https://ko.wikipedia.org/wiki/%EC%86%8C%EB%85%80%EC%8B%9C%EB%8C%80	2022/08/21	0	2022-09-30 15:21:49	2022-10-01 16:19:46
BK22012721	11	질문자	그렇구나. 그럼 8명의 멤버들은 다 같은 소속사에 속해있는 거야?				0	2022-09-30 15:21:49	2022-10-01 16:19:46
BK22012721	12	전문가	소녀시대 멤버들은 각자 다른 소속사에서 활동하고 있어. 태연과 유리, 효연, 써니와 윤아는 SM엔터테인먼트에 속해있고, 티파니는 해외 소속사와 계약을 했으며 서현은 나무엑터스 그리고 수영은 사람엔터테인먼트에 속해있어.	소녀시대 소속사	http://www.munhwa.com/news/view.html?no=2022080501032830307001	2022/08/05	0	2022-09-30 15:21:49	2022-10-01 16:19:46
BK22012721	13	질문자	다 같은 소속사가 아니구나. 학창 시절에 소녀시대 인기가 굉장히 많았었는데 기록이 새록새록 하네.				0	2022-09-30 15:21:50	2022-10-01 16:19:46
BK22012721	14	전문가	소녀시대와 나이가 비슷하면 같이 성장한 느낌을 느낄 수도 있겠다.				0	2022-09-30 15:21:50	2022-10-01 16:19:46
BK22012721	15	질문자	나이가 비슷해서 그런가 친근하기도 해. 혹시 소녀시대 노래 중에 스키니진 입고 부른 유명한 노래가 뭐였지?				0	2022-09-30 15:21:50	2022-10-01 16:19:46
BK22012721	16	전문가	지 뮤직비디오가 흰색 티셔츠에 색깔 있는 스키니진의 스타일로 인기를 끌었는데, 그때 당시 우리나라 아이돌 그룹 최초로 1억 뷰를 달성했을 정도로 인기가 많았어. 그 이후로도 소녀시대는 치어리딩이나 본드걸, 제복 등 여러 가지 콘셉트를 연관시킨 노래를 내면서 아이돌 최정상 자리를 지켜왔지.	소녀시대 스키니진 뮤비	http://www.munhwa.com/news/view.html?no=2022080501032830307001	2022/08/05	0	2022-09-30 15:21:50	2022-10-01 16:19:46
BK22012721	17	질문자	옛날이나 지금이나 소녀시대 인기가 여전히 대단한 것 같아. 그런데 써니가 코로나에 걸렸다는 소식 들었어?				0	2022-09-30 15:21:50	2022-10-01 16:19:46
BK22012721	18	전문가	응. 소녀시대 멤버인 써니가 코로나19에 확진돼서 스케줄을 다 멈춘 상태인데, 재택에서 치료하고 격리를 하면서 방역 당국의 지침을 지키고 있어.	써니 코로나 확진	https://biz.chosun.com/entertainment/enter_general/2022/08/24/P2QA6RIGZVWKRQJIATDVGKSFDQ/	2022/08/24	0	2022-09-30 15:21:50	2022-10-01 16:19:46
BK22012721	19	질문자	신곡 발매로 한창 바쁠 시기에 코로나 확진돼서 여러모로 많이 힘들겠다.				0	2022-09-30 15:21:50	2022-10-01 16:19:46
BK22012721	20	전문가	그러게 타이밍이 안 좋네. 포에버 원 들으면서 마음속으로나마 소시의 컴백을 축하해 주자!				1	2022-09-30 15:21:50	2022-10-01 16:19:46
