id	utterance_id	role	text	search_query	search_URL	reference_date	terminate	regDate	updDate
BK22001449	1	질문자	친구가 표를 선물해줘서 뮤지컬 엘리자벳을 봤었는데, 생각보다 흥미롭더라고요.				0	2022-07-20 16:16:25	2022-08-02 12:01:32
BK22001449	2	전문가	좋은 친구분을 두셔서 부럽네요. 특별히 인상적이었던 부분이 있었나요?				0	2022-07-20 16:16:25	2022-07-21 10:31:51
BK22001449	3	질문자	뮤지컬 내용만 봤을 땐 로맨스 판타지 같다는 인상을 많이 받았는데, 주인공인 엘리자벳 황후가 실존 인물이라는 말을 친구가 해줘서 많이 놀랐어요. 어느 시대 사람인지 혹시 아세요?				0	2022-07-20 16:16:25	2022-08-02 12:01:32
BK22001449	4	전문가	엘리자벳 아말리에 유진 황후는 1837년에 태어나서 1898년에 숨을 거두었어요. 오스트리아 헝가리 제국을 통치한 황제 프란츠 요제프 1세의 부인이였죠.	엘리자벳 황후 시대	https://mobile.newsis.com/view.html?ar_id=NISX20150513_0013659624#_enliple	2016/12/28	0	2022-07-20 16:16:25	2022-07-21 10:31:51
BK22001449	5	질문자	1898년에 조선에는 무슨 일이 있었죠?				0	2022-07-20 16:16:25	2022-08-02 12:01:32
BK22001449	6	전문가	대한제국에서는 1998년 2월 22일, 대원군이 서거했어요. 대원군의 아들이었던 고종이 대한제국을 세워서 황제가 된 1897년 10월 12일로부터 불과 4개월 뒤에 있었던 일이에요.	1898년 조선시대	https://www.chosun.com/opinion/2020/11/04/QIAX7FY6CJD2FFIDNWAPYWSYV4/	2020/11/04	0	2022-07-20 16:16:25	2022-07-21 10:31:51
BK22001449	7	질문자	흥선대원군과 엘리자벳 황후의 사망 연도가 같다니 왠지 신기하네요. 뮤지컬에서는 엘리자벳이 암살을 당해서 죽는데, 이 암살도 실제로 있었던 일인가요?				0	2022-07-20 16:16:25	2022-08-02 12:01:32
BK22001449	8	전문가	네, 이탈리아인 무정부주의자 루이지 루케니가 저지른 일이었어요. 루케니는 왕족을 혐오했는데, 본래는 다른 귀족을 죽이려다 실패했던 와중에 당시 스위스 여행 중이었던 엘리자벳을 발견하고선 그만 찌른 거죠.	엘리자벳 암살	https://www.khan.co.kr/culture/culture-general/article/201812131452001	2018/12/13	0	2022-07-20 16:16:25	2022-07-21 10:31:51
BK22001449	9	질문자	그럼 무고한 사람을 죽인거나 마찬가지네요! 루케니는 결국엔 어떻게 되었나요?				0	2022-07-20 16:16:25	2022-08-02 12:01:32
BK22001449	10	전문가	루케니는 사형을 원했지만, 스위스에서는 무기징역을 선고했어요. 추가 재판을 요구했지만 재판 결과는 똑같아서, 결국 1910년에 10월 19일에 벨트로 목을 매어 자살했죠.	루케니 최후	https://ko.wikipedia.org/wiki/%EB%A3%A8%EC%9D%B4%EC%A7%80_%EB%A3%A8%EC%BC%80%EB%8B%88	2022/02/18	0	2022-07-20 16:16:25	2022-07-21 10:31:51
BK22001449	11	질문자	뮤지컬 마지막 장면에서 루케니가 갑자기 목을 매고 자살해서 좀 당황했는데, 그게 실제 역사를 반영한 것이었네요! 그럼 혹시 엘리자벳 황후가 정신병원을 방문한 것도 실제로 있었던 일이었을까요?				0	2022-07-20 16:16:25	2022-08-02 12:01:32
BK22001449	12	전문가	네, 엘리자벳은 정신병원을 자주 방문했어요. 그냥 단순히 방문한 것이 아니라 후원도 했었죠. 심지어 황실의 행사에 참여하는 대신 정신병원을 들리기도 했고요.	엘리자벳 정신병원 방문	https://www.khan.co.kr/culture/culture-general/article/201812131452001	2018/12/13	0	2022-07-20 16:16:25	2022-07-21 10:31:51
BK22001449	13	질문자	엘리자벳 본인도 우울증과 신경쇠약을 앓았다는 이야기를 들었던 것 같기도 해요. 그런 와중에 아들인 루돌프 황태자가 자살하다니, 저라도 미쳐버리지 않곤 못 버텼을 거 같아요. 실제 역사 속의 루돌프 황태자도 스스로 목숨을 끊은거죠?				0	2022-07-20 16:16:25	2022-08-02 12:01:32
BK22001449	14	전문가	루돌프 황태자의 문제는 더 복잡했어요. 아버지와는 정치적 노선이 달랐고, 어머니는 아들인 그를 별로 신경 쓰지 않아서 갈수록 정신적으로 병들 수 밖에 없었죠. 결국 사냥용 별장인 마이얼링에서 남작의 딸인 마리 폰 베체라와 동반 자살했어요.	루돌프 황태자 죽음	https://ko.wikipedia.org/wiki/%EB%A3%A8%EB%8F%8C%ED%94%84_%ED%8F%B0_%EC%99%B8%EC%8A%A4%ED%84%B0%EB%9D%BC%EC%9D%B4%ED%9E%88%EC%9B%85%EA%B0%80%EB%A5%B8_%ED%99%A9%ED%83%9C%EC%9E%90	2022/03/23	0	2022-07-20 16:16:25	2022-07-21 10:31:51
BK22001449	15	질문자	루돌프 황태자의 정치적 성향은 어땠나요?				0	2022-07-20 16:16:25	2022-08-02 12:01:32
BK22001449	16	전문가	루돌프 황태자는 독일 프로이센 제국에 반감을 가지고 있었어요. 동시에 자유주의적인 정치적 성향으로 인해서, 반대 세력에 의해서 암살되었다는 의혹도 있고요.	루돌프 황태자 정치적 성향	http://www.wolyo.co.kr/news/articleView.html?idxno=26051	2014/10/23	0	2022-07-20 16:16:25	2022-07-21 10:31:51
BK22001449	17	질문자	역사적으로 여러가지로 혼란스러웠던 시기였던 것 같아요. 그렇다곤 해도 아버지인 프란츠 요제프도 정말 박복하네요. 아들은 권총으로 자살하고, 아내는 암살 당하다니 너무 끔찍해요.				0	2022-07-20 16:16:25	2022-08-02 12:01:32
BK22001449	18	전문가	프란츠 요제프의 가정사는 정말 불행했죠. 이종사촌이었던 엘리자벳 황후와의 사이에서 1남 3녀인 조피, 기젤라, 루돌프와 마리 발레리를 두긴 했지만, 이 한명이었던 조피는 요절하고, 루돌프는 1889년에 변사했어요. 심지어 동생인 막시밀리안은 프랑스 괴뢰 정권의 멕시코 황제로 즉위했다가 프랑스군 철군 이후 1867년 반군에게 처형 당했으니까요.	프란츠 요제프 가족	https://ko.wikipedia.org/wiki/%ED%94%84%EB%9E%80%EC%B8%A0_%EC%9A%94%EC%A0%9C%ED%94%84_1%EC%84%B8	2022/03/02	0	2022-07-20 16:16:25	2022-07-21 10:31:51
BK22001449	19	질문자	왠지 모르게 오스트리아 황족 중에서 불행한 사람들이 많은 거 같다는 생각도 드네요. 예전에 페르디난트라는 이름의 황태자가 암살당하는 사건 때문에 1차대전이 일어났다는 내용을 교과서에서 봤는데, 제 기억이 맞다면 그 사람도 오스트리아 황태자였거든요.				0	2022-07-20 16:16:26	2022-08-02 12:01:32
BK22001449	20	전문가	오스트리아 황태자인 프란츠 페르디난트는 프란츠 요제프의 조카였어요. 하지만 사촌형 루돌프가 자살한 사건이 벌어지자, 페르디난트가 합스부르그의 후계자가 된거죠.	오스트리아 황태자 부부 암살	http://woman.chosun.com/news/articleView.html?idxno=99646	2022/06/23	0	2022-07-20 16:16:26	2022-07-21 10:31:51
BK22001449	21	질문자	그러면 엘리자벳 황후의 남편인 프란츠 요제프가 그 황태자의 삼촌이라는거네요? 이렇게 또 연결이 되는 게 너무 신기해요. 그렇지만 아들도 죽고 조카도 그렇게 죽다니, 무슨 저주라도 씌인게 아닌가 싶을 정도로 너무한데요.				0	2022-07-20 16:16:26	2022-08-02 12:01:32
BK22001449	22	전문가	실제로 저주가 아닌가 하는 소문이 돌기도 했어요. 황제가 사형시킨 헝가리 민족주의자의 어머니가 황제에게 저주를 내린거 아닐까 하는 소문이요.	프란츠 요제프 저주	https://premium.chosun.com/site/data/html_dir/2015/01/08/2015010803182.html	2015/01/09	0	2022-07-20 16:16:26	2022-07-21 10:31:51
BK22001449	23	질문자	정말 저주가 있었는진 모르겠지만 여러가지로 안타깝네요. 하지만 동시에 흥미로운 이야기였어요. 역사 지식을 늘려줘서 고마워요!				0	2022-07-20 16:16:26	2022-08-02 12:01:32
BK22001449	24	전문가	별 말씀을요, 다음에도 기회되면 같이 역사 이야기를 나누어요.				1	2022-07-20 16:16:26	2022-07-22 11:11:11
