id	utterance_id	role	text	search_query	search_URL	reference_date	terminate	regDate	updDate
BK22002757	1	질문자	안녕하세요. 좋은 소식 전하러 왔어요! 그 유명한 드라마 왕좌의 게임의 속편이 나온대요!				0	2022-08-02 12:19:21	2022-08-02 14:06:13
BK22002757	2	전문가	존 스노 말씀하시는 거죠? 저도 정말 기대 중이에요. 그 후속작에서는 기존의 핵심 인물이었던 존 스노를 중심으로 시리즈를 만들 예정인데, 키트 해링턴이라는 원래의 영국 배우가 그대로 이 역을 맡게 되니까 기대를 안 할 수가 없죠!	왕좌의 게임 속편	https://www.yna.co.kr/view/AKR20220618004500075	2022/06/18	0	2022-08-02 12:19:21	2022-08-02 14:06:13
BK22002757	3	질문자	맞아요, 왕좌의 게임이 정말 인기가 어마어마했었는데. 언제 속편이 나오나 했어요.				0	2022-08-02 12:19:21	2022-08-02 14:06:13
BK22002757	4	전문가	그러게요. 이 드라마가 마지막 시즌 8에 6화까지 자그마치 총 73편이나 되는 회차를 전 세계 무려 170여 개국에서 방송하면서 인기몰이를 엄청나게 했죠.	왕좌의 게임 기록	https://www.yna.co.kr/view/AKR20190520146100009	2019/05/20	0	2022-08-02 12:19:21	2022-08-02 14:06:13
BK22002757	5	질문자	그렇게나 많은 국가에서 그렇게나 많은 회차라니, 실감하기 어려울 정도네요.				0	2022-08-02 12:19:21	2022-08-02 14:06:13
BK22002757	6	전문가	왕좌의 게임의 인기에 대해서 더 놀라운 사실을 하나 더 알려드리자면, 마지막 시즌인 8시즌만 봤을 때 누적 평균 시청자 수가 미국에서만 4천300만 명이나 되는 걸로 집계됐어요. 대박이죠?	왕좌의 게임 기록	https://www.yna.co.kr/view/AKR20190520146100009	2019/05/20	0	2022-08-02 12:19:21	2022-08-02 14:06:13
BK22002757	7	질문자	와, 엄청나네요. 이렇게까지 인기가 많을 수 있는 이유가 뭘까요? 물론 재미는 둘째로 치고요.				0	2022-08-02 12:19:21	2022-08-02 14:06:13
BK22002757	8	전문가	시즌 8에서 한 회에 들인 제작비가 약 178억 원 정도인데, 이게 영화 하나 만드는 비용하고 맞먹거든요. 이렇게까지 투자했는 데 인기가 없기도 어렵죠.	왕좌의 게임 흥행 비결	https://www.donga.com/news/Culture/article/all/20190515/95538816/1	2019/05/15	0	2022-08-02 12:19:21	2022-08-02 14:06:13
BK22002757	9	질문자	그렇게나 많은 돈이 들었다고요? 하지만 그런데도 마지막 시즌은 평이 좋지 않았죠? 정말 충격적인 결말과 전개라.				0	2022-08-02 12:19:21	2022-08-02 14:06:13
BK22002757	10	전문가	네, 안타깝게도요. 이게 오리지널 스토리랑 출간되지 않은 소설 분량이 많아진 후반부 7,8 시즌에서는 문제가 많았어요. 인기만큼이나 악평도 어마어마해서 매화마다 온갖 밈이 만들어지고 시즌 8에 가서는 다시 제작하라는 청원까지 등장했었죠.	왕좌의 게임 시즌8 청원	http://www.newstof.com/news/articleView.html?idxno=1735	2019/07/12	0	2022-08-02 12:19:21	2022-08-02 14:06:13
BK22002757	11	질문자	그래도 그동안 충분히 재미있기도 했고, 이 작품을 통해서 훌륭한 배우들을 많이 알게 되어서 저는 다 용서했어요! 예를 들어 피터 딘클리지나 에밀리아 클라크요.				0	2022-08-02 12:19:21	2022-08-02 14:06:13
BK22002757	12	전문가	저도 그렇게 생각해요. 배우 피터 딘클리지는 선천적으로 왜소증을 가지고 있지만 범접할 수 없는 연기력으로 외형에 대한 사람들의 편견을 깨부쉈잖아요. 자신과 같은 왜소증을 가진 사람들에 대한 신념과 가치관이 있으신 분이라, 백설공주와 일곱난쟁이의 실사화 과정에서 난쟁이를 묘사하는 방식에 대해 비판한 적도 있죠.	피터 딘클리지 왜소증	https://www.donga.com/news/Inter/article/all/20220126/111442659/1	2022/01/26	0	2022-08-02 12:19:21	2022-08-02 14:06:13
BK22002757	13	질문자	맞아요. 자신의 처치를 비관하지 않고 항상 약자와 소수자들에 대해 고찰하는 모습이 정말 멋지고 본받고 싶은 부분이에요. 출연진 중에 에밀리아 클라크도 촬영 중에 힘든 시기 이겨냈다죠?				0	2022-08-02 12:19:21	2022-08-02 14:06:13
BK22002757	14	전문가	왕좌의 게임 출연진에 대해 정말 속속들이 알고 계시는군요? 맞아요. 왕좌의 게임에서 대너리스 타르가르옌 역이었던 에밀리아 클라크는 시즌 중간에 두 차례나 뇌수술을 받고 그 결과로 심한 불안증과 공황 장애도 겪었죠. 하지만 클라크는 완전히 회복했고 자신처럼 뇌 부상이나 뇌졸중을 겪은 사람들을 위해 자선 재단을 설립하도록 도왔어요. 정말 이 정도면 성인이죠.	에밀리아 클라크 뇌수술	https://www.bbc.com/korean/international-47662832	2019/03/22	0	2022-08-02 12:19:21	2022-08-02 14:06:13
BK22002757	15	질문자	역시 드라마의 역할보다 더 멋진 배우네요. 이쯤 되니 이 배우들을 위한 훌륭한 작품을 써준 작가는 근황이 어떤지 궁금해지는데요?				0	2022-08-02 12:19:21	2022-08-02 14:06:13
BK22002757	16	전문가	아 작가요. 엘든링이라는 게임 아세요? 왕좌의 게임 원작 소설의 작가인 조지 마틴이 이 게임 개발에 스토리 작가로 참여해서 게임 세계관을 제작했거든요.	왕좌의 게임 작가 엘든링	https://zdnet.co.kr/view/?no=20220103063616	2022/01/03	0	2022-08-02 12:19:21	2022-08-02 14:06:13
BK22002757	17	질문자	와 왕좌의 게임 작가의 세계관으로 만들어진 게임이라니, 너무 기대돼요. 게임도 그렇고 드라마도 그렇고 앞으로 기대되는 것들 투성이네요!				0	2022-08-02 12:19:22	2022-08-02 14:06:13
BK22002757	18	전문가	맞아요, 저도 정말 왕좌의 게임과 관련된 것들이라면 잠을 못 이룰 정도예요.				0	2022-08-02 12:19:22	2022-08-02 14:06:13
BK22002757	19	질문자	이거 드라마 개봉하면 같이 보실래요?				0	2022-08-02 12:19:22	2022-08-02 14:06:13
BK22002757	20	전문가	좋아요! 그럼 그때 또 연락 주세요, 기대하고 있을게요!				1	2022-08-02 12:19:22	2022-08-03 08:16:00
