id	utterance_id	role	text	search_query	search_URL	reference_date	terminate	regDate	updDate
BK22008485	1	질문자	얼마 전에 미술관 방문에 취미가 생겼어요. 미술사에 대해 알고싶은데 전문지식이 없어서 고민이네요.				0	2022-09-14 22:20:54	2022-09-14 22:20:54
BK22008485	2	전문가	와, 아주 좋은 취미가 생기셨네요. 어떤 미술관에 방문하셨나요?				0	2022-09-14 22:20:54	2022-09-14 22:20:54
BK22008485	3	질문자	르네상스 명화에 관련된 미술 전시를 보고왔어요. 혹시 라파엘로가 그렸던 아테네 학당에 대해서 알고계신가요?				0	2022-09-14 22:20:54	2022-09-14 22:20:54
BK22008485	4	전문가	그럼요, 제 전문 분야라서 잘 알고있어요. 그림 아테네 학당은 이탈리아출신 화가 라파엘로 산치오가 1509년부터 1510년까지 2년에 걸쳐 완성한 프레스코화 인데요. 프레스코는 채화 기법인데요. 석회 혹은 석고등 으로 만든 석회벽이 덜 마른 상태에서 그림물감이 스며들게 하는 방법이에요. 그리고 화가 라파엘로는 당시 르네상스를 이끌던 3대 예술가로 미켈란젤로, 레오나르도 다빈치와 함께 꼽히죠.	라파엘로 아테네 학당	https://www.chosun.com/culture-life/health/2022/09/01/XYRXPZBJCNGHTDQZF5JXGOI5SM/?utm_source=naver&utm_medium=referral&utm_campaign=naver-news	2022/09/01	0	2022-09-14 22:20:54	2022-09-14 22:20:54
BK22008485	5	질문자	와 흥미롭네요. 그림 아테네 학당의 설명을 들어볼 수 있을까요?				0	2022-09-14 22:20:54	2022-09-14 22:20:54
BK22008485	6	전문가	네, 작품의 폭은 총 7m의 크기로 고대 그리스의 철학적 사고를 추앙하기 위해 그려졌고 바티칸 사도 궁전 방 가운데 교황 개인 서재에 있는데요.그리고 등장인물이 가장 화려한 작품으로 소크라테스, 피타고라스 등 철학자와 수학자들이 그려졌죠.	작품 아테네 학당	https://www.chosun.com/culture-life/health/2022/09/01/XYRXPZBJCNGHTDQZF5JXGOI5SM/?utm_source=naver&utm_medium=referral&utm_campaign=naver-news	2022/09/01	0	2022-09-14 22:20:54	2022-09-20 22:47:58
BK22008485	7	질문자	아, 이 거대한 그림에 그런 비밀이 숨겨져 있었군요. 왜 명작이라고 한지 알겠네요. 이 그림에 르네상스의 상황을 어떻게 재현해냈나요?				0	2022-09-14 22:20:54	2022-09-14 22:20:54
BK22008485	8	전문가	네, 이 작품이 계획된 시기는 1508년 1월 1일인데요. 르네상스 시대의 최전성기인 14~16세기죠. 당시 르네상스인들은 가톨릭 교회를 다니면서 동시에 고대 그리스·로마 문화를 인간의 이상으로 여겼죠. 이들에게 접근하기 위해 교회는 인문주의를 빌려 교회의 지위를 높이고자 했어요. 이 그림은 르네상스 시대 시민들에게 인문학적 가치관과 교회의 활동이 다르지 않다는 것을 보여주기 위한 하나의 장치였던거죠.	르네상스 시대와 아테네학당	https://www.insight.co.kr/news/182516	2018/10/16	0	2022-09-14 22:20:54	2022-09-14 22:20:54
BK22008485	9	질문자	아, 흥미로운 시대적 배경이 있었군요. 이 그림을 쉽게 이해하려면 르네상스 시대를 잘 알아야 할 것 같은데 혹시 알려주실 수 있나요?				0	2022-09-14 22:20:54	2022-09-14 22:20:54
BK22008485	10	전문가	네, 많은 분들이 아시다시피 르네상스는 프랑스어 태어나다라는 뜻의 naître 동사와 다시의 re를 이은 조어에요. 이탈리아어로 리나 센자와 리나스크리멘토 등으로 불렸고, 두 뜻 모두 다시 태어나다의 의미를 갖고있지요. 유럽 사람들이 항상 동경해 마지않는 그리스 로마시대는 다시 태어났죠. 인간중심의 그리스와 로마의 문화와 예술이 이탈리아에서 다시 꽃을 피웠던 시대적 맥락에서 르네상스를 이해할 수 있을 것 같습니다.	르네상스 시대	https://www.tfmedia.co.kr/news/article.html?no=131507	2022/09/10	0	2022-09-14 22:20:54	2022-09-14 22:20:54
BK22008485	11	질문자	그렇군요, 그 시대를 여행해보고 싶네요. 르네상스시대가 바람이 불면서 그림이외에 어떤 다른 매체가 있었나요?				0	2022-09-14 22:20:54	2022-09-14 22:20:54
BK22008485	12	전문가	네, 그 당시 조각은 회화를 압도했는데요. 르네상스시대는 그리스와 로마의 건축과 조각을 다른종교의 우상으로 여겼고, 폐쇄적인 중세 기독교에 새로운 바람을 불러일으켰어요. 다시 말해 이 시대에 조형예술은 재발견되었고 교황, 군주, 귀족들은 너도나도 유행처럼 자신의 집과 별장 정원에 조각공원을 지었어요.	르네상스와 조각	https://www.donga.com/news/article/all/20110608/37855426/1	2011/06/08	0	2022-09-14 22:20:54	2022-09-14 22:20:54
BK22008485	13	질문자	아, 위대한 조각가들이 있었군요. 그 위대한 조각가들 중 어떤 명인이 있을까요?				0	2022-09-14 22:20:54	2022-09-14 22:20:54
BK22008485	14	전문가	베르니니라는 뛰어난 업적을 남긴 이가 있는데 역대 교황의 총애를 받아 조각 건축 분수제작을 했어요. 그의 조각품은 탁월한 기교와 관능미 덕분에 많은 이의 사랑을 받아왔고 그의 걸작품중 프로세르피나의 겁탈, 다비드, 아폴로와 다프네 등과 같은 불멸의 작품들이 있어요. 보르게세 갤러리에 이 세 작품이 나란히 전시돼 있어요.	르네상스 조각가 명인	https://www.donga.com/news/article/all/20110608/37855426/1	2011/06/08	0	2022-09-14 22:20:54	2022-09-14 22:20:54
BK22008485	15	질문자	네, 처음 들어보는 조각가네요. 참 흥미로워요. 그렇다면 베르니니가 만든 조각의 양식은 뭔지 알 수 있을까요?				0	2022-09-14 22:20:54	2022-09-14 22:20:54
BK22008485	16	전문가	네, 극적인 상황을 최고도의 찰나로 표현하는 특징은 16세기 후반에서 17세기에 걸쳐 유행하였는데, 이를 가리켜 바로크양식이라고해요. 이 양식은 17세기에 연극이 선풍적인 인기를 누렸을 때와 관련이 있는데, 조각이 건축과 한 공간 속에 회화와 어우러져 한편의 환상적인 세계를 지어내는거죠. 연극을 무대 앞에서 보듯이 조각 또한 관객이 감상하기에 가장 이상적인 관점을 참고해 만들었고, 배우들이 연기를 하듯 금방이라도 움직일 것 처럼 역동적인 구성과 사건을 함축해 보여주죠.	조각가 베르니니	http://www.veritas-a.com/news/articleView.html?idxno=135499	2018/11/26	0	2022-09-14 22:20:54	2022-09-14 22:20:54
BK22008485	17	질문자	와, 기회가 된다면 보르게세 갤러리에 방문해 베르니니의 작품을 직접 보고싶네요. 혹시 그 갤러리에 직접 방문한다면 안내를 받을 수 있는지 아실까요?				0	2022-09-14 22:20:54	2022-09-14 22:20:54
BK22008485	18	전문가	네, 그럼요. 보르게세 미술관에서 한국어로 작품설명을 들을 수 있게 되었어요.지금까지는 이탈리아어, 영어, 프랑스어, 독일어, 스페인어 등 총 5개 언어로만 오디오 가이드 서비스를 지원해 왔구요.	로마 보르게세 미술관	https://www.yna.co.kr/view/AKR20181016153900109?input=1195m	2018/10/16	0	2022-09-14 22:20:54	2022-09-14 22:20:54
BK22008485	19	질문자	네, 정말 좋은소식이네요. 덕분에 감사합니다. 유럽여행을 하게된다면 명작에 대해 더 공부해서 감상해봐야겠어요.				0	2022-09-14 22:20:54	2022-09-14 22:20:54
BK22008485	20	전문가	네, 저도 유익한 정보를 알려주게 되어 뿌듯하네요. 그럼 안녕히 계세요!				1	2022-09-14 22:20:54	2022-09-26 16:12:49
