id	utterance_id	role	text	search_query	search_URL	reference_date	terminate	regDate	updDate
BK22006101	1	질문자	어제 친구를 만났는데, 친구가 당뇨라고 하더라고요. 당뇨가 정확히 어떤 질병인가요?				0	2022-08-21 18:40:53	2022-08-21 18:40:53
BK22006101	2	전문가	당뇨라니 걱정되시겠어요. 몸 안에 인슐린이 결핍되거나 인슐린 저항성으로 인해 음식에서 얻은 포도당을 제대로 사용하지 못해서 체내 포도당 수치가 올라가게 되는데, 이때 나타나는 다양한 문제를 당뇨라고 해요.	당뇨 정의	http://news.kmib.co.kr/article/view.asp?arcid=0923056568&code=14130000&cp=nv	2015/05/04	0	2022-08-21 18:40:53	2022-08-21 18:40:53
BK22006101	3	질문자	그렇군요, 문득 우리나라 당뇨 유병률은 얼마나 되는지 궁금해지네요.				0	2022-08-21 18:40:53	2022-08-21 18:40:53
BK22006101	4	전문가	대한 당뇨병 학회에서 당뇨병 팩트 시트 2020을 발표했는데, 우리나라 30세 이상의 당뇨병 환자는 성인 기준 7명 중 1명으로 500만 명에 달해요.	당뇨 유병률	https://jhealthmedia.joins.com/article/article_view.asp?pno=22797	2020/12/03	0	2022-08-21 18:40:53	2022-08-31 10:25:02
BK22006101	5	질문자	500만 명이라니 꽤 많은 숫자네요. 당뇨는 어떻게 진단하나요?				0	2022-08-21 18:40:53	2022-08-30 16:37:35
BK22006101	6	전문가	혈액검사를 통해 당뇨를 진단할 수 있어요. 음식을 먹지 않은 빈속으로 혈당을 검사했을 때 측정한 혈당이 데시리터당 126밀리그램 이상이거나, 포도당 섭취 후 한 검사 2시간 뒤 혈당이 데시리터당 200밀리그램 이상인 경우, 무작위 당 검사에서 데시리터당 200밀리그램이면서 혈당이 높을 때 나타나는 일반적인 증상이 있는 경우 당뇨라고 할 수 있어요.	당뇨 진단	https://www.yeongnam.com/web/view.php?key=20181120.010190809060001	2018/11/20	0	2022-08-21 18:40:53	2022-09-05 08:48:46
BK22006101	7	질문자	아하, 그러면 당뇨일 때 나타나는 일반적인 증상에는 어떤 게 있나요?				0	2022-08-21 18:40:53	2022-08-21 18:40:53
BK22006101	8	전문가	당뇨에 걸렸다고 바로 몸에 이상 신호가 나타나진 않을 수 있어요. 당뇨 초기에는 음식을 많이 먹고, 소변을 자주 보는 증상, 그리고 갈증을 자주 느끼거나 체중의 감소 등의 증상이 있으니 참고하세요.	당뇨 증상	http://www.ftimes.kr/news/articleView.html?idxno=18139	2022/06/15	0	2022-08-21 18:40:53	2022-08-21 18:40:53
BK22006101	9	질문자	다갈, 다음, 다뇨 증상을 조심해야겠네요. 당뇨가 합병증도 많다고 들어서요. 당뇨 합병증에는 어떤 것들이 있나요?				0	2022-08-21 18:40:53	2022-08-21 18:40:53
BK22006101	10	전문가	당뇨는 다양한 합병증을 초래하는데, 만성 합병증으로는 망막 병증, 신기능 장애, 신경병증 등이 있으며, 관상동맥질환이나 뇌혈관질환 같은 대혈관질환 합병증이 생길 수 있어요. 또한 급성 합병증인 당뇨병성 케톤산증과 고혈당성 고 삼투압 증후군은 빨리 치료하지 않으면 사망할 수 있어 초기 증상이 있을 경우 즉시 병원으로 가 검사를 해야 해요.	당뇨 합병증	https://www.nbntv.co.kr/news/articleView.html?idxno=698695	2020/03/14	0	2022-08-21 18:40:53	2022-08-31 10:25:02
BK22006101	11	질문자	당뇨는 합병증이 더 무섭다고 하더니 그게 정말이네요.				0	2022-08-21 18:40:53	2022-08-21 18:40:53
BK22006101	12	전문가	네, 그렇기 때문에 꾸준한 관리와 치료를 해야 하는 만성 질환이에요.				0	2022-08-21 18:40:53	2022-08-21 18:40:53
BK22006101	13	질문자	그러면 꾸준한 관리를 위해 당뇨 식단은 어떻게 하는 것이 좋은가요?				0	2022-08-21 18:40:53	2022-08-21 18:40:53
BK22006101	14	전문가	당뇨에는 채식 위주의 식단이 좋아요. 일주일에 몇 회 이상은 가금류나 고기 대신 콩, 두부 등의 식물성 단백질을 공급할 수 있는 음식을 먹는 거죠.	당뇨 식단	http://www.cancerline.co.kr/html/23107.html	2021/01/30	0	2022-08-21 18:40:53	2022-08-21 18:40:53
BK22006101	15	질문자	혹시 당뇨에 좋은 과일도 있나요? 과일은 당이 있어서 걱정이 되어서요.				0	2022-08-21 18:40:53	2022-08-21 18:40:53
BK22006101	16	전문가	네, 과일 중에 사과는 혈액 내의 인슐린을 통제하고 혈당 수치가 바뀌는 것을 예방해 줘요. 섭취량은 하루 반 개 이하가 좋습니다.	당뇨에 좋은 과일	http://theviewers.co.kr/View.aspx?No=2503969	2022/08/19	0	2022-08-21 18:40:53	2022-08-21 18:40:53
BK22006101	17	질문자	하루 반 개 이하가 좋군요, 혹시 사과 말고 당뇨에 좋은 다른 음식도 있나요?				0	2022-08-21 18:40:53	2022-08-31 10:25:02
BK22006101	18	전문가	비타민D와 단백질이 풍부하고 식이섬유가 많기 때문에 혈당이 빠르게 올라가는 것을 막아주는 보리도 당뇨에 좋아요.	당뇨에 좋은 음식	http://theviewers.co.kr/View.aspx?No=2503969	2022/08/19	0	2022-08-21 18:40:53	2022-08-21 18:40:53
BK22006101	19	질문자	친구에게 사과와 보리밥에 대해서 알려줘야겠어요. 오늘도 좋은 정보 알려주셔서 감사하고 다음에 뵐게요.				0	2022-08-21 18:40:53	2022-08-21 18:40:53
BK22006101	20	전문가	네, 건강 관리 잘하시고 다음에 뵐게요.				1	2022-08-21 18:40:53	2022-09-05 08:48:46
