id	utterance_id	role	text	search_query	search_URL	reference_date	terminate	regDate	updDate
BK22006044	1	질문자	저 요즘 계속 속이 안 좋은데 내시경을 해 봐도 다른 문제는 없다고 해서 이상하네요. 이런 걸 신경성 위염이라고 하는 걸까요?				0	2022-08-21 01:53:26	2022-08-21 01:53:26
BK22006044	2	전문가	복통을 호소하는데 내시경상으로 이상이 없다면 신경성 위염으로 진단 될 수 있어요. 기능성 소화 불량증이 원래 명칭인데, 스트레스가 많은 직장인이나 학생들에게 흔하게 나타나죠.	신경성 위염	https://www.hidoc.co.kr/healthstory/news/C0000000073	2015/03/04	0	2022-08-21 01:53:26	2022-08-21 01:53:26
BK22006044	3	질문자	진짜 저도 소화 기능이 많이 떨어진 것 같아요. 혹시 소화 불량 말고 다른 증상이 나타나기도 하나요?				0	2022-08-21 01:53:26	2022-08-21 01:53:26
BK22006044	4	전문가	가스가 차고 수시로 속이 더부룩하고 명치 끝도 아프죠. 또 변비나 설사가 동반되고 두통도 생길 수 있고, 피로하고 식욕이 없는 증상이 지속되곤 해요.	신경성 위염 증상	http://weekly.hankooki.com/news/articleView.html?idxno=6764129	2020/04/28	0	2022-08-21 01:53:26	2022-08-21 01:53:26
BK22006044	5	질문자	딱 요즘 제가 겪는 증상이랑 비슷하네요. 최근에 신경 쓸 일이 많아져서 그런 것 같아요. 그런데 어떻게 감정에 따라서 소화 기능에 장애가 생길 수도 있는 거예요?				0	2022-08-21 01:53:26	2022-08-21 01:53:26
BK22006044	6	전문가	그건 사람의 감정을 조절하는 자율 신경에 위장이 지배받아서 그래요. 슬픔이나 근심이 있으면 위장의 운동력이 떨어지고 위산 분비도 줄어들게 되죠. 자율 신경이 위를 압박하거든요. 그래서 조금만 먹어도 소화 장애가 생기는 거예요.	감정에 따른 소화 기능 장애	http://weekly.hankooki.com/news/articleView.html?idxno=6764129	2020/04/28	0	2022-08-21 01:53:26	2022-08-21 01:53:26
BK22006044	7	질문자	아, 그래서 이 신경성 위염에 스트레스가 가장 큰 원인이라고 하는 거군요. 그럼 혹시 속이 쓰린 증상도 스트레스와 관련이 있나요?				0	2022-08-21 01:53:26	2022-08-21 01:53:26
BK22006044	8	전문가	맞아요, 스트레스를 받으면 심장 같은 필수 장기의 운동 능력은 향상하지만, 생명 활동을 하는 데 급하게 필요하지 않은 다른 장기의 기능은 떨어지거든요. 속 쓰림이 심해지는 것도 위장 운동성과 위점막의 재생 능력이 떨어져서 그런 거죠.	속쓰림 스트레스	https://www.hidoc.co.kr/healthstory/news/C0000503885	2020/03/30	0	2022-08-21 01:53:26	2022-08-21 01:53:26
BK22006044	9	질문자	그렇군요. 그럼 이런 신경성 위염은 어떻게 치료를 해야 해요? 제 경험에 비춰보면 약을 먹는다고 딱히 좋아지는 것도 아니거든요.				0	2022-08-21 01:53:26	2022-08-21 01:53:26
BK22006044	10	전문가	맞아요, 신경성 위염은 치료가 쉽지 않아요. 원인을 특정하기 어려운 데다 복합적으로 여러 요소가 작용하거든요. 그래서 약물 치료는 물론이고 식이요법과 생활 습관을 개선하는 등의 노력이 필요하고, 스트레스가 원인이라면 필요에 따라서 정신과 치료가 동반될 수도 있어요.	신경성 위염 치료	https://health.chosun.com/site/data/html_dir/2022/02/14/2022021401869.html	2022/02/14	0	2022-08-21 01:53:26	2022-08-21 01:53:26
BK22006044	11	질문자	얘기를 들어보니 저는 스트레스와 과민한 성격이 제일 문제인 것 같은데, 사실 이건 바로 고치기가 쉽지 않거든요. 그럼 제일 먼저 어떤 부분을 개선해야 그나마 좀 증상이 나아질 수 있을까요?				0	2022-08-21 01:53:26	2022-08-21 01:53:26
BK22006044	12	전문가	가장 효과적인 방법은 기능성 소화장애의 원인이 되는 스트레스를 없애는 것이죠. 하지만 실제로 생활 속에서 이를 실천하기는 어려우니까, 평상시 소화에 도움이 되는 식습관을 가지는 것이 좋아요.	신경성 위염 완화 하려면	https://health.chosun.com/site/data/html_dir/2017/11/10/2017111001580.html	2017/11/10	0	2022-08-21 01:53:26	2022-08-21 01:53:26
BK22006044	13	질문자	그럼 소화에 도움이 되려면 어떤 식습관을 가져야 좋을까요?				0	2022-08-21 01:53:26	2022-08-21 01:53:26
BK22006044	14	전문가	음식은 천천히, 규칙적인 시간에 먹어야 해요. 십이지장은 소장의 첫 부분인데, 위에서 내려온 음식의 산성을 중화하는 역할을 하죠. 그런데 식사를 불규칙하고 빠르게 하게 되면 위산이 갑자기 많이 분비되어서 십이지장의 중화 기능 저하, 점막 손상, 소화불량 같은 증상이 생기는 거예요.	소화에 도움이 되는 습관	https://health.chosun.com/site/data/html_dir/2017/11/10/2017111001580.html	2017/11/10	0	2022-08-21 01:53:26	2022-08-21 01:53:26
BK22006044	15	질문자	알겠어요. 규칙적으로 천천히 먹는 연습을 해야겠네요. 그럼 반대로 신경성 위염일 때 하지 말아야 할 식습관도 있나요?				0	2022-08-21 01:53:26	2022-08-31 09:26:57
BK22006044	16	전문가	자극적인 음식은 식도 점막에 상처를 내고 속쓰림을 유발하니까, 과하게 뜨겁고 매운 음식은 피해야 해요.	신경성 위염 피해야 하는 식습관	https://health.chosun.com/site/data/html_dir/2017/11/10/2017111001580.html	2017/11/10	0	2022-08-21 01:53:26	2022-08-21 01:53:26
BK22006044	17	질문자	아, 저 평소에 스트레스받으면 매운 음식으로 풀고 그랬는데, 그게 더 악화시키는 행동이었다니, 후회되네요.				0	2022-08-21 01:53:26	2022-08-21 01:53:26
BK22006044	18	전문가	스트레스받는다고 매운 음식을 먹으면 위장을 더 괴롭히는 행동이니까 앞으로는 자제하도록 해요.				0	2022-08-21 01:53:26	2022-08-21 01:53:26
BK22006044	19	질문자	그래야겠네요. 다른 방법으로 스트레스를 풀고 식습관도 바르게 개선해야겠어요.				0	2022-08-21 01:53:26	2022-08-21 01:53:26
BK22006044	20	전문가	그래요, 꾸준히 노력해서 꼭 신경성 위염 증상이 완화되면 좋겠네요.				0	2022-08-21 01:53:26	2022-08-21 01:53:26
BK22006044	21	질문자	조언 해줘서 고마워요, 오늘 대화 저에게 꼭 필요한 내용이었어요. 다음에 볼 때는 더 건강해져서 볼 수 있게 노력해볼게요.				1	2022-08-21 01:53:26	2022-08-31 09:26:57
