id	utterance_id	role	text	search_query	search_URL	reference_date	terminate	regDate	updDate
BK22002256	1	질문자	요즘 피로가 쌓였는지 피곤해서 아침에 일어나기가 힘들어.				0	2022-08-02 12:15:06	2022-08-02 13:25:17
BK22002256	2	전문가	한번 푹 쉬어야할텐데 제대로 쉬지를 못했구나.				0	2022-08-02 12:15:06	2022-08-02 13:25:17
BK22002256	3	질문자	응. 그래서 아침 먹을 시간을 없애고 그 시간에 잠을 자려고.				0	2022-08-02 12:15:06	2022-08-02 13:25:17
BK22002256	4	전문가	흠, 나는 아무리 피곤해도 네가 아침을 먹었으면 좋겠어. 아침 식사를 하지 않으면 에너지원이 부족해서 힘차게 하루를 시작할 수가 없어. 그리고 점심식사를 해도 에너지원이 충족되지 않으니 밤 늦게 음식을 먹게 되기 쉬워. 그로 인해 속이 더부룩해지면 잠에 들기 어려워 또 개운하게 아침을 시작하지 못하니 악순환이 반복되는거지.	아침을 안먹으면	http://kormedi.com/1215944/	2015/08/19	0	2022-08-02 12:15:06	2022-08-02 13:25:17
BK22002256	5	질문자	어쩐지 자꾸 저녁에 뭘 먹게 되더라고. 그리고 속이 더부룩하고 무거우니까 잠에 들기도 불편하기도 했어. 그리고 전날 밤에 뭔가를 먹고 자면 다음 날에 유난히 더 배고프던데, 신체의 자연스러운 현상인가?				0	2022-08-02 12:15:06	2022-08-02 13:25:17
BK22002256	6	전문가	식욕촉진호르몬 때문에 그런거야. 만약 전날 밤이나 저녁에 식사를 하고 아침밥을 걸렀어. 그 후에 바로 점심이나 저녁을 먹으면 식욕 촉진 호르몬이 발산되어 과식이나 폭식을 하기 쉬워져. 그렇기 때문에 아침을 거르면 체중이 늘기 쉬워지게 돼.	아침 거르기 단점	https://health.chosun.com/site/data/html_dir/2022/05/03/2022050302105.html	2022/05/07	0	2022-08-02 12:15:06	2022-08-02 13:25:17
BK22002256	7	질문자	식욕 촉진 호르몬이라는게 있어? 이름만 들어도 체중이 마구 증가할 것 같아.				0	2022-08-02 12:15:06	2022-08-02 13:25:17
BK22002256	8	전문가	우리 몸의 음식 섭취가 충분하지 않으면 뇌는 영양분이 필요하다는 사인을 보내. 특히 그렐린이란 호르몬은 식욕을 촉진하는 호르몬인데 뇌 시상하부의 식욕 중추를 자극을 해. 그러면 시상하부에선 NPY라는 식욕 촉진 화학물질을 방출해서 계속 공복감을 느끼게하고 평소에 좋아하던 음식을 떠올리게 해.	식욕 촉진 호르몬	https://health.chosun.com/site/data/html_dir/2022/02/10/2022021002302.html	2022/02/13	0	2022-08-02 12:15:06	2022-08-02 13:25:17
BK22002256	9	질문자	정말? 그런데 나는 아침을 안먹으니까 살이 좀 빠지는 것 같던데.				0	2022-08-02 12:15:06	2022-08-02 13:25:17
BK22002256	10	전문가	오하이오 주립대의 연구를 보면 아침을 거르면 당분간은 살이 빠지는 경향을 보이지만 시간이 지나면 원래 체중으로 돌아와. 그런데 문제는 체중이 다시 늘면서 복부에 지방이 집중이 돼.	아침 거르기 체중	http://kormedi.com/1224440/	2017/08/26	0	2022-08-02 12:15:06	2022-08-02 13:25:17
BK22002256	11	질문자	복부에 집중이 되면 안좋은거야?				0	2022-08-02 12:15:06	2022-08-02 13:25:17
BK22002256	12	전문가	물론이지. 복부 지방으로 인해서 몸의 무게 중심이 앞으로 쏠리면 척추도 함께 앞으로 쏠려. 그러면 요추전만증이라고 척추가 앞으로 휘어지는 일이 생길 수도 있어. 그리고 척추에 무게가 더 실리면서 디스크를 손상시켜 통증을 유발하고 허리디스크도 생길 수 있으니 조심해야해.	복부비만 건강	https://www.sedaily.com/NewsView/268FW21U4O	2022/07/08	0	2022-08-02 12:15:06	2022-08-02 13:25:17
BK22002256	13	질문자	디스크 뿐만 아니라 건강에도 안좋을 것 같네.				0	2022-08-02 12:15:06	2022-08-02 13:25:17
BK22002256	14	전문가	맞아. 대한가정의학지에 소개된 연구를 보면 아무리 건강해도 아침을 자주 거르면 공복 혈당장애가 생길 가능성이 1.3배 높아진다고 나와있어.	아침 거르기 혈당 장애	http://www.realfoods.co.kr/view.php?ud=20220311000085	2022/03/11	0	2022-08-02 12:15:06	2022-08-02 13:25:17
BK22002256	15	질문자	이정도면 아침을 거르는건 너무 나쁜 행동 같은데.				0	2022-08-02 12:15:06	2022-08-02 13:25:17
BK22002256	16	전문가	그런데 아침을 거르는데도 어느정도 장점은 있어. 단식을 하면 손상된 세포가 회복되는 현상이 나타나거든. 그래서 끼니를 거르는 횟수가 누적되면 몸의 염증 수치가 떨어지게 되는거야. 간헐적 단식이라고 들어봤지? 간헐적 단식이 건강에 좋다는 이야기를 하는 사람들이 이런 원리를 가져와서 주장을 펼치는거야.	간헐적 단식	http://kormedi.com/1219018/	2016/05/30	0	2022-08-02 12:15:06	2022-08-02 13:25:17
BK22002256	17	질문자	어느 정도의 장점은 있구나. 그러면 나도 한번씩 단식을 해봐야겠네.				0	2022-08-02 12:15:06	2022-08-02 13:25:17
BK22002256	18	전문가	대신 식사를 하지 않을 땐 계획적으로 해야해. 계획이 없이 단식을 하게되면 영양결핍으로 이어져서 신체상, 정신건강상의 문제가 생길 수 있어. 만약 규칙적으로 아침을 거르고자 한다면 공인된 영양전문가와 상담을 통해서 올바르게 단식을 하는 것이 좋아. 상황이 여의치 않다면 본인의 식습관을 점검하고 내가 어떤 영양분을 얼마나 섭취하고 있는지, 부족한 점은 없는지 잘 확인할 수 있어야해.	단식 영양소 결핍	http://kormedi.com/1224440/	2017/08/26	0	2022-08-02 12:15:06	2022-08-02 13:25:17
BK22002256	19	질문자	생각해보면 영양전문가와 상담하는게 옳은 것 같아. 내 건강을 담보로 하는 행동인데 안전하게 하는게 좋지.				0	2022-08-02 12:15:06	2022-08-02 13:25:17
BK22002256	20	전문가	맞아. 함부로 단식을 하는건 잠깐은 몰라도 장기적으로 보면 안좋은 영향을 끼칠 수 있어.				0	2022-08-02 12:15:06	2022-08-02 13:25:17
BK22002256	21	질문자	덕분에 무모하게 단식을 하는 시도는 안할 것 같아. 정말 고마워. 나는 그럼 내 식습관을 좀 돌아보러 갈게.				1	2022-08-02 12:15:06	2022-08-02 14:31:48
