id	utterance_id	role	text	search_query	search_URL	reference_date	terminate	regDate	updDate
BK22006032	1	질문자	지난주에 휴가를 바다로 갔다 온 뒤로 피부가 붉어져서 큰일이에요. 이럴 때 알로에를 피부에 붙이면 진정 효과가 있어서 좋다는데 사실인가요?				0	2022-08-21 00:31:34	2022-08-21 01:30:05
BK22006032	2	전문가	그러시군요, 알로에는 99.5퍼센트가 수분으로 이뤄져있어 피부 진정과 수분 공급에 좋아요. 저도 얼마 전에 햇빛에 오랜 시간 있었더니, 피부가 간지럽고 붉어져서 알로에를 팩처럼 붙였더니 금세 가라앉더라고요.	알로에 수분	https://health.chosun.com/site/data/html_dir/2021/08/24/2021082401939.html	2021/08/25	0	2022-08-21 00:31:34	2022-08-30 16:30:16
BK22006032	3	질문자	효과가 좋은가 보네요. 그런데 혹시라도 알로에가 피부에 맞지 않을까봐요.				0	2022-08-21 00:31:34	2022-08-21 01:30:05
BK22006032	4	전문가	그럼 알로에를 손등이나 귓불에 약간 바른 후에 발진이 생기는지 확인 해보세요. 그러고 나서 괜찮으면 사용하시고요.	알로에 알레르기	https://www.news1.kr/articles/?3686710	2019/08/03	0	2022-08-21 00:31:34	2022-08-21 01:30:05
BK22006032	5	질문자	그렇게 해봐야겠어요, 그런데 알로에가 피부 건강에 좋다는 게 실제로 인정된 건가요?				0	2022-08-21 00:31:34	2022-08-21 01:30:05
BK22006032	6	전문가	네, 식약처에서 알로에를 공식적으로 인정해 피부 건강과 장 건강, 면역력 증진 및 배변활동에 효과가 있다는 내용을 알로에 제품에 표기할 수 있도록 허가했답니다.	알로에 식약처	http://news.heraldcorp.com/view.php?ud=20170823000237	2017/08/23	0	2022-08-21 00:31:34	2022-08-21 01:30:05
BK22006032	7	질문자	그럼 더 신뢰가 가는군요. 그런데 말씀하신 내용에는 피부 미용 외에 다른 효능도 있었네요? 알로에가 면역력에 도움이 되는 이유가 궁금하네요.				0	2022-08-21 00:31:34	2022-08-21 01:30:05
BK22006032	8	전문가	그 이유는 알로에에 많이 들어있는 다당류 때문이에요. 이 성분이 면역력을 높이는 대식세포를 활성화시켜 면역 균형을 유지하고, 몸속에 침입한 바이러스 등의 유해 물질들을 신속하게 알아차린답니다.	알로에 면역	https://www.mk.co.kr/news/society/view/2021/01/77765/	2021/01/25	0	2022-08-21 00:31:34	2022-08-21 01:30:05
BK22006032	9	질문자	그런 효능이 있다니 놀랍네요. 그럼 배변 활동에 좋은 건 어떤 이유인가요?				0	2022-08-21 00:31:34	2022-08-21 01:30:05
BK22006032	10	전문가	알로에에 알로인 성분이 풍부하거든요. 알로인은 대변을 묽게 해 몸 안의 독소를 배출하고 변비 개선에 도움을 준답니다.	알로에 변비	https://health.chosun.com/site/data/html_dir/2021/08/24/2021082401939.html	2021/08/25	0	2022-08-21 00:31:34	2022-08-21 01:30:05
BK22006032	11	질문자	그렇군요, 그런데 여지껏 알로에는 바르는 것만 생각했지 섭취는 어떻게 하는지 모르겠네요.				0	2022-08-21 00:31:34	2022-08-21 01:30:05
BK22006032	12	전문가	그러시군요, 보통 팩이나 수딩젤 같은 뷰티 제품으로도 접하긴 하죠. 그런 방법도 있지만 알로에는 직접 먹을 수 있고, 간단하게 주스나 젤리로도 즐길 수 있어요.	알로에 섭취	http://www.mkhealth.co.kr/news/articleView.html?idxno=58823	2022/07/19	0	2022-08-21 00:31:34	2022-08-21 01:30:05
BK22006032	13	질문자	생각해 보니 알로에 음료를 마셔본 적이 있네요. 혹시 알로에는 어떤 형태로 섭취할 때 가장 효과가 큰지 아시나요?				0	2022-08-21 00:31:34	2022-08-29 16:58:12
BK22006032	14	전문가	네, 알로에는 고분자 다당체가 많이 함유되어 있어 생알로에로 섭취해야 효과가 극대화된답니다.	생알로에	https://www.hankookilbo.com/News/Read/A202006291737000052?did=NA	2020/06/29	0	2022-08-21 00:31:34	2022-08-30 16:30:16
BK22006032	15	질문자	그렇군요, 참고할게요. 마지막으로 알로에의 적정한 섭취 용량이 있는지 궁금해요. 한 번에 많이 먹어도 그렇게 나쁠 거 같지 않은데 그래도 알아두면 좋을 거 같아서요.				0	2022-08-21 00:31:34	2022-08-29 15:40:22
BK22006032	16	전문가	알로에 겔을 기준으로 말씀드리자면, 하루 25그램 이상 섭취는 지양하세요. 과하게 드시면 구토나 복통, 설사 등의 부작용이 발생할 수 있으니 주의하시고요.	알로에 부작용	https://www.news1.kr/articles/?3686710	2019/08/03	0	2022-08-21 00:31:34	2022-08-30 16:30:16
BK22006032	17	질문자	25그램을 넘지 않게 섭취할게요. 오늘 덕분에 새로운 정보를 많이 알게 되었네요.				0	2022-08-21 00:31:34	2022-08-21 01:30:05
BK22006032	18	전문가	다른 궁금한 건 없으신가요?				1	2022-08-21 00:31:34	2022-08-30 16:30:16
BK22006032	19	질문자	네, 도움 주셔서 너무 감사합니다. 오늘 즐거운 시간이었어요.				0	2022-08-21 00:31:34	2022-08-21 01:30:05
BK22006032	20	전문가	저도 즐거웠어요, 다음에 또 대화 나눠요.				0	2022-08-21 00:31:34	2022-08-21 01:30:05
