id	utterance_id	role	text	search_query	search_URL	reference_date	terminate	regDate	updDate
BK22001004	1	질문자	밤마다 잠을 못 자서 피곤하고 너무 힘들어.				0	2022-07-20 16:12:25	2022-08-02 12:01:32
BK22001004	2	전문가	요즘 스트레스 받는 일도 많고 업무가 많아 집에 와서도 늦게까지 컴퓨터 앞에서 일하니 잠자는 것이 힘들지.	불면증원인	https://www.jejutwn.com/news/article.html?no=137374	2022/06/21	0	2022-07-20 16:12:25	2022-07-21 10:12:58
BK22001004	3	질문자	잠 못 잔 지 2주 정도 되었는데 불면증인가?				0	2022-07-20 16:12:25	2022-08-02 12:01:32
BK22001004	4	전문가	잘 수 있는 조건과 환경이 되었는데도 잠을 이루지 못하는 것을 불면증이라고 하는데, 잠을 자지 못한 것이 2주 정도 되었다면 단기 불면증이야.	불면증	http://www.samsunghospital.com/home/healthInfo/content/contenView.do?CONT_SRC_ID=09a4727a8000f254&CONT_SRC=CMS&CONT_ID=1846&CONT_CLS_CD=001020001001	2014/02/05	0	2022-07-20 16:12:25	2022-07-21 10:12:58
BK22001004	5	질문자	어떻게 해야 잠을 잘 수 있을까? 자려고 누워서 계속 자야 한다고 생각하는 데 잠을 못 자겠어.				0	2022-07-20 16:12:26	2022-08-02 12:01:32
BK22001004	6	전문가	불면증은 근심, 걱정 때문에 더 잠자기 힘든 거야. 잠을 못 잔다고, 자야 한다고 의식하면 더 잠을 자기 힘들어져.	불면증 극복	https://health.chosun.com/site/data/html_dir/2019/07/24/2019072402097.html	2019/07/25	0	2022-07-20 16:12:26	2022-07-21 10:12:58
BK22001004	7	질문자	잠을 자야겠다는 생각을 하지 않도록 해야 한다는 거지? 근데 너무 고통스러운데 약을 먹을까?				0	2022-07-20 16:12:26	2022-08-02 12:01:32
BK22001004	8	전문가	불면증 치료는 약물치료와 비약물 치료 두 가지 방법이 있는데, 비약물 치료인 수면패턴과 생활패턴을 점검하는 비약물 치료 부터 해보자.	불면증 약물	https://kormedi.com/1400285/%eb%b6%88%eb%a9%b4%ec%a6%9d-%ea%b7%b9%eb%b3%b5-%eb%87%8c%ea%b0%80-%ec%b2%9c%ec%b2%9c%ed%9e%88-%eb%8a%99%eb%8a%94-%ec%97%b4%ec%87%a0/	2022/05/26	0	2022-07-20 16:12:26	2022-07-21 10:12:58
BK22001004	9	질문자	그래. 약부터 먹는 것보다는 생활패턴에 문제가 무엇인지 찾아서 바꿔볼게.				0	2022-07-20 16:12:26	2022-08-02 12:01:32
BK22001004	10	전문가	일단, 늦게까지 일하다가 자는 것부터 바꿔야 해. 적어도 잠자기 1시간에서 2시간 전에는 업무를 끝내고 스트레스 받는 일을 하지 않도록 하는 거지.	불면증 극복	https://www.hellot.net/news/article.html?no=64345	2021/12/20	0	2022-07-20 16:12:26	2022-07-21 10:12:59
BK22001004	11	질문자	알았어. 되도록 자기 한 시간 전까지는 일을 끝내도록 할게.				0	2022-07-20 16:12:26	2022-08-02 12:01:32
BK22001004	12	전문가	그리고, 자려고 누웠는데 잠이 오지 않아 힘들 때에는 계속 침대에 있기보다는 침대에서 나와서 독서를 하거나 음악을 듣는 것이 더 좋아.	불면증 치료	https://www.yakup.com/news/index.html?mode=view&cat=13&nid=267591	2022/03/28	0	2022-07-20 16:12:26	2022-07-21 10:12:59
BK22001004	13	질문자	자기 전에 읽기 좋은 책이나 음악을 준비해 놓아야겠네.				0	2022-07-20 16:12:26	2022-08-02 12:01:32
BK22001004	14	전문가	밤에 방 창문으로 차 불빛이 들어오잖아. 인공 불빛은 빛 공해고, 잠을 자는데 방해가 되니 암막 커튼을 꼭 치도록 하고.	빛 공해 불면증	https://news.jtbc.joins.com/article/article.aspx?news_id=NB11578768	2018/01/21	0	2022-07-20 16:12:26	2022-07-21 10:12:59
BK22001004	15	질문자	맞아. 잠이 들려고 하면 차 불빛 때문에 깬 적이 제법 있어. 혹시 잠을 잘 오게 하는 음식도 있을까?				0	2022-07-20 16:12:26	2022-08-02 12:01:32
BK22001004	16	전문가	상추의 쓴맛을 내는 성분인 락투카리움은 진정, 최면 효과가 있어 신경을 안정시키고, 깻잎은 수면을 돕는 칼슘이 풍부한 식품이니 도움이 되니 먹어 봐.	불면증 식품	https://health.chosun.com/site/data/html_dir/2022/06/13/2022061301314.html	2022/06/13	0	2022-07-20 16:12:26	2022-07-21 10:12:59
BK22001004	17	질문자	저녁에는 상추와 깻잎을 많이 먹어야겠네. 자기 전에 마시면 좋은 음료도 있으면 추천해 줘.				0	2022-07-20 16:12:26	2022-08-02 12:01:32
BK22001004	18	전문가	불면증을 감소시키는 아피게닌이 들어 있는 캐모마일차나, 따뜻한 우유 한 잔은 긴장을 완화해서 숙면에 도움이 되니 자기 전에 마셔 봐.	불면증에 좋은 음료	http://www.thekpm.com/news/articleView.html?idxno=100831	2021/10/07	0	2022-07-20 16:12:26	2022-07-21 10:12:59
BK22001004	19	질문자	자기 전에 따뜻한 차 한 잔이 도움이 되겠어.				0	2022-07-20 16:12:26	2022-08-02 12:01:32
BK22001004	20	전문가	불면증을 극복하기 위해서는 스트레스를 줄이는 것이 제일 중요해.				0	2022-07-20 16:12:26	2022-07-21 10:12:59
BK22001004	21	질문자	잠을 못 자는 것이 이렇게 괴로울 줄 몰랐어. 알려준 방법으로 노력해 볼게.				0	2022-07-20 16:12:26	2022-08-02 12:01:32
BK22001004	22	전문가	꼭 극복해서 편안하게 자길 빌어.				1	2022-07-20 16:12:26	2022-07-21 15:23:21
