id	utterance_id	role	text	search_query	search_URL	reference_date	terminate	regDate	updDate
BK22004907	1	질문자	저희 애가 요새 밥을 통 먹지 않아서 걱정이에요.				0	2022-08-07 11:42:25	2022-08-07 11:42:25
BK22004907	2	전문가	아, 전부터 아이가 편식이 좀 심하다고 하셨죠.				0	2022-08-07 11:42:25	2022-08-07 11:42:25
BK22004907	3	질문자	네, 근데 요즘 들어서는 편식 수준이 아니라 아예 음식을 먹지 않아요. 혹시 섭식장애는 아닐까 걱정이 되는데요. 이렇게 어린 나이부터 섭식장애가 나타날 수도 있나요?				0	2022-08-07 11:42:25	2022-08-07 11:42:25
BK22004907	4	전문가	연구에 따르면 섭식장애는 이르면 9살부터 나타나니까 있을 수 있는 일이죠. 남자아이가 섭식장애를 앓을 가능성은 여자아이 못지 않게 높다는 연구 결과도 있구요.	섭식장애	https://www.yna.co.kr/view/AKR20220804029100009?input=1195m	2022/08/04	0	2022-08-07 11:42:25	2022-08-07 11:42:25
BK22004907	5	질문자	그렇군요. 제가 혹시 너무 간섭하는 건 아닌가 싶어서 지금까지는 개입하기가 망설여졌거든요. 아이의 식습관에 제가 개입하는 게 좋을까요?				0	2022-08-07 11:42:25	2022-08-07 11:42:25
BK22004907	6	전문가	아무래도 그렇죠. 편식 등 안 좋은 식습관을 지닌 아이는 저러다 나아지겠지 생각하기보다는, 쭉 관찰하면서 습관을 고치도록 유도하는 게 좋아요. 식습관이 나쁜 성인도 섭식장애로 이어지는데, 애들은 더하거든요.	섭식장애 청소년	https://kormedi.com/1412334/%ec%82%b4%ec%b0%94%ea%b9%8c%eb%b4%90-%ea%b2%81%eb%82%98-%ec%95%84%eb%8f%99%c2%b7%ec%b2%ad%ec%86%8c%eb%85%84-%ec%84%ad%ec%8b%9d%ec%9e%a5%ec%95%a0%ec%97%90-%ec%b7%a8%ec%95%bd/	2022/08/05	0	2022-08-07 11:42:25	2022-08-07 11:42:25
BK22004907	7	질문자	제가 얼른 뭔가 하는 게 좋겠네요. 그런데 제가 아직 아이 마음을 잘 이해를 못하는 것 같아요. 섭식장애가 있는 사람들은 어떤 마음으로 음식을 안 먹는 건가요?				0	2022-08-07 11:42:25	2022-08-07 11:42:25
BK22004907	8	전문가	섭식장애를 앓고 있는 환자는 거식증, 폭식증 가릴 것 없이 공통적으로 왜곡된 신체상을 가지고 있고, 자기 몸에 대해서 불만이 있다는 특징이 있어요. 그래서 체중조절을 해야겠다는 강박관념을 가지게 되고, 식습관이 점점 이상해지는 거죠.	섭식장애 치료	https://health.chosun.com/site/data/html_dir/2021/08/27/2021082701674.html	2021/08/30	0	2022-08-07 11:42:25	2022-08-07 11:42:25
BK22004907	9	질문자	맞아요, 가끔 아이한테 넌지시 물어보면 자기가 너무 뚱뚱하다고 생각한다고 하더라고요. 섭식장애를 없애려면 어떻게 해야 해요?				0	2022-08-07 11:42:25	2022-08-07 11:42:25
BK22004907	10	전문가	섭식장애를 극복하기 위해서는, 다이어트 강박에서 벗어나는 게 일순위 과제죠. 정신과에 가서 상담치료를 통해 환자가 체중이나 체형에 대해 가지고 있는 왜곡된 생각을 교정해야 해요.	섭식장애 왜곡	https://health.chosun.com/site/data/html_dir/2017/06/22/2017062202523.html	2017/06/23	0	2022-08-07 11:42:25	2022-08-07 11:42:25
BK22004907	11	질문자	아이가 아직 어린데 병원에 가야 한다니 마음이 아프네요. 저는 한번도 체중에 대한 말을 한 적이 없는데, 애가 왜 다이어트 강박을 가지게 됐는지 모르겠어요. 요새 마른 것을 좋아하는 사회적 분위기 때문일까요?				0	2022-08-07 11:42:25	2022-08-07 11:42:25
BK22004907	12	전문가	네, 섭식장애는 사회적인 요인 때문에 발생하기도 하고, 대뇌에서 세로토닌을 제대로 분비하지 않아서 발생하기도 하지만, 보통 전자의 원인이 커요. 환자 본인의 성격이 강박적으로 통제하려는 성향이 있거나, 자존감이 낮거나, 과도하게 완벽주의를 추구하는 경우에도 섭식장애가 발생하지요.	섭식장애 상담치료	https://www.gokorea.kr/news/articleView.html?idxno=59544	2018/12/03	0	2022-08-07 11:42:25	2022-08-07 11:42:25
BK22004907	13	질문자	아, 아이가 조금 완벽주의적인 성향이 있긴 한데요. 사실 장점이라고 생각했는데, 완벽주의랑 섭식장애가 연관이 있나요?				0	2022-08-07 11:42:25	2022-08-07 11:42:25
BK22004907	14	전문가	네, 현대에는 완벽주의 성향이 섭식장애를 비롯해서 우울증, 불안 같은 정신 문제를 일으키는 원인 중 하나라고 보고 있어요. 완벽주의자들은 실패를 굉장히 두려워하는 경향이 있고, 항상 실패할 경우를 대비해서 다음 대책까지도 같이 시도를 하기 때문에 스트레스를 받거나 번아웃이 올 가능성이 크거든요.	섭식장애 완벽주의	https://www.hidoc.co.kr/healthstory/news/C0000672831	2022/02/22	0	2022-08-07 11:42:25	2022-08-07 11:42:25
BK22004907	15	질문자	그렇군요, 아이에게 완벽하지 않아도 된다고 잘 말해줘야겠어요. 그런데 아까 상담 치료를 해야 한다고 하셨는데, 상담은 반드시 필수적일까요? 아무래도 요새 아이가 학교며 학원이며 시간이 별로 없어서, 그냥 앞으로 식사만 거르지 않게 하면 어떤가 싶어서요.				0	2022-08-07 11:42:25	2022-08-07 11:42:25
BK22004907	16	전문가	상담이 필요하죠. 물론 잘 먹고 체중을 회복하는 것이 거식증과 폭식증 극복에 있어 가장 중요한 요소지만, 상담은 정신적 어려움을 극복하는 데 도움이 되거든요. 환자가 체중에 완전히 관심을 끊게 하는 것까지는 어렵겠지만 덜 신경 쓰게 하는 게 목적이에요. 체중에 대한 생각이 행동을 좌지우지하거나 생활을 망치는 일이 발생하지 않도록 하는 게 매우 중요하죠.	섭식장애 완벽한	https://www.seoul.co.kr/news/newsView.php?id=20160516022001	2016/05/16	0	2022-08-07 11:42:25	2022-08-07 11:42:25
BK22004907	17	질문자	알겠어요, 상담 치료를 알아볼게요. 섭식 장애는 몇 주 정도면 완치가 될까요? 다음 달에는 아이 중간고사가 있어서요.				0	2022-08-07 11:42:25	2022-08-07 11:42:25
BK22004907	18	전문가	섭식 장애 치료를 그렇게 조급하게 바라보시면 안 돼요. 당장 내일 낫는 게 목표가 아니고, 3개월이나 1년 후처럼 먼 미래를 생각하면서 치료에 접근해야 해요.	섭식장애 완치	https://www.hankookilbo.com/News/Read/A2022051410410002404?did=NA	2022/05/15	0	2022-08-07 11:42:25	2022-08-23 11:27:12
BK22004907	19	질문자	아, 제가 또 너무 조급하게 마음을 먹었네요. 말씀 잘 새겨듣겠습니다. 저는 이제 슬슬 아이 데리러 갈 시간이 되어서 이만 가볼게요.				0	2022-08-07 11:42:25	2022-08-07 11:42:25
BK22004907	20	전문가	네, 혹시 섭식장애에 대해서 궁금한 점 있으면 언제든지 물어보시고, 조심히 들어가세요.				1	2022-08-07 11:42:25	2022-08-23 11:27:12
