id	utterance_id	role	text	search_query	search_URL	reference_date	terminate	regDate	updDate
BK22001486	1	질문자	올 여름 휴가로 유럽에 가려고 했는데 원숭이두창 때문에 걱정이야.				0	2022-07-20 16:16:45	2022-08-02 12:01:32
BK22001486	2	전문가	그러게. 요즘에 유럽이랑 미국에서 원숭이두창 많이 걸린다고 하더라.				0	2022-07-20 16:16:45	2022-07-21 10:33:33
BK22001486	3	질문자	원숭이두창은 이번에 처음 들어봤어. 도대체 어떻게 하면 걸리는 거야?				0	2022-07-20 16:16:45	2022-08-02 12:01:32
BK22001486	4	전문가	이미 감염된 동물이나 사람의 체액, 혈액, 피부, 점막과 맞닿거나 감염된 사람의 체액이나 피가 묻은 물품, 옷, 침구류와 간접적으로 닿으면 퍼지게 돼.	원숭이 두창 감염원인	https://n.news.naver.com/article/417/0000826181?sid=101	2022/06/26	0	2022-07-20 16:16:45	2022-07-21 10:33:33
BK22001486	5	질문자	아니, 누가 감염되었는지 알 수 없는 경우도 있을 텐데 예방법은 없는 건가?				0	2022-07-20 16:16:45	2022-08-02 12:01:32
BK22001486	6	전문가	음, 우선 원숭이두창 발생 지역 방문을 안 하는 게 좋지. 어쩔 수 없이 가게 된다면 남의 피나 체액, 피부에 직접 접촉하지 않도록 신경 써야 해. 그리고 물건으로도 감염될 가능성이 있으니 손을 비누로 잘 씻고 알코올 소독제로 수시로 소독해 줘야 해.	원숭이 두창 예방법	https://n.news.naver.com/article/011/0004069230?sid=103	2022/06/26	0	2022-07-20 16:16:45	2022-07-21 10:33:33
BK22001486	7	질문자	수시로 손 소독을 했는데도 코로나에 걸리는 사람들이 많았잖아. 원숭이두창 백신이 있다면 백신을 맞고 싶어.				0	2022-07-20 16:16:45	2022-08-02 12:01:32
BK22001486	8	전문가	5월부터 유럽과 미국을 중심으로 원숭이두창이 퍼지기 시작했잖아. 우리나라에서도 해외 상황을 지켜보면서 3세대 백신을 도입하기 위해 협의 중이야.	원숭이 두창 백신	https://www.dailian.co.kr/news/view/1126647/?sc=Naver	2022/06/27	0	2022-07-20 16:16:45	2022-07-21 10:33:33
BK22001486	9	질문자	얼른 백신을 맞을 수 있으면 좋겠어. 으, 생각하기도 싫지만 만약에 원숭이두창 걸리면 치료는 어떻게 하는 거야?				0	2022-07-20 16:16:45	2022-08-02 12:01:32
BK22001486	10	전문가	대부분 대증적 치료를 하는데 감염 정도가 심하다면 두창 치료에 쓰이는 항바이러스제나 면역글로불린을 써서 치료해.	원숭이 두창 치료법	https://www.pharmnews.com/news/articleView.html?idxno=206126	2022/06/27	0	2022-07-20 16:16:45	2022-07-21 10:33:33
BK22001486	11	질문자	그렇구나. 인터넷으로 사진 보니까 원숭이두창 감염 증상이 수두랑 비슷한 거 같아.				0	2022-07-20 16:16:45	2022-08-02 12:01:32
BK22001486	12	전문가	음, 비슷한 듯 다른 점들이 있어. 원숭이두창에서는 림프절 비대를 잘 관찰할 수 있는데 수두에서는 림프절 비대가 흔한 증상은 아니야. 또 원숭이두창에서는 손발바닥의 피부 병변이 75퍼센트 환자에서 발견될 정도이지만 수두는 손발바닥 피부 병변이 흔하진 않아.	원숭이 두창 수두 차이	https://www.yna.co.kr/view/AKR20220624093100017?input=1195m	2022/06/24	0	2022-07-20 16:16:45	2022-07-21 10:33:33
BK22001486	13	질문자	물어보는 걸 이렇게 척척 다 대답해주니 걸어 다니는 백과사전 같아.				0	2022-07-20 16:16:45	2022-08-02 12:01:32
BK22001486	14	전문가	사실 우리 누나가 미국에 살거든. 원숭이두창 걱정돼서 나도 많이 찾아봤지.				0	2022-07-20 16:16:45	2022-07-21 10:33:33
BK22001486	15	질문자	그렇구나, 코로나는 전파력이 엄청나게 셌잖아. 원숭이두창도 그렇게 전파될까봐 걱정돼.				0	2022-07-20 16:16:45	2022-08-02 12:01:32
BK22001486	16	전문가	코로나 전파력이 무시무시하긴 했지. 근데 원숭이두창 전파력은 코로나19 때만큼 강하지 않아.	원숭이 두창 전파력	https://www.newspim.com/news/view/20220626000001	2022/06/26	0	2022-07-20 16:16:45	2022-07-21 10:33:33
BK22001486	17	질문자	그 말 들으니 뭔가 안심된다. 근데 원숭이두창도 코로나처럼 비상사태가 선포되고 그런 건가?				0	2022-07-20 16:16:45	2022-08-02 12:01:32
BK22001486	18	전문가	세계보건기구인 WHO가 원숭이두창을 국제적 공중보건 비상사태로 선포하지는 않기로 했어.	원숭이 두창 비상사태	https://n.news.naver.com/article/052/0001756190?sid=104	2022/06/26	0	2022-07-20 16:16:45	2022-07-21 10:33:33
BK22001486	19	질문자	휴, 아직 코로나도 안 끝났는데 또 다른 질병으로 비상사태가 선포될까봐 겁났는데. 그런데 WHO가 비상사태를 선포하는 기준은 뭐야? 뭔가 이유가 있는 거겠지?				0	2022-07-20 16:16:45	2022-08-02 12:01:32
BK22001486	20	전문가	응, 원숭이두창 때문에 입원해야 할 수준의 환자가 적었고 원숭이두창으로 죽은 환자가 오직 한 명뿐이라는 이유가 크게 작용했어. 또한 원숭이두창의 기초 감염 재생산지수는 0.8로 1을 넘지 않거든.	WHO 비상사태 기준	https://n.news.naver.com/article/014/0004857831?sid=103	2022/06/27	0	2022-07-20 16:16:45	2022-07-21 10:33:33
BK22001486	21	질문자	알기 쉽게 설명해 주니 이해하기가 쉬워서 좋네. 고마워 정말.				0	2022-07-20 16:16:45	2022-08-02 12:01:32
BK22001486	22	전문가	응, 원숭이두창 너무 걱정하지 말고 차근차근 여행 준비 잘 해.				1	2022-07-20 16:16:45	2022-07-22 11:15:43
