id	utterance_id	role	text	search_query	search_URL	reference_date	terminate	regDate	updDate
BK22005568	1	질문자	요새 체력이 떨어졌는지 오후만 되면 피곤함이 몰려와요. 비타민을 좀 먹어볼까 싶은데 무작정 먹으면 안될 것 같아서 좀 알아보고 먹으려고 해요. 비타민이 몸에서 무슨 기능을 하는거예요?				0	2022-08-19 23:27:08	2022-08-19 23:27:08
BK22005568	2	전문가	비타민이 하는 일은, 우리 체내에서 원활한 물질의 대사를 돕는 역할이예요. 그리고, 영양소들이 제대로 쓰일 수 있도록 하는 효소의 역할도 돕죠.	비타민 기능	https://ko.wikipedia.org/wiki/%EB%B9%84%ED%83%80%EB%AF%BC	2022/06/30	0	2022-08-19 23:27:08	2022-08-19 23:27:08
BK22005568	3	질문자	그럼 물질 대사나 효소를 돕는 중요한 역할인데 음식을 통해 섭취해야 하는 거예요? 우리 몸에서 만들 순 없나요?				0	2022-08-19 23:27:08	2022-08-19 23:27:08
BK22005568	4	전문가	비타민이 생명체의 삶에 중요한 역할을 하는 분자이지만 스스로 합성하는 것이 어렵기 때문에 음식을 통해 섭취해야 하는 거예요. 많은 양을 필요로 하진 않지만요.	비타민 섭취	https://ko.wikipedia.org/wiki/%EB%B9%84%ED%83%80%EB%AF%BC	2022/06/30	0	2022-08-19 23:27:08	2022-08-19 23:27:08
BK22005568	5	질문자	스스로 합성하는 것이 어렵기 때문에 우리가 따로 섭취를 해야 하는 것이군요. 사람은 음식을 통해 비타민을 섭취하지만 동물들은 따로 비타민을 먹지 않아도 큰 문제가 없잖아요. 왜 그런거예요?				0	2022-08-19 23:27:08	2022-08-19 23:27:08
BK22005568	6	전문가	아, 동물은 몸 속에서 스스로 합성할 수 있거든요. 예를 들면 비타민 C는 인간에게 있어선 비타민이잖아요, 그렇지만 토끼나 쥐같은 대다수 동물들에겐 호르몬이죠.	동물 비타민	https://ko.wikipedia.org/wiki/%EB%B9%84%ED%83%80%EB%AF%BC	2022/06/30	0	2022-08-19 23:27:08	2022-08-19 23:27:08
BK22005568	7	질문자	그럼 동물은 비타민 C가 호르몬이라는 말이네요. 그럼 호르몬과 비타민은 무슨 차이인데요?				0	2022-08-19 23:27:08	2022-08-19 23:27:08
BK22005568	8	전문가	비타민은 외부에서 섭취해야 하지만, 호르몬은 신체 내분기기관에서 합성된다는 것이 차이점이예요. 참고로 소량으로 신체의 기능을 조절한다는 점은 비타민과 호르몬의 공통점이구요.	비타민 호르몬	https://ko.wikipedia.org/wiki/%EB%B9%84%ED%83%80%EB%AF%BC	2022/06/30	0	2022-08-19 23:27:08	2022-08-25 16:35:25
BK22005568	9	질문자	이해됐어요. 비타민과 호르몬이 둘 다 소량 필요하지만 체내에서 스스로 합성되는 것은 호르몬, 그렇지 않은 것은 비타민이라는 말씀이시군요. 근데 수용성 비타민, 지용성 비타민 이런것들 있잖아요, 이건 무슨말이예요?				0	2022-08-19 23:27:08	2022-08-19 23:27:08
BK22005568	10	전문가	수용성 비타민에 대해서 먼저 말씀드릴게요. 쉽게 말해서 물에 녹는 비타민이예요. 이 수용성 비타민은 많이 먹더라도 몸 안에 축적되지 않아요. 물과 함께 소변으로 배출되죠. 그래서 매일 일정량을 먹어야 하구요.	수용성 비타민	https://ko.wikipedia.org/wiki/%EB%B9%84%ED%83%80%EB%AF%BC	2022/06/30	0	2022-08-19 23:27:08	2022-08-19 23:27:08
BK22005568	11	질문자	축적되지 않기 때문에 매일 먹어야 한다는 말씀이시군요. 그럼 지용성 비타민은요?				0	2022-08-19 23:27:08	2022-08-19 23:27:08
BK22005568	12	전문가	지용성 비타민은 물에는 안녹아요. 근데 지방에 의해서는 녹죠. 많이 먹으면 몸에 축적되기 때문에 지나친 복용으로 인한 중독 증상이 나타날 수도 있구요.	지용성 비타민	https://ko.wikipedia.org/wiki/%EB%B9%84%ED%83%80%EB%AF%BC	2022/06/30	0	2022-08-19 23:27:08	2022-08-19 23:27:08
BK22005568	13	질문자	그러면 지용성 비타민은 양을 잘 조절해서 먹어야겠네요. 제가 얼마전에 건강검진을 받았는데 비타민D가 부족하다고 하더라구요. 따로 영양제를 섭취하라고 권유하시던데, 비타민D가 무슨 역할을 하길래 영양제까지 섭취해서 채워야하는거죠?				0	2022-08-19 23:27:08	2022-08-19 23:27:08
BK22005568	14	전문가	비타민 D는 칼슘 흡수를 돕는 역할을 해요. 뼈 건강에 중요한 역할을 하는거죠. 미 국립보건원에 따르면, 신체와 뇌 간에 메시지를 전달하고, 바이러스와 박테리아를 물리치는 역할에도 비타민 D가 필요해요.	비타민D	https://kormedi.com/1402161/%eb%b9%84%ed%83%80%eb%af%bc-c-d-%ea%b3%bc%eb%8b%a4-%eb%b3%b5%ec%9a%a9%ed%95%98%eb%a9%b4-%eb%82%98%ed%83%80%eb%82%98%eb%8a%94-%ec%a6%9d%ec%83%81/	2022/06/06	0	2022-08-19 23:27:08	2022-08-19 23:27:08
BK22005568	15	질문자	뼈 건강이라니, 칼슘만 섭취한다고 뼈가 건강해지는 것이 아니고 칼슘 흡수를 돕는 비타민 D가 필요한 거였군요. 비타민 D를 보충하려면 어떻게 해야하죠?				0	2022-08-19 23:27:08	2022-08-19 23:27:08
BK22005568	16	전문가	대표적으로는 햇빛을 충분히 쐬는 방법이 있어요. 야외에서 매일 20분에서 30분 정도 팔다리를 햇빛에 노출시키는거죠. 좀 더 빠르고 간편한 방법으로는 비타민D 영양제를 섭취하는 방법도 있구요.	비타민D 보충	http://lady.khan.co.kr/khlady.html?mode=view&artid=202206201140001&code=14	2022/06/20	0	2022-08-19 23:27:08	2022-08-19 23:27:08
BK22005568	17	질문자	오늘 좋은 정보 알려주셔서 감사해요. 부족한 비타민 D를 채우려면 저도 영양제를 섭취해야겠어요. 혹시 제가 궁금한 것이 있으면 또 연락 드려도 될까요?				0	2022-08-19 23:27:08	2022-08-19 23:27:08
BK22005568	18	전문가	물론이죠, 언제라도 궁금한 것이 있으시면 연락 주세요.				1	2022-08-19 23:27:08	2022-08-25 16:35:25
BK22005568	19	질문자	네, 그럼 다음에 또 연락 드릴게요.				0	2022-08-19 23:27:08	2022-08-19 23:27:08
BK22005568	20	전문가	네, 좋은 하루 되세요.				0	2022-08-19 23:27:08	2022-08-19 23:27:08
