id	utterance_id	role	text	search_query	search_URL	reference_date	terminate	regDate	updDate
BK22004290	1	질문자	친구가 본인이 기면증 같다면서 도움을 요청했어요. 기면증이란 어떤 병을 말하나요?				0	2022-08-04 11:38:05	2022-08-06 01:06:37
BK22004290	2	전문가	저런, 친구의 요청이 있었군요. 기면증이란 밤에 잠을 푹 잤는데도 불구하고 낮에 졸음이 쏟아지는 질병을 말해요.	기면증	http://www.mkhealth.co.kr/news/articleView.html?idxno=57195	2022/04/04	0	2022-08-04 11:38:05	2022-08-18 10:23:43
BK22004290	3	질문자	충분히 잤는데 낮에도 자꾸 졸린 게 기면증이군요. 기면증의 원인에는 무엇이 있나요?				0	2022-08-04 11:38:05	2022-08-06 01:06:37
BK22004290	4	전문가	기면증의 원인은 명확히 밝혀진 게 없어요. 다만 수면이나 각성을 유지할 때 필요한 히포크레틴이라는 성분의 소실과 기면증이 관련 있다는 증거들이 나오고 있어, 히포크레틴이 기면증의 유력한 원인이라고 볼 수 있어요.	기면증 원인	http://www.mkhealth.co.kr/news/articleView.html?idxno=57195	2022/04/04	0	2022-08-04 11:38:05	2022-08-06 01:06:37
BK22004290	5	질문자	그렇다면 기면증의 증상에는 어떤 것들이 있나요?				0	2022-08-04 11:38:05	2022-08-06 01:06:37
BK22004290	6	전문가	기면증의 증상은 낮 일과 중 특별한 이유가 없는데도 졸음을 참을 수 없는 경우, 그리고 갑자기 몸에 힘이 사라지는 탈력 발작, 만성피로, 수면마비, 가위눌림 등이 있는데 이런 증상이 수시로 발생한다면 기면증을 의심해 볼 수 있어요.	기면증 증상	http://www.sportsworldi.com/newsView/20220324517203	2022/03/25	0	2022-08-04 11:38:05	2022-08-06 01:06:37
BK22004290	7	질문자	친구가 말하는 증상이 여기에 해당되는 것 같아요. 기면증이 의심된다면 그다음에는 어떻게 해야 하나요?				0	2022-08-04 11:38:05	2022-08-06 01:06:37
BK22004290	8	전문가	기면증이 의심된다면 먼저 수면다원검사를 진행하여 원인을 찾고 근본적인 치료를 하는 것이 중요해요.	기면증 의심	https://www.edaily.co.kr/news/read?newsId=01289046632200016&mediaCodeNo=257&OutLnkChk=Y	2022/01/21	0	2022-08-04 11:38:05	2022-08-06 01:06:37
BK22004290	9	질문자	기면증 검사를 해야 한다는 말씀이시죠? 그 검사를 하면 무엇을 알 수 있나요?				0	2022-08-04 11:38:05	2022-08-06 01:06:37
BK22004290	10	전문가	검사를 통해 잠을 자는 동안의 뇌파와 안구의 움직임 그리고 근육의 긴장도와 잠을 잘 때 발생하는 부정맥, 동맥혈, 산소포화도 같은 것들을 측정하게 돼요.	기면증 검사	http://www.healthinnews.co.kr/news/articleView.html?idxno=30391	2022/05/31	0	2022-08-04 11:38:05	2022-08-06 01:06:37
BK22004290	11	질문자	많은 것들을 알 수 있네요. 그럼 검사를 통해 기면증으로 판정되면 치료는 어떻게 하나요?				0	2022-08-04 11:38:05	2022-08-06 01:06:37
BK22004290	12	전문가	기면증은 대부분 약물로 치료를 해요. 대표적인 약물은 모다피닐이며, 이 약물을 통해서 낮에 쏟아지는 졸림을 조절할 수 있게 되죠.	기면증 치료	https://www.yeongnam.com/web/view.php?key=20210927010003075	2021/09/28	0	2022-08-04 11:38:05	2022-08-06 01:06:37
BK22004290	13	질문자	약물로 치료를 하게 되는군요. 생활 습관도 중요할 것 같은데 기면증에 도움 되는 습관이 있을까요?				0	2022-08-04 11:38:05	2022-08-06 01:06:37
BK22004290	14	전문가	규칙적인 시간을 정해 잠을 자고 정상적인 수면 습관을 만드는 것이 좋아요. 또한 필요하다면 학교나 직장 등에 협조를 요청해보세요.	기면증에 도움되는 습관	https://www.dailysecu.com/news/articleView.html?idxno=89847	2019/12/22	0	2022-08-04 11:38:05	2022-08-06 01:06:37
BK22004290	15	질문자	네, 마지막으로 기면증에 도움 되는 음식도 추천 부탁드려요.				0	2022-08-04 11:38:05	2022-08-06 01:06:37
BK22004290	16	전문가	마늘, 연근, 사과 등은 몸의 피로를 풀어 잠을 잘 잘 수 있게 도와주고, 바나나에 들어있는 트립토판 또한 깊은 잠을 잘 수 있게 하니 참고하세요.	기면증에 좋은 음식	http://www.newsclaim.co.kr/news/articleView.html?idxno=1063936	2020/08/27	0	2022-08-04 11:38:05	2022-08-06 01:06:37
BK22004290	17	질문자	좋은 정보 감사합니다. 오늘 배운 걸로 친구에게 기면증에 대해서 얘기해 줄 수 있겠네요.				0	2022-08-04 11:38:05	2022-08-06 01:06:37
BK22004290	18	전문가	도움이 되어서 다행이에요. 더 궁금한 게 있다면 알려드릴게요.				0	2022-08-04 11:38:05	2022-08-06 01:06:37
BK22004290	19	질문자	오늘은 이만하면 될 것 같아요. 친구에게 바나나라도 사서 가봐야겠네요. 그럼 다음에 봬요.				0	2022-08-04 11:38:05	2022-08-06 01:06:37
BK22004290	20	전문가	네, 조심히 가시고 그럼 다음에 또 만나요.				1	2022-08-04 11:38:05	2022-08-18 10:23:43
