id	utterance_id	role	text	search_query	search_URL	reference_date	terminate	regDate	updDate
BK22001913	1	질문자	요즘 컴퓨터로 작업을 너무 많이 해서 그런지, 눈이 뻑뻑한 느낌이 들어.				0	2022-08-02 12:12:08	2022-08-02 12:42:51
BK22001913	2	전문가	모니터나 스마트폰을 오랜 시간 동안 눈 깜빡임 없이 집중해서 보는 경우에 눈물의 분비 순환이 줄어들어서 뻑뻑한 느낌이 들 수 있어.	눈이 뻑뻑한 느낌	https://www.medipana.com/article/view.php?news_idx=254609&sch_menu=1&sch_gubun=5	2020/03/25	0	2022-08-02 12:12:08	2022-08-02 12:42:51
BK22001913	3	질문자	맞아, 집중해서 일을 하다 보면 눈을 덜 깜빡거리게 되긴 하는 것 같아.				0	2022-08-02 12:12:08	2022-08-02 12:42:51
BK22001913	4	전문가	눈을 깜빡이는 횟수가 줄어들게 되면 초점을 맞추기 위해 눈 안 섬모체 근육의 긴장 상태가 유지되면서 눈의 피로도도 증가하거든. 이로 인해 일시적으로 시야가 흐려 보이는 증상이나 복시 증상, 안구건조증도 생길 수 있지.	눈 깜빡임 안구건조증	http://www.cctimes.kr/news/articleView.html?idxno=706235	2022/05/29	0	2022-08-02 12:12:08	2022-08-02 12:42:51
BK22001913	5	질문자	그럼 혹시 내가 안구건조증인가? 안구건조증의 대표적인 증상으로는 무엇이 있어?				0	2022-08-02 12:12:08	2022-08-02 12:42:51
BK22001913	6	전문가	눈물막의 눈물 증발량이 많아 안구의 표면이 손상되어 발생하는 질환인 안구건조증은 눈이 시린 느낌, 가려움, 충혈, 이물감 등의 증상들을 가지고 있어. 또한, 뿌옇게 보일 때는 눈을 깜빡이면 증상이 사라지는 경우도 많지.	안구건조증 증상	https://health.chosun.com/site/data/html_dir/2022/06/24/2022062402183.html	2022/06/25	0	2022-08-02 12:12:08	2022-08-02 12:42:51
BK22001913	7	질문자	아, 내가 지금 가지고 있는 증상들이랑 비슷한 걸 보니 안구건조증이 맞나 봐. 원인을 찾아야 할 텐데, 혹시 에어컨을 많이 틀어도 안구건조증이 생길 수 있어?				0	2022-08-02 12:12:08	2022-08-02 12:42:51
BK22001913	8	전문가	당연하지, 얼굴 부분으로 에어컨의 바람이 직접 향한다면 이 또한 눈물의 증발을 촉진시키는 요인이 되거든. 선풍기도 마찬가지고.	에어컨 눈물 증발	https://www.segye.com/newsView/20220703511662?OutUrl=naver	2022/07/03	0	2022-08-02 12:12:08	2022-08-02 12:42:51
BK22001913	9	질문자	이런 것도 모르고 눈에 안 좋은 행동은 다 하고 있었네. 안구건조증 치료 방법에 대해서도 설명해 줄래?				0	2022-08-02 12:12:08	2022-08-02 12:42:51
BK22001913	10	전문가	일단 가장 쉬운 안구건조증 치료 방법으로는 인공눈물을 넣어주는 방법이 있어. 눈물이 부족할 때 이를 인공눈물로 보충해 주는 거지.	안구건조증 인공눈물	https://www.mk.co.kr/news/culture/view/2022/04/310527/	2022/04/06	0	2022-08-02 12:12:08	2022-08-02 12:42:51
BK22001913	11	질문자	아하, 그럼 인공눈물은 어떤 걸 선택하면 되는 거야?				0	2022-08-02 12:12:08	2022-08-02 12:42:51
BK22001913	12	전문가	인공눈물의 성분은 각각 다르기 때문에 의사 선생님과 상의한 후에 선택하는 게 중요해. 눈물층의 불안정 여부인지 아니면 눈물 생성 부족인지 등 환자의 상태에 맞는 인공눈물을 선택해야 하거든.	인공눈물 선택	https://www.mk.co.kr/news/culture/view/2022/04/310527/	2022/04/06	0	2022-08-02 12:12:09	2022-08-02 12:42:51
BK22001913	13	질문자	응, 알겠어. 또 다른 안구건조증 치료 방법으로는 어떤 게 있어?				0	2022-08-02 12:12:09	2022-08-02 12:42:51
BK22001913	14	전문가	음, 따뜻한 수건을 이용해서 하루에 10분 정도씩 눈에 온찜질을 해주는 것도 안구건조증을 개선해 나가는 데 사용되는 방법 중 하나야.	안구건조증 온찜질	https://mdtoday.co.kr/news/view/1065574601903251	2021/10/11	0	2022-08-02 12:12:09	2022-08-02 12:42:51
BK22001913	15	질문자	이게 제일 쉬운 방법이겠다. 그럼 혹시 안구건조증에 좋은 영양제 같은 건 없을까?				0	2022-08-02 12:12:09	2022-08-02 12:42:51
BK22001913	16	전문가	안구건조증 치료에 도움이 되는 영양제로는 등 푸른 생선에 많이 들어있는 오메가3 성분의 영양제가 있어. 오메가3가 염증을 유발하는 물질을 줄여주고 눈물을 안정화시켜 주거든.	안구건조증 오메가3	https://moneys.mt.co.kr/news/mwView.php?no=2022012817338079843	2022/02/05	0	2022-08-02 12:12:09	2022-08-02 12:42:51
BK22001913	17	질문자	아, 그래? 종합 비타민만 먹고 있었는데, 앞으로는 오메가3도 복용해야겠네.				0	2022-08-02 12:12:09	2022-08-02 12:42:51
BK22001913	18	전문가	응, 눈도 자주 깜빡여주고 신경 써서 관리하면 금방 괜찮아질 거야.				0	2022-08-02 12:12:09	2022-08-02 12:42:51
BK22001913	19	질문자	알겠어, 좋은 정보들 알려줘서 너무 고마워!				0	2022-08-02 12:12:09	2022-08-02 12:42:51
BK22001913	20	전문가	아냐, 얼른 안구건조증이 사라져서 눈이 편안해지길 바랄게!				1	2022-08-02 12:12:09	2022-08-02 13:07:30
