id	utterance_id	role	text	search_query	search_URL	reference_date	terminate	regDate	updDate
BK22003370	1	질문자	혹시 네일 아트에 대해 관심이 있으신가요? 요새 네일숍에서 젤 네일을 한다고 하는데 그게 뭔지 알고 계시나요?				0	2022-08-04 11:11:48	2022-08-04 11:11:48
BK22003370	2	전문가	그럼요, UV 젤을 UV 라이트에 쐬어 단단해지게 만드는 방법의 네일 아트랍니다.	젤 네일	https://health.chosun.com/site/data/html_dir/2021/08/09/2021080901164.html	2021/08/10	0	2022-08-04 11:11:48	2022-08-04 11:11:48
BK22003370	3	질문자	그렇군요, 많은 사람들이 젤 네일을 하길래 어떤 점이 좋은지 궁금했어요.				0	2022-08-04 11:11:48	2022-08-04 11:11:48
BK22003370	4	전문가	그러셨군요, 젤 네일은 손톱에 색을 칠하는 것뿐만 아니라 보석 등을 붙여 꾸밀 수 있어요. 유해성이 적은 UV 젤을 사용해 냄새가 많이 나지 않고, 3주에서 4주 동안 유지할 수 있으며 아세톤으로 지워지지 않는다는 특징이 있답니다.	젤 네일 특징	https://health.chosun.com/site/data/html_dir/2021/08/09/2021080901164.html	2021/08/10	0	2022-08-04 11:11:48	2022-08-04 11:11:48
BK22003370	5	질문자	3주에서 4주나 지속된다니, 큰 장점이 있네요. 그럼 단점으로는 어떤 게 있을까요?				0	2022-08-04 11:11:48	2022-08-04 11:11:48
BK22003370	6	전문가	아무래도 젤 네일은 젤을 굳히기 위해 UV 램프나 LED 램프를 사용하기 때문에 시술 시간이 일반 네일에 비해 더 소요되고, 나중에 네일을 제거할 때도 전용 리무버로 지워야 해요.	젤 네일 단점	https://mnb.moneys.mt.co.kr/mnbview.php?type=1&no=2014013012038081135&outlink=1&ref=https%3A%2F%2Fsearch.naver.com	2014/01/30	0	2022-08-04 11:11:48	2022-08-04 11:11:48
BK22003370	7	질문자	그렇군요, 그럼 네일을 제거하려면 어떻게 해야 하는데요?				0	2022-08-04 11:11:48	2022-08-04 11:11:48
BK22003370	8	전문가	젤 네일을 제거하는 방법으로는 쏙오프와 드릴오프라는 방식이 있어요. 일단 쏙오프는 아세톤을 묻힌 솜을 손톱에 올린 후 포일로 감아 젤을 녹이는 방식이라면 드릴오프는 드릴로 젤을 갈아내는 방식이랍니다. 피부의 수분이 증발된다는 단점이 있는 쏙오프에 비해 드릴오프는 손톱 손상이 없어 인기가 많아요.	젤 네일 제거	http://www.newsworker.co.kr/news/articleView.html?idxno=14905	2018/02/02	0	2022-08-04 11:11:48	2022-08-04 11:11:48
BK22003370	9	질문자	그렇군요, 그런데 드릴로 제거하는 경우는 조심해야 할 거 같아요.				0	2022-08-04 11:11:48	2022-08-04 11:11:48
BK22003370	10	전문가	그렇죠, 전문가가 아닌 사람이 하면 손톱이 손상될 수 있어서 주의해야 한답니다.	젤 네일 드릴 제거	https://health.chosun.com/site/data/html_dir/2021/08/09/2021080901164.html	2021/08/10	0	2022-08-04 11:11:48	2022-08-04 11:11:48
BK22003370	11	질문자	꼭 네일숍에 가서 받아야겠어요. 혹시 제거하는 과정에서 손톱이 상하지는 않을까요?				0	2022-08-04 11:11:48	2022-08-04 11:11:48
BK22003370	12	전문가	아무래도 젤 네일을 지우기 위해 반복적으로 손톱의 표면을 밀고, 아세톤으로 네일을 불리다 보니 손톱이 건조해지고 이러한 과정에서 조갑박리증이 생길 수 있죠. 조갑박리증이라는 질환은 손톱이 부러지거나 피부와 분리되는 증상을 보이는데 염증을 발생시키거나 무좀균의 감염을 일으킬 수 있어요.	조갑박리증	https://health.chosun.com/site/data/html_dir/2015/06/11/2015061102225.html	2015/06/11	0	2022-08-04 11:11:48	2022-08-05 15:22:58
BK22003370	13	질문자	그런 질환에 걸릴 수도 있다니, 참고하도록 할게요. 아, 요즘 네일숍에 가지 않고 직접 하는 사람도 많지 않나요?				0	2022-08-04 11:11:48	2022-08-05 15:22:58
BK22003370	14	전문가	맞아요, 코로나바이러스의 영향으로 네일숍에 가지 않고 네일 제품을 구매해 셀프로 하는 사람들이 많아지고 있죠.	코로나바이러스 셀프 네일	http://www.viva100.com/main/view.php?key=20200317010006898	2020/03/18	0	2022-08-04 11:11:48	2022-08-04 11:11:48
BK22003370	15	질문자	저도 손재주가 있으면 직접 할 텐데 자신이 없네요. 혹시 저처럼 손재주 없는 사람도 간단하게 할 수 있는 방법은 없을까요?				0	2022-08-04 11:11:48	2022-08-05 15:22:58
BK22003370	16	전문가	그럼 성형 네일이라고도 불리는 붙이는 젤 네일은 어떠세요? 집에서 간편하게 할 수 있어 대중의 관심을 얻고 있답니다. 단 1초면 붙일 수 있기 때문에 시술 시간이 짧고, 손톱손상 걱정도 없어요.	붙이는 젤 네일	http://www.sportsseoul.com/news/read/405430	2016/06/20	0	2022-08-04 11:11:48	2022-08-04 11:11:48
BK22003370	17	질문자	붙이는 젤 네일 괜찮아 보이지만, 어떤 디자인이 있는지 더 알아봐야겠어요.				0	2022-08-04 11:11:48	2022-08-04 11:11:48
BK22003370	18	전문가	네, 어떤 디자인이 있는지 한 번 알아보세요.				0	2022-08-04 11:11:48	2022-08-04 11:11:48
BK22003370	19	질문자	그럴게요, 좋은 정보 알려주셔서 감사해요. 오늘 무척 즐거운 대화였어요.				0	2022-08-04 11:11:48	2022-08-04 11:11:48
BK22003370	20	전문가	저도 즐거웠어요, 다음에 또 대화 나누도록 해요.				1	2022-08-04 11:11:48	2022-08-05 15:22:58
