id	utterance_id	role	text	search_query	search_URL	reference_date	terminate	regDate	updDate
BK22005925	1	질문자	요즘 살이 찐 것 같아 다이어트하려고 찾아보니 간헐적 단식을 하는 사람들이 많더라. 간헐적 단식은 어떻게 하는 거야?				0	2022-08-19 16:40:51	2022-08-19 16:40:51
BK22005925	2	전문가	간헐적 단식은 8에서 12시간의 정해진 시간에만 음식을 먹고, 나머지 시간은 공복을 유지하는 거야.	간헐적 단식	https://health.chosun.com/site/data/html_dir/2022/08/17/2022081701750.html	2022/08/17	0	2022-08-19 16:40:51	2022-08-30 11:50:32
BK22005925	3	질문자	일정한 시간에 먹고, 일정에 시간에 먹지 않는 방법이구나. 어떤 원리로 간헐적 단식이 체중 감소 효과가 있는 거야?				0	2022-08-19 16:40:51	2022-08-19 16:40:51
BK22005925	4	전문가	살이 찌는 원인이 혈당인데 간헐적 단식을 해서 그 혈당을 소모하는 거야. 단식으로 혈당을 소모한 후에 우리 몸의 다음 에너지원인 지방을 꺼내서 쓰게 하려고 공복 시간을 유지하는 거야.	간헐적 단식 방법	https://www.hidoc.co.kr/healthstory/news/C0000723178	2022/08/09	0	2022-08-19 16:40:51	2022-08-19 16:40:51
BK22005925	5	질문자	우리 몸의 지방을 쓰게 하는 의도라니 잘하면 살이 빠지겠네. 또 다른 간헐적 단식의 효과는 뭐가 있어?				0	2022-08-19 16:40:51	2022-08-19 16:40:51
BK22005925	6	전문가	간헐적 단식을 하면 인슐린의 분비도 억제되면서 인슐린의 저항성이 개선돼. 그리고 인슐린이 정상적으로 역할을 해서 포도당이 세포에 흡수되도록 도와줘.	간헐적 단식 효과	https://www.hidoc.co.kr/healthstory/news/C0000692949	2022/05/01	0	2022-08-19 16:40:51	2022-08-19 16:40:51
BK22005925	7	질문자	적절한 단식 시간으로 우리 몸에서 인슐린이 제대로 작용할 수 있게 해주는 거구나. 단식을 하게 되면 계획적으로 먹게 되는 거라 괜찮겠네.				0	2022-08-19 16:40:51	2022-08-19 16:40:51
BK22005925	8	전문가	그렇지, 계속 생각 없이 먹을 수 있는데 간헐적 단식을 하면 먹는 양도 조절하고 시간도 조절하는 효과가 있지.				0	2022-08-19 16:40:51	2022-08-19 16:40:51
BK22005925	9	질문자	하지만 간헐적 단식이 좋은 점만 있는 건 아닐 텐데 어떤 문제가 있을까?				0	2022-08-19 16:40:51	2022-08-19 16:40:51
BK22005925	10	전문가	간헐적 단식의 장점이 많지만 폭식을 할 염려가 있어. 공복 시간에 대한 보상 심리와 다가올 공복 시간에 대한 조급한 마음을 가질 수 있거든.	간헐적 단삭 폭식	http://www.sisajournal.com/news/articleView.html?idxno=237758	2022/05/01	0	2022-08-19 16:40:51	2022-08-30 11:50:32
BK22005925	11	질문자	그러네, 굶었다가 먹으니 폭식으로 이어질 수 있겠어. 그리고 또 어떤 점을 조심해야 할까?				0	2022-08-19 16:40:51	2022-08-19 16:40:51
BK22005925	12	전문가	간헐적 단식을 하는 사람들은 단식하는 시간 동안 물도 같이 섭취하지 않는 경우가 있어. 식사를 하는 것과는 상관없이 수분 섭취는 필수적인 부분이니, 시간과 섭취량을 정해 물을 섭취하는 것이 탈수를 막는 좋은 방법이야.	간헐적 단식 주의점	http://www.sisajournal.com/news/articleView.html?idxno=237758	2022/05/01	0	2022-08-19 16:40:51	2022-08-19 16:40:51
BK22005925	13	질문자	나도 식사를 안 하면 물을 따로 챙겨마시기 어렵던데 간헐적 단식을 하면 물 섭취를 신경 써야겠다. 간헐적 단식을 하면서 운동도 해주는 게 효과적이겠지?				0	2022-08-19 16:40:51	2022-08-19 16:40:51
BK22005925	14	전문가	그럼, 단식 시간이 길어지면 근육이 손실될 우려가 있어. 그래서 단백질 섭취도 충분히 하면서 근력을 기르기 위한 운동도 병행해 줘야 해.	효과적인 간헐적 단식	https://www.hidoc.co.kr/healthstory/news/C0000658111	2021/12/22	0	2022-08-19 16:40:51	2022-08-19 16:40:51
BK22005925	15	질문자	단백질 섭취도 신경 써줘야겠구나. 지금 이야기하면서 간헐적 단식을 하려고 마음먹었는데 어떻게 하는 건지 방법 좀 자세히 알려줘.				0	2022-08-19 16:40:51	2022-08-19 16:40:51
BK22005925	16	전문가	16대8 단식법과 12대12 단식법, 23대1 단식법이 있어. 16대8 단식법은 하루에 16시간은 공복을 유지하고 8시간 동안 먹는 것이고, 12대12 단식법은 12시간은 공복을 유지하고 12시간 먹는 것, 23대1 단식법은 하루에 한 끼 식사만 하는 방법이야.	간헐적 단식 방법	https://www.mk.co.kr/economy/view/2022/127517	2022/02/11	0	2022-08-19 16:40:51	2022-08-19 16:40:51
BK22005925	17	질문자	단식법도 정말 다양한데, 내 생활 패턴에 맞는 방법을 생각해 봐야겠네. 혹시 2끼 먹을 거면 저녁을 먹으면 안 되는 거지?				0	2022-08-19 16:40:51	2022-08-19 16:40:51
BK22005925	18	전문가	2끼를 먹을 거라면 어느 끼니를 안 먹던 상관없어. 일정하게 하는 것이 중요한 거야.	간헐적 단식 저녁	https://www.hidoc.co.kr/healthstory/news/C0000647303	2021/11/05	0	2022-08-19 16:40:51	2022-08-19 16:40:51
BK22005925	19	질문자	그렇구나, 네가 알려준 덕분에 어떻게 해야 할지 감이 잡히는 것 같아.				1	2022-08-19 16:40:51	2022-08-30 11:50:32
BK22005925	20	전문가	네 생활 패턴에 맞는 방법으로 하고, 우리는 다음에 보자.				0	2022-08-19 16:40:51	2022-08-19 16:40:51
