id	utterance_id	role	text	search_query	search_URL	reference_date	terminate	regDate	updDate
BK22004655	1	질문자	요즘 불면증을 겪는 사람이 많다던데 정말 그렇게 많을까?				0	2022-08-04 11:41:18	2022-08-11 08:59:44
BK22004655	2	전문가	사실이야. 건강보험심사평가원에 따르면 국내에서 불면증을 호소하고 있는 사람은 매해 8퍼센트 증가하는 추세로 작년에만 68만 명을 넘어선 것으로 나타났어. 이렇게 불면증을 겪는 사람들이 지속적으로 늘어나면 서 다른 질병은 물론 합병증 위험성도 높아지고 있어.	불면증	http://www.outdoornews.co.kr/news/articleView.html?idxno=33380	2022/07/20	0	2022-08-04 11:41:18	2022-09-27 14:57:21
BK22004655	3	질문자	불면증을 겪고 있는 사람이 정말 많구나. 불면증의 양상도 사람마다 다르다고 하던데 어떻게 나눠볼 수 있을 까?				0	2022-08-04 11:41:18	2022-08-11 08:59:44
BK22004655	4	전문가	맞아. 대표적인 불면증 증상은 잠이 잘 오지 않는 입면장애, 중간에 자주 깨는 잦은 각성, 원하지 않은 이른 시간에 기상하는 것 등이 있어. 입면장애의 경우 잠자리에 들고 20분 이상 잠이 들지 않는 경우에 해당되는 데 이런 불면증은 그 원인이 무척 다양해.	불면증 원인	https://www.edaily.co.kr/news/read?newsId=01207046632362704&mediaCodeNo=257&OutLnkChk=Y	2022/06/17	0	2022-08-04 11:41:18	2022-08-11 08:59:44
BK22004655	5	질문자	자고는 싶은데 잠들지 못하는 것도 진짜 곤욕이겠다. 그런데 불면증을 진단하는 기준은 뭐야?				0	2022-08-04 11:41:18	2022-08-11 08:59:44
BK22004655	6	전문가	미국수면학회의 수면장애 국제분류는 불면증에 대해 잠을 충분히 잘 수 있는 상황임에도 지속적인 수면의 개시, 지속 시간, 수면 구조 통합 및 수면의 질 저하와 함께 주간 기능장애를 일으키는 질환 상태라고 정의하 고 있어. 한 마디로 네 말처럼 잠을 자고 싶어도 잠들 수 없고, 질적으로나 양적으로나 만족스러운 수면을 이 루지 못해 낮에 사회적이나 직업적인 다양한 기능 영역에서 현저한 지장을 받고 고통을 느끼는 것을 수면 장애라고 할 수 있지.	불면증 진단기준	http://weekly.khan.co.kr/khnm.html?mode=view&code=123&artid=202001171822021&pt=nv	2020/02/03	0	2022-08-04 11:41:18	2022-08-11 08:59:44
BK22004655	7	질문자	그럼 수면무호흡증이랑 코골이도 수면장애의 범주에 들어가는 거지? 둘은 어떻게 구분해?				0	2022-08-04 11:41:18	2022-08-11 08:59:44
BK22004655	8	전문가	응. 코골이는 잠자는 동안 소음이 큰 거고, 수면무호흡증은 자다가 숨을 잠깐씩 멈추는 상태가 반복되는 것 을 말하는데 잠잘 때 단순히 드르렁, 드르렁 소리만 나면 코골이일 가능성이 크고, 커억, 컥 하고 숨이 턱턱 막히는 소리가 나면 수면무호흡증을 의심할 수 있어.	수면무호흡증	https://www.mk.co.kr/news/it/view/2022/07/606032/	2022/07/10	0	2022-08-04 11:41:18	2022-08-11 08:59:44
BK22004655	9	질문자	그렇구나. 근데 잠자다가 그런 사람들 많지 않아? 시끄러운 거 말고 문제가 있는 거야?				0	2022-08-04 11:41:18	2022-08-11 08:59:44
BK22004655	10	전문가	수면무호흡증은 수면 중 호흡이 멈춰 체내 산소 공급이 원활하게 이뤄지지 않는 증상을 말하고 단순한 코골 이와는 달리 질병으로 분류돼. 깨어 있을 때는 아무 증상이 없고 잘때만 나타나기 때문에 스스로는 알기 힘 들어서 방치되기 쉽기 때문에 주의해야해.	수면무호흡증치료	http://www.sporbiz.co.kr/news/articleView.html?idxno=624024	2022/07/01	0	2022-08-04 11:41:18	2022-08-11 08:59:44
BK22004655	11	질문자	그렇구나. 호흡이 멈추는 거니까 위험하겠다. 그럼 수면무호흡증 진단은 어떻게 할 수 있어?				0	2022-08-04 11:41:18	2022-08-11 08:59:44
BK22004655	12	전문가	충분히 자도 피로가 여전히 풀리지 않는다면 수면장애를 의심하고 수면다원검사라는 것을 받을 수 있는데 잠을 자는 동안 몸에서 일어나는 여러 반응을 검사해 수면장애의 원인을 찾아내는 검사법이야.	수면다원검사	http://sjbnews.com/news/news.php?number=752726	2022/07/28	0	2022-08-04 11:41:18	2022-09-27 14:57:21
BK22004655	13	질문자	오! 그러면 자는 동안 몸에서 일어나는 변화를 알 수 있겠구나. 그럼 수면무호흡증으로 진단을 받으면 치료 는 어떻게 받아야 하는 거야?				0	2022-08-04 11:41:18	2022-08-11 08:59:44
BK22004655	14	전문가	수술하지 않고 코골이와 수면무호흡증을 치료하는 가장 확실하고 근본적인 방법은 양압기야. 양압기는 잠자 는 동안에 기도에 일정한 압력의 공기를 불어넣어 기도를 넓혀줌으로써 호흡기를 편안하게 하는 치료기기 인데 양압기를 잘 사용하면 깊은 잠을 잘 수 있어서 수명이 연장되고, 불면증과 치매를 예방하는데도 큰 도 움이 돼.	양압기	https://www.mk.co.kr/news/it/view/2022/07/606032/	2022/07/10	0	2022-08-04 11:41:18	2022-09-27 14:57:21
BK22004655	15	질문자	그런 게 있구나. 수면무호흡증은 양압기라는 치료기기가 있어서 다행인데 일반 불면증은 어떻게 해야할까?				0	2022-08-04 11:41:18	2022-08-11 08:59:44
BK22004655	16	전문가	불안감이나 스트레스가 심해서 불면증을 혼자 고치기 힘든 경우에는 병원에 방문해서 상담을 통해 심리적인 요인을 찾은 뒤 평소 수면 패턴이나 수면 습관 등에서 개선할 점을 분석하고 그에 맞는 약물치료와 인지행동 치료, 수면 위생관리 등을 진행하게 돼. 불면증을 성공적으로 치료하기 위해서는 단순히 수면시간을 늘리는 것이 아닌 심리적 불면증의 원인에 대한 정밀한 분석과 상담이 필요하거든.	불면증치료	http://www.healthinnews.co.kr/news/articleView.html?idxno=29499	2022/04/22	0	2022-08-04 11:41:18	2022-08-11 08:59:44
BK22004655	17	질문자	불면증도 방치하지 않는 것이 정말 중요하겠다. 혹시 불면증에 도움이 될 만한 음식이 있을까?				0	2022-08-04 11:41:18	2022-08-11 08:59:44
BK22004655	18	전문가	체리, 호두, 우유, 상추, 바나나 등은 신체 리듬을 조절하고 긴장을 완화시키는 음식으로 잘 알려져 있고 체리 와 호두, 상추는 멜라토닌 성분을 함유하고 있어서 수면을 돕는 효과적인 식품이야. 그 중에서도 체리는 불 면증을 완화해서 수면 사이클을 회복하는데 기여하고 상추에도 락투세린이라는 성분이 있어서 진정 효과가 있지.	불면증에 좋은 음식	https://www.hellot.net/news/article.html?no=66289	2022/03/08	0	2022-08-04 11:41:18	2022-08-11 08:59:44
BK22004655	19	질문자	오늘 공부 진짜 많이 한 거 같아. 몰랐던 거 알려줘서 정말 고마워.				0	2022-08-04 11:41:19	2022-08-11 08:59:44
BK22004655	20	전문가	벌써 시간이 이렇게 많이 흘렀구나. 모르는 거 있으면 앞으로 또 물어봐. 잘가!				1	2022-08-04 11:41:19	2022-09-27 14:57:21
