id	utterance_id	role	text	search_query	search_URL	reference_date	terminate	regDate	updDate
BK22004678	1	질문자	감기기가 있는지 목이 따끔거리네.				0	2022-08-04 16:37:56	2022-08-22 12:04:07
BK22004678	2	전문가	나도 감기 기운이 있을 때 목부터 붓는데 너도 그런가 보다.				0	2022-08-04 16:37:56	2022-08-22 12:04:07
BK22004678	3	질문자	따뜻한 물도 마시고 하는데, 낫지를 않네. 목 부었을 때 좋은 거 없을까?				0	2022-08-04 16:37:56	2022-08-22 12:04:07
BK22004678	4	전문가	프로폴리스 같은 거 어때? 피곤해서 목이 붓거나 코가 간질간질 할 때 먹으면 부은 목이 좀 가라앉거든.	목 부었을 때 프로폴리스	https://www.vogue.co.kr/2015/05/22/%eb%b7%b0%ed%8b%b0-%ed%94%bc%ed%94%8c-6%ec%9d%b8%ec%9d%b4-%ea%b3%b5%ea%b0%9c%ed%95%98%eb%8a%94-%ea%b7%b8%eb%93%a4%eb%a7%8c%ec%9d%98-%ec%98%81%ec%96%91%ec%a0%9c/	2015/05/22	0	2022-08-04 16:37:56	2022-08-22 12:04:07
BK22004678	5	질문자	요즘 약국에도 프로폴리스 많이 보이던데, 목 부은 데도 먹는 거구나. 프로폴리스가 어떻게 목 부은 걸 가라앉혀주는 거야?				0	2022-08-04 16:37:56	2022-08-22 12:04:07
BK22004678	6	전문가	프로폴리스가 항염 효과가 있거든. 염증을 유발하는 프로스타글란딘이란 물질이 생기는 걸 막아서 목에 있는 염증을 없애주는 거야.	목 아플 때 프로폴리스	http://www.queen.co.kr/news/articleView.html?idxno=217963	2018/01/23	0	2022-08-04 16:37:56	2022-08-22 12:04:07
BK22004678	7	질문자	항염 작용이 부은 목을 가라앉혀주는 거구나. 프로폴리스가 꿀처럼 벌들이 만드는 거라고 알고 있는데 정확히 어떤 거야?				0	2022-08-04 16:37:56	2022-08-22 12:04:07
BK22004678	8	전문가	꿀벌들이 나무 수액이랑 침, 효소를 섞어서 만드는 건데, 벌집 안쪽에 발라서 벌집을 균과 바이러스로부터 지키기 위해서 만들어내는 성분이야.	프로폴리스란	https://www.dailysecu.com/news/articleView.html?idxno=54485	2019/07/08	0	2022-08-04 16:37:56	2022-08-22 12:04:07
BK22004678	9	질문자	꿀벌들은 진짜 똑똑한 거 같다. 염증 가라앉혀 주는 게 말고 다른 효능은 어떤 게 있어?				0	2022-08-04 16:37:56	2022-08-22 12:04:07
BK22004678	10	전문가	항염 작용 외에도 항산화 효과도 있고, 면역력 증강에도 도움이 돼. 그리고 노화억제 같은 피부미용에도 효능이 있어.	프로폴리스 효능	http://www.insightkorea.co.kr//news/articleView.html?idxno=70799	2019/12/13	0	2022-08-04 16:37:56	2022-08-22 12:04:07
BK22004678	11	질문자	정말 좋은 효능이 많네. 시중에 제품들이 많던데 어떤 걸 보고 골라야 할까?				0	2022-08-04 16:37:56	2022-08-22 12:04:07
BK22004678	12	전문가	먼저 프로폴리스의 원산지를 확인해보는 게 좋아. 보통 호주나 뉴질랜드, 브라질산 제품들이 있는데, 브라질의 그린 프로폴리스가 가장 품질이 좋은 걸로 알려져 있어.	프로폴리스 고를 때	http://www.ikunkang.com/news/articleView.html?idxno=33507	2021/04/02	0	2022-08-04 16:37:56	2022-08-22 12:04:07
BK22004678	13	질문자	아 그렇구나. 브라질 그린프로폴리스가 품질이 더 좋은 이유가 있을까?				0	2022-08-04 16:37:56	2022-08-04 16:37:56
BK22004678	14	전문가	그린프로폴리스에는 다른 프로폴리스에는 없는 아르테필린C가 들어있거든. 아르테필린C는 항염증과 항암, 항산화 효과가 있는 천연항생물질이야.	그린 프로폴리스	http://www.ikunkang.com/news/articleView.html?idxno=33965	2021/06/24	0	2022-08-04 16:37:56	2022-08-22 12:04:07
BK22004678	15	질문자	특별한 성분이 들어있어서 좋은 거구나. 프로폴리스는 보통 알약으로 되어 있는 거야?				0	2022-08-04 16:37:56	2022-08-22 12:04:07
BK22004678	16	전문가	형태가 여러가지라 먹는 법도 좀 찾아봐. 알약타입도 있고 원액, 리퀴드, 파우더타입, 미스트 타입 등이 있어.	프로폴리스 알약 형태	https://www.dailysecu.com/news/articleView.html?idxno=32235	2018/03/30	0	2022-08-04 16:37:56	2022-08-22 12:04:07
BK22004678	17	질문자	여러가지 형태로 나오고 있네. 혹시 조심해야 할 부작용 같은 것도 있을까?				0	2022-08-04 16:37:56	2022-08-04 16:37:56
BK22004678	18	전문가	큰 부작용은 없지만, 화분이나 벌꿀에 알러지가 있는 사람은 모유꽃가루 성분때문에 알러지가 생길 수 있으니 조심하는 게 좋아. 임신중이거나 수유중인 사람도 피하는 게 좋고, 천식같은 기관지 환자도 부작용이 있을 수 있어.	프로폴리스 부작용	https://www.nbntv.co.kr/news/articleView.html?idxno=691661	2019/10/29	0	2022-08-04 16:37:56	2022-08-22 12:04:07
BK22004678	19	질문자	난 해당 사항은 없으니 다행이다. 난 그럼 프로폴리스 사러 약국으로 가봐야겠어. 오늘 좋은 정보 알려줘서 고마워!				0	2022-08-04 16:37:56	2022-08-04 16:37:56
BK22004678	20	전문가	목 아픈 거 얼른 가라앉으면 좋겠네. 잘 가고 다음에 봐.				1	2022-08-04 16:37:56	2022-08-22 12:04:07
