id	utterance_id	role	text	search_query	search_URL	reference_date	terminate	regDate	updDate
BK22001912	1	질문자	최근 눈 밑이 떨리는 증상이 있었는데 친구가 마그네슘 부족이라고 하더라고요. 마그네슘이 부족하면 눈이 떨리나요?				0	2022-08-02 12:12:08	2022-08-02 12:42:46
BK22001912	2	전문가	네, 그럴 수 있어요. 내 의지와 상관없이 눈 주변의 안륜근이 수축하는 눈 밑 떨림은 마그네슘 부족으로 흔히 발생해요. 그리고 피로하거나 카페인을 과하게 섭취했을 때도 일시적인 눈 밑 떨림이 생길 수 있죠. 이럴 때 마그네슘이 들어간 영양제를 먹거나 전해질 음료를 마시면 즉시 좋아지는 것이 일반적이에요.	마그네슘 부족 눈떨림	https://www.fneyefocus.com/news/articleView.html?idxno=17227	2022/07/05	0	2022-08-02 12:12:08	2022-08-02 12:42:46
BK22001912	3	질문자	저도 마그네슘을 섭취해서 그런 건지 좋아지긴 했어요. 눈 밑 떨림의 원인은 마그네슘 부족이나 피로, 카페인이 전부인가요?				0	2022-08-02 12:12:08	2022-08-02 12:42:46
BK22001912	4	전문가	더 있어요. 동맥경화와 갑상선기능항진증인데요, 안면신경 위를 지나는 추골동맥이 단단해지고 좁아지는 동맥경화가 생기면 안면신경을 누르게 되고 눈 밑 떨림이 생길 수 있어요. 갑상선기능항진증의 경우 신경이 과흥분하며 증상이 생길 수 있는데 한쪽이 아닌 양쪽 눈이 모두 떨리는 특징이 있어요.	눈 밑 떨림 원인	https://health.chosun.com/site/data/html_dir/2022/01/19/2022011901013.html	2022/01/19	0	2022-08-02 12:12:08	2022-08-02 12:42:46
BK22001912	5	질문자	단순히 눈이 좀 떨리는 건데 원인이 꽤 다양하네요. 저는 자꾸만 눈이 떨리니까 뇌에 문제가 생긴 건 아닌지 걱정되던데 뇌 질환 쪽으로는 관련이 없나요?				0	2022-08-02 12:12:08	2022-08-02 12:42:46
BK22001912	6	전문가	식사를 잘 챙겨 먹었고, 충분히 휴식을 취했는데도 증상이 나아지지 않는다면 뇌 질환을 의심해 볼 수 있어요. 대표적인 뇌신경 질환은 안검연축이에요.	눈꺼풀 떨림	https://health.chosun.com/site/data/html_dir/2022/04/29/2022042901683.html	2022/05/01	0	2022-08-02 12:12:08	2022-08-02 12:42:46
BK22001912	7	질문자	처음 들어보는 질환인데 안검연축의 원인은 뭔가요?				0	2022-08-02 12:12:08	2022-08-02 12:42:46
BK22001912	8	전문가	안검연축은 뇌에 문제가 생기면서 발병하는 것으로 추정만 할 뿐 정확한 원인은 아직 밝혀지지 않았어요.	안검연축 원인	https://www.hankyung.com/opinion/article/2022051568061	2022/05/16	0	2022-08-02 12:12:08	2022-08-02 12:42:46
BK22001912	9	질문자	그렇군요. 안검연축은 눈이 떨리는 증상 외에 다른 증상들이 동반되나요?				0	2022-08-02 12:12:08	2022-08-02 12:42:46
BK22001912	10	전문가	눈 떨림은 물론이고 내 의지와는 상관없이 눈이 꽉 감기면서 일상생활에 문제가 생길 수 있어요. 그대로 둔다면 얼굴까지 떨리는 안면연축도 생길 수 있어요. 안면연축은 안면신경이 혈관에 눌리면서 발생하는데 과흥분 증상으로 인해 한쪽 얼굴이 윙크하듯 움직이거나 눈꺼풀이 떨리고 심할 땐 얼굴에 경련이 일어나기도 해요.	안검연축 증상	https://www.k-health.com/news/articleView.html?idxno=59157	2022/04/30	0	2022-08-02 12:12:08	2022-08-02 12:42:46
BK22001912	11	질문자	방치하면 더 심해지기도 하는군요. 저는 마그네슘 먹고 괜찮아졌으니까 큰 문제는 없겠죠?				0	2022-08-02 12:12:08	2022-08-02 12:42:46
BK22001912	12	전문가	맞아요. 눈 떨림의 대부분은 피로나 마그네슘 부족 때문이니 보충하고 괜찮아졌으면 크게 걱정하지 않으셔도 돼요.				0	2022-08-02 12:12:08	2022-08-02 12:42:46
BK22001912	13	질문자	마그네슘은 이름 때문인지 잘 잊어버리는 영양 성분인 것 같아요. 마그네슘은 우리 몸에서 어떤 역할을 하는 건가요?				0	2022-08-02 12:12:08	2022-08-02 12:42:46
BK22001912	14	전문가	마그네슘은 우리 몸에서 네 번째로 많은 미네랄이에요. 체내의 300여 개 화학반응의 조효소 역할을 하는 것은 물론이고 신경계에도 영향을 줘 근육의 이완과 수축을 돕죠. 또 뼈 건강에도 도움이 돼요. 뼛속의 칼슘을 만드는 칼시토닌의 생성을 위해 마그네슘이 필요하거든요. 칼슘이 너무 많아지면 신장결석과 같은 부작용이 발생할 수 있는데 마그네슘이 혈액에 칼슘이 녹을 수 있도록 도우며 칼슘 부작용을 예방하기도 해요.	마그네슘 역할	https://www.hidoc.co.kr/healthstory/news/C0000656697	2021/12/17	0	2022-08-02 12:12:08	2022-08-02 12:42:46
BK22001912	15	질문자	생각보다 많은 일을 하네요. 4번째로 많은 미네랄이라는 게 놀라워요. 마그네슘은 왠지 영양제로만 먹을 수 있을 것 같은데 음식으로도 먹을 수 있나요?				0	2022-08-02 12:12:08	2022-08-02 12:42:46
BK22001912	16	전문가	네, 음식으로도 먹을 수 있어요. 녹황색채소, 곡류, 콩류, 견과류, 해조류 등 식물성 식품에 많이 함유되어 있어요. 특히 다시마에는 100g 당 760mg의 마그네슘이 있는데 음식 중 가장 많은 양이에요. 그리고 아몬드 100g에도 310mg의 마그네슘이 들어있어요.	마그네슘 음식	https://kormedi.com/1386480/%EB%88%88%EB%B0%91-%EB%96%A8%EB%A6%BC-%EC%A7%9C%EC%A6%9D-%EC%A4%91%EB%85%84%C2%B7%EC%9E%90%EB%85%80%EA%B0%80-%ED%95%A8%EA%BB%98-%EB%A8%B9%EC%96%B4%EC%95%BC-%ED%95%A0-%EC%9D%B4-%EC%9D%8C/	2022/03/16	0	2022-08-02 12:12:08	2022-08-02 12:42:46
BK22001912	17	질문자	건강한 식단으로 식사를 하면 어느 정도는 섭취할 수 있겠네요. 마그네슘을 너무 많이 먹었을 때의 부작용도 있을까요?				0	2022-08-02 12:12:08	2022-08-02 12:42:46
BK22001912	18	전문가	마그네슘을 과다하게 섭취하게 되면 설사가 발생할 수 있어요. 설사가 있다면 즉시 섭취를 멈추거나 먹는 양을 줄이시면 돼요.	마그네슘 과다섭취	https://kormedi.com/1397863/%EB%A7%88%EA%B7%B8%EB%84%A4%EC%8A%98%EC%9D%B4-%EC%A7%84%EC%A7%9C-%EC%A2%8B%EC%95%84-%EA%B3%BC%EB%9F%89-%EC%84%AD%EC%B7%A8-%EC%A3%BC%EC%9D%98%ED%95%98%EC%84%B8%EC%9A%94/	2022/05/14	0	2022-08-02 12:12:08	2022-08-02 12:42:46
BK22001912	19	질문자	큰 문제는 없어서 다행이에요. 하루에 먹어야 하는 마그네슘은 어느 정도인가요?				0	2022-08-02 12:12:08	2022-08-02 12:42:46
BK22001912	20	전문가	하루 권장량은 남자 350mg, 여자 250mg 정도인데 이 수치는 일반적인 거고 모든 사람에게 똑같이 적용되는 건 아니에요. 평소 신경을 많이 쓰는 편이거나 활동량이 많다면 좀 더 보충하는 것이 좋아요.	마그네슘 권장량	https://www.chosun.com/special/special_section/2021/10/27/VLP7PNXPJ5BFTIIIHW5DYRRO7A/	2021/10/27	0	2022-08-02 12:12:08	2022-08-02 12:42:46
BK22001912	21	질문자	먹고 있는 영양제의 마그네슘 함량을 체크해 봐야겠네요. 오늘 많이 알려줘서 고마워요. 내일 봐요.				1	2022-08-02 12:12:08	2022-08-02 13:07:22
