id	utterance_id	role	text	search_query	search_URL	reference_date	terminate	regDate	updDate
BK22000023	1	질문자	제 친구가 극단적인 다이어트를 했더니 면역체계가 무너졌나봐요. 대상포진에 걸렸다고 해요.				0	2022-07-20 16:03:26	2022-08-02 12:01:32
BK22000023	2	전문가	어머, 대상포진이요? 그거 엄청 아플텐데. 물집을 동반한 발진이 몸에 나타나잖아요. 그래서 처음에는 두드러기로 착각할 수도 있어요.	대상포진	https://ko.wikipedia.org/wiki/%EB%8C%80%EC%83%81%ED%8F%AC%EC%A7%84	2022/06/04	0	2022-07-20 16:03:26	2022-07-21 09:06:31
BK22000023	3	질문자	맞아요. 처음에는 두드러기인 줄 알고 피부과에 갔는데 대상포진으로 진단 받았다네요.				0	2022-07-20 16:03:26	2022-08-02 12:01:32
BK22000023	4	전문가	대상포진은 두드러기랑 전혀 달라요. 일반적으로 두드러기는 긁으면 벌레 물린 것처럼 크고 넓게 생겼는데 대상포진은 다양하게 나타나죠. 또 둘의 큰 차이점은 대상포진은 붉은 반점이 생길 수 있고 물집도 생기죠. 대부분 대상포진이 더 아프기 때문에 빠른 진단과 치료가 필요해요.	대상포진 두드러기 차이	https://www.ytn.co.kr/_ln/0105_202111051231592103	2021/11/05	0	2022-07-20 16:03:26	2022-07-21 09:06:31
BK22000023	5	질문자	그럼 대상포진의 경우 초기부터 통증이 발생하나요?				0	2022-07-20 16:03:26	2022-08-02 12:01:32
BK22000023	6	전문가	음, 대부분 초기에는 감기 몸살 비슷한 증상이 발생하고 며칠 뒤부터 붉은 발진이 얼굴이나 가슴, 허리, 팔 등에 무리지어 생겨나요. 그리고 발진이 생기기 전에는 가렵거나 찌르는 통증이 나타나기에 다른 질병으로 오인하는 경우가 많죠.	대상포진 초기증상	http://news.kmib.co.kr/article/view.asp?arcid=0924239962&code=14130000&cp=nv	2022/04/12	0	2022-07-20 16:03:26	2022-07-21 09:06:31
BK22000023	7	질문자	그런데 대상포진의 원인은 대부분 면역체계의 문제이기에 그냥 시간이 지나면 서서히 괜찮아 질 것 같기도 해요.				0	2022-07-20 16:03:26	2022-08-02 12:01:32
BK22000023	8	전문가	오, 그렇지 않아요. 빠르게 치료하지 않으면 대상포진 합병증에 시달릴 거예요. 가장 흔한 것은 신경통인데, 바이러스로 인해 신경절이 파괴되어 생기는 통증이 수 주에서 수 년 간 지속되는 것을 말하죠.	대상포진 합병증	https://health.chosun.com/site/data/html_dir/2022/06/02/2022060201811.html	2022/06/02	0	2022-07-20 16:03:26	2022-07-21 09:06:31
BK22000023	9	질문자	신경에 문제가 생긴다는게 이해가 되지 않아요.				0	2022-07-20 16:03:26	2022-08-02 12:01:32
BK22000023	10	전문가	대상포진 자체가 과거 수두에 감염되었던 사람이나 수두 예방접종 경험이 있는 사람을 대상으로 발생하는데, 그 바이러스가 감각신경절에 잠복해 있다 면역체계가 무너질 때 나타나기에 신경통과 관련이 있죠.	대상포진 신경통 이유	https://www.edaily.co.kr/news/read?newsId=01085686629280160&mediaCodeNo=257&OutLnkChk=Y	2021/12/19	0	2022-07-20 16:03:26	2022-07-21 09:06:31
BK22000023	11	질문자	그렇다면 신경통 치료제는 현재 개발된 상태인가요?				0	2022-07-20 16:03:26	2022-08-02 12:01:32
BK22000023	12	전문가	음, 얼마 전 삼익제약이 대상포진 후 신경통 치료제 개발에 박차를 가했어요. 지금까지 대상포진 후 신경통 환자들은 약물치료로 완화되지 않는 경우가 많았는데, 현재 임상실험이 성공한다면 환자 삶에 큰 희망이 되는 것이죠.	대상포진 치료제 개발	http://www.kukinews.com/newsView/kuk202205240039	2022/05/24	0	2022-07-20 16:03:26	2022-07-21 09:06:31
BK22000023	13	질문자	후유증 치료제가 아직 개발 단계라니, 생각보다 무서운 병이네요. 대상포진 예방을 위해서라도 면역체계를 유지해야겠어요.				0	2022-07-20 16:03:26	2022-08-02 12:01:32
BK22000023	14	전문가	네, 면역력 저하가 큰 원인이기 때문에 평소 규칙적인 생활과 안정적인 영양섭취 및 정신적 안정이 중요하죠. 그리고 예방접종도 큰 도움이 돼요.	대상포진 치료	https://www.yakup.com/news/index.html?mode=view&cat=12&nid=268943	2022/05/02	0	2022-07-20 16:03:26	2022-07-21 09:06:31
BK22000023	15	질문자	대상포진에도 예방접종이 있는지 몰랐어요.				0	2022-07-20 16:03:26	2022-08-02 12:01:32
BK22000023	16	전문가	대상포진 예방을 위해 미리미리 주사를 맞는 것이 좋아요. 보통 60세 이상 성인에서 1회 접종, 이미 발병한 경우에는 회복 후 6개월이 지나 맞는 것을 권장하죠.	대상포진 예방접종	https://kormedi.com/1400269/%ec%bd%94%eb%a1%9c%eb%82%98-%eb%b0%b1%ec%8b%a0%eb%a7%8c-%ec%84%b1%ec%9d%b8%eb%8f%84-%eb%8b%a4%ec%8b%9c-%ec%a0%91%ec%a2%85%ed%95%b4%ec%95%bc-%ed%95%a0-%ec%98%88%eb%b0%a9%ec%a0%91%ec%a2%85/	2022/05/27	0	2022-07-20 16:03:26	2022-07-21 09:06:31
BK22000023	17	질문자	지금까지 대상포진 관련 주사는 한 번도 맞아보지 않았는데 지금 당장 알아봐야 겠어요.				0	2022-07-20 16:03:26	2022-08-02 12:01:32
BK22000023	18	전문가	네 미리미리 알아보고 예방하면 좋죠. 후유증도 크고 당시의 고통이 큰 질병이니까요.				0	2022-07-20 16:03:26	2022-07-21 09:06:31
BK22000023	19	질문자	대상포진 걸린 친구에게도 얼른 정보 알려줘야 겠네요. 정보 감사합니다.				0	2022-07-20 16:03:26	2022-08-02 12:01:32
BK22000023	20	전문가	네 친구분께 어서 완쾌하시라고 전달 부탁드려요.				1	2022-07-20 16:03:26	2022-07-21 09:13:28
