id	utterance_id	role	text	search_query	search_URL	reference_date	terminate	regDate	updDate
BK22004975	1	질문자	요즘에 계속 흉통이 느껴지는데, 심장 문제인가 싶어서 그쪽으로 검사를 해봤더니 심장엔 아무런 문제가 없대. 대체 왜 계속 흉통이 느껴지는 걸까?				0	2022-08-09 23:27:41	2022-08-09 23:27:41
BK22004975	2	전문가	심장은 문제가 전혀 없는데 흉통이 있다는 거지? 그렇다면, 한 번 역류성식도염을 의심해보는 것도 좋을 거 같아. 흉통의 40퍼센트 가량은 역류성식도염 내지 소화계 질환 때문에 발생하거든.	흉통의 원인	https://www.mk.co.kr/news/culture/view/2022/08/682476/	2022/08/03	0	2022-08-09 23:27:41	2022-08-09 23:27:41
BK22004975	3	질문자	어, 역류성식도염은 어떤 질환이야? 그런 병명은 처음 들어봤어.				0	2022-08-09 23:27:41	2022-08-09 23:27:41
BK22004975	4	전문가	위에 있던 내용물이 조금씩 반복해서 식도로 역류하게 되면, 식도 점막이 손상될 수 있어. 이렇게 해서 염증이 나타나게 되면, 이걸 역류성식도염이라고 부르지.	역류성식도염이란	https://www.dongascience.com/news.php?idx=52463	2022/02/18	0	2022-08-09 23:27:41	2022-08-23 14:34:36
BK22004975	5	질문자	음, 어떤 병인지 느낌은 대충은 알 거 같아. 그럼 역류성식도염은 대체 왜 생기는 거야?				0	2022-08-09 23:27:41	2022-08-09 23:27:41
BK22004975	6	전문가	습관 때문에 역류성식도염이 생기기도 하는데, 가령 과식 직후나 야식을 먹은 다음에 바로 눕는 습관이 있다면, 역류성식도염이 생길 수도 있어. 그 외에도 흡연이나 음식이 원인이 될 수 있는데, 괄약근 쪽의 압력이 낮아지게 만드는 기름진 음식이나, 음주, 초콜릿 등 그리고 심지어 커피마저도 역류성 식도염의 주요한 원인이 될 수 있지.	역류성 식도염 원인	https://www.koscaj.com/news/articleView.html?idxno=224404	2022/01/14	0	2022-08-09 23:27:41	2022-08-23 14:34:36
BK22004975	7	질문자	이런, 내가 커피를 하루에 여러 잔 마시는 편이기는 해. 그럼 나도 역류성식도염일 수 있겠네. 혹시 역류성식도염의 증상엔 뭐가 더 있을까?				0	2022-08-09 23:27:41	2022-08-09 23:27:41
BK22004975	8	전문가	일단 아까 말했 듯 흉통도 있지만, 역류성식도염의 대표적인 증상은 속쓰림과 위산의 역류 현상이야. 하지만, 그 외에도 다른 질환으로 착각할 만한 다른 증상들이 나타나기도 해. 가령 인후와 후두의 통증과 이물감, 만성적인 기침, 그리고 음식을 잘 섭취하기 힘든 현상 등이 발생하기도 하지.	역류성 식도염 대표적 증상은	https://www.hidoc.co.kr/healthstory/news/C0000371400	2018/04/04	0	2022-08-09 23:27:41	2022-08-23 14:34:36
BK22004975	9	질문자	으음, 왠지 나도 역류성식도염이 맞는 거 같아. 사실, 흉통 뿐만 아니라 기침이랑, 인후 쪽의 통증도 없지 않거든. 그러면 혹시, 역류성식도염을 악화시키지 않으려면 어떻게 해야 할까?				0	2022-08-09 23:27:41	2022-08-09 23:27:41
BK22004975	10	전문가	일단, 야식 내지 늦은 식사는 피하도록 해. 이 두 개는 역류성식도염을 악화시키는 주요 원인이거든. 실제로, 미국 소화기학회인 ACG에 따르면, 역류성식도염 환자들에게 식사를 마친 뒤 3시간이 지나기 전에는 잠자리에 들지 않아야 한다고 조언했어.	역류성식도염 악화	https://health.chosun.com/site/data/html_dir/2022/02/10/2022021002385.html	2022/02/11	0	2022-08-09 23:27:41	2022-08-23 14:34:36
BK22004975	11	질문자	응, 이 참에 야식은 끊는 게 좋겠다. 그러면 혹시, 역류성식도염이 있을 때 섭취하면 위에 도움이 되는 음식도 있을까?				0	2022-08-09 23:27:41	2022-08-09 23:27:41
BK22004975	12	전문가	양배추와 브로콜리를 위에 좋은 음식의 예로 들 수 있어. 이 둘은 위 점막에 좋은 비타민K와 U가 충분하거든. 특히, 비타민U는 위 점막을 보호할 뿐만 아니라, 위산 내지 자극적인 음식을 섭취하는 바람에 손상되었던 위벽을 회복시키는 효능도 있어.	역류성 식도염 위에 좋은 음식	https://www.chosun.com/special/special_section/2022/07/06/2VP4UAUWVZA7DB6KNO32WYPUCA/	2022/07/06	0	2022-08-09 23:27:41	2022-08-23 14:34:36
BK22004975	13	질문자	그러면 이번에 장 보면서 양배추를 조금 사와야겠다. 그러면 혹시, 역류성식도염이 있을 때 위장이 역류하는 걸 막을 수 있는 다른 방법도 있을까?				0	2022-08-09 23:27:41	2022-08-09 23:27:41
BK22004975	14	전문가	잠을 잘 때 조금 신경 써주는 것으로도 위장의 역류를 막을 수 있어. 가령, 잠자리에서 침대머리를 15도 올리는 것도 도움이 될 수 있지. 그 외에도 잠을 잘 때의 자세도 중요한데, 오른쪽 방향으로 눕기보단 왼쪽 방향으로 누워주면 내용물의 역류를 막는데 도움이 돼.	위장 역류 막는 법 역류성식도염	http://www.busan.com/view/busan/view.php?code=2022080417131236842	2022/08/08	0	2022-08-09 23:27:41	2022-08-09 23:27:41
BK22004975	15	질문자	으음, 시도는 해보겠지만, 내가 잠버릇이 좀 고약하다 보니 자면서 계속 자세가 바뀔 거 같긴 해. 혹시 이거 말고도, 역류성식도염을 극복하는데 도움이 되는 다른 방법이 없을까?				0	2022-08-09 23:27:41	2022-08-09 23:27:41
BK22004975	16	전문가	복부 비만이 생기지 않도록, 평균 체중을 유지하도록 신경 써주는 것도 좋아. 복부 비만이 생길 경우 위 쪽에 가해지는 압력이 높아지는데, 이러면 역류가 발생할 수도 있거든.	역류성 식도염 극복 도움	https://dk.asiae.co.kr/article/2020080413463659604	2020/08/04	0	2022-08-09 23:27:41	2022-08-18 17:02:02
BK22004975	17	질문자	아, 요즘 내가 복부에 살이 좀 붙긴 했는데, 어쩌면 이것도 역류성식도염의 원인 중 하나가 되었을지도 모르겠네. 안 그래도 다이어트 생각을 하긴 했는데, 이 참에 좀 열심히 살을 빼야겠다.				0	2022-08-09 23:27:41	2022-08-09 23:27:41
BK22004975	18	전문가	응, 다이어트를 시도해보는 것도 좋은 생각일 거 같아.				0	2022-08-09 23:27:41	2022-08-09 23:27:41
BK22004975	19	질문자	그러게 말이야, 아무튼 질문에 답해줘서 고마워! 더 이야기 나누고 싶지만, 나는 이만 오늘 마감인 과제가 있어서 들어가 볼게.				0	2022-08-09 23:27:41	2022-08-09 23:27:41
BK22004975	20	전문가	그래, 과제 작업 잘하고, 다음에 다시 이야기 나누자.				1	2022-08-09 23:27:41	2022-08-23 14:34:36
