id	utterance_id	role	text	search_query	search_URL	reference_date	terminate	regDate	updDate
BK22000946	1	질문자	요즘 계속 우울하고, 시도때도 없이 눈물이 날 것 같은 기분이 되네. 왜 그럴까?				0	2022-07-20 16:11:55	2022-08-02 12:01:32
BK22000946	2	전문가	우울증이 아닐까 싶기도 하네. 그렇게 심한 우울 상태가 반복되면 반복성 우울장애로 진단하고 심리 치료와 함께 약물 치료를 하기도 해.	우울증	https://ko.wikipedia.org/wiki/%EC%9A%B0%EC%9A%B8%EC%A6%9D	2022/06/03	0	2022-07-20 16:11:55	2022-07-21 10:10:33
BK22000946	3	질문자	나 정말 우울증일까? 혹시 우울증 전조 증상이 있어?				0	2022-07-20 16:11:55	2022-08-02 12:01:32
BK22000946	4	전문가	우울감, 무기력감, 불안, 식욕장애, 수면장애, 자살 충동같은 것이 증상으로 나타날 수 있어.	우울증 전조증상	https://ko.wikipedia.org/wiki/%EC%9A%B0%EC%9A%B8%EC%A6%9D	2022/06/03	0	2022-07-20 16:11:55	2022-07-21 10:10:33
BK22000946	5	질문자	나는 최근 내 자기 혐오, 증오감으로 마음이 슬프고 힘들었어. 이런 것도 우울증의 한 증상일까?				0	2022-07-20 16:11:55	2022-08-02 12:01:32
BK22000946	6	전문가	그랬구나, 그럴 수 있어. 그런 자기증오는 경계선 성격장애의 증상이기도 하고, 우울증과 같은 기분 장애의 증상이기도 해.	자기혐오	https://ko.wikipedia.org/wiki/%EC%9E%90%EA%B8%B0%ED%98%90%EC%98%A4	2022/02/27	0	2022-07-20 16:11:55	2022-07-21 10:10:33
BK22000946	7	질문자	우울해서 그렇게 내 외모가 혐오스러웠을까? 우울증은 어떻게 치료할 수 있어?				0	2022-07-20 16:11:55	2022-08-02 12:01:32
BK22000946	8	전문가	우울증 치료하면 약물 치료가 제일 먼저 떠오르지. 그렇지만 약에 의존하지 않고 우울의 근본적인 이유를 찾아 그 이유를 해소 시키는 것이 우선시 되어야 해.	우울증 치료	http://www.biotimes.co.kr/news/articleView.html?idxno=8052	2022/06/17	0	2022-07-20 16:11:55	2022-07-21 10:10:33
BK22000946	9	질문자	그럼 혹시 다이어트 약이 우울증을 유발하기도 할까?				0	2022-07-20 16:11:55	2022-08-02 12:01:32
BK22000946	10	전문가	다이어트약에는 많은 부작용이 있을 수 있는데, 장기 복용 시엔 우울증이 부작용으로 나타날 수 있어. 그게 악화되면 자살 충동까지 생기기도 해.	다이어트약 우울증	https://www.chosun.com/national/welfare-medical/2021/10/07/UFEDLNORFVHPTJ47CXCFERBUAE/	2021/10/07	0	2022-07-20 16:11:55	2022-07-21 10:10:33
BK22000946	11	질문자	그럴 수도 있구나. 살 찐 것 때문에 스트레스가 커지는 것 같아 얼마 전에 처방을 받아 먹기 시작했거든.				0	2022-07-20 16:11:55	2022-08-02 12:01:32
BK22000946	12	전문가	다이어트약이 우울증의 원인이 아니라해도 또 다른 부작용이 있을 수 있으니 우선은 끊어보는 게 좋겠어.				0	2022-07-20 16:11:55	2022-07-21 10:10:33
BK22000946	13	질문자	그래야겠다. 우울증은 완치가 어려운 병이라는 말을 들었는데, 그게 사실이야?				0	2022-07-20 16:11:55	2022-08-02 12:01:32
BK22000946	14	전문가	우울증을 처음 치료받을 때는 완치율이 꽤 높지만 지속적인 치료를 안하면 2년 내로 재발하는 비율이 50에서 70퍼센트라는 연구결과가 있어.	우울증 완치	https://www.healthinnews.co.kr/news/articleView.html?idxno=21956	2021/02/24	0	2022-07-20 16:11:55	2022-07-21 10:10:33
BK22000946	15	질문자	어느 정도로 치료가 되어야 완치가 되었다고 진단받을 수 있을까?				0	2022-07-20 16:11:55	2022-08-02 12:01:32
BK22000946	16	전문가	사실 우울증은 재발이 흔하다고 재발을 경고하는 경우는 많아도 깨끗이 다 나았다는 기준을 찾기는 힘들어.	우울증 치료 기간	http://www.whosaeng.com/115776	2020/02/13	0	2022-07-20 16:11:55	2022-07-21 10:10:33
BK22000946	17	질문자	왠지 점점 더 막막하고 자신이 없어지네. 그래도 주위에선 다들 우울증을 감기처럼 생각하라고, 자주 걸리고 많이들 걸리는 것이라고 북돋아주더라.				0	2022-07-20 16:11:55	2022-08-02 12:01:32
BK22000946	18	전문가	분명 우울증은 주변에서 용기를 북돋는다고 저절로 낫는 병은 아니지만, 절대로 심약한 사람만이 걸리는 병이 아니라는 점을 기억해야 해. 특별한 스트레스 없이도 생길 수 있는 뇌의 병이라고 인식만 하고 있으면 마음이 좀 나을거야.	우울증 감기	https://www.seoul.co.kr/news/newsView.php?id=20171226020002	2017/12/26	0	2022-07-20 16:11:55	2022-07-21 10:10:33
BK22000946	19	질문자	일단 정확한 진단을 위해서 병원에 가보려고는 했었어. 객관적인 사실로 나를 안심 시켜줘서 고맙다.				0	2022-07-20 16:11:55	2022-08-02 12:01:32
BK22000946	20	전문가	네가 힘들어하니 맘이 아프지만, 너무 지레 겁 먹을 필요 없어. 병원에 다녀오고 나면 나에게도 어떤지 알려줘. 기다릴게!				1	2022-07-20 16:11:55	2022-07-21 15:14:55
