id	utterance_id	role	text	search_query	search_URL	reference_date	terminate	regDate	updDate
BK22012573	1	질문자	그동안 미뤄왔던 건강검진을 받을려고 합니다. 처음이라 궁금한게 많은데 건강검진에도 종류가 있나요?				0	2022-09-30 15:18:02	2022-10-01 15:59:21
BK22012573	2	전문가	건강검진에는 여러 종류가 있는데 특수검진, 종합검진, 기타 검진을 비롯한 국가건강검진 등이 있습니다.	건강검진 종류	http://medicalworldnews.co.kr/news/view.php?idx=1510950744	2022/07/15	0	2022-09-30 15:18:02	2022-10-01 15:59:21
BK22012573	3	질문자	그중 국가건강검진을 받을려고 하는데 어떤 항목들이 있나요?				0	2022-09-30 15:18:02	2022-10-01 15:59:21
BK22012573	4	전문가	건강검진은 신체를 모두 통틀어서 기능과 상태를 자세하게 검사하기 때문에 항목 범위가 다양하고 넓습니다. 그중 가장 중심이 되는 항목은 5대 암 검진입니다.	국가건강검진 항목	http://www.jeollailbo.com/news/articleView.html?idxno=660832	2022/06/30	0	2022-09-30 15:18:02	2022-10-01 15:59:21
BK22012573	5	질문자	5대 암 이라면 어떤 암을 말하는 건가요?				0	2022-09-30 15:18:03	2022-10-01 15:59:21
BK22012573	6	전문가	5대 암으로는 간암, 대장암, 유방암, 위암, 자궁경부암을 말합니다. 그중 건강검진 필수라고 할 수 있는 암은 위암, 대장암인데 조기 발견하여 치료하면 완치율과 생존율이 높기 때문입니다.	5대암	https://sports.donga.com/article/all/20220321/112445855/2	2022/03/21	0	2022-09-30 15:18:03	2022-10-01 15:59:21
BK22012573	7	질문자	저는 40대인데 5대 암 검사를 다 받을 수 있나요?				0	2022-09-30 15:18:03	2022-10-01 15:59:21
BK22012573	8	전문가	연령대별 검사 종류가 다른데 자궁경부암은 만 20세 이상의 여성, 간암과 유방암은 만 40세 이상, 위암과 대장암은 만 50세 이상자만 검사 가능합니다.	40대 국가건강검진	https://www.nbntv.co.kr/news/articleView.html?idxno=218492	2020/03/12	0	2022-09-30 15:18:03	2022-10-01 15:59:21
BK22012573	9	질문자	그럼 국가건강검진 비용은 어느 정도인가요?				0	2022-09-30 15:18:03	2022-10-01 15:59:21
BK22012573	10	전문가	공단에서 검진 비용을 전부 지불하므로 본인 부담은 적습니다. 그러나 국가건강검진에서 할 수 있는 검사들은 모든 질병을 파악하기 힘들므로 개개인의 상태별로 꼭 필요한 검사들은 추가해서 받는게 좋습니다.	국가건강검진 비용	https://view.asiae.co.kr/article/2021102218042152815	2021/10/23	0	2022-09-30 15:18:03	2022-10-01 15:59:21
BK22012573	11	질문자	혹시 검사 전 주의해야 할 점이 있을까요?				0	2022-09-30 15:18:03	2022-10-01 15:59:21
BK22012573	12	전문가	확실한 검사를 위해 건강검진 전에는 음식을 먹지 말아야  하는데 검진 하루 전 저녁 9시부터는 공복 상태를 유지해야 합니다.	국가건강검진 주의	https://www.nbntv.co.kr/news/articleView.html?idxno=695293	2019/11/14	0	2022-09-30 15:18:03	2022-10-01 15:59:21
BK22012573	13	질문자	검사 전날 금식을 하고 예약 하지 않고도 검사 가능한가요?				0	2022-09-30 15:18:03	2022-10-01 15:59:21
BK22012573	14	전문가	건강검진을 받을 때는 반드시 예약을 하셔야 되며 국민건강보험공단 건강검진 지정기관이 맞는지도 확인 하셔야 합니다.	국민건강검진 예약	https://www.etoday.co.kr/news/view/1710445	2019/01/14	0	2022-09-30 15:18:03	2022-10-01 15:59:21
BK22012573	15	질문자	예약을 하고도 못 받을 경우는 연장도 가능한가요?				0	2022-09-30 15:18:03	2022-10-01 15:59:21
BK22012573	16	전문가	네. 국가건강검진을 올해까지 받지 못하면 추가로 요청하셔서 내년에 검진을 받을 수 있습니다.	국가건강검진 연장	https://www.yna.co.kr/view/AKR20191203144800017	2019/12/04	0	2022-09-30 15:18:03	2022-10-01 15:59:21
BK22012573	17	질문자	연장도 된다고 하니 바빠서 못 받으면 어쩌나 했는데 안심이 됩니다.				0	2022-09-30 15:18:03	2022-10-01 15:59:21
BK22012573	18	전문가	바쁘시더라도 계속 미루지 마시고 올해에는 꼭 받으셨으면 좋겠습니다.				0	2022-09-30 15:18:03	2022-10-01 15:59:21
BK22012573	19	질문자	전문가님 말씀대로 이번 연도에는 받도록 하겠습니다.				0	2022-09-30 15:18:03	2022-10-01 15:59:21
BK22012573	20	전문가	건강검진 미리미리 받으셔서 건강 챙기세요.				1	2022-09-30 15:18:03	2022-10-01 15:59:21
