id	utterance_id	role	text	search_query	search_URL	reference_date	terminate	regDate	updDate
BK22012353	1	질문자	저는 수족냉증이라 손과 발이 너무 시려요. 수족냉증의 원인은 정확히 뭐예요?				0	2022-09-30 15:10:30	2022-10-01 12:03:58
BK22012353	2	전문가	수족냉증은 외부에서 느껴지는 추위나 다양한 자극으로 인해 혈관이 수축하고, 손과 발 그리고 말초 부분까지 혈액이 정상적으로 공급되지 않아서 차가워지는 것입니다.	수족냉증 증상 원인	http://www.ftimes.kr/news/articleView.html?idxno=13990	2021/10/31	0	2022-09-30 15:10:30	2022-10-01 12:03:58
BK22012353	3	질문자	그렇다면 수족냉증을 예방할 수 있는 방법은 있나요?				0	2022-09-30 15:10:30	2022-10-01 12:03:58
BK22012353	4	전문가	네, 손과 발을 따뜻하게 하는 것입니다. 그리고 손과 발 이외에도 옷을 따뜻하게 입어서 몸 전체의 온도를 높여 주는 게 좋습니다.	수족냉증 증상 예방	https://www.hidoc.co.kr/healthstory/news/C0000651862	2021/11/25	0	2022-09-30 15:10:30	2022-10-01 12:03:58
BK22012353	5	질문자	몸 전체의 온도가 유지될 수 있게 따뜻한 옷을 입으라는 말씀이시군요. 그 밖의 예방법은 뭐가 있을까요?				0	2022-09-30 15:10:30	2022-10-01 12:03:58
BK22012353	6	전문가	그 외에도 운동이나 반신욕 등을 하며 혈액순환을 촉진시키면 도움이 됩니다. 또, 혈관은 스트레스에 취약하기 때문에 적절한 휴식과 깊은 수면을 취하는 것도 좋습니다.	수족냉증 예방	https://www.hidoc.co.kr/healthstory/news/C0000651862	2021/11/25	0	2022-09-30 15:10:30	2022-10-01 12:03:58
BK22012353	7	질문자	그렇군요. 혈액이 순환할 수 있도록 운동이나 반신욕으로 열을 내는 거네요.그런데 다양한 예방법들을 해 봐도 나아지지 않는다면 어떡하죠?				0	2022-09-30 15:10:31	2022-10-01 12:03:58
BK22012353	8	전문가	사실 수족냉증은 진단명이 아니라 증상이기 때문에 검사가 꼭 필요해요. 원인을 찾아야 하거든요.	수족냉증 원인	http://www.knnews.co.kr/news/articleView.php?idxno=1370544	2021/02/21	0	2022-09-30 15:10:31	2022-10-01 12:03:58
BK22012353	9	질문자	혹시 큰 병으로 인해서 수족냉증 증상이 나타나는 것은 아닐지 상상하니, 너무 걱정돼요.				0	2022-09-30 15:10:31	2022-10-01 12:03:58
BK22012353	10	전문가	가장 흔한 원인은 단순한 혈액순환장애입니다. 하지만 이상감각이 느껴지는 말초신경 질환이 원인이거나, 체온을 낮추고 대사장애를 일으킬 수 있는 갑상선 질환이 원인일 수도 있습니다. 또 자가면역장애로 인한 류머티즘성 질환, 경추와 요추에서 생긴 협착증이나 디스크도 수족냉증의 원인이 될 수 있습니다.	수족냉증 원인 질병	http://www.knnews.co.kr/news/articleView.php?idxno=1370544	2021/02/21	0	2022-09-30 15:10:31	2022-10-01 12:03:58
BK22012353	11	질문자	말씀을 듣고 보니 병원에 꼭 가봐야겠어요.				0	2022-09-30 15:10:31	2022-10-01 12:03:58
BK22012353	12	전문가	네, 좋은 판단입니다. 수족냉증을 관리하면서 증세를 호전시키기 위해서는 원인 질환을 발견하여 적극적으로 치료하는 것이 무엇보다도 중요합니다.	수족냉증 질병	https://www.medipana.com/article/view.php?news_idx=271281&sch_menu=1&sch_gubun=5	2021/02/17	0	2022-09-30 15:10:31	2022-10-01 12:03:58
BK22012353	13	질문자	알았어요. 혹시 그 외에 주의해야 할 것들이 있나요?				0	2022-09-30 15:10:31	2022-10-01 12:03:58
BK22012353	14	전문가	카페인이 들어 있는 커피, 콜라와 같은 음료는 줄이는 게 좋습니다. 또 음주도 적정량만 마시는 것이 좋으며 흡연은 혈관이 수축되는 원인이 되기 때문에 하지 말아야 합니다.	수족냉증 음주	http://www.viva100.com/main/view.php?key=20200720010003676	2020/07/21	0	2022-09-30 15:10:31	2022-10-01 12:03:58
BK22012353	15	질문자	금연, 절주, 카페인 줄이기는 기본적인 것 같으면서도 지키기 어려운 것 같아요. 그래도 여름철에는 수족냉증 증상이 없겠죠?				0	2022-09-30 15:10:31	2022-10-01 12:03:58
BK22012353	16	전문가	수족냉증 환자들은 여름철에도 발생합니다. 무더운 여름인데도 특히 손발이 차가운 사람들이 있습니다.	여름 수족냉증	http://www.ikunkang.com/news/articleView.html?idxno=33876	2021/06/08	0	2022-09-30 15:10:31	2022-10-01 12:03:58
BK22012353	17	질문자	여름은 계속 덥기 때문에 상관없을 것 같은데요.				0	2022-09-30 15:10:31	2022-10-01 12:03:58
BK22012353	18	전문가	여름철의 냉방병은 수족냉증을 심해지게 하는 원인이 될 수 있습니다. 특히 평상시 수족냉증을 앓았다면 혈액 흐름의 변화 때문에 얼굴이나 손과 발에 차가운 감각이 느껴지기도 하고, 이와는 정 반대로 얼굴이 화끈거리고, 가슴이 두근거리는 일도 생깁니다.	수족냉증 냉방병	https://sports.khan.co.kr/bizlife/sk_index.html?art_id=202007070700013&sec_id=561801&pt=nv	2020/07/07	0	2022-09-30 15:10:31	2022-10-01 12:03:58
BK22012353	19	질문자	여름철에는 어떻게 수족냉증을 예방해야 하죠?				0	2022-09-30 15:10:32	2022-10-01 12:03:58
BK22012353	20	전문가	에어컨 바람이 나오는 방향을 사람이 적은 곳으로 맞추는 게 좋습니다. 또 차가운 에어컨 바람이 몸에 직접 닿는 것을 방지하기 위해 긴소매의 겉옷을 입거나, 양말을 신는 것도 도움이 됩니다.	수족냉증 냉방병	https://sports.khan.co.kr/bizlife/sk_index.html?art_id=202007070700013&sec_id=561801&pt=nv	2020/07/07	0	2022-09-30 15:10:32	2022-10-01 12:03:58
BK22012353	21	질문자	그렇군요, 자세히 설명해 주셔서 감사합니다.				1	2022-09-30 15:10:32	2022-10-01 12:03:58
