id	utterance_id	role	text	search_query	search_URL	reference_date	terminate	regDate	updDate
BK22005543	1	질문자	어젯밤부터 온몸이 가려워서 박박 긁느라 잠을 제대로 못 잤어.				0	2022-08-14 03:34:39	2022-08-14 03:34:39
BK22005543	2	전문가	밤새 긁었으면 가려운 정도가 심했을 텐데 굉장히 고통스러웠겠네.				0	2022-08-14 03:34:39	2022-08-14 03:34:39
BK22005543	3	질문자	어제 시골에서 보내주신 과일과 야채들을 싹 다 정리했는데 그것 때문에 그런가? 맨손으로 하나하나 씻고 정리 해서 넣었는데 그게 원인인가 싶기도 해. 그 이후부터 몸이 가려운데 이런 증상을 접촉 피부염이라고 하는 거지?				0	2022-08-14 03:34:39	2022-08-14 12:56:31
BK22005543	4	전문가	음 접촉 피부염은 가려움을 일으키는 자극이 되는 물질이나 혹은 알레르기 유발 물질이 피부와 접촉했을 때 반응을 하는 질환이야. 이때 염증 반응이 나타나는데 이 증상이 심할수록 가려움이 심하거든. 원인을 딱 단정 짓기가 애매하긴 하네.	가려운 병	https://www.joongang.co.kr/article/25094042	2022/08/13	0	2022-08-14 03:34:39	2022-08-14 12:56:31
BK22005543	5	질문자	딱 내 증상이랑 유사하네. 아무래도 어제 씻고 정리한 과일 중에 나랑 안 맞는 게 있었던 것 같아. 특정 과일이랑 안 맞을 경우 알레르기 반응이 나타나기도 하지?				0	2022-08-14 03:34:39	2022-08-14 12:56:31
BK22005543	6	전문가	그치. 네가 봄철 나무인 삼나무, 자작나무 꽃가루에 반응 한다면 사과, 복숭아, 토마토 등에 알레르기 증상을 있을 수 있어. 가을철에 날리는 돼지풀, 쑥과 같은 잡초 꽃가루에 알레르기 반응을 일으킨다면 수박, 오잉, 호박, 바나나는 특별히 조심해야 해.	접촉 피부염 과일	https://ilyo.co.kr/?ac=article_view&entry_id=414335	2021/10/20	0	2022-08-14 03:34:39	2022-08-14 12:56:31
BK22005543	7	질문자	어떤 게 문제였는지 궁금해. 다행히 어제보다는 좀 가라앉았는데 이대로 방치해도 되나?				0	2022-08-14 03:34:39	2022-08-14 12:56:31
BK22005543	8	전문가	증상이 가벼운 경우에는 원인이 되는 물질과 최대한 접촉하지 않는 게 우선이지. 증상이 심할 경우 병원에 가서 전문가와의 상담을 통해 약물 치료를 받는 게 좋고.	접촉 피부염 관리	https://www.dailian.co.kr/news/view/403383/?sc=naver	2013/11/11	0	2022-08-14 03:34:39	2022-08-14 12:56:31
BK22005543	9	질문자	휴 처음 겪는 일이라서 너무 당황스러워. 보통 접촉 피부염이 발생할 경우 두드러기가 올라올 수도 있는 거지? 이때 어떤 증상이 같이 동반되는 거야?				0	2022-08-14 03:34:39	2022-08-25 15:23:13
BK22005543	10	전문가	그렇지. 피부의 특정 부위가 빨갛게 부어오르는 발적, 두드러기 증상이 나타날 수 있고 심할 경우에는 물집이 생겨서 진물이 흘러. 이때 피부 껍질이 벗겨질 수 있지. 동시에 가려움 증상이 나타나는데 피부 상태는 화상을 입었을 때처럼 메마르게 되고 건조해져.	두드러기 접촉 피부염	https://www.gokorea.kr/news/articleView.html?idxno=89571	2019/01/31	0	2022-08-14 03:34:39	2022-08-14 12:56:31
BK22005543	11	질문자	생각보다 증상이 많이 심각하구나. 주변 사람들의 이야기를 들어보니 두드러기가 생기는 경우가 꽤 많다고 하더라고. 생각보다 흔히 발생할 수 있는 질환이어서 그런지 그냥 넘어가는 경우도 많다던데?				0	2022-08-14 03:34:39	2022-08-14 12:56:31
BK22005543	12	전문가	사실 두드러기는 전 세계 인구의 약 15에서 20프로가 평생 한 번은 겪는 피부 질환인데, 단순 알레르기라고 판단하는 건 금물이야. 두드러기를 가벼운 증상으로 보고 방치할 경우 가려움증 때문에 고통받게 되고 삶의 질이 낮아질 수밖에 없거든. 심하게 긁으면 흉터로 이어지기 때문에 일생 생활에 지장을 줄 수도 있고 말이야. 적절한 치료 시기를 놓치는 경우 만성으로도 이어질 수 있으니 세심한 관리가 필요해.	면역 가려움	http://www.stardailynews.co.kr/news/articleView.html?idxno=327886	2022/08/12	0	2022-08-14 03:34:39	2022-08-14 12:56:31
BK22005543	13	질문자	이야기를 듣고 보니 가볍게 생각하고 넘길 질환은 아닌 것 같아. 그런데 이런 두드러기는 왜 생기는 거야? 면역력과 관련이 있나?				0	2022-08-14 03:34:39	2022-08-14 12:56:31
BK22005543	14	전문가	두드러기 증상은 장기의 부조화가 원인인데, 우리 몸의 면역체계가 무너지면서 그 이상 신호가 피부를 통해 나타나는 거지. 두드러기가 생기는 원인은 굉장히 다양한데 학계에서는 면역학적 관점에 가장 주목하고 있어.	두드러기 예방	https://www.pharmnews.com/news/articleView.html?idxno=208568	2022/08/10	0	2022-08-14 03:34:39	2022-08-14 12:56:31
BK22005543	15	질문자	그렇구나. 평상시에 면역력을 높이기 위해 운동도 열심히 하고 영양제도 잘 챙겨 먹어야겠네. 그런데 두드러기는 급성이 있고 또 만성이 있다고 들었는데 이걸 어떻게 구분하는 거야?				0	2022-08-14 03:34:39	2022-08-24 00:19:44
BK22005543	16	전문가	급성 두드러기는 말 그대로 짧게 몇 시간만 증상이 나타나고 길게는 며칠 이내에 증상이 나아져. 단, 6주 이상 이 증상이 계속될 경우에는 만성 두드러기로 분류하지.	두드러기 대책	https://www.hellot.net/news/article.html?no=70320	2022/08/05	0	2022-08-14 03:34:39	2022-08-24 00:19:44
BK22005543	17	질문자	증상이 호전되는 시기로 보면 되는구나. 마지막으로 두드러기가 생겼을 경우 특별히 조심해야 하는 게 있을까?				0	2022-08-14 03:34:39	2022-08-14 12:56:31
BK22005543	18	전문가	일단 몸을 덥거나 열이 나게 하는 건 되도록 피하는 게 좋아. 술, 맵고 뜨거운 음식, 자극적인 음식, 난방이나 목욕을 너무 뜨겁게 하는 건 최대한 지양해야 해. 아 스트레스는 만병의 근원이니 스트레스도 유의하는 게 좋고!	두드러기 식이	https://www.gokorea.kr/news/articleView.html?idxno=75160	2019/01/15	0	2022-08-14 03:34:39	2022-08-14 12:56:31
BK22005543	19	질문자	오케이. 앞으로는 두드러기가 와도 당황하지 않고 1차적인 대처는 할 수 있을 것 같아. 덕분에 많은 것들을 배우게 됐네.				0	2022-08-14 03:34:39	2022-08-14 12:56:31
BK22005543	20	전문가	일상생활에서 생각보다 자주 발현되는 증상인 만큼 기본적인 것만 알고 있어도 많은 도움이 될 거야. 의사한테 가서 진료를 받는 것이 가장 좋겠지만 상황에 따라 어려울 수도 있으니까 말이야.				0	2022-08-14 03:34:39	2022-08-14 12:56:31
BK22005543	21	질문자	그렇지. 아무튼 오늘 두드러기 박사가 된 것 같아. 자세히 알려줘서 정말 고마워,.				0	2022-08-14 03:34:39	2022-08-14 12:56:31
BK22005543	22	전문가	워낙 관심이 많은 분야에서 너무 많은 정보를 알려준 것 같아 머쓱하긴 하지만 도움이 되었으면 좋겠어. 궁금한 게 있으면 언제든 물어봐도 좋고!				1	2022-08-14 03:34:39	2022-08-25 15:23:13
BK22005543	23	질문자	덕분에 가려움 증상에 대해 전반적인 정보를 습득할 수 있어서 굉장히 뜻깊은 시간이었어. 다음에 또 궁금한 게 있으면 질문할게. 다시 한번 고마워.				0	2022-08-14 03:34:39	2022-08-14 12:56:31
