id	utterance_id	role	text	search_query	search_URL	reference_date	terminate	regDate	updDate
BK22006341	1	질문자	발바닥에 뭐가 생겼는데 이게 티눈인지 사마귀인지 어떻게 하면 알 수 있을까?				0	2022-08-24 17:16:37	2022-08-24 17:16:37
BK22006341	2	전문가	윗부분 각질을 제거해서 단단한 핵이 보이면 티눈이고, 안쪽에 검은 점이나 붉은색의 출혈 자국이 보이면 사마귀야.	티눈과 사마귀	http://www.dailypop.kr/news/articleView.html?idxno=61653	2022/07/28	0	2022-08-24 17:16:37	2022-08-24 17:16:37
BK22006341	3	질문자	그렇다면 사마귀가 난 것 같은 데, 왜 생긴 걸까?				0	2022-08-24 17:16:37	2022-08-24 17:16:37
BK22006341	4	전문가	사마귀는 인유두종 바이러스, HPV에 의한 피부질환으로 면역력이 약해지면 몸에 들어와서 발병해.	사마귀	https://www.jeonmae.co.kr/news/articleView.html?idxno=906761	2022/08/04	0	2022-08-24 17:16:37	2022-09-02 11:06:32
BK22006341	5	질문자	사마귀는 면역력이 약해지면 생기는 거구나. 발바닥 말고 아니고 다른 곳에도 생길 수 있어?				0	2022-08-24 17:16:37	2022-08-24 17:16:37
BK22006341	6	전문가	응, 얼굴, 목, 가슴, 배, 손, 발, 생식기 같은 몸의 어느 부분이나 생길 수 있어. 사마귀가 어디에 생겼는지와 생긴 원인에 따라 편평 사마귀, 수장족저 사마귀, 성기 사마귀, 물 사마귀 등으로 구분할 수 있어.	사마귀 구분	https://www.hidoc.co.kr/healthstory/news/C0000721557	2022/08/16	0	2022-08-24 17:16:37	2022-08-24 17:16:37
BK22006341	7	질문자	몸 어디에나 생길 수 있구나. 그럼, 사마귀는 전염되기도 해?				0	2022-08-24 17:16:37	2022-08-24 17:16:37
BK22006341	8	전문가	전염력이 강한 바이러스 질환이야. 다른 부위로 전염될 수 있고, 면역력이 약한 어린이나 노인들은 피부를 잠깐 접촉하기만 해도 전염될 수 있어.	사마귀 전염력	http://www.segyebiz.com/newsView/20220813504801?OutUrl=naver	2022/08/13	0	2022-08-24 17:16:37	2022-08-24 17:16:37
BK22006341	9	질문자	식구들에게 옮기지 않게 조심해야겠구나. 그럼, 집에서 손톱깎이로 제거하면 안 될까?				0	2022-08-24 17:16:37	2022-08-24 17:16:37
BK22006341	10	전문가	손으로 긁고 떼어내거나 손톱깎이 같은 것으로 도려내면 증상이 더 악화될 수 있어. 사마귀가 제거되는 것이 아니고 전염되거나 재발될 수 있거든. 손으로 사마귀를 없앤다고 만진 경우 손톱 근처에까지 바이러스가 전염될 수 있으니 주의해야 해.	사마귀 제거	https://www.hidoc.co.kr/healthstory/news/C0000608252	2021/06/09	0	2022-08-24 17:16:37	2022-08-24 17:16:37
BK22006341	11	질문자	절대로 집에서 제거하려고 하면 안 되는 거였네. 그럼, 빨리 치료받는 것이 좋겠구나.				0	2022-08-24 17:16:37	2022-08-24 17:16:37
BK22006341	12	전문가	응, 초기에 사마귀 개수 또는 크기가 작을 때 빨리 치료받도록 해.	사마귀 치료	https://www.jejutwn.com/news/article.html?no=119570	2022/01/15	0	2022-08-24 17:16:37	2022-09-02 11:06:32
BK22006341	13	질문자	병원에 가서 치료를 받아야겠구나. 병원에 가면 어떤 치료를 받는 데?				0	2022-08-24 17:16:37	2022-08-24 17:16:37
BK22006341	14	전문가	심하지 않으면 연고를 처방받게 될 거고, 혹시 많이 진행되었다면 액화질소를 이용한 냉동치료나 탄산가스 레이저 시술로 치료를 받을 거야. 경우에 따라서는 전기 소작법과 주사요법으로 치료받을 수도 있어.	사마귀 치료방법	https://www.hidoc.co.kr/healthstory/news/C0000688580	2022/04/20	0	2022-08-24 17:16:37	2022-08-24 17:16:37
BK22006341	15	질문자	병원에 가서 치료받으려니 너무 무섭네. 다음에는 사마귀가 생기지 않게 하는 것이 중요할 것 같은데 예방법은 뭐가 있을까?				0	2022-08-24 17:16:38	2022-08-24 17:16:38
BK22006341	16	전문가	사마귀는 면역력이 약해진 몸에 바이러스가 침투해서 감염되는 질환이니 바이러스에 취약해 지지 않도록 면역력과 피부 장벽을 강화시키는 것이 중요해.	사마귀 면역력	http://www.healthinnews.co.kr/news/articleView.html?idxno=27716	2022/02/09	0	2022-08-24 17:16:38	2022-08-24 17:16:38
BK22006341	17	질문자	면역력을 기르는 것이 중요한 거구나. 그렇다면 무리하지 않고 휴식을 취하는 것도 필요하겠네.				0	2022-08-24 17:16:38	2022-08-24 17:16:38
BK22006341	18	전문가	맞아, 물도 충분히 섭취하고 충분한 휴식과 수면을 취하는 것이 필요해.	사마귀 관리	http://sjbnews.com/news/news.php?number=747941	2022/06/10	0	2022-08-24 17:16:38	2022-08-24 17:16:38
BK22006341	19	질문자	발바닥에 생긴 것 때문에 걱정했는데, 네 덕에 사마귀인 것도 알고 치료법도 알게 되었네, 고마워.				0	2022-08-24 17:16:38	2022-08-24 17:16:38
BK22006341	20	전문가	병원에 가서 치료 잘 받아. 우리는 다음에 보자, 잘 가.				1	2022-08-24 17:16:38	2022-09-02 11:06:32
