id	utterance_id	role	text	search_query	search_URL	reference_date	terminate	regDate	updDate
BK22003875	1	질문자	이번에 언니가 유방암 진단을 받았어요. 알아보니 여성들이 정말 많이 걸리는 암이더라고요.				0	2022-08-04 11:16:26	2022-08-12 10:32:09
BK22003875	2	전문가	맞아요. 유방암은 여성 암 1위로 세계보건기구 WHO에 따르면 여성 암 사망 원인 1위에요. 전 세계적으로 유방암 환자는 계속 늘어나고 있고, 국내에서도 매년 2만 명에서 3만 명 정도의 유방암 환자들이 발생되고 있어요.	유방암 여성암 1위	https://www.rapportian.com/news/articleView.html?idxno=149652	2022/07/27	0	2022-08-04 11:16:26	2022-08-04 11:16:26
BK22003875	3	질문자	그래도 저희 언니는 아직 20대 후반밖에 되지 않았는걸요.				0	2022-08-04 11:16:27	2022-08-04 11:16:27
BK22003875	4	전문가	최근에는 젊은 여성들도 유방암에 많이 진단되고 있기 때문에 젊더라도 경각심을 갖고 정기적으로 유방 건강검진을 받아야 해요.	젊은 유방암 환자	https://www.rapportian.com/news/articleView.html?idxno=149652	2022/07/27	0	2022-08-04 11:16:27	2022-08-04 11:16:27
BK22003875	5	질문자	아, 그렇군요. 그러면 유방암의 증상에는 어떤 것들이 있나요?				0	2022-08-04 11:16:27	2022-08-16 10:48:05
BK22003875	6	전문가	유방이나 겨드랑이에 멍울이 생기는 게 유방암의 대표적인 증상이에요. 또 유두나 유륜 주변이 빨갛게 붓거나 유두가 갑자기 함몰된다면 유방암을 의심해 봐야 해요.	유방암 대표적인 증상	https://www.rapportian.com/news/articleView.html?idxno=149652	2022/07/27	0	2022-08-04 11:16:27	2022-08-04 11:16:27
BK22003875	7	질문자	그럼 증상이 있으면 병원에 가서 검사를 받아보면 되는 건가요?				0	2022-08-04 11:16:27	2022-08-04 11:16:27
BK22003875	8	전문가	이런 증상이 발견된 후에는 이미 암이 많이 진행이 됐다는 거예요. 사실 유방암 초기에는 대부분 증상이 없거든요. 그저 정기검진을 꾸준히 받는 방법 밖에는 없어요.	초기 유방암 증상	https://www.rapportian.com/news/articleView.html?idxno=149652	2022/07/27	0	2022-08-04 11:16:27	2022-08-04 11:16:27
BK22003875	9	질문자	정말 정기검진을 꾸준히 받아야 겠네요. 그럼 유방암의 생존율은 얼마나 되나요?				0	2022-08-04 11:16:27	2022-08-16 10:48:05
BK22003875	10	전문가	다행히 유방암은 조기에 발견하면 예후가 좋은 편이에요. 특히 0기나 1기면 생존율이 90퍼센트 이상이에요. 단 4기가 넘어가면 그땐 치료를 받아도 5년 생존율이 30퍼센트 미만으로 낮아져요. 그렇기 때문에 초기에 발견해서 적극적으로 치료하는 게 중요해요.	유방암 초기에 발견	https://www.rapportian.com/news/articleView.html?idxno=149652	2022/07/27	0	2022-08-04 11:16:27	2022-08-04 11:16:27
BK22003875	11	질문자	그런데, 유방암은 왜 걸리는 거예요?				0	2022-08-04 11:16:27	2022-08-16 10:48:05
BK22003875	12	전문가	유방암의 원인으로는 여성 호르몬이나 연령 및 출산 경험, 수유 요인, 방사선 노출, 가족력 등을 들 수 있는데 사실 정확한 이유는 밝혀진 게 없어요.	유방암 원인	http://sjbnews.com/news/news.php?number=751008	2022/07/12	0	2022-08-04 11:16:27	2022-08-12 10:32:09
BK22003875	13	질문자	원인이 없는 게 더 무섭네요. 그럼 걸리지 않으려면 어떻게 해야 하나요?				0	2022-08-04 11:16:27	2022-08-04 11:16:27
BK22003875	14	전문가	음식 조절과 꾸준한 운동으로 예방할 수 있는데 음식은 식이섬유나 제철 음식 섭취 등 균형 잡힌 식사를 해야 해요. 또 꾸준한 검진을 통해 조기에 유방암을 찾아내는 게 중요해요.	유방암 예방	http://sjbnews.com/news/news.php?number=751008	2022/07/12	0	2022-08-04 11:16:27	2022-08-12 10:32:09
BK22003875	15	질문자	아, 그렇군요. 이번에 언니가 맘모톰 수술을 한다고 하는 데 그게 어떤 수술인가요?				0	2022-08-04 11:16:27	2022-08-12 10:32:09
BK22003875	16	전문가	맘모톰이란 수술 기구의 이름이에요. 예전에는 유방을 절제해서 유방 안에 생긴 혹을 제거했는데 그 경우 흉터가 많이 남았어요. 이 단점을 보완하기 위해 고안된 수술이 맘모톰으로, 피부를 작게 3밀리미터 정도 절제 후 맘모톰이라는 기구를 넣어 혹을 제거하는 수술이에요.	유방암 맘모톰 수술	http://www.mediafine.co.kr/news/articleView.html?idxno=9953	2021/02/15	0	2022-08-04 11:16:27	2022-08-12 10:32:09
BK22003875	17	질문자	아, 그럼 흉터가 아예 남지 않는 수술인가요? 정말 다행이네요.				0	2022-08-04 11:16:27	2022-08-04 11:16:27
BK22003875	18	전문가	아예 흉터가 남지 않는 건 아니에요. 수술 직후엔 여드름 정도 크기의 붉은 반점 정도로 보이는데 1년 이상 지나면 점점 옅어져서 잘 안 보이게 되는 거예요. 또 전신 마취가 아닌 부분 마취를 하기 때문에 금식을 따로 하지 않아도 되고 부작용과 합병증 발병 확률이 낮고 일상생활이 가능하다는 장점이 있어요.	유방암 맘모톰 수술 흉터	http://www.mediafine.co.kr/news/articleView.html?idxno=9953	2021/02/15	0	2022-08-04 11:16:27	2022-08-04 11:16:27
BK22003875	19	질문자	장점이 많은 수술이네요. 언니가 수술받고 빨리 나았으면 좋겠어요. 오늘 이것저것 친절하게 알려주셔서 너무 감사드려요.				0	2022-08-04 11:16:27	2022-08-04 11:16:27
BK22003875	20	전문가	별말씀을요, 언니분 쾌차하실 거예요. 너무 걱정하지 마시고 궁금한 점 있으면 언제든 물어보세요.				1	2022-08-04 11:16:27	2022-08-16 10:55:16
