id	utterance_id	role	text	search_query	search_URL	reference_date	terminate	regDate	updDate
BK22004259	1	질문자	요즘 발가락 사이로 각질이 자꾸 생겨서 속상해요. 샌들을 신고 싶은데 창피해서 신지도 못하고 있어요.				0	2022-08-04 11:37:50	2022-08-08 20:11:48
BK22004259	2	전문가	정말요? 깨끗이 씻어도 발가락 사이에 계속 각질이 생겨요?				0	2022-08-04 11:37:50	2022-08-08 20:11:48
BK22004259	3	질문자	네, 하얀 각질만 생기면 좋은데 이제는 이상한 냄새까지 나더라고요. 혹시 무좀 아닐까요?				0	2022-08-04 11:37:50	2022-08-08 20:11:48
BK22004259	4	전문가	음, 발가락 사이의 각질이 벗겨지고 하얗게 물러지고 냄새가 나면 지간형 무좀이에요.	무좀	https://www.hidoc.co.kr/healthstory/news/C0000718965	2022/07/23	0	2022-08-04 11:37:50	2022-08-08 20:11:48
BK22004259	5	질문자	정말요? 무좀에 걸린 거라면 정말 충격이네요. 평소 깨끗이 씻는데도 무좀은 왜 걸리는 거예요?				0	2022-08-04 11:37:50	2022-08-08 20:11:48
BK22004259	6	전문가	아, 무좀의 원인은 오랜 시간 양말과 구두를 신었을 경우 생겨요. 또 발에 땀이 나고 축축하면 무좀을 발생시키는 곰팡이인 백선균이 늘어나는 환경이 조성돼요. 백선균이 발의 진피에 침투했을 때 무좀이 돼요.	무좀 원인	https://mdtoday.co.kr/news/view/1065581923339749	2022/07/22	0	2022-08-04 11:37:50	2022-08-28 21:45:49
BK22004259	7	질문자	그렇군요. 제가 구두를 좋아해서 무좀에 걸릴 수밖에 없나 봐요. 무좀은 발에만 생기는 병인 거죠?				0	2022-08-04 11:37:50	2022-08-08 20:11:48
BK22004259	8	전문가	아, 무좀은 발에 생긴다고 생각하실 수 있는데 각질이 많고 습하고 따뜻하면 몸 어디에나 발생해요. 발무좀은 전체 무좀의 30퍼센트에서 40퍼센트 정도로 비율로 나타나요.	무좀 발생 부위	https://www.hidoc.co.kr/healthstory/news/C0000718965	2022/07/23	0	2022-08-04 11:37:50	2022-08-08 20:11:48
BK22004259	9	질문자	와, 무좀은 발에만 생기는 게 아니라니 충격이네요. 그러면 지간형 무좀은 어떻게 치료할 수 있나요?				0	2022-08-04 11:37:50	2022-08-08 20:11:48
BK22004259	10	전문가	발가락 사이가 건조하고 각질이 일어난 경우라면 항진균제 연고를 일정하게 발라주면 치료할 수 있어요.	지간형 무좀 치료	https://www.hidoc.co.kr/healthstory/news/C0000718965	2022/07/23	0	2022-08-04 11:37:50	2022-08-08 20:11:48
BK22004259	11	질문자	네, 항진균제라고 하셨는데 연고로만 있는 건가요? 전 연고가 끈적거려서 좀 싫어서요.				0	2022-08-04 11:37:50	2022-08-08 20:11:48
BK22004259	12	전문가	항진균제는 크림, 연고, 네일라카, 스프레이형, 파우더형 등이 있어요. 또 외용제와 먹는 약으로 구별돼요. 무좀 발생 위치와 증상에 따라 치료 시기가 달라지는 걸 기억하셔야 해요.	무좀항진균제치료	https://moneys.mt.co.kr/news/mwView.php?no=2022060714404744329	2022/06/08	0	2022-08-04 11:37:50	2022-08-08 20:11:48
BK22004259	13	질문자	그렇군요. 그런데 항진균제를 발라도 나아지지 않으면 어떻게 하나요?				0	2022-08-04 11:37:50	2022-08-08 20:11:48
BK22004259	14	전문가	항진균제를 발라도 무좀이 나아지지 않으면 먹는 항진균제를 사용해야 해요. 과거에는 먹는 항진균제에 간 독성 등의 문제가 있었는데 최근에는 간에 특이한 문제가 없으면 누구나 먹을 수 있어요.	무좀 경구용 항진균제	https://view.asiae.co.kr/article/2022061115202007644	2022/06/11	0	2022-08-04 11:37:50	2022-08-08 20:11:48
BK22004259	15	질문자	아, 바르는 치료제 외에도 먹는 치료제도 있어서 무좀 치료는 그리 어렵지 않네요. 무좀은 한번 생겼다가 나아지면 이제 다시 생길 일은 없는 거죠?				0	2022-08-04 11:37:50	2022-08-08 20:11:48
BK22004259	16	전문가	음, 무좀은 치료를 완벽히 하지 않고 그냥 놔두면 균이 발등이나 발톱 등 다른 신체 부위로 들어갈 수 있어요. 무좀균을 박멸하지 않았을 경우 또 재발하는 특징이 있어서 자칫하면 무좀균이 평생 몸에 있을 수 있어요.	무좀 재발	https://www.hidoc.co.kr/healthstory/news/C0000718965	2022/07/23	0	2022-08-04 11:37:50	2022-08-08 20:11:48
BK22004259	17	질문자	네? 평생 무좀균과 함께라니 생각만 해도 끔찍하네요. 무좀이 생기는 걸 막고 싶은데 어떻게 예방할 수 있나요?				0	2022-08-04 11:37:50	2022-08-08 20:11:48
BK22004259	18	전문가	무좀을 예방하려면 진균이 발바닥, 발가락에서 움직이는 경우가 많으니 발바닥과 발가락 사이를 잘 씻어야 해요. 그리고 씻은 후에는 발을 완벽히 마르도록 하는 게 좋아요.	무좀 예방	https://health.chosun.com/site/data/html_dir/2022/06/23/2022062302219.html	2022/06/23	0	2022-08-04 11:37:50	2022-08-15 15:37:25
BK22004259	19	질문자	그렇군요. 이제부터 발가락 사이를 공들여 씻어야겠어요. 오늘 알려주신 방법과 치료법으로 얼른 무좀을 낫게 해야겠어요.				0	2022-08-04 11:37:50	2022-08-08 20:11:48
BK22004259	20	전문가	네, 얼른 나으셔서 예쁜 샌들 사러 가죠. 다음에 만날 때는 건강한 모습으로 만나요.				1	2022-08-04 11:37:50	2022-08-29 08:14:52
