id	utterance_id	role	text	search_query	search_URL	reference_date	terminate	regDate	updDate
BK22005536	1	질문자	요즘 업무가 바빠 앉아만 있었더니 살이 너무 찌는 게 느껴지더라구요. 그래서 남편이랑 새벽마다 일찍 일어나서 산책로 걷기로 약속했어요.				0	2022-08-14 00:05:37	2022-08-14 00:05:37
BK22005536	2	전문가	이사 가신 곳이 산책로가 잘 되어 있었다고 들었는데 걸으면 좋겠네요.				0	2022-08-14 00:05:37	2022-08-14 00:05:37
BK22005536	3	질문자	안그래도 오늘 처음으로 걸어봤는데 좋더라구요. 너무 오랜만에 두 시간쯤 걸었더니 근육이 아픈에요. 오랜만에 운동하고 난 후에 근육통이 생기는 이유는 뭐죠?				0	2022-08-14 00:05:37	2022-08-14 09:53:43
BK22005536	4	전문가	운동 후 근육통은 근육과 연결조직에 강한 힘이 들어가서 조직이 손상됐거나 대사산물로 만들어진 젖산 같은 노폐물이 근육에 축적됐을때 발생해요.	근육통	https://health.chosun.com/site/data/html_dir/2022/08/04/2022080401958.html	2022/08/05	0	2022-08-14 00:05:37	2022-08-14 09:53:43
BK22005536	5	질문자	너무 오랜만에 운동해서 강한 힘이 가해졌나봐요. 근육통은 보통 어느정도 지나면 낫죠?				0	2022-08-14 00:05:37	2022-08-14 09:53:43
BK22005536	6	전문가	보통 운동한 날로부터 2일에서 3일 정도 지나면 회복돼요. 근육 조직이 손상됐다면 더 오래 걸리구요.	근육통 회복 날짜	https://health.chosun.com/site/data/html_dir/2022/08/04/2022080401958.html	2022/08/05	0	2022-08-14 00:05:37	2022-08-14 09:53:43
BK22005536	7	질문자	3일 뒤에 중요한 약속이 있는데 어떻게 하면 회복을 더 빨리 할 수 있을까요?				0	2022-08-14 00:05:37	2022-08-14 00:05:37
BK22005536	8	전문가	냉찜질을 하면 더 빨리 회복할 수 있어요. 만약에 통증이 7일 이상 계속되면 온찜질이나 스트레칭으로 혈액순환을 원활하게 하면서 근육의 긴장을 풀어주면 통증 완화에 좋아요.	근육통 빨리 없애는 방법	https://health.chosun.com/site/data/html_dir/2022/08/04/2022080401958.html	2022/08/05	0	2022-08-14 00:05:37	2022-08-14 09:53:43
BK22005536	9	질문자	어떻게 하면 근육통을 예방할 수 있을까요?				0	2022-08-14 00:05:37	2022-08-14 00:05:37
BK22005536	10	전문가	운동 전에 스트레칭을 하면 근육통과 관절통을 예방하기 좋아요. 운동 전 스트레칭은 팔 벌려 뛰기, 가볍게 달리기와 같은 동적인 스트레칭이 더 효과적인데요. 굳어있는 관절, 근육, 인대가 풀려서 본 운동에 들어가서 강한 자극이 생기는 걸 막을 수 있죠.	운동 전 스트레칭	https://health.chosun.com/site/data/html_dir/2022/08/04/2022080401958.html	2022/08/05	0	2022-08-14 00:05:37	2022-08-14 09:53:43
BK22005536	11	질문자	운동 전엔 동적 스트레칭이 효과적이라면 운동 후엔 어떻게 하면 좋나요?				0	2022-08-14 00:05:37	2022-08-14 00:05:37
BK22005536	12	전문가	운동 후에는 손으로 발끝을 당기기, 다리를 좌우로 늘리는 정적 스트레칭이 효과적인데, 젖산 축적 정도를 낮춰서 근육통 예방에 좋아요.	운동 후 스트레칭	https://health.chosun.com/site/data/html_dir/2022/08/04/2022080401958.html	2022/08/05	0	2022-08-14 00:05:37	2022-08-14 09:53:43
BK22005536	13	질문자	근육통이 심할 때 더 빨리 풀리라고 고강도 운동을 해도 괜찮나요?				0	2022-08-14 00:05:37	2022-08-14 00:05:37
BK22005536	14	전문가	횡문근육해증이 생길 수 있으니 주의해야해요. 근육통이 있는데 고강도 운동을 하면 근육 세포막 손상으로 이어질 수 있거든요. 이렇게되면 마이오글로빈, 칼륨, 인이 나와 신장이나 심장에 문제가 생길 수 있는 병이에요.	횡문근융해증	https://health.chosun.com/site/data/html_dir/2021/12/06/2021120601715.html	2021/12/07	0	2022-08-14 00:05:37	2022-08-14 09:53:43
BK22005536	15	질문자	횡문근육해증에 걸렸다는 건 어떻게 알 수 있어요.				0	2022-08-14 00:05:37	2022-08-14 09:53:43
BK22005536	16	전문가	근육통의 정도가 심하면서 특정 부위에 부종이 생기거나 전신 무기력감, 갈색빛의 소변과 같은 증상이 나타나면 횡문근육해증에 걸린걸 알 수 있어요.	횡문근융해증 의심 증상	https://health.chosun.com/site/data/html_dir/2021/12/06/2021120601715.html	2021/12/07	0	2022-08-14 00:05:37	2022-08-14 09:53:43
BK22005536	17	질문자	어머, 근육통이 있을 때 무리해서 운동하지 않으려고 해야겠네요. 이제 막 운동을 시작해서 어떤 주기로 운동 강도를 높여나가면 될까요?				0	2022-08-14 00:05:37	2022-08-14 09:53:43
BK22005536	18	전문가	1주일에 10퍼센트 정도의 비율로 운동 시간과 강도를 늘려나가면 좋아요. 가벼운 운동으로 시작해서 점차 양과 강도를 늘려서 강도 높은 운동을 해 나가는거죠.	운동 강도 높이는 주기	https://health.chosun.com/site/data/html_dir/2021/12/06/2021120601715.html	2021/12/07	0	2022-08-14 00:05:37	2022-08-14 09:53:43
BK22005536	19	질문자	저도 운동을 안하다가 한 번에 두 시간쯤 걸어서 여러 근육에 자극이 됐나봐요.				0	2022-08-14 00:05:37	2022-08-14 09:53:43
BK22005536	20	전문가	가볍게 시작해서 점차 양과 강도를 늘린다는 생각으로 운동하세요. 근육통으로 인한 불편함이 어서 사라지길 바래요.				0	2022-08-14 00:05:37	2022-08-14 09:53:43
BK22005536	21	질문자	다음에 저희 집 오시면 저녁 식사하고 산책로 같이 걸으면서 대화 놔눠요.				0	2022-08-14 09:53:43	2022-08-14 09:53:43
BK22005536	22	전문가	저도 식후에 걷는 거 좋아해요. 조만간 집에 초대해 주세요. 저는 이만 가 볼게요.				1	2022-08-14 09:53:43	2022-08-25 15:06:39
