id	utterance_id	role	text	search_query	search_URL	reference_date	terminate	regDate	updDate
BK22000149	1	질문자	건강해지려고 운동을 시작했는데 근육통이 심해요. 계속 해도 되는 걸까요?				0	2022-07-20 16:04:37	2022-08-02 12:01:32
BK22000149	2	전문가	운동이 처음이거나 오랜만인 경우 온몸이 쑤시는 것 같은 근육통이 생길 수 있어요. 대부분 알이 배겼다라고 표현을 하는데 운동을 하면서 근육에 미세한 손상을 입은거에요. 지연성 근육통이라 부르고 심한 경우 강도 높은 운동은 멈추고 스트레칭과 함께 휴식 시간을 갖는 것이 좋아요.	운동 후 심한 근육통	https://m.health.chosun.com/svc/news_view.html?contid=2022032401509	2022/03/24	0	2022-07-20 16:04:37	2022-07-21 09:32:18
BK22000149	3	질문자	지연성 근육통이라고 하는군요. 생기지 않게 하려면 어떻게 해야하나요?				0	2022-07-20 16:04:37	2022-08-02 12:01:32
BK22000149	4	전문가	운동을 할 때 너무 무리하거나 많은 땀을 흘리지 않도록 주의해야해요. 평소에 운동을 잘 안했었다면 가벼운 운동부터 시작하고 운동량과 강도를 점점 늘려나가는 것이 좋아요. 만약 고강도 운동을 했다면 이틀정도 휴식 시간을 가져야해요.	지연성 근육통	https://m.health.chosun.com/svc/news_view.html?contid=2018011501080	2018/01/15	0	2022-07-20 16:04:37	2022-07-21 09:32:18
BK22000149	5	질문자	운동은 매일 해야 좋은거라고 생각했는데 아니었군요. 일주일에 몇 번정도 하는 것이 좋을까요?				0	2022-07-20 16:04:37	2022-08-02 12:01:32
BK22000149	6	전문가	병이 없는 건강한 성인의 경우 근력 운동은 최소 주 2회이상 해주는 것이 좋아요. 중강도의 유산소 운동이라면 1회에 30분에서 60분씩 주 5일, 고강도라면 20분에서 60분사이로 주 3회가 좋아요.	적당한 운동 횟수	https://www.seoul.co.kr/news/newsView.php?id=20190607038001	2019/06/07	0	2022-07-20 16:04:37	2022-07-21 09:32:18
BK22000149	7	질문자	대략 주 2회에서 3회 정도라는 말씀이시군요. 제가 운동을 하면서 궁금했던 점이 있는데, 유산소 운동과 근력 운동 중 어떤걸 먼저 해야할까요?				0	2022-07-20 16:04:37	2022-08-02 12:01:32
BK22000149	8	전문가	유산소 운동을 하기 전에 근력 운동을 하는 것이 가장 좋은 방법이에요. 운동을 시작하면 탄수화물이 가장 먼저 사용되고 그 후 지방이 쓰여요. 탄수화물을 에너지원으로 사용하는 근력 운동을 하고 유산소 운동을 뒤이어 해주는 것이 효과를 높이는 방법이죠.	유산소운동 근력운동 순서	https://news.mt.co.kr/mtview.php?no=2020070712585172596	2020/07/22	0	2022-07-20 16:04:38	2022-07-21 09:32:18
BK22000149	9	질문자	근력 운동 후 유산소 운동을 해줘야하는거군요. 그럼 스트레칭은 언제 해줘야하는건가요?				0	2022-07-20 16:04:38	2022-08-02 12:01:32
BK22000149	10	전문가	스트레칭은 운동 전 후 모두 해주어야하는 필수 코스에요. 스트레칭을 해주면 관절의 운동 범위를 늘리게 해주고 유연성도 높일 수 있어요. 숨이 차 오르고 땀도 많이 나온 상태에서 정리운동 없이 마치게되면 그 다음날까지도 피로감이 이어질 수 있어요.	운동 전 스트레칭	https://m.health.chosun.com/svc/news_view.html?contid=2022061301799	2022/06/13	0	2022-07-20 16:04:38	2022-07-21 09:32:18
BK22000149	11	질문자	운동 전후로 다 해줘야하는거에요? 저는 힘들기도하고 귀찮기도해서 매번 운동 후 스트레칭을 패스했어요. 그래서 근육통도 심했던 걸까요?				0	2022-07-20 16:04:38	2022-08-02 12:01:32
BK22000149	12	전문가	그럴지도 몰라요. 운동 후에는 정적인 스트레칭을 시행하면서 자극 받은 근육을 풀어줘야해요. 근육 안에 젖산이 생기는 것을 줄여주면서 지연성 근육통을 예방하게 되거든요.	운동 후 스트레칭 중요성	https://m.health.chosun.com/svc/news_view.html?contid=2021031602437	2021/03/17	0	2022-07-20 16:04:38	2022-07-21 09:32:18
BK22000149	13	질문자	앞으로는 귀찮아도 빼먹지 말아야겠어요. 그럼 만약 다이어트를 목적으로 한다면 식전과 식후 중 언제 운동을 하는게 도움이 되나요?				0	2022-07-20 16:04:38	2022-08-02 12:01:32
BK22000149	14	전문가	다이어트가 목적이라면 식전에 하는게 좋아요. 공복은 저혈당 상태라 운동을 했을 때 탄수화물로 구성된 혈당을 쓰지않고 체지방을 에너지원으로 삼아 사용하기때문이에요. 세시간에서 네시간정도 공복 상태에서 산책이나 조깅 등 강도가 약한 운동을 30분 이상 해주는 것이 효과적이에요.	다이어트 식전운동 식후운동	https://m.health.chosun.com/svc/news_view.html?contid=2021081701283	2021/08/17	0	2022-07-20 16:04:38	2022-07-21 09:32:18
BK22000149	15	질문자	그렇군요. 그런데 어떤 사람들은 공복에 움직이면 힘들어하는 경우가 있던데 공복운동을 하면 안되는 사람도 있나요?				0	2022-07-20 16:04:38	2022-08-02 12:01:32
BK22000149	16	전문가	당뇨를 앓고 있는 분들은 안돼요. 공복인 상태에서 운동을 하면 급격한 혈당 상승이 있을 수 있기때문이에요. 또 당뇨가 있는 분들은 인슐린 저항성 문제도 함께 가지고 있는 경우가 많기때문에 조심해야해요.	공복 유산소 안되는 사람	https://m.health.chosun.com/svc/news_view.html?contid=2022061701689	2022/06/17	0	2022-07-20 16:04:38	2022-07-21 09:32:18
BK22000149	17	질문자	운동도 참 알아둬야할 것들이 많은 것 같아요. 그래도 건강한 생활에 도움을 주는거니 꼭 하긴 해야겠죠?				0	2022-07-20 16:04:38	2022-08-02 12:01:32
BK22000149	18	전문가	운동을 전혀 안한 사람은 암 발병 확률이 최대 77퍼센트까지 올랐다는 연구 결과도 있으니 운동이 꼭 필요하다 볼 수 있죠. 운동을 전혀 안한 사람은 신장암 발병률이 최고 77퍼센트, 방광암의 발병률이 최고 74퍼센트가 높았거든요. 연구에 참가한 사람 중 정상 체중인 경우도 있었는데 결과는 비슷했어요.	운동 필요성	https://www.sisajournal.com/news/articleView.html?idxno=240387	2022/06/15	0	2022-07-20 16:04:38	2022-07-21 09:32:18
BK22000149	19	질문자	확률이 조금만 높아지는게 아니라 엄청 높아지는거네요. 개인차는 있겠지만 경각심이 생기는 수치인 것 같아요.				0	2022-07-20 16:04:38	2022-08-02 12:01:32
BK22000149	20	전문가	그렇죠? 평소 운동을 싫어하던 분들이라도 몸을 일으키게 만드는 실험 결과인 것 같아요. 그렇다고 매일 강도 높은 운동을 할 필요는 없어요. 가벼운 산책부터 시작해 조금씩 늘려가는 것이 바람직하죠.				0	2022-07-20 16:04:38	2022-07-21 09:32:18
BK22000149	21	질문자	저도 지금 근육통때문에 쉬었는데 다시 시작해봐야겠어요. 덕분에 앞으로는 똑똑하게 운동할 수 있을 것 같아요. 고마워요!				1	2022-07-20 16:04:38	2022-08-02 12:01:32
