id	utterance_id	role	text	search_query	search_URL	reference_date	terminate	regDate	updDate
BK22002209	1	질문자	목도 뻐근하고 어깨도 아프고 살짝 두통도 있는 것 같은데 스마트폰을 너무 많이 봐서 그런가?				0	2022-08-02 12:14:41	2022-08-02 13:19:30
BK22002209	2	전문가	맞아, 너무 오래 스마트폰이나 컴퓨터를 사용하면 고개를 숙이게 되고, 그로 인해 목뼈에 이상이 생겨 각종 신체 불균형 문제에 시달리게 돼.	거북목	https://www.jejutwn.com/news/article.html?no=140352	2022/07/22	0	2022-08-02 12:14:41	2022-08-02 13:19:30
BK22002209	3	질문자	그럼 이렇게 계속 자세가 굳어지면 그 거북목이 되는 건가?				0	2022-08-02 12:14:41	2022-08-02 13:19:30
BK22002209	4	전문가	그런 자세를 계속하면 목의 근육과 인대에 무리를 주게 돼서, 원래 C자 형태인 경추가 일자가 되는 일자목이나 역C자인 거북목이 되는 거야.	거북목 스마트폰	http://www.koreahealthlog.com/news/articleView.html?idxno=32515	2022/07/21	0	2022-08-02 12:14:41	2022-08-02 13:19:30
BK22002209	5	질문자	거북목이 되면 나처럼 머리도 아프고 어깨도 아픈 거야?				0	2022-08-02 12:14:41	2022-08-02 13:19:30
BK22002209	6	전문가	목과 어깨, 팔에 통증이 생기고 심하면 두통까지 나타나. 목덜미가 뻐근하거나 통증이 생기다가 손목과 손이 저리기까지 하고.	거북목 증상	https://mdtoday.co.kr/news/view/1065592878180306	2022/07/05	0	2022-08-02 12:14:41	2022-08-02 13:19:30
BK22002209	7	질문자	지금 내 증세와 거의 일치하는 것 같아. 그냥 방치하면 더 심해지겠지?				0	2022-08-02 12:14:41	2022-08-02 13:19:30
BK22002209	8	전문가	가볍게 생각하고 방치하면 목 디스크로 발전할 수 있으니 치료를 받고 잘못된 자세는 고치는 것이 좋겠어.	거북목 디스크	http://www.jeonmin.co.kr/news/articleView.html?idxno=357261	2022/06/08	0	2022-08-02 12:14:41	2022-08-02 13:19:30
BK22002209	9	질문자	거북목을 일으키는 안 좋은 자세는 어떤 거야?				0	2022-08-02 12:14:41	2022-08-02 13:19:30
BK22002209	10	전문가	오랜 시간 앉아서 목과 머리를 앞으로 내미는 자세, 컴퓨터나 스마트폰을 내려다보며 고개를 오랜 시간 숙이고 있는 자세, 바닥이나 소파에 누워서 책, 신문, 텔레비전을 보는 자세는 좋지 않아. 너무 높은 베개를 사용하는 것도 좋지 않고.	거북목 습관	http://www.segyebiz.com/newsView/20220630519842?OutUrl=naver	2022/07/01	0	2022-08-02 12:14:41	2022-08-02 13:19:30
BK22002209	11	질문자	너무 높은 베개를 사용하면 좋지 않으니 베개를 사용하지 않는 건 어때?				0	2022-08-02 12:14:41	2022-08-02 13:19:30
BK22002209	12	전문가	거북목을 완화하려면 경추가 C자를 유지하게 하는 것이 중요한데 베개를 사용하지 않으면 경추가 일자가 돼서 좋지 않아.	거북목 베개	https://health.chosun.com/site/data/html_dir/2022/01/05/2022010501842.html	2022/01/05	0	2022-08-02 12:14:41	2022-08-02 13:19:30
BK22002209	13	질문자	그렇구나, 그럼 병원에 가면 어떤 치료를 받아?				0	2022-08-02 12:14:41	2022-08-02 13:19:30
BK22002209	14	전문가	도수치료를 받게 되는데 통증을 완화하고 아픈 부위의 움직임을 좀 더 수월하게 할 수 있도록 돕고 근력을 강화하게 도와줘.	거북목 도수치료	https://mdtoday.co.kr/news/view/1065599351356329	2022/07/12	0	2022-08-02 12:14:41	2022-08-02 13:19:30
BK22002209	15	질문자	병원에 가서 치료받는 것도 고민해 봐야겠네. 컴퓨터 사용할 때는 어떻게 하는 것이 도움이 될까?				0	2022-08-02 12:14:41	2022-08-02 13:19:30
BK22002209	16	전문가	모니터를 볼 때는 눈높이 보다 약간 낮게 들고, 스트레칭을 한 시간에 한 번 정도는 해서 근육을 풀어주는 것이 좋아.	거북목 치료	http://www.healthinnews.co.kr/news/articleView.html?idxno=30781	2022/06/20	0	2022-08-02 12:14:41	2022-08-02 13:19:30
BK22002209	17	질문자	그 스트레칭은 어떻게 하는 거야?				0	2022-08-02 12:14:41	2022-08-02 13:19:30
BK22002209	18	전문가	먼저 바로 앉은 다음 앞과 뒤, 양옆의 네 방향으로 손으로는 밀고 머리로는 버티는 운동을 하면 도움이 될 거야.	거북목 개선	http://www.jemin.com/news/articleView.html?idxno=740460	2022/07/18	0	2022-08-02 12:14:41	2022-08-02 13:19:30
BK22002209	19	질문자	알겠어, 알려준 방법으로 꼭 스트레칭해야지.				0	2022-08-02 12:14:41	2022-08-02 13:19:30
BK22002209	20	전문가	병원도 꼭 가서 치료받아 봐. 혼자 가기 힘들면 같이 가줄게.				1	2022-08-02 12:14:41	2022-08-02 14:16:22
