id	utterance_id	role	text	search_query	search_URL	reference_date	terminate	regDate	updDate
BK22001267	1	질문자	최근에 탈색 염색을 했는데 미용실 언니가 보색 샴푸를 쓰래. 보색 샴푸가 뭔지 알아?				0	2022-07-20 16:14:53	2022-08-02 12:01:32
BK22001267	2	전문가	보색 샴푸는 탈색 후 염색을 한 경우 쓰는 샴푸야. 시간이 지나면서 염색 컬러가 빠지고 노란 탈색모가 드러날 때 쓰는 거지.	보색 샴푸	https://www.sisunnews.co.kr/news/articleView.html?idxno=141140	2021/05/26	0	2022-07-20 16:14:53	2022-07-21 10:24:32
BK22001267	3	질문자	보색 샴푸는 그냥 샴푸처럼 매일 사용하는 거야?				0	2022-07-20 16:14:53	2022-08-02 12:01:32
BK22001267	4	전문가	아니, 잦은 사용은 모발에 별로 좋지 않아. 염색을 한 바로 다음에는 이틀이나 사흘 정도마다, 그 이후에는 일주일마다 쓰는 걸 추천해.	보색 샴푸 사용	https://www.harpersbazaar.co.kr/article/55848	2021/06/05	0	2022-07-20 16:14:54	2022-07-21 10:24:32
BK22001267	5	질문자	귀찮을 뻔 했는데 매일 써야 하는 건 아니라 다행이다. 그런데 나는 아직 노란끼가 올라오지 않았고, 다만 염색 후에 머릿결이 너무 손상돼서 걱정이야. 머릿결을 좋게 하는 샴푸는 없을까?				0	2022-07-20 16:14:54	2022-08-02 12:01:32
BK22001267	6	전문가	찾아보면 데미지 클리닉 위주의 샴푸가 있어. 잦은 펌과 염색 등으로 인해 푸석해진 극손상 모발에 영향을 주는 제품이지. 두피와 모발의 노폐물을 깨끗하게 세정해주는 기능을 가지고 있어.	손상 모발 케어 샴푸	http://www.fashionbiz.co.kr/TN/?cate=2&recom=2&idx=193167	2022/06/22	0	2022-07-20 16:14:54	2022-07-21 10:24:32
BK22001267	7	질문자	그럼 나는 클리닉 샴푸를 찾아봐야 하는 건가? 아니면 샴푸 말고도 다른 제품이 있어?				0	2022-07-20 16:14:54	2022-08-02 12:01:32
BK22001267	8	전문가	건성 모발이나 극손상 모발에는 세럼, 오일, 앰플 등 다양한 제품을 사용할 수 있지.	극손상 모발 해결	http://www.queen.co.kr/news/articleView.html?idxno=210262	2017/08/31	0	2022-07-20 16:14:54	2022-07-21 10:24:32
BK22001267	9	질문자	앰플은 얼굴에만 바르는 게 아니었어? 머리에는 어떻게 바르는 거야?				0	2022-07-20 16:14:54	2022-08-02 12:01:32
BK22001267	10	전문가	일단 샴푸와 트리트먼트로 먼저 머리를 감아. 그 다음에 젖은 머리의 물기를 제거하고 골고루 발라주면 돼.	헤어 앰플 사용법	https://www.news1.kr/articles/?2295910	2015/06/24	0	2022-07-20 16:14:54	2022-07-21 10:24:32
BK22001267	11	질문자	트리트먼트는 린스와 다른 거야? 나는 보통 샴푸와 린스를 하거든.				0	2022-07-20 16:14:54	2022-08-02 12:01:32
BK22001267	12	전문가	트리트먼트와 린스는 그 목적이 달라. 린스는 머리카락의 엉킴을 방지하고 머릿결을 부드럽게 하는 게 목적이지만, 트리트먼트는 머리카락 내부에 수분과 영양분을 보충해주는 게 목적이거든.	트리트먼트 린스 차이	http://www.slist.kr/news/articleView.html?idxno=257475	2021/06/07	0	2022-07-20 16:14:54	2022-07-21 10:24:32
BK22001267	13	질문자	그럼 샴푸와 트리트먼트, 린스를 다 쓴다고 하면 순서는 어떻게 되는 거야? 아무래도 나는 영양분 보충도 필요하고 머리카락 엉킴도 방지해야 할 것 같거든.				0	2022-07-20 16:14:54	2022-08-02 12:01:32
BK22001267	14	전문가	샴푸, 트리트먼트, 린스 순서가 좋아. 샴푸로 먼저 머리를 깨끗하게 한 다음 트리트먼트로 영양을 공급한 뒤에 린스로 코팅을 해주는 거지. 그리고 참고로 헤어 제품은 가급적 두피를 피하는 게 좋아. 머리카락에만 도포해서 10분 내외로 사용하고.	샴푸 트리트먼트 린스 순서	http://medicalworldnews.co.kr/news/view.php?idx=1510931855	2019/08/03	0	2022-07-20 16:14:54	2022-07-21 10:24:32
BK22001267	15	질문자	와, 오늘 나 정말 많은 정보를 얻고 가네. 마지막으로 하나 더 물어봐도 될까?				0	2022-07-20 16:14:54	2022-08-02 12:01:32
BK22001267	16	전문가	궁금한 건 아무거나 물어봐.				0	2022-07-20 16:14:54	2022-07-21 10:24:32
BK22001267	17	질문자	혹시 모발에 좋은 음식은 뭐가 있을까?				0	2022-07-20 16:14:54	2022-08-02 12:01:32
BK22001267	18	전문가	머리카락은 단백질로 만들어져 있으니까, 단백질이 풍부한 음식을 먹는 게 좋아. 단백질이 풍부하면서도 지방은 적은 생선, 닭고기, 달걀, 콩, 두유 등이 좋지.	모발 건강 음식	https://kormedi.com/1405767/%ed%83%88%eb%aa%a8-%eb%a7%8e%ec%9d%80-%ec%97%ac%eb%a6%84%ec%b2%a0%eb%a8%b8%eb%a6%ac-%ea%b4%80%eb%a6%ac%eb%b2%95-%eb%aa%a8%eb%b0%9c%ec%97%90-%ec%a2%8b%ec%9d%80-%ec%8b%9d%ed%92%88-5/	2022/06/27	0	2022-07-20 16:14:54	2022-07-21 10:24:32
BK22001267	19	질문자	마지막까지 자세한 답변 정말 고마워.				0	2022-07-20 16:14:54	2022-08-02 12:01:32
BK22001267	20	전문가	나중에라도 또 궁금한 게 생기면 언제든지 물어봐. 그럼 나 먼저 이만 가볼게.				0	2022-07-20 16:14:54	2022-07-21 10:24:32
BK22001267	21	질문자	응, 조심히 들어가고 다음에 또 보자.				1	2022-07-20 16:14:54	2022-08-02 12:01:32
