id	utterance_id	role	text	search_query	search_URL	reference_date	terminate	regDate	updDate
BK22007047	1	질문자	저, 곧 스페인 여행 가는데 너무 들떠서 뭐 부터 준비해야 할지 모르겠어요.				0	2022-08-31 17:32:12	2022-08-31 21:22:16
BK22007047	2	전문가	어머, 스페인 가세요? 저 대학생 때 배낭여행으로 다녀왔거든요.				0	2022-08-31 17:32:12	2022-08-31 17:32:12
BK22007047	3	질문자	사실 제가 해외여행이 처음이거든요. 이것저것 여쭤보고 싶은 것들이 너무 많아요. 우선, 미리 챙겨야 하는 여행 필수 준비물들이 어떤 게 있을까요?				0	2022-08-31 17:32:12	2022-08-31 21:22:16
BK22007047	4	전문가	해외여행을 갈 때 필수로 챙겨야 할 물건들은 여권과 여행용 워시키트와 개인 상비약 등이 있어요.	해외여행 준비물	https://www.nbntv.co.kr/news/articleView.html?idxno=367941	2019/05/20	0	2022-08-31 17:32:12	2022-08-31 21:22:16
BK22007047	5	질문자	특히 상비약이 유용할 것 같아요. 미처 챙길 생각을 못 했거든요.				0	2022-08-31 17:32:12	2022-08-31 21:22:16
BK22007047	6	전문가	왜냐하면 해외여행을 가서 앓기 쉬운 질병의 대표가 바로 물갈이거든요. 그래서 장 트러블이 일어날 수 있으니 지사제와 해열진통제를 상비약으로 준비해 주는 게 좋아요.	해외여행 상비약	http://www.economytalk.kr/news/articleView.html?idxno=223907	2022/07/15	0	2022-08-31 17:32:12	2022-08-31 21:22:16
BK22007047	7	질문자	여쭤보지 않았으면 아주 큰일날 뻔했어요. 아, 그렇다면 스페인의 대표 요리는 어떤 게 있는지 추천해 주실 수 있을까요?				0	2022-08-31 17:32:12	2022-08-31 21:22:16
BK22007047	8	전문가	파에야를 추천해드려요. 스페인 대표 음식이면서 쌀이나 고기, 해산물 재료로 쓰는 볶음밥 종류인데 한국인 관광객들에게도 인기가 좋은 편이에요.	스페인 대표 음식	https://www.mk.co.kr/news/culture/view/2021/08/753577/	2021/08/04	0	2022-08-31 17:32:12	2022-09-13 11:06:52
BK22007047	9	질문자	벌써 군침이 돌아요. 제가 간식 종류를 아주 좋아하는데 맛있는 스페인 디저트 종류는 어떤 게 있나요?				0	2022-08-31 17:32:12	2022-08-31 21:22:16
BK22007047	10	전문가	그렇다면 추로스는 어떠세요? 추로스는 스페인에서 즐겨먹는 음식인데 밀가루와 버터, 그리고 소금과 물을 섞어서 반죽을 만들고 짤주머니에 넣은 다음 길게 짜서 기름에 튀겨 만드는 음식이에요.	스페인 전통간식 츄러스	https://www.hankyung.com/economy/article/201909116373i	2019/09/13	0	2022-08-31 17:32:12	2022-08-31 21:22:16
BK22007047	11	질문자	어머, 저 추로스 정말 좋아하거든요. 이때까지 스페인 전통간식인 줄도 모르고 있었네요. 스페인의 추로스 역사가 궁금해요!				0	2022-08-31 17:32:12	2022-08-31 21:22:16
BK22007047	12	전문가	추로스는 추로라고 부르기도 하는데 처음 만들어지기 시작한 건 중국 명나라 때예요. 포르투갈 상인들이 유타오라는 튀김빵을 가지고 온 게 시초가 되었거든요.	추로	https://ko.wikipedia.org/wiki/%EC%B6%94%EB%A1%9C	2022/03/05	0	2022-08-31 17:32:12	2022-08-31 21:22:16
BK22007047	13	질문자	저, 스페인에 가면 아마도 매일 먹게 될 것 같아요.				0	2022-08-31 17:32:12	2022-08-31 21:22:16
BK22007047	14	전문가	하하, 그럼요! 여행은 아무래도 먹으러 가는 거 아니겠어요?				0	2022-08-31 17:32:12	2022-08-31 21:22:16
BK22007047	15	질문자	그래도 이왕 여행 가는 건데 다른 추억들도 많이 만들어 오고 싶기도 해요. 아, 스페인의 관광명소에는 어떤 게 있는지 아세요?				0	2022-08-31 17:32:12	2022-08-31 21:22:16
BK22007047	16	전문가	만약 스페인 남부를 여행하시게 된다면, 그라나다라는 도시에서 이슬람 왕조의 슬픈 역사가 서려있는 알람브라 궁전을 방문할 수 있어요. 여기서는 아라베스크 문양으로 장식된 벽과 화려하면서도 조화로운 패턴의 타일 바닥 등이 주는 정교한 예술이 이슬람 미술의 정점을 느끼게 해주거든요.	스페인 관광명소	http://www.obsnews.co.kr/news/articleView.html?idxno=1172164	2019/08/09	0	2022-08-31 17:32:12	2022-08-31 21:22:16
BK22007047	17	질문자	우와, 실제로 보면 정말 황홀할 것 같아요. 시간이 많이 지났는데도 이런 건축물이 훼손되지 않고 과연 잘 보존되어 있을까요?				0	2022-08-31 17:32:12	2022-08-31 21:22:16
BK22007047	18	전문가	안타깝게도 수세기 동안 스페인의 지배 아래에서 이슬람 영향을 받은 부분들은 꽤 많이 손상되었어요.	알람브라	https://ko.wikipedia.org/wiki/%EC%95%8C%EB%9E%8C%EB%B8%8C%EB%9D%BC	2022/05/27	0	2022-08-31 17:32:12	2022-08-31 21:22:16
BK22007047	19	질문자	유적이 잘 보존되지 못한 점은 정말 안타깝네요. 아, 그리고 저 마지막으로 여쭤보고 싶은 게 있는데 여행 가서 일정이 맞으면 축제도 즐겨보고 싶은데 추천해주실 만한 게 있을까요?				0	2022-08-31 17:32:12	2022-08-31 21:22:16
BK22007047	20	전문가	그렇다면 토마티나를 꼭 가보세요. 스페인의 발렌시아 주에 있는 도시 부뇰에서 8월 마지막 수요일에 열리는 토마토 축제거든요.	토마티나	https://ko.wikipedia.org/wiki/%ED%86%A0%EB%A7%88%ED%8B%B0%EB%82%98	2022/07/29	0	2022-08-31 17:32:12	2022-08-31 21:22:16
BK22007047	21	질문자	아쉽게도 일정이 맞지 않아서 못 가볼 것 같아요. 그렇지만 오늘 알려주신 내용들 정말 감사해요! 여행 준비를 하는데 정말 많은 팁이 되었어요!				0	2022-08-31 21:22:16	2022-08-31 21:22:16
BK22007047	22	전문가	저도 알려드리면서 여행 기억이 새록새록 나서 좋았어요. 몸 조심히 다녀오시고 귀국하면 한번 봬어요!				1	2022-08-31 21:22:16	2022-09-13 11:06:52
