id	utterance_id	role	text	search_query	search_URL	reference_date	terminate	regDate	updDate
BK22000660	1	질문자	요즘 새로운 취미가 생겼어요. 골프를 치는데 엄청 재밌더라고요.				0	2022-07-20 16:09:19	2022-08-02 12:01:32
BK22000660	2	전문가	코로나 이후로 골프를 취미로 갖는 사람들이 많아졌어요. 젊은 층 사이에서도 가족이나 친구들과 모임으로 골프 라운딩이 대세죠.	취미로 즐기는 골프	http://www.newsprime.co.kr/news/article/?no=564069	2022/03/31	0	2022-07-20 16:09:19	2022-07-21 09:55:10
BK22000660	3	질문자	네, 그런데 생각만큼 쉽지 않더라고요. 그래서 요새는 스크린골프로 연습을 하고 있어요.				0	2022-07-20 16:09:19	2022-08-02 12:01:32
BK22000660	4	전문가	골프를 실내에서 즐길 수 있도록 만든 스크린골프 말씀하시는 거죠? 골프 시뮬레이터요.	스크린골프	https://ko.wikipedia.org/wiki/%EC%8A%A4%ED%81%AC%EB%A6%B0%EA%B3%A8%ED%94%84	2022/06/30	0	2022-07-20 16:09:19	2022-07-21 09:55:10
BK22000660	5	질문자	네, 맞아요. 동네에 스크린골프장이 생겨서 자주 애용하고 있는데, 데이트하기도 좋아요.				0	2022-07-20 16:09:19	2022-08-02 12:01:32
BK22000660	6	전문가	실제로 젊은 층의 골프 인구가 많아져서 스크린골프장이 호황이에요. 코로나로 체육 활동이 줄고 있는 요즘에도 스크린골프장 매출은 올라가고 있지요.	스크린골프장	https://news.mt.co.kr/mtview.php?no=2022062116301160641	2022/06/21	0	2022-07-20 16:09:19	2022-07-21 09:55:10
BK22000660	7	질문자	저랑 비슷한 분들이 많은 가봐요. 혹시 스크린골프 잘 치는 법 좀 공유해 주실래요?				0	2022-07-20 16:09:19	2022-08-02 12:01:32
BK22000660	8	전문가	스크린골프는 게임 프로그램입니다. 초기 설정된 게임 값을 본인의 공에 맞게 어드레스의 방향을 설정하면 항상 일정한 플레이를 할 수 있어요.	스크린골프 잘 치는 법	http://news.imaeil.com/page/view/2012082707554355228	2012/08/27	0	2022-07-20 16:09:19	2022-07-21 09:55:10
BK22000660	9	질문자	좋은 정보 감사드려요. 스크린골프를 잘 치면 필드에서도 잘 칠 수 있겠죠?				0	2022-07-20 16:09:19	2022-08-02 12:01:32
BK22000660	10	전문가	필드에 가끔 나가도 스크린골프에서 했던 것을 토대로 적용하면 좋은 성과를 얻을 수 있어요. 요즘은 스크린 골프도 실제 골프장과 비슷하기 때문에 본인만의 방법으로 데이터를 만들어 접목시키는 거죠.	스크린골프와 필드골프	https://www.newspim.com/news/view/20220616000782	2022/06/16	0	2022-07-20 16:09:19	2022-07-21 09:55:10
BK22000660	11	질문자	열심히 연습해서 아마추어 골프 대회에 나가볼까 봐요.				0	2022-07-20 16:09:19	2022-08-02 12:01:32
BK22000660	12	전문가	대회에 참여하고 싶은 아마추어 골퍼는 골프협회에서 접수 기간에 신청을 하면 대회에 출천할 수 있어요. 남녀별 신페리오 방식으로 우승자를 뽑게 되죠.	아마추어 골프 대회 참가 방법	http://www.idomin.com/news/articleView.html?idxno=712351	2019/11/08	0	2022-07-20 16:09:19	2022-07-21 09:55:10
BK22000660	13	질문자	신페리오 방식으로 우승자를 뽑는다는 게 무슨 말인가요?				0	2022-07-20 16:09:19	2022-08-02 12:01:32
BK22000660	14	전문가	신페리오 방식이란 18개의 홀 중에서 임의로 고른 12개의 홀에는 1.5배의 스코어를 하고, 코스의 파를 뺀 80퍼센트는 핸디캡으로 계산하는 것을 말해요.	신페리오 방식	http://www.sportsseoul.com/news/read/1132772?ref=naver	2022/06/15	0	2022-07-20 16:09:19	2022-07-21 09:55:10
BK22000660	15	질문자	아하, 그게 신페리오 방식이군요. 그럼 스트로크 플레이 샷건 방식으로 하는 대회도 있나요?				0	2022-07-20 16:09:19	2022-08-02 12:01:32
BK22000660	16	전문가	네, 18홀 스트로크 플레이 중 샷건 방식으로 진행하는 대회가 있어요. 추가로 여성이라면 레이디 티를 받을 수 있고요.	스트로크 플레이 샷건 대회	https://www.newscj.com/190149	2013/06/15	0	2022-07-20 16:09:19	2022-07-21 09:55:10
BK22000660	17	질문자	그렇군요. 여러 곳에서 주최하는 대회가 많으니 더 찾아볼게요.				0	2022-07-20 16:09:19	2022-08-02 12:01:32
BK22000660	18	전문가	네, 아마추어 골프 연맹이 있으니 거기에서 한번 알아보세요.				0	2022-07-20 16:09:19	2022-07-21 09:55:10
BK22000660	19	질문자	감사합니다, 대회에 참가할 수 있도록 실력을 쌓아볼게요.				0	2022-07-20 16:09:19	2022-08-02 12:01:32
BK22000660	20	전문가	네, 저도 궁금이님을 계속해서 응원할게요.				1	2022-07-20 16:09:19	2022-07-21 13:03:33
