id	utterance_id	role	text	search_query	search_URL	reference_date	terminate	regDate	updDate
BK22000052	1	질문자	작년 여름이랑 가을에 제주도 여행을 다녀왔는데 너무 좋았어. 올해도 가고 싶네.				0	2022-07-20 16:03:41	2022-08-02 12:01:32
BK22000052	2	전문가	지금 제주 항공권 엄청 비싸지 않아? 유가 급등으로 항공권 가격이 뛰어서 휴가 포기하는 휴포족도 많아졌잖아.	제주 항공권	http://www.busan.com/view/busan/view.php?code=2022062716510620257	2022/06/27	0	2022-07-20 16:03:41	2022-07-21 09:19:09
BK22000052	3	질문자	맞아. 항공권이 작년에 비해 몇 배는 더 비싸진 것 같아. 그래도 해외보다는 경비가 싸서 많이들 제주로 여행 가더라.				0	2022-07-20 16:03:42	2022-08-02 12:01:32
BK22000052	4	전문가	맞아. 코로나로 인해 해외여행이 불가능해지면서 여행 수요가 제주로 쏠렸지.	제주 여행 급증	https://www.dnews.co.kr/uhtml/view.jsp?idxno=202201281706546630079	2022/02/01	0	2022-07-20 16:03:42	2022-07-21 09:19:09
BK22000052	5	질문자	요즘은 제주에서 한 달 살이도 많이 하더라. 여유만 있다면 나도 해보고 싶어.				0	2022-07-20 16:03:42	2022-08-02 12:01:32
BK22000052	6	전문가	내국인 관광객들이 장기 체류형으로 많이 머물기 시작했어. 새로운 여행 트렌드라고 볼 수 있을 것 같아.	제주 한 달 살이 수요	https://www.donga.com/news/article/all/20200116/99260568/1	2020/01/17	0	2022-07-20 16:03:42	2022-07-21 09:19:09
BK22000052	7	질문자	맞아. 주변 친구들도 짧은 시간에 많은 관광지를 둘러보는 것보다는 여유롭게 즐기는 여행을 많이 가더라고.				0	2022-07-20 16:03:42	2022-08-02 12:01:32
BK22000052	8	전문가	단순히 명소를 여행하는 것이 아니라 현지 생활 체험을 선호하기 때문이야. 그래서 근거리 주말 여행이나 한 달 살이, 호캉스, 액티비티 여행이 더 인기를 끌고 있지.	한 달 살이 인기	https://biz.chosun.com/site/data/html_dir/2019/10/26/2019102602558.html	2019/10/27	0	2022-07-20 16:03:42	2022-07-21 09:19:09
BK22000052	9	질문자	나도 이참에 제주 한 달 살이나 해볼까?				0	2022-07-20 16:03:42	2022-08-02 12:01:32
BK22000052	10	전문가	시간적, 경제적 여유만 된다면 괜찮은 방법 같은데?				0	2022-07-20 16:03:42	2022-07-21 09:19:09
BK22000052	11	질문자	그럼 렌터카를 빌려야겠지? 요즘 제주도 가면 다들 차를 렌트해서 돌아다니더라고.				0	2022-07-20 16:03:42	2022-08-02 12:01:32
BK22000052	12	전문가	요즘 제주 렌터카 품귀현상인거 알아? 코로나 이후 제주도가 해외 대체 여행지가 되면서 성수기, 비성수기 경계선이 무너졌대. 그래서 가격대가 부담스러운 일부 차종 빼고는 거의 풀부킹이 예상되니까 서두르는게 좋을 것 같아.	제주 렌터카 품귀	https://www.fnnews.com/news/202106231526119504	2021/06/27	0	2022-07-20 16:03:42	2022-07-21 09:19:09
BK22000052	13	질문자	와, 그렇게 많은 렌트카가 풀부킹이 예상된다니 너무 놀라운데? 알려줘서 고마워. 지금부터 서둘러서 알아봐야겠어.				0	2022-07-20 16:03:42	2022-08-02 12:01:32
BK22000052	14	전문가	아참, 차 렌트할 때 보험 꼼꼼하게 알아보는게 좋을거야. 렌터카 회사에서 권하는 자차보험은 사실상 자동차보험이 아닌 유사보험이거든. 그래서 렌터카 회사마다 보상 내용이 다를 수 있고 보상 한도도 높지 않지. 저렴하게 많은 보장을 받길 원한다면 렌터카를 빌리기 전 본인이 가입한 자동차 보험사에서 렌터카 특약에 가입하는게 현명한 방법이야.	제주 렌터카 보험	https://www.newspim.com/news/view/20210607000572	2021/06/07	0	2022-07-20 16:03:42	2022-07-21 09:19:09
BK22000052	15	질문자	안그래도 요즘 렌터카 관련 보험 문제를 뉴스에서 엄청 많이 본 것 같아.				0	2022-07-20 16:03:42	2022-08-02 12:01:32
BK22000052	16	전문가	현재 규정상, 렌터카 이용 중 사고가 났을 때 이용자가 수리비 폭탄을 떠안을 가능성이 커서 그럴거야. 현재 렌터카가 많이 보편화 되어 있음에도 소비자에게 피해를 전가하는 불공정 약관이 유지되고 있기 때문이지.	제주 렌터카 사고 주의	https://idsn.co.kr/news/view/1065593616300143	2022/03/23	0	2022-07-20 16:03:42	2022-07-21 09:19:09
BK22000052	17	질문자	애초에 사고가 나지 않도록 조심해야겠어.				0	2022-07-20 16:03:42	2022-08-02 12:01:32
BK22000052	18	전문가	아무래도 여행이다보니 분위기에 들떠서 과속으로 운전하는 사람이 많아서 사고가 빈번하게 발생하고 있어. 그리고 초보운전이나 장롱 면허 소지자들의 운전미숙도 렌터카 사고의 주요 원인이야. 그러니 제주도에 가게 되면 운전 꼭 조심해.	제주 렌터카 이용 주의	http://www.jemin.com/news/articleView.html?idxno=734339	2022/03/30	0	2022-07-20 16:03:42	2022-07-21 09:19:09
BK22000052	19	질문자	그래야겠다. 꼼꼼하게 알려줘서 고마워. 너 덕분에 걱정을 덜 수 있었던 것 같아.				0	2022-07-20 16:03:42	2022-08-02 12:01:32
BK22000052	20	전문가	즐겁고 안전한 여행 되길 바랄게.				1	2022-07-20 16:03:42	2022-07-21 09:55:02
