id	utterance_id	role	text	search_query	search_URL	reference_date	terminate	regDate	updDate
BK22006307	1	질문자	전문가님 혹시 조각보에 대해 잘 알고 계신가요?				0	2022-08-24 19:51:05	2022-09-05 16:49:25
BK22006307	2	전문가	네, 물론이죠. 그런데 갑자기 조각보라니 혹시 무슨 일이세요?				0	2022-08-24 19:51:05	2022-09-06 11:49:27
BK22006307	3	질문자	아니, 이번 주말에 친구네 어머니가 참여하신 조각보 전시를 보러 다녀왔는데 퀼트와 꽤 유사해 보이더라고요. 그런데 취미로 모인 분들이 개최한 전시라 설명도 없고 전시회 이름이랑 작품만 나와있어서 어디 물어볼 곳이 없었어요. 혹시 퀼트랑 조각보는 어떤 차이가 있나요?				0	2022-08-24 19:51:05	2022-08-24 19:51:05
BK22006307	4	전문가	우선 바느질에 차이가 있어요. 퀼트는 홈질로 천을 연결하지만 조각보는 보통 감침질을 사용하죠.	조각보 감침질	http://www.busan.com/view/busan/view.php?code=20150619000012	2015/06/19	0	2022-08-24 19:51:05	2022-09-06 11:49:27
BK22006307	5	질문자	오, 사용하는 바느질 기법에 차이가 있군요? 그리고 소재도 뭔가 다르게 느껴지던데 맞나요?				0	2022-08-24 19:51:05	2022-08-24 19:51:05
BK22006307	6	전문가	네, 그렇죠. 궁금이님이 말씀하신 대로 소재에서도 차이가 있어요. 조각보는 모시, 비단, 삼베와 같이 한국적인 원단을 이용한다면 퀼트는 주로 면 소재를 사용하죠. 누비처럼 솜을 덧대거나 다양한 부자재를 이용하기도 하고요.	조각보 한국적인 원단	https://www.inews365.com/news/article.html?no=644518	2020/11/18	0	2022-08-24 19:51:05	2022-08-24 19:51:05
BK22006307	7	질문자	한국적인 소재를 사용해서 그런 멋이 느껴졌군요. 그런데 전시회 제목이 규방공예였거든요. 혹시 규방공예가 뭔가요?				0	2022-08-24 19:51:05	2022-08-24 19:51:05
BK22006307	8	전문가	옛 여인들이 규방에서 우아하게 즐기던 공예들을 규방공예라고 해요. 자수나 조각보, 매듭과 누비와 같은 것들을 아울러 규방공예라고 부르죠. 현재는 많은 작가들에 의해 예술의 한 분야로 전해지고 있고요.	규방공예 예술 전승	https://www.nongmin.com/plan/PLN/SRS/57005/view	2015/02/09	0	2022-08-24 19:51:05	2022-08-24 19:51:05
BK22006307	9	질문자	아하, 규방이라는 곳에서 즐기던 공예를 규방공예라고 하는군요? 그런데 저도 조각보들 조금 배워보고 싶은 마음이 들더라고요. 혹시 조각보로 만들어볼 수 있는 작품에는 뭐가 있을까요?				0	2022-08-24 19:51:05	2022-08-24 19:51:05
BK22006307	10	전문가	보통 자주 만드는 조각보에는 기러기보, 바둑판보, 연잎보 등과 같은 작품이 있어요. 이것들을 응용해서 사각바늘방석이나 괴불노리개 같은 규방 소품도 만들어 볼 수 있죠.	조각보 기러기보 아리랑문보	http://www.busan.com/view/busan/view.php?code=20150619000012	2015/06/19	0	2022-08-24 19:51:05	2022-09-06 11:49:27
BK22006307	11	질문자	정말 다양한 작품을 만들어 볼 수 있네요. 혹시 어떤 준비물이 필요한지도 궁금해요.				0	2022-08-24 19:51:05	2022-08-24 19:51:05
BK22006307	12	전문가	기본적으로 원단과 바늘, 견사, 해라, 가위, 다리미, 자, 모눈종이를 준비하셔야 조각보를 만들어 볼 수 있어요.	조각보 준비물	http://www.busan.com/view/busan/view.php?code=20150619000012	2015/06/19	0	2022-08-24 19:51:05	2022-09-06 11:49:27
BK22006307	13	질문자	제가 아직 해보지 않아서 그런지 왠지 준비물이 많게 느껴지네요. 혹시 제가 만들어 볼만한 작품도 있을까요?				0	2022-08-24 19:51:05	2022-08-24 19:51:05
BK22006307	14	전문가	조각보 찻잔 받침을 추천해 드릴게요. 연두색, 쑥색, 다홍색과 같이 3가지 자투리 천을 잇대 만드는 사각형의 찻잔 받침이에요. 맞댄 천을 감침질로 완성할 수 있죠.	조각보 찻잔받침 만들기	https://www.nongmin.com/plan/PLN/SRS/57005/view	2015/02/09	0	2022-08-24 19:51:05	2022-08-24 19:51:05
BK22006307	15	질문자	세 가지 천으로 만드는 거면 우선 그렇게 복잡해 보이지는 않네요. 혹시 조각보를 만들 때 주의해야 하는 점도 있을까요?				0	2022-08-24 19:51:05	2022-08-24 19:51:05
BK22006307	16	전문가	네, 디자인대로 정확한 치수를 지켜야 한다는 점이에요. 하나라도 차이가 생기면 조각보가 비틀어지고 배가 부른 모양이 되거든요.	조각보 치수	http://www.busan.com/view/busan/view.php?code=20150619000012	2015/06/19	0	2022-08-24 19:51:05	2022-09-06 11:49:27
BK22006307	17	질문자	치수는 언제나 기본적으로 지켜야 하는 사항이군요? 그럼 또 다른 주의점은 없나요?				0	2022-08-24 19:51:05	2022-09-06 11:49:27
BK22006307	18	전문가	뒤틀림을 막으려면 올 사이에 정확하게 바늘이 들어가야 하기 때문에 씨줄과 날줄도 잘 다룰 줄 아셔야 해요.	조각보 뒤틀림	http://www.busan.com/view/busan/view.php?code=20150619000012	2015/06/19	0	2022-08-24 19:51:05	2022-09-06 11:49:27
BK22006307	19	질문자	흠, 말씀을 들어보니 왠지 누군가에게 배우는 게 좋을 것 같네요.				0	2022-08-24 19:51:05	2022-09-05 16:49:25
BK22006307	20	전문가	네, 아무래도 누군가의 도움을 받는다면 초보때는 많은 도움이 되죠.				0	2022-08-24 19:51:05	2022-08-24 19:51:05
BK22006307	21	질문자	전시회 당일에는 바빠서 친구 어머니께 말을 못 건네었는데 한번 여쭤볼까 봐요. 오늘 조각보라는 규방공예에 대해 알려주셔서 감사합니다.				0	2022-08-24 19:51:05	2022-08-24 19:51:05
BK22006307	22	전문가	친구 어머니한테 배우면 확실히 좋을 것 같네요. 그럼 예쁜 작품 완성하시면 다음에 자랑 한번 해주세요.				0	2022-08-24 19:51:05	2022-09-06 11:49:27
BK22006307	23	질문자	네, 그럼 작품 완성하고 연락드릴게요.				1	2022-09-05 16:49:25	2022-09-06 11:49:27
