id	utterance_id	role	text	search_query	search_URL	reference_date	terminate	regDate	updDate
BK22002459	1	질문자	어릴 땐 해외여행이라면 무조건 유럽 쪽으로만 가고 싶었거든? 그런데 요즘은, 조금 더 낯설고 이색적인 곳으로 떠나고 싶어져.				0	2022-08-02 12:16:46	2022-08-02 13:46:09
BK22002459	2	전문가	나랑 여행 취향이 비슷하게 변하고 있나 보네. 요즘 제일 가보고 싶은 나라는 어딘데?				0	2022-08-02 12:16:46	2022-08-02 13:46:09
BK22002459	3	질문자	최근에 두바이 여행과 관련된 정보들을 엄청 찾아보고 있어. 아무래도 중동에 대한 궁금증이 커지고 있나 봐.				0	2022-08-02 12:16:46	2022-08-02 13:46:09
BK22002459	4	전문가	나 두바이 여행 다녀와 본 적 있어! 궁금한 게 있다면 뭐든지 물어봐도 좋아.				0	2022-08-02 12:16:46	2022-08-02 13:46:09
BK22002459	5	질문자	그렇구나, 사실 최근에 우연히 무함마드 빈 라쉬드 도서관 사진을 본 적이 있어. 그 후로 두바이의 모든 것이 궁금해지기 시작했었거든. 스케일도 엄청나고, 그 분위기 자체가 장엄할 정도로 예술이었지.				0	2022-08-02 12:16:46	2022-08-02 13:46:09
BK22002459	6	전문가	사실 그 도서관은 3년 전에 완공을 마쳐서, 훨씬 일찍 개관될 수 있었던 곳이야. 그런데 코로나19가 시작되고, 추가공사를 하는 등 이런저런 이유로 개관이 계속 미뤄졌었지.	두바이 도서관	http://uberin.mk.co.kr/view.php?year=2022&no=603117	2022/07/11	0	2022-08-02 12:16:46	2022-08-02 13:46:09
BK22002459	7	질문자	그랬구나, 완공 소식을 알고 있었던 사람들은 더욱 애타게 개관을 기다렸겠다. 그런데, 두바이 근처에는 무함마드 외에도 이미 유명한 도서관이 하나 더 있다던데.				0	2022-08-02 12:16:46	2022-08-02 13:46:09
BK22002459	8	전문가	맞아, 샤르자의 지혜의 집 도서관 역시 아주 훌륭하지. 샤르자 자체가 출판 관련 경제활동이 매우 활발한 지역이야. 매년 세계출판 비엔날레도 열리고, 출판관련 자유경제무역지대도 있거든.	두바이 지혜의집	http://uberin.mk.co.kr/view.php?year=2022&no=603117	2022/07/11	0	2022-08-02 12:16:46	2022-08-02 13:46:09
BK22002459	9	질문자	그렇구나, 여행가게 된다면 도서관만큼은 그 두 곳으로 꼭 다녀와야 겠어. 두바이는 먹거리쪽으로는 별로 유명하지 않지?				0	2022-08-02 12:16:46	2022-08-02 13:46:09
BK22002459	10	전문가	그렇지 않아, 두바이는 중동에서 최초로 미쉐린 가이드 목적지로 선정되기도 했는걸?	두바이 미쉐린	https://www.traveltimes.co.kr/news/articleView.html?idxno=401325	2022/04/27	0	2022-08-02 12:16:46	2022-08-02 13:46:09
BK22002459	11	질문자	중동 최초 미쉐린 선정이라니, 놀라운 사실이었네. 여행 간다면 먹거리 걱정은 일절 없겠어.				0	2022-08-02 12:16:46	2022-08-02 13:46:09
BK22002459	12	전문가	물론이지, UAE는 두바이 푸드 페스티벌을 개최하기도 했어. 두바이 자체가 다채로운 식문화와 함께 미식의 도시로 성장하는 추세지.	두바이 푸드 페스티벌	http://news.heraldcorp.com/view.php?ud=20220701000439	2022/07/01	0	2022-08-02 12:16:46	2022-08-02 13:46:09
BK22002459	13	질문자	음식 관련 축제까지 열리다니, 정말 미식의 도시가 맞네. 페스티벌에서는 어떤 것들을 즐길 수 있어?				0	2022-08-02 12:16:46	2022-08-02 13:46:09
BK22002459	14	전문가	대표적으로는 저렴한 가격대로 고급 레스토랑 파인 다이닝을 즐길 수 있는 두바이 레스토랑 위크가 있어. 또한, 로컬들만 알고 있는 숨은 맛집을 찾아갈 수 있는 히든 젬스도 있지.	두바이 히든 젬스	https://sports.khan.co.kr/bizlife/sk_index.html?art_id=202204262343003&sec_id=561050&pt=nv	2022/04/26	0	2022-08-02 12:16:46	2022-08-02 13:46:09
BK22002459	15	질문자	여행을 가게 된다면, 그런 다양한 페스티벌 일정에 맞춰서 가는 것도 좋겠네. 덕분에 더욱 즐거운 여행이 될 것 같아. 혹시 숙소 중에 나킬몰 근처에 있는 세인트레지스 두파이 더 팜이라는 호텔 들어봤어?				0	2022-08-02 12:16:46	2022-08-02 13:46:09
BK22002459	16	전문가	당연하지, 두바이의 인기 쇼핑몰인 나킬몰과 통로로 연결된 호텔이잖아. 약 300여 개의 매장은 물론이고 영화관, 레스토랑까지 편리하게 이용할 수 있어서 접근성이 아주 편리한 곳이야.	두바이 나킬몰	http://www.tournews21.com/news/articleView.html?idxno=46604	2021/04/26	0	2022-08-02 12:16:46	2022-08-02 13:46:09
BK22002459	17	질문자	우와, 쇼핑은 물론이고 외식까지 한 번에 가능한 곳이었네. 난 자연 한 가운데 있는 숙소도 좋지만, 아무래도 인프라가 잘 되어있는 숙소가 더 끌리더라. 난, 여행에 있어서 먹거리와 쇼핑은 필수거든.				0	2022-08-02 12:16:46	2022-08-02 13:46:09
BK22002459	18	전문가	쇼핑이나 외식이 여행에서 중요한 부분을 차지한다면, 10주간 펼쳐지는 두바이 서머서프라이즈 쇼핑 축제는 꼭 놓치지 않길 바랄게. 무려 800개가 넘는 브랜드에서 최대 75퍼센트까지 할인을 하거든. 특히 서머 레스토랑 위크에서는 두바이의 미식을 특별 할인이 적용된 가격에 즐겨볼 수도 있어.	두바이 서머서프라이즈	https://newsis.com/view/?id=NISX20220704_0001929999&cID=10701&pID=10700	2022/07/04	0	2022-08-02 12:16:46	2022-08-02 13:46:09
BK22002459	19	질문자	75퍼센트 할인이라니, 정말 놓치면 섭섭할 만한 축제네. 그 서머서프라이즈 축제 기간은 언제까지인데?				0	2022-08-02 12:16:46	2022-08-02 13:46:09
BK22002459	20	전문가	두바이관광청의 공지에 따르면 서머서프라이즈 축제는 오는 9월4일까지 두바이 전역에서 개최될 예정이야.	두바이 서머서프라이즈	https://newsis.com/view/?id=NISX20220704_0001929999&cID=10701&pID=10700	2022/07/04	0	2022-08-02 12:16:46	2022-08-02 13:46:09
BK22002459	21	질문자	기간이 생각보다 넉넉하구나, 꼭 그 안에 두바이 여행을 다녀와야겠어. 덕분에 정말 알차고 경제적인 여행이 될 수 있을 것 같아.				0	2022-08-02 12:16:46	2022-08-02 13:46:09
BK22002459	22	전문가	여행 일정 계획에 도움이 되었다니 나도 기분이 좋네. 가는 날까지 꼼꼼하게 알아봐야 해, 안전하고 즐거운 여행 되길 바랄게!				0	2022-08-02 12:16:46	2022-08-02 13:46:09
BK22002459	23	질문자	응 고마워, 다녀오게 되면 바로 연락줄게.				1	2022-08-02 12:16:46	2022-08-02 15:32:16
