id	utterance_id	role	text	search_query	search_URL	reference_date	terminate	regDate	updDate
BK22002607	1	질문자	부산에 사는 친한 친구가 서울로 놀러오는데 어디를 같이 가는게 좋을까?				0	2022-08-02 12:18:01	2022-08-02 13:58:46
BK22002607	2	전문가	오, 친구가 놀러와서 기대되겠다. 친구는 평소에 뭐에 관심이 많은데?				0	2022-08-02 12:18:01	2022-08-02 13:58:46
BK22002607	3	질문자	음, 친구는 주로 문화,예술에 관심이 많아. 맛집도 좋아하지만.				0	2022-08-02 12:18:01	2022-08-02 13:58:46
BK22002607	4	전문가	너 서울공예박물관 가봤어? 지금 전시 1동에서 로에베 재단 공예상 전을 하고 있는데 거기 가보는 건 어때? 31일까지 한다고 했으니 친구랑 가보면 좋을 것 같은데. 결선에 오른 30명의 공예작품이 전시되어 있는데 올해 한국인이 최초로 우승했거든. 작품명이 성실의 시간이라던데, 세계적인 명성의 공모전에서 우승이라니 대단하지.	서울공예박물관	https://www.edaily.co.kr/news/read?newsId=01144726632391568&mediaCodeNo=257&OutLnkChk=Y	2022/07/05	0	2022-08-02 12:18:01	2022-08-02 13:58:46
BK22002607	5	질문자	서울공예박물관은 아직 한 번도 안 가봤어. 지난번에 개관한 곳 맞지?				0	2022-08-02 12:18:01	2022-08-02 13:58:46
BK22002607	6	전문가	응. 국내 첫 공예전문 공립박물관이야. 국가 지정문화재도 볼 수 있고, 총 2만 3257점의 공예품을 가지고 있어. 아, 그 자리가 예전에 풍문여고가 있던 부지라 기존의 학교 건물 5개의 외형을 그대로 살리면서 리모델링 한 거야.	서울공예박물관 개관	https://cm.asiae.co.kr/article/2021113011162588811	2021/12/01	0	2022-08-02 12:18:01	2022-08-02 13:58:47
BK22002607	7	질문자	친구가 딱 좋아할 것 같아. 다른 데 추천해줄 곳 또 있어?				0	2022-08-02 12:18:01	2022-08-02 13:58:47
BK22002607	8	전문가	국립현대미술관 가보는것도 괜찮지. 지금 하고 있는 전시는 스웨덴의 아크데스 국립건축디자인센터와 아랍 에미리트 샤르자미술재단과의 협력으로 진행되는 전시야. 각 기관의 미디어 소장품이나 주요 작가들의 작품을 볼 수 있는데, 샤르자미술재단도 샤르자 비엔날레로 굉장히 영향력있는 기관이라 볼 가치가 있을 거야. 9월 12일까지 하고 전시의 제목은 감각의 공간, 워치 앤 칠이야.	MMCA	http://www.sctoday.co.kr/news/articleView.html?idxno=38490	2022/06/14	0	2022-08-02 12:18:01	2022-08-02 13:58:47
BK22002607	9	질문자	두 곳 다 가까우니까 친구가 괜찮다고 하면 투어처럼 돌아다녀도 좋겠다. 또 재미있는 게 있을까?				0	2022-08-02 12:18:01	2022-08-02 13:58:47
BK22002607	10	전문가	그럼 친구 혹시 디자인에도 흥미가 있나? 이번에 디자인 매거진 라이브러리가 동대문디자인플라자에 개관했거든. 그래픽, 산업디자인, 건축, 인테리어, 패션, 라이프스타일 등 거의 107가지 종류가 넘는 국내외 매거진을 볼 수 있는 곳이야. 달마다 국내 잡지 33종, 해외 잡지 74종이 새로 들어오고, 오전 10시부터 오후 8시까지 무료 이용 가능하니까 디자인 분야에 관심있으면 가봐도 좋겠다.	서울 예술전시	https://www.segye.com/newsView/20220713521223?OutUrl=naver	2022/07/13	0	2022-08-02 12:18:01	2022-08-02 13:58:47
BK22002607	11	질문자	동대문디자인플라자는 나도 안 가봤는데 이번 기회에 가봐야겠다. 친구도 나도 디자인 분야에는 관심 많으니까.				0	2022-08-02 12:18:01	2022-08-02 13:58:47
BK22002607	12	전문가	아, 생각해보니 동대문디자인플라자에 또다른 재밌는 전시가 있는데, 20세기를 매혹시킨 디자인 가구전이거든. 1920년대부터 60년대 사이의 미공개 오리지널 빈티지 가구 컬렉션을 볼 수 있어. 무려 바우하우스의 초기 가구 컬렉션까지 볼 수 있는 전시야.	동대문디자인플라자 전시	https://www.nocutnews.co.kr/news/5784544	2022/07/10	0	2022-08-02 12:18:01	2022-08-02 13:58:47
BK22002607	13	질문자	서울에는 정말 흥미롭고 유명한 전시들이 많네.				0	2022-08-02 12:18:01	2022-08-02 13:58:47
BK22002607	14	전문가	꼭 크고 유명한 전시가 아니더라도 인사동에 가면 일년 내내 다양한 전시가 계속 열리고 있어서 돌아다니며 보기 좋아. 인사동이 한국에서 가장 화랑이 많은 곳이거든. 화랑들이 밀집되어 있으니까 여러 화랑들 돌아다니면서 마음에 드는 전시를 찾아보는 게 재미지.	서울 전시회	https://kookbang.dema.mil.kr/newsWeb/20220713/1/BBSMSTR_000000100192/view.do	2022/07/12	0	2022-08-02 12:18:01	2022-08-02 13:58:47
BK22002607	15	질문자	맞아, 사실 크게 이목을 끄는 전시회에 몇 번 갔었는데 사람이 너무 많아서 제대로 못 봤거든. 인사동 거닐면서 작은 화랑들 보는 게 더 좋을 수도 있겠어.				0	2022-08-02 12:18:01	2022-08-02 13:58:47
BK22002607	16	전문가	그래, 요즘 많이 하는 인스타그래머블한 전시들에 지치잖아. 사람들이 워낙 전시 관람 후기를 올린다기 보다 인스타그램에 사진 한 장 올리려고 전시회를 오니까. 물론 대중들이 작품을 좀 더 쉽게 이해하고 직접 참여해볼 수 있는건 사실이지만, 너무 인스타그램에 올릴 사진을 찍는 사람들이 많아서 관람 자체가 불편하기도 하지.	인스타그래머블 전시	http://www.ohmynews.com/NWS_Web/View/at_pg.aspx?CNTN_CD=A0002839484&CMPT_CD=P0010&utm_source=naver&utm_medium=newsearch&utm_campaign=naver_news	2022/06/03	0	2022-08-02 12:18:01	2022-08-02 13:58:47
BK22002607	17	질문자	그럼 친구한테 어느 쪽이 더 좋은지 물어봐야겠다.				0	2022-08-02 12:18:01	2022-08-02 13:58:47
BK22002607	18	전문가	참고로 더 알려주자면 이번에 서울역사박물관이 개편 공사를 끝내서 재개관 했어. 20주년 기념으로 20년부터 공사를 했다가 상설전시관을 다시 열었으니까 흥미 있다면 거기도 괜찮지 않을까? 10주년때의 전면 개편 이후로 처음 바꾼 거거든. 거기도 오전 9시부터 오후 6시까지 무료로 관람할 수 있어.	서울역사박물관	https://www.news1.kr/articles/?4726126	2022/06/29	0	2022-08-02 12:18:01	2022-08-02 13:58:47
BK22002607	19	질문자	오늘 알려준 곳들만 다 가도 친구랑 엄청 알찬 시간을 보낼 거 같다. 알려줘서 고마워.				0	2022-08-02 12:18:01	2022-08-02 13:58:47
BK22002607	20	전문가	친구분이랑 즐거운 시간 보내, 다음에 또 보자.				1	2022-08-02 12:18:01	2022-08-02 16:48:22
