id	utterance_id	role	text	search_query	search_URL	reference_date	terminate	regDate	updDate
BK22007152	1	질문자	전문가님 저 이번에 로마 여행을 가게 됐어요.				0	2022-09-01 19:30:55	2022-09-01 19:30:55
BK22007152	2	전문가	오, 로마 여행이라니 정말 부럽네요. 그럼 여행지는 정하셨나요?				0	2022-09-01 19:30:55	2022-09-01 19:30:55
BK22007152	3	질문자	그게 제가 바빴던지라 부모님이 가고 싶으시다는 트레비 분수 말고는 정해진 것이 없어요. 그래서 말인데 혹시 로마에 대해 알려주실 수 있을까요? 우선 트레비 분수는 도대체 뭐길래 부모님이 그렇게 가고 싶어 하는지가 궁금해요.				0	2022-09-01 19:30:55	2022-09-01 19:30:55
BK22007152	4	전문가	하하, 부모님이 로맨틱하시네요. 트레비 분수는 1732년~ 1762년에 만들어진 분수예요. 분수의 배경은 나폴리 궁전의 벽면을 이용해 조각들로 채워 만들어졌죠. 분수를 찾으면 등 뒤로 동전을 던지는 사람들이 많은데 한 번은 로마를 다시 올 수 있고 두 번은 사랑이 이루어지며 세 번은 사랑하는 사람과 이별한다는 미신이 있어서에요.	로마 여행 트레비 분수	https://www.sisamagazine.co.kr/news/articleView.html?idxno=458338	2022/08/10	0	2022-09-01 19:30:55	2022-09-01 19:30:55
BK22007152	5	질문자	저희 부모님은 몇 번 던질지 궁금해지는걸요? 그럼 트레비 분수에서 가까운 위치에 볼만한 곳이 있을까요? 부모님을 모시고 가다 보니 아무래도 체력 같은 게 신경 쓰여서요.				0	2022-09-01 19:30:55	2022-09-01 19:30:55
BK22007152	6	전문가	판테온 신전을 방문해보시면 되겠네요. 트레비 분수에서 4~5분가량 걸으면 광장에 분수대와 높은 석주가 위치해 있는 곳이죠. 기원전 27년에 로마의 최초 황제인 아그리파가 로마의 모든 신을 위해 만든 신전이에요. 그리스 시대 이후 고대 로마 신전 중 가장 규모가 크기도 하고 가장 온전한 형태로 남아있는 신전이기도 하죠.	로마 판테온 신전	http://www.dtnews24.com/news/articleView.html?idxno=412534	2017/01/27	0	2022-09-01 19:30:55	2022-09-01 19:30:55
BK22007152	7	질문자	초대 황제가 지었다니 얼마나 클지 궁금해지네요. 혹시 콜로세움도 로마에서 볼 수 있나요?				0	2022-09-01 19:30:55	2022-09-01 19:30:55
BK22007152	8	전문가	물론이죠, 과거 투사와 사자가 결투를 벌이던 곳인 콜로세움은 로마를 상징하는 건물이거든요.	로마 여행 콜로세움	https://www.hankyung.com/life/article/2019060986781	2019/06/09	0	2022-09-01 19:30:55	2022-09-01 19:30:55
BK22007152	9	질문자	오, 콜로세움이 로마에 있는 건물이었군요. 그럼 주변에 위치한 다른 볼거리도 있다면 알려주시겠어요?				0	2022-09-01 19:30:55	2022-09-01 19:30:55
BK22007152	10	전문가	콜로세움에서 나와 왼쪽에 있는 길을 따라가시면 진실의 입을 보실 수 있어요. 본래 강의 신 홀르비오의 얼굴을 조각해 만든 조각인데 진실의 입으로 불리게 된 것은 한참 후의 일이죠.	콜로세움 진실의 입 홀르비오	https://www.hankyung.com/life/article/2019060986781	2019/06/09	0	2022-09-01 19:30:55	2022-09-01 19:30:55
BK22007152	11	질문자	진실의 입은 저도 여행 프로그램에서 종종 본 조각이네요. 그럼 또 어떤 곳에 가보면 좋을까요?				0	2022-09-01 19:30:55	2022-09-01 19:30:55
BK22007152	12	전문가	콜로세움에서 베네치아 광장 방향으로 큰길을 따라 10여분 걸어서 포로 로마노를 보러 가세요. 현재는 돌무더기만 남은 곳이지만 한때는 로마의 정치와 상업, 종교의 중심지였던 곳이거든요. 포로 로마노 가운데에 놓인 성스러운 길은 전쟁에서 승리한 장군들이 개선 행진을 하던 곳이니 꼭 한번 눈에 담아보세요.	콜로세움 베네치아 광장 포로 로마노	https://www.hankyung.com/life/article/2019060986781	2019/06/09	0	2022-09-01 19:30:55	2022-09-01 19:30:55
BK22007152	13	질문자	성스러운 길이라니 이름이 비범하고 멋있네요. 그럼 가볼 만한 다른 곳이 있을까요?				0	2022-09-01 19:30:55	2022-09-01 19:30:55
BK22007152	14	전문가	네, 베네치아 광장 가는 길로 포로 로마노를 가셨으면 베네치아 광장도 가보셔야겠죠? 이곳은 1871년 이탈리아 통일을 기념하기 위해 만들어진 곳으로 로마의 배꼽이라고 불리는 곳에 위치한 광장이에요. 남쪽으로는 국군묘지와 비토리오 에마누엘레 2세의 동상과 기념관, 조국의 제단이 층층이 조성되어 있죠.	비토리오 에마누엘레 2세 기념관	http://www.viva100.com/main/view.php?key=20171023020021193	2017/10/23	0	2022-09-01 19:30:55	2022-09-01 19:30:55
BK22007152	15	질문자	볼 것이 정말 많은 곳이니 꼭 모시고 가야겠어요. 그런데 로마에 바티칸도 위치해 있지 않나요?				0	2022-09-01 19:30:55	2022-09-01 19:30:55
BK22007152	16	전문가	네, 맞아요. 또 하나의 국가인 바티칸은 로마에 위치해 있어요. 세상에서 가장 작은 독립국이며 전 세계 가톨릭의 총본산인 곳이죠. 미켈란젤로의 천지 장조와 같이 유명한 예술 작품들을 볼 수 있는 곳이기도 해요.	바티칸 가톨릭 총본산	https://www.sisamagazine.co.kr/news/articleView.html?idxno=458338	2022/08/10	0	2022-09-01 19:30:55	2022-09-01 19:30:55
BK22007152	17	질문자	천지창조도 바티칸에 있는 작품이군요? 저는 바티칸에 있다고 알았던 작품이 피에타상밖에 없었거든요. 그럼 혹시 피에타상은 어디서 볼 수 있나요?				0	2022-09-01 19:30:55	2022-09-01 19:30:55
BK22007152	18	전문가	네, 피에타상은 교황이 기거하는 성 베드로 성당에서 볼 수 있어요. 이곳은 초대 교황 베드로의 이름을 따서 명명한 곳이죠.	성 베드로 성당 피에타	https://www.sisamagazine.co.kr/news/articleView.html?idxno=458338	2022/08/10	0	2022-09-01 19:30:55	2022-09-01 19:30:55
BK22007152	19	질문자	로마가 정말 볼 것이 많은 곳이네요. 전문가님이 추천해주신 곳들 위주로 자세한 시간표를 짜 봐야겠어요.				0	2022-09-01 19:30:55	2022-09-01 19:30:55
BK22007152	20	전문가	네, 아무래도 기원전부터 조성된 도시이다 보니 문화유적이 많은 곳이죠.				0	2022-09-01 19:30:55	2022-09-01 19:30:55
BK22007152	21	질문자	전문가님과 대화를 나누다 보니 정말 기대가 되네요. 좋은 정보 정말 감사해요. 로마에서 꼭 전문가님 선물을 사 오도록 할게요.				0	2022-09-01 19:30:55	2022-09-01 19:30:55
BK22007152	22	전문가	하하, 아녜요. 부모님을 모시고 가시니 부디 별 탈 없이 다녀오시면 좋겠네요. 그럼 여행 준비하시면서 또 궁금한 점이 생기신다면 연락 주세요.				1	2022-09-01 19:30:55	2022-09-08 15:18:17
