id	utterance_id	role	text	search_query	search_URL	reference_date	terminate	regDate	updDate
BK22008203	1	질문자	제가 친구랑 같이 취미 삼아 한달에 두 번 정도 등산을 해보려고 하는데요. 등산에 대해 아는 것이 별로 없어서 도움을 받으러 왔어요.				0	2022-09-12 19:11:04	2022-09-12 19:11:04
BK22008203	2	전문가	그러시군요. 저는 주말마다 등산을 다니다보니 등산에 대해서는 잘 알아요. 어떤 것이 궁금하신가요?				0	2022-09-12 19:11:04	2022-09-12 19:11:04
BK22008203	3	질문자	등산을 하기 전에 미리 필요한 물품들을 사려고 하는데요. 등산화를 살 지 말 지 고민이 되서요. 그냥 운동화를 신어도 될 것 같은데 등산화를 꼭 사야할까요?				0	2022-09-12 19:11:04	2022-09-12 19:11:04
BK22008203	4	전문가	등산화는 꼭 사는 걸 추천해요. 등산화를 신으면 발목 관절을 유연하게 해줄 뿐만 아니라 지면 충격을 흡수해줘서 무릎 관절의 부담을 경감시킬 수 있거든요.	등산화	http://www.ftimes.kr/news/articleView.html?idxno=17845	2022/05/13	0	2022-09-12 19:11:04	2022-09-12 19:11:04
BK22008203	5	질문자	그렇군요! 그럼 등산복이랑 같이 구매를 해야겠네요. 혹시 등산복은 어떤 것을 사면 좋을지 알려주실 수 있나요?				0	2022-09-12 19:11:04	2022-09-12 19:11:04
BK22008203	6	전문가	등산복을 구입하실 때는 디자인보다는 보온성과 편안함을 우선적으로 고려해야 해요.
