id	utterance_id	role	text	search_query	search_URL	reference_date	terminate	regDate	updDate
BK22016783	1	질문자	이탈리아 로마로 여행을 가려고 해요. 책을 보니 로마에서 볼만한 유적지로 콜로세움이 있던데, 콜로세움은 어떤 곳인가요?				0	2022-10-18 12:30:26	2022-10-18 14:14:40
BK22016783	2	전문가	콜로세움은 역사적으로 로마제국에서 가장 거대한 원형경기장으로, 5만 명이 넘는 관중을 수용할 수 있었어요. 관중은 중앙 무대 위 공연을 수월하게 관람할 수 있었는데, 안에 있는 관람석의 경사가 가파르기 때문이었어요. 1980년에 유네스코는 콜로세움을 세계문화유산으로 선정했어요.	콜로세움	http://www.ohmynews.com/NWS_Web/View/at_pg.aspx?CNTN_CD=A0001907358	2013/09/25	0	2022-10-18 12:30:26	2022-10-18 14:14:40
BK22016783	3	질문자	로마의 문화를 느껴볼 수 있는 명소네요. 로마에도 파리처럼 유명한 개선문이 있는지 알려주세요.				0	2022-10-18 12:30:26	2022-10-18 14:14:40
BK22016783	4	전문가	콘스탄티누스 개선문은 로마 황제들의 축하 행렬이 거행되었던 길 위에 세워진 유적입니다. 로마 시대 때부터 고스란히 그 모습을 간직한 로마 개선문 세 곳 가운데 최고의 걸작으로 알려져 있습니다.	콘스탄티누스 개선문	http://www.jndn.com/article.php?aid=1557971878280881089	2019/05/16	0	2022-10-18 12:30:26	2022-10-18 14:14:40
BK22016783	5	질문자	로마에 과거 신전이었던 곳도 남아있나요?				0	2022-10-18 12:30:26	2022-10-18 14:14:40
BK22016783	6	전문가	네, 기원전 25년 집정관 아그리파 시대에 제작된 판테온은 고대 로마의 신을 위한 신전이었어요. 그러다 나중에는 성모와 순교자의 교회로 탈바꿈했어요. 그리고 위인들이 묻혀있는 묘지이기도 합니다.	로마 신전 판테온	https://www.yeongnam.com/web/view.php?key=20210315010002202	2021/03/16	0	2022-10-18 12:30:26	2022-10-18 14:14:40
BK22016783	7	질문자	그렇군요, 혹시 이탈리아에서 방문할 만한 광장이 있다면 어디일까요?				0	2022-10-18 12:30:26	2022-10-18 14:14:40
BK22016783	8	전문가	도미티아누스 황제 시대에 경기장이었던 나보나 광장은 로마 바로크 양식으로 만들어졌어요. 이곳에 있는 피우미 분수가 널리 알려져 있는데요, 유명한 이탈리아 조각가 베르니니가 제작했어요. 성 아그네스의 신앙심을 기념하기 위해 만든 성 아그네스 인 아고네 성당도 나보나 광장에서 볼 수 있어요.	나보나 광장	https://www.nocutnews.co.kr/news/4624399	2016/07/18	0	2022-10-18 12:30:26	2022-10-18 14:14:40
BK22016783	9	질문자	나보나 광장에서 피우미 분수 꼭 보고 싶네요. 이탈리아에서 유명한 분수가 또 있다면 알려주세요.				0	2022-10-18 12:30:26	2022-10-18 14:14:40
BK22016783	10	전문가	트레비 분수는 반은 인간, 반은 동물의 모습을 한 커다란 한 쌍의 해신 트리톤이 모는 전차 위에 해신 넵투누스상이 거대한 조개 위에 서 있는 형태를 띠고 있습니다. 개선문을 모방한 벽화가 이 조형물들 뒤에 배경으로 자리 잡고 있죠. 주변 커다란 암석 사이로 흐르는 물이 연못을 형성하는데요, 많은 관광객이 연못을 등진 채로 동전을 던집니다.	트레비 분수	https://www.mk.co.kr/news/culture/view/2016/08/580552/	2016/08/16	0	2022-10-18 12:30:26	2022-10-18 14:14:40
BK22016783	11	질문자	트레비 분수에 소원 빌면서 동전을 던져봐야겠네요. 과거에 있었던 건물들의 흔적을 볼 수 있는 명소는 어디인가요?				0	2022-10-18 12:30:26	2022-10-18 14:14:40
BK22016783	12	전문가	포로 로마노에서 로마의 멸망 이후 얼마 남지 않은 건축물들의 잔해를 볼 수 있어요. 타블라리움, 사투르누스 신전, 베스파시아누스 신전, 그리고 셉티미우스 세베루스 개선문과 티투스 개선문, 쿠리아 율리아, 바실리카 아이밀리아, 카이사르 신전, 베스타 신전 등의 잔해를 살펴볼 수 있어요.	포로 로마노	https://www.busan.com/view/busan/view.php?code=2021012820371445697	2021/02/02	0	2022-10-18 12:30:26	2022-10-18 14:14:40
BK22016783	13	질문자	그렇군요, 옛날 건축물들의 잔해를 보면 기분이 묘할 것 같아요. 이탈리아에도 가볼 만한 미술관이 있을까요?				0	2022-10-18 12:30:26	2022-10-18 14:14:40
BK22016783	14	전문가	네, 1997년에 발전소를 개조하여 만든 몬테마티니 미술관을 소개할게요. 터빈과 같은 발전설비와 함께 고대 조각상들을 감상할 수 있어요.	몬테마티니 미술관	https://www.chosun.com/opinion/specialist_column/2022/07/18/3ARXIDDPA5EKXAPKDVARUUWRDA/	2022/07/18	0	2022-10-18 12:30:26	2022-10-18 14:14:40
BK22016783	15	질문자	영화 로마의 휴일에서 진실의 입에 손을 넣는 장면이 나오던데, 진실의 입에 대해 알려주세요.				0	2022-10-18 12:30:26	2022-10-18 14:14:40
BK22016783	16	전문가	기원전 4세기에 제작된 것으로 추측되는 진실의 입은 6000년 이상의 세월이 담긴 유적입니다. 강의 신 홀르비오의 얼굴을 본떠 제작된 조각상으로, 시간이 많이 흐른 뒤에야 진실과 거짓을 판별하는 진실의 입이라는 이름으로 널리 불리게 되었죠.	진실의 입	https://www.hankyung.com/life/article/2019060986781	2019/06/09	0	2022-10-18 12:30:26	2022-10-18 14:14:40
BK22016783	17	질문자	6000년도 더 됐다니 정말 오래된 유적이네요. 이번에는 로마 안에 있지만 하나의 독립된 나라인 바티칸에서 구경할 만한 곳을 알려주세요.				0	2022-10-18 12:30:26	2022-10-18 14:14:40
BK22016783	18	전문가	산피에트로 대성당은 바티칸 가운데에 자리 잡고 있는데요. 이곳은 이중 콜로네이드로 제작되었고, 원형 광장과 궁전 및 정원이 가까이 있어요. 산피에트로 대성당은 라파엘로와 미켈란젤로를 위시하여 베르니니, 마데르나, 브라만테 등 훌륭한 예술가들의 재능이 녹아 있는 건축물입니다. 이 중에서도 미켈란젤로의 천지창조가 가장 널리 알려져 있어요.	산피에트로 대성당	https://www.hankyung.com/life/article/2019060986781	2019/06/09	0	2022-10-18 12:30:27	2022-10-18 14:14:40
BK22016783	19	질문자	이탈리아는 역사적인 유물이 굉장히 많이 산재해있네요. 여행 가면 볼거리가 다양하겠어요.				0	2022-10-18 12:30:27	2022-10-18 14:14:40
BK22016783	20	전문가	네, 다양한 역사적 유물을 감상할 수 있는 이탈리아에서 즐거운 추억 쌓으시길 바랄게요.				1	2022-10-18 12:30:27	2022-10-18 14:14:40
