id	utterance_id	role	text	search_query	search_URL	reference_date	terminate	regDate	updDate
BK22015126	1	질문자	친구들과 브뤼셀로 여행 가기로 했어. 브뤼셀에서는 그랑플라스를 꼭 가야 한다고 하던데, 어떤 곳이야?				0	2022-10-06 13:03:03	2022-10-06 13:47:13
BK22015126	2	전문가	그랑플라스는 브뤼셀의 중심부이면서 브뤼셀 여행의 시작과 끝이라고 생각하면 돼. 그랑플라스는 17세기 중세 느낌을 간직하고 있는 구시가지 광장으로 1998년 유네스코 세계문화유산으로 지정된 곳이야.	브뤼셀 그랑플라스	https://www.mk.co.kr/news/culture/view/2019/05/302502/	2019/05/08	0	2022-10-06 13:03:03	2022-10-06 13:47:13
BK22015126	3	질문자	중세 느낌이 나는 광장이 그랑플라스이구나. 사진에서 보니 그랑플라스에 건물들이 너무 멋있던데, 어떤 건물들이야?				0	2022-10-06 13:03:03	2022-10-12 15:33:42
BK22015126	4	전문가	그랑플라스에 있는 화려한 건물들은 거의 길드 하우스야. 17세기에는 브뤼셀에 유럽의 상인들이 모여서 그들의 만든 동업자 조합이지.	그랑플라스 길드 하우스	https://www.dnews.co.kr/uhtml/view.jsp?idxno=201906051056142910117	2019/06/15	0	2022-10-06 13:03:03	2022-10-12 15:33:42
BK22015126	5	질문자	길드 하우스가 그렇게 화려한 것을 보니 그 당시 상인들의 힘이 대단했나 보구나. 그리고, 그랑플라스에는 시청사가 있다던데, 어떤 건물인지 설명해 줄래?				0	2022-10-06 13:03:03	2022-10-12 15:33:42
BK22015126	6	전문가	종탑의 높이가 91미터인 시청사는 그랑플라스의 랜드마크야. 과거 브라방 공국의 수도였던 시절, 많은 재산과 영향력을 지닌 브라방공이 가장 화려한 자신의 건물을 가지고자 지은 건물이 1444년에 완공된 시청사야. 1695년 프랑스의 태양왕 루이 14세의 공격으로 많은 부분 파손되었지만, 재건되어 현재에 이르렀어.	브뤼셀 시청사	https://magazine.hankyung.com/money/article/202101204796c	2018/08/02	0	2022-10-06 13:03:03	2022-10-12 15:33:42
BK22015126	7	질문자	브뤼셀의 시청사가 그런 스토리가 있는 건물이구나. 그리고, 브뤼셀에서 꼭 봐야 하는 오줌싸개 동상에 대해서도 설명해 줄래?				0	2022-10-06 13:03:03	2022-10-09 11:43:33
BK22015126	8	전문가	브뤼셀의 가장 나이 많은 시민인 오줌싸개 동상은 벨기에 여행 코스 중에 하나지. 벌거벗은 모습이지만, 동상은 시기에 따라 다양한 옷으로 갈아입는데, 이것은 세계 여러 나라에서 동상을 위해 전통 의상을 제작해서 보낸 것들이야.	오줌싸개동상	https://www.nocutnews.co.kr/news/4445420	2015/07/17	0	2022-10-06 13:03:03	2022-10-12 15:33:42
BK22015126	9	질문자	각 나라의 전통의상을 동상에게 보내줬구나. 여행 책자를 보니 벨기에는 만화가 유명하다던데, 어떤 것이 있어?				0	2022-10-06 13:03:03	2022-10-12 15:33:42
BK22015126	10	전문가	피에르 퀼리포르는 벨기에의 작가로 스머프를 1958년에 만들었어. 그리고, 탱탱의 모험, 아스테릭스 같은 다양한 작품들도 벨기에에서 만들어진 거야. 벨기에 만화 캐릭터를 보고 싶다면 벨기에 만화 센터를 방문하거나, 라 부티크 탱탱에 가면 탱탱의 모험 캐릭터에 대한 것들을 볼 수 있어.	벨기에 만화	https://www.news1.kr/articles/?3764479	2019/11/09	0	2022-10-06 13:03:03	2022-10-06 13:47:13
BK22015126	11	질문자	스머프는 나도 되게 좋아하는 만화인데, 벨기에에서 만들어진 거구나. 그리고, 벨기에는 맥주도 유명한데 맥주에 대해 자세히 알아볼 수 있는 곳도 있어?				0	2022-10-06 13:03:03	2022-10-12 15:33:42
BK22015126	12	전문가	벨기에 맥주는 2016년 유네스코 무형 문화재로 인정받을 정도로 유명하지. 맥주 전용 박물관에 가면 벨기에 맥주의 전통과 과거, 양조 방법, 맥주 재료, 발효, 보관에 대한 것들을 볼 수 있어.	벨기에 맥주 박물관	https://www.ttlnews.com/article/biz_world/3948	2018/08/15	0	2022-10-06 13:03:03	2022-10-06 13:47:13
BK22015126	13	질문자	맥주 전용 박물관에 가면 벨기에 맥주에 대해 자세히 알 수 있겠구나. 그러면, 브뤼셀 맥주는 어떤 특징이 있어?				0	2022-10-06 13:03:03	2022-10-06 13:47:13
BK22015126	14	전문가	브뤼셀은 맥주 종류가 다양하며, 몰트와 과일 향이 나고 효모 맛을 느낄 수 있는 에일 맥주가 발달한 곳이야.	브뤼셀 맥주 특징	https://www.news1.kr/articles/?4396187	2021/08/07	0	2022-10-06 13:03:03	2022-10-12 15:33:42
BK22015126	15	질문자	브뤼셀은 에일 맥주를 맛보기 좋은 곳이구나. 또, 벨기에 하면 초콜릿도 유명하다던데, 어떤 것들이 유명해?				0	2022-10-06 13:03:03	2022-10-12 15:33:42
BK22015126	16	전문가	유명한 브랜드의 수제 제품부터 저렴한 초콜릿 제품들까지 모두 만날 수 있는 곳이 브뤼셀이야. 유명한 브랜드로는 노이하우스, 고디바, 레오니다스가 있고, 대표 상품으로는 견과류나 크림을 초콜릿 속에 넣은 프랄린 초콜릿이 있지.	벨기에 초콜릿	https://www.sedaily.com/NewsView/1S3HXBF0TH	2018/08/25	0	2022-10-06 13:03:03	2022-10-12 15:33:42
BK22015126	17	질문자	벨기에 초콜릿을 다 먹어보고 싶다. 브뤼셀 여행에 대해 궁금한 것이 많았는데 상세히 알려줘서 고마워.				0	2022-10-06 13:03:03	2022-10-06 13:47:13
BK22015126	18	전문가	고맙긴, 여행 계획 세우다가 모르는 것 있으면 또 물어봐.				1	2022-10-06 13:03:03	2022-10-12 15:33:42
BK22015126	19	질문자	그래, 우리는 내일 또 만나자.				0	2022-10-06 13:03:03	2022-10-06 13:47:13
BK22015126	20	전문가	조심해서 잘 가고, 안녕.				0	2022-10-06 13:03:03	2022-10-06 13:47:13
