id	utterance_id	role	text	search_query	search_URL	reference_date	terminate	regDate	updDate
BK22004321	1	질문자	제가 이번 여름휴가를 담양으로 가볼까 생각하고 있는데 혹시 어떤 곳인지 알고 계시나요?				0	2022-08-04 11:38:20	2022-08-06 10:47:59
BK22004321	2	전문가	그럼요, 전라남도 담양은 대나무의 고장으로 전라남도에 속하며 광주광역시에 인접해 있죠. 담양이라는 지명은 고려 현종 9년부터 쓰였고, 한자로 못 담과 볕 양이에요.	전라남도 담양	http://www.kjdaily.com/article.php?aid=1648462884570555028	2022/03/28	0	2022-08-04 11:38:20	2022-08-19 14:50:01
BK22004321	3	질문자	한자의 뜻을 들으니, 비옥한 지역을 의미하는 거 같아요.				0	2022-08-04 11:38:21	2022-08-06 10:47:59
BK22004321	4	전문가	네, 영산강이 시작되는 곳이기도 하고 담양호와 광주호 등의 큰 담수호와 크고 작은 하천도 많은 곳이에요. 게다가 볕이 좋은 지역이기 때문에 식물이 잘 자라 농작물과 꽃, 수목에 좋은 조건이랍니다.	담양	https://www.jnilbo.com/view/media/view?code=20170804000000529321426	2017/08/03	0	2022-08-04 11:38:21	2022-08-06 10:47:59
BK22004321	5	질문자	멋진 곳 같아서 꼭 가보고 싶네요. 그럼 담양에 유명한 장소로 어디가 있을까요?				0	2022-08-04 11:38:21	2022-08-06 10:47:59
BK22004321	6	전문가	그럼 담양 10경에 대해 소개해 드릴게요. 아마 몇 군데는 들어보셨을 거예요. 바로 죽녹원, 소쇄원, 용흥사 계곡, 관방제림, 가마골 용소, 추월산, 금성산성, 병풍산, 삼인산, 메타세쿼이아 길이랍니다.	담양 10경	http://www.gjdream.com/news/articleView.html?idxno=610352	2021/09/24	0	2022-08-04 11:38:21	2022-08-06 10:47:59
BK22004321	7	질문자	그렇군요, 죽녹원이랑 메타세쿼이아 길은 주위 지인들에게 들어보긴 했어요. 많은 사람들이 가는 걸로 알고 있는데 좋은 곳인가요?				0	2022-08-04 11:38:21	2022-08-06 10:47:59
BK22004321	8	전문가	그렇다면 죽녹원이라는 곳부터 알려드릴게요. 죽녹원은 2003년 향교리 대숲에 조성 대나무 테마공원이에요. 길이가 2.4킬로미터의 대숲 산책길과 죽림욕장으로 인기 있는 곳이죠.	죽녹원	https://www.sedaily.com/NewsView/1VKJZDWV15	2019/06/25	0	2022-08-04 11:38:21	2022-08-06 10:47:59
BK22004321	9	질문자	그렇군요, 산책로가 잘 되어 있어 걷기 좋다고 들었어요.				0	2022-08-04 11:38:21	2022-08-06 10:47:59
BK22004321	10	전문가	맞아요, 죽마고우길과 사랑이 변치 않는 길 등 총 8개의 테마길이 서로 연결되어 있어서 산책하기 좋답니다.	죽녹원 산책로	https://www.jnilbo.com/view/media/view?code=20171110000000535723242	2017/11/09	0	2022-08-04 11:38:21	2022-08-23 08:21:33
BK22004321	11	질문자	멋지네요, 담양 여행을 간다면 죽녹원은 꼭 갈 거예요. 이번에는 메타세쿼이아 길에 대해 알려주세요.				0	2022-08-04 11:38:21	2022-08-06 10:47:59
BK22004321	12	전문가	네, 1972년도 당시 담양 군수였던 김기회에 의해 만들어진 메타세쿼이아 길은 국도 24호선을 가로수로 조성했어요. 이 길은 건설교통부가 실시한 한국의 아름다운 길 100선에서 최우수상을 수상했답니다.	메타세쿼이아 길	http://www.gjdream.com/news/articleView.html?idxno=610352	2021/09/24	0	2022-08-04 11:38:21	2022-08-06 17:51:12
BK22004321	13	질문자	상까지 받았다니, 많은 사람들이 찾겠어요.				0	2022-08-04 11:38:21	2022-08-06 10:47:59
BK22004321	14	전문가	그럼요, 지난해에 유료 관광객이 무려 57만 명이나 왔는걸요.	메타세쿼이아 관광객	https://www.jnilbo.com/view/media/view?code=20171110000000535723242	2017/11/09	0	2022-08-04 11:38:21	2022-08-06 10:47:59
BK22004321	15	질문자	그렇다면 저도 꼭 들러봐야겠어요. 혹시 담양에서 해마다 열리는 축제 같은 건 없을까요?				0	2022-08-04 11:38:21	2022-08-06 10:47:59
BK22004321	16	전문가	담양 대나무 축제라고 들어본 적 있으신가요? 죽녹원과 관방제림, 메타세쿼이아 길 등의 지역 생태관광자원과 연계해 진행하는 봄 대표 축제에요. 이 축제는 2012년부터 5년 연속 문화 관광 우수축제에 선정되었고, 2017년부터는 3년 연속 문화 관광 최우수축제로 선정되었답니다.	담양대나무축제	http://www.namdonews.com/news/articleView.html?idxno=522160	2019/04/30	0	2022-08-04 11:38:21	2022-08-23 08:21:33
BK22004321	17	질문자	오, 이번에 못 가더라도 언젠가는 꼭 가봐야겠어요.				0	2022-08-04 11:38:21	2022-08-06 10:47:59
BK22004321	18	전문가	네, 내년 봄에 한 번 계획해서 다녀오세요.				0	2022-08-04 11:38:21	2022-08-06 10:47:59
BK22004321	19	질문자	그래야겠어요, 오늘 좋은 정보 주셔서 너무 감사해요. 정말 많은 도움이 되었답니다.				0	2022-08-04 11:38:21	2022-08-06 10:47:59
BK22004321	20	전문가	별말씀을요, 더 궁금한 점이 있으시면 연락 주시고 다음에 또 대화 나눠요.				1	2022-08-04 11:38:21	2022-08-23 08:21:33
