id	utterance_id	role	text	search_query	search_URL	reference_date	terminate	regDate	updDate
BK22002208	1	질문자	외국 친구들이 안동 하회마을을 알던데 어떻게 아는지 너무 신기해.				0	2022-08-02 12:14:40	2022-08-02 13:19:23
BK22002208	2	전문가	1999년 안동하회 마을에 방문한 영국 엘리자베스 2세 여왕이 가장 한국적이고 아름다움을 지닌 마을이라고 극찬하면서부터 세계적으로 알려지게 되었어.	안동하회마을	http://www.ksmnews.co.kr/default/index_view_page.php?idx=370936&part_idx=229	2022/03/13	0	2022-08-02 12:14:40	2022-08-02 13:19:23
BK22002208	3	질문자	엘리자베스 여왕이 방문하면서부터 유명해진 거구나. 안동 하회마을은 어떤 곳이야?				0	2022-08-02 12:14:40	2022-08-02 13:19:23
BK22002208	4	전문가	풍산 류씨가 대대로 600년간 살아온 동성마을 중 하나로 조선시대의 대유학자인 류운룡 선생과 임진왜란 때 영의정을 지낸 류성룡 형제가 자란 곳으로 유명해. 그리고, 초가집과 기와집이 잘 보존된 곳이기도 하고.	하회마을 역사	http://www.dkilbo.com/news/articleView.html?idxno=333498	2021/05/16	0	2022-08-02 12:14:40	2022-08-02 13:19:23
BK22002208	5	질문자	초가와 기와집이 있는 마을이라면 조선시대로 돌아간 느낌이겠다. 처음부터 마을 이름이 하회마을이었어?				0	2022-08-02 12:14:40	2022-08-02 13:19:23
BK22002208	6	전문가	아니, 옛 이름은 부용촌이었어. 부용은 연꽃이라는 뜻인데 마을의 모양이 꼭 연꽃이 핀 모양 같다고 해서 붙여진 이름이야.	하회마을 부용촌	https://news.imaeil.com/page/view/2021032620242577425	2021/03/27	0	2022-08-02 12:14:40	2022-08-02 13:19:23
BK22002208	7	질문자	부용촌이라는 이름도 꽤 이쁘네. 그럼 지금의 하회마을이란 이름은 무슨 뜻이야?				0	2022-08-02 12:14:40	2022-08-02 13:19:23
BK22002208	8	전문가	낙동강 물이 s자처럼 흘러간다는 뜻이야.	하회마을 의미	http://www.tournews21.com/news/articleView.html?idxno=45226	2021/01/11	0	2022-08-02 12:14:40	2022-08-02 13:19:23
BK22002208	9	질문자	그렇구나, 하회마을도 유네스코 세계유산으로 지정된 곳이지?				0	2022-08-02 12:14:41	2022-08-02 13:19:23
BK22002208	10	전문가	2010년 브라질에서 열린 제34차 유네스코 세계유산위원회에서 세계유산으로 등재가 확정되었어.	하회마을 유네스코	http://www.idaegu.com/newsView/idg202009200092	2020/09/23	0	2022-08-02 12:14:41	2022-08-02 13:19:23
BK22002208	11	질문자	하회마을이 가치가 있는 곳 임을 세계적으로 인정받은 거네. 하회마을의 명소는 어딘지 소개해 줘.				0	2022-08-02 12:14:41	2022-08-02 13:19:23
BK22002208	12	전문가	소나무 숲인 만송정은 하회마을의 명소 중 하나야. 천연기념물 473호인 이곳은 류운룡이 바위 절벽인 부용대의 거친 기운을 완화하고 북서쪽의 허한 기운을 메울 목적으로 소나무 1만 그루를 심은, 하회 마을 강변을 따라 넓게 펼쳐진 곳이야.	하회마을 만송정	https://news.imaeil.com/page/view/2022033010134937733	2022/03/31	0	2022-08-02 12:14:41	2022-08-02 13:19:23
BK22002208	13	질문자	소나무 숲이면 너무 멋있겠다. 하회마을은 오래된 마을이니 고택도 많겠다.				0	2022-08-02 12:14:41	2022-08-02 13:19:23
BK22002208	14	전문가	그렇지, 양진당은 보물 제306호로 대종택이면서 류중영과 류운룡을 불천위로 모시는 곳이고, 류성룡의 종택인 보물 제414호인 충효당이 있어. 그 밖에도 하동고택, 북촌댁, 남촌댁도 고택도 국가 민속 문화재로 지정된 곳이야.	하회마을 고택	http://www.busan.com/view/busan/view.php?code=20181002000337	2018/10/03	0	2022-08-02 12:14:41	2022-08-02 13:19:23
BK22002208	15	질문자	하회마을은 마을 전체가 문화재라고 할 수 있겠다. 유명한 곳이 많으니 하회마을에서 찍은 드라마나 영화도 많지?				0	2022-08-02 12:14:41	2022-08-02 13:19:23
BK22002208	16	전문가	하회마을의 독특한 분위기 때문에 드라마나, 영화의 단골 촬영지이지. 스캔들, YMCA 야구단, 한반도 등 많은 영화들이 여기서 촬영되었어. 이 영화들을 보면서 하회마을을 찾아보는 것도 재미지.	하회마을 관광지	http://www.newsinside.kr/news/articleView.html?idxno=382621	2016/02/02	0	2022-08-02 12:14:41	2022-08-02 13:19:23
BK22002208	17	질문자	그렇겠다, 이야기해 준 영화를 보면서 어디가 하회마을인지 찾아봐야 겠다. 하회마을에 유명한 음식은 어떤 것이 있어?				0	2022-08-02 12:14:41	2022-08-02 13:19:23
BK22002208	18	전문가	안동은 유교 문화가 뿌리 깊은 지역이잖아. 그래서 제사와 관련 있는 헛제사밥이 유명해. 평상시에 먹기 힘든 제사 음식과 같은 재료로 만든 비빔밥을 헛제사밥이라고 해.	안동 헛제사밥	http://www.naeil.com/news_view/?id_art=209045	2016/09/04	0	2022-08-02 12:14:41	2022-08-02 13:19:23
BK22002208	19	질문자	헛제사밥이라는 음식은 이름이 너무 특이하다. 하회마을에 가서 헛제사밥 한번 먹어 보고 싶다.				0	2022-08-02 12:14:41	2022-08-02 13:19:23
BK22002208	20	전문가	그래 시간되면 한번 다녀와.				1	2022-08-02 12:14:41	2022-08-02 14:16:13
