id	utterance_id	role	text	search_query	search_URL	reference_date	terminate	regDate	updDate
BK22002016	1	질문자	나 이번에 친구들이랑 처음으로 당구장 가서 이것저것 배웠는데, 은근 어렵더라?				0	2022-08-02 12:13:03	2022-08-02 12:56:00
BK22002016	2	전문가	당구장 가서 어떤 거 배웠는데?				0	2022-08-02 12:13:03	2022-08-02 12:56:00
BK22002016	3	질문자	포켓볼이랑 4구랑 알려줘서 해 봤지. 그런데 경기마다 규칙도 다르고 헷갈리더라고. 공을 당구대 구멍에 넣는 게 포켓볼이지?				0	2022-08-02 12:13:03	2022-08-02 12:56:00
BK22002016	4	전문가	맞아, 흰 공을 이용해서 1번부터 15번까지 숫자가 쓰여있는 공을 쳐서 포켓에 넣는 게 포켓볼이야.	포켓볼	https://ko.wikipedia.org/wiki/%ED%8F%AC%EC%BC%93%EB%B3%BC	2022/02/10	0	2022-08-02 12:13:03	2022-08-02 12:56:00
BK22002016	5	질문자	포켓볼이 그나마 좀 쉽더라. 일단 치라는 대로 치긴 했는데 규칙 좀 제대로 알려주라.				0	2022-08-02 12:13:03	2022-08-02 12:56:00
BK22002016	6	전문가	일단 검은색 공을 먼저 넣으면 안 되는 거 알지? 그리고 흰 공이 밖으로 나가거나 구멍에 들어가는 것도 안 돼. 샷을 할 때 두 발 모두 떼는 것도 안 되고. 어길 경우 페널티가 있어.	포켓볼 규칙	http://news.imaeil.com/page/view/2014120408101504873	2014/12/04	0	2022-08-02 12:13:03	2022-08-02 12:56:00
BK22002016	7	질문자	안 되는 게 많네. 그래도 포켓볼은 공이 많아서 어쨌든 공이 맞긴 하는데 그 뒤에 4구를 쳤거든. 4구가 난이도가 더 어렵더라고.				0	2022-08-02 12:13:03	2022-08-02 12:56:00
BK22002016	8	전문가	4구는 흰 공이랑 노란 공, 그리고 빨간 공 두 개로 하는 게임이야. 내 공이 흰 공일 때 상대는 노란 공으로 진행하는데, 내 공으로 빨간 공 두 개만 맞히면 10점을 얻는 거야.	당구 4구 규칙	https://sports.news.naver.com/news.nhn?oid=570&aid=0000000244	2018/04/26	0	2022-08-02 12:13:03	2022-08-02 12:56:00
BK22002016	9	질문자	그럼 빨간 공을 한 개만 맞히면?				0	2022-08-02 12:13:03	2022-08-02 12:56:00
BK22002016	10	전문가	빨간 공을 한 개만 맞히면 상대한테 공격권이 넘어가는 거야. 상대 공을 건드리거나 빨간 공을 한 개도 못 맞혔을 땐 벌점 10점인 거고.	당구 4구 규칙	https://sports.news.naver.com/news.nhn?oid=570&aid=0000000244	2018/04/26	0	2022-08-02 12:13:03	2022-08-02 12:56:00
BK22002016	11	질문자	그 10점이라는 게 점수판 알 한 개인 거지? 당구는 점수를 미리 채워놓고 시작하더라.				0	2022-08-02 12:13:04	2022-08-02 12:56:00
BK22002016	12	전문가	당구 점수판에선 자신의 점수를 왼쪽으로 미리 이동해 놓지. 그리고 득점할 때마다 알을 오른쪽으로 옮기는 거야. 자기 점수를 다 쳐서 오른쪽으로 알이 다 이동하면 마무리로 3쿠션을 치면 돼.	당구 점수판	https://sports.news.naver.com/news.nhn?oid=570&aid=0000000244	2018/04/26	0	2022-08-02 12:13:04	2022-08-02 12:56:00
BK22002016	13	질문자	그러고 보니 3쿠션도 있지? 난 3쿠션은 안 쳐 보고 구경만 했는데 3쿠션은 너무 어려워 보이더라.				0	2022-08-02 12:13:04	2022-08-02 12:56:00
BK22002016	14	전문가	3쿠션 경기는 당구공 세 개로 하는 거야. 흰 공이랑 노란 공, 그리고 빨간 공을 사용해. 4구랑 다른 건 내 공으로 제1목적구인 상대 공이나 빨간 공을 먼저 맞히고 쿠션에 3번 이상 맞아야 한다는 거야. 그다음에 제2목적구를 맞혀야 1점을 얻는 거지.	당구 3쿠션 규칙	https://sports.news.naver.com/news.nhn?oid=570&aid=0000000244	2018/04/26	0	2022-08-02 12:13:04	2022-08-02 12:56:00
BK22002016	15	질문자	와, 그냥 공 맞히는 것도 어려운데 공을 세 번이나 돌려야 한다는 거네. 그래서 3쿠션이라고 하는 거구나.				0	2022-08-02 12:13:04	2022-08-02 12:56:00
BK22002016	16	전문가	어려워 보여도 연습하다 보면 할 수 있을 거야.				0	2022-08-02 12:13:04	2022-08-02 12:56:00
BK22002016	17	질문자	난 일단 포켓볼부터 마스터해야 할 것 같은데. 아, 또 궁금한 게 있는데 당구 칠 때 막대에 초크를 문지르잖아. 그건 왜 하는 거야?				0	2022-08-02 12:13:04	2022-08-02 12:56:00
BK22002016	18	전문가	당구 초크는 석회질이 주 재료인데 초크를 칠해서 공을 칠 때 팁이 안 미끄러지도록 해 주는 거야.	당구 초크	https://ko.wikipedia.org/wiki/%EB%8B%B9%EA%B5%AC	2022/03/02	0	2022-08-02 12:13:04	2022-08-02 12:56:00
BK22002016	19	질문자	그래서 칠 때마다 그걸 문지르라고 했던 거구나. 그럼 마지막으로 하나만 더 물어봐도 돼?				0	2022-08-02 12:13:04	2022-08-02 12:56:00
BK22002016	20	전문가	궁금한 거 있으면 더 물어봐도 괜찮아.				0	2022-08-02 12:13:04	2022-08-02 12:56:00
BK22002016	21	질문자	그럼 당구 칠 때 에티켓 같은 것 좀 알려주라.				0	2022-08-02 12:13:04	2022-08-02 12:56:00
BK22002016	22	전문가	당구 칠 때 에티켓이라고 하면 의도하지 않은 샷이 성공할 땐 인사해서 미안함을 표시해 주는 게 좋지. 또 상대방이 플레이할 때 영향을 주는 말이나 행동을 자제하고.	당구 에티켓	https://bravo.etoday.co.kr/view/atc_view.php?varAtcId=8855	2018/07/30	0	2022-08-02 12:13:04	2022-08-02 12:56:00
BK22002016	23	질문자	음, 그냥 매너 있게 행동하면 되겠구나.				0	2022-08-02 12:13:04	2022-08-02 12:56:00
BK22002016	24	전문가	그렇지 뭐. 당구 더 배워보고 싶으면 언제 한 번 놀러 와. 내가 같이 당구장 가서 궁금한 거 알려줄게.				0	2022-08-02 12:13:04	2022-08-02 12:56:00
BK22002016	25	질문자	그럼 나야 고맙지! 그럼 시간 날 때 날짜 정해서 한 번 놀러 갈게.				1	2022-08-02 12:13:04	2022-08-02 13:30:03
