id	utterance_id	role	text	search_query	search_URL	reference_date	terminate	regDate	updDate
BK22012267	1	질문자	집에서 잘 안 나가지만 운동은 해야겠고, 집에서 할 수 있는 운동이 있을까?				0	2022-09-30 15:08:05	2022-10-01 11:16:34
BK22012267	2	전문가	좋아 하나씩 운동법을 알려줄게. 크런치의 대표 동작인 베이직 크런치는 쉽게 복근 중상부를 자극할 수 있는 동작이야. 윗몸 일으키기를 한다고 생각하는데 반만 한다고 생각해. 상체를 완전히 들지는 말고, 상부 복부 힘을 사용해서 몸을 들어 올려 봐.	크런치 효과	http://www.ftimes.kr/news/articleView.html?idxno=15557	2021/12/31	0	2022-09-30 15:08:05	2022-10-01 11:16:34
BK22012267	3	질문자	크런치는 상복부를 자극해주는 운동이구나, 하복부는 어떻게 자극할까?				0	2022-09-30 15:08:05	2022-10-01 11:16:34
BK22012267	4	전문가	레그레이즈를 하면 돼. 바닥에 똑바로 누운 상태에서 복근에 자극을 주기 위해서 두 다리를 들어올리는 하복부 단련이야. 다만 그 과정간에 허리에 힘이 강하게 들어갈 수 있어서 디스크 손상위험이 있어.	레그 레이즈 하복부	http://www.beyondpost.co.kr/view.php?ud=20200910154450818446a9e4dd7f_30	2020/09/10	0	2022-09-30 15:08:05	2022-10-01 11:16:34
BK22012267	5	질문자	복부는 그 두개면 될 것 같고, 가슴 근육은 어떻게 키워?				0	2022-09-30 15:08:06	2022-10-01 11:16:34
BK22012267	6	전문가	가슴근육과 삼두근을 키우기 위해서는 팔굽혀펴기를 해. 팔 간격을 얼마나 벌리는 지에 따라 운동 효과에 영향을 받는 부위가 달라져.	가슴근육 맨몸운동	https://www.gokorea.kr/news/articleView.html?idxno=23269	2017/07/11	0	2022-09-30 15:08:06	2022-10-01 11:16:34
BK22012267	7	질문자	엎드린 자세를 유지하기만 해도 효과가 좋은 운동이 있다던데?				0	2022-09-30 15:08:06	2022-10-01 11:16:34
BK22012267	8	전문가	플랭크겠네. 최대한 오랫동안 팔굽혀펴기와 비슷한 자세를 유지하는 등척성 체간근 근력운동이야.	플랭크	https://ko.wikipedia.org/wiki/%ED%94%8C%EB%9E%AD%ED%81%AC_(%EC%9A%B4%EB%8F%99)	2022/02/15	0	2022-09-30 15:08:06	2022-10-01 11:16:34
BK22012267	9	질문자	참, 버피인가 하는 운동을 영상으로 봤는데, 아랫집에 울릴까봐 못 하겠어.				0	2022-09-30 15:08:06	2022-10-01 11:16:34
BK22012267	10	전문가	그러면 슬로우버피를 하면 좋을 거야. 발 앞에 양손을 짚으며 쪼그려 앉고, 다리를 한 쪽씩 쭉 뻗어. 그리고 어깨와 발끝이 일직선이 되도록 해. 마지막으로 한쪽 발씩 앞으로 옮기면서 만세 동작을 하며 일어나는 운동이야. 속도를 천천히 하는 만큼 자세를 정확히 하는 게 좋아.	슬로우 버피	http://www.ftimes.kr/news/articleView.html?idxno=14437	2021/11/14	0	2022-09-30 15:08:06	2022-10-01 11:16:34
BK22012267	11	질문자	공기의자 비슷한 운동도 영상으로 본 기억이 있어.				0	2022-09-30 15:08:06	2022-10-01 11:16:34
BK22012267	12	전문가	에어스쿼트는 엉덩이를 무릎보다 낮은 높이까지 내렸다가 올리는 베이직한 운동이야. 코어와 허벅지 앞,뒤쪽 그리고 엉덩이에 자극을 주지.	에어 스쿼트 자세	https://www.hidoc.co.kr/healthstory/news/C0000523651	2020/06/30	0	2022-09-30 15:08:06	2022-10-01 11:16:34
BK22012267	13	질문자	누워서 엉덩이를 드는 동작도 있던데 그건 뭐야?				0	2022-09-30 15:08:06	2022-10-01 11:16:34
BK22012267	14	전문가	브릿지 동작이야. 허벅지와 허리의 힘을 기르는데 도움이 되는 동작이고, 바닥에 등과 손바닥을 대고 눕고 나서, 어깨로 체중을 받치면서 엉덩이를 들어올리면 돼. 조심해야하는 건 무릎과 가슴이 일직선이 돼야 해.	브릿지	https://health.chosun.com/site/data/html_dir/2022/04/21/2022042102236.html	2022/04/22	0	2022-09-30 15:08:06	2022-10-01 11:16:34
BK22012267	15	질문자	마치 산을 오르는 사람 처럼 양 다리를 움직이는 운동은 뭐야?				0	2022-09-30 15:08:06	2022-10-01 11:16:34
BK22012267	16	전문가	마운틴 클라이머구나. 팔굽혀펴기 자세를 취하는데, 양발은 자연스럽게 벌리고, 두 다리를 번갈아가며 가슴 쪽으로 당기는 운동법이야. 이게 허벅지에 힘을 줘야 할 것 같지만, 사실 복부에 더 힘을 주는 게 좋아. 팔굽혀펴기나 플랭크랑 비교하면 열량소모가 훨씬 크다보니까 체지방을 줄이는데 좋지.	마운틴 클라이머 운동	https://www.segye.com/newsView/20200406524451?OutUrl=naver	2020/04/08	0	2022-09-30 15:08:06	2022-10-01 11:16:34
BK22012267	17	질문자	만약에 도구를 조금 곁들인다면 어떤 운동을 더 할 수 있을까?				0	2022-09-30 15:08:07	2022-10-01 11:16:34
BK22012267	18	전문가	가슴과 어깨 근육이 탄탄해지는 턱걸이를 할 수 있지.	턱걸이 효과	https://n.news.naver.com/mnews/article/296/0000029919?sid=103	2017/01/08	0	2022-09-30 15:08:07	2022-10-01 11:16:34
BK22012267	19	질문자	덕분에 집에서 운동을 해서 멋진 몸을 만들 수 있겠는걸!				0	2022-09-30 15:08:07	2022-10-01 11:16:34
BK22012267	20	전문가	하지만 꼭 조심해. 운동을 처음 하는 사람들은 잘못된 자세를 취해서 다른 부위를 자극하거나, 부상을 입을 수 있으니까. 스포츠손상을 입을만큼 자기 능력보다 무리해서 고강도의 운동을 하지 않도록 해.	홈 트레이닝 주의할 점 전문가	https://www.tfmedia.co.kr/news/article.html?no=103231	2021/04/21	0	2022-09-30 15:08:07	2022-10-01 11:16:34
BK22012267	21	질문자	조심해서 다치지 않게 운동해야겠네.				0	2022-09-30 15:08:07	2022-10-01 11:16:34
BK22012267	22	전문가	맞아 그게 제일 중요하다고 할 수 있어.				1	2022-09-30 15:08:07	2022-10-01 11:16:34
