id	utterance_id	role	text	search_query	search_URL	reference_date	terminate	regDate	updDate
BK22003291	1	질문자	어제 제 친구가 산티아고 순례자길을 걷는다고 스페인으로 출국했어요.				0	2022-08-04 11:11:07	2022-08-04 11:11:07
BK22003291	2	전문가	친구 분이 멋진 도전 시작하셨군요. 준비는 잘해서 가셨는지 모르겠네요. 성공적으로 순례자 길을 걸으려면 준비가 반이거든요.				0	2022-08-04 11:11:07	2022-08-29 09:00:26
BK22003291	3	질문자	혼자서 책도 찾아보면서 꽤 꼼꼼하게 준비하더라고요. 엄청 긴 루트라고 들었는데 그래서인지 평소에 걷는 훈련도 많이 하고 갔어요.				0	2022-08-04 11:11:07	2022-08-04 11:11:07
BK22003291	4	전문가	장장 800킬로미터를 걷는 길이에요. 스페인과 프랑스에 걸치는 길인데 산티아고데콤포스텔라 대성당까지 걸어야하죠. 그곳에 예수의 열두 제자중 하나인 야고보 성인이 잠들어 있어요.	카미노데산티아고	http://www.lecturernews.com/news/articleView.html?idxno=96764	2022/05/12	0	2022-08-04 11:11:07	2022-08-04 11:11:07
BK22003291	5	질문자	엄청나게 먼 거리네요. 그 긴 거리를 지도를 보고 가려면 어렵겠어요.				0	2022-08-04 11:11:07	2022-08-04 11:11:07
BK22003291	6	전문가	순례자길에는 길을 잃지 않게 조개 표식이 되어 있어요. 길을 가는 도중에 계속 발견할 수 있어서 표식을 보면서 갈 수 있죠.	조개 표식	https://ko.wikipedia.org/wiki/%EC%B9%B4%EB%AF%B8%EB%85%B8%EB%8D%B0%EC%82%B0%ED%8B%B0%EC%95%84%EA%B3%A0	2022/06/19	0	2022-08-04 11:11:07	2022-08-04 11:11:07
BK22003291	7	질문자	그렇군요. 조개 표식이 안내판이 되어주겠네요. 그 길을 지나왔다는 증거를 사진으로 남기는 것도 필요하겠어요.				0	2022-08-04 11:11:07	2022-08-04 11:11:07
BK22003291	8	전문가	순례자 길을 걸으면서 휴대폰을 계속 사용하는 것은 별로 유쾌하지 않겠죠. 스페인 관광청에서 필그램 패스포트라고 순례자 여권을 판매하고 있어요. 중간중간 스탬프를 찍을 수 있게 돼 있어서 그 길을 지나왔다는 인증을 스스로에게 남길 수 있어요.	필그림 패스포트	https://news.mt.co.kr/mtview.php?no=2014082008354235609&outlink=1&ref=https%3A%2F%2Fsearch.naver.com	2014/08/21	0	2022-08-04 11:11:07	2022-08-04 11:11:07
BK22003291	9	질문자	좋은 아이디어네요. 국내에도 그 덕분에 순례길 유사한 곳들도 많이 생기고, 스탬프를 찍어서 인증하기도 하더라고요.				0	2022-08-04 11:11:07	2022-08-04 11:11:07
BK22003291	10	전문가	맞아요. 우리나라도 코리아둘레길이 조성되어 있어요. 걷기 여행 활성화를 위해서 만들었는데 많은 사람들이 걷기 여행을 할 때 그 길을 기점으로 활용하고 있어요.	코리아 둘레길	https://www.kukinews.com/newsView/kuk202206260019	2022/06/26	0	2022-08-04 11:11:07	2022-08-04 11:11:07
BK22003291	11	질문자	제주 올레길은 많이 들어봤는데, 코리아 둘레길은 생소해요. 우리나라 둘레를 걷는 거면 남해, 동해, 서해로 연결된 길인가요?				0	2022-08-04 11:11:07	2022-08-21 23:15:00
BK22003291	12	전문가	맞아요, 서해랑길, 남파랑길, 해파랑길과 DMZ평화의 길로 돼 있어요.	코리아 둘레길 루트	http://news.tf.co.kr/read/national/1947507.htm	2022/06/25	0	2022-08-04 11:11:07	2022-08-29 09:00:26
BK22003291	13	질문자	길마다 지역이 다르니 풍경이나 매력도 조금씩 다르겠네요. 저는 서해 쪽은 거의 못가봤는데, 서해랑길은 어때요?				0	2022-08-04 11:11:07	2022-10-28 13:44:18
BK22003291	14	전문가	일단 서해랑길 특징은 가장 최장 걷기여행 길이라는 거에요. 전남 해남에서 인천 강화도까지 109개 구간을 연결하고, 31개의 기초자치단체에 걸쳐 있어요. 이름처럼 코리아 둘레길 중에 서해안을 따라 걷는 코스인데, 문화체육관광부랑 한국관광공사에서 심혈을 기울여서 조성했어요.	서해랑길	http://www.sisamagazine.co.kr/news/articleView.html?idxno=453968	2022/07/12	0	2022-08-04 11:11:07	2022-10-28 12:24:57
BK22003291	15	질문자	와, 해남에서 인천까지면 정말 어마어마하게 기네요. 그럼 남파랑길은 어때요?				0	2022-08-04 11:11:07	2022-10-28 12:24:57
BK22003291	16	전문가	남파랑길은 남해안을 걷는 코스에요. 부산 오륙도 해맞이 공원에서 전남 해남 땅끝마을까지 걷는 90개 코스, 1470km로 돼 있어요. 남쪽의 쪽빛 바다와 함께 걷는 길이라는 슬로건도 있죠.	남파랑길	http://san.chosun.com/site/data/html_dir/2022/06/27/2022062702050.html?utm_source=naver&utm_medium=referral&utm_campaign=san	2022/07/13	0	2022-08-04 11:11:07	2022-08-29 09:00:27
BK22003291	17	질문자	서해랑길이랑 남파랑길이 연결 돼있네요. 동해안을 걷는 길은 아까 해파랑길이라고 하셨죠?				0	2022-08-04 11:11:07	2022-08-22 12:33:21
BK22003291	18	전문가	맞아요, 해파랑길은 부산 오륙도 해맞이 공원에서 시작해서 강원 고성 통일 전망대까지 750km로 이어진 길이에요. 엄청 장대한 여정이 이어지겠죠?	해파랑길	https://www.hankyung.com/life/article/2022033154121	2022/04/01	0	2022-08-04 11:11:07	2022-10-28 12:24:57
BK22003291	19	질문자	와 서해, 남해, 동해가 다 걸어서 갈 수 있는 하나의 길로 연결되어 있다니 대단하네요. 북쪽 길만 연결돼 있지 않아서 아쉽네요.				0	2022-08-04 11:11:07	2022-08-21 23:15:00
BK22003291	20	전문가	북쪽 노선도 추진되고 있어요. DMZ 평화의 길이라고 인천 강화군에서 강원 고성군까지 524km로 이어지는 도보 여행길을 조성중이이요. 비무장지대의 평화, 접경지역의 번영과 발전을 목표로 여러 부처와 시군에서 합동으로 추진중이죠.	DMZ 평화의길	http://www.kmaeil.com/news/articleView.html?idxno=319318	2021/11/16	0	2022-08-04 11:11:07	2022-08-29 09:00:27
BK22003291	21	질문자	우리나라의 동서남북이 도보로 다 연결되어 있다니 뜻깊어요. 스페인 산티아고 순례자 길도 좋지만, 우리나라 국토 도보여행도 언젠가 도전해봐야겠어요.				0	2022-08-21 23:15:00	2022-08-21 23:15:00
BK22003291	22	전문가	맞아요, 우리나라 전국을 도보로 여행하는 것도 너무 멋진 일이 되겠네요. 언제 한번 같이 도전해봐요.				1	2022-08-21 23:15:00	2022-10-31 12:01:40
