id	utterance_id	role	text	search_query	search_URL	reference_date	terminate	regDate	updDate
BK22011995	1	질문자	격한 운동은 나한테 정말 안맞는 것 같아. 아침에 하고 나면 하루종일 힘이 없어.				0	2022-09-30 12:20:29	2022-09-30 12:20:29
BK22011995	2	전문가	자기한테 맞는 운동을 찾기가 쉽지 않지.				0	2022-09-30 12:20:29	2022-09-30 12:20:29
BK22011995	3	질문자	그래서 요가 같은 게 나한테 맞지 않을까 싶어. 좀 차분하면서 운동도 될 것 같아서 말이야. 요가를 요즘은 운동으로 하지만 원래는 수행법의 하나였다며?				0	2022-09-30 12:20:29	2022-09-30 12:20:29
BK22011995	4	전문가	응, 요가는 고대 인도에서 제사의 의식으로 생긴 명상 방법인데 힌두교에서 종교적 목적에 의해 영적으로 수행을 하기 위한 방법으로 쓰였지.	요가 수행	https://ko.wikipedia.org/wiki/%EC%9A%94%EA%B0%80	2022/03/13	0	2022-09-30 12:20:29	2022-09-30 12:20:29
BK22011995	5	질문자	아, 그렇구나. 요가도 종류가 하나가 아니고 여러가지가 있는 것 같더라고. 어떤 종류들이 있는 지 대표적인 것들 좀 알려줘.				0	2022-09-30 12:20:29	2022-09-30 12:20:29
BK22011995	6	전문가	음, 요가 종류 중 잘 알려진 걸로는 하타요가, 라자요가, 즈나나 요가, 만트라 요가나 박티요가 , 쿤달리니요가도 있고 탄트라 요가, 카르마 요가라는 종류도 있어.	요가 종류	https://n.news.naver.com/mnews/article/082/0001125220?sid=103	2021/10/30	0	2022-09-30 12:20:29	2022-10-06 14:20:22
BK22011995	7	질문자	다 생소한 용어들이네. 하타요가라는 말을 그나마 들어본 적이 있는거 같은데, 어떤 요가인거야?				0	2022-09-30 12:20:29	2022-09-30 12:20:29
BK22011995	8	전문가	하타요가는 우리나라나 미국에서 인기가 있는 요가인데 15세의 인도 스와트마라나 라는 사람이 만든 요가야. 2008년 기준으로 미국에서 1500만 명 정도가 이 요가를 수행하는 걸로 알려져 있을 만큼 인기가 많지. 우리나라에 있는 요가 수련장에서 하는 대부분의 요가가 바로 이 하타요가고 우리가 보통 알고 있는 요가 자세들이 하타요가에서 나온 것들이야.	하타요가	http://www.cancerline.co.kr/html/9689.html	2013/10/31	0	2022-09-30 12:20:29	2022-09-30 12:20:29
BK22011995	9	질문자	아, 그래서 많이 들어봤나보다. 라자요가라는 건 정말 처음 들어보는 데 어떤 요가야?				0	2022-09-30 12:20:29	2022-09-30 12:20:29
BK22011995	10	전문가	응, 라자요가는 박티요가, 즈냐냐, 카르마랑 함께 고대 4대 요가로 불리는 요가인데, 몸과 마음을 훈련하고 수양시켜 해탈을 얻는 게 목표인 요가야.	라자요가	https://ko.wikipedia.org/wiki/%EB%9D%BC%EC%9E%90_%EC%9A%94%EA%B0%80	2022/02/14	0	2022-09-30 12:20:29	2022-09-30 12:20:29
BK22011995	11	질문자	아, 그렇구나. 아까 말한 것 중에 만트라 요가라는 것도 있었잖아. 만트라는 불교 용어 아니야?				0	2022-09-30 12:20:29	2022-09-30 12:28:50
BK22011995	12	전문가	오 아는구나. 만트라는 불교와 힌두교에서 기도, 명상을 할 때 외우는 주문이나 주술을 말하는데, 만트라 요가는 이런 특정한 소리를 반복해서 부르면서 그 소리가 갖는 힘을 몸과 마음으로 전달하고 또 외부로 발휘시키는 요가 방식이야.	만트라요가 불교 용어	https://n.news.naver.com/mnews/article/082/0001085477?sid=103	2021/04/23	0	2022-09-30 12:20:29	2022-09-30 12:32:43
BK22011995	13	질문자	소리를 내면서 하는 요가구나. 내가 들어본 요가 중에 아쉬탕가 요가라는 것도 있는데 그건 어떤 방식의 요가인지 혹시 알아?				0	2022-09-30 12:20:29	2022-09-30 12:28:50
BK22011995	14	전문가	아쉬탕가는 하타 요가보다 격렬한 동작들로 이뤄서 있어서 역동적이면서도 땀이 많이 나는 요가 방식이야. 땀이 많이 나다보니 노폐물이나 독소를 제거하는데 도움도 되고 온 몸의 힘과 근력을 늘리기에도 효과적인 요가야.	아쉬탕가 요가	https://n.news.naver.com/mnews/article/082/0000794775?sid=102	2018/04/16	0	2022-09-30 12:20:29	2022-09-30 12:28:50
BK22011995	15	질문자	격렬한 요가라면 다이어트 요가로 괜찮겠네. 아 그러고보니 다이어트용으로 핫요가 하는 사람들도 많던데, 핫요가는 정확히 어떤거야?				0	2022-09-30 12:20:29	2022-09-30 12:28:50
BK22011995	16	전문가	핫요가는 인도 요가 컬리지의 창립자이면서 하타 요가 마스터인 비크람 차우드리라는 사람이 만들었고 1970년대에 많이 대중화가 된 요가야. 비크람 요가 라고도 불리지. 요가가 생긴 지역인 인도의 환경을 그대로 재현해서 요가 스튜디오의 실내 온도를 38도로 올려 진행하는 방식의 요가야.	핫요가	https://ko.wikipedia.org/wiki/%ED%95%AB%EC%9A%94%EA%B0%80	2022/03/03	0	2022-09-30 12:20:29	2022-09-30 12:32:43
BK22011995	17	질문자	인도의 환경을 재현하려고 높은 온도에서 하는 거였구나. 아, 우리 동네에 최근에 비트요가라는 학원도 생겼던데 비트요가는 또 뭐야?				0	2022-09-30 12:20:29	2022-09-30 12:32:43
BK22011995	18	전문가	비트요가는 음악에 맞춰 요가를 하는 인사이드 플로랑 비슷한 방식인데 비트 요가만을 위한 특정 음악과 정해진 시퀀스가 있다는 차이가 있어. 코어 강화를 위한 동작들이 많아서 기초 체력을 높이는 데 좋고 신나고 즐겁게 요가를 할 수 있는 방식이지.	비트요가	https://www.hidoc.co.kr/healthstory/news/C0000274037	2017/08/28	0	2022-09-30 12:20:29	2022-09-30 12:32:43
BK22011995	19	질문자	비트가 음악의 비트를 말하는거였네. 난 다이어트가 목표이기도 하니까 핫요가나 아쉬탕가쪽으로 한 번 알아봐야겠다. 자세히 알려줘서 정말 고마워.				1	2022-09-30 12:20:31	2022-10-06 14:20:22
BK22011995	20	전문가	도움이 되었다면 다행이지 뭐. 재밌게 즐길 수 있는 걸로 잘 골라봐. 그럼 다음에 또 보자.				0	2022-09-30 12:20:29	2022-09-30 12:32:43
