id	utterance_id	role	text	search_query	search_URL	reference_date	terminate	regDate	updDate
BK22015543	1	질문자	요즘 부산국제영화제가 열리고 있다고 하던데 맞나요?				0	2022-10-10 01:11:30	2022-10-10 01:11:30
BK22015543	2	전문가	네, 저도 영화를 좋아해서 관심 있게 지켜보고 있어요.				0	2022-10-10 01:11:30	2022-10-17 15:48:17
BK22015543	3	질문자	그렇군요, 저도 영화를 좋아해서 영화제에 놀러가 볼까 생각 중이에요. 근데 올해 부산국제영화제의 특징은 뭔가요?				0	2022-10-10 01:11:30	2022-10-17 15:48:17
BK22015543	4	전문가	코로나 때문에 기존의 투자배급사들의 입지는 줄어들었지만, OTT 플랫폼은 성장세가 크다는 것이 특징이에요.	부산국제영화제	http://www.munhwa.com/news/view.html?no=2022100801039912069002	2022/10/08	0	2022-10-10 01:11:30	2022-10-17 15:48:17
BK22015543	5	질문자	OTT 시장이 최근에 많이 커지고 있다고 알고 있는데, 부산국제영화제에서도 큰 존재감을 자랑하고 있군요. 그럼 OTT 회사들은 영화제에서 어떻게 작품을 홍보하고 있나요?				0	2022-10-10 01:11:30	2022-10-17 15:48:17
BK22015543	6	전문가	아직 미공개 상태인 오리지널 시리즈의 일부 회차를 부산국제영화제에서 선보이면서 홍보를 하고, 일부 업체는 주요 지점에 홍보 부스를 차려서 작품을 홍보하고 있어요.	부산국제영화제 OTT	https://www.sedaily.com/NewsView/26C9BEW1SN	2022/10/07	0	2022-10-10 01:11:30	2022-10-10 01:11:30
BK22015543	7	질문자	그렇군요, 그럼 영화제에서 상영되는 OTT 시리즈의 규모는 어느 정도 되나요?				0	2022-10-10 01:11:30	2022-10-10 01:11:30
BK22015543	8	전문가	부산국제영화제에 초청된 넷플릭스, 티빙, 디즈니플러스와 같은 OTT 시리즈는 모두 9편이에요. OTT 시리즈를 상영하는 온스크린은 작년에 신설되어서 총 3편을 초청했는데, 올해는 9편으로 대폭 늘어났어요.	부산국제영화제 OTT 온스크린	https://www.donga.com/news/Culture/article/all/20221009/115871556/1	2022/10/09	0	2022-10-10 01:11:30	2022-10-10 01:11:30
BK22015543	9	질문자	규모가 3배로 커진 셈이네요. 그럼 상영 분량은 어느 정도 되나요?				0	2022-10-10 01:11:30	2022-10-10 01:11:30
BK22015543	10	전문가	시리즈 한 편당 분량이 짧게는 30분, 길게는 1시간인 것을 반영해서, 극장에서는 2~4회 분의 분량을 연이어 상영하고 있어요.	부산국제영화제 온스크린	https://ent.sbs.co.kr/news/article.do?article_id=E10010258915	2022/10/08	0	2022-10-10 01:11:30	2022-10-10 01:11:30
BK22015543	11	질문자	영화제인 만큼 영화처럼 상영하고 있군요. 그럼 홍보 부스는 반응이 어땠나요? 어떤 드라마의 홍보 부스가 있었는지도 궁금하네요.				0	2022-10-10 01:11:30	2022-10-17 15:48:17
BK22015543	12	전문가	넷플릭스가 마련한 사랑방에는 포토 부스를 이용하려는 사람들이 줄을 서 기다리는 모습이 보였어요. 그리고 웨이브 홍보 부스에는 트레이서의 주연 배우인 임시완, 고아성이 방문하면서 100명이 넘는 인파가 몰리기도 했고요.	트레이서 부스	https://www.yna.co.kr/view/AKR20221009012300005	2022/10/09	0	2022-10-10 01:11:30	2022-10-17 15:48:17
BK22015543	13	질문자	홍보 부스가 제 역할을 톡톡히 하고 있네요. 근데 넷플릭스에서 운영한다는 사랑방은 어떤 곳인가요?				0	2022-10-10 01:11:30	2022-10-17 15:48:17
BK22015543	14	전문가	사랑방은 넷플릭스가 영화제 기간 동안 운영하는 카페에요. 운영 기간은 9일까지, 오전 8시부터 오후 9시까지구요. 사랑방에는 기념사진을 촬영할 수 있는 무료 셀프 포토 부스가 있고, 세계적으로 인기를 끈 오징어 게임의 미니어처 장식도 있어요.	넷플릭스 사랑방	https://www.mk.co.kr/star/movies/view/2022/10/887009/	2022/10/07	0	2022-10-10 01:11:30	2022-10-17 15:48:17
BK22015543	15	질문자	아하, 넷플릭스에서 홍보를 목적으로 운영하는 카페였군요! 아이디어가 참 좋은 것 같아요. 다른 OTT 기업은 어떤 부스를 차렸나요?				0	2022-10-10 01:11:30	2022-10-10 01:11:30
BK22015543	16	전문가	웨이브는 이번 영화제에 공식 후원사로 참여하면서 적극적인 행보를 이어가고 있어요. 공식 후원사들만 부스를 차릴 수 있는 영화의전당 광장에 과몰입 다이빙 풀 콘셉트로 부스를 차려서, 체험형 콘텐츠와 포토존을 세우고 다양한 이벤트도 진행하고 있어요.	부산국제영화제 웨이브	https://sedaily.com/NewsView/26C9BEW1SN	2022/10/07	0	2022-10-10 01:11:30	2022-10-10 01:11:30
BK22015543	17	질문자	그렇군요, 근데 작년엔 OTT가 영화제에 진출하는 것에 대해 안 좋은 여론도 있었는데, 올해는 이렇게 OTT 기업이 적극적으로 영화제에 개입하고 온스크린 상영 규모도 늘어난 걸 보니 OTT에 대한 인식이 많이 개선되었나 봐요?				0	2022-10-10 01:11:30	2022-10-17 15:48:17
BK22015543	18	전문가	네, 맞아요, 부산국제영화제 집행위원장은 OTT 시리즈가 영화산업에 미치는 영향에 대해 우려도 있지만, 또 다른 영화의 영역으로 끌어안아야 한다는 생각으로 점차 바뀌고 있는 것 같다고 의견을 표했어요.	부산국제영화제 OTT 우려	https://www.mk.co.kr/news/culture/view/2022/10/883035/	2022/10/06	0	2022-10-10 01:11:30	2022-10-17 15:48:17
BK22015543	19	질문자	OTT에 대한 인식이 많이 좋아지고 있군요. 오늘 부산국제영화제에 대해 다양한 정보를 알려주셔서 감사했어요.				0	2022-10-10 01:11:30	2022-10-10 01:11:30
BK22015543	20	전문가	별말씀을요, 내년에는 같이 한번 영화제를 관람하러 가봐요. 시간 되실 때 연락 주세요!				1	2022-10-10 01:11:30	2022-10-17 15:48:17
