id	utterance_id	role	text	search_query	search_URL	reference_date	terminate	regDate	updDate
BK22014678	1	질문자	제가 이번 여름 방학에 이탈리아에 있는 밀라노로 여행을 가게 됐는데요. 해외 여행을 갈 생각에 설레기도 하지만 밀라노에 대해 아는 게 별로 없어서 걱정이에요.				0	2022-10-01 21:58:25	2022-10-01 22:36:29
BK22014678	2	전문가	밀라노 여행이라니 정말 부러운걸요. 여행 정보는 지금부터 차근 차근 조사하시면 되니까요.				0	2022-10-01 21:58:25	2022-10-01 21:58:25
BK22014678	3	질문자	사실 열심히 밀라노에 대해 조사하면서 계획을 짜고 있는데 쉽지 않네요. 그래서 그런데 밀라노에 추천 해주실 만한 관광지가 있다면 알려주실 수 있나요?				0	2022-10-01 21:58:25	2022-10-01 21:58:25
BK22014678	4	전문가	감탄사가 나올만큼 화려하고 거대한 외관을 가진 두오모를 일단 추천드리고 싶어요. 밀라노는 로마에서 쉽게 찾아 볼 수 있는 바로크 또는 르네상스 양식보다 알프스 이북에서 발달한 고딕 양식에 많은 영향을 받았는데 그 이유는 밀라노가 이탈리아 반도의 북쪽에 위치하고 있기 때문이에요. 밀라노 두오모는 1386년에 착공되었지만 우여곡절이 많았던 공사 과정 때문에 600년이라는 시간을 소요해서 1951년에서야 완공될 수 있었죠. 또한 2,000개의 성인상과 135개의 소첨탑으로 장식되어 있고 꼭대기에는 황금빛 성모 마리아 상이 있어요. 아, 그리고 두오모는 앞에서 보는 모습도 멋있지만 뒤쪽에서 본다면 또 다른 종류의 화려함과 아름다움을 느낄 수 있으니 참고하세요.	두오모	https://terms.naver.com/entry.naver?docId=6081786&cid=67006&categoryId=67373	2020/07/13	0	2022-10-01 21:58:25	2022-10-05 05:57:36
BK22014678	5	질문자	역사가 정말 오래 된 성당이네요. 아, 그리고 밀라노를 여행했던 친구가 스칼라 극장에 꼭 가보라고 하던데요. 스칼라 극장이 어떤 곳인지 알려주실 수 있을까요?				0	2022-10-01 21:58:25	2022-10-01 22:36:29
BK22014678	6	전문가	물어보신 스칼라 극장은 외부에서 봤을 때는 화려한 분위기의 건물은 아니지만 파리, 빈과 함께 유럽 3대 오페라 하우스로 꼽히면서 세계의 음악을 지휘하는 곳이라고 할 수 있어요. 1778년 산타 마리아 델라 스칼라 성당이 위치했던 장소에 설립됐으며 제2차 세계대전 때 폭격 때문에 많은 부분이 파괴됐어요. 전후 1946년 지금 우리가 아는 모습으로 다시 복구되었고요. 예로부터 유명한 오페라 작곡가들이 이곳에서 자신의 작품을 처음으로 선보였으며 오늘날에도 세계적인 음악가들은 전부 이 무대를 겪는답니다. 여행하실 때 시간이 촉박하지 않으시다면 이 곳에서 세계적으로 유명한 오페라를 한편 관람해보세요.	스칼라 극장	https://terms.naver.com/entry.naver?docId=6081785&cid=67006&categoryId=67373	2020/07/13	0	2022-10-01 21:58:25	2022-10-01 22:36:29
BK22014678	7	질문자	그렇게 대단한 오페라 하우스가 밀라노 하우스에 있다면 꼭 들러서 오페라를 한 편 관람해 봐야겠어요. 아, 그리고 밀라노에 가면 스포르체코스 성에 꼭 들러봐야 한다고 들었거든요. 스포르체스코 성에 대해 알려주실 수 있을까요?				0	2022-10-01 21:58:25	2022-10-07 10:15:05
BK22014678	8	전문가	물어보신 스포르체스코 성은 15세기에 밀라노의 영주였던 프란체스코 스포르짜가 만든 성인데요. 당대에 유명한 건축가들이었던 브라만테와 레오나르도 다 빈치 등이 성을 건축할 때 참여했어요. 성은 평평한 땅에 정사각형 모양으로 건축되었고 동그랗고 특이한 모양의 망루가 덧대어 붙여져 있고요. 성 내부는 시립 박물관으로써 무료로 관람할 수 있고 미켈란젤로의 세 개의 피에타 작품 중 미완성작인 론다니니의 피에타가 이곳에 있으니 알아두세요. 성의 뒤편에 위치하고 있는 넓은 셈피오네 공원은 밀라노 시민들의 휴식을 취하는 공간이기도 하죠.	스포르체코스 성	https://terms.naver.com/entry.naver?docId=6081787&cid=67006&categoryId=67373	2020/07/13	0	2022-10-01 21:58:25	2022-10-01 22:36:29
BK22014678	9	질문자	미켈란젤로의 작품도 있는데다 내부에 있는 박물관은 입장료까지 무료라니 꼭 방문해야겠군요. 아, 그리고 제가 미술관 관람을 무척 좋아하거든요. 그래서 그런데 밀라노에 둘러볼만한 미술관이 있다면 추천해주실 수 있을까요?				0	2022-10-01 21:58:25	2022-10-01 22:36:29
BK22014678	10	전문가	브레라 미술관을 추천해요. 우피치 미술관에 버금갈 정도로 이탈리아 회화의 보고로 유명한 브레라 미술관은 회화관을 의미하는 피나코테카라고도 불리죠. 롬바르디아파와 베네치아파를 중점적으로 북부 이탈리아 르네상스 회화의 걸작을 소장하고 있는 곳이기도 해요. 또한 매달 세 번째 일요일에는 브레라 미술관 앞에서 브레라 벼룩시장도 진행되니까 관심 가시면 일정 맞춰서 들러 보세요.	브레라 미술관	https://terms.naver.com/entry.naver?docId=963890&cid=42864&categoryId=50859	2016/06/28	0	2022-10-01 21:58:25	2022-10-05 05:57:36
BK22014678	11	질문자	제가 미술관 관람을 아주 좋아하는데 꼭 방문해 볼게요. 아, 그리고 밀라노에 가면 몬테 나폴레오네 거리를 꼭 가봐야 한다고 들었는데요. 몬테 나폴레오네 거리에 대해 알려주실 수 있을까요?				0	2022-10-01 21:58:25	2022-10-01 22:36:29
BK22014678	12	전문가	우리나라의 청담동을 연상시키는 밀라노의 몬테 나폴레오네 거리에 대해 궁금하신가봐요. 화려한 명품숍들과 세련된 패션 감각을 가진 이탈리아인들을 가장 많이 볼 수 있는 곳이기도 하죠. 독특하게도 섬유나 방직 등이 연관된 다양한 조형물들이 거리 군데 군데를 꾸며주고 있는 게 이 거리에 상징적인 멋을 더해줘요.	몬테 나폴레오네 거리	http://www.ohmynews.com/NWS_Web/View/at_pg.aspx?CNTN_CD=A0002351267	2017/08/16	0	2022-10-01 21:58:25	2022-10-05 05:57:36
BK22014678	13	질문자	패션에 관심 있는 사람이라면 꼭 가봐야 하는 거리겠군요. 그리고 혹시 더 추천해 주실만한 관광지가 있을까요? 앞에서 알려주신 관광지들을 다 가봐도 일정이 길이서 시간이 남을 것 같아요.				0	2022-10-01 21:58:25	2022-10-01 22:36:29
BK22014678	14	전문가	음, 시간적 여유가 되신다면 에마누엘레 갤러리를 가보시라고 하고 싶어요. 화려함의 극치를 보여주는 에마누엘레 갤러리는 그 화려함 덕분에 밀라노의 거실’이란 별칭이 붙었는데요. 십자로의 천장은 팔각형의 유리 돔으로 보고 있으면 웅장한 느낌을 받을 수 있죠. 또한 그 아래에 있는 루넷에는 프레스코화가 그려져 있으며 그 아래는 여상주를 올린 발코니가 연결되어 있어서 19세기 근대 건축의 최상 면모를 보여주는 곳이죠. 루넷이란 둥근 지붕이 벽과 만나는 지점에 위치한 반원형의 공간을 지칭해요.	에마누엘레 갤러	http://www.viva100.com/main/view.php?key=20171016020021118	2017/10/16	0	2022-10-01 21:58:25	2022-10-05 05:57:36
BK22014678	15	질문자	꼭 방문해서 얼마나 화려한지 구경하고 싶네요. 그리고 제가 걱정되는 게 하나 있는데 밀라노의 날씨가 어떨지 고민이에요. 밀라노의 날씨가 어떤 편인지 궁금한데 알려주실 수 있을까요?				0	2022-10-01 21:58:25	2022-10-01 22:36:29
BK22014678	16	전문가	여름 방학 때 가신다고 하셨으니 여름 날씨가 걱정이신가 봐요. 밀라노의 여름철은 매우 강한 햇볕이 내리쬐고 꽤 습하지만 그늘에 있다면 그렇게 덥지는 않으실거에요. 겨울은 시원하고 비가 많으며 온난습윤 기후와 지중해성 기후가 함께 나타나고요. 큰 일교차 때문에 감기에 걸리시는 일 없게 주의하셔야 해요. 선글라스는 일년 내내 필요하니 꼭 챙기시고 소나기가 가끔 오니까 일기예보를 확인하시는 게 좋아요.	밀라노 날씨 정보	https://terms.naver.com/entry.naver?docId=6081588&cid=67006&categoryId=67373	2020/07/13	0	2022-10-01 21:58:25	2022-10-01 22:36:29
BK22014678	17	질문자	선글라스를 꼭 챙겨야 하는군요. 그리고 여행 하면 빼놓을 수 없는 게 음식이잖아요. 대표적인 밀라노의 음식을 추천해 주실 수 있을까요?				0	2022-10-01 21:58:25	2022-10-01 22:36:29
BK22014678	18	전문가	밀라노에는 명화 최후의 만찬이 갖는 유명세에 뒤지지 않을만큼 유명한 향토 요리가 있는데요. 바로 오소부코에요. 밀라노의 대표적인 건강식 요리기도 한데 우리나라의 갈비찜과 흡사한 음식이에요. 정통 이탈리안 스타일의 음식으로 미식가들은 물론이며 외교사절, 상사주재원 등이 즐겨 먹는 음식이죠.	오소부코	https://n.news.naver.com/mnews/article/014/0000123168?sid=103	2004/05/13	0	2022-10-01 21:58:25	2022-10-01 22:36:29
BK22014678	19	질문자	우리나라의 갈비찜과 비슷하면서 이탈리아 전통 스타일이라니 정말 기대되는걸요. 이렇게 친절하게 밀라노에 대해 알려주셔서 정말 감사해요. 많은 도움 될 것 같아요.				0	2022-10-01 21:58:26	2022-10-01 22:36:29
BK22014678	20	전문가	도움이 될 것 같다니 저도 기분이 좋네요. 밀라노 여행에서 잊지 못할 추억 많이 만들고 오시기를 바랄게요.				1	2022-10-01 21:58:26	2022-10-07 10:15:06
