id	utterance_id	role	text	search_query	search_URL	reference_date	terminate	regDate	updDate
BK22001943	1	질문자	어제 피시방에 문서 인쇄하러 잠깐 갔는데 다들 같은 게임하고 있더라? 예전에도 종종 가면 다들 그 게임만 하고 있던데, 무슨 게임이지?				0	2022-08-02 12:12:22	2022-08-02 12:45:44
BK22001943	2	전문가	리그 오브 레전드 말하는 거구나? 이번에 게임트릭스 기준 205주 연속 PC방 주간 점유율 1위라는 신기록을 달성할 만큼 사람들이 PC방에서 많이 하는 게임이지.	롤 피씨방 점유율	https://www.etnews.com/20220704000139	2022/07/05	0	2022-08-02 12:12:22	2022-08-02 12:45:44
BK22001943	3	질문자	아, 그게 리그 오브 레전드구나? 사람들이 엄청 이야기를 많이 해서 나도 들어본 적은 있어. 205주나 점유율 1위를 차지하다니, 무슨 특별한 비결이라도 있는 거야?				0	2022-08-02 12:12:22	2022-08-02 12:45:44
BK22001943	4	전문가	리그 오브 레전드가 정상을 차지할 수 있는 이유는 여러 가지가 있겠지만 우선 다양한 게임 업데이트와 꾸준한 e스포츠 리그 운영을 들 수 있겠지. 그리고 한국 플레이어들을 위해 내놓은 다양한 마케팅 전략 역시 리그오브레전드의 성공 요인으로 꼽혀.	롤 흥행 요인	https://www.techm.kr/news/articleView.html?idxno=99005	2022/07/04	0	2022-08-02 12:12:22	2022-08-02 12:45:44
BK22001943	5	질문자	그런 점들이 게이머들의 마음을 유혹한 거구나. 그러면 롤은 처음에도 지금처럼 흥행했었어? 스타크래프트는 발매할 때부터 엄청나게 인기 많았었잖아.				0	2022-08-02 12:12:22	2022-08-02 12:45:44
BK22001943	6	전문가	롤이 탄생했던 2009년엔 분명 흥행에 성공하지 못했었어. 튜토리얼도 친절하지 않았었고 캐릭터 모션도 툭툭 끊어져서 유저들은 많은 불만을 보였었거든.	롤 초반 흥행 부진	https://news.g-enews.com/ko-kr/news/article/news_all/2017120415400598959bdce8ae77_1/article.html?md=20171204190119_U	2017/12/04	0	2022-08-02 12:12:22	2022-08-02 12:45:44
BK22001943	7	질문자	오, 그랬던 게임이 지금 위치까지 성장한 거구나. 이런 유명한 게임들은 돈 많이 투자할수록 이기기 쉬워져서 조금 별로던데, 이 게임은 안 그래?				0	2022-08-02 12:12:22	2022-08-02 12:45:44
BK22001943	8	전문가	전혀 그렇지 않아. 챔피언 스킨 구매같이 유저를 결제하게 할만한 다양한 콘텐츠가 있긴 하지만, 이것들이 게임 밸런스에 전혀 영향을 주지 않거든.	롤 과금 요소	https://ditoday.com/%eb%84%98%ec%b9%98%eb%8a%94-%ec%bd%98%ed%85%90%ec%b8%a0-%eb%a6%ac%ea%b7%b8-%ec%98%a4%eb%b8%8c-%eb%a0%88%ec%a0%84%eb%93%9c%ec%9d%98-%ec%a7%84%ec%a0%95%ed%95%9c-%ea%b0%80%ec%b9%98/	2022/02/08	0	2022-08-02 12:12:23	2022-08-02 12:45:44
BK22001943	9	질문자	정말 바람직한 게임이네. 예전에 내가 했던 게임은 과금 요소가 너무 많아서 하기 불편했었는데! 이번 기회에 나도 게임 다시 한번 해볼까?				0	2022-08-02 12:12:23	2022-08-02 12:45:44
BK22001943	10	전문가	그래보는 것도 좋지! 앞으로 나랑 같이 게임할 수도 있고 말이야.				0	2022-08-02 12:12:23	2022-08-02 12:45:44
BK22001943	11	질문자	근데 최근에 게임이 질병이라는 WHO의 말이 있어서 조금 고민되네. 게임중독이 질병코드에도 등재된다던데.				0	2022-08-02 12:12:23	2022-08-02 12:45:44
BK22001943	12	전문가	그건 너무 신경 쓰지 않아도 괜찮아. WHO가 게임중독 질병화 결정에 참고한 것으로 생각되는 44편의 논문에서 몇 가지 오류가 발견됐었거든. 다시 말하면 WHO의 게임중독 질병코드 등재는 과학적이지 못한 행동이었다는 거지.	WHO 게임중독 질병코드	https://byline.network/2022/07/08-91/	2022/07/10	0	2022-08-02 12:12:23	2022-08-02 12:45:44
BK22001943	13	질문자	음, 그래도 게임하는 거 자체가 별로 좋은 일은 아닌 것 같은데. 게임하는 게 딱히 장점도 없잖아?				0	2022-08-02 12:12:23	2022-08-02 12:45:44
BK22001943	14	전문가	장점이 없긴 왜 없어! 스트레스 해소도 되고 특정 인지능력 향상도 되는걸? 게임을 너무 부정적으로만 보지는 마.	게임의 장점	https://www.segye.com/newsView/20190526507057?OutUrl=naver	2019/05/27	0	2022-08-02 12:12:23	2022-08-02 12:45:44
BK22001943	15	질문자	그런가? 근데 내가 예전에 게임하는게 마약하는 거랑 비슷한 효과를 불러일으킨다는 말도 좀 들었었거든? 그래서 그때 하던 게임을 끊기도 했었고.				0	2022-08-02 12:12:23	2022-08-02 12:45:44
BK22001943	16	전문가	그거는 너무 과장된 말이야. 게임 중인 사람의 뇌에서 도파민이 30에서 50퍼센트가량 증가하는 건 사실이지만, 이건 마약을 투입했을 때 도파민 분비량이 1200퍼센트나 증가하는 것과 비교하면 정말 미미한 수준이야. 오히려 좋아하는 사람과 데이트하거나 맛있는 음식을 먹는 수준에 불과하지.	게임 마약 비교	https://sports.khan.co.kr/bizlife/sk_index.html?art_id=202109061549003&sec_id=560201&pt=nv	2021/09/06	0	2022-08-02 12:12:23	2022-08-02 12:45:44
BK22001943	17	질문자	내가 들었던 말이 진짜 많이 과장된 말이었구나. 그냥 부정적인 말들은 크게 신경 쓰지 말고 나도 이번 기회에 롤 한번 해봐야겠다.				0	2022-08-02 12:12:23	2022-08-02 12:45:44
BK22001943	18	전문가	좋은 생각이야! 이제 곧 있으면 너랑 게임도 같이 할 수 있겠는걸?				0	2022-08-02 12:12:23	2022-08-02 12:45:44
BK22001943	19	질문자	하하, 그런가? 근데 내가 롤에 대해서는 아무것도 모르는데 그냥 시작해도 되려나? 실력이 너무 안 좋아서 민폐 끼칠 것만 같아.				0	2022-08-02 12:12:23	2022-08-02 12:45:44
BK22001943	20	전문가	이제 롤 실력 올려주는 인공지능 프로그램도 나올 예정이니까 한 번 도움 받아 보는 게 어때? 인공지능이 게이머의 리플레이를 보고 승률이 높은 전략이나 게임 플레이 방법을 가르쳐주는 스타일이라 실력이 쑥쑥 늘 수 있을거야.	게임 가르쳐 주는 AI	https://www.hani.co.kr/arti/economy/it/1039200.html	2022/04/18	0	2022-08-02 12:12:23	2022-08-02 12:45:44
BK22001943	21	질문자	와, 그런 것도 있어? 내가 그 인공지능으로 롤 배우다가 너보다 게임 잘하게 되면 어떻게 하지?				0	2022-08-02 12:12:23	2022-08-02 12:45:44
BK22001943	22	전문가	하하, 그럴 일은 없으니까 너무 신 내지는 마. 난 이제 다시 일하러 들어가야겠다.				0	2022-08-02 12:12:23	2022-08-02 12:45:44
BK22001943	23	질문자	응, 오늘 좋은 거 가르쳐줘서 너무 고마워! 나도 그러면 교습소 알아보러 가볼게!				1	2022-08-02 12:12:23	2022-08-02 13:12:16
