id	utterance_id	role	text	search_query	search_URL	reference_date	terminate	regDate	updDate
BK22014865	1	질문자	있잖아, 내 친구가 포켓몬 게임을 굉장히 좋아하는데, 그 중에서도 제일 좋아하는 게임은 포켓몬스터 금과 은 시리즈라고 하더라. 꽤 예전에 발매된 게임이라고 하는데, 혹시 이 시리즈가 언제 발매된 게임인지 알 수 있을까?				0	2022-10-04 03:59:34	2022-10-04 21:49:05
BK22014865	2	전문가	해당 시리즈는 1999년에 일본에서 최초로 발매되었어. 이후 1년 뒤인 2000년에는 일본 국외인 오스트레일리아와 북아메리카에도 발매되었고, 2001년에는 유럽, 그리고 2002년에는 우리나라에서도 발매되었지.	포켓몬 금은 발매일	https://ko.wikipedia.org/wiki/%ED%8F%AC%EC%BC%93%EB%AA%AC%EC%8A%A4%ED%84%B0_%EA%B8%88%C2%B7%EC%9D%80	2022/05/06	0	2022-10-04 03:59:34	2022-10-04 21:49:05
BK22014865	3	질문자	아, 이게 2000년이 되기 전에 만들어진 게임인 줄은 몰랐어. 그런데 포켓몬스터 금, 은이 한국에서도 발매되었다면, 정식으로 한글화가 되었다는 의미야? 아니면 일본어 내지 영어판을 수입했다는 거야?				0	2022-10-04 03:59:34	2022-10-04 21:49:05
BK22014865	4	전문가	전자의 추측이 맞아. 한국에서 해당 소프트웨어의 한국어 버전이 2002년 4월 24일, 대원씨아이를 통해 발매되었거든. 참고로 이건 포켓몬스터 소프트웨어 중 최초로 정식 한국어 번역이 된 작품이기도 해.	포켓몬스터 금은 한국어	https://ko.wikipedia.org/wiki/%ED%8F%AC%EC%BC%93%EB%AA%AC%EC%8A%A4%ED%84%B0_%EA%B8%88%C2%B7%EC%9D%80	2022/05/06	0	2022-10-04 03:59:34	2022-10-04 21:49:05
BK22014865	5	질문자	흠, 그러면 한국의 포켓몬 팬들에게 있어선 굉장히 기념비적인 작품이네. 혹시, 포켓몬스터 금, 은의 판매량은 어느 정도였어?				0	2022-10-04 03:59:34	2022-10-04 21:49:05
BK22014865	6	전문가	일본의 경우, 2000년 4월에만 650만장 가량이 판매되었어. 또 한국의 경우, 2002년 4월의 발매 이후 꾸준히 판매되었고, 이후 2005년 2월까지 10만장 가량 판매된 것으로 집계되었지.	포켓몬스터 금은 판매량	https://ko.wikipedia.org/wiki/%ED%8F%AC%EC%BC%93%EB%AA%AC%EC%8A%A4%ED%84%B0_%EA%B8%88%C2%B7%EC%9D%80	2022/05/06	0	2022-10-04 03:59:34	2022-10-04 21:49:05
BK22014865	7	질문자	내가 기억하기론 당시엔 국내 콘솔 시장이 그렇게 활성화가 안 되어 있었던 거 같은데, 그 와중에 10만장이라는 기록을 세웠다는 건 대단하기는 하네. 포켓몬스터 금, 은이 엄청난 인기를 끈 게임이라는 건 부정할 수 없을 거 같은데, 혹시 이 게임의 목표는 정확히 뭐였어?				0	2022-10-04 03:59:34	2022-10-04 21:49:05
BK22014865	8	전문가	성도 및 관동 지방 모두를 아우르는 최고의 포켓몬 트레이너가 되는 것이 이 게임의 목표야. 그리고 이 목표를 이루기 위해선 포켓몬을 성장시켜야 할 뿐만 아니라, 성도의 체육관장 8명을 이겨서 체육관 배지를 수집해야 하지. 그리고 사천왕과 챔피언에게 도전한 다음, 관동 지방에 있는 또 다른 체육관장 8명을 상대로 승리해야 해.	포켓몬스터 금 은 목표	https://ko.wikipedia.org/wiki/%ED%8F%AC%EC%BC%93%EB%AA%AC%EC%8A%A4%ED%84%B0_%EA%B8%88%C2%B7%EC%9D%80	2022/05/06	0	2022-10-04 03:59:38	2022-10-04 21:49:05
BK22014865	9	질문자	아, 어렸을 때 봤던 포켓몬 애니메이션에서 지우랑 피카츄가 포켓몬 체육관 시합에서 승리해서 배지를 얻는 장면이 나오던데, 이게 그냥 나온 설정이 아니라 포켓몬 게임에서 모티브를 얻은 거 였구나. 그럼 혹시, 포켓몬스터 금, 은의 주인공으로는 누가 등장해? 이 게임도 피카츄를 데리고 모험하는 게임인 거야?				0	2022-10-04 03:59:38	2022-10-04 21:49:05
BK22014865	10	전문가	이 게임의 주인공은 연두마을이라는 장소에 사는 한 소년이야. 그리고 플레이어는 게임을 시작하면서, 피카츄가 아니라 치코리타, 브케인, 리아코 중 한 마리를 시작 포켓몬으로서 공박사에게 받게 되지. 이 세 마리 포켓몬 중 한 마리를 선택한 뒤, 플레이어는 포켓몬 마스터가 되기 위한 여정을 시작하게 돼.	포켓몬스터 금은 주인공	https://ko.wikipedia.org/wiki/%ED%8F%AC%EC%BC%93%EB%AA%AC%EC%8A%A4%ED%84%B0_%EA%B8%88%C2%B7%EC%9D%80	2022/05/06	0	2022-10-04 03:59:38	2022-10-04 21:49:05
BK22014865	11	질문자	아, 그러면 지우와 피카츄가 주인공인 게임은 아닌가 보네. 그러면 혹시, 포켓몬스터 금, 은에서도 로켓단이라는 악당들이 등장해? 포켓몬 애니메이션을 보면, 로켓단이 늘 주인공이 가는 곳에 훼방을 놓거든.				0	2022-10-04 03:59:38	2022-10-04 21:49:05
BK22014865	12	전문가	물론이야, 포켓몬스터 금과 은 버전에서도 로켓단이 등장해. 참고로 포켓몬들 중에서는 설정상 맛있는 식재료로 활용할 수 있는 개체들이 있는데, 로켓단들은 꼬리 끝에서 무척 달콤한 맛이 나는 야돈의 꼬리를 잘라 아지트에서 암거래하는 악당으로 등장하지.	포켓몬스터 금은 로켓단	https://www.gamemeca.com/view.php?gid=1407910	2017/11/09	0	2022-10-04 03:59:41	2022-10-04 21:49:05
BK22014865	13	질문자	포켓몬의 꼬리를 식용 판매하는 로켓단이라니, 애니메이션의 우스꽝스러운 로켓단이랑은 분위기가 좀 많이 다르네. 그러면 포켓몬스터 금, 은에 등장하는 최종 보스는 로켓단인 거야?				0	2022-10-04 03:59:41	2022-10-04 21:49:05
BK22014865	14	전문가	아니, 플레이어가 포켓몬을 악용해 나쁜 짓을 저지르는 범죄 집단인 로켓단과 맞서 싸우는 건 맞지만, 이건 모험 도중에 벌어지는 일이야. 플레이어가 마지막으로 상대해야 하는 상대는, 다름 아닌 전작의 주인공인 레드였지.	포켓몬스터 금 은 최종 보스	https://ko.wikipedia.org/wiki/%ED%8F%AC%EC%BC%93%EB%AA%AC%EC%8A%A4%ED%84%B0_%EA%B8%88%C2%B7%EC%9D%80	2022/05/06	0	2022-10-04 03:59:41	2022-10-04 21:49:05
BK22014865	15	질문자	흠, 전작의 주인공이 최종 보스로 나온다는 설정도 굉장히 흥미롭네. 그나저나 너랑 이야기하면서 자료를 좀 찾아봤는데, 포켓몬스터 금, 은과 비슷한 시기에 발매된 포켓몬스터 크리스탈이라는 게임이 또 있더라? 그런데 이 게임이랑 포켓몬스터 금, 은 게임의 외양이 굉장히 많이 비슷해 보이는데, 혹시 이 게임과 포켓몬스터 금, 은 사이에는 서로 어떤 관련이 있는 거야?				1	2022-10-04 03:59:41	2022-10-26 16:31:03
BK22014865	16	전문가	아, 포켓몬스터 크리스탈은, 이전에 나온 포켓몬스터 금과 은 버전에 새로운 요소를 추가해서 발매한 게임이야. 줄거리를 포함해서 전반적인 게임 플레이 자체는 별 차이가 없지만, 포켓몬스터 크리스탈에는 기존 금, 은에 없었던 새로운 요소들이 몇 개 들어가 있어. 가령, 기존 시리즈의 경우 플레이어가 오직 남자 캐릭터로만 게임을 즐길 수 있었던 반면, 이 게임에서는 최초로 주인공의 성별을 고르는 것이 가능해졌지.	포켓몬스터 금은 크리스탈	https://ko.wikipedia.org/wiki/%ED%8F%AC%EC%BC%93%EB%AA%AC%EC%8A%A4%ED%84%B0_%EA%B8%88%C2%B7%EC%9D%80	2022/05/06	0	2022-10-04 03:59:41	2022-10-04 21:49:05
BK22014865	17	질문자	아, 그러면 일종의 확장팩 개념인 거구나. 어떤 느낌인지 이제 이해가 된 거 같아. 친절하게 설명해줘서 고마워!				0	2022-10-04 03:59:41	2022-10-04 21:49:05
BK22014865	18	전문가	천만에, 혹시 추가적으로 더 궁금한 건 없을까?				0	2022-10-04 03:59:41	2022-10-04 21:49:05
BK22014865	19	질문자	음, 지금 바로 떠오르는 건 없는 거 같아. 그리고 설명이 굉장히 흥미롭기는 했지만, 나는 아쉽게도 내일 출근 준비를 해서 먼저 들어가 봐야 할 거 같아. 다음에 다시 또 이야기 나누자!				0	2022-10-04 03:59:41	2022-10-04 21:49:05
BK22014865	20	전문가	그래, 시간이 좀 늦기는 했네. 다음에 이야기 또 이야기 나누어.				0	2022-10-04 03:59:41	2022-10-04 21:49:05
