id	utterance_id	role	text	search_query	search_URL	reference_date	terminate	regDate	updDate
BK22001659	1	질문자	재택근무가 길어지니까 생각보다 여유시간이 많이 남네요, 보통은 퇴근하고 자기 바빴는데 남은 여유시간에 뭐라도 해야겠어요. 어떤 취미를 하면 좋을까요?				0	2022-07-20 16:18:15	2022-08-02 12:01:32
BK22001659	2	전문가	재택근무를 하면서 출퇴근 대중교통에서 보내던 시간에 새로운 걸 배우고 취미활동을 하는 사람이 많아지고 있어요. 재택근무를 하면서 출퇴근에 드는 체력소모와 시간을 오롯이 취미에 쓰는 분도 있고요.	재택근무 취미	https://www.newspim.com/news/view/20211231000750	2022/01/03	0	2022-07-20 16:18:15	2022-07-21 10:49:29
BK22001659	3	질문자	이미 하고 있는 사람도 있군요. 저도 진작에 취미생활이나 뭘 배울 생각을 했으면 좋았을텐데. 지금이라도 찾아봐야겠어요.				0	2022-07-20 16:18:15	2022-08-02 12:01:32
BK22001659	4	전문가	운동이라던지 사람 만나는 것 처럼 밖에서 하는 취미를 좋아하세요, 아니면 집 안에서 하는 취미를 좋아하세요?				0	2022-07-20 16:18:15	2022-07-21 10:49:29
BK22001659	5	질문자	저는 집에서 하는 취미가 좋아요. 손재주가 좋아서 만들기 같은 거 하면 좋을텐데.				0	2022-07-20 16:18:15	2022-08-02 12:01:32
BK22001659	6	전문가	손재주가 좋으면 만들기 취미도 좋겠네요. 온라인으로도 집에서 만다라위빙, 진채화, 프리저브드 플러워 같은 인기많은 수공예 클래스를 수강해서 배울 수 있어요.	금손 취미 종류	http://www.dailypop.kr/news/articleView.html?idxno=47735	2020/11/12	0	2022-07-20 16:18:15	2022-07-21 10:49:29
BK22001659	7	질문자	프리저브드 플라워는 들어봤는데 처음 듣는 것들이 몇 개 있네요. 만다라위빙이 뭐죠?				0	2022-07-20 16:18:15	2022-08-02 12:01:32
BK22001659	8	전문가	만다라위빙은 드림캐쳐나 악마의 눈으로도 불려요. 멕시코 원주민들의 전통 수호 부적에서 유래되었고 여러 색깔의 무늬가 특징인 장식품이에요. 해외에서도 유행하고 있고 나무막대기에 뜨개실을 감아서 모양을 만들어요.	금손 취미 종류	http://www.dailypop.kr/news/articleView.html?idxno=47735	2020/11/12	0	2022-07-20 16:18:15	2022-07-21 10:49:29
BK22001659	9	질문자	아하, 드림캐쳐를 말하시는 거였군요! 그럼 진채화는 그림과 관련된 건가요?				0	2022-07-20 16:18:15	2022-08-02 12:01:32
BK22001659	10	전문가	진채화는 물감을 두껍게 쌓아서 그리는 기법의 그림이에요. 진채화는 박생광이라는 한국화가가 유명해요.	진채화란	https://news.mt.co.kr/mtview.php?no=2013103013473592679&outlink=1&ref=https%3A%2F%2Fsearch.naver.com	2013/10/30	0	2022-07-20 16:18:16	2022-07-21 10:49:29
BK22001659	11	질문자	진채화도 재밌어보이네요. 그림보다는 만들기가 조금 더 흥미로워서 찾아봤는데 라탄공예가 있더라고요. 완성작을 보면 분위기 있고 이쁘던데 라탄공예는 배우기가 어려울까요?				0	2022-07-20 16:18:16	2022-08-02 12:01:32
BK22001659	12	전문가	라탄은 일정한 모양을 만들기 위해서 번갈아 엮어주기만 하는 방식이라 초보자도 쉽게 할 수 있어요.	라탄공예	http://www.handmk.com/news/articleView.html?idxno=12131	2022/03/01	0	2022-07-20 16:18:16	2022-07-21 10:49:29
BK22001659	13	질문자	라탄공예를 배워서 간단한 소품같은 것도 만들면 좋겠어요. 라탄공예도 혼자서 배울 수 있나요?				0	2022-07-20 16:18:16	2022-08-02 12:01:32
BK22001659	14	전문가	네, 라탄공예를 배우려고 공방에 가지 않아도 관련 책이나 유튜브 등에도 독학을 할 수 있는 콘텐츠가 많아서 혼자서도 배울 수 있어요.	라탄공예 독학	https://www.hankyung.com/economy/article/2021051308981	2021/05/14	0	2022-07-20 16:18:16	2022-07-21 10:49:29
BK22001659	15	질문자	집에서 재료 사서 유튜브로 배워봐야겠네요. 라탄공예하는 데 비용이 많이 들까요?				0	2022-07-20 16:18:16	2022-08-02 12:01:32
BK22001659	16	전문가	라탄공예의 주재료는 등나무로 만든 환심인데, 환심은 250g당 1만원 안팎이라 재료비가 많이 들지 않아요.	라탄공예 독학	https://www.hankyung.com/economy/article/2021051308981	2021/05/14	0	2022-07-20 16:18:16	2022-07-21 10:49:29
BK22001659	17	질문자	혼자서 배울 수 있는데다가 비용도 적게 들고 정말 좋은 취미가 되겠어요. 라탄으로 만들 수 있는 것들이 많은 것 같은데 작은 트레이 외에도 만들 수 있는 게 있나요?				0	2022-07-20 16:18:16	2022-08-02 12:01:32
BK22001659	18	전문가	트레이 말고도 컵받침, 컵홀더, 거울, 바구니, 전등갓, 휴지케이스, 피크닉 바구니 등 다양한 작품을 만들 수 있어요. 그리고 가죽이나 금속 같이 다른 소재도 사용하면 더 고급스럽고 근사해져요. 그리고 재료도 환심, 가위, 송곳, 칼, 분무기 정도만 있으면 되고요.	라탄공예 종류	http://www.naeil.com/news_view/?id_art=359329	2020/08/19	0	2022-07-20 16:18:16	2022-07-21 10:49:29
BK22001659	19	질문자	라탄공예로 만들 수 있는 작품이 무궁무진하네요. 라탄공예에 필요한 재료가 정말 간단한데 다 온라인에서 구하면 되겠죠?				0	2022-07-20 16:18:16	2022-08-02 12:01:32
BK22001659	20	전문가	라탄 준비물은 온라인이나 누리집에서 쉽게 구할 수 있어요.	라탄공예 준비물	https://www.hani.co.kr/arti/specialsection/esc_section/985543.html	2021/03/05	0	2022-07-20 16:18:16	2022-07-21 10:49:29
BK22001659	21	질문자	덕분에 라탄공예라는 재밌는 취미를 알게되었어요. 다음번에도 좋은 취미 추천 부탁 드려요.				1	2022-07-20 16:18:16	2022-08-02 12:01:32
