id	utterance_id	role	text	search_query	search_URL	reference_date	terminate	regDate	updDate
BK22000647	1	질문자	여가 생활은 주로 어떻게 보내고 있으신가요?				0	2022-07-20 16:09:13	2022-08-02 12:01:32
BK22000647	2	전문가	저는 주로 혼자서 무언가를 하는 것을 좋아합니다. 독서를 하거나 혼자 영화를 보든지 하죠.				0	2022-07-20 16:09:13	2022-07-21 09:54:46
BK22000647	3	질문자	그렇군요, 저는 이번에 처음으로 보드게임을 해보려고요.				0	2022-07-20 16:09:13	2022-08-02 12:01:32
BK22000647	4	전문가	놀이판이나 간단한 도구로 진행하는 놀이인 보드 게임 말인가요?	보드게임	https://ko.wikipedia.org/wiki/%EB%B3%B4%EB%93%9C_%EA%B2%8C%EC%9E%84	2022/03/03	0	2022-07-20 16:09:13	2022-07-21 09:54:46
BK22000647	5	질문자	네, 그런데 어떤 보드게임으로 먼저 시작해야 할지 모르겠어요.				0	2022-07-20 16:09:13	2022-08-02 12:01:32
BK22000647	6	전문가	타일을 기반으로 하는 보드게임인 루미큐브 어떠세요? 1930년대 초에 루마니아에서 태어난 유대인이 러미와 마작의 요소를 섞어, 이스라엘에서 만든 보드게임입니다.	루미큐브	https://ko.wikipedia.org/wiki/%EB%A3%A8%EB%AF%B8%ED%81%90%EB%B8%8C	2022/02/27	0	2022-07-20 16:09:13	2022-07-21 09:54:46
BK22000647	7	질문자	오, 루미큐브의 규칙은 어떻게 되나요?				0	2022-07-20 16:09:13	2022-08-02 12:01:32
BK22000647	8	전문가	먼저 루미큐브의 구성은 숫자 1부터 13까지 적힌 빨강, 주황, 파랑, 검정 4가지 색의 타일이 2세트가 있고, 조커 타일이 2개가 있습니다. 총 106개인 타일을 섞어서 7개씩 쌓은 뒤 각자 14개의 타일을 자신의 받침대에 가져가 정렬합니다. 규칙을 따라 가져간 이 타일들을 먼저 모두 내려놓는 사람이 승리하는 게임이 됩니다.	루미큐브 규칙	https://star.mbn.co.kr/view.php?no=1516036&year=2014	2014/12/11	0	2022-07-20 16:09:13	2022-07-21 09:54:46
BK22000647	9	질문자	흥미로운 게임이네요. 가져간 타일은 어떻게 먼저 모두 내려놓게 되나요?				0	2022-07-20 16:09:13	2022-08-02 12:01:32
BK22000647	10	전문가	우선은 본인이 가지고 있는 14개 타일 중에서, 숫자의 합이 30 이상 될 수 있는 타일을 만들어 등록을 해야 합니다. 혹시 조커가 있다면 숫자의 합이 30이 되지 않아도 30 이상으로 취급해 등록할 수 있습니다. 만약 조커도 없고 30 이상의 숫자도 만들 수 없다면 타일 뭉치에서 타일 하나를 가져오고 턴을 마쳐야 합니다.	루미큐브 하는법	https://www.gamechosun.co.kr/webzine/article/view.php?no=144532	2017/11/09	0	2022-07-20 16:09:13	2022-07-21 09:54:46
BK22000647	11	질문자	자세한 설명 감사드립니다. 그런데 5명 이상의 인원이 할 수 있는 보드게임도 있나요?				0	2022-07-20 16:09:13	2022-08-02 12:01:32
BK22000647	12	전문가	그러면 마피아 게임이 괜찮을 것 같네요. 마피아 게임은 인원이 많을수록 재밌어요. 최소 5인 이상은 되어야 게임을 할 수 있고, 밤 플레이를 하려면 사회자가 필요합니다.	5인 이상 보드게임	https://www.gamechosun.co.kr/webzine/article/view.php?no=145494	2018/01/08	0	2022-07-20 16:09:13	2022-07-21 09:54:46
BK22000647	13	질문자	생각해 보니 어릴 적에 마피아 게임을 한 적이 있어요. 그리고 카드게임도 했었는데, 과일 모양 막 그려져있던 거요.				0	2022-07-20 16:09:13	2022-08-02 12:01:32
BK22000647	14	전문가	할리갈리 말씀이시군요. 전 세계에서 인기를 얻고 있는 할리갈리는 미국에서 가장 재미있는 보드게임상, 핀란드 올해 어린이 보드게임상, 프랑스 페어플레이 지도 상, 일본 보드게임상을 받았습니다. 할리갈리는 크리스마스에 선물하기 좋은 보드게임으로도 1위이며, 국내에서만 300만 개가 판매되었죠.	할리갈리 게임	http://www.veritas-a.com/news/articleView.html?idxno=87501	2017/06/28	0	2022-07-20 16:09:13	2022-07-21 09:54:46
BK22000647	15	질문자	네, 할리갈리가 상을 많이 받았네요. 그런데 저는 느려서 그런지 할리갈리가 좀 안 맞는 느낌이더라고요. 저 같은 사람이 할 수 있는 보드게임도 많겠죠?				0	2022-07-20 16:09:13	2022-08-02 12:01:32
BK22000647	16	전문가	그럼요. 세계에 있는 보드게임의 종류는 약 1만 종이에요. 멘사 회원들이 추천하는 보드게임인 멘사 셀렉트가 있으니 해보시는 게 어때요?	두뇌보드게임	http://www.kookje.co.kr/news2011/asp/newsbody.asp?code=0800&key=20170110.22018190458	2017/01/09	0	2022-07-20 16:09:13	2022-07-21 09:54:46
BK22000647	17	질문자	멘사 셀렉트라는 보드게임이 있는건가요?				0	2022-07-20 16:09:13	2022-08-02 12:01:32
BK22000647	18	전문가	멘사 셀렉트는 게임 이름이 아니고 상입니다. 미국 멘사에서 수여하는 보드게임 상인 멘사 셀렉트는 매년 5개의 보드게임을 선정하는데요. 1990년부터 매년 선정하고 있어요.	멘사 셀렉트	https://ko.wikipedia.org/wiki/%EB%A9%98%EC%82%AC_%EC%85%80%EB%A0%89%ED%8A%B8	2022/05/28	0	2022-07-20 16:09:13	2022-07-21 09:54:47
BK22000647	19	질문자	아하, 하나의 게임 이름이 아니라 매년 멘사에서 선정하는 보드게임들을 말하는 거군요. 멘사 셀렉트에서 추천한 보드게임, 이렇게요. 보드게임을 하면 뇌에도 도움이 될까요?				0	2022-07-20 16:09:13	2022-08-02 12:01:32
BK22000647	20	전문가	그럼요, 보드게임은 규칙을 이해하고 기억하면서 해야 하고, 손도 많이 사용하게 되죠. 손을 많이 쓰면 전두엽을 자극해서 집중력과 기억력을 강화시키기 때문에 치매를 억제할 수 있습니다.	보드게임과 뇌의 관계	https://magazine.hankyung.com/money/article/202101204259c	2019/03/27	0	2022-07-20 16:09:13	2022-07-21 09:54:47
BK22000647	21	질문자	보드게임을 통해 하루빨리 잠자는 두뇌를 깨워야겠네요. 괜찮다면 같이 한번 해보실래요?				0	2022-07-20 16:09:13	2022-08-02 12:01:32
BK22000647	22	전문가	새로운 여가 생활을 하는 건 좋은 일이죠. 함께 해보자고요.				1	2022-07-20 16:09:13	2022-07-21 13:01:07
