id	utterance_id	role	text	search_query	search_URL	reference_date	terminate	regDate	updDate
BK22008888	1	질문자	이번에 가족들과 함께 남해로 여행을 가려고 해요.				0	2022-09-18 23:47:05	2022-09-18 23:47:05
BK22008888	2	전문가	남해로 여행이라니 정말 즐거울 것 같은데요? 계획은 다 세운거에요?				0	2022-09-18 23:47:05	2022-09-18 23:47:05
BK22008888	3	질문자	이제 계획을 세우기 시작하려고 하는데 남해에 대해서 아예 몰라서 좀 어렵네요. 남해에 물건마을이라고 있던데 이곳은 어떤 곳인가요?				0	2022-09-18 23:47:05	2022-09-18 23:47:05
BK22008888	4	전문가	남해군에 있는 물건마을은 어촌마을로 마을 앞 해안에 어부림은 해풍을 막아주고 뒤에는 산이 있어서 북풍을 막아주는 역할을 해서 사람이 살기 좋은 마을이에요. 여기는 독일마을이 있어서 체험과 관광 명소로 떠오르고 있고요.	남해	http://www.kookje.co.kr/news2011/asp/newsbody.asp?code=0300&key=20210426.22015007487	2021/04/25	0	2022-09-18 23:47:05	2022-09-27 17:03:44
BK22008888	5	질문자	독일마을이 위치해 있는 곳이군요. 독일마을은 주변 지인들에게도 추천을 많이 받은 곳이라서 꼭 가보려고 하는데 독일마을은 어떤 곳인가요?				0	2022-09-18 23:47:05	2022-09-18 23:47:05
BK22008888	6	전문가	독일마을은 1960~70년대에 독일로 건너가서 광부와 간호사로 일하며 외화 벌이를 한 교포들을 위해서 만들어진 공간이에요. 근처에는 원예예술촌도 있고요. 이곳은 뉴질랜드, 네덜란드, 프랑스풍 등의 집과 정원으로 꾸며져 있는 곳이에요. 독일마을을 방문하게 된다면 소세지를 꼭 먹어보고 오세요.	남해 독일마을	http://www.travie.com/news/articleView.html?idxno=20262	2018/05/24	0	2022-09-18 23:47:05	2022-09-18 23:47:05
BK22008888	7	질문자	독일마을은 들으면 들을수록 가고 싶은 곳이네요. 혹시 독일마을에서 특별한 이벤트나 축제를 하고 있는 건 없나요?				0	2022-09-18 23:47:05	2022-09-18 23:47:05
BK22008888	8	전문가	마침 오는 9월 30일~10월 2일까지 독일마을에서 맥주축제가 열려요. 남해관광문화재단은 유럽형 문화공연과 전시 등 프로그램을 준비하고 유럽문화를 느낄 수 있도록 체험 행사도 준비하고 있죠.	남해 축제	http://www.100ssd.co.kr/news/articleView.html?idxno=90248	2022/08/22	0	2022-09-18 23:47:05	2022-09-18 23:47:05
BK22008888	9	질문자	저희가 여행 계획을 세운 날짜와 딱 겹쳐서 다녀올 수 있을 것 같아요. 혹시 독일마을 말고 남해에 또 가볼만한 곳이 어디 있을까요?				0	2022-09-18 23:47:05	2022-09-18 23:47:05
BK22008888	10	전문가	다랭이마을이라고 들어본 적 있나요? 남해에는 다랭이마을이 있는데 여행지로 개발된 곳이라 볼거리나 체험할 거리가 많아요.	남해 가볼만한 곳	https://www.jejutwn.com/news/article.html?no=141178	2022/08/01	0	2022-09-18 23:47:05	2022-09-18 23:47:05
BK22008888	11	질문자	다랭이 마을은 처음 들어보는데 혹시 다랭이 마을에서도 독일마을과 같은 프로그램이나 축제는 없나요?				0	2022-09-18 23:47:05	2022-09-18 23:47:05
BK22008888	12	전문가	다랭이 마을에서는 10월까지 달빛 걷기 행사를 진행하고 있어요. 이 축제에서는 골목길과 천혜의 풍광을 자랑하는 해안길을 제대로 느낄 수 있죠. 또 마을 해설사와 함께 걷는 이벤트이다 보니까 다랭이 마을에 문화재와 옛 농업양식 등에 대하여 들을 수 있고 참가한 분들의 소원을 담은 풍등 날리기 체험도 가능해요.	남해 다랭이마을	http://www.idomin.com/news/articleView.html?idxno=801063	2022/08/03	0	2022-09-18 23:47:05	2022-09-18 23:47:05
BK22008888	13	질문자	다랭이 마을에도 행사가 진행되는 것이 있네요. 가족들과 이야기해보고 방문해 봐야겠어요. 어머니가 자연 풍경 보는 것을 좋아하는데 혹시 풍경이 멋진 명소가 남해에 있나요?				0	2022-09-18 23:47:05	2022-09-18 23:47:05
BK22008888	14	전문가	남해에서 풍경이 좋은 곳은 보리암이 있어요. 여행에서 금산 보리암은 빠질 수 없는 명소라고 할 수 있죠. 특히 꼭대기에서 바라보는 풍경은 남해 최고라고 할 수 있어요.	남해 가볼만한곳	http://www.mhns.co.kr/news/articleView.html?idxno=302585	2019/10/03	0	2022-09-18 23:47:05	2022-09-18 23:47:05
BK22008888	15	질문자	보리암의 풍경이 남해 최고라고 하니 어머니 모시고 꼭 다녀와야겠어요. 남해에 생각보다 명소가 생각보다 더 많네요. 남해에는 인정받은 명소가 있을까요?				0	2022-09-18 23:47:05	2022-09-18 23:47:05
BK22008888	16	전문가	남해의 명소는 많지만 이번 2022 경남 유니크 베뉴 공모에서 남해 3곳의 관광지가 지정되어서 소개해드릴게요. 유니크 베뉴는 개최 지역만의 고유한 의미나 독특한 느낌을 자아내는 이색적인 장소를 뜻하는 말인데요. 이번에 지정된 곳은 남해의 남해각과 이순신순국공원 내 리더십체험관, 보물섬 전망대에요.	남해 관광지	http://www.busan.com/view/busan/view.php?code=2022081009314699574	2022/08/10	0	2022-09-18 23:47:05	2022-09-18 23:47:05
BK22008888	17	질문자	와 남해는 가볼 곳이 정말 많군요. 참고해서 이동 스케줄 잡아야겠어요. 혹시 남해에서 유명한 먹을거리는 어떤 것이 있나요?				0	2022-09-18 23:47:05	2022-09-18 23:47:05
BK22008888	18	전문가	남해군에는 독일소시지와 수제맥주, 유자빵 등의 음식이 새로 떠오르고 있어요. 한 조사에서 관광객이 가장 선호하는 1등 음식이 독일소시지 였고요. 그 외에 전복마늘찜과 해물찜, 시금치, 고사리 파스타 등이 있어요. 참고해서 선호하는 음식을 먹는 건 어떨까요?	남해 명물	https://www.khan.co.kr/local/Gyeonggnam/article/202209020947011	2022/09/02	0	2022-09-18 23:47:05	2022-09-27 17:03:44
BK22008888	19	질문자	참고해서 음식을 알아봐야겠어요. 다음에도 궁금한 점이 있으면 연락 드릴게요.				0	2022-09-18 23:47:05	2022-09-18 23:47:05
BK22008888	20	전문가	저는 언제든지 환영이에요. 다음에도 오늘 같이 즐겁게 이야기 나눠요.				1	2022-09-18 23:47:05	2022-09-27 17:03:44
