id	utterance_id	role	text	search_query	search_URL	reference_date	terminate	regDate	updDate
BK22009204	1	질문자	제가 샌프란시스코로 여행을 가게 됐어요. 설레기도 하지만 정보가 많이 없어서 걱정이 되기도 하네요. 혹시 샌프란시스코에 추천해주실만한 관광지 있을까요?				0	2022-09-22 10:35:08	2022-09-22 10:35:08
BK22009204	2	전문가	샌프란시스코의 금문교를 일단 추천해요. 1937년 5월 27일에 개통한 길이 2,737 m의 다리와 물과의 간격 67 m 그리고 타워와의 총 높이 227 m로 샌프란시스코 베이와 마린 카운티 사이를 이어주는 세계 최초 현수교로 건설되었어요. 금문교라는 이름은 미군 대위였던 존 프리몬트가 태평양으로 나가는 이 지역의 해협을 보면서 저 넘어 동방과 무역을 하는 황금의 문이다 라고 말한데에서 유래됐고요. 금문교는 조셉 스트라우스가 1917년에 처음 설계했는데 사실 경제 대공황 때 좋지 않은 경제 상황을 이겨내기 위한 프로젝트로 진행되며 만들어지게 된거에요.	샌프란시스코 관광지	https://terms.naver.com/entry.naver?docId=6233709&cid=67006&categoryId=68045	2020/12/11	0	2022-09-22 10:35:08	2022-09-29 18:27:36
BK22009204	3	질문자	금문교라면 사진으로 많이 본 것 같은데 그런 역사적 배경이 숨겨진 다리였군요. 그리고 제가 초콜릿을 좋아하는데 샌프란시스코에 초콜릿을 좋아한다면 기라델리 스퀘어에 꼭 가봐야 한다고 하더라고요. 기라델리 스퀘어에 대해 알려주실 수 있을까요?				0	2022-09-22 10:35:08	2022-09-22 10:35:08
BK22009204	4	전문가	초콜릿을 너무나 좋아하고 사랑하는 분이라면 꼭 놓치지 말아야 곳이 바로 기라델리 스퀘어에요. 초콜렛 샵, 레스토랑, 카페 등이 모여 있는 작은 쇼핑몰인데 원래는 샌프란시스코에서 시작된 브랜드 기라델리의 초콜릿 공장이였다가 1960년대에 쇼핑센터로 바꾼거에요. 초콜릿 샘플링도 하고 있어서 무료로 초콜렛을 먹어 볼 수 있고 카페 뒷쪽에서는 초콜릿을 만드는 과정도 구경할 수 있어요. 즉석으로 만든 콘 또는 와플에 아이스크림과 토핑을 올려 주는 선데, 파르페 등이 인기가 많아요. 구경만 해도 즐거운 기념품샵도 한 번 둘러보는 것을 추천해요.	기라델리 스퀘어	https://terms.naver.com/entry.naver?docId=6233715&cid=67006&categoryId=68045	2020/12/11	0	2022-09-22 10:35:08	2022-09-22 10:35:08
BK22009204	5	질문자	기라델리 스퀘어에 꼭 가보고 싶네요. 아, 그리고 샌프란시코에 그레이스 대성당이 굉장히 유명하다고 들었어요. 그레이스 대성당에 대해서 알려주실 수 있을까요?				0	2022-09-22 10:35:08	2022-09-22 10:35:08
BK22009204	6	전문가	놉 힐에 있는 그레이스 대성당을 보면 전면의 위엄과 웅장한 모습에 탄성이 저절로 나올거에요. 1849년 골드 러시 때 처음 건설되었지만 1906년에 샌프란시스코 대지진 때 붕괴되었어요. 1928년 건축가 루이스 호바트라는 건축가가 프랑스풍의 고딕 스타일로 설계한 후 30여 년 동안 공사가 진행됐고 1964년에 완공되었요. 성공회 성당으로 미국에서 3번째로 규모가 커요. 12달러의 기본 입장료를 내고 둘러볼 수 있는데 8달러의 비용을 추가로 내면 가이드의 안내를 받으며 구경할 수 있어요.	그레이스 대성당	https://terms.naver.com/entry.naver?docId=6233716&cid=67006&categoryId=68045	2020/12/11	0	2022-09-22 10:35:08	2022-09-22 10:35:08
BK22009204	7	질문자	시간이 된다면 꼭 한 번 방문해보고 싶네요. 아, 그리고 샌프란시스코에 골든 게이트 공원이 유명하다고 들었어요. 골든 게이트 공원에 대해 알려주실 수 있나요?				0	2022-09-22 10:35:08	2022-09-28 20:42:47
BK22009204	8	전문가	뉴욕의 센트럴 파크가 있다면 샌프란스코에는 골든 게이트 파크가 있다고 할 수 있죠. 샌프란시스코 도심 속에 있는 공원인데 시민들에게 소중한 휴식처이기 때문에 많은 사랑을 받는 곳이에요. 동서로 5 km 남북으로 1.6 km의 직사각형 모양의 공원으로 크기로 비교를 하자면 센트럴 파크보다 더 커요. 원래 모래와 참나무들로 엉망으로 뒤덮여 있고 아무도 관심 갖지 않던 곳이였지만 윌리엄 해먼드 홀이라는 공원 설계자가 이 곳에 1871년부터 약 5년 동안 7만 5천여 그루의 나무를 심으면서 모두에게 사랑받는 도심 공원으로 변신했죠.	골든 게이트 공원	https://terms.naver.com/entry.naver?docId=6233719&cid=67006&categoryId=68045	2020/12/11	0	2022-09-22 10:35:08	2022-09-28 20:42:47
BK22009204	9	질문자	센트럴 파크도 굉장히 크다고 느꼈는데 더 큰 공원이라면 정말 규모가 크겠네요. 그리고 제가 미술관 관람하는 것을 정말 좋아하는데 샌프란시스코에 훌륭한 현대미술관이 있다고 들었어요. 샌프란시스코에 있는 현대미술관에 대해 알려주실 수 있을까요?				0	2022-09-22 10:35:08	2022-09-22 10:35:08
BK22009204	10	전문가	매년 약 70만 명이 방문하는 샌프란시스코 현대미술관은 미서부 최고의 현대미술관 중의 하나에요. 약 33,000여 점의 그림, 조각, 사진, 건축, 디자인, 미디어 아트들로 이루어져 있는 세계적인 수준의 미술관이죠. 2016년에 대대적으로 전시관을 확장하기 위해 공사를 거쳐 약 16,000 제곱미터의 크기로 넓어져서 미국에서뿐 아니라 세계에서 가장 큰 현대 미술관 중의 하나가 됐어요.	샌프란시스코 현대미술관	https://terms.naver.com/entry.naver?docId=6233717&cid=67006&categoryId=68045	2020/12/11	0	2022-09-22 10:35:08	2022-09-22 10:35:08
BK22009204	11	질문자	그런 멋진 미술관이 있다면 꼭 가봐야겠네요. 아, 그리고 샌프란시스코에 페인티드 레이디스라는 을 꼭 가보라고 친구가 그러더라고요. 처음 들었을 때 이름이 참 독특하다고 생각이 들었는데 페인티드 레이디스가 어떤 곳인지 알려주실 수 있나요?				0	2022-09-22 10:35:08	2022-09-22 10:35:08
BK22009204	12	전문가	알록달록한 색깔의 페인트칠이 되어 있는 숙녀들과 비슷한 모양이지만 제각각의 색깔의 페인트로 색칠되어 있는 집들을 보면 왜 이곳을 페인티드 레이디스라고 부르는지 바로 알아채실거에요. 앞줄에 7채의 집들은 세븐 시스터즈라는 애칭을 가지고 있고요. 빅토리안 스타일과 에드워디안 스타일의 건축 스타일에 상큼한 색깔들로 페이트칠 되어 있는 블럭으로 1892~1896년 개발자인 매튜 카발너프가 722 Steiner Street에 집을 세우면서 시작되었어요. 바로 앞에 있는 알라모 스퀘어 공원 위에서 내려다 보면 저 멀리 샌프란시스코의 도심과 어우러져 보이는 형형색색의 삼각 지붕들의 모습이 너무나 아름답게 보일거에요.	페인티드 레이디스	https://terms.naver.com/entry.naver?docId=6233723&cid=67006&categoryId=68045	2020/12/11	0	2022-09-22 10:35:08	2022-09-22 10:35:08
BK22009204	13	질문자	그렇게 예쁜 풍경을 자랑하는 곳이라면 꼭 가봐야겠네요. 아, 그런데 샌프란시스코에 있는 트윈픽스에도 꼭 가봐야 한다고 들었어요. 트윈 픽스에 대해 설명해 주실 수 있나요?				0	2022-09-22 10:35:08	2022-09-22 10:35:08
BK22009204	14	전문가	샌프란시스코에서 가장 전망이 훌륭한 두 개의 봉우리라 하여 쌍둥이 꼭대기라는 의미를 가진 트윈 픽스라고 불러요. 해발 276 m의 유레카 피크와 277 m의 노아 피크로 이루어져 있는데 샌프란시스코 전경을 360도로 감상할 수 있는 최고의 지점이에요. 전망대의 기능만 하는 게 아니라 전파 송신소와 상수도 저장소도 이곳에 위치하고 있죠. 낮에는 안개가 많아서 풍경을 감상하기 어려울 때도 있지만 밤에는 기온이 낮고 안개가 걷힐 가능성이 높아서 샌프란시스코의 야경을 보려는 사람들이 많이 찾는 곳이에요. 높은 곳이어서 바람이 많이 부니까 외투 하나는 꼭 챙겨서 올라가세요.	트윈 픽스	https://terms.naver.com/entry.naver?docId=6233725&cid=67006&categoryId=68045	2020/12/11	0	2022-09-22 10:35:08	2022-09-22 10:35:08
BK22009204	15	질문자	샌프란시스코에 그렇게 전망이 훌륭한 장소가 있다면 꼭 가봐야겠네요. 아, 그리고 샌프란시스코에 무지개 깃발이 상징인 카스트로 거리가 있다고 들었어요. 카스트로 거리에 대해 알려주실 수 있을까요?				0	2022-09-22 10:35:08	2022-09-22 10:35:08
BK22009204	16	전문가	곳곳에서 무지개 깃발이 꽂혀 있는 곳이죠. 바로 샌프란시스코의 성소수자의 거리 카스트로에요. 19세기 미국에 마지막까지 저항한 멕시코인인 호세 카스트로의 이름에서 카스트로라는 이 거리의 이름이 유래 됐어요. 미국에서 사실상 최초의 동성애자 지역이며 미국 최초의 동성애자 정치인 하비 밀크를 비롯해서 성소수자 인권 운동의 활동이 중심적으로 펼쳐지는 곳으로 정치, 경제, 사회, 문화 등 여러 방면에 영향을 끼치고 있어요. 동성애 영화를 상영하는 카스트로 극장, 매년 6월 마지막 주에 열리는 게이 퍼레이드, 10월 카스트로 축제와 할로윈 퍼레이드 등 동성애와 관련된 다양한 행사 등이 열리고 있어요.	카스트로	https://terms.naver.com/entry.naver?docId=6233727&cid=67006&categoryId=68045	2020/12/11	0	2022-09-22 10:35:08	2022-09-22 10:35:08
BK22009204	17	질문자	동성애 관련된 거리가 있군요. 신기하네요. 샌프란시스코에 대해 이렇게 자세하게 알려주셔서 정말 감사합니다.				0	2022-09-22 10:35:08	2022-09-22 10:35:08
BK22009204	18	전문가	별 말씀을요. 제 설명이 여행 하실 때 많은 도움이 된다면 좋을 것 같아요.				0	2022-09-22 10:35:08	2022-09-22 10:35:08
BK22009204	19	질문자	여행 계획 짤 때 정말로 많은 도움 될 것 같아요. 덕분에 즐겁고 행복한 여행 될 것 같아요.				1	2022-09-22 10:35:08	2022-10-04 10:34:21
BK22009204	20	전문가	샌프란시스코에서 행복하고 좋은 시간 보내고 오시기를 바랄게요.				0	2022-09-22 10:35:08	2022-09-22 10:35:08
