id	utterance_id	role	text	search_query	search_URL	reference_date	terminate	regDate	updDate
BK22013214	1	질문자	요즘 내 친구가 인디 게임을 만들고 싶다고 하더라. 인디 게임이라는 말은 많이 들어봤는데, 그게 뭐야?				0	2022-09-30 15:35:07	2022-10-01 18:23:49
BK22013214	2	전문가	인디 게임은 소형 게임사가 독립적으로 개발한 게임을 말해. 장르가 다양하고, 참신한 발상을 많이 찾아볼 수 있는 게 특징이야. 그 점에 매력을 느끼는 게이머들도 많아.	인디게임이 뭔가요	https://www.news2day.co.kr/article/20220907500365	2022/09/12	0	2022-09-30 15:35:07	2022-10-01 18:23:49
BK22013214	3	질문자	그렇구나, 내 친구도 그런 참신하고 재미있는 게임을 만들고 싶다고 했어. 그럼 인디 게임은 투자를 따로 안 받고 만드는 거야?				0	2022-09-30 15:35:07	2022-10-01 18:23:49
BK22013214	4	전문가	그렇지는 않아. 대형 게임 업체들이 인디 게임을 지원하거나, 심지어 인수합병을 하는 경우도 있어.	인디게임이 뭔가요	https://www.news2day.co.kr/article/20220907500365	2022/09/12	0	2022-09-30 15:35:07	2022-10-01 18:23:49
BK22013214	5	질문자	그렇잖아도 요즘 친구가 개발 자금 확보가 많이 힘들다고 하더라고. 그런 대형 게임사의 투자를 받으려면 어떻게 하는게 좋을까?				0	2022-09-30 15:35:07	2022-10-01 18:23:49
BK22013214	6	전문가	2022년 9월 21일 기준으로 스마일게이트, 카카오 게임즈, 네오위즈, 엔씨소프트, 펄어비스, 데브시스터즈 등의 기업들이 인디 게임 투자 및 후원에 적극적이야. 이런 인디게임에 관심 많은 기업들을 노려보는 게 좋아.	인디 게임 투자	http://www.dt.co.kr/contents.html?article_no=2022092202101931820001&ref=naver	2022/09/20	0	2022-09-30 15:35:08	2022-10-01 18:23:49
BK22013214	7	질문자	그런 사람들이 한데 모이거나, 내 친구가 그 기업들에게 어필해서 투자를 받을 수 있는 자리도 있을까?				0	2022-09-30 15:35:08	2022-10-01 18:23:49
BK22013214	8	전문가	대형 게임사가 개최한 인디 게임 창작자를 지원하는 박람회를 찾아가는 게 좋아. 스마일 게이트의 버닝비버 2022 인디게임 축제나 네오위즈의 방구석 인디 게임쇼 같은 예시가 있으니, 참고해 봐.	인디게임 투자 어디서	https://newsis.com/view/?id=NISX20220912_0002009877&cID=13008&pID=13100	2022/09/13	0	2022-09-30 15:35:08	2022-10-01 18:23:49
BK22013214	9	질문자	알았어, 친구한테 꼭 전해 줄게. 근데 대형 게임사들은 왜 인디 게임에 투자하려고 하는 걸까?				0	2022-09-30 15:35:08	2022-10-01 18:23:49
BK22013214	10	전문가	게임업계에 따르면, 앞으로 다가올 미래의 먹거리를 찾아내 개발하기 위해서 대형 게임사들이 인디게임에 투자하는 거라고 분석하고 있지.	인디게임 투자 이유	https://news.mt.co.kr/mtview.php?no=2022090515103389785	2022/09/06	0	2022-09-30 15:35:08	2022-10-01 18:23:49
BK22013214	11	질문자	그렇구나. 그런데 인디 게임으로 성공한 대표적인 사례가 있을까?				0	2022-09-30 15:35:08	2022-10-01 18:23:49
BK22013214	12	전문가	마인크래프트와 스타듀밸리가 대표적으로 성공한 인디 게임이야. 마인크래프트는 마이크로 소프트에서 약 25억 달러에 인수했고, 스타듀밸리는 1인 개발 게임인데도 1500만 장이라는 엄청난 판매량을 올렸어.	인디게임 성공 사례	https://www.etoday.co.kr/news/view/2084081	2021/12/04	0	2022-09-30 15:35:08	2022-10-01 18:23:49
BK22013214	13	질문자	와, 나는 스타듀밸리의 성공 사례가 너무 신기하다. 1인 개발이라니, 혼자서 게임을 만든다는 건 상상도 못 했어. 하지만 인디 게임으로서 성공한 사례만 있을 것 같지는 않은데, 인디 게임이 성공적으로 흥행하기 위한 조건은 뭘까?				0	2022-09-30 15:35:08	2022-10-01 18:23:49
BK22013214	14	전문가	의외로 게임 앱 판매 화면에 뜨는 아이콘, 설명문, 스크린 샷, 관련 비디오가 굉장히 중요해. 저런 요소들이 유저가 앱을 접하는 첫인상이라, 실제 다운로드로 연결되게 하는 통로 역할을 하거든. 일단 다운로드를 하게 만들어야 뭐든 보여줄 수 있는 거지.	인디게임 성공 비결	https://www.yna.co.kr/view/AKR20160422094100017?input=1195m	2016/04/22	0	2022-09-30 15:35:08	2022-10-01 18:23:49
BK22013214	15	질문자	좋다, 메모해 뒀다가 친구한테 전해줘야겠어. 내 친구는 스컬이라는 게임을 롤모델 삼아서 개발 중 이래. 스컬은 얼마나 판매된 게임이야?				0	2022-09-30 15:35:08	2022-10-01 18:23:49
BK22013214	16	전문가	스컬은 정식 출시 1년 만에 한국 패키지 인디 게임 최초로 100만 장을 돌파한 게임이야. 네 친구가 롤 모델로 삼기에 아주 적절한 게임이라고 할 수 있지.	스컬 판매량	http://osen.mt.co.kr/article/G1111752484	2022/01/27	0	2022-09-30 15:35:08	2022-10-01 18:23:49
BK22013214	17	질문자	그렇구나, 나도 살짝 해봤는데 정말 재밌더라. 스컬의 성공 비결이 뭘까? 친구한테 알려주고 싶어.				0	2022-09-30 15:35:08	2022-10-01 18:23:49
BK22013214	18	전문가	스컬은 기본적으로 재미의 접근성이 높아서, 어느 유저든 쉽게 즐길 수 있어. 그리고 반복 활동에도 조금씩 변화를 줘서 지루함을 최소화하고 있기 때문에, 많은 사람들이 질리지 않고 지속적으로 플레이하는 거야.	스컬 성공 비결	http://www.khgames.co.kr/news/articleView.html?idxno=133829	2022/01/27	0	2022-09-30 15:35:08	2022-10-01 18:23:49
BK22013214	19	질문자	쉬운 접근성과, 질리지 않는 지속성 꼭 기억해 둬야겠다. 내 친구도 그런 게임을 만들어 냈으면 좋겠어.				0	2022-09-30 15:35:08	2022-10-01 18:23:49
BK22013214	20	전문가	네 친구의 앞길을 응원할게.				0	2022-09-30 15:35:08	2022-10-01 18:23:49
BK22013214	21	질문자	고마워, 나중에 게임이 출시되면 너한테도 링크 보내 줄게!				1	2022-09-30 15:35:08	2022-10-01 18:23:49
