id	utterance_id	role	text	search_query	search_URL	reference_date	terminate	regDate	updDate
BK22015513	1	질문자	내년 여름 휴가 계획을 벌써 짜는 중이야.				0	2022-10-09 20:36:06	2022-10-09 20:36:06
BK22015513	2	전문가	1년 가까이 남았는데 벌써 계획을 세운다고?				0	2022-10-09 20:36:06	2022-10-09 20:36:06
BK22015513	3	질문자	응, 미리 예약을 해야 싼 것들이 있어서 난 항상 그렇게 하거든. 방콕 가려고 하는데 너한테 좀 물어보려고 연락했어.				0	2022-10-09 20:36:06	2022-10-09 20:36:06
BK22015513	4	전문가	다음 여름 휴가지는 방콕으로 선택했구나. 어떤 게 궁금한거야?				0	2022-10-09 20:36:06	2022-10-09 20:36:06
BK22015513	5	질문자	일단 가면 사원을 가장 먼저 가보려고 하거든. 짜오프라야 강 주변에 사원들이 많잖아. 어떤 사원들이 있는지 좀 알려줘.				0	2022-10-09 20:36:06	2022-10-09 20:36:06
BK22015513	6	전문가	짜오프라야강 주변은 짜끄라 왕조를 열었던 라마 1세가 수도로 활용했던 지역인 랏따나꼬신이 중심이라고 보면 되는데, 왕궁을 중심으로 왓 포, 왓 아룬, 왓 프라깨우 등 주요 사원들이 밀집해 있어.	짜오프라야강 주변 사원	http://www.travie.com/news/articleView.html?idxno=20808	2019/04/04	0	2022-10-09 20:36:06	2022-10-09 20:36:06
BK22015513	7	질문자	왓 포, 왓 아룬, 왓 프라깨우 사원이 있구나. 왓 아룬 사원이 가장 많이 들어본 곳이긴하다. 왓 아룬 이름에는 무슨 뜻이 있어?				0	2022-10-09 20:36:06	2022-10-09 20:36:06
BK22015513	8	전문가	왓 아룬은 왕실 전용 사원인데 태국 말로 아루나는 새벽을 뜻해.	왓 아룬 사원 이름	https://n.news.naver.com/mnews/article/016/0000600920?sid=103	2014/12/23	0	2022-10-09 20:36:06	2022-10-09 20:36:06
BK22015513	9	질문자	아, 새벽 사원이라는 뜻이구나. 사원갈 때 준비해야 할 것들이 있을까?				0	2022-10-09 20:36:06	2022-10-09 20:36:06
BK22015513	10	전문가	사원을 방문할 때는 예의를 갖추기 위해서 긴팔 옷을 입고 가는 게 가장 중요해. 금빛으로 둘러쌓인 건물이 햇빛을 반사하기 때문에 아주 더워서 긴팔 입고 가면 햇빛 가리기에도 좋아. 그리고 시원한 물도 한 병 꼭 챙기는 게 좋은데 땀이 줄줄 흐를 만큼 더운데 안에는 물 살 곳이 딱히 없거든.	방콕 사원 준비	https://www.travie.com/news/articleView.html?idxno=50504	2022/08/12	0	2022-10-09 20:36:06	2022-10-09 20:36:06
BK22015513	11	질문자	긴팔 옷이랑 시원한 물을 준비하면 되는구나. 아, 전에 TV에서 보니까 왓 아룬은 일몰이 정말 멋지던데, 멀리서 일몰을 보려면 어떤 방법이 좋을까?				0	2022-10-09 20:36:06	2022-10-10 12:12:28
BK22015513	12	전문가	왓 아룬은 일출과 일몰이 멋있기로 유명하지. 일몰을 보려면 두 가지 방법이 있는데 하나는 짜오프라야 강변에서 배를 타고 사원 전경을 보는 방법이 있고, 또 하나는 새벽사원 정상에 올라가서 짜오프라야 전경을 한 번에 보는 방법이 있어.	왓 아룬 일몰	https://n.news.naver.com/mnews/article/079/0002753723?sid=103	2015/09/25	0	2022-10-09 20:36:06	2022-10-10 13:23:39
BK22015513	13	질문자	배를 타고 보는 일몰이라니 정말 낭만적이다. 가서 교통수단은 아무래도 택시를 많이 탈 것 같은데, 전에 어디서 보니까 택시가 색깔별로 종류가 다르다고 하더라고. 어떻게 다른거야?				0	2022-10-09 20:36:06	2022-10-10 12:12:28
BK22015513	14	전문가	방콕 택시들은 종류가 여러가지 있는데 색깔로 구별을 하고 있어. 노란색, 초록색 반반으로 된 택시는 미터택시이고 분홍, 하늘, 노란색 같이 단색으로 된 택시는 가격을 흥정해서 이용을 하는 택시야.	방콕 택시 색깔	https://n.news.naver.com/mnews/article/079/0002646986?sid=103	2014/10/21	0	2022-10-09 20:36:06	2022-10-09 20:48:35
BK22015513	15	질문자	난 흥정은 못하니까 노란색이랑 초록색으로 된 택시만 타야겠다. 여행카페에서 보니까 그랩도 많이 쓰는 것 같은데 그랩은 어떻게 이용해?				0	2022-10-09 20:36:06	2022-10-09 20:48:35
BK22015513	16	전문가	방콕에 도착해서 현지 유심으로 바꾼 다음에 그랩 어플을 설치하 내가 있는 장소나 출발지를 정하고 목적지를 찾아서 등록하면 차와 기사를 배차해 주게 돼. 메뉴는 그랩 카, 그랩 택시, 저스트 그랩으로 나뉘어져 있는데 그랩 카는 택시 기사가 아닌 일반 운전자가 운행하는 일반 차량이고 그랩 택시는 일반 택시랑 같은데 그랩에 등록된 택시 차량이야. 저스트 그랩은 그랩 카나 그랩 택시 중에 내가 있는 곳에 가까운 차를 불러주는 거야.	방콕 그랩	http://www.dailypop.kr/news/articleView.html?idxno=36451	2018/11/23	0	2022-10-09 20:36:06	2022-10-09 20:48:35
BK22015513	17	질문자	설명을 잘 해주니까 바로 알겠다. 아, 방콕에 수상 보트도 있잖아. 꼭 한 번 타보고 싶던데 종류나 요금 좀 알려줘.				0	2022-10-09 20:36:06	2022-10-09 20:48:35
BK22015513	18	전문가	강을 오가는 보트가 여럿 있는데 , 파란색 깃발을 단 건 관광용 보트이고 그 외에 운행 날짜나 서는 곳, 요금, 시간에 따라서 주황색, 노란색, 초록색 깃발이 달린 보트들이 있어. 관광용 보트는 150바트하는 일일패스를 사서 타면 하루 종일 원하는 곳에서 여러번 타고 내릴 수 있으니까 참고해.	방콕 수상 보트	http://www.outdoornews.co.kr/news/articleView.html?idxno=24588	2017/08/21	0	2022-10-09 20:36:06	2022-10-09 20:48:35
BK22015513	19	질문자	일일패스도 있다니 좋은 정보네. 아이랑 갈만한 곳도 좀 알아봐야 하는데 혹시 키즈 카페 같은 곳들도 있을까?				0	2022-10-09 20:36:08	2022-10-09 20:48:35
BK22015513	20	전문가	응, 방콕에 대형 쇼핑몰 안에 키즈카페들이 있어. 아이콘시암에 수퍼파크 타일랜드라는 키즈카페도 있고 엠포리움 백화점에 이매지니아 플레이랜드도 있지. 아 , 그리고 시암파라곤에는 어린이 직업체험 테파파크인 키자니아도 있어.	방콕 키즈카페	https://n.news.naver.com/mnews/article/002/0002119644?sid=102	2020/01/24	0	2022-10-09 20:36:06	2022-10-09 20:48:35
BK22015513	21	질문자	아이콘 시암 요즘 핫하다고 하던데, 키즈카페도 갈 겸 한 번 가봐야겠다. 덕분에 알차게 계획 세울 수 있을 것 같아. 계획 세우다가 궁금한 거 있으면 또 연락해도 되지?				0	2022-10-09 20:48:35	2022-10-09 20:48:35
BK22015513	22	전문가	내가 도울 수 있는 거라면 언제든지 알려줄게. 준비 잘 하고 또 연락해.				1	2022-10-09 20:48:35	2022-10-17 14:30:30
BK22015513	23	질문자	응, 정말 고마워. 잘 지내고, 다음에 또 연락할게.				0	2022-10-09 20:48:35	2022-10-09 20:48:35
