id	utterance_id	role	text	search_query	search_URL	reference_date	terminate	regDate	updDate
BK22015354	1	질문자	올해 안에 꼭 여행가보고 싶은 도시가 생겼어. 최근 즐겨봤던 드라마 배경으로 나왔던 곳인데, 보면 볼수록 직접 가보고 싶은 마음이 들더라고.				0	2022-10-08 01:27:51	2022-10-08 01:27:51
BK22015354	2	전문가	여행해보지 않았던 도시가 드라마 배경으로 꾸준히 나오면 그럴 수 있겠다. 어떤 드라마를 봤길래 그래?				0	2022-10-08 01:27:51	2022-10-08 01:27:51
BK22015354	3	질문자	징크스의 연인이라는 드라마인데, 거기서 경남 진주의 곳곳이 많이 나오더라고! 대부분이 관광명소인 것 같던데, 어떤 곳들이 나왔었는지 알려줄 수 있어?				0	2022-10-08 01:27:51	2022-10-08 01:27:51
BK22015354	4	전문가	징크스의 연인은 주로 진주 논개시장을 주 배경으로 담아냈고, 그 외에도 문산성당, 레일바이크 등의 관광명소들을 무대로 4개월에서 5개월간의 기간 동안 촬영한 드라마야.	징크스의 연인 진주 명소	https://newsis.com/view/?id=NISX20220708_0001935758&cID=10812&pID=10800	2022/07/10	0	2022-10-08 01:27:51	2022-10-08 01:27:51
BK22015354	5	질문자	그렇구나, 이 드라마를 계기로 진주의 곳곳이 더 많이 유명해질 것 같던데. 진주시에서는 촬영지 홍보를 위해 어떤 노력을 하고 있어?				0	2022-10-08 01:27:51	2022-10-08 01:27:51
BK22015354	6	전문가	진주시에서는 논개시장에 있는 남자주인공의 생선가게 촬영지에 포토존을 조성하고, 다양한 이벤트를 열고있어. 드라마의 현장감을 그대로 표현하기 위해서 촬영에 쓰인 소품들을 최대한 보존하고, 포토존에는 TV를 비치해 드라마 징크스의 연인을 보여주기도하지. 또한, 드라마의 배경이 되었던 관광명소들을 중심으로 사진을 전시하고있어.	징크스의 연인 진주 명소	https://newsis.com/view/?id=NISX20220708_0001935758&cID=10812&pID=10800	2022/07/10	0	2022-10-08 01:27:51	2022-10-08 01:27:51
BK22015354	7	질문자	다양한 방향으로 관광지를 조성하고있구나. 요즘은 온라인 홍보도 중요할텐데, 온라인 쪽으로는 어떤 방법을 활용하고 있어?				0	2022-10-08 01:27:52	2022-10-08 01:27:52
BK22015354	8	전문가	진주의 관광캐릭터인 하모의 공식 유튜브 등의 전용채널을 통해 해당 드라마 촬영지를 알리고 있어. 또한, 네이버에서 해당 촬영지가 검색될 수 있도록 검색 등록 작업 역시 진행중이지. 그 외에도 드라마 속 진주 찾기 이벤트를 통해 당첨자에게 하모 쿠션이나 인형 등 관련 굿즈를 제공하면서 더 많은 관광객 유치를 위해 힘쓰고 있어.	징크스의 연인 진주 촬영지 검색 등록	https://www.busan.com/view/busan/view.php?code=2022070714484025084	2022/07/08	0	2022-10-08 01:27:52	2022-10-08 01:27:52
BK22015354	9	질문자	효과적인 방법인 것 같네. 진주에 여행가게 된다면, 드라마에 나왔던 곳들은 꼭 다 가보고 싶어. 드라마에 레일바이크도 나오던데, 진주 레일바이크의 주변 경관은 좀 어때?				0	2022-10-08 01:27:52	2022-10-08 01:27:52
BK22015354	10	전문가	진주 레일바이크를 타면 남강의 경치는 물론이고 형형색색의 꽃들도 눈에 담을 수 있어. 또한, 반환점에서는 재미있는 조형물을 만날 수도 있지. 참고로 진주 레일바이크는 경남 최초의 레일바이크이기도 해.	진주 레일바이크	http://www.kidshankook.kr/news/articleView.html?idxno=3457	2022/05/18	0	2022-10-08 01:27:52	2022-10-08 01:27:52
BK22015354	11	질문자	남강을 보며 달리면 기분이 정말 좋을 것 같다. 그럼 전국적으로 처음 생긴 레일바이크는 어느 지역이야?				0	2022-10-08 01:27:52	2022-10-08 01:27:52
BK22015354	12	전문가	우리나라에서 제일 처음 레일바이크가 생긴 지역은 강원도 정선군이야. 정선에 있는 구절리역의 아우라지역 구간에서 2005년 7월 1일에 개장했지.	정선 레일바이크 최초	http://www.kidshankook.kr/news/articleView.html?idxno=3457	2022/05/18	0	2022-10-08 01:27:52	2022-10-08 01:27:52
BK22015354	13	질문자	그렇게 예전부터 레일바이크가 있었는 줄도 몰랐네. 진주 레일바이크 탑승장에는 아이들을 위한 시설도 있다던데, 정확히 뭐가 있는 거야?				0	2022-10-08 01:27:52	2022-10-08 01:27:52
BK22015354	14	전문가	탑승장에는 자그마한 놀이동산이 마련되어 있어. 놀이기구로는 미니 바이킹과 미니 허리케인 등 총 4가지의 기구가 있지. 놀이기구를 타려면 따로 표를 구매해야해.	진주 레일바이크 놀이동산	https://www.busan.com/view/busan/view.php?code=2022051720491896176	2022/05/18	0	2022-10-08 01:27:52	2022-10-08 01:27:52
BK22015354	15	질문자	레일바이크 탑승장에 있는 놀이동산이라니, 이색적이네. 꼭 한번 가보고 싶은데, 진주 레일바이크의 위치와 이번 달 운행 시간이 어떻게 돼?				0	2022-10-08 01:27:52	2022-10-08 01:27:52
BK22015354	16	전문가	진주 레일바이크는 진주시 내동면 망경로 13번지에 위치하고, 운행 시간은 평일 오전 9시부터 오후 6시까지, 주말은 오전 9시부터 오후 7시까지야. 참고로 이 운행시간은 이번 달인 10월을 포함해 3월부터 11월까지 유지돼.	진주 레일바이크 운행 시간	https://www.busan.com/view/busan/view.php?code=2022051720491896176	2022/05/18	0	2022-10-08 01:27:52	2022-10-08 01:27:52
BK22015354	17	질문자	고마워, 그리고 진주 근처에 있는 하동군에는 국내에서 제일 긴 레일바이크 터널이 있다던데! 혹시 그 터널의 이름이 뭔지 알려줄 수 있어?				0	2022-10-08 01:27:52	2022-10-08 01:27:52
BK22015354	18	전문가	국내 레일바이크 터널 중 가장 긴 터널은 바로 이명터널이야. 이 터널의 길이는 1.28km에 달하지. 최근에는 터널 입구에 호랑이 입속으로 들어가는 모양의 조형물이 설치되었고, 조형물에서 호랑이 울음소리까지 나도록 되어있어서 더욱 즐거운 탑승이 가능해.	하동 레일바이크 이명터널	http://www.kidshankook.kr/news/articleView.html?idxno=3457	2022/05/18	0	2022-10-08 01:27:52	2022-10-08 01:27:52
BK22015354	19	질문자	거기도 특이하네, 진주 여행 가는 날 하동도 같이 들러야겠다. 오늘 알려준 정보들 전부 고마워. 여행 루트 짜는데 많은 도움이 되었어.				1	2022-10-08 01:27:52	2022-10-14 14:24:46
BK22015354	20	전문가	도움이 되었다니 다행이야, 더 질문할 일 있으면 언제든지 연락해!				0	2022-10-08 01:27:52	2022-10-08 01:27:52
