id	utterance_id	role	text	search_query	search_URL	reference_date	terminate	regDate	updDate
BK22015062	1	질문자	이번 가을에 경주 여행 계획 중이에요. 오랜만에 가는 여행이라 무척 기대가 되네요.				0	2022-10-05 22:03:07	2022-10-06 01:44:22
BK22015062	2	전문가	경주 여행 좋지요. 요즘 날씨도 좋아 바깥을 다니기도 더 좋은 것 같아요.				1	2022-10-05 22:03:14	2022-10-12 13:12:36
BK22015062	3	질문자	맞아요. 그리고 경주는 역사의 도시잖아요. 수학 여행 가듯이 역사 기행도 겸하려고 하는데, 어디 갈만한 곳이 있을까요?				0	2022-10-05 22:03:07	2022-10-12 13:12:36
BK22015062	4	전문가	불국사는 어떤가요? 한국관광공사에서는 9월 추천 가볼만한 곳의 테마로 수학여행의 재발견을 선정하며, 경주에서는 수학여행의 대표 코스였던 불국사부터 추천했어요. 예전에 수학여행 단체 사진을 찍던 청운교와 백운교는 여전히 불국사 인증 사진 장소로 인기 있는 곳이죠.	경주 가볼만한 곳 불국사	https://newsis.com/view/?id=NISX20220824_0001988512&cID=10701&pID=10700	2022/08/27	0	2022-10-05 22:03:07	2022-10-06 01:44:22
BK22015062	5	질문자	아, 생각나네요. 저도 사진 찍었었죠. 다리들 모양이 특이했었는데, 어떤 의미가 담긴 거였나요?				0	2022-10-05 22:03:07	2022-10-06 01:44:22
BK22015062	6	전문가	맞아요. 규모는 다르지만, 다리 밑이 무지개 모양인 것과 계단 형태라는 공통점이 있는 청운교와 백운교는 다리 아래 속세와 위쪽 부처 세계를 이어준다는 의미를 담고 있죠. 청운교는 웅장함이, 백운교는 섬세함 돋보이는 다리로 전체 34 계단이에요.	경주 불국사 청운교 백운교	https://www.ilyosisa.co.kr/news/article.html?no=236529	2022/09/26	0	2022-10-05 22:03:07	2022-10-06 15:17:22
BK22015062	7	질문자	아하, 그렇군요. 물어보지 않았으면 눈으로 구경만 할뻔 했네요. 불국사에서 또 주목해 볼 것은 뭐가 있지요?				0	2022-10-05 22:03:07	2022-10-05 23:19:31
BK22015062	8	전문가	대웅전 뜰에는 석탑이자 국보인 다보탑과 삼층석탑이 있죠. 두 탑 모두 우리나라를 대표하는 탑으로 동쪽의 다보탑은 특수형 탑이고, 서쪽의 석가탑은 일반형의 석탑이에요. 일제강점기를 지나며 다보탑의 사리와 사리장치가 사라지고, 기단 돌계단 위에 놓여 있던 네 개의 돌사자도 하나만 남게 됐지만, 석가탑에서 발견된 유물은 2018년 개관한 불국사박물관에서 만날 수 있어요.	경주 가볼만한 곳 불국사	https://newsis.com/view/?id=NISX20220824_0001988512&cID=10701&pID=10700	2022/08/27	0	2022-10-05 22:03:07	2022-10-06 01:44:22
BK22015062	9	질문자	아, 그런 탑들이 있었죠! 예전부터 궁금했던 건데요, 모양도 형식도 다른 두 탑이 한 자리에 배치된 이유도 있나요?				0	2022-10-05 22:03:07	2022-10-06 15:17:22
BK22015062	10	전문가	법화경 견보탑품에 따르면 석가탑은 현재의 부처인 석가여래의 설법 내용을 표현하고, 다보탑은 과거의 부처인 다보여래가 불법을 증명하는 것을 상징해 다보여래가 머무는 환상적인 궁전과 같은 의미를 갖죠. 다보여래와 석가여래가 한 쌍을 이루기 때문에 다보탑과 석가탑 역시 한 쌍으로 함께 있는 거에요.	불국사 석가탑 다보탑 관계	https://shindonga.donga.com/3/all/13/1750417/1	2019/06/07	0	2022-10-05 22:03:07	2022-10-06 04:22:51
BK22015062	11	질문자	그런 의미가 있는 줄 전혀 몰랐어요. 그리고 제가 절에 대해서는 잘 몰라서 그런데 대웅전이라는 곳은 어떤 곳인가요?				0	2022-10-05 22:03:07	2022-10-06 04:22:51
BK22015062	12	전문가	대웅전은 불교 사찰에 설치되는 전당으로 대웅보전이라고도 불려요. 현세불인 석가모니를 모시는 곳으로, 불상을 모실 뿐 아니라 예불과 불공, 기도, 법요 등 불교의 주요 의식과 신앙 행위가 이뤄지는 장소이기도 하죠. 대웅이라는 명칭은 법화경에서 석가모니를 위대한 영웅이라고 가리켜 이른 것에서 유래됐어요. 사찰의 중심이 되는 건물이며, 가장 중요한 곳으로 취급되죠.	대웅전	https://ko.wikipedia.org/wiki/%EB%8C%80%EC%9B%85%EC%A0%84	2022/02/21	0	2022-10-05 22:03:07	2022-10-06 01:28:46
BK22015062	13	질문자	아 그렇군요. 그리고 불국사 옆에는 석굴암이 있잖아요. 어릴 때 보면서 이곳은 어떻게 지었을까 그런 생각을 했었는데, 혹시 석굴암의 건축에 대해서도 아시나요?				0	2022-10-05 22:03:07	2022-10-06 01:44:22
BK22015062	14	전문가	네, 석굴암은 인도나 중국에서 사용하던 채굴기법이 아닌, 축조기법을 사용해 지어졌어요. 암석지대에 굴을 파내는 방식이 아니라, 돌을 가공하고 조립해 실을 만들고 그 위에 흙을 덮는 방법으로 지어진 것이죠. 이와 같은 석굴사원은 세계에서 유례를 찾아보기 힘든 매우 희귀한 사례에요. 바닥부터 천장까지 모든 부자재를 짜맞춰야 하기 때문에 구조적으로 완벽해야만 가능한 공사였지요. 또한 석굴암은 먼저 불상을 안치하고 나중에 석굴을 완성했는데, 천장을 돔 구조로 지어서 구조적으로 안전하도록 했죠.	경주 불국사 석굴암 양식	https://www.nongmin.com/plan/PLN/SRS/296140/view	2018/08/09	0	2022-10-05 22:03:07	2022-10-06 15:17:22
BK22015062	15	질문자	그 옛날에 어떻게 그런 완벽한 공사를 할 수 있었는지 정말 신기해요. 그런데 신라 사람들은 그런 거대한 석굴암을 왜 그곳에 지었나요?				0	2022-10-05 22:03:07	2022-10-06 01:44:22
BK22015062	16	전문가	신라는 왜의 침입으로 고통받았지만, 토함산은 경주의 전략적 요충지로 신라가 동해에 그대로 노출되는 위험을 막아주는 산이었어요. 불국사는 바로 그러한 토함산의 서쪽 기슭에 세워져 남쪽을 향해 있고, 동쪽 산마루에는 석굴암이 동남쪽 바다를 바라보며 있는 것이지요. 사중기와 향전의 기록으로 보아 불국사는 현세 김 씨 왕족의 영화를 위해 지어졌고, 석불사는 역대 김 씨 왕가 선조들의 극락왕생을 기원하는 목적으로 지어진 것으로 볼 수 있어요.	경주 불국사 석굴암 본존불 토함산	https://www.mk.co.kr/opinion/columnists/view/2020/10/1078844/	2020/10/21	0	2022-10-05 22:03:07	2022-10-06 01:44:22
BK22015062	17	질문자	다 목적이 있었군요. 애들에게 잘 설명해 주어야겠어요. 불국사 외에 경주 역사 기행에서 또 가봐야 할 곳은 어디일까요?				0	2022-10-05 22:03:07	2022-10-06 01:44:22
BK22015062	18	전문가	국립경주박물관은 놓쳐서는 안될 곳이죠. 신라의 천년 역사와 문화 유산을 한 눈에 볼 수 있는 곳으로 금관총, 황남대총, 천마총에서 발견된 다수의 국보와 보물급 유물을 볼 수 있어요. 또 신라 시대 고분군 대릉원에서는 내부 관람이 가능한 천마총과 거대한 쌍분인 황남대총을 꼭 찾아보세요. 그리고 선덕 여왕 재위시 건축된 것으로 추정하는 야경이 신비로운 첨성대도 잊지 마세요.	경주 가볼만한 곳 국립경주박물관	http://www.discoverynews.kr/news/articleView.html?idxno=873751	2022/09/08	0	2022-10-05 22:03:07	2022-10-06 01:28:46
BK22015062	19	질문자	경주는 역사 기행으로 볼 곳이 많다는 생각이 새삼 드네요. 많은 도움이 되었어요. 다음에 만날 때는 경주 맛집도 좀 추천해주세요, 잘 지내고 또 봐요.				0	2022-10-05 22:03:07	2022-10-05 23:19:31
BK22015062	20	전문가	네, 그래요. 경주 나들이도 하시고, 즐거운 역사 기행도 되길 바래요. 건강 조심하시고, 다음에 만나요.				0	2022-10-05 22:03:07	2022-10-12 13:12:36
