id	utterance_id	role	text	search_query	search_URL	reference_date	terminate	regDate	updDate
BK22005481	1	질문자	요즘 텔레비전에서 해주는 골프 경기를 자주 보는데 너무 재미있더라.				0	2022-08-14 13:35:24	2022-08-14 13:35:24
BK22005481	2	전문가	나도 골프를 자주 쳐서 텔레비전으로 골프 경기도 자주 봐.				0	2022-08-14 13:35:24	2022-08-25 12:41:29
BK22005481	3	질문자	그렇구나, 그런데 내가 골프 규칙을 잘 몰라서 그런지 보면서 좀 이해가 안 되더라고. 한 가지 궁금한 게 있는데 골프는 심판이 어디에 있어?				0	2022-08-14 13:35:24	2022-08-25 12:41:29
BK22005481	4	전문가	골프는 유일하게 심판이 없는 스포츠야. 대신 경기위원이라는 사람이 있는데, 보통 규칙에 대한 질문에 답을 주거나 규칙을 적용할 것인지를 놓고 의견 차이가 있을 때 해결해주는 역할을 해.	골프 심판	https://www.chosun.com/sports/golf/2022/07/28/XV35G5IQLNEYRIUBPJN2QHR2BY/	2022/07/28	0	2022-08-14 13:35:44	2022-08-14 13:35:44
BK22005481	5	질문자	심판이 없는 스포츠도 있구나. 그러면 골프는 몇 명이 하는 스포츠야?				0	2022-08-14 13:35:44	2022-08-25 12:41:29
BK22005481	6	전문가	일단 골프는 혼자서 할 수 없어. 전문 선수들도 2명이나 3명이 한 팀으로 경기를 하고, 아마추어들은 보통 4명이 경기를 해.	골프	https://www.golfjournal.co.kr/news/articleView.html?idxno=3510	2022/04/01	0	2022-08-14 13:35:44	2022-08-25 12:41:29
BK22005481	7	질문자	그렇구나, 그러면 골프공이랑 관련된 규칙도 있어?				0	2022-08-14 13:35:44	2022-08-14 13:35:44
BK22005481	8	전문가	응, 골프대회에서는 보통 경기를 시작하기 전에 골프공의 브랜드랑 개수를 상대편 선수랑 캐디한테 말해줘야 하고, 동반 플레이어의 공으로 경기를 하지 않도록 신경 써야해.	골프공	https://www.golfjournal.co.kr/news/articleView.html?idxno=3412	2022/01/20	0	2022-08-14 13:35:44	2022-08-25 12:41:29
BK22005481	9	질문자	공도 세세하게 신경 써서 경기를 해야 하는구나. 그러면 골프채와 관련된 규칙도 있어?				0	2022-08-14 13:35:44	2022-08-25 12:41:29
BK22005481	10	전문가	응, 골프 경기에서 쓸 수 있는 골프채는 최대 14개이고, 최소한 몇 개는 사용해야 한다는 규칙은 없어.	골프채	http://www.kookje.co.kr/news2011/asp/newsbody.asp?code=0200&key=20140527.22019192700	2014/05/26	0	2022-08-14 13:35:44	2022-08-25 12:41:29
BK22005481	11	질문자	아, 14개나 쓸 수 있구나. 그런데 홀인원이라는 건 뭐야?				0	2022-08-14 13:35:44	2022-08-21 17:24:48
BK22005481	12	전문가	골프랑 친숙하지 않은 사람도 아는 홀인원은 공을 한 번에 홀컵에 넣는 건데, 가장 높게 쳐주는 건 파3홀에서 홀인원을 했을 때고, 아마추어 선수들이 홀인원을 하는 경우는 많지 않지.	골프 홀인원	https://www.ftimes.kr/news/articleView.html?idxno=12264	2021/08/29	0	2022-08-14 13:35:44	2022-08-14 13:35:44
BK22005481	13	질문자	홀인원은 정말 하기 어려운 거 같아. 그리고 티업이랑 티오프는 어떻게 달라?				0	2022-08-14 13:35:44	2022-08-14 13:35:44
BK22005481	14	전문가	볼을 치려고 티에 공을 두는 건 티업이고, 클럽으로 친 볼이 티에서 벗어나는 상태는 티오프라고 해.	골프  티업	https://www.mk.co.kr/premium/life/view/2020/06/28499/	2020/06/13	0	2022-08-14 13:35:44	2022-08-14 13:35:44
BK22005481	15	질문자	아, 그렇게 다른 단어였구나. 그런데 골프의 갤러리라는 말은 어디서 나온 거야?				0	2022-08-14 13:35:44	2022-08-25 12:41:29
BK22005481	16	전문가	골프가 요즘은 대중화가 됐지만 옛날에는 상류층만 할 수 있는 고급 취미 생활이었어. 그런데 이 상류층들이 골프 대회를 관람하는 게 극장이나 미술관에서 작품을 보는 것하고 유사해서 갤러리라는 말이 나왔지.	골프 갤러리	http://www.ohmynews.com/NWS_Web/View/at_pg.aspx?CNTN_CD=A0002767365	2021/08/19	0	2022-08-14 13:35:44	2022-08-25 12:41:29
BK22005481	17	질문자	그런 배경 스토리가 있었구나. 그런데 골프 하다가 다칠 수도 있지?				0	2022-08-14 13:35:44	2022-08-14 13:35:44
BK22005481	18	전문가	그렇지, 어깨의 관절 주위에 있는 4개의 힘줄이 회전근개인데, 골프를 하면 보통 회전근개파열을 겪을 수 있어.	골프 부상	https://health.chosun.com/site/data/html_dir/2022/03/22/2022032201514.html	2022/03/22	0	2022-08-14 13:35:44	2022-08-25 12:41:29
BK22005481	19	질문자	역시 어깨를 쓰는 운동이어서 어깨 부상 위험이 있구나.				0	2022-08-14 13:35:44	2022-08-14 13:35:44
BK22005481	20	전문가	응, 아무래도 스포츠는 부상 위험이 늘 있는 거 같아.				0	2022-08-14 13:35:44	2022-08-14 13:35:44
BK22005481	21	질문자	고마워, 덕분에 오늘 골프에 대해서 많은 것을 알게 됐어.				0	2022-08-14 13:35:44	2022-08-25 12:41:29
BK22005481	22	전문가	도움이 되었다니 정말 다행이야. 집에 조심히 가고 다음에 보자.				1	2022-08-14 13:35:44	2022-08-25 12:41:29
