id	utterance_id	role	text	search_query	search_URL	reference_date	terminate	regDate	updDate
BK22015796	1	질문자	최근 사격에 관심이 생기게 되었어. 그래서 지난 세계 사격 선수권대회나 올림픽을 다시 보려고 하는데 보기 전에 공부를 좀 해야 할 것 같아. 혹시 시간 괜찮으면 도와줄래?				0	2022-10-12 13:35:16	2022-10-12 13:35:16
BK22015796	2	전문가	나도 사격이라는 스포츠를 좋아해서 모든 경기를 챙겨보고 있어! 궁금한게 있으면 얼마든지 물어봐!				0	2022-10-12 13:35:21	2022-10-12 13:35:21
BK22015796	3	질문자	국제식 사격이라는 말을 들어 봤는데 어떤 것을 가리키니?				0	2022-10-12 13:35:16	2022-10-12 13:35:16
BK22015796	4	전문가	국제사격연맹이 제정한 규칙에 따라 진행되는 사격 경기를 국제식 사격이라고 하는데, 올림픽에서의 사격 경기도 국제사격연맹의 규칙에 따라 진행되는 만큼 국제식 사격이 세계적으로 가장 보편화되어있는 스포츠 사격 형태지. 우리나라에서 스포츠 종목으로 사격이라고 한다면 국제식 사격을 가리킨다고 보면 돼. 국제식 사격의 시초는 군사적 목적의 사격술과 관련이 있지만 정밀성과 스포츠로서 보급의 용이성을 중심으로 발전을 해왔기 때문에 오늘날 국제적 사격은 군대에서의 실전성은 덜 강조되고 외형적으로도 군대의 사격과 많이 달라졌지. 국제식 사격에 사용되는 사용되는 총기도 비교적 위력이 약한 공기총이나 22구경 소총 같은 총기가 주류가 되었어.	국제식사격	https://ko.wikipedia.org/wiki/%EA%B5%AD%EC%A0%9C%EC%8B%9D_%EC%82%AC%EA%B2%A9	2022/04/10	0	2022-10-12 13:35:21	2022-10-15 16:39:51
BK22015796	5	질문자	올림픽에서 하는 사격이 국제식 사격이구나! 이 스포츠를 이해하기 위해서는 총에 대해서도 먼저 알아야 할 것 같아. 소총이란 어떤 건지 가르쳐줄래?				0	2022-10-12 13:35:21	2022-10-15 16:39:51
BK22015796	6	전문가	라이플이라고도하는 소총은 총열 내부에 나선형의 강선이 파여 있고 어깨에 견착해서 사용하는 화기를 가리켜. 사실 원래 라이플은 강선만 가리키고 강선소총은 라이플드 건이라고 했지. 탄알이 총열을 떠나는 순간, 탄알은 회전하며 날아가는데 이 회전은 안정성을 유지시켜주고 요동을 막아주어 뾰족한 탄알을 머스킷에서 사용되던 둥근 탄환 대신 사용할 수 있게 되었지. 이 덕분에 라이플은 머스킷 보다 뛰어난 사정거리와 명중률을 가지게 되었어.	소총	https://ko.wikipedia.org/wiki/%EC%86%8C%EC%B4%9D	2022/04/11	0	2022-10-12 13:35:21	2022-10-15 16:39:51
BK22015796	7	질문자	주로 영화 속 첩보요원들이 들고 다니는 총을 가리켜 권총이라고 하던데 권총은 어떤 총기를 말하는 건지 구체적으로 알려줄래?				0	2022-10-12 13:35:21	2022-10-12 13:35:21
BK22015796	8	전문가	권총은 한 손 또는 두 손으로 다룰 수 있는 개인용 소화기를 가리키는데 들고 사용 하기 때문에 개머리판이 없고 다른 총기류보다 상대적으로 크기가 작지. 
