id	utterance_id	role	text	search_query	search_URL	reference_date	terminate	regDate	updDate
BK22016290	1	질문자	저희 아빠는 월드컵이랑 올림픽 경기를 보는 재미로 산다고 하셨어요. 그 대회들이 그렇게 재밌어요?				0	2022-10-17 09:42:33	2022-10-20 10:40:00
BK22016290	2	전문가	좋아하는 사람들은 굉장히 좋아하지! 나도 올림픽, 월드컵 두 대회 모두 좋아한단다.				0	2022-10-17 09:42:33	2022-10-17 10:15:38
BK22016290	3	질문자	음, 그럼 저도 다음부터는 아빠 옆에서 같이 봐야겠어요. 근데, 월드컵이랑 올림픽은 뭐가 달라요?				0	2022-10-17 09:42:33	2022-10-17 10:15:38
BK22016290	4	전문가	올림픽은 세계적인 종합 스포츠 대회 중 하나인데, 월드컵은 단일 종목 대회란다. 월드컵은 축구 국제 기구인 FIFA에 가맹한 축구 연맹의 남자 축구 국가대표팀만 참가하는 국제 축구 대회거든. 또, 올림픽은 고대 그리스의 전통을 이어받아 하나의 도시를 중심으로 열리지만, 월드컵은 하나의 국가를 중심으로 개최돼. 대회 기간도 다르지! 올림픽은 대개 2주 동안 열리는데, 월드컵은 1개월 정도 진행돼.	월드컵 올림픽	https://ko.wikipedia.org/wiki/FIFA_%EC%9B%94%EB%93%9C%EC%BB%B5	2022/10/12	0	2022-10-17 09:42:33	2022-10-17 10:15:38
BK22016290	5	질문자	완전히 다른 대회였네요. 저는 친구들이랑 밖에서 공놀이 하는 걸 좋아하는데, 월드컵이 축구 대회면 공놀이 하는 걸 볼 수 있겠네요? 월드컵 대회는 어떻게 진행돼요?				0	2022-10-17 09:42:33	2022-10-17 10:15:38
BK22016290	6	전문가	우선 예선과 본선 무대 두 부분으로 나뉘어. 본선에 진출할 32팀을 가려내기 위한 경기가 예선 무대인데, 본선보다 3년 앞서 시작한단다. 그리고 본선에서는 1개월 내외의 기간 동안 개최국 경기장에서 우승을 두고 32팀이 경쟁하게 되지.	FIFA 월드컵 진행 방식	https://ko.wikipedia.org/wiki/FIFA_%EC%9B%94%EB%93%9C%EC%BB%B5	2022/10/12	0	2022-10-17 09:42:33	2022-10-20 10:40:01
BK22016290	7	질문자	그럼 지금 아빠가 보고 계시던 건 예선 경기였나 봐요! 아빠가 여기서 이겨야 본선에 간다라고 하셨거든요. 그럼, 지금까지 월드컵 대회에서 제일 우승 많이 한 나라는 어느 나라예요?				0	2022-10-17 09:42:33	2022-10-17 10:15:38
BK22016290	8	전문가	지금껏 총 20번 대회가 개최됐고, 우승국은 8팀이었지. 제일 우승을 많이 한 팀은 브라질인데, 5번이나 우승컵을 손에 쥐었어. 그다음은 독일과 이탈리아가 4번, 또 그다음은 초대 우승팀인 우루과이랑 아르헨티나, 프랑스가 각각 2번씩, 마지막은 스페인과 잉글랜드가 각각 1번씩 우승을 차지했단다.	월드컵 우승 국가	https://ko.wikipedia.org/wiki/FIFA_%EC%9B%94%EB%93%9C%EC%BB%B5	2022/10/12	0	2022-10-17 09:42:33	2022-10-17 10:15:38
BK22016290	9	질문자	우아, 브라질이 축구 엄청 잘하나 봐요! 참, 우리 아빠가 그러는데 월드컵에서 우승하면 트로피를 준댔어요. 월드컵에서 우승한 나라한테 주는 트로피는 어떻게 생겼어요?				0	2022-10-17 09:42:33	2022-10-17 10:24:15
BK22016290	10	전문가	현재 FIFA컵으로 알려진 새 트로피는 1970년 이후에 디자인됐어. 18캐럿 금으로 만들어졌는데, 높이는 36cm이고 무게는 6.175kg이야. 기본 바탕에 준보석의 공작석 2층을 더했고, 트로피 아래쪽에는 1974년 이후부터의 월드컵 우승국과 연도를 새길 수 있게 되어 있단다. 지금 이 트로피는 우승 국가명이 장식판에 가득 채워질 2038년까지 사용되고, 그 이후에는 또 다른 세 번째 트로피를 제작할 예정이야.	월드컵 트로피 제작	https://ko.wikipedia.org/wiki/FIFA_%EC%9B%94%EB%93%9C%EC%BB%B5	2022/10/12	0	2022-10-17 09:42:33	2022-10-17 10:24:15
BK22016290	11	질문자	2038년이면 저도 어른이겠네요! 어른이 되면 저도 축구를 배워보고 싶어요.				0	2022-10-17 09:42:33	2022-10-17 10:32:18
BK22016290	12	전문가	하하, 축구는 어른이 되기 전에도 배울 수 있어. 축구가 정말 하고 싶으면 아빠한테 한번 말해 보렴.				0	2022-10-17 09:42:33	2022-10-17 10:32:18
BK22016290	13	질문자	네, 그럴게요. 근데 아까 월드컵은 예선이랑 본선이 있다고 하셨잖아요. 예선이라는 건 어떤 식으로 진행돼요?				0	2022-10-17 09:42:33	2022-10-17 10:32:18
BK22016290	14	전문가	예선 경기는 남미부터 북중미카리브, 아프리카, 아시아, 오세아니아, 유럽까지 총 6개의 FIFA 대륙 연맹별로 나뉘어서 치러져. 각 대륙의 연맹들이 대회를 관장하고. FIFA는 매번 대회가 시작되기 전에 대륙 연맹간의 실력 차이에 따라서 각 대륙별로 참가팀 숫자를 배분하는데, 이때 월드컵 개최국은 자동으로 본선에 출전하게 된단다. 다른 스포츠들과는 다르게 대륙 연맹별로 치러지는 선수권 대회의 성적이나 이전 월드컵 대회의 성적은 따로 반영되지 않아. 2006년 월드컵 이후부터는 지난번 대회에서 우승한 팀의 자동 출전권도 폐지됐고.	FIFA 월드컵 예선 방식	https://ko.wikipedia.org/wiki/FIFA_%EC%9B%94%EB%93%9C%EC%BB%B5_%EC%98%88%EC%84%A0	2022/07/31	0	2022-10-17 09:42:33	2022-10-17 10:32:18
BK22016290	15	질문자	음, 개최국들은 자동으로 본선에 갈 수 있으니까 월드컵 개최국이 되면 좋은 점이 많겠어요. 그럼 월드컵 본선은 어떻게 진행되는데요?				0	2022-10-17 09:42:33	2022-10-17 10:36:56
BK22016290	16	전문가	현재 월드컵 본선은 한 달 동안 32개 팀이 특정 개최국에서 대회를 치르는데, 2개의 라운드로 이루어져 있어. 조별 리그전이랑 토너먼트전, 이렇게 두 가지지. 참, 본선 대회 약 7개월 전에는 조추첨을 해서 조를 배정한단다.	FIFA 월드컵 본선 방식	https://ko.wikipedia.org/wiki/FIFA_%EC%9B%94%EB%93%9C%EC%BB%B5	2022/10/12	0	2022-10-17 09:42:33	2022-10-17 10:36:56
BK22016290	17	질문자	조추첨이요? 본선 경기 전에 조추첨은 어떤 식으로 하는데요?				0	2022-10-17 09:42:33	2022-10-17 10:36:57
BK22016290	18	전문가	조추첨에서 가장 먼저 하는 일은, FIFA 랭킹이랑 월드컵 랭킹을 고려한 랭킹 상위팀과 개최국을 합쳐 8개팀을 가려내고, 1번 시드부터 8번 시드까지 나누는 거야. 그다음 지역별 안배에 따라 포트라고 칭하는 추첨함에서 이뤄지는 추첨으로 8개조, 32팀이 각각 구성되지. 조추첨을 할 때 톱시드로 배정된 국가들은 모두 강력한 팀인데, 이들을 미리 구분함으로써 강팀간의 대결을 피할 수 있단다.	FIFA 월드컵 조추첨	http://www.maniareport.com/view.php?ud=2021040408005484625e8e941087_19	2021/04/04	0	2022-10-17 09:42:33	2022-10-20 10:40:01
BK22016290	19	질문자	맞아요, 게임에서도 처음부터 보스 몬스터끼리 맞붙으면 재미 없으니까요! 아, 저 또 궁금한 거 있어요. 전 공놀이할 때 헤딩골을 잘 넣는데, 월드컵에서 헤딩골을 제일 많이 넣은 축구선수는 누구예요?				0	2022-10-17 09:42:33	2022-10-17 10:48:59
BK22016290	20	전문가	하하, 네가 헤딩골을 잘 넣는구나? 월드컵 역사상 헤딩골을 제일 많이 넣은 선수는 독일의 미로슬라프 클로제란다. 2022년 대회 조별리그에서 사우디아라비아를 상대로 오직 헤딩 하나만으로 헤트트릭을 성공시켰고, 그 대회에서만 총 5번의 헤딩골을 터트렸어. 그리고 현재까지 이 클로제 선수가 월드컵에서 헤딩으로 넣은 골은 총 8개야.	월드컵 헤딩골 최다 선수	https://ko.wikipedia.org/wiki/FIFA_%EC%9B%94%EB%93%9C%EC%BB%B5#%ED%86%B1%EC%8B%9C%EB%93%9C_%ED%8E%B8%EC%84%B1	2022/10/12	0	2022-10-17 09:42:33	2022-10-17 10:48:59
BK22016290	21	질문자	와, 완전 멋있어요. 저도 헤딩골로 월드컵 경기에서 우승하고 싶어요. 그럼 되게 멋있겠죠?				0	2022-10-17 10:15:38	2022-10-17 10:48:59
BK22016290	22	전문가	하하, 그럼 정말 멋있겠지! 참, 5시까지는 집에 돌아가야 한댔지? 이제 슬슬 집에 데려다 줄까?				0	2022-10-17 10:15:38	2022-10-17 10:48:59
BK22016290	23	질문자	근데 저 혼자 갈 수 있어요! 여기서 집 가는 길도 다 알아서요. 근데 저 다음에 또 놀러와도 되죠?				0	2022-10-17 10:32:18	2022-10-17 10:48:59
BK22016290	24	전문가	그래, 심심하면 얼마든지 놀러오렴. 차 조심해서 가고, 또 보자.				0	2022-10-17 10:32:18	2022-10-17 10:48:59
BK22016290	25	질문자	네, 또 놀러 올게요!				1	2022-10-17 10:48:59	2022-10-20 10:40:01
