id	utterance_id	role	text	search_query	search_URL	reference_date	terminate	regDate	updDate
BK22011739	1	질문자	스노보드는 언제부터 올림픽 종목이 된 거죠? 어제 우연히 경기를 봤는데 놀이 같기도 하고 긴장감이 덜해서 스포츠라고 부르는 게 오히려 신기했어요!				0	2022-09-26 14:57:20	2022-09-26 14:57:20
BK22011739	2	전문가	스노보드는 1998년에 열린 일본 나가노 동계올림픽 때부터 정식 종목으로 선정되었어요. 참고로, 1960년대에 미국 산악지방에서 처음 시작되었는데, 즐기는 사람들이 늘면서 대중적인 스포츠로 자리 잡았죠. 겨울에 타는 서핑이라고 불리기도 하고요.	스노보드의 시작	https://www.newsis.com/view/?id=NISX20220116_0001725991	2022/01/17	0	2022-09-26 14:57:20	2022-09-26 14:57:20
BK22011739	3	질문자	오, 겨울에 타는 서핑이라니 너무 딱이네요! 이번 베이징올림픽에는 종목이 몇 가지인가요?				0	2022-09-26 14:57:20	2022-09-26 14:57:20
BK22011739	4	전문가	2022 베이징 동계올림픽에서 스노보드는 평행대회전 남녀 부문과 하프파이프 남녀 부문, 스노보드 크로스 남녀 부문, 빅에어 남녀 부문, 슬로프스타일 남녀 부문, 혼성 단체전 등이 열려요. 여기에 걸린 금메달 수만 해도 총 11개죠.	베이징동계올림픽 스노보드 종목	https://www.newsis.com/view/?id=NISX20220116_0001725991	2022/01/17	0	2022-09-26 14:57:20	2022-09-26 14:57:20
BK22011739	5	질문자	와, 생각보다 종목이 다양하네요! 이름만 들어서는 무슨 경긴지 모르겠는데, 하나씩 설명해주실 수 있나요?				0	2022-09-26 14:57:20	2022-09-26 14:57:20
BK22011739	6	전문가	그럼요! 일단 평행대회전은 선수 두 명이 평행으로 설치된 기문 코스 두 개를 동시에 출발해서 빨리 내려오는 순서로 승자를 가리는 경기예요.	평행대회전 경기	https://www.newsis.com/view/?id=NISX20220116_0001725991	2022/01/17	0	2022-09-26 14:57:20	2022-09-26 14:57:20
BK22011739	7	질문자	오, 뭔가 상당히 간단해 보이네요. 하프파이프 경기는 어떤 방식이에요?				0	2022-09-26 14:57:20	2022-09-26 14:57:20
BK22011739	8	전문가	하프파이프는 파이프를 반으로 자른 반원통형 모양의 기울어진 슬로프를 내려오며 점프나 회전 같은 공중 연기를 펼치는 경기예요. 심판들이 높이와 회전, 테크닉, 난이도 등을 채점하죠.	하프파이프 경기	https://www.newsis.com/view/?id=NISX20220116_0001725991	2022/01/17	0	2022-09-26 14:57:20	2022-09-26 14:57:20
BK22011739	9	질문자	오, 기술을 선보이는 경기가 있었군요. 그럼 스노보드 크로스는 어때요?				0	2022-09-26 14:57:20	2022-09-26 14:57:20
BK22011739	10	전문가	스노보드 크로스 경기는 4~6명의 선수들이 한 조를 이뤄서, 뱅크나 롤러, 스파인, 점프 같은 여러 지형지물로 형성된 코스를 경주해요. 결승선을 통과한 순서대로 순위를 정하고요.	스노보드 크로스 경기	https://www.newsis.com/view/?id=NISX20220116_0001725991	2022/01/17	0	2022-09-26 14:57:20	2022-09-26 14:57:20
BK22011739	11	질문자	왠지 엄청 다이나믹한 경기일 것 같네요. 빅에어도 이름만 봐서는 기술이 들어가는 경기일 것 같은데 맞나요?				0	2022-09-26 14:57:20	2022-09-26 14:57:20
BK22011739	12	전문가	맞아요, 빅에어 경기는 큰 점프대 1개에서 도약해 플립이나 회전 같은 공중묘기를 선보이는 방식이에요. 좋은 점수를 받으려면 도약을 힘 있게 해서 공중묘기 자세와 비거리, 안정적인 착지가 잘 이뤄져야 하죠.	빅에어 경기	https://www.newsis.com/view/?id=NISX20220116_0001725991	2022/01/17	0	2022-09-26 14:57:20	2022-10-05 09:15:44
BK22011739	13	질문자	와, 엄청 멋있는 경기일 것 같아요. 그럼 마지막으로 슬로프스타일은 어떤 경기죠?				0	2022-09-26 14:57:20	2022-09-26 14:57:20
BK22011739	14	전문가	슬로프스타일 경기는 레일, 테이블, 박스, 월 같은 여러 기물들과 점프대로 구성되어 있는 코스에서 열려요.	슬로프스타일 경기	https://www.newsis.com/view/?id=NISX20220116_0001725991	2022/01/17	0	2022-09-26 14:57:20	2022-09-26 14:57:20
BK22011739	15	질문자	여러 종목이 복합적으로 섞인 것 같네요. 듣다 보니 스노보드 강국이 어딜지 궁금해지는데 어느 나라가 제일 잘해요?				0	2022-09-26 14:57:20	2022-09-26 14:57:20
BK22011739	16	전문가	올림픽에서 스노보드로 제일 성공한 나라는 미국이에요. 그간 딴 메달 수만 해도 31개죠. 2위인 스위스가 13개를 땄으니 한참 앞선 셈이죠? 게다가 미국의 숀 화이트 선수는 스노보드의 황제라고 불리는데 하프파이프 경기에서만 금메달을 3번이나 땄어요.	스노보드 강국 미국	https://www.newsis.com/view/?id=NISX20220116_0001725991	2022/01/17	0	2022-09-26 14:57:20	2022-10-05 09:15:44
BK22011739	17	질문자	와, 미국이 정말 강하네요. 자유로운 이미지랑도 잘 어울리고요!				0	2022-09-26 14:57:20	2022-09-26 14:57:20
BK22011739	18	전문가	그러게요, 궁금이님 말을 듣고 보니 미국이랑 잘 어울리네요.				0	2022-09-26 14:57:20	2022-09-26 14:57:20
BK22011739	19	질문자	이야기를 듣다 보니 경기별로 한번씩 다 보고 싶네요. 전문가님 덕분에 좋은 정보를 알았네요, 감사해요!				0	2022-09-26 14:57:20	2022-09-26 14:57:20
BK22011739	20	전문가	별 말씀을요, 도움이 되었다면 다행이죠! 그럼, 스노보드 경기 재밌게 관람해요!				1	2022-09-26 14:57:20	2022-10-05 09:15:44
