id	utterance_id	role	text	search_query	search_URL	reference_date	terminate	regDate	updDate
BK22016409	1	질문자	안녕하세요, 요즘 뭐하고 지내세요?				0	2022-10-18 23:13:04	2022-10-18 23:13:04
BK22016409	2	전문가	저는 일을 하면서 취미로 축구 경기를 자주 챙겨보고 있어요.				0	2022-10-18 23:13:04	2022-10-18 23:13:04
BK22016409	3	질문자	축구에 관심이 많으시군요, 저도 그래요. 그럼 혹시 월드컵 평가전 선수 명단이 언제쯤 발표될 지 알고 계시나요?				0	2022-10-18 23:13:04	2022-10-18 23:13:04
BK22016409	4	전문가	오늘 대한축구협회에서 발표한 기사를 보면, 파울루 벤투 감독은 오는 21일 오전 중에 11월에 있을 국내 평가전에 나설 축구대표팀 소집 명단을 발표할 예정이에요.	평가전 명단	https://news.mt.co.kr/mtview.php?no=2022101815511647564	2022/10/18	0	2022-10-18 23:13:04	2022-10-18 23:13:04
BK22016409	5	질문자	그렇군요, 그럼 소집된 선수들은 향후에 어떤 일정을 소화하게 되나요?				0	2022-10-18 23:13:04	2022-10-18 23:13:04
BK22016409	6	전문가	평가전에 나서는 선수들 일정은 일단 파주 축구국가대표트레이닝센터에 소집될 계획이에요.	평가전 소집	https://dailian.co.kr/news/view/1163650	2022/10/18	0	2022-10-18 23:13:04	2022-10-20 15:55:43
BK22016409	7	질문자	일단 파주에서 먼저 소집을 하는군요. 그럼 최종적으로 대표팀으로 선발된 후의 출국 일정은 어떻게 되나요?				0	2022-10-18 23:13:04	2022-10-18 23:13:04
BK22016409	8	전문가	일단 최종 대표팀 명단은 11월12일에 발표되고, 14일 오전 0시25분에 QR859편을 통해 카타르로 출국할 예정이에요.	월드컵 대표팀 출국	https://star.mt.co.kr/stview.php?no=2022101816201117757	2022/10/18	0	2022-10-18 23:13:04	2022-10-18 23:13:04
BK22016409	9	질문자	14일에 카타르로 떠나는 일정이군요. 그럼 그 전에 국내에서 마지막 평가전에 대한 정보는 알고 계시는 게 있나요?				0	2022-10-18 23:13:04	2022-10-18 23:13:04
BK22016409	10	전문가	대표팀은 11월 11일에 국내에서의 마지막 평가전을 치를 계획이에요. 출정식이 될 이 경기의 상대 국가는 아직 정해지지 않았지만, 유럽 국가가 될 가능성이 높아요.	월드컵 국내 평가전	http://www.dailysportshankook.co.kr/news/articleView.html?idxno=265387	2022/10/18	0	2022-10-18 23:13:04	2022-10-18 23:13:04
BK22016409	11	질문자	그렇군요, 그럼 출국 전 경기에 해외에서 뛰는 선수들도 참여를 하나요?				0	2022-10-18 23:13:04	2022-10-18 23:13:04
BK22016409	12	전문가	음, 이 때는 피파에서 지정한 공식 A매치 기간이 아니기 때문에 아쉽게도 손흥민, 김민재, 황의조같은 해외파 선수들은 경기에 참여 하지 못해요.	평가전 해외파	https://www.goal.com/kr/%EB%89%B4%EC%8A%A4/%E1%84%87%E1%85%A6%E1%86%AB%E1%84%90%E1%85%AE%E1%84%92%E1%85%A9-%E1%84%82%E1%85%A2%E1%84%83%E1%85%A1%E1%86%AF-11%E1%84%8B%E1%85%B5%E1%86%AF-%E1%84%8E%E1%85%AE%E1%86%AF%E1%84%8C%E1%85%A5%E1%86%BC%E1%84%89%E1%85%B5%E1%86%A8-%E1%84%92%E1%85%AE-%E1%84%8B%E1%85%B5%E1%84%90%E1%85%B3%E1%86%AE%E1%84%82%E1%85%A1%E1%86%AF-%E1%84%8B%E1%85%AF%E1%86%AF%E1%84%83%E1%85%B3%E1%84%8F%E1%85%A5%E1%86%B8-%E1%84%8E%E1%85%AC%E1%84%8C%E1%85%A9%E1%86%BC-%E1%84%86%E1%85%A7%E1%86%BC%E1%84%83%E1%85%A1%E1%86%AB-%E1%84%87%E1%85%A1%E1%86%AF%E1%84%91%E1%85%AD/blt3ef62937ea57960d	2022/10/18	0	2022-10-18 23:13:04	2022-10-18 23:13:04
BK22016409	13	질문자	아쉽게 됐네요, 그래도 어쩔 수 없죠. 그럼 카타르에 입국한 이후에도 예정되어 있는 평가전 일정이 있을까요?				0	2022-10-18 23:13:04	2022-10-18 23:13:04
BK22016409	14	전문가	아뇨, 카타르 입성 이후에 잡혀있는 평가전 일정은 없어요. 그래서 벤투호는 카타르 입성 후에는 열흘 정도 자체 훈련만 진행하다, 한국 시간으로 24일 오후 10시에 우루과이와 조별리그 첫 경기를 치를 예정이에요.	카타르 평가전	https://star.mt.co.kr/stview.php?no=2022101815511647564&MS2	2022/10/18	0	2022-10-18 23:13:04	2022-10-18 23:13:04
BK22016409	15	질문자	그렇군요, 그리고 제가 알기로는 월드컵 조별리그에서 가나와도 경기를 치르는데, 가나의 선수 라인업은 지금 어떻게 구성되고 있나요?				0	2022-10-18 23:13:04	2022-10-20 15:55:43
BK22016409	16	전문가	가나 축구대표팀은 공격수인 캘럼 허드슨오도이를 영입하려고 노력 중에 있어요. 다만 잉글랜드 프로축구팀인 아스널에서 뛰는 공격수인 에디 은케티아의 합류는 어려울 거란 전망이 나오고 있어요.	가나 대표팀	https://www.mk.co.kr/news/sports/view/2022/10/919992/	2022/10/18	0	2022-10-18 23:13:04	2022-10-20 15:55:43
BK22016409	17	질문자	흠, 근데 허드슨오도이는 영국에서 태어난 선수이지 않나요? 어떻게 가나의 대표팀이 될 수 있는 거죠?				0	2022-10-18 23:13:04	2022-10-18 23:13:04
BK22016409	18	전문가	허드슨오도이는 가나 출신 아버지를 두고 있어서 가나 대표팀에서도 뛸 수 있어요. 그리고 허드슨오도이는 잉글랜드 A대표팀에서 이미 3경기를 치렀는데, 피파 규정상 만 21세 미만일 때 A매치를 최대 3경기를 치른 선수까지는 국적 변경이 가능해요.	허드슨오도이 국적	https://www.hankyung.com/sports/article/202210185066Y	2022/10/18	0	2022-10-18 23:13:04	2022-10-18 23:13:04
BK22016409	19	질문자	그렇군요, 가나의 대표팀은 어떻게 구성될 지 궁금하네요. 월드컵이 시작될 때까지 계속 얘기 나눠봐요.				1	2022-10-18 23:13:04	2022-10-20 15:55:43
BK22016409	20	전문가	좋아요, 시간되실 때 언제든 연락 주세요!				0	2022-10-18 23:13:04	2022-10-18 23:13:04
