id	utterance_id	role	text	search_query	search_URL	reference_date	terminate	regDate	updDate
BK22002227	1	질문자	혹시 주짓수가 어떤 운동인지 알고 계시나요? 이번에 새로운 운동을 배워보려고 알아보는 중이에요.				0	2022-08-02 12:14:50	2022-08-02 13:21:44
BK22002227	2	전문가	그럼요, 유도복과 비슷한 도복을 입는 주짓수는 맨손으로 상대방을 제압해 자신에게 유리한 포지션을 선점하고 기술을 사용하는 실전 격투의 성향이 강한 운동이에요. 팔다리의 관절을 꺾거나 목을 조르는 등의 기술이 있답니다.	주짓수	http://www.ftimes.kr/news/articleView.html?idxno=12082	2021/08/19	0	2022-08-02 12:14:50	2022-08-02 13:21:44
BK22002227	3	질문자	그렇군요, 기술이 좀 무서운데 거친 운동인가 봐요?				0	2022-08-02 12:14:50	2022-08-02 13:21:44
BK22002227	4	전문가	아, 대개 꺾고 조르는 등을 위주로 하기 때문에 거칠다고 오해할 수 있지만 주짓수는 부드러움이 강함을 이긴다는 모토를 갖고 있어요. 주짓수의 한자 표기도 유술이라는 점을 보면 어떤 스타일인지 유추할 수 있죠.	유술	https://news.mt.co.kr/mtview.php?no=2015012811263166230&outlink=1&ref=https%3A%2F%2Fsearch.naver.com	2015/01/28	0	2022-08-02 12:14:50	2022-08-02 13:21:44
BK22002227	5	질문자	그렇군요, 기술을 사용해 강한 사람도 이길 수 있다는 건가요?				0	2022-08-02 12:14:50	2022-08-02 13:21:44
BK22002227	6	전문가	네, 주짓수는 힘의 사용을 최소화하면서 상대방의 힘을 역이용하거든요. 그렇기 때문에 효과적인 호신술로 유명하죠.	주짓수 호신술	https://www.insight.co.kr/news/146144	2018/03/21	0	2022-08-02 12:14:50	2022-08-02 13:21:44
BK22002227	7	질문자	그렇군요, 힘 차이가 중요한 운동이 많은데 주짓수는 그런 제한이 없어서 누구에게나 좋겠어요. 실제로 호신술로 사용한 경우도 있나요?				0	2022-08-02 12:14:50	2022-08-02 13:21:44
BK22002227	8	전문가	그럼요, 주짓수를 수련한 72세의 한 노인이 강도를 제압했답니다. 힘으로만 하는 운동이 아니기 때문에 상대방보다 힘이 약해도 효과적인 기술로 상대를 제압할 수 있다는 게 참 매력적인 거 같아요.	주짓수 노인	http://www.ftimes.kr/news/articleView.html?idxno=12082	2021/08/19	0	2022-08-02 12:14:50	2022-08-02 13:21:44
BK22002227	9	질문자	사실 그런 운동이 많지 않잖아요. 주짓수는 언제부터 생겼는지 궁금해요.				0	2022-08-02 12:14:51	2022-08-02 13:21:44
BK22002227	10	전문가	브라질로 이주한 일본 유도가 마에다 미츠요로부터 시작되었고, 그레이시 가문에서 변형되어 개발되었답니다. 이후 1990년대 미국에 소개되었고, UFC 등의 종합격투기 대회에서 위력을 선보이며 세계적으로 인기를 얻기 시작했죠.	UFC 주짓수	https://news.mt.co.kr/mtview.php?no=2015012811263166230&outlink=1&ref=https%3A%2F%2Fsearch.naver.com	2015/01/28	0	2022-08-02 12:14:51	2022-08-02 13:21:44
BK22002227	11	질문자	그렇군요, 그럼 주짓수는 태권도처럼 정해진 단계가 있나요?				0	2022-08-02 12:14:51	2022-08-02 13:21:44
BK22002227	12	전문가	네, 띠의 색깔에 따라 등급이 다르답니다. 띠는 흰 띠, 파란 띠, 보라색 띠, 갈색 띠, 검은 띠 순이고 단계 당 짧게는 1년 반, 길게는 2년에서 3년 정도로 수련 시간이 걸려요.	주짓수 띠	https://www.hani.co.kr/arti/specialsection/esc_section/578013.html	2013/03/14	0	2022-08-02 12:14:51	2022-08-02 13:21:44
BK22002227	13	질문자	그렇게 등급이 정해져 있군요. 아, 주짓수를 하면 어떤 운동 효과가 있는지 궁금해요.				0	2022-08-02 12:14:51	2022-08-02 13:21:44
BK22002227	14	전문가	일단 스트레스가 해소되고, 다이어트에 좋답니다. 생존과 제압을 하기 위해 많이 움직이고, 그만큼 운동량도 많기 때문에 체중 감소에 효과가 좋아요.	주짓수 효과	http://news.imaeil.com/page/view/2015062505420736633	2015/06/25	0	2022-08-02 12:14:51	2022-08-02 13:21:44
BK22002227	15	질문자	그렇군요, 그럼 다이어트로도 많이 배우겠네요?				0	2022-08-02 12:14:51	2022-08-02 13:21:44
BK22002227	16	전문가	네, 주짓수는 한 시간에 무려 1000칼로리 이상을 소모할 수 있어요. 그래서 다이어트를 위해 배우는 여성들이 많죠.	주짓수 다이어트	http://www.gvalley.co.kr/news/articleView.html?idxno=565135	2019/05/07	0	2022-08-02 12:14:51	2022-08-02 13:21:44
BK22002227	17	질문자	다이어트에 좋다고 하니, 꼭 배워보고 싶네요.				0	2022-08-02 12:14:51	2022-08-02 13:21:44
BK22002227	18	전문가	이번 기회에 한 번 도전해 보세요.				0	2022-08-02 12:14:51	2022-08-02 13:21:44
BK22002227	19	질문자	네, 집 근처에 있는 주짓수 학원에 가봐야겠어요. 오늘 좋은 정보 주셔서 감사합니다.				0	2022-08-02 12:14:51	2022-08-02 13:21:44
BK22002227	20	전문가	별말씀을요, 다른 궁금한 게 있으시면 언제든지 물어보세요.				1	2022-08-02 12:14:51	2022-08-02 14:21:26
