id	utterance_id	role	text	search_query	search_URL	reference_date	terminate	regDate	updDate
BK22003630	1	질문자	체육 시간에 멀리뛰기를 하다가 육상부 코치로부터 육상부에 들어오라는 권유를 받았어요. 열심히 해서 유명한 선수가 되보려구요.				0	2022-08-04 11:14:10	2022-08-11 08:56:36
BK22003630	2	전문가	육상부 제의를 받으셨다니 정말 축하드려요. 육상부 출신 중에 우상혁 선수도 달리기가 좋아 들어갔다가 지도자의 권유로 높이뛰기를 시작했죠.	우상혁 높이뛰기 시작한 계기	http://www.sportsq.co.kr/news/articleView.html?idxno=442091	2022/07/19	0	2022-08-04 11:14:10	2022-08-11 08:56:36
BK22003630	3	질문자	그런 계기로 시작하게 됐다니 그때 권유했던 지도자도 요즘 성과보면 뿌듯하겠어요. 우상혁 선수가 올림픽에도 나왔나요?				0	2022-08-04 11:14:10	2022-08-04 11:14:10
BK22003630	4	전문가	우상혁은 2020년 도쿄올림픽에서 2.35m를 넘어서 대한민국 신기록을 세웠어요. 종전 대한민국 높이뛰기 최고 기록은 이진택 교수의 2.34m였거든요.	우상혁 도쿄올림픽	https://ko.wikipedia.org/wiki/%EC%9A%B0%EC%83%81%ED%98%81	2022/07/04	0	2022-08-04 11:14:10	2022-08-09 14:07:06
BK22003630	5	질문자	대한민국 신기록을 세웠다니 정말 잘 하는 선수네요. 높이뛰기는 도구를 사용해서 뛰어도 되나요?				0	2022-08-04 11:14:10	2022-08-04 11:14:10
BK22003630	6	전문가	높이뛰기는 육상경기 종목 중 하난데요. 특별한 장치는 쓸 수 없고 특정 높이의 수평 막대 위로 넘어야하는 종목이에요.	높이뛰기	https://ko.wikipedia.org/wiki/%EB%86%92%EC%9D%B4%EB%9B%B0%EA%B8%B0	2022/02/23	0	2022-08-04 11:14:10	2022-08-04 11:14:10
BK22003630	7	질문자	특별한 장치도 없이 2.35m를 넘었다니 정말 대단한걸요. 우상혁 선수가 목표로 하는 높이가 있을까요?				0	2022-08-04 11:14:10	2022-08-04 11:14:10
BK22003630	8	전문가	높이뛰기 선수치고 작은 키인 188cm인데 2m38을 목표로 하고 있어요. 우상혁 선수의 인스타그램 아이디에는 238이 들어가요. 높이뛰기 선수들 중에 소수만 가입된 50클럽 가입을 목표로 하고 있는데요. 50클럽은 키보다 50cm 이상 높은 높이를 넘어야 가입할 수 있거든요.	우상혁 목표	http://www.sporbiz.co.kr/news/articleView.html?idxno=625679	2022/07/17	0	2022-08-04 11:14:10	2022-08-09 14:07:06
BK22003630	9	질문자	세계 선수들 중에도 소수가 가입된거라면 정말 그 기록을 깨는건 어려운 일인가봐요. 도쿄올림픽 이후에도 좋은 성과를 내고 있나요?				0	2022-08-04 11:14:11	2022-08-04 11:14:11
BK22003630	10	전문가	우상혁은 그 이후에도 좋은 성과를 내고 있어요. 지난 3월 세계실내육상선수권 대회에서 한국인 최초로 금메달을 땄구요. 이후 5월 카타르 도하 다이아몬드리그에서도 우승을 차지했어요.	우상혁 메달	https://newsis.com/view/?id=NISX20220715_0001944919&cID=10601&pID=10600	2022/07/15	0	2022-08-04 11:14:11	2022-08-04 11:14:11
BK22003630	11	질문자	지금 몸 상태가 정말 좋은가봐요. 우상혁 선수가 출전할 수 있는 대회 중 가장 권위있는 육상 대회는 뭐에요?				0	2022-08-04 11:14:11	2022-08-09 14:07:06
BK22003630	12	전문가	육상에서 최고 권위있는 대회는 세계육상연맹 주관인 세계육상선수권대회에요. 이번 대회는 미국에서 처음 열리고 2019년 도하 세계육상선수권대회 이후 3년 만에 열리는 거에요.	세계육상선수권대회	https://newsis.com/view/?id=NISX20220715_0001944919&cID=10601&pID=10600	2022/07/15	0	2022-08-04 11:14:11	2022-08-04 11:14:11
BK22003630	13	질문자	이번 세계육상선수권대회의 규모는 어느정도 인가요?				0	2022-08-04 11:14:11	2022-08-04 11:14:11
BK22003630	14	전문가	200여국에서 192팀, 1900여명의 선수가 참가한 규모로 열리구요. 총 48개 종목에서 경기가 열려요.	2022 세계육상선수권대회 규모	https://newsis.com/view/?id=NISX20220715_0001944919&cID=10601&pID=10600	2022/07/15	0	2022-08-04 11:14:11	2022-08-04 11:14:11
BK22003630	15	질문자	우리나라에서 우상혁 이전에 세계육상선수권 대회 높이뛰기 분야에서 좋은 결과를 냈던 선수가 있었나요?				0	2022-08-04 11:14:11	2022-08-04 11:14:11
BK22003630	16	전문가	1999년 세비야 세계육상선수권대회 이진택이 결선에 진출했었어요. 우상혁은 이번에 결선 진출자가 됐구요.	세계육상선수권대회 대한민국 높이뛰기	https://www.yna.co.kr/view/AKR20220716004100007?input=1195m	2022/07/16	0	2022-08-04 11:14:11	2022-08-09 14:07:06
BK22003630	17	질문자	23년 만에 높이뛰기 인재가 나왔네요.				0	2022-08-04 11:14:11	2022-08-09 14:07:06
BK22003630	18	전문가	결선에 올라갔으니 메달권에 들었으면 좋겠어요.				0	2022-08-04 11:14:11	2022-08-04 11:14:11
BK22003630	19	질문자	세계육상선수권대회 높이뛰기 결선은 언제 열릴 예정인가요?				0	2022-08-04 11:14:11	2022-08-04 11:14:11
BK22003630	20	전문가	한국시간으로 19일 오전 9시 45분에 결선이 열려요. 한국 육상 사상 최초로 우승에 도전을 하죠.	2022 세계육상선수권대회 높이뛰기 결선	http://news.tvchosun.com/site/data/html_dir/2022/07/16/2022071690006.html	2022/07/16	0	2022-08-04 11:14:11	2022-08-04 11:14:11
BK22003630	21	질문자	그날 경기 챙겨보면서 응원해야겠어요. 오늘 이야기 나눈 거 재미있었어요.				1	2022-08-04 11:14:11	2022-08-11 08:56:36
