id	utterance_id	role	text	search_query	search_URL	reference_date	terminate	regDate	updDate
BK22016211	1	질문자	넌 스포츠 종목 중 무슨 경기 보는 걸 제일 좋아하냐? 난 야구가 그렇게 재밌던데.				0	2022-10-15 12:05:48	2022-10-15 14:18:02
BK22016211	2	전문가	하하, 맞아. 넌 고등학생 때도 야구장 자주 갔잖아. 나는 럭비가 제일 재밌더라.				0	2022-10-15 12:05:48	2022-10-15 13:43:38
BK22016211	3	질문자	어, 너 럭비 좋아했었어? 난 이름만 알지 자세히 모르는데, 럭비는 어떤 식으로 경기하는 스포츠야?				0	2022-10-15 12:05:48	2022-10-15 14:18:02
BK22016211	4	전문가	럭비는 단순히 럭비라고도 하고 럭비 풋볼이라고도 하는데, 발이랑 손을 사용한 구기 스포츠야. 풋볼 알지? 럭비는 풋볼의 일종이라고 생각하면 돼. 직사각형의 경기장에서 양 팀이 타원형의 럭비공을 H자 형태로 생긴 상대편 엔드라인 너머나 골대로 보내 득점하면서 경기 해. 참, 럭비는 보통 럭비 리그와 럭비 유니온, 두 가지로 종목으로 나뉘어.	럭비	https://ko.wikipedia.org/wiki/%EB%9F%AD%EB%B9%84	2022/08/21	0	2022-10-15 12:05:48	2022-10-15 14:18:02
BK22016211	5	질문자	음, 실제로 한번 보고 싶다. 근데 솔직히 우리나라에서는 럭비 경기를 한다는 소리를 못 들어본 것 같은데, 럭비는 어느 나라에서 인기 있는데? 아, 그리고 럭비도 올림픽 정식 종목이야?				0	2022-10-15 12:05:48	2022-10-15 14:18:02
BK22016211	6	전문가	응! 럭비는 2016년 하계 올림픽 때부터 7인제 남녀부문이 정식 종목으로 채택됐어. 그리고 럭비는 트라이 내이션스의 SANZAR 국가들, 식스 네이션스라고 하는 유럽 국가들, 남아프리카, 오세아니아, 아르헨티나 등에서 인기가 많아.	럭비 인기 올림픽 정식 종목	https://ko.wikipedia.org/wiki/%EB%9F%AD%EB%B9%84	2022/08/21	0	2022-10-15 12:05:48	2022-10-15 14:18:02
BK22016211	7	질문자	아, 올림픽 정식 종목이었네! 럭비는 언제 어떻게 만들어진 스포츠인데?				0	2022-10-15 12:05:48	2022-10-15 14:18:02
BK22016211	8	전문가	1823년에 럭비 스쿨이라는 잉글랜드의 유명 사립학교에서 풋볼 경기를 하던 중, 윌리엄 웹 엘리스라는 학생이 손으로 공을 들고 달린 게 기원으로 전해지고 있어. 참고로 후세의 창작이라는 설도 있긴 해.	럭비 기원	https://ko.wikipedia.org/wiki/%EB%9F%AD%EB%B9%84	2022/08/21	0	2022-10-15 12:05:48	2022-10-15 14:18:02
BK22016211	9	질문자	아, 그렇구나. 아까 럭비는 럭비 유니온이랑 럭비 리그로 나뉜다고 했지? 럭비 리그는 어떤 종목인데?				0	2022-10-15 12:05:48	2022-10-15 14:27:45
BK22016211	10	전문가	럭비 유니온이랑 규칙이 약간 다른 럭비 경기인데, 럭비 리그는 13인제로 진행해. 시드니 등의 동해안 일대 등 오스트레일리아의 일부 지역에서 절대적 인기를 끌고 있는 종목이지. 그쪽에서는 풋볼이나 풋티로 불러.	럭비 리그	https://ko.wikipedia.org/wiki/%EB%9F%AD%EB%B9%84%EB%A6%AC%EA%B7%B8	2022/09/23	0	2022-10-15 12:05:48	2022-10-15 14:27:45
BK22016211	11	질문자	럭비 리그는 13인제 럭비구나. 그럼, 럭비 유니언은 어떤 종목인데?				0	2022-10-15 12:05:51	2022-10-15 14:27:45
BK22016211	12	전문가	아까 말한 럭비 리그가 성행하는 몇 나라를 빼고는, 다른 대부분의 국가에서 말하는 럭비가 럭비 유니언 방식의 경기를 뜻해. 우리나라에서 말하는 럭비도 이 럭비 유니언 방식의 경기지. 공식적인 경기에서는 대개 한 팀당 15명으로 구성되고, 7인제 럭비에서는 한 팀당 7명이야.	럭비 유니언	https://ko.wikipedia.org/wiki/%EB%9F%AD%EB%B9%84_%EC%9C%A0%EB%8B%88%EC%96%B8	2022/08/21	0	2022-10-15 12:05:51	2022-10-15 14:27:45
BK22016211	13	질문자	럭비 리그 경기에서는 15인제가 기본인 거네. 럭비 경기 규칙에는 어떤 것들이 있어?				0	2022-10-15 12:05:51	2022-10-15 14:52:57
BK22016211	14	전문가	럭비 경기 규칙은 13인제인 리그 경기냐, 15인제인 유니온 경기냐에 따라 차이가 있는데, 우선 두 종목 모구 럭비공 종류는 같아. 또 전진을 위해서는 공을 발로 차거나 공과 함께 뛰는 방법만 허용되고 앞으로 공을 패스하는 건 안 돼. 득점도 골이나 트라이를 통해서만 가능한데, 골은 골 포스트 사이에 있는 크로스바 위로 공을 차서 넘기는 걸 말하고, 트라이는 상대방 진영의 골라인 너머의 지면에 공을 갖다 놓는 걸 의미해.	럭비 규칙	https://ko.wikipedia.org/wiki/%EB%9F%AD%EB%B9%84	2022/08/21	0	2022-10-15 12:05:51	2022-10-15 14:52:57
BK22016211	15	질문자	이렇게 규칙 들어 보니까 럭비 경기도 되게 재밌겠다. 그럼 리그랑 유니온 경기는 어떻게 다른지도 좀 궁금한데, 어떤 차이점이 있어?				0	2022-10-15 12:05:51	2022-10-15 14:58:12
BK22016211	16	전문가	아까 말한 것처럼, 일단 15인제와 13인제로 나뉜다는 점이랑, 태클 이후에 진행 방식이 가장 큰 차이점이야. 럭비 리그 경기에서는 플랭커 두 명이 빠져 있는데, 유니온이랑 달리 리그에서는 한 팀이 6차례 태클을 당하는 사이에 득점을 못 하면 공 소유권이 상대편으로 넘어가서 그래.	럭비 15인제 13인제 차이점	https://ko.wikipedia.org/wiki/%EB%9F%AD%EB%B9%84	2022/08/21	0	2022-10-15 12:05:51	2022-10-15 14:58:12
BK22016211	17	질문자	오, 꽤 중요한 부분에서 차이점이 있네. 나 마지막으로 하나만 더 물어볼게! 럭비 경기에서 심판은 총 몇 명이야?				0	2022-10-15 12:05:51	2022-10-15 15:03:07
BK22016211	18	전문가	주심 한 사람이랑, 선심 두 명이 경기의 심판을 맡아. 경기 전체를 통제하는 건 주심이고, 공이 경기장 밖으로 나갔을 때 나간 장소를 알리고 골킥이 성공했는지 판정하는 건 선심이지. 아, 그리고 선심은 선수의 반칙을 주심에게 알리는 역할도 해.	럭비 심판 구성	https://ko.wikipedia.org/wiki/%EB%9F%AD%EB%B9%84	2022/08/21	0	2022-10-15 12:05:53	2022-10-15 15:03:07
BK22016211	19	질문자	너 진짜 많이 알고 있네? 난 너랑 되게 오래 알고 지냈는데 네가 럭비에 관심이 이렇게 많은 줄은 몰랐다, 야.				0	2022-10-15 12:05:51	2022-10-15 15:03:07
BK22016211	20	전문가	하하, 나도 럭비 경기는 티비나 유튜브로만 봐서 굳이 너한테 말할 일이 없었지. 다음에 같이 한번 보러 가자.				0	2022-10-15 12:05:53	2022-10-15 15:03:07
BK22016211	21	질문자	좋아 좋아. 아, 난 이제 동아리 갈 시간 다 됐다. 내일 학교에서 또 보자!				0	2022-10-15 12:12:03	2022-10-15 15:03:07
BK22016211	22	전문가	그래, 잘 가고 내일 또 보자.				1	2022-10-15 12:12:03	2022-10-19 15:39:21
