id	utterance_id	role	text	search_query	search_URL	reference_date	terminate	regDate	updDate
BK22013600	1	질문자	요즘 즐겨보는 예능 프로그램이 있는데 연예인 부부들이 함께 댄스스포츠를 배우는 거야. 혹시 뭔지 알고 있니?				0	2022-09-30 15:46:38	2022-10-02 11:21:25
BK22013600	2	전문가	아, 우리들의 차차차 라고 tvN의 새로운 예능이야. 부부들이 출연해 농도 짙은 댄스스포츠를 함께 배우며 부부관계에 다시 한번 로맨스를 일으켜보는 리얼리티 프로그램이지.	우리들의 차차차	https://www.joynews24.com/view/1504505	2022/07/27	0	2022-09-30 15:46:38	2022-10-02 11:21:25
BK22013600	3	질문자	응, 그 프로그램 맞아. 그런데 춤 이름이 댄스스포츠라면 올림픽 같은 큰 대회에도 나가는 스포츠 종목인 거야?				0	2022-09-30 15:46:38	2022-10-02 11:21:25
BK22013600	4	전문가	그럼, 댄스스포츠는 2010년 광저우 아시안게임에 정식종목이었어. 댄스스포츠 연맹은 2007년에 대한체육회 정회원 단체가 되었는데 올림픽이나 아시안게임의 출전 종목일 경우 정회원 단체가 되거든.	댄스스포츠연맹	https://sports.khan.co.kr/sports/sk_index.html?art_id=202108311111003&sec_id=530101&pt=nv	2021/08/31	0	2022-09-30 15:46:38	2022-10-02 11:21:25
BK22013600	5	질문자	아, 그렇구나. 댄스스포츠에도 춤의 종류가 많던데 알려 줄래?				0	2022-09-30 15:46:38	2022-10-02 11:21:25
BK22013600	6	전문가	먼저 댄스스포츠는 모던댄스와 라틴댄스 두 종류가 있어. 1924년에 영국왕실무도교사협회에서 모던댄스로 정립한 종목은 왈츠, 탱고, 퀵스텝, 비엔나왈츠, 폭스트롯 5종목이고, 1974년에는 삼바, 자이브, 차차차, 룸바, 파소도블 5종목을 라틴 댄스로 정했지.	댄스스포츠 종류	http://www.knyhnews.co.kr/news/articleView.html?idxno=7611	2019/11/19	0	2022-09-30 15:46:38	2022-10-02 11:21:25
BK22013600	7	질문자	왈츠는 음악의 종류이기도 해서 많이 들어봤는데 어떤 춤이야?				0	2022-09-30 15:46:38	2022-10-02 11:21:25
BK22013600	8	전문가	왈츠라는 말은 돌다라는 어원을 갖고 있는데 독일어로 파도치듯 떠오르고 내려간다는 의미야. 독일에서 농부들이 추던 춤을 무용가 랜들러가 고안했고 이후 영국으로 전해져 4분의 3박자인 왈츠로 발전된 춤이야.	왈츠	http://news.imaeil.com/page/view/2017020904461761276	2017/02/09	0	2022-09-30 15:46:38	2022-10-02 11:21:25
BK22013600	9	질문자	그러면 퀵스텝은 어떤 춤이야?				0	2022-09-30 15:46:38	2022-10-02 11:21:25
BK22013600	10	전문가	회전 위주의 왈츠와 달리 퀵스텝은 직선적인 춤이야. 미국 사우스캐롤라이나주의 흑인들이 추던 찰스톤 춤이 1921년 뉴욕으로 전해져 현대 무도의 아버지라 불리는 무용가 버논 캣슬에 의해 퀵스텝으로 다시 태어나게 된 춤이지.	퀵스텝	http://www.knyhnews.co.kr/news/articleView.html?idxno=7611	2019/11/19	0	2022-09-30 15:46:38	2022-10-02 11:21:25
BK22013600	11	질문자	그렇구나. 영화 여인의 향기에 나왔던 춤인 탱고도 소개해 줘.				0	2022-09-30 15:46:38	2022-10-02 11:21:25
BK22013600	12	전문가	탱고는 1880년대에 아르헨티나의 부둣가에서 시작된 춤인데 유럽의 상류층 문화에 전파되면서 예절과 아름다움을 중시하는 품격 있고 우아한 커플댄스로 인식되었어. 밀롱가라는 탱고 전용 공간에서 모여 춤을 추는 특징이 있어.	탱고	https://www.dailyimpact.co.kr/news/articleView.html?idxno=83166	2022/08/01	0	2022-09-30 15:46:38	2022-10-02 11:21:25
BK22013600	13	질문자	탱고를 추던 넓은 마룻바닥이 깔린 공간을 밀롱가라고 하는구나. 그리고 라틴댄스 종류 중에서 룸바는 어떤 춤인 거야?				0	2022-09-30 15:46:38	2022-10-02 11:21:26
BK22013600	14	전문가	룸바는 쿠바에서 유래된 라틴 댄스의 가장 기본이 되는 춤으로 사랑의 춤이라고 해. 느린 템포의 춤이지만 동작은 육감적으로 쉴 새 없이 움직여야 하는 춤이야.	룸바	https://www.joongang.co.kr/article/23901659	2020/10/23	0	2022-09-30 15:46:38	2022-10-02 11:21:26
BK22013600	15	질문자	느끼한 춤이었다는 기억이 나네. 파소도블레는 처음 들어보는데 어떤 춤이야?				0	2022-09-30 15:46:39	2022-10-02 11:21:26
BK22013600	16	전문가	투우사와 투우의 관계를 그린 춤으로 스페인에서 유래된 춤이야. 투우사의 특징적인 자세와 오만한 듯한 모습이 빠르게 펼쳐지는 춤으로 박진감이 넘치는데 경기에서는 음악의 단위에 맞춰진 기승전결의 스토리가 있어야 하지.	파소도블레	https://www.joongang.co.kr/article/23901659	2020/10/23	0	2022-09-30 15:46:39	2022-10-02 11:21:26
BK22013600	17	질문자	음, 파소도블레는 힘이 넘치고 멋질 것 같아 꼭 한 번 보고 싶네. 삼바는 브라질의 춤 맞지?				0	2022-09-30 15:46:39	2022-10-02 11:21:26
BK22013600	18	전문가	맞아, 격렬한 리듬의 브라질 대표 민속춤으로 아프리카 흑인 노예들이 목화밭에서의 힘든 노동을 잊기 위해 특유의 노랫가락에 맞춰 추던 춤이 라틴댄스로 자리 잡게 된 거지.	삼바	http://www.knyhnews.co.kr/news/articleView.html?idxno=7611	2019/11/19	0	2022-09-30 15:46:39	2022-10-02 11:21:26
BK22013600	19	질문자	삼바춤은 보는 것만으로도 신이 나는 것 같아. 덕분에 댄스 스포츠의 여러 가지 춤들을 알게 되었어, 고마워.				0	2022-09-30 15:46:39	2022-10-02 11:21:26
BK22013600	20	전문가	더 궁금한 내용이 생기면 언제든지 연락해.				1	2022-09-30 15:46:39	2022-10-02 11:21:26
