id	utterance_id	role	text	search_query	search_URL	reference_date	terminate	regDate	updDate
BK22018492	1	질문자	근대 5종이란 경기가 있던데, 거기에는 어떤 종목들이 포함돼?				0	2022-10-21 17:56:33	2022-10-22 09:20:13
BK22018492	2	전문가	근대 5종 경기에는 펜싱, 수영, 승마, 사격과 육상이 포함되며, 영어로는 숫자 5를 뜻하는 펜타와 애슬론의 합성어인 펜타슬론이라고 해.	근대 5종	https://www.ftimes.kr/news/articleView.html?idxno=11954	2021/08/11	0	2022-10-21 17:56:33	2022-10-22 09:20:13
BK22018492	3	질문자	그렇구나, 어떻게 해서 5종목을 정한거래?				0	2022-10-21 17:56:33	2022-10-22 09:20:13
BK22018492	4	전문가	과거 이상적인 군인이 갖춰야 했던 능력들을 기준으로 고대 5종 경기의 종목을 택했듯이, 근대 올림픽의 창시자인 피에르 드 쿠베르탱 남작은 19세기의 전령이 지녀야야 할 능력을 바탕으로 근대 5종 경기의 종목을 선정했지.	근대 5종 종목	https://ko.wikipedia.org/wiki/%EA%B7%BC%EB%8C%805%EC%A2%85	2022/10/03	0	2022-10-21 17:56:33	2022-10-22 09:20:13
BK22018492	5	질문자	그렇게 5종목을 하면 엄청 힘들거 같은데, 아직 올림픽 종목인가 봐?				0	2022-10-21 17:56:33	2022-10-22 09:20:13
BK22018492	6	전문가	응, 쿠베르탱 남작은 근대 5종 선수만이 올림픽의 진정한 선수로 불릴 수 있다고 했지만, 다섯 경기를 하면 경기 시간이 오래 걸리기도 하는 등 문제점이 있어 여러번 올림픽에서 퇴출 위기를 겪었어.	근대 5종 올림픽	https://www.yna.co.kr/view/AKR20211103114000007	2021/11/03	0	2022-10-21 17:56:33	2022-10-22 09:20:13
BK22018492	7	질문자	그래도 오랜 기간 올림픽 종목이었을 것 같은데, 언제부터 올림픽 종목이 됐는데?				0	2022-10-21 17:56:33	2022-10-22 09:20:13
BK22018492	8	전문가	1912년 스톡홀름 대회부터 110년 동안 올림픽 정식종목으로 채택됐었지. 하지만 머지않아 종목 교체를 앞두고 있어.	근대 5종 올림픽 종목	https://www.hankookilbo.com/News/Read/A2022050308470000341	2022/05/03	0	2022-10-21 17:56:33	2022-10-22 09:20:13
BK22018492	9	질문자	왜 종목 교체가 필요하게 됐는데?				0	2022-10-21 17:56:34	2022-10-22 09:20:13
BK22018492	10	전문가	공정성 논란으로 승마가 장애물 경기로 대체될 것으로 보여. 하지만 기존 근대 5종 종목들은 2024년 파리올림픽까지는 유지되고 이후에 바뀐 종목으로 정식 경기를 치를 거야.	근대 5종  종목 교체	https://www.hankookilbo.com/News/Read/A2022050308470000341	2022/05/03	0	2022-10-21 17:56:34	2022-10-22 09:20:13
BK22018492	11	질문자	무슨 공정성 논란이 있었는데?				0	2022-10-21 17:56:34	2022-10-22 09:20:13
BK22018492	12	전문가	2020 도쿄올림픽에서 여자부 아니카 슐로이가 굳건한 1위를 하고 있는 중 승마 경기에서 말이 갑자기 장애물을 넘지 않으려고 해서 0점을 받은 것을 계기로 종목 교체가 의논 되기 시작했어.	근대 5종 공정성 논란	https://www.hankookilbo.com/News/Read/A2022050308470000341	2022/05/03	0	2022-10-21 17:56:34	2022-10-22 09:20:13
BK22018492	13	질문자	안타깝네, 특히 승마 경기에서 논란이 된 이유가 있을까?				0	2022-10-21 17:56:34	2022-10-22 09:20:13
BK22018492	14	전문가	승마 경기는 선수에게 말이 랜덤으로 주어지기 때문에, 말과 교감할 시간도 없이 경기를 진행하게 돼. 실력이 아닌 운에 좌지우지된다는 많은 의견이 있었지.	근대 5종 승마	https://www.hankookilbo.com/News/Read/A2022050308470000341	2022/05/03	0	2022-10-21 17:56:34	2022-10-22 09:20:13
BK22018492	15	질문자	승마를 대치할 장애물 경기는 어떻게 정하고 있는데?				0	2022-10-21 17:56:34	2022-10-22 09:20:13
BK22018492	16	전문가	국제근대5종연맹이 현지시간 2022년 6월 27∼28일 튀르키예 앙카라에서 새 종목 후보로 장애물 경기 테스트 이벤트가 열렸는데, 이 경기는 토탈 9개 구간을 빠르게 통과하는 방식이었지.	근대 5종 장애물 경기	https://www.hani.co.kr/arti/sports/sports_general/1048941.html	2022/06/29	0	2022-10-21 17:56:34	2022-10-22 09:20:13
BK22018492	17	질문자	근대 5종 경기가 논란을 딛고 다시 옛 명성을 얻었으면 좋겠어.				0	2022-10-21 17:56:34	2022-10-22 09:20:13
BK22018492	18	전문가	맞아, 열심히 고생하는 선수들이 있으니까.				0	2022-10-21 17:56:34	2022-10-22 09:20:13
BK22018492	19	질문자	파리 올림픽에서는 새로운 근대 5종을 본다니 기대되기도 하네.				0	2022-10-21 17:56:34	2022-10-22 09:20:13
BK22018492	20	전문가	올림픽을 즐기기 위해 근대 5종 올림픽 규칙을 설명해 줄게.				1	2022-10-21 17:56:34	2022-10-22 09:20:13
