id	utterance_id	role	text	search_query	search_URL	reference_date	terminate	regDate	updDate
BK22018522	1	질문자	요새 프로야구에 관심이 많다 보니 삼성 라이온즈와 구단과 관련된 선수들에 대해서도 관심이 많아졌어. 삼성 라이온즈의 연고지는 어디야?				0	2022-10-21 17:57:13	2022-10-22 09:27:22
BK22018522	2	전문가	삼성 라이온즈는 대구를 연고지로 하는 한국 프로야구에 소속된 야구단이야.	삼성 라이온즈 연고지	https://ko.wikipedia.org/wiki/%EC%82%BC%EC%84%B1_%EB%9D%BC%EC%9D%B4%EC%98%A8%EC%A6%88	2022/09/13	0	2022-10-21 17:57:13	2022-10-22 09:27:22
BK22018522	3	질문자	그래서 삼성 라이온즈가 대구 팬들한테 인기가 많았구나. 그럼 삼성 라이온즈는 어느 홈 구장을 사용하고 있어?				0	2022-10-21 17:57:13	2022-10-22 09:27:22
BK22018522	4	전문가	삼성 라이온즈는 홈 구장으로 대구삼성라이온즈파크를 사용하고 있고, 제2 홈 구장으로는 포항야구장을 사용하고 있어.	삼성 라이온즈 홈 구장	https://ko.wikipedia.org/wiki/%EC%82%BC%EC%84%B1_%EB%9D%BC%EC%9D%B4%EC%98%A8%EC%A6%88	2022/09/13	0	2022-10-21 17:57:13	2022-10-22 09:27:22
BK22018522	5	질문자	나도 그 구장들에 한번 가보고 싶어. 그럼 삼성 라이온즈는 한국시리즈에서 언제 처음으로 우승했어?				0	2022-10-21 17:57:13	2022-10-22 09:27:22
BK22018522	6	전문가	삼성 라이온즈는 1985년에 전, 후기 통합 우승한 이후에 한국시리즈에서는 2002년에 처음으로 정상에 등극하는 영광을 누렸어.	한국시리즈	https://ko.wikipedia.org/wiki/%EC%82%BC%EC%84%B1_%EB%9D%BC%EC%9D%B4%EC%98%A8%EC%A6%88	2022/09/13	0	2022-10-21 17:57:13	2022-10-22 09:27:22
BK22018522	7	질문자	삼성 라이온즈가 명문 팀이었네. 역사가 깊다보니 삼성 라이온즈도 부침이 있는 시기가 있었을 것 같아. 삼성 라이온즈가 창단한 이후에 가장 낮은 성적을 기록했을 때는 몇 등이었어?				0	2022-10-21 17:57:13	2022-10-22 09:27:22
BK22018522	8	전문가	삼성 라이온즈가 팀이 만들어진 이후 거둔 최하위 성적은 2016년과 2017년에 정규 시즌에서 9위를 기록한 것이었어.	최하위 성적	https://ko.wikipedia.org/wiki/%EC%82%BC%EC%84%B1_%EB%9D%BC%EC%9D%B4%EC%98%A8%EC%A6%88	2022/09/13	0	2022-10-21 17:57:13	2022-10-22 09:27:22
BK22018522	9	질문자	삼성 라이온즈도 암흑기가 있었나보네. 그럼 삼성 라이온즈에서 가장 오래 감독직을 유지한 사람은 누구였어?				0	2022-10-21 17:57:13	2022-10-22 09:27:22
BK22018522	10	전문가	삼성 라이온즈에서 감독직을 맡은 사람은 12대 감독이었던 선동열이었어. 그는 2005년부터 2010년까지 6시즌 동안 한국시리즈에서 2번 우승하기도 하며 정규 시즌에서는 417승 13무 340패를 기록했어.	삼성 라이온즈 역대 감독	https://ko.wikipedia.org/wiki/%EC%82%BC%EC%84%B1_%EB%9D%BC%EC%9D%B4%EC%98%A8%EC%A6%88	2022/09/13	0	2022-10-21 17:57:13	2022-10-22 09:27:22
BK22018522	11	질문자	선동열이 삼성 라이온즈 감독을 맡았었구나, 몰랐어. 삼성 라이온즈는 2011년에 국내 구단들 중 최초의 기록을 세웠다고 하던데, 그게 뭐였어?				0	2022-10-21 17:57:13	2022-10-22 09:27:22
BK22018522	12	전문가	삼성 라이온즈는 2011년을 앞두고 류중일 감독이 부임하여 그 해에 페넌트 레이스와 한국시리즈 우승으로 5번째 우승을 차지했어. 이후 한국 우승팀 자격으로 출전한 2011년 아시아 시리즈에서 일본의 우승팀 후쿠오카 소프트뱅크 호크스를 꺾고 대한민국 팀 최초로 아시아 시리즈에서 정상을 차지했어. 이로 인해서 2011년 정규 시즌, 한국시리즈, 아시아 시리즈에서 모두 우승하며 국내 프로 야구단 중 처음으로 트리플 크라운을 달성한 팀이 되었어.	삼성 라이온즈 트리플 크라운	https://ko.wikipedia.org/wiki/%EC%82%BC%EC%84%B1_%EB%9D%BC%EC%9D%B4%EC%98%A8%EC%A6%88	2022/09/13	0	2022-10-21 17:57:13	2022-10-22 09:27:22
BK22018522	13	질문자	그렇구나. 삼성 라이온즈는 명문 팀답게 레전드 선수들이 많을 것 같아. 삼성 라이온즈의 영구 결번은 몇 개야?				0	2022-10-21 17:57:13	2022-10-22 09:27:22
BK22018522	14	전문가	삼성 라이온즈는 창단 이후부터 지금까지 많은 스타 선수들을 배출했는데 이 중에서 영구 결번은 3개야. 이 영광은 이만수의 22번, 양준혁의 10번, 이승엽의 36번만 누릴 수 있었어.	삼성 라이온즈 영구 결번	http://www.mydaily.co.kr/new_yk/html/read.php?newsid=202210140359833505&ext=na&utm_campaign=naver_news&utm_source=naver&utm_medium=related_news#PL2	2022/10/14	0	2022-10-21 17:57:13	2022-10-22 09:27:22
BK22018522	15	질문자	역시 나는 삼성 라이온즈하면 이승엽이 제일 먼저 생각이 나. 그는 은퇴하고 어떻게 지내고 있어?				0	2022-10-21 17:57:13	2022-10-22 09:27:22
BK22018522	16	전문가	이승엽은 은퇴 후 2018년부터 한국 프로야구 홍보 대사로 활동하며 야구 국가대표팀 기술위원회 위원으로도 활동했고, SBS와 SBS 스포츠의 프로 야구 해설위원으로 팬들과 소통하고 있어.	이승엽 은퇴 후	https://ko.wikipedia.org/wiki/%EC%9D%B4%EC%8A%B9%EC%97%BD	2022/10/04	0	2022-10-21 17:57:13	2022-10-22 09:27:22
BK22018522	17	질문자	오늘 삼성 라이온즈에 대해 설명을 들으니 정말 흥미로운 구단이라는 걸 알 수 있었어.				0	2022-10-21 17:57:13	2022-10-22 09:27:22
BK22018522	18	전문가	맞아, 한국 프로야구에는 지역마다 특색이 있는 구단이 있어서 좋은 것 같아.				0	2022-10-21 17:57:13	2022-10-22 09:27:22
BK22018522	19	질문자	오늘 삼성 라이온즈에 대해 알려줘서 고마워. 다음에도 궁금한 것이 있으면 찾아올게.				0	2022-10-21 17:57:13	2022-10-22 09:27:22
BK22018522	20	전문가	그래, 그렇게 말해줘서 고맙고 다음에도 나를 찾아주면 많이 알려줄게.				1	2022-10-21 17:57:13	2022-10-22 09:27:22
