id	utterance_id	role	text	search_query	search_URL	reference_date	terminate	regDate	updDate
BK22017563	1	질문자	너 스키 탈 줄 알아? 나는 스키를 아직 안타봤는데, 이번 겨울에는 꼭 배워보고 싶어.				0	2022-10-18 19:25:31	2022-10-18 19:25:31
BK22017563	2	전문가	응, 난 어릴 때 스키를 배워서 탈 줄 알아.				0	2022-10-18 19:25:31	2022-10-18 19:25:31
BK22017563	3	질문자	그렇구나, 내 주변에도 탈 줄 아는 친구들이 많은 걸 보면 스키가 꽤 대중적인 스포츠인 것 같아. 스키는 언제 어디서 시작된 스포츠야?				0	2022-10-18 19:25:31	2022-10-18 19:25:31
BK22017563	4	전문가	스웨덴의 습원에서 기원전 25세기 경에 사용하던 스키가 발견된 게 가장 오래된 스키의 흔적이야. 그 후로 눈이 많이 내리는 알프스 산맥 지역쪽에서 교통수단으로 이용하던 것이 스포츠로 자리잡게 되었어.	스키	https://ko.wikipedia.org/wiki/%EC%8A%A4%ED%82%A4	2022/03/31	0	2022-10-18 19:25:31	2022-10-24 16:46:25
BK22017563	5	질문자	오 그렇구나, 올림픽을 보면 스키 경기의 종류가 한 가지가 아니던데, 어떤 종목들이 있어?				0	2022-10-18 19:25:31	2022-10-18 19:25:31
BK22017563	6	전문가	스키 경기는 스키를 타고 눈 위를 달려 시간이나 득점을 겨루는 경기들이 있는데, 대표적으로 알파인 스키와 노르딕 스키, 바이애슬론 경기 등이 있어.	스키 종목	http://www.jbnews.com/news/articleView.html?idxno=633736	2015/01/21	0	2022-10-18 19:25:31	2022-10-18 19:25:31
BK22017563	7	질문자	아하, 알파인 스키는 어떤 종목이야?				0	2022-10-18 19:25:31	2022-10-18 19:25:31
BK22017563	8	전문가	알파인스키는 알프스 고산 지역에서 발달한 스포츠라 가파른 산지를 활강하는 스타일의 종목이야. 설치된 기문들을 통과해가면서 경사면을 내려오는 종목이지.	알파인 스키	https://www.etoday.co.kr/news/view/2096657	2022/01/14	0	2022-10-18 19:25:31	2022-10-24 16:46:25
BK22017563	9	질문자	아하, 그럼 노르딕 스키는 어떤거야?				0	2022-10-18 19:25:31	2022-10-18 19:25:31
BK22017563	10	전문가	노르딕 스키는 알파인 스키보다 비교적으로 내리막이 가파르지 않고, 평탄한 지형에서 빠르게 이동하기 위해서 발달한 스키야. 동계올림픽의 마라톤이라고 불리는 크로스컨트리 스키가 노르딕 스키 중 한 종류라고 생각하면 돼.	노르딕 스키	https://www.etoday.co.kr/news/view/2098930	2022/01/21	0	2022-10-18 19:25:31	2022-10-18 19:25:31
BK22017563	11	질문자	어떤 지형에서 타는지가 큰 차이구나. 그럼 바이애슬론 경기는 뭔데?				0	2022-10-18 19:25:31	2022-10-18 19:25:31
BK22017563	12	전문가	바이애슬론은 둘이라는 의미의 바이와 운동경기를 뜻하는 애슬론이 더해진 단어인 만큼 크로스 컨트리 스키와 사격이 더해진 경기야. 선수들이 스키를 타고 코스를 주행하다가 곳곳에 있는 사격장에서 사격을 해서 주행시간과 사격의 정확성을 따져서 승패를 겨루는 경기이지.	바이애슬론 경기	http://www.ablenews.co.kr/News/NewsContent.aspx?CategoryCode=0031&NewsCode=003120220222163357111543	2022/02/23	0	2022-10-18 19:25:31	2022-10-18 19:25:31
BK22017563	13	질문자	우와 그런 경기가 있었구나. 그럼 경사가 큰 곳을 달릴 때 쓰는 스키와 평지를 달릴 때 쓰는 스키가 조금 다를 것 같은데, 차이가 있어?				0	2022-10-18 19:25:31	2022-10-18 19:25:31
BK22017563	14	전문가	응, 크로스 컨트리를 할 때 착용하는 스키는 우선 스키화의 앞쪽만 고정이 되어서 뒷꿈치가 자유롭게 떨어지도록 만들어졌어. 그리고 알파인 스키를 할 때 착용하는 스키보다 폭이 가늘고 길이도 짧고 무게도 더 가벼워.	스키의 길이와 폭	https://newsis.com/view/?id=NISX20220125_0001736932&cID=10511&pID=10500	2022/01/26	0	2022-10-18 19:25:31	2022-10-18 19:25:31
BK22017563	15	질문자	오, 신기하다. 다음에 열리는 동계올림픽이 시작하면 스키 경기도 챙겨봐야겠어. 지난 베이징 동계올림픽에서 스키 종목 중에 특별히 활약한 한국 선수가 있어?				0	2022-10-18 19:25:31	2022-10-18 19:25:31
BK22017563	16	전문가	지난 베이징 동계올림픽에서 스키 남자 알파인 회전 종목에 출전한 정동현이라는 선수가 최종 순위 21위를 하면서 역대 한국 알파인 스키 올림픽 순위 중 가장 높은 순위를 기록했어.	베이징 동계올림픽 정동현	https://www.yna.co.kr/view/AKR20220929065400007?input=1195m	2022/09/29	0	2022-10-18 19:25:31	2022-10-24 16:46:25
BK22017563	17	질문자	오, 그렇구나. 다음 올림픽에서 더 좋은 활약을 펼치길 기대해봐야겠다. 다음 동계올림픽이 언제 어디에서 열리더라?				0	2022-10-18 19:25:31	2022-10-18 19:25:31
BK22017563	18	전문가	제25회 동계올림픽은 2026년에 알프스 등 아름다운 자연과 다양한 문화유산이 자리잡고 있는 이탈리아 북부에서 열릴 예정이야.	제25회 동계올림픽	https://sports.khan.co.kr/news/sk_index.html?art_id=202202202001003&sec_id=530601&pt=nv	2022/02/20	0	2022-10-18 19:25:31	2022-10-18 19:25:31
BK22017563	19	질문자	아하, 아직 멀었지만 벌써 기다려진다. 그 때까지 나도 스키를 배워둬야겠어. 시간이 벌써 이렇게 됐네, 나는 먼저 들어가볼게!				0	2022-10-18 19:25:31	2022-10-18 19:25:31
BK22017563	20	전문가	그래, 다치지 말고 재미있게 배우길 바래. 조심히 들어가고 다음에 또 보자!				1	2022-10-18 19:25:31	2022-10-24 16:46:25
