id	utterance_id	role	text	search_query	search_URL	reference_date	terminate	regDate	updDate
BK22000671	1	질문자	오랜만에 롤 하러 pc방 갔는데 다들 롤은 안 하고 대회만 보고 있더라? 무슨 중요한 대회라도 하나?				0	2022-07-20 16:09:25	2022-08-02 12:01:32
BK22000671	2	전문가	요즘 롤에 관심 없는 편이구나? 역대 처음으로 우리나라에서 MSI가 열렸는데, 이걸 모르고 있었어?	msi 한국 개최	http://game.mk.co.kr/view.php?year=2022&no=408780	2022/05/09	0	2022-07-20 16:09:25	2022-07-21 09:55:28
BK22000671	3	질문자	한동안 현생에 치이다 보니까 모르고 있었네. 우리나라 팀은 좀 잘하고 있어?				0	2022-07-20 16:09:25	2022-08-02 12:01:32
BK22000671	4	전문가	T1이 최고의 기량을 보여주고 있어. 조별리그에서 6전 전승으로 1등하고 6강전에 진출했거든.	msi t1 결과	https://sports.chosun.com/news/ntype.htm?id=202205170100131690008908&servicedate=20220516	2022/05/16	0	2022-07-20 16:09:25	2022-07-21 09:55:28
BK22000671	5	질문자	와, 내가 알고 있는 그 T1 말하는 거야? 페이커 있었던 그 팀?				0	2022-07-20 16:09:25	2022-08-02 12:01:32
BK22000671	6	전문가	응, 심지어 페이커 아직도 T1에서 활동하고 있어. 올해로 벌써 데뷔 9주년째야. 진짜 대단하지 않아?	페이커 9주년	http://www.newsculture.press/news/articleView.html?idxno=507273	2022/03/23	0	2022-07-20 16:09:25	2022-07-21 09:55:28
BK22000671	7	질문자	대박이다! 프로게이머는 보통 나이 들면 실력이 줄어서 은퇴하지 않나?				0	2022-07-20 16:09:25	2022-08-02 12:01:32
BK22000671	8	전문가	프로게이머는 확실히 다른 스포츠에 비해 에이징 커브가 심하게 나타나긴 하지. 그래서 선수 수명이 엄청 짧은 편이야.	프로게이머 에이징 커브	http://jmagazine.joins.com/monthly/view/335273	2022/01/17	0	2022-07-20 16:09:25	2022-07-21 09:55:28
BK22000671	9	질문자	페이커는 예외인 사례인가 보네. 그래도 이제 20대 중반이니까 30대 전에는 은퇴할 텐데, 이제 볼 수 있는 날이 별로 안 남았겠네.				0	2022-07-20 16:09:25	2022-08-02 12:01:32
BK22000671	10	전문가	30대 되고 나서도 실력만 받쳐준다면 프로게이머로 계속 활동할 수도 있지! 스타2 프로게이머였던 임재덕이나 스트리트 파이터5 프로게이머인 이선우도 30대였는걸?	30대 프로게이머	https://game.dailyesports.com/view.php?ud=2017091500230446535	2017/09/15	0	2022-07-20 16:09:25	2022-07-21 09:55:28
BK22000671	11	질문자	아, 듣고 나니까 나도 임요환이 30대까지 프로게이머 했던 거 어렴풋이 기억난다. 그때 진짜 충격이었는데.				0	2022-07-20 16:09:25	2022-08-02 12:01:32
BK22000671	12	전문가	임요환도 전성기 때 만큼의 활약은 못 했어도 정말 대단했었지. 최초의 30대 프로게이머로 활동했으니까 말이야.	최초의 30대 프로게이머	http://osen.mt.co.kr/article/G1110806885	2018/01/03	0	2022-07-20 16:09:25	2022-07-21 09:55:28
BK22000671	13	질문자	그러게. 전성기 때는 진짜 멋있었는데, 요새는 뭐 하고 살려나.				0	2022-07-20 16:09:25	2022-08-02 12:01:32
BK22000671	14	전문가	예전에는 e스포츠 감독으로 활동하다가 지금은 프로 포커 플레이어로 활동하고 있어.	임요환 현재 직업	http://news.heraldcorp.com/view.php?ud=20210707001088	2021/07/15	0	2022-07-20 16:09:25	2022-07-21 09:55:28
BK22000671	15	질문자	와, 전혀 상상하지 못했던 직업을 가졌네? 포커도 스타크래프트처럼 잘하려나?				0	2022-07-20 16:09:25	2022-08-02 12:01:32
BK22000671	16	전문가	어느 정도 성과는 냈었어! 마카오 포커컵에 나가서 235명 중에 8등이나 했었거든!	임요환 포커 성적	https://sports.news.naver.com/news.nhn?oid=236&aid=0000096641	2014/01/22	0	2022-07-20 16:09:25	2022-07-21 09:55:28
BK22000671	17	질문자	게임만 잘하는 게 아니라 포커까지 잘하는 거 보면 진짜 신기하네. 재능이 넘치는 건가?				0	2022-07-20 16:09:25	2022-08-02 12:01:32
BK22000671	18	전문가	포커나 게임 둘 다 심리전이랑 멀티태스킹이 중요해서 하나를 잘하면 다른 하나도 잘할 확률이 높아.	포커 플레이어 프로게이머	https://sports.news.naver.com/news.nhn?oid=236&aid=0000096641	2014/01/22	0	2022-07-20 16:09:25	2022-07-21 09:55:28
BK22000671	19	질문자	그러면 게임에 재능 없었던 나는 포커에도 재능이 없으려나?				0	2022-07-20 16:09:25	2022-08-02 12:01:32
BK22000671	20	전문가	에이, 꼭 그렇게만 볼 수 있는 건 아니지! 포커 해본 적은 있어?				0	2022-07-20 16:09:25	2022-07-21 09:55:28
BK22000671	21	질문자	아니. 해보려고 했는데 룰이 너무 어려워서 손 대기가 어렵더라고.				0	2022-07-20 16:09:25	2022-08-02 12:01:32
BK22000671	22	전문가	내가 가르쳐 줄 테니까 다음에 시간 될 때 한 번 해보자!				0	2022-07-20 16:09:25	2022-07-21 09:55:28
BK22000671	23	질문자	믿어도 되는 거 맞지? 다음에 연락할 테니까 재밌게 놀아보자!				1	2022-07-20 16:09:25	2022-08-02 12:01:32
