id	utterance_id	role	text	search_query	search_URL	reference_date	terminate	regDate	updDate
BK22015963	1	질문자	혹시 이번 해에 스노보드 대회에서 우리나라가 우승한 일이 있었나요? 주위 사람들이 얘기하는 걸 들었는데 저는 처음 듣는 얘기라서요.				0	2022-10-13 17:31:34	2022-10-13 18:44:34
BK22015963	2	전문가	네, 이상호 선수가 한국 선수 최초로 국제스키연맹 월드컵에서 시즌 종합 우승을 차지했어요. 이상호 선수는 알파인 스노보드 월드컵 남자부 종합 순위 604점으로 2위 슈테판 바우마이스터 506점의 기록을 제치고 1위에 올랐죠.	한국 스노보드 선수 우승	https://www.yna.co.kr/view/AKR20220319051900007?input=1195m	2022/03/19	0	2022-10-13 17:31:34	2022-10-19 09:19:34
BK22015963	3	질문자	우리나라 선수가 우승하다니, 정말 대단하네요. 스노보드 종목은 사실 올림픽인지도 몰랐거든요. 스노보드가 어느 올림픽 때 정식 종목이 된 건가요?				0	2022-10-13 17:31:34	2022-10-19 09:19:34
BK22015963	4	전문가	스노보드는 나가노 동계 올림픽에서 정식 종목으로 채택되었어요. 당시에는 지금과는 달리 남녀 하프파이프와 남녀 대회전 등 4개 종목뿐이었고요.	스노보드 올림픽 종목	https://sports.khan.co.kr/news/sk_index.html?cat=view&art_id=201401211852493&sec_id=530601&pt=nv	2014/01/21	0	2022-10-13 17:31:34	2022-10-19 09:19:34
BK22015963	5	질문자	그렇군요, 제가 스노보드에 대한 지식이 없는데 올림픽에서 스노보드 경기 종류는 어떤 게 있는지 알려주세요.				0	2022-10-13 17:31:34	2022-10-21 11:11:29
BK22015963	6	전문가	네, 스노보드는 알파인 계열과 프리스타일 계열이 있어요. 알파인 계열은 빠른 스피드를 겨루는 것으로 평행대회전, 스노보드 크로스가 있고, 반대로 프리스타일 계열은 예술로 점수를 가르는 것으로 하프파이프, 슬로프스타일, 빅에어가 있어요.	스노보드 경기	https://www.spotvnews.co.kr/news/articleView.html?idxno=501130	2022/01/23	0	2022-10-13 17:31:34	2022-10-20 23:01:55
BK22015963	7	질문자	생각보다 다양하네요, 평행대회전과 스노보드 크로스는 어떻게 하는 건지 궁금해요.				0	2022-10-13 17:31:34	2022-10-13 18:44:34
BK22015963	8	전문가	평행대회전 종목은 높이 200미터에서 550미터 길이 간 펼쳐지는 경기로 평행하게 설치된 블루 또는 레드 코스를 동시에 출발해 빠르게 내려오는 것을 겨루는 거예요. 스노보드 크로스는 4명에서 6명이 한 조인데 뱅크, 롤러, 스파인, 점프 등 다양한 지형지물로 구성된 코스를 빨리 통과해야 하는 종목이고요.	스노보드 알파인 계열	https://www.spotvnews.co.kr/news/articleView.html?idxno=501130	2022/01/23	0	2022-10-13 17:31:34	2022-10-20 23:01:55
BK22015963	9	질문자	듣기만 해도 박진감이 넘치네요. 그럼 하프파이브와 슬로프스타일은 어떤 종목인가요?				0	2022-10-13 17:31:34	2022-10-13 18:44:34
BK22015963	10	전문가	하프파이프는 기울어진 반원통형 슬로프를 내려오며 공중회전과 점프 등 공중에서 연기를 펼쳐야 하는 종목이에요. 그리고 슬로프스타일은 레일, 테이블, 박스, 웨이브, 점프대 등을 활용해 연기하는 종목이고요.	스노보드 프리스타일 계열	https://www.spotvnews.co.kr/news/articleView.html?idxno=501130	2022/01/23	0	2022-10-13 17:31:34	2022-10-20 23:01:55
BK22015963	11	질문자	그렇군요, 마지막으로 빅에어에 대해서도 알려주세요.				0	2022-10-13 17:31:34	2022-10-13 18:44:34
BK22015963	12	전문가	빅에어는 1개의 큰 점프대를 도약해서 점프와 회전, 착지 등 공중에서 묘기와 비거리를 겨루는 종목이에요. 평창올림픽에서 정식 종목이 되었고요.	스노보드 빅에어	https://www.spotvnews.co.kr/news/articleView.html?idxno=501130	2022/01/23	0	2022-10-13 17:31:34	2022-10-20 23:01:55
BK22015963	13	질문자	얼마 전에 등장한 새로운 종목이네요. 혹시 보드 종류에 대해 잘 아시나요? 묘기를 하거나 균형을 잡을 때는 특별한 걸 써야할 거 같은데요.				0	2022-10-13 17:31:34	2022-10-14 14:26:42
BK22015963	14	전문가	네, 하프파이프와 슬로프스타일의 경우 균형을 잡으며 묘기가 극에 달하기 때문에 이러한 부분을 고려해 부드러우면서도 탄력이 좋은 보드를 사용하죠.	하프파이프 슬로프스타일 보드 종류	https://sports.khan.co.kr/news/sk_index.html?cat=view&art_id=201401211852493&sec_id=530601&pt=nv	2014/01/21	0	2022-10-13 17:31:34	2022-10-20 23:01:55
BK22015963	15	질문자	그럼 속도를 빨리 하기 위한 보드는 다른 모양이겠네요?				0	2022-10-13 17:31:34	2022-10-13 18:44:34
BK22015963	16	전문가	그렇죠, 속도를 겨루는 회전은 스피드가 중요하기 때문에 보드의 폭을 최대한 좁게 만들어요. 그리고 턴을 할 때 스피드가 줄지 않게 단단하게 만들죠. 크로스의 경우도 회전과 비슷한 보드를 사용하지만 장애물도 있기 때문에 속도만 위해서는 안되고, 스피드를 생각하면서도 장애물을 통과할 때 안정감을 위해 약간의 탄력성이 필요해요.	회전 크로스 보드 특징	https://sports.khan.co.kr/news/sk_index.html?cat=view&art_id=201401211852493&sec_id=530601&pt=nv	2014/01/21	0	2022-10-13 17:31:34	2022-10-20 23:01:55
BK22015963	17	질문자	그렇군요, 앞으로 스노보드에 관심을 좀 가져야겠어요.				0	2022-10-13 17:31:34	2022-10-13 18:44:34
BK22015963	18	전문가	그래요, 또 궁금한 게 있으신가요?				0	2022-10-13 17:31:34	2022-10-13 17:37:51
BK22015963	19	질문자	아니요, 오늘 좋은 정보 주셔서 감사해요.				0	2022-10-13 17:31:34	2022-10-13 17:37:51
BK22015963	20	전문가	별말씀을요, 다음에 또 대화 나눠요.				1	2022-10-13 17:31:34	2022-10-21 11:11:29
