id	utterance_id	role	text	search_query	search_URL	reference_date	terminate	regDate	updDate
BK22009115	1	질문자	요즘 새로운 운동을 배우는 중인데, 아직 적응기가 안 끝나서 그런지 근육통이 잠도 못 잘 정도로 심해. 그런데도 너무 재밌어서 매일 가고 있어!				0	2022-09-20 22:12:38	2022-09-20 22:12:38
BK22009115	2	전문가	잠에 못 들 정도로 심한 근육통이라니, 고생이 많네. 그런데도 매일 다닐 만큼 푹 빠진 운동이 뭐야?				0	2022-09-20 22:12:38	2022-09-20 22:12:38
BK22009115	3	질문자	지난주부터 스포츠클라이밍을 배우고 있어. 처음부터 제대로 배워야 부상없이 운동할 수 있대서, 아주 열심히 배우고 있지. 자칫 잘못하면 방아쇠수지증후군에 걸릴 수도 있다던데, 그게 어떤 질환이야?				0	2022-09-20 22:12:38	2022-09-20 22:12:38
BK22009115	4	전문가	방아쇠수지증후군은 손가락에 부담이 반복적으로 누적되는 경우에 손가락 힘줄에 마찰이 가해지면서 통증과 염증을 유발하는 질환을 의미해. 손가락 마디를 구부릴 때마다 뚝뚝 소리가 나면서 통증이 발생하고, 시간이 지날수록 이 통증이 심해질뿐만 아니라 손가락을 움직이는 것도 힘들어지지.	클라이밍 방아쇠수지증후군	https://www.edaily.co.kr/news/read?newsId=02463286629143712&mediaCodeNo=257&OutLnkChk=Y	2021/08/03	0	2022-09-20 22:12:38	2022-09-20 22:12:38
BK22009115	5	질문자	그래서 등반하는 사람들이 손가락에 테이핑을 하고 있던 거구나. 스포츠클라이밍은 손과 발을 모두 사용하는데, 유독 손의 힘이 중요한 이유가 뭘까?				0	2022-09-20 22:12:38	2022-09-20 22:12:38
BK22009115	6	전문가	스포츠클라이밍을 할 때는 몸무게를 손가락만으로 버텨야 하는 상황이 빈번하게 발생해. 그래서 무엇보다도 악력이 중요할 수밖에 없지. 하지만 손가락은 신체의 여러 관절 중에서도 작고 연약한 편이라, 과부화에 걸리지 않도록 주의해야해.	클라이밍 악력	https://www.edaily.co.kr/news/read?newsId=02463286629143712&mediaCodeNo=257&OutLnkChk=Y	2021/08/03	0	2022-09-20 22:12:38	2022-09-20 22:12:38
BK22009115	7	질문자	큰일이네, 나도 클라이밍 수업을 받고나오면 발이나 다리보다는 손바닥과 손가락이 많이 아프던데. 네가 설명해준 방아쇠수지증후군 증상처럼 마디에서 뚝뚝 소리가 난 적도 있어. 이럴 때 집에서 간단하게 관리해줄 만한 방법 없을까?				0	2022-09-20 22:12:38	2022-09-20 22:12:38
BK22009115	8	전문가	초기 질환의 경우에는 무엇보다도 손가락에 쌓인 스트레스부터 풀어주는 것이 좋아. 손가락 사용이 많았던 날에는 집에서 따뜻한 물에 10분 정도 온욕을 해주고, 이후 핸드크림을 사용해 손 전체를 부드럽게 마사지해주는 것도 좋지.	클라이밍 온욕	https://www.segye.com/newsView/20210804515683?OutUrl=naver	2021/08/04	0	2022-09-20 22:12:38	2022-09-20 22:12:38
BK22009115	9	질문자	온욕이 좋구나, 따뜻한 물에 담구는 거면 기분까지 좋아질 것 같아. 또 하나 궁금한 게 있는데, 암벽화 사이즈는 어떻게 고르는 것이 좋아?				0	2022-09-20 22:12:38	2022-09-20 22:12:38
BK22009115	10	전문가	암벽화를 구매할 때는 평소 사이즈보다 조금 작거나 딱 맞는 느낌으로 고르는 것이 좋아. 발끝의 감각을 최대한으로 사용하고, 작은 홀드 등을 밟을 때도 중심을 잃지 않아야 하기 때문이지.	클라이밍 암벽화 사이즈	http://www.knnews.co.kr/news/articleView.php?idxno=1382256	2022/07/28	0	2022-09-20 22:12:38	2022-09-20 22:12:38
BK22009115	11	질문자	조금 작은 사이즈를 고르는 게 좋구나. 그런데 사람마다 족형이 조금씩 다르잖아, 나는 발볼이 좀 넓은 편인데 이런 부분들은 어떻게 고르는 것이 좋아?				0	2022-09-20 22:12:38	2022-09-20 22:12:38
BK22009115	12	전문가	암벽화를 고를 때 발볼, 발뒤꿈치, 발등이 신발 안에서 잘 밀착되어 있는지를 체크해보면 돼. 겉돌지 않고 딱 맞으면 자신에게 잘 맞는 암벽화인 거지. 신발을 신은 채로 서서 발목 돌리기를 해보면, 이 세 부위가 안에서 겉돌지 않는지 확인해볼 수 있어.	클라이밍 족형	http://san.chosun.com/news/articleView.html?idxno=14582	2021/01/20	0	2022-09-20 22:12:38	2022-09-20 22:12:38
BK22009115	13	질문자	그거 참 좋은 방법이네, 고마워! 나도 이제 대여하지 않고 내 암벽화를 구매하려고 하거든. 혹시 알아두면 좋을 암벽화 관리 방법도 있을까?				0	2022-09-20 22:12:38	2022-09-20 22:12:38
BK22009115	14	전문가	암벽화가 습하거나 뜨거운 곳에 노출되지 않도록 주의하는 것이 좋아. 신발을 습기나 땀에 젖은 상태로 방치하면 가죽이나 재봉선이 부식될 수 있고, 뜨거운 곳에 노출되면 신발 천과 창 사이 접착제가 늘어나 약해지거나 떨어질 수 있거든. 뭉친 신뭉지를 암벽화 안에 넣어두는 것도 신발의 형태 유지와 습기 제거에 좋은 방법이 될 거야.	클라이밍 암벽화 관리	http://san.chosun.com/news/articleView.html?idxno=14582	2021/01/20	0	2022-09-20 22:12:38	2022-09-20 22:12:38
BK22009115	15	질문자	서늘하고 통풍이 잘 되는 곳에 보관하면 되겠구나, 고마워. 그나저나 요즘 서울은 물론이고 수도권에도 실내 클라이밍장이 많이 생긴 것 같아서 좋아. 올해 새로생긴 곳이 얼마나 되지?				0	2022-09-20 22:12:38	2022-09-20 22:12:38
BK22009115	16	전문가	최근 6개월 내에 수도권에는 약 15곳 정도의 실내 암장이 새로 생겼어. 그 중 서울에만 해도 8곳이나 생겼지.	클라이밍 수도권 실내암장	http://www.psnews.co.kr/news/articleView.html?idxno=2011131	2022/07/11	0	2022-09-20 22:12:38	2022-09-20 22:12:38
BK22009115	17	질문자	와, 역시 서울이 제일 많네. 기회가 된다면 얼마전에 오픈한 북한산 국제클라이밍센터도 한 번 가보고 싶어. 거기 운영시간이 어떻게 돼?				0	2022-09-20 22:12:38	2022-09-20 22:12:38
BK22009115	18	전문가	화요일에서 금요일은 오전 9시30분부터 오후 9시30분까지이고, 주말과 공휴일은 오전 9시30분부터 오후 7시까지 운영돼. 참고로 매주 월요일은 휴장일이야.	북한산 국제클라이밍센터	https://view.asiae.co.kr/article/2022071507303844884	2022/07/15	0	2022-09-20 22:12:38	2022-09-20 22:12:38
BK22009115	19	질문자	자세한 정보 알려줘서 고마워. 다음에 또 궁금한 점 생기면 물어보러 올게!				0	2022-09-20 22:12:38	2022-09-20 22:12:38
BK22009115	20	전문가	고맙긴 뭘, 그래 언제든지 연락해!				1	2022-09-20 22:12:38	2022-09-28 14:09:58
