id	utterance_id	role	text	search_query	search_URL	reference_date	terminate	regDate	updDate
BK22015298	1	질문자	얼마 전에 친한 친구가 태권도 선수가 된 후로 친구가 출전하는 경기나 중계 영상을 몇 번인가 봤는데, 배경 지식이 모자라니까 경기 내용이 잘 이해가 안 가더라고. 그래서 태권도에 관해 이것저것 좀 물어보고 싶어. 태권도는 언제 생겨난 무술이고, 어떤 특징이 있어?				0	2022-10-07 10:16:19	2022-10-07 10:16:19
BK22015298	2	전문가	태권도는 무기를 쓰지 않고 맨손과 발로 공격과 방어를 하는 전통 무예인데, 특히 발차기 기술이 특징적이지. 태권도가 만들어진 시기는 비교적 최근이야. 태권도의 시작은 1945년으로 거슬러 올라가게 되는데, 일제 해방을 전후로 해 국내에 무술 도장이 여럿 만들어져. 그리고 그중에서 소위 5대관으로 불리면서 제일 유명했던 도장들이 나뉘며 만들어졌던 9개관이 다시 1960년대에 들어 합쳐지면서 현대 태권도의 전신이 되지.	태권도	https://ko.wikipedia.org/wiki/%ED%83%9C%EA%B6%8C%EB%8F%84	2022/09/26	0	2022-10-07 10:16:19	2022-10-07 10:16:19
BK22015298	3	질문자	태권도의 시작이 생각했던 것보다 상당히 최근이라 놀랐어. 발차기 기술이 특징적이라고 했는데, 태권도의 발차기 기술에는 어떤 것들이 있을까?				0	2022-10-07 10:16:19	2022-10-07 10:16:19
BK22015298	4	전문가	태권도 발차기 중 핵심 동작은 앞차기, 돌려차기, 몸돌려차기, 옆차기, 이렇게 네 가지이고, 여기서 변형된 비틀어차기, 반달차기 등 여러 파생 발기술이 있어. 발차기는 태권도에서 가장 중요한 기술인 만큼 그 종류를 다 합치면 25가지나 돼.	태권도 발차기 기술	https://www.ftimes.kr/news/articleView.html?idxno=12310	2021/09/01	0	2022-10-07 10:16:19	2022-10-07 10:16:19
BK22015298	5	질문자	그렇게나 많은 기술이 있을 거라고는 생각지도 못했어. 다른 무술의 발차기 기술과 비교했을 때 태권도의 발차기는 어느 정도 위력이야?				0	2022-10-07 10:16:19	2022-10-07 10:16:19
BK22015298	6	전문가	지난 2010년 TV 내셔널지오그래픽이 만든 파이트 사이언스에서는 무에타이, 가라테, 카포에이라, 태권도 등 여러 무술의 발차기 강도를 비교 측정했는데, 무에타이의 돌려차기는 시속 209km에 힘 635kg, 가라테의 앞차기는 시속 114km에 힘 195kg, 카포에이라의 발차기로 바닥에 쭈그렸다가 돌려 차 올리는 기술인 마텔로 드 네가티바는 시속 159km에 힘 816kg이었어. 그리고 태권도의 돌려차기는 시속 219km에 힘 1043kg으로 속도와 힘 모두 1등을 차지했지.	태권도 충격량 1톤 발차기	https://news.jtbc.co.kr/article/article.aspx?news_id=NB11293688	2016/08/17	0	2022-10-07 10:16:19	2022-10-07 10:16:19
BK22015298	7	질문자	힘 1043kg이라니 믿기지 않는 위력이네. 태권도에는 품새라는 것도 있던데, 품새에는 어떤 종류가 있고, 품새를 겨루는 대회도 있는지 알려줄래?				0	2022-10-07 10:16:19	2022-10-07 10:16:19
BK22015298	8	전문가	품새에는 태극 1~8장, 고려, 금강, 평원, 태백 등이 있어. 태권도 품새 경기는 2009년 하계 유니버시아드 대회, 2018 자카르타-팔렘방 아시안게임에서 세부 종목으로 채택되어 열리고 있지.	태권도 품새 종류	https://ko.wikipedia.org/wiki/%ED%92%88%EC%83%88	2022/09/16	0	2022-10-07 10:16:19	2022-10-07 10:16:19
BK22015298	9	질문자	품새 이름들이 참 멋들어진 것 같아. 고려 품새는 어떤 특징이 있을까?				0	2022-10-07 10:16:19	2022-10-07 10:16:19
BK22015298	10	전문가	고려 품새는 우리나라 고려 왕조와 깊은 연관이 있는 품새인데, 유단자 품새 중 가장 많은 기술이 등장해. 교본상 30동작에 연결 동작도 많아서 총 48동작으로 구성되어 있지. 고려 품새는 올곧은 선비 정신을 표현하는 직선 형태의 연속 공격이 다른 품새에 비해 많은 것도 특징이야.	태권도 고려 품새 동작	http://www.mooyenews.kr/5864	2015/08/21	0	2022-10-07 10:16:19	2022-10-07 10:16:19
BK22015298	11	질문자	품새마다 그렇게 의미가 담겨 있나 보구나. 그럼 금강 품새는 어떤 특징이 있으려나? 금강 품새에 나오는 동작도 하나만 같이 소개해 줄래?				0	2022-10-07 10:16:19	2022-10-07 10:16:19
BK22015298	12	전문가	고려 품새와 다르게 금강 품새는 적의 목숨을 뺏는 치명적인 공격 동작이 아예 없어. 금강 품새의 동작은 주로 몸통 공격과 바탕손 공격, 하단 공격으로 이루어져 있는데, 살생유택의 자비를 표현한다고 볼 수 있지. 금강 품새에 나오는 동작으로는 금강막기를 소개해 줄게. 금강역사를 상징하는 기술인 금강막기는 양팔을 전부 사용해 옆 내려막기와 얼굴 올려막기를 동시에 하는 복합 방어 기술이야.	태권도 금강 품새 동작	http://www.mooyenews.kr/6082	2015/10/23	0	2022-10-07 10:16:19	2022-10-07 10:16:19
BK22015298	13	질문자	이름도 멋지고 동작도 멋있네. 참, 태권도 얘기를 하다 보니까 문득 격파가 생각나는데, 혹시 격파 대회도 있을까?				0	2022-10-07 10:16:19	2022-10-07 10:16:19
BK22015298	14	전문가	응, 올해 대한태권도협회에서 격파분야를 새로 만들었어. 그리고 단일종목으로 유일하게 승인받은 제1회 백석대학교총장배 전국 태권도 격파 대회가 5월 27일 오전 11시부터 28일까지 천안 유관순 체육관에서 열렸지.	태권도 격파 대회	http://www.ebaekje.co.kr/news/articleView.html?idxno=126588	2022/05/27	0	2022-10-07 10:16:19	2022-10-07 10:16:19
BK22015298	15	질문자	격파하는 거 너무 멋있던데, 열리는 대회가 더 있나 알아봐야겠는걸. 태권도 중계 영상을 찾을 때 검색어로 쓰고 싶어서 그런데, 우리나라 태권도 선수를 한 명만 간략한 이력이랑 같이 소개해 줄래?				0	2022-10-07 10:16:19	2022-10-07 10:16:19
BK22015298	16	전문가	이다빈 선수를 소개해 줄게. 이다빈 선수는 2014 인천 아시안게임 62kg급에 이어서 2018 자카르타, 팔렘방 아시안게임 67kg 초과급에서 금메달을 획득해 대회 2연승을 기록했어. 게다가, 2016년 마닐라 아시아대회 73kg이랑 2019년 맨체스터 세계대회를 제패하기도 했지.	이다빈 태권도 선수	https://www.hani.co.kr/arti/sports/sportstemp/1005417.html	2021/07/28	0	2022-10-07 10:16:19	2022-10-07 10:16:19
BK22015298	17	질문자	이력이 장난 아니네, 경기 영상을 꼭 찾아봐야겠어. 궁금하던 게 많이 풀려서 앞으로 더 재미있게 태권도 경기를 볼 수 있을 거 같아.				0	2022-10-07 10:16:19	2022-10-07 10:16:19
BK22015298	18	전문가	다행이야, 도움이 된 것 같아서 기쁘네.				0	2022-10-07 10:16:19	2022-10-07 10:16:19
BK22015298	19	질문자	엄청 도움이 많이 됐어, 고마워. 나는 그럼 태권도 경기 영상 좀 찾아보러 가 볼게.				0	2022-10-07 10:16:19	2022-10-07 10:16:19
BK22015298	20	전문가	응. 경기 보다가 혹시 궁금한 거 생기면 또 연락하고, 다음에 만나자.				1	2022-10-07 10:16:19	2022-10-13 16:59:44
