id	utterance_id	role	text	search_query	search_URL	reference_date	terminate	regDate	updDate
BK22009183	1	질문자	요즘 미식 축구에 관심이 많은데 미식축구가 뭔지 자세히 알려주실 수 있어요?				0	2022-09-21 16:06:59	2022-09-21 16:06:59
BK22009183	2	전문가	미식축구란 구기종목으로 미국에서 발달 하였고 풋볼의 일종이죠. 강인한 체력과 다양한 전략이 요구되는 스포츠에요.	미식축구	https://ko.wikipedia.org/wiki/%EB%AF%B8%EC%8B%9D%EC%B6%95%EA%B5%AC	2022/06/25	0	2022-09-21 16:06:59	2022-09-21 16:06:59
BK22009183	3	질문자	전략과 체력이 동시에 요구되는군요. 그러면 미식축구를 하는 방법은 어떻게 돼요?				0	2022-09-21 16:06:59	2022-09-21 16:06:59
BK22009183	4	전문가	미식축구공을 상대편 진영의 끝쪽에 갖다 놓아야하고 럭비나 축구랑 다르게 포지션이 전문화 되어 있어 공수 구분이 뚜렷하죠.	미식축구 방법	https://ko.wikipedia.org/wiki/%EB%AF%B8%EC%8B%9D%EC%B6%95%EA%B5%AC	2022/06/25	0	2022-09-21 16:06:59	2022-09-21 16:06:59
BK22009183	5	질문자	공수 구분이 뚜렷하다니 재밌을 것 같아요. 그런데 미식축구와 럭비가 같은거 아닌가요?				0	2022-09-21 16:06:59	2022-09-21 16:06:59
BK22009183	6	전문가	럭비는 축구나 농구같이 자유롭게 경기장을 돌아다니며 공을 뺏고 상대방 진영으로 가지만 미식축구는 상대와 자기 진영이 나위어 있어 수비시에는 상대편이 자기 진영으로 오는 것을 막고 반대로 공격시엔 상대영역에 침투하여 10야드 간격으로 들어가 영역을 넓히죠.	미식축구 차이점	https://ko.wikipedia.org/wiki/%EB%AF%B8%EC%8B%9D%EC%B6%95%EA%B5%AC	2022/06/25	0	2022-09-21 16:06:59	2022-09-21 16:06:59
BK22009183	7	질문자	미식축구와 럭비가 이렇게나 달랐다니 저는 같은 줄 알고 있었거든요. 혹시 차이점이 더 있나요?				0	2022-09-21 16:06:59	2022-09-21 16:06:59
BK22009183	8	전문가	미식축구는 럭비와 다르게 전진패스가 허용 돼 있고, 상대방 공을 뺐는 것이 중점이 아니라 넘어 오지 못하게 막는게 중점이에요.	미식축구 차이점	https://ko.wikipedia.org/wiki/%EB%AF%B8%EC%8B%9D%EC%B6%95%EA%B5%AC	2022/06/25	0	2022-09-21 16:06:59	2022-09-21 16:06:59
BK22009183	9	질문자	공을 뺐는게 중점이 아니라 막는게 중점이었군요. 막기 위해선 어떤 방법이 있죠?				0	2022-09-21 16:06:59	2022-09-21 16:06:59
BK22009183	10	전문가	막는 방법으로는 블로킹이라는 기술이 있어요. 럭비에는 없는 기술이며 공을 가지지 않는 선수를 막는거죠.	미식축구 태클	https://ko.wikipedia.org/wiki/%EB%AF%B8%EC%8B%9D%EC%B6%95%EA%B5%AC	2022/06/25	0	2022-09-21 16:06:59	2022-09-21 16:06:59
BK22009183	11	질문자	블로킹이라는 기술로 선수들을 막는 거군요. 그러면 미식축구의 최초의 경기는 언제였나요?				0	2022-09-21 16:06:59	2022-09-21 16:06:59
BK22009183	12	전문가	최초 경기는 1869년 11월 6일 뉴저지에 있는 프리스턴 대학과 뉴브런즈윅래트커스 대학에서 열렸어요.	미식축구 역사	https://ko.wikipedia.org/wiki/%EB%AF%B8%EC%8B%9D%EC%B6%95%EA%B5%AC	2022/06/25	0	2022-09-21 16:06:59	2022-09-21 16:06:59
BK22009183	13	질문자	최초의 경기가 1869년이라니 굉장히 오래 되었네요. 미식축구는 몇명이서 하는 스포츠인가요?				0	2022-09-21 16:06:59	2022-09-21 16:06:59
BK22009183	14	전문가	미식축구는 한 팀에 11명이이에요. 그리고 선수 교체가 자유로우며 한 팀에 수비,공격,스페셜 팀 선수로 나뉘게 되죠.	미식축구	https://ko.wikipedia.org/wiki/%EB%AF%B8%EC%8B%9D%EC%B6%95%EA%B5%AC	2022/06/25	0	2022-09-21 16:06:59	2022-09-21 16:06:59
BK22009183	15	질문자	미식축구는 11명이 한 팀을 이뤄 하는 스포츠군요. 그러면 심판은 어떻게 보나요?				0	2022-09-21 16:06:59	2022-09-21 16:06:59
BK22009183	16	전문가	한 경기에서 총 7명의 심판이 구성되며 엄파이어, 레퍼리, 라인저지, 헤드라인즈맨, 사이드저지, 필드저지, 백저지로 이루어져 있어요. 그 중 흰 모자를 쓴 레퍼리가 운영의 중심이 되죠.	미식축구 심판	https://ko.wikipedia.org/wiki/%EB%AF%B8%EC%8B%9D%EC%B6%95%EA%B5%AC	2022/06/25	0	2022-09-21 16:06:59	2022-09-21 16:06:59
BK22009183	17	질문자	심판이 7명이라니 굉장히 많이 구성되는군요.				0	2022-09-21 16:06:59	2022-09-21 16:06:59
BK22009183	18	전문가	궁금이님 말씀대로 미식축구는 선수도 심판도 꽤 많은 편이죠.				0	2022-09-21 16:06:59	2022-09-21 16:06:59
BK22009183	19	질문자	그러게요. 미식축구에 대해 많이 배워 가는 것 같아요. 좋은 정보 주셔서 감사하고 다음에 또 만나요.				1	2022-09-21 16:06:59	2022-09-29 15:29:16
BK22009183	20	전문가	물어봐주셔서 오히려 제가 감사해요. 더 궁금한 점 있으시면 언제든지 찾아오세요. 또 봐요!				0	2022-09-21 16:06:59	2022-09-21 16:06:59
