id	utterance_id	role	text	search_query	search_URL	reference_date	terminate	regDate	updDate
BK22017165	1	질문자	최근에 농구에 관심이 많아졌어요.				0	2022-10-18 12:35:50	2022-10-18 13:36:10
BK22017165	2	전문가	제가 한때 농구선수로도 활동했었는데, 궁금한 건 저한테 여쭤보세요.				0	2022-10-18 12:35:50	2022-10-18 13:36:10
BK22017165	3	질문자	농구의 득점 규칙이 어떻게 되나요?				0	2022-10-18 12:35:50	2022-10-18 13:36:10
BK22017165	4	전문가	공을 상대팀의 바스켓에 던져 넣었을 때 득점이 발생해요. 이때 필드 골은 2점, 3점 라인 밖에서 넣은 슛은 3점, 그리고 자유투는 1점이에요.	농구	https://ko.wikipedia.org/wiki/%EB%86%8D%EA%B5%AC	2022/08/23	0	2022-10-18 12:35:50	2022-10-18 13:36:10
BK22017165	5	질문자	그렇군요, 근데 최근에 프로농구 규칙이 바뀌었다고 하지 않았나요? 어떻게 바뀌었죠?				0	2022-10-18 12:35:50	2022-10-18 13:36:10
BK22017165	6	전문가	크게 세 가지가 있는데, 첫번째는 속공 상황에 적용되는 U파울이 강화돼서 진행 중인 선수나, 당장 공을 갖고 있지 않지만 공을 잡을 기회가 있는 선수에게도 U파울이 적용돼요. 두번째는 부상을 입은 선수가 약 15초 안에 경기를 할 수가 없거나 치료를 받는다면 혹은 감독을 비롯한 소속팀 인원들에게 도움을 받는다면, 그 선수는 바로 교체되어야 해요. 세번째는 립 스루가 나왔을 때 슈팅 파울로 적용하지 않는다는 거예요.	농구 규칙	https://www.nocutnews.co.kr/news/5425426	2020/10/08	0	2022-10-18 12:35:50	2022-10-18 13:36:10
BK22017165	7	질문자	2020년에 여자농구에도 규칙 변화가 있지 않았나요?				0	2022-10-18 12:35:50	2022-10-18 13:36:10
BK22017165	8	전문가	맞아요, 핸드 체킹에 대해 룰을 좀더 엄격하게 적용하기로 했어요. 기존에는 수비를 할 때 손을 사용하거나 상대 선수와 과도하게 신체 접촉하는 걸 일부 이해하고 넘어갔지만, 2020년부터는 철저하게 반칙으로 삼기 시작했어요.	여자농구 핸드 체킹	http://www.sportsworldi.com/newsView/20200928514868	2020/09/28	0	2022-10-18 12:35:50	2022-10-18 13:36:10
BK22017165	9	질문자	그렇군요, 혹시 립스루는 정확히 어떤 동작인가요?				0	2022-10-18 12:35:50	2022-10-18 13:36:10
BK22017165	10	전문가	립스루 동작에서는 공격수가 패스 받은 공을 양손으로 잡은 상태에서 수비수 바로 앞에서 전진하는 팔 동작을 취하는 거예요. 볼을 가진 양팔을 수비자를 향해 전진하는 척 위협하듯이 뻗는 동작이죠.	립스루 농구	http://sports.hankooki.com/news/articleView.html?idxno=6254100	2018/01/12	0	2022-10-18 12:35:50	2022-10-18 13:36:10
BK22017165	11	질문자	그런데 농구는 코트에서 경기가 이루어지는데 왜 필드골이라고 부르나요?				0	2022-10-18 12:35:50	2022-10-18 13:36:10
BK22017165	12	전문가	일단 농구에서 필드골은 덩크에서 3점슛까지 다양하게 득점을 넣는 걸 가리키죠. 농구 경기장을 코트라고 부르는 건 맞는데, 축구 같은 다른 스포츠의 필드랑 비슷하기 때문에 경기에서 득점을 필드골이라고 부른다고 일반적으로 알려져 있어요.	필드골 농구 코트	http://www.maniareport.com/view.php?ud=2021051908541532045e8e941087_19	2021/05/19	0	2022-10-18 12:35:50	2022-10-18 13:36:10
BK22017165	13	질문자	큰 의미는 없는 거네요. 여자 농구와 남자 농구에서 같은 농구공을 사용하나요?				0	2022-10-18 12:35:50	2022-10-18 13:36:10
BK22017165	14	전문가	아뇨, 현재 남자와 여자는 농구공의 크기가 달라요. 남자 농구는 공의 둘레가 29.5인치, 무게는 22온스인 반면에 여자 농구는 둘레 28.5인치에 무게는 20온스예요.	여자 남자 농구공 인치	http://www.maniareport.com/view.php?ud=2021052615115810055e8e941087_19	2021/05/26	0	2022-10-18 12:35:50	2022-10-18 13:36:10
BK22017165	15	질문자	여자 농구공이 좀더 작고 가볍군요. 바스켓에 붙은 사각형판 안쪽에 하얀색 직사각형은 뭐죠?				0	2022-10-18 12:35:50	2022-10-18 13:36:10
BK22017165	16	전문가	백보드라고 해서, NBA 규칙에 따르면 안쪽에 하얀 색 직사각형으로 나타내요. 선수들이 슛을 쏠 때 활용하게 하는 목적인데 처음 농구 배울 때도 보통 백보드를 맞춰 넣는 것부터 시작해요.	농구 백보드	http://www.maniareport.com/view.php?ud=2021052308010485335e8e941087_19	2021/05/23	0	2022-10-18 12:35:50	2022-10-18 13:36:10
BK22017165	17	질문자	흥미롭네요, 농구는 처음에 어떻게 시작되었나요?				0	2022-10-18 12:35:50	2022-10-18 13:36:10
BK22017165	18	전문가	1891년 미국 스프링필드 YMCA 체육학교에서 근무하던 캐나다인 선생님 제임스 네이스미스가 농구를 만들었어요. 북부지방은 겨울이 길어 야외에서 할 스포츠가 별로 없었어요. 그래서 겨울에 할 만한 스포츠를 찾다가 실내에서 아이들이 바구니를 달아놓고 노는 것을 보고 네이스미스가 농구에 대한 영감을 얻었다고 알려져 있어요.	농구 유래	https://news.koreadaily.com/2019/11/04/society/opinion/7746912.html	2019/11/04	0	2022-10-18 12:35:50	2022-10-18 13:36:10
BK22017165	19	질문자	아이들 놀이에서 유래되었다니 신기하군요. 알려주신 내용 잘 기억하면서 농구 경기도 재밌게 관람할게요.				0	2022-10-18 12:35:50	2022-10-18 13:36:10
BK22017165	20	전문가	네, 나중에 시간 되실 때 저랑 농구 경기를 같이 보러 가요.				1	2022-10-18 12:35:50	2022-10-18 13:36:10
