id	utterance_id	role	text	search_query	search_URL	reference_date	terminate	regDate	updDate
BK22016439	1	질문자	동생이 축구를 좋아하는데 새벽에 발롱도르 시상식 본다고 밤을 새운다고 하더라고. 다음날 학교 가야 하니까 빨리 자라고 했더니 이건 진짜 중요한 시상식이라 꼭 봐야 한다고 우기던데, 발롱도르는 어떤 상이야?				0	2022-10-18 12:06:56	2022-10-19 13:31:26
BK22016439	2	전문가	발롱도르는 프랑스 축구 전문 잡지인 프랑스풋볼이 주관하는 상인데, 한 해 동안 최고의 활약을 선보인 축구 선수에게 주는 권위 있는 상이야.	발롱도르 시상식	https://www.mbn.co.kr/news/sports/4864388	2022/10/18	0	2022-10-18 12:06:56	2022-10-19 13:31:26
BK22016439	3	질문자	그렇구나. 뭐 전통과 역사가 있다나 어쨌다나 하던데 언제부터 생겨난 시상식인 거야?				0	2022-10-18 12:06:56	2022-10-19 13:31:26
BK22016439	4	전문가	발롱도르는 1956년에 시작되었는데 축구 선수가 받을 수 있는 가장 명예로운 상이야.	발롱도르 시상식 시초	http://osen.mt.co.kr/article/G1111968204	2022/10/18	0	2022-10-18 12:06:56	2022-10-19 13:31:26
BK22016439	5	질문자	그럼 축구선수들에게는 그야말로 꿈의 상이겠네. 우리나라 손흥민 선수도 요즘 잘하던데 발롱도르 상 후보에 못 올랐어?				0	2022-10-18 12:06:56	2022-10-19 13:31:26
BK22016439	6	전문가	아냐, 손흥민은 2022 발롱도르 후보 30명 가운데서 11위를 차지했어.	2022 손흥민 발롱도르	https://www.joongang.co.kr/article/25109956#home	2022/10/18	0	2022-10-18 12:06:56	2022-10-21 10:11:39
BK22016439	7	질문자	내가 잘 몰라서 그러는데, 그 정도면 잘한 거야? 예전에는 발롱도르 순위가 몇 위였는데?				0	2022-10-18 12:06:56	2022-10-19 13:31:26
BK22016439	8	전문가	2019년에 총 30명의 발롱도르 후보 중 하나로 처음 이름을 올렸는데, 이때도 아시아 선수 가운데 최고 순위인 22위에 올랐었어.	손흥민 역대 발롱도르 순위	https://news.sbs.co.kr/news/endPage.do?news_id=N1006936072	2022/10/18	0	2022-10-18 12:06:56	2022-10-19 13:31:26
BK22016439	9	질문자	오, 자기 기록을 자기가 깬 거네. 손의 파트너인 같은 팀 해리 케인도 엄청나게 잘 하는 선수로 알고 있는데, 그럼 케인은 몇 위에 올랐어?				0	2022-10-18 12:06:56	2022-10-19 13:31:26
BK22016439	10	전문가	해리 케인도 손흥민과 함께 최종 후보에 올라 21위에 선정되었어. 그래서 토트넘 구단에서는 손흥민과 케인이 서로 안고 있는 사진과 함께 두 선수에게 축하한다는 메시지를 전하기도 했어.	2022 해리케인 발롱도르 순위	https://news.mt.co.kr/mtview.php?no=2022101806513977149	2022/10/18	0	2022-10-18 12:06:56	2022-10-21 10:11:39
BK22016439	11	질문자	와, 손흥민이 케인보다도 순위가 높네. 지난 시즌에 손흥민이 진짜 잘하긴 했어. 그럼 발롱도르 상은 누가 받았는데?				0	2022-10-18 12:06:56	2022-10-21 10:11:39
BK22016439	12	전문가	발롱도르 수상자는 100명의 기자단 투표로 결정되는데, 2위 사디오 마네, 3위 케빈 더브라위너를 제치고 벤제마가 받았지.	2022 발롱도르 수상자	https://news.sbs.co.kr/news/endPage.do?news_id=N1006936072	2022/10/18	0	2022-10-18 12:06:56	2022-10-19 13:31:26
BK22016439	13	질문자	그렇구나. 그 벤제마라는 선수는 어느 팀에서 뛰는 선수야? 지난 시즌에 얼마나 좋은 성적을 냈길래 선정되었는지 궁금하다.				0	2022-10-18 12:06:56	2022-10-19 13:31:26
BK22016439	14	전문가	벤제마는 35살의 백전노장이야. 레알 마드리스 소속으로, 2021~2022시즌에 유럽축구연맹 챔피언스리그와 스페인의 프리메라리가에서 팀이 우승하는 데 이바지했지. 또 UCL에서는 15골로 득점왕에 올랐고, 라리가에서도 득점 1위를 기록했어. 무려 27골을 넣었거든.	2022 발롱도르 벤제마	https://mbn.co.kr/news/sports/4864388	2022/10/18	0	2022-10-18 12:06:56	2022-10-19 13:31:26
BK22016439	15	질문자	정말 잘하는 선수구나. 근데 세계적인 축구선수라고 하면 난 호날두랑 메시 먼저 떠오르는데, 이 두 사람은 아예 순위에도 못 들었어?				0	2022-10-18 12:06:56	2022-10-19 13:31:26
BK22016439	16	전문가	호날두는 20위를 차지했어. 발롱도르를 5번이나 받았지만, 이번에는 30명 가운데 20위에 머무르고 말았지. 또 메시는 발롱도르를 7회 받은 최다 수상자이지만 이번엔 아예 순위에도 오르지 못했어.	2022 발롱도르 메시 호날두	https://news.mt.co.kr/mtview.php?no=202210180141774975O&pDepth1=sports&pDepth2=Stotal&page=1	2022/10/18	0	2022-10-18 12:06:56	2022-10-19 13:31:26
BK22016439	17	질문자	하, 역시 나이는 못 속이는구나. 이제는 그들도 역사의 뒷길로 사라지게 되는 건가 보네.				0	2022-10-18 12:06:56	2022-10-19 13:31:26
BK22016439	18	전문가	아무래도 그런 분위기지. 하지만 이들이 세계 최고의 축구선수라는 사실은 변하지 않을 거야.				0	2022-10-18 12:06:56	2022-10-19 13:31:26
BK22016439	19	질문자	그렇긴 하네, 축구를 잘 모르는 나도 이 두 선수만큼은 잘 아니까. 아무튼 오늘 발롱도르에 대한 정보 알려줘서 고마웠고 다음에 또 이야기 나누자.				1	2022-10-18 12:06:56	2022-10-21 10:11:39
BK22016439	20	전문가	나도 오늘 대화 재미있었어. 그럼 다음에 또 재미있는 대화 나누도록 하자. 그럼 안녕.				0	2022-10-18 12:06:56	2022-10-19 13:31:26
