id	utterance_id	role	text	search_query	search_URL	reference_date	terminate	regDate	updDate
BK22016207	1	질문자	요즘 롤드컵이 한창 진행 중이라 경기 보는 재미가 쏠쏠한데, 어제는 바쁜 일이 있어서 못 봤네. 혹시 어제 경기 봤으면 좀 물어봐도 될까?				0	2022-10-16 09:17:42	2022-10-16 09:17:42
BK22016207	2	전문가	응, 나는 경기 항상 챙겨 보니까 뭐든 물어봐.				0	2022-10-16 09:17:42	2022-10-19 15:38:50
BK22016207	3	질문자	물어볼 사람이 바로 옆에 있어서 다행이네. 어제 담원이랑 G2 경기 때 출전 선수랑 챔피언 픽은 어떻게 됐어?				0	2022-10-16 09:17:42	2022-10-16 09:17:42
BK22016207	4	전문가	담원 기아 쪽에서는 너구리 장하권이랑 캐니언 김건부, 쇼메이커 허수, 덕담 서대길, 켈린 김형규가 나왔고, G2 측에서는 브로큰 블레이드 세르겐 첼리크, 얀코스 마르친 얀코프스키, 캡스 라스무스 뷘터, 플란키드 빅터토르토사, 타르가마스 라피엘 크라비가 출전했어. 챔피언 픽을 보면, 담원 기아는 세주아니에 비에고, 르블랑, 루시안, 나미를 가져갔고, G2 측은 피오라랑 벨베스, 스웨인, 세나에 세라핀 조합을 골랐지.	롤드컵 15일 담원 G2 픽	https://www.xportsnews.com/article/1642177	2022/10/15	0	2022-10-16 09:17:42	2022-10-16 09:17:42
BK22016207	5	질문자	조합이 재미있게 짜인 것 같은 걸. 참, 너구리 장하권 선수는 한동안 쉬었던 거 같은데, 어쩌다 복귀를 결정했고, 여러 팀 중에 왜 담원 기아로 돌아갔는지 혹시 알아?				0	2022-10-16 09:17:42	2022-10-19 15:38:50
BK22016207	6	전문가	응, 장하권 선수의 말에 따르면, 휴식 기간 동안 다른 게임을 하거나 간간이 대회를 보면서 많이 쉬었대. 그런데 친구와 대화를 하다가 스프링 시즌이 끝날 때까지도 정말 좋아하는 무언가를 찾지 못하면 다시 프로 복귀를 하는 게 어떻겠는냐는 얘기가 나왔고, 스프링 시즌이 끝날 무렵이 되니 다시 롤을 해야겠다는 느낌이 왔대. 담원 기아로 복귀한 이유는 기존 감독이나 코치, 멤버가 다 남아 있는 데다가, 한 번 합을 맞춰 보았던 곳으로 가는 게 본인은 물론 팀 쪽에서도 편할 것이라고 생각해서고.	장하권 담원 복귀 이유	https://www.kukinews.com/newsView/kuk202204210047	2022/04/21	0	2022-10-16 09:17:42	2022-10-19 15:38:50
BK22016207	7	질문자	정말 좋아하는 걸 찾다가 복귀했다니, 슬럼프에 빠졌던 건가 싶어서 안타깝기도 하고, 한편으로는 다시 기운을 낸 거 같아서 응원해 주고 싶기도 하네. 선수 얘기가 나와서 말인데, 쇼메이커 허수 선수도 자주 보는 거 같아. 이 선수 포지션이랑 간략한 이력을 좀 소개해 줄래?				0	2022-10-16 09:17:42	2022-10-16 09:17:42
BK22016207	8	전문가	응, 우선, 쇼메이커 허수 선수의 포지션은 미드라이너야. 2017년 11월 17일에 리그 오브 레전드 챌린저스 코리아의 담원 게이밍에 들어가면서 프로 생활을 시작한 뒤, 2020 케스파컵에 출전해 대회 MVP에 선정되는 등 팀의 우승에 크게 기여했어. 2022시즌을 앞두고는 DWG KIA와 재계약을 맺었지.	쇼메이커 허수	https://ko.wikipedia.org/wiki/%EC%87%BC%EB%A9%94%EC%9D%B4%EC%BB%A4	2022/08/18	0	2022-10-16 09:17:42	2022-10-16 09:17:42
BK22016207	9	질문자	2017년부터 프로 생활을 시작했다니 경력이 참 오래된 선수였구나. 그럼 경기 얘기로 돌아와서, 경기는 대략 어떻게 진행됐어?				0	2022-10-16 09:17:42	2022-10-16 09:17:42
BK22016207	10	전문가	먼저, 담원 기아는 탑에서 킬을 나눠 가져간 뒤, 미드 교전에서도 켈린의 나미가 캡스의 스웨인을 잡았어. 그리고 너구리의 세주아니가 브로큰 블레이드의 피오라를 혼자 잡아내면서 담원 기아는 G2의 미드 1차 포탑을 밀어냈지. 이후, 담원 기아는 21분 만에 드래곤 3스택을 쌓으면서 탑 2차 포탑에서도 G2 선수 3명을 처리했고, 미드와 바텀 3차 포탑을 철거한 뒤에는 G2 쪽 미드에서 일어난 전투에서 대승을 해. 그렇게 담원 기아는 G2 본진으로 진입해 쌍둥이 포탑이랑 넥서스까지 부수면서 승리했지.	롤 15일 담원 g2	https://www.dailyesports.com/view.php?ud=202210150619264314b91e133c1f_27	2022/10/15	0	2022-10-16 09:17:42	2022-10-16 09:17:42
BK22016207	11	질문자	상당히 일방적인 경기가 펼쳐진 거 같네. 어제 담원이 치른 다른 경기들 내용도 좀 물어보고 싶은데, EG랑 붙은 경기 때 양측 챔피언 픽은 뭐였어?				0	2022-10-16 09:17:42	2022-10-16 09:17:42
BK22016207	12	전문가	담원 기아 쪽은 아트록스에 세주아니, 사일러스, 드레이븐, 레나타를 가져갔고, EG 측은 오른, 벨베스, 아칼리에 루시안과 나미를 골랐어.	롤 15일 담원 기아 EG 픽	https://www.xportsnews.com/article/1642184	2022/10/15	0	2022-10-16 09:17:42	2022-10-16 09:17:42
BK22016207	13	질문자	G2 전에서 담원 기아도 그렇고, 요즘 보면 루시안이랑 나미를 묶어서 가져가는 경우가 많은 거 같네. 경기 흐름을 대강 들려줄 수 있을까?				0	2022-10-16 09:17:42	2022-10-16 09:17:42
BK22016207	14	전문가	응, 경기 초반에는 루시안-나미 조합을 뽑은 EG 쪽이 이득을 봤어. 그런데 바텀에서 분위기가 좋았던 EG가 시도한 4인 다이브를 담원 기아가 제대로 받아쳐 3킬을 얻어내면서 담원 기아가 경기의 흐름을 다시 잡게 돼. 이후, 담원 기아는 중앙에서 전령을 소환해 1차 타워를 부수고, 교전에서 연달아 이기면서 대지용의 영혼을 완성하고 탑도 공략하게 되지. 그리고 30분이 채 되기 전에 EG의 넥서스를 부쉈어.	롤 15일 담원 기아 EG	https://www.kukinews.com/newsView/kuk202210150002	2022/10/15	0	2022-10-16 09:17:42	2022-10-16 09:17:42
BK22016207	15	질문자	어휴, 경기를 실제로 봤으면 초반에 좀 불안했겠어. 마지막으로 한 경기만 더 물어볼게. 담원 기아랑 징동 경기에서 징동 쪽 출전 선수랑 양 팀 챔피언 조합을 좀 알려줄래?				0	2022-10-16 09:17:42	2022-10-16 09:17:42
BK22016207	16	전문가	응, 징동 측 출전 선수는 369 바이자하오, 카나비 서진혁, 야가오 쩡치, 호프 왕제, 미싱 루윈펑 선수야. 챔피언 조합을 살펴보면, 담원 기아 쪽은 그라가스, 그레이브즈, 르블랑, 아펠리오스, 룰루를 가져갔고, 징동 측은 케넨, 리신, 사일러스, 루시안, 나미를 골랐지.	롤 15일 담원 징동 픽	https://www.xportsnews.com/article/1642194	2022/10/15	0	2022-10-16 09:17:42	2022-10-16 09:17:42
BK22016207	17	질문자	세상에, 세 경기를 물어봤는데, 세 경기 다 루시안과 나미 조합이 나왔네. 그럼 경기 내용을 간략하게 좀 이야기해 줄 수 있을까?				0	2022-10-16 09:17:42	2022-10-16 09:17:42
BK22016207	18	전문가	우선, 담원 기아는 경기 5분에 탑에서 캐니언의 그레이브즈가 369의 케넨을 잡으면서 첫 번째 킬을 따낸 뒤, 바텀 전투에서 켈린 김형규 선수의 룰루가 미싱 선수의 나미를 잡았어. 그 뒤로 너구리의 그라가스도 두 번 잡히긴 했지만, 담원 기아는 징동의 2차 포탑을 부수고, 3차 포탑 골드도 뜯어내는 한편, 26분에 벌어진 미드 전투에서도 이득을 챙기면서 바론 버프를 가져가는 데에도 성공했어. 이후, 담원 기아는 골드 차이를 1만 이상 벌리면서 징동의 바텀 건물을 철거하고, 27분에는 일어난 탑 정글 전투에서도 크게 이겼지. 그렇게 담원 기아는 징동 본진으로 진입해 넥서스를 부수면서 경기를 승리했어.	롤드컵 15일 담원 징동	https://www.dailyesports.com/view.php?ud=202210150920001732b91e133c1f_27	2022/10/15	0	2022-10-16 09:17:42	2022-10-16 09:17:42
BK22016207	19	질문자	골드 차이 1만이나 날 정도면 경기력이 압도적이었나 보다. 우리나라 팀이 왕창 이긴 소식을 들으니까 덩달아 기분이 좋아지네. 오늘 경기 얘기 들려줘서 고마워, 나는 하이라이트 영상이라도 잠시 찾아보러 가 볼게.				0	2022-10-16 09:17:42	2022-10-16 09:17:42
BK22016207	20	전문가	응, 앞으로도 바빠서 경기 못 보는 날 있으면 언제든 물어봐. 그럼 다음에 또 만나자.				1	2022-10-16 09:17:42	2022-10-19 15:38:51
