id	utterance_id	role	text	search_query	search_URL	reference_date	terminate	regDate	updDate
BK22003626	1	질문자	이번에 토트넘 선수들이 내한을 했다고 하던데, 언제 입국한 건가요?				0	2022-08-04 11:14:09	2022-09-21 23:45:16
BK22003626	2	전문가	네, 22 23 프리시즌 투어를 위해 인천국제공항으로 10일 오후쯤 입국했어요.	토트넘 내한	http://www.munhwa.com/news/view.html?no=2022071001039910175019	2022/07/10	0	2022-08-04 11:14:09	2022-08-04 11:14:09
BK22003626	3	질문자	그럼 손흥민 선수도 같이 온건가요?				0	2022-08-04 11:14:09	2022-08-04 11:14:09
BK22003626	4	전문가	아뇨, 저번에 손흥민 선수는 모하메드 살라와 공동득점왕을 받고 5월 말에 귀국해서 A매치 4경기를 치르고 한국에서 휴가를 보내다가 내한한 토트넘에 합류했어요.	손흥민 귀국	https://newsis.com/view/?id=NISX20220716_0001945562&cID=10523&pID=10500	2022/07/17	0	2022-08-04 11:14:09	2022-08-04 11:14:09
BK22003626	5	질문자	아, 손흥민 선수는 계속 한국에 있었군요. 토트넘이 내한할 때 손흥민 선수는 뭘 했나요?				0	2022-08-04 11:14:09	2022-09-21 23:45:16
BK22003626	6	전문가	10일에 토트넘이 한국에 올때 공항에 나가 마중을 나갔어요. 또 세비야전 전에는 고기집에서 한턱 쐈어요.	손흥민 마중	https://www.yna.co.kr/view/AKR20220716047400007?input=1195m	2022/07/16	0	2022-08-04 11:14:09	2022-09-21 23:45:16
BK22003626	7	질문자	아, 토트넘이 세비야와 경기를 했나요?				0	2022-08-04 11:14:09	2022-09-21 23:45:16
BK22003626	8	전문가	네, 그것도 수원 월드컵 경기장에서 16일 8시에 했어요. 쿠팡플레이 시리즈 2차전이었는데 1대1로 비겼어요.	토트넘 세비야	http://osen.mt.co.kr/article/G1111897863	2022/07/16	0	2022-08-04 11:14:09	2022-08-04 11:14:09
BK22003626	9	질문자	아, 한국에서 경기를 했는데 몰랐군요. 혹시 골은 누가 넣었나요?				0	2022-08-04 11:14:09	2022-08-04 11:14:09
BK22003626	10	전문가	케인이 페널티 지역 가운데에서 왼발로 넣었어요. 손흥민 선수가 페널티 아크에서 돌아서면서 수비를 따돌린 후 케인에게 패스를 해서 도움을 기록했고요.	토트넘 세비야 골	https://www.yna.co.kr/view/AKR20220716046600007?input=1195m	2022/07/16	0	2022-08-04 11:14:09	2022-08-04 11:14:09
BK22003626	11	질문자	역시 명불허전 손흥민 선수네요. 이 경기에 선발 출전을 한건가요?				0	2022-08-04 11:14:09	2022-08-04 11:14:09
BK22003626	12	전문가	네, 해리케인과 같이 손흥민 선수도 선발출전 했어요.	토트넘 세비야 선발	http://sports.hankooki.com/news/articleView.html?idxno=6802274	2022/07/16	0	2022-08-04 11:14:09	2022-08-04 11:14:09
BK22003626	13	질문자	그렇군요, 그럼 토트넘 선수들은 한국에서 이 경기 한경기만 하는건가요?				0	2022-08-04 11:14:09	2022-08-04 11:14:09
BK22003626	14	전문가	아뇨, K리그 올스타 선수들이랑 서울 월드컵 경기장에서 경기했어요. 그 경기는 토트넘이 6대3으로 승리 했어요.	토트넘 K리그	http://sports.hankooki.com/news/articleView.html?idxno=6802290	2022/07/16	0	2022-08-04 11:14:09	2022-08-04 11:14:09
BK22003626	15	질문자	아, 이벤트성 경기인 것 같군요. 그 경기에서도 손흥민 선수가 나왔나요?				0	2022-08-04 11:14:09	2022-08-04 11:14:09
BK22003626	16	전문가	네, 대신 선발은 아니었고 후반 3분 교체 출전했어요.	토트넘 K리그 손흥민	https://www.news1.kr/articles/?4744310	2022/07/16	0	2022-08-04 11:14:09	2022-08-04 11:14:09
BK22003626	17	질문자	아, 제가 이런 정보를 너무 늦게 알아버렸네요.				0	2022-08-04 11:14:09	2022-08-04 11:14:09
BK22003626	18	전문가	제가 좀 더 일찍 말해줄걸 그랬어요.				0	2022-08-04 11:14:09	2022-08-04 11:14:09
BK22003626	19	질문자	다음에는 꼭 알려주셔야 해요.				0	2022-08-04 11:14:09	2022-08-04 11:14:09
BK22003626	20	전문가	네, 그 번호로 연락 드릴게요.				0	2022-08-04 11:14:09	2022-08-04 11:14:09
BK22003626	21	질문자	고마워요, 그럼 다음에는 꼭 같이 가요.				1	2022-08-04 11:14:09	2022-09-21 23:45:16
