id	utterance_id	role	text	search_query	search_URL	reference_date	terminate	regDate	updDate
BK22016199	1	질문자	오랜만이네요, 요즘 뭐하고 지내시나요?				0	2022-10-16 01:09:49	2022-10-16 01:09:49
BK22016199	2	전문가	저는 요즘 여자 배구를 즐겨보는데, 선수들 중에 김연경 선수를 가장 좋아해요.				0	2022-10-16 01:09:49	2022-10-19 15:32:50
BK22016199	3	질문자	그러시군요, 어제 김연경 선수가 행사에 참석했다는데 혹시 어떤 행사인지 알고 계시나요?				0	2022-10-16 01:09:49	2022-10-16 01:09:49
BK22016199	4	전문가	네, 어제 오후 2시에 인천 삼산월드체육관에서 Greeting to Fans라는 플로깅 캠페인과 출정식이 열렸었어요. 이 행사에는 흥국생명 팀의 권순찬 감독과 선수단 모두가 참석해서 자리를 빛냈어요.	김연경 출정식	https://star.mt.co.kr/stview.php?no=2022101513501122624	2022/10/15	0	2022-10-16 01:09:49	2022-10-16 01:09:49
BK22016199	5	질문자	아, 출정식과 캠페인이 열린 행사였군요. 최근에는 코로나때문에 대면으로 열리기 힘들었을 것 같은데, 이번 행사는 좀 오랜만에 대면으로 열린 행사였겠네요?				0	2022-10-16 01:09:49	2022-10-17 01:45:09
BK22016199	6	전문가	네 맞아요, 이번 출정식은 2019년 이후로 3년 만에 팬들과 함께 한 출정식이었어요. 2020년, 2021년에는 코로나19로 인해 비대면으로 출정식을 진행했구요.	흥국생명 출정식	https://news.mt.co.kr/mtview.php?no=2022101513501122624	2022/10/15	0	2022-10-16 01:09:49	2022-10-19 15:32:50
BK22016199	7	질문자	그렇군요, 오랜만의 대면 행사여서 팬들이 정말 즐거워 했겠어요. 팬들은 얼마나 참석했고 반응은 어땠나요?				0	2022-10-16 01:09:49	2022-10-16 01:09:49
BK22016199	8	전문가	이날 행사에는 팬들은 470여 명 정도 왔고, 선수들과 의미있는 시간을 보내면서 다가올 시즌에 대해 열띤 응원을 약속했어요.	김연경 출정식 팬	http://itnews.inews24.com/view/1528690	2022/10/15	0	2022-10-16 01:09:49	2022-10-16 01:09:49
BK22016199	9	질문자	470명이라니 정말 많이 왔네요. 그럼 김연경 선수는 다음 시즌에 대해 어떤 각오를 내비쳤나요?				0	2022-10-16 01:09:49	2022-10-16 01:09:49
BK22016199	10	전문가	다시 흥국생명에 돌아오게 됐는데 이번 여름에 잘 준비했다고 말했고, 삼산체육이 처음이라 낯설지만 많은 팬이 경기장을 꽉 채워주시면 좋은 경기 보여드리도록 최선을 다하겠다고 다짐했어요.	김연경 각오	http://itnews.inews24.com/view/1528685	2022/10/15	0	2022-10-16 01:09:49	2022-10-16 01:09:49
BK22016199	11	질문자	다짐대로 흥국생명과 김연경 선수가 좋은 경기를 보여줬으면 좋겠네요. 근데 이번에 감독이 새로 오셨다고 들었는데, 감독님은 어떤 분이신가요?				0	2022-10-16 01:09:49	2022-10-16 01:09:49
BK22016199	12	전문가	권 감독은 2017년부터 3시즌 동안 남자부 KB손해보험을 지도해오신 분이에요. 이번에 흥국생명 사령탑으로 부임하면서 처음으로 여자부 팀을 이끌게 되었구요.	흥국생명 감독	https://www.nocutnews.co.kr/news/5833213	2022/10/15	0	2022-10-16 01:09:49	2022-10-16 01:09:49
BK22016199	13	질문자	처음으로 여자팀을 이끌게 되어서 많이 긴장되실 것 같네요. 그럼 흥국생명의 요즘 상황은 어떻고, 앞으로는 어떤 경기를 치를 예정이죠?				0	2022-10-16 01:09:49	2022-10-16 01:09:49
BK22016199	14	전문가	흥국생명의 정규시즌 첫 경기는 10월 25일에 열리고 상대는 인천 페퍼저축은행이에요. 그리고 흥국생명은 지난해에 6위로 마무리를 했지만, 올 시즌에는 김연경과 외국인선수인 옐레나가 합류하면서 팬들의 기대치가 많이 높아진 상황이에요.	흥국생명 첫 경기	https://www.hankookilbo.com/News/Read/A2022092309480001200	2022/09/23	0	2022-10-16 01:09:49	2022-10-16 01:09:49
BK22016199	15	질문자	그렇군요, 근데 옐레나 선수는 처음 들어보는데 어떤 특징을 가진 선수죠?				0	2022-10-16 01:09:49	2022-10-16 01:09:49
BK22016199	16	전문가	옐레나는 이번 시즌에 김연경 선수와 좌, 우 쌍포를 구축하게 될 선수에요. 장점도 매우 많은데 공격과 블로킹은 물론이고 수비도 눈에 띌 정도로 실력이 좋아요.	흥국생명 옐레나	https://sports.donga.com/sports/article/all/20220926/115652597/2	2022/09/26	0	2022-10-16 01:09:49	2022-10-16 01:09:49
BK22016199	17	질문자	옐레나 선수와 김연경 선수가 서로 합이 잘 맞았으면 좋겠네요. 아, 아까 플로깅도 이번 행사에서 진행했다고 하셨는데 플로깅은 어떤 행사인가요?				0	2022-10-16 01:09:49	2022-10-16 01:09:49
BK22016199	18	전문가	플로깅은 오전 10시부터 사전 행사로 열렸는데, 김연경 선수를 포함한 선수단과 40여명의 팬들이 인천 아라뱃길 주위의 쓰레기를 주우며 의미있는 시간을 보냈어요.	흥국생명 플로깅	https://www.mhnse.com/news/articleView.html?idxno=147295	2022/10/16	0	2022-10-16 01:09:49	2022-10-16 01:09:49
BK22016199	19	질문자	쓰레기도 줍고 선수들도 만나는 의미있는 시간이었겠네요. 오늘 흥국생명에 관한 유익한 정보 정말 감사해요.				0	2022-10-16 01:09:49	2022-10-16 01:09:49
BK22016199	20	전문가	별 말씀을요, 앞으로도 궁금한 점이 있으시면 또 물어보세요. 다음에 시간되실 때 다시 만나서 이야기 나눠요!				1	2022-10-16 01:09:49	2022-10-19 15:32:50
