id	utterance_id	role	text	search_query	search_URL	reference_date	terminate	regDate	updDate
BK22002807	1	질문자	테니스를 배우고 싶어서 등록하고 왔는데 가기전에 테니스에 대해서 좀 알고 가려고요.				0	2022-08-02 12:19:49	2022-08-02 14:08:38
BK22002807	2	전문가	테니스는 단식과 복식으로 나누어지는데, 단식은 두 명의 선수가 겨루고 복식은 각 두 명의 선수로 이루어진 두 팀이 겨루는 라켓 스포츠에요.	테니스	https://ko.wikipedia.org/wiki/%ED%85%8C%EB%8B%88%EC%8A%A4	2022/06/26	0	2022-08-02 12:19:49	2022-08-02 14:08:38
BK22002807	3	질문자	배드민턴과 동일하게 단식과 복식으로 나눠지네요. 테니스의 역사에 대해서도 궁금하네요.				0	2022-08-02 12:19:49	2022-08-02 14:08:38
BK22002807	4	전문가	1968년에 상업화의 흐름에 따라서 프로와 아마추어의 구분이 있던 테니스계가 구분을 없애고 지금과 같은 형태의 프로 대회가 개최되기 시작했어요. 이때부터 선수들은 어떤 대회든 자유롭게 참가할 수 있게 되었고, 상위 랭커들은 테니스 선수 활동하는 것만으로도 생계를 유지할 수 있게 되었어요.	테니스의 역사	https://ko.wikipedia.org/wiki/%ED%85%8C%EB%8B%88%EC%8A%A4%EC%9D%98_%EC%97%AD%EC%82%AC	2022/02/03	0	2022-08-02 12:19:49	2022-08-02 14:08:38
BK22002807	5	질문자	테니스 선수 활동으로 생계유지가 어려웠었다는 것이 안타깝네요. 테니스는 어떻게 경기를 하게 되나요?				0	2022-08-02 12:19:49	2022-08-02 14:08:38
BK22002807	6	전문가	테니스의 한 세트는 6번의 게임에서 승점을 획득해야 이기는 게임이에요. 그리고 게임마다 총 4점을 먼저 득점하는 선수가 한 게임을 가져가는 방식으로 진행돼요.	테니스 배우기	https://www.khan.co.kr/world/asia-australia/article/201801241058001	2018/01/24	0	2022-08-02 12:19:49	2022-08-02 14:08:38
BK22002807	7	질문자	테니스는 특이하게 진행되는 운동이네요. 그럼 타이브레이크가 뭔지 아세요?				0	2022-08-02 12:19:49	2022-08-02 14:08:38
BK22002807	8	전문가	타이브레이크는 테니스 경기에서 매치포인트가 6 대 6, 혹은 8 대 8 인 경우에 7포인트를 먼저 얻는 팀이 승리하는 규칙이에요.	테니스 타이브레이크	https://www.mhnse.com/news/articleView.html?idxno=81779	2021/08/03	0	2022-08-02 12:19:49	2022-08-02 14:08:38
BK22002807	9	질문자	동점인 경우에 타이브레이크를 적용하는 거군요. 참 테니스복도 사야하는데 테니스복은 규정이 따로 있는 건가요?				0	2022-08-02 12:19:49	2022-08-02 14:08:38
BK22002807	10	전문가	테니스는 다른 운동에 비해 복장 규정이 엄격한 편이에요. 남자의 경우 깃이 달린 셔츠에 짧은 하의를 착용하고, 여자의 경우에는 원피스나 셔츠에 짧은 하의를 착용하는 것으로 정해져 있어요. 색깔은 따로 정해지진 않았지만 전통적으로는 흰색의 상의와 하의를 착용하는 것이 매너에요. 또 테니스화의 경우 각 코트마다 다른 종류의 테니스화를 신어야 해요.	테니스 복장 규정	http://www.tennispeople.kr/news/articleView.html?idxno=11172	2020/04/25	0	2022-08-02 12:19:49	2022-08-02 14:08:38
BK22002807	11	질문자	테니스화를 코트마다 다른 것을 착용하는 것도 신기하네요. 테니스 코트마다 다른 것을 착용한다면 테니스 코트가 여러 종류인가요?				0	2022-08-02 12:19:49	2022-08-02 14:08:38
BK22002807	12	전문가	테니스 코트는 크게 하드 코트, 클레이 코트, 잔디 코트 이렇게 3가지 종류로 나누어져요.	테니스 코트 종류	http://www.sporbiz.co.kr/news/articleView.html?idxno=621219	2022/06/06	0	2022-08-02 12:19:49	2022-08-02 14:08:38
BK22002807	13	질문자	코트가 여러 종류인 줄은 몰랐어요. 말씀하신 코트 중에 하드 코트는 어떤 코트를 말하는 건가요?				0	2022-08-02 12:19:49	2022-08-02 14:08:38
BK22002807	14	전문가	하드 코트는 보통 아스팔트 재질로 만들어진 코트에요. 코트의 특성에 따라 볼의 바운드 속도 등이 달라지는데 하드 코트는 테니스 코트들 중에서 가장 중간적인 특성을 가지고 있어요.	하드 코트	https://ko.wikipedia.org/wiki/%ED%95%98%EB%93%9C_%EC%BD%94%ED%8A%B8	2022/02/11	0	2022-08-02 12:19:49	2022-08-02 14:08:38
BK22002807	15	질문자	코트에 따라서 볼 속도가 달라지는군요. 하드 코트는 이해했고 그럼 클레이 코트는 어떤 코트에요?				0	2022-08-02 12:19:49	2022-08-02 14:08:38
BK22002807	16	전문가	클레이 코트는 셰일이나 암석, 벽돌을 가늘게 분쇄해서 만들어지는데, 사용되는 클레이의 종류에 따라 레드와 그린 두 가지로 나뉘어요. 다른 코트에 비해 준설이 용이하지만 관리 비용이 많이 소요되는 단점이 있어요. 평평한 표면을 유지하기 위해서 주기적으로 롤러로 눌러주고, 수분이 일정하게 유지될 수 있도록 관리해야 해요.	클레이 코트	https://ko.wikipedia.org/wiki/%ED%81%B4%EB%A0%88%EC%9D%B4_%EC%BD%94%ED%8A%B8	2022/02/25	0	2022-08-02 12:19:49	2022-08-02 14:08:38
BK22002807	17	질문자	클레이 코트는 손이 많이 가는 코트네요. 관리가 힘든 클레이 코트도 장점이 있겠죠?				0	2022-08-02 12:19:49	2022-08-02 14:08:38
BK22002807	18	전문가	공의 바운드는 느리고 높은 것이 특징인 클레이 코트는 리턴을 쉽게 할 수 있어서 공격적인 플레이보다 수비적인 플레이를 하는 선수들이 더 유리한 경기를 펼칠 수 있어요.	테니스 클레이 코트 장점	http://www.sporbiz.co.kr/news/articleView.html?idxno=621219	2022/06/06	0	2022-08-02 12:19:49	2022-08-02 14:08:38
BK22002807	19	질문자	수비하기에 좋은 코트가 클레이 코트네요. 그럼 잔디 코트는 어떤 특징이 있나요?				0	2022-08-02 12:19:49	2022-08-02 14:08:38
BK22002807	20	전문가	잔디 코트는 잔디로 인해서 볼이 낮게 깔리며 볼의 속도도 빨라서 클레이와는 상반된 특성을 가진 코트에요. 잔디 코트의 특성으로 인해 강서버 유형의 선수나 서브 앤 발리 유형의 선수들에게 유리한 코트에요.	테니스 잔디 코트	https://www.tennis.co.kr/tkboard/tkboard_view.php?seq_no=33407&category=global	2022/06/26	0	2022-08-02 12:19:49	2022-08-02 14:08:38
BK22002807	21	질문자	궁금했던 것들이 많았는데 잘 알려줘서 고마워요.				1	2022-08-02 12:19:49	2022-08-03 08:32:25
