id	utterance_id	role	text	search_query	search_URL	reference_date	terminate	regDate	updDate
BK22018493	1	질문자	우리 학교에 펜싱부가 생겼는데, 펜싱이란 어떤 스포츠야?				0	2022-10-21 17:56:34	2022-10-22 09:20:20
BK22018493	2	전문가	펜싱이란 검을 쓰는 무기 스포츠인데, 고전 펜싱과 다르기 때문에 올림픽 펜싱이라고도 해.	펜싱	https://ko.wikipedia.org/wiki/%ED%8E%9C%EC%8B%B1	2022/10/04	0	2022-10-21 17:56:34	2022-10-22 09:20:20
BK22018493	3	질문자	그런 펜싱은 언제 어떻게 생겨났어?				0	2022-10-21 17:56:34	2022-10-22 09:20:20
BK22018493	4	전문가	16세기 말, 명예를 생명보다 중시하던 영국의 귀족들한테는 결투가 유행이었어. 그때 주로 길고 얇고, 찌르는데 유리한 검인 레이피어검으로 하는 펜싱을 했지. 이 검은 현대 펜싱 검의 처음 모델로 알려졌고, 귀족들이 결투에 대비해 펜싱을 익히던 검이야.	펜싱 유래	https://www.sciencetimes.co.kr/news/%ED%8E%9C%EC%8B%B1-%EA%B8%B0%EC%88%A0%EC%97%90-%EC%88%A8%EC%9D%80-%EA%B3%BC%ED%95%99-%EC%9B%90%EB%A6%AC/	2014/10/01	0	2022-10-21 17:56:34	2022-10-22 09:20:20
BK22018493	5	질문자	그럼 펜싱에는 어떤 종류들이 있어?				0	2022-10-21 17:56:34	2022-10-22 09:20:20
BK22018493	6	전문가	펜싱에는 플뢰레, 에페, 사브르 세 종목이 있는데. 각각 몸통, 전신, 상체를 중심으로 공격해.	펜싱 종목	https://www.insight.co.kr/news/350633	2021/07/27	0	2022-10-21 17:56:34	2022-10-22 09:20:20
BK22018493	7	질문자	그럼 사용하는 칼의 종류도 다른 거야?				0	2022-10-21 17:56:34	2022-10-22 09:20:20
BK22018493	8	전문가	응, 플뢰레는 500g 이하, 에페는 770g 이상의 칼을 사용해. 사브르는 베기 공격을 할 수 있기에 90cm의 다른 종목 보다 짧은 88cm의 날이 있는 칼을 사용하지.	펜싱 종목 칼	https://www.hani.co.kr/arti/specialsection/esc_section/788603.html	2017/03/30	0	2022-10-21 17:56:34	2022-10-22 09:20:20
BK22018493	9	질문자	펜싱 경기장의 규격도 정해져 있어?				0	2022-10-21 17:56:34	2022-10-22 09:20:20
BK22018493	10	전문가	보통 너비 1.5~2m, 길이 14m의 피스트라고 하는 코트에서 경기를 진행해. 선수의 두 발이 피스트 끝에 표시된 경계선 밖으로 나가면 점수를 잃어.	펜싱 경기장	https://www.hani.co.kr/arti/specialsection/esc_section/788603.html	2017/03/30	0	2022-10-21 17:56:34	2022-10-22 09:20:20
BK22018493	11	질문자	그럼 펜싱은 몇 점 내면 이기는 거야?				0	2022-10-21 17:56:34	2022-10-22 09:20:20
BK22018493	12	전문가	예선전에서는 시간에 상관없이 5점을 먼저 내야하고, 8강부터는 3분씩 3번의 경기에서 15점을 먼저 내야하지.	펜싱 점수	https://www.hani.co.kr/arti/specialsection/esc_section/788603.html	2017/03/30	0	2022-10-21 17:56:34	2022-10-22 09:20:20
BK22018493	13	질문자	점수를 먼저 내기 위해 순발력도 중요하겠네. 순발력을 기르기 위해 특별히 하는 훈련이 있을까?				0	2022-10-21 17:56:34	2022-10-22 09:20:20
BK22018493	14	전문가	공격의 기본 동작인 팡트를 연습해. 이 동작은 상대를 보다 빠르고 정교하게 찌르기 위해 과학적인 방식으로 꾸준히 반복적으로 훈련해. 에페, 플뢰레, 사브르가 서로 다른 규칙을 쓰지만 팡트는 공통으로 사용되는 동작이거든.	펜싱 훈련 방법	https://www.sciencetimes.co.kr/news/%ED%8E%9C%EC%8B%B1-%EA%B8%B0%EC%88%A0%EC%97%90-%EC%88%A8%EC%9D%80-%EA%B3%BC%ED%95%99-%EC%9B%90%EB%A6%AC/	2014/10/01	0	2022-10-21 17:56:34	2022-10-22 09:20:20
BK22018493	15	질문자	에페, 플뢰레, 사브르에 모두 쓰이는 기본 동작이구나. 팡트라는 동작은 어떤 동작이야?				0	2022-10-21 17:56:34	2022-10-22 09:20:20
BK22018493	16	전문가	선수들이 앞으로나 뒤로 왔다 갔다 하면서 상대의 틈을 노린 다음 앞다리를 내밀고 뒷다리를 펴면서 찌르기 자세를 취하는 것이지.	팡트	https://www.hani.co.kr/arti/specialsection/esc_section/788603.html	2017/03/30	0	2022-10-21 17:56:34	2022-10-22 09:20:20
BK22018493	17	질문자	팡트를 할 때면 신중해야겠구나, 자칫 내가 찔릴 수도 있으니까 말이야.				0	2022-10-21 17:56:34	2022-10-22 09:20:20
BK22018493	18	전문가	맞아, 그래서 앞뒤 이동을 많이 하며 빈 틈을 노리는 거지.				0	2022-10-21 17:56:34	2022-10-22 09:20:20
BK22018493	19	질문자	그렇구나, 언제 공격할지 모르니 눈을 뗄 수 없겠네.				0	2022-10-21 17:56:34	2022-10-22 09:20:20
BK22018493	20	전문가	맞아, 다음번엔 펜싱의 다양한 용어와 규칙을 더 알려줄게.				1	2022-10-21 17:56:34	2022-10-22 09:20:20
