id	utterance_id	role	text	search_query	search_URL	reference_date	terminate	regDate	updDate
BK22014189	1	질문자	아버지가 야구를 좋아하셔서 저도 간혹 보곤 하는데, 투수들이 공을 던질 때 구속이 일정하지 않고 느려졌다가 빨라졌다가를 반복하네요.				0	2022-09-30 16:06:13	2022-10-02 02:35:56
BK22014189	2	전문가	느린 공은 아마 변화구를 던진 것 같네요. 변화구가 속구보다 빠를 순 없긴 하니까요.				0	2022-09-30 16:06:14	2022-10-02 02:35:56
BK22014189	3	질문자	변화구란 어떤 것을 말하나요?				0	2022-09-30 16:06:14	2022-10-02 02:35:56
BK22014189	4	전문가	변화구란 일반적으로 야구에서 투구를 할 때, 날아가던 방향이 갑작스럽게 바뀌어 타자들의 타격을 방해하는 공을 변화구라고 해요.	변화구	https://ko.wikipedia.org/wiki/%EB%B3%80%ED%99%94%EA%B5%AC	2022/05/03	0	2022-09-30 16:06:14	2022-10-02 02:35:56
BK22014189	5	질문자	아하, 즉 다양한 공들을 던짐으로써 타자들이 원할한 타격을 할 수 없게 만드는 것이군요?				0	2022-09-30 16:06:14	2022-10-02 02:35:56
BK22014189	6	전문가	맞아요. 변화구는 속도가 느리기 때문에 배트에 맞아도 반동이 적고, 움직임이 커 공을 정확하게 맞히는 것도 힘들어요. 투수는 이런 것들을 이용해 타자의 타이밍을 빼앗고 헛스윙을 끌어내기도 해요.	변화구 특징	https://ko.wikipedia.org/wiki/%EB%B3%80%ED%99%94%EA%B5%AC	2022/05/03	0	2022-09-30 16:06:14	2022-10-02 02:35:56
BK22014189	7	질문자	그렇다면 주로 사용하는 변화구들은 어떤 것들이 있나요?				0	2022-09-30 16:06:14	2022-10-02 02:35:56
BK22014189	8	전문가	대표적으로 슬라이더나 커브, 체인지업, 포크볼이 있어요. 현대에는 이 변화구들 이외에도 정말 많은 변화구가 만들어졌어요.	변화구 종류	https://www.mk.co.kr/news/economy/view/2011/11/742151/	2011/11/16	0	2022-09-30 16:06:14	2022-10-02 02:35:56
BK22014189	9	질문자	슬라이더는 어떤 특징을 가진 변화구인가요?				0	2022-09-30 16:06:14	2022-10-02 02:35:56
BK22014189	10	전문가	슬라이더는 직구와 엇비슷한 속도로 가다가, 타자에게 가까이 갔을 때 방향이 바뀌어 스트라이크존의 바깥으로 휘어져 버리는 구종이에요.	슬라이더	http://www.maniareport.com/view.php?ud=2020112706510774815e8e941087_19	2020/11/27	0	2022-09-30 16:06:14	2022-10-02 02:35:56
BK22014189	11	질문자	커브는 또 어떤 특징을 가지고 있죠?				0	2022-09-30 16:06:14	2022-10-02 02:35:56
BK22014189	12	전문가	커브는 변화구 중에서도 낙차가 크기 때문에 커다란 포물선을 형성하며 아래로 떨어지는 변화구에요. 커브는 보통 날아가는 방향의 반대 방향으로 회전하며 궤적을 만들죠.	커브볼	https://www.hani.co.kr/arti/economy/marketing/1058214.html	2022/09/11	0	2022-09-30 16:06:14	2022-10-02 02:35:56
BK22014189	13	질문자	그렇다면 체인지업은 어떤 방식의 변화구일까요?				0	2022-09-30 16:06:15	2022-10-02 02:35:56
BK22014189	14	전문가	체인지업은 투구 동작과 투구할 때 팔의 속도가 직구를 던지는 것과 똑같기 때문에 오해할 수 있지만, 그보다 12km에서 20km 정도의 느린 공이 타자에게 날아가게 되죠.	체인지업	https://ko.wikipedia.org/wiki/%EC%B2%B4%EC%9D%B8%EC%A7%80%EC%97%85	2022/05/03	0	2022-09-30 16:06:15	2022-10-02 02:35:56
BK22014189	15	질문자	포크볼은 공이 어떻게 움직이나요?				0	2022-09-30 16:06:15	2022-10-02 02:35:56
BK22014189	16	전문가	포크볼은 공이 쭉 직선으로 가는 것처럼 보이지만 타자의 바로 앞에서 종으로 갑작스럽게 떨어지는 공이에요. 스플리터나 너클볼과 비슷하게 떨어지고, 공의 회전도 거의 없는 편이죠.	포크볼	https://ko.wikipedia.org/wiki/%ED%8F%AC%ED%81%AC%EB%B3%BC	2022/09/08	0	2022-09-30 16:06:15	2022-10-02 02:35:56
BK22014189	17	질문자	너클볼은 저도 들어본 적이 있는 것 같은데, 굉장히 독특한 방식이었던 것 같았어요. 너클볼은 어떤 변화구인가요?				0	2022-09-30 16:06:15	2022-10-02 02:35:56
BK22014189	18	전문가	너클볼은 공의 회전이 없는 구종을 말해요. 회전이 없으면 공 주변의 공기 흐름이 달라져 난기류가 형성되고, 이에 따라 전혀 예측하지 못하는 특이한 움직임을 가지게 되죠. 타자는 물론이고 던지는 투수조차도 이 공을 원하는 곳으로 던지기란 불가능에 가까워요.	너클볼	https://ko.wikipedia.org/wiki/%EB%84%88%ED%81%B4%EB%B3%BC	2022/02/13	0	2022-09-30 16:06:15	2022-10-02 02:35:56
BK22014189	19	질문자	단순히 공을 던지는 것만 아니라 이런 다양한 전략과 수 싸움이 야구를 더 재밌게 만드는 것이었군요. 오늘 궁금했던 점 알려주셔서 감사합니다.				0	2022-09-30 16:06:15	2022-10-02 02:35:56
BK22014189	20	전문가	이런 것들을 알고 보시면 더 야구가 재밌어질 거에요. 다음번에도 얼마든지 물어보세요.				1	2022-09-30 16:06:15	2022-10-02 02:35:56
