id	utterance_id	role	text	search_query	search_URL	reference_date	terminate	regDate	updDate
BK22015592	1	질문자	친구가 지난 주말에 ATP 코리아오픈 테니스 경기 구경 갔다 왔는데, 사람이 엄청 많았다고 하더라고요. 전 테니스가 인기 있는지 몰랐는데 많이 흥행했나요?				0	2022-10-10 19:20:49	2022-10-10 19:20:49
BK22015592	2	전문가	친구분이 관람가서 직접 체험했군요. 이번 ATP 투어는 한국에서 26년 만에 개최 된 경기로, 대회 기간 동안에 많은 관람객이 찾아서 흥행대박을 쳤어요. 사실상 주말 센터코트 관중은 만원입장이나 다름 없었고, 대회 기간 동안 경기장을 찾은 관중 수가 5만 1783명을 찍음으로써 역대 최고를 기록했거든요.	atp 코리아오픈 흥행	https://sports.khan.co.kr/sports/sk_index.html?art_id=202210031723003&sec_id=530101&pt=nv	2022/10/03	0	2022-10-10 19:20:49	2022-10-10 19:20:49
BK22015592	3	질문자	우리나라 테니스 관중이 생각보다 많군요. 그런데, 뉴스에 보니까 ATP테니스 대회가 이번주에 또 열린다고 하던데 그건 또 뭐에요?				0	2022-10-10 19:20:49	2022-10-10 19:20:49
BK22015592	4	전문가	10월 2일에 끝난 대회는 총상금 123만7천570달러 규모의 ATP 투어 유진투자증권 코리아 오픈 경기였어요. 연일 많은 관중들이 경기장을 찾았었죠. 그 대회와 똑같은 장소인 서울 송파구 올림픽공원에서 1주일만인 10월 10일에 개막한 경기는 총상금 13만2천800달러 규모로 투어보다는 한 등급 낮은 ATP 휠라 서울오픈 챌린저 대회에요.	ATP서울 오픈 챌린저	https://www.yna.co.kr/view/AKR20221009022400007?input=1195m	2022/10/09	0	2022-10-10 19:20:49	2022-10-10 19:20:49
BK22015592	5	질문자	대회마다 등급이 따로 있나보네요. 상금규모도 엄청 차이가 나고요. 이번 챌린저 대회는 국제적으로 어느 정도 수준인거에요?				0	2022-10-10 19:20:49	2022-10-10 19:20:49
BK22015592	6	전문가	2022 FILA ATP 서울오픈 챌린저 대회에 출전할 수 있는 선수는 남자 테니스 선수들 중에서 세계 랭킹 100위부터 300위 사이에요. 선수들은 대회에서 경기를 치르면서 포인트를 쌓고 또 투어에 진출 하기 위한 발판으로 삼기 때문에 상당히 수준이 높은 국제대회라고 할 수 있어요.	ATP서울 오픈 챌린저 수준	https://newsis.com/view/?id=NISX20221007_0002040531&cID=13001&pID=13000	2022/10/07	0	2022-10-10 19:20:49	2022-10-10 19:20:49
BK22015592	7	질문자	세계 300위 이내에 든다는건 정말 쉬운일은 아니죠. 투어, 챌린지 등 ATP가 앞에 붙어서 헷갈리는데 ATP에서는 구체적으로 어떤 일을 하는 곳인지 궁금하네요.				0	2022-10-10 19:20:49	2022-10-10 19:20:49
BK22015592	8	전문가	ATP가 여러 대회 앞에 붙어 있어서 헷갈릴만 하죠. ATP는 프로 테니스 협회를 의미하는데 1972년에 설립된 국제기구로 남자 프로 테니스 선수들의 권리를 보호하는 취지로 시작되었어요. ATP는 세계 남자 테니스 대회인 ATP투어는 물론이고 그보다 레벨이 낮은 단계인 ATP챌린저 투어와 은퇴한 선수들로 경기를 치르는 ATP챔피언스 투어도 관장해요. ATP투어에 해당되는 국제 경기는 4경기로 ATP 파이널스와 ATP 월드 투어 마스터스 1000 뿐만 아니라 ATP 월드 투어 500 시리즈와 ATP 월드 투어 250 시리즈가 있어요.	ATP	https://ko.wikipedia.org/wiki/%ED%94%84%EB%A1%9C_%ED%85%8C%EB%8B%88%EC%8A%A4_%ED%98%91%ED%9A%8C	2022/03/06	0	2022-10-10 19:20:49	2022-10-10 19:20:49
BK22015592	9	질문자	ATP투어에 해당되는 4경기가 상위 경기고, 아래가 챌린저가 붙는거고, 은퇴 선수가 하는게 챔피언스로 구분 되는거군요. 굉장히 높아 보이는 ATP파이널스 대회 나가려면 어떤 자격을 갖추어야 해요?				0	2022-10-10 19:20:49	2022-10-10 19:20:49
BK22015592	10	전문가	ATP 파이널스 대회는 세계적인 남자 테니스 대회로 매해 연말 세계 랭킹에서 8위까지 해당 되는 최고 수준의 선수들만 출전할 수 있어요.	ATP 파이널스	https://ko.wikipedia.org/wiki/ATP_%ED%8C%8C%EC%9D%B4%EB%84%90%EC%8A%A4	2022/07/30	0	2022-10-10 19:20:49	2022-10-10 19:20:49
BK22015592	11	질문자	와, 그야말로 테니스계 별들의 전쟁이네요. 우승을 다투는 경기 방식은 어떻게 돼요?				0	2022-10-10 19:20:49	2022-10-10 19:20:49
BK22015592	12	전문가	별들의 전쟁이란 표현이 정말 잘 맞네요. 우승을 다투기 위해서 처음에는 8명이 두개의 조로 나뉘어져요. 두 조가 풀리그를 펼쳐서 조별 순위가 결정 되면 4강전은 각 조의 1위가 다른 조의 2위와 겨루는 크로스 토너먼트를 치르죠. 4강전에서 승리한 두 선수가 결국 결승에서 우승을 결정 짓는 방식이에요.	ATP 파이널스 방식	http://www.sportsseoul.com/news/read/980679?ref=naver	2020/11/14	0	2022-10-10 19:20:49	2022-10-10 19:20:49
BK22015592	13	질문자	크로스 토너먼트를 치른 뒤 승리자가 결승을 치르게 되면 같은 조의 1, 2위가 결승에서 만날 수도 있겠네요.				0	2022-10-10 19:20:49	2022-10-10 19:20:49
BK22015592	14	전문가	그렇죠, 같은 조의 1위와 2위가 맞붙은 상대조의 선수들을 모두 이길 수도 있으니까요.				0	2022-10-10 19:20:49	2022-10-10 19:20:49
BK22015592	15	질문자	조별 행운도 기대할 수 없도록 선수 개인의 기량만을 평가하는 냉정한 방식이네요. 작년에는 어떤 선수들이 ATP파이널스에 진출했어요?				0	2022-10-10 19:20:49	2022-10-10 19:20:49
BK22015592	16	전문가	작년 대회에서 어떤 선수들이 최고 대회에 출전했는지 궁금한 모양이네요. 2021년 11월 12일에 ATP 투어 홈페이지에 발표된 8명의 선수들은 그린그룹과 레드그룹으로 나뉘었어요. 그린그룹에 속한 선수들은 세계 8위의 카스퍼 루드와 6위의 안드레이 루블레프, 3위의 스테파노스 치치파스와 1위의 노박 조코비치였어요. 레드그룹에 속한 선수들은 세계 9위의 후베르트 후르카츠와 7위의 마테오 베레티니, 4위의 알렉산더 츠베레프와 2위인 다닐 메드베데프였어요.	2021 ATP 파이널스	http://www.sportsseoul.com/news/read/1076105?ref=naver	2021/11/12	0	2022-10-10 19:20:49	2022-10-10 19:20:49
BK22015592	17	질문자	세계 최고의 선수들이 겨루었는데 결승에는 어떤 선수들이 올라가서 우승을 다투었는지 상황들이 정말 궁금하네요.				0	2022-10-10 19:20:49	2022-10-10 19:20:49
BK22015592	18	전문가	남자프로테니스 2021시즌 결승전은 2021년 11월 22일 이탈리아 토리노에 있는 팔라 알피투어 경기장에서 열렸는데 세계 3위인 독일의 알렉산더 츠베레프가 세계 2위인 러시아의 메드베데프를 꺾고 단식 경기 최종 우승을 차지했어요. 츠베레프가 결승에 오르기 전에 세계랭킹 1위인 노박 조코비치를 만나서 승리를 거두고 결승에 진출했었죠.	2021 ATP 파이널스	https://sports.donga.com/article/all/20211122/110394097/1	2021/11/22	0	2022-10-10 19:20:49	2022-10-17 16:23:04
BK22015592	19	질문자	츠베레프는 결승에 오르기 전에 이미 세계 1위인 조코비치를 이겼으니 완전 상승세였을 것 같아요. 테니스 얘기 하다보니 시간이 벌써 이렇게 되었네요.				0	2022-10-10 19:20:50	2022-10-10 19:20:50
BK22015592	20	전문가	그러게요, 시간 가는줄 모르고 한참 얘기했네요.				0	2022-10-10 19:20:50	2022-10-10 19:20:50
BK22015592	21	질문자	오늘 덕분에 아주 유익하고 재미난 시간 보냈어요. 다음에 또 뵈어요.				0	2022-10-10 19:20:50	2022-10-10 19:20:50
BK22015592	22	전문가	저도 즐겁게 대화 나누어서 기분 좋아요. 다음에 또 재미난 얘기 나누어요.				1	2022-10-10 19:20:50	2022-10-17 16:23:04
