id	utterance_id	role	text	search_query	search_URL	reference_date	terminate	regDate	updDate
BK22013142	1	질문자	해외 뉴스 채널을 보다 보면 크리켓 경기 결과에 대해서도 보도하더라고요. 해외에서 크리켓의 인기는 어느 정도인가요?				0	2022-09-30 15:33:18	2022-10-01 18:01:26
BK22013142	2	전문가	유럽이나 호주, 인도로 출장을 가면 TV 스포츠 중계로 크리켓 중계를 흔히 보게 됩니다. 인도, 스리랑카, 호주 등 과거 영국의 식민 지배를 받았다가 독립한 영연방국가들 사이에서 엄청난 인기를 끌고 있죠. 이런 국가의 경제규모와 인기를 반영하듯 크리켓의 시장성은 큽니다.	크리켓 해외 인기	https://www.khan.co.kr/sports/sports-general/article/201305242129325#c2b	2013/05/24	0	2022-09-30 15:33:18	2022-10-01 18:01:26
BK22013142	3	질문자	아, 그래서 국제 뉴스 채널에 심심치 않게 등장하는 거였군요. 크리켓은 언제부터 시작된 스포츠인가요?				0	2022-09-30 15:33:18	2022-10-01 18:01:26
BK22013142	4	전문가	크리켓의 기원은 확실하지 않지만 13세기 영국에서 시작되었고, 1774년에는 경기 규칙이 제정되었다고 알려져 있을 정도로 역사가 긴 스포츠입니다.	크리켓 유래	https://sports.khan.co.kr/news/sk_index.html?cat=view&art_id=201409260610163&sec_id=530601&pt=nv	2014/09/26	0	2022-09-30 15:33:18	2022-10-01 18:01:26
BK22013142	5	질문자	생각보다 역사가 오래된 스포츠였군요. 크리켓 경기장을 보면 야구 경기장하고 완전 딴판이던데, 경기장 규격은 어떻게 되나요?				0	2022-09-30 15:33:18	2022-10-01 18:01:26
BK22013142	6	전문가	크리켓 경기는 타원형의 잔디 그라운드 위에서 펼쳐집니다. 그라운드의 폭은 90에서 150미터가 되어야 하는데, 타원 모양과 크게 다르지 않으면 크기나 형태에 있어서 제약은 없으며 펜스나 로프 등으로 구분해주면 됩니다.	크리켓 경기장	https://sports.khan.co.kr/news/sk_index.html?cat=view&art_id=201409260610163&sec_id=530601&pt=nv	2014/09/26	0	2022-09-30 15:33:18	2022-10-01 18:01:27
BK22013142	7	질문자	생각보다 규정이 까다롭지 않네요. 크리켓의 기본 경기 방식은 어떤가요?				0	2022-09-30 15:33:18	2022-10-01 18:01:27
BK22013142	8	전문가	크리켓은 야구하고 경기 방식이 유사합니다. 양 팀은 11명으로 구성되고, 원형 혹은 타원형의 경기장 한가운데 자리한 직사각형 모양의 피치 위에서 투수인 볼러와 타자인 배트맨이 대결하죠.	크리켓 경기방식	https://www.news1.kr/articles/?1849849	2014/09/09	0	2022-09-30 15:33:19	2022-10-01 18:01:27
BK22013142	9	질문자	그러면 점수는 어떻게 나는 건가요?				0	2022-09-30 15:33:19	2022-10-01 18:01:27
BK22013142	10	전문가	피치의 양 끝에는 20미터 간격으로 위킷이라는 기둥 두 개가 세워져 있습니다. 수비팀의 볼러가 반대편 위킷 앞에 서 있는 배트맨 방향으로 투구를 하면, 배트맨은 이 공을 친 후, 반대편 위킷으로 달려가는데요. 동시에 반대편 위킷에 있던 주자는 배트맨이 공을 친 위킷을 향해 달립니다. 두 선수가 교차해서 반대편 위킷에 배트를 대면 한 점을 획득해요. 수비팀이 위킷에 공을 전달하기 전에 왕복한 수만큼 추가로 점수를 얻고요.	크리켓  위켓 점수	https://www.news1.kr/articles/?1849849	2014/09/09	0	2022-09-30 15:33:19	2022-10-01 18:01:27
BK22013142	11	질문자	주자가 미리 서 있는 상황에서 타자와 왔다 갔다 하면서 점수를 한 점씩 얻는 거군요. 그러면 한 번에 여러 점을 획득할 수는 없나요?				0	2022-09-30 15:33:19	2022-10-01 18:01:27
BK22013142	12	전문가	물론 가능합니다. 배트맨의 타구가 경기장 바깥으로 굴러서 빠져나가면 4점을 획득하고, 홈런처럼 공이 날아서 바깥으로 나가면 6점을 얻게 됩니다.	크리켓 홈런 6점	https://www.news1.kr/articles/?1849849	2014/09/09	0	2022-09-30 15:33:19	2022-10-01 18:01:27
BK22013142	13	질문자	크리켓도 일종의 홈런이 있는 셈이군요.				0	2022-09-30 15:33:19	2022-10-01 18:01:27
BK22013142	14	전문가	아무래도 득점이 많이 나야 경기가 재밌을 테니까요.				0	2022-09-30 15:33:19	2022-10-01 18:01:27
BK22013142	15	질문자	그러면 수비팀에서는 어떻게 배트맨을 아웃시키나요?				0	2022-09-30 15:33:19	2022-10-01 18:01:27
BK22013142	16	전문가	배트맨이 친 뜬공을 잡거나, 볼러가 위킷을 맞히는 등의 방식으로 수비팀은 배트맨을 아웃시킵니다. 아웃 10개가 되면 공격과 수비가 바뀌고요.	크리켓 10개의 아웃	https://www.news1.kr/articles/?1849849	2014/09/09	0	2022-09-30 15:33:19	2022-10-01 18:01:27
BK22013142	17	질문자	영연방국가들이면 인구가 꽤 많잖아요. 혹시 크리켓도 국제 대회가 있나요?				0	2022-09-30 15:33:19	2022-10-01 18:01:27
BK22013142	18	전문가	네, 물론 있습니다. 크리켓 부문의 국제기구인 ICC에 가입한 나라들이 참가하여 진행되는 국제 크리켓 대회로, 남자 국가대표팀만 참가합니다. 올림픽이나 월드컵과 마찬가지로 4년에 한 번씩 열리고요.	크리켓 월드컵	https://ko.wikipedia.org/wiki/%ED%81%AC%EB%A6%AC%EC%BC%93_%EC%9B%94%EB%93%9C%EC%BB%B5	2022/03/06	0	2022-09-30 15:33:19	2022-10-01 18:01:27
BK22013142	19	질문자	이제 채널을 돌리다 크리켓이 나와도 제대로 볼 수 있을 것 같네요. 오늘도 덕분에 정말 감사했습니다. 그러면 안녕히 계세요.				0	2022-09-30 15:33:19	2022-10-01 18:01:27
BK22013142	20	전문가	네, 다음에 또 뵙겠습니다.				1	2022-09-30 15:33:19	2022-10-01 18:01:27
