id	utterance_id	role	text	search_query	search_URL	reference_date	terminate	regDate	updDate
BK22015926	1	질문자	제가 외국 친구를 사귀게 되었는데 그 친구가 태권도에 관심이 많은 친구에요. 막상 우리나라에서 만들어진 스포츠인데도 저는 아는게 없어서 조금 부끄럽더라고요. 그래서 몇가지 물어보고 싶은데 괜찮을까요?				0	2022-10-13 12:14:37	2022-10-14 13:14:37
BK22015926	2	전문가	얼마든지요, 태권도에 대해서 어떤게 궁금하신지 거에요?				0	2022-10-13 12:14:30	2022-10-13 12:14:30
BK22015926	3	질문자	태권도가 올림픽 종목으로 채택되었다는건 알고 있는데 언제부터 올림픽 종목이 된거에요?				1	2022-10-13 12:14:37	2022-10-18 16:31:37
BK22015926	4	전문가	태권도는 1994년 9월 4일 파리 IOC총회에서 2000 시드니 올림픽 정식종목으로 채택 했어요. 그래서 이 날은 태권도진흥법에 따라 법정 기념일로 제정되어 있답니다.	태권도 정식채택	https://mookas.com/news/18575	2022/09/05	0	2022-10-13 12:14:30	2022-10-13 12:14:30
BK22015926	5	질문자	우와 법정기념일로도 제정되어 있는 줄은 몰랐어요. 태권도는 우리나라에서 시작된거니까 아무래도 우리나라가 강국이죠?				0	2022-10-13 12:14:30	2022-10-13 12:14:30
BK22015926	6	전문가	맞아요, 한국외에 중국과 러시아, 이란도 유소년, 청소년, 성인에 이르기까지 우수한 선수가 많은 태권도 강국이랍니다.	한국 태권도 강국	https://mookas.com/news/18304	2022/03/01	0	2022-10-13 12:14:30	2022-10-14 13:14:37
BK22015926	7	질문자	이란도 우수하다니 새롭게 알게 되었어요. 태권도에서 품새라는 단어도 많이 나오던데 그건 무슨 뜻이에요?				0	2022-10-13 12:14:30	2022-10-13 21:52:01
BK22015926	8	전문가	품새라는건 방어와 공격의 주요 기술을 연결해서 가상의 상대를 대상으로 수련하는 거에요. 태권도의 여러 기술들을 단계별로 모으고 일정한 양식에 맞춰 수련하는거죠.	태권도 품새란 무엇	http://www.ftimes.kr/news/articleView.html?idxno=13861	2021/10/26	0	2022-10-13 12:14:30	2022-10-13 22:50:24
BK22015926	9	질문자	가상의 상대라면 혼자서 스스로 하는 대련인거네요. 올림픽에서 태권도 경기는 몇분이나 진행되나요?				0	2022-10-13 12:14:30	2022-10-13 12:14:30
BK22015926	10	전문가	태권도는 3라운드로 진행되고 각 라운드마다 2분씩 진행이 됩니다. 최종적으로 점수가 높은 선수가 승리하는거에요.	태권도 올림픽경기시간	https://www.yna.co.kr/view/AKR20220526069400007?input=1195m	2022/05/26	0	2022-10-13 12:14:30	2022-10-13 12:14:30
BK22015926	11	질문자	아 그럼 점수는 어떻게 계산하는 거에요?				0	2022-10-13 12:14:30	2022-10-13 12:14:30
BK22015926	12	전문가	각 공격득점으로는 몸통 부위의 주먹공격은 1점이고 몸통 부위의 발공격은 2점이에요. 그리고 머리 부위를 공격한 발기술은 3점, 몸의 회전으로 몸통을 공격하는건 4점 몸의 회전으로 얼굴 부위를 공격하는 건 5점을 획득할 수 있어요. 점수계산은 이렇게 간단하게 이루어지죠.	태권도 득점올리는 방식	https://newsis.com/view/?id=NISX20210704_0001499947&cID=10501&pID=10500	2021/07/06	0	2022-10-13 12:14:30	2022-10-13 12:14:30
BK22015926	13	질문자	그렇게 어렵지는 않은것 같아요. 우리나라가 태권도 강국이면 올림픽에서도 효자종목일 것 같은데 금메달 많이 땄나요?				0	2022-10-13 12:14:30	2022-10-13 12:14:30
BK22015926	14	전문가	양궁에 이어서 태권도는 전통적인 효자 종목으로 2000년 시드니올림픽 이후 지금까지 총 12개의 금메달을 획득한 기록이 있어요.	태권도 효자종목	https://newsis.com/view/?id=NISX20210704_0001499947&cID=10501&pID=10500	2021/07/06	0	2022-10-13 12:14:30	2022-10-13 12:14:30
BK22015926	15	질문자	양궁 다음이라니 진짜 효자 종목이기는 하네요. 그런데 이번에는 금메달이 없어서 아쉽기는 해요. 우리나라는 그럼 태권도장이 언제 생긴거에요?				0	2022-10-13 12:14:30	2022-10-13 12:14:30
BK22015926	16	전문가	1945년 해방 전에 생긴 최초의 태권도장은 이원국 선생의 청도관과 노병직 선생의 송무관이에요. 여기에 윤병인 선생의 YMCA권법부, 전상섭 선생의 조선연무관, 황기 선생의 무덕관 까지 이렇게 5개의 도장에서 태권도가 시작 되었답니다.	국내 최초의 태권도장	http://news.heraldcorp.com/view.php?ud=20150918000057	2015/09/18	0	2022-10-13 12:14:30	2022-10-13 12:14:30
BK22015926	17	질문자	해방되기도 전에 생긴 도장들이 있네요. 프랑스에서 태권도 그랑프리도 열렸다고 하던데 우리나라 선수도 참가했나요?				0	2022-10-13 12:14:30	2022-10-13 22:50:24
BK22015926	18	전문가	2022 세계태권도연맹 월드 태권도 그랑프리 대회는 9월 4일 프랑스에서 열렸는데, 67㎏ 초과급에서 우리나라 이다빈 선수가 프랑스의 알테아 로랭선수를 이기면서 우승을 했죠.	태권도그랑프리	https://newsis.com/view/?id=NISX20220923_0002024225&cID=10501&pID=10500	2022/09/23	0	2022-10-13 12:14:30	2022-10-13 12:14:30
BK22015926	19	질문자	오 우승 소식이라니까 반갑네요. 오늘 진짜 많이 배웠어요. 우리나라 스포츠인만큼 저도 더 관심을 가져야겠다는 생각이 드네요.				0	2022-10-13 12:14:30	2022-10-13 12:14:30
BK22015926	20	전문가	너무 좋은 생각이신거 같아서 알려드린게 엄청 뿌듯하네요. 다음에 또 궁금한게 생기시면 언제든지 물어보세요.				0	2022-10-13 12:14:30	2022-10-13 12:14:37
