id	utterance_id	role	text	search_query	search_URL	reference_date	terminate	regDate	updDate
BK22003929	1	질문자	얼마 전에 친구 집에 놀러갔는데 진돗개를 한 마리 키우더라구요. 진돗개가 주인을 잘 따르는 편인가요?				0	2022-08-04 11:16:58	2022-08-04 11:16:58
BK22003929	2	전문가	네, 진돗개는 주인을 잘 따르는 편이기도 하고, 용감하고 충성심도 강한 편이에요. 우리나라 대표 견종인 건 아시죠? 1962년에 진돗개를 천연기념물 제53호로 지정했어요. 진도 특산이잖아요.	진돗개	https://ko.wikipedia.org/wiki/%EC%A7%84%EB%8F%97%EA%B0%9C	2022/07/01	0	2022-08-04 11:16:58	2022-08-17 09:55:25
BK22003929	3	질문자	우리나라 견종인 건 알고 있었지만 천연기념물로 지정되어있다니, 그건 몰랐어요. 국적 얘기가 나와서 말인데요, 시베리안 허스키 있잖아요, 그 종류는 시베리아에서 와서 시베리안이라는 이름이 붙는 건가요?				0	2022-08-04 11:16:58	2022-08-16 17:16:51
BK22003929	4	전문가	네, 맞아요. 이름에서도 알 수 있다시피 시베리아, 특히 동시베리아에서 왔어요. 털이 촘촘한 썰매견으로 알려져 있죠. 참고로 시베리안 허스키를 구분할 땐 뭘로 구분하냐면, 쫑긋한 삼각형 모양의 귀, 적당한 근육, 또렷한 무늬와 두 겹으로 나있는 두터운 털, 낫 모양을 하고 있는 꼬리 등으로 구분해요.	시베리안 허스키	https://ko.wikipedia.org/wiki/%EC%8B%9C%EB%B2%A0%EB%A6%AC%EC%95%88_%ED%97%88%EC%8A%A4%ED%82%A4	2022/07/14	0	2022-08-04 11:16:58	2022-08-16 17:16:51
BK22003929	5	질문자	이렇게 특정 지명이 이름에 들어가다보니 이름만 보고도 어디서 왔는지 알 수 있겠네요. 그럼 혹시 알래스칸 맬러뮤트도 이런 지역 명을 붙인 이름인가요?				0	2022-08-04 11:16:58	2022-08-17 09:55:25
BK22003929	6	전문가	잘 아시네요. 알래스칸 맬러뮤트도 이름에서 알 수 있듯이 알래스카에서 왔죠. 역시 썰매를 끄는 썰매개예요. 힘도 좋고, 지구력도 있어서 강인하죠. 가끔은 시베리안 허스키와 헷갈리는 경우도 있지만, 다른 점이 많아요.	알래스칸 맬러뮤트	https://ko.wikipedia.org/wiki/%EC%95%8C%EB%9E%98%EC%8A%A4%EC%B9%B8_%EB%A7%AC%EB%9F%AC%EB%AE%A4%ED%8A%B8	2022/03/11	0	2022-08-04 11:16:58	2022-08-17 09:55:25
BK22003929	7	질문자	알래스칸 맬러뮤트도 썰매를 끄는 견종이군요. 혹시 알래스칸 맬러뮤트나 시베리안 허스키 말고도 썰매를 끄는 견종이 또 있나요?				0	2022-08-04 11:16:58	2022-08-17 09:55:25
BK22003929	8	전문가	사모예드도 썰매를 끄는 개예요. 물론 가정에서 반려견으로도 많이 키우죠. 시베리안 허스키처럼 시베리아에서 왔구요. 사모예드는 지역 이름은 아니고, 북쪽의 시베리아 유목민들의 이름을 따서 지은거예요. 유목민족 이름이 사모예드족이거든요.	사모예드	https://ko.wikipedia.org/wiki/%EC%82%AC%EB%AA%A8%EC%98%88%EB%93%9C%EA%B2%AC	2022/03/12	0	2022-08-04 11:16:58	2022-08-17 09:55:25
BK22003929	9	질문자	사모예드도 썰매를 끄는 견종이라니, 역시 몸집이 큰 개들이 힘이 좋은가봐요. 몸집이 큰 견종 중에서 양떼 모는 개도 있지 않나요?				0	2022-08-04 11:16:58	2022-08-17 09:55:25
BK22003929	10	전문가	보더콜리 아세요? 양치는 개로 잘 알려져 있어요. 별명이 농장의 양치는 개, 일하는 양치는 개예요. 운동량이 많아서 훈련시키는 것이나 운동을 좋아하는 사람에게 적합한 견종이죠. 보더콜리는 끈기가 있는 편인데, 지능이 높고 주인에게 순종적이에요.	보더콜리	https://www.ajunews.com/view/20200623093408206	2020/06/23	0	2022-08-04 11:16:58	2022-08-17 09:55:25
BK22003929	11	질문자	일하는 개라니, 목축업을 많이 하는 나라에서 흔히 볼 수 있겠네요. 이름을 들어보니 이 종류도 맞는 것 같은데, 혹시 올드 잉글리시 쉽독도 양치는 개인가요?				0	2022-08-04 11:16:58	2022-08-04 11:16:58
BK22003929	12	전문가	네, 맞아요. 이 견종도 목양견이고 이름에서 알 수 있듯이 영국에서 왔어요. 귀요미 강아지라는 별칭도 가졌어요. 청색과 회색이 올드 잉글리시 쉽독의 대표 색상인데 아쉽게도 유의해야 할 질병이 있어요. 결막염과 각막염, 백내장도 조심해야 하는데, 당뇨도 주의해야 해요.	올드 잉글리시 쉽독	https://ko.wikipedia.org/wiki/%EC%98%AC%EB%93%9C_%EC%9E%89%EA%B8%80%EB%A6%AC%EC%8B%9C_%EC%8B%9C%ED%94%84%EB%8F%84%EA%B7%B8	2022/03/06	0	2022-08-04 11:16:58	2022-08-17 09:55:25
BK22003929	13	질문자	올드 잉글리시 쉽독 저도 알아요. 그치만 주의해야 할 질병이 있다는 건 몰랐네요. 아, 그리고 다리가 길쭉길쭉하고 날렵하게 생긴 강아지도 봤는데, 그레이 하운드였나, 그 종류도 혹시 목양견인가요?				0	2022-08-04 11:16:58	2022-08-16 17:16:51
BK22003929	14	전문가	아뇨, 그레이하운드는 목양견이 아니고 사냥개예요. 보신대로 그레이하운드는 몸이 가늘어서 아주 잘 달려요. 참고로 이 견종은 이집트에서 왔고 평균적으로 체고는 약 70센티, 몸무게는 27킬로에서 32킬로 정도예요.	그레이하운드	https://ko.wikipedia.org/wiki/%EA%B7%B8%EB%A0%88%EC%9D%B4%ED%95%98%EC%9A%B4%EB%93%9C	2022/02/23	0	2022-08-04 11:16:58	2022-08-04 11:16:58
BK22003929	15	질문자	하운드 종류에게 목양을 맡기면 안되겠군요. 또 다른 사냥개는 어떤 견종이 있어요?				0	2022-08-04 11:16:58	2022-08-04 11:16:58
BK22003929	16	전문가	독일에서 온 닥스훈트도 원래는 오소리 사냥을 하는 전문 사냥개예요. 몸통이 긴데 다리는 짧아요. 근데 닥스훈트도 주의해야 할 질병이 있어요. 심장판막질환 발생 확률이 선천적으로 높은 편이거든요. 닥스훈트가 나이가 들면 내분비질환의 하나인 당뇨병이나 쿠싱증후군이 발병할 가능성도 커진다는 것도 알아두셔야 해요.	닥스훈트	https://ko.wikipedia.org/wiki/%EB%8B%A5%EC%8A%A4%ED%9B%88%ED%8A%B8	2022/06/20	0	2022-08-04 11:16:58	2022-08-16 17:16:51
BK22003929	17	질문자	닥스훈트도 사냥개 종류인 건 몰랐어요. 다리 길이가 인상적이어서 쉽게 잊혀지지 않는 견종이에요.				0	2022-08-04 11:16:58	2022-08-17 09:55:25
BK22003929	18	전문가	외형이 특이하다보니 오래 기억에 남죠.				0	2022-08-04 11:16:58	2022-08-17 09:55:25
BK22003929	19	질문자	아무튼 오늘 몰랐던 것을 많이 알게 되었네요. 궁금한 것이 또 생기면 또 여쭤봐도 될까요?				0	2022-08-04 11:16:58	2022-08-04 11:16:58
BK22003929	20	전문가	그럼요, 당연하죠. 언제든지 궁금한 것이 있으시면 제게 연락 주세요.				1	2022-08-04 11:16:58	2022-08-17 09:55:25
