id	utterance_id	role	text	search_query	search_URL	reference_date	terminate	regDate	updDate
BK22002628	1	질문자	2세 계획을 세우고 있는데 학비가 장난이 아니라는 말을 많이 들었어요. 그래서 미리 유치원이나 교육비도 좀 알아봐야 할 것 같아요.				0	2022-08-02 12:18:13	2022-08-02 14:00:03
BK22002628	2	전문가	미리 계획을 세우면 좋죠. 아기가 크기 전에 계획을 세워야 어린이집이나 유치원 입학, 학군지로 이사 등의 결정이 쉬워질 거예요.				0	2022-08-02 12:18:13	2022-08-02 14:00:03
BK22002628	3	질문자	제 생각도 그래요. 미리 준비해서 나쁠 건 없으니까요. 조카를 보니까 영어유치원을 다니던데 요즘에는 영어유치원에 다니는 아이들이 많나요?				0	2022-08-02 12:18:13	2022-08-02 14:00:03
BK22002628	4	전문가	영어유치원은 상류 교육 코스로 알려져 있는데, 국내 시장규모가 2500억원을 넘을 정도로 커졌어요.	영어유치원통계	http://plus.hankyung.com/apps/newsinside.view?aid=201609200465A	2016/09/20	0	2022-08-02 12:18:13	2022-08-02 14:00:03
BK22002628	5	질문자	많은 아이들이 영어유치원을 다니고 있나 보네요. 영어유치원은 되게 비싸다고 들었는데 얼마나 비싼가요?				0	2022-08-02 12:18:13	2022-08-02 14:00:03
BK22002628	6	전문가	2018년 사교육걱정없는세상 법률위원회의 조사에 따르면 서울의 유아 영어학원의 평균 학원비는 월 103만 7000원이었어요.	영어유치원 비용	http://weekly.khan.co.kr/khnm.html?mode=view&code=115&artid=202006191523151&pt=nv	2020/06/29	0	2022-08-02 12:18:13	2022-08-02 14:00:03
BK22002628	7	질문자	학원비만 100만원이 넘으면 식비와 다른 생활비까지 합치면 어마어마 하겠군요. 그렇다면 공립 유치원은 얼마예요?				0	2022-08-02 12:18:13	2022-08-02 14:00:03
BK22002628	8	전문가	국공립 유치원은 방과 후 과정을 포함해서 월 평균 5000원이고 사립유치원은 평균 17만원이 들어요.	공립 유치원 비용	https://www.ibabynews.com/news/articleView.html?idxno=100440	2021/11/29	0	2022-08-02 12:18:13	2022-08-02 14:00:03
BK22002628	9	질문자	유치원마다 비용 차이가 너무 많이 나네요. 국공립유치원을 다니면서 영어학원을 다니는 게 나을지도 모르겠어요. 국공립유치원에 입학하려면 어떻게 해야 하나요?				0	2022-08-02 12:18:13	2022-08-02 14:00:03
BK22002628	10	전문가	유치원에 입학하려면 처음학교로 사이트에서 접수해야 해요. 1지망부터 3지망까지 접수를 한 후에 추첨으로 선발되니까 가고싶은 유치원을 미리 선택해야 해요.	공립 유치원 입학 방법	http://www.gjdream.com/news/articleView.html?idxno=610978	2021/10/27	0	2022-08-02 12:18:13	2022-08-02 14:00:03
BK22002628	11	질문자	유치원도 인터넷으로 접수를 할 수가 있군요. 영어유치원은 너무 비싸서 안되겠고 공립이나 사립으로 다닐 수 밖에 없겠네요. 보통 어린이집을 다니고 나서 유치원에 보내는 거죠?				0	2022-08-02 12:18:13	2022-08-02 14:00:03
BK22002628	12	전문가	어린이집은 만 0세부터 5세까지 다닐 수 있고 유치원은 만 3세부터 5세까지 다닐 수 있어요.	어린이집 유치원 입학 나이	http://www.ksilbo.co.kr/news/articleView.html?idxno=761092	2020/05/10	0	2022-08-02 12:18:13	2022-08-02 14:00:03
BK22002628	13	질문자	어린이집이랑 유치원은 순서가 따로 없군요. 요즘은 맞벌이 가정이 많은데 유치원 마치는 시간이 지나면 어떻게 돌보는지 궁금하네요.				0	2022-08-02 12:18:13	2022-08-02 14:00:03
BK22002628	14	전문가	요즘 공립유치원과 사립유치원 모두 정규 수업이 끝난 뒤에도 맞벌이 가정을 위해 종일반을 운영해요. 사립 유치원은 원하면 종일반을 다닐 수 있지만 공립유치원은 불가능할 때도 있어요. 그래서 원비가 더 비싸더라도 사립 유치원을 선택하는 학부모도 있어요.	유치원 맞벌이	https://www.chosun.com/site/data/html_dir/2018/10/27/2018102700141.html	2018/10/27	0	2022-08-02 12:18:13	2022-08-02 14:00:03
BK22002628	15	질문자	국공립 유치원의 종일반은 경쟁률이 높은가 보네요.				0	2022-08-02 12:18:13	2022-08-02 14:00:03
BK22002628	16	전문가	방과후 과정이 종일반인데, 2018년 서울 지역의 국공립유치원 방과후 과정 경쟁률은 4.28 대 1이예요.	국공립 유치원 종일반 경쟁률	https://www.hankookilbo.com/News/Read/201903131758040339	2019/03/14	0	2022-08-02 12:18:13	2022-08-02 14:00:03
BK22002628	17	질문자	경쟁률이 많이 높군요. 유치원 종일반은 그럼 몇시까지 애기를 봐주나요? 저는 맞벌이를 계속 할 생각이라 퇴근시간과 비슷하게라도 데리고 있어주면 좋겠네요.				0	2022-08-02 12:18:13	2022-08-02 14:00:03
BK22002628	18	전문가	종일반은 하루 12시간으로 오전 7시반부터 오후 7시 반까지 돌봄서비스를 제공해요. 하지만 아무나 종일반에 입학 할 수 있는 건 아니고 맞벌이, 다자녀, 한부모 가정이 종일반에 입학 할 수 있어요. 전업주부나 육아휴직자는 하루에 6시간 돌봐주는 맞춤반을 이용할 수 있어요.	유치원 종일반 시간	http://view.asiae.co.kr/news/view.htm?idxno=2016051306590410565	2016/05/13	0	2022-08-02 12:18:13	2022-08-02 14:00:03
BK22002628	19	질문자	원한다고 해서 종일반을 이용할 수 있는게 아니군요. 유치원 선택부터 이렇게 어려울 줄 몰랐네요.				0	2022-08-02 12:18:13	2022-08-02 14:00:03
BK22002628	20	전문가	유치원 선택하는 것도 많이 따져봐야 해요. 나중에 유치원 고르실때 알려주시면 제가 많이 도움 드릴게요.				0	2022-08-02 12:18:13	2022-08-02 14:00:03
BK22002628	21	질문자	감사합니다. 아이 교육에 많은 돈이 든다고 해서 막연하게 걱정만 했는데 오늘 대화를 통해서 조금이라도 알게 되어서 마음이 편한하네요. 다음번에 또 궁금한 거 있으면 말씀드릴게요.				1	2022-08-02 12:18:13	2022-08-02 16:54:54
