id	utterance_id	role	text	search_query	search_URL	reference_date	terminate	regDate	updDate
BK22011636	1	질문자	요즘 반려견으로 키울 강아지를 알아보고 있는데, 주변에서 웰시 코기를 많이 추천해 주더라고. 그래서 말인데 웰시 코기의 특징에 대해서 좀 알려줄래?				0	2022-09-27 14:11:01	2022-09-27 14:11:01
BK22011636	2	전문가	웰시 코기는 웨일스 출신으로 짧은 다리와 긴 몸통을 특징으로 가지고 있어. 이런 체형적 특징 때문에 종종걸음으로 걸어 다니는데, 이 모습이 사랑스러워 보여서 반려견으로서 인기가 많은 편이야.	웰시 코기 특징	http://star.ohmynews.com/NWS_Web/OhmyStar/at_pg.aspx?CNTN_CD=A0002723337&CMPT_CD=P0010&utm_source=naver&utm_medium=newsearch&utm_campaign=naver_news	2021/03/02	0	2022-09-27 14:11:01	2022-09-27 14:11:01
BK22011636	3	질문자	맞아, 웰시 코기의 걸음걸이가 너무 귀엽긴 하더라. 웰시 코기의 특징은 또 어떤 게 있어?				0	2022-09-27 14:11:01	2022-09-27 14:11:01
BK22011636	4	전문가	웰시 코기 품종은 친화력이 좋고 사람을 잘 따르는 특징을 가지고 있어. 그리고 웰시 코기 중 일부는 보더 콜리처럼 양몰이를 할 수 있는 능력도 가지고 있지.	웰시 코기 사람을 잘 따르는 품종	https://ko.wikipedia.org/wiki/%EC%9B%B0%EC%8B%9C_%EC%BD%94%EA%B8%B0	2022/07/30	0	2022-09-27 14:11:01	2022-09-27 14:11:01
BK22011636	5	질문자	그렇구나. 그런데 웰시 코기가 정말 목양견으로 쓰였어? 웰시 코기는 다리가 짧아서 양몰이를 못할 것 같거든.				0	2022-09-27 14:11:01	2022-10-03 13:23:47
BK22011636	6	전문가	그렇게 생각할 수도 있겠네. 하지만, 웰시 코기는 목양견이 맞아. 그리고 웰시 코기의 짧은 다리는 웰시 코기가 가축을 몰 때 소나 양 같은 가축의 발에 차이는 걸 방지하기 위해 개량된 결과물이야.	웰시코기 목양견 다리	https://www.insight.co.kr/news/172458	2018/08/15	0	2022-09-27 14:11:01	2022-09-30 14:45:29
BK22011636	7	질문자	아하, 오히려 다리가 길면 가축에 치여서 다칠 수 있겠구나. 이건 미처 생각을 못 했네. 혹시 웰시 코기의 꼬리가 짧은 것도 목양견이라는 특징과 어떤 연관이 있는 건가?				0	2022-09-27 14:11:01	2022-09-27 14:11:01
BK22011636	8	전문가	맞아. 목양견으로 쓰이던 웰시 코기는 원래 긴 꼬리를 가지고 있었는데, 가축에게 밟히는 사고를 막기 위해 웰시 코기의 꼬리를 자르는 관습이 생겨나게 된 거거든.	웰시코기 목양견 꼬리	https://sports.khan.co.kr/bizlife/sk_index.html?cat=view&art_id=201606201543003&sec_id=650101&pt=nv	2016/06/21	0	2022-09-27 14:11:01	2022-09-27 14:11:01
BK22011636	9	질문자	이런 이유 때문에 웰시 코기의 다리와 꼬리가 짧은 거였구나. 그런데 반려견의 꼬리는 원래 어떤 역할을 하는 거지?				0	2022-09-27 14:11:01	2022-09-27 14:11:01
BK22011636	10	전문가	반려견에게 있어서 꼬리는 자신의 감정을 표현할 수 있는 중요한 기관이야. 경계할 때는 꼬리를 바짝 세우고, 기분이 좋으면 꼬리를 열심히 흔드는 등 반려견은 꼬리를 표현 수단으로 사용하거든. 보호자들이 반려견의 감정을 알 수 있는 방법이기도 하고.	반려견 꼬리 감정표시	https://news.mt.co.kr/mtview.php?no=2019121309563198717	2019/12/15	0	2022-09-27 14:11:01	2022-09-27 14:11:01
BK22011636	11	질문자	이렇게 감정을 나타낼 수 있는 중요한 기관인데, 웰시 코기에게 꼬리 자르는 수술을 해도 되는 거야? 단미 수술이 법적으로 허용되는 건지 궁금해. 이제 목양견으로 쓰이는 것도 아니어서 굳이 꼬리를 자를 필요가 없을 것 같거든.				0	2022-09-27 14:11:01	2022-09-27 14:11:01
BK22011636	12	전문가	한국에는 법적 규정이 없어서 단미 수술을 금지할 방법이 없어. 그래서 요즘 여러 동물 보호 단체에서는 단미 수술을 동물 학대로 여겨야 한다고 주장하고 있지. 참고로 노르웨이, 프랑스, 네덜란드, 호주 등의 나라에서는 단미 수술을 법적으로 금지하고 있는 상황이야.	단미 수술 법적 규정	https://www.mk.co.kr/news/culture/view/2022/06/527039/	2022/06/16	0	2022-09-27 14:11:01	2022-09-27 14:11:01
BK22011636	13	질문자	우리나라도 얼른 단미 수술을 금지하는 법적 규정이 마련되어야겠네. 그나저나 웰시 코기는 보통 무게가 어느 정도 돼? 소형견, 중형견, 대형견 중 어디에 속하는지 궁금해.				0	2022-09-27 14:11:01	2022-09-27 14:11:01
BK22011636	14	전문가	웰시 코기는 작은 체구 때문에 소형견으로 보는 사람들이 많은데 사실 웰시 코기는 중형견에 속해. 웰시 코기의 체중은 15킬로그램 정도이고 키는 25에서 30센티미터 정도 되거든.	웰시코기 체중 키	https://www.asiatime.co.kr/article/20210513500311	2021/05/13	0	2022-09-27 14:11:01	2022-10-04 15:20:27
BK22011636	15	질문자	웰시 코기가 그렇게 작은 건 아니구나. 웰시 코기 품종은 어떤 질병에 취약한 편이야? 키우기 전에 미리 알아둬야 할 것 같아서 말이야.				0	2022-09-27 14:11:01	2022-09-27 14:11:01
BK22011636	16	전문가	웰시 코기는 경추 부분의 추간판 탈출증이 생기지 않도록 특히 조심해야 해. 또한, 허리가 길고 다리가 짧은 체형적인 특성상 뒷다리에 마비 증상이 생길 수도 있어. 그리고 급성 탈출증이 유발되는 행동인 소파나 침대 등을 오르내리는 것을 웰시 코기가 피할 수 있도록 보호자가 신경 써야 해.	웰시코기 급성 탈출증	https://www.insight.co.kr/news/173733	2018/08/26	0	2022-09-27 14:11:01	2022-09-27 14:11:01
BK22011636	17	질문자	응, 귀여워 보이는 강아지의 외형이 질병의 원인이 되기도 하는구나.				0	2022-09-27 14:11:01	2022-09-27 14:11:01
BK22011636	18	전문가	맞아, 그래도 미리 신경 쓰고 관리해 주면 큰 문제는 없을 거야.				0	2022-09-27 14:11:01	2022-09-27 14:11:01
BK22011636	19	질문자	알겠어. 덕분에 오늘 웰시 코기에 대해 많은 걸 배울 수 있었어. 고마워!				0	2022-09-27 14:11:01	2022-09-27 14:11:01
BK22011636	20	전문가	혹시 나중에 더 궁금한 점이 있으면 언제든 물어봐!				1	2022-09-27 14:11:01	2022-10-04 15:20:27
