id	utterance_id	role	text	search_query	search_URL	reference_date	terminate	regDate	updDate
BK22012756	1	질문자	강아지가 나이가 들면서 안질환에 대해 궁금한 게 많아졌어. 혹시 강아지도 안구건조증이 생길 수 있을까?				0	2022-09-30 15:22:44	2022-10-01 16:23:48
BK22012756	2	전문가	갑자기 날씨가 추워지거나 건조함, 미세먼지로 인해 강아지도 건성각 결막염이라고도 부르는 안구건조증이 생길 수 있어. 안구건조증은 강아지에게 흔하게 발생하는 안과질환인데, 눈물의 분비량 감소로 인해 눈물층이 모자라게 되면 생기게 돼.	강아지 안구건조증	https://www.kidd.co.kr/news/213386	2020/01/08	0	2022-09-30 15:22:44	2022-10-01 16:23:48
BK22012756	3	질문자	안구건조증이 생기게 되면 어떤 증상이 나타나게 돼?				0	2022-09-30 15:22:44	2022-10-01 16:23:48
BK22012756	4	전문가	눈이 충혈되거나 실눈을 뜨며, 끈끈한 눈곱이 생기거나 눈을 깜빡이는 게 잦다면 강아지에게 안구건조증이 생긴 거야.	반려견 안구건조증  눈곱	https://www.fneyefocus.com/news/articleView.html?idxno=15011	2020/11/06	0	2022-09-30 15:22:44	2022-10-01 16:23:48
BK22012756	5	질문자	혹시 다른 이유로 눈곱이 생길 수도 있어?				0	2022-09-30 15:22:44	2022-10-01 16:23:48
BK22012756	6	전문가	다른 강아지들과 놀다가 다치거나 눈 주변이 간지러워 긁다가 발톱에 긁혀서 각막에 손상을 입어 눈곱이 낄 수 있어. 그래서 각막에 상처가 나지 않도록 조심해 줘야 해.	강아지 눈곱 원인	https://www.notepet.co.kr/news/article/article_view/?idx=16152	2019/07/03	0	2022-09-30 15:22:44	2022-10-01 16:23:48
BK22012756	7	질문자	안구건조증이 아니어도 눈곱이 낄 수 있구나. 그런데 안구건조증이 생기면 병원에 데려가야 해?				0	2022-09-30 15:22:44	2022-10-01 16:23:48
BK22012756	8	전문가	안구건조증도 다른 질환들처럼 발견하면 초기에 바로 치료를 해주는 게 중요해. 수의사의 지시대로 연고나 안약을 꾸준히 발라주고, 세균이 침윤했다면 세안 약을 넣어줘서 닦아내줘야 헤.	안구건조증 치료	https://www.kidd.co.kr/news/213386	2020/01/08	0	2022-09-30 15:22:44	2022-10-01 16:23:48
BK22012756	9	질문자	강아지에게서 안구건조증 증상이 나타나면 바로 동물 병원에 데려가야겠다.				0	2022-09-30 15:22:44	2022-10-01 16:23:48
BK22012756	10	전문가	어떤 질환이든 증상이 나타나면 바로 병원에 데려가는 게 좋아.				0	2022-09-30 15:22:44	2022-10-01 16:23:48
BK22012756	11	질문자	그래야겠어. 그런데 강아지들의 시력을 저하시키는 안질환에 어떤 것들이 있는지 알아?				0	2022-09-30 15:22:44	2022-10-01 16:23:48
BK22012756	12	전문가	녹내장과 포도막염, 각막궤양이 반려동물의 시력을 망가뜨리는 주 3대 안과질환이야. 그중에서 각막궤양이 나이 상관없이 제일 수두룩하게 발생해.	반려동물 안과질환	https://www.fneyefocus.com/news/articleView.html?idxno=16641	2021/12/12	0	2022-09-30 15:22:44	2022-10-01 16:23:48
BK22012756	13	질문자	각막궤양이 뭔지 설명해 줄 수 있어?				0	2022-09-30 15:22:44	2022-10-01 16:23:48
BK22012756	14	전문가	각막은 눈 가장 앞쪽에 있는 동공과 홍재를 보호해 주는 막인데, 이 각막에 상처와 손상이 생기게 되는 게 각막궤양이야. 만약 이 질환이 의심되면 동물 병원에서 형광 염색약을 통해 진단을 받을 수 있어.	각막궤양	https://www.healthinnews.co.kr/news/articleView.html?idxno=31441	2022/07/22	0	2022-09-30 15:22:44	2022-10-01 16:23:48
BK22012756	15	질문자	각막궤양은 어쩌다가 생기게 되는 거야?				0	2022-09-30 15:22:45	2022-10-01 16:23:48
BK22012756	16	전문가	각막궤양은 얼굴을 씻길 때 각막을 건드리게 돼서 각막 궤양이 생기거나, 샴푸가 각막을 손상시켜서 발생하게 돼. 그런데 반려동물은 말을 못 해서 시력에 문제가 발생해도 가족들이 발견하기가 쉽지 않아.	각막궤양 유발	https://www.hankookilbo.com/News/Read/201709261033688843	2017/09/26	0	2022-09-30 15:22:45	2022-10-01 16:23:48
BK22012756	17	질문자	그렇구나. 궁금한 게 있는데 백내장은 노견에서만 발생하는 질환이야?				0	2022-09-30 15:22:45	2022-10-01 16:23:48
BK22012756	18	전문가	대부분 나이가 들어가면서 백내장이 발생한다고 알고 있는데, 어린 강아지를 비롯해서 모든 강아지들에게 백내장이 생길 수도 있어. 유전성 백내장은 어린 나이에 생기거든.	백내장   어린 강아지	https://www.news1.kr/articles/?4191703	2021/01/27	0	2022-09-30 15:22:45	2022-10-01 16:23:48
BK22012756	19	질문자	나이가 어린 강아지에게도 백내장이 생길 수 있구나.				0	2022-09-30 15:22:45	2022-10-01 16:23:48
BK22012756	20	전문가	강아지들의 안질환을 위해서 평소에 관리를 잘해주는 게 좋아.				1	2022-09-30 15:22:45	2022-10-01 16:23:48
