id	utterance_id	role	text	search_query	search_URL	reference_date	terminate	regDate	updDate
BK22001749	1	질문자	집에 혹시 어린이 해열제 남는 거 있으세요?				0	2022-07-20 16:19:05	2022-08-02 12:01:32
BK22001749	2	전문가	해열제는 늘 상비약으로 가지고 있죠. 가족 중 열나는 사람이 있나요?				0	2022-07-20 16:19:05	2022-07-21 10:59:43
BK22001749	3	질문자	네, 저희 둘째가 며칠 전부터 콧물이 나길래 지켜보고 있었는데 오늘 갑자기 체온을 재보니 37.9도네요. 꼭 38도 넘어야 해열제를 먹일 수 있나요?				0	2022-07-20 16:19:05	2022-08-02 12:01:32
BK22001749	4	전문가	에고, 고열로 오르면 안되는데 걱정되시겠어요. 보통 해열진통제는 아이가 38도 이상의 고열일 때 사용하는 것을 권장하지만 반드시 38도를 넘긴 다음 사용할 수 있는 약은 아니에요. 저는 아이가 유난히 더 힘들어 할 때 해열진통제로서 먹이고 있어요.	어린이 해열제 38도	https://health.chosun.com/site/data/html_dir/2022/03/28/2022032801982.html	2022/03/29	0	2022-07-20 16:19:05	2022-07-21 10:59:43
BK22001749	5	질문자	먹여도 된다니 다행이네요. 저희 아이가 어렸을 때 열성경련 경험도 있고 지금 무척 힘들어하니 우선 먹여야겠네요. 그때 정말 무서웠거든요.				0	2022-07-20 16:19:05	2022-08-02 12:01:32
BK22001749	6	전문가	아이의 열성경련을 처음 보니까 얼마나 놀라셨겠어요. 다른 신경학적 기저질환이 없는 건강한 소아에게 단순열성경련이 생긴다면 뇌전증으로 이행할 확률은 약 1퍼센트로 매우 적으니 너무 큰 걱정은 안 하셔도 돼요.	열성경련	https://www.inews365.com/news/article.html?no=680654	2021/09/02	0	2022-07-20 16:19:05	2022-07-21 10:59:43
BK22001749	7	질문자	아이 키우는 게 정말 쉬운 일이 아니네요. 열날 때마다 겁부터 나서 알람 맞추고 밤새 보초 서는 것도 너무 힘들어요. 열날 때 알람해주는 편리한 앱 같은 거 없을까요?				0	2022-07-20 16:19:05	2022-08-02 12:01:32
BK22001749	8	전문가	아, 제가 강력 추천하고 싶은 앱이 있어요. 열이 날 때 엄마가 어떻게 행동해야 할지 알려주는 열나요 앱을 추천해요. 아이 체온 입력에 따라 해열제 용량, 복용 간격도 알려주고, 체온 측정 시간도 알람으로 알려줘서 해열제 하루 허용량, 아이 수분 섭취 필요량도 관리할 수 있어요. 저도 아이가 열이 나기 시작하면 무조건 열나요 어플에 제일 먼저 기록하고 있어요.	열나요 어플	https://www.ibabynews.com/news/articleView.html?idxno=37361	2016/02/18	0	2022-07-20 16:19:05	2022-07-21 10:59:43
BK22001749	9	질문자	저는 매번 수기로 써서 체크했는데 이제는 어플을 이용해야겠네요.				0	2022-07-20 16:19:05	2022-08-02 12:01:32
BK22001749	10	전문가	아직도 이 어플을 모르셨군요. 진짜 전문의가 만든 어플이라서 더 믿음이 가는 어플이에요.				0	2022-07-20 16:19:05	2022-07-21 10:59:43
BK22001749	11	질문자	우와, 그렇군요. 유용한 어플을 알게 되서 든든하긴 한데 저 사실 아직 어린이 해열제 성분 종류도 헷갈리더라고요. 저에게 자세히 설명 좀 해줄 수 있나요?				0	2022-07-20 16:19:05	2022-08-02 12:01:32
BK22001749	12	전문가	저도 처음엔 엄청 헷갈렸는데 성분에 대한 공부를 미리 해두니 지금은 걱정없네요. 소아에게 사용할 수 있는 해열제 성분은 아세트아미노펜, 이부프로펜, 덱시부프로펜이 있어요. 그중에서도 소아 청소년에게는 아세트아미노펜 복용이 우선적으로 권고되고 있어요. 혹시 지금 어떤 성분의 해열제를 갖고 계세요?	어린이 해열제 성분 종류	https://health.chosun.com/site/data/html_dir/2022/03/25/2022032501821.html	2022/03/26	0	2022-07-20 16:19:05	2022-07-21 10:59:43
BK22001749	13	질문자	지금은 아세트아미노펜 해열제만 갖고 있어서 다른 계열의 해열제가 있으신지 여쭈려고 연락드렸어요. 열이 안 떨어지면 교차 복용 해야 될 것 같아서요. 교차복용은 어떻게 해야 될까요?				0	2022-07-20 16:19:05	2022-08-02 12:01:32
BK22001749	14	전문가	저는 종류별로 갖고 있으니 급하시면 제가 나눠드릴게요. 그 전에 교차복용 방법부터 얼른 익히세요. 교차복용은 통상적으로 2시간 간격으로 해야해요. 같은 계열의 해열제는 4시간에서 6시간 혹은 6시간에서 8시간 간격으로 복용해야 하는데 다른 계열의 해열제는 2시간 간격으로 복용할 수 있는 것이죠. 또 부루펜 계열과 맥시부펜 계열은 교차 복용 금지니까 꼭 기억해두세요.	어린이 해열제 교차복용	https://www.sedaily.com/NewsView/1ZABCNDZSG	2020/11/09	0	2022-07-20 16:19:05	2022-07-21 10:59:43
BK22001749	15	질문자	이래서 성분별로 해열제를 구비해두어야 하네요. 지난번 코로나 대유행일 때도 약국에 어린이 해열제가 없어서 난리였잖아요. 가을에 코로나가 재유행한다고 예상하던데 만약 어린이 해열제가 품절되면 그때 성인약도 먹어도 될까요?				0	2022-07-20 16:19:05	2022-08-02 12:01:32
BK22001749	16	전문가	해열진통제 소아용과 성인용의 주요 성분은 같아서 성인용으로도 복용이 가능해요. 다만, 보통 12세 이상의 체중 40킬로그램 이상의 소아는 성인용 약품을 그대로 복용할 수 있지만 그 이하의 소아가 성인용 약물을 복용하기 위해서는 연령과 체중에 맞는 용량으로 정제를 분할하거나 가루약으로 조제해야 가능해요. 저라면 어떻게 해서든 소아용을 찾아서 먹일 것 같은데 만일을 위해서 알아두면 좋아요.	어린이 해열제 대신 성인약	https://health.chosun.com/site/data/html_dir/2022/04/01/2022040101825.html	2022/04/02	0	2022-07-20 16:19:05	2022-07-21 10:59:43
BK22001749	17	질문자	네, 비상상황이 생길 수도 있으니 알아둘게요! 지금도 저희 아이 열이 펄펄나는데 대체 해열제 효과는 언제부터 나타날까요?				0	2022-07-20 16:19:05	2022-08-02 12:01:32
BK22001749	18	전문가	해열제 먹인지 얼마 안 되지 않았나요? 해열제 먹이고 30분에서 수시간 후에 열이 점차 떨어질 수 있어요. 엄마 마음이 급해서 해열제를 더 먹이고 다른 해열제로 교차복용시키면 매우 위험할 수 있으니까 복용법을 꼭 지키세요.	해열제 효과 시간	http://www.k-health.com/news/articleView.html?idxno=58679	2022/03/24	0	2022-07-20 16:19:05	2022-07-21 10:59:43
BK22001749	19	질문자	열성경련이 또 나타날까봐 겁이 나서 체온계로 자주 체크하게 되네요. 차라리 미온수 마사지라도 하는 게 좋을까요?				0	2022-07-20 16:19:05	2022-08-02 12:01:32
BK22001749	20	전문가	미온수 마사지는 상황에 맞게 해야 해요. 열이 날 때 바로 미온수 마사지를 하면 아이가 보챌 수도 있고, 오한으로 오히려 아이가 힘들어 할 수도 있고요. 해열제를 먹이고 1시간 정도 후에도 열이 높으면 그때 미온수 마사지를 하는 것이 좋으니 좀 더 지켜보는 게 어때요?	미온수 마사지	https://news.imaeil.com/page/view/2022053021324599498	2022/06/01	0	2022-07-20 16:19:05	2022-07-21 10:59:43
BK22001749	21	질문자	네, 지켜볼게요! 아이가 정말 오랜만에 열이 나다 보니 제가 조급해진 것 같네요. 알려주신 정보들 덕분에 이번에는 대처를 잘할 수 있을 것 같아요.				0	2022-07-20 16:19:05	2022-08-02 12:01:32
BK22001749	22	전문가	아이가 열이 나면 엄마는 마음이 급해지죠. 저도 매번 그러는 걸요. 저희 집에 모든 종류의 해열제가 있으니 필요하시면 새벽이라도 연락 주세요!				0	2022-07-20 16:19:05	2022-07-21 10:59:43
BK22001749	23	질문자	정말 감사합니다, 아이 경과 지켜보다가 혹시 연락 드릴 일이 생기면 다시 연락 드릴게요!				1	2022-07-20 16:19:05	2022-08-02 12:01:32
