id	utterance_id	role	text	search_query	search_URL	reference_date	terminate	regDate	updDate
BK22000680	1	질문자	우리 애가 공부할 때마다 자꾸 딴 짓만 하려고 해서 고민이네. 10분 이상 집중을 못하는 것 같아.				0	2022-07-20 16:09:29	2022-08-02 12:01:32
BK22000680	2	전문가	혹시 ADHD 있는 거 아니야? ADHD 있으면 공부하는 데에 집중하기도 힘들고 학습에 오랜 시간 몰두하기가 어렵거든.	공부에 집중을 잘 못하는 아이	http://www.kyeongin.com/main/view.php?key=20220517010003015	2022/05/18	0	2022-07-20 16:09:29	2022-07-21 09:55:40
BK22000680	3	질문자	단순히 집중력이 낮은 건 줄 알고 조금 혼도 내보고 했는데, 병일 수도 있다니까 괜히 미안해지네.				0	2022-07-20 16:09:29	2022-08-02 12:01:32
BK22000680	4	전문가	양육태도를 그런 식으로 고정하다가는 아이가 더 이상 말도 안 듣게 되고 갈등도 생길 수 있어. 그러다 보면 너도 우울감이 생길 수 있지.	adhd 양육 태도	http://www.jeonmin.co.kr/news/articleView.html?idxno=354871	2022/04/29	0	2022-07-20 16:09:29	2022-07-21 09:55:40
BK22000680	5	질문자	상황이 더 악화되기 전에 알게돼서 다행이다. ADHD 검사해보려면 어떻게 해야 해?				0	2022-07-20 16:09:29	2022-08-02 12:01:32
BK22000680	6	전문가	병원가서 CAT 검사를 받아보면 돼. CAT 검사로 아이의 주의력을 종합적이고 객관적으로 평가할 수 있거든.	adhd 진단 방법	http://www.e2news.com/news/articleView.html?idxno=92593	2016/04/25	0	2022-07-20 16:09:29	2022-07-21 09:55:40
BK22000680	7	질문자	혹시라도 ADHD가 맞다고 하면 참 큰일인데. 치료는 가능한거지?				0	2022-07-20 16:09:29	2022-08-02 12:01:32
BK22000680	8	전문가	ADHD 치료는 약물치료로 가능해! 장기적으로 뇌의 기능을 호전시켜주거든. 정신과에서 처방 받을 수 있어.	adhd 치료 방법	https://www.yeongnam.com/web/view.php?key=20220228010003475	2022/03/01	0	2022-07-20 16:09:29	2022-07-21 09:55:40
BK22000680	9	질문자	정신과 약이라니까 조금 부담이 되네. 왠지 모르게 부작용도 심할 것 같고.				0	2022-07-20 16:09:29	2022-08-02 12:01:32
BK22000680	10	전문가	부작용이 없지는 않지. 치료제로 쓰이는 암페타민의 경우는 현기증이나 가쁜 호흡 같은 부작용이 있어서 먹을 때 주의해야 해.	adhd 치료 약물 부작용	http://www.insightkorea.co.kr/news/articleView.html?idxno=77353	2020/02/27	0	2022-07-20 16:09:30	2022-07-21 09:55:40
BK22000680	11	질문자	그런 말 들으니까 치료받기가 조금 두려워지네. 그냥 이대로 지내도 괜찮지 않을까 싶기도 하고.				0	2022-07-20 16:09:30	2022-08-02 12:01:32
BK22000680	12	전문가	그런 생각하다가 나중에 엄청 후회할걸? ADHD는 치료 효과가 굉장히 빨리 나타나는 질환이기 때문에 병원을 빨리 찾아가는게 좋지. 환자들 중에서는 어릴 때 치료 받았으면 자신의 미래가 달라졌을 거라고 한탄하는 환자들도 많거든.	adhd 약물 치료 효과	https://www.chosun.com/national/weekend/2022/05/14/LFKAGZEFQJFO3FO2HOBT7VCBFM/?utm_source=naver&utm_medium=referral&utm_campaign=naver-news	2022/05/14	0	2022-07-20 16:09:30	2022-07-21 09:55:40
BK22000680	13	질문자	빨리 병원 안 데리고 갔다가 나중에 애가 커서 나한테 불평할 수도 있겠구나?				0	2022-07-20 16:09:30	2022-08-02 12:01:32
BK22000680	14	전문가	그럴 수도 있지. 충분히 주의 기울이고 의사 처방에 맞춰서 약물 복용하면 큰 부작용은 없을 테니까 너무 걱정하지는 마.				0	2022-07-20 16:09:30	2022-07-21 09:55:40
BK22000680	15	질문자	좋은 조언 해줘서 고마워. 우리 애한테 이런 병이 있을수도 있다고 생각하니까 마음이 너무 아프네.				0	2022-07-20 16:09:30	2022-08-02 12:01:32
BK22000680	16	전문가	너무 부정적으로만 생각하지마. ADHD가 꼭 나쁜 것만은 아니야. 시각을 조금만 바꿔 보면 오히려 장점으로 볼 수 있는 점들도 있어. ADHD인 아이들은 호기심이 많고 활력이 넘쳐서 많은 것에 열정을 보이거든.	adhd 장점	https://www.datanews.co.kr/m/m_article.html?no=108168	2020/09/21	0	2022-07-20 16:09:30	2022-07-21 09:55:41
BK22000680	17	질문자	우리 애도 진짜 호기심 많아. 길거리 지나다니다 보면 풀이나 벌레들 보고 엄청 관찰할 때도 많거든. 또 ADHD 환자한테 장점이라고 할만한 점이 있을까?				0	2022-07-20 16:09:30	2022-08-02 12:01:32
BK22000680	18	전문가	좋아하는 일에는 다른 사람들보다 고도의 집중력을 보여주기도 하고 갑작스러운 상황에 당당하게 행동하는 점도 ADHD 환자의 장점이라고 할 수 있지! 물론 사람마다 조금씩 다르기는 하지만 말이야.	adhd 장점	http://www.busaneconomy.com/news/articleView.html?idxno=136771	2019/12/09	0	2022-07-20 16:09:30	2022-07-21 09:55:41
BK22000680	19	질문자	장점들도 있다니까 마음이 좀 놓인다. 더 늦기 전에 아이 데리고 어서 병원에 가봐야겠어.				0	2022-07-20 16:09:30	2022-08-02 12:01:32
BK22000680	20	전문가	응, 혹시 확진 받더라도 희망 가지고 치료받으면 좋겠다. 화이팅!				1	2022-07-20 16:09:30	2022-07-22 13:20:42
