id	utterance_id	role	text	search_query	search_URL	reference_date	terminate	regDate	updDate
BK22002597	1	질문자	요즘 친구들 인스타 스토리를 보면 식물 안 키우는 친구들이 손에 꼽더라고요.				0	2022-08-02 12:17:55	2022-08-02 13:52:27
BK22002597	2	전문가	플랜테리어를 하는 친구분들이 많으신가 봐요?				0	2022-08-02 12:17:55	2022-08-02 13:52:27
BK22002597	3	질문자	혹시 죄송한데 플랜테리어가 뭔가요?				0	2022-08-02 12:17:55	2022-08-02 13:52:27
BK22002597	4	전문가	플랜테리어는 식물을 뜻하는 plant와 인테리어의 합성어예요. 코로나19 이후로 집에 머무는 시간이 늘어나면서 수요가 증가하기 시작했어요.	플랜테리어	https://www.ajunews.com/view/20220714085630412	2022/07/15	0	2022-08-02 12:17:55	2022-08-02 13:52:27
BK22002597	5	질문자	음, 생각해보면 제 친구들도 그즈음부터 식물을 키우긴 했던 것 같아요. 그런데 집을 꾸미려는 욕구는 알겠는데 이렇게 모두가 다 키우니까 신기하네요. 혹시 이유를 아시나요?				0	2022-08-02 12:17:55	2022-08-02 13:52:27
BK22002597	6	전문가	SNS상의 파급력이 영향을 미쳤어요. 친구분들처럼 SNS에 식물 키우는 걸 올리는 분들이 많아졌거든요.	플랜테리어 SNS	https://biz.chosun.com/industry/company/2022/07/11/WQ3JZWWJLJCW7MD7DYKTOTFZBU/?utm_source=naver&utm_medium=original&utm_campaign=biz	2022/07/11	0	2022-08-02 12:17:55	2022-08-02 13:52:27
BK22002597	7	질문자	정말 신기하긴 하네요. 사실 저도 친구들이 올리는 걸 보면서 조금 부럽다는 생각이 들던 찰나였거든요. 그런데 제가 식물을 키우다가 죽일까 봐 걱정도 되고요.				0	2022-08-02 12:17:55	2022-08-02 13:52:27
BK22002597	8	전문가	반려식물을 키우실 생각이시면 아직은 초보시니까 예쁜 식물을 키우시기보다는 키울 수 있는 식물을 키우시는 게 좋아요.	식집사 덕목	https://news.mt.co.kr/mtview.php?no=2022070117103282929	2022/07/03	0	2022-08-02 12:17:55	2022-08-02 13:52:27
BK22002597	9	질문자	오, 정말 발상의 전환이네요. 생각해보면 이제까지 제가 죽인 식물들은 다 예뻐서 구입했지 키우는 난이도를 고려해본 적은 없긴 해요. 그럼 어떤 식물들을 키워보면 좋을까요?				0	2022-08-02 12:17:55	2022-08-02 13:52:27
BK22002597	10	전문가	산호수나 아이비는 냉방이나 난방 때문에 환기가 어려운 환경에서도 병충해 걱정 없이 잘 자라는 식물이에요. 공기정화에도 효과가 있고 예쁘기도 해서 초보자도 키워보기 괜찮죠. 또 테이블야자나 스파티필룸도 그늘에서 잘 자라는 장점이 있고 원하신다면 흙 없이 수경재배를 해보실 수도 있고요.	플랜테리어 초보자	https://bravo.etoday.co.kr/view/atc_view.php?varAtcId=11630	2020/10/16	0	2022-08-02 12:17:55	2022-08-02 13:52:27
BK22002597	11	질문자	수경재배는 신기해서 구미가 당기기는 하네요. 사실 물 주는 주기를 일일이 기억하고 있는 것도 힘들기도 하고요. 물 주는 주기는 외우거나 적어두는 방법밖에 없는 걸까요?				0	2022-08-02 12:17:55	2022-08-02 13:52:27
BK22002597	12	전문가	가끔 식물마다 다르긴 하지만 주기를 외우는 것보다 간편하고 쉬운 방법이 있긴 해요.				0	2022-08-02 12:17:55	2022-08-02 13:52:27
BK22002597	13	질문자	와, 혹시 어떤 방법인지 알려주실 수 있을까요?				0	2022-08-02 12:17:55	2022-08-02 13:52:27
BK22002597	14	전문가	화분의 겉흙을 만져보시고 건조함이 느껴질 때 물을 흠뻑 주면 돼요. 물 주는 주기는 실내환경에 따라 달라질 수 있기 때문에 제가 말씀드린 방법이 나을 거예요.	화분 겉흙	https://www.mk.co.kr/news/culture/view/2013/03/231797/	2013/03/27	0	2022-08-02 12:17:55	2022-08-02 13:52:27
BK22002597	15	질문자	정말 간편한 방법이네요. 그런데 식물마다 다를 수 있다고 하셨으니 살펴보면서 줘야겠어요. 그럼 식물 키울 때 또 주의해야 하는 점이 있을까요?				0	2022-08-02 12:17:55	2022-08-02 13:52:27
BK22002597	16	전문가	걱정하신 물 주는 주기 말고도 온도, 일조량, 통풍도 주의해 주셔야 해요. 또 물을 너무 많이 줄 경우 뿌리가 썩을 수 있으니 이 또한 주의해야 하고요.	식물 통풍 과습 뿌리	https://www.esquirekorea.co.kr/article/54276	2021/04/07	0	2022-08-02 12:17:55	2022-08-02 13:52:27
BK22002597	17	질문자	제가 키워왔던 식물들이 죽어났던 이유를 또 하나 알게 되었네요. 물 주는 주기 말고도 신경 써야 할 점이 더 있었군요. 그런데 혹시 식물은 어디서 구입하면 좋을까요?				0	2022-08-02 12:17:55	2022-08-02 13:52:27
BK22002597	18	전문가	아무래도 초보자시니 꽃시장을 더 추천드려요. 꽃시장은 판매하시는 분들에게 정보도 물어볼 수 있는 장점이 있거든요. 온라인 구매도 가능하지만 직접 보고 살 수 없어서 후기도 꼼꼼히 살펴야 하고 신경 쓰실게 많아요.	식물 구입처	http://www.idomin.com/news/articleView.html?idxno=726873	2020/04/13	0	2022-08-02 12:17:55	2022-08-02 13:52:27
BK22002597	19	질문자	확실히 오프라인으로 구입하는 게 저한테는 이득일 것 같네요. 그리고 또 궁금한 게 있는데 친구들을 보니 분갈이니 뭐니 하면서 흙까지 구입하더라고요. 혹시 흙을 꼭 구입해서 사용해야 하나요?				0	2022-08-02 12:17:55	2022-08-02 13:52:27
BK22002597	20	전문가	친구분들이 흙을 굳이 구입하는 데는 이유가 있어요. 흙을 어디서 퍼와서 사용하면 벌레 알이나 유충이 있을 수 있어서 분갈이용 흙이나 원예용 상토를 구입하는 것이 좋거든요.	플랜테리어 초보자 구입	https://bravo.etoday.co.kr/view/atc_view.php?varAtcId=11630	2020/10/16	0	2022-08-02 12:17:55	2022-08-02 13:52:27
BK22002597	21	질문자	저는 벌레를 정말 싫어하는 편이라 꼭 흙은 구입해서 사용하도록 해야겠네요. 오늘 감사하게도 식물 키우기 꿀팁부터 구매처까지 너무 많은 정보를 얻었네요. 추천해주신 식물 중 하나로 꼭 구입하도록 할게요.				1	2022-08-02 12:17:56	2022-08-02 16:46:32
