id	utterance_id	role	text	search_query	search_URL	reference_date	terminate	regDate	updDate
BK22015953	1	질문자	어제 달력을 보니 임신 30주가 됐더라고요. 이제 곧 출산을 앞두고 있어서 기분이 싱숭생숭하네요.				0	2022-10-13 16:34:39	2022-10-13 16:34:39
BK22015953	2	전문가	정말 그러시겠어요. 아기 얼굴을 볼 날도 얼마 안 남아서 여러 감정이 드시죠?				0	2022-10-13 16:34:39	2022-10-13 16:34:39
BK22015953	3	질문자	네, 빨리 아기 얼굴을 보고 싶기도 하고 또 어떻게 생겼는지 궁금하기도 하네요. 그런데 임신 30주 차에는 아기에게 어떤 변화가 있어요?				0	2022-10-13 16:34:39	2022-10-13 16:34:39
BK22015953	4	전문가	아, 임신 30주에 접어들면 뱃속의 아기의 머리가 엄마의 골반 아래로 향하게 돼요. 그리고 엄마의 몸에서는 초유가 만들어지기 시작해요.	임신 30주 태아	https://www.hidoc.co.kr/healthstory/news/C0000108377	2015/09/18	0	2022-10-13 16:34:39	2022-10-13 16:34:39
BK22015953	5	질문자	그렇군요. 그런데 아기의 머리가 골반 아래로 향하는 건 왜 그런 거예요? 혹시 위험한 거 아니에요?				0	2022-10-13 16:34:39	2022-10-13 16:34:39
BK22015953	6	전문가	아기가 머리를 골반 아래로 향하는 건 출산에 대비해서 그러는 건데요. 대신 머리를 거꾸로 두고 있어도 자세를 바꿀 시간이 있으니 너무 걱정하지 않으셔도 돼요.	임신 30주 태아 머리	https://www.hidoc.co.kr/healthstory/news/C0000108377	2015/09/18	0	2022-10-13 16:34:39	2022-10-13 16:34:39
BK22015953	7	질문자	네, 그런데 최근에 출산한 친구는 전치태반으로 고생했다는데 혹시 전치태반이 뭔지 아세요?				0	2022-10-13 16:34:39	2022-10-13 16:34:39
BK22015953	8	전문가	아, 보통 임신부의 자궁경부에 태아의 머리가 위치해야 하는데 태아보다 태반이 앞에 있어서 자궁 입구를 막고 있는 경우가 있는데 그걸 전치태반으로 불러요.	전치태반	https://www.hidoc.co.kr/healthstory/news/C0000692540	2022/04/30	0	2022-10-13 16:34:39	2022-10-13 16:34:39
BK22015953	9	질문자	어머, 그러면 전치태반은 무척이나 위험하겠네요?				0	2022-10-13 16:34:39	2022-10-13 16:34:39
BK22015953	10	전문가	맞아요. 전치태반은 자칫하면 심각한 출혈을 일으켜서 산모와 태아 모두의 목숨을 위험에 빠뜨릴 수 있어요. 임산부 고위험 질환이면서 제왕절개술이 꼭 필요한 경우가 전치태반이에요.	전치태반 위험	https://www.hidoc.co.kr/healthstory/news/C0000692540	2022/04/30	0	2022-10-13 16:34:39	2022-10-13 16:34:39
BK22015953	11	질문자	아, 그러면 전치태반이 있으면 어떻게 알 수 있나요? 전치태반 증상이 따로 있나요?				0	2022-10-13 16:34:39	2022-10-13 16:34:39
BK22015953	12	전문가	네, 전치태반의 특징적 증상은 통증 없는 출혈인데요. 임신 2분기 후반까지 멀쩡하다가 임신 후기에 질에서 갑자기 통증 없는 출혈이 시작되면 의심해 볼 수 있어요. 출혈의 색은 선홍색 피일 수 있는데 임산부마다 출혈의 모양이나 상태 빈도가 달라요. 그런데 출혈 횟수가 늘어날수록 출혈의 양도 많아지니 주의가 필요해요.	전치태반 증상	https://www.hidoc.co.kr/healthstory/news/C0000692540	2022/04/30	0	2022-10-13 16:34:39	2022-10-13 16:34:39
BK22015953	13	질문자	네, 통증이 없는 출혈이 있으면 전치태반을 의심해 봐야겠네요. 그런데 미리 병원서 확인하는 검사나 방법은 없나요?				0	2022-10-13 16:34:39	2022-10-13 16:34:39
BK22015953	14	전문가	물론 있죠. 전치태반을 확인하는 제일 좋은 방법은 초음파 검사에요. 초음파 검사로 태반의 위치를 확인할 수 있으니 안심하세요. 임신 후기에 초음파 검사는 특히 중요하니 꼭 받으시는 게 좋아요.	전치태반 병원 확인	https://www.hidoc.co.kr/healthstory/news/C0000692540	2022/04/30	0	2022-10-13 16:34:39	2022-10-13 16:34:39
BK22015953	15	질문자	네, 만약 전치태반이라면 미리 아기를 낳아야 하나요?				0	2022-10-13 16:34:39	2022-10-13 16:34:39
BK22015953	16	전문가	음, 전치태반으로 인한 출혈이 심하지 않다 하더라도 전치태반으로 확인된다면 입원한 후 상태를 관찰하게 돼요. 출혈이 멈추고 태아의 건강이 괜찮으면 퇴원할 수 있어요. 그 후 태아가 생존력을 가지는 시기인 37주에 제왕절개술을 받으셔야 해요.	전치태반 제왕절개	https://www.hidoc.co.kr/healthstory/news/C0000692540	2022/04/30	0	2022-10-13 16:34:39	2022-10-13 16:34:39
BK22015953	17	질문자	아, 그런데 전치태반은 왜 제왕절개로 수술해야 하는 거예요?				0	2022-10-13 16:34:39	2022-10-13 16:34:39
BK22015953	18	전문가	전치태반일 경우 분만 전이나 분만 하는 중에 심각한 출혈이 발생할 수 있어요. 전치태반인 경우에는 자연분만은 불가능하고요. 꼭 제왕절개를 통해서만 분만이 가능해요.	전치태반 제왕절개 이유	https://www.hidoc.co.kr/healthstory/news/C0000320259	2017/12/07	0	2022-10-13 16:34:39	2022-10-19 08:35:20
BK22015953	19	질문자	전치태반일 경우 분만 방법을 선택할 수 있는 게 아니군요. 임신 후기니 저도 초음파 검사를 받아보고 혹시 전치태반은 아닌지 잘 확인해 봐야겠어요. 잘 모르는 정보였는데 자세히 알려주셔서 감사해요.				0	2022-10-13 16:34:39	2022-10-13 16:34:39
BK22015953	20	전문가	별말씀을요. 임신 후기니 몸 관리 잘 하시고 초음파 검사도 미리 받아보세요. 그럼 다음에 또 봐요.				1	2022-10-13 16:34:39	2022-10-19 08:35:20
