id	utterance_id	role	text	search_query	search_URL	reference_date	terminate	regDate	updDate
BK22002557	1	질문자	제가 강아지를 처음 키워봐서 반복되는 특징 있는 행동 하나하나 검색해 보거든요. 그때마다 강아지가 기분이 너무 좋아서 신나서 하는 행동들이더라구요.				0	2022-08-02 12:17:34	2022-08-02 13:50:37
BK22002557	2	전문가	제 아들도 다 검색해보곤 하더라구요. 스마트폰 시대에 처음 반려견 키워보면 다 그런가 봐요.				0	2022-08-02 12:17:34	2022-08-02 13:50:37
BK22002557	3	질문자	아, 그런데 이번 주에 유난히 제가 키우는 강아지가 가구나 다른 물체에 자주 부딪히더라구요. 예전에는 안 그랬었는데 요즘 부쩍 그래서 걱정이 돼요.				0	2022-08-02 12:17:34	2022-08-02 13:50:37
BK22002557	4	전문가	백내장 때문에 그런 거로 보이네요. 백내장은 수정체가 혼탁해지는 거라 반려견 시각에서 뿌옇게 흐려져 보이거든요. 그럼 시야가 좁아지다 보니 가구나 다른 물체에 부딪히게 된 거예요. 수정체가 눈에 들어오는 빛을 모아 상이 망막에 흐리지 않게 맺게 해주는 역할을 하거든요.	강아지 백내장	http://www.k-health.com/news/articleView.html?idxno=50882	2020/11/10	0	2022-08-02 12:17:34	2022-08-02 13:50:37
BK22002557	5	질문자	저런 행동을 보인지 얼마 안 됐긴한데 백내장이 생기면 나타나는 증상은 뭐에요?				0	2022-08-02 12:17:35	2022-08-02 13:50:37
BK22002557	6	전문가	초기에는 백내장의 크기도 작고 딱히 시력이 나빠지지 않아서 초기엔 알아채기 어려워요. 수정체를 전부 덮는 성숙 백내장, 백내장 말기에는 시력이 상실되고 녹내장 같은 다른 눈 질환을 앓게 돼요.	강아지 백내장 증상	http://www.sisunnews.co.kr/news/articleView.html?idxno=134718	2020/12/22	0	2022-08-02 12:17:35	2022-08-02 13:50:37
BK22002557	7	질문자	도대체 무슨 원인으로 강아지한테 백내장이 생기는 거예요?				0	2022-08-02 12:17:35	2022-08-02 13:50:37
BK22002557	8	전문가	보통 노화에 의해 생기긴 하는데 영양적 불균형, 유전적 원인으로도 어릴 때도 발생하구요. 심한 안구염 겪고 난 뒤나 녹내장, 외상에 의해서도 생길 수 있어요. 당뇨를 앓고 있으면 백내장이 오구요.	반려견 백내장 원인	https://mdtoday.co.kr/news/view/1065604084406475	2022/02/22	0	2022-08-02 12:17:35	2022-08-02 13:50:37
BK22002557	9	질문자	다른 거엔 해당이 안 되는데 제 반려견이 당뇨를 반년 전부터 앓고 있긴 해요.				0	2022-08-02 12:17:35	2022-08-02 13:50:37
BK22002557	10	전문가	강아지의 경우 당뇨가 생기면 혈당 관리를 얼마나 잘하느냐에 따라 증상의 정도가 차이가 나긴 하지만 결국 1년 이내에 백내장이 생기거든요.	강아지 당뇨병 백내장 발병 상관관계	http://www.jeonmin.co.kr/news/articleView.html?idxno=351088	2022/03/10	0	2022-08-02 12:17:35	2022-08-02 13:50:37
BK22002557	11	질문자	혈당 관리를 위해 엄청 노력했는데 당뇨를 앓으면 백내장이 오는군요. 혈당 관리를 열심히 했으니 백내장이 약한 정도로 진행된 거였음 좋겠네요. 병원에서 어떻게 진료를 해주나요?				0	2022-08-02 12:17:35	2022-08-02 13:50:37
BK22002557	12	전문가	수술이나 보조제를 처방하는데요. 시력이 수술이 권장될 정도로 나빠지지 않았으면 악화되는 걸 천천히 할 수 있는 보조제를 점안하거나 복용하면서 경과를 확인해요.	반려견 백내장 치료방법	http://www.jeonmin.co.kr/news/articleView.html?idxno=351088	2022/03/10	0	2022-08-02 12:17:35	2022-08-02 13:50:37
BK22002557	13	질문자	수술을 안 하고 보조제를 점안하거나 약만 먹어도 백내장이 좋아지나요?				0	2022-08-02 12:17:35	2022-08-02 13:50:37
BK22002557	14	전문가	아니요. 백내장은 수술로만 치료가 가능해요. 진행 속도를 늦출 수 있는 눈 영양제를 점안하다가 적절한 시기에 수술해야 해요.	반려견 백내장 치료방법	https://mdtoday.co.kr/news/view/1065604084406475	2022/02/22	0	2022-08-02 12:17:35	2022-08-02 13:50:37
BK22002557	15	질문자	어떤 방법으로 수술이 진행돼요?				0	2022-08-02 12:17:35	2022-08-02 13:50:37
BK22002557	16	전문가	사람과 유사한 방법으로 수술은 하나 강아지는 전신마취가 필요해요. 초음파유화 흡입술을 이용해서 수술을 하는데요. 혼탁해진 수정체를 제거하고 인공 수정체를 넣어서 시력을 유지하는 수술법이에요.	반려견 백내장 수술 방법	https://mdtoday.co.kr/news/view/1065604084406475	2022/02/22	0	2022-08-02 12:17:35	2022-08-02 13:50:37
BK22002557	17	질문자	위에서 말했듯이 제 반려견은 당뇨가 있는데 전신마취를 해서 백내장 수술을 해도 괜찮은 건가요?				0	2022-08-02 12:17:35	2022-08-02 13:50:37
BK22002557	18	전문가	당뇨가 있더라도 혈당 검사를 해서 이상이 없고 마취가 가능하면 수술은 가능하니 걱정하지 마세요.	당뇨에 걸린 반려견 백내장 수술	https://mdtoday.co.kr/news/view/1065604084406475	2022/02/22	0	2022-08-02 12:17:35	2022-08-02 13:50:37
BK22002557	19	질문자	아, 오늘 당장 동물 병원 예약해서 백내장 검사 받아봐야겠어요.				0	2022-08-02 12:17:35	2022-08-02 13:50:37
BK22002557	20	전문가	네. 병원 간 김에 상담받아보고 백내장, 당뇨와 합병으로 올 수 있는 질병 검사 다 받아보고 오세요.				0	2022-08-02 12:17:35	2022-08-02 13:50:37
BK22002557	21	질문자	이왕 간 김에 다 받아볼게요. 오늘 대화 유익하고 즐거웠어요.				1	2022-08-02 12:17:35	2022-08-02 15:54:47
