id	utterance_id	role	text	search_query	search_URL	reference_date	terminate	regDate	updDate
BK22006560	1	질문자	강아지를 분양 받아서 키우고 있는데 생각보다 어려움이 많아요. 모르는 것도 많고요.				0	2022-08-27 12:48:57	2022-09-03 15:36:00
BK22006560	2	전문가	강아지를 분양 받으셨군요! 생각보다 신경 써야 할 것이 많죠~.				0	2022-08-27 12:48:57	2022-08-27 12:48:57
BK22006560	3	질문자	맞아요. 나름대로 준비해서 데리고 왔는데 모르는 것이 많아서 공부하고 있어요! 요즘 같은 여름에는 강아지가 털 때문에 더울 것 같아서 걱정인데 여름철에 강아지 털 관리는 어떻게 해야 하는 지 알려줄 수 있나요?				0	2022-08-27 12:48:57	2022-09-03 15:36:00
BK22006560	4	전문가	강아지의 경우에는 사람과 달리 피부에 땀샘이 없는데요. 그렇기에 털을 밀어도 바람을 느낄 수는 없죠. 너무 털이 없으면 자외선 노출의 위험성이 커져요. 또한 실내에서 생활하는 경우 체온 유지가 힘들어지면서 냉방병에 걸릴 수도 있죠. 그렇기에 5-10mm 정도 털을 남기고 잘라주는 것이 좋아요.	강아지 여름	https://kormedi.com/1412341/%ec%9c%84%eb%93%9c%ed%8e%ab-%eb%b3%b5%ec%8a%ac-%eb%b3%b5%ec%8a%ac-%ec%9a%b0%eb%a6%ac-%eb%8c%95%eb%8c%95%ec%9d%b4-%ec%97%ac%eb%a6%84-%eb%af%b8%ec%9a%a9%ec%9d%80-%ec%96%b4%eb%96%bb%ea%b2%8c/	2022/08/06	0	2022-08-27 12:48:57	2022-09-05 15:37:29
BK22006560	5	질문자	알려주신 내용 참고해서 정리해 줘야겠네요! 강아지를 키우다 보니까 궁금한 것이 있는데요. 사람처럼 강아지도 밥을 먹고 양치를 해줘야 하는 건가요?				0	2022-08-27 12:48:57	2022-08-27 12:48:57
BK22006560	6	전문가	그렇죠! 3세 이상의 반려견 중에서 80% 이상이 치태나 치석 또는 구강 염증을 경험한 적이 있기 때문에 관리를 해야 해요. 주기적으로 반려견 스켈링도 할 수 있지만 아이에 따라 공격성이 있는 경우 전신마취를 한 뒤에 시행하는 경우도 있어요. 그렇기에 집에서 칫솔과 치약을 이용해서 양치를 해줘야 해요! 하지만 이것만으로 부족한 경우가 많기에 구강 보조제를 사용해서 관리해주면 치석이 쌓이지 않게 예방할 수 있죠.	강아지 구강관리	https://www.itbiznews.com/news/articleView.html?idxno=74732	2022/08/08	0	2022-08-27 12:48:57	2022-08-27 12:48:57
BK22006560	7	질문자	강아지 구강관리에 정성을 들여야겠어요! 몰랐으면 큰일날 뻔 했어요. 실내에서 생활하는 강아지의 발톱도 관리해주어야 하나요?				0	2022-08-27 12:48:57	2022-08-27 12:48:57
BK22006560	8	전문가	강아지를 실내에서 키우면 주기적으로 발톱관리가 필요한데요. 길어진 발톱으로 걷다보면 발바닥이 바닥에 닿지 않아서 무릎과 허리에 무리가 올 수 있어요. 그렇기에 적절하게 잘라주는 것이 좋아요. 강아지의 경우 발톱에 혈관이 있기 때문에 오랜 시간 발톱을 자르지 않으면 혈관이 발톱으로 타고 내려와서 나중에 발톱을 자를때 피가 날 수 있으니 참고하셔서 관리하시면 될 것 같아요.	강아지 발톱관리	http://www.dailypop.kr/news/articleView.html?idxno=52292	2021/07/07	0	2022-08-27 12:48:57	2022-08-27 12:48:57
BK22006560	9	질문자	발톱에 혈관이 있다니 조심해서 관리해줘야겠어요. 또 강아지를 키울 때 주의해야 할 사항이 있나요?				0	2022-08-27 12:48:57	2022-08-27 12:48:57
BK22006560	10	전문가	강아지가 잘 받아먹는 모습을 보며 무분별한 음식을 주는 행위가 반복되면 비만으로 가게 될 수 있는 점을 주의해야 해요.	강아지 비만	http://www.dailypop.kr/news/articleView.html?idxno=50377	2021/04/13	0	2022-08-27 12:48:57	2022-09-08 13:13:21
BK22006560	11	질문자	그렇군요! 항상 급여를 할 때 신경을 써야겠어요. 강아지에게 자주 발병 되는 질병이 있나요?				0	2022-08-27 12:48:57	2022-08-27 12:48:57
BK22006560	12	전문가	혹시 반려견 백내장에 대해 들어 보셨나요? 반려견의 눈이 뿌옇게 보이는 건 단순한 노화일 수 있지만 백내장이 진행된 것일 수 있어요. 백내장이 많이 진행되면 포도막염이나 녹내장 등 다양한 합병증이 동반돼 수술을 못하게 될 수도 있어서 항상 주의 깊게 살펴봐야 해요. 보호자가 방심하는 사이에 반려견이 시력을 잃어가는 중 일수도 있으니 주기적인 검진이 필요해요.	강아지 백내장	http://www.k-health.com/news/articleView.html?idxno=60736	2022/08/20	0	2022-08-27 12:48:57	2022-08-27 12:48:57
BK22006560	13	질문자	강아지도 백내장이 생기는군요. 생각보다 키우게 되니까 신경 써야 할 것이 더 많은 것 같아요! 벌써 이별이 두려운데 혹시 강아지 평균 수명은 얼마나 돼요?				0	2022-08-27 12:48:57	2022-08-27 12:48:57
BK22006560	14	전문가	강아지의 평균수명은 소형견의 경우 12세에서 17세 사이이고 중견견은 10세에서 15세, 정도에요. 대형견은 8세에서 13세 정도인데요. 견종에 따라 약 10년까지 차이가 날 수 있어요. 하지만 이건 평균적인 수치이고 케어에 따라 수명이 늘어나거나 짧아질 수 있겠죠?	강아지 평균수명	https://www.asiatime.co.kr/1065596575407085	2021/01/17	0	2022-08-27 12:48:57	2022-09-03 15:36:00
BK22006560	15	질문자	그렇군요. 앞으로 잘 관리해줘서 오래 함께 해야겠어요. 저는 치와와를 키우는데 치와와의 기대 수명은 어느정도인가요?				0	2022-08-27 12:48:57	2022-08-27 12:48:57
BK22006560	16	전문가	치와와의 기대수명은 7.9세인데. 기네스 신기록에 최장수 반려견으로 이름을 올린 21살의 치와와도 있으니 열심히 케어 한다면 기대 수명보다 오래 살 수도 있어요.	반려견 기대수명	https://www.notepet.co.kr/news/article/article_view/?idx=25467&groupCode=AB130AD130	2022/04/29	0	2022-08-27 12:48:57	2022-09-03 15:36:00
BK22006560	17	질문자	앞으로 정말 잘 케어 해서 함께 해야겠어요! 요즘 강아지와 관련된 이슈가 있나요?				0	2022-08-27 12:48:57	2022-08-27 12:48:57
BK22006560	18	전문가	요즘 일부 기업이 사내 복지제도로 강아지와 고양이 장례를 지원하고 있어서 반려동물을 키우는 사람들에게 주목을 받고 있어요!	강아지 장례	https://www.news1.kr/articles/?4307538	2021/05/15	0	2022-08-27 12:48:57	2022-08-27 12:48:57
BK22006560	19	질문자	와 반려동물을 키우는 사람에게는 정말 좋은 제도네요! 오늘 좋은 정보 많이 알아가요~. 감사해요!				0	2022-08-27 12:48:57	2022-09-03 15:36:00
BK22006560	20	전문가	저도 즐거운 대화를 할 수 있었어요! 다음에도 함께 이야기 나눠요.				1	2022-08-27 12:48:57	2022-09-08 13:13:21
