id	utterance_id	role	text	search_query	search_URL	reference_date	terminate	regDate	updDate
BK22004633	1	질문자	곧 저희 아버지 환갑이거든요. 자식들은 모여서 식사하고 끝냈으면 하는데 어른들은 환갑에 굉장히 큰 의미를 두시니까 어떻게 할지 고민이네요.				0	2022-08-04 11:41:06	2022-08-24 08:21:08
BK22004633	2	전문가	에고고, 고민이 많으시겠어요. 예전에는 우리나라 사람들 평균 수명이 짧았으니까 환갑이 되면 장수한 걸로 여길 만큼 중요하게 생각하긴 했었죠.	환갑	https://ko.wikipedia.org/wiki/%ED%99%98%EA%B0%91	2022/02/14	0	2022-08-04 11:41:06	2022-08-17 11:46:36
BK22004633	3	질문자	예전에나 그랬지 100세 시대에 환갑이 무슨 의미가 있나 싶어요. 근데 환갑은 언제부터 시작된 건가요?				0	2022-08-04 11:41:06	2022-08-24 08:21:08
BK22004633	4	전문가	고려사에 의하면 고려 말부터 환갑이 시작된 걸로 추정돼요. 역사가 오래됐죠?	환갑 유래	http://www.joongboo.com/news/articleView.html?idxno=957725	2014/11/23	0	2022-08-04 11:41:06	2022-08-10 21:15:47
BK22004633	5	질문자	그러게요, 환갑의 역사가 이렇게 긴 줄 몰랐어요.				0	2022-08-04 11:41:06	2022-08-17 11:46:36
BK22004633	6	전문가	생각보다 역사가 길답니다. 그런데 혹시 아버지 환갑 기념으로 생각해둔 계획 있으세요?				0	2022-08-04 11:41:06	2022-08-18 02:55:47
BK22004633	7	질문자	사실 제가 작년에 아버지 연세가 60이셔서 환갑이라고 착각했었거든요?				0	2022-08-04 11:41:06	2022-08-10 21:15:47
BK22004633	8	전문가	정말요? 육십 갑자의 갑으로 되돌아온다는 뜻의 환갑 또는 회갑은 세는 나이로 예순한 살이라 만 60세를 이르는 말인데 착각하셨나 봐요.	환갑잔치 나이	https://sgsg.hankyung.com/article/2021111243671	2021/11/15	0	2022-08-04 11:41:06	2022-08-24 08:21:08
BK22004633	9	질문자	그러니까요, 제가 작년에 착각하는 바람에 아버지 해외여행을 보내드리긴 했는데 올해는 어떻게 할지 아직 고민 중이에요.				0	2022-08-04 11:41:06	2022-08-17 11:46:36
BK22004633	10	전문가	아, 작년에 그런 일이 있으셔서 고민 중이시군요.				0	2022-08-04 11:41:06	2022-08-17 11:46:36
BK22004633	11	질문자	네, 작년에 무리하는 바람에 올해도 해외여행을 가는 건 좀 부담스럽거든요. 그리고 코로나 때문에 걱정이기도 하고요.				0	2022-08-04 11:41:06	2022-08-22 22:51:59
BK22004633	12	전문가	아, 그런 이유라면 부담스러울 수 있겠네요. 그럼 국내 여행은 어떠세요? 값비싼 항공료의 부담과 코로나19의 재확산 가능성이 높아져서 해외여행 대신에 국내로 여행을 가는 사람들이 많이 늘고 있거든요.	해외여행 부담	https://newsis.com/view/?id=NISX20220817_0001981151&cID=13001&pID=13000	2022/08/17	0	2022-08-04 11:41:06	2022-08-24 08:21:08
BK22004633	13	질문자	제 친구도 여름휴가 해외로 가려다 제주도에 다녀왔던데 그럼 저도 제주도 가족여행 한번 알아볼까요? 아버지 환갑여행 겸 가족 여행 괜찮겠죠?				0	2022-08-04 11:41:06	2022-08-22 22:51:59
BK22004633	14	전문가	제주도 가족여행 좋네요. 동문시장, 함덕 해수욕장, 월정리 해변, 성산일출봉, 섭지코지 등의 빼어난 관광지가 많이 분포되어 있는 동부지역을 제주도 가족여행코스로 선호하는 사람들이 많거든요. 그러니 제주도 동부 위주로 여행 계획을 짜도 좋을 것 같아요.	제주도가족여행코스	http://www.discoverynews.kr/news/articleView.html?idxno=54677	2018/12/04	0	2022-08-04 11:41:06	2022-08-24 08:21:08
BK22004633	15	질문자	성산 일출봉과 섭지코지라니 너무 좋을 것 같아요. 그리고 기왕이면 용돈도 봉투에 드리는 것보다 환갑이니 특별하게 용돈 박스에 드리는 게 낫겠죠?				0	2022-08-04 11:41:06	2022-08-22 22:51:59
BK22004633	16	전문가	그럼요, 부모님 생신이나 환갑, 칠순, 어버이날처럼 특별한 날에 용돈 박스를 선물하면 좋죠.	환갑 용돈박스	https://www.woodkorea.co.kr/news/articleView.html?idxno=41235	2019/12/13	0	2022-08-04 11:41:06	2022-08-17 11:46:36
BK22004633	17	질문자	그럼 용돈 박스 준비하고 가족여행이면 될 것 같은데. 설마 환갑잔치 크게 안 한다고 아버지가 섭섭해하진 않으시겠죠?				0	2022-08-04 11:41:06	2022-08-17 11:46:36
BK22004633	18	전문가	괜찮을 거예요. 요즘에는 돌잔치나 환갑잔치 같은 행사들을 소규모 형태로 가족끼리 많이 진행하는 추세니까요.	환갑 상차림	http://www.dtnews24.com/news/articleView.html?idxno=430616	2017/08/07	0	2022-08-04 11:41:06	2022-08-17 11:46:36
BK22004633	19	질문자	그렇다면 정말 다행이네요. 근데 요즘은 아기가 없어서 그런가 환갑잔치보다 돌잔치 하는 집이 더 없는 것 같아요.				0	2022-08-04 11:41:06	2022-08-17 11:46:36
BK22004633	20	전문가	그게 다 이유가 있답니다. 통계청에 따르면 만 60세 인구는 80만 3399명이거든요. 근데 올해의 만 1세의 아이들의 숫자는 27만 134명이랍니다.	돌잔치 환갑잔치	https://news.mt.co.kr/mtview.php?no=2022061406515227084	2022/06/19	0	2022-08-04 11:41:06	2022-08-24 08:21:08
BK22004633	21	질문자	올해 태어난 아이들이 27만 명이라니 적기는 하네요. 작년에는 출산율이 어떻게 되나요?				0	2022-08-04 11:41:07	2022-08-17 11:46:36
BK22004633	22	전문가	2021년에는 아이들이 26만 500명이 태어났어요.	돌잔치 환갑잔치	https://news.mt.co.kr/mtview.php?no=2022061406515227084	2022/06/19	0	2022-08-04 11:41:07	2022-08-17 11:46:36
BK22004633	23	질문자	작년에도 생각보다 적은 숫자라 충격이네요. 오늘 좋은 대화 나눠서 좋았어요. 저는 저녁에 가족들이랑 아버지 환갑 어떻게 할지 얘기 좀 나눠봐야겠어요.				0	2022-08-04 11:41:07	2022-08-17 11:46:36
BK22004633	24	전문가	아버지의 의견과 가족들의 의견을 잘 모아서 좋은 결과가 있길 바랄게요.				1	2022-08-04 11:41:07	2022-08-24 08:21:08
