id	utterance_id	role	text	search_query	search_URL	reference_date	terminate	regDate	updDate
BK22014698	1	질문자	우리 강아지 말이야, 휴가 갔다 와서 보니 눈 안쪽에 빨갛게 혹 같은 게 생겼던데 너 혹시 이게 뭔지 알아?				0	2022-10-03 22:03:16	2022-10-03 22:03:16
BK22014698	2	전문가	강아지 눈 안쪽에 빨간색을 띠는 혹 같은 게 생겼다면 제3안검 탈출증이야. 제3안검이 있어야 할 자리로부터 탈출을 해서 튀어나오는 질환이지. 색깔과 모양이 체리를 닮아 체리아이라는 별칭으로 불리기도 해.	강아지 눈 빨간 혹	https://www.k-health.com/news/articleView.html?idxno=48370	2020/05/08	0	2022-10-03 22:03:16	2022-10-03 22:03:16
BK22014698	3	질문자	제3안검 탈출증이라고? 제3안검이라는 말 자체를 처음 들어봤는데 이게 뭐야?				0	2022-10-03 22:03:16	2022-10-03 22:03:16
BK22014698	4	전문가	사람은 눈꺼풀이 위, 아래 이렇게 두 개가 있잖아. 강아지는 눈 안쪽에도 숨어있는 눈꺼풀이 하나가 더 있는데 이 세 번째 눈꺼풀이 바로 제3안검이야. 제3안검에는 눈물을 생성하는 역할을 하는 눈물샘이 위치해있어. 그래서 전체 눈물 양의 절반가량이 여기서 만들어지지. 또 바람이나 먼지와 같은 각종 이물질로부터 눈을 지켜주는 역할을 하는 게 바로 제3안검이야.	강아지 제3안검	http://www.k-health.com/news/articleView.html?idxno=61177	2022/09/17	0	2022-10-03 22:03:16	2022-10-03 22:03:16
BK22014698	5	질문자	그럼 꽤 중요한 역할을 하는 거네. 근데 이게 어떤 이유로 탈출하게 되는 거야?				0	2022-10-03 22:03:16	2022-10-07 10:06:28
BK22014698	6	전문가	제3안검에 염증이 있거나 유전적인 이유로 제3안검 주변 조직이 늘어질 때 제3안검 탈출증이 발생해. 주로 코커스패니얼, 불도그, 페키니즈, 비글 같은 품종에게 흔히 발생하지. 얘네들은 제3안검을 잡아주는 결합조직이 선천적으로 약하거든.	강아지 제3안검 탈출증 원인	http://www.k-health.com/news/articleView.html?idxno=48370	2020/05/08	0	2022-10-03 22:03:16	2022-10-03 22:03:16
BK22014698	7	질문자	아, 불도그가 원래 이 병에 취약하구나. 근데 유전적인 이유 때문이면 그냥 둬도 괜찮은 거야, 아니면 치료가 필요한 거야?				0	2022-10-03 22:03:16	2022-10-03 22:03:16
BK22014698	8	전문가	제3안검 탈출증은 빨리 치료해주는 게 좋아. 별다른 조치 없이 내버려 두면 돌출된 제3안검이 눈을 자극해서 강아지가 눈을 비비거나 긁게 되고 바닥이나 가구에 눈을 문지르게 되거든. 그렇게 되면 결막염이나 각막염으로까지 이어질 수 있고 눈의 다른 부분까지 감염이 발생해서 문제가 커질 수 있어. 2차적인 질병을 막기 위해서라도 치료를 발 빠르게 해줄 필요가 있는 거지.	강아지 제3안검 탈출증 발생	http://www.k-health.com/news/articleView.html?idxno=48370	2020/05/08	0	2022-10-03 22:03:16	2022-10-07 10:06:28
BK22014698	9	질문자	그럼 빨리 병원에 가봐야겠네. 근데 제3안검 탈출증은 어떤 방식으로 치료해?				0	2022-10-03 22:03:16	2022-10-07 10:06:28
BK22014698	10	전문가	일단 안약을 넣는 방법으로 치료를 시도할 수 있어. 하지만 이 방법으로는 제3안검 탈출증을 완치하기가 힘들어. 재발하는 경우가 많거든. 그래서 매몰법이나 절개법 등을 통한 수술로 치료를 하는 게 더 효과적이야.	강아지 제3안검 탈출증 치료	http://www.k-health.com/news/articleView.html?idxno=61177	2022/09/17	0	2022-10-03 22:03:16	2022-10-03 22:03:16
BK22014698	11	질문자	수술까지 해야 된다고? 그럼 매몰법과 절개법에 대해 미리 알아두고 싶은데 설명 좀 해줘.				0	2022-10-03 22:03:16	2022-10-03 22:03:16
BK22014698	12	전문가	일단 절개법은 악성종양이거나 회복이 불가능한 외상일 경우에만 시행해. 눈물샘이 손상되고 안구건조증이 발생할 가능성이 있거든. 이 외에는 매몰법을 시행하는데 이건 비교적 간단한 수술이야. 튀어나온 제3안검을 제거하는 게 아니고 주머니를 만들어서 거기에 집어넣는 수술이거든.	강아지 제3안검 탈출증 매몰법 절개법	http://www.k-health.com/news/articleView.html?idxno=61177	2022/09/17	0	2022-10-03 22:03:16	2022-10-07 10:06:28
BK22014698	13	질문자	그래도 보호자 입장에서는 그렇게 간단하게 들리지가 않는다. 어쨌든 수술하면 재발 걱정은 안 해도 되는 거야?				0	2022-10-03 22:03:16	2022-10-03 22:03:16
BK22014698	14	전문가	그렇지는 않아. 제3안검 탈출증이 발생하고 오랜 시간이 지난 뒤에 수술을 하면 재발 가능성이 높거든. 그래서 이런 경우에는 재수술에 대한 부분도 염두에 두고 있어야 해.	강아지 제3안검 탈출증 수술 재발	http://www.k-health.com/news/articleView.html?idxno=61177	2022/09/17	0	2022-10-03 22:03:16	2022-10-03 22:03:16
BK22014698	15	질문자	우리 애는 얼마 안 됐으니 재발 가능성이 높지는 않겠네. 그래도 최대한 빨리 가보기는 해야겠다. 근데 혹시 제3안검 탈출증을 예방할 수 있는 방법은 없어?				0	2022-10-03 22:03:16	2022-10-03 22:03:16
BK22014698	16	전문가	응, 안타깝게도 제3안검 탈출증은 예방이 불가능해. 그러니 강아지의 눈 상태를 자주 살펴보고 눈이 충혈되거나 제3안검이 튀어나오는 등의 증상이 나타난다면 동물 병원에 가서 진료를 받고 빨리 치료를 시작하는 게 최선이지.	강아지 제3안검 탈출증 예방	http://www.k-health.com/news/articleView.html?idxno=48370	2020/05/08	0	2022-10-03 22:03:16	2022-10-03 22:03:16
BK22014698	17	질문자	유전적인 이유가 있다길래 예방은 힘들지 않을까 했는데 진짜로 그렇구나. 우리 둘째는 아직 증상이 없어서 예방법이 있으면 관리해주려고 했는데 그렇게 못하겠네. 그럼 뭐, 평상시에 눈에 신경을 많이 써주는 수밖에 없겠다.				0	2022-10-03 22:03:16	2022-10-07 10:06:28
BK22014698	18	전문가	안타깝지만 그게 보호자가 할 수 있는 최선의 방법이야.				0	2022-10-03 22:03:16	2022-10-03 22:03:16
BK22014698	19	질문자	그래도 어쨌든 우리 첫째 눈이 왜 그런지도 알게 됐고 동물 병원에도 빨리 데려갈 수 있게 돼서 다행이다. 다 니 덕분이야. 고마워.				0	2022-10-03 22:03:16	2022-10-03 22:03:16
BK22014698	20	전문가	난 그냥 정보만 줬을 뿐인데, 뭐. 여하튼 강아지 치료 성공적으로 잘 마치길 바랄게.				0	2022-10-03 22:03:16	2022-10-03 22:03:16
BK22014698	21	질문자	응, 고마워. 그럼 난 이만 가서 동물 병원에 전화 좀 돌려봐야겠다. 다음 주에 보자.				0	2022-10-03 22:03:16	2022-10-03 22:03:16
BK22014698	22	전문가	그래, 얼른 가보고 다음 주에 보자.				1	2022-10-03 22:03:16	2022-10-07 10:06:28
