id	utterance_id	role	text	search_query	search_URL	reference_date	terminate	regDate	updDate
BK22011989	1	질문자	저희 아버지가 시골에서 진돗개를 키우시는데, 이번에 새끼를 낳았더라구요. 그래서 한마리 데려와 키워볼까 하는데 진돗개는 다 크면 얼마나 커지나요?				0	2022-09-30 11:00:14	2022-09-30 11:00:14
BK22011989	2	전문가	진돗개는 암컷이 비해 수컷이 더 큰데요. 진돗개 수컷은 키가 50~55㎝, 무게 18~23kg가량이에요. 진돗개 암컷은 45~50㎝의 키, 15~19kg 정도의 무게가 나간답니다.	진돗개 키	https://www.kgnews.co.kr/news/article.html?no=647562	2021/05/26	0	2022-09-30 11:00:14	2022-09-30 11:00:14
BK22011989	3	질문자	50cm라면 어느정도일지 예상은 잘 안가지만 큰 견종 중 하나겠죠? 근데 진돗개는 성격이 어떤가요?				0	2022-09-30 11:00:14	2022-09-30 11:00:14
BK22011989	4	전문가	진돗개는 경비견과 사냥견으로 길러질만큼 용감하면서 민첩한 견종이에요. 진돗개는 우리나라 토종견으로써 사냥에 대한 본능이 강하고, 대담하며 주인에 대한 충성심이 높아서 첫 주인을 결코 잊지 않는다고 알려져 있어요.	진돗개 성격	https://www.kgnews.co.kr/news/article.html?no=647562	2021/05/26	0	2022-09-30 11:00:14	2022-09-30 11:00:14
BK22011989	5	질문자	그러고보니 진돗개의 충성심을 보여주는 광고도 있었던게 기억나네요. 혹시 털은 많이 빠지는 편인가요?				0	2022-09-30 11:00:15	2022-09-30 11:00:15
BK22011989	6	전문가	네. 진돗개는 1년에 2번 털갈이를 하는데, 털이 많이 빠지는 견종이라 주기적으로 빗질해주셔야 해요.	진돗개 털갈이	https://www.kgnews.co.kr/news/article.html?no=647562	2021/05/26	0	2022-09-30 11:00:15	2022-09-30 11:00:15
BK22011989	7	질문자	어떤 개든 털은 빠지겠지만 털갈이 시기에는 각오해야겠네요. 그런데 생김새만 보고 진돗개인지 아닌지 잘 모르겠던데, 어떤 모습을 가져야 진돗개라 할 수 있나요?				0	2022-09-30 11:00:15	2022-10-04 19:03:08
BK22011989	8	전문가	진돗개의 머리는 보통 뭉툭한 삼각형 형태이고 눈은 붉은면서 둥근 형태로 눈꼬리가 살짝 올라가 귀밑 선에 맞아야 해요. 진돗개는 이중모인데 속털은 부드러우면서 조밀하고, 겉털은 두꺼우면서도 빳빳하답니다.	진돗개 머리 삼각형	https://www.kgnews.co.kr/news/article.html?no=647562	2021/05/26	0	2022-09-30 11:00:15	2022-09-30 11:00:15
BK22011989	9	질문자	아 그렇군요. 그런데 듣기로는 진돗개가 우리나라 토종개라고 하던데, 토종개는 진돗개가 유일한건가요?				0	2022-09-30 11:00:15	2022-09-30 11:00:15
BK22011989	10	전문가	아니에요. 우리나라 토종개는 진도개 뿐 아니라 경주개동경이, 북한의 풍산개, 삽살개, 제주개, 불개, 오수개 등 총 7종이 있답니다.	한국 토종개	http://digitalchosun.dizzo.com/site/data/html_dir/2019/07/24/2019072480209.html	2019/07/25	0	2022-09-30 11:00:15	2022-09-30 11:00:15
BK22011989	11	질문자	삽살개는 알겠는데 다른 견종은 생소하네요. 그런데 진돗개는 매일 산책시켜줘야 하나요?				0	2022-09-30 11:00:15	2022-09-30 11:00:15
BK22011989	12	전문가	진돗개는 밖에서 대소변을 보는 실외배변을 좋아하는데요. 이런 습관은 개나 반려인 모두에게 힘든 점으로 손꼽히고 있어요. 하루에 적어도 세네 번 이상 산책을 해야하니 반려인 중에서는 재택업무가 가능한 직업으로 바꾼 경우도 있답니다.	진돗개 실외배변	https://www.hani.co.kr/arti/animalpeople/companion_animal/991570.html	2021/04/19	0	2022-09-30 11:00:15	2022-09-30 11:00:15
BK22011989	13	질문자	야외배변만 한다면 하루도 빠지지 않고 나가야하는거네요. 그런데 진돗개가 천연기념물이잖아요. 천연기념물은 함부로 데려오고 그러면 안되지 않나요?				0	2022-09-30 11:00:15	2022-09-30 11:00:15
BK22011989	14	전문가	진돗개는 현재 보호종 및 문화재로 분류되어 있는데요. 진돗개는 진도의 지정 구역에서 관리되고 있고, 진도군수가 승인은 해줘야만 진도군 이외의 지역으로 진돗개를 반출할 수 있답니다. 이런 승인없이 무단 반출은 금지되어 있고 순혈통을 지키기 위하여 법도 제정되어 있는 상태예요.	진돗개 천연기념물 군수 승인	https://www.sisunnews.co.kr/news/articleView.html?idxno=107297	2019/06/17	0	2022-09-30 11:00:15	2022-09-30 11:00:15
BK22011989	15	질문자	역시 천연기념물이라 까다롭게 관리되고 있네요. 그럼 진돗개를 키우는데 주의해야 할 점은 없을까요?				0	2022-09-30 11:00:15	2022-09-30 11:00:15
BK22011989	16	전문가	진돗개는 집과 주인을 지키는 것을 워낙 좋아하고 낯선 동물 및 사람에게 예민하게 반응하는 성격인지라 밖에 나갈 때는 입마개를 해 주셔야 해요. 거기다 진돗개는 깔끔한 성향이라 주변 환경 및 털을 깨끗하게 관리해주셔야 한답니다.	진돗개 청결	https://www.kgnews.co.kr/news/article.html?no=647562	2021/05/26	0	2022-09-30 11:00:15	2022-09-30 11:00:15
BK22011989	17	질문자	깔끔한 걸 좋아하는 성격은 저랑도 비슷하네요. 진돗개 데려오는 건 조금 더 깊게 생각해봐야겠어요. 퇴근이 늦을 때가 있는데 실외배변이 조금 마음에 걸리거든요.				0	2022-09-30 11:00:15	2022-09-30 11:00:15
BK22011989	18	전문가	진돗개는 실외배변을 좋아하는 견종이니까 신중하게 생각해 보시고 결정하세요.				0	2022-09-30 11:00:15	2022-09-30 11:00:15
BK22011989	19	질문자	그래야겠어요. 오늘 진돗개에 대해서 많은 정보를 공유해 주셔서 감사했어요. 다음에 맛있는 식사 대접할께요.				0	2022-09-30 11:00:15	2022-09-30 11:00:15
BK22011989	20	전문가	정보를 공유할 수 있어서 저도 뿌듯했답니다. 그럼 시간 될 때 연락 주세요. 안녕히 가세요.				1	2022-09-30 11:00:15	2022-10-06 14:08:20
