id	utterance_id	role	text	search_query	search_URL	reference_date	terminate	regDate	updDate
BK22014761	1	질문자	제가 최근에 고양이를 입양했는데요, 반려묘를 기르는 게 처음이라 모르는 게 너무 많아요. 제일 고민인 건 식사를 어떻게 챙겨줘야 하느냐는 건데, 고양이에게 마른 사료를 줘도 될까요?				0	2022-10-02 23:50:22	2022-10-03 17:55:47
BK22014761	2	전문가	어머, 이제 집사가 되셨네요! 음, 건조 식품은 고양이가 배설하는 고농축의 소변에 돌이나 결정을 형성할 가능성이 높은 편이라서, 최상의 선택은 아니긴 해요. 그래도 마른 사료에 반려묘에게 필요한 영양분이 충분히 들어 있으면 건조 식품 자체를 아예 좋지 못한 식단으로 생각할 필요는 없어요. 대신 마른 음식을 줄 때는 적당히 수분기가 있는 음식과 함께 혼합하는 게 좋고, 물이나 습식 식품을 적절히 보충해줘야 해요.	고양이 마른 사료	https://www.famtimes.co.kr/news/articleView.html?idxno=58114	2020/01/13	0	2022-10-02 23:50:22	2022-10-03 17:55:47
BK22014761	3	질문자	네, 어쨌든 건조 식품을 줄 때는 습식 식품도 곁들여야겠네요. 근데 걱정인 게, 입양한 지 이제 사흘 째인데 고양이가 스트레스를 좀 받는 것 같아요. 전 식사 때문인 것 같은데, 혹시 입양 고양이의 식단을 짤 때 고려해야 할 게 있나요?				0	2022-10-02 23:50:22	2022-10-03 20:37:39
BK22014761	4	전문가	입양이나 분양으로 고양이를 처음 집으로 데리고 온 경우에는, 고양이가 예전에 익숙했던 양과 시간에 맞춰 사료를 주는 게 중요해요. 그러고 나서 차츰 새로운 식사 스케줄로 바꾸어가는 방식이 좋죠. 고양이는 갑작스러운 변화를 엄청 싫어하기 때문에 새로운 가족과 새로운 집은 고양이에게 불안과 두려움, 스트레스를 불러일으킬 수 있으니 세심하게 살펴봐야 해요.	입양 고양이 식단	https://www.famtimes.co.kr/news/articleView.html?idxno=58114	2020/01/13	0	2022-10-02 23:50:25	2022-10-04 08:20:22
BK22014761	5	질문자	아, 갑자기 식사 스케줄이 달라져서 스트레스를 받은 걸지도 모르겠네요. 그럼 전 주인 분께 평소 어떻게 식사했었는지부터 물어봐야겠어요. 음, 근데 새로운 식사 스케줄로 옮겨갈 때, 음식 양은 어느 정도로 하면 좋을까요?				0	2022-10-02 23:50:25	2022-10-04 08:20:22
BK22014761	6	전문가	반려묘는 매일 체중 0.45kg당 30 칼로리를 섭취하도록 하면 돼요. 예를 들어 고양이 체중이 4.5kg이라면 매일 300 칼로리를 섭취하면 되죠. 일반적으로 수분 함유 제품은 170g당 250 칼로리 정도이고, 건조 식품은 1컵당 300 칼로리니까 4.5kg의 반려묘에게는 약 198g짜리 통조림이나 마른 음식 1컵을 마련해주면 돼요.	고양이 음식 양	https://www.famtimes.co.kr/news/articleView.html?idxno=58114	2020/01/13	0	2022-10-02 23:50:22	2022-10-04 10:47:52
BK22014761	7	질문자	자세히 알려주셔서 너무 고마워요. 제가 한 달 뒤에는 한 마리 더 분양할 수도 있는데, 그 애는 자유 급식을 한다더라고요. 자유 급식하는 고양이는 식사를 어떻게 챙겨줘야 할까요?				0	2022-10-02 23:50:22	2022-10-04 08:53:39
BK22014761	8	전문가	음, 음식 그릇에 적절한 양을 넣어 두고, 자유 급식을 하는 반려묘가 언제든 찾아와 사료를 먹을 수 있도록 하면 돼요. 이렇게 하면 과체중 및 비만의 위험도 줄일 수 있고, 남는 음식을 줄여 낭비도 예방해주죠. 아! 그리고 반려묘가 하루에 얼마나 먹는 지도 관찰할 수 있어서 편해요.	자유급식 고양이	https://www.famtimes.co.kr/news/articleView.html?idxno=58114	2020/01/13	0	2022-10-02 23:50:22	2022-10-04 08:53:39
BK22014761	9	질문자	아, 그렇겠네요! 참, 고양이한테 사료를 주는 횟수는 어느 정도가 좋나요?				0	2022-10-02 23:50:22	2022-10-04 08:56:57
BK22014761	10	전문가	그건 기르는 반려묘가 실제로 얼마나 먹는지에 따라 다르죠. 보호자들은 대개 아침과 저녁에 사료를 주되, 이후 간식 등의 사료를 더 줄지 안 줄지는 반려묘가 먹는 양과 습성, 무게, 체질 등에 따라 다르게 하면 돼요. 본인 반려묘에게 하루 몇 회 정도 사료를 주는 게 좋은지 정확하게 알고 싶으면 수의사와 상담하시면 되고요.	고양이 사료 횟수	https://www.famtimes.co.kr/news/articleView.html?idxno=58114	2020/01/13	0	2022-10-02 23:50:22	2022-10-04 08:56:57
BK22014761	11	질문자	아, 그럼 제 친구가 수의사인데 걔한테 상담받으면 되겠네요. 참, 갑자기 생각났는데 수의사 친구가 고양이의 갈비뼈를 보면 영양상태를 체크할 수 있다고 하던데 맞나요? 어떻게 갈비뼈를 보고 반려묘의 건강상태를 살펴볼 수 있는 건지 자세히 알려주세요.				0	2022-10-02 23:50:22	2022-10-07 14:23:29
BK22014761	12	전문가	맞아요, 반려묘의 갈비뼈를 살펴보면 반려묘가 너무 적게 먹고 있거나 너무 많이 먹고 있는 건 아닌지 가장 확실하게 알 수 있죠. 반려묘가 걸어다닐 때 피부를 통해 갈비뼈가 움직이는 게 보이면 매우 마른 상태이거나 영양 실조인 상황이에요. 반대로, 직접 반려묘의 몸통을 만져 봐도 갈비뼈가 느껴지지 않는 경우엔 비만이거나 과체중일 가능성이 높아요. 이럴 때는 사료 섭취량을 적절하게 조절해서 반려묘가 정상 체중이 되도록 도와야 하죠.	고양이 갈비뼈 건강 상태	https://www.famtimes.co.kr/news/articleView.html?idxno=58114	2020/01/13	0	2022-10-02 23:50:22	2022-10-07 14:23:29
BK22014761	13	질문자	아, 친구 말이 맞네요. 근데 고양이들이 물을 싫어해서 그런지, 우리 애는 물을 잘 안 마시는 것 같아요. 보통 고양이들은 하루에 어느 정도 물을 섭취해야 하나요?				0	2022-10-02 23:50:22	2022-10-07 14:23:29
BK22014761	14	전문가	반려묘는 하루에 체중 1kg당 약 40ml의 물을 섭취하면 돼요. 수분 섭취량이 부족하거나 기타 다른 이유로 요로결석, 신부전증, 방광염 따위를 앓는 고양이들이 많으니 조심하시고요.	고양이 물 섭취	https://www.dailyvet.co.kr/news/practice/companion-animal/85217	2017/10/24	0	2022-10-02 23:50:22	2022-10-04 10:47:52
BK22014761	15	질문자	헉 진짜 조심해야겠네요. 휴, 싫어하더라도 적정량만큼은 수분을 섭취할 수 있도록 도와줘야겠어요.				0	2022-10-02 23:50:22	2022-10-04 10:47:52
BK22014761	16	전문가	네, 반려묘와 오래오래 건강히 지내려면 여러가지로 신경 써야 해요. 혹시 또 궁금한 거 있어요? 아쉽긴 한데, 저 5분 정도 있다가 출발해야해서요.				0	2022-10-02 23:50:22	2022-10-04 10:47:52
BK22014761	17	질문자	아, 벌써 시간이 이렇게 됐네요! 음, 그럼 저 개인적으로 궁금했던 거 한 가지만 더 여쭤볼게요. 고양이가 단맛을 못 느낀다는 말이 있던데, 사실이에요?				0	2022-10-02 23:50:22	2022-10-04 10:47:52
BK22014761	18	전문가	맞아요. 고양이들은 단맛을 느낄 수 없어요. 단맛을 뇌에 전달하는 미각수용체가 고양이과 동물의 혀에는 없거든요. 그래서 반려묘에게 약을 먹일 때 달콤한 시럽 같은 걸 약에 섞어서 줘도 거품만 물어서 당황하는 초보 집사들이 많죠, 하하.	고양이 단맛	https://www.dongascience.com/news.php?idx=8448	2015/10/22	0	2022-10-02 23:50:22	2022-10-04 11:22:46
BK22014761	19	질문자	그렇군요! 하하, 오늘 덕분에 정말 큰 도움 받았어요. 이만 출발하시고, 제가 다음 번에 맛있는 식사 대접할 테니 저희 집 놀러오셔요.				0	2022-10-02 23:50:25	2022-10-04 10:47:52
BK22014761	20	전문가	너무 좋죠! 그날 입양한 고양이도 보면 되겠네요. 기대하고 있을 테니 꼭 초대해주세요.				0	2022-10-02 23:50:22	2022-10-04 10:47:52
BK22014761	21	질문자	네, 조심히 가시고 곧 봬요!				1	2022-10-04 10:47:52	2022-10-07 14:36:08
