id	utterance_id	role	text	search_query	search_URL	reference_date	terminate	regDate	updDate
BK22008981	1	질문자	요새 주위에서 콜라비를 자주 먹는 것 같아요. 저희 딸아이도 유튜브를 보더니 콜라비 음식을 만들어 달라던데, 콜라비가 뭐죠?				0	2022-09-20 11:07:54	2022-09-28 11:14:19
BK22008981	2	전문가	순무양배추라고도 불리는 콜라비는 유럽이 원산지이며, 배추속 브라시카 올레라케아 중 하나인 식물이죠.	콜라비	https://ko.wikipedia.org/wiki/%EC%BD%9C%EB%9D%BC%EB%B9%84	2022/06/21	0	2022-09-20 11:07:54	2022-09-28 11:14:19
BK22008981	3	질문자	아하, 유럽에서 온 식물이군요. 그런데 아동이 먹기에도 괜찮은가요?				0	2022-09-20 11:07:54	2022-09-28 11:14:19
BK22008981	4	전문가	네, 아동의 골격을 강화해주며, 치아를 튼튼하게 해주고 샐러리 당근을 넣어 혼합녹즙을 만들면 많은 양의 칼슘 섭취도 가능하거든요.	콜라비 아동	http://view.asiae.co.kr/news/view.htm?idxno=2015101809391908085	2015/10/18	0	2022-09-20 11:07:54	2022-09-28 11:14:19
BK22008981	5	질문자	아동의 골격과 치아 강화에 도움을 주는군요. 혹시 영양성분도 알려주실 수 있나요?				0	2022-09-20 11:07:54	2022-09-28 11:14:19
BK22008981	6	전문가	100g당 비타민C를 62mg 함유하고 있는데, 하루 영양소 기준치의 75퍼센트에 해당하며, 열량은 27kcal예요.	콜라비 영양성분	https://ko.wikipedia.org/wiki/%EC%BD%9C%EB%9D%BC%EB%B9%84	2022/06/21	0	2022-09-20 11:07:54	2022-09-28 11:14:19
BK22008981	7	질문자	비타민C가 75퍼센트나 들어 있군요. 그러면 맛은 어떤 편이에요?				0	2022-09-20 11:07:54	2022-09-28 11:14:19
BK22008981	8	전문가	콜라비는 수분이 90퍼센트 이상이고 줄기는 아삭아삭하며 단맛이 나는 편이에요.	콜라비 맛	https://ko.wikipedia.org/wiki/%EC%BD%9C%EB%9D%BC%EB%B9%84	2022/06/21	0	2022-09-20 11:07:54	2022-09-20 11:07:54
BK22008981	9	질문자	아삭거리고 단맛이 나면 맛이 좋을 것 같은데요. 그럼 주로 어떤 식으로 활용하여 먹어요?				0	2022-09-20 11:07:54	2022-09-28 11:14:19
BK22008981	10	전문가	잎은 쌈으로 활용하여 먹으며, 무침, 조림으로도 먹어요. 또한 과일이랑 갈아서 주스로 먹기도 하고, 피클로도 담가 먹어요.	콜라비 활용	https://ko.wikipedia.org/wiki/%EC%BD%9C%EB%9D%BC%EB%B9%84	2022/06/21	0	2022-09-20 11:07:54	2022-09-28 11:14:19
BK22008981	11	질문자	먹을 수 있는 방법도 아주 다양하고 좋네요. 그러면 효능으로는 어떤 게 있어요?				0	2022-09-20 11:07:54	2022-09-28 11:14:19
BK22008981	12	전문가	콜라비의 성분 중 글루코시놀레이트는 항암작용을 하는데, 유방암, 간암, 방광암 등과 같은 각종 암에 좋아요.	콜라비 효능	https://www.nbntv.co.kr/news/articleView.html?idxno=774661	2019/12/17	0	2022-09-20 11:07:54	2022-09-28 11:14:19
BK22008981	13	질문자	콜라비가 각 종 암에 효과가 있었군요. 혹시 보관법도 알려 주실 수 있을까요?				0	2022-09-20 11:07:54	2022-09-20 11:07:54
BK22008981	14	전문가	잎을 떼어서 수분이 날아가지 않게 줄기 부분을 젖은 키친타월로 감싸 넣고 비닐 팩에 밀봉하여 냉장 보관하시면 돼요.	콜라비 보관법	https://www.nbntv.co.kr/news/articleView.html?idxno=774661	2019/12/17	0	2022-09-20 11:07:54	2022-09-28 11:14:19
BK22008981	15	질문자	보관 방법도 그렇게 어려운 편은 아니네요. 그렇다면 저희 아버지가 먹어도 좋을까요?				0	2022-09-20 11:07:54	2022-09-20 11:07:54
BK22008981	16	전문가	콜라비는 산성물질을 중화시켜주고, 피로 회복에 도움을 주기 때문에 노인에게도 아주 좋은 음식이죠.	콜라비 노인	https://www.nbntv.co.kr/news/articleView.html?idxno=301663	2020/03/12	0	2022-09-20 11:07:54	2022-09-20 11:07:54
BK22008981	17	질문자	노인에게도 좋다니 저희 가족에게 아주 알맞는 음식 재료예요.				0	2022-09-20 11:07:54	2022-09-28 11:14:19
BK22008981	18	전문가	아이가 있으신 분이나 노부모를 모시고 계신다면 드시는 게 좋겠죠?				0	2022-09-20 11:07:54	2022-09-28 11:14:19
BK22008981	19	질문자	그래야겠네요. 덕분에 딸에게 맛있게 만들어 줄 수 있겠어요. 좋은 정보 감사드리고 다음에 또 만나요!				0	2022-09-20 11:07:54	2022-09-28 11:14:19
BK22008981	20	전문가	식사 맛있게 하시고 궁금한 점 있으시면 연락주세요. 또 봬요!				1	2022-09-20 11:07:54	2022-09-28 11:14:19
