id	utterance_id	role	text	search_query	search_URL	reference_date	terminate	regDate	updDate
BK22015316	1	질문자	요즘 강아지들 산책을 될 수 있으면 매일 시키려고 하는데 괜찮은 결정일까요? 다녀오면 왠지 피곤해 보이기도 해서 걱정돼요.				0	2022-10-07 14:58:35	2022-10-14 19:45:56
BK22015316	2	전문가	오, 반려견들의 1일 1산책은 스트레스도 풀리고 몸도 건강해지니 필수죠. 한여름에는 낮 산책이 오히려 위험할 수 있긴 하지만요.	반려견 산책 중요	http://www.dailypop.kr/news/articleView.html?idxno=60449	2022/06/07	0	2022-10-07 14:58:35	2022-10-14 19:45:56
BK22015316	3	질문자	어머, 저 이번 여름에도 낮에 산책 자주 나갔는데 위험한 거였나요?				0	2022-10-07 14:58:35	2022-10-14 19:45:56
BK22015316	4	전문가	도시의 길 대부분이 콘크리트나 아스팔트로 되어 있어서 한여름 낮에는 강아지들이 산책하는 데 위험하거든요. 이런 길은 열을 잘 흡수해서 엄청 뜨거운데 강아지들이 맨발인 상태로 땅을 밟으면 발바닥에 화상을 입을 수도 있어요.	여름철 강아지 발바닥 화상	http://www.dailypop.kr/news/articleView.html?idxno=60449	2022/06/07	0	2022-10-07 14:58:35	2022-10-07 14:58:35
BK22015316	5	질문자	화상이라니, 전혀 몰랐던 사실이에요! 그럼 여름에 산책시킬 땐 신발을 신기면 덜 위험할까?				0	2022-10-07 14:58:35	2022-10-14 19:52:39
BK22015316	6	전문가	신발이 그렇게 좋은 해결책은 아니에요. 발에 난 땀이 제대로 배출되지 않아서 피부염이 생길 수 있거든요.	강아지 신발 피부염	http://www.dailypop.kr/news/articleView.html?idxno=60449	2022/06/07	0	2022-10-07 14:58:35	2022-10-07 14:58:35
BK22015316	7	질문자	저런, 그럼 여름에는 언제 산책시키는 게 좋을까요?				0	2022-10-07 14:58:35	2022-10-14 19:45:56
BK22015316	8	전문가	여름철에 강아지 산책을 해야 한다면 일단 낮 시간대는 피하고 이른 아침이나 해질 무렵, 저녁 같이 상대적으로 온도가 낮은 때에 하는 게 좋아요.	여름 강아지 산책 시간대	http://www.dailypop.kr/news/articleView.html?idxno=60449	2022/06/07	0	2022-10-07 14:58:35	2022-10-07 14:58:35
BK22015316	9	질문자	아하, 그럼 오전이나 저녁에 산책시켜줘야겠네요. 그러고 보니 한창 더운 날엔 에어컨을 빵빵하게 틀어뒀었는데 이건 괜찮나요?				0	2022-10-07 14:58:35	2022-10-14 19:45:56
BK22015316	10	전문가	음, 오히려 안 좋을 수도 있어요. 에어컨 온도를 낮게 해서 오래 틀어두면 반려견들의 면역력이 떨어질 수 있거든요. 그러면 냉방병이나 감기에 걸릴 수 있어요.	강아지 에어컨 위험	http://www.dailypop.kr/news/articleView.html?idxno=60449	2022/06/07	0	2022-10-07 14:58:35	2022-10-14 19:45:56
BK22015316	11	질문자	에고, 그러면 온도를 어떻게 설정해두는 게 적당하려나요?				0	2022-10-07 14:58:35	2022-10-14 19:45:56
BK22015316	12	전문가	일단 안과 밖의 온도 차이가 6도는 넘지 않게 조절해두고, 에어컨 바람이 반려견에게 직접적으로 닿지 않도록 해두면 좋죠.	강아지 에어컨 적절히 조절	http://www.dailypop.kr/news/articleView.html?idxno=60449	2022/06/07	0	2022-10-07 14:58:35	2022-10-07 14:58:35
BK22015316	13	질문자	아하, 내년에는 에어컨 온도랑 날개를 좀 조절해놔야겠네요. 근데 제가 조금 있으면 낮에도 일을 시작해서 여름쯤이면 계속 살펴봐주지 못할 것 같아 걱정이 좀 생기네요. 강아지가 많이 더워할까 봐 걱정되는데 어떻게 하는 게 좋을까요?				0	2022-10-07 14:58:35	2022-10-14 19:45:56
BK22015316	14	전문가	음, 만약 주인이 외출한 집에 반려견이 더워할까 봐 걱정이 된다면 강아지 전용으로 나온 쿨매트 같은 걸 깔아줘 봐요. 에어컨을 틀어두고 나가는 것보단 이게 나아요.	강아지 쿨매트 활용	http://www.dailypop.kr/news/articleView.html?idxno=60449	2022/06/07	0	2022-10-07 14:58:35	2022-10-07 14:58:35
BK22015316	15	질문자	아하, 쿨매트 같은 게 있군요. 그런 걸 깔아둬도 도움이 된다니 좋은 정보네요. 여름되기 전에 털도 미리 짧게 잘라두면 시원하고 좋겠죠?				0	2022-10-07 14:58:35	2022-10-14 19:45:56
BK22015316	16	전문가	너무 짧게는 말고, 털 길이를 3cm 정도로 해서 미용을 하도록 해요. 그리고 빗질을 자주 해주는 게 털을 미는 것보다 좋아요. 죽어 있는 속털을 빼내고 털이 서로 엉키지 않게 관리만 잘 하면 더위를 덜 타게 할 수 있거든요.	여름철 강아지 미용법	http://www.dailypop.kr/news/articleView.html?idxno=60449	2022/06/07	0	2022-10-07 14:58:35	2022-10-07 14:58:35
BK22015316	17	질문자	이런, 저는 매번 엄청 짧게 깎았는데 오히려 좋지 않은 거였다니 속상하네요.				0	2022-10-07 14:58:35	2022-10-14 19:45:56
BK22015316	18	전문가	몰랐으면 그럴 수 있죠. 이제부터 잘 관리해주면 되니까 너무 울적해하지 말아요.				0	2022-10-07 14:58:35	2022-10-07 14:58:35
BK22015316	19	질문자	강아지 키우면서 그래도 지식을 많이 쌓았다고 생각했는데 아직도 알아야 할 게 산더미네요. 좋은 정보 알려주셔서 감사해요!				0	2022-10-07 14:58:35	2022-10-07 14:58:35
BK22015316	20	전문가	아니에요, 배우려는 의지가 있다는 게 중요한 거죠! 그럼, 집에 조심히 들어가고 또 만나요!				1	2022-10-07 14:58:35	2022-10-17 10:29:26
