id	utterance_id	role	text	search_query	search_URL	reference_date	terminate	regDate	updDate
BK22015490	1	질문자	아내가 벌써 임신 23주차가 되었어요. 첫 아이라 그런지 여전히 신기하고 궁금한 점이 많아요.				0	2022-10-09 16:30:56	2022-10-09 16:30:56
BK22015490	2	전문가	네, 어떤 점들이 궁금하세요?				0	2022-10-09 16:30:56	2022-10-09 16:48:02
BK22015490	3	질문자	음, 먼저 23주 태아의 크기는 얼마나 되나요?				0	2022-10-09 16:30:56	2022-10-09 16:30:56
BK22015490	4	전문가	23주의 태아는 약 28~30cm, 체중은 약 650g 정도예요.	임신 23주 태아 크기	https://www.hidoc.co.kr/healthstory/news/C0000108213	2015/09/15	0	2022-10-09 16:30:56	2022-10-09 17:11:48
BK22015490	5	질문자	아, 정말 많이 컸네요. 그럼 태아는 어느정도 발달이 되었나요?				0	2022-10-09 16:30:56	2022-10-09 16:48:02
BK22015490	6	전문가	네, 23주의 태아는 골격, 관절이 발달하여 두개골이나 척추, 갈비뼈, 팔 다리 등을 X-ray를 통해 확인할 수 있고, 자궁 안팎의 모든 소리를 들을 수 있을만큼 청력이 발달했어요.	임신 23주 태아 특징	https://www.hidoc.co.kr/healthstory/news/C0000108213	2015/09/15	0	2022-10-09 16:30:56	2022-10-09 17:11:48
BK22015490	7	질문자	정말 많이 발달했네요. 그럼 지금 아내의 몸 상태는 어떤가요?				0	2022-10-09 16:30:56	2022-10-09 17:11:48
BK22015490	8	전문가	임신 전보다 체중이 5~6kg 정도 늘어 등이나 허리가 아플 수 있고 발이 붓거나 다리가 저릴 수 있어요. 또 혈액이 늘어나 혈관이 확장되고 자궁이 커져 정맥을 압박할 수 있어요. 그로인해 외음부나 허벅지, 종아리 등에 정맥 혈관이 꼬불꼬불, 시퍼렇게 확장되는 정맥류가 생길 수 있지요.	임신 23주 엄마의 증상	https://www.hidoc.co.kr/healthstory/news/C0000108213	2015/09/15	0	2022-10-09 16:30:56	2022-10-10 00:54:22
BK22015490	9	질문자	아, 아내가 정맥류가 생겼는지 잘 살펴봐야 겠네요. 정맥류는 잘 모르겠지만 요즘 잇몸이 붓고 아프다는 말을 자주 하던데 이것도 임신 증상 중 하나인가요?				0	2022-10-09 16:30:56	2022-10-09 17:11:48
BK22015490	10	전문가	네, 임신을 하면 침의 산도가 변해 치석이 생길 수 있어요. 또 피의 양이 증가하면서 잇몸에 혈류량이 많아지고 붓기 때문에 잇몸이 들뜨거나 피가 나고 통증이 생기게 되는거죠.	임신 중 치석	https://www.hidoc.co.kr/healthstory/news/C0000108213	2015/09/15	0	2022-10-09 16:30:56	2022-10-09 17:11:48
BK22015490	11	질문자	아, 그럼 어떻게 해야 하나요? 임신 중인데 치과에서 치료를 받을 수 있나요?				0	2022-10-09 16:30:56	2022-10-09 17:11:48
BK22015490	12	전문가	일단 급한 충치만 응급 수단 정도로만 치료하고 완전한 치료는 출산 후에 하는것이 좋아요.	임신 중 충치 치료	https://www.hidoc.co.kr/healthstory/news/C0000108213	2015/09/15	0	2022-10-09 16:30:56	2022-10-09 17:11:48
BK22015490	13	질문자	아, 그렇군요. 아내가 고생이 많겠네요. 그리고 주변에서 태교를 하면 좋다고 하던데 태교는 어떻게 하면 되나요?				0	2022-10-09 16:30:56	2022-10-09 17:11:48
BK22015490	14	전문가	엄마가 리듬에 맞춰 기분좋게 흔들거리면 태아의 기분도 좋아지고 마음도 안정될 수 있어요. 부부가 함께 음악에 맞춰 기분 좋게 춤을 추는 것도 좋은 태교가 될 수 있어요.	임신 23주 태교	https://www.hidoc.co.kr/healthstory/news/C0000108213	2015/09/15	0	2022-10-09 16:30:56	2022-10-09 17:11:48
BK22015490	15	질문자	아, 춤은 잘 못추지만 아내와 함께 노력해 봐야겠네요. 참, 그리고 요즘 아내가 절 피하고 잠자리를 거부하는 것 같아요. 이것도 임신과 연관이 있나요?				0	2022-10-09 16:30:56	2022-10-09 17:11:48
BK22015490	16	전문가	네, 무의식적으로 태아의 존재를 인식해 남편과 성관계를 피하려는 심리가 생기기도 해요. 고민하시는 부분에 대해 아내분과 솔직한 대화를 나눠보세요.	임신 23주 남편 거부 심리	https://www.hidoc.co.kr/healthstory/news/C0000108213	2015/09/15	0	2022-10-09 16:30:56	2022-10-10 00:54:22
BK22015490	17	질문자	아, 그런 마음이 들 수 있군요. 아내와 좀 더 진지한 대화를 나눠봐야 겠네요. 마지막으로 이 시기에 아내가 주의해야 할 점이 있을까요?				0	2022-10-09 16:30:56	2022-10-09 17:11:48
BK22015490	18	전문가	임신 중기에는 임신중독을 예방하는 식단이 필요해요. 염분 섭취가 지나치지 않아야 하는데 염장류 식품이나 가공식품의 섭취를 줄이는 게 좋아요. 또 간장 역시 1큰술에 3.5g의 염분이 들어있기 때문에 하루에 2큰술 반 이상을 사용하지 않도록 주의하는 게 좋아요.	임신 중기 임신중독증	https://www.hidoc.co.kr/healthstory/news/C0000108213	2015/09/15	0	2022-10-09 16:30:56	2022-10-09 17:11:48
BK22015490	19	질문자	아, 식단 관리가 필요하군요. 덕분에 좋은 정보 많이 알았어요. 궁금한 점도 많이 해소 되었고요.				0	2022-10-09 16:30:56	2022-10-09 17:11:48
BK22015490	20	전문가	궁금한 점이 해소 되었다니 정말 다행이네요. 또 궁금한 점 있으면 언제든지 물어보세요.				1	2022-10-09 16:30:56	2022-10-17 13:53:49
