id	utterance_id	role	text	search_query	search_URL	reference_date	terminate	regDate	updDate
BK22003362	1	질문자	큰 아이가 어린이집에서 수족구에 걸려 왔는데, 수족구는 어떤 병이야?				0	2022-08-04 11:11:43	2022-08-08 11:36:41
BK22003362	2	전문가	아이가 아파서 걱정이 많겠구나.수족구는 콕사키바이러스나 엔테로바이러스에 감염돼서 아이 손이나 발, 입안에 물집이 생기는 바이러스성 질환이야.	수족구	https://www.hankookilbo.com/News/Read/A2022072911130001388?did=NA	2022/07/29	0	2022-08-04 11:11:44	2022-08-08 11:36:41
BK22003362	3	질문자	바이러스에 의해 걸리는 병이구나. 지금 열이 나고 반점이 생겼는데 또 어떤 증세가 나타나?				0	2022-08-04 11:11:44	2022-08-04 11:11:44
BK22003362	4	전문가	발열 1에서 2일 후에는 볼 안쪽과 잇몸, 혀에 작은 붉은 반점이 나타나다가 수포나 궤양으로 변해. 그리고 식욕이 없고, 피곤해하며, 설사나 구토 증세도 나타날 수 있어.	수족구 증세	https://health.chosun.com/site/data/html_dir/2022/07/15/2022071501794.html	2022/07/18	0	2022-08-04 11:11:44	2022-08-04 11:11:44
BK22003362	5	질문자	입안에 수포가 생기니 입맛이 없긴 하겠어. 혹시 합병증도 나타날 수 있어?				0	2022-08-04 11:11:44	2022-08-04 11:11:44
BK22003362	6	전문가	응, 신경성 폐부종, 폐출혈, 심근염, 심장막염이나 뇌간 뇌척수염, 뇌염이나 회색질척수염 같은 마비 증상이 나타날 수 있어.	수족구 합병증	http://www.econovill.com/news/articleView.html?idxno=582690	2022/07/23	0	2022-08-04 11:11:44	2022-08-04 11:11:44
BK22003362	7	질문자	합병증이 너무 무서운데 잘 관리해 줘야겠다. 혹시 둘째 아이에게도 전염될 수 있어?				0	2022-08-04 11:11:44	2022-08-04 11:11:44
BK22003362	8	전문가	감염된 후 호흡기 분비물로 1에서 3주까지 감염력을 보이기도 하고, 대변으로 수주에서 수개월까지 바이러스가 분비될 수도 있어. 또, 증상이 없는 것 같아도 바이러스가 분비되기도 하니 전염되지 않게 조심해야 해.	수족구 전염력	http://www.mdilbo.com/detail/5yPgc8/673693	2022/07/12	0	2022-08-04 11:11:44	2022-08-04 11:11:44
BK22003362	9	질문자	둘째 아이에게 전염되지 않도록 주의해야 겠네. 그럼 수족구병은 백신은 없어?				0	2022-08-04 11:11:44	2022-08-08 11:36:41
BK22003362	10	전문가	응, 아직 백신이 개발되지 않아 예방하는 것이 중요해.	수족구 백신	https://health.chosun.com/site/data/html_dir/2022/07/12/2022071201371.html	2022/07/12	0	2022-08-04 11:11:44	2022-08-08 11:36:41
BK22003362	11	질문자	백신이 빨리 개발되었으면 좋겠다. 수족구병은 어떻게 간호해 줘야 해?				0	2022-08-04 11:11:44	2022-08-04 11:11:44
BK22003362	12	전문가	일단 잘 먹이는 것이 중요해. 입안이 아파서 잘 먹지 못할 테니 부드럽고 자극적이지 않은 음식을 준비해 줘.	수족구 치료	https://www.edaily.co.kr/news/read?newsId=01213606632291856&mediaCodeNo=257&OutLnkChk=Y	2022/04/01	0	2022-08-04 11:11:44	2022-08-04 11:11:44
BK22003362	13	질문자	계란찜 같은 부드러운 걸 준비해 줘야겠어. 혹시 아이스크림을 달라고 하는데 줘도 될까?				0	2022-08-04 11:11:44	2022-08-04 11:11:44
BK22003362	14	전문가	설사만 없으면 아이스크림 먹여도 괜찮아. 찬 걸 먹으면 입이 얼얼해져서 아픈 것도 좀 줄일 수도 있어.	수족구 음식	http://www.bosa.co.kr/news/articleView.html?idxno=2170824	2022/03/30	0	2022-08-04 11:11:44	2022-08-04 11:11:44
BK22003362	15	질문자	아이스크림 먹어도 돼서 다행이다. 수족구를 빨리 낫게 하는 방법은 뭐가 있어?				0	2022-08-04 11:11:44	2022-08-08 11:36:41
BK22003362	16	전문가	손을 잘 씻고 양치질을 꼭 세 번 하고, 가글액을 사용해서 입안을 청결하게 해줘.	수족구 낫는 법	https://www.dailysecu.com/news/articleView.html?idxno=70086	2019/09/17	0	2022-08-04 11:11:44	2022-08-08 11:36:41
BK22003362	17	질문자	알겠어, 첫째는 잘 관리해 주고 둘째가 옮지 않도록 신경도 써야겠어.				0	2022-08-04 11:11:44	2022-08-04 11:11:44
BK22003362	18	전문가	그래, 잘 관리해야지 아이들이 아픈 것만큼 힘든 게 없더라.				0	2022-08-04 11:11:44	2022-08-08 11:36:41
BK22003362	19	질문자	응, 아이가 아프니 집도 엉망이고 힘드네.				0	2022-08-04 11:11:44	2022-08-04 11:11:44
BK22003362	20	전문가	고생스럽겠지만 잘 간호해서 빨리 좋아지길 바랄게.				1	2022-08-04 11:11:44	2022-08-08 11:36:41
