id	utterance_id	role	text	search_query	search_URL	reference_date	terminate	regDate	updDate
BK22011521	1	질문자	아이가 클수록 편식을 하는 것 같아서 걱정인데, 주변 엄마들을 보면 다들 같은 고민을 하더라고요. 아이들을 왜 이렇게 편식을 하는 걸까요?				0	2022-09-24 20:50:38	2022-09-24 20:50:38
BK22011521	2	전문가	아이가 성장하면서 편식을 하는 건 정상적인 일이에요. 특히 2~5세 아이들은 새로운 음식을 거부하는 음식 네오포비아로 인해 심하게 음식을 거부하는 반응이 나타나기도 하죠.	아이 편식 원인	https://www.ibabynews.com/news/articleView.html?idxno=62253	2018/02/13	0	2022-09-24 20:50:38	2022-09-24 20:50:38
BK22011521	3	질문자	편식이 성장하면서 생기는 정상적인 일이라면 그냥 편식하도록 내버려 두어도 괜찮은 건가요?				0	2022-09-24 20:50:38	2022-09-24 20:50:38
BK22011521	4	전문가	그건 아니에요. 아이가 편식하게 되면 나중에 학교에 들어가서 적응하기도 어렵고 타인과의 관계에서도 위축될 수 있으므로 꼭 고치고 넘어가야 해요.	편식을 그냥 두어도 되나	https://www.ibabynews.com/news/articleView.html?idxno=62253	2018/02/13	0	2022-09-24 20:50:38	2022-10-04 13:30:25
BK22011521	5	질문자	그럼 편식하는 아이를 제가 어떻게 대해야 좋을까요? 솔직히 화도 나고 속상해서 식사 시간마다 싸우는 일도 자주 생기거든요.				0	2022-09-24 20:50:38	2022-09-24 20:50:38
BK22011521	6	전문가	부모가 편식하는 아이와 실랑이하면서 너무 예민하게 반응하면 좋지 않아요. 밥 먹으면서 계속해서 혼나고 다투는 경험을 한 아이들은 먹는 것 자체를 싫어하게 될 수도 있으니까요.	편식하는 아이 대하는 법	http://news.imaeil.com/page/view/2022080922490065167	2022/08/15	0	2022-09-24 20:50:38	2022-10-04 13:30:25
BK22011521	7	질문자	그럼 편식 없이 골고루 밥을 먹으면 좋아하는 간식을 준다든가 하는 방법을 쓰면 어떨까요? 아무래도 보상이 있으면 의욕이 생겨서 밥을 잘 먹게 되지 않을까 싶거든요.				0	2022-09-24 20:50:38	2022-09-24 20:50:38
BK22011521	8	전문가	아이에게 보상 음식을 주는 방법은 싫어하는 음식을 당장 먹이는 데는 효과가 있을 수 있지만 싫은 음식은 더 싫어지고 보상받는 음식은 더 맛있는 음식이라고 생각하기 쉬워요. 그래서 오히려 편식이 더 심해질 수 있죠.	편식하는 아이 보상 제공	http://news.imaeil.com/page/view/2022080922490065167	2022/08/15	0	2022-09-24 20:50:38	2022-10-04 13:30:25
BK22011521	9	질문자	그렇구나. 저희 아이는 특히 채소를 안 먹는데 그럼 채소를 먹이려면 어떤 식으로 해주어야 좋을까요?				0	2022-09-24 20:50:38	2022-09-24 20:50:38
BK22011521	10	전문가	채소를 줄 때 다양한 방식으로 요리하는 방법이 있어요. 찌거나 볶고 데치는 등 방법을 다양하게 해서 제공하는 거죠. 그러면 아이가 음식에서 색다른 맛을 발견할 수 있거든요.	편식하는 아이 야채 먹이기	http://news.imaeil.com/page/view/2022080922490065167	2022/08/15	0	2022-09-24 20:50:38	2022-10-04 13:30:25
BK22011521	11	질문자	아, 같은 재료라도 조리법을 다르게 하는 거네요. 그런데 어떻게 요리해서 줘도 안 먹는 음식이 있다면 그때는 어떻게 하는 게 좋을까요? 저희 아이는 가지를 특히 안 먹어서 그냥 포기하고 아예 안 주고 있거든요.				0	2022-09-24 20:50:38	2022-09-24 20:50:38
BK22011521	12	전문가	아이가 특정 음식을 안 먹는다고 바로 포기하지 말고 꾸준히 식탁에 내는 것이 좋아요. 시간 간격을 두면서 계속 먹어보게 하는 거죠.	아이가 절대 안 먹는 음식 먹이기	http://news.imaeil.com/page/view/2022080922490065167	2022/08/15	0	2022-09-24 20:50:38	2022-10-04 13:30:25
BK22011521	13	질문자	그렇구나. 그럼 잊힐 만 할 때 다시 노출하는 방법을 써야겠네요. 혹시 아이 편식을 고치기 위해서 또 제가 할 수 있는 일이 없을까요?				0	2022-09-24 20:50:38	2022-09-24 20:50:38
BK22011521	14	전문가	아이에게 먹는 즐거움을 주기 위해서 아이와 요리를 같이 하는 것도 하나의 방법이 될 수 있어요. 재료의 색깔과 모양, 맛의 변화를 경험하게 되면 음식 자체에 관심이 생기고 흥미를 느낄 수 있거든요.	편식 고치는 방법	https://www.ibabynews.com/news/articleView.html?idxno=62253	2018/02/13	0	2022-09-24 20:50:38	2022-10-04 13:30:25
BK22011521	15	질문자	그러고 보니 아이와 함께 요리를 만들면 자기가 직접 만든 거라고 관심을 더 많이 가지면서 편식도 점차 없어질 것 같네요. 참, 식사 전에 에피타이저로 간단하게 먹을 것을 주면 아이 입맛을 돋게 만든다고 친구가 그러던데, 이 방법이 진짜 효과가 있을까요?				0	2022-09-24 20:50:38	2022-10-04 13:30:25
BK22011521	16	전문가	아이들은 소화기관과 뱃골의 크기가 작아서 한 번에 먹을 수 있는 양이 정해져 있기 때문에 간식은 최소한으로 주는 게 좋아요. 특히 밥을 먹기 전에 음료수나 찬물을 먹는 것도 좋지 않고요.	편식하는 아이 식사 전 간식	https://www.ibabynews.com/news/articleView.html?idxno=62253	2018/02/13	0	2022-09-24 20:50:38	2022-10-04 13:30:25
BK22011521	17	질문자	어머, 저는 일부러 밥맛을 좋게 만들려고 가볍게 간식을 주려고 했는데 그게 오히려 안 좋은 방법이었네요. 그럼 그 방법은 쓰지 말아야겠어요.				0	2022-09-24 20:50:38	2022-10-03 22:23:08
BK22011521	18	전문가	네, 아이가 밥에 집중할 수 있도록 간식을 너무 많이 주지 말아요.				0	2022-09-24 20:50:38	2022-09-24 20:50:38
BK22011521	19	질문자	그래야겠어요. 아이가 편식하니까 식사 시간마다 너무 힘들었는데, 오늘 대화를 통해서 조금이나마 마음의 짐을 덜어낸 것 같아서 좋네요.				0	2022-09-24 20:50:38	2022-09-24 20:50:38
BK22011521	20	전문가	다행이네요. 한순간에 해결되는 문제가 아니니까 천천히 시간을 가지고 조금씩 고치려고 노력하면 좋을 거예요.				1	2022-09-24 20:50:38	2022-10-04 13:30:25
BK22011521	21	질문자	고마워요, 앞으로 좀 더 신경 써서 편식을 고칠 수 있도록 노력해 볼게요. 오늘 대화 정말 유익했어요. 그럼 다음에 또 만나요.				0	2022-09-24 20:50:38	2022-09-24 20:50:38
