id	utterance_id	role	text	search_query	search_URL	reference_date	terminate	regDate	updDate
BK22015214	1	질문자	있잖아, 이번에 고양이를 키우는 친구 집에 놀러갔는데, 친구 말로는 고양이한테도 바디랭귀지가 있다고 하더라. 그런데 고양이가 친구 앞에서 계속 배를 뒤집던데, 이건 무슨 뜻이야?				0	2022-10-06 22:03:32	2022-10-06 23:25:05
BK22015214	2	전문가	아, 만약 고양이가 상대방을 바라보면서 배를 뒤집어 보여준다면, 이건 상대를 신뢰한다는 뜻이야. 하지만, 만약 이 상태에서 고양이의 배를 만지게 되면, 고양이가 불쾌해 하면서 물어버리는 일이 발생할 수도 있어.	고양이 배 뒤집기	http://news.imaeil.com/page/view/2021051718424230026	2021/05/17	0	2022-10-06 22:03:32	2022-10-06 23:25:05
BK22015214	3	질문자	자기가 배를 보여줘 놓고선, 정작 사람이 배를 만지면 물어버린단 말이야? 왜 고양이는 배를 만지면 무는 거야?				0	2022-10-06 22:03:32	2022-10-06 23:25:05
BK22015214	4	전문가	그게, 고양이에게 있어서 배는 최대의 약점이거든. 그러다 보니, 만약 보호자가 고양이의 배를 쓰다듬을 경우, 고양이는 이걸 공격으로 간주해서 물거나 할퀴는 행동을 보이기도 해.	고양이 배 물음	https://www.k-health.com/news/articleView.html?idxno=51944	2021/01/17	0	2022-10-06 22:03:32	2022-10-06 23:25:05
BK22015214	5	질문자	아하, 그러면 배를 보인다고 해서 만져 달라는 뜻으로 오해하면 안된다는 거구나. 알겠어, 그러면 혹시, 고양이가 꼬리를 흔드는 건 무슨 뜻이야? 내가 이번에 친구 고양이 근처에 갔더니 고양이가 꼬리를 흔들던데, 개들은 사람을 반가워하면 꼬리를 흔들잖아.				0	2022-10-06 22:03:32	2022-10-06 23:25:05
BK22015214	6	전문가	아, 개와 고양이가 꼬리를 흔드는 것은 서로 의미가 달라. 만약 개가 사람에게 꼬리를 흔든다면 그건 반갑다는 의미가 맞지만, 만약 고양이가 상대방에게 꼬리를 흔든다면, 그건 상대방에게 다가오지 말라는 신호를 주는 거야.	고양이 개 꼬리	http://news.imaeil.com/page/view/2021051718424230026	2021/05/17	0	2022-10-06 22:03:32	2022-10-13 14:59:25
BK22015214	7	질문자	이런, 그럼 친구 고양이가 나를 별로 마음에 들어하지 않았나 보다. 그런데, 친구네 고양이는 내 친구가 부르는 소리에도 꼬리를 흔들더라? 강아지처럼 온 몸을 흔드는 건 아니고 누워있다가 꼬리를 흔든 거긴 한데, 그러면 친구네 고양이가 사실 친구를 싫어한다는 거야?				0	2022-10-06 22:03:32	2022-10-06 23:25:05
BK22015214	8	전문가	아니, 만약 고양이가 자거나 누워있는 상태에서 주인이 불렀을 때 꼬리를 흔들었다면, 그건 고양이가 주인의 말을 듣고 있기는 하지만 피곤해서 근처에 가지는 못하겠다는 뜻이야. 말이나 소리로 응답하는 대신, 꼬리를 사용해서 주인에게 반응하는 거지.	고양이 누워서 꼬리	https://www.salgoonews.com/news/articleView.html?idxno=19094	2022/05/12	0	2022-10-06 22:03:32	2022-10-06 23:25:05
BK22015214	9	질문자	흠, 그렇구나. 하긴 이번에 봤을 때 친구네 고양이가 조금 피곤해 보이기는 하더라. 그러고 보니 먹이를 줄 때나 소변을 볼 때도 고양이가 꼬리를 부르르 떨던데, 혹시 고양이가 어디 아프기라도 한 걸까?				0	2022-10-06 22:03:32	2022-10-06 23:25:05
BK22015214	10	전문가	아니, 그건 아파서 그러는 게 아니야. 소변을 볼 때 꼬리를 부르르 떠는 건 마킹을 하고 있다는 의미고, 만약 밥 먹을 시간에 주인을 향해 꼬리를 떤다면, 그건 먹이를 달라고 재촉하는 거야.	고양이 꼬리 부르르	https://www.salgoonews.com/news/articleView.html?idxno=19094	2022/05/12	0	2022-10-06 22:03:32	2022-10-06 23:25:05
BK22015214	11	질문자	아, 그러면 걱정할 필요는 없구나. 그러면 혹시, 고양이가 기분이 좋을 때는 꼬리가 어떻게 움직여?				0	2022-10-06 22:03:32	2022-10-06 23:25:05
BK22015214	12	전문가	기분이 좋고 편안한 상태일 때, 고양이는 꼬리를 위로 바짝 세워. 그리고 만약 꼬리가 위로 향한 상태에서 주인의 몸에 얼굴까지 부빈다면, 그건 고양이가 애교를 부리는 거야.	기분 좋은 고양이 꼬리	https://www.salgoonews.com/news/articleView.html?idxno=19094	2022/05/12	0	2022-10-06 22:03:32	2022-10-06 23:25:05
BK22015214	13	질문자	음, 궁금한 게 있는데, 내가 맨 처음 친구 집에 들어갔을 때 친구네 고양이가 꼬리를 위로 바짝 세웠거든? 그런데 꼬리 말고 털도 바짝 세우던데, 그러면 이것도 고양이가 기분이 좋다는 뜻인 거야?				1	2022-10-06 22:03:35	2022-10-13 14:59:25
BK22015214	14	전문가	아니, 그건 기분이 좋다는 신호가 아니야. 만약 고양이의 몸과 꼬리에 있는 털이 바짝 세워진 상태에서 꼬리가 위로 올라가 있다면, 이건 고양이가 굉장히 겁 먹었다는 뜻이지.	고양이 꼬리 털 위로 바짝	https://www.salgoonews.com/news/articleView.html?idxno=19094	2022/05/12	0	2022-10-06 22:03:32	2022-10-06 23:25:05
BK22015214	15	질문자	이런, 그러면 친구네 고양이가 생각보다 나를 엄청 많이 무서워했나봐. 그러면 혹시, 겁이 많은 고양이는 어떻게 대하는 게 좋을까?				0	2022-10-06 22:03:32	2022-10-06 23:25:05
BK22015214	16	전문가	만약 겁이 많은 고양이라면, 눈을 맞추는 것은 최대한 피하도록 하고, 만약 눈이 마주쳤다면 눈을 천천히 깜빡이도록 해. 고양이들의 세계에서는, 상대방의 눈을 바라보는 것은 싸우고 싶다는 의미로 통하거든.	겁많은 고양이	https://www.famtimes.co.kr/news/articleView.html?idxno=502168	2021/01/05	0	2022-10-06 22:03:32	2022-10-06 23:25:05
BK22015214	17	질문자	아, 그러고 보니 내가 친구네 고양이가 너무 귀여워서 넋을 놓고 계속 바라보고 있었거든. 어쩌면 그거 때문에 이 고양이가 내 의도를 오해한 걸지도 모르겠어. 싸우자는 뜻으로 받아들였을지도 모르고 말이야.				0	2022-10-06 22:03:32	2022-10-06 23:25:05
BK22015214	18	전문가	그럴지도 몰라. 우리들이야 고양이가 예뻐서 본 거지만, 고양이는 우리가 왜 자기들을 바라보는지 의도를 파악할 수가 없잖아. 어쩌면 그래서 널 무서워했던 걸지도 몰라.				0	2022-10-06 22:03:32	2022-10-06 23:25:05
BK22015214	19	질문자	그러게 말이야, 혹시라도 친구 집에 다시 놀러가게 되면, 그때는 아무리 고양이가 예쁘더라도 뚫어지게 바라보는 행동은 삼가해야겠어. 아무튼 좋은 정보를 알려줘서 정말 고마워! 조금 더 이야기를 나누고 싶긴 하지만, 난 아쉽게도 오늘 마감인 과제가 있어서 먼저 들어가 봐야 할 거 같아.				0	2022-10-06 22:03:32	2022-10-06 23:25:05
BK22015214	20	전문가	그렇구나, 그러면 과제 마무리 잘 하고, 다음에 다시 또 이야기 나누자.				0	2022-10-06 22:03:32	2022-10-06 23:25:05
