id	utterance_id	role	text	search_query	search_URL	reference_date	terminate	regDate	updDate
BK22008045	1	질문자	제가 강아지들이 걸리는 슬개골 탈구라는 질환이 궁금해서 그런데 알려주실 수 있을까요?				0	2022-09-10 00:55:03	2022-09-10 00:55:03
BK22008045	2	전문가	네, 물론이죠. 슬개골 탈구는 대퇴골 활차구의 깊이가 바뀐다거나 낮기 때문에 슬개골이 제대로 고정되지 않고 빠지는 증상을 말해요.	슬개골탈구	https://www.jeonmae.co.kr/news/articleView.html?idxno=910311	2022/08/22	0	2022-09-10 00:55:03	2022-09-26 10:51:46
BK22008045	3	질문자	아이고, 탈구라길래 정말 자리에서 뼈가 이탈되는 건가 했는데 맞군요. 그런데 이런 증상이 발생하는 이유는 뭔가요?				0	2022-09-10 00:55:03	2022-09-10 00:55:03
BK22008045	4	전문가	다양한 이유가 있는데 우선 선천적으로 다리뼈 모양이 변형되어 발생하는 경우가 있어요. 또 사고라든지 과체중과 같은 후천적인 원인으로 나타나는 경우도 있고요.	슬개골탈구 다리뼈 변형	https://mdtoday.co.kr/news/view/1065602022251141	2022/07/20	0	2022-09-10 00:55:03	2022-09-10 00:55:03
BK22008045	5	질문자	앗, 선천적이라고 말씀하시니 생각이 난 건데 제 친구가 제가 키우게 된 강아지 품종을 보더니 슬개골 탈구가 나타날 수 있는 품종이라고 조심하라고 했거든요. 혹시 슬개골 탈구가 잘 발생하는 견종이 따로 있는 건가요?				0	2022-09-10 00:55:03	2022-09-10 00:55:03
BK22008045	6	전문가	네, 맞아요. 말티즈나, 요크셔테리어, 푸들, 비숑, 치와와, 포메라니언과 같은 품종들에서 나타나기 쉽거든요.	슬개골탈구 품종	http://www.daejonilbo.com/news/articleView.html?idxno=1431616	2020/07/20	0	2022-09-10 00:55:03	2022-09-10 00:55:03
BK22008045	7	질문자	아이고, 제가 키우게 된 강아지는 비숑이거든요. 사실 제가 키우고 싶어서 키우는 건 아니고 친척분이 떠밀듯이 주고 간 아이라 정보를 너무 몰랐네요. 그런데 슬개골 탈구가 발생하면 어떻게 알 수 있을까요?				0	2022-09-10 00:55:03	2022-09-10 00:55:03
BK22008045	8	전문가	보통 뒷다리 한쪽을 들고 절름거린다거나 강아지가 걷는 모습을 뒤에서 봤을 때 O자형이라면 의심해보셔야 해요. 또 강아지를 들어 올릴 때 딱딱 거리는 소리가 날 수도 있고요.	슬개골탈구 깽깽이걸음	http://www.daejonilbo.com/news/articleView.html?idxno=1431616	2020/07/20	0	2022-09-10 00:55:03	2022-09-23 19:22:29
BK22008045	9	질문자	음, 말씀해주신 사항들을 잘 기억해두고 항상 잘 관찰해봐야겠어요. 그러면 슬개골 탈구는 어떻게 치료하나요?				0	2022-09-10 00:55:03	2022-09-10 00:55:03
BK22008045	10	전문가	슬개골 탈구는 일반적으로 4단계로 구분하는데 1단계는 보통 수술을 하지 않지만 2단계부터는 나이나 임상증상 발현 여부를 따져보고 수술을 하는 경우도 있어요.	슬개골탈구 2단계 수술	https://sports.khan.co.kr/bizlife/sk_index.html?art_id=201705161747004&sec_id=561801&pt=nv	2017/05/18	0	2022-09-10 00:55:03	2022-09-23 19:22:29
BK22008045	11	질문자	그 작은 아이들이 수술할걸 생각하면 마음이 아프네요. 보통 수술방법은 어떻게 되나요?				0	2022-09-10 00:55:03	2022-09-10 00:55:03
BK22008045	12	전문가	활차구성형술, 경골조면변위술, 대퇴직근이동술, 근막겹침술, 내측관절낭이완술과 같은 다양한 수술법을 종합적으로 이용해 수술해요.	슬개골탈구 수술법	https://sports.khan.co.kr/bizlife/sk_index.html?art_id=201705161747004&sec_id=561801&pt=nv	2017/05/18	0	2022-09-10 00:55:03	2022-09-23 19:22:29
BK22008045	13	질문자	여러 가지의 수술법을 적용해 수술하는군요. 그럼 강아지들도 사람과 같이 재활훈련을 해야 하나요?				0	2022-09-10 00:55:03	2022-09-10 00:55:03
BK22008045	14	전문가	네, 맞아요. 레이저 치료라든지 신경근 전기자극 치료, 수중 러닝머신, 운동재활치료 등을 통해 통증과 염증을 잠재우면서 기능을 정상적으로 회복할 수 있도록 해줘야 해요.	슬개골탈구 신경근전기자극치료	http://www.siminilbo.co.kr/news/articleView.html?idxno=626293	2019/05/04	0	2022-09-10 00:55:03	2022-09-10 00:55:03
BK22008045	15	질문자	아팠던 만큼 많은 정성이 필요하네요. 운동재활치료라면 산책하는 것도 슬개골 탈구 수술 후에 좋을 것 같은데 맞나요?				0	2022-09-10 00:55:03	2022-09-10 00:55:03
BK22008045	16	전문가	네, 다만 30분 이상 산책하는 것은 좋지 않아요. 과도하게 움직이면 오히려 악역향을 끼칠 수 있거든요.	슬개골탈구 30분 산책	https://www.jeonmae.co.kr/news/articleView.html?idxno=910311	2022/08/22	0	2022-09-10 00:55:03	2022-09-10 00:55:03
BK22008045	17	질문자	생각보다 짧은 시간이니 신경 써야겠네요. 휴, 제가 잘 돌봐줄 수 있을지 정말 걱정이 많네요.				0	2022-09-10 00:55:03	2022-09-10 00:55:03
BK22008045	18	전문가	저한테 이렇게 꼼꼼하게 물어보시는 걸 보면 잘 돌보실 수 있을 거예요.				0	2022-09-10 00:55:03	2022-09-10 00:55:03
BK22008045	19	질문자	위로 정말 감사해요. 오늘 덕분에 한시름 놓았어요. 제가 질문이 많았는데 친절하게 알려주셔서 정말 감사해요.				0	2022-09-10 00:55:03	2022-09-10 00:55:03
BK22008045	20	전문가	도움이 됐다니 정말 다행이네요. 혹시 또 궁금한 게 있으시면 메시지 하세요.				1	2022-09-10 00:55:03	2022-09-26 10:51:46
