id	utterance_id	role	text	search_query	search_URL	reference_date	terminate	regDate	updDate
BK22007869	1	질문자	저 산후우울증에 걸린 걸까요? 하루 종일 머리도 아프고 기분도 우울해요.				0	2022-09-08 14:44:48	2022-09-08 14:44:48
BK22007869	2	전문가	아기 돌보기 많이 힘들죠? 많이 피곤해 보이는데 어젯밤에 잠은 좀 잤어요?				0	2022-09-08 14:44:48	2022-09-08 14:44:48
BK22007869	3	질문자	아니요, 요즘 밤마다 아기가 자지러지게 울어서 거의 일주일째 잠을 제대로 못 자고 있어요. 좀 찾아보니 영아산통과 비슷한 것 같은데 영아산통의 정확한 뜻이 뭐예요? 혹시 질병인가요?				0	2022-09-08 14:44:48	2022-09-08 14:44:48
BK22007869	4	전문가	영아산통은 생후 100일이 되지 않은 신생아에게 일시적으로 생기는 배앓이 증상이에요. 만약 밤에 잠자던 아기가 깨서 많이 울고 보챈다면 영아산통을 의심해 볼 수 있어요. 의학적으로 분류된 정식 질환은 아니고 정확한 원인도 아직 밝혀지지 않은 상태예요.	영아산통	http://www.sisunnews.co.kr/news/articleView.html?idxno=156780	2022/01/27	0	2022-09-08 14:44:48	2022-09-21 11:07:55
BK22007869	5	질문자	밤에 자다 깨서 울고 보채는 증상이 저희 아기랑 비슷해요. 그런데 아기의 울음에는 정말 다양한 이유가 있잖아요. 영아산통인지 아닌지 확인할 좀 더 명확한 방법은 없나요?				0	2022-09-08 14:44:48	2022-09-21 11:07:55
BK22007869	6	전문가	서울대학교병원 의학정보에 따르면 배앓이가 원인인 것으로 짐작되는 아기의 울음과 보챔이 하루에 3시간, 최소 일주일간 세 번 이상 나타날 때 영아산통이라고 불러요.	영아산통 정의	http://www.babytimes.co.kr/news/articleView.html?idxno=29718	2019/09/04	0	2022-09-08 14:44:48	2022-09-08 14:44:48
BK22007869	7	질문자	우는 시간은 그 정도 되는데 배앓이 때문에 우는 건지는 잘 모르겠어요. 영아산통일 때 아기가 보이는 특별한 행동이 있나요?				0	2022-09-08 14:44:48	2022-09-08 14:44:48
BK22007869	8	전문가	네, 제가 몇 가지를 알려 드릴게요. 양손을 꽉 움켜쥐고 양다리를 배 위로 끌어당기는 모습을 보이는 경우, 다리를 구부렸다가 쫙 펴는 행동을 반복하는 경우, 얼굴이 빨개질 정도로 한껏 배에 힘을 주면서 방귀를 뀌거나 대변이나 소변을 보는 경우, 쉬지 않고 몇 분 혹은 몇 시간을 우는 경우에 영아산통을 의심해 볼 수 있어요.	영아산통 증상	https://www.ibabynews.com/news/articleView.html?idxno=65042	2018/05/17	0	2022-09-08 14:44:48	2022-09-08 14:44:48
BK22007869	9	질문자	그렇군요, 안고 달래느라 아기가 어떤 행동을 하는지는 유심히 보지 못했는데 오늘부터는 잘 관찰해 봐야겠어요. 좀 전에 정확한 원인은 밝혀지지 않았다고 하셨지만 그래도 아기가 배앓이를 하는 데는 뭔가 이유가 있지 않을까요?				0	2022-09-08 14:44:48	2022-09-08 14:44:48
BK22007869	10	전문가	네, 아기가 영아산통 증상을 보이는 것은 위와 장의 미성숙으로 인해 유단백 성분이 복부 팽만감 혹은 통증을 일으킬 때 혹은 배가 지나치게 고프거나 부를 때, 심한 변비가 있을 때, 스트레스를 받았을 때 등 여러 가지 까닭이 있어요.	영아산통 원인	http://www.sisunnews.co.kr/news/articleView.html?idxno=156780	2022/01/27	0	2022-09-08 14:44:48	2022-09-08 14:44:48
BK22007869	11	질문자	하긴 어른도 다양한 이유로 배앓이를 하니 아기도 비슷한가 보네요. 아기가 배가 아파서 울면 어떻게 해줘야 도움이 될까요?				0	2022-09-08 14:44:48	2022-09-21 11:07:55
BK22007869	12	전문가	아기가 배앓이 때문에 우는 것으로 생각된다면 따뜻한 손을 이용해 2~3회 가볍게 배를 문질러 주세요. 그리고 아기의 가슴과 어깨 부분을 마주 닿게 하고 안아 주는 것, 무릎을 구부린 채로 안아서 마치 그네를 태우는 것처럼 느리게 흔들어 주는 것도 효과가 있고요.	영아산통 아기 돌보는 법	http://www.sisunnews.co.kr/news/articleView.html?idxno=156780	2022/01/27	0	2022-09-08 14:44:48	2022-09-08 14:44:48
BK22007869	13	질문자	꼭 기억했다가 따라해 볼게요. 그런데 혹시 영아산통이 생기지 않도록 방지할 수 있는 방법은 없나요?				0	2022-09-08 14:44:48	2022-09-08 14:44:48
BK22007869	14	전문가	수유하는 과정에서 함께 들이마시는 공기가 영아산통 증상의 원인이 될 수도 있기 때문에 아기가 흡입한 공기가 빠져나갈 수 있도록 수유를 한 다음 트림을 충분히 시키면 도움이 돼요.	영아산통 관리법	http://www.babytimes.co.kr/news/articleView.html?idxno=29718	2019/09/04	0	2022-09-08 14:44:48	2022-09-08 14:44:48
BK22007869	15	질문자	그렇군요, 지금 모유와 분유를 혼합 수유하고 있는데 제가 먹는 음식에 따라 아기에게 배앓이가 생길 수도 있을까요?				0	2022-09-08 14:44:48	2022-09-08 14:44:48
BK22007869	16	전문가	네, 모유수유를 하고 있다면 엄마가 짜고 매운 자극적인 음식을 먹거나 유제품, 계란, 밀가루, 견과류 등을 섭취했을 때 아기의 소화기 계통에 이상이 생길 수 있기 때문에 조심해야 해요.	모유수유 영아산통 방지법	https://www.ibabynews.com/news/articleView.html?idxno=65042	2018/05/17	0	2022-09-08 14:44:48	2022-09-08 14:44:48
BK22007869	17	질문자	유제품이나 계란을 정말 많이 먹었는데 앞으로 조심해야겠어요. 마지막으로 분유를 먹일 때 신경써야 할 부분이 있으면 알려 주세요.				0	2022-09-08 14:44:48	2022-09-08 14:44:48
BK22007869	18	전문가	조유하면서 거품이 생긴 분유를 아기에게 그대로 먹이면 거품의 공기 때문에 배앓이 증상이 생길 수 있어요. 그러므로 아기에게 수유하기 전에 거품이 가라앉았는지 확인해 주세요.	분유수유 영아산통 방지법	http://www.babytimes.co.kr/news/articleView.html?idxno=29718	2019/09/04	0	2022-09-08 14:44:48	2022-09-08 14:44:48
BK22007869	19	질문자	네, 오늘부터 바로 실천할게요. 이렇게 이야기 나누니 기분도 좋아지도 컨디션도 나아졌어요. 유용한 팁 많이 알려 주셔서 정말 감사해요.				0	2022-09-08 14:44:48	2022-09-08 14:44:48
BK22007869	20	전문가	도움이 되었다니 저도 기분 좋네요. 궁금한 게 있을 때는 언제든 물어보세요.				1	2022-09-08 14:44:48	2022-09-21 11:07:55
