id	utterance_id	role	text	search_query	search_URL	reference_date	terminate	regDate	updDate
BK22008011	1	질문자	저희 가족에게 새로운 가족이 생길 것 같아요. 친구네 개가 여러 마리의 새끼를 낳아서 제가 한 마리 입양하기로 했거든요. 저도 그럴 계획이지만 요즘은 강아지를 키우는 사람이 정말 많은 것 같아요.				0	2022-09-09 19:32:38	2022-09-09 19:32:38
BK22008011	2	전문가	현재 우리나라에 반려동물을 키우는 사람의 수가 일천만 명이 넘는다고 해요. 수많은 강아지가 반려견이란 이름으로 일상의 일부분이 되어 삶을 함께 하고 있죠.	우리나라 애견인구	http://www.kyeonggi.com/1164978	2016/04/21	0	2022-09-09 19:32:38	2022-09-09 19:32:38
BK22008011	3	질문자	반려견과 함께 하는 사람들이 정말 많네요. 저도 다음 주면 집에 반려견을 데리고 와야 하는데 강아지를 키워본 적이 없어서 어떻게 준비를 해야 할지 걱정이에요. 강아지를 입양하기 전 어떤 준비물이 필요한지 알려주실 수 있을까요?				0	2022-09-09 19:32:38	2022-09-09 19:32:38
BK22008011	4	전문가	사료, 식기, 간식, 장난감, 용변패드, 샴푸, 빗, 영양제, 집, 목줄, 인식표 등이 필요해요. 아기를 한 명 키울 때와 비슷한 물품들이죠. 다양하고 많은 용품들은 인터넷에서 찾아보시거나 대형 동물 용품점에서 구매하 실 수 있어요.	강아지 입양 준비물	https://news.imaeil.com/page/view/2020110214570243390	2020/11/02	0	2022-09-09 19:32:38	2022-09-22 10:34:34
BK22008011	5	질문자	한 생명을 책임지고 키우는 건 정말 책임감이 뒤따르는 일이죠. 강아지를 집에 데리고 오면 질병을 예방 할 수 있게 예방 접종부터 시키려고 하는데요. 강아지 예방 접종 시기는 태어나고 얼마 후가 적당할까요?				0	2022-09-09 19:32:38	2022-09-09 19:32:38
BK22008011	6	전문가	강아지가 예방접종을 마치려면 총 16주의 시간이 들어요. 강아지가 태어나고 6주 후부터 1차 예방접종을 시작하신 다음 8주째에 2차를 맞아야 해요. 3차는 10주째에 맞고 4차는 12주째에 맞은 다음 5차는 14주 그리고 마지막 6차 접종을 16주째에 하고 나면 끝이 나요. 이 때 꼭 명심하셔야 할 게 있는데 4차 접종을 마치기 전에 야외로 산책을 하거나 바깥에 외출을 하면 안된다는 것이죠. 아직 항체가 만들어지지 않아 질병에 걸릴 가능성이 높기 때문인데 다른 강아지와 접촉하는 것도 금지에요.	강아지 예방접종 시기	https://www.sisunnews.co.kr/news/articleView.html?idxno=132845	2020/11/03	0	2022-09-09 19:32:38	2022-09-09 19:32:38
BK22008011	7	질문자	예방 접종이 한 번으로 끝나는 게 아니고 여러 번에 걸쳐서 해야 하는군요. 아, 그리고 강아지는 잡식 동물이라고 들었는데 맞나요? 혹시 강아지에게 주면 안되는 음식은 어떤 게 있을까요?				0	2022-09-09 19:32:38	2022-09-09 19:32:38
BK22008011	8	전문가	강아지는 육식동물에서 진화를 거쳤는데 현재는 잡식 동물이 맞아요. 강아지도 사람처럼 5대 영양소를 균형 있게 섭취하는 것이 중요하죠. 그리고 대부분의 보호자들이 잘 알고 있는 금지 음식이 몇 개 있어요. 초콜릿, 커피, 우유, 파, 양파, 마늘은 강아지에게 금지에요. 또한 포도, 아보카도, 견과류도 강아지에게는 건강하지 못한 음식이에요.	강아지 먹으면 안되는 것	http://www.dailypop.kr/news/articleView.html?idxno=52038	2021/06/29	0	2022-09-09 19:32:38	2022-09-09 19:32:38
BK22008011	9	질문자	강아지가 섭취하면 안되는 음식이 꽤 있군요. 사람한테 좋다고 해서 무조건 강아지에게도 좋은건 아닌가봐요. 그렇다면 강아지가 섭취하면 건강에 좋을만한 음식에 대해서도 알려주실 수 있을까요?				0	2022-09-09 19:32:38	2022-09-09 19:32:38
BK22008011	10	전문가	양배추가 우리 위 건강에 좋다고 유명한 식품인데 반려견의 위 건강에도 유익해요. 그리고 오이는 수분이 많고 항산화 물질과 콜레스테롤을 감소시키는 성분이 들어있죠. 게다가 오이는 다량의 비타민이 들어있어 강아지의 면역력을 강화시키고 모질을 좋게 하며 당뇨병과 관절통을 방지하는데 효과가 있어요. 당근이 함유한 카로틴 성분은 항산화 물질이어서 반려견의 면역력을 향상시키고요. 생선도 강아지에게 훌륭한 식품인데 그 이유는 생선은 많은 단백질과 칼슘, 타우린, DHA 등이 들어있어서 건강에 큰 도움을 주기 때문이에요.	강아지 건강에 좋은 음식	https://www.hidoc.co.kr/healthstory/news/C0000658225	2021/12/24	0	2022-09-09 19:32:38	2022-09-22 10:34:34
BK22008011	11	질문자	지금 해주신 조언을 바탕으로 강아지에게 건강에 좋은 식품을 많이 챙겨줘야겠어요. 그런데 제가 듣기로는 강아지도 사람처럼 감정이 다양하다고 들었는데 맞는지 모르겠네요. 꼬리를 열심히 흔들면 강아지가 기분이 좋은 거 맞죠?				0	2022-09-09 19:32:38	2022-09-09 22:11:02
BK22008011	12	전문가	강아지는 꼬리를 통해서 다양한 감정을 표현하는데 꼬리의 모양, 방향, 들어가는 힘 등에 따라서 어떤 감정인지 알 수 있어요. 물어보신대로 반려견이 꼬리를 힘있게 흔든다면 기분이 좋고 들뜬 상태죠. 꼬리가 힘이 들어가 있고 위로 솟아 있거나 말려 있다면 강아지가 경계를 하고 있다는 뜻이고요. 꼬리를 높게 흔들면서 힘을 주고 있다면 공격을 할 확률이 높아요. 이럴 때 만약에 개가 으르렁거린다면 접근하지 말라는 경고 메세지이므로 그 자리를 벗어나시는 게 좋아요.	강아지와의 소통	https://www.hidoc.co.kr/healthstory/news/C0000698959	2022/05/18	0	2022-09-09 19:32:38	2022-09-22 10:34:34
BK22008011	13	질문자	꼬리로 마음을 표현한다는 게 귀여운면서도 참 신기하네요. 그리고 친구에게 듣기로는 강아지에게도 양치질을 시킨다고 하던데 강아지에게도 양치질이 필요한가요? 반려견의 구강 관리는 어떻게 해줘야 할지 알려주실 수 있을까요?				0	2022-09-09 22:11:02	2022-09-16 14:26:01
BK22008011	14	전문가	반려견은 사람보다 5배나 더 빠르게 플라크와 치석이 생길 수 있어서 올바른 양치 습관을 통해 구강 관리를 꾸준히 해주는 게 좋아요. 구강 관리만 잘 해줘도 반려견의 수명이 20~30% 가 늘어나기 때문에 반려견의 구강관리는 중요하지만 꾸준히 관리하는 게 쉽지는 않죠. 반려견의 이빨을 닦아 줄 때 한 번에 닦으려고 하면 양치에 대해 거부감이 들 수 있으니 하루씩 부위를 나누어서 닦으면 좋아요. 먼저 구강 내 끼어있는 이물질을 제거 하고 1일차에는 치아 전면 부분, 2일차에는 오른쪽, 3일차에는 왼쪽 등 나누어 닦으면 양치에 대한 거부감을 줄이는 데 효과가 있어요. 특히 반려동물은 양치 후에 사람처럼 입 속을 헹궈낼 수 없으니 반려동물 전용 치약이 필요해요.	반려견 양치	https://newsis.com/view/?id=NISX20220323_0001805017&cID=13001&pID=13000	2022/03/24	0	2022-09-09 22:11:02	2022-09-16 14:26:01
BK22008011	15	질문자	강아지에게 양치질을 꾸준히 시켜줘야겠어요. 아, 그리고 강아지의 배변 훈련에 대해서 걱정이 좀 돼요. 언제부터 강아지에게 배변 훈련을 시키고 어떻게 시켜야 하는지에 대해서도 알려주실 수 있을까요?				0	2022-09-09 22:11:02	2022-09-09 22:11:02
BK22008011	16	전문가	강아지의 종류와 크기마다 조금씩 다르기는 하지만 보통 생후 14주 후에 배변 훈련을 시작하는 게 적절해요. 그 전에는 괄약근과 대장 근육이 잘 형성되지 않아서 배변을 참는 데 어려움이 있을 수 있어요. 그렇지만 14주가 지나고 나면 어느정도 대소변을 가리는 데 연습이 가능한 상황이 되거든요. 배변 패드에 대소변을 해결한 강아지에게 칭찬을 하거나 간식을 주는 것도 잊지 마세요. 그리고 설령 강아지가 배변을 똑바로 해내지 못한다고 해도 혼내시면 안돼요.	강아지 배변 훈련	https://www.sisunnews.co.kr/news/articleView.html?idxno=122585	2020/03/24	0	2022-09-09 22:11:02	2022-09-09 22:11:02
BK22008011	17	질문자	인내심을 가지고 강아지를 응원해주는 게 배변 훈련의 핵심이군요. 설명을 듣고 나니 강아지를 돌보는 것에 대한 걱정이 많이 없어졌어요.				0	2022-09-09 22:11:02	2022-09-09 22:11:02
BK22008011	18	전문가	그렇다면 다행이네요. 강아지를 건강하게 키우실 수 있기를 바랄게요.				0	2022-09-09 22:11:02	2022-09-09 22:11:02
BK22008011	19	질문자	반려견을 돌보는 방법에 대해서 이렇게 자세하게 설명해주셔서 건강하게 잘 돌볼 수 있을 것 같아요.				0	2022-09-09 22:11:02	2022-09-09 22:11:02
BK22008011	20	전문가	귀엽고 건강한 반려견과 즐거운 시간 보내시기를 바랄게요.				1	2022-09-09 22:11:02	2022-09-22 10:34:34
