id	utterance_id	role	text	search_query	search_URL	reference_date	terminate	regDate	updDate
BK22015146	1	질문자	날씨가 추워져서 그런가 내 동생이 수족냉증으로 고생하더라. 근데 수족냉증은 원인이 뭐야?				0	2022-10-07 14:30:46	2022-10-14 13:13:45
BK22015146	2	전문가	수족냉증은 원인이 다양해. 혈액순환장애가 가장 흔한 원인이지만, 말초신경 질환, 갑상선 질환, 류머티즘성 질환, 경추와 요추의 협착증이나 디스크 등이 수족냉증을 일으키는 원인 질환일 수도 있어.	수족냉증 원인	http://www.knnews.co.kr/news/articleView.php?idxno=1370544	2022/02/21	0	2022-10-07 14:30:46	2022-10-07 14:30:46
BK22015146	3	질문자	생각보다 너무 다양한데. 내 동생이라면 그나마 디스크쪽이 의심되는데, 그럼 반드시 mri검사를 해야 정확한 원인을 알 수 있는 거야?				0	2022-10-07 14:30:46	2022-10-07 14:30:46
BK22015146	4	전문가	전문가에게 진료를 받고 정말 의심될 경우에만 고가의 검사를 받으면 돼. Ct나 mri 같은 것 말이야. 디스크와 협착증은 비대칭적인 증상 발현이 많고, 경추와 요추 신경의 피부분절 분포 양상에 따라 증상이 발현하거든.	디스크 수족냉증	http://www.knnews.co.kr/news/articleView.php?idxno=1370544	2022/02/21	0	2022-10-07 14:30:46	2022-10-07 14:30:46
BK22015146	5	질문자	그럼 일단 동생을 병원에 데려가서 진료부터 받고 검사를 하든가 해야겠네. 수족냉증은 여자한테 많이 나타난다던데, 그 이유는 뭐야? 내 동생도 여자거든.				0	2022-10-07 14:30:46	2022-10-13 17:50:52
BK22015146	6	전문가	생리통, 생리불순이 있으면 여성호르몬 분비에 문제가 있거나 생리 때문에 혈액이 부족할 수 있기 때문이야. 혈액순환이 잘 되지 않으니까 신체 말단의 체온이 떨어지는 거지.	수족냉증 여자	https://health.chosun.com/site/data/html_dir/2022/09/06/2022090601808.html	2022/09/06	0	2022-10-07 14:30:46	2022-10-07 14:30:46
BK22015146	7	질문자	동생이 생리통이 심한 편이긴 해. 수족냉증을 좀 완화하는 방법은 없을까?				0	2022-10-07 14:30:46	2022-10-07 14:30:46
BK22015146	8	전문가	있지. 따뜻한 물론 족욕을 하거나 반식욕을 하면 좋아. 또, 근력 운동과 유산소 운동을 꾸준히 해서 기초대사량을 높여 체온을 올리는 방법도 있고.	수족냉증 완화	https://health.chosun.com/site/data/html_dir/2022/09/06/2022090601808.html	2022/09/06	0	2022-10-07 14:30:46	2022-10-07 14:30:46
BK22015146	9	질문자	운동이 수족냉증에 도움이 될 줄은 몰랐어. 그런데 우리 엄마도 수족냉증이 있는 편이거든. 수족냉증은 흔한 편이야?				0	2022-10-07 14:30:46	2022-10-07 14:30:46
BK22015146	10	전문가	흔한 편이지, 우리나라의 12%인구가 수족냉증을 호소할 정도야. 참고로 수족냉증의 정의는 그다지 춥지 않은 온도에서 손이나 발이 지나치게 차갑다고 느끼는 증상이야.	수족냉증 인구	https://www.hidoc.co.kr/healthstory/news/C0000651862	2021/11/15	0	2022-10-07 14:30:46	2022-10-07 14:30:46
BK22015146	11	질문자	12%라면 정말 많네. 다행히 엄마나 동생이나 아주 심한 편은 아니지만, 혹시 수족냉증이 아니라 다른 질병일 가능성도 있을까?				0	2022-10-07 14:30:46	2022-10-07 14:30:46
BK22015146	12	전문가	만약 단순이 손발이 차가운 정도가 아니라 손끝과 발끝의 색깔이 변하거나 감각 이상, 통증이 느껴지면 레이노 증후군을 의심해야 해.	수족냉증 질병	http://www.gimhaenews.co.kr/news/articleView.html?idxno=44696	2022/01/15	0	2022-10-07 14:30:46	2022-10-07 14:30:46
BK22015146	13	질문자	손발의 색깔이 변한다니, 듣기만 해도 무섭다. 다행히 그렇지는 않은데, 만약 레이노 증후군인 줄 모르고 시간이 지나면 어떻게 돼?				0	2022-10-07 14:30:46	2022-10-07 14:30:46
BK22015146	14	전문가	만약 증상이 심해진다면 만성적인 감염이 손톱 발톱 주변에 생기거나 또는 손끝에 궤양이 생길 수도 있어.	레이노 증후군	http://economychosun.com/client/news/view.php?boardName=C22&t_num=13612094	2022/01/12	0	2022-10-07 14:30:46	2022-10-07 14:30:46
BK22015146	15	질문자	감염이나 궤양이라, 정말 무섭다. 레이노 증후군은 어떻게 치료해?				0	2022-10-07 14:30:46	2022-10-07 14:30:46
BK22015146	16	전문가	칼슘채널차단제, 프로스타글란딘 등의 약물로 혈관을 확장해줄 수 있어. 만약 효과가 없으면 수술로 혈관을 수축시키는 교감신경을 절제할 수도 있고.	레이노 증후군 치료	http://economychosun.com/client/news/view.php?boardName=C22&t_num=13612094	2022/01/12	0	2022-10-07 14:30:46	2022-10-07 14:30:46
BK22015146	17	질문자	교감신경을 절제하다니 생각보다 큰 수술일 것 같아. 엄마랑 동생한테 차 한잔 타줄까 하는데, 수족냉증에 도움이 되는 건 없을까?				0	2022-10-07 14:30:46	2022-10-13 17:50:52
BK22015146	18	전문가	좋은 생각이야! 생강차가 수족냉증, 배가 차가워져서 발생하는 소화불량, 생리통 완화에 좋아. 생강이 신진대사를 활성화하고, 생강에 있는 진저롤 성분이 혈액순환 촉진을 통해 체온을 높여주거든.	생강차 수족냉증	https://www.asiatoday.co.kr/view.php?key=20220930001516051	2022/10/04	0	2022-10-07 14:30:46	2022-10-14 13:13:45
BK22015146	19	질문자	소화불량에도 좋다니 효과가 다양하네, 엄마가 소화기관이 좀 안 좋은데 한 번 타줘야겠다. 덕분에 오늘 많이 배웠지만, 나 지금은 좀 가봐야하는데. 나중에 다시 얘기하자.				0	2022-10-07 14:30:46	2022-10-13 17:50:52
BK22015146	20	전문가	그래, 동생의 수족냉증이 얼른 완화되었으면 좋겠네. 조심히 가고 나중에 또 봐!				1	2022-10-07 14:30:46	2022-10-14 13:13:45
