id	utterance_id	role	text	search_query	search_URL	reference_date	terminate	regDate	updDate
BK22002619	1	질문자	전세금이 올라서 이사를 해야 하는데 제일 먼저 뭘 해야 할 지 모르겠어요.				0	2022-08-02 12:18:08	2022-08-02 13:59:39
BK22002619	2	전문가	이사할 땐 챙겨야 할 게 너무 많죠. 확인해야 할 것들을 알려드릴까요?				0	2022-08-02 12:18:08	2022-08-02 13:59:39
BK22002619	3	질문자	네, 이사할 때 어떤 걸 준비해야 하는지 알려주시면 좋겠네요.				0	2022-08-02 12:18:08	2022-08-02 13:59:39
BK22002619	4	전문가	가장 먼저 택배나 우편물을 위해서 이사할 집으로 우편물 주소를 바꿔 놓고, 신용카드나 체크카드의 주소를 수정하셔야 해요.	이사 체크리스트	http://www.dailypop.kr/news/articleView.html?idxno=48317	2020/12/28	0	2022-08-02 12:18:08	2022-08-02 13:59:39
BK22002619	5	질문자	우편물 주소를 안바꾸면 우편을 찾아 예전에 살던 집으로 가야하는 경우도 있겠군요. 그리고 도시가스 비용도 미리 정산해야 하죠?				0	2022-08-02 12:18:08	2022-08-02 13:59:39
BK22002619	6	전문가	도시가스를 사용한다면 도시가스사 고객센터에 전화해서 가스 막음 조치를 신청하고, 요금 정산을 받으면 돼요. 만약 LP가스를 사용한다면 가스판매점에 연락하면 되고요.	이사 도시가스 정산	http://www.gnnews.co.kr/news/articleView.html?idxno=472567	2021/04/08	0	2022-08-02 12:18:08	2022-08-02 13:59:39
BK22002619	7	질문자	가스 막음 조치는 뭔가요? 이사날에 바쁠 것 같은데 도시가스 직원이 오셔서 해야하면 더 정신이 없을 것 같아서요. 꼭 해야 하나요?				0	2022-08-02 12:18:08	2022-08-02 13:59:39
BK22002619	8	전문가	가스 막음 조치는 가스레인지 같이 가스를 사용하는 기계를 철거하거나 설치할 때 배관이나 밸브를 막아서 가스 누출을 방지하는 조치인데, 최근 5년동안 가스 막음 조치를 제대로 하지 않아서 발생한 가스사고만 54건이에요. 가스 막음 조치는 안전을 위해 하는 게 좋아요.	이사 도시가스 막음 반드시	http://www.datasom.co.kr/news/articleView.html?idxno=121598	2022/03/15	0	2022-08-02 12:18:08	2022-08-02 13:59:39
BK22002619	9	질문자	가스 막음 조치를 안 해서 사고가 그렇게 많이 난다니, 귀찮아도 반드시 해야겠네요. 이사 당일에 전화해서 가스 막음 해달라고 말씀 드리면 되나요?				0	2022-08-02 12:18:08	2022-08-02 13:59:39
BK22002619	10	전문가	이사하기 3일 전까지 가스 시설 막음 조치를 해달라고 신청하셔야 해요. 아까 정산과 마찬가지로 도시가스를 이용하신다면 지역관리소에, LP가스를 이용하신다면 가스판매점에 연락 하시면 됩니다.	가스막음조치 방법	http://www.joongboo.com/news/articleView.html?idxno=363534623	2022/04/06	0	2022-08-02 12:18:08	2022-08-02 13:59:39
BK22002619	11	질문자	늦지 않게 미리 신청해야겠네요. 이삿짐 센터는 가격이 얼마정도 하나요?				0	2022-08-02 12:18:08	2022-08-02 13:59:39
BK22002619	12	전문가	일반이사나 포장이사를 하신다면 가격은 천차만별이에요. 인부가 몇 명인지, 이사하는 곳 과의 거리나 짐의 양, 층수나 엘리베이터 사용가능여부, 사다리차 이용여부 등에 따라서 비용이 달라지거든요.	이삿짐 센터	http://www.dailypop.kr/news/articleView.html?idxno=58533	2022/03/17	0	2022-08-02 12:18:08	2022-08-02 13:59:39
BK22002619	13	질문자	제가 직접 알아볼 수 밖에 없겠네요. 쓰던 가구 대부분을 버리고 갈 것 같은데 그냥 집 앞에 내놓으면 되나요?				0	2022-08-02 12:18:08	2022-08-02 13:59:39
BK22002619	14	전문가	대형폐기물 배출방법은 지역마다 다른데 서울시 같은 경우에는 13일에 배출 가이드라인이 최근 통일되어 발표되었어요. 신고필증을 받아서 부착하는 방식에서 접수 시 부여받은 신고번호를 폐기물에 기재하는 방식으로 바뀌었죠.	대형폐기물 배출방법	https://www.sedaily.com/NewsView/264ODMLOS1	2022/04/13	0	2022-08-02 12:18:08	2022-08-02 13:59:39
BK22002619	15	질문자	저는 서울이라서 알려주신 대로 신고번호만 기재하면 되겠어요. 이사하고 나면 전입 신고만 하면 되는거죠?				0	2022-08-02 12:18:08	2022-08-02 13:59:39
BK22002619	16	전문가	전입 신고는 서류상의 거주지를 바꾸는 것으로 이사 당일이나 이사 이후라도 가능한 한 빨리 하는 것이 좋아요. 전입 신고를 하지 않으면 주택임대차보호법의 보호를 받지 못 할 수도 있기 때문에 전입 신고를 하고 확정일자까지 받아야하죠.	이사 후 전입신고	https://www.nbntv.co.kr/news/articleView.html?idxno=312889	2020/03/12	0	2022-08-02 12:18:08	2022-08-02 13:59:39
BK22002619	17	질문자	전입 신고를 하면서 확정일자도 같이 받아야 하는군요. 확정일자는 뭔가요?				0	2022-08-02 12:18:08	2022-08-02 13:59:39
BK22002619	18	전문가	확정일자는 어떤 증서의 작성일로부터 완전한 증거능력을 인정받은 날짜를 뜻하는 거예요.	확정일자	https://ko.wikipedia.org/wiki/%ED%99%95%EC%A0%95%EC%9D%BC%EC%9E%90	2022/02/12	0	2022-08-02 12:18:08	2022-08-02 13:59:39
BK22002619	19	질문자	전입 신고를 하고 그게 증거가 된다고 인정받는 거군요. 이렇게 이사 전후로 필요한 것에 대해 이야기를 들으니 어떤 것 부터 준비해야 할 지 알겠어요. 다음에 또 궁금한 게 있으면 문의드릴게요.				0	2022-08-02 12:18:08	2022-08-02 13:59:39
BK22002619	20	전문가	네, 무사히 이사 마치시길 바라요. 언제든지 궁금한게 있으면 말씀 주세요.				1	2022-08-02 12:18:08	2022-08-02 16:53:18
