id	utterance_id	role	text	search_query	search_URL	reference_date	terminate	regDate	updDate
BK22015561	1	질문자	친구가 블랙프라이데이에 쇼핑 엄청 할 거라고 벼르고 있던데, 블랙프라이데이가 뭐하는 날이에요?				0	2022-10-10 10:06:03	2022-10-10 10:06:03
BK22015561	2	전문가	아, 블랙프라이데이는 미국에서 대규모로 소비가 이뤄지는 날인데, 보통 추수감사절이 지난 후 그다음 금요일에 진행해요. 쇼핑몰 같은 데서 물건 할인율을 파격적인 수치로 적용하고, 소비자들은 그 기회에 평소 사고 싶었던 물건들을 사는 거죠.	블랙프라이데이란	https://www.bbc.com/korean/news-46258853	2018/11/21	0	2022-10-10 10:06:03	2022-10-10 20:52:22
BK22015561	3	질문자	바겐세일의 날 같은 거네요! 근데 왜 블랙이라는 단어를 써요?				0	2022-10-10 10:06:03	2022-10-10 10:06:03
BK22015561	4	전문가	그날이 흑자를 내는 날인데 영어로는 흑자를 블랙 잉크라고 하거든요. 여기서 유래해 블랙이라는 단어를 쓰는 거예요.	블랙 표현의 의미	https://www.bbc.com/korean/news-46258853	2018/11/21	0	2022-10-10 10:06:03	2022-10-10 20:52:22
BK22015561	5	질문자	아하, 영어식 표현을 그대로 쓰는 거군요. 그럼 이때는 무조건 싸게 살 수 있는 거예요?				0	2022-10-10 10:06:03	2022-10-10 10:06:03
BK22015561	6	전문가	이때를 잘 이용하면 다른 때보다 훨씬 싸게 물건을 살 수 있죠. 근데 오히려 더 비싸게 가격을 지불할 수도 있어서 조심해야 해요.	블랙프라이데이 바가지요금 주의	https://www.bbc.com/korean/news-46258853	2018/11/21	0	2022-10-10 10:06:03	2022-10-10 20:52:22
BK22015561	7	질문자	헛, 가격이 바르게 나와있지 않은 곳이 있나 보네요. 근데 가격이 싼지, 비싼지를 어떻게 구분하죠?				0	2022-10-10 10:06:03	2022-10-17 15:27:50
BK22015561	8	전문가	소비자들이 가격 변화를 확인할 수 있는 사이트가 몇 개 있어요. Get.keepa.com, Price Spy 같은 사이트에 들어가서 미국, 유럽 등의 대형 브랜드가 얼마에 제품을 파는지 확인할 수 있죠. 검색해 봐서 블랙프라이데이 때보다 다른 때 가격이 더 싸면 안 사는 게 나아요.	블랙프라이데이 가격 비교 필요	https://www.bbc.com/korean/news-46258853	2018/11/21	0	2022-10-10 10:06:03	2022-10-17 15:27:50
BK22015561	9	질문자	오, 그런 유용한 사이트가 있다니 너무 좋네요. 근데 블랙프라이데이로 구매해도 세금이 안 붙나요?				0	2022-10-10 10:06:03	2022-10-10 10:06:03
BK22015561	10	전문가	아, 원래 자기가 쓸 물품을 해외직구하면 금액이 150달러 이하일 땐 관세나 부가세를 면제해줬고, 합산 좌세를 하는 경우를 따로 뒀었어요. 같은 요일에 동일한 해외 판매자에게 주문을 2번 이상 하거나 해외에서 산 물건들이 같은 날짜에 들어오는 경우였죠. 근데 관세청이 이번에 합산과세의 기준을 없애기로 했어요. 그전까진 소액면세제도를 악용하려고 의도적으로 분할, 면세 통관을 한 게 아니어도 구매한 물건의 입항일이 같다는 이유만으로 과세를 적용받았는데 이젠 완전히 풀린 셈이죠.	해외 물품 구매 관세 규정	https://www.seoul.co.kr/news/newsView.php?id=20221005500084	2022/10/05	0	2022-10-10 10:06:03	2022-10-10 20:52:22
BK22015561	11	질문자	오, 그럼 물건 사기가 한결 편해지겠네요! 근데 워낙 큰 행사라 사기 같은 걸 당하는 사람도 꽤 있을 것 같은데 처리할 수 있는 방법이 있나요?				0	2022-10-10 10:06:03	2022-10-10 16:52:31
BK22015561	12	전문가	만약에 결제를 다 한 상태에서 사기가 의심되거나 연락두절, 미배송, 결제금액 상이 같은 피해를 입었다면 신용카드사에서 제공하는 차지백 서비스를 통해 피해 구제를 받을 수 있어요.	구매 사기 피해 구제법	https://www.ajunews.com/view/20181122152457603	2018/11/22	0	2022-10-10 10:06:03	2022-10-10 10:06:03
BK22015561	13	질문자	차지백 서비스가 어떤 서비슨데요?				0	2022-10-10 10:06:03	2022-10-10 10:06:03
BK22015561	14	전문가	차지백 서비스는 소비자가 사기의심 등의 피해로 불이익을 입었을 때 카드사에 연락해서 승인이 끝난 거래를 취소해달라고 요청하는 거예요.	차지백 서비스란	https://www.ajunews.com/view/20181122152457603	2018/11/22	0	2022-10-10 10:06:03	2022-10-10 10:06:03
BK22015561	15	질문자	와, 그런 서비스가 있다니 좀 안심이 되네요. 그냥 신청하기만 하면 알아서 처리해 주나요?				0	2022-10-10 10:06:03	2022-10-10 10:06:03
BK22015561	16	전문가	그런 건 아니고, 예약 확인서나 이메일 같이 객관적으로 피해를 입증할 수 있는 자료를 제출해야 돈을 다시 돌려받을 가능성이 높아요. 그러니 거래할 때 중요한 정보들을 다 기록해두는 게 좋죠.	구매 과정 정보 기록 중요	https://www.ajunews.com/view/20181122152457603	2018/11/22	0	2022-10-10 10:06:03	2022-10-10 10:06:03
BK22015561	17	질문자	결제 정보나 판매 사이트 목록 같은 것도 좀 캡쳐해 두면 좋겠네요. 사기 걱정만 없다면 너무 좋은 쇼핑 찬스네요.				0	2022-10-10 10:06:03	2022-10-10 10:06:03
BK22015561	18	전문가	크게 세일하는 곳이 많으니 사람들이 물건을 엄청 사긴 하더라고요.				0	2022-10-10 10:06:03	2022-10-10 10:06:03
BK22015561	19	질문자	저도 한번 둘러보면서 살 만한 거 있나 살펴봐야겠어요. 오늘 이야기 나눠서 즐거웠어요, 다음에 또 봬요!				0	2022-10-10 10:06:03	2022-10-10 10:06:03
BK22015561	20	전문가	네, 조심히 들어가요, 궁금이님!				1	2022-10-10 10:06:03	2022-10-17 15:27:50
