id	utterance_id	role	text	search_query	search_URL	reference_date	terminate	regDate	updDate
BK22000270	1	질문자	나 이번에 쓰던 유선 이어폰 수명이 다 되어서 블루투스 이어폰 사보려고.				0	2022-07-20 16:05:41	2022-08-02 12:01:32
BK22000270	2	전문가	블루투스를 이어폰에 연결해서 작동하는 이어폰은 선이 없으니까 유선 이어폰보다 쓰기 편하긴 하지. 어떤 거 살 건데?	블루투스 이어폰	https://ko.wikipedia.org/wiki/%EC%9D%B4%EC%96%B4%ED%8F%B0	2022/02/26	0	2022-07-20 16:05:41	2022-07-21 09:35:54
BK22000270	3	질문자	내가 아이폰을 쓰다 보니까 에어팟을 구매할까 하는데, 써봤어? 이것도 종류가 여러 가지라며.				0	2022-07-20 16:05:41	2022-08-02 12:01:32
BK22000270	4	전문가	2016년에 아이폰 7이랑 애플워치 시리즈 2랑 함께 출시된 에어팟 1세대가 있고, 2019년에 출시된 에어팟 2세대도 있지.	에어팟	https://ko.wikipedia.org/wiki/%EC%97%90%EC%96%B4%ED%8C%9F	2022/02/26	0	2022-07-20 16:05:41	2022-07-21 09:35:54
BK22000270	5	질문자	1세대, 2세대는 차이점이 뭔데?				0	2022-07-20 16:05:41	2022-08-02 12:01:32
BK22000270	6	전문가	에어팟 1세대 2세대 차이는 W1 칩에서 H1 칩으로 바꿔서 음성 인식으로 siri를 호출할 수 있는 기능이 추가됐다는 거지.	에어팟 1세대 2세대 차이	https://www.nbntv.co.kr/news/articleView.html?idxno=700607	2019/11/14	0	2022-07-20 16:05:41	2022-07-21 09:35:54
BK22000270	7	질문자	에어팟에서 siri를 쓸 일이 있나 모르겠는데. 그것 말고는 없는 거야?				0	2022-07-20 16:05:41	2022-08-02 12:01:32
BK22000270	8	전문가	블루투스 5.0을 포함해서 여러 기술이 탑재됐지. 칩을 변경해서 지연 현상이 줄기도 했고, 골전도 마이크를 이용해서 무선 연결이 가능한 거리도 늘어났어.	에어팟 1세대 2세대 차이	https://www.nbntv.co.kr/news/articleView.html?idxno=700607	2019/11/14	0	2022-07-20 16:05:41	2022-07-21 09:35:54
BK22000270	9	질문자	전체적으로 성능 향상이 된 거구나. 그럼 2세대까지 나온 건가?				0	2022-07-20 16:05:41	2022-08-02 12:01:32
BK22000270	10	전문가	2021년 10월 18일에 에어팟 3세대가 나오긴 했어. 에어팟 프로랑 비슷하긴 한데 크기가 약간 변했고 짧은 스템을 가진 외부 재설계를 특징으로 해. 포스 터치 컨트롤도 비슷하고.	에어팟 3세대	https://ko.wikipedia.org/wiki/%EC%97%90%EC%96%B4%ED%8C%9F	2022/06/17	0	2022-07-20 16:05:41	2022-07-21 09:35:54
BK22000270	11	질문자	그럼 1세대 2세대 3세대 있는 거네. 그러고 보니 에어팟 프로도 있었지. 그건 또 어떤 게 다른 건지 궁금하네.				0	2022-07-20 16:05:41	2022-08-02 12:01:32
BK22000270	12	전문가	아무래도 에어팟 3세대랑 에어팟 프로가 뭐가 가장 크게 차이 나냐고 하면 아무래도 액티브 노이즈 캔슬링이지.	에어팟 프로 차이	https://zdnet.co.kr/view/?no=20211020112502	2021/10/20	0	2022-07-20 16:05:41	2022-07-21 09:35:54
BK22000270	13	질문자	아, 맞아. 노이즈 캔슬링 기능은 이야기 많이 들었어. 이 기능이 인기가 많다며.				0	2022-07-20 16:05:41	2022-08-02 12:01:32
BK22000270	14	전문가	외부에서 나는 소음을 줄여서 이어폰에서 나오는 소리에 집중하게 해주는 걸 노이즈 캔슬링이라고 하는데, 좋은 기능이지만 조심해야 사용해야 돼. 얼마 전에 싱가포르에서 에어팟 프로를 착용하고 달리던 여성이 쓰러지는 나무에 깔려서 사망하는 일이 있었거든.	노이즈 캔슬링	http://www.cctvnews.co.kr/news/articleView.html?idxno=222521	2021/03/18	0	2022-07-20 16:05:41	2022-07-21 09:35:54
BK22000270	15	질문자	주변 소음이 안 들리니까 그럴 수 있겠구나. 만약 산다면 조심해서 사용해야겠네.				0	2022-07-20 16:05:41	2022-08-02 12:01:32
BK22000270	16	전문가	위험하게 사용만 안 한다면 상당히 좋은 기능이긴 하지.				0	2022-07-20 16:05:41	2022-07-21 09:35:54
BK22000270	17	질문자	그럼 에어팟 프로로 하려는데, 기왕이면 최신 제품으로 사고 싶네. 프로는 2세대 나올 계획은 없나?				0	2022-07-20 16:05:41	2022-08-02 12:01:32
BK22000270	18	전문가	에어팟 프로 차세대 제품은 2022년 가을에 선보일 예정이야. 2세대에는 새로운 건강 관리 및 피트니스 기능도 추가될 전망이고.	에어팟 프로 2세대	https://www.asiatime.co.kr/article/20220510500306	2022/05/11	0	2022-07-20 16:05:41	2022-07-21 09:35:54
BK22000270	19	질문자	그럼 조금 더 기다렸다가 에어팟 프로 2세대를 사야겠다.				0	2022-07-20 16:05:41	2022-08-02 12:01:32
BK22000270	20	전문가	그래, 에어팟 프로 2세대 정확히 발매일 나오면 알려 줄게.				1	2022-07-20 16:05:41	2022-07-21 11:01:49
