id	utterance_id	role	text	search_query	search_URL	reference_date	terminate	regDate	updDate
BK22009278	1	질문자	집에 인테리어를 새로 하면서 커튼도 좀 바꾸려고 해. 근데 여름에는 커튼을 쓸 일이 없으니까 겨울용 커튼만 구입하면 될까?				0	2022-09-22 17:00:27	2022-09-22 20:07:20
BK22009278	2	전문가	커튼은 찬바람도 막아주고 인테리어 효과도 있지. 하지만, 여름에는 답답해 보일 수도 있고, 창문을 열어 놓는 경우가 많으니 커튼을 잘 안 치는 경우가 많지만 여름에도 커튼은 필요해. 여름에 커튼을 치면 실내 온도를 내리는 효과를 해서 냉방비를 줄이는 데 도움이 돼.	커튼 기능	https://www.nongmin.com/nature/NAT/LVN/324048/view	2020/07/16	0	2022-09-22 17:00:27	2022-09-22 20:07:20
BK22009278	3	질문자	너무 더울 때 커튼을 치면 실내 온도를 내릴 수 있겠구나. 그런데, 커튼에 대해 알아보다 보니 커튼 천도 종류가 많던데 천에 따라 특징이 다 다른 거지?				0	2022-09-22 17:00:27	2022-09-22 20:07:20
BK22009278	4	전문가	응, 커튼에 사용된 소재에 따라 특징이 다 달라. 두꺼운 천인 드레이프는 안정감을 주고, 시폰 소재는 호텔 같은 분위기를 연출할 수 있게 도와줘. 그리고, 레이스는 얇고 야리야리한 느낌을 주고, 케이스먼트는 레이스보다는 두꺼운 실로 짠 거야. 리넨은 구김과 거친 느낌으로 자연스럽고, 면과 마 소재는 모던하면서 내추럴하고, 폴리에스터는 관리가 쉬고 패턴이 다양하다는 특징이 있어.	커튼 고르는 법	http://woman.chosun.com/news/articleView.html?idxno=99029	2022/06/14	0	2022-09-22 17:00:27	2022-09-22 20:07:20
BK22009278	5	질문자	정말 천 종류에 따라 다양한 느낌을 주는구나. 커튼 소재를 고르는 것도 한참 고민해야겠구나. 커튼 소재가 주는 느낌도 다르겠지만, 색도 중요할 것 같은데 커튼 색 고르는 팁도 알려줘.				0	2022-09-22 17:00:27	2022-09-22 20:07:20
BK22009278	6	전문가	갈색톤의 가구가 많으면 아이보리나 베이지색 커튼이 잘 어울릴 거야. 블랙 앤 화이트 가구가 많으면 흰색이나 회색 커튼이 조화로울 거고.	커튼 색 고르기	https://news.sbs.co.kr/news/endPage.do?news_id=N1003548139&plink=ORI&cooper=NAVER	2016/04/30	0	2022-09-22 17:00:27	2022-09-22 20:07:20
BK22009278	7	질문자	우리 집은 갈색톤의 가구가 많으니 아이보리나 베이지색의 커튼에서 고르면 되겠구나. 근데, 아이들 방이 좀 작아 넓어 보이게 하고 싶은데 그때는 커튼 색을 어떤 걸로 하면 될까?				0	2022-09-22 17:00:27	2022-09-22 20:07:20
BK22009278	8	전문가	좁은 공간을 넓게 보이려면 인테리어를 밝을 톤으로 하면 도움 되는 데 커튼도 그래. 흰색이나 베이지 계열의 커튼을 선택하면 넓어 보일 거야.	좁은 방 커튼	http://www.dailypop.kr/news/articleView.html?idxno=62605	2022/09/06	0	2022-09-22 17:00:27	2022-09-22 20:07:20
BK22009278	9	질문자	흰색이나 베이지 톤의 커튼이 넓어 보이는 효과가 있구나. 그리고 인테리어 잡지에서 보니까 속커튼이 있으니 예뻐 보이던데 집에 어디에 활용하면 좋을까?				0	2022-09-22 17:00:27	2022-09-22 20:07:20
BK22009278	10	전문가	속 커튼은 빛이 많이 들어오는 큰 창이 있는 거실에 사용하면 좋아. 시폰이나 레이스 소재의 속커튼을 달면 햇빛도 조절할 수 있고, 사생활 보호에도 효과가 있지.	거실 속 커튼	http://woman.chosun.com/news/articleView.html?idxno=99031	2022/06/15	0	2022-09-22 17:00:27	2022-09-22 20:07:20
BK22009278	11	질문자	레이스로 된 이쁜 속커튼을 거실에 달아야겠다. 그러면, 침실에는 어떤 커튼이 좋아?				0	2022-09-22 17:00:27	2022-09-22 20:07:20
BK22009278	12	전문가	침실에는 외부와 차단돼서 프라이빗하고 안정된 분위기를 만드는 것이 가장 필요한 공간이지. 이때 커튼은 침구류의 색을 고려해서 침구류와 비슷한 색을 선택하거나 아예 대비되는 것을 선택하면 돼. 호텔 스타일링을 원한다면 나비 주름이 있는 커튼을 선택하면 되고.	침실 커튼	http://woman.chosun.com/news/articleView.html?idxno=99031	2022/06/15	0	2022-09-22 17:00:27	2022-09-29 16:05:32
BK22009278	13	질문자	침구류의 색을 참고로 커튼 색을 고르면 되는구나. 그리고, 친구는 겨울에 암막 커튼을 사용하던데 암막 커튼은 어떤 커튼이야?				0	2022-09-22 17:00:27	2022-09-22 20:07:20
BK22009278	14	전문가	찬바람이 불때 많이 사용하는 커튼이야. 외부에서 들어오는 바람을 막아주고 내부의 공기가 빠져나가는 것을 막아줘 보온효과가 큰 커튼이거든. 암막 커튼은 보온 기능도 하지만, 빛을 차단하는 역할도 해서 인기가 많아.	암막 커튼	http://www.gvalley.co.kr/news/articleView.html?idxno=513528	2015/10/29	0	2022-09-22 17:00:27	2022-09-22 20:07:20
BK22009278	15	질문자	겨울에는 보온 기능이 있는 암막 커튼이 유용하겠구나. 근데, 암막 커튼만 사용하면 너무 어둡지 않을까?				0	2022-09-22 17:00:27	2022-09-22 20:07:20
BK22009278	16	전문가	암막 커튼이 너무 어두울까 걱정이 된다면 화이트 시폰과 암막 커튼 이 두 가지를 섞는 방법도 있어. 화이트 시폰 커튼과 암막 커튼을 이중으로 설치하면 너무 밝지도 어둡지도 않는 화사한 분위기를 낼 수 있어.	화이트 쉬폰, 암막 커튼	http://www.dailypop.kr/news/articleView.html?idxno=57770	2022/02/09	0	2022-09-22 17:00:27	2022-09-22 20:07:20
BK22009278	17	질문자	이중 커튼을 설치하는 거 너무 좋은 방법이다.				0	2022-09-22 17:00:27	2022-09-22 20:07:20
BK22009278	18	전문가	그렇게 설치하면 인테리어 효과도 좋을 거야.				0	2022-09-22 17:00:27	2022-09-22 20:07:20
BK22009278	19	질문자	너와 이야기하면서 커튼에 대한 고민이 많이 해결되었어.				0	2022-09-22 17:00:27	2022-09-22 20:07:20
BK22009278	20	전문가	커튼 고르다가 잘 모르겠으면 전화하고, 우리는 다음에 보자.				1	2022-09-22 17:00:27	2022-09-29 16:05:32
