id	utterance_id	role	text	search_query	search_URL	reference_date	terminate	regDate	updDate
BK22002582	1	질문자	날씨가 더운 것뿐만 아니라 습해서 정말 힘드네요.				0	2022-08-02 12:17:47	2022-08-02 13:51:46
BK22002582	2	전문가	여름철은 정말 기온도 기온이지만 습도 때문에도 힘들죠.				0	2022-08-02 12:17:47	2022-08-02 13:51:46
BK22002582	3	질문자	네, 맞아요. 그래서 제습기를 구입할까 하는데 혹시 제습기가 정말 효과적인가요?				0	2022-08-02 12:17:47	2022-08-02 13:51:46
BK22002582	4	전문가	네, 그럼요. 보통 장마철 실내 습도는 70퍼센트 이상으로 높아지는데 제습기는 이를 40에서 60퍼센트까지 낮출 수 있어요.	제습기 장점	https://www.etnews.com/20220616000063	2022/06/16	0	2022-08-02 12:17:47	2022-08-02 13:51:46
BK22002582	5	질문자	와, 수치상으로도 엄청 효과적이네요. 사용하고 나면 방이 정말 쾌적해지기는 하겠어요.				0	2022-08-02 12:17:47	2022-08-02 13:51:46
BK22002582	6	전문가	그럼요, 제습기는 실내를 쾌적하게 만들기도 하지만 습기를 잡는 역할을 하기 때문에 빨래를 말리는 데에도 좋아요.	제습기 빨래	https://www.ilovepc.co.kr/news/articleView.html?idxno=43719	2022/06/13	0	2022-08-02 12:17:47	2022-08-02 13:51:46
BK22002582	7	질문자	안 그래도 장마철에는 빨래가 너무 안 말라서 찝찝했는데 여러모로 활용도가 정말 괜찮은 제품이네요.				0	2022-08-02 12:17:47	2022-08-02 13:51:46
BK22002582	8	전문가	네, 그렇죠. 제습기를 주로 사용하실 침실이나 거실 말고도 옷방이나 신발장처럼 밀폐된 공간에서도 활용하실 수 있어요.	제습기 옷방	http://view.asiae.co.kr/news/view.htm?idxno=2014060808403423524	2014/06/08	0	2022-08-02 12:17:47	2022-08-02 13:51:46
BK22002582	9	질문자	신발장에서도 사용이 가능하다니 정말 활용도가 좋기는 하네요. 그런데 주변에서 에어컨 틀면 되는데 제습기를 뭐 하러 사려 하냐는 사람들도 있더라고요. 에어컨도 제습 기능이 된다면서요.				0	2022-08-02 12:17:47	2022-08-02 13:51:46
BK22002582	10	전문가	하하, 사실 에어컨과 제습기의 작동원리가 같기는 해요. 차이가 있다면 에어컨은 실내 온도를 낮춰주지만 제습기는 가동 시 실내 온도가 올라가죠.	제습기 에어컨 제습 차이점	https://www.hankyung.com/life/article/2022070864547	2022/07/09	0	2022-08-02 12:17:47	2022-08-02 13:51:46
BK22002582	11	질문자	어, 그러면 상대적으로 시원한 에어컨을 사용하는 게 더 좋은 게 아닌가요?				0	2022-08-02 12:17:47	2022-08-02 13:51:46
BK22002582	12	전문가	음, 그렇지 않아요. 습도를 낮출 때 있어서 가장 중요한 포인트는 수분을 가진 공기를 얼마나 효과적으로 제거하느냐라는 문제죠. 따뜻한 공기는 차가운 공기에 비해 수분 함유량이 높아 건조 성능 효율이 높지만 냉방기기는 공기를 차갑게 만들기 때문에 제습기에 비해 효과적인 제습이 어렵거든요.	제습기 에어컨 차이점	http://www.dt.co.kr/contents.html?article_no=2013081902012351748002	2013/08/18	0	2022-08-02 12:17:47	2022-08-02 13:51:46
BK22002582	13	질문자	와, 생각보다 확실한 차이점이 있네요. 그럼 제습기는 어떻게 선택하는 것이 좋을까요?				0	2022-08-02 12:17:48	2022-08-02 13:51:46
BK22002582	14	전문가	우선 거주하고 계신 공간의 크기를 고려하셔야 해요. 가정집 기준 12평 공간에는 10리터, 30평 공간에는 24리터의 제품을 사용하는 것이 적절하죠. 여기서 리터 표기는 물통 용량이 아니고 제습기가 하루 동안 제습할 수 있는 제습 용량을 말해요.	제습기 선택 요령	http://lady.khan.co.kr/khlady.html?mode=view&code=8&artid=201407011705591&pt=nv	2014/07/01	0	2022-08-02 12:17:48	2022-08-02 13:51:46
BK22002582	15	질문자	제습기에 표기된 리터가 물통 용량이 아니라 제습 용량 표기였군요. 처음 알았네요. 그럼 물통 사이즈도 고려하는 것이 좋을까요?				0	2022-08-02 12:17:48	2022-08-02 13:51:46
BK22002582	16	전문가	네, 맞아요. 물통 용량이 적으면 그만큼 자주 비워줘야 해서 귀찮게 되거든요. 그리고 제습량이 같더라도 제품마다 물통 용량은 다를 수 있어서 제품을 선택하실 때 잘 확인하고 구매하시는 걸 추천드려요.	제습기 용량 물통	https://www.ajunews.com/view/20180516153039715	2018/05/16	0	2022-08-02 12:17:48	2022-08-02 13:51:46
BK22002582	17	질문자	물통을 비워줘야 하는 건 정말 생각지도 못한 부분이네요. 정말 물통이 큰 제품으로 구입해야겠어요. 안 그러면 너무 귀찮을 것 같네요.				0	2022-08-02 12:17:48	2022-08-02 13:51:46
BK22002582	18	전문가	물통을 비우기가 귀찮으시면 연속배수 기능이 있는 제습기를 선택하시는 것도 고려해볼 만한 사항이에요.	제습기 용량 물통	https://www.etnews.com/20200604000026	2020/06/04	0	2022-08-02 12:17:48	2022-08-02 13:51:46
BK22002582	19	질문자	오, 그런 기능도 있군요. 어떤 방법으로 물통을 안 비우고 연속해서 배수를 할 수 있는 거죠?				0	2022-08-02 12:17:48	2022-08-02 13:51:46
BK22002582	20	전문가	연속배수 기능은 제습기가 흡수한 습기를 물통을 거치지 않고 호스를 통해 바로 배출할 수 있도록 만든 기능이에요. 호스를 연결해 사용하면 물통을 갈아줄 필요가 없어지는 거죠.	제습기 연속배수기능	http://www.ksilbo.co.kr/news/articleView.html?idxno=937889	2022/06/10	0	2022-08-02 12:17:48	2022-08-02 13:51:46
BK22002582	21	질문자	음, 그럼 결국은 화장실이든 베란다 배수구든 물이 빠져나갈 곳이 필요하긴 하겠네요. 호스가 연결되니 조금 지저분해 보일 것 같기도 하고요.				0	2022-08-02 12:17:48	2022-08-02 13:51:46
BK22002582	22	전문가	네, 사실 조금 거추장스러울 수 있기는 하죠. 저도 그래서 그냥 물통을 비워주는 방식으로 사용하고 있답니다.				0	2022-08-02 12:17:48	2022-08-02 13:51:46
BK22002582	23	질문자	네, 저도 그냥 물통이 큰 제품을 선택해 비워주는 쪽으로 해야겠어요.				0	2022-08-02 12:17:48	2022-08-02 13:51:46
BK22002582	24	전문가	하하, 저랑 말씀 나누시는 동안 구매하는 쪽으로 결정을 하셨나 봐요?				0	2022-08-02 12:17:48	2022-08-02 13:51:46
BK22002582	25	질문자	네, 주변에 에어컨이 있으면 된다는 말에 설득될 뻔했는데 오늘 말씀 나눠보니까 제습기를 구입해야겠다는 생각에 확신이 섰어요. 얼른 구입해서 하루빨리 빨래를 뽀송하게 말리고 싶네요. 이렇게 좋은 정보 주셔서 감사합니다.				0	2022-08-02 12:17:48	2022-08-02 13:51:46
BK22002582	26	전문가	도움이 됐다니 기쁘네요. 제습기 잘 활용하셔서 뽀송한 여름철 나시길 바랄게요!				1	2022-08-02 12:17:48	2022-08-02 16:35:08
