id	utterance_id	role	text	search_query	search_URL	reference_date	terminate	regDate	updDate
BK22019403	1	질문자	급한 건 아니지만, 타던 차도 질렸겠다, 슬슬 차를 바꾸고 싶어서 이런저런 차를 알아보는 중인데, 생각보다 정보를 얻기가 힘드네. 혹시 자동차 관해서 잘 알면 좀 상담해도 될까?				0	2022-10-26 10:46:15	2022-10-26 12:56:28
BK22019403	2	전문가	그야 물론이지, 내가 그동안 말은 안 했는데, 자동차를 엄청 좋아해서 자동차에 관해서라면 뭐든 공부하거든.				0	2022-10-26 10:46:15	2022-10-26 12:56:28
BK22019403	3	질문자	앗, 그랬구나, 물어볼 사람이 생겨서 진짜 다행이다. 일단, 지금 크게 두 모델 정도로 추려서 알아보던 중이야. 먼저 현대자동차의 7세대 그랜저인 디 올 뉴 그랜저라는 차부터 물어보고 싶은데, 이 차 출시일이랑 엔진 모델 종류를 좀 알 수 있을까?				0	2022-10-26 10:46:15	2022-10-26 12:56:28
BK22019403	4	전문가	응, 디 올 뉴 그랜저는 다음 달 중에 공식 출시될 예정이고, 엔진 모델은 2.5리터 GDI 가솔린 엔진, 3.5리터 GDI 가솔린 엔진, 3.5리터 LPi 엔진, 1.6리터 가솔린 터보 하이브리드, 이렇게 네 종류가 있어.	디 올 뉴 그랜저 엔진 모델	https://www.hani.co.kr/arti/economy/car/1063319.html	2022/10/19	0	2022-10-26 10:46:15	2022-10-26 12:56:28
BK22019403	5	질문자	내년쯤에나 나오나 싶었는데 다음 달에 출시되는 거였구나. 혹시 사전 계약도 진행 중이려나? 그리고 디 올 뉴 그랜저 프리뷰 행사 같은 게 있으면 좀 알려줄래?				0	2022-10-26 10:46:15	2022-10-26 12:56:28
BK22019403	6	전문가	현대자동차 측 공식 입장에 따르면, 현행 모델에서 출고가 늦어지는 차량이 많기 때문에 7세대 그랜저는 사전 계약을 진행하지 않아. 하지만 그랜저를 먼저 만나볼 수 있는 프리뷰 행사는 서울, 대전, 대구, 광주, 부산 등지에서 열리고, 현대자동차 홈페이지의 디 올 뉴 그랜저에서 관련 내용을 확인하고 신청할 수 있어.	7세대 그랜저 사전 계약	https://www.autotribune.co.kr/news/articleView.html?idxno=6855	2022/10/20	0	2022-10-26 10:46:15	2022-10-27 16:22:35
BK22019403	7	질문자	사전 계약을 못 한다니, 사고 싶어도 바로 못 사는 상황이 생길 수도 있을 거 같네. 아까 디 올 뉴 그랜저에는 엔진 모델이 네 종류 있다고 했는데, 1.6리터 가솔린 터보 하이브리드 모델은 출력이랑 토크 사양이 어느 정도야?				0	2022-10-26 10:46:15	2022-10-26 12:56:28
BK22019403	8	전문가	1.6리터 가솔린 엔진은 터보차저가 적용되어 있어서 최고 출력이 180마력, 최대 토크가 27kg.m이고, 모터 성능은 최고 출력이 4.2kW, 토크가 264Nm이야.	7세대 그랜저 하이브리드 출력 토크	https://www.autotribune.co.kr/news/articleView.html?idxno=6857	2022/10/20	0	2022-10-26 10:46:15	2022-10-26 12:56:28
BK22019403	9	질문자	최신 차라 그런지 하이브리드치고 성능이 준수해 보이네. 사진만으로는 크기가 잘 가늠이 안 돼서 그런데, 7세대 디 올 뉴 그랜저의 차체 크기는 어느 정도 돼? 아, 그리고 내부 구조 중에 스티어링휠이랑 기어노브 형태가 어떤지도 좀 알려줄래?				0	2022-10-26 10:46:15	2022-10-26 12:56:28
BK22019403	10	전문가	차체 크기부터 말해 주면, 전폭이 1880mm, 전장이 5035mm, 전고가 1462mm에 휠베이스는 2895mm야. 스티어링휠은 1세대 그랜저의 스티어링휠을 연상되는 3-스포크 타입이고, 기어노브는 현대차의 최신 전기차인 아이오닉5나 아이오닉6에서 볼 수 있는 칼럼식이야.	7세대 그랜저 전장 전폭 스티어링휠	http://www.carguy.kr/news/articleView.html?idxno=44203	2022/09/29	0	2022-10-26 10:46:15	2022-10-26 12:56:28
BK22019403	11	질문자	스티어링휠은 잘 모르겠지만, 일단 기어노브가 칼럼식인 건 괜찮은걸. 그랜저 외에 GM에서 나온 쉐보레 8세대 콜벳도 생각 중인데, 8세대 콜벳 C8의 엔진 사양을 좀 알 수 있을까?				0	2022-10-26 10:46:15	2022-10-26 12:56:28
BK22019403	12	전문가	8세대 콜벳에는 자연흡기 방식의 차세대 6.2리터 스몰 블록 V8 LT2 엔진이 탑재되어 있고, 최고 출력 495마력, 최대 토크 64.9kg.m의 성능을 내.	8세대 콜벳 엔진 출력 토크	https://www.motoya.co.kr/news/articleView.html?idxno=17909	2019/07/22	0	2022-10-26 10:46:15	2022-10-26 12:56:28
BK22019403	13	질문자	오호, 한 번쯤 타 보고 싶어지게끔 만드는 성능이네. 가속 성능이랑 최고 속력은 어느 정도야? 아 그리고, 사진으로 보니까 차체가 좀 낮아 보이던데 차량 손상에 대한 대비책이 있으려나?				0	2022-10-26 10:46:15	2022-10-26 12:56:28
BK22019403	14	전문가	우선, 쉐보레 콜벳 C8은 정지 상태에서 3초 안에 시속 96km까지 도달하는 가속 성능을 지니고 있고, 최고 속력은 시속 300km야. 그리고 낮은 지상고 때문에 일어날 수 있는 차량 손상 방지를 위해 전륜 쪽에 리프트 기능이 있어. 리프트 기능은 GPS를 바탕으로 리프트 스폿을 최대 1000개까지 저장해 해당 지점을 통과할 때 전륜을 자동으로 들어 올려 주지.	8세대 콜벳 c8 최고 속도 가속	https://www.hankookilbo.com/News/Read/A2021030621110001703	2021/03/07	0	2022-10-26 10:46:15	2022-10-26 12:56:28
BK22019403	15	질문자	아하, 굴곡진 곳을 지나다가 차 밑바닥이 다 긁히는 건 아닌가 싶었는데 다 대비책이 마련되어 있었구나. 콜벳 모델 중에 하이브리드는 없는 거 같던데, 혹시 하이브리드 모델은 언제쯤 출시 예정인지, 모델 이름은 뭔지 알아?				0	2022-10-26 10:46:28	2022-10-26 12:56:28
BK22019403	16	전문가	지난 4월 25일 CNN 등 외신에서 보도된 GM 마크 로이스 사장의 발표 내용에 따르면, 콜벳의 하이브리드 버전은 2023년에 출시될 예정이야. 이름은 스팅레이와 일렉트릭을 합친 E-레이고.	쉐보레 콜벳 e 레이 출시	https://www.motorgraph.com/news/articleView.html?idxno=29854	2022/04/26	0	2022-10-26 10:46:28	2022-10-26 12:56:28
BK22019403	17	질문자	이름이 단순하면서도 멋진 거 같네. 그 콜벳 E-레이는 구동 방식이랑 출력 사양이 어떻게 되려나?				0	2022-10-26 10:46:28	2022-10-26 12:56:28
BK22019403	18	전문가	파워트레인은 매체에 따라 예상하는 바가 조금씩 다른데, 대강 전륜 차축에는 전기 모터가, 후륜에는 6.2리터 V8 엔진이 동력을 공급하는 사륜 구동 방식일 것으로 보고 있어. 최고 출력은 총 600~650마력 정도일 것으로 예상되고.	쉐보레 콜벳 e 레이 엔진 출력	https://www.motoya.co.kr/news/articleView.html?idxno=34211	2021/10/22	0	2022-10-26 10:46:33	2022-10-26 12:56:28
BK22019403	19	질문자	진짜 그 정도 성능으로 출시되면 좋겠네. 일단 그랜저 프리뷰 행사에 가 보고 그랜저를 살지 콜벳을 기다릴지 결정해야겠다. 오늘 고마웠어, 나는 그럼 우선 그랜저 프리뷰 행사 홈페이지 좀 둘러보러 가 볼게.				1	2022-10-26 10:46:33	2022-10-27 16:22:35
BK22019403	20	전문가	에이, 뭐 이런 걸로. 자동차 관해서 궁금한 거 생기면 언제든 연락 줘. 그럼 나중에 또 보자.				0	2022-10-26 10:46:33	2022-10-26 12:56:28
