id	utterance_id	role	text	search_query	search_URL	reference_date	terminate	regDate	updDate
BK22016261	1	질문자	이번에 저 취업에 성공해서 첫 월급을 받았어요.				0	2022-10-16 20:38:00	2022-10-16 20:38:00
BK22016261	2	전문가	와아, 정말 축하해요! 첫 직장에서 첫 월급은 정말 기분이 좋죠.				0	2022-10-16 20:38:00	2022-10-16 20:38:00
BK22016261	3	질문자	네 정말 좋아요. 안그래도 첫 월급겸 집에 음식물 처리기를 하나 장만하려고 하는데 종류가 엄청 많더라고요? 음식물 처리기에는 어떤 종류가 있는지 아시나요?				0	2022-10-16 20:38:00	2022-10-16 20:56:41
BK22016261	4	전문가	당연히 알죠. 종류는 4가지인데 크게 건조식, 분쇄건조식, 습식분쇄식, 미생물발효식 으로 나뉘어요.	음식물처리기 종류	http://www.dailypop.kr/news/articleView.html?idxno=59773	2022/05/09	0	2022-10-16 20:38:00	2022-10-16 20:56:41
BK22016261	5	질문자	크게 4가지로 나뉘는군요. 그러면 종류별로 특징을 알아야 할 것 같은데 먼저 건조식부터 설명해 주실래요?				0	2022-10-16 20:38:00	2022-10-19 16:49:09
BK22016261	6	전문가	건조식은 말 그대로 음식물의 수분을 고온으로 날려 물기와 냄새를 제거하는 방식이에요. 수분이 사라지기 때문에 무게와 부피가 줄고 부패하지도 않는 데다 비교적 저렴하다는 것이 장점으로 꼽히죠.	건조식 음식물처리기 장점	http://www.dailypop.kr/news/articleView.html?idxno=59773	2022/05/09	0	2022-10-16 20:38:00	2022-10-16 20:56:41
BK22016261	7	질문자	우와, 장점이 정말 많네요. 그러면 이 건조식은 어떤 단점이 있을까요?				0	2022-10-16 20:38:00	2022-10-16 20:56:41
BK22016261	8	전문가	건조식의 단점으로는, 필터를 주기적으로 교체해야 하기 때문에 배보다 배꼽이 더 큰 상황이 발생할 수 있어요. 그리고 잘 관리해주더라도 약간의 악취는 남아있기 때문에 그건 감수하셔야 해요. 또 열을 이용한 방식이기 때문에 전력 소모량도 커요.	건조식 음식물처리기 단점	http://www.dailypop.kr/news/articleView.html?idxno=59773	2022/05/09	0	2022-10-16 20:38:00	2022-10-16 20:56:41
BK22016261	9	질문자	저런, 냄새가 완전히 사라지지도 않고 전력 소모량도 크면 유지비가 상당하겠군요. 그러면 분쇄건조식도 설명해 주시겠어요?				0	2022-10-16 20:38:00	2022-10-16 20:56:41
BK22016261	10	전문가	분쇄건조식은 건조식에서 한 단계 더 발전한 것인데, 고온으로 건조한 음식물쓰레기를 분쇄해 가루형태로 처리하는 방식으로 건조식보다 부피 감소율이 훨씬 높은게 특징이에요.	분쇄식 음식물처리기 장점	http://www.dailypop.kr/news/articleView.html?idxno=59773	2022/05/09	0	2022-10-16 20:38:00	2022-10-16 20:56:41
BK22016261	11	질문자	부피 감소율이 훨씬 높다면 정말 편리하겠어요. 그러면 이 분쇄식의 단점도 알려주세요.				0	2022-10-16 20:38:00	2022-10-16 20:56:41
BK22016261	12	전문가	분쇄식 필터의 단점은 필터 외에도 칼날 교체 비용이 추가로 들어간다는점과, 건조식과 마찬가지로 약간의 냄새를 동반하는 점이에요. 또 칼날로 절삭하고 으깨는 방식이기 때문에 조개껍질 등은 넣을 수 없어요.	분쇄식 음식물처리기 단점	http://www.dailypop.kr/news/articleView.html?idxno=59773	2022/05/09	0	2022-10-16 20:38:00	2022-10-16 20:56:41
BK22016261	13	질문자	건조식과 분쇄건조식 모두 냄새로부터 자유로울 수가 없는게 조금 아쉽네요. 다음으로 습식분쇄식의 특징도 알려주시겠어요?				0	2022-10-16 20:38:00	2022-10-16 20:56:41
BK22016261	14	전문가	습식분쇄는 흔히 디스포저라고 불리는 방식인데, 싱크대 배수구에 설치해 물과 함께 음식물을 분쇄해서 고형물은 2차 처리기에, 걸러진 음식은 하수구로 배출하는 방식이에요. 이 방식은 원형 배수구와 싱크대 하부에 공간이 있어야만 설치할 수 있다는 특징이 있죠.	습식분쇄식 음식물처리기	http://www.dailypop.kr/news/articleView.html?idxno=59773	2022/05/09	0	2022-10-16 20:38:00	2022-10-16 20:56:41
BK22016261	15	질문자	앗, 제가 전에 뉴스에서 그 방식은 문제가 될 수도 있다고 봤는데 맞나요? 맞다면 자세히 설명해 주시겠어요?				0	2022-10-16 20:38:00	2022-10-17 00:04:05
BK22016261	16	전문가	네, 궁금이님이 보신게 맞아요. 2차 처리기를 설치하지 않거나 거름망 없이 사용하는 경우 배관 막힘과 수질 오염 등의 문제를 야기하기 때문에 이 경우에는 현행법상 불법에 해당되어서 과태료를 물어야 할 수도 있어요. 따라서 습식분쇄식을 구매하기 전에 꼼꼼히 확인하셔야 해요.	습식분쇄식 음식물처리기 불법	http://www.dailypop.kr/news/articleView.html?idxno=59773	2022/05/09	0	2022-10-16 20:38:00	2022-10-16 20:56:41
BK22016261	17	질문자	자칫하면 과태료를 물 수도 있군요. 그러면 마지막 미생물발효식은 어떤 방식인가요? 이름이 특이하네요.				0	2022-10-16 20:38:00	2022-10-16 20:56:41
BK22016261	18	전문가	미생물발효식은 가장 친환경적인 방식으로 최근 인기가 높아지고 있죠. 미생물이 음식물을 자연 분해해 90% 이상 소멸돼 퇴비화되는 방식인데, 쌓인 부산물은 일반 쓰레기나 식물 퇴비 등으로 처리하면 되는게 이 방식의 특징이죠.	미생물 발효식 음식물처리기	http://www.dailypop.kr/news/articleView.html?idxno=59773	2022/05/09	0	2022-10-16 20:38:02	2022-10-16 20:56:41
BK22016261	19	질문자	친환경적인 방식에다가 뒷처리도 간편할 것 같네요. 오늘 어떤걸 살지 결정하는데 정말 도움이 많이 되었어요. 제가 커피 쏠게요.				0	2022-10-16 20:38:02	2022-10-16 20:56:41
BK22016261	20	전문가	하하, 이정도는 당연히 알려드려야죠. 그럼 요 앞 카페로 가시죠.				1	2022-10-16 20:38:02	2022-10-19 16:49:09
