id	utterance_id	role	text	search_query	search_URL	reference_date	terminate	regDate	updDate
BK22006167	1	질문자	이제 곧 출산할 때가 다가와서 아기 용품을 준비하려고 하는 데 어려워서 그런데 좀 도와줘. 배냇저고리나 내복을 몇 개나 사야 해?				0	2022-08-22 14:01:52	2022-08-22 14:01:52
BK22006167	2	전문가	그럼, 네 출산준비는 내가 당연히 도와줘야지. 배냇저고리나 내복, 가제 수건은 미리 너무 많이 구매할 필요는 없어. 아기가 금세 커서 얼마 입지도 못하기도 하고, 조리원이나 산부인과, 지인들이 선물로 주기도 하거든.	출산용품 배냇저고리	http://news.heraldcorp.com/view.php?ud=20150623000334	2015/06/23	0	2022-08-22 14:01:52	2022-08-22 14:01:52
BK22006167	3	질문자	그렇겠구나, 나도 지인이 아기 낳다고 하면 내복 선물 많이 했거든. 그럼 목욕 타월은 어른하고 같이 쓰기도 그렇고 새로 사야 할 것 같은 데 어떤 걸 고르면 될까?				0	2022-08-22 14:01:52	2022-08-22 14:01:52
BK22006167	4	전문가	목욕 타월은 아기 몸 전체를 덮을 수 있는 크기로 구매하는 편이 좋아. 속싸개처럼 쓸 수도 있는 제품들도 좋고.	출산용품 목욕타월	https://www.ibabynews.com/news/articleView.html?idxno=26705	2015/01/12	0	2022-08-22 14:01:52	2022-08-22 14:01:52
BK22006167	5	질문자	속싸개 겸용으로 사면 편리하겠구나. 체온계나 온도계도 하나씩 준비해야 겠지?				0	2022-08-22 14:01:52	2022-08-31 09:23:22
BK22006167	6	전문가	체온계는 수은 체온계보다는 빠르고 간편해서 유용한 전자 체온계를 준비하는 것이 좋아. 그리고, 탕온도계가 필수품은 아니지만 아기가 목욕할 때 물 온도를 잴 수 있어 유용하지.	출산용품 온도계	https://www.ibabynews.com/news/articleView.html?idxno=26705	2015/01/12	0	2022-08-22 14:01:52	2022-08-31 12:06:58
BK22006167	7	질문자	나는 목욕물 온도 맞추는 것이 힘들 것 같아서 구매하려고. 손 싸개도 꼭 필요하다는 사람들이 많던데.				0	2022-08-22 14:01:52	2022-08-22 14:01:52
BK22006167	8	전문가	손 싸개를 2, 3장 준비하면 유용할 거야. 아기가 얼굴 긁는 것을 막아주거든.	출산용품 손싸개	https://www.ibabynews.com/news/articleView.html?idxno=46466	2017/04/13	0	2022-08-22 14:01:52	2022-08-22 14:01:52
BK22006167	9	질문자	손 싸개는 꼭 준비해야겠구나. 나는 모유 수유하려고 계획하고 있는 데 관련 용품을 미리 구매해 놔야 할까?				0	2022-08-22 14:01:52	2022-08-22 14:01:52
BK22006167	10	전문가	모유 수유하는 엄마들이 사용하는 수유패드, 수유쿠션, 모유저장팩, 산모 방석은 출산하는 방식에 따라 필요한 것들이 달라질 수 있어. 그래서 미리 구매해 놓기보다는 출산 후에 상황을 봐서 필요한 것만 구매하는 것이 좋겠어.	출산용품 모유	https://www.ibabynews.com/news/articleView.html?idxno=46466	2017/04/13	0	2022-08-22 14:01:52	2022-08-22 14:01:52
BK22006167	11	질문자	출산 방식에 따라 필요한 물건이 달라질 수 있겠구나. 그럼, 꼭 출산용품으로 필요한 것은 뭐가 있을까?				0	2022-08-22 14:01:52	2022-08-31 12:06:58
BK22006167	12	전문가	카시트를 사용하는 습관을 신생아 시기부터 들여야 해. 미리 구매해서 차에 장착해 두는 것이 좋아. 어른들에게는 간단한 사고라도 아이는 중상을 입거나 목숨이 위태로울 수 있거든.	출산용품 카시트	https://www.chosun.com/site/data/html_dir/2018/10/18/2018101800077.html	2018/10/18	0	2022-08-22 14:01:52	2022-08-31 12:06:58
BK22006167	13	질문자	맞다, 카시트는 미리 사놔야 하는 품목이지. 그리고, 장난감은 아기의 개월마다 필요한 것들이 너무 다양하던데 다 사줘야 할까?				0	2022-08-22 14:01:52	2022-08-22 14:01:52
BK22006167	14	전문가	육아용품 중에 많은 비중을 차지하는 장난감은 꼭 사야 하나 고민이 많은 품목인데 아기 발달 정도에 따라 1에서 3개월 정도로 짧은 기간만 사용하게 되는 품목이야. 매번 새로운 장난감을 사는 게 부담이 된다면 무료 장난감 대여소나 장난감 대여 전문점도 있으니 이용하는 것도 좋은 방법이야.	육아용품 구매	https://kizmom.hankyung.com/news/view.html?aid=201711140164o	2017/11/14	0	2022-08-22 14:01:52	2022-08-22 14:01:52
BK22006167	15	질문자	무료로 장난감을 빌려주는 곳도 있구나. 한 번 찾아보고 나중에 이용해 봐야겠다. 그럼 출산용품은 미리 많이 준비할 필요가 없는 건가?				0	2022-08-22 14:01:52	2022-08-22 14:01:52
BK22006167	16	전문가	맞아, 당장 필요한 것들만 미리 준비하면 돼. 미리 준비해두면 짐이 될 수도 있고 나중에 다른 것을 사고 싶어 후회하게 될 수도 있어. 아기를 키우면서 필요한 것들은 그때그때 사는 것이 더 좋아.	출산용품 준비	http://news.heraldcorp.com/view.php?ud=20150626000383	2015/06/26	0	2022-08-22 14:01:52	2022-08-22 14:01:52
BK22006167	17	질문자	그러면 정말 필요한 것들로만 리스트를 작성해 봐야겠다. 필요한 용품을 산 다음에 또 내가 무얼 준비하면 될까?				0	2022-08-22 14:01:52	2022-08-22 14:01:52
BK22006167	18	전문가	상황에 맞게 아기방을 따로 꾸미거나 안방 한쪽에 아기 공간을 준비해 놔. 아기용품을 놓아두고 아기를 재우고 기저귀를 갈 아기를 위한 장소를 미리 마련하는 거야.	출산준비	https://kizmom.hankyung.com/news/view.html?aid=201609279650o	2016/09/27	0	2022-08-22 14:01:52	2022-08-31 12:06:58
BK22006167	19	질문자	그렇네, 제일 중요한 것이 아기 공간이겠네. 출산용품 때문에 고민이 많았었는데 상세히 알려줘서 고마워.				0	2022-08-22 14:01:52	2022-08-22 14:01:52
BK22006167	20	전문가	출산 준비 잘하고 언제든지 궁금한 건 물어봐, 잘 가.				1	2022-08-22 14:01:52	2022-08-31 12:19:51
