id	utterance_id	role	text	search_query	search_URL	reference_date	terminate	regDate	updDate
BK22007893	1	질문자	너 혹시 집에 가스레인지 써?				0	2022-09-08 15:42:38	2022-09-08 15:42:38
BK22007893	2	전문가	응 난 가스레인지 쓰는데 왜?				0	2022-09-08 15:42:38	2022-09-08 15:42:38
BK22007893	3	질문자	나도 계속 가스레인지 썼는데 이번에 전기레인지로 바꿔볼까 생각중이라서 물어봤어. 전기레인지도 여러 종류가 있다고 하던데 혹시 알아?				0	2022-09-08 15:42:38	2022-09-08 15:42:38
BK22007893	4	전문가	전기레인지에는 크게 하이라이트랑 인덕션, 핫플레이트 세 종류로 분류할 수 있어.	전기레인지 종류	http://www.idsn.co.kr/news/articleView.html?idxno=61183	2021/12/30	0	2022-09-08 15:42:38	2022-09-15 20:05:49
BK22007893	5	질문자	아 다른 건 들어본 거 같은데 핫플레이트는 뭐야?				0	2022-09-08 15:42:38	2022-09-08 15:42:38
BK22007893	6	전문가	핫플레이트는 예전에 많이 쓰던 건데 대신 안에 들어있는 히터가 열판을 뜨겁게 만들어서 냄비를 직접 데우는 방식의 제품이야.	핫플레이트	https://www.sisunnews.co.kr/news/articleView.html?idxno=106027	2019/05/30	0	2022-09-08 15:42:38	2022-09-08 15:42:38
BK22007893	7	질문자	아 그렇구나. 요즘에 안 쓰는 건 뭔가 단점이 있어서 그런거겠지?				0	2022-09-08 15:42:38	2022-09-08 15:42:38
BK22007893	8	전문가	응 단점들이 있어서 요즘은 잘 안쓰지. 사용할 때 기기랑 철판 모두 열이 나기 때문에 화상을 조심해야 되고 집에서 요리할 때 쓰기엔 화력이 좀 약해. 구조적으로 화구를 여러 개로 늘리기도 어렵고 온도 조절을 정확하게 할 수 없어서 요리할 때 불조절 하기가 어려운 점도 있어. 그리고 철판에 음식을 떨어뜨리면 그대로 타서 눌러붙는 단점도 있고.	핫플레이트 단점	https://it.donga.com/30065/	2020/01/31	0	2022-09-08 15:42:38	2022-09-22 10:04:08
BK22007893	9	질문자	그래서 요즘은 안 쓰는구나. 그럼 나머지 인덕션이랑 하이라이트는 어떤 차이가 있어?				0	2022-09-08 15:42:38	2022-09-08 15:42:38
BK22007893	10	전문가	음 인덕션은 자기장의 원리를 이용한 거라 사용하는 용기에 직접 열을 가하는 유도 가열방식이고 하이라이트는 상판 밑에 열선에 전기가 가해지면서 발생하는 열로 상판을 뜨겁게 달구는 방식이야. 하이라이트는 상판 자체를 뜨겁게 만들어야 하다보니 인덕션에 비해 요리하는 시간이 길어지지.	인덕션 하이라이트 차이	https://www.news1.kr/articles/?4147412	2020/12/14	0	2022-09-08 15:42:38	2022-09-08 15:42:38
BK22007893	11	질문자	둘이 완전히 다른 거였네. 인덕션은 전용 용기를 써야된다고 들었는데 왜 그런거야?				0	2022-09-08 15:42:38	2022-09-08 15:42:38
BK22007893	12	전문가	아까 말했듯이 인덕션은 자기장을 이용해서 열을 발생시키는 방식이기 때문에 철 성분이 있는 스테인레스 용기와 용기의 바닥에 자성이 있으면서 바닥이 평평한 것만 써야 해. 또 인덕션에서 발생하는 고온의 화력 열원에서 사용할 수 없는 용기를 올리면 상판이 그걸 감지해서 작동하지 않게 되어있어.	인덕션 전용 용기	http://www.ksilbo.co.kr/news/articleView.html?idxno=930600	2022/03/28	0	2022-09-08 15:42:38	2022-09-08 15:42:38
BK22007893	13	질문자	아 그럼 다른 것보다 안전할 것 같긴하다.				0	2022-09-08 15:42:38	2022-09-08 15:42:38
BK22007893	14	전문가	보통 인덕션이 화력이 약하다고 아는 사람들이 많은데 사실 인덕션이 가스레인지보다 화력이 좋아. 실제로 물이 끓는 시간을 비교하면 인덕션이 1.5배에서 2배 빠르거든.	인덕션 가스레인지 화력	http://www.mkhealth.co.kr/news/articleView.html?idxno=53419	2021/06/07	0	2022-09-08 15:42:38	2022-09-08 15:42:38
BK22007893	15	질문자	정말이야? 당연히 화력이 떨어질 줄 알았는데 아니라니 놀랍네. 근데 인덕션은 청소할 때도 주의를 해야한다던데 어떻게 해야하는거야?				0	2022-09-08 15:42:38	2022-09-08 15:42:38
BK22007893	16	전문가	인덕션을 청소할 때는 꼭 전용 세제랑 스크래퍼를 사용해야 해. 가스레인지를 닦을 때 처럼 젖은 행주나 주방 세제로 닦으면 부품이 심각하게 망가질 수 있거든.	인덕션 청소	http://www.segyebiz.com/newsView/20210616515336?OutUrl=naver	2021/06/16	0	2022-09-08 15:42:38	2022-09-08 15:42:38
BK22007893	17	질문자	그럼 인덕션으로 바꾸면 전용용기도 사야하고 전용 세제까지 준비를 해야하는거네. 하이라이트는 혹시 어떤 단점이 있을까?				0	2022-09-08 15:42:38	2022-09-08 15:42:38
BK22007893	18	전문가	하이라이트는 상판이 세라믹으로 되있어서 오염 관리하기는 쉬운데 전원을 끄더라도 열기가 잠시 동안은 남아 있기 때문에 사용하고 나서 화재나 화상의 위험이 있어서 조심을 해야하는 단점이 있어.	하이라이트 단점	https://www.sisunnews.co.kr/news/articleView.html?idxno=106027	2019/05/30	0	2022-09-08 15:42:38	2022-09-08 15:42:38
BK22007893	19	질문자	아이들이 있는 집이면 그런 건 특히 위험하겠다. 각각 장단점이 있어서 고르기가 힘들겠는 걸. 좀 더 고민 해봐야겠다.				0	2022-09-08 15:42:38	2022-09-08 15:42:38
BK22007893	20	전문가	이사가기 전 까지 골라야할텐데 시간이 많진 않겠네. 이사 준비 잘 하고 궁금한 거 있으면 또 연락줘.				0	2022-09-08 15:42:38	2022-09-08 15:42:38
BK22007893	21	질문자	응 아무래도 너한테 몇 번 더 연락하지 싶어. 그럼 들어가고 나중에 또 봐.				1	2022-09-08 15:42:38	2022-09-22 10:04:08
