id	utterance_id	role	text	search_query	search_URL	reference_date	terminate	regDate	updDate
BK22017694	1	질문자	내가 요즘 모나미 볼펜이 다 떨어져서 사러 가려고 하는데, 모나미 역사가 아주 길다고 들어서 모나미에 대해서 궁금해지더라. 너도 모나미 볼펜 써 봤지?				0	2022-10-20 14:04:28	2022-10-27 15:01:41
BK22017694	2	전문가	그럼, 나도 써 봤지. 나도 예전에 모나미가 궁금해서 이것저것 찾아봤었는데, 궁금한 게 있으면 물어봐.				0	2022-10-20 14:04:28	2022-10-20 14:04:28
BK22017694	3	질문자	잘됐네, 그럼 내가 많이 썼던 볼펜 브랜드라, 좀 물어볼게. 모나미는 언제 만들어진 회사야?				0	2022-10-20 14:04:28	2022-10-27 15:01:41
BK22017694	4	전문가	사업을 시작한 건 1960년이었어. 그때는 회화구류를 생산하는 광신화학공업이었는데, 지금은 62년째 우리나라 필기구를 만들고 있지.	모나미 설립	https://news.g-enews.com/ko-kr/news/article/news_all/202108061710548657bc88014e31_1/article.html?md=20210809100150_U	2021/08/11	0	2022-10-20 14:04:28	2022-10-20 14:04:28
BK22017694	5	질문자	와, 62년째라니 역사가 있네. 모나미 153 모델이 어떻게 만들어졌는지 궁금해.				0	2022-10-20 14:04:28	2022-10-20 14:04:28
BK22017694	6	전문가	153모델을 고안한 건 1962년, 모나미의 창업주인 송삼석 회장이 국내에서 열린 국제산업박람회에 참석했을 때부터야. 그때 송 회장은 잉크가 필요없는 신기한 필기구를 보았고, 당시 국내 필기구의 단점을 보완할 수 있겠다고 확신했어. 그 후, 잉크 기술을 연구한 끝에 1963년 5월 1일, 유성 볼펜 모나미 153이 탄생됐지.	모나미 153 탄생	https://news.g-enews.com/ko-kr/news/article/news_all/202108061710548657bc88014e31_1/article.html?md=20210809100150_U	2021/08/11	0	2022-10-20 14:04:28	2022-10-20 14:04:28
BK22017694	7	질문자	볼펜을 신기하게 보았다면, 그때는 우리나라에 볼펜이 수입되지 않았었나 보네. 당시 우리나라 필기구로는 어떤 게 있었어?				0	2022-10-20 14:04:28	2022-10-27 15:01:41
BK22017694	8	전문가	1960년대에는 주로 잉크를 찍어 써야 하는 만년필 타입을 썼지. 잉크를 엎지르면 필기한 내용을 망치게 되는 경우가 많았는데, 은행에서도 통장에 잉크를 엎지르는 일이 종종 있었어.	1960년대 필기구	https://www.metroseoul.co.kr/article/20220818500195	2022/08/18	0	2022-10-20 14:04:28	2022-10-20 14:04:28
BK22017694	9	질문자	그럼 볼펜이 정말 혁신적인 제품이었겠다. 요즘도 싼 편인 것 같은데, 그때 모나미 가격은 얼마였어?				0	2022-10-20 14:04:28	2022-10-27 15:01:41
BK22017694	10	전문가	그건 모나미 153이라는 이름을 보면 알 수 있어. 숫자 15는 1963년 모나미가 출시할 당시 서울 시내버스 요금 및 신문 한 부 가격에 상응한다는 뜻이고, 뒤에 붙는 숫자 3은 모나미가 만든 세 번째 제품이라는 의미야.	모나미 출시 가격	https://www.metroseoul.co.kr/article/20220818500195	2022/08/18	0	2022-10-20 14:04:28	2022-10-20 14:04:28
BK22017694	11	질문자	서울 시내버스 요금 값으로 볼펜을 살 수 있다는 뜻이었구나. 그럼 모나미라는 이름은 무슨 뜻이야?				0	2022-10-20 14:04:28	2022-10-27 15:01:41
BK22017694	12	전문가	프랑스어로 monami가 나의 친구라는 뜻인데, 거기서 이름을 따와 볼펜의 몸체에 새겼지.	모나미 뜻	https://www.thescoop.co.kr/news/articleView.html?idxno=54156	2022/04/27	0	2022-10-20 14:04:28	2022-10-20 14:04:28
BK22017694	13	질문자	나의 친구라, 의미가 좋네. 며칠 전에 친구가 한정판 모나미 볼펜을 있다고 자랑하는 거 있지. 그런데 모나미 볼펜이 한정판도 있었다니 금시초문인데, 혹시 어떤 건지 알아?				0	2022-10-20 14:04:28	2022-10-27 15:01:41
BK22017694	14	전문가	그건 지난 2014년때인데, 153 볼펜 출시 50주년을 맞아 모나미 153 리미티드를 출시했어. 그때 고급화 전략으로 육각 모양은 그대로 살리되 바디를 메탈 소재로 만들고, 고급 리필심을 적용했지.	모나미 50주년 한정판	https://www.metroseoul.co.kr/article/20220818500195	2022/08/18	0	2022-10-20 14:04:28	2022-10-20 14:04:28
BK22017694	15	질문자	메탈 소재의 모나미 볼펜이라니, 실물로 보고 싶네. 그때 한정판 볼펜은 얼마에 팔았어?				0	2022-10-20 14:04:28	2022-10-20 14:04:28
BK22017694	16	전문가	당시 2만원대였는데, 한정판이라서 1만개만 팔았어. 그런데 출시한 지 1시간 만에 품절되고 중고시장에서 가격이 수십 배 올라 거래되는 등, 반응이 뜨거웠지.	모나미 50주년 한정판 가격	https://www.metroseoul.co.kr/article/20220818500195	2022/08/18	0	2022-10-20 14:04:28	2022-10-20 14:04:28
BK22017694	17	질문자	1시간만에 품절이라니 인기가 대단하구나. 지난 광복절에도 새로운 제품을 만들었던 것 같은데, 그건 어떤 거였어?				0	2022-10-20 14:04:28	2022-10-20 14:04:28
BK22017694	18	전문가	맞아, 광복 77주년을 기념해 153 CLIP 8.15 광복절 기획세트를 팔았었어. 그 세트는 총 6개로 구성되었는데 각각, 제주해녀항일운동, 조선어학회, 제2독립만세운동, 영화 아리랑, 대한여자애국단, 동의의국을 의미하고, 이 활동에 대한 설명을 담았지. 이 세트는 딱 5000개만 한정 판매했어.	모나미 광복절	http://kr.aving.net/news/articleView.html?idxno=1770315	2022/08/01	0	2022-10-20 14:04:28	2022-10-27 15:01:41
BK22017694	19	질문자	5000개 한정이라, 너무 적긴하지만 소장하는 의미가 있겠어. 나도 정말 사고 싶다. 오늘 이것저것 알려줘서 고맙지만, 난 그만 나가봐야 해서 나중에 마저 얘기해도 될까?				0	2022-10-20 14:04:28	2022-10-27 15:01:41
BK22017694	20	전문가	그럼, 당연하지. 나도 대화하느라 재밌었어, 조심히 가고 나중에 또 보자.				1	2022-10-20 14:04:28	2022-10-27 15:01:41
