id	utterance_id	role	text	search_query	search_URL	reference_date	terminate	regDate	updDate
BK22016318	1	질문자	하루 종일 컴퓨터 작업을 해서 그런지 어깨와 허리가 뻐근해요. 마사지기를 사서 자기전에 해보려는데, 클럭이랑 픽스가 눈에 띄더라구요. 둘 중에 어떤게 더 무거운가요?				0	2022-10-17 13:21:05	2022-10-17 13:21:05
BK22016318	2	전문가	픽스 본체가 클럭 본체보다 사이즈가 더 크고 무게도 픽스는 20그램, 클럭은 12.8그램으로 픽스가 더 무거워요. 워낙 근소한 차이지만 픽스가 조금 더 무겁다고 보시면 돼요.	클럭 픽스 무게	https://it.donga.com/29928/	2019/12/30	0	2022-10-17 13:21:05	2022-10-17 14:03:24
BK22016318	3	질문자	둘다 그렇게 무거운 편은 아니네요. 무거우면 잘 떨어지진 않을까 걱정이었거든요. 마사지 패드는 영구적으로 붙일 수 있는건가요?				0	2022-10-17 13:21:05	2022-10-20 17:41:49
BK22016318	4	전문가	픽스, 클럭 두 제품 모두 마사지 패드에 하이드로겔이 적용 되어 있어서 사용할수록 접착력이 떨어져요. 대신 마사지 패드를 흐르는 물에 씻어서 자연 건조 시키면 접착력이 되돌아 온다는 장점이 있답니다.	클럭 픽스 접착력	https://it.donga.com/29928/	2019/12/30	0	2022-10-17 13:21:05	2022-10-17 14:03:24
BK22016318	5	질문자	다시 씻어 사용하더라도 마사지 패드를 영구적으로 사용하는건 어려워 보이네요. 마사지 패드 사이즈는 어떤 것이 더 큰가요?				0	2022-10-17 13:21:05	2022-10-17 14:03:24
BK22016318	6	전문가	클럭은 마사지 패드 크기가 2종류에요. 하나는 가로 128밀리미터, 세로 54밀리미터이고, 또 다른 하나는 가로 175밀리미터, 세로 68밀리미터에요. 마사지 부위에 따라서 원하는 마사지 패드를 선택해서 붙일 수 있다는 장점이 있어요. 픽스 또한 마사지 패드가 2개지만 사이즈는 두개 다 동일해요. 크기는 가로 140밀리미터, 세로는 66밀리미터로, 클럭에서 제공하는 기본 패드보다는 사이즈가 크기 때문에 활용도가 높다는 것이 장점이에요.	클럭 픽스 마사지패드 크기	https://it.donga.com/29928/	2019/12/30	0	2022-10-17 13:21:05	2022-10-17 14:03:24
BK22016318	7	질문자	동일한 사이즈를 원하면 픽스, 여러가지 크기를 원한다면 클럭이 알맞겠네요. 저주파 마사지기는 마사지 모드가 다양한게 좋을 것 같은데, 픽스는 몇가지의 마사지 모드가 제공되나요?				0	2022-10-17 13:21:05	2022-10-24 08:44:15
BK22016318	8	전문가	픽스의 마사지 모드는 안마와 길게 두드림, 침, 두드림, 두드림과 침, 리듬 마사지, 자동 마사지 등 7가지 모드가 있어요. 자동 마사지는 앞서 말한 6가지 종류의 마사지를 종합적으로 작동하는 거에요. 각각의 모드를 선택한 다음 강도를 조절하면 15분 동안 마사지를 이용할 수 있어요. 마사지 강도는 총 9단계까지 조절 가능하고요.	픽스 마사지 모드	https://it.donga.com/29928/	2019/12/30	0	2022-10-17 13:21:05	2022-10-20 17:41:49
BK22016318	9	질문자	픽스는 생각보다 마사지 작동법이 간단할 것 같아요. 그럼 클럭은 마사지 모드가 어떻게 구성되어 있나요?				0	2022-10-17 13:21:05	2022-10-17 14:03:24
BK22016318	10	전문가	클럭은 블루, 화이트 모드 단 두 가지의 마사지 모드가 있어요. 이 두 모드 다 픽스의 자동 마사지 모드와 동일하다고 이해하면 되는데요. 블루 모드는 강하게 두드리는 모드와 주무름, 기본 마사지가 혼합된 모드이며, 화이트 모드는 기본 마사지, 침, 약한 세기의 두드림 모드가 혼합되어 있는 모드에요.	클럭 마사지 모드	https://it.donga.com/29928/	2019/12/30	0	2022-10-17 13:21:05	2022-10-20 17:41:49
BK22016318	11	질문자	약한 걸 원하는지 강한걸 원하는지에 따라서 블루, 화이트 모드를 선택하면 되는거구나, 두 제품의 구성에도 차이가 있나요?				0	2022-10-17 13:21:05	2022-10-17 14:03:24
BK22016318	12	전문가	클럭 미니 마사지기SE, 픽스 EMS 저주파 마사지기 두가지 제품을 비교해 보았을 때, 픽스는 1가지 구성이지만 옵션으로 본체, 마사지 패드를 추가 구매 할수 있고요. 클럭은 SE 패키지 이외에도 리모컨이 있는 S 패키지, 본체 2개와 리모컨 1개 구성의 Duo 패키지 등 여러 패키지 중에서 선택할 수 있어요.	클럭 픽스 구성	https://it.donga.com/29928/	2019/12/30	0	2022-10-17 13:21:05	2022-10-17 14:03:24
BK22016318	13	질문자	클럭이 선택권이 조금 더 다양해 보이네요. 두 제품 다 LED창이 있다고 하던데, LED창을 통해서 어떤 걸 확인 할수 있는거에요?				0	2022-10-17 13:21:11	2022-10-17 14:03:24
BK22016318	14	전문가	픽스는 본체 상단 부분에 커다란 LED가 있는데 여기에는 마사지 강도를 의미하는 숫자가 표시돼요. 클럭은 본체의 중앙 부분에 작은 LED가 있는데, 여기에는 마사지 모드의 색상이 나온답니다. 즉 LED창을 통해서 픽스는 마사지의 강도를, 클럭은 마사지 모드를 확인 할수 있는거죠.	클럭 픽스 LED	https://it.donga.com/29928/	2019/12/30	0	2022-10-17 13:21:11	2022-10-17 14:03:24
BK22016318	15	질문자	색상과 숫자로 현재 받고 있는 마사지에 대한 정보를 알려주는거네요. 그럼 두 제품 가격은 어떻게 되나요?				0	2022-10-17 13:21:11	2022-10-17 14:03:24
BK22016318	16	전문가	판매 가격은 클럭이 39,900원, 픽스는 29,800원이에요. 두 제품 모두 장단점이 뚜렷한 것이 특징이라 할 수 있어요.	클럭 픽스 가격	https://it.donga.com/29928/	2019/12/30	0	2022-10-17 13:21:11	2022-10-24 08:44:15
BK22016318	17	질문자	만원차이는 큰 금액은 아니라서 그런지 선택하는데 고민이 더 깊어지네요.				0	2022-10-17 13:21:19	2022-10-17 14:03:24
BK22016318	18	전문가	금액에 대한 차이가 크지 않다면, 본인에게 필요한 기능이 어떤 것인지와 취향 등을 따져서 선택하시는게 좋아요.				0	2022-10-17 13:21:19	2022-10-17 14:03:24
BK22016318	19	질문자	그렇겠네요. 두 제품 모두 마음에 드는데 조금 더 고민해 봐야겠어요. 오늘 유용한 정보 공유해 주셔서 감사해요.				1	2022-10-17 13:21:19	2022-10-25 11:23:36
BK22016318	20	전문가	네, 신중하게 선택해서 오래 사용하시길 바라요. 그럼 다음에 또 대화 나눠요. 안녕히 가세요.				0	2022-10-17 13:21:19	2022-10-17 14:03:24
