id	utterance_id	role	text	search_query	search_URL	reference_date	terminate	regDate	updDate
BK22009197	1	질문자	요즘 슬슬 날씨가 쌀쌀해지네요. 겨울철을 대비해서 다운 재킷 하나 마련하고 싶어서 알아보고 있는데 생소한 용어가 많더라고요. 다운 재킷의 충전도라는 게 대체 뭔가요?				0	2022-09-21 17:46:27	2022-09-25 22:15:15
BK22009197	2	전문가	솜털과 깃털의 비율을 충전도라고 해요. 깃털보다 솜털 비중이 높을 수록 보온력이 좋은데 이는 솜털이 깃털보다 공기를 많이 품을 수 있기 때문이죠.	다운 재킷 솜털 깃털 충전도	https://www.khan.co.kr/economy/market-trend/article/201311272127505	2013/11/27	0	2022-09-21 17:46:27	2022-09-29 13:57:43
BK22009197	3	질문자	새의 털에도 종류가 있다는 건 처음 알았네요. 그럼 그 충전 비율이 어느 정도 되야 쓸만한 제품인가요?				0	2022-09-21 17:46:27	2022-09-25 22:15:15
BK22009197	4	전문가	다운, 즉 새의 가슴 솜털이 충전재 중 75퍼센트 이상 포함되어야 제대로 된 제품이에요. 충전도가 8대 2 정도면 우수한 품질로 보고요.	다운 재킷 충전도 품질	https://www.khan.co.kr/economy/market-trend/article/201311272127505	2013/11/27	0	2022-09-21 17:46:27	2022-09-25 22:15:15
BK22009197	5	질문자	말씀해 주신 것들을 꼭 고려해서 사야 겠네요. 맞다, 재킷 팔 부분에 새겨진 숫자들은 뭔가요? 브랜드 불문하고 있던데 그것도 제품의 스펙을 나타내는 정보인가요?				0	2022-09-21 17:46:27	2022-09-25 22:15:15
BK22009197	6	전문가	다운 재킷의 팔 부분에 새겨져 있는 100단위 숫자들 말씀하시는 거죠? 그게 필파워에요. 필파워는 솜털 28그램을 24시간 압축한 뒤 압축을 해제했을 때 부풀어 오르는 복원력을 의미하죠.	다운 재킷 숫자 필파워 복원력	https://sports.donga.com/3/all/20141208/68425126/3	2014/12/09	0	2022-09-21 17:46:27	2022-09-25 22:15:15
BK22009197	7	질문자	아, 역시 그것도 다 의미가 있었네요. 그런데 재킷의 복원력, 그러니까 필파워가 크면 뭐가 좋은거죠?				0	2022-09-21 17:46:27	2022-09-25 22:15:15
BK22009197	8	전문가	공기를 많이 품고 있는 다운 재킷일수록 필파워 수치가 높아요. 따라서 보온력이 탁월하죠.	필파워 다운 재킷 보온성	https://sports.donga.com/3/all/20141208/68425126/3	2014/12/09	0	2022-09-21 17:46:27	2022-09-25 22:15:15
BK22009197	9	질문자	아하, 공기층이 두꺼우니까 보온성이 더 좋겠네요. 그럼 필파워가 어느 정도 되어야 좋은 제품으로 취급되나요?				0	2022-09-21 17:46:27	2022-09-21 17:46:27
BK22009197	10	전문가	일반적으로 필파워가 600을 넘으면 훌륭한 다운재킷으로 평가되죠. 850을 넘으면 최고급 제품이고요. 단, 일부 브랜드는 필파워가 아닌 자신들이 만든 평가수치를 표시하기도 하니까 주의하셔야 해요.	다운 재킷 필파워 수치 최고급	https://sports.donga.com/3/all/20141208/68425126/3	2014/12/09	0	2022-09-21 17:46:27	2022-09-25 22:15:15
BK22009197	11	질문자	필파워도 잘 보고 사야 겠군요. 그런데 다운 재킷 상품들을 보면 보통 거위털이랑 오리털로 나뉘잖아요? 거위털이 더 고급인 이유는 뭔가요?				0	2022-09-21 17:46:27	2022-09-25 22:15:15
BK22009197	12	전문가	오리털보다 거위털이 더 길쭉하고 크기 때문에 더 따뜻한 털로 취급되고 있어요. 추운 지역에서 자랄 수록 털이 항온 유지를 위해 더 크고 탄성이 좋거든요. 그래서 더 고급인 거예요.	다운 재킷 거위털 오리털 고급	http://www.busan.com/view/busan/view.php?code=20131227000026	2013/12/27	0	2022-09-21 17:46:27	2022-09-25 22:15:15
BK22009197	13	질문자	그래서 거위털을 오리털보다 더 쳐주는 거였군요. 아, 다운 재킷의 겉감은 어떤 겉감이 좋나요?				0	2022-09-21 17:46:27	2022-09-25 22:15:15
BK22009197	14	전문가	눈이나 비를 막아줄 수 있는 소재를 써야 해요. 습기가 발생하면 내부 충전재가 젖어버리고, 그렇게 되면 공기층을 만드는 털이 뭉쳐지면서 보온 능력이 저하되거든요.	다운 재킷 소재 습기	https://sports.donga.com/3/all/20141208/68425126/3	2014/12/09	0	2022-09-21 17:46:27	2022-09-25 22:15:15
BK22009197	15	질문자	한마디로 방수 기능이 제일 중요하다는 거군요. 혹시 KS마크처럼 다운 재킷에도 공신력 있는 인증 제도 같은 게 있나요?				0	2022-09-21 17:46:27	2022-09-25 22:15:15
BK22009197	16	전문가	한국의류시험연구원에서 품질이 최고급인 다운재킷에는 엑설런트 골드 다운, 친환경제품에는 EQ 인증마크를 수여하고 있어요.	다운 재킷 한국의류시험연구원	https://www.khan.co.kr/economy/market-trend/article/201311272127505	2013/11/27	0	2022-09-21 17:46:27	2022-09-25 22:15:15
BK22009197	17	질문자	참고해야겠네요. 원래 제가 물건을 대충 사는 스타일인데 다운 재킷은 가격이 비싸다 보니 좀 더 깐깐하게 살 수 밖에 없는 거 같아요.				0	2022-09-21 17:46:27	2022-09-29 13:57:43
BK22009197	18	전문가	맞아요. 아무래도 다운 재킷은 가격대가 있는 편이니 꼼꼼하게 보고 사는 게 현명하죠.				0	2022-09-21 17:46:27	2022-09-25 22:15:15
BK22009197	19	질문자	그럼 저는 이제 구매하러 가 볼게요. 오늘도 질문에 친절하게 답해 주셔서 정말 감사합니다. 덕분에 쇼핑에 큰 도움이 됐어요.				1	2022-09-21 17:46:27	2022-09-29 13:57:43
BK22009197	20	전문가	제가 도움이 됐다니 기쁘네요. 다음에도 모르는 게 있으면 질문 주세요.				0	2022-09-21 17:46:27	2022-09-25 22:15:15
