id	utterance_id	role	text	search_query	search_URL	reference_date	terminate	regDate	updDate
BK22004793	1	질문자	재택을 많이 하다보니 집에서 커피마실 일이 많네요. 배달을 매번 시켜먹기도 그렇고 집에 커피머신이나 드립용품을 살까봐요.				0	2022-08-05 14:53:02	2022-08-05 14:53:02
BK22004793	2	전문가	커피머신 하나 사두시면 카페를 가지 않아도 맛있는 커피를 마실 수 있으니 좋죠. 생각해두신 커피머신이 있으세요?				0	2022-08-05 14:53:02	2022-08-05 14:53:02
BK22004793	3	질문자	아직까지는 생각해둔 제품이 따로 없어요. 커피머신 종류도 다양하게 있더라고요.				0	2022-08-05 14:53:02	2022-08-05 14:53:02
BK22004793	4	전문가	맞아요. 국내에서 접할 수 있는 커피머신은 추출법이나 작동 방식에 따라 종류가 나뉘어요. 커피메이커, 전자동과 반자동 에스프레소 머신, 캡슐커피 머신 등의 종류가 있죠. 궁금이 님의 성향에 따라서 어떤 제품이 맞을지 확인해 봐야 해요.	커피머신 종류	https://it.donga.com/101747/	2022/02/10	0	2022-08-05 14:53:02	2022-08-05 14:53:02
BK22004793	5	질문자	커피머신에도 많은 종류가 있군요. 캡슐커피 머신은 뭔지 알겠는데 에스프레소 머신은 뭐죠?				0	2022-08-05 14:53:02	2022-08-05 14:53:02
BK22004793	6	전문가	카페에서 커피 내리는 거 보신 적 있으세요? 그 기계가 반자동 에스프레소 머신이예요. 전자동 에스프레소 머신은 에스프레소 추출 과정 전부를 기계가 해주는 거고요.	에스프레소머신은	https://it.donga.com/101747/	2022/02/10	0	2022-08-05 14:53:02	2022-08-05 14:53:02
BK22004793	7	질문자	카페에서 쓰는 게 에스프레소 머신이군요. 그럼 커피메이커는 뭔가요?				0	2022-08-05 14:53:02	2022-08-05 14:53:02
BK22004793	8	전문가	커피메이커는 미국에서 개발되어서 인기를 끌었던 커피머신이예요. 커피메이커를 이용해서 원두 가루로 연하게 커피를 내릴 수 있었죠.	커피메이커는	http://www.ohmynews.com/NWS_Web/Series/series_premium_pg.aspx?CNTN_CD=A0002836658&CMPT_CD=P0010&utm_source=naver&utm_medium=newsearch&utm_campaign=naver_news	2022/05/21	0	2022-08-05 14:53:02	2022-08-22 16:25:06
BK22004793	9	질문자	커피메이커는 예전에 저희집에도 있었던 것 같네요. 지금은 버렸지만요. 수동으로 커피를 갈아서 내리는 방법도 분위기있고 좋을 것 같아요.				0	2022-08-05 14:53:02	2022-08-05 14:53:02
BK22004793	10	전문가	수동으로 커피를 내리는 방법도 좋죠. 수동 커피 브루어 모카포트를 아시나요? 모카포트는 집에서 간편하게 쓸 수 있는 수동 커피 도구예요. 전자동 커피머신에 비해 가격이 저렴하고 모카포트와 전자동 커피머신으로 내린 커피의 맛이 큰 차이가 없어서 커피애호가들에게는 장기적으로 더 좋은 선택이 될 수 있죠.	수동 커피	http://www.joongdo.co.kr/web/view.php?key=20220704010000755	2022/07/06	0	2022-08-05 14:53:02	2022-08-05 14:53:02
BK22004793	11	질문자	모카포트는 처음 들어 봤어요. 모카포트는 어떻게 생긴 제품인가요?				0	2022-08-05 14:53:02	2022-08-05 14:53:02
BK22004793	12	전문가	모카포트는 작은 주전자 모양으로 생겼어요. 불 위에 올려서 에스프레소를 뽑는다는 뜻의 스토브 톱 에스프레소가 원래 이름이죠. 이탈리아는 90퍼센트가 넘는 가정에서 모카포트를 쓰고 있고 대대로 물려주기도 해요.	모카포트 모양	https://www.hankyung.com/economy/article/2019092260631	2019/09/23	0	2022-08-05 14:53:02	2022-08-05 14:53:02
BK22004793	13	질문자	저는 생소한 기계인데 이탈리아에서는 거의 전 국민이 사용하고 있는 커피머신이군요. 저도 한번 사용해 보고 싶은데 어떻게 사용하는 건지 알려주세요.				0	2022-08-05 14:53:02	2022-08-05 14:53:02
BK22004793	14	전문가	모카포트 사용법을 알려드릴게요. 먼저 원두를 필터에 넣고 하단 포트에 물을 담아요. 조립한 후에 모카포트를 가스레인지 위에 올려 끓이면 수증기가 압력밸브를 통해서 필터까지 가게 돼요. 이 때 수증기와 물이 섞이고 수증기의 양이 많아지면서 포트 위쪽의 추출구에서 커피가 나오게 돼요.	모카포트 사용법	http://www.econovill.com/news/articleView.html?idxno=244392	2015/05/29	0	2022-08-05 14:53:02	2022-08-22 16:25:06
BK22004793	15	질문자	생각보다 사용법이 많이 어렵지 않네요. 모카포트는 저렴하다고 하셨는데 가격대가 어느정도일까요?				0	2022-08-05 14:53:02	2022-08-05 14:53:02
BK22004793	16	전문가	모카포트는 2만원에서 3만원대로 에스프레소 머신은 수백만원 하는 것에 비해 많이 저렴하죠. 가격도 저렴하고 사용하기도 편리하니까 그 정도면 충분히 훌륭한 에스프레소 기계라고 할 수 있죠.	모카포트 가격	http://news.imaeil.com/page/view/2015021205441978889	2015/02/12	0	2022-08-05 14:53:02	2022-08-05 14:53:02
BK22004793	17	질문자	모카포트가 가격도 저렴하고 이탈리아 사람들 90퍼센트가 쓰고 있다고 하니 저도 써보고 싶어졌어요. 모카포트 주의사항은 따로 없나요?				0	2022-08-05 14:53:02	2022-08-05 14:53:02
BK22004793	18	전문가	모카포트는 세척과 보관에 주의해야 해요. 알루미늄으로 만들어진 모카포트는 세제를 사용하지 말고 물과 손으로만 닦아줘야 해요. 세척을 다 하면 통풍이 잘 되는 곳에서 말려줘야 하고요.	모카포트 세제	http://www.dailypop.kr/news/articleView.html?idxno=56355	2021/12/14	0	2022-08-05 14:53:02	2022-08-05 14:53:02
BK22004793	19	질문자	세제를 안써도 된다니 오히려 좋네요. 모카포트가 있으면 캠핑을 가서도 커피를 내려먹을 수 있겠어요. 덕분에 좋은 제품을 알았네요.				0	2022-08-05 14:53:02	2022-08-05 14:53:02
BK22004793	20	전문가	도움이 될 수 있어서 다행이네요. 모카포트에 대해 궁금한 게 더 있으세요?				0	2022-08-05 14:53:02	2022-08-05 14:53:02
BK22004793	21	질문자	아니요, 이제 제가 직접 쓰면서 알아가 볼래요. 그럼 저는 모카포트를 구경하러 가봐야겠어요. 다음에 또 궁금한게 있으면 문의드릴게요.				0	2022-08-05 14:53:02	2022-08-05 14:53:02
BK22004793	22	전문가	마음에 딱 드는 모카포트를 발견하시기를 바라요. 다음에 또 뵈어요.				1	2022-08-05 14:53:02	2022-08-22 16:25:06
