id	utterance_id	role	text	search_query	search_URL	reference_date	terminate	regDate	updDate
BK22016441	1	질문자	건전지는 왜 사도 또 사도 모자란 것 같지? 몇 팩을 쟁여둔 게 엊그제 같은데, 또 텅텅 비었어.				0	2022-10-18 12:33:31	2022-10-18 12:33:34
BK22016441	2	전문가	아무래도 건전지가 필요한 제품들이 한 둘이 아니니까, 그럴 수 있지. 오늘 또 새로 구매해야 겠네?				0	2022-10-18 12:33:31	2022-10-18 14:42:54
BK22016441	3	질문자	응, 오늘은 시간이 없고 내일 잔뜩 사 놓으려고. 그런데 점점 더 브랜드가 다양해지는 것 같아. 가격대도 천차만별이던데, 가격대비 성능 차이가 많이 나려나?				0	2022-10-18 12:33:34	2022-10-18 14:42:54
BK22016441	4	전문가	한국소비자원에서 시행한 조사에 따르면 선호도가 높은 건전지 브랜드 20종을 대상으로 가격 대비 성능과 지속시간, 안전성 등을 시험했을 때 가격 대비 성능 차이가 크게 났어. 100원당 AA형은 최대 6.3배, AAA형은 최대 7.3배나 차이를 보였지.	한국소비자원 건전지시험	http://www.wsobi.com/news/articleView.html?idxno=62789	2018/07/20	0	2022-10-18 12:33:34	2022-10-20 17:14:12
BK22016441	5	질문자	생각보다 차이가 훨씬 크네. 그럼 가격 대비 성능 외에 안전성이나 지속시간의 시험 결과는 어땠어?				0	2022-10-18 12:33:38	2022-10-18 14:42:54
BK22016441	6	전문가	내누액 등의 안전성 면에서는 다행히 모든 제품에 이상이 없었어. 하지만 얼마나 오래 사용할 수 있는지를 시험하는 지속시간에 있어서는 제품별 결과가 상이했지.	한국소비자원 건전지시험	http://www.wsobi.com/news/articleView.html?idxno=62789	2018/07/20	0	2022-10-18 12:33:38	2022-10-20 17:14:12
BK22016441	7	질문자	그렇구나, 안전성에 가성비까지 시험해준 평가라고 하니 어떤 브랜드 제품이 나은지 꼭 참고해봐야겠다. 그리고 또 하나 궁금한 게 있는데, 건전지는 외관만 봐서는 잔량을 알 수가 없잖아. 따로 잔량을 가늠해볼만한 방법이 없을까?				0	2022-10-18 12:33:38	2022-10-21 14:28:05
BK22016441	8	전문가	그럴 땐 건전지를 살짝 들어서 바닥에 떨어트려보면 돼. 건전히 하나 크기 정도의 높이에서 떨어뜨리면 되는데, 건전지에 잔량이 있으면 바닥에 서지만 잔량이 없으면 바닥에 쓰러지지.	헌 건전지 구별	https://www.edaily.co.kr/news/read?newsId=01157846625639032&mediaCodeNo=257&OutLnkChk=Y	2020/01/18	0	2022-10-18 12:33:38	2022-10-18 14:42:54
BK22016441	9	질문자	우와, 그것 참 간편하고 쉬운 방법이네! 어떻게 그 방법으로 건전지의 잔량을 확인할 수 있는 거야?				0	2022-10-18 12:33:41	2022-10-18 14:42:54
BK22016441	10	전문가	알카라인 건전지의 구성 물질에는 아연 성분이 있는데, 건전지를 사용하면 아연이 산화하게 돼. 산화된 아연은 마치 스프링처럼 통통 튀는 성질을 지니고 있지. 그래서 다 쓴 건전지를 5cm가량의 높이에서 떨어뜨리면 꼿꼿하게 서지 못하고 통통 튀어 눕게되는 거야.	건전지 구별 아연	https://www.mk.co.kr/news/society/view/2017/07/467839/	2017/07/13	0	2022-10-18 12:33:41	2022-10-21 14:28:05
BK22016441	11	질문자	생각보다 되게 과학적인 방법이었구나. 그리고 건전지를 대량으로 사두다보면, 마지막에 쓰는 건전지는 수명이 조금 짧아지는 것 같던데. 건전지의 수명을 유지하면서 보관하려면 어떻게 해야 해?				0	2022-10-18 12:33:41	2022-10-18 14:42:54
BK22016441	12	전문가	건전지를 여러 개 구입했는데, 2~3개만 사용하고 나머지는 보관해야 한다면 냉장고에 넣어두는 방법도 있어. 건전지 냉장 보관법은 제품의 자가 방전 시점을 늦춰주기 때문에 여러 누리꾼들 사이에서도 많은 주목을 받았던 방법이지.	건전지 냉장고 보관	https://sports.khan.co.kr/bizlife/sk_index.html?cat=view&art_id=201502081712503&sec_id=562901&pt=nv	2015/02/08	0	2022-10-18 12:33:45	2022-10-18 14:42:54
BK22016441	13	질문자	우와, 그것도 정말 신박한 보관 방법이다. 그 방법 외에 혹시 내가 주의해야될 점으로는 뭐가 있을까?				0	2022-10-18 12:33:45	2022-10-18 14:42:54
BK22016441	14	전문가	가장 피해야 하는 건 새 건전지와 헌 건전지, 그리고 잔량이 조금 남은 건전지를 한 곳에 보관하는 습관이야. 새 제품과 헌 제품을 구분하지 않은 채 같이 두면, 에너지가 높은 곳에서 낮은 쪽으로 흘러 수명이 조금 남은 건전지가 오히려 충전될 수 있거든. 그렇게되면 전체 건전지의 사용가능 용량도 줄어들고, 에너지를 받은 건전지는 충격을 받아 누액이 흘러나올 수도 있어.	건전지 보관 방법	https://www.mk.co.kr/news/society/view/2017/07/467839/	2017/07/13	0	2022-10-18 12:33:45	2022-10-21 13:55:59
BK22016441	15	질문자	누액이 흘러나올 수도 있다니 충격적이네. 그러고보니 건전지가 터지는 사고도 왕왕 발생하던데. 건전지 폭발에는 어떤 요인들이 있는 거야?				0	2022-10-18 12:33:45	2022-10-18 14:42:54
BK22016441	16	전문가	사용권장기한이 지난 건전지를 사용하거나, 고온의 장소에 제품을 보관하거나, 건전지의 음극과 양극 부분에 다른 금속류나 전선이 닿았을 때 폭발의 요인이 될 수 있어.	건전지 폭발요인	http://www.consumernews.co.kr/news/articleView.html?idxno=501858	2015/04/30	0	2022-10-18 12:33:45	2022-10-18 14:42:54
BK22016441	17	질문자	기한 지난 건전지 사용이 위험할 수도 있다니, 생각없이 썼었는데 앞으로 조심해야겠다. 그럼 혹시 전지 연결만 제대로 한다면 다른 브랜드 제품을 섞어서 쓰는 건 괜찮을까?				0	2022-10-18 12:33:50	2022-10-21 14:28:05
BK22016441	18	전문가	그렇지 않아, 전지를 섞어서 쓰게되면 과방전의 원인이 될 수 있거든. 그래서 제조사는 물론이고 용량도 동일한 전지를 사용하는 게 좋아.	건전지 과방전	https://www.segye.com/newsView/20180829001267?OutUrl=naver	2018/08/29	0	2022-10-18 12:33:50	2022-10-18 14:42:54
BK22016441	19	질문자	오늘 몰랐던 점을 많이 배워가네, 고마워. 이번에 구매하게 되면 보관부터 관리까지 철저히 해야겠다.				0	2022-10-18 12:33:50	2022-10-18 14:42:54
BK22016441	20	전문가	고맙긴 뭘, 앞으로도 안전하게 잘 사용하길 바랄게.				1	2022-10-18 12:33:50	2022-10-21 14:28:05
