id	utterance_id	role	text	search_query	search_URL	reference_date	terminate	regDate	updDate
BK22019490	1	질문자	친구집에 가니 인공 지능 기술이 들어가 있는 전동 칫솔이 있더라고요. 만족스럽게 사용중이라고 해서 저도 관심이 가는데, 오랄비, 전동칫솔 iO 시리즈 9 가격대가 어떻게 되죠?				0	2022-10-27 12:01:47	2022-10-28 09:36:51
BK22019490	2	전문가	오랄비 전동칫솔 iO 시리즈 9는 iO 라인업 가운데 가장 고가이며, 가격대는 30만 원대로 웬만한 전자기기 가격과 비슷한 수준이라 볼 수 있어요.	오랄비 전동칫솔 iO 시리즈 9 가격	http://news.bizwatch.co.kr/article/industry/2022/03/08/0008	2022/03/08	0	2022-10-27 12:01:47	2022-10-28 09:36:51
BK22019490	3	질문자	생각했던 것 보다 더 고가네요. 구입하면 어떤 구성품들이 같이 오나요?				0	2022-10-27 12:01:47	2022-10-28 09:36:51
BK22019490	4	전문가	오랄비 iO 시리즈 9 는 본체와 칫솔모 2개, 충전기, 여행용 케이스로 구성 되어 있는데, 이 여행용 케이스에는 본체와 칫솔모 한 개를 담을 수 있어요.	오랄비 전동칫솔 iO 시리즈 9 구성품	https://zdnet.co.kr/view/?no=20220225154329	2022/02/27	0	2022-10-27 12:01:47	2022-10-28 09:36:51
BK22019490	5	질문자	여행용 케이스도 같이 오는구나, 그럼 충전은 어떻게 하는 거예요?				0	2022-10-27 12:01:47	2022-10-28 09:36:51
BK22019490	6	전문가	충전은 두가지 방식으로 할 수 있어요. 하나는 충전식 거치대에 칫솔을 세워서 충전하는 방법과, 충전식 휴대용 케이스에 칫솔을 보관해둔 상태에서 충전을 하는 방법이 있어요.	오랄비 전동칫솔 iO 시리즈 9 충전 방법	http://news.bizwatch.co.kr/article/industry/2022/03/08/0008	2022/03/08	0	2022-10-27 12:01:47	2022-10-27 12:01:47
BK22019490	7	질문자	충전을 2가지 방식으로 할수 있군요. 그럼 한번 충전하면 며칠이나 사용 가능한거에요?				0	2022-10-27 12:01:47	2022-10-27 12:01:47
BK22019490	8	전문가	오랄비 전동칫솔 iO 시리즈9는 3시간 충전으로 1일 2회, 2분 동안 사용 시 최대 12일까지 쓸 수 있어요.	오랄비 전동칫솔 iO 시리즈 9 충전	http://news.bizwatch.co.kr/article/industry/2022/03/08/0008	2022/03/08	0	2022-10-27 12:01:47	2022-10-28 09:36:51
BK22019490	9	질문자	여행 갈 때 완충 해서 가져가면 여행 기간 내내 충분히 쓸 수 있겠네요. 앱이랑 연동이 된다고 들었는데, 어떤 앱을 설치하면 되는 거예요?				0	2022-10-27 12:01:47	2022-10-28 09:36:51
BK22019490	10	전문가	전동칫솔과 앱을 연동하려면 먼저 스마트폰에 오랄비 앱을 설치해야 해요. 그 후 칫솔과 블루투스로 연결한 다음 앱을 활용할 수 있어요.	오랄비 전동칫솔 iO 시리즈 9 앱	https://zdnet.co.kr/view/?no=20220225154329	2022/02/27	0	2022-10-27 12:01:47	2022-10-27 12:01:47
BK22019490	11	질문자	오랄비 앱을 깔아야 하는구나, 그럼 앱과 연결되면 어떤 기능들을 사용 할 수 있어요?				0	2022-10-27 12:01:47	2022-10-27 12:01:47
BK22019490	12	전문가	양치 시 블루투스로 연결해 놓은 앱을 켜 놓으면 실시간 모니터링을 통해 제대로 칫솔질 하지 않은 부분이 어디인지 알 수 있어요. 이 앱에 표시된 치아 부위는 칫솔모가 이를 닦을수록 파란색에서 하얀색으로 변해가게 된답니다.	오랄비 전동칫솔 iO 시리즈 9 앱 모니터링	https://zdnet.co.kr/view/?no=20220225154329	2022/02/27	0	2022-10-27 12:01:47	2022-10-28 09:36:51
BK22019490	13	질문자	신기한 기능이네요. 이런 기능 이외에 앱을 통해 다른 정보도 볼 수 있나요?				0	2022-10-27 12:01:47	2022-10-27 12:01:47
BK22019490	14	전문가	양치를 끝내면 칫솔질 점수를 보여주는데요. 칫솔모가 치아에 도달한 정도와 양치 소요 시간, 치아와 잇몸에 가한 압력 세기 등을 모두 종합하여 점수로 나타내 준답니다.	오랄비 전동칫솔 iO 시리즈 9 앱 기능	https://zdnet.co.kr/view/?no=20220225154329	2022/02/27	0	2022-10-27 12:01:47	2022-10-28 09:36:51
BK22019490	15	질문자	내가 양치를 잘 했는지 수치로 표시되면 더 좋은 점수를 받기 위해 열심히 양치를 하게 될 것 같아요. 칫솔모는 벌어졌을 때 교체해주면 되는 거죠?				0	2022-10-27 12:01:47	2022-10-28 09:36:51
BK22019490	16	전문가	스마트 기능이 없는 일반 전동 칫솔은 모가 벌어지거나 연해지면 사용자의 판단에 의하여 모를 교체 해야 했는데요. 오랄비 앱에는 칫솔모 소모 정도를 기록하고 칫솔모 교체 시기를 알림 받을 수 있는 기능이 있으니 이 기능을 사용하여 교체 시기를 확인하시면 돼요.	오랄비 전동칫솔 iO 시리즈 9 칫솔모 교체	https://zdnet.co.kr/view/?no=20220225154329	2022/02/27	0	2022-10-27 12:01:47	2022-10-28 09:36:51
BK22019490	17	질문자	앱에서 칫솔모 교체 시기까지 알려주는구나, 신기하고 편리한 기능들이 많은 건 확실한데, 가격대가 좀 부담되긴 하네요.				0	2022-10-27 12:01:47	2022-10-27 12:01:47
BK22019490	18	전문가	네, 오랄비 전동칫솔 iO 시리즈 9에 탑재되어 있는 기능이 본인에게 꼭 필요한 것인지 아니면 없어도 되는 기능인지를 먼저 생각해 보시고, 결정하시면 도움이 될 것 같네요.				0	2022-10-27 12:01:47	2022-10-27 12:01:47
BK22019490	19	질문자	맞아요. 좋아보이긴 하지만 무턱대고 살만한 가격이 아니니 조금 더 고민을 해봐야겠어요. 오늘 대화 즐거웠고 다음에 차 한 잔 같이 해요.				1	2022-10-27 12:01:47	2022-10-28 09:36:51
BK22019490	20	전문가	저야 언제나 환영이죠. 그럼 궁금이님 시간 되실 때 연락 주세요. 안녕히 가세요.				0	2022-10-27 12:01:47	2022-10-27 12:01:47
