id	utterance_id	role	text	search_query	search_URL	reference_date	terminate	regDate	updDate
BK22017526	1	질문자	키보드를 사려고 하는데 키보드에도 여러 용어가 있더군요. 기계식 키보드와 멤브레인키보드가 있던데 두 가지의 차이점이 뭔가요?				0	2022-10-18 12:39:41	2022-10-18 14:56:14
BK22017526	2	전문가	멤브레인 키보드와 기계식 키보드는 키감의 차이로 나뉘어요. 멤브레인 키보드는 키 캡 밑에 고무로 된 돔 때문에 촉각적인 반응은 없지만 부드러운 키감을 느낄 수 있어요. 기계식 키보드는 키를 누르면 반동하는 스프링과 스위치가 있어서 정확성이 높아요.	기계식 키보드 멤브레인 차이	https://www.itworld.co.kr/howto/217729	2021/12/08	0	2022-10-18 12:39:41	2022-10-18 14:56:14
BK22017526	3	질문자	기계식 키보드가 정확성이 더 높군요. 그렇다면 무접점 키보드는 무엇인가요?				0	2022-10-18 12:39:41	2022-10-18 14:56:14
BK22017526	4	전문가	그동안 무접점 키보드라 함은 정전용량 무접점 방식의 키보드를 지칭했는데요. 근래에는 광축이라는 새로운 방식의 키보드가 생겼어요. 먼저 정전용량 무접점 방식은 자판을 칠 때 전기가 모여 전압이 어느 정도치에 다다르면 회로 기판에 있는 센서가 이를 인지하는 식이고, 다음 광축 방식은 적외선 같은 빛을 사용해 센서로 자판을 누른 신호를 인지하는 방식이에요.	무접점 키보드	https://it.donga.com/28007/	2018/08/02	0	2022-10-18 12:39:41	2022-10-18 14:56:14
BK22017526	5	질문자	그렇다면 노트북의 키보드는 무슨 방식의 키보드인가요?				0	2022-10-18 12:39:41	2022-10-18 14:56:14
BK22017526	6	전문가	노트북에 사용된 키보드는 멤브레인 키보드의 세분화 형태인 펜타그래프 키보드가 주로 쓰여요. 키 캡이 납작하고 스위치가 키보드 자체에 부착돼 있죠. 이 밖에 아이솔레이션 키보드도 노트북 키보드로 종종 사용되는데 대부분의 형태는 펜타그래프 키보드와 유사하지만 키 캡 사이 사이 간격이 떨어져 있어서 이물질이 덜 끼는 특징이 있어요.	노트북 키보드	https://www.ilovepc.co.kr/news/articleView.html?idxno=41843	2021/12/14	0	2022-10-18 12:39:41	2022-10-18 14:56:14
BK22017526	7	질문자	노트북 키보드는 장시간 사용 시 손가락 피로감이 느껴졌는데 키 캡이 납작해서가 아닐까 싶네요. 손가락 피로감이 더 낮은 키보드를 고르려면 키보드 정보 중 뭘 봐야할까요?				0	2022-10-18 12:39:41	2022-10-18 14:56:14
BK22017526	8	전문가	손가락의 피로도는 스위치의 압력에 따라 달라져요. 스위치의 압력은 40g, 55g 등으로 표시되는데 이 숫자가 클수록 압력이 높아 타건 시 힘이 더 들어요. 반대로 압력이 낮은 키보드는 피로감은 적지만 가벼운 터치만으로도 입력이 되는 경우가 있어 오타율이 높아져요.	손가락 피로도 낮은 키보드	http://www.knnews.co.kr/news/articleView.php?idxno=1216262	2017/05/30	0	2022-10-18 12:39:41	2022-10-18 14:56:14
BK22017526	9	질문자	스위치 압력에 따른 거였군요. 너무 낮으면 오타율이 오를 수 있다니 고민이 되네요.				0	2022-10-18 12:39:41	2022-10-18 14:56:14
BK22017526	10	전문가	네, 무조건 낮은 키압을 찾기보다는 본인에게 맞는 키압을 찾는 게 중요해요.				0	2022-10-18 12:39:41	2022-10-18 14:56:14
BK22017526	11	질문자	키압도 중요하지만 키보드를 두드릴 때의 느낌도 저는 중요하거든요. 이걸 나타내는 용어로 청축이니 갈축이니 여러 가지로 나뉘던데 자세히 설명 부탁드려요.				0	2022-10-18 12:39:41	2022-10-18 14:56:14
BK22017526	12	전문가	네, 플라스틱으로 이루어진 버튼 아래 위치한 스위치의 형태에 따라 축의 모양이 바뀌는데 이 타입에 따라서 청색, 갈색, 흑색 등 색으로 나눈 거예요. 걸쇠가 퉁겨지는 소리가 나는 클릭 유형인 청축과 녹축, 대조적으로 소음이 적은 넌클릭 유형인 갈축과 백축, 걸쇠가 처음부터 퉁기지 않는 리니어 형태의 흑축과 적축 그리고 은축 등으로 분류돼요.	청축 갈축 적축 흑축 백축	https://www.bloter.net/newsView/blt202107100004	2021/07/10	0	2022-10-18 12:39:41	2022-10-18 14:56:14
BK22017526	13	질문자	넌클릭 타입이 소음이 덜하다니 조금 더 알고 싶어요. 갈축과 백축의 차이는 무엇인가요?				0	2022-10-18 12:39:41	2022-10-18 14:56:14
BK22017526	14	전문가	백축은 기계식의 키감을 온전히 살린 갈축보다 스위치가 시끄럽게 울려서 문서 작업을 많이 하는 사무용으로는 백축이나 청축보다는 갈축이나 적축을 많이 사용하죠.	갈축과 백축 차이	http://www.weeklypost.kr/news/articleView.html?idxno=907	2020/01/03	0	2022-10-18 12:39:41	2022-10-18 14:56:14
BK22017526	15	질문자	살펴봐야 할 항목이 생각보다 많네요. 그렇다면 키배열의 종류는 뭐가 있나요?				0	2022-10-18 12:39:41	2022-10-18 14:56:14
BK22017526	16	전문가	키보드의 키배열은 크기나 배열에 따라 나눠요. 종류는 풀배열, 텐키리스배열, 미니 배열 등이 있죠. 이 중에서 텐키리스나 미니 배열이 가지고 다니기 좋아요.	키보드 키배열 종류	http://www.mhns.co.kr/news/articleView.html?idxno=531288	2022/07/27	0	2022-10-18 12:39:41	2022-10-18 14:56:14
BK22017526	17	질문자	제가 외근이나 출장이 잦아서 텐키리스나 미니 키배열이 좋을 것 같은데 휴대용으로 따로 나온 키보드가 있나요?				0	2022-10-18 12:39:41	2022-10-18 14:56:14
BK22017526	18	전문가	높이가 낮은 콤팩트한 크기의 휴대용 블루투스 키보드는 출장이나 외근 시에 가방에 넣어 쉽게 가지고 다닐 수 있어요. 미니멀리스트이거나 책상 서랍에 키보드를 정리 하고 싶다면 휴대용 블루투스 키보드가 좋아요. 더구나 휴대용 블루투스 키보드는 한 키보드에 최대 3대의 기계장치와 페어링이 가능하죠.	휴대용 키보드	https://www.ciokorea.com/news/34006	2017/04/26	0	2022-10-18 12:39:41	2022-10-18 14:56:14
BK22017526	19	질문자	블루투스면 무선이니 정말 휴대성이 뛰어나겠어요. 오늘 설명해 주신 걸 바탕으로 제게 맞는 키보드를 찾아봐야겠어요.				0	2022-10-18 12:39:42	2022-10-18 14:56:14
BK22017526	20	전문가	네, 여러 기능을 하나씩 살펴보고 필요한 기능이 있는 키보드를 찾길 바랄게요.				1	2022-10-18 12:39:42	2022-10-18 14:56:14
