id	utterance_id	role	text	search_query	search_URL	reference_date	terminate	regDate	updDate
BK22018815	1	질문자	오랜만이에요. 날씨도 좋고 하늘도 너무 예쁜 날인데 뭐 하세요?				0	2022-10-24 22:24:41	2022-10-24 23:41:05
BK22018815	2	전문가	요즘 하늘이 너무 예쁘네요. 저는 백화점에 가서 마사지 기기를 좀 보고 왔어요.				0	2022-10-24 22:24:41	2022-10-24 23:41:05
BK22018815	3	질문자	오, 저도 마사지 기기를 사야하는데! 안마 의자는 부피가 너무 커서 둘 곳이 없어서 몸에 착용하는 마사지 기기를 사고 싶은데 추천해주실 만한 거 있나요?				0	2022-10-24 22:24:41	2022-11-01 11:45:56
BK22018815	4	전문가	몸에 착용하는 마사지 기기라면 쥬빌리바이오텍에서 나온 첨단 웨어러블 디바이스 림포웨어는 어때요?	쥬빌리바이오텍 LymphoWear	https://news.mt.co.kr/mtview.php?no=2022092713141946978	2022/09/27	0	2022-10-24 22:24:41	2022-10-31 16:05:19
BK22018815	5	질문자	쥬빌리바이오텍은 처음 들어 본 회사네요. 어떤 걸 주로 만드는 회사예요?				0	2022-10-24 22:24:41	2022-10-24 23:41:05
BK22018815	6	전문가	쥬빌리바이오텍은 건강 관련 웨어러블 기기를 만드는 바이오테크놀로지 회사예요.	쥬빌리바이오텍	https://news.mt.co.kr/mtview.php?no=2022092713141946978	2022/09/27	0	2022-10-24 22:24:41	2022-10-24 23:41:05
BK22018815	7	질문자	그렇군요. 그러면 마사지 기기로는 어떤 부위를 마사지 할 수 있나요?				0	2022-10-24 22:24:41	2022-10-24 23:41:05
BK22018815	8	전문가	겨드랑이나 쇄골 같은 림프절 부위랑 어깨 근육을 동시에 마사지 할 수 있어요.	LymphoWear 마사지기기	https://news.mt.co.kr/mtview.php?no=2022092713141946978	2022/09/27	0	2022-10-24 22:24:41	2022-10-24 23:41:05
BK22018815	9	질문자	림프절 마사지까지 동시에 되니 너무 시원할 거 같아요. 그러면 웨어러블 기기니까 착용을 해서 마사지를 받는 건가요?				0	2022-10-24 22:24:41	2022-10-24 23:41:05
BK22018815	10	전문가	네, 조끼를 걸치듯이 양쪽 어깨에 착용을 하면 되요.	LymphoWear 림프 마사지	https://news.mt.co.kr/mtview.php?no=2022092713141946978	2022/09/27	0	2022-10-24 22:24:41	2022-10-24 23:41:05
BK22018815	11	질문자	착용을 하고 마사지를 받는 거라면 무게도 중요할 거 같은데, 몇 키로 정도 나가나요?				0	2022-10-24 22:24:41	2022-10-24 23:41:05
BK22018815	12	전문가	쥬빌리바이오텍의 림포웨어 무게는 2.5키로 정도로 가벼운 편이에요.	LymphoWear 무게	https://news.mt.co.kr/mtview.php?no=2022092713141946978	2022/09/27	0	2022-10-24 22:24:41	2022-10-24 23:41:05
BK22018815	13	질문자	그렇군요. 그런데 체구가 작은 저부터 비교적 체구가 있는 편이신 부모님까지 함께 쓰고 싶은데 제품 사이즈가 나누어져 있나요?				0	2022-10-24 22:24:41	2022-11-01 11:45:56
BK22018815	14	전문가	사이즈가 나누어져 있지는 않고 밴드 소재라 사이즈를 조절해서 착용할 수 있어요.	LymphoWear 사이즈	https://news.mt.co.kr/mtview.php?no=2022092713141946978	2022/09/27	0	2022-10-24 22:24:41	2022-10-31 16:05:19
BK22018815	15	질문자	가족들이 모두 함께 사용할 수 있겠네요. 근데 마사지 조끼를 입으면 움직이는 데 불편하지는 않을까요?				0	2022-10-24 22:24:41	2022-11-01 11:45:56
BK22018815	16	전문가	안마의자 같은 대형 가전과는 달리 신체 움직임을 제한하지 않아서 괜찮으실 거예요.	LymphoWear	https://news.mt.co.kr/mtview.php?no=2022092713141946978	2022/09/27	0	2022-10-24 22:24:41	2022-11-01 11:45:56
BK22018815	17	질문자	그렇군요. 그러면 한 번 충전 했을 때 어느 정도 사용을 할 수 있을까요?				0	2022-10-24 22:24:41	2022-10-24 23:41:05
BK22018815	18	전문가	하루에 1번 15분씩 사용한다고 계산했을 때, 1회 충전하면 16일 사용이 가능해요.	LymphoWear 충전	https://news.mt.co.kr/mtview.php?no=2022092713141946978	2022/09/27	0	2022-10-24 22:24:41	2022-10-24 23:41:05
BK22018815	19	질문자	저는 더 오래 마사지를 하니까 10일 정도 생각하고 쓰면 되겠어요. 마사지 기기는 손으로 잡고 쓰는 것만 사용했는데 입어서 사용하면 너무 편리할 거 같아요. 더 다양한 정보를 찾아 보고 어떤 걸 살지 고민해야 겠어요.				0	2022-10-24 22:24:41	2022-10-31 16:05:19
BK22018815	20	전문가	네, 온라인에 더 다양한 제품과 정보들이 많으니까 잘 찾아 보고 마음에 드는 기기로 사시길 바랄게요. 좋은 하루 되세요.				1	2022-10-24 22:24:41	2022-11-01 11:45:56
