id	utterance_id	role	text	search_query	search_URL	reference_date	terminate	regDate	updDate
BK22017962	1	질문자	요즘 플라스틱 사용이 정말 심각한 문제 중에 하나잖아요. 제가 원래는 생수를 사마셨는데 이제 정수기를 구입해서 물을 마시려고요. 그런데 정수기 고르는 일이 참 쉽지 않네요.				0	2022-10-21 14:03:20	2022-10-21 16:27:32
BK22017962	2	전문가	맞아요. 요즘 플라스틱 사용을 줄이기 위해 다들 많이 노력하고 있죠.				0	2022-10-21 14:03:20	2022-10-21 16:27:32
BK22017962	3	질문자	생수를 마실 때마다 배출되는 플라스틱을 보면 마음이 안 좋아서요. 흠, 그런데 어떤 기준으로 정수기를 골라야 할지 잘 감이 안와요. 검색을 해보니 역삼투압 정수기와 직수 정수기로 나뉘는 것 같던데 역삼투압 정수기에 대해 먼저 알려주실 수 있을까요?				0	2022-10-21 14:03:20	2022-10-21 16:27:32
BK22017962	4	전문가	역삼투압 정수기는 평소에 주위에서 흔하게 사용되는 RO필터 정수기로 지금까지 시장을 주도해왔어요. 역삼투압 정수 방식은 삼투 현상을 반대로 적용시킨 기술인데요. 촘촘하게 구성된 구조의 막을 사용하여 불순물이 많은 원수에서 불순물은 걸러지고 물은 투과되게 만들어서 선택적으로 깨끗해진 물만 남게 되는 원리로 미세정밀 여과 방식이라는 명칭으로도 불리죠. 보편적으로 RO필터는 촘촘하게 짜여진 필름막으로 머리카락의 100만분의 1크기까지 거를 수 있는 것으로 알려져 있어요.	RO필터 정수기	https://www.ajunews.com/view/20200715073922494	2020/07/15	0	2022-10-21 14:03:20	2022-10-21 16:27:32
BK22017962	5	질문자	아, 주위에서 쉽게 찾아볼 수 있는 정수기가 역삼투압식 정수기군요. 흠, 그렇다면 역삼투압식 정수기에 단점으로는 뭐가 있을까요?				0	2022-10-21 14:03:20	2022-10-21 16:27:32
BK22017962	6	전문가	필터가 촘촘하고 세밀하게 거르기 때문에 제거 시간 당 정수 용량이 적어 빠르게 물을 정수할 수는 없다는 점이 단점으로 꼽히는데요. 그렇기에 RO필터 정수기는 물탱크격인 저수조에 물을 채워서 이용하기 때문에 상대적으로 제품의 크기가 큰 편이죠. 직수형 정수기와 비교하자면 저수조까지 관리해야 하는 필요성 또한 단점이에요.	RO필터 정수기 단점	https://www.ajunews.com/view/20200715073922494	2020/07/15	0	2022-10-21 14:03:20	2022-10-21 16:27:32
BK22017962	7	질문자	흠, 제가 게으른 편이라서 관리가 자주 필요하다는 점이 좀 그렇네요. 그렇다면 직수형 정수기는 어떤 정수기인지도 알 수 있을까요?				0	2022-10-21 14:03:20	2022-10-21 16:27:32
BK22017962	8	전문가	직수형 정수기는 기존에 있던 역삼투압 제품과는 다르게 물탱크를 없애서 규격이 줄어든 것이 특징이에요. 그렇기 때문에 넓지 않은 공간에도 쉽게 설치할 수 있는 것이 장점이죠. 아무래도 1인 가구에게 특히 매력적인 모델이죠.	직수형 정수기 특징	http://www.m-i.kr/news/articleView.html?idxno=921624	2022/05/24	0	2022-10-21 14:03:20	2022-10-21 16:27:32
BK22017962	9	질문자	오, 공간을 많이 차지하지 않는다는 게 마음에 드네요. 그런데 직수형 정수기에도 단점이 있겠죠? 직수형 정수기의 단점은 어떤 게 있을까요?				0	2022-10-21 14:03:20	2022-10-21 16:27:32
BK22017962	10	전문가	직수형 정수기의 수질이 안 좋다는 뜻은 아니지만 아무래도 상대적으로 역삼투압형 정수기와 비교해보자면 수질이 떨어지는 게 사실이에요. 직수형 정수기는 대개 역삼투압 필터와 다르게 정수 능력이 떨어지는 나노트랩 필터나 중공사막 필터를 이용하거든요. 직수형이 수돗물 정도의 물을 정수하는 것은 문제가 없지만 지하수를 사용하는 경우라면 정수가 완벽하게 이루어지기 어렵다는게 정수기 제조업체들의 일반적인 의견이에요.	직수형 정수기 수질	https://www.newspim.com/news/view/20181228000574	2018/12/30	0	2022-10-21 14:03:20	2022-10-21 16:27:32
BK22017962	11	질문자	아, 수질이 역삼투압 정수기보다 떨어진다니 너무 큰 단점인데요. 설명을 듣고 나니까 어떤 제품을 선택해야 할지 더 고민이 되는 것 같아요. 정수기를 선택할 때 어떤 요소를 고려해서 고르는 게 좋을까요?				0	2022-10-21 14:03:20	2022-10-21 16:27:32
BK22017962	12	전문가	정수기는 필터마다 오염 물질을 제거하는 성능과 장단점이 다양하게 존재하기 때문에 사용자의 성향과 사용 환경에 적합한 방식의 정수기를 고르는 게 중요해요. 물 속의 병원성 세균이나 수인성 질병에 대해 예민하다면 역삼투압 방식이나 나노방식, 중공사막 전부 괜찮은데요. 질산성 질소, 중금속이 걱정되거나 새로운 오염 물질에 예민하다면 제일 뛰어난 정수 능력을 가진 역삼투압 방식의 정수기가 사용자의 요구를 충족시키는 정수기에요.	정수기 오염물질	http://www.mdtoday.co.kr/mdtoday/index.html?no=293307	2017/08/17	0	2022-10-21 14:03:20	2022-10-21 16:27:32
BK22017962	13	질문자	음, 아무래도 저도 병원성 세균에 예민한 편인데 역삼투압 정수기를 구매해야 하나 싶네요. 혹시 필터 방식 외에도 정수기에 대해 더 고민해볼 부분이 있을까요?				0	2022-10-21 14:03:20	2022-10-21 16:27:32
BK22017962	14	전문가	정수 방식 말고도 고려해야 하는 요소는 제품이 가진 부가기능이에요. 우선적으로 정수 방식을 결정했다면 온수, 냉수, 얼음, 사물인터넷 등과 같이 필요하다고 생각되는 기능을 추가적으로 선택해서 정수기를 구매하시면 돼요.	정수기 부가기능	http://www.mdtoday.co.kr/mdtoday/index.html?no=293307	2017/08/17	0	2022-10-21 14:03:20	2022-10-21 16:27:32
BK22017962	15	질문자	집에서 아이스 커피를 즐겨 마시는데 얼음 기능이 있으면 편할 것 같긴 하네요. 아, 그리고 엄마한테 정수기에 대해 물어보니 인증 마크를 확인하라고 하셨는데요. 정수기에 붙어 있는 인증 마크가 뭘 의미하는 건가요?				0	2022-10-21 14:03:20	2022-10-21 16:27:32
BK22017962	16	전문가	공신력 있는 기관의 인증 마크를 확인하면 품질을 확인 할 수 있어서 어머니께서 그렇게 얘기하신걸거에요. 정수기의 품질도 고려해봐야 할 대상인데요. 정수기 품질을 알아보기 위해서는 제조사가 내세우는 품질이 얼마나 근거가 있는지 확인하는 게 중요하죠. 국내에서는 정수기를 생산하고 판매하는 업자는 성능 인증을 받고 KC 마크가 부착되어 있는 제품만 판매할 수 있거든요. 즉 국내에 출시된 정수기는 전부 법률적으로 정해진 일정 수준 이상의 품질이 보장된다고 할 수 있는거죠.	정수기 품질	http://www.mdtoday.co.kr/mdtoday/index.html?no=293307	2017/08/17	0	2022-10-21 14:03:20	2022-10-21 16:27:32
BK22017962	17	질문자	국내에서 생산된 제품은 인증 마크를 찾아볼 수 있는거군요. 흠, 그런데 역삼투압형 정수기나 직수형 정수기 말고도 브리타 정수기도 간편한 사용 방법 덕분에 요새 많이 쓴다고 들었어요. 브리타 정수기에 대해서도 설명해 주실 수 있을까요?				0	2022-10-21 14:03:20	2022-10-21 16:27:32
BK22017962	18	전문가	브리타 제품은 필터를 누구나 교체할 수 있다는 점이 특징이자 큰 장점이죠. 보편적으로 국내 제품은 3~4개의 원통형 필터가 탑재되어 있어요. 브리타 정수기는 플라스틱 주전자의 모습을 하고 있고 뚜껑에 소형 필터가 설치되어 있는 구조에요. 필터는 탈부착 방식이며 교체가 가능한 것도 특징이고요. 또한 뚜껑에 부착되어 있는 메모 기능을 통해서 눈으로 교체해야 하는 주기도 알아볼 수 있어요.	브리타 정수기	http://www.m-i.kr/news/articleView.html?idxno=495270	2019/02/12	0	2022-10-21 14:03:20	2022-10-21 16:27:32
BK22017962	19	질문자	비용이나 공간적 여건이 충족되지 않는다면 브리타 정수기도 좋은 대안이 될 수 있겠군요. 이렇게 친절하게 정수기에 대해 알려주셔서 정말 감사해요.				0	2022-10-21 14:03:20	2022-10-21 16:27:32
BK22017962	20	전문가	이 정도로 뭘요. 또 궁금한 게 생기면 주저 말고 언제든지 물어봐주세요.				0	2022-10-21 14:03:20	2022-10-21 16:27:32
BK22017962	21	질문자	알려주신 정보 덕분에 정수기를 꼼꼼하게 따져보고 잘 구매할 수 있을 것 같아요.				0	2022-10-21 14:03:20	2022-10-21 16:27:32
BK22017962	22	전문가	도움이 된 것 같아서 저도 참 기분이 좋네요. 좋은 제품 잘 구매하기를 바랄게요.				1	2022-10-21 14:03:20	2022-10-27 15:47:00
