id	utterance_id	role	text	search_query	search_URL	reference_date	terminate	regDate	updDate
BK22019569	1	질문자	집에 가스레인지가 망가져서 교체하려고 하는데 요즘 가스레인지보다 전기레인지가 더 인기가 많다고 하더라고요. 그래서 전기레인지를 알아보려고 하는데 종류가 다양해서 어떤 걸 알아봐야 할지 모르겠어요. 도와주실 수 있나요?				0	2022-10-28 00:59:08	2022-10-28 00:59:08
BK22019569	2	전문가	그럼요, 어떤 내용들을 알려 드릴까요?				0	2022-10-28 00:59:08	2022-10-28 00:59:08
BK22019569	3	질문자	가스레인지만 사용을 해봐서 전기레인지라는 것 자체가 생소해요. 전기레인지는 어떤 제품인가요?				0	2022-10-28 00:59:08	2022-10-28 00:59:08
BK22019569	4	전문가	전기레인지는 가스레인지와는 달리 유해가스 및 가스 냄새가 없고 청소가 용이해요. 열을 가하는 방식에 따라 인덕션과 하이라이트로 나눌 수 있는데 생김새가 비슷해 두개의 명칭을 혼용할 수도 있지만 각각의 장단점이 명확하게 있어요.	전기레인지 열을 가하는 방식	https://www.ddaily.co.kr/news/article/?no=200101	2020/08/14	0	2022-10-28 00:59:08	2022-10-28 01:31:11
BK22019569	5	질문자	아, 인덕션은 들어본 적 있는 것 같긴 한데, 어떤 제품이고 어떤 장점이 있나요?				0	2022-10-28 00:59:08	2022-10-28 00:59:08
BK22019569	6	전문가	인덕션은 전자기 유도 방식의 조리기구인데, 내부 코일에 전류를 흘려 전자기장으로 용기를 가열하는 방식이에요. 조리 용기만 발열시키기 때문에 상판이 뜨거워 지지 않아 화재나 화상의 위험이 없다는 장점이 있어요.	전기레인지 인덕션	https://www.ddaily.co.kr/news/article/?no=200101	2020/08/14	0	2022-10-28 00:59:08	2022-10-28 01:31:11
BK22019569	7	질문자	위험하지 않다는 건 정말 좋은 점이네요. 그럼 단점은 어떤게 있나요?				0	2022-10-28 00:59:08	2022-10-28 00:59:08
BK22019569	8	전문가	사용할 수 있는 전용 용기가 따로 있어요. 자석이 붙는 물질로 만들거나 400계 스테인리스로 된 인덕션 전용 조리기구만 사용 할 수 있기 때문에 도자기나 알루미늄, 유리 용기는 사용이 불가하고 하이라이트에 비해 가격이 비싸다는 단점이 있어요.	인덕션 전용 조리기구	https://www.ddaily.co.kr/news/article/?no=200101	2020/08/14	0	2022-10-28 00:59:08	2022-10-28 01:31:11
BK22019569	9	질문자	개인적으로 가격이 비싸다는 건 정말 큰 단점이네요. 그럼 하이라이트는 어떤 특징이 있나요?				0	2022-10-28 00:59:08	2022-10-28 00:59:08
BK22019569	10	전문가	하이라이트는 전기로 상판에 열을 가해 열이 용기에 그대로 전달되는 방식으로 전원을 켜면 화구가 빨갛게 변해요. 상판 자체를 달구는 방식이라 예열이 필요해 인덕션보다 조리시간이 오래 걸리고 화상의 위험도 있어요. 하지만 전용 조리기구가 따로 필요하지 않아 그 전에 사용하던 조리기구를 그대로 사용할 수 있어요.	전기레인지 하이라이트	https://www.ddaily.co.kr/news/article/?no=200101	2020/08/14	0	2022-10-28 00:59:08	2022-10-31 10:57:01
BK22019569	11	질문자	정말 각자의 장단점이 있네요. 이 두 가지 방식의 장점만 합쳐져 있는 제품은 없나요?				0	2022-10-28 00:59:08	2022-10-31 10:57:01
BK22019569	12	전문가	이 두 개를 혼합한 하이브리드 형식의 제품도 있어요. 다양한 재질의 조리기구를 사용할 수 있죠.	전기레인지 하이브리드	https://www.ddaily.co.kr/news/article/?no=200101	2020/08/14	0	2022-10-28 00:59:08	2022-10-31 10:57:01
BK22019569	13	질문자	그럼 인덕션과 하이라이트 중 어떤 제품이 더 인기가 많은가요?				0	2022-10-28 00:59:08	2022-10-28 01:31:11
BK22019569	14	전문가	인덕션의 수요가 급증하고 있는데 조리기간이 하이라이트나 가스레인지보다 빠르고 전용 용기가 많이 보급화된 영향이 커요. 인덕션에선 뚝배기 요리를 할 수 없다는 단점이 있었는데 일부 용기업체들은 인덕션에서 사용할 수 있는 용기도 내놓고 있어요.	인덕션 수요 급증	https://www.ddaily.co.kr/news/article/?no=200101	2020/08/14	0	2022-10-28 00:59:08	2022-10-28 01:31:11
BK22019569	15	질문자	아, 그렇군요. 그런데 이 제품들은 전기레인지다 보니 아무래도 전기 사용량이 많겠죠?				0	2022-10-28 00:59:08	2022-10-31 10:57:01
BK22019569	16	전문가	전기레인지 구매 전 전기요금으로 이어질 수 있는 최대 화력을 확인해 보는 것도 좋아요. 국내 제품들의 최대 출력은 대부분 3~3.4kW정도인데 독일 등 해외업체는 최대 출력을 7.4kW로 소개해요. 화력이 쎈 만큼 조리시간도 짧아질 수 있어요.	전기레인지 최대 화력	https://www.ddaily.co.kr/news/article/?no=200101	2020/08/14	0	2022-10-28 00:59:08	2022-10-31 10:57:01
BK22019569	17	질문자	전기를 많이 쓰게 되었을 때 생길 수 있는 문제점들은 없나요?				0	2022-10-28 00:59:08	2022-10-28 01:31:11
BK22019569	18	전문가	주방에 다른 전기 기기들과 함께 사용하다보면 과부화가 생겨 차단기가 내려갈 수도 있어요. 전기 용량이 큰 전기레인지를 안전하게 사용하려면 배선 설치를 고려해 보는 것도 좋아요.	전기레인지 전기용량	https://www.ddaily.co.kr/news/article/?no=200101	2020/08/14	0	2022-10-28 00:59:08	2022-10-28 01:31:11
BK22019569	19	질문자	많이 쓸수록 전기세도 많이 나오겠죠?				0	2022-10-28 00:59:08	2022-10-28 01:31:11
BK22019569	20	전문가	네, 전기요금엔 누진세라는 게 적용될 수 있기 때문에 오랫동안 전기레인지를 사용할 경우엔 전기세가 급증하는 상황이 생길 수도 있어요.	전기레인지 누진세	https://www.ddaily.co.kr/news/article/?no=200101	2020/08/14	0	2022-10-28 00:59:08	2022-10-28 01:31:11
BK22019569	21	질문자	전기세 외에 다른 문제점은 없나요?				0	2022-10-28 00:59:08	2022-10-28 01:31:11
BK22019569	22	전문가	전기를 주로 사용하다보니 전자파 문제도 지적되고 있어요. 아무래도 전기를 쓰다 보면 전자파가 나오겠지만 이는 스마트폰이나 밥솥, 전자레인지 등에서 발생하는 정도와 비슷해요. 사용할 땐 다른 전기 기기와 마찬가지로 거리를 두면 좋겠지만 일상에서 사용하기에는 크게 문제가 되지 않아요.	전기레인지 전자파	https://www.ddaily.co.kr/news/article/?no=200101	2020/08/14	0	2022-10-28 00:59:08	2022-10-31 10:57:01
BK22019569	23	질문자	아, 다행이네요. 좀 더 고민을 해보고 구입을 해야겠어요. 오늘 친절하고 자세한 설명 너무 감사드려요.				0	2022-10-28 00:59:08	2022-10-28 01:31:12
BK22019569	24	전문가	별말씀을요, 충분히 고민 해보시고 좋은 제품 구입하세요. 또 궁금한 점 있으시면 언제든지 물어보세요.				1	2022-10-28 00:59:08	2022-10-31 10:57:01
