id	utterance_id	role	text	search_query	search_URL	reference_date	terminate	regDate	updDate
BK22001401	1	질문자	컴퓨터가 오래돼서 그런지 뭘 하나 하려고 해도 너무 느리네요.				0	2022-07-20 16:15:59	2022-08-02 12:01:32
BK22001401	2	전문가	오래되면 사람이고, 기계고 느려지죠. 오래 사용했으면 쓸모없는것들이 용량을 많이 차지 하고 있을 수 있으니, 쓸데없는 파일들을 찾아서 지워주기만 해도 훨씬 나아요.	컴퓨터 용량 정리	https://www.nongmin.com/nature/NAT/ETC/31468/view	2016/03/07	0	2022-07-20 16:15:59	2022-07-21 10:30:15
BK22001401	3	질문자	바로바로 지우면서 사용했어야했는데, 파일 찾는것도 한참 걸리겠어요. 컴퓨터 처음 켤때도 엄청 오래 걸리는데, 파일 없애주면 부팅도 좀 빨라질까요?				0	2022-07-20 16:15:59	2022-08-02 12:01:32
BK22001401	4	전문가	부팅이 느리다면, 부팅할 때마다 자동 실행되도록 설정된 프로그램을 살펴보세요. 보면, 자주 사용하는 프로그램은 물론, 항상 실행될 필요가 없는 것도 많거든요. 방법은, 작업 표시줄을 우클릭해서 작업 관리자를 선택한 다음에, 시작 프로그램 탭을 클릭하면 자동 실행되는 프로그램들이 모두 표시되니까, 이 목록을 살펴보고 항상 실행될 필요가 없는 프로그램을 판단해서 정리하면 돼요.	컴퓨터 부팅 속도	https://www.itworld.co.kr/news/201314	2021/07/15	0	2022-07-20 16:15:59	2022-07-21 10:30:15
BK22001401	5	질문자	작업관리자 들어가서 정리해봐야겠어요. 그런데, 아직도 인터넷 익스플로러가 익숙해서 작업표시줄에 고정해놓고 사용하는데, 자꾸 종료되었다고 메시지 뜨는데, 이것 때문에도 문제가 있을까요?				0	2022-07-20 16:15:59	2022-08-02 12:01:32
BK22001401	6	전문가	지금까지는 아닌데, 2022년 6월 15일 마침내 마이크로소프트의 웹 브라우저 인터넷 익스플로러의 공식 지원이 종료 되었어요. 계속 사용하면 보안 패치 등의 서비스가 중단돼요.	인터넷익스플로러 종료	http://www.itdaily.kr/news/articleView.html?idxno=208870	2022/07/01	0	2022-07-20 16:15:59	2022-07-21 10:30:15
BK22001401	7	질문자	그러면, 바이러스 등의 위험이 있겠군요. 사용하지 않으려고 해도, 얼마전 철도청에서 여행 패키지 상품 예약하려고 하는데 인터넷 익스플로러로만 가능했어요. 익숙한데다 가능한걸 사용해야하니 그냥 쭉 사용 하게 돼요.				0	2022-07-20 16:15:59	2022-08-02 12:01:32
BK22001401	8	전문가	아직까지도 그런 경우들이 많아요. 사용하려는 앱이 인터넷 익스플로러에서만 정상 동작하도록 처음부터 만들어진 다음에 주기적인 업데이트 등 관리가 안되어서 그래요. 중소기업이나 산업현장에서는 아직도 이런 일이 많은데 빨리 시정되어야 해요.	인터넷 익스플로러	http://www.itdaily.kr/news/articleView.html?idxno=208870	2022/07/01	0	2022-07-20 16:15:59	2022-07-21 10:30:15
BK22001401	9	질문자	MS는 왜 이렇게 사람을 번거롭게 하는지 모르겠네요.				0	2022-07-20 16:16:00	2022-08-02 12:01:32
BK22001401	10	전문가	제품 개선이라는 명목이 있지만, 한번 사서 평생 사용하면 MS는 아마 망하지 않을까요?				0	2022-07-20 16:16:00	2022-07-21 10:30:15
BK22001401	11	질문자	그렇기도 하겠네요. 컴퓨터 잘 모르는 사람들은 이럴때마다 막연한 두려움이 생겨요. 느려터진 지금 컴퓨터는 버리고, 최신의 컴퓨터를 사고 싶어지네요.				0	2022-07-20 16:16:00	2022-08-02 12:01:32
BK22001401	12	전문가	다들 그런 마음이 들때 새로 사게 돼죠. 만약, 컴퓨터 버리게 되면, 컴퓨터 안에 있는 내용들이 그대로 버려지기 때문에 민감한 개인 정보들은 미리 없애는게 좋아요. 중고시장에서 거래되는 PC 하드에서 수만건의 환자 정보가 복원되는 등 개인정보 악용 문제를 주의해야해요.	컴퓨터 버리기	https://n.news.naver.com/mnews/article/032/0002738719?sid=110	2016/10/30	0	2022-07-20 16:16:00	2022-07-21 10:30:15
BK22001401	13	질문자	무서운 세상이네요. 컴퓨터 버리기 전에 어떻게 해야 완전히 정보를 없앨 수 있어요?				0	2022-07-20 16:16:00	2022-08-02 12:01:32
BK22001401	14	전문가	폐기하려는 컴퓨터가 있으면, 하드디스크를 분쇄기로 파쇄해야 해요.	컴퓨터 버리기	https://www.ccreview.co.kr/news/articleView.html?idxno=294730	2020/11/11	0	2022-07-20 16:16:00	2022-07-21 10:30:15
BK22001401	15	질문자	그래야 안심하고 버릴 수 있는 거군요. 여러 가지 조치해도 느려지면 새로 사야 하는데, 이번엔 아예 저렴한 조립PC 살까요?				0	2022-07-20 16:16:00	2022-08-02 12:01:32
BK22001401	16	전문가	컴퓨터를 잘 아는 경우라면 필요한것 위주로 조립하면 좋죠. 그런데, 조립형 컴퓨터인 경우, 중고 컴퓨터를 전문가들 손을 거쳐서 재판매 형태로 이루어지는 경우가 있어서 구분 못하고 살 수 있기 때문에 주의해야해요.	조립형 컴퓨터	http://www.jndn.com/article.php?aid=1552557532277626005	2019/03/14	0	2022-07-20 16:16:00	2022-07-21 10:30:15
BK22001401	17	질문자	컴퓨터 구조 잘 모르는 저같은 경우는, 그냥 비싼 돈 주고 브랜드 PC 사야겠네요. 이번에 사실 프린터를 사고 싶었는데, 비용이 만만치 않겠어요.				0	2022-07-20 16:16:00	2022-08-02 12:01:32
BK22001401	18	전문가	프린터 살 계획이라서, 컴퓨터를 어떻게든 더 사용해보려고 한거였군요. 소모품 비용은 잉크젯 프린터의 경우 프린터 가격대비 평균 20퍼센트로 레이저 프린터의 컬러 82퍼센트, 흑백 32퍼센트보다 소모품 비용이 적게 들고 장당 인쇄비용도 잉크젯 프린터가 레이저 프린터보다 적은 비용이 들어요.	잉크젯프린터	http://www.safetimes.co.kr/news/articleView.html?idxno=111888	2022/06/15	0	2022-07-20 16:16:00	2022-07-21 10:30:15
BK22001401	19	질문자	그러면, 잉크젯으로 해서, 프린터라도 비용 절감 해야겠어요. 오늘, 컴퓨터 관리와 여러 정보 알려줘서 정말 감사해요.				0	2022-07-20 16:16:00	2022-08-02 12:01:32
BK22001401	20	전문가	컴퓨터 시작 프로그램 정리와 용량 확보해서 좀 더 오래 사용할 수 있길 바라요.				1	2022-07-20 16:16:00	2022-07-22 11:02:38
