id	utterance_id	role	text	search_query	search_URL	reference_date	terminate	regDate	updDate
BK22018309	1	질문자	제가 사려고 했던 음반이 절판되어서 신제품을 구할 수 없게 되었어요.				0	2022-10-21 17:50:16	2022-10-22 05:26:30
BK22018309	2	전문가	그렇다면 중고 시장을 한번 찾아보시는 것도 방법이에요.				0	2022-10-21 17:50:16	2022-10-22 05:26:30
BK22018309	3	질문자	안 그래도 조금 알아봤는데, 큰 중고 거래 플랫폼으로는 중고나라, 당근마켓, 번개장터가 있더라고요. 저는 한 번도 중고 거래를 해본 적이 없어서 어디를 이용해야 할지 잘 모르겠어요. 각각의 플랫폼에 어떤 특징이 있는지 알려주실 수 있나요?				0	2022-10-21 17:50:16	2022-10-22 05:26:30
BK22018309	4	전문가	그럼 네이버 카페인 중고나라를 먼저 설명해드릴게요. 중고나라는 거래 물량이 압도적으로 많다는 게 제일 큰 장점이에요. 거래되는 물건의 양이 많다 보니 원하는 조건에 부합하는 물건을 찾기도 쉽죠.	중고나라	http://www.dailypop.kr/news/articleView.html?idxno=62336	2022/08/26	0	2022-10-21 17:50:16	2022-10-22 05:26:30
BK22018309	5	질문자	제가 찾는 물건이 있을 가능성도 제일 크겠네요. 중고나라의 불편한 점으로는 어떤 것이 있나요?				0	2022-10-21 17:50:16	2022-10-22 05:26:30
BK22018309	6	전문가	중고나라의 큰 단점은 카페 이용 자체가 복잡하다는 점이에요. 활성 메뉴 수가 너무 많아서 원하는 메뉴를 찾는 데도 많은 시간이 걸리는 데다가, 검색을 하면 수많은 광고 글과 판매 글이 함께 검색되기 때문에 정작 필요한 게시물을 찾기가 어려워요.	중고나라 단점	http://www.dailypop.kr/news/articleView.html?idxno=62336	2022/08/26	0	2022-10-21 17:50:16	2022-10-22 05:26:30
BK22018309	7	질문자	아, 저도 중고나라에 들어가 봤다가 메뉴 수에 놀랐던 경험이 있어요. 그로 인해 이용자들이 불편을 겪는군요. 그럼 다음으로 당근마켓의 특징도 알려주세요.				0	2022-10-21 17:50:16	2022-10-22 05:26:30
BK22018309	8	전문가	당근마켓은 중고 직거래 플랫폼이에요. 내 위치에서 가까이 있는 사람하고만 거래할 수 있도록 제한되어있죠. 또 당근마켓에는 거래 후기 등으로 부여되는 매너 온도라는 시스템이 있어서, 매너 온도를 보고 거래의 신뢰도를 판단 할 수 있어요.	당근마켓	http://www.dailypop.kr/news/articleView.html?idxno=62336	2022/08/26	0	2022-10-21 17:50:16	2022-10-22 05:26:30
BK22018309	9	질문자	판매자의 신뢰도를 확인할 수 있다니, 독특하고 편리한 시스템이네요. 당근마켓의 불편한 점은 무엇일까요?				0	2022-10-21 17:50:16	2022-10-22 05:26:30
BK22018309	10	전문가	당근마켓을 이용하신다면, 동네 기반의 거래 특성상 거래 물건과 동네에 따라 거래의 진행 속도가 느릴 수 있다는 점을 염두에 두셔야 해요.	당근마켓 단점	http://www.dailypop.kr/news/articleView.html?idxno=62336	2022/08/26	0	2022-10-21 17:50:16	2022-10-22 05:26:30
BK22018309	11	질문자	그렇군요, 마지막으로 번개장터의 특징이 궁금하네요.				0	2022-10-21 17:50:16	2022-10-22 05:26:30
BK22018309	12	전문가	번개장터는 이용자의 취향을 기반으로 한 중고 거래 플랫폼이에요. 중고 거래를 돕는 여러 가지 메뉴를 운영하고 있죠. 하지만 메뉴가 너무 많은 탓에 번개장터를 처음 이용하는 사람은 불편을 겪을 수 있어요. 또 번개장터의 아쉬운 점으로는 정보가 부족한 글이 많다는 점이에요. 판매 글의 물품 사진을 직접 촬영하지 않고 판매페이지의 사진을 그대로 사용하거나 자세한 설명이 누락된 글들을 많이 볼 수 있어요.	번개장터	http://www.dailypop.kr/news/articleView.html?idxno=62336	2022/08/26	0	2022-10-21 17:50:16	2022-10-22 05:26:30
BK22018309	13	질문자	각각의 플랫폼에 대해 이해가 잘 됐어요. 그런데 아무래도 중고 거래를 한 번도 해본 적이 없다 보니 사기가 제일 걱정돼요. 사기 피해를 막으려면 어떤 점을 눈여겨봐야 하나요?				0	2022-10-21 17:50:16	2022-10-22 05:26:30
BK22018309	14	전문가	중고 사이트에서 판매자의 아이디를 검색해보면 그 사람의 이전 게시물을 확인할 수 있어요. 만약 검색되는 판매 이력이 없거나 최근 들어 갑자기 많은 양의 판매 글을 올린 사람이라면 사기를 의심해보실 수 있어요.	중고거래 사기 이전 게시물	https://www.insight.co.kr/news/118714	2017/09/16	0	2022-10-21 17:50:16	2022-10-22 05:26:30
BK22018309	15	질문자	판매자의 판매 이력을 잘 살펴봐야 하는군요. 또 어떤 경우 사기를 의심해볼 수 있나요?				0	2022-10-21 17:50:16	2022-10-22 05:26:30
BK22018309	16	전문가	중고 사이트 판매 글의 사진 정보가 부족한 경우 판매자에게 제품을 파악하기 위한 추가 사진을 요구할 수 있는데요, 이때 판매자가 추가 사진 제공을 거부한다면 제품 이상을 숨기려는 것일 수도 있어요. 이럴 땐 아무리 가격이 저렴하더라도 거래를 진행하지 않는 게 좋아요.	중거거래 사기 사진 거부	https://www.insight.co.kr/news/118714	2017/09/16	0	2022-10-21 17:50:16	2022-10-22 05:26:30
BK22018309	17	질문자	그 말씀을 듣고 보니 짐짓 다른 사진을 요구해보는 것도 사기 피해를 막는 좋은 방법일 것 같네요. 중고 거래를 할때 알아두면 좋은 매너로는 어떤 것이 있나요?				0	2022-10-21 17:50:16	2022-10-22 05:26:30
BK22018309	18	전문가	중고 거래를 할 땐 무리한 가격 흥정을 시도하지 않는 게 매너예요. 또 직거래의 경우 현장에서 가격 협상을 시도하는 것도 상대방에게 큰 실례라는 점, 기억해 주세요.	중고거래 팁	https://lk.asiae.co.kr/article/2020061114123439109	2020/06/13	0	2022-10-21 17:50:16	2022-10-22 05:26:30
BK22018309	19	질문자	전문가님 덕분에 중고 거래를 해 볼 용기가 생기는 것 같아요. 중고 거래 플랫폼의 특징과 중고 거래 시의 주의점을 알려주셔서 감사해요!				0	2022-10-21 17:50:17	2022-10-22 05:26:30
BK22018309	20	전문가	뭘요, 중고 플랫폼에서 궁금이님이 찾으시는 음반을 꼭 발견하시길 바라요.				1	2022-10-21 17:50:17	2022-10-22 05:26:30
