id	utterance_id	role	text	search_query	search_URL	reference_date	terminate	regDate	updDate
BK22001214	1	질문자	늘 쓰던 립스틱이 국내에서는 단종됐대요.				0	2022-07-20 16:14:25	2022-08-02 12:01:32
BK22001214	2	전문가	이런, 꼭 필요하시면 해외 직구로 구매해 보시는 건 어때요?				0	2022-07-20 16:14:25	2022-07-21 10:22:27
BK22001214	3	질문자	해외 직구요? 저 아직 한 번도 안 해봤는데. 해외에 있는 물건을 사는 게 해외 직구 맞죠?				0	2022-07-20 16:14:25	2022-08-02 12:01:32
BK22001214	4	전문가	맞아요. 정확하게는, 온라인 쇼핑몰을 통해서 해외에서 직접 구매하는 소비행위를 뜻해요.	해외직구	https://ko.wikipedia.org/wiki/%ED%95%B4%EC%99%B8%EC%A7%81%EA%B5%AC	2022/05/24	0	2022-07-20 16:14:25	2022-07-21 10:22:27
BK22001214	5	질문자	구매대행이라고 하던가요? 그것도 해외직구 방식 중 하나인 거예요?				0	2022-07-20 16:14:25	2022-08-02 12:01:32
BK22001214	6	전문가	맞아요. 해외 직구는 직접배송, 배송대행, 구매대행, 이렇게 세 가지 방식으로 진행할 수 있어요. 직접배송은 해당 쇼핑몰에서 직접 물건을 구매하는 방식이고, 배송대행은 상품은 직접 구매하지만 배송은 대행업체에게 맡기는 방식이에요. 구매대행은 구매부터 배송까지 모든 것을 위임하는 방식이고요.	구매 대행	https://ko.wikipedia.org/wiki/%ED%95%B4%EC%99%B8%EC%A7%81%EA%B5%AC	2022/05/24	0	2022-07-20 16:14:25	2022-07-21 10:22:27
BK22001214	7	질문자	음, 그럼 물건을 좀 싸게 사려면 직접배송 방식이 낫겠네요?				0	2022-07-20 16:14:25	2022-08-02 12:01:32
BK22001214	8	전문가	아무래도 직접배송 방식을 활용하면 좀 더 저렴하죠. 해외 쇼핑몰에서 직접 결제한 후에 국내로 배송하는 방식이니까, 해외에서 판매하는 가격으로 상품을 구매할 수 있거든요. 근데 간혹 국제배송비가 비싸서 국내보다 높은 가격에 구매하게 될 수도 있으니까 조심하셔야 해요.	해외직구 직접배송 방식	https://news.mt.co.kr/mtview.php?no=2021112717454517924	2021/11/28	0	2022-07-20 16:14:25	2022-07-21 10:22:27
BK22001214	9	질문자	미국의 아마존 같은 사이트에서 구매하는 것도 직접구매 방식이겠네요. 근데 직접구매 방식은 환불이 어렵진 않나요?				0	2022-07-20 16:14:25	2022-08-02 12:01:32
BK22001214	10	전문가	그렇죠. 직접구매 방식은 하자 상품이 배송돼도 환불이나 반품이 힘들긴 해요.	해외직구 직접배송 환불	https://news.mt.co.kr/mtview.php?no=2021112608000038985	2021/11/27	0	2022-07-20 16:14:25	2022-07-21 10:22:27
BK22001214	11	질문자	하자 상품이 오면 난감하겠는데요? 흠, 배송대행 방식은 어떤가요?				0	2022-07-20 16:14:25	2022-08-02 12:01:32
BK22001214	12	전문가	배송대행 방식을 줄여서 배대지라고도 하는데, 배대지는 대행 업체가 현지에서 상품을 검수하기 때문에 하자 상품으로 피해를 볼 가능성은 덜하죠. 대신, 직접배송에 비해 절차가 좀 복잡해요. 온라인에 익숙지 않은 사람에겐 구매 과정이 힘들 수도 있어요.	해외직구 배송대행 환불	https://news.mt.co.kr/mtview.php?no=2021112608000038985	2021/11/27	0	2022-07-20 16:14:25	2022-07-21 10:22:27
BK22001214	13	질문자	복잡한 거 딱 질색인데! 그냥 직접배송 방식으로 직구해야 할까 봐요.				0	2022-07-20 16:14:25	2022-08-02 12:01:32
BK22001214	14	전문가	흠, 쉽고 편하게 직구를 하고 싶다면 구매대행 방식이 가장 좋을 수도 있어요. 별도로 해외 쇼핑몰에 가입할 필요가 없어서 편리하거든요. 대신 해외직구 방식 중 수수료가 제일 센 편이에요.	해외직구 구매대행 편리	https://news.mt.co.kr/mtview.php?no=2021112608000038985	2021/11/27	0	2022-07-20 16:14:25	2022-07-21 10:22:27
BK22001214	15	질문자	오, 좋아요! 구매대행 방식이 제일 낫겠네요. 전 그냥 단종된 제품을 구하고 싶은 거니까 구매대행 방식이 딱인데, 저렴하게 사려고 해외직구를 하는 사람들은 구미가 당기진 않겠네요.				0	2022-07-20 16:14:25	2022-08-02 12:01:32
BK22001214	16	전문가	그렇죠. 아 참, 구매대행하실 때 오픈마켓에 입점한 업체가 해외 사업자일 경우 분쟁이 일어났을 때 해결하기 어려울 수 있어요.	해외 구매대행 주의할 점	https://www.segye.com/newsView/20191127508311?OutUrl=naver	2019/11/27	0	2022-07-20 16:14:25	2022-07-21 10:22:27
BK22001214	17	질문자	네, 조심할게요. 어떤 방식이든 장단점이 있네요. 예전엔 해외직구가 이렇게까지 대중화되진 않았었는데 요즘은 많이들 하는 것 같아요.				0	2022-07-20 16:14:25	2022-08-02 12:01:32
BK22001214	18	전문가	맞아요. 특히 최근에 해외여행이 어려워지면서 해외 직구 상품의 접근성이 높아진 부분도 있어요. 해외 직구 관련 시장도 빠르게 성장하고 있으니 앞으로는 좀 더 저렴하고 안전한 직구 방식들도 생겨나겠죠.	해외직구 인기	https://www.etnews.com/20220209000010	2022/02/09	0	2022-07-20 16:14:25	2022-07-21 10:22:27
BK22001214	19	질문자	그럼 더 좋죠. 오늘 감사했어요. 제 립스틱 사면서, 하나 더 살 테니까 배송 오면 선물로 드릴게요.				0	2022-07-20 16:14:25	2022-08-02 12:01:32
BK22001214	20	전문가	와, 정말요? 쓰고 있던 틴트 거의 다 써갔는데, 저 완전 계 탔네요.				0	2022-07-20 16:14:25	2022-07-21 10:22:27
BK22001214	21	질문자	하하, 배송 오면 연락드릴 테니까 조만간 또 봐요.				1	2022-07-20 16:14:25	2022-08-02 12:01:32
