id	utterance_id	role	text	search_query	search_URL	reference_date	terminate	regDate	updDate
BK22018793	1	질문자	오늘따라 날씨가 너무 좋네요. 김치냉장고를 사려고 백화점에 갔었는데 저녁 약속이 있는 걸 깜박해서 못 사고 그냥 돌아 왔어요.				0	2022-10-24 18:28:01	2022-10-31 20:33:49
BK22018793	2	전문가	저도 요즘 약속을 자꾸 깜박하는 일이 많아요. 그런데 요즘 주변에 김치냉장고 장만하는 사람들이 많네요. 김장철이라서 그런가봐요.				0	2022-10-24 18:28:01	2022-10-31 20:33:49
BK22018793	3	질문자	겨울이 오니까 김장을 많이 하나 봐요. 김치 냉장고의 경우엔 김장철에 판매량이 높은가요?				0	2022-10-24 18:28:01	2022-10-31 19:32:01
BK22018793	4	전문가	네, 가을부터 김장을 해서 10월부터 김치냉장고 수요가 증가해요. 작년 롯데하이마트의 경우 김치냉장고 연간 매출 중 42%가 10월 이후에 판매되기도 했어요.	김치냉장고 수요	https://www.mk.co.kr/news/economy/view/2022/10/927827/	2022/10/20	0	2022-10-24 18:28:01	2022-11-01 11:29:57
BK22018793	5	질문자	저도 이번에 김장을 하고 김치를 보관하려고 사는 거거든요. 그러면 이번에 나온 김치냉장고 하나 추천해주실 수 있나요?				0	2022-10-24 18:28:01	2022-10-24 18:46:55
BK22018793	6	전문가	위니아에서 나온 2023년형 딤채는 어떠세요? 지역별 김치 맞춤 숙성모드가 있거든요 김치 양념의 특성에 따라 중부식과 남부식 숙성모드를 조절해줘요.	위니아 '2023년형 딤채'	https://www.mk.co.kr/news/economy/view/2022/10/927827/	2022/10/20	0	2022-10-24 18:28:01	2022-10-24 18:50:52
BK22018793	7	질문자	딤채 신상이 나왔나 봐요? 김치도 지역별로 숙성도 가능하고 너무 신기하네요. 그런데 요즘에는 김치냉장고에 김치만 보관하는 건 아니던데 다른 걸 넣을 수도 있나요?				0	2022-10-24 18:28:01	2022-11-01 11:29:57
BK22018793	8	전문가	네, 말씀하신 것처럼 요즘에는 김치 냉장고에 다양한 식재료를 보관하죠. 그래서 요즘 김치 냉장고는 밀키트 보관 모드, 과일주나 과일청 숙성모드 등 다양한 기능이 추가되어 활용도가 높아요.	위니아 2023년형 딤채 숙성모드	https://www.mk.co.kr/news/economy/view/2022/10/927827/	2022/10/20	0	2022-10-24 18:28:01	2022-11-01 11:29:57
BK22018793	9	질문자	안그래도 집에서 밀키트를 많이 만들어 먹는데 밀키트 보관모드도 있다니 활용도가 좋겠어요. 그러면 위니아 딤채 디자인은 어떤가요?				0	2022-10-24 18:28:01	2022-10-31 19:32:01
BK22018793	10	전문가	위니아 2023년 딤채는 유리로 매트한 질감을 나타냈고, 따뜻한 색상을 표현했어요. 또 유리나 메탈로 소재를 다양화 했죠.	위니아 2023년형 소재	https://www.mk.co.kr/news/economy/view/2022/10/927827/	2022/10/20	0	2022-10-24 18:28:01	2022-10-24 18:50:52
BK22018793	11	질문자	메탈 소재도 예쁘고 좋을 거 같네요. 혹시 LG전자에서 새로 나온 김치냉장고도 있나요?				0	2022-10-24 18:28:01	2022-11-01 11:29:57
BK22018793	12	전문가	네. LG전자에서도 디오스 오브제컬렉션 김치냉장고가 새로 출시됐어요. 기존의 기능 외에도 씽큐 앱 업 가전 센터에서 구입 후에 기능을 추가할 수 있어요.	LG전자 신제품 디오스 오브제컬렉션 김치냉장고	https://www.mk.co.kr/news/economy/view/2022/10/927827/	2022/10/20	0	2022-10-24 18:28:01	2022-10-31 19:32:01
BK22018793	13	질문자	기능을 업그레이드 하는 건 정말 좋은 장점이네요. 디오스 오브제 컬렉션 김치 냉장고의 특징은 어떤 게 있을까요?				0	2022-10-24 18:28:01	2022-10-24 18:46:55
BK22018793	14	전문가	다용도 분리벽으로 식재료마다 온도를 다르게 설정이 가능하고, 입체냉각,쿨링케어,냉기지킴가드의 3단계 냉기 케어 시스템, 김치맛을 살리는 유산균을 최대 57배까지 늘려주는 유산균 김치 플러스, 포장김치 바코드를 찍고 제조일자를 입력해서 최적의 온도와 시간으로 익혀주는 인공지능 맞춤보관 기능 등이 있어요.	LG전자 '디오스 오브제컬렉션 인공지능	https://www.mk.co.kr/news/economy/view/2022/10/927827/	2022/10/20	0	2022-10-24 18:28:01	2022-11-01 11:29:57
BK22018793	15	질문자	김치냉장고에도 AI기능이 적용되었네요. 요즘 냉장고들은 문색을 자유자재로 바꿀 수 있는데 이 제품은 그런 기능은 없나요?				0	2022-10-24 18:28:01	2022-10-24 18:46:55
BK22018793	16	전문가	네, 문 색을 바꾸는 기능도 있어요. 김치 냉장고 표면에 발광다이오드 광원을 부착해서 수시로 문 색깔을 변경할 수 있어요.	디오스 오브제컬렉션 김치냉장고 색상	https://www.mk.co.kr/news/economy/view/2022/10/927827/	2022/10/20	0	2022-10-24 18:28:01	2022-10-31 20:33:49
BK22018793	17	질문자	그럼 도어 색을 어떻게 바꿀 수 있나요?				0	2022-10-24 18:28:01	2022-10-24 18:50:52
BK22018793	18	전문가	도어 색은 LG 씽큐 어플리케이션에서 변경이 가능해요.	LG 씽큐 앱	https://www.mk.co.kr/news/economy/view/2022/10/927827/	2022/10/20	0	2022-10-24 18:28:01	2022-10-24 18:50:52
BK22018793	19	질문자	어플이랑 연동되어 있는거군요. 새로 나온 김치 냉장고를 어떤 걸 사야 할 지 막막했는데 덕분에 잘 알 수 있게 됐어요. 고마워요.				0	2022-10-24 18:28:01	2022-11-01 11:29:58
BK22018793	20	전문가	도움이 되었다니 다행이에요. 김치 냉장고는 한 번 사면 오랫동안 쭉 써야 하니까 기능들을 더 살펴 보고 좋은 걸로 구매해요. 좋은 하루 되세요.				1	2022-10-24 18:28:01	2022-11-01 11:29:58
