id	utterance_id	role	text	search_query	search_URL	reference_date	terminate	regDate	updDate
BK22013424	1	질문자	이번에 이사 가면서 집 정리를 하다 보니 아까운 물건들이 많이 있는데, 중고로 돼 팔 수 있는 방법이 있을까?				0	2022-09-30 15:42:04	2022-10-01 19:03:45
BK22013424	2	전문가	중고거래 플랫폼이 있어. 중고거래 플랫폼을 이용하는 사람은 전자제품도 팔고 기프티콘도 팔고 음식도 파는 등 다양한 물건들을 팔고 사고해.	중고거래 시장	https://www.mk.co.kr/news/business/view/2021/10/1007228/	2021/10/25	0	2022-09-30 15:42:04	2022-10-01 19:03:45
BK22013424	3	질문자	중고거래 플랫폼을 이용하면 쉽게 이용 가능하겠다. 우리나라 사람들이 가장 자주 사용하는 중고거래 플랫폼이 뭐야?				0	2022-09-30 15:42:04	2022-10-01 19:03:45
BK22013424	4	전문가	당근 마켓이 우리나라 사람이 일상에서 가장 자주 사용하는 앱 상위권에 있어. 2022년 5월 기준으로 지역 생활 커뮤니티 당근 마켓 누적 가입자 수가 3000만 명을 넘었고 이건 우리나라 국민의 60% 가까이 가입했다는 뜻이야.	중고거래플랫폼 순위	https://www.mk.co.kr/news/business/view/2022/06/520673/	2022/06/15	0	2022-09-30 15:42:04	2022-10-01 19:03:45
BK22013424	5	질문자	많은 사람들이 사용하는구나. 당근 마켓에서 거래하는 방법은 어떻게 돼?				0	2022-09-30 15:42:04	2022-10-01 19:03:45
BK22013424	6	전문가	간단해. 당근 마켓 앱에 로그인해서 네가 팔 물건을 글로 올리고, 살 사람과 채팅으로 거래 약속을 잡고 만나서 팔면 돼. 살 때도 올려져 있는 파는 글들을 보고 채팅으로 약속 잡고 사면돼.	당근마켓 거래방법	https://it.donga.com/32081/	2021/06/10	0	2022-09-30 15:42:04	2022-10-01 19:03:45
BK22013424	7	질문자	거래하는 방법이 간단해서 좋다. 당근 마켓은 사고팔고를 거의 직접 만나서 하나 봐?				0	2022-09-30 15:42:04	2022-10-01 19:03:45
BK22013424	8	전문가	당신 근처의 마켓을 줄여서 당근 마켓이야. 근처 6㎞ 이내 동네 사람들과 수수료 없이 중고거래를 하는 앱이고, 가입하기 위해서는 GPS를 통해 내가 설정한 동네에 내가 진짜로 있는지 동네 인증부터 해야 해. 파는 곳이 동네니까 대부분 직접 만나서 직거래를 하지.	당근마켓	https://www.nongmin.com/nature/NAT/LVN/343876/view	2021/08/30	0	2022-09-30 15:42:04	2022-10-01 19:03:45
BK22013424	9	질문자	직접 만나서 거래하면 사기당할 일을 적겠다. 당근 마켓의 다른 안 좋은 점이 뭐가 있을까?				0	2022-09-30 15:42:04	2022-10-01 19:03:45
BK22013424	10	전문가	당근 마켓은 동네 위주로 하고 있다 보니 거래할 물건과 지역에 따라 늦게 팔릴 수도 있어.	당근마켓    비교	http://www.dailypop.kr/news/articleView.html?idxno=62336	2022/08/26	0	2022-09-30 15:42:04	2022-10-01 19:03:45
BK22013424	11	질문자	내가 물건을 팔았는데 산 사람이 집에 가져가서 보다가 마음에 안 든다고 환불하면 무조건 환불해 줘야 해?				0	2022-09-30 15:42:04	2022-10-01 19:03:45
BK22013424	12	전문가	중고거래는 전자상거래 등에서의 소비자 보호에 관한 법률이 적용되지 않기 때문에 산 사람이 안 사겠다고 마음이 변했다고 판 사람이 환불해 주지 않아도 돼. 특히 팔 때 하자가 있어도 환불이 어렵다고 미리 알려줬거나 산 사람이 조심하지 못해서 망가진 경우에는 더욱 환불 안 해줘도 돼. 그러니 너도 중고 물건을 살 경우에는 생각을 많이 하고 사도록 해.	중고거래 환불	https://news.mt.co.kr/mtview.php?no=2022082521191048876	2022/08/25	0	2022-09-30 15:42:04	2022-10-01 19:03:45
BK22013424	13	질문자	그런데 중고거래를 하다 보면 내가 소득이 생기는 거잖아. 이것도 세금을 내야 되는 거야?				0	2022-09-30 15:42:05	2022-10-01 19:03:45
BK22013424	14	전문가	아니. 국세청에서는 얼마에 판매하는 것에는 상관없이 잠깐 그 순간 중고물품을 판 거로는 사업으로 볼 수가 없기 때문에 세금을 부과 안 하겠다고 해. 하지만 작은 금액이라도 자주 반복적으로 중고 물건을 팔아서 이득을 계속 얻었다면 종합소득세 등을 과세할 수 있어.	중고거래 세금	https://www.hani.co.kr/arti/economy/consumer/1012263.html	2021/09/20	0	2022-09-30 15:42:05	2022-10-01 19:03:45
BK22013424	15	질문자	이사 갈 때 잠깐 여러 개 판 거니까, 소득세 문제는 걱정 안 해도 되겠다. 지금은 파니까 문제없지만 내가 중고거래로 사기를 당하면 어떻게 해야해?				0	2022-09-30 15:42:05	2022-10-01 19:03:45
BK22013424	16	전문가	2022년 8월 28일 방송 통신 위원에 따르면 온라인 중고거래 사기 피해뿐만 아니라 음식점 별점을 테러한다는지 악성 후기를 쓴다든지 하는 피해에 대해서 온라인 피해 365센터가 올해 10월부터 대국민 서비스도 하고 방송통신위원회, 한국 정보통신진흥 협회 등이 운용하는 전용 사이트에서 피해 신청도 가능해	중고거래 사기	http://www.dt.co.kr/contents.html?article_no=2022082902101031820001	2022/08/28	0	2022-09-30 15:42:05	2022-10-01 19:03:45
BK22013424	17	질문자	알려줘서 고마워. 집에 가서 중고로 팔 물건을 깨끗하게 닦아 놔야겠어.				0	2022-09-30 15:42:05	2022-10-01 19:03:45
BK22013424	18	전문가	정리할 것도 많고 중고로 팔 물건도 많겠네. 이번에 용돈 좀 벌겠는데?				0	2022-09-30 15:42:05	2022-10-01 19:03:45
BK22013424	19	질문자	용돈 벌어서 다시 필요한 중고 물건을 사야겠어. 살 때는 사기인지 잘 봐야겠다. 내가 팔 때는 매너 있는 거래를 하고				0	2022-09-30 15:42:05	2022-10-01 19:03:45
BK22013424	20	전문가	우리 동네의 매너 있는 거래로 아직 정 많은 동네라고 이웃들이 생각할 거야. 언제든지 궁금한 거 있으면 나에게 물어봐.				1	2022-09-30 15:42:05	2022-10-01 19:03:45
