id	utterance_id	role	text	search_query	search_URL	reference_date	terminate	regDate	updDate
BK22018795	1	질문자	이번달에 이사를 가게되었는데요. 가구를 새 걸로 장만할까 고민중이에요.				0	2022-10-25 19:13:13	2022-10-25 19:13:13
BK22018795	2	전문가	아, 그런 고민이 있으시구나. 혹시 어떤 가구를 구매하고싶으세요?				0	2022-10-25 19:13:13	2022-10-25 19:13:13
BK22018795	3	질문자	얼마 전에 SNS에서 원목 가구 사진을 보았는데 인테리어에 좋을 것 같더라구요. 그런데 제가 원목 가구에 대해 하나도 몰라서요. 혹시 원목이 정확히 뭔지 알고 계세요?				0	2022-10-25 19:13:13	2022-10-25 19:13:13
BK22018795	4	전문가	네, 원목은 말 그대로 자라있는 나무나 그것을 벤 목재를 말해요. 특히 모든 목재제품은 원목을 기초재료로 활용하지만, 실제로 원목을 있는 그대로 활용하기 보다는 원목을 여러가지 형태로 가공한 제품을 원료로 활용하는 경우가 더 많죠.	원목	http://www.imwood.co.kr/news/articleView.html?idxno=28290	2022/10/24	0	2022-10-25 19:13:13	2022-10-25 19:13:13
BK22018795	5	질문자	원목이 그런 의미였군요. 그렇다면 원목가구의 장점을 알 수 있을까요?				0	2022-10-25 19:13:13	2022-10-25 19:13:13
BK22018795	6	전문가	네, 원목 가구의 장점은 위화감 없이 웬만한 소재를 소화할 수 있다는 점이 꼽혀요. 특히 요즘은 여러 종류의 인테리어 소재들이 함께 공간을 만들어내고 있죠. 참고로 실내에 자연 그대로의 무늬가 들어와 주변과 어우러질 때, 우리는 그 모습에서 자연스러움과 이색적인 매력을 느끼게 되죠.	원목 가구	http://www.woodkorea.co.kr/news/articleView.html?idxno=42394	2019/12/31	0	2022-10-25 19:13:13	2022-10-25 19:13:13
BK22018795	7	질문자	아, 원목가구에 그런 장점이 있군요. 원목 가구에 관심이 생기는데 혹시 원목 가구 세일을 하는 브랜드가 있을까요?				0	2022-10-25 19:13:13	2022-10-25 19:13:13
BK22018795	8	전문가	원목 가구 브랜드 모나코에서 최대 50%할인을 진행한다고 가구 프리미엄 아울렛 가구톡세상에서 밝혔죠. 이 브랜드는 고무나무와 하이그로시를 사용하여 가구를 제작하는 것이 특징이죠.	원목 가구 세일	http://www.youngnong.co.kr/news/articleView.html?idxno=40177	2022/10/12	0	2022-10-25 19:13:13	2022-10-26 12:58:10
BK22018795	9	질문자	아, 고무나무로 가구를 만드는 브랜드군요. 그렇다면 고무나무는 어떤 특징을 갖고 있는 원목 소재인가요?				0	2022-10-25 19:13:13	2022-10-25 19:13:13
BK22018795	10	전문가	고무나무는 친환경 소재이기 때문에 오래 사용해도 변질과 변형이 적어 가장 실용적인 가구 소재로 활용되고 있죠. 안정감과 더불어 실내 습도, 온도 유지의 효과까지 더해져 사계절의 온도 차가 심한 국내에 적합하여 주목받는 원목이에요.	고무나무 원목	http://www.youngnong.co.kr/news/articleView.html?idxno=40177	2022/10/12	0	2022-10-25 19:13:13	2022-10-26 12:58:10
BK22018795	11	질문자	고무나무는 그런 특징이 있군요. 혹시 고무나무 이외에 어떤 나무를 원목소재로 삼나요?				0	2022-10-25 19:13:13	2022-10-25 19:13:13
BK22018795	12	전문가	팽창과 수축이 작고 휘어짐의 강도가 커 무거운 무게에도 잘 견디는 특성이 있는 소나무가 있는데요. 참고로 소나무를 활용한 가구는 내후성이 강해 오랜시간 변형 없이 사용할 수 있다는 장점이 있죠.	원목 소재	https://www.insight.co.kr/news/413298	2022/09/29	0	2022-10-25 19:13:13	2022-10-25 19:13:13
BK22018795	13	질문자	소나무도 있었군요. 그렇다면 소나무를 활용해 가구를 만든 브랜드를 알려주시겠어요?				0	2022-10-25 19:13:13	2022-10-25 19:13:13
BK22018795	14	전문가	지난달 30일에 무인양품 주식회사가 어떤 공간에도 잘 어울리는 소나무 가구 시리즈를 출시한다고 밝혔어요. 이 시리즈는 소프트 우드 중 가구에 쓰이는 대표적인 원료인 소나무를 활용해 유닛선반, 목제 거울, 침대, 그리고 로우 접이식 테이블로 구성했죠.	소나무 가구	https://newsis.com/view/?id=NISX20220930_0002033026&cID=13001&pID=13000	2022/09/30	0	2022-10-25 19:13:13	2022-10-25 19:13:13
BK22018795	15	질문자	소나무를 활용해 가구 시리즈를 선보였군요. 저희 집에 접이식 테이블을 하나 구비할까 생각 했었는데요. 혹시 무인양품에서 만든 로우 접이식 테이블은 어떤 특성이 있는 제품인가요?				0	2022-10-25 19:13:13	2022-10-25 19:13:13
BK22018795	16	전문가	로우 접이식 테이블의 구성은 흠집에 강한 자외선 도장으로 상판이 있는 제품이에요. 특히 테이블 다리는 우레탄 수지 도장을 활용해 표면을 매끄럽게 마무리했어요. 그리고 다리와 상판 모두 소나무 원목 집성재를 사용해 접이식 테이블이지만 오랫동안 쓸 수 있죠.	무인양품 로우 접이식 테이블	https://newsis.com/view/?id=NISX20220930_0002033026&cID=13001&pID=13000	2022/09/30	0	2022-10-25 19:13:13	2022-10-25 19:13:13
BK22018795	17	질문자	그런 특성이 있는 제품이군요. 거실에 테이블을 두려고 하는데 수납공간이 있었으면 좋겠거든요. 혹시 이런 점을 반영한 테이블도 있을까요?				0	2022-10-25 19:13:13	2022-10-25 19:13:13
BK22018795	18	전문가	네, 상판 밑부분에 서랍형 수납공간으로 구성한 것 중에 리프트 테이블이란 가구가 있어요. 리프트 테이블은 TV를 보거나 노트북으로 작업을 하면서 식사를 하는 등 특히 주로 거실에서 생활하는 1~2인가구가 실용적으로 쓸 수 있는 상품이죠.	거실 테이블	https://realty.chosun.com/site/data/html_dir/2018/09/11/2018091102287.html?utm_source=naver&utm_medium=original&utm_campaign=realty	2018/09/12	0	2022-10-25 19:13:13	2022-10-26 12:58:10
BK22018795	19	질문자	아, 그런 특성이 있는 테이블도 있었군요. 원목으로 만들어진 리프트 테이블이 있는지 찾아봐야겠네요. 가구에 대해 자세히 말씀해주신 덕분에 가구 사러갈 때 도움이 많이 될 것 같아요.				0	2022-10-25 19:13:13	2022-10-26 12:58:10
BK22018795	20	전문가	네, 저도 가구에 대한 정보를 다양하게 설명할 수 있어 뿌듯하네요. 그럼 안녕히 계세요!				1	2022-10-25 19:13:13	2022-10-26 12:58:10
