id	utterance_id	role	text	search_query	search_URL	reference_date	terminate	regDate	updDate
BK22019418	1	질문자	오랜만이에요. 며칠 전이 제 생일이라서 친구들을 만난다고 너무 정신이 없었어요.				0	2022-10-26 14:09:34	2022-10-26 14:09:34
BK22019418	2	전문가	생일인지도 몰랐는데 생일 너무 축하해요. 생일 선물은 많이 받았나요?				0	2022-10-26 14:09:34	2022-10-26 14:09:34
BK22019418	3	질문자	안그래도 이번에 남편한테 음식물 처리기를 사달라고 할건데 어떤 걸 사야할 지 모르겠어요. 음식물 처리 방식도 여러개라던데 어떤 방식이 있는 지 아세요?				0	2022-10-26 14:09:34	2022-10-27 16:25:43
BK22019418	4	전문가	음식물 쓰레기를 처리하는 방법은 크게 고온건조분쇄 방법과 미생물처리 방법으로 나뉠 수 있어요. 각각의 장점과 단점이 있지만 가장 중요한 건 음식물 처리 기능과 악취 막는 거죠.	음식물 처리 방식	https://www.etnews.com/20221010000073	2022/10/10	0	2022-10-26 14:09:34	2022-10-26 14:23:46
BK22019418	5	질문자	음식물 처리 과정에서 악취를 막는 거도 중요하겠네요. 그러면 새로 출시된 거 중에 하나 추천해주실 만한게 있을까요?				0	2022-10-26 14:09:34	2022-10-26 14:23:46
BK22019418	6	전문가	SK매직에서 올해 6월에 나온 에코클린은 어떠세요? 14년 만에 음식물처리기 시장에 다시 제품을 선 보였어요.	SK매직 에코클린	https://www.etnews.com/20221010000073	2022/10/10	0	2022-10-26 14:09:34	2022-10-27 16:25:43
BK22019418	7	질문자	요즘 음식물 처리기가 유행이라 다시 사업을 시작했나봐요. 그러면 이 제품은 건조방식인가요?				0	2022-10-26 14:09:34	2022-10-26 14:23:46
BK22019418	8	전문가	SK매직의 에코클린은 순환 제습 건조 분쇄방식 기술로 음식물 쓰레기를 처리해요.	SK매직 에코클린 건조분쇄	https://www.etnews.com/20221010000073	2022/10/10	0	2022-10-26 14:09:34	2022-10-26 14:23:46
BK22019418	9	질문자	그러면 이 제품은 냄새를 차단하는 기능이 있나요?				0	2022-10-26 14:09:34	2022-10-26 14:23:46
BK22019418	10	전문가	음식물 처리 과정에서 나오는 음식물 악취를 물로 바꾸고 습기의 외부 방출을 근본적으로 차단한 제품이에요.	SK매직 에코클린 악취차단	https://www.etnews.com/20221010000073	2022/10/10	0	2022-10-26 14:09:34	2022-10-26 14:23:46
BK22019418	11	질문자	습기가 차단되면 냄새도 안나겠네요. SK매직 에코클린 음식물 처리기 내부의 세균 문제는 괜찮은가요? 음식물을 담다보니 세균 걱정이 가장 크거든요.				0	2022-10-26 14:09:34	2022-10-26 14:23:46
BK22019418	12	전문가	음식물 처리기 내부에 감압청정 필터를 탑재해서 내부 세균증식을 막고 악취, 필터 오염 문제도 해결했어요.	SK매직 에코클린 감압청정 필터	https://www.etnews.com/20221010000073	2022/10/10	0	2022-10-26 14:09:34	2022-10-26 14:23:46
BK22019418	13	질문자	세균증식을 막는 필터가 있군요. 그런데 SK매직은 정수기 회사로 알고 있는데 정수기에 사용한 기술도 음식물 처리기에 적용을 했나요?				0	2022-10-26 14:09:34	2022-10-26 14:23:46
BK22019418	14	전문가	네, SK매직이 정수기에서 사용하던 냉매 컨트롤 기술이랑 노하우, 물 배출, 필터 기술도 음식물 처리기에 활용을 했어요.	SK매직 에코클린 정수기	https://www.etnews.com/20221010000073	2022/10/10	0	2022-10-26 14:09:34	2022-10-26 14:23:46
BK22019418	15	질문자	그렇군요. 그러면 음식물 처리기를 넣는 방향은 어디로 설치 돼 있나요?				0	2022-10-26 14:09:34	2022-10-27 16:25:43
BK22019418	16	전문가	음식물을 편하게 담기 위해 상단 오픈 방식을 사용했고 또 허리 부담을 감소시키기 위한 스탠드형태의 음식물 처리기기도 나왔어요.	SK매직 에코클린 스탠드	https://www.etnews.com/20221010000073	2022/10/10	0	2022-10-26 14:09:34	2022-10-27 16:25:43
BK22019418	17	질문자	상단에 담으면 쓰레기 버리기가 훨씬 편할 거 같아요. 그런데 요즘 가전은 기능도 중요하지만 디자인도 중요하잖아요. 디자인에는 신경을 썼나요?				0	2022-10-26 14:09:34	2022-10-26 14:23:46
BK22019418	18	전문가	어떤 공간에도 잘 어울릴 수 있고, 편리하게 쓸 수 있게 심미적 기능과 사용자 편의 기능을 고민해서 만들었는데 그 덕분에 산업통산자원부가 주최하는 2022 굿디자인 어워드에서 수상을 하기도 했어요.	SK매직 에코클린 2022 굿디자인 어워드	https://www.etnews.com/20221010000073	2022/10/10	0	2022-10-26 14:09:34	2022-10-26 14:23:46
BK22019418	19	질문자	굿디자인으로 수상을 했다면 집안에 둬도 좋은 인테이어 소품이 되겠어요. 나중에 실물을 확인해 보고 구매를 해야 겠어요. 좋은 정보들 알려 줘서 고마워요.				0	2022-10-26 14:09:34	2022-10-26 14:23:46
BK22019418	20	전문가	제가 알려드린게 도움이 되었으면 좋겠네요. 실물도 보고 설명도 더 듣고 마음에 드는 제품으로 사세요. 좋은 하루 되세요.				1	2022-10-26 14:09:34	2022-10-27 16:25:43
