id	utterance_id	role	text	search_query	search_URL	reference_date	terminate	regDate	updDate
BK22019069	1	질문자	요즘 다이슨에서 나온 헤어 기기들이 눈에 들어오더라고요. 다이슨에 대해서 몇 가지 질문해도 될까요?				0	2022-10-25 16:01:13	2022-10-25 16:43:03
BK22019069	2	전문가	네, 궁금한 점이 있으면 질문하셔도 돼요. 성심성의껏 답변해 드릴게요.				0	2022-10-25 16:01:13	2022-10-25 16:43:03
BK22019069	3	질문자	바쁘실 텐데 감사합니다. 먼저 다이슨이 어떤 기업인지 알고 싶어요.				0	2022-10-25 16:01:14	2022-10-25 16:43:03
BK22019069	4	전문가	다이슨은 1993년 제임스 다이슨이 창립한 영국의 전자제품 회사예요. 본사는 싱가포르에 두고 있고요.	다이슨	https://ko.wikipedia.org/wiki/%EB%8B%A4%EC%9D%B4%EC%8A%A8_(%EA%B8%B0%EC%97%85)	2022/07/03	0	2022-10-25 16:01:14	2022-10-25 16:43:03
BK22019069	5	질문자	영국 회사인데 본사는 싱가포르에 있군요. 다이슨 기업의 한국 매출은 얼마나 되나요?				0	2022-10-25 16:01:14	2022-10-25 16:43:03
BK22019069	6	전문가	2022년 4월 14일 전자공시시스템에 의하면 다이슨코리아 2021년 매출은 2020년에 비하여 43퍼센트 상승한 5,527억 원으로 집계되었어요.	다이슨 국내 매출	https://n.news.naver.com/article/030/0003010072?sid=105	2022/04/14	0	2022-10-25 16:01:14	2022-10-25 16:43:03
BK22019069	7	질문자	43퍼센트 상승이라니 대단하네요. 최근 다이슨 에어랩 신제품이 출시 되었던데 가격은 얼마이고, 어떤 특징이 있나요?				0	2022-10-25 16:01:14	2022-10-25 16:43:03
BK22019069	8	전문가	다이슨이 2022년 6월, 4년 만에 다이슨 에어랩 멀티 스타일러라는 신제품을 선보였는데요. 가격은 이전 모델보다 상승하여 699,000원으로 정해졌어요. 에어랩 멀티 스타일러는 공기역학적 기술을 이용하여 드라이와 웨이브를 할 수 있는 기능이 더욱 좋아졌고, 사용자가 편하게 사용할 수 있게 주요 배럴이 재설계 됐어요. 코안다 효과를 최대화하여 머릿결이 손상되는 것을 방지했고요.	다이슨 에어랩 신제품	http://www.sporbiz.co.kr/news/articleView.html?idxno=634132	2022/10/11	0	2022-10-25 16:01:14	2022-10-25 16:43:03
BK22019069	9	질문자	배럴이 바뀌었군요. 근데 거의 70만 원이라니 가격이 너무 비싸네요. 그런데 다이슨에서 사용했다는 코안다 효과라는 게 뭐예요?				0	2022-10-25 16:01:14	2022-10-25 16:43:03
BK22019069	10	전문가	코안다는 루마니아의 과학자 헨리 코안다에서 생겨난 말이에요. 한마디로 이야기하면 곡률이 있는 물체 표면으로 액체가 흐를 때, 기류 압력 차로 액체가 곡선을 따라붙는 듯 흐르는 현상을 뜻해요.	다이슨 코안다 효과	https://n.news.naver.com/article/138/0002128720?sid=105	2022/07/15	0	2022-10-25 16:01:14	2022-10-25 16:43:03
BK22019069	11	질문자	아, 그래서 머리카락이 배럴에 따라붙는군요. 신제품 다이슨 에어랩 멀티 스타일러의 배럴은 어떤 구성으로 되어 있나요?				0	2022-10-25 16:01:14	2022-10-25 16:43:03
BK22019069	12	전문가	다이슨 에어랩 멀티 스타일러에는 코안다 스무딩 드라이어, 소프트 스무딩 브러시, 하드 스무딩 브러시, 라운드 볼륨 브러시, 40mm 에어랩 배럴과 롱 배럴, 30mm 에어랩 배럴과 롱 배럴 등 모두 6개의 툴이 들어있어요.	다이슨 에어랩 툴	https://www.ajunews.com/view/20220725134609941	2022/07/26	0	2022-10-25 16:01:14	2022-10-25 16:43:03
BK22019069	13	질문자	저는 긴 머리라서 롱 배럴을 유용하게 쓸 거 같아요. 다이슨 에어랩 멀티 스타일러는 어디서 구매할 수 있을까요?				0	2022-10-25 16:01:14	2022-10-25 16:43:03
BK22019069	14	전문가	에어랩 멀티 스타일러는 다이슨 데모스토어 및 공식 웹사이트, SSG 닷컴 사이트, 롯데백화점에 입점한 다이슨 매장 중 주요 11개 매장에서 구입하실 수 있어요.	다이슨 에어랩 구매 매장	https://n.news.naver.com/article/016/0002021119?sid=101	2022/07/27	0	2022-10-25 16:01:14	2022-10-25 16:43:03
BK22019069	15	질문자	구매할 수 있는 데가 꽤 많네요. 다이슨은 어떻게 이렇게 획기적인 헤어 상품을 개발할 수 있는지 궁금해지네요. 연구 투자를 많이 하나요?				0	2022-10-25 16:01:14	2022-10-25 16:43:03
BK22019069	16	전문가	다이슨은 머리카락 연구만을 위한 헤어 사이언스 연구소가 건립되어 있는데, 2013년부터 2022년까지 10년동안 1,585억 5,200만 원 정도를 쏟아 부었어요. 다이슨에 재직 중인 약 1만 3,000여 명의 직원 중 절반이 엔지니어고요.	다이슨 연구 투자	https://n.news.naver.com/article/008/0004777952?sid=101	2022/08/02	0	2022-10-25 16:01:14	2022-10-25 16:43:03
BK22019069	17	질문자	투자하는 돈이 막대하네요. 그런데 다이슨 제품의 AS는 잘 되나요?				0	2022-10-25 16:01:14	2022-10-25 16:43:03
BK22019069	18	전문가	아쉽게도 다이슨의 AS 정책은 좋지 않다는 평판이에요. 다이슨 국내 서비스 센터에 제품 수리를 요청한 적 있는 일부 소비자들은 부품 입고 시간과 대기 시간이 길다고 아쉬움을 보였어요. 다이슨이 해외 기업이라는 것을 고려하더라도 너무 길게 대기해야 한다는 지적이에요.	다이슨 AS	https://it.chosun.com/site/data/html_dir/2022/07/29/2022072901754.html	2022/08/01	0	2022-10-25 16:01:14	2022-10-25 16:43:03
BK22019069	19	질문자	그렇군요. 구매할 때 AS도 고려 사항이라 이 부분은 좀 아쉽네요. 아무튼 오늘 말씀해 주신 덕분에 다이슨에 대해서 많은 걸 알았어요.				0	2022-10-25 16:01:14	2022-10-25 16:43:03
BK22019069	20	전문가	네, 고가의 제품일수록 여러 가지 사항을 잘 알아보고 구매하는 게 좋죠. 더 궁금한 점이 있으면 언제든지 연락해 주세요.				1	2022-10-25 16:01:14	2022-10-25 16:43:03
