id	utterance_id	role	text	search_query	search_URL	reference_date	terminate	regDate	updDate
BK22004045	1	질문자	장판 사려고 알아보니 쓸만한 것들은 품절 된 것도 많네요. 왜 이렇게 사람들이 많이 사는 거죠?				0	2022-08-04 11:18:05	2022-08-16 14:45:56
BK22004045	2	전문가	작년보다 훨씬 더 추워서 그래요. 전기장판뿐 아니라 난방 커튼 같은 난방비 절감을 돕는 방한 인테리어 소품 판매량이 증가했어요.	방한템	https://sports.khan.co.kr/bizlife/sk_index.html?art_id=202112010808013&sec_id=564001&pt=nv	2021/12/01	0	2022-08-04 11:18:05	2022-08-16 14:45:56
BK22004045	3	질문자	진짜 올해 너무 춥긴 해요. 제 자취방도 완전 냉골이다 보니 보일러를 돌려도 따듯해지기까지 오래 걸리는 것 같아요.				0	2022-08-04 11:18:05	2022-08-16 14:45:56
BK22004045	4	전문가	혹시 외출하실 때 보일러 전원을 끄고 가시나요? 전원을 끄면 에너지 효율이 떨어지고 보일러 재가동할 때 집안의 온기를 채우는데 오래 걸려요. 그래서 추천하는 방법은 온도를 평소보다 낮추거나 외출모드로 설정하는 것이에요.	보일러 난방비 절감	http://www.slist.kr/news/articleView.html?idxno=214203	2020/12/31	0	2022-08-04 11:18:05	2022-08-16 14:45:56
BK22004045	5	질문자	예전에는 외출모드로 생활했었는데 가스비가 생각보다 많이 나오더라고요. 혹시 에너지를 절약할 수 있는 방법이 있을까요?				0	2022-08-04 11:18:05	2022-08-04 11:18:05
BK22004045	6	전문가	뽁뽁이, 문풍지, 단열폼블럭, 암막커튼을 이용하면 집에서 온기가 빠져나가거나 한기가 들어오는 것을 막을 수 있어요. 이렇게 하면 집에 온기가 보존돼서 에너지가 절약될 수 있을 거에요.	에너지 절약	https://ko.wikipedia.org/wiki/%EC%97%90%EB%84%88%EC%A7%80_%EC%A0%88%EC%95%BD	2022/06/20	0	2022-08-04 11:18:05	2022-08-16 14:45:56
BK22004045	7	질문자	그런 것들은 이미 방에 다 해 놨어요. 다른 방한 소품은 없을까요?				0	2022-08-04 11:18:05	2022-08-16 14:45:56
BK22004045	8	전문가	외풍을 차단하여 보온 효과를 높여주는 난방 텐트는 어때요? 최근 큰 인기를 끌고 있고 남녀 모두 사랑하는 아이템이에요.	난방텐트	https://www.wowtv.co.kr/NewsCenter/News/Read?articleId=A201612060170&resource=	2016/12/06	0	2022-08-04 11:18:05	2022-08-16 14:45:56
BK22004045	9	질문자	인터넷에서 한번 본 것 같아요. 근데 효과가 있을까요?				0	2022-08-04 11:18:05	2022-08-04 11:18:05
BK22004045	10	전문가	그럼요. 실내온도 20도에서 전기장판을 사용할 때 텐트를 사용하면 텐트를 사용하지 않을 때에 비해 내부공기 온도가 3도정도가 더 올라간 23도가 되어요. 그리고 난방텐트를 사용하면 난방온도조절을 할 수 있어 에너지 절감효과도 있어 유용해요.	난방텐트	https://www.viva100.com/main/view.php?key=20220111010002791	2022/01/11	0	2022-08-04 11:18:05	2022-08-17 08:51:33
BK22004045	11	질문자	그럼 난방 텐트 구매해서 사용해봐야겠네요. 제품을 고를 때 팁이 있을까요?				0	2022-08-04 11:18:05	2022-08-16 14:45:56
BK22004045	12	전문가	내구성을 잘 살펴봐야 할 것 같아요. 한국소비자원에서 11일에 소비자에게 객관적인 상품 선택정보를 제공하려는 목적으로 보온효과, 에너지 절감, 내구성, 안전성등을 시험하고 평가했어요. 시중에서 가장 많이 팔리고 있는 난방텐트 7개대상으로 진행한 테스트의 결과는 보온성은 대부분의 제품이 우수한 것으로 나타났고 내구성이 제품마다 차이가 있다고 알려졌어요.	난방텐트 소보자원	https://biz.newdaily.co.kr/site/data/html/2022/01/11/2022011100060.html	2022/01/11	0	2022-08-04 11:18:05	2022-08-17 08:51:33
BK22004045	13	질문자	제품 별로 보온력도 차이가 있을 것 같았는데 비슷하다니 신기하네요. 제품을 고르는 또 다른 팁이 있을까요?				0	2022-08-04 11:18:05	2022-08-16 14:45:56
BK22004045	14	전문가	구매할 때 폴대 재질도 봐야 해요. 재질 중 가장 인기가 많은 제품은 PE폴대에요. PE폴대를 사용할 때 무게감도 있고 휘어져도 다시 복원되는 탄성을 가진다는 장점이 있어요.	난방텐트 주의	http://www.viva100.com/main/view.php?key=20160125001710427	2016/01/25	0	2022-08-04 11:18:06	2022-08-16 14:45:56
BK22004045	15	질문자	제품 고를 때 참고할게요. 제품을 사용할 때 주의 사항이 있을까요?				0	2022-08-04 11:18:06	2022-08-16 14:45:56
BK22004045	16	전문가	난방텐트를 사용할 때 안과 밖의 온도차가 커져서 텐트 안쪽에 물기가 생길 수 있는데 이럴때는 난방텐트의 입구를 조금 열어두고 텐트 안쪽에서 온열기구의 사용을 최소화하는 것이 좋아요.	난방텐트 주의사항	http://daily.hankooki.com/news/articleView.html?idxno=350836	2015/11/19	0	2022-08-04 11:18:06	2022-08-17 08:51:33
BK22004045	17	질문자	물기 생기는 거 관리하지 않으면 곰팡이가 생길 우려도 있네요.				0	2022-08-04 11:18:06	2022-08-04 11:18:06
BK22004045	18	전문가	맞아요. 곰팡이가 생기면 매년 새 제품을 다시 사야 할 수도 있어요.				0	2022-08-04 11:18:06	2022-08-16 14:45:56
BK22004045	19	질문자	정말 그렇겠네요. 덕분에 제품 수월하게 고를 수 있겠어요. 더 궁금한 게 생기면 연락해도 될까요?				0	2022-08-04 11:18:06	2022-08-16 14:45:56
BK22004045	20	전문가	언제든지 괜찮으니 궁금한 게 생기면 편하게 연락 주세요. 그럼 안녕히 들어가세요.				1	2022-08-04 11:18:06	2022-08-17 08:51:33
