id	utterance_id	role	text	search_query	search_URL	reference_date	terminate	regDate	updDate
BK22019475	1	질문자	날이 추워져서 겨울이불을 사려고 하는데, 이불 소재가 너무 다양하더라. 겨울이불 중에 텐셀로 만들어진 것들이 있던데 텐셀이 어떤 건지 설명해 줄래?				0	2022-10-27 12:03:05	2022-10-27 12:37:00
BK22019475	2	전문가	텐셀은 유칼립투스 나무 펄프로 만들어진 친환경 섬유 소재야. 흡습력이 뛰어나서 정전기가 덜 발생되고 쾌적한 상태를 오래 유지하는 특징이 있어. 또, 세탁과 관리도 쉬워서 위생적으로 사용 가능해.	겨울이불 텐셀	https://www.khan.co.kr/economy/market-trend/article/201612301328001	2016/12/30	0	2022-10-27 12:03:05	2022-10-27 12:37:00
BK22019475	3	질문자	텐셀이 친환경 소재인 것이 맘에 든다. 그러면, 양모는 어떤 특징이 있어?				0	2022-10-27 12:03:06	2022-10-27 12:37:00
BK22019475	4	전문가	양모는 흡수력과 발산력이 좋아서 침구를 보송보송하고 쾌적한 상태로 오랫동안 유지할 수 있고 탄성력도 좋은 편이야. 하지만, 다른 섬유에 비해서는 덜 부드럽고 약간 빳빳한 느낌이 있어.	겨울이불 양모	https://www.khan.co.kr/economy/market-trend/article/201612301328001	2016/12/30	0	2022-10-27 12:03:06	2022-10-28 09:50:54
BK22019475	5	질문자	나는 추울 때 이불 안에 들어가서 느끼는 부드러움이 좋은데 양모는 안되겠네. 그럼, 극세사는 겨울이불로 사용하기에 어떨까?				0	2022-10-27 12:03:06	2022-10-27 12:37:00
BK22019475	6	전문가	극세사는 겨울에 많은 사람들이 많이 사용하는 이불 중에 하나지. 표면에 가는 실이 있어서 부드럽고 포근한 느낌을 주고, 뛰어난 투습성으로 건조도 쉽고 보온성도 좋거든. 또, 극세사는 촘촘하게 만들어져서 피부에도 자극이 적은 것이 특징이야.	겨울이불 극세사	https://www.wowtv.co.kr/NewsCenter/News/Read?articleId=A201401200199&resource=	2014/01/20	0	2022-10-27 12:03:06	2022-10-27 12:37:00
BK22019475	7	질문자	극세사를 겨울이불로 구매하는 것도 좋겠는데. 예전부터 사용한 목화솜은 어떤 특징이 있어?				0	2022-10-27 12:03:06	2022-10-27 12:37:00
BK22019475	8	전문가	목화솜은 숨이 죽으면 다시 틀어서 사용할 수 있는 회복력이 좋은 천연 소재로 물세탁을 할 필요가 없어. 만약 사용하다가 변색되거나 냄새가 날 때나 솜이 무거워지거나 일광욕에도 솜이 회복되지 않을 때에는 솜틀집에 가서 솜을 틀면 처음과 같이 뽀송뽀송하게 회복되는 특징이 있어.	겨울이불 목화솜	http://www.enewstoday.co.kr/news/articleView.html?idxno=675394	2017/01/09	0	2022-10-27 12:03:06	2022-10-27 12:37:00
BK22019475	9	질문자	엄마가 가끔 목화솜을 솜틀집에서 틀러 가셨는데 그런 이유였구나. 겨울이불로 오리털 이불도 생각하고 있는데 어떤 특징이 있어?				0	2022-10-27 12:03:06	2022-10-27 12:37:00
BK22019475	10	전문가	오리털은 공기의 변화에 맞춰서 자연적으로 수축, 흡습, 발산, 발수 작용을 해서 이불 밖의 공기로부터 체온을 유지시켜주는 역할을 해. 오리털 이불을 고를 때에는 털이 빠져나올 수 있으니 바느질이 꼼꼼하게 잘 되었는지 확인하고 구매하는 것이 좋아.	겨울이불 오리털	https://www.donga.com/news/article/all/20140117/60203612/2	2014/01/17	0	2022-10-27 12:03:06	2022-10-28 09:50:54
BK22019475	11	질문자	맞아, 오리털 이불은 바느질이 잘 안되어 있으면 털이 빠져나오더라. 그러면, 구스 이불은 어떤 이불이야?				0	2022-10-27 12:03:06	2022-10-27 12:37:00
BK22019475	12	전문가	거위의 가슴 주변에 난 부드러운 솜털과 목부분의 깃털을 원료로 하는 구스이불은 외부 온도의 영향을 받지 않고 체온을 일정하게 유지시켜줘서 4계절 내내 사용할 수 있다는 장점이 있어.	겨울이불 구스	https://biz.chosun.com/site/data/html_dir/2014/11/07/2014110702790.html	2014/11/10	0	2022-10-27 12:03:06	2022-10-27 12:37:00
BK22019475	13	질문자	구스이불이 4계절 내내 사용할 수 있다니 좋네. 구스이불로 구매한다면 솜털과 깃털 중에 어느 것이 많은 것이 좋은 제품이야?				0	2022-10-27 12:03:06	2022-10-27 12:37:00
BK22019475	14	전문가	좋은 원산지의 고급 구스털을 사용한다고 해도 중요한 것은 솜털의 함량이 많아야 해. 그렇지 않으면, 제품의 통기성과 보온력이 떨어지고 거친 느낌이 나거든. 솜털 90%, 깃털 10% 이상인 제품이 우리나라에서는 고급 제품으로 분류하고 있어.	겨울이불 구스 솜털	http://www.hortitimes.com/news/articleView.html?idxno=10588	2019/03/21	0	2022-10-27 12:03:06	2022-10-28 09:50:54
BK22019475	15	질문자	구스 이불을 살 때에는 솜털과 깃털의 비율을 봐야겠네. 그리고, 구스 이불을 살 때 어떤 점을 고려하면 좋을까?				0	2022-10-27 12:03:06	2022-10-27 12:37:00
BK22019475	16	전문가	구스 이불은 1, 2년을 사용하는 제품이 아니라서 AS가 매우 중요해. 구스 이불을 구입할 때에는 전문적으로 AS가 가능한지와 AS 기간이 어느 정도 되는지 살펴봐야 해.	겨울이불 구스 AS	http://www.hortitimes.com/news/articleView.html?idxno=10588	2019/03/21	0	2022-10-27 12:03:06	2022-10-28 09:50:54
BK22019475	17	질문자	그렇구나, 구스 이불은 한 번 사면 오래 사용하니 꼭 꼼꼼하게 확인해야겠어.				0	2022-10-27 12:03:06	2022-10-27 12:37:00
BK22019475	18	전문가	어떤 소재의 이불을 구매하던 너에게 맞는 이불을 잘 선택해.				0	2022-10-27 12:03:06	2022-10-27 12:37:00
BK22019475	19	질문자	알겠어, 오늘 너와 이야기해서 즐거웠어.				0	2022-10-27 12:03:06	2022-10-27 12:37:00
BK22019475	20	전문가	나도 즐거웠어, 우리는 다음에 보자.				1	2022-10-27 12:03:06	2022-10-28 09:50:54
