id	utterance_id	role	text	search_query	search_URL	reference_date	terminate	regDate	updDate
BK22016172	1	질문자	잠을 자고 나면 고개가 너무 아프고 몸이 쑤셔서 피곤해. 베개가 너무 높은 것 같아서 바꿔보려고 하는데, 나 같이 똑바로 누워서 자는 사람은 베개 높이가 어느 정도 돼야 해?				0	2022-10-17 08:52:33	2022-10-17 11:58:21
BK22016172	2	전문가	자고 일어나면 몸이 불편해서 베개를 바꾸려고 생각하고 있구나. 너처럼 바로 누워서 자는 경우라면 목뼈가 자연스럽게 C자형 커브를 유지하면서 몸과 허리가 부담을 느끼지 않는 높이인 6~8센티미터의 베개가 좋아. 일반적으로 네 팔뚝 높이 정도라고 생각하면 돼.	똑바로 누워 자는 사람 베개	https://news.g-enews.com/ko-kr/news/article/news_all/201511271438360816517_1/article.html?md=20151127161109_U	2015/11/27	0	2022-10-17 08:52:33	2022-10-17 11:58:21
BK22016172	3	질문자	나는 좀 낮은 베개가 맞는 거구나. 그러면, 남편은 옆으로 누워서 자는데 베개 높이가 어느 정도되는 것이 좋아?				0	2022-10-17 08:52:33	2022-10-17 11:58:21
BK22016172	4	전문가	옆으로 자는 경우에는 어깨 높이를 고려해서 옆에서 봤을 때 목뼈와 허리 뼈가 일직선을 유지하도록 베개 높이를 맞춰주는 것이 좋아. 바로 누워자는 자세보다 팔뚝 하나가 더 높은 10~15센티미터의 베개를 고르면 돼.	측면 자세 베개	http://www.viva100.com/main/view.php?key=20151127010006022	2015/11/28	0	2022-10-17 08:52:33	2022-10-17 11:58:21
BK22016172	5	질문자	남편은 나보다 높은 베개가 좋구나. 그러면, 베개 넓이는 어느 정도되는 것이 좋아?				0	2022-10-17 08:52:33	2022-10-17 11:58:21
BK22016172	6	전문가	가장 좋은 베개 넓이는 어깨보다 조금 넓은 베개를 선택하는 것이 좋아. 베개가 너무 작으면 자다가 몸을 돌릴 때 안정감도 없고 목을 지탱해 주지 못하거든.	베개 넓이	https://kormedi.com/1416201/%ec%a7%80%ea%b8%88-%eb%b2%a0%ea%b3%a0-%ec%9e%90%eb%8a%94-%eb%b2%a0%ea%b0%9c-%eb%82%98%ed%95%9c%ed%85%8c-%eb%a7%9e%eb%8a%94%ec%a7%80-%eb%b3%b4%eb%a0%a4%eb%a9%b4/	2022/09/01	0	2022-10-17 08:52:33	2022-10-17 11:58:21
BK22016172	7	질문자	베개 크기도 너무 작으면 좋지 않은 거구나. 그러면, 베개는 어느 정도 푹신한 것이 좋은 거야?				0	2022-10-17 08:52:33	2022-10-17 11:58:21
BK22016172	8	전문가	너무 딱딱한 베개는 머리와 베개가 닿는 면적이 좁아서 머리가 받는 압력이 높아지고 불안정해. 또, 푹신한 베개는 적당한 높이를 유지하지 못해서 목 근육이 피곤하고 호흡에도 좋지 않아. 그래서, 베개는 푹신하면서도 어느 정도 딱딱한 베개를 선택하는 것이 좋아.	베개 굳기	https://kormedi.com/1416201/%ec%a7%80%ea%b8%88-%eb%b2%a0%ea%b3%a0-%ec%9e%90%eb%8a%94-%eb%b2%a0%ea%b0%9c-%eb%82%98%ed%95%9c%ed%85%8c-%eb%a7%9e%eb%8a%94%ec%a7%80-%eb%b3%b4%eb%a0%a4%eb%a9%b4/	2022/09/01	0	2022-10-17 08:52:33	2022-10-17 11:58:21
BK22016172	9	질문자	푹신한 베개가 좋은 건 줄 알았는데 아니구나. 친구는 경추베개를 추천해 주기도 하던데 경추베개가 뭐야?				0	2022-10-17 08:52:33	2022-10-17 11:58:21
BK22016172	10	전문가	경추베개는 머리로 베는 것이 아니고 목으로 베는 베개야. 경추베개는 자는 동안 올바른 경추의 자세를 잡아주는 제품이야.	경추베개	https://www.ibabynews.com/news/articleView.html?idxno=64922	2018/05/11	0	2022-10-17 08:52:33	2022-10-17 11:58:21
BK22016172	11	질문자	경추베개는 목으로 베는 베개구나. 그럼, 경추베개를 사려면 어떤 것을 선택해야 해?				0	2022-10-17 08:52:33	2022-10-17 11:58:21
BK22016172	12	전문가	경추베개를 선택할 때에는 C자 커브를 잘 지켜주는 제품인지 확인해야 해. 누웠을 때 베개의 높이가 6~8센티미터이고 경추 곡선을 유연하게 구현 가능하고, 자는 동안 뒤척여도 안정적인 넓이와 경추부가 일자가 되는지를 확인해야 해. 그리고, 소재와 촉감도 살펴봐야 해.	경추베개 선택 방법	https://www.ibabynews.com/news/articleView.html?idxno=64922	2018/05/11	0	2022-10-17 08:52:33	2022-10-17 11:58:21
BK22016172	13	질문자	베개를 제대로 사려면 직접 누워보고 사는 것이 좋겠구나. 근데, 편백 베개 같은 것도 있던데 어떤 제품이야?				0	2022-10-17 08:52:33	2022-10-20 08:39:53
BK22016172	14	전문가	항균 효과가 좋아 아토피, 알레르기, 민감성 환자들이 주로 사용하는 천연 소재인 편백으로 만든 제품이 편백 베개야. 이 편백에서 나오는 천연항생물질인 피톤치드와 편백 향은 심리적인 안정감과 스트레스를 낮추는 역할을 해서 숙면을 취하는 데 도움이 돼.	편백베개	http://www.womennews.co.kr/news/articleView.html?idxno=219956	2022/02/13	0	2022-10-17 08:52:33	2022-10-17 11:58:21
BK22016172	15	질문자	그렇구나, 편백이 사람 마음을 편안하게 하는 효과가 있구나. 그러면, 메모리폼 베개는 어떤 특징이 있어?				0	2022-10-17 08:52:33	2022-10-20 08:39:53
BK22016172	16	전문가	메모리폼은 물리적 힘을 가하면 변형되지만 그 힘을 없애면 다시 돌아오는 발포 물질로, 밀도는 높지만 탄성이 낮아 충격을 잘 흡수해서 뒤척임에도 안정적인 소재야.	메모리폼 베개	http://www.womennews.co.kr/news/articleView.html?idxno=219956	2022/02/13	0	2022-10-17 08:52:33	2022-10-17 11:58:21
BK22016172	17	질문자	많이 뒤척이면서 자는 남편에게 좋은 베개네. 어떤 베개를 골라야 할지 어려웠는데 많은 정보 줘서 고마워.				0	2022-10-17 08:52:33	2022-10-17 11:58:21
BK22016172	18	전문가	고맙긴, 언제든 궁금한 건 물어봐.				0	2022-10-17 08:52:33	2022-10-17 11:58:21
BK22016172	19	질문자	그래, 우리는 다음에 보자.				1	2022-10-17 08:52:33	2022-10-20 08:39:53
BK22016172	20	전문가	조심히 잘 가고 다음에 보자, 안녕.				0	2022-10-17 08:52:33	2022-10-17 11:58:21
