id	utterance_id	role	text	search_query	search_URL	reference_date	terminate	regDate	updDate
BK22016128	1	질문자	얼마 전 마트에 갔는데, 어묵으로 만든 국수가 있더라고요. 한 번 구매해서 먹어봤는데, 밀가루로 만든 국수보다 맛이 더 좋더라고요. 혹시 만두도 밀가루가 아닌 어묵으로 피를 만든 제품이 있을까요?				0	2022-10-14 21:26:51	2022-10-14 21:55:03
BK22016128	2	전문가	네, 오뚜기에서 어묵을 이용해 만두피를 만든 제품인 X.O. 어묵만두가 있는데, 어묵 만두의 종류는 두 가지로 김치와 고기가 있어요.	X.O. 어묵 만두 고기 김치	https://www.news1.kr/articles/?4093822	2020/10/21	0	2022-10-14 21:26:51	2022-10-15 00:05:00
BK22016128	3	질문자	만두피를 어묵으로 만든 제품이 이미 판매되고 있었군요. 그럼 X.O. 어묵만두 김치는 어떤 재료로 만든 제품인가요?				0	2022-10-14 21:26:51	2022-10-14 21:55:03
BK22016128	4	전문가	어묵으로 감싼 피로 만든 X.O. 어묵만두 김치는 칼칼한 국산 김치와 100퍼센트 국산 돼지고기로 속을 채운 제품인데, 어육을 사용한 탱글탱글한 식감이 특징이죠.	X.O. 어묵만두 김치	https://www.segye.com/newsView/20201021511763?OutUrl=naver	2020/10/22	0	2022-10-14 21:26:51	2022-10-15 00:05:00
BK22016128	5	질문자	어묵으로 감싼 피로 만들어서 식감이 탱글탱글한가 봐요. 그리고 X.O. 어묵만두 고기는 어떻게 조리해 먹나요?				0	2022-10-14 21:26:51	2022-10-15 00:05:00
BK22016128	6	전문가	국산 돼지고기로 속을 듬뿍 채운 X.O. 어묵만두 고기는 간편하게 전자레인지를 이용하거나 찜기를 사용한 조리로 촉촉한 만두를 맛볼 수도 있는 제품이에요.	X.O. 어묵만두 고기	https://www.wikitree.co.kr/articles/582960	2020/10/21	0	2022-10-14 21:26:51	2022-10-15 00:05:00
BK22016128	7	질문자	찜기로 조리해 촉촉한 만두를 맛볼 수도 있군요. 그런데 X.O. 만두라는 제품 이름이 독특한 것 같은데, 어떤 의미인가요? 그리고 어떤 제품들이 출시되었나요?				0	2022-10-14 21:26:51	2022-10-15 00:05:00
BK22016128	8	전문가	지난 2019년에 선보인 X.O. 만두는 비범한, 놀라운이라는 뜻이 담긴 오뚜기 만두의 대표 브랜드로, 물만두와 교자 그리고 굴림만두와 슈마이 등 다양한 제품들을 출시하며 프리미엄 만두로서 입지를 다지고 있죠.	X.O.만두 의미	http://www.shinailbo.co.kr/news/articleView.html?idxno=1448824	2021/08/17	0	2022-10-14 21:26:51	2022-10-15 00:05:00
BK22016128	9	질문자	X.O. 만두가 2019년에 선보인 제품이네요. 그리고 X.O. 제품인 교자에는 어떤 재료가 들어갔나요?				0	2022-10-14 21:26:51	2022-10-15 00:05:00
BK22016128	10	전문가	프리미엄 만두인 X.O. 교자는 쫄깃하고 부드러운 만두피에 새송이버섯과 돼지고기 그리고 소고기와 송화 버섯 등 엄선한 재료가 들어갔는데, 큼직하게 썬 만두소에 XO 소스로 맛을 더한 제품이죠.	X.O. 교자	https://www.mk.co.kr/news/special-edition/view/2019/12/1063227/	2019/12/19	0	2022-10-14 21:26:51	2022-10-15 00:05:00
BK22016128	11	질문자	XO 소스는 처음 들어보는 소스인데, 어떤 소스인가요?				0	2022-10-14 21:26:51	2022-10-15 00:05:00
BK22016128	12	전문가	XO 장이라고도 하는 XO 소스는 홍콩에서 생겨난 매운 해산물 소스인데, 주로 광둥성을 비롯한 중국 남부 지역에서 많이 사용되는 소스에요.	XO장	https://ko.wikipedia.org/wiki/XO%EC%9E%A5	2022/02/09	0	2022-10-14 21:26:51	2022-10-15 00:05:00
BK22016128	13	질문자	아, 매운 해산물 소스를 말하는군요. 그리고 간식용으로 바삭한 군만두를 자주 먹는 편인데, 혹시 X.O. 제품 중에 군만두도 있나요?				0	2022-10-14 21:26:51	2022-10-15 00:05:00
BK22016128	14	전문가	네, 군만두 제품도 있어요. 제품명이 X.O. 군만두 고기듬뿍인데, 국산 찹쌀가루를 이용해 만두피가 더욱 바삭하고 기존의 군만두 제품과는 차별화된 원료 배합과 반죽 방식을 사용했죠.	X.O. 군만두	http://www.nspna.com/news/?mode=view&newsid=520884	2021/08/17	0	2022-10-14 21:26:51	2022-10-15 00:05:00
BK22016128	15	질문자	국산 찹쌀가루로 만들어 바삭하군요. 그럼 X.O. 군만두 고기듬뿍은 조리 방법이 어떻게 되나요?				0	2022-10-14 21:26:51	2022-10-15 00:05:00
BK22016128	16	전문가	X.O. 군만두 고기듬뿍은 에어프라이어를 180도로 예열해서 약 10분에서 12분 정도 조리하거나 프라이팬에 구워 먹으면 돼요.	X.O. 군만두 고기듬뿍 조리	http://www.seoulfn.com/news/articleView.html?idxno=429141	2021/08/17	0	2022-10-14 21:26:51	2022-10-15 00:05:00
BK22016128	17	질문자	에어프라이어에서 10분 정도 조리하면 되는군요. 밖을 보니 해가 저물었는데, 이만 정리하고 일어날까요.				0	2022-10-14 21:26:51	2022-10-15 00:05:00
BK22016128	18	전문가	네, 시간 가는 줄 모르고, 이야기하다 보니 벌써 저녁때가 되었네요.				1	2022-10-14 21:26:51	2022-10-19 14:04:50
BK22016128	19	질문자	그러게요. 저는 집에 가는 길에 장 보면서 마트에 어떤 만두 제품들이 있는지 좀 보려고요. 그럼 조심히 가시고, 맛있는 저녁 드세요.				0	2022-10-14 21:26:51	2022-10-15 00:05:00
BK22016128	20	전문가	네, 시장 잘 보시고, 가족들과 맛있는 저녁 해드세요.				0	2022-10-14 21:26:51	2022-10-15 00:05:00
