id	utterance_id	role	text	search_query	search_URL	reference_date	terminate	regDate	updDate
BK22006238	1	질문자	혹시 자외선 차단제 고르는 법을 알려주실 수 있을까요?				0	2022-08-23 06:23:49	2022-09-06 11:11:04
BK22006238	2	전문가	자외선 차단제를 구입하시려는 모양이네요? 혹시 어떤 부분이 궁금하세요?				0	2022-08-23 06:23:49	2022-08-23 06:23:49
BK22006238	3	질문자	용어가 어렵기도 하고 제가 민감성 피부라 어떤 것을 골라야 할지도 모르겠더라고요. 혹시 민감성 피부는 어떤 것을 고르는 것이 좋은가요?				0	2022-08-23 06:23:49	2022-09-06 11:11:04
BK22006238	4	전문가	민감성 피부는 가능하면 화학적 차단제가 들어있지 않은 물리적 차단제가 들어간 제품을 고르시는 게 좋아요. 향이 없거나, 알러지 프리와 같은 저자극 제품을 선택하시면 되죠.	자외선 차단제 고르는 법	https://view.asiae.co.kr/article/2022073009471944568	2022/07/30	0	2022-08-23 06:23:49	2022-08-23 06:23:49
BK22006238	5	질문자	생각보다 고려해야 할 사항이 많네요. 그런데 혹시 유기 자차가 뭔가요?				0	2022-08-23 06:23:49	2022-08-23 06:23:49
BK22006238	6	전문가	유기 자차는 화학적 차단제가 들어간 제품이에요. 자외선을 피부에 흡수시킨 후 열을 내뿜어 차단하는 방식이죠. 다만 자극이 동반될 수 있어 피부가 따가운 경우도 있기 때문에 민감한 피부는 주의해서 사용해야 하고요.	유기 자차 자외선 흡수 자극	http://www.babytimes.co.kr/news/articleView.html?idxno=46785	2021/06/08	0	2022-08-23 06:23:49	2022-09-06 11:11:04
BK22006238	7	질문자	화학적 차단제를 유기 자차라고 하는군요? 그런데 단점이 많아 보이는데 굳이 사용하는 이유가 뭔가요?				0	2022-08-23 06:23:49	2022-08-23 06:23:49
BK22006238	8	전문가	백탁 현상이 적은 데다가 피부에 바를 때 발림성이 좋기 때문이에요.	유기 자차 백탁 발림성	http://www.babytimes.co.kr/news/articleView.html?idxno=46785	2021/06/08	0	2022-08-23 06:23:49	2022-08-23 06:23:49
BK22006238	9	질문자	음, 확실히 장점이 있기는 하네요. 그럼 무기 자차는 어떤 건지 궁금해요.				0	2022-08-23 06:23:49	2022-08-23 06:23:49
BK22006238	10	전문가	무기 자차는 물리적 차단제가 들어간 제품이에요. 피부 표면에 막을 만들어 자외선을 반사시키거나 산란시켜 피부를 보호하죠. 피부에 막을 만들어 덮어 주다가 씻기기 때문에 자극이 낮고 자외선과 반응할 때 민감한 피부에도 자극을 일으키지 않아 예민한 피부를 가진 사람도 사용하기 좋아요.	무기 자차 산란	http://www.babytimes.co.kr/news/articleView.html?idxno=46785	2021/06/08	0	2022-08-23 06:23:49	2022-08-23 06:23:49
BK22006238	11	질문자	오, 그래서 아까 물리적 차단제 제품을 구입하라고 알려주신 거군요. 그런데 선크림에 쓰여있는 영어나 플러스 기호도 뭐가 뭔지 전혀 모르겠더라고요. 혹시 SPF는 무슨 뜻인가요?				0	2022-08-23 06:23:49	2022-09-06 11:11:04
BK22006238	12	전문가	아무래도 잘 모르실만하죠. SPF는 Sun Protection Factor 즉 일광차단지수를 의미해요. SPF 지수를 통해 자외선 B를 얼마나 차단할 수 있는지 알 수 있죠.	SPF 일광차단지수	https://www.sisunnews.co.kr/news/articleView.html?idxno=163874	2022/05/25	0	2022-08-23 06:23:49	2022-09-05 16:44:44
BK22006238	13	질문자	SPF는 자외선 B를 차단하는 일광차단지수군요? 그럼 PA는 또 뭔가요? 플러스 기호도 궁금해요.				0	2022-08-23 06:23:49	2022-08-23 06:23:49
BK22006238	14	전문가	PA는 자외선 A 차단 지수예요. 차단할 수 있는 정도에 따라 원플러스, 투플러스, 쓰리플러스로 표기하죠.	PA 자외선 A	https://view.asiae.co.kr/article/2022073009471944568	2022/07/30	0	2022-08-23 06:23:49	2022-08-23 06:23:49
BK22006238	15	질문자	플러스 기호가 자외선 A 차단지수와 연관이 있는 거군요? 그런데 플러스 기호만 봐서는 어느 정도를 차단할 수 있는지 이해가 잘 가지 않네요.				0	2022-08-23 06:23:49	2022-08-23 06:23:49
BK22006238	16	전문가	우선 원플러스는 선크림을 사용하지 않은 경우에 비해 2~4배 정도 보호되고 투플러스는 4~8배 쓰리플러스는 8배 이상 보호가 돼요.	PA 자외선 A 차단 등급	https://www.sisunnews.co.kr/news/articleView.html?idxno=163874	2022/05/25	0	2022-08-23 06:23:49	2022-08-23 06:23:49
BK22006238	17	질문자	쓰리플러스 제품은 상당히 강력하겠네요. 저는 왠지 피하는 게 좋을 것 같아요. 그런데 말씀을 나누다 보니 자외선도 종류가 있는 모양이네요?				0	2022-08-23 06:23:49	2022-08-23 06:23:49
BK22006238	18	전문가	네, 맞아요. 파장의 길이에 따라 자외선이 3가지 종류로 구분되거든요. A, B, C와 같이 총 세 가지 종류인데 자외선 C는 대부분이 오존층에서 걸러지고 A와 B가 지표까지 도달하죠.	자외선 파장 3종류	https://www.sisunnews.co.kr/news/articleView.html?idxno=163874	2022/05/25	0	2022-08-23 06:23:49	2022-08-23 06:23:49
BK22006238	19	질문자	자외선에도 종류가 있는지 몰랐네요. 오늘 덕분에 선크림에 대한 정보는 물론이고 자외선의 종류까지 알아가게 됐네요. 정말 감사해요.				0	2022-08-23 06:23:49	2022-09-06 11:11:04
BK22006238	20	전문가	도움이 됐다니 정말 기뻐요. 혹시 구입하시면서 궁금한 게 있으면 또 물어봐주세요.				1	2022-08-23 06:23:49	2022-09-06 11:11:04
